ffff00013d62e840 1215075802 C Bi:6:002:1 0 383 = 47010484 00000f80 5e0c6000 04300000 00000000 5e1f2703 463a0000 86f2f201
ffff00013d62e840 1215075869 S Bi:6:002:1 -115 32768 <
ffff000103533900 1215076670 C Bi:6:002:1 0 376 = 40010484 00000f80 cb036000 04300000 00000000 04232703 463a0000 82f1f101
ffff000103533900 1215076695 S Bi:6:002:1 -115 32768 <
ffff000103558cc0 1215077612 C Bi:6:002:1 0 351 = 27010484 00000f80 8d0d6000 04300000 00000000 be262703 463a0000 86ecec01
ffff000103558cc0 1215077637 S Bi:6:002:1 -115 32768 <
ffff00014c2bf900 1215078576 C Bi:6:002:1 0 374 = 3e010484 00000f80 5e086000 04300000 00000000 682a2703 443a0000 84f4f401
ffff00014c2bf900 1215078600 S Bi:6:002:1 -115 32768 <
ffff00013d62e840 1215079486 C Bi:6:002:1 0 384 = 48010484 00000f80 2e0b6000 04300000 00000000 d42d2703 443a0000 87f2f201
ffff00013d62e840 1215079511 S Bi:6:002:1 -115 32768 <
ffff000103533900 1215103677 C Bi:6:002:1 0 304 = f8000484 00000f00 d70c6000 00300000 00000000 40862703 443a0000 37520001
ffff000103533900 1215103707 S Bi:6:002:1 -115 32768 <
ffff000103558cc0 1215163226 C Bi:6:002:1 0 304 = f8000484 00000f00 d90c6000 00300000 00000000 dc6e2803 36360000 3e520001
ffff000103558cc0 1215163284 S Bi:6:002:1 -115 32768 <
ffff00014c2bf900 1215177799 C Bi:6:002:1 0 383 = 47010484 00000f80 5f0c6000 04300000 00000000 f2ad2803 44400000 85f4f401
ffff00014c2bf900 1215177826 S Bi:6:002:1 -115 32768 <
ffff00013d62e840 1215178998 C Bi:6:002:1 0 376 = 40010484 00000f80 cc036000 04300000 00000000 abb22803 463a0000 88e9e901
ffff00013d62e840 1215179028 S Bi:6:002:1 -115 32768 <
ffff000103533900 1215179740 C Bi:6:002:1 0 351 = 27010484 00000f80 8e0d6000 04300000 00000000 b4b52803 463a0000 86f3f301
ffff000103533900 1215179769 S Bi:6:002:1 -115 32768 <
ffff000103558cc0 1215180589 C Bi:6:002:1 0 374 = 3e010484 00000f80 5f086000 04300000 00000000 e1b82803 423a0000 85050501
ffff000103558cc0 1215180614 S Bi:6:002:1 -115 32768 <
ffff00014c2bf900 1215281328 C Bi:6:002:1 0 376 = 40010484 00000f80 cd036000 04300000 00000000 6d422a03 463c0000 86f2f201
ffff00014c2bf900 1215281382 S Bi:6:002:1 -115 32768 <
ffff00013d62e840 1215282266 C Bi:6:002:1 0 351 = 27010484 00000f80 8f0d6000 04300000 00000000 27462a03 443a0000 85efef01
ffff00013d62e840 1215282296 S Bi:6:002:1 -115 32768 <
ffff000103533900 1215283231 C Bi:6:002:1 0 374 = 3e010484 00000f80 60086000 04300000 00000000 d1492a03 443c0000 85eded01
ffff000103533900 1215283255 S Bi:6:002:1 -115 32768 <
ffff000103558cc0 1215284134 C Bi:6:002:1 0 384 = 48010484 00000f80 300b6000 04300000 00000000 4c4d2a03 403a0000 86fcfc01
ffff000103558cc0 1215284159 S Bi:6:002:1 -115 32768 <
ffff00014c2bf900 1215296642 C Bi:6:002:1 0 310 = fe000484 00000f80 c7006000 00300000 00000000 f0772a03 403a0000 33520001
ffff00014c2bf900 1215296667 S Bi:6:002:1 -115 32768 <
ffff00013d62e840 1215382635 C Bi:6:002:1 0 383 = 47010484 00000f80 610c6000 04300000 00000000 f5cd2b03 443a0000 88f2f201
ffff00013d62e840 1215382690 S Bi:6:002:1 -115 32768 <
ffff000103533900 1215386517 C Bi:6:002:1 0 384 = 48010484 00000f80 310b6000 04300000 00000000 3edd2b03 463a0000 82e9e901
ffff000103533900 1215386543 S Bi:6:002:1 -115 32768 <
ffff000103558cc0 1215401090 C Bi:6:002:1 0 310 = fe000484 00000f80 c8006000 00300000 00000000 f10f2c03 463a0000 61520001
ffff000103558cc0 1215401123 S Bi:6:002:1 -115 32768 <
ffff00014c2bf900 1215410336 C Bi:6:002:1 0 377 = 41010484 00000f00 5b0d6000 04300000 00000000 593a2c03 443c0000 87f5f501
ffff00014c2bf900 1215410369 S Bi:6:002:1 -115 32768 <
ffff00013d62e840 1215410970 C Bi:6:002:1 0 377 = 41010484 00000f00 5b0d6000 04300000 00000000 c73c2c03 443e0000 83efef01
ffff00013d62e840 1215410997 S Bi:6:002:1 -115 32768 <
ffff000103533900 1215412207 C Bi:6:002:1 0 370 = 3a010484 00000f00 43066000 04300000 00000000 a3412c03 443e0000 88f5f501
ffff000103533900 1215412234 S Bi:6:002:1 -115 32768 <
ffff000103558cc0 1215412820 C Bi:6:002:1 0 370 = 3a010484 00000f00 43066000 04300000 00000000 12442c03 443c0000 88f3f301
ffff000103558cc0 1215412845 S Bi:6:002:1 -115 32768 <
ffff00014c2bf900 1215414029 C Bi:6:002:1 0 370 = 3a010484 00000f00 43066000 04300000 00000000 cc482c03 463c0000 87f0f001
ffff00014c2bf900 1215414053 S Bi:6:002:1 -115 32768 <
ffff00013d62e840 1215414613 C Bi:6:002:1 0 345 = 21010484 00000f00 ef086000 04300000 00000000 324b2c03 443c0000 87efef01
ffff00013d62e840 1215414640 S Bi:6:002:1 -115 32768 <
ffff000103533900 1215415230 C Bi:6:002:1 0 345 = 21010484 00000f00 ef086000 04300000 00000000 934d2c03 443e0000 87f7f701
ffff000103533900 1215415254 S Bi:6:002:1 -115 32768 <
ffff000103558cc0 1215415777 C Bi:6:002:1 0 345 = 21010484 00000f00 ef086000 04300000 00000000 d04f2c03 443a0000 82fefe01
ffff000103558cc0 1215415798 S Bi:6:002:1 -115 32768 <
ffff00014c2bf900 1215417776 C Bi:6:002:1 0 378 = 42010484 00000f00 900a6000 04300000 00000000 77572c03 443a0000 83efef01
ffff00014c2bf900 1215417797 S Bi:6:002:1 -115 32768 <
ffff00013d62e840 1215418923 C Bi:6:002:1 0 378 = 42010484 00000f00 900a6000 04300000 00000000 ed5b2c03 443c0000 86fafa01
ffff00013d62e840 1215418947 S Bi:6:002:1 -115 32768 <
ffff000103533900 1215419985 C Bi:6:002:1 0 378 = 42010484 00000f00 900a6000 04300000 00000000 1e602c03 463c0000 85e4e401
ffff000103533900 1215420006 S Bi:6:002:1 -115 32768 <
ffff000103558cc0 1215436251 C Bi:6:002:1 0 377 = 41010484 00000f00 5c0d6000 04300000 00000000 9f9f2c03 44380000 86efef01
ffff000103558cc0 1215436274 S Bi:6:002:1 -115 32768 <
ffff00014c2bf900 1215436901 C Bi:6:002:1 0 377 = 41010484 00000f00 5c0d6000 04300000 00000000 1ca22c03 443a0000 86f9f901
ffff00014c2bf900 1215436928 S Bi:6:002:1 -115 32768 <
ffff00013d62e840 1215437516 C Bi:6:002:1 0 377 = 41010484 00000f00 5c0d6000 04300000 00000000 81a42c03 463a0000 86f6f601
ffff00013d62e840 1215437575 S Bi:6:002:1 -115 32768 <
ffff000103533900 1215438149 C Bi:6:002:1 0 377 = 41010484 00000f00 5c0d6000 04300000 00000000 f9a62c03 463a0000 86fbfb01
ffff000103533900 1215438175 S Bi:6:002:1 -115 32768 <
ffff000103558cc0 1215438770 C Bi:6:002:1 0 370 = 3a010484 00000f00 44066000 04300000 00000000 6fa92c03 44380000 88f1f101
ffff000103558cc0 1215438794 S Bi:6:002:1 -115 32768 <
ffff00014c2bf900 1215440316 C Bi:6:002:1 0 370 = 3a010484 00000f00 44066000 04300000 00000000 85af2c03 463a0000 86f0f001
ffff00014c2bf900 1215440342 S Bi:6:002:1 -115 32768 <
ffff00013d62e840 1215440935 C Bi:6:002:1 0 370 = 3a010484 00000f00 44066000 04300000 00000000 e2b12c03 463a0000 86f8f801
ffff00013d62e840 1215440960 S Bi:6:002:1 -115 32768 <
ffff000103533900 1215442131 C Bi:6:002:1 0 345 = 21010484 00000f00 f0086000 04300000 00000000 c5b62c03 443a0000 86f1f101
ffff000103533900 1215442154 S Bi:6:002:1 -115 32768 <
ffff000103558cc0 1215442705 C Bi:6:002:1 0 345 = 21010484 00000f00 f0086000 04300000 00000000 fbb82c03 463a0000 85f7f701
ffff000103558cc0 1215442725 S Bi:6:002:1 -115 32768 <
ffff00014c2bf900 1215443276 C Bi:6:002:1 0 345 = 21010484 00000f00 f0086000 04300000 00000000 45bb2c03 443a0000 88fbfb01
ffff00014c2bf900 1215443296 S Bi:6:002:1 -115 32768 <
ffff00013d62e840 1215443855 C Bi:6:002:1 0 378 = 42010484 00000f00 910a6000 04300000 00000000 9dbd2c03 463a0000 86f2f201
ffff00013d62e840 1215443871 S Bi:6:002:1 -115 32768 <
ffff000103533900 1215444561 C Bi:6:002:1 0 378 = 42010484 00000f00 910a6000 04300000 00000000 18c02c03 443a0000 86f8f801
ffff000103533900 1215444593 S Bi:6:002:1 -115 32768 <
ffff000103558cc0 1215445221 C Bi:6:002:1 0 378 = 42010484 00000f00 910a6000 04300000 00000000 8ac22c03 443c0000 84fcfc01
ffff000103558cc0 1215445247 S Bi:6:002:1 -115 32768 <
ffff00014c2bf900 1215445825 C Bi:6:002:1 0 378 = 42010484 00000f00 910a6000 04300000 00000000 f4c42c03 463c0000 86f3f301
ffff00014c2bf900 1215445850 S Bi:6:002:1 -115 32768 <
ffff00013d62e840 1215485029 C Bi:6:002:1 0 383 = 47010484 00000f80 620c6000 04300000 00000000 f65d2d03 443a0000 86fbfb01
ffff00013d62e840 1215485085 S Bi:6:002:1 -115 32768 <
ffff000103533900 1215486285 C Bi:6:002:1 0 376 = 40010484 00000f80 cf036000 04300000 00000000 05632d03 463c0000 86f7f701
ffff000103533900 1215486312 S Bi:6:002:1 -115 32768 <
ffff000103558cc0 1215487209 C Bi:6:002:1 0 351 = 27010484 00000f80 910d6000 04300000 00000000 bf662d03 423c0000 88f6f601
ffff000103558cc0 1215487234 S Bi:6:002:1 -115 32768 <
ffff00014c2bf900 1215488179 C Bi:6:002:1 0 374 = 3e010484 00000f80 62086000 04300000 00000000 696a2d03 443a0000 88eded01
ffff00014c2bf900 1215488205 S Bi:6:002:1 -115 32768 <
ffff00013d62e840 1215489022 C Bi:6:002:1 0 384 = 48010484 00000f80 320b6000 04300000 00000000 a66d2d03 40380000 82f1f101
ffff00013d62e840 1215489052 S Bi:6:002:1 -115 32768 <
ffff000103533900 1215505538 C Bi:6:002:1 0 310 = fe000484 00000f80 c9006000 00300000 00000000 f2a72d03 40380000 5e520001
ffff000103533900 1215505563 S Bi:6:002:1 -115 32768 <
ffff000103558cc0 1215588658 C Bi:6:002:1 0 376 = 40010484 00000f80 d0036000 04300000 00000000 f7f22e03 46400000 87f2f201
ffff000103558cc0 1215588696 S Bi:6:002:1 -115 32768 <
ffff00014c2bf900 1215589612 C Bi:6:002:1 0 351 = 27010484 00000f80 920d6000 04300000 00000000 b1f62e03 443a0000 86f1f101
ffff00014c2bf900 1215589638 S Bi:6:002:1 -115 32768 <
ffff00013d62e840 1215591441 C Bi:6:002:1 0 384 = 48010484 00000f80 330b6000 04300000 00000000 bffd2e03 443a0000 84e2e201
ffff00013d62e840 1215591466 S Bi:6:002:1 -115 32768 <
ffff000103533900 1215690097 C Bi:6:002:1 0 383 = 47010484 00000f80 640c6000 04300000 00000000 317f3003 463a0000 86fbfb01
ffff000103533900 1215690130 S Bi:6:002:1 -115 32768 <
ffff000103558cc0 1215691048 C Bi:6:002:1 0 376 = 40010484 00000f80 d1036000 04300000 00000000 d7823003 443a0000 85f9f901
ffff000103558cc0 1215691075 S Bi:6:002:1 -115 32768 <
ffff00014c2bf900 1215691887 C Bi:6:002:1 0 351 = 27010484 00000f80 930d6000 04300000 00000000 91863003 463a0000 89e9e901
ffff00014c2bf900 1215691904 S Bi:6:002:1 -115 32768 <
ffff00013d62e840 1215692906 C Bi:6:002:1 0 374 = 3e010484 00000f80 64086000 04300000 00000000 3b8a3003 44380000 83f4f401
ffff00013d62e840 1215692937 S Bi:6:002:1 -115 32768 <
ffff00013d9fb000 1215772206 S Ci:6:002:0 s c0 05 004c 0000 0001 1 <
ffff00013d9fb000 1215772380 C Ci:6:002:0 0 1 = 20
ffff00013d9fb000 1215772548 S Co:6:002:0 s 40 05 004c 0000 0001 1 = 20
ffff00013d9fb000 1215772686 C Co:6:002:0 0 1 >
ffff000103533900 1215792226 C Bi:6:002:1 0 383 = 47010484 00000f80 650c6000 04300000 00000000 fb0d3203 463a0000 86eded01
ffff000103533900 1215792252 S Bi:6:002:1 -115 32768 <
ffff000103558cc0 1215793350 C Bi:6:002:1 0 376 = 40010484 00000f80 d2036000 04300000 00000000 81123203 463a0000 88f1f101
ffff000103558cc0 1215793375 S Bi:6:002:1 -115 32768 <
ffff00014c2bf900 1215794276 C Bi:6:002:1 0 351 = 27010484 00000f80 940d6000 04300000 00000000 3b163203 443e0000 84f5f501
ffff00014c2bf900 1215794300 S Bi:6:002:1 -115 32768 <
ffff00013d62e840 1215795130 C Bi:6:002:1 0 374 = 3e010484 00000f80 65086000 04300000 00000000 7a193203 46400000 87f6f601
ffff00013d62e840 1215795156 S Bi:6:002:1 -115 32768 <
ffff000103533900 1215795977 C Bi:6:002:1 0 384 = 48010484 00000f80 350b6000 04300000 00000000 a41c3203 443c0000 86f9f901
ffff000103533900 1215796003 S Bi:6:002:1 -115 32768 <
ffff000103558cc0 1215894635 C Bi:6:002:1 0 383 = 47010484 00000f80 660c6000 04300000 00000000 fc9d3303 443c0000 84f1f101
ffff000103558cc0 1215894694 S Bi:6:002:1 -115 32768 <
ffff00014c2bf900 1215895830 C Bi:6:002:1 0 376 = 40010484 00000f80 d3036000 04300000 00000000 cca23303 463e0000 87eded01
ffff00014c2bf900 1215895857 S Bi:6:002:1 -115 32768 <
ffff00013d62e840 1215896750 C Bi:6:002:1 0 351 = 27010484 00000f80 950d6000 04300000 00000000 85a63303 443c0000 88eded01
ffff00013d62e840 1215896776 S Bi:6:002:1 -115 32768 <
ffff000103533900 1215897727 C Bi:6:002:1 0 374 = 3e010484 00000f80 66086000 04300000 00000000 2faa3303 403a0000 860c0c01
ffff000103533900 1215897751 S Bi:6:002:1 -115 32768 <
ffff000103558cc0 1215898490 C Bi:6:002:1 0 384 = 48010484 00000f80 360b6000 04300000 00000000 28ad3303 463c0000 84eded01
ffff000103558cc0 1215898515 S Bi:6:002:1 -115 32768 <
ffff00014c2bf900 1215978680 C Bi:6:002:1 0 370 = 3a010484 00000f00 45066000 04300000 00000000 77e63403 463c0000 87efef01
ffff00014c2bf900 1215978710 S Bi:6:002:1 -115 32768 <
ffff00013d62e840 1215980657 C Bi:6:002:1 0 370 = 3a010484 00000f00 45066000 04300000 00000000 47ee3403 463a0000 87f2f201
ffff00013d62e840 1215980691 S Bi:6:002:1 -115 32768 <
ffff000103533900 1215981286 C Bi:6:002:1 0 370 = 3a010484 00000f00 45066000 04300000 00000000 bef03403 463c0000 86f7f701
ffff000103533900 1215981307 S Bi:6:002:1 -115 32768 <
ffff000103558cc0 1215981887 C Bi:6:002:1 0 370 = 3a010484 00000f00 45066000 04300000 00000000 1bf33403 443a0000 84f4f401
ffff000103558cc0 1215981916 S Bi:6:002:1 -115 32768 <
ffff000190514480 1215990046 S Ci:6:002:0 s c0 05 0454 0000 0001 1 <
ffff000190514480 1215990125 C Ci:6:002:0 0 1 = 00
ffff000190514480 1215990165 S Ci:6:002:0 s c0 05 0860 0000 0004 4 <
ffff000190514480 1215990218 C Ci:6:002:0 0 4 = 21c3d572
ffff000190514480 1215990251 S Co:6:002:0 s 40 05 0860 0000 0004 4 = 21c3d572
ffff000190514480 1215990292 C Co:6:002:0 0 4 >
ffff000190514480 1215990320 S Ci:6:002:0 s c0 05 0c00 0000 0004 4 <
ffff000190514480 1215990371 C Ci:6:002:0 0 4 = 07000000
ffff000190514480 1215990396 S Ci:6:002:0 s c0 05 08b0 0000 0004 4 <
ffff000190514480 1215990429 C Ci:6:002:0 0 4 = 42060000
ffff000190514480 1215990455 S Co:6:002:0 s 40 05 08b0 0000 0004 4 = 18060000
ffff000190514480 1215990493 C Co:6:002:0 0 4 >
ffff000190514480 1215990539 S Ci:6:002:0 s c0 05 0d04 0000 0004 4 <
ffff000190514480 1215990584 C Ci:6:002:0 0 4 = 017c90b1
ffff000190514480 1215990615 S Co:6:002:0 s 40 05 0c90 0000 0004 4 = 017c8001
ffff000190514480 1215990642 C Co:6:002:0 0 4 >
ffff000190514480 1215990682 S Ci:6:002:0 s c0 05 08ac 0000 0004 4 <
ffff000190514480 1215990744 C Ci:6:002:0 0 4 = 08faf00f
ffff000190514480 1215990771 S Co:6:002:0 s 40 05 08ac 0000 0004 4 = 08faf00f
ffff000190514480 1215990810 C Co:6:002:0 0 4 >
ffff000190514480 1215990838 S Ci:6:002:0 s c0 05 08ac 0000 0004 4 <
ffff000190514480 1215990882 C Ci:6:002:0 0 4 = 08faf00f
ffff000190514480 1215990909 S Co:6:002:0 s 40 05 08ac 0000 0004 4 = 08faf00f
ffff000190514480 1215990949 C Co:6:002:0 0 4 >
ffff000190514480 1215990976 S Ci:6:002:0 s c0 05 08c4 0000 0004 4 <
ffff000190514480 1215991020 C Ci:6:002:0 0 4 = 00000000
ffff000190514480 1215991047 S Co:6:002:0 s 40 05 08c4 0000 0004 4 = 00000000
ffff000190514480 1215991085 C Co:6:002:0 0 4 >
ffff000190514480 1215991112 S Ci:6:002:0 s c0 05 0c00 0000 0004 4 <
ffff000190514480 1215991156 C Ci:6:002:0 0 4 = 07000000
ffff000190514480 1215991182 S Ci:6:002:0 s c0 05 08b0 0000 0004 4 <
ffff000190514480 1215991214 C Ci:6:002:0 0 4 = 18060000
ffff000190514480 1215991239 S Co:6:002:0 s 40 05 08b0 0000 0004 4 = 18060000
ffff000190514480 1215991278 C Co:6:002:0 0 4 >
ffff000190514480 1215991325 S Ci:6:002:0 s c0 05 0d04 0000 0004 4 <
ffff000190514480 1215991371 C Ci:6:002:0 0 4 = 017c90b1
ffff000190514480 1215991397 S Co:6:002:0 s 40 05 0c90 0000 0004 4 = 017c8001
ffff000190514480 1215991436 C Co:6:002:0 0 4 >
ffff000190514480 1215991476 S Ci:6:002:0 s c0 05 0e00 0000 0004 4 <
ffff000190514480 1215991520 C Ci:6:002:0 0 4 = 07000000
ffff000190514480 1215991545 S Ci:6:002:0 s c0 05 08b0 0000 0004 4 <
ffff000190514480 1215991578 C Ci:6:002:0 0 4 = 18060000
ffff000190514480 1215991603 S Co:6:002:0 s 40 05 08b0 0000 0004 4 = 18060000
ffff000190514480 1215991631 C Co:6:002:0 0 4 >
ffff000190514480 1215991677 S Ci:6:002:0 s c0 05 0d44 0000 0004 4 <
ffff000190514480 1215991739 C Ci:6:002:0 0 4 = 017c90b1
ffff000190514480 1215991766 S Co:6:002:0 s 40 05 0e90 0000 0004 4 = 017c8001
ffff000190514480 1215991804 C Co:6:002:0 0 4 >
ffff000190514480 1215991843 S Ci:6:002:0 s c0 05 08ac 0000 0004 4 <
ffff000190514480 1215991888 C Ci:6:002:0 0 4 = 08faf00f
ffff000190514480 1215991915 S Co:6:002:0 s 40 05 08ac 0000 0004 4 = 08faf00f
ffff000190514480 1215991943 C Co:6:002:0 0 4 >
ffff000190514480 1215991968 S Ci:6:002:0 s c0 05 08ac 0000 0004 4 <
ffff000190514480 1215992011 C Ci:6:002:0 0 4 = 08faf00f
ffff000190514480 1215992103 S Co:6:002:0 s 40 05 08ac 0000 0004 4 = 08faf00f
ffff000190514480 1215992141 C Co:6:002:0 0 4 >
ffff000190514480 1215992173 S Ci:6:002:0 s c0 05 08c4 0000 0004 4 <
ffff000190514480 1215992221 C Ci:6:002:0 0 4 = 00000000
ffff000190514480 1215992250 S Co:6:002:0 s 40 05 08c4 0000 0004 4 = 00000000
ffff000190514480 1215992279 C Co:6:002:0 0 4 >
ffff000190514480 1215992308 S Ci:6:002:0 s c0 05 0e00 0000 0004 4 <
ffff000190514480 1215992350 C Ci:6:002:0 0 4 = 07000000
ffff000190514480 1215992381 S Ci:6:002:0 s c0 05 08b0 0000 0004 4 <
ffff000190514480 1215992420 C Ci:6:002:0 0 4 = 18060000
ffff000190514480 1215992452 S Co:6:002:0 s 40 05 08b0 0000 0004 4 = 18060000
ffff000190514480 1215992495 C Co:6:002:0 0 4 >
ffff000190514480 1215992545 S Ci:6:002:0 s c0 05 0d44 0000 0004 4 <
ffff000190514480 1215992592 C Ci:6:002:0 0 4 = 017c90b1
ffff000190514480 1215992621 S Co:6:002:0 s 40 05 0e90 0000 0004 4 = 017c8001
ffff000190514480 1215992662 C Co:6:002:0 0 4 >
ffff000190514480 1215992704 S Ci:6:002:0 s c0 05 0668 0000 0002 2 <
ffff000190514480 1215992750 C Ci:6:002:0 0 2 = 0010
ffff000190514480 1215992779 S Co:6:002:0 s 40 05 0668 0000 0002 2 = 0010
ffff000190514480 1215992808 C Co:6:002:0 0 2 >
ffff000190514480 1215992836 S Co:6:002:0 s 40 05 0483 0000 0001 1 = 00
ffff000190514480 1215992869 C Co:6:002:0 0 1 >
ffff000190514480 1215992897 S Ci:6:002:0 s c0 05 0837 0000 0001 1 <
ffff000190514480 1215992929 C Ci:6:002:0 0 1 = 00
ffff000190514480 1215992958 S Ci:6:002:0 s c0 05 08ac 0000 0004 4 <
ffff000190514480 1215992996 C Ci:6:002:0 0 4 = 08faf00f
ffff000190514480 1215993024 S Co:6:002:0 s 40 05 08ac 0000 0004 4 = 08faf00f
ffff000190514480 1215993053 C Co:6:002:0 0 4 >
ffff000190514480 1215993082 S Ci:6:002:0 s c0 05 08c4 0000 0004 4 <
ffff000190514480 1215993120 C Ci:6:002:0 0 4 = 00000000
ffff000190514480 1215993150 S Co:6:002:0 s 40 05 08c4 0000 0004 4 = 00000000
ffff000190514480 1215993179 C Co:6:002:0 0 4 >
ffff000190514480 1215993208 S Ci:6:002:0 s c0 05 0848 0000 0004 4 <
ffff000190514480 1215993245 C Ci:6:002:0 0 4 = 8bffd061
ffff000190514480 1215993273 S Co:6:002:0 s 40 05 0848 0000 0004 4 = 8bffd061
ffff000190514480 1215993303 C Co:6:002:0 0 4 >
ffff000190514480 1215993332 S Ci:6:002:0 s c0 05 08ac 0000 0004 4 <
ffff000190514480 1215993370 C Ci:6:002:0 0 4 = 08faf00f
ffff000190514480 1215993399 S Co:6:002:0 s 40 05 08ac 0000 0004 4 = 08faf00f
ffff000190514480 1215993428 C Co:6:002:0 0 4 >
ffff000190514480 1215993456 S Ci:6:002:0 s c0 05 08ac 0000 0004 4 <
ffff000190514480 1215993495 C Ci:6:002:0 0 4 = 08faf00f
ffff000190514480 1215993524 S Co:6:002:0 s 40 05 08ac 0000 0004 4 = 08faf00f
ffff000190514480 1215993554 C Co:6:002:0 0 4 >
ffff000190514480 1215993583 S Ci:6:002:0 s c0 05 08c4 0000 0004 4 <
ffff000190514480 1215993621 C Ci:6:002:0 0 4 = 00000000
ffff000190514480 1215993649 S Co:6:002:0 s 40 05 08c4 0000 0004 4 = 00000000
ffff000190514480 1215993678 C Co:6:002:0 0 4 >
ffff000190514480 1215993707 S Ci:6:002:0 s c0 05 0c00 0000 0004 4 <
ffff000190514480 1215993746 C Ci:6:002:0 0 4 = 07000000
ffff000190514480 1215993775 S Ci:6:002:0 s c0 05 08b0 0000 0004 4 <
ffff000190514480 1215993808 C Ci:6:002:0 0 4 = 18060000
ffff000190514480 1215993838 S Co:6:002:0 s 40 05 08b0 0000 0004 4 = 18060000
ffff000190514480 1215993869 C Co:6:002:0 0 4 >
ffff000190514480 1215993918 S Ci:6:002:0 s c0 05 0d04 0000 0004 4 <
ffff000190514480 1215993962 C Ci:6:002:0 0 4 = 017c90b1
ffff000190514480 1215993991 S Co:6:002:0 s 40 05 0c90 0000 0004 4 = 017c8001
ffff000190514480 1215994020 C Co:6:002:0 0 4 >
ffff000190514480 1215994061 S Ci:6:002:0 s c0 05 0e00 0000 0004 4 <
ffff000190514480 1215994121 C Ci:6:002:0 0 4 = 07000000
ffff000190514480 1215994151 S Ci:6:002:0 s c0 05 08b0 0000 0004 4 <
ffff000190514480 1215994183 C Ci:6:002:0 0 4 = 18060000
ffff000190514480 1215994211 S Co:6:002:0 s 40 05 08b0 0000 0004 4 = 18060000
ffff000190514480 1215994244 C Co:6:002:0 0 4 >
ffff000190514480 1215994293 S Ci:6:002:0 s c0 05 0d44 0000 0004 4 <
ffff000190514480 1215994337 C Ci:6:002:0 0 4 = 017c90b1
ffff000190514480 1215994366 S Co:6:002:0 s 40 05 0e90 0000 0004 4 = 017c8001
ffff000190514480 1215994394 C Co:6:002:0 0 4 >
ffff000190514480 1215994457 S Ci:6:002:0 s c0 05 0c20 0000 0004 4 <
ffff000190514480 1215994502 C Ci:6:002:0 0 4 = 13131313
ffff000190514480 1215994530 S Co:6:002:0 s 40 05 0c20 0000 0004 4 = 13131313
ffff000190514480 1215994559 C Co:6:002:0 0 4 >
ffff000190514480 1215994587 S Ci:6:002:0 s c0 05 0c24 0000 0004 4 <
ffff000190514480 1215994621 C Ci:6:002:0 0 4 = 20202020
ffff000190514480 1215994650 S Co:6:002:0 s 40 05 0c24 0000 0004 4 = 20202020
ffff000190514480 1215994678 C Co:6:002:0 0 4 >
ffff000190514480 1215994708 S Ci:6:002:0 s c0 05 0c28 0000 0004 4 <
ffff000190514480 1215994751 C Ci:6:002:0 0 4 = 20201e1c
ffff000190514480 1215994780 S Co:6:002:0 s 40 05 0c28 0000 0004 4 = 20201e1c
ffff000190514480 1215994820 C Co:6:002:0 0 4 >
ffff000190514480 1215994849 S Ci:6:002:0 s c0 05 0c2c 0000 0004 4 <
ffff000190514480 1215994894 C Ci:6:002:0 0 4 = 20202020
ffff000190514480 1215994923 S Co:6:002:0 s 40 05 0c2c 0000 0004 4 = 20202020
ffff000190514480 1215994951 C Co:6:002:0 0 4 >
ffff000190514480 1215994979 S Ci:6:002:0 s c0 05 0c30 0000 0004 4 <
ffff000190514480 1215995012 C Ci:6:002:0 0 4 = 20201e1c
ffff000190514480 1215995042 S Co:6:002:0 s 40 05 0c30 0000 0004 4 = 20201e1c
ffff000190514480 1215995071 C Co:6:002:0 0 4 >
ffff000190514480 1215995100 S Ci:6:002:0 s c0 05 0c34 0000 0004 4 <
ffff000190514480 1215995134 C Ci:6:002:0 0 4 = 20202020
ffff000190514480 1215995163 S Co:6:002:0 s 40 05 0c34 0000 0004 4 = 20202020
ffff000190514480 1215995192 C Co:6:002:0 0 4 >
ffff000190514480 1215995222 S Ci:6:002:0 s c0 05 0c38 0000 0004 4 <
ffff000190514480 1215995266 C Ci:6:002:0 0 4 = 201e1c1a
ffff000190514480 1215995295 S Co:6:002:0 s 40 05 0c38 0000 0004 4 = 201e1c1a
ffff000190514480 1215995335 C Co:6:002:0 0 4 >
ffff000190514480 1215995364 S Ci:6:002:0 s c0 05 0c3c 0000 0004 4 <
ffff000190514480 1215995408 C Ci:6:002:0 0 4 = 20202020
ffff000190514480 1215995436 S Co:6:002:0 s 40 05 0c3c 0000 0004 4 = 20202020
ffff000190514480 1215995465 C Co:6:002:0 0 4 >
ffff000190514480 1215995493 S Ci:6:002:0 s c0 05 0c40 0000 0004 4 <
ffff000190514480 1215995527 C Ci:6:002:0 0 4 = 20201e1c
ffff000190514480 1215995556 S Co:6:002:0 s 40 05 0c40 0000 0004 4 = 20201e1c
ffff000190514480 1215995611 C Co:6:002:0 0 4 >
ffff000190514480 1215995641 S Ci:6:002:0 s c0 05 0c44 0000 0004 4 <
ffff000190514480 1215995685 C Ci:6:002:0 0 4 = 1a181e1e
ffff000190514480 1215995714 S Co:6:002:0 s 40 05 0c44 0000 0004 4 = 1a181e1e
ffff000190514480 1215995744 C Co:6:002:0 0 4 >
ffff000190514480 1215995772 S Ci:6:002:0 s c0 05 0c48 0000 0004 4 <
ffff000190514480 1215995805 C Ci:6:002:0 0 4 = 1e1e1e1e
ffff000190514480 1215995834 S Co:6:002:0 s 40 05 0c48 0000 0004 4 = 1e1e1e1e
ffff000190514480 1215995869 C Co:6:002:0 0 4 >
ffff000190514480 1215995898 S Ci:6:002:0 s c0 05 0c4c 0000 0004 4 <
ffff000190514480 1215995932 C Ci:6:002:0 0 4 = 1c1a1816
ffff000190514480 1215995961 S Co:6:002:0 s 40 05 0c4c 0000 0004 4 = 1c1a1816
ffff000190514480 1215995994 C Co:6:002:0 0 4 >
ffff000190514480 1215996034 S Ci:6:002:0 s c0 05 0c54 0000 0004 4 <
ffff000190514480 1215996071 C Ci:6:002:0 0 4 = 120a0400
ffff000190514480 1215996103 S Co:6:002:0 s 40 05 0c54 0000 0004 4 = 120a0400
ffff000190514480 1215996134 C Co:6:002:0 0 4 >
ffff000190514480 1215996167 S Ci:6:002:0 s c0 05 0e20 0000 0004 4 <
ffff000190514480 1215996224 C Ci:6:002:0 0 4 = 14141414
ffff000190514480 1215996259 S Co:6:002:0 s 40 05 0e20 0000 0004 4 = 14141414
ffff000190514480 1215996292 C Co:6:002:0 0 4 >
ffff000190514480 1215996327 S Ci:6:002:0 s c0 05 0e24 0000 0004 4 <
ffff000190514480 1215996378 C Ci:6:002:0 0 4 = 1d1d1d1d
ffff000190514480 1215996414 S Co:6:002:0 s 40 05 0e24 0000 0004 4 = 1d1d1d1d
ffff000190514480 1215996455 C Co:6:002:0 0 4 >
ffff000190514480 1215996492 S Ci:6:002:0 s c0 05 0e28 0000 0004 4 <
ffff000190514480 1215996536 C Ci:6:002:0 0 4 = 1d1d1b19
ffff000190514480 1215996573 S Co:6:002:0 s 40 05 0e28 0000 0004 4 = 1d1d1b19
ffff000190514480 1215996622 C Co:6:002:0 0 4 >
ffff000190514480 1215996658 S Ci:6:002:0 s c0 05 0e2c 0000 0004 4 <
ffff000190514480 1215996695 C Ci:6:002:0 0 4 = 1f1f1f1f
ffff000190514480 1215996732 S Co:6:002:0 s 40 05 0e2c 0000 0004 4 = 1f1f1f1f
ffff000190514480 1215996763 C Co:6:002:0 0 4 >
ffff000190514480 1215996798 S Ci:6:002:0 s c0 05 0e30 0000 0004 4 <
ffff000190514480 1215996835 C Ci:6:002:0 0 4 = 1f1f1d1b
ffff000190514480 1215996871 S Co:6:002:0 s 40 05 0e30 0000 0004 4 = 1f1f1d1b
ffff00014c2bf900 1215996915 C Bi:6:002:1 0 383 = 47010484 00000f80 670c6000 04300000 00000000 fe2d3503 46380000 88f4f401
ffff00014c2bf900 1215996933 S Bi:6:002:1 -115 32768 <
ffff000190514480 1215996959 C Co:6:002:0 0 4 >
ffff000190514480 1215996996 S Ci:6:002:0 s c0 05 0e34 0000 0004 4 <
ffff000190514480 1215997052 C Ci:6:002:0 0 4 = 1f1f1f1f
ffff000190514480 1215997089 S Co:6:002:0 s 40 05 0e34 0000 0004 4 = 1f1f1f1f
ffff000190514480 1215997123 C Co:6:002:0 0 4 >
ffff000190514480 1215997157 S Ci:6:002:0 s c0 05 0e38 0000 0004 4 <
ffff000190514480 1215997195 C Ci:6:002:0 0 4 = 1f1d1b19
ffff000190514480 1215997232 S Co:6:002:0 s 40 05 0e38 0000 0004 4 = 1f1d1b19
ffff000190514480 1215997264 C Co:6:002:0 0 4 >
ffff000190514480 1215997299 S Ci:6:002:0 s c0 05 0e3c 0000 0004 4 <
ffff000190514480 1215997336 C Ci:6:002:0 0 4 = 1f1f1f1f
ffff000190514480 1215997371 S Co:6:002:0 s 40 05 0e3c 0000 0004 4 = 1f1f1f1f
ffff000190514480 1215997403 C Co:6:002:0 0 4 >
ffff000190514480 1215997438 S Ci:6:002:0 s c0 05 0e40 0000 0004 4 <
ffff000190514480 1215997492 C Ci:6:002:0 0 4 = 1f1f1d1b
ffff000190514480 1215997527 S Co:6:002:0 s 40 05 0e40 0000 0004 4 = 1f1f1d1b
ffff000190514480 1215997558 C Co:6:002:0 0 4 >
ffff000190514480 1215997593 S Ci:6:002:0 s c0 05 0e44 0000 0004 4 <
ffff000190514480 1215997631 C Ci:6:002:0 0 4 = 19171d1d
ffff000190514480 1215997665 S Co:6:002:0 s 40 05 0e44 0000 0004 4 = 19171d1d
ffff000190514480 1215997697 C Co:6:002:0 0 4 >
ffff000190514480 1215997731 S Ci:6:002:0 s c0 05 0e48 0000 0004 4 <
ffff000190514480 1215997770 C Ci:6:002:0 0 4 = 1d1d1d1d
ffff000190514480 1215997803 S Co:6:002:0 s 40 05 0e48 0000 0004 4 = 1d1d1d1d
ffff000190514480 1215997834 C Co:6:002:0 0 4 >
ffff000190514480 1215997868 S Ci:6:002:0 s c0 05 0e4c 0000 0004 4 <
ffff000190514480 1215997905 C Ci:6:002:0 0 4 = 1b191715
ffff000190514480 1215997940 S Co:6:002:0 s 40 05 0e4c 0000 0004 4 = 1b191715
ffff000190514480 1215997988 C Co:6:002:0 0 4 >
ffff000190514480 1215998023 S Ci:6:002:0 s c0 05 0e54 0000 0004 4 <
ffff000190514480 1215998061 C Ci:6:002:0 0 4 = 11090300
ffff000190514480 1215998095 S Co:6:002:0 s 40 05 0e54 0000 0004 4 = 11090300
ffff000190514480 1215998128 C Co:6:002:0 0 4 >
ffff000190514480 1215998176 S Ci:6:002:0 s c0 05 0454 0000 0001 1 <
ffff000190514480 1215998242 C Ci:6:002:0 0 1 = 00
ffff000190514480 1215998276 S Ci:6:002:0 s c0 05 0454 0000 0001 1 <
ffff000190514480 1215998313 C Ci:6:002:0 0 1 = 00
ffff000190514480 1215998346 S Co:6:002:0 s 40 05 0454 0000 0001 1 = 80
ffff000190514480 1215998377 C Co:6:002:0 0 1 >
ffff000190514480 1215998411 S Ci:6:002:0 s c0 05 041a 0000 0002 2 <
ffff000190514480 1215998448 C Ci:6:002:0 0 2 = ff0f
ffff000190514480 1215998483 S Ci:6:002:0 s c0 05 0808 0000 0004 4 <
ffff000190514480 1215998520 C Ci:6:002:0 0 4 = 3382023e
ffff000190514480 1215998555 S Co:6:002:0 s 40 05 0808 0000 0004 4 = 3382023e
ffff000190514480 1215998585 C Co:6:002:0 0 4 >
ffff000190514480 1215998619 S Ci:6:002:0 s c0 05 0834 0000 0004 4 <
ffff000190514480 1215998657 C Ci:6:002:0 0 4 = 05a73700
ffff000190514480 1215998691 S Co:6:002:0 s 40 05 0834 0000 0004 4 = 06a73700
ffff000190514480 1215998738 C Co:6:002:0 0 4 >
ffff000190514480 1215998772 S Ci:6:002:0 s c0 05 0830 0000 0004 4 <
ffff000190514480 1215998811 C Ci:6:002:0 0 4 = b8eeaa2e
ffff000190514480 1215998845 S Co:6:002:0 s 40 05 0830 0000 0004 4 = b8aeaa2e
ffff000190514480 1215998876 C Co:6:002:0 0 4 >
ffff000190514480 1215998910 S Ci:6:002:0 s c0 05 0830 0000 0004 4 <
ffff000190514480 1215998949 C Ci:6:002:0 0 4 = b8aeaa2e
ffff000190514480 1215998983 S Co:6:002:0 s 40 05 0830 0000 0004 4 = b8aeaa2e
ffff000190514480 1215999015 C Co:6:002:0 0 4 >
ffff000190514480 1215999049 S Ci:6:002:0 s c0 05 082c 0000 0004 4 <
ffff000190514480 1215999087 C Ci:6:002:0 0 4 = dc832000
ffff00014c2bf3c0 1215999121 S Co:6:002:0 s 40 05 082c 0000 0004 4 = dd832000
ffff00013d62e840 1215999143 C Bi:6:002:1 0 351 = 27010484 00000f80 960d6000 04300000 00000000 bf363503 443a0000 83f4f401
ffff00013d62e840 1215999170 S Bi:6:002:1 -115 32768 <
ffff00014c2bf3c0 1215999214 C Co:6:002:0 0 4 >
ffff00014c2bf3c0 1215999250 S Co:6:002:0 s 40 05 0cb0 0000 0004 4 = 17773354
ffff00014c2bf3c0 1215999284 C Co:6:002:0 0 4 >
ffff00014c2bf3c0 1215999320 S Co:6:002:0 s 40 05 0eb0 0000 0004 4 = 17773354
ffff00014c2bf3c0 1215999369 C Co:6:002:0 0 4 >
ffff00014c2bf3c0 1215999404 S Ci:6:002:0 s c0 05 0cb4 0000 0004 4 <
ffff00014c2bf3c0 1215999442 C Ci:6:002:0 0 4 = 77000001
ffff00014c2bf3c0 1215999476 S Co:6:002:0 s 40 05 0cb4 0000 0004 4 = 77000001
ffff00014c2bf3c0 1215999508 C Co:6:002:0 0 4 >
ffff00014c2bf3c0 1215999542 S Ci:6:002:0 s c0 05 0eb4 0000 0004 4 <
ffff00014c2bf3c0 1215999581 C Ci:6:002:0 0 4 = 77000001
ffff00014c2bf3c0 1215999615 S Co:6:002:0 s 40 05 0eb4 0000 0004 4 = 77000001
ffff00014c2bf3c0 1215999647 C Co:6:002:0 0 4 >
ffff00014c2bf3c0 1215999682 S Ci:6:002:0 s c0 05 0900 0000 0004 4 <
ffff00014c2bf3c0 1215999720 C Ci:6:002:0 0 4 = 01040000
ffff00014c2bf3c0 1215999754 S Co:6:002:0 s 40 05 0900 0000 0004 4 = 01040000
ffff00014c2bf3c0 1215999786 C Co:6:002:0 0 4 >
ffff00014c2bf3c0 1215999820 S Ci:6:002:0 s c0 05 080c 0000 0004 4 <
ffff00014c2bf3c0 1215999875 C Ci:6:002:0 0 4 = 13111312
ffff00014c2bf3c0 1215999909 S Co:6:002:0 s 40 05 080c 0000 0004 4 = 03111312
ffff00014c2bf3c0 1215999940 C Co:6:002:0 0 4 >
ffff00014c2bf3c0 1215999975 S Ci:6:002:0 s c0 05 0a04 0000 0004 4 <
ffff00014c2bf3c0 1216000029 C Ci:6:002:0 0 4 = 0c00ff01
ffff0001197b9d80 1216000064 S Co:6:002:0 s 40 05 0a04 0000 0004 4 = 0c00ff0f
ffff000103533900 1216000088 C Bi:6:002:1 0 374 = 3e010484 00000f80 67086000 04300000 00000000 693a3503 46440000 8bf4f401
ffff000103533900 1216000103 S Bi:6:002:1 -115 32768 <
ffff0001197b9d80 1216000150 C Co:6:002:0 0 4 >
ffff0001197b9d80 1216000188 S Ci:6:002:0 s c0 05 0440 0000 0004 4 <
ffff0001197b9d80 1216000247 C Ci:6:002:0 0 4 = 00000000
ffff0001197b9d80 1216000284 S Co:6:002:0 s 40 05 0440 0000 0004 4 = 50010000
ffff0001197b9d80 1216000317 C Co:6:002:0 0 4 >
ffff0001197b9d80 1216000351 S Ci:6:002:0 s c0 05 0c1c 0000 0004 4 <
ffff0001197b9d80 1216000389 C Ci:6:002:0 0 4 = 03000040
ffff0001197b9d80 1216000423 S Co:6:002:0 s 40 05 0c1c 0000 0004 4 = 0300402d
ffff0001197b9d80 1216000455 C Co:6:002:0 0 4 >
ffff0001197b9d80 1216000489 S Ci:6:002:0 s c0 05 0e1c 0000 0004 4 <
ffff0001197b9d80 1216000528 C Ci:6:002:0 0 4 = 03000040
ffff0001197b9d80 1216000562 S Co:6:002:0 s 40 05 0e1c 0000 0004 4 = 0300402d
ffff0001197b9d80 1216000594 C Co:6:002:0 0 4 >
ffff0001197b9d80 1216000629 S Ci:6:002:0 s c0 05 0860 0000 0004 4 <
ffff0001197b9d80 1216000668 C Ci:6:002:0 0 4 = 21c3d572
ffff0001197b9d80 1216000703 S Co:6:002:0 s 40 05 0860 0000 0004 4 = 21c32568
ffff0001197b9d80 1216000746 C Co:6:002:0 0 4 >
ffff0001197b9d80 1216000780 S Ci:6:002:0 s c0 05 0c00 0000 0004 4 <
ffff0001197b9d80 1216000818 C Ci:6:002:0 0 4 = 07000000
ffff0001197b9d80 1216000853 S Ci:6:002:0 s c0 05 08b0 0000 0004 4 <
ffff000103558cc0 1216000881 C Bi:6:002:1 0 384 = 48010484 00000f80 370b6000 04300000 00000000 803d3503 463e0000 8ce8e80f
ffff000103558cc0 1216000907 S Bi:6:002:1 -115 32768 <
ffff0001197b9d80 1216000955 C Ci:6:002:0 0 4 = 18060000
ffff0001197b9d80 1216000992 S Co:6:002:0 s 40 05 08b0 0000 0004 4 = 18060000
ffff0001197b9d80 1216001026 C Co:6:002:0 0 4 >
ffff0001197b9d80 1216001082 S Ci:6:002:0 s c0 05 0d04 0000 0004 4 <
ffff0001197b9d80 1216001134 C Ci:6:002:0 0 4 = 017c90b1
ffff0001197b9d80 1216001168 S Co:6:002:0 s 40 05 0c90 0000 0004 4 = 017d8301
ffff0001197b9d80 1216001199 C Co:6:002:0 0 4 >
ffff0001197b9d80 1216001246 S Ci:6:002:0 s c0 05 08ac 0000 0004 4 <
ffff0001197b9d80 1216001297 C Ci:6:002:0 0 4 = 08faf00f
ffff0001197b9d80 1216001331 S Co:6:002:0 s 40 05 08ac 0000 0004 4 = 08faf00f
ffff0001197b9d80 1216001371 C Co:6:002:0 0 4 >
ffff0001197b9d80 1216001406 S Ci:6:002:0 s c0 05 08ac 0000 0004 4 <
ffff0001197b9d80 1216001444 C Ci:6:002:0 0 4 = 08faf00f
ffff0001197b9d80 1216001478 S Co:6:002:0 s 40 05 08ac 0000 0004 4 = 08faf00f
ffff0001197b9d80 1216001509 C Co:6:002:0 0 4 >
ffff0001197b9d80 1216001544 S Ci:6:002:0 s c0 05 08c4 0000 0004 4 <
ffff0001197b9d80 1216001583 C Ci:6:002:0 0 4 = 00000000
ffff0001197b9d80 1216001620 S Co:6:002:0 s 40 05 08c4 0000 0004 4 = 00000000
ffff0001197b9d80 1216001652 C Co:6:002:0 0 4 >
ffff0001197b9d80 1216001687 S Ci:6:002:0 s c0 05 0c00 0000 0004 4 <
ffff0001197b9d80 1216001743 C Ci:6:002:0 0 4 = 07000000
ffff0001197b9d80 1216001778 S Ci:6:002:0 s c0 05 08b0 0000 0004 4 <
ffff0001197b9d80 1216001816 C Ci:6:002:0 0 4 = 18060000
ffff0001197b9d80 1216001850 S Co:6:002:0 s 40 05 08b0 0000 0004 4 = 18060000
ffff0001197b9d80 1216001882 C Co:6:002:0 0 4 >
ffff0001197b9d80 1216001937 S Ci:6:002:0 s c0 05 0d04 0000 0004 4 <
ffff0001197b9d80 1216001997 C Ci:6:002:0 0 4 = 017d91b1
ffff0001197b9d80 1216002032 S Co:6:002:0 s 40 05 0c90 0000 0004 4 = 887d8101
ffff0001197b9d80 1216002062 C Co:6:002:0 0 4 >
ffff0001197b9d80 1216002109 S Ci:6:002:0 s c0 05 0e00 0000 0004 4 <
ffff0001197b9d80 1216002155 C Ci:6:002:0 0 4 = 07000000
ffff0001197b9d80 1216002189 S Ci:6:002:0 s c0 05 08b0 0000 0004 4 <
ffff0001197b9d80 1216002241 C Ci:6:002:0 0 4 = 18060000
ffff0001197b9d80 1216002275 S Co:6:002:0 s 40 05 08b0 0000 0004 4 = 18060000
ffff0001197b9d80 1216002305 C Co:6:002:0 0 4 >
ffff0001197b9d80 1216002358 S Ci:6:002:0 s c0 05 0d44 0000 0004 4 <
ffff0001197b9d80 1216002405 C Ci:6:002:0 0 4 = 017c90b1
ffff0001197b9d80 1216002439 S Co:6:002:0 s 40 05 0e90 0000 0004 4 = 017d8301
ffff0001197b9d80 1216002470 C Co:6:002:0 0 4 >
ffff0001197b9d80 1216002516 S Ci:6:002:0 s c0 05 08ac 0000 0004 4 <
ffff0001197b9d80 1216002562 C Ci:6:002:0 0 4 = 08faf00f
ffff0001197b9d80 1216002596 S Co:6:002:0 s 40 05 08ac 0000 0004 4 = 08faf00f
ffff0001197b9d80 1216002626 C Co:6:002:0 0 4 >
ffff0001197b9d80 1216002660 S Ci:6:002:0 s c0 05 08ac 0000 0004 4 <
ffff0001197b9d80 1216002696 C Ci:6:002:0 0 4 = 08faf00f
ffff0001197b9d80 1216002731 S Co:6:002:0 s 40 05 08ac 0000 0004 4 = 08faf00f
ffff0001197b9d80 1216002762 C Co:6:002:0 0 4 >
ffff0001197b9d80 1216002796 S Ci:6:002:0 s c0 05 08c4 0000 0004 4 <
ffff0001197b9d80 1216002832 C Ci:6:002:0 0 4 = 00000000
ffff0001197b9d80 1216002866 S Co:6:002:0 s 40 05 08c4 0000 0004 4 = 00000000
ffff0001197b9d80 1216002897 C Co:6:002:0 0 4 >
ffff0001197b9d80 1216002932 S Ci:6:002:0 s c0 05 0e00 0000 0004 4 <
ffff0001197b9d80 1216002968 C Ci:6:002:0 0 4 = 07000000
ffff0001197b9d80 1216003002 S Ci:6:002:0 s c0 05 08b0 0000 0004 4 <
ffff0001197b9d80 1216003039 C Ci:6:002:0 0 4 = 18060000
ffff0001197b9d80 1216003073 S Co:6:002:0 s 40 05 08b0 0000 0004 4 = 18060000
ffff0001197b9d80 1216003121 C Co:6:002:0 0 4 >
ffff0001197b9d80 1216003176 S Ci:6:002:0 s c0 05 0d44 0000 0004 4 <
ffff0001197b9d80 1216003241 C Ci:6:002:0 0 4 = 017d91b1
ffff0001197b9d80 1216003275 S Co:6:002:0 s 40 05 0e90 0000 0004 4 = 887d8101
ffff0001197b9d80 1216003306 C Co:6:002:0 0 4 >
ffff0001197b9d80 1216003353 S Ci:6:002:0 s c0 05 0668 0000 0002 2 <
ffff0001197b9d80 1216003399 C Ci:6:002:0 0 2 = 0010
ffff0001197b9d80 1216003433 S Co:6:002:0 s 40 05 0668 0000 0002 2 = 0010
ffff0001197b9d80 1216003464 C Co:6:002:0 0 2 >
ffff0001197b9d80 1216003498 S Co:6:002:0 s 40 05 0483 0000 0001 1 = 00
ffff0001197b9d80 1216003528 C Co:6:002:0 0 1 >
ffff0001197b9d80 1216003562 S Ci:6:002:0 s c0 05 0837 0000 0001 1 <
ffff0001197b9d80 1216003616 C Ci:6:002:0 0 1 = 00
ffff0001197b9d80 1216003650 S Ci:6:002:0 s c0 05 08ac 0000 0004 4 <
ffff0001197b9d80 1216003685 C Ci:6:002:0 0 4 = 08faf00f
ffff0001197b9d80 1216003720 S Co:6:002:0 s 40 05 08ac 0000 0004 4 = 08faf00f
ffff0001197b9d80 1216003751 C Co:6:002:0 0 4 >
ffff0001197b9d80 1216003785 S Ci:6:002:0 s c0 05 08c4 0000 0004 4 <
ffff0001197b9d80 1216003822 C Ci:6:002:0 0 4 = 00000000
ffff0001197b9d80 1216003856 S Co:6:002:0 s 40 05 08c4 0000 0004 4 = 00000000
ffff0001197b9d80 1216003887 C Co:6:002:0 0 4 >
ffff0001197b9d80 1216003921 S Ci:6:002:0 s c0 05 0848 0000 0004 4 <
ffff0001197b9d80 1216003958 C Ci:6:002:0 0 4 = 8bffd061
ffff0001197b9d80 1216003992 S Co:6:002:0 s 40 05 0848 0000 0004 4 = 8bffd061
ffff0001197b9d80 1216004085 C Co:6:002:0 0 4 >
ffff0001197b9d80 1216004103 S Ci:6:002:0 s c0 05 08ac 0000 0004 4 <
ffff0001197b9d80 1216004140 C Ci:6:002:0 0 4 = 08faf00f
ffff0001197b9d80 1216004177 S Co:6:002:0 s 40 05 08ac 0000 0004 4 = 08faf00f
ffff0001197b9d80 1216004208 C Co:6:002:0 0 4 >
ffff0001197b9d80 1216004238 S Ci:6:002:0 s c0 05 08ac 0000 0004 4 <
ffff0001197b9d80 1216004275 C Ci:6:002:0 0 4 = 08faf00f
ffff0001197b9d80 1216004312 S Co:6:002:0 s 40 05 08ac 0000 0004 4 = 08faf00f
ffff0001197b9d80 1216004343 C Co:6:002:0 0 4 >
ffff0001197b9d80 1216004379 S Ci:6:002:0 s c0 05 08c4 0000 0004 4 <
ffff0001197b9d80 1216004427 C Ci:6:002:0 0 4 = 00000000
ffff0001197b9d80 1216004461 S Co:6:002:0 s 40 05 08c4 0000 0004 4 = 00000000
ffff0001197b9d80 1216004496 C Co:6:002:0 0 4 >
ffff0001197b9d80 1216004530 S Ci:6:002:0 s c0 05 0c00 0000 0004 4 <
ffff0001197b9d80 1216004566 C Ci:6:002:0 0 4 = 07000000
ffff0001197b9d80 1216004600 S Ci:6:002:0 s c0 05 08b0 0000 0004 4 <
ffff0001197b9d80 1216004637 C Ci:6:002:0 0 4 = 18060000
ffff0001197b9d80 1216004671 S Co:6:002:0 s 40 05 08b0 0000 0004 4 = 18060000
ffff0001197b9d80 1216004702 C Co:6:002:0 0 4 >
ffff0001197b9d80 1216004757 S Ci:6:002:0 s c0 05 0d04 0000 0004 4 <
ffff0001197b9d80 1216004804 C Ci:6:002:0 0 4 = 887d93b1
ffff0001197b9d80 1216004839 S Co:6:002:0 s 40 05 0c90 0000 0004 4 = 887d8301
ffff0001197b9d80 1216004871 C Co:6:002:0 0 4 >
ffff0001197b9d80 1216004918 S Ci:6:002:0 s c0 05 0e00 0000 0004 4 <
ffff0001197b9d80 1216004966 C Ci:6:002:0 0 4 = 07000000
ffff0001197b9d80 1216005000 S Ci:6:002:0 s c0 05 08b0 0000 0004 4 <
ffff0001197b9d80 1216005036 C Ci:6:002:0 0 4 = 18060000
ffff0001197b9d80 1216005071 S Co:6:002:0 s 40 05 08b0 0000 0004 4 = 18060000
ffff0001197b9d80 1216005119 C Co:6:002:0 0 4 >
ffff0001197b9d80 1216005174 S Ci:6:002:0 s c0 05 0d44 0000 0004 4 <
ffff0001197b9d80 1216005221 C Ci:6:002:0 0 4 = 887d93b1
ffff0001197b9d80 1216005255 S Co:6:002:0 s 40 05 0e90 0000 0004 4 = 887d8301
ffff0001197b9d80 1216005286 C Co:6:002:0 0 4 >
ffff0001197b9d80 1216005335 S Ci:6:002:0 s c0 05 0073 0000 0001 1 <
ffff0001197b9d80 1216005384 C Ci:6:002:0 0 1 = 07
ffff0001197b9d80 1216005418 S Co:6:002:0 s 40 05 0073 0000 0001 1 = 07
ffff0001197b9d80 1216005449 C Co:6:002:0 0 1 >
ffff0001197b9d80 1216005509 S Ci:6:002:0 s c0 05 0c24 0000 0004 4 <
ffff0001197b9d80 1216005558 C Ci:6:002:0 0 4 = 20202020
ffff0001197b9d80 1216005592 S Co:6:002:0 s 40 05 0c24 0000 0004 4 = 2c2c2c2c
ffff0001197b9d80 1216005624 C Co:6:002:0 0 4 >
ffff0001197b9d80 1216005657 S Ci:6:002:0 s c0 05 0c28 0000 0004 4 <
ffff0001197b9d80 1216005693 C Ci:6:002:0 0 4 = 20201e1c
ffff0001197b9d80 1216005727 S Co:6:002:0 s 40 05 0c28 0000 0004 4 = 2c2c2c2a
ffff0001197b9d80 1216005758 C Co:6:002:0 0 4 >
ffff0001197b9d80 1216005792 S Ci:6:002:0 s c0 05 0c2c 0000 0004 4 <
ffff0001197b9d80 1216005830 C Ci:6:002:0 0 4 = 20202020
ffff0001197b9d80 1216005864 S Co:6:002:0 s 40 05 0c2c 0000 0004 4 = 31313131
ffff0001197b9d80 1216005895 C Co:6:002:0 0 4 >
ffff0001197b9d80 1216005930 S Ci:6:002:0 s c0 05 0c30 0000 0004 4 <
ffff0001197b9d80 1216005967 C Ci:6:002:0 0 4 = 20201e1c
ffff0001197b9d80 1216006002 S Co:6:002:0 s 40 05 0c30 0000 0004 4 = 312f2d2b
ffff0001197b9d80 1216006034 C Co:6:002:0 0 4 >
ffff0001197b9d80 1216006068 S Ci:6:002:0 s c0 05 0c34 0000 0004 4 <
ffff0001197b9d80 1216006122 C Ci:6:002:0 0 4 = 20202020
ffff0001197b9d80 1216006156 S Co:6:002:0 s 40 05 0c34 0000 0004 4 = 2d2d2d2d
ffff0001197b9d80 1216006188 C Co:6:002:0 0 4 >
ffff0001197b9d80 1216006222 S Ci:6:002:0 s c0 05 0c38 0000 0004 4 <
ffff0001197b9d80 1216006259 C Ci:6:002:0 0 4 = 201e1c1a
ffff0001197b9d80 1216006294 S Co:6:002:0 s 40 05 0c38 0000 0004 4 = 2d2d2b29
ffff0001197b9d80 1216006326 C Co:6:002:0 0 4 >
ffff0001197b9d80 1216006360 S Ci:6:002:0 s c0 05 0c3c 0000 0004 4 <
ffff0001197b9d80 1216006397 C Ci:6:002:0 0 4 = 20202020
ffff0001197b9d80 1216006432 S Co:6:002:0 s 40 05 0c3c 0000 0004 4 = 31313131
ffff0001197b9d80 1216006463 C Co:6:002:0 0 4 >
ffff0001197b9d80 1216006497 S Ci:6:002:0 s c0 05 0c40 0000 0004 4 <
ffff0001197b9d80 1216006534 C Ci:6:002:0 0 4 = 20201e1c
ffff0001197b9d80 1216006569 S Co:6:002:0 s 40 05 0c40 0000 0004 4 = 312f2d2b
ffff0001197b9d80 1216006617 C Co:6:002:0 0 4 >
ffff0001197b9d80 1216006651 S Ci:6:002:0 s c0 05 0c44 0000 0004 4 <
ffff0001197b9d80 1216006688 C Ci:6:002:0 0 4 = 1a181e1e
ffff0001197b9d80 1216006723 S Co:6:002:0 s 40 05 0c44 0000 0004 4 = 29292d2d
ffff0001197b9d80 1216006754 C Co:6:002:0 0 4 >
ffff0001197b9d80 1216006788 S Ci:6:002:0 s c0 05 0c48 0000 0004 4 <
ffff0001197b9d80 1216006826 C Ci:6:002:0 0 4 = 1e1e1e1e
ffff0001197b9d80 1216006861 S Co:6:002:0 s 40 05 0c48 0000 0004 4 = 2d2d2d2d
ffff0001197b9d80 1216006892 C Co:6:002:0 0 4 >
ffff0001197b9d80 1216006926 S Ci:6:002:0 s c0 05 0c4c 0000 0004 4 <
ffff0001197b9d80 1216006962 C Ci:6:002:0 0 4 = 1c1a1816
ffff0001197b9d80 1216006996 S Co:6:002:0 s 40 05 0c4c 0000 0004 4 = 2b292727
ffff0001197b9d80 1216007028 C Co:6:002:0 0 4 >
ffff0001197b9d80 1216007061 S Ci:6:002:0 s c0 05 0c54 0000 0004 4 <
ffff0001197b9d80 1216007117 C Ci:6:002:0 0 4 = 120a0400
ffff0001197b9d80 1216007152 S Co:6:002:0 s 40 05 0c54 0000 0004 4 = 21191300
ffff0001197b9d80 1216007184 C Co:6:002:0 0 4 >
ffff0001197b9d80 1216007219 S Ci:6:002:0 s c0 05 0e24 0000 0004 4 <
ffff0001197b9d80 1216007256 C Ci:6:002:0 0 4 = 1d1d1d1d
ffff0001197b9d80 1216007290 S Co:6:002:0 s 40 05 0e24 0000 0004 4 = 19191919
ffff0001197b9d80 1216007321 C Co:6:002:0 0 4 >
ffff0001197b9d80 1216007355 S Ci:6:002:0 s c0 05 0e28 0000 0004 4 <
ffff0001197b9d80 1216007393 C Ci:6:002:0 0 4 = 1d1d1b19
ffff0001197b9d80 1216007427 S Co:6:002:0 s 40 05 0e28 0000 0004 4 = 19191917
ffff0001197b9d80 1216007458 C Co:6:002:0 0 4 >
ffff0001197b9d80 1216007493 S Ci:6:002:0 s c0 05 0e2c 0000 0004 4 <
ffff0001197b9d80 1216007530 C Ci:6:002:0 0 4 = 1f1f1f1f
ffff0001197b9d80 1216007564 S Co:6:002:0 s 40 05 0e2c 0000 0004 4 = 1e1e1e1e
ffff0001197b9d80 1216007613 C Co:6:002:0 0 4 >
ffff0001197b9d80 1216007648 S Ci:6:002:0 s c0 05 0e30 0000 0004 4 <
ffff0001197b9d80 1216007685 C Ci:6:002:0 0 4 = 1f1f1d1b
ffff0001197b9d80 1216007719 S Co:6:002:0 s 40 05 0e30 0000 0004 4 = 1e1c1a18
ffff0001197b9d80 1216007751 C Co:6:002:0 0 4 >
ffff0001197b9d80 1216007785 S Ci:6:002:0 s c0 05 0e34 0000 0004 4 <
ffff0001197b9d80 1216007823 C Ci:6:002:0 0 4 = 1f1f1f1f
ffff0001197b9d80 1216007858 S Co:6:002:0 s 40 05 0e34 0000 0004 4 = 1a1a1a1a
ffff0001197b9d80 1216007889 C Co:6:002:0 0 4 >
ffff0001197b9d80 1216007924 S Ci:6:002:0 s c0 05 0e38 0000 0004 4 <
ffff0001197b9d80 1216007962 C Ci:6:002:0 0 4 = 1f1d1b19
ffff0001197b9d80 1216007996 S Co:6:002:0 s 40 05 0e38 0000 0004 4 = 1a1a1816
ffff0001197b9d80 1216008041 C Co:6:002:0 0 4 >
ffff0001197b9d80 1216008078 S Ci:6:002:0 s c0 05 0e3c 0000 0004 4 <
ffff0001197b9d80 1216008125 C Ci:6:002:0 0 4 = 1f1f1f1f
ffff0001197b9d80 1216008161 S Co:6:002:0 s 40 05 0e3c 0000 0004 4 = 1e1e1e1e
ffff0001197b9d80 1216008192 C Co:6:002:0 0 4 >
ffff0001197b9d80 1216008227 S Ci:6:002:0 s c0 05 0e40 0000 0004 4 <
ffff0001197b9d80 1216008265 C Ci:6:002:0 0 4 = 1f1f1d1b
ffff0001197b9d80 1216008299 S Co:6:002:0 s 40 05 0e40 0000 0004 4 = 1e1c1a18
ffff0001197b9d80 1216008331 C Co:6:002:0 0 4 >
ffff0001197b9d80 1216008365 S Ci:6:002:0 s c0 05 0e44 0000 0004 4 <
ffff0001197b9d80 1216008403 C Ci:6:002:0 0 4 = 19171d1d
ffff0001197b9d80 1216008438 S Co:6:002:0 s 40 05 0e44 0000 0004 4 = 16161a1a
ffff0001197b9d80 1216008470 C Co:6:002:0 0 4 >
ffff0001197b9d80 1216008504 S Ci:6:002:0 s c0 05 0e48 0000 0004 4 <
ffff0001197b9d80 1216008542 C Ci:6:002:0 0 4 = 1d1d1d1d
ffff0001197b9d80 1216008577 S Co:6:002:0 s 40 05 0e48 0000 0004 4 = 1a1a1a1a
ffff0001197b9d80 1216008621 C Co:6:002:0 0 4 >
ffff0001197b9d80 1216008656 S Ci:6:002:0 s c0 05 0e4c 0000 0004 4 <
ffff0001197b9d80 1216008695 C Ci:6:002:0 0 4 = 1b191715
ffff0001197b9d80 1216008730 S Co:6:002:0 s 40 05 0e4c 0000 0004 4 = 18161414
ffff0001197b9d80 1216008762 C Co:6:002:0 0 4 >
ffff0001197b9d80 1216008796 S Ci:6:002:0 s c0 05 0e54 0000 0004 4 <
ffff0001197b9d80 1216008834 C Ci:6:002:0 0 4 = 11090300
ffff0001197b9d80 1216008869 S Co:6:002:0 s 40 05 0e54 0000 0004 4 = 0e060200
ffff0001197b9d80 1216008901 C Co:6:002:0 0 4 >
ffff00013d9fb000 1216764264 S Ci:6:002:0 s c0 05 004c 0000 0001 1 <
ffff00013d9fb000 1216764359 C Ci:6:002:0 0 1 = 20
ffff00013d9fb000 1216764505 S Co:6:002:0 s 40 05 004c 0000 0001 1 = 20
ffff00013d9fb000 1216764626 C Co:6:002:0 0 1 >
ffff00013d9fb000 1216764808 S Ci:6:002:0 s c0 05 0770 0000 0004 4 <
ffff00013d9fb000 1216764953 C Ci:6:002:0 0 4 = 00000000
ffff00013d9fb000 1216765114 S Ci:6:002:0 s c0 05 0774 0000 0004 4 <
ffff00013d9fb000 1216765259 C Ci:6:002:0 0 4 = 00000000
ffff00013d9fb000 1216765421 S Co:6:002:0 s 40 05 076e 0000 0001 1 = 0c
ffff00013d9fb000 1216765561 C Co:6:002:0 0 1 >
ffff00013d9fb000 1216765730 S Ci:6:002:0 s c0 05 0808 0000 0004 4 <
ffff00013d9fb000 1216765876 C Ci:6:002:0 0 4 = 3382023e
ffff00013d9fb000 1216766022 S Ci:6:002:0 s c0 05 0a5c 0000 0002 2 <
ffff00013d9fb000 1216766142 C Ci:6:002:0 0 2 = 4400
ffff00013d9fb000 1216766178 S Ci:6:002:0 s c0 05 0f48 0000 0002 2 <
ffff00013d9fb000 1216766304 C Ci:6:002:0 0 2 = 3501
ffff00013d9fb000 1216766334 S Ci:6:002:0 s c0 05 0f04 0000 0004 4 <
ffff00013d9fb000 1216766445 C Ci:6:002:0 0 4 = 06000500
ffff00013d9fb000 1216766475 S Ci:6:002:0 s c0 05 0f14 0000 0004 4 <
ffff00013d9fb000 1216766586 C Ci:6:002:0 0 4 = 5c001a00
ffff00013d9fb000 1216766615 S Ci:6:002:0 s c0 05 0f10 0000 0004 4 <
ffff00013d9fb000 1216766733 C Ci:6:002:0 0 4 = 00000000
ffff00013d9fb000 1216766756 S Ci:6:002:0 s c0 05 0f0c 0000 0004 4 <
ffff00013d9fb000 1216766866 C Ci:6:002:0 0 4 = 00000000
ffff00013d9fb000 1216766894 S Ci:6:002:0 s c0 05 0f08 0000 0004 4 <
ffff00013d9fb000 1216767008 C Ci:6:002:0 0 4 = 6b00ab01
ffff00013d9fb000 1216767028 S Ci:6:002:0 s c0 05 0fcc 0000 0004 4 <
ffff00013d9fb000 1216767141 C Ci:6:002:0 0 4 = 00000000
ffff00013d9fb000 1216767169 S Ci:6:002:0 s c0 05 09a4 0000 0004 4 <
ffff00013d9fb000 1216767288 C Ci:6:002:0 0 4 = 80000800
ffff00013d9fb000 1216767310 S Co:6:002:0 s 40 05 09a4 0000 0004 4 = 80000a00
ffff00013d9fb000 1216767426 C Co:6:002:0 0 4 >
ffff00013d9fb000 1216767455 S Ci:6:002:0 s c0 05 09a4 0000 0004 4 <
ffff00013d9fb000 1216767568 C Ci:6:002:0 0 4 = 80000a00
ffff00013d9fb000 1216767596 S Co:6:002:0 s 40 05 09a4 0000 0004 4 = 80000800
ffff00013d9fb000 1216767710 C Co:6:002:0 0 4 >
ffff00013d9fb000 1216767732 S Ci:6:002:0 s c0 05 0a2c 0000 0004 4 <
ffff00013d9fb000 1216767843 C Ci:6:002:0 0 4 = 00809000
ffff00013d9fb000 1216767874 S Co:6:002:0 s 40 05 0a2c 0000 0004 4 = 00009000
ffff00013d9fb000 1216767982 C Co:6:002:0 0 4 >
ffff00013d9fb000 1216768016 S Ci:6:002:0 s c0 05 0a2c 0000 0004 4 <
ffff00013d9fb000 1216768060 C Ci:6:002:0 0 4 = 00009000
ffff00013d9fb000 1216768085 S Co:6:002:0 s 40 05 0a2c 0000 0004 4 = 00809000
ffff00013d9fb000 1216768120 C Co:6:002:0 0 4 >
ffff00013d9fb000 1216768142 S Ci:6:002:0 s c0 05 0b58 0000 0004 4 <
ffff00013d9fb000 1216768176 C Ci:6:002:0 0 4 = 00000000
ffff00013d9fb000 1216768295 S Co:6:002:0 s 40 05 0b58 0000 0004 4 = 01000000
ffff00013d9fb000 1216768334 C Co:6:002:0 0 4 >
ffff00013d9fb000 1216768464 S Ci:6:002:0 s c0 05 0b58 0000 0004 4 <
ffff00013d9fb000 1216768507 C Ci:6:002:0 0 4 = 01000000
ffff00013d9fb000 1216768630 S Co:6:002:0 s 40 05 0b58 0000 0004 4 = 00000000
ffff00013d9fb000 1216768664 C Co:6:002:0 0 4 >
ffff00013d9fb000 1216768681 S Ci:6:002:0 s c0 05 01cc 0000 0001 1 <
ffff00013d9fb000 1216768809 C Ci:6:002:0 0 1 = 00
ffff00013d9fb000 1216768841 S Co:6:002:0 s 40 05 01f8 0000 0004 4 = 00000000
ffff00013d9fb000 1216768952 C Co:6:002:0 0 4 >
ffff00013d9fb000 1216768973 S Co:6:002:0 s 40 05 01d8 0000 0004 4 = 58000000
ffff00013d9fb000 1216769081 C Co:6:002:0 0 4 >
ffff00013d9fb000 1216769111 S Co:6:002:0 s 40 05 0440 0000 0004 4 = 00000000
ffff00013d9fb000 1216769223 C Co:6:002:0 0 4 >
ffff00013d9fb000 1216769245 S Ci:6:002:0 s c0 05 0c00 0000 0004 4 <
ffff00013d9fb000 1216769356 C Ci:6:002:0 0 4 = 07000000
ffff00013d9fb000 1216769490 S Ci:6:002:0 s c0 05 08b0 0000 0004 4 <
ffff00013d9fb000 1216769610 C Ci:6:002:0 0 4 = 18060000
ffff00013d9fb000 1216769749 S Co:6:002:0 s 40 05 08b0 0000 0004 4 = 42060000
ffff00013d9fb000 1216769784 C Co:6:002:0 0 4 >
ffff00013d9fb000 1216769824 S Ci:6:002:0 s c0 05 0d04 0000 0004 4 <
ffff00013d9fb000 1216769869 C Ci:6:002:0 0 4 = 088d90b1
ffff00013d9fb000 1216769887 S Co:6:002:0 s 40 05 0c90 0000 0004 4 = 088d2304
ffff00013d9fb000 1216769916 C Co:6:002:0 0 4 >
ffff00013d9fb000 1216769946 S Co:6:002:0 s 40 05 0280 0000 0002 2 = 0001
ffff00013d9fb000 1216769986 C Co:6:002:0 0 2 >
ffff00013d9fb000 1216770103 S Ci:6:002:0 s c0 05 010c 0000 0001 1 <
ffff00013d9fb000 1216770148 C Ci:6:002:0 0 1 = b4
ffff00013d9fb000 1216770272 S Co:6:002:0 s 40 05 010c 0000 0001 1 = b4
ffff00013d9fb000 1216770305 C Co:6:002:0 0 1 >
ffff00013d9fb000 1217756176 S Ci:6:002:0 s c0 05 004c 0000 0001 1 <
ffff00013d9fb000 1217756331 C Ci:6:002:0 0 1 = 20
ffff00013d9fb000 1217756494 S Co:6:002:0 s 40 05 004c 0000 0001 1 = 20
ffff00013d9fb000 1217756634 C Co:6:002:0 0 1 >
ffff00013d9fb000 1218748286 S Ci:6:002:0 s c0 05 004c 0000 0001 1 <
ffff00013d9fb000 1218748378 C Ci:6:002:0 0 1 = 20
ffff00013d9fb000 1218748525 S Co:6:002:0 s 40 05 004c 0000 0001 1 = 20
ffff00013d9fb000 1218748667 C Co:6:002:0 0 1 >
ffff00013d9fb000 1218748838 S Ci:6:002:0 s c0 05 0770 0000 0004 4 <
ffff00013d9fb000 1218748983 C Ci:6:002:0 0 4 = 00000000
ffff00013d9fb000 1218749138 S Ci:6:002:0 s c0 05 0774 0000 0004 4 <
ffff00013d9fb000 1218749284 C Ci:6:002:0 0 4 = 00000000
ffff00013d9fb000 1218749439 S Co:6:002:0 s 40 05 076e 0000 0001 1 = 0c
ffff00013d9fb000 1218749577 C Co:6:002:0 0 1 >
ffff00013d9fb000 1218749738 S Ci:6:002:0 s c0 05 0808 0000 0004 4 <
ffff00013d9fb000 1218749886 C Ci:6:002:0 0 4 = 3382023e
ffff00013d9fb000 1218750041 S Ci:6:002:0 s c0 05 0a5c 0000 0002 2 <
ffff00013d9fb000 1218750167 C Ci:6:002:0 0 2 = 0000
ffff00013d9fb000 1218750194 S Ci:6:002:0 s c0 05 0f48 0000 0002 2 <
ffff00013d9fb000 1218750313 C Ci:6:002:0 0 2 = 0602
ffff00013d9fb000 1218750343 S Ci:6:002:0 s c0 05 0f04 0000 0004 4 <
ffff00013d9fb000 1218750455 C Ci:6:002:0 0 4 = 00000000
ffff00013d9fb000 1218750484 S Ci:6:002:0 s c0 05 0f14 0000 0004 4 <
ffff00013d9fb000 1218750597 C Ci:6:002:0 0 4 = 06002400
ffff00013d9fb000 1218750625 S Ci:6:002:0 s c0 05 0f10 0000 0004 4 <
ffff00013d9fb000 1218750738 C Ci:6:002:0 0 4 = 00000000
ffff00013d9fb000 1218750769 S Ci:6:002:0 s c0 05 0f0c 0000 0004 4 <
ffff00013d9fb000 1218750880 C Ci:6:002:0 0 4 = 00000000
ffff00013d9fb000 1218750909 S Ci:6:002:0 s c0 05 0f08 0000 0004 4 <
ffff00013d9fb000 1218751033 C Ci:6:002:0 0 4 = 00003002
ffff00013d9fb000 1218751053 S Ci:6:002:0 s c0 05 0fcc 0000 0004 4 <
ffff00013d9fb000 1218751166 C Ci:6:002:0 0 4 = 00000000
ffff00013d9fb000 1218751194 S Ci:6:002:0 s c0 05 09a4 0000 0004 4 <
ffff00013d9fb000 1218751314 C Ci:6:002:0 0 4 = 80000800
ffff00013d9fb000 1218751336 S Co:6:002:0 s 40 05 09a4 0000 0004 4 = 80000a00
ffff00013d9fb000 1218751443 C Co:6:002:0 0 4 >
ffff00013d9fb000 1218751471 S Ci:6:002:0 s c0 05 09a4 0000 0004 4 <
ffff00013d9fb000 1218751591 C Ci:6:002:0 0 4 = 80000a00
ffff00013d9fb000 1218751612 S Co:6:002:0 s 40 05 09a4 0000 0004 4 = 80000800
ffff00013d9fb000 1218751720 C Co:6:002:0 0 4 >
ffff00013d9fb000 1218751749 S Ci:6:002:0 s c0 05 0a2c 0000 0004 4 <
ffff00013d9fb000 1218751867 C Ci:6:002:0 0 4 = 00809000
ffff00013d9fb000 1218751888 S Co:6:002:0 s 40 05 0a2c 0000 0004 4 = 00009000
ffff00013d9fb000 1218751996 C Co:6:002:0 0 4 >
ffff00013d9fb000 1218752042 S Ci:6:002:0 s c0 05 0a2c 0000 0004 4 <
ffff00013d9fb000 1218752179 C Ci:6:002:0 0 4 = 00009000
ffff00013d9fb000 1218752207 S Co:6:002:0 s 40 05 0a2c 0000 0004 4 = 00809000
ffff00013d9fb000 1218752244 C Co:6:002:0 0 4 >
ffff00013d9fb000 1218752363 S Ci:6:002:0 s c0 05 0b58 0000 0004 4 <
ffff00013d9fb000 1218752493 C Ci:6:002:0 0 4 = 00000000
ffff00013d9fb000 1218752634 S Co:6:002:0 s 40 05 0b58 0000 0004 4 = 01000000
ffff00013d9fb000 1218752751 C Co:6:002:0 0 4 >
ffff00013d9fb000 1218752898 S Ci:6:002:0 s c0 05 0b58 0000 0004 4 <
ffff00013d9fb000 1218753051 C Ci:6:002:0 0 4 = 01000000
ffff00013d9fb000 1218753209 S Co:6:002:0 s 40 05 0b58 0000 0004 4 = 00000000
ffff00013d9fb000 1218753349 C Co:6:002:0 0 4 >
ffff00013d9fb000 1218753512 S Ci:6:002:0 s c0 05 01cc 0000 0001 1 <
ffff00013d9fb000 1218753659 C Ci:6:002:0 0 1 = 00
ffff00013d9fb000 1218753802 S Co:6:002:0 s 40 05 01fc 0000 0004 4 = 00000000
ffff00013d9fb000 1218753915 C Co:6:002:0 0 4 >
ffff00013d9fb000 1218753952 S Co:6:002:0 s 40 05 01dc 0000 0004 4 = 58000000
ffff00013d9fb000 1218754057 C Co:6:002:0 0 4 >
ffff00013d9fb000 1218754088 S Co:6:002:0 s 40 05 0440 0000 0004 4 = 00000000
ffff00013d9fb000 1218754194 C Co:6:002:0 0 4 >
ffff00013d9fb000 1218754225 S Ci:6:002:0 s c0 05 0c00 0000 0004 4 <
ffff00013d9fb000 1218754338 C Ci:6:002:0 0 4 = 07000000
ffff00013d9fb000 1218754367 S Ci:6:002:0 s c0 05 08b0 0000 0004 4 <
ffff00013d9fb000 1218754486 C Ci:6:002:0 0 4 = 42060000
ffff00013d9fb000 1218754509 S Co:6:002:0 s 40 05 08b0 0000 0004 4 = 42060000
ffff00013d9fb000 1218754618 C Co:6:002:0 0 4 >
ffff00013d9fb000 1218754668 S Ci:6:002:0 s c0 05 0d04 0000 0004 4 <
ffff00013d9fb000 1218754790 C Ci:6:002:0 0 4 = 088d90b1
ffff00013d9fb000 1218754820 S Ci:6:002:0 s c0 05 0c1c 0000 0004 4 <
ffff00013d9fb000 1218754939 C Ci:6:002:0 0 4 = 0300402d
ffff00013d9fb000 1218754960 S Co:6:002:0 s 40 05 0c1c 0000 0004 4 = 03000039
ffff00013d9fb000 1218755067 C Co:6:002:0 0 4 >
ffff00013d9fb000 1218755096 S Ci:6:002:0 s c0 05 0e1c 0000 0004 4 <
ffff00013d9fb000 1218755215 C Ci:6:002:0 0 4 = 0300402d
ffff00013d9fb000 1218755238 S Co:6:002:0 s 40 05 0e1c 0000 0004 4 = 0300e032
ffff00013d9fb000 1218755345 C Co:6:002:0 0 4 >
ffff00013d9fb000 1218755375 S Co:6:002:0 s 40 05 0280 0000 0002 2 = 0001
ffff00013d9fb000 1218755482 C Co:6:002:0 0 2 >
ffff00013d9fb000 1218755513 S Ci:6:002:0 s c0 05 010c 0000 0001 1 <
ffff00013d9fb000 1218755625 C Ci:6:002:0 0 1 = b4
ffff00013d9fb000 1218755655 S Co:6:002:0 s 40 05 010c 0000 0001 1 = b4
ffff00013d9fb000 1218755762 C Co:6:002:0 0 1 >
