ffff000103533900 1189372817 C Bi:6:002:1 0 383 = 47010484 00000f80 630b6000 04300000 00000000 7bec9e01 463a0000 88f2f201
ffff000103533900 1189372888 S Bi:6:002:1 -115 32768 <
ffff000103558cc0 1189373747 C Bi:6:002:1 0 376 = 40010484 00000f80 d0026000 04300000 00000000 4ff09e01 463a0000 87fdfd01
ffff000103558cc0 1189373774 S Bi:6:002:1 -115 32768 <
ffff00014c2bf900 1189374655 C Bi:6:002:1 0 351 = 27010484 00000f80 900c6000 04300000 00000000 edf39e01 463c0000 86ebeb01
ffff00014c2bf900 1189374678 S Bi:6:002:1 -115 32768 <
ffff00013d62e840 1189376578 C Bi:6:002:1 0 384 = 48010484 00000f80 330a6000 04300000 00000000 4dfb9e01 463c0000 87f0f001
ffff00013d62e840 1189376603 S Bi:6:002:1 -115 32768 <
ffff000103533900 1189475469 C Bi:6:002:1 0 383 = 47010484 00000f80 640b6000 04300000 00000000 ad7da001 463c0000 8af1f101
ffff000103533900 1189475515 S Bi:6:002:1 -115 32768 <
ffff000103558cc0 1189476730 C Bi:6:002:1 0 376 = 40010484 00000f80 d1026000 04300000 00000000 9282a001 483c0000 89efef01
ffff000103558cc0 1189476755 S Bi:6:002:1 -115 32768 <
ffff00014c2bf900 1189477526 C Bi:6:002:1 0 351 = 27010484 00000f80 910c6000 04300000 00000000 c785a001 463a0000 87f1f101
ffff00014c2bf900 1189477552 S Bi:6:002:1 -115 32768 <
ffff00013d62e840 1189478311 C Bi:6:002:1 0 374 = 3e010484 00000f80 64076000 04300000 00000000 c788a001 463c0000 8aefef01
ffff00013d62e840 1189478335 S Bi:6:002:1 -115 32768 <
ffff000103533900 1189577564 C Bi:6:002:1 0 383 = 47010484 00000f80 650b6000 04300000 00000000 7e0ca201 463a0000 87f7f701
ffff000103533900 1189577619 S Bi:6:002:1 -115 32768 <
ffff000103558cc0 1189578737 C Bi:6:002:1 0 376 = 40010484 00000f80 d2026000 04300000 00000000 0911a201 463c0000 88eaea01
ffff000103558cc0 1189578766 S Bi:6:002:1 -115 32768 <
ffff00014c2bf900 1189579652 C Bi:6:002:1 0 351 = 27010484 00000f80 920c6000 04300000 00000000 c314a201 463a0000 88f7f701
ffff00014c2bf900 1189579676 S Bi:6:002:1 -115 32768 <
ffff00013d62e840 1189580624 C Bi:6:002:1 0 374 = 3e010484 00000f80 65076000 04300000 00000000 6d18a201 463a0000 87fcfc01
ffff00013d62e840 1189580648 S Bi:6:002:1 -115 32768 <
ffff000103533900 1189581535 C Bi:6:002:1 0 384 = 48010484 00000f80 350a6000 04300000 00000000 f21ba201 44360000 89fdfd01
ffff000103533900 1189581560 S Bi:6:002:1 -115 32768 <
ffff000103558cc0 1189680240 C Bi:6:002:1 0 383 = 47010484 00000f80 660b6000 04300000 00000000 939da301 463a0000 8aefef01
ffff000103558cc0 1189680293 S Bi:6:002:1 -115 32768 <
ffff00014c2bf900 1189681185 C Bi:6:002:1 0 376 = 40010484 00000f80 d3026000 04300000 00000000 39a1a301 463c0000 84f2f201
ffff00014c2bf900 1189681214 S Bi:6:002:1 -115 32768 <
ffff00013d62e840 1189682102 C Bi:6:002:1 0 351 = 27010484 00000f80 930c6000 04300000 00000000 f3a4a301 463e0000 86f8f801
ffff00013d62e840 1189682127 S Bi:6:002:1 -115 32768 <
ffff000103533900 1189683066 C Bi:6:002:1 0 374 = 3e010484 00000f80 66076000 04300000 00000000 9da8a301 463a0000 89e9e901
ffff000103533900 1189683091 S Bi:6:002:1 -115 32768 <
ffff000103558cc0 1189683957 C Bi:6:002:1 0 384 = 48010484 00000f80 360a6000 04300000 00000000 06aca301 463a0000 86eded01
ffff000103558cc0 1189683981 S Bi:6:002:1 -115 32768 <
ffff00014c2bf900 1189782678 C Bi:6:002:1 0 383 = 47010484 00000f80 670b6000 04300000 00000000 be2da501 48380000 87f5f501
ffff00014c2bf900 1189782710 S Bi:6:002:1 -115 32768 <
ffff00013d62e840 1189783606 C Bi:6:002:1 0 376 = 40010484 00000f80 d4026000 04300000 00000000 6431a501 463c0000 87f7f701
ffff00013d62e840 1189783630 S Bi:6:002:1 -115 32768 <
ffff000103533900 1189784523 C Bi:6:002:1 0 351 = 27010484 00000f80 940c6000 04300000 00000000 1e35a501 463a0000 89f1f101
ffff000103533900 1189784553 S Bi:6:002:1 -115 32768 <
ffff000103558cc0 1189785535 C Bi:6:002:1 0 374 = 3e010484 00000f80 67076000 04300000 00000000 c838a501 46360000 8aebeb01
ffff000103558cc0 1189785563 S Bi:6:002:1 -115 32768 <
ffff00014c2bf900 1189786367 C Bi:6:002:1 0 384 = 48010484 00000f80 370a6000 04300000 00000000 153ca501 463c0000 8af2f201
ffff00014c2bf900 1189786391 S Bi:6:002:1 -115 32768 <
ffff000103533480 1189820289 S Ci:6:002:0 s c0 05 004c 0000 0001 1 <
ffff000103533480 1189820457 C Ci:6:002:0 0 1 = 20
ffff000103533480 1189820566 S Co:6:002:0 s 40 05 004c 0000 0001 1 = 20
ffff000103533480 1189820688 C Co:6:002:0 0 1 >
ffff00013d62e840 1189885065 C Bi:6:002:1 0 383 = 47010484 00000f80 680b6000 04300000 00000000 b3bda601 463a0000 87f0f001
ffff00013d62e840 1189885092 S Bi:6:002:1 -115 32768 <
ffff000103533900 1189886021 C Bi:6:002:1 0 376 = 40010484 00000f80 d5026000 04300000 00000000 58c1a601 483c0000 89fbfb01
ffff000103533900 1189886050 S Bi:6:002:1 -115 32768 <
ffff000103558cc0 1189886949 C Bi:6:002:1 0 351 = 27010484 00000f80 950c6000 04300000 00000000 23c5a601 463a0000 86fcfc01
ffff000103558cc0 1189886973 S Bi:6:002:1 -115 32768 <
ffff00014c2bf900 1189887912 C Bi:6:002:1 0 374 = 3e010484 00000f80 68076000 04300000 00000000 ccc8a601 42360000 88fbfb01
ffff00014c2bf900 1189887937 S Bi:6:002:1 -115 32768 <
ffff00013d62e840 1189888774 C Bi:6:002:1 0 384 = 48010484 00000f80 380a6000 04300000 00000000 1dcca601 46380000 88f7f701
ffff00013d62e840 1189888799 S Bi:6:002:1 -115 32768 <
ffff000103533900 1189969341 C Bi:6:002:1 0 290 = ea000484 00000f80 700f6000 00300000 00000000 4001a801 3a3a0000 36520001
ffff000103533900 1189969389 S Bi:6:002:1 -115 32768 <
ffff000103558cc0 1189973068 C Bi:6:002:1 0 377 = 41010484 00000f00 450d6000 04300000 00000000 7715a801 463c0000 88f3f301
ffff000103558cc0 1189973094 S Bi:6:002:1 -115 32768 <
ffff00014c2bf900 1189973719 C Bi:6:002:1 0 377 = 41010484 00000f00 450d6000 04300000 00000000 0918a801 463a0000 88f6f601
ffff00014c2bf900 1189973747 S Bi:6:002:1 -115 32768 <
ffff00013d62e840 1189974352 C Bi:6:002:1 0 377 = 41010484 00000f00 450d6000 04300000 00000000 6e1aa801 463c0000 88f2f201
ffff00013d62e840 1189974378 S Bi:6:002:1 -115 32768 <
ffff000103533900 1189974959 C Bi:6:002:1 0 377 = 41010484 00000f00 450d6000 04300000 00000000 d31ca801 463c0000 85f7f701
ffff000103533900 1189974982 S Bi:6:002:1 -115 32768 <
ffff000103558cc0 1189975578 C Bi:6:002:1 0 370 = 3a010484 00000f00 27066000 04300000 00000000 421fa801 463c0000 87fefe01
ffff000103558cc0 1189975602 S Bi:6:002:1 -115 32768 <
ffff00014c2bf900 1189976207 C Bi:6:002:1 0 370 = 3a010484 00000f00 27066000 04300000 00000000 b121a801 443a0000 89f3f301
ffff00014c2bf900 1189976231 S Bi:6:002:1 -115 32768 <
ffff00013d62e840 1189976804 C Bi:6:002:1 0 370 = 3a010484 00000f00 27066000 04300000 00000000 0e24a801 463c0000 89f2f201
ffff00013d62e840 1189976830 S Bi:6:002:1 -115 32768 <
ffff000103533900 1189977392 C Bi:6:002:1 0 370 = 3a010484 00000f00 27066000 04300000 00000000 6b26a801 463a0000 86e8e801
ffff000103533900 1189977413 S Bi:6:002:1 -115 32768 <
ffff000103558cc0 1189978281 C Bi:6:002:1 0 345 = 21010484 00000f00 d5086000 04300000 00000000 0c2aa801 443c0000 88f5f501
ffff000103558cc0 1189978300 S Bi:6:002:1 -115 32768 <
ffff00014c2bf900 1189989897 C Bi:6:002:1 0 383 = 47010484 00000f80 690b6000 04300000 00000000 3257a801 463a0000 87eeee01
ffff00014c2bf900 1189989917 S Bi:6:002:1 -115 32768 <
ffff00013d62e840 1189991341 C Bi:6:002:1 0 376 = 40010484 00000f80 d6026000 04300000 00000000 ca5ca801 463a0000 88ecec01
ffff00013d62e840 1189991370 S Bi:6:002:1 -115 32768 <
ffff000103533900 1189991897 C Bi:6:002:1 0 378 = 42010484 00000f00 7a0a6000 04300000 00000000 e75ea801 463e0000 86f7f701
ffff000103533900 1189991922 S Bi:6:002:1 -115 32768 <
ffff000103558cc0 1189992393 C Bi:6:002:1 0 351 = 27010484 00000f80 960c6000 04300000 00000000 0761a801 483a0000 89eded01
ffff000103558cc0 1189992419 S Bi:6:002:1 -115 32768 <
ffff00014c2bf900 1189996407 C Bi:6:002:1 0 374 = 3e010484 00000f80 69076000 04300000 00000000 9370a801 463e0000 8af7f701
ffff00014c2bf900 1189996431 S Bi:6:002:1 -115 32768 <
ffff00013d62e840 1189997217 C Bi:6:002:1 0 384 = 48010484 00000f80 390a6000 04300000 00000000 b773a801 463a0000 86f2f201
ffff00013d62e840 1189997244 S Bi:6:002:1 -115 32768 <
ffff000103533900 1190029491 C Bi:6:002:1 0 370 = 3a010484 00000f00 28066000 04300000 00000000 c5f1a801 463c0000 8c000001
ffff000103533900 1190029517 S Bi:6:002:1 -115 32768 <
ffff000103558cc0 1190032421 C Bi:6:002:1 0 370 = 3a010484 00000f00 28066000 04300000 00000000 61fda801 463a0000 87f6f601
ffff000103558cc0 1190032455 S Bi:6:002:1 -115 32768 <
ffff00014c2bf900 1190089568 C Bi:6:002:1 0 383 = 47010484 00000f80 6a0b6000 04300000 00000000 85dca901 463e0000 87f2f201
ffff00014c2bf900 1190089623 S Bi:6:002:1 -115 32768 <
ffff00013d62e840 1190092020 C Bi:6:002:1 0 376 = 40010484 00000f80 d7026000 04300000 00000000 09e6a901 463a0000 89f6f601
ffff00013d62e840 1190092046 S Bi:6:002:1 -115 32768 <
ffff000103533900 1190092902 C Bi:6:002:1 0 351 = 27010484 00000f80 970c6000 04300000 00000000 a8e9a901 44340000 84f1f101
ffff000103533900 1190092930 S Bi:6:002:1 -115 32768 <
ffff000103558cc0 1190093851 C Bi:6:002:1 0 374 = 3e010484 00000f80 6a076000 04300000 00000000 42eda901 46380000 87efef01
ffff000103558cc0 1190093875 S Bi:6:002:1 -115 32768 <
ffff00014c2bf900 1190191975 C Bi:6:002:1 0 383 = 47010484 00000f80 6b0b6000 04300000 00000000 876cab01 46380000 86fbfb01
ffff00014c2bf900 1190192026 S Bi:6:002:1 -115 32768 <
ffff00013d62e840 1190193170 C Bi:6:002:1 0 376 = 40010484 00000f80 d8026000 04300000 00000000 2c71ab01 463a0000 88efef01
ffff00013d62e840 1190193196 S Bi:6:002:1 -115 32768 <
ffff000103533900 1190194085 C Bi:6:002:1 0 351 = 27010484 00000f80 980c6000 04300000 00000000 e674ab01 463c0000 88f7f701
ffff000103533900 1190194111 S Bi:6:002:1 -115 32768 <
ffff000103558cc0 1190195048 C Bi:6:002:1 0 374 = 3e010484 00000f80 6b076000 04300000 00000000 9078ab01 463c0000 87f1f101
ffff000103558cc0 1190195072 S Bi:6:002:1 -115 32768 <
ffff00014c2bf900 1190195942 C Bi:6:002:1 0 384 = 48010484 00000f80 3b0a6000 04300000 00000000 fb7bab01 46380000 8aecec01
ffff00014c2bf900 1190195967 S Bi:6:002:1 -115 32768 <
ffff00013d62e840 1190212911 C Bi:6:002:1 0 345 = 21010484 00000f00 d6086000 04300000 00000000 88beab01 463a0000 85f9f901
ffff00013d62e840 1190212936 S Bi:6:002:1 -115 32768 <
ffff000103533900 1190218830 C Bi:6:002:1 0 345 = 21010484 00000f00 d7086000 04300000 00000000 93d5ab01 46380000 8bf6f601
ffff000103533900 1190218855 S Bi:6:002:1 -115 32768 <
ffff000103558cc0 1190294380 C Bi:6:002:1 0 383 = 47010484 00000f80 6c0b6000 04300000 00000000 88fcac01 463c0000 8aefef01
ffff000103558cc0 1190294406 S Bi:6:002:1 -115 32768 <
ffff00014c2bf900 1190295382 C Bi:6:002:1 0 376 = 40010484 00000f80 d9026000 04300000 00000000 d100ad01 42340000 8afcfc01
ffff00014c2bf900 1190295396 S Bi:6:002:1 -115 32768 <
ffff00013d62e840 1190296327 C Bi:6:002:1 0 351 = 27010484 00000f80 990c6000 04300000 00000000 8a04ad01 46380000 87f1f101
ffff00013d62e840 1190296347 S Bi:6:002:1 -115 32768 <
ffff000103533900 1190297282 C Bi:6:002:1 0 374 = 3e010484 00000f80 6c076000 04300000 00000000 3f08ad01 44380000 83f4f401
ffff000103533900 1190297301 S Bi:6:002:1 -115 32768 <
ffff000103558cc0 1190298172 C Bi:6:002:1 0 384 = 48010484 00000f80 3c0a6000 04300000 00000000 a80bad01 463a0000 86fbfb01
ffff000103558cc0 1190298202 S Bi:6:002:1 -115 32768 <
ffff000103150900 1190310736 S Ci:6:002:0 s c0 05 0454 0000 0001 1 <
ffff000103150900 1190310879 C Ci:6:002:0 0 1 = 00
ffff000103150900 1190310930 S Ci:6:002:0 s c0 05 0860 0000 0004 4 <
ffff000103150900 1190310970 C Ci:6:002:0 0 4 = 21c3d572
ffff000103150900 1190311027 S Co:6:002:0 s 40 05 0860 0000 0004 4 = 21c3d572
ffff000103150900 1190311070 C Co:6:002:0 0 4 >
ffff000103150900 1190311102 S Ci:6:002:0 s c0 05 0c00 0000 0004 4 <
ffff000103150900 1190311136 C Ci:6:002:0 0 4 = 07000000
ffff000103150900 1190311165 S Ci:6:002:0 s c0 05 08b0 0000 0004 4 <
ffff000103150900 1190311199 C Ci:6:002:0 0 4 = 42060000
ffff000103150900 1190311229 S Co:6:002:0 s 40 05 08b0 0000 0004 4 = 18060000
ffff000103150900 1190311259 C Co:6:002:0 0 4 >
ffff000103150900 1190311309 S Ci:6:002:0 s c0 05 0d04 0000 0004 4 <
ffff000103150900 1190311355 C Ci:6:002:0 0 4 = 017c90b1
ffff000103150900 1190311387 S Co:6:002:0 s 40 05 0c90 0000 0004 4 = 017c8001
ffff000103150900 1190311415 C Co:6:002:0 0 4 >
ffff000103150900 1190311457 S Ci:6:002:0 s c0 05 08ac 0000 0004 4 <
ffff000103150900 1190311504 C Ci:6:002:0 0 4 = 08faf00f
ffff000103150900 1190311533 S Co:6:002:0 s 40 05 08ac 0000 0004 4 = 08faf00f
ffff000103150900 1190311562 C Co:6:002:0 0 4 >
ffff000103150900 1190311607 S Ci:6:002:0 s c0 05 08ac 0000 0004 4 <
ffff000103150900 1190311657 C Ci:6:002:0 0 4 = 08faf00f
ffff000103150900 1190311688 S Co:6:002:0 s 40 05 08ac 0000 0004 4 = 08faf00f
ffff000103150900 1190311729 C Co:6:002:0 0 4 >
ffff000103150900 1190311757 S Ci:6:002:0 s c0 05 08c4 0000 0004 4 <
ffff000103150900 1190311791 C Ci:6:002:0 0 4 = 00000000
ffff000103150900 1190311819 S Co:6:002:0 s 40 05 08c4 0000 0004 4 = 00000000
ffff000103150900 1190311848 C Co:6:002:0 0 4 >
ffff000103150900 1190311877 S Ci:6:002:0 s c0 05 0c00 0000 0004 4 <
ffff000103150900 1190311915 C Ci:6:002:0 0 4 = 07000000
ffff000103150900 1190311944 S Ci:6:002:0 s c0 05 08b0 0000 0004 4 <
ffff000103150900 1190311980 C Ci:6:002:0 0 4 = 18060000
ffff000103150900 1190312047 S Co:6:002:0 s 40 05 08b0 0000 0004 4 = 18060000
ffff000103150900 1190312142 C Co:6:002:0 0 4 >
ffff000103150900 1190312199 S Ci:6:002:0 s c0 05 0d04 0000 0004 4 <
ffff000103150900 1190312256 C Ci:6:002:0 0 4 = 017c90b1
ffff000103150900 1190312290 S Co:6:002:0 s 40 05 0c90 0000 0004 4 = 017c8001
ffff000103150900 1190312321 C Co:6:002:0 0 4 >
ffff00013d29e600 1190312367 S Ci:6:002:0 s c0 05 0e00 0000 0004 4 <
ffff00013d29e600 1190312419 C Ci:6:002:0 0 4 = 07000000
ffff00013d29e600 1190312454 S Ci:6:002:0 s c0 05 08b0 0000 0004 4 <
ffff00013d29e600 1190312493 C Ci:6:002:0 0 4 = 18060000
ffff00013d29e600 1190312527 S Co:6:002:0 s 40 05 08b0 0000 0004 4 = 18060000
ffff00013d29e600 1190312558 C Co:6:002:0 0 4 >
ffff00013d29e600 1190312615 S Ci:6:002:0 s c0 05 0d44 0000 0004 4 <
ffff00013d29e600 1190312668 C Ci:6:002:0 0 4 = 017c90b1
ffff00013d29e600 1190312703 S Co:6:002:0 s 40 05 0e90 0000 0004 4 = 017c8001
ffff00013d29e600 1190312734 C Co:6:002:0 0 4 >
ffff00013d29e600 1190312782 S Ci:6:002:0 s c0 05 08ac 0000 0004 4 <
ffff00013d29e600 1190312832 C Ci:6:002:0 0 4 = 08faf00f
ffff00013d29e600 1190312866 S Co:6:002:0 s 40 05 08ac 0000 0004 4 = 08faf00f
ffff00013d29e600 1190312913 C Co:6:002:0 0 4 >
ffff00013d29e600 1190312947 S Ci:6:002:0 s c0 05 08ac 0000 0004 4 <
ffff00013d29e600 1190312985 C Ci:6:002:0 0 4 = 08faf00f
ffff00013d29e600 1190313020 S Co:6:002:0 s 40 05 08ac 0000 0004 4 = 08faf00f
ffff00013d29e600 1190313051 C Co:6:002:0 0 4 >
ffff00013d29e600 1190313086 S Ci:6:002:0 s c0 05 08c4 0000 0004 4 <
ffff00013d29e600 1190313125 C Ci:6:002:0 0 4 = 00000000
ffff00013d29e600 1190313160 S Co:6:002:0 s 40 05 08c4 0000 0004 4 = 00000000
ffff00013d29e600 1190313191 C Co:6:002:0 0 4 >
ffff00013d29e600 1190313226 S Ci:6:002:0 s c0 05 0e00 0000 0004 4 <
ffff00013d29e600 1190313265 C Ci:6:002:0 0 4 = 07000000
ffff00013d29e600 1190313300 S Ci:6:002:0 s c0 05 08b0 0000 0004 4 <
ffff00013d29e600 1190313336 C Ci:6:002:0 0 4 = 18060000
ffff00013d29e600 1190313370 S Co:6:002:0 s 40 05 08b0 0000 0004 4 = 18060000
ffff00013d29e600 1190313413 C Co:6:002:0 0 4 >
ffff00013d29e600 1190313468 S Ci:6:002:0 s c0 05 0d44 0000 0004 4 <
ffff00013d29e600 1190313515 C Ci:6:002:0 0 4 = 017c90b1
ffff00013d29e600 1190313549 S Co:6:002:0 s 40 05 0e90 0000 0004 4 = 017c8001
ffff00013d29e600 1190313582 C Co:6:002:0 0 4 >
ffff00013d29e600 1190313629 S Ci:6:002:0 s c0 05 0668 0000 0002 2 <
ffff00013d29e600 1190313676 C Ci:6:002:0 0 2 = 0010
ffff00013d29e600 1190313711 S Co:6:002:0 s 40 05 0668 0000 0002 2 = 0010
ffff00013d29e600 1190313741 C Co:6:002:0 0 2 >
ffff00013d29e600 1190313775 S Co:6:002:0 s 40 05 0483 0000 0001 1 = 00
ffff00013d29e600 1190313806 C Co:6:002:0 0 1 >
ffff00013d29e600 1190313839 S Ci:6:002:0 s c0 05 0837 0000 0001 1 <
ffff00013d29e600 1190313874 C Ci:6:002:0 0 1 = 00
ffff00013d29e600 1190313909 S Ci:6:002:0 s c0 05 08ac 0000 0004 4 <
ffff00013d29e600 1190313945 C Ci:6:002:0 0 4 = 08faf00f
ffff00013d29e600 1190313980 S Co:6:002:0 s 40 05 08ac 0000 0004 4 = 08faf00f
ffff00013d29e600 1190314010 C Co:6:002:0 0 4 >
ffff00013d29e600 1190314045 S Ci:6:002:0 s c0 05 08c4 0000 0004 4 <
ffff00013d29e600 1190314080 C Ci:6:002:0 0 4 = 00000000
ffff00013d29e600 1190314115 S Co:6:002:0 s 40 05 08c4 0000 0004 4 = 00000000
ffff00013d29e600 1190314163 C Co:6:002:0 0 4 >
ffff00013d29e600 1190314204 S Ci:6:002:0 s c0 05 0848 0000 0004 4 <
ffff00013d29e600 1190314243 C Ci:6:002:0 0 4 = 8bffd061
ffff00013d29e600 1190314278 S Co:6:002:0 s 40 05 0848 0000 0004 4 = 8bffd061
ffff00013d29e600 1190314310 C Co:6:002:0 0 4 >
ffff00013d29e600 1190314345 S Ci:6:002:0 s c0 05 08ac 0000 0004 4 <
ffff00013d29e600 1190314381 C Ci:6:002:0 0 4 = 08faf00f
ffff00013d29e600 1190314416 S Co:6:002:0 s 40 05 08ac 0000 0004 4 = 08faf00f
ffff00013d29e600 1190314447 C Co:6:002:0 0 4 >
ffff00013d29e600 1190314481 S Ci:6:002:0 s c0 05 08ac 0000 0004 4 <
ffff00013d29e600 1190314534 C Ci:6:002:0 0 4 = 08faf00f
ffff00013d29e600 1190314569 S Co:6:002:0 s 40 05 08ac 0000 0004 4 = 08faf00f
ffff00013d29e600 1190314600 C Co:6:002:0 0 4 >
ffff00013d29e600 1190314635 S Ci:6:002:0 s c0 05 08c4 0000 0004 4 <
ffff00013d29e600 1190314672 C Ci:6:002:0 0 4 = 00000000
ffff00013d29e600 1190314707 S Co:6:002:0 s 40 05 08c4 0000 0004 4 = 00000000
ffff00013d29e600 1190314739 C Co:6:002:0 0 4 >
ffff00013d29e600 1190314774 S Ci:6:002:0 s c0 05 0c00 0000 0004 4 <
ffff00013d29e600 1190314811 C Ci:6:002:0 0 4 = 07000000
ffff00013d29e600 1190314846 S Ci:6:002:0 s c0 05 08b0 0000 0004 4 <
ffff00013d29e600 1190314882 C Ci:6:002:0 0 4 = 18060000
ffff00013d29e600 1190314918 S Co:6:002:0 s 40 05 08b0 0000 0004 4 = 18060000
ffff00013d29e600 1190314950 C Co:6:002:0 0 4 >
ffff00013d29e600 1190315006 S Ci:6:002:0 s c0 05 0d04 0000 0004 4 <
ffff00013d29e600 1190315053 C Ci:6:002:0 0 4 = 017c90b1
ffff00013d29e600 1190315089 S Co:6:002:0 s 40 05 0c90 0000 0004 4 = 017c8001
ffff00013d29e600 1190315120 C Co:6:002:0 0 4 >
ffff00013d29e600 1190315168 S Ci:6:002:0 s c0 05 0e00 0000 0004 4 <
ffff00013d29e600 1190315216 C Ci:6:002:0 0 4 = 07000000
ffff00013d29e600 1190315250 S Ci:6:002:0 s c0 05 08b0 0000 0004 4 <
ffff00013d29e600 1190315291 C Ci:6:002:0 0 4 = 18060000
ffff00013d29e600 1190315325 S Co:6:002:0 s 40 05 08b0 0000 0004 4 = 18060000
ffff00013d29e600 1190315356 C Co:6:002:0 0 4 >
ffff00013d29e600 1190315410 S Ci:6:002:0 s c0 05 0d44 0000 0004 4 <
ffff00013d29e600 1190315456 C Ci:6:002:0 0 4 = 017c90b1
ffff00013d29e600 1190315491 S Co:6:002:0 s 40 05 0e90 0000 0004 4 = 017c8001
ffff00013d29e600 1190315538 C Co:6:002:0 0 4 >
ffff00013d29e600 1190315607 S Ci:6:002:0 s c0 05 0c20 0000 0004 4 <
ffff00013d29e600 1190315666 C Ci:6:002:0 0 4 = 13131313
ffff00013d29e600 1190315701 S Co:6:002:0 s 40 05 0c20 0000 0004 4 = 13131313
ffff00013d29e600 1190315732 C Co:6:002:0 0 4 >
ffff00013d29e600 1190315767 S Ci:6:002:0 s c0 05 0c24 0000 0004 4 <
ffff00013d29e600 1190315803 C Ci:6:002:0 0 4 = 20202020
ffff00013d29e600 1190315838 S Co:6:002:0 s 40 05 0c24 0000 0004 4 = 20202020
ffff00013d29e600 1190315869 C Co:6:002:0 0 4 >
ffff00013d29e600 1190315904 S Ci:6:002:0 s c0 05 0c28 0000 0004 4 <
ffff00013d29e600 1190315940 C Ci:6:002:0 0 4 = 20201e1c
ffff00013d29e600 1190315975 S Co:6:002:0 s 40 05 0c28 0000 0004 4 = 20201e1c
ffff00013d29e600 1190316018 C Co:6:002:0 0 4 >
ffff00013d29e600 1190316054 S Ci:6:002:0 s c0 05 0c2c 0000 0004 4 <
ffff00013d29e600 1190316095 C Ci:6:002:0 0 4 = 20202020
ffff00013d29e600 1190316131 S Co:6:002:0 s 40 05 0c2c 0000 0004 4 = 20202020
ffff00013d29e600 1190316163 C Co:6:002:0 0 4 >
ffff00013d29e600 1190316199 S Ci:6:002:0 s c0 05 0c30 0000 0004 4 <
ffff00013d29e600 1190316237 C Ci:6:002:0 0 4 = 20201e1c
ffff00013d29e600 1190316272 S Co:6:002:0 s 40 05 0c30 0000 0004 4 = 20201e1c
ffff00013d29e600 1190316304 C Co:6:002:0 0 4 >
ffff00013d29e600 1190316339 S Ci:6:002:0 s c0 05 0c34 0000 0004 4 <
ffff00013d29e600 1190316376 C Ci:6:002:0 0 4 = 20202020
ffff00013d29e600 1190316412 S Co:6:002:0 s 40 05 0c34 0000 0004 4 = 20202020
ffff00013d29e600 1190316444 C Co:6:002:0 0 4 >
ffff00013d29e600 1190316479 S Ci:6:002:0 s c0 05 0c38 0000 0004 4 <
ffff00013d29e600 1190316534 C Ci:6:002:0 0 4 = 201e1c1a
ffff00013d29e600 1190316569 S Co:6:002:0 s 40 05 0c38 0000 0004 4 = 201e1c1a
ffff00013d29e600 1190316601 C Co:6:002:0 0 4 >
ffff00013d29e600 1190316636 S Ci:6:002:0 s c0 05 0c3c 0000 0004 4 <
ffff00013d29e600 1190316673 C Ci:6:002:0 0 4 = 20202020
ffff00013d29e600 1190316711 S Co:6:002:0 s 40 05 0c3c 0000 0004 4 = 20202020
ffff00013d29e600 1190316742 C Co:6:002:0 0 4 >
ffff00013d29e600 1190316777 S Ci:6:002:0 s c0 05 0c40 0000 0004 4 <
ffff00013d29e600 1190316814 C Ci:6:002:0 0 4 = 20201e1c
ffff00013d29e600 1190316849 S Co:6:002:0 s 40 05 0c40 0000 0004 4 = 20201e1c
ffff00013d29e600 1190316882 C Co:6:002:0 0 4 >
ffff00013d29e600 1190316917 S Ci:6:002:0 s c0 05 0c44 0000 0004 4 <
ffff00013d29e600 1190316953 C Ci:6:002:0 0 4 = 1a181e1e
ffff00013d29e600 1190316989 S Co:6:002:0 s 40 05 0c44 0000 0004 4 = 1a181e1e
ffff00013d29e600 1190317038 C Co:6:002:0 0 4 >
ffff00013d29e600 1190317073 S Ci:6:002:0 s c0 05 0c48 0000 0004 4 <
ffff00013d29e600 1190317110 C Ci:6:002:0 0 4 = 1e1e1e1e
ffff00013d29e600 1190317146 S Co:6:002:0 s 40 05 0c48 0000 0004 4 = 1e1e1e1e
ffff00013d29e600 1190317178 C Co:6:002:0 0 4 >
ffff00013d29e600 1190317212 S Ci:6:002:0 s c0 05 0c4c 0000 0004 4 <
ffff00013d29e600 1190317249 C Ci:6:002:0 0 4 = 1c1a1816
ffff00013d29e600 1190317284 S Co:6:002:0 s 40 05 0c4c 0000 0004 4 = 1c1a1816
ffff00013d29e600 1190317315 C Co:6:002:0 0 4 >
ffff00013d29e600 1190317350 S Ci:6:002:0 s c0 05 0c54 0000 0004 4 <
ffff00013d29e600 1190317388 C Ci:6:002:0 0 4 = 120a0400
ffff00013d29e600 1190317423 S Co:6:002:0 s 40 05 0c54 0000 0004 4 = 120a0400
ffff00013d29e600 1190317455 C Co:6:002:0 0 4 >
ffff00013d29e600 1190317490 S Ci:6:002:0 s c0 05 0e20 0000 0004 4 <
ffff00013d29e600 1190317541 C Ci:6:002:0 0 4 = 14141414
ffff00013d29e600 1190317576 S Co:6:002:0 s 40 05 0e20 0000 0004 4 = 14141414
ffff00013d29e600 1190317607 C Co:6:002:0 0 4 >
ffff00013d29e600 1190317643 S Ci:6:002:0 s c0 05 0e24 0000 0004 4 <
ffff00013d29e600 1190317679 C Ci:6:002:0 0 4 = 1d1d1d1d
ffff00013d29e600 1190317715 S Co:6:002:0 s 40 05 0e24 0000 0004 4 = 1d1d1d1d
ffff00013d29e600 1190317745 C Co:6:002:0 0 4 >
ffff00013d29e600 1190317781 S Ci:6:002:0 s c0 05 0e28 0000 0004 4 <
ffff00013d29e600 1190317818 C Ci:6:002:0 0 4 = 1d1d1b19
ffff00013d29e600 1190317853 S Co:6:002:0 s 40 05 0e28 0000 0004 4 = 1d1d1b19
ffff00013d29e600 1190317884 C Co:6:002:0 0 4 >
ffff00013d29e600 1190317919 S Ci:6:002:0 s c0 05 0e2c 0000 0004 4 <
ffff00013d29e600 1190317957 C Ci:6:002:0 0 4 = 1f1f1f1f
ffff00013d29e600 1190317992 S Co:6:002:0 s 40 05 0e2c 0000 0004 4 = 1f1f1f1f
ffff00013d29e600 1190318038 C Co:6:002:0 0 4 >
ffff00013d29e600 1190318073 S Ci:6:002:0 s c0 05 0e30 0000 0004 4 <
ffff00013d29e600 1190318111 C Ci:6:002:0 0 4 = 1f1f1d1b
ffff00013d29e600 1190318146 S Co:6:002:0 s 40 05 0e30 0000 0004 4 = 1f1f1d1b
ffff00013d29e600 1190318177 C Co:6:002:0 0 4 >
ffff00013d29e600 1190318212 S Ci:6:002:0 s c0 05 0e34 0000 0004 4 <
ffff00013d29e600 1190318250 C Ci:6:002:0 0 4 = 1f1f1f1f
ffff00013d29e600 1190318285 S Co:6:002:0 s 40 05 0e34 0000 0004 4 = 1f1f1f1f
ffff00013d29e600 1190318317 C Co:6:002:0 0 4 >
ffff00013d29e600 1190318352 S Ci:6:002:0 s c0 05 0e38 0000 0004 4 <
ffff00013d29e600 1190318390 C Ci:6:002:0 0 4 = 1f1d1b19
ffff00013d29e600 1190318425 S Co:6:002:0 s 40 05 0e38 0000 0004 4 = 1f1d1b19
ffff00013d29e600 1190318457 C Co:6:002:0 0 4 >
ffff00013d29e600 1190318491 S Ci:6:002:0 s c0 05 0e3c 0000 0004 4 <
ffff00013d29e600 1190318542 C Ci:6:002:0 0 4 = 1f1f1f1f
ffff00013d29e600 1190318578 S Co:6:002:0 s 40 05 0e3c 0000 0004 4 = 1f1f1f1f
ffff00013d29e600 1190318609 C Co:6:002:0 0 4 >
ffff00013d29e600 1190318644 S Ci:6:002:0 s c0 05 0e40 0000 0004 4 <
ffff00013d29e600 1190318683 C Ci:6:002:0 0 4 = 1f1f1d1b
ffff00013d29e600 1190318718 S Co:6:002:0 s 40 05 0e40 0000 0004 4 = 1f1f1d1b
ffff00013d29e600 1190318750 C Co:6:002:0 0 4 >
ffff00013d29e600 1190318785 S Ci:6:002:0 s c0 05 0e44 0000 0004 4 <
ffff00013d29e600 1190318823 C Ci:6:002:0 0 4 = 19171d1d
ffff00013d29e600 1190318858 S Co:6:002:0 s 40 05 0e44 0000 0004 4 = 19171d1d
ffff00013d29e600 1190318906 C Co:6:002:0 0 4 >
ffff00013d29e600 1190318941 S Ci:6:002:0 s c0 05 0e48 0000 0004 4 <
ffff00013d29e600 1190318979 C Ci:6:002:0 0 4 = 1d1d1d1d
ffff00013d29e600 1190319013 S Co:6:002:0 s 40 05 0e48 0000 0004 4 = 1d1d1d1d
ffff00013d29e600 1190319045 C Co:6:002:0 0 4 >
ffff00013d29e600 1190319080 S Ci:6:002:0 s c0 05 0e4c 0000 0004 4 <
ffff00013d29e600 1190319118 C Ci:6:002:0 0 4 = 1b191715
ffff00013d29e600 1190319153 S Co:6:002:0 s 40 05 0e4c 0000 0004 4 = 1b191715
ffff00013d29e600 1190319185 C Co:6:002:0 0 4 >
ffff00013d29e600 1190319220 S Ci:6:002:0 s c0 05 0e54 0000 0004 4 <
ffff00013d29e600 1190319257 C Ci:6:002:0 0 4 = 11090300
ffff00013d29e600 1190319292 S Co:6:002:0 s 40 05 0e54 0000 0004 4 = 11090300
ffff00013d29e600 1190319324 C Co:6:002:0 0 4 >
ffff00013d29e600 1190319374 S Ci:6:002:0 s c0 05 0454 0000 0001 1 <
ffff00013d29e600 1190319425 C Ci:6:002:0 0 1 = 00
ffff00013d29e600 1190319459 S Ci:6:002:0 s c0 05 0454 0000 0001 1 <
ffff00013d29e600 1190319495 C Ci:6:002:0 0 1 = 00
ffff00013d29e600 1190319530 S Co:6:002:0 s 40 05 0454 0000 0001 1 = 80
ffff00013d29e600 1190319561 C Co:6:002:0 0 1 >
ffff00013d29e600 1190319596 S Ci:6:002:0 s c0 05 041a 0000 0002 2 <
ffff00013d29e600 1190319633 C Ci:6:002:0 0 2 = ff0f
ffff00013d29e600 1190319668 S Ci:6:002:0 s c0 05 0808 0000 0004 4 <
ffff00013d29e600 1190319706 C Ci:6:002:0 0 4 = 3382023e
ffff00013d29e600 1190319741 S Co:6:002:0 s 40 05 0808 0000 0004 4 = 3382023e
ffff00013d29e600 1190319789 C Co:6:002:0 0 4 >
ffff00013d29e600 1190319822 S Ci:6:002:0 s c0 05 0834 0000 0004 4 <
ffff00013d29e600 1190319861 C Ci:6:002:0 0 4 = 05a73700
ffff00013d29e600 1190319895 S Co:6:002:0 s 40 05 0834 0000 0004 4 = 06a73700
ffff00013d29e600 1190319927 C Co:6:002:0 0 4 >
ffff00013d29e600 1190319961 S Ci:6:002:0 s c0 05 0830 0000 0004 4 <
ffff00013d29e600 1190319999 C Ci:6:002:0 0 4 = b8eeaa2e
ffff00013d29e600 1190320089 S Co:6:002:0 s 40 05 0830 0000 0004 4 = b8aeaa2e
ffff00013d29e600 1190320122 C Co:6:002:0 0 4 >
ffff00013d29e600 1190320158 S Ci:6:002:0 s c0 05 0830 0000 0004 4 <
ffff00013d29e600 1190320197 C Ci:6:002:0 0 4 = b8aeaa2e
ffff00013d29e600 1190320232 S Co:6:002:0 s 40 05 0830 0000 0004 4 = b8aeaa2e
ffff00013d29e600 1190320281 C Co:6:002:0 0 4 >
ffff00013d29e600 1190320316 S Ci:6:002:0 s c0 05 082c 0000 0004 4 <
ffff00013d29e600 1190320354 C Ci:6:002:0 0 4 = dc832000
ffff00013d29e600 1190320389 S Co:6:002:0 s 40 05 082c 0000 0004 4 = dd832000
ffff00013d29e600 1190320421 C Co:6:002:0 0 4 >
ffff00013d29e600 1190320455 S Co:6:002:0 s 40 05 0cb0 0000 0004 4 = 17773354
ffff00013d29e600 1190320486 C Co:6:002:0 0 4 >
ffff00013d29e600 1190320521 S Co:6:002:0 s 40 05 0eb0 0000 0004 4 = 17773354
ffff00013d29e600 1190320552 C Co:6:002:0 0 4 >
ffff00013d29e600 1190320587 S Ci:6:002:0 s c0 05 0cb4 0000 0004 4 <
ffff00013d29e600 1190320625 C Ci:6:002:0 0 4 = 77000001
ffff00013d29e600 1190320660 S Co:6:002:0 s 40 05 0cb4 0000 0004 4 = 77000001
ffff00013d29e600 1190320691 C Co:6:002:0 0 4 >
ffff00013d29e600 1190320726 S Ci:6:002:0 s c0 05 0eb4 0000 0004 4 <
ffff00013d29e600 1190320764 C Ci:6:002:0 0 4 = 77000001
ffff00013d29e600 1190320799 S Co:6:002:0 s 40 05 0eb4 0000 0004 4 = 77000001
ffff00013d29e600 1190320831 C Co:6:002:0 0 4 >
ffff00013d29e600 1190320866 S Ci:6:002:0 s c0 05 0900 0000 0004 4 <
ffff00013d29e600 1190320918 C Ci:6:002:0 0 4 = 01040000
ffff00013d29e600 1190320952 S Co:6:002:0 s 40 05 0900 0000 0004 4 = 01040000
ffff00013d29e600 1190320983 C Co:6:002:0 0 4 >
ffff00013d29e600 1190321018 S Ci:6:002:0 s c0 05 080c 0000 0004 4 <
ffff00013d29e600 1190321057 C Ci:6:002:0 0 4 = 13111312
ffff00013d29e600 1190321091 S Co:6:002:0 s 40 05 080c 0000 0004 4 = 03111312
ffff00013d29e600 1190321123 C Co:6:002:0 0 4 >
ffff00013d29e600 1190321158 S Ci:6:002:0 s c0 05 0a04 0000 0004 4 <
ffff00013d29e600 1190321196 C Ci:6:002:0 0 4 = 0c00ff01
ffff00013d29e600 1190321231 S Co:6:002:0 s 40 05 0a04 0000 0004 4 = 0c00ff0f
ffff00013d29e600 1190321281 C Co:6:002:0 0 4 >
ffff00013d29e600 1190321316 S Ci:6:002:0 s c0 05 0440 0000 0004 4 <
ffff00013d29e600 1190321354 C Ci:6:002:0 0 4 = 00000000
ffff00013d29e600 1190321389 S Co:6:002:0 s 40 05 0440 0000 0004 4 = 50010000
ffff00013d29e600 1190321422 C Co:6:002:0 0 4 >
ffff00013d29e600 1190321457 S Ci:6:002:0 s c0 05 0c1c 0000 0004 4 <
ffff00013d29e600 1190321495 C Ci:6:002:0 0 4 = 03000040
ffff00013d29e600 1190321531 S Co:6:002:0 s 40 05 0c1c 0000 0004 4 = 0300402d
ffff00013d29e600 1190321562 C Co:6:002:0 0 4 >
ffff00013d29e600 1190321590 S Ci:6:002:0 s c0 05 0e1c 0000 0004 4 <
ffff00013d29e600 1190321629 C Ci:6:002:0 0 4 = 03000040
ffff00013d29e600 1190321664 S Co:6:002:0 s 40 05 0e1c 0000 0004 4 = 0300402d
ffff00013d29e600 1190321695 C Co:6:002:0 0 4 >
ffff00013d29e600 1190321730 S Ci:6:002:0 s c0 05 0860 0000 0004 4 <
ffff00013d29e600 1190321785 C Ci:6:002:0 0 4 = 21c3d572
ffff00013d29e600 1190321820 S Co:6:002:0 s 40 05 0860 0000 0004 4 = 21c3a568
ffff00013d29e600 1190321852 C Co:6:002:0 0 4 >
ffff00013d29e600 1190321886 S Ci:6:002:0 s c0 05 0c00 0000 0004 4 <
ffff00013d29e600 1190321925 C Ci:6:002:0 0 4 = 07000000
ffff00013d29e600 1190321959 S Ci:6:002:0 s c0 05 08b0 0000 0004 4 <
ffff00013d29e600 1190321998 C Ci:6:002:0 0 4 = 18060000
ffff00013d29e600 1190322034 S Co:6:002:0 s 40 05 08b0 0000 0004 4 = 18060000
ffff00013d29e600 1190322066 C Co:6:002:0 0 4 >
ffff00013d29e600 1190322121 S Ci:6:002:0 s c0 05 0d04 0000 0004 4 <
ffff00013d29e600 1190322170 C Ci:6:002:0 0 4 = 017c90b1
ffff00013d29e600 1190322204 S Co:6:002:0 s 40 05 0c90 0000 0004 4 = 017d8301
ffff00013d29e600 1190322235 C Co:6:002:0 0 4 >
ffff00013d29e600 1190322283 S Ci:6:002:0 s c0 05 08ac 0000 0004 4 <
ffff00013d29e600 1190322332 C Ci:6:002:0 0 4 = 08faf00f
ffff00013d29e600 1190322367 S Co:6:002:0 s 40 05 08ac 0000 0004 4 = 08faf00f
ffff00013d29e600 1190322413 C Co:6:002:0 0 4 >
ffff00013d29e600 1190322446 S Ci:6:002:0 s c0 05 08ac 0000 0004 4 <
ffff00013d29e600 1190322485 C Ci:6:002:0 0 4 = 08faf00f
ffff00013d29e600 1190322520 S Co:6:002:0 s 40 05 08ac 0000 0004 4 = 08faf00f
ffff00013d29e600 1190322551 C Co:6:002:0 0 4 >
ffff00013d29e600 1190322585 S Ci:6:002:0 s c0 05 08c4 0000 0004 4 <
ffff00013d29e600 1190322621 C Ci:6:002:0 0 4 = 00000000
ffff00013d29e600 1190322656 S Co:6:002:0 s 40 05 08c4 0000 0004 4 = 00000000
ffff00013d29e600 1190322687 C Co:6:002:0 0 4 >
ffff00013d29e600 1190322722 S Ci:6:002:0 s c0 05 0c00 0000 0004 4 <
ffff00013d29e600 1190322757 C Ci:6:002:0 0 4 = 07000000
ffff00013d29e600 1190322792 S Ci:6:002:0 s c0 05 08b0 0000 0004 4 <
ffff00013d29e600 1190322827 C Ci:6:002:0 0 4 = 18060000
ffff00013d29e600 1190322862 S Co:6:002:0 s 40 05 08b0 0000 0004 4 = 18060000
ffff00013d29e600 1190322911 C Co:6:002:0 0 4 >
ffff00013d29e600 1190322965 S Ci:6:002:0 s c0 05 0d04 0000 0004 4 <
ffff00013d29e600 1190323011 C Ci:6:002:0 0 4 = 017d91b1
ffff00013d29e600 1190323046 S Co:6:002:0 s 40 05 0c90 0000 0004 4 = 6c7d8101
ffff00013d29e600 1190323077 C Co:6:002:0 0 4 >
ffff00013d29e600 1190323124 S Ci:6:002:0 s c0 05 0e00 0000 0004 4 <
ffff00013d29e600 1190323172 C Ci:6:002:0 0 4 = 07000000
ffff00013d29e600 1190323206 S Ci:6:002:0 s c0 05 08b0 0000 0004 4 <
ffff00013d29e600 1190323242 C Ci:6:002:0 0 4 = 18060000
ffff00013d29e600 1190323275 S Co:6:002:0 s 40 05 08b0 0000 0004 4 = 18060000
ffff00013d29e600 1190323306 C Co:6:002:0 0 4 >
ffff00013d29e600 1190323361 S Ci:6:002:0 s c0 05 0d44 0000 0004 4 <
ffff00013d29e600 1190323415 C Ci:6:002:0 0 4 = 017c90b1
ffff00013d29e600 1190323450 S Co:6:002:0 s 40 05 0e90 0000 0004 4 = 017d8301
ffff00013d29e600 1190323481 C Co:6:002:0 0 4 >
ffff00013d29e600 1190323528 S Ci:6:002:0 s c0 05 08ac 0000 0004 4 <
ffff00013d29e600 1190323574 C Ci:6:002:0 0 4 = 08faf00f
ffff00013d29e600 1190323609 S Co:6:002:0 s 40 05 08ac 0000 0004 4 = 08faf00f
ffff00013d29e600 1190323656 C Co:6:002:0 0 4 >
ffff00013d29e600 1190323690 S Ci:6:002:0 s c0 05 08ac 0000 0004 4 <
ffff00013d29e600 1190323725 C Ci:6:002:0 0 4 = 08faf00f
ffff00013d29e600 1190323760 S Co:6:002:0 s 40 05 08ac 0000 0004 4 = 08faf00f
ffff00013d29e600 1190323791 C Co:6:002:0 0 4 >
ffff00013d29e600 1190323825 S Ci:6:002:0 s c0 05 08c4 0000 0004 4 <
ffff00013d29e600 1190323861 C Ci:6:002:0 0 4 = 00000000
ffff00013d29e600 1190323895 S Co:6:002:0 s 40 05 08c4 0000 0004 4 = 00000000
ffff00013d29e600 1190323927 C Co:6:002:0 0 4 >
ffff00013d29e600 1190323962 S Ci:6:002:0 s c0 05 0e00 0000 0004 4 <
ffff00013d29e600 1190323998 C Ci:6:002:0 0 4 = 07000000
ffff00013d29e600 1190324037 S Ci:6:002:0 s c0 05 08b0 0000 0004 4 <
ffff00013d29e600 1190324081 C Ci:6:002:0 0 4 = 18060000
ffff00013d29e600 1190324116 S Co:6:002:0 s 40 05 08b0 0000 0004 4 = 18060000
ffff00013d29e600 1190324164 C Co:6:002:0 0 4 >
ffff00013d29e600 1190324219 S Ci:6:002:0 s c0 05 0d44 0000 0004 4 <
ffff00013d29e600 1190324283 C Ci:6:002:0 0 4 = 017d91b1
ffff00013d29e600 1190324318 S Co:6:002:0 s 40 05 0e90 0000 0004 4 = 6c7d8101
ffff00013d29e600 1190324349 C Co:6:002:0 0 4 >
ffff00013d29e600 1190324396 S Ci:6:002:0 s c0 05 0668 0000 0002 2 <
ffff00013d29e600 1190324442 C Ci:6:002:0 0 2 = 0010
ffff00013d29e600 1190324477 S Co:6:002:0 s 40 05 0668 0000 0002 2 = 0010
ffff00013d29e600 1190324508 C Co:6:002:0 0 2 >
ffff00013d29e600 1190324541 S Co:6:002:0 s 40 05 0483 0000 0001 1 = 00
ffff00013d29e600 1190324572 C Co:6:002:0 0 1 >
ffff00013d29e600 1190324607 S Ci:6:002:0 s c0 05 0837 0000 0001 1 <
ffff00013d29e600 1190324659 C Ci:6:002:0 0 1 = 00
ffff00013d29e600 1190324693 S Ci:6:002:0 s c0 05 08ac 0000 0004 4 <
ffff00013d29e600 1190324728 C Ci:6:002:0 0 4 = 08faf00f
ffff00013d29e600 1190324763 S Co:6:002:0 s 40 05 08ac 0000 0004 4 = 08faf00f
ffff00013d29e600 1190324795 C Co:6:002:0 0 4 >
ffff00013d29e600 1190324829 S Ci:6:002:0 s c0 05 08c4 0000 0004 4 <
ffff00013d29e600 1190324865 C Ci:6:002:0 0 4 = 00000000
ffff00013d29e600 1190324900 S Co:6:002:0 s 40 05 08c4 0000 0004 4 = 00000000
ffff00013d29e600 1190324931 C Co:6:002:0 0 4 >
ffff00013d29e600 1190324966 S Ci:6:002:0 s c0 05 0848 0000 0004 4 <
ffff00013d29e600 1190325002 C Ci:6:002:0 0 4 = 8bffd061
ffff00013d29e600 1190325037 S Co:6:002:0 s 40 05 0848 0000 0004 4 = 8bffd061
ffff00013d29e600 1190325069 C Co:6:002:0 0 4 >
ffff00013d29e600 1190325104 S Ci:6:002:0 s c0 05 08ac 0000 0004 4 <
ffff00013d29e600 1190325140 C Ci:6:002:0 0 4 = 08faf00f
ffff00013d29e600 1190325174 S Co:6:002:0 s 40 05 08ac 0000 0004 4 = 08faf00f
ffff00013d29e600 1190325205 C Co:6:002:0 0 4 >
ffff00013d29e600 1190325239 S Ci:6:002:0 s c0 05 08ac 0000 0004 4 <
ffff00013d29e600 1190325291 C Ci:6:002:0 0 4 = 08faf00f
ffff00013d29e600 1190325326 S Co:6:002:0 s 40 05 08ac 0000 0004 4 = 08faf00f
ffff00013d29e600 1190325358 C Co:6:002:0 0 4 >
ffff00013d29e600 1190325392 S Ci:6:002:0 s c0 05 08c4 0000 0004 4 <
ffff00013d29e600 1190325430 C Ci:6:002:0 0 4 = 00000000
ffff00013d29e600 1190325465 S Co:6:002:0 s 40 05 08c4 0000 0004 4 = 00000000
ffff00013d29e600 1190325496 C Co:6:002:0 0 4 >
ffff00013d29e600 1190325531 S Ci:6:002:0 s c0 05 0c00 0000 0004 4 <
ffff00013d29e600 1190325567 C Ci:6:002:0 0 4 = 07000000
ffff00013d29e600 1190325602 S Ci:6:002:0 s c0 05 08b0 0000 0004 4 <
ffff00013d29e600 1190325638 C Ci:6:002:0 0 4 = 18060000
ffff00013d29e600 1190325673 S Co:6:002:0 s 40 05 08b0 0000 0004 4 = 18060000
ffff00013d29e600 1190325705 C Co:6:002:0 0 4 >
ffff00013d29e600 1190325759 S Ci:6:002:0 s c0 05 0d04 0000 0004 4 <
ffff00013d29e600 1190325806 C Ci:6:002:0 0 4 = 6c7d93b1
ffff00013d29e600 1190325841 S Co:6:002:0 s 40 05 0c90 0000 0004 4 = 6c7d8301
ffff00013d29e600 1190325871 C Co:6:002:0 0 4 >
ffff00013d29e600 1190325918 S Ci:6:002:0 s c0 05 0e00 0000 0004 4 <
ffff00013d29e600 1190325966 C Ci:6:002:0 0 4 = 07000000
ffff00013d29e600 1190326000 S Ci:6:002:0 s c0 05 08b0 0000 0004 4 <
ffff00013d29e600 1190326041 C Ci:6:002:0 0 4 = 18060000
ffff00013d29e600 1190326075 S Co:6:002:0 s 40 05 08b0 0000 0004 4 = 18060000
ffff00013d29e600 1190326106 C Co:6:002:0 0 4 >
ffff00013d29e600 1190326161 S Ci:6:002:0 s c0 05 0d44 0000 0004 4 <
ffff00013d29e600 1190326209 C Ci:6:002:0 0 4 = 6c7d93b1
ffff00013d29e600 1190326242 S Co:6:002:0 s 40 05 0e90 0000 0004 4 = 6c7d8301
ffff00013d29e600 1190326288 C Co:6:002:0 0 4 >
ffff00013d29e600 1190326337 S Ci:6:002:0 s c0 05 0073 0000 0001 1 <
ffff00013d29e600 1190326385 C Ci:6:002:0 0 1 = 07
ffff00013d29e600 1190326419 S Co:6:002:0 s 40 05 0073 0000 0001 1 = 07
ffff00013d29e600 1190326450 C Co:6:002:0 0 1 >
ffff00013d29e600 1190326508 S Ci:6:002:0 s c0 05 0c24 0000 0004 4 <
ffff00013d29e600 1190326557 C Ci:6:002:0 0 4 = 20202020
ffff00013d29e600 1190326592 S Co:6:002:0 s 40 05 0c24 0000 0004 4 = 29292929
ffff00013d29e600 1190326623 C Co:6:002:0 0 4 >
ffff00013d29e600 1190326656 S Ci:6:002:0 s c0 05 0c28 0000 0004 4 <
ffff00013d29e600 1190326692 C Ci:6:002:0 0 4 = 20201e1c
ffff00013d29e600 1190326727 S Co:6:002:0 s 40 05 0c28 0000 0004 4 = 29292725
ffff00013d29e600 1190326758 C Co:6:002:0 0 4 >
ffff00013d29e600 1190326793 S Ci:6:002:0 s c0 05 0c2c 0000 0004 4 <
ffff00013d29e600 1190326831 C Ci:6:002:0 0 4 = 20202020
ffff00013d29e600 1190326865 S Co:6:002:0 s 40 05 0c2c 0000 0004 4 = 2e2e2e2e
ffff00013d29e600 1190326913 C Co:6:002:0 0 4 >
ffff00013d29e600 1190326948 S Ci:6:002:0 s c0 05 0c30 0000 0004 4 <
ffff00013d29e600 1190326984 C Ci:6:002:0 0 4 = 20201e1c
ffff00013d29e600 1190327019 S Co:6:002:0 s 40 05 0c30 0000 0004 4 = 2c2a2826
ffff00013d29e600 1190327051 C Co:6:002:0 0 4 >
ffff00013d29e600 1190327085 S Ci:6:002:0 s c0 05 0c34 0000 0004 4 <
ffff00013d29e600 1190327123 C Ci:6:002:0 0 4 = 20202020
ffff00013d29e600 1190327158 S Co:6:002:0 s 40 05 0c34 0000 0004 4 = 2a2a2a2a
ffff00013d29e600 1190327189 C Co:6:002:0 0 4 >
ffff00013d29e600 1190327224 S Ci:6:002:0 s c0 05 0c38 0000 0004 4 <
ffff00013d29e600 1190327261 C Ci:6:002:0 0 4 = 201e1c1a
ffff00013d29e600 1190327295 S Co:6:002:0 s 40 05 0c38 0000 0004 4 = 2a282624
ffff00013d29e600 1190327326 C Co:6:002:0 0 4 >
ffff00013d29e600 1190327361 S Ci:6:002:0 s c0 05 0c3c 0000 0004 4 <
ffff00013d29e600 1190327416 C Ci:6:002:0 0 4 = 20202020
ffff00013d29e600 1190327451 S Co:6:002:0 s 40 05 0c3c 0000 0004 4 = 2e2e2e2e
ffff00013d29e600 1190327483 C Co:6:002:0 0 4 >
ffff00013d29e600 1190327517 S Ci:6:002:0 s c0 05 0c40 0000 0004 4 <
ffff00013d29e600 1190327553 C Ci:6:002:0 0 4 = 20201e1c
ffff00013d29e600 1190327588 S Co:6:002:0 s 40 05 0c40 0000 0004 4 = 2c2a2826
ffff00013d29e600 1190327619 C Co:6:002:0 0 4 >
ffff00013d29e600 1190327654 S Ci:6:002:0 s c0 05 0c44 0000 0004 4 <
ffff00013d29e600 1190327692 C Ci:6:002:0 0 4 = 1a181e1e
ffff00013d29e600 1190327727 S Co:6:002:0 s 40 05 0c44 0000 0004 4 = 24242a2a
ffff00013d29e600 1190327759 C Co:6:002:0 0 4 >
ffff00013d29e600 1190327794 S Ci:6:002:0 s c0 05 0c48 0000 0004 4 <
ffff00013d29e600 1190327831 C Ci:6:002:0 0 4 = 1e1e1e1e
ffff00013d29e600 1190327866 S Co:6:002:0 s 40 05 0c48 0000 0004 4 = 2a2a2a28
ffff00013d29e600 1190327913 C Co:6:002:0 0 4 >
ffff00013d29e600 1190327948 S Ci:6:002:0 s c0 05 0c4c 0000 0004 4 <
ffff00013d29e600 1190327985 C Ci:6:002:0 0 4 = 1c1a1816
ffff00013d29e600 1190328140 S Co:6:002:0 s 40 05 0c4c 0000 0004 4 = 26242222
ffff00013d29e600 1190328174 C Co:6:002:0 0 4 >
ffff00013d29e600 1190328214 S Ci:6:002:0 s c0 05 0c54 0000 0004 4 <
ffff00013d29e600 1190328263 C Ci:6:002:0 0 4 = 120a0400
ffff00013d29e600 1190328298 S Co:6:002:0 s 40 05 0c54 0000 0004 4 = 1c140e00
ffff00013d29e600 1190328329 C Co:6:002:0 0 4 >
ffff00013d29e600 1190328363 S Ci:6:002:0 s c0 05 0e24 0000 0004 4 <
ffff00013d29e600 1190328417 C Ci:6:002:0 0 4 = 1d1d1d1d
ffff00013d29e600 1190328452 S Co:6:002:0 s 40 05 0e24 0000 0004 4 = 20202020
ffff00013d29e600 1190328483 C Co:6:002:0 0 4 >
ffff00013d29e600 1190328517 S Ci:6:002:0 s c0 05 0e28 0000 0004 4 <
ffff00013d29e600 1190328555 C Ci:6:002:0 0 4 = 1d1d1b19
ffff00013d29e600 1190328590 S Co:6:002:0 s 40 05 0e28 0000 0004 4 = 20201e1c
ffff00013d29e600 1190328622 C Co:6:002:0 0 4 >
ffff00013d29e600 1190328656 S Ci:6:002:0 s c0 05 0e2c 0000 0004 4 <
ffff00013d29e600 1190328695 C Ci:6:002:0 0 4 = 1f1f1f1f
ffff00013d29e600 1190328729 S Co:6:002:0 s 40 05 0e2c 0000 0004 4 = 25252525
ffff00013d29e600 1190328760 C Co:6:002:0 0 4 >
ffff00013d29e600 1190328795 S Ci:6:002:0 s c0 05 0e30 0000 0004 4 <
ffff00013d29e600 1190328833 C Ci:6:002:0 0 4 = 1f1f1d1b
ffff00013d29e600 1190328868 S Co:6:002:0 s 40 05 0e30 0000 0004 4 = 23211f1d
ffff00013d29e600 1190328913 C Co:6:002:0 0 4 >
ffff00013d29e600 1190328948 S Ci:6:002:0 s c0 05 0e34 0000 0004 4 <
ffff00013d29e600 1190328986 C Ci:6:002:0 0 4 = 1f1f1f1f
ffff00013d29e600 1190329021 S Co:6:002:0 s 40 05 0e34 0000 0004 4 = 21212121
ffff00013d29e600 1190329052 C Co:6:002:0 0 4 >
ffff00013d29e600 1190329087 S Ci:6:002:0 s c0 05 0e38 0000 0004 4 <
ffff00013d29e600 1190329125 C Ci:6:002:0 0 4 = 1f1d1b19
ffff00013d29e600 1190329163 S Co:6:002:0 s 40 05 0e38 0000 0004 4 = 211f1d1b
ffff00013d29e600 1190329196 C Co:6:002:0 0 4 >
ffff00013d29e600 1190329231 S Ci:6:002:0 s c0 05 0e3c 0000 0004 4 <
ffff00013d29e600 1190329285 C Ci:6:002:0 0 4 = 1f1f1f1f
ffff00013d29e600 1190329320 S Co:6:002:0 s 40 05 0e3c 0000 0004 4 = 25252525
ffff00013d29e600 1190329351 C Co:6:002:0 0 4 >
ffff00013d29e600 1190329385 S Ci:6:002:0 s c0 05 0e40 0000 0004 4 <
ffff00013d29e600 1190329423 C Ci:6:002:0 0 4 = 1f1f1d1b
ffff00013d29e600 1190329457 S Co:6:002:0 s 40 05 0e40 0000 0004 4 = 23211f1d
ffff00013d29e600 1190329488 C Co:6:002:0 0 4 >
ffff00013d29e600 1190329523 S Ci:6:002:0 s c0 05 0e44 0000 0004 4 <
ffff00013d29e600 1190329561 C Ci:6:002:0 0 4 = 19171d1d
ffff00013d29e600 1190329596 S Co:6:002:0 s 40 05 0e44 0000 0004 4 = 1b1b2121
ffff00013d29e600 1190329627 C Co:6:002:0 0 4 >
ffff00013d29e600 1190329662 S Ci:6:002:0 s c0 05 0e48 0000 0004 4 <
ffff00013d29e600 1190329700 C Ci:6:002:0 0 4 = 1d1d1d1d
ffff00013d29e600 1190329735 S Co:6:002:0 s 40 05 0e48 0000 0004 4 = 2121211f
ffff00013d29e600 1190329784 C Co:6:002:0 0 4 >
ffff00013d29e600 1190329819 S Ci:6:002:0 s c0 05 0e4c 0000 0004 4 <
ffff00013d29e600 1190329857 C Ci:6:002:0 0 4 = 1b191715
ffff00013d29e600 1190329892 S Co:6:002:0 s 40 05 0e4c 0000 0004 4 = 1d1b1919
ffff00013d29e600 1190329923 C Co:6:002:0 0 4 >
ffff00013d29e600 1190329958 S Ci:6:002:0 s c0 05 0e54 0000 0004 4 <
ffff00013d29e600 1190329996 C Ci:6:002:0 0 4 = 11090300
ffff00013d29e600 1190330031 S Co:6:002:0 s 40 05 0e54 0000 0004 4 = 130b0500
ffff00013d29e600 1190330063 C Co:6:002:0 0 4 >
ffff000103533480 1190748255 S Ci:6:002:0 s c0 05 0770 0000 0004 4 <
ffff000103533480 1190748408 C Ci:6:002:0 0 4 = 00000000
ffff000103533480 1190748564 S Ci:6:002:0 s c0 05 0774 0000 0004 4 <
ffff000103533480 1190748710 C Ci:6:002:0 0 4 = 00000000
ffff000103533480 1190748870 S Co:6:002:0 s 40 05 076e 0000 0001 1 = 0c
ffff000103533480 1190749008 C Co:6:002:0 0 1 >
ffff000103533480 1190749173 S Ci:6:002:0 s c0 05 0808 0000 0004 4 <
ffff000103533480 1190749318 C Ci:6:002:0 0 4 = 3382023e
ffff000103533480 1190749478 S Ci:6:002:0 s c0 05 0a5c 0000 0002 2 <
ffff000103533480 1190749631 C Ci:6:002:0 0 2 = 9400
ffff000103533480 1190749786 S Ci:6:002:0 s c0 05 0f48 0000 0002 2 <
ffff000103533480 1190749933 C Ci:6:002:0 0 2 = 0703
ffff000103533480 1190750088 S Ci:6:002:0 s c0 05 0f04 0000 0004 4 <
ffff000103533480 1190750211 C Ci:6:002:0 0 4 = 01000400
ffff000103533480 1190750240 S Ci:6:002:0 s c0 05 0f14 0000 0004 4 <
ffff000103533480 1190750358 C Ci:6:002:0 0 4 = 88001100
ffff000103533480 1190750387 S Ci:6:002:0 s c0 05 0f10 0000 0004 4 <
ffff000103533480 1190750499 C Ci:6:002:0 0 4 = 00000000
ffff000103533480 1190750528 S Ci:6:002:0 s c0 05 0f0c 0000 0004 4 <
ffff000103533480 1190750639 C Ci:6:002:0 0 4 = 00000000
ffff000103533480 1190750669 S Ci:6:002:0 s c0 05 0f08 0000 0004 4 <
ffff000103533480 1190750780 C Ci:6:002:0 0 4 = ef00a003
ffff000103533480 1190750809 S Ci:6:002:0 s c0 05 0fcc 0000 0004 4 <
ffff000103533480 1190750920 C Ci:6:002:0 0 4 = 00000000
ffff000103533480 1190750949 S Ci:6:002:0 s c0 05 09a4 0000 0004 4 <
ffff000103533480 1190751067 C Ci:6:002:0 0 4 = 80000800
ffff000103533480 1190751089 S Co:6:002:0 s 40 05 09a4 0000 0004 4 = 80000a00
ffff000103533480 1190751196 C Co:6:002:0 0 4 >
ffff000103533480 1190751226 S Ci:6:002:0 s c0 05 09a4 0000 0004 4 <
ffff000103533480 1190751344 C Ci:6:002:0 0 4 = 80000a00
ffff000103533480 1190751364 S Co:6:002:0 s 40 05 09a4 0000 0004 4 = 80000800
ffff000103533480 1190751479 C Co:6:002:0 0 4 >
ffff000103533480 1190751508 S Ci:6:002:0 s c0 05 0a2c 0000 0004 4 <
ffff000103533480 1190751620 C Ci:6:002:0 0 4 = 00809000
ffff000103533480 1190751649 S Co:6:002:0 s 40 05 0a2c 0000 0004 4 = 00009000
ffff000103533480 1190751756 C Co:6:002:0 0 4 >
ffff000103533480 1190751785 S Ci:6:002:0 s c0 05 0a2c 0000 0004 4 <
ffff000103533480 1190751896 C Ci:6:002:0 0 4 = 00009000
ffff000103533480 1190751925 S Co:6:002:0 s 40 05 0a2c 0000 0004 4 = 00809000
ffff000103533480 1190752033 C Co:6:002:0 0 4 >
ffff000103533480 1190752063 S Ci:6:002:0 s c0 05 0b58 0000 0004 4 <
ffff000103533480 1190752112 C Ci:6:002:0 0 4 = 00000000
ffff000103533480 1190752129 S Co:6:002:0 s 40 05 0b58 0000 0004 4 = 01000000
ffff000103533480 1190752236 C Co:6:002:0 0 4 >
ffff000103533480 1190752372 S Ci:6:002:0 s c0 05 0b58 0000 0004 4 <
ffff000103533480 1190752519 C Ci:6:002:0 0 4 = 01000000
ffff000103533480 1190752681 S Co:6:002:0 s 40 05 0b58 0000 0004 4 = 00000000
ffff000103533480 1190752819 C Co:6:002:0 0 4 >
ffff000103533480 1190752978 S Ci:6:002:0 s c0 05 01cc 0000 0001 1 <
ffff000103533480 1190753126 C Ci:6:002:0 0 1 = 00
ffff000103533480 1190753264 S Co:6:002:0 s 40 05 01f4 0000 0004 4 = 00000000
ffff000103533480 1190753381 C Co:6:002:0 0 4 >
ffff000103533480 1190753531 S Co:6:002:0 s 40 05 01d4 0000 0004 4 = 58000000
ffff000103533480 1190753642 C Co:6:002:0 0 4 >
ffff000103533480 1190753778 S Co:6:002:0 s 40 05 0440 0000 0004 4 = 00000000
ffff000103533480 1190753890 C Co:6:002:0 0 4 >
ffff000103533480 1190753928 S Ci:6:002:0 s c0 05 0c00 0000 0004 4 <
ffff000103533480 1190754043 C Ci:6:002:0 0 4 = 07000000
ffff000103533480 1190754073 S Ci:6:002:0 s c0 05 08b0 0000 0004 4 <
ffff000103533480 1190754184 C Ci:6:002:0 0 4 = 18060000
ffff000103533480 1190754213 S Co:6:002:0 s 40 05 08b0 0000 0004 4 = 42060000
ffff000103533480 1190754321 C Co:6:002:0 0 4 >
ffff000103533480 1190754370 S Ci:6:002:0 s c0 05 0d04 0000 0004 4 <
ffff000103533480 1190754483 C Ci:6:002:0 0 4 = 088d90b1
ffff000103533480 1190754513 S Co:6:002:0 s 40 05 0c90 0000 0004 4 = 088d2304
ffff000103533480 1190754627 C Co:6:002:0 0 4 >
ffff000103533480 1190754661 S Co:6:002:0 s 40 05 0280 0000 0002 2 = 0001
ffff000103533480 1190754762 C Co:6:002:0 0 2 >
ffff000103533480 1190754790 S Ci:6:002:0 s c0 05 010c 0000 0001 1 <
ffff000103533480 1190754908 C Ci:6:002:0 0 1 = b4
ffff000103533480 1190754932 S Co:6:002:0 s 40 05 010c 0000 0001 1 = b4
ffff000103533480 1190755040 C Co:6:002:0 0 1 >
ffff000103533480 1190755081 S Ci:6:002:0 s c0 05 004c 0000 0001 1 <
ffff000103533480 1190755186 C Ci:6:002:0 0 1 = 20
ffff000103533480 1190755207 S Co:6:002:0 s 40 05 004c 0000 0001 1 = 20
ffff000103533480 1190755314 C Co:6:002:0 0 1 >
ffff000103533480 1191836282 S Ci:6:002:0 s c0 05 004c 0000 0001 1 <
ffff000103533480 1191836361 C Ci:6:002:0 0 1 = 20
ffff000103533480 1191836510 S Co:6:002:0 s 40 05 004c 0000 0001 1 = 20
ffff000103533480 1191836633 C Co:6:002:0 0 1 >
ffff000103533480 1192732252 S Ci:6:002:0 s c0 05 004c 0000 0001 1 <
ffff000103533480 1192732396 C Ci:6:002:0 0 1 = 20
ffff000103533480 1192732549 S Co:6:002:0 s 40 05 004c 0000 0001 1 = 20
ffff000103533480 1192732687 C Co:6:002:0 0 1 >
ffff000103533480 1192764182 S Ci:6:002:0 s c0 05 0770 0000 0004 4 <
ffff000103533480 1192764330 C Ci:6:002:0 0 4 = 00000000
ffff000103533480 1192764498 S Ci:6:002:0 s c0 05 0774 0000 0004 4 <
ffff000103533480 1192764646 C Ci:6:002:0 0 4 = 00000000
ffff000103533480 1192764808 S Co:6:002:0 s 40 05 076e 0000 0001 1 = 0c
ffff000103533480 1192764946 C Co:6:002:0 0 1 >
ffff000103533480 1192765109 S Ci:6:002:0 s c0 05 0808 0000 0004 4 <
ffff000103533480 1192765256 C Ci:6:002:0 0 4 = 3382023e
ffff000103533480 1192765417 S Ci:6:002:0 s c0 05 0a5c 0000 0002 2 <
ffff000103533480 1192765563 C Ci:6:002:0 0 2 = 0000
ffff000103533480 1192765721 S Ci:6:002:0 s c0 05 0f48 0000 0002 2 <
ffff000103533480 1192765843 C Ci:6:002:0 0 2 = 5a00
ffff000103533480 1192765872 S Ci:6:002:0 s c0 05 0f04 0000 0004 4 <
ffff000103533480 1192765992 C Ci:6:002:0 0 4 = 00000000
ffff000103533480 1192766021 S Ci:6:002:0 s c0 05 0f14 0000 0004 4 <
ffff000103533480 1192766134 C Ci:6:002:0 0 4 = 00000200
ffff000103533480 1192766163 S Ci:6:002:0 s c0 05 0f10 0000 0004 4 <
ffff000103533480 1192766276 C Ci:6:002:0 0 4 = 00000000
ffff000103533480 1192766307 S Ci:6:002:0 s c0 05 0f0c 0000 0004 4 <
ffff000103533480 1192766417 C Ci:6:002:0 0 4 = 00000000
ffff000103533480 1192766446 S Ci:6:002:0 s c0 05 0f08 0000 0004 4 <
ffff000103533480 1192766565 C Ci:6:002:0 0 4 = 00005c00
ffff000103533480 1192766586 S Ci:6:002:0 s c0 05 0fcc 0000 0004 4 <
ffff000103533480 1192766708 C Ci:6:002:0 0 4 = 00000000
ffff000103533480 1192766737 S Ci:6:002:0 s c0 05 09a4 0000 0004 4 <
ffff000103533480 1192766856 C Ci:6:002:0 0 4 = 80000800
ffff000103533480 1192766877 S Co:6:002:0 s 40 05 09a4 0000 0004 4 = 80000a00
ffff000103533480 1192766984 C Co:6:002:0 0 4 >
ffff000103533480 1192767013 S Ci:6:002:0 s c0 05 09a4 0000 0004 4 <
ffff000103533480 1192767132 C Ci:6:002:0 0 4 = 80000a00
ffff000103533480 1192767153 S Co:6:002:0 s 40 05 09a4 0000 0004 4 = 80000800
ffff000103533480 1192767260 C Co:6:002:0 0 4 >
ffff000103533480 1192767289 S Ci:6:002:0 s c0 05 0a2c 0000 0004 4 <
ffff000103533480 1192767408 C Ci:6:002:0 0 4 = 00809000
ffff000103533480 1192767429 S Co:6:002:0 s 40 05 0a2c 0000 0004 4 = 00009000
ffff000103533480 1192767536 C Co:6:002:0 0 4 >
ffff000103533480 1192767565 S Ci:6:002:0 s c0 05 0a2c 0000 0004 4 <
ffff000103533480 1192767677 C Ci:6:002:0 0 4 = 00009000
ffff000103533480 1192767706 S Co:6:002:0 s 40 05 0a2c 0000 0004 4 = 00809000
ffff000103533480 1192767827 C Co:6:002:0 0 4 >
ffff000103533480 1192767856 S Ci:6:002:0 s c0 05 0b58 0000 0004 4 <
ffff000103533480 1192767968 C Ci:6:002:0 0 4 = 00000000
ffff000103533480 1192767997 S Co:6:002:0 s 40 05 0b58 0000 0004 4 = 01000000
ffff000103533480 1192768112 C Co:6:002:0 0 4 >
ffff000103533480 1192768141 S Ci:6:002:0 s c0 05 0b58 0000 0004 4 <
ffff000103533480 1192768259 C Ci:6:002:0 0 4 = 01000000
ffff000103533480 1192768280 S Co:6:002:0 s 40 05 0b58 0000 0004 4 = 00000000
ffff000103533480 1192768387 C Co:6:002:0 0 4 >
ffff000103533480 1192768418 S Ci:6:002:0 s c0 05 01cc 0000 0001 1 <
ffff000103533480 1192768535 C Ci:6:002:0 0 1 = 00
ffff000103533480 1192768555 S Co:6:002:0 s 40 05 01f8 0000 0004 4 = 00000000
ffff000103533480 1192768663 C Co:6:002:0 0 4 >
ffff000103533480 1192768691 S Co:6:002:0 s 40 05 01d8 0000 0004 4 = 58000000
ffff000103533480 1192768727 C Co:6:002:0 0 4 >
ffff000103533480 1192768744 S Co:6:002:0 s 40 05 0440 0000 0004 4 = 00000000
ffff000103533480 1192768849 C Co:6:002:0 0 4 >
ffff000103533480 1192768880 S Ci:6:002:0 s c0 05 0c00 0000 0004 4 <
ffff000103533480 1192768992 C Ci:6:002:0 0 4 = 07000000
ffff000103533480 1192769021 S Ci:6:002:0 s c0 05 08b0 0000 0004 4 <
ffff000103533480 1192769135 C Ci:6:002:0 0 4 = 42060000
ffff000103533480 1192769156 S Co:6:002:0 s 40 05 08b0 0000 0004 4 = 42060000
ffff000103533480 1192769264 C Co:6:002:0 0 4 >
ffff000103533480 1192769313 S Ci:6:002:0 s c0 05 0d04 0000 0004 4 <
ffff000103533480 1192769420 C Ci:6:002:0 0 4 = 088d90b1
ffff000103533480 1192769445 S Ci:6:002:0 s c0 05 0c1c 0000 0004 4 <
ffff000103533480 1192769556 C Ci:6:002:0 0 4 = 0300402d
ffff000103533480 1192769585 S Co:6:002:0 s 40 05 0c1c 0000 0004 4 = 03000039
ffff000103533480 1192769701 C Co:6:002:0 0 4 >
ffff000103533480 1192769722 S Ci:6:002:0 s c0 05 0e1c 0000 0004 4 <
ffff000103533480 1192769836 C Ci:6:002:0 0 4 = 0300402d
ffff000103533480 1192769864 S Co:6:002:0 s 40 05 0e1c 0000 0004 4 = 0300e032
ffff000103533480 1192769899 C Co:6:002:0 0 4 >
ffff000103533480 1192769916 S Co:6:002:0 s 40 05 0280 0000 0002 2 = 0001
ffff000103533480 1192770020 C Co:6:002:0 0 2 >
ffff000103533480 1192770049 S Ci:6:002:0 s c0 05 010c 0000 0001 1 <
ffff000103533480 1192770169 C Ci:6:002:0 0 1 = b4
ffff000103533480 1192770193 S Co:6:002:0 s 40 05 010c 0000 0001 1 = b4
ffff000103533480 1192770301 C Co:6:002:0 0 1 >
