ffff00013d62e840 1179133949 C Bi:6:002:1 0 376 = 40010484 00000f80 6c026000 04300000 00000000 dab00201 463c0000 87f7f701
ffff00013d62e840 1179134022 S Bi:6:002:1 -115 32768 <
ffff000103533900 1179135022 C Bi:6:002:1 0 351 = 27010484 00000f80 2c0c6000 04300000 00000000 2cb50201 463e0000 8cf3f301
ffff000103533900 1179135047 S Bi:6:002:1 -115 32768 <
ffff000103558cc0 1179136060 C Bi:6:002:1 0 374 = 3e010484 00000f80 ff066000 04300000 00000000 35b90201 46400000 8ae9e901
ffff000103558cc0 1179136116 S Bi:6:002:1 -115 32768 <
ffff00014c2bf900 1179235131 C Bi:6:002:1 0 383 = 47010484 00000f80 000b6000 04300000 00000000 223c0401 463c0000 87ecec01
ffff00014c2bf900 1179235164 S Bi:6:002:1 -115 32768 <
ffff00013d62e840 1179236274 C Bi:6:002:1 0 376 = 40010484 00000f80 6d026000 04300000 00000000 9e400401 463a0000 8a000001
ffff00013d62e840 1179236303 S Bi:6:002:1 -115 32768 <
ffff000103533900 1179242424 C Bi:6:002:1 0 374 = 3e010484 00000f80 00076000 04300000 00000000 ab580401 463a0000 8afdfd01
ffff000103533900 1179242480 S Bi:6:002:1 -115 32768 <
ffff000103558cc0 1179243275 C Bi:6:002:1 0 384 = 48010484 00000f80 d0096000 04300000 00000000 385c0401 463a0000 87ecec01
ffff000103558cc0 1179243293 S Bi:6:002:1 -115 32768 <
ffff00014c2bf900 1179297834 C Bi:6:002:1 0 377 = 41010484 00000f00 3b0d6000 04300000 00000000 08310501 463c0000 85f9f901
ffff00014c2bf900 1179297857 S Bi:6:002:1 -115 32768 <
ffff00013d62e840 1179299026 C Bi:6:002:1 0 377 = 41010484 00000f00 3b0d6000 04300000 00000000 9a350501 463c0000 88eeee01
ffff00013d62e840 1179299056 S Bi:6:002:1 -115 32768 <
ffff000103533900 1179301238 C Bi:6:002:1 0 377 = 41010484 00000f00 3b0d6000 04300000 00000000 553e0501 463c0000 89eded01
ffff000103533900 1179301266 S Bi:6:002:1 -115 32768 <
ffff000103558cc0 1179302393 C Bi:6:002:1 0 377 = 41010484 00000f00 3b0d6000 04300000 00000000 dc420501 46380000 89f1f101
ffff000103558cc0 1179302420 S Bi:6:002:1 -115 32768 <
ffff00014c2bf900 1179303018 C Bi:6:002:1 0 370 = 3a010484 00000f00 1d066000 04300000 00000000 53450501 44380000 89f6f601
ffff00014c2bf900 1179303043 S Bi:6:002:1 -115 32768 <
ffff00013d62e840 1179303641 C Bi:6:002:1 0 370 = 3a010484 00000f00 1d066000 04300000 00000000 c2470501 463a0000 8af9f901
ffff00013d62e840 1179303665 S Bi:6:002:1 -115 32768 <
ffff000103533900 1179304699 C Bi:6:002:1 0 370 = 3a010484 00000f00 1d066000 04300000 00000000 e24b0501 463a0000 88f6f601
ffff000103533900 1179304725 S Bi:6:002:1 -115 32768 <
ffff000103558cc0 1179305744 C Bi:6:002:1 0 370 = 3a010484 00000f00 1d066000 04300000 00000000 fa4f0501 443c0000 8ae7e701
ffff000103558cc0 1179305771 S Bi:6:002:1 -115 32768 <
ffff00014c2bf900 1179306348 C Bi:6:002:1 0 345 = 21010484 00000f00 c7086000 04300000 00000000 72520501 46380000 88f7f701
ffff00014c2bf900 1179306373 S Bi:6:002:1 -115 32768 <
ffff00013d62e840 1179306919 C Bi:6:002:1 0 345 = 21010484 00000f00 c7086000 04300000 00000000 b2540501 463c0000 88eded01
ffff00013d62e840 1179306943 S Bi:6:002:1 -115 32768 <
ffff000103533900 1179308146 C Bi:6:002:1 0 345 = 21010484 00000f00 c7086000 04300000 00000000 72590501 463a0000 89f8f801
ffff000103533900 1179308175 S Bi:6:002:1 -115 32768 <
ffff000103558cc0 1179308898 C Bi:6:002:1 0 378 = 42010484 00000f00 700a6000 04300000 00000000 415c0501 46380000 87f4f401
ffff000103558cc0 1179308923 S Bi:6:002:1 -115 32768 <
ffff00014c2bf900 1179309527 C Bi:6:002:1 0 378 = 42010484 00000f00 700a6000 04300000 00000000 b35e0501 463c0000 87e4e401
ffff00014c2bf900 1179309553 S Bi:6:002:1 -115 32768 <
ffff00013d62e840 1179310549 C Bi:6:002:1 0 378 = 42010484 00000f00 700a6000 04300000 00000000 c7620501 463c0000 86fbfb01
ffff00013d62e840 1179310572 S Bi:6:002:1 -115 32768 <
ffff000103533900 1179337788 C Bi:6:002:1 0 383 = 47010484 00000f80 010b6000 04300000 00000000 f2cc0501 463a0000 88e9e901
ffff000103533900 1179337816 S Bi:6:002:1 -115 32768 <
ffff000103558cc0 1179338660 C Bi:6:002:1 0 376 = 40010484 00000f80 6e026000 04300000 00000000 98d00501 463a0000 88efef01
ffff000103558cc0 1179338685 S Bi:6:002:1 -115 32768 <
ffff00014c2bf900 1179339936 C Bi:6:002:1 0 351 = 27010484 00000f80 2e0c6000 04300000 00000000 a0d50501 463a0000 88e1e101
ffff00014c2bf900 1179339960 S Bi:6:002:1 -115 32768 <
ffff00013d62e840 1179439913 C Bi:6:002:1 0 383 = 47010484 00000f80 020b6000 04300000 00000000 eb5b0701 463c0000 88f5f501
ffff00013d62e840 1179439939 S Bi:6:002:1 -115 32768 <
ffff000103533900 1179440931 C Bi:6:002:1 0 376 = 40010484 00000f80 6f026000 04300000 00000000 0f600701 463a0000 8aeeee01
ffff000103533900 1179440956 S Bi:6:002:1 -115 32768 <
ffff000103558cc0 1179441861 C Bi:6:002:1 0 351 = 27010484 00000f80 2f0c6000 04300000 00000000 c8630701 463c0000 87f4f401
ffff000103558cc0 1179441886 S Bi:6:002:1 -115 32768 <
ffff00014c2bf900 1179443677 C Bi:6:002:1 0 384 = 48010484 00000f80 d2096000 04300000 00000000 c56a0701 443a0000 88f5f501
ffff00014c2bf900 1179443708 S Bi:6:002:1 -115 32768 <
ffff00013d62e840 1179542312 C Bi:6:002:1 0 383 = 47010484 00000f80 030b6000 04300000 00000000 eceb0801 463a0000 8af4f401
ffff00013d62e840 1179542342 S Bi:6:002:1 -115 32768 <
ffff000103533900 1179543356 C Bi:6:002:1 0 376 = 40010484 00000f80 70026000 04300000 00000000 1cf00801 463c0000 89f1f101
ffff000103533900 1179543382 S Bi:6:002:1 -115 32768 <
ffff000103558cc0 1179544279 C Bi:6:002:1 0 351 = 27010484 00000f80 300c6000 04300000 00000000 d6f30801 463e0000 87f0f001
ffff000103558cc0 1179544305 S Bi:6:002:1 -115 32768 <
ffff00014c2bf900 1179545244 C Bi:6:002:1 0 374 = 3e010484 00000f80 03076000 04300000 00000000 80f70801 463a0000 87fafa01
ffff00014c2bf900 1179545308 S Bi:6:002:1 -115 32768 <
ffff00013d62e840 1179546116 C Bi:6:002:1 0 384 = 48010484 00000f80 d3096000 04300000 00000000 d8fa0801 463c0000 89f7f701
ffff00013d62e840 1179546142 S Bi:6:002:1 -115 32768 <
ffff000103533900 1179617911 C Bi:6:002:1 0 377 = 41010484 00000f00 3c0d6000 04300000 00000000 68130a01 463e0000 87f4f401
ffff000103533900 1179617948 S Bi:6:002:1 -115 32768 <
ffff000103558cc0 1179618615 C Bi:6:002:1 0 370 = 3a010484 00000f00 1e066000 04300000 00000000 1b160a01 463c0000 8af7f701
ffff000103558cc0 1179618645 S Bi:6:002:1 -115 32768 <
ffff00014c2bf900 1179619242 C Bi:6:002:1 0 345 = 21010484 00000f00 c8086000 04300000 00000000 b4180a01 463c0000 8aeded01
ffff00014c2bf900 1179619267 S Bi:6:002:1 -115 32768 <
ffff00013d62e840 1179619890 C Bi:6:002:1 0 378 = 42010484 00000f00 710a6000 04300000 00000000 241b0a01 463a0000 87fbfb01
ffff00013d62e840 1179619913 S Bi:6:002:1 -115 32768 <
ffff000103533900 1179645025 C Bi:6:002:1 0 383 = 47010484 00000f80 040b6000 04300000 00000000 4d7d0a01 443a0000 89020201
ffff000103533900 1179645049 S Bi:6:002:1 -115 32768 <
ffff000103558cc0 1179645979 C Bi:6:002:1 0 376 = 40010484 00000f80 71026000 04300000 00000000 f3800a01 46380000 89fafa01
ffff000103558cc0 1179646006 S Bi:6:002:1 -115 32768 <
ffff00014c2bf900 1179646722 C Bi:6:002:1 0 351 = 27010484 00000f80 310c6000 04300000 00000000 04840a01 463a0000 85f2f201
ffff00014c2bf900 1179646747 S Bi:6:002:1 -115 32768 <
ffff00013d62e840 1179649038 C Bi:6:002:1 0 384 = 48010484 00000f80 d4096000 04300000 00000000 f18c0a01 463a0000 85f1f101
ffff00013d62e840 1179649068 S Bi:6:002:1 -115 32768 <
ffff000103533900 1179747115 C Bi:6:002:1 0 383 = 47010484 00000f80 050b6000 04300000 00000000 ef0b0c01 463c0000 88f7f701
ffff000103533900 1179747144 S Bi:6:002:1 -115 32768 <
ffff000103558cc0 1179748179 C Bi:6:002:1 0 376 = 40010484 00000f80 72026000 04300000 00000000 36100c01 463c0000 88e9e901
ffff000103558cc0 1179748205 S Bi:6:002:1 -115 32768 <
ffff00014c2bf900 1179749092 C Bi:6:002:1 0 351 = 27010484 00000f80 320c6000 04300000 00000000 f0130c01 463c0000 89efef01
ffff00014c2bf900 1179749115 S Bi:6:002:1 -115 32768 <
ffff00013d62e840 1179751049 C Bi:6:002:1 0 384 = 48010484 00000f80 d5096000 04300000 00000000 541b0c01 463e0000 87f0f001
ffff00013d62e840 1179751075 S Bi:6:002:1 -115 32768 <
ffff000103533780 1179772232 S Ci:6:002:0 s c0 05 004c 0000 0001 1 <
ffff000103533780 1179772364 C Ci:6:002:0 0 1 = 20
ffff000103533780 1179772561 S Co:6:002:0 s 40 05 004c 0000 0001 1 = 20
ffff000103533780 1179772715 C Co:6:002:0 0 1 >
ffff000103533900 1179849535 C Bi:6:002:1 0 383 = 47010484 00000f80 060b6000 04300000 00000000 f19b0d01 463a0000 8af0f001
ffff000103533900 1179849564 S Bi:6:002:1 -115 32768 <
ffff000103558cc0 1179850504 C Bi:6:002:1 0 376 = 40010484 00000f80 73026000 04300000 00000000 f89f0d01 463c0000 89f1f101
ffff000103558cc0 1179850558 S Bi:6:002:1 -115 32768 <
ffff00014c2bf900 1179852128 C Bi:6:002:1 0 374 = 3e010484 00000f80 06076000 04300000 00000000 35a60d01 463a0000 89f5f501
ffff00014c2bf900 1179852154 S Bi:6:002:1 -115 32768 <
ffff00013d62e840 1179852914 C Bi:6:002:1 0 384 = 48010484 00000f80 d6096000 04300000 00000000 4da90d01 463c0000 87f9f901
ffff00013d62e840 1179852943 S Bi:6:002:1 -115 32768 <
ffff000103533900 1179952864 C Bi:6:002:1 0 376 = 40010484 00000f80 74026000 04300000 00000000 ae2f0f01 463e0000 87eded01
ffff000103533900 1179952890 S Bi:6:002:1 -115 32768 <
ffff000103558cc0 1179953648 C Bi:6:002:1 0 351 = 27010484 00000f80 340c6000 04300000 00000000 f8320f01 463a0000 87f4f401
ffff000103558cc0 1179953673 S Bi:6:002:1 -115 32768 <
ffff00014c2bf900 1179954916 C Bi:6:002:1 0 374 = 3e010484 00000f80 07076000 04300000 00000000 cb370f01 423c0000 8affff01
ffff00014c2bf900 1179954940 S Bi:6:002:1 -115 32768 <
ffff00013d62e840 1179955896 C Bi:6:002:1 0 384 = 48010484 00000f80 d7096000 04300000 00000000 913b0f01 463a0000 8aefef01
ffff00013d62e840 1179955920 S Bi:6:002:1 -115 32768 <
ffff000103533900 1180054221 C Bi:6:002:1 0 383 = 47010484 00000f80 080b6000 04300000 00000000 f4bb1001 463a0000 89f5f501
ffff000103533900 1180054247 S Bi:6:002:1 -115 32768 <
ffff000103558cc0 1180055188 C Bi:6:002:1 0 376 = 40010484 00000f80 75026000 04300000 00000000 d8bf1001 463a0000 89f5f501
ffff000103558cc0 1180055212 S Bi:6:002:1 -115 32768 <
ffff00014c2bf900 1180055968 C Bi:6:002:1 0 351 = 27010484 00000f80 350c6000 04300000 00000000 04c31001 463c0000 87f0f001
ffff00014c2bf900 1180055992 S Bi:6:002:1 -115 32768 <
ffff00013d62e840 1180056791 C Bi:6:002:1 0 374 = 3e010484 00000f80 08076000 04300000 00000000 0bc61001 463a0000 86f2f201
ffff00013d62e840 1180056814 S Bi:6:002:1 -115 32768 <
ffff000103558600 1180069537 S Ci:6:002:0 s c0 05 0454 0000 0001 1 <
ffff000103558600 1180069637 C Ci:6:002:0 0 1 = 00
ffff000103558600 1180069775 S Ci:6:002:0 s c0 05 0860 0000 0004 4 <
ffff000103558600 1180069827 C Ci:6:002:0 0 4 = 21c3d572
ffff000103558600 1180069944 S Co:6:002:0 s 40 05 0860 0000 0004 4 = 21c3d572
ffff000103558600 1180069978 C Co:6:002:0 0 4 >
ffff000103558600 1180070097 S Ci:6:002:0 s c0 05 0c00 0000 0004 4 <
ffff000103558600 1180070153 C Ci:6:002:0 0 4 = 07000000
ffff000103558600 1180070270 S Ci:6:002:0 s c0 05 08b0 0000 0004 4 <
ffff000103558600 1180070310 C Ci:6:002:0 0 4 = 42060000
ffff000103558600 1180070331 S Co:6:002:0 s 40 05 08b0 0000 0004 4 = 18060000
ffff000103558600 1180070360 C Co:6:002:0 0 4 >
ffff000103558600 1180070400 S Ci:6:002:0 s c0 05 0d04 0000 0004 4 <
ffff000103558600 1180070431 C Ci:6:002:0 0 4 = 017c90b1
ffff000103558600 1180070452 S Co:6:002:0 s 40 05 0c90 0000 0004 4 = 017c8001
ffff000103558600 1180070480 C Co:6:002:0 0 4 >
ffff000103558600 1180070512 S Ci:6:002:0 s c0 05 08ac 0000 0004 4 <
ffff000103558600 1180070544 C Ci:6:002:0 0 4 = 08faf00f
ffff000103558600 1180070562 S Co:6:002:0 s 40 05 08ac 0000 0004 4 = 08faf00f
ffff000103558600 1180070588 C Co:6:002:0 0 4 >
ffff000103558600 1180070606 S Ci:6:002:0 s c0 05 08ac 0000 0004 4 <
ffff000103558600 1180070654 C Ci:6:002:0 0 4 = 08faf00f
ffff000103558600 1180070672 S Co:6:002:0 s 40 05 08ac 0000 0004 4 = 08faf00f
ffff000103558600 1180070698 C Co:6:002:0 0 4 >
ffff000103558600 1180070716 S Ci:6:002:0 s c0 05 08c4 0000 0004 4 <
ffff000103558600 1180070749 C Ci:6:002:0 0 4 = 00000000
ffff000103558600 1180070768 S Co:6:002:0 s 40 05 08c4 0000 0004 4 = 00000000
ffff000103558600 1180070794 C Co:6:002:0 0 4 >
ffff000103558600 1180070813 S Ci:6:002:0 s c0 05 0c00 0000 0004 4 <
ffff000103558600 1180070844 C Ci:6:002:0 0 4 = 07000000
ffff000103558600 1180070863 S Ci:6:002:0 s c0 05 08b0 0000 0004 4 <
ffff000103558600 1180070904 C Ci:6:002:0 0 4 = 18060000
ffff000103558600 1180070922 S Co:6:002:0 s 40 05 08b0 0000 0004 4 = 18060000
ffff000103558600 1180070948 C Co:6:002:0 0 4 >
ffff000103558600 1180070986 S Ci:6:002:0 s c0 05 0d04 0000 0004 4 <
ffff000103558600 1180071028 C Ci:6:002:0 0 4 = 017c90b1
ffff000103558600 1180071047 S Co:6:002:0 s 40 05 0c90 0000 0004 4 = 017c8001
ffff000103558600 1180071073 C Co:6:002:0 0 4 >
ffff000103558600 1180071104 S Ci:6:002:0 s c0 05 0e00 0000 0004 4 <
ffff000103558600 1180071154 C Ci:6:002:0 0 4 = 07000000
ffff000103558600 1180071172 S Ci:6:002:0 s c0 05 08b0 0000 0004 4 <
ffff000103558600 1180071204 C Ci:6:002:0 0 4 = 18060000
ffff000103558600 1180071223 S Co:6:002:0 s 40 05 08b0 0000 0004 4 = 18060000
ffff000103558600 1180071269 C Co:6:002:0 0 4 >
ffff000103558600 1180071308 S Ci:6:002:0 s c0 05 0d44 0000 0004 4 <
ffff000103558600 1180071339 C Ci:6:002:0 0 4 = 017c90b1
ffff000103558600 1180071358 S Co:6:002:0 s 40 05 0e90 0000 0004 4 = 017c8001
ffff000103558600 1180071401 C Co:6:002:0 0 4 >
ffff000103558600 1180071433 S Ci:6:002:0 s c0 05 08ac 0000 0004 4 <
ffff000103558600 1180071464 C Ci:6:002:0 0 4 = 08faf00f
ffff000103558600 1180071484 S Co:6:002:0 s 40 05 08ac 0000 0004 4 = 08faf00f
ffff000103558600 1180071526 C Co:6:002:0 0 4 >
ffff000103558600 1180071545 S Ci:6:002:0 s c0 05 08ac 0000 0004 4 <
ffff000103558600 1180071576 C Ci:6:002:0 0 4 = 08faf00f
ffff000103558600 1180071595 S Co:6:002:0 s 40 05 08ac 0000 0004 4 = 08faf00f
ffff000103558600 1180071622 C Co:6:002:0 0 4 >
ffff000103558600 1180071640 S Ci:6:002:0 s c0 05 08c4 0000 0004 4 <
ffff000103558600 1180071672 C Ci:6:002:0 0 4 = 00000000
ffff000103558600 1180071690 S Co:6:002:0 s 40 05 08c4 0000 0004 4 = 00000000
ffff000103558600 1180071718 C Co:6:002:0 0 4 >
ffff000103558600 1180071736 S Ci:6:002:0 s c0 05 0e00 0000 0004 4 <
ffff000103558600 1180071779 C Ci:6:002:0 0 4 = 07000000
ffff000103558600 1180071797 S Ci:6:002:0 s c0 05 08b0 0000 0004 4 <
ffff000103558600 1180071830 C Ci:6:002:0 0 4 = 18060000
ffff000103558600 1180071848 S Co:6:002:0 s 40 05 08b0 0000 0004 4 = 18060000
ffff000103558600 1180071876 C Co:6:002:0 0 4 >
ffff000103558600 1180071914 S Ci:6:002:0 s c0 05 0d44 0000 0004 4 <
ffff000103558600 1180071946 C Ci:6:002:0 0 4 = 017c90b1
ffff000103558600 1180071964 S Co:6:002:0 s 40 05 0e90 0000 0004 4 = 017c8001
ffff000103558600 1180071992 C Co:6:002:0 0 4 >
ffff000103558600 1180072044 S Ci:6:002:0 s c0 05 0668 0000 0002 2 <
ffff000103558600 1180072083 C Ci:6:002:0 0 2 = 0010
ffff000103558600 1180072109 S Co:6:002:0 s 40 05 0668 0000 0002 2 = 0010
ffff000103558600 1180072153 C Co:6:002:0 0 2 >
ffff000103558600 1180072175 S Co:6:002:0 s 40 05 0483 0000 0001 1 = 00
ffff000103558600 1180072209 C Co:6:002:0 0 1 >
ffff000103558600 1180072230 S Ci:6:002:0 s c0 05 0837 0000 0001 1 <
ffff000103558600 1180072281 C Ci:6:002:0 0 1 = 00
ffff000103558600 1180072307 S Ci:6:002:0 s c0 05 08ac 0000 0004 4 <
ffff000103558600 1180072343 C Ci:6:002:0 0 4 = 08faf00f
ffff000103558600 1180072367 S Co:6:002:0 s 40 05 08ac 0000 0004 4 = 08faf00f
ffff000103558600 1180072404 C Co:6:002:0 0 4 >
ffff000103558600 1180072428 S Ci:6:002:0 s c0 05 08c4 0000 0004 4 <
ffff000103558600 1180072464 C Ci:6:002:0 0 4 = 00000000
ffff000103558600 1180072487 S Co:6:002:0 s 40 05 08c4 0000 0004 4 = 00000000
ffff000103558600 1180072529 C Co:6:002:0 0 4 >
ffff000103558600 1180072552 S Ci:6:002:0 s c0 05 0848 0000 0004 4 <
ffff000103558600 1180072589 C Ci:6:002:0 0 4 = 8bffd061
ffff000103558600 1180072613 S Co:6:002:0 s 40 05 0848 0000 0004 4 = 8bffd061
ffff000103558600 1180072654 C Co:6:002:0 0 4 >
ffff000103558600 1180072678 S Ci:6:002:0 s c0 05 08ac 0000 0004 4 <
ffff000103558600 1180072715 C Ci:6:002:0 0 4 = 08faf00f
ffff000103558600 1180072739 S Co:6:002:0 s 40 05 08ac 0000 0004 4 = 08faf00f
ffff000103558600 1180072779 C Co:6:002:0 0 4 >
ffff000103558600 1180072803 S Ci:6:002:0 s c0 05 08ac 0000 0004 4 <
ffff000103558600 1180072839 C Ci:6:002:0 0 4 = 08faf00f
ffff000103558600 1180072863 S Co:6:002:0 s 40 05 08ac 0000 0004 4 = 08faf00f
ffff000103558600 1180072904 C Co:6:002:0 0 4 >
ffff000103558600 1180072928 S Ci:6:002:0 s c0 05 08c4 0000 0004 4 <
ffff000103558600 1180072965 C Ci:6:002:0 0 4 = 00000000
ffff000103558600 1180072989 S Co:6:002:0 s 40 05 08c4 0000 0004 4 = 00000000
ffff000103558600 1180073029 C Co:6:002:0 0 4 >
ffff000103558600 1180073053 S Ci:6:002:0 s c0 05 0c00 0000 0004 4 <
ffff000103558600 1180073090 C Ci:6:002:0 0 4 = 07000000
ffff000103558600 1180073114 S Ci:6:002:0 s c0 05 08b0 0000 0004 4 <
ffff000103558600 1180073158 C Ci:6:002:0 0 4 = 18060000
ffff000103558600 1180073182 S Co:6:002:0 s 40 05 08b0 0000 0004 4 = 18060000
ffff000103558600 1180073212 C Co:6:002:0 0 4 >
ffff000103558600 1180073256 S Ci:6:002:0 s c0 05 0d04 0000 0004 4 <
ffff000103558600 1180073293 C Ci:6:002:0 0 4 = 017c90b1
ffff000103558600 1180073316 S Co:6:002:0 s 40 05 0c90 0000 0004 4 = 017c8001
ffff000103558600 1180073347 C Co:6:002:0 0 4 >
ffff000103558600 1180073383 S Ci:6:002:0 s c0 05 0e00 0000 0004 4 <
ffff000103558600 1180073420 C Ci:6:002:0 0 4 = 07000000
ffff000103558600 1180073444 S Ci:6:002:0 s c0 05 08b0 0000 0004 4 <
ffff000103558600 1180073481 C Ci:6:002:0 0 4 = 18060000
ffff000103558600 1180073505 S Co:6:002:0 s 40 05 08b0 0000 0004 4 = 18060000
ffff000103558600 1180073535 C Co:6:002:0 0 4 >
ffff000103558600 1180073579 S Ci:6:002:0 s c0 05 0d44 0000 0004 4 <
ffff000103558600 1180073616 C Ci:6:002:0 0 4 = 017c90b1
ffff000103558600 1180073640 S Co:6:002:0 s 40 05 0e90 0000 0004 4 = 017c8001
ffff000103558600 1180073670 C Co:6:002:0 0 4 >
ffff000103558600 1180073728 S Ci:6:002:0 s c0 05 0c20 0000 0004 4 <
ffff000103558600 1180073783 C Ci:6:002:0 0 4 = 13131313
ffff000103558600 1180073807 S Co:6:002:0 s 40 05 0c20 0000 0004 4 = 13131313
ffff000103558600 1180073837 C Co:6:002:0 0 4 >
ffff000103558600 1180073861 S Ci:6:002:0 s c0 05 0c24 0000 0004 4 <
ffff000103558600 1180073908 C Ci:6:002:0 0 4 = 20202020
ffff000103558600 1180073932 S Co:6:002:0 s 40 05 0c24 0000 0004 4 = 20202020
ffff000103558600 1180073963 C Co:6:002:0 0 4 >
ffff000103558600 1180073986 S Ci:6:002:0 s c0 05 0c28 0000 0004 4 <
ffff000103558600 1180074033 C Ci:6:002:0 0 4 = 20201e1c
ffff000103558600 1180074057 S Co:6:002:0 s 40 05 0c28 0000 0004 4 = 20201e1c
ffff000103558600 1180074088 C Co:6:002:0 0 4 >
ffff000103558600 1180074112 S Ci:6:002:0 s c0 05 0c2c 0000 0004 4 <
ffff000103558600 1180074159 C Ci:6:002:0 0 4 = 20202020
ffff000103558600 1180074182 S Co:6:002:0 s 40 05 0c2c 0000 0004 4 = 20202020
ffff000103558600 1180074213 C Co:6:002:0 0 4 >
ffff000103558600 1180074236 S Ci:6:002:0 s c0 05 0c30 0000 0004 4 <
ffff000103558600 1180074284 C Ci:6:002:0 0 4 = 20201e1c
ffff000103558600 1180074307 S Co:6:002:0 s 40 05 0c30 0000 0004 4 = 20201e1c
ffff000103558600 1180074338 C Co:6:002:0 0 4 >
ffff000103558600 1180074361 S Ci:6:002:0 s c0 05 0c34 0000 0004 4 <
ffff000103558600 1180074408 C Ci:6:002:0 0 4 = 20202020
ffff000103558600 1180074432 S Co:6:002:0 s 40 05 0c34 0000 0004 4 = 20202020
ffff000103558600 1180074464 C Co:6:002:0 0 4 >
ffff000103558600 1180074487 S Ci:6:002:0 s c0 05 0c38 0000 0004 4 <
ffff000103558600 1180074531 C Ci:6:002:0 0 4 = 201e1c1a
ffff000103558600 1180074554 S Co:6:002:0 s 40 05 0c38 0000 0004 4 = 201e1c1a
ffff000103558600 1180074585 C Co:6:002:0 0 4 >
ffff000103558600 1180074608 S Ci:6:002:0 s c0 05 0c3c 0000 0004 4 <
ffff000103558600 1180074656 C Ci:6:002:0 0 4 = 20202020
ffff000103558600 1180074679 S Co:6:002:0 s 40 05 0c3c 0000 0004 4 = 20202020
ffff000103558600 1180074710 C Co:6:002:0 0 4 >
ffff000103558600 1180074734 S Ci:6:002:0 s c0 05 0c40 0000 0004 4 <
ffff000103558600 1180074781 C Ci:6:002:0 0 4 = 20201e1c
ffff000103558600 1180074805 S Co:6:002:0 s 40 05 0c40 0000 0004 4 = 20201e1c
ffff000103558600 1180074836 C Co:6:002:0 0 4 >
ffff000103558600 1180074859 S Ci:6:002:0 s c0 05 0c44 0000 0004 4 <
ffff000103558600 1180074906 C Ci:6:002:0 0 4 = 1a181e1e
ffff000103558600 1180074929 S Co:6:002:0 s 40 05 0c44 0000 0004 4 = 1a181e1e
ffff000103558600 1180074960 C Co:6:002:0 0 4 >
ffff000103558600 1180074983 S Ci:6:002:0 s c0 05 0c48 0000 0004 4 <
ffff000103558600 1180075031 C Ci:6:002:0 0 4 = 1e1e1e1e
ffff000103558600 1180075054 S Co:6:002:0 s 40 05 0c48 0000 0004 4 = 1e1e1e1e
ffff000103558600 1180075085 C Co:6:002:0 0 4 >
ffff000103558600 1180075108 S Ci:6:002:0 s c0 05 0c4c 0000 0004 4 <
ffff000103558600 1180075156 C Ci:6:002:0 0 4 = 1c1a1816
ffff000103558600 1180075179 S Co:6:002:0 s 40 05 0c4c 0000 0004 4 = 1c1a1816
ffff000103558600 1180075210 C Co:6:002:0 0 4 >
ffff000103558600 1180075233 S Ci:6:002:0 s c0 05 0c54 0000 0004 4 <
ffff000103558600 1180075281 C Ci:6:002:0 0 4 = 120a0400
ffff000103558600 1180075304 S Co:6:002:0 s 40 05 0c54 0000 0004 4 = 120a0400
ffff000103558600 1180075335 C Co:6:002:0 0 4 >
ffff000103558600 1180075358 S Ci:6:002:0 s c0 05 0e20 0000 0004 4 <
ffff000103558600 1180075406 C Ci:6:002:0 0 4 = 14141414
ffff000103558600 1180075429 S Co:6:002:0 s 40 05 0e20 0000 0004 4 = 14141414
ffff000103558600 1180075460 C Co:6:002:0 0 4 >
ffff000103558600 1180075483 S Ci:6:002:0 s c0 05 0e24 0000 0004 4 <
ffff000103558600 1180075531 C Ci:6:002:0 0 4 = 1d1d1d1d
ffff000103558600 1180075555 S Co:6:002:0 s 40 05 0e24 0000 0004 4 = 1d1d1d1d
ffff000103558600 1180075585 C Co:6:002:0 0 4 >
ffff000103558600 1180075608 S Ci:6:002:0 s c0 05 0e28 0000 0004 4 <
ffff000103558600 1180075656 C Ci:6:002:0 0 4 = 1d1d1b19
ffff000103558600 1180075679 S Co:6:002:0 s 40 05 0e28 0000 0004 4 = 1d1d1b19
ffff000103558600 1180075710 C Co:6:002:0 0 4 >
ffff000103558600 1180075733 S Ci:6:002:0 s c0 05 0e2c 0000 0004 4 <
ffff000103558600 1180075781 C Ci:6:002:0 0 4 = 1f1f1f1f
ffff000103558600 1180075805 S Co:6:002:0 s 40 05 0e2c 0000 0004 4 = 1f1f1f1f
ffff000103558600 1180075836 C Co:6:002:0 0 4 >
ffff000103558600 1180075859 S Ci:6:002:0 s c0 05 0e30 0000 0004 4 <
ffff000103558600 1180075906 C Ci:6:002:0 0 4 = 1f1f1d1b
ffff000103558600 1180075930 S Co:6:002:0 s 40 05 0e30 0000 0004 4 = 1f1f1d1b
ffff000103558600 1180075960 C Co:6:002:0 0 4 >
ffff000103558600 1180075983 S Ci:6:002:0 s c0 05 0e34 0000 0004 4 <
ffff000103558600 1180076037 C Ci:6:002:0 0 4 = 1f1f1f1f
ffff000103558600 1180076062 S Co:6:002:0 s 40 05 0e34 0000 0004 4 = 1f1f1f1f
ffff000103558600 1180076092 C Co:6:002:0 0 4 >
ffff000103558600 1180076107 S Ci:6:002:0 s c0 05 0e38 0000 0004 4 <
ffff000103558600 1180076156 C Ci:6:002:0 0 4 = 1f1d1b19
ffff000103558600 1180076180 S Co:6:002:0 s 40 05 0e38 0000 0004 4 = 1f1d1b19
ffff000103558600 1180076211 C Co:6:002:0 0 4 >
ffff000103558600 1180076234 S Ci:6:002:0 s c0 05 0e3c 0000 0004 4 <
ffff000103558600 1180076281 C Ci:6:002:0 0 4 = 1f1f1f1f
ffff000103558600 1180076305 S Co:6:002:0 s 40 05 0e3c 0000 0004 4 = 1f1f1f1f
ffff000103558600 1180076336 C Co:6:002:0 0 4 >
ffff000103558600 1180076360 S Ci:6:002:0 s c0 05 0e40 0000 0004 4 <
ffff000103558600 1180076407 C Ci:6:002:0 0 4 = 1f1f1d1b
ffff000103558600 1180076430 S Co:6:002:0 s 40 05 0e40 0000 0004 4 = 1f1f1d1b
ffff000103558600 1180076460 C Co:6:002:0 0 4 >
ffff000103558600 1180076484 S Ci:6:002:0 s c0 05 0e44 0000 0004 4 <
ffff000103558600 1180076532 C Ci:6:002:0 0 4 = 19171d1d
ffff000103558600 1180076555 S Co:6:002:0 s 40 05 0e44 0000 0004 4 = 19171d1d
ffff000103558600 1180076586 C Co:6:002:0 0 4 >
ffff000103558600 1180076610 S Ci:6:002:0 s c0 05 0e48 0000 0004 4 <
ffff000103558600 1180076656 C Ci:6:002:0 0 4 = 1d1d1d1d
ffff000103558600 1180076680 S Co:6:002:0 s 40 05 0e48 0000 0004 4 = 1d1d1d1d
ffff000103558600 1180076710 C Co:6:002:0 0 4 >
ffff000103558600 1180076733 S Ci:6:002:0 s c0 05 0e4c 0000 0004 4 <
ffff000103558600 1180076781 C Ci:6:002:0 0 4 = 1b191715
ffff000103558600 1180076805 S Co:6:002:0 s 40 05 0e4c 0000 0004 4 = 1b191715
ffff000103558600 1180076835 C Co:6:002:0 0 4 >
ffff000103558600 1180076858 S Ci:6:002:0 s c0 05 0e54 0000 0004 4 <
ffff000103558600 1180076907 C Ci:6:002:0 0 4 = 11090300
ffff000103558600 1180076931 S Co:6:002:0 s 40 05 0e54 0000 0004 4 = 11090300
ffff000103558600 1180076962 C Co:6:002:0 0 4 >
ffff000103558600 1180076997 S Ci:6:002:0 s c0 05 0454 0000 0001 1 <
ffff000103558600 1180077032 C Ci:6:002:0 0 1 = 00
ffff000103558600 1180077056 S Ci:6:002:0 s c0 05 0454 0000 0001 1 <
ffff000103558600 1180077091 C Ci:6:002:0 0 1 = 00
ffff000103558600 1180077115 S Co:6:002:0 s 40 05 0454 0000 0001 1 = 80
ffff000103558600 1180077154 C Co:6:002:0 0 1 >
ffff000103558600 1180077178 S Ci:6:002:0 s c0 05 041a 0000 0002 2 <
ffff000103558600 1180077213 C Ci:6:002:0 0 2 = ff0f
ffff000103558600 1180077236 S Ci:6:002:0 s c0 05 0808 0000 0004 4 <
ffff000103558600 1180077282 C Ci:6:002:0 0 4 = 3382023e
ffff000103558600 1180077305 S Co:6:002:0 s 40 05 0808 0000 0004 4 = 3382023e
ffff000103558600 1180077336 C Co:6:002:0 0 4 >
ffff000103558600 1180077359 S Ci:6:002:0 s c0 05 0834 0000 0004 4 <
ffff000103558600 1180077407 C Ci:6:002:0 0 4 = 05a73700
ffff000103558600 1180077430 S Co:6:002:0 s 40 05 0834 0000 0004 4 = 06a73700
ffff000103558600 1180077461 C Co:6:002:0 0 4 >
ffff000103558600 1180077484 S Ci:6:002:0 s c0 05 0830 0000 0004 4 <
ffff000103558600 1180077531 C Ci:6:002:0 0 4 = b8eeaa2e
ffff000103558600 1180077555 S Co:6:002:0 s 40 05 0830 0000 0004 4 = b8aeaa2e
ffff000103558600 1180077585 C Co:6:002:0 0 4 >
ffff000103558600 1180077609 S Ci:6:002:0 s c0 05 0830 0000 0004 4 <
ffff000103558600 1180077657 C Ci:6:002:0 0 4 = b8aeaa2e
ffff000103558600 1180077680 S Co:6:002:0 s 40 05 0830 0000 0004 4 = b8aeaa2e
ffff000103558600 1180077711 C Co:6:002:0 0 4 >
ffff000103558600 1180077734 S Ci:6:002:0 s c0 05 082c 0000 0004 4 <
ffff000103558600 1180077782 C Ci:6:002:0 0 4 = dc832000
ffff000103558600 1180077805 S Co:6:002:0 s 40 05 082c 0000 0004 4 = dd832000
ffff000103558600 1180077835 C Co:6:002:0 0 4 >
ffff000103558600 1180077860 S Co:6:002:0 s 40 05 0cb0 0000 0004 4 = 17773354
ffff000103558600 1180077904 C Co:6:002:0 0 4 >
ffff000103558600 1180077927 S Co:6:002:0 s 40 05 0eb0 0000 0004 4 = 17773354
ffff000103558600 1180077958 C Co:6:002:0 0 4 >
ffff000103558600 1180077981 S Ci:6:002:0 s c0 05 0cb4 0000 0004 4 <
ffff000103558600 1180078032 C Ci:6:002:0 0 4 = 77000001
ffff000103558600 1180078056 S Co:6:002:0 s 40 05 0cb4 0000 0004 4 = 77000001
ffff000103558600 1180078087 C Co:6:002:0 0 4 >
ffff000103558600 1180078110 S Ci:6:002:0 s c0 05 0eb4 0000 0004 4 <
ffff000103558600 1180078157 C Ci:6:002:0 0 4 = 77000001
ffff000103558600 1180078181 S Co:6:002:0 s 40 05 0eb4 0000 0004 4 = 77000001
ffff000103558600 1180078212 C Co:6:002:0 0 4 >
ffff000103558600 1180078235 S Ci:6:002:0 s c0 05 0900 0000 0004 4 <
ffff000103558600 1180078282 C Ci:6:002:0 0 4 = 01040000
ffff000103558600 1180078306 S Co:6:002:0 s 40 05 0900 0000 0004 4 = 01040000
ffff000103558600 1180078336 C Co:6:002:0 0 4 >
ffff000103558600 1180078359 S Ci:6:002:0 s c0 05 080c 0000 0004 4 <
ffff000103558600 1180078407 C Ci:6:002:0 0 4 = 13111312
ffff000103558600 1180078430 S Co:6:002:0 s 40 05 080c 0000 0004 4 = 03111312
ffff000103558600 1180078461 C Co:6:002:0 0 4 >
ffff000103558600 1180078485 S Ci:6:002:0 s c0 05 0a04 0000 0004 4 <
ffff000103558600 1180078532 C Ci:6:002:0 0 4 = 0c00ff01
ffff000103558600 1180078555 S Co:6:002:0 s 40 05 0a04 0000 0004 4 = 0c00ff0f
ffff000103558600 1180078586 C Co:6:002:0 0 4 >
ffff000103558600 1180078609 S Ci:6:002:0 s c0 05 0440 0000 0004 4 <
ffff000103558600 1180078657 C Ci:6:002:0 0 4 = 00000000
ffff000103558600 1180078681 S Co:6:002:0 s 40 05 0440 0000 0004 4 = 50010000
ffff000103558600 1180078711 C Co:6:002:0 0 4 >
ffff000103558600 1180078735 S Ci:6:002:0 s c0 05 0c1c 0000 0004 4 <
ffff000103558600 1180078782 C Ci:6:002:0 0 4 = 03000040
ffff000103558600 1180078806 S Co:6:002:0 s 40 05 0c1c 0000 0004 4 = 0300402d
ffff000103558600 1180078836 C Co:6:002:0 0 4 >
ffff000103558600 1180078860 S Ci:6:002:0 s c0 05 0e1c 0000 0004 4 <
ffff000103558600 1180078907 C Ci:6:002:0 0 4 = 03000040
ffff000103558600 1180078931 S Co:6:002:0 s 40 05 0e1c 0000 0004 4 = 0300402d
ffff000103558600 1180078961 C Co:6:002:0 0 4 >
ffff000103558600 1180078985 S Ci:6:002:0 s c0 05 0860 0000 0004 4 <
ffff000103558600 1180079033 C Ci:6:002:0 0 4 = 21c3d572
ffff000103558600 1180079056 S Co:6:002:0 s 40 05 0860 0000 0004 4 = 21c3a768
ffff000103558600 1180079087 C Co:6:002:0 0 4 >
ffff000103558600 1180079111 S Ci:6:002:0 s c0 05 0c00 0000 0004 4 <
ffff000103558600 1180079157 C Ci:6:002:0 0 4 = 07000000
ffff000103558600 1180079181 S Ci:6:002:0 s c0 05 08b0 0000 0004 4 <
ffff000103558600 1180079217 C Ci:6:002:0 0 4 = 18060000
ffff000103558600 1180079240 S Co:6:002:0 s 40 05 08b0 0000 0004 4 = 18060000
ffff000103558600 1180079279 C Co:6:002:0 0 4 >
ffff000103558600 1180079323 S Ci:6:002:0 s c0 05 0d04 0000 0004 4 <
ffff000103558600 1180079359 C Ci:6:002:0 0 4 = 017c90b1
ffff000103558600 1180079382 S Co:6:002:0 s 40 05 0c90 0000 0004 4 = 017d8101
ffff000103558600 1180079413 C Co:6:002:0 0 4 >
ffff000103558600 1180079449 S Ci:6:002:0 s c0 05 08ac 0000 0004 4 <
ffff000103558600 1180079485 C Ci:6:002:0 0 4 = 08faf00f
ffff000103558600 1180079509 S Co:6:002:0 s 40 05 08ac 0000 0004 4 = 08faf00f
ffff000103558600 1180079539 C Co:6:002:0 0 4 >
ffff000103558600 1180079562 S Ci:6:002:0 s c0 05 08ac 0000 0004 4 <
ffff000103558600 1180079598 C Ci:6:002:0 0 4 = 08faf00f
ffff000103558600 1180079622 S Co:6:002:0 s 40 05 08ac 0000 0004 4 = 08faf00f
ffff000103558600 1180079654 C Co:6:002:0 0 4 >
ffff000103558600 1180079677 S Ci:6:002:0 s c0 05 08c4 0000 0004 4 <
ffff000103558600 1180079713 C Ci:6:002:0 0 4 = 00000000
ffff000103558600 1180079737 S Co:6:002:0 s 40 05 08c4 0000 0004 4 = 00000000
ffff000103558600 1180079779 C Co:6:002:0 0 4 >
ffff000103558600 1180079803 S Ci:6:002:0 s c0 05 0c00 0000 0004 4 <
ffff000103558600 1180079841 C Ci:6:002:0 0 4 = 07000000
ffff000103558600 1180079864 S Ci:6:002:0 s c0 05 08b0 0000 0004 4 <
ffff000103558600 1180079908 C Ci:6:002:0 0 4 = 18060000
ffff000103558600 1180079931 S Co:6:002:0 s 40 05 08b0 0000 0004 4 = 18060000
ffff000103558600 1180079962 C Co:6:002:0 0 4 >
ffff000103558600 1180080009 S Ci:6:002:0 s c0 05 0d04 0000 0004 4 <
ffff000103558600 1180080047 C Ci:6:002:0 0 4 = 017d91b1
ffff000103558600 1180080072 S Co:6:002:0 s 40 05 0c90 0000 0004 4 = 407d8101
ffff000103558600 1180080103 C Co:6:002:0 0 4 >
ffff000103558600 1180080140 S Ci:6:002:0 s c0 05 0e00 0000 0004 4 <
ffff000103558600 1180080176 C Ci:6:002:0 0 4 = 07000000
ffff000103558600 1180080200 S Ci:6:002:0 s c0 05 08b0 0000 0004 4 <
ffff000103558600 1180080237 C Ci:6:002:0 0 4 = 18060000
ffff000103558600 1180080260 S Co:6:002:0 s 40 05 08b0 0000 0004 4 = 18060000
ffff000103558600 1180080291 C Co:6:002:0 0 4 >
ffff000103558600 1180080335 S Ci:6:002:0 s c0 05 0d44 0000 0004 4 <
ffff000103558600 1180080371 C Ci:6:002:0 0 4 = 017c90b1
ffff000103558600 1180080394 S Co:6:002:0 s 40 05 0e90 0000 0004 4 = 017d8101
ffff000103558600 1180080425 C Co:6:002:0 0 4 >
ffff000103558600 1180080462 S Ci:6:002:0 s c0 05 08ac 0000 0004 4 <
ffff000103558600 1180080497 C Ci:6:002:0 0 4 = 08faf00f
ffff000103558600 1180080521 S Co:6:002:0 s 40 05 08ac 0000 0004 4 = 08faf00f
ffff000103558600 1180080551 C Co:6:002:0 0 4 >
ffff000103558600 1180080574 S Ci:6:002:0 s c0 05 08ac 0000 0004 4 <
ffff000103558600 1180080611 C Ci:6:002:0 0 4 = 08faf00f
ffff000103558600 1180080634 S Co:6:002:0 s 40 05 08ac 0000 0004 4 = 08faf00f
ffff000103558600 1180080665 C Co:6:002:0 0 4 >
ffff000103558600 1180080688 S Ci:6:002:0 s c0 05 08c4 0000 0004 4 <
ffff000103558600 1180080724 C Ci:6:002:0 0 4 = 00000000
ffff000103558600 1180080747 S Co:6:002:0 s 40 05 08c4 0000 0004 4 = 00000000
ffff000103558600 1180080779 C Co:6:002:0 0 4 >
ffff000103558600 1180080802 S Ci:6:002:0 s c0 05 0e00 0000 0004 4 <
ffff000103558600 1180080839 C Ci:6:002:0 0 4 = 07000000
ffff000103558600 1180080862 S Ci:6:002:0 s c0 05 08b0 0000 0004 4 <
ffff000103558600 1180080908 C Ci:6:002:0 0 4 = 18060000
ffff000103558600 1180080931 S Co:6:002:0 s 40 05 08b0 0000 0004 4 = 18060000
ffff000103558600 1180080961 C Co:6:002:0 0 4 >
ffff000103558600 1180081005 S Ci:6:002:0 s c0 05 0d44 0000 0004 4 <
ffff000103558600 1180081042 C Ci:6:002:0 0 4 = 017d91b1
ffff000103558600 1180081065 S Co:6:002:0 s 40 05 0e90 0000 0004 4 = 407d8101
ffff000103558600 1180081096 C Co:6:002:0 0 4 >
ffff000103558600 1180081132 S Ci:6:002:0 s c0 05 0668 0000 0002 2 <
ffff000103558600 1180081169 C Ci:6:002:0 0 2 = 0010
ffff000103558600 1180081192 S Co:6:002:0 s 40 05 0668 0000 0002 2 = 0010
ffff000103558600 1180081222 C Co:6:002:0 0 2 >
ffff000103558600 1180081246 S Co:6:002:0 s 40 05 0483 0000 0001 1 = 00
ffff000103558600 1180081279 C Co:6:002:0 0 1 >
ffff000103558600 1180081303 S Ci:6:002:0 s c0 05 0837 0000 0001 1 <
ffff000103558600 1180081340 C Ci:6:002:0 0 1 = 00
ffff000103558600 1180081363 S Ci:6:002:0 s c0 05 08ac 0000 0004 4 <
ffff000103558600 1180081408 C Ci:6:002:0 0 4 = 08faf00f
ffff000103558600 1180081432 S Co:6:002:0 s 40 05 08ac 0000 0004 4 = 08faf00f
ffff000103558600 1180081462 C Co:6:002:0 0 4 >
ffff000103558600 1180081485 S Ci:6:002:0 s c0 05 08c4 0000 0004 4 <
ffff000103558600 1180081533 C Ci:6:002:0 0 4 = 00000000
ffff000103558600 1180081556 S Co:6:002:0 s 40 05 08c4 0000 0004 4 = 00000000
ffff000103558600 1180081587 C Co:6:002:0 0 4 >
ffff000103558600 1180081610 S Ci:6:002:0 s c0 05 0848 0000 0004 4 <
ffff000103558600 1180081659 C Ci:6:002:0 0 4 = 8bffd061
ffff000103558600 1180081682 S Co:6:002:0 s 40 05 0848 0000 0004 4 = 8bffd061
ffff000103558600 1180081712 C Co:6:002:0 0 4 >
ffff000103558600 1180081735 S Ci:6:002:0 s c0 05 08ac 0000 0004 4 <
ffff000103558600 1180081783 C Ci:6:002:0 0 4 = 08faf00f
ffff000103558600 1180081807 S Co:6:002:0 s 40 05 08ac 0000 0004 4 = 08faf00f
ffff000103558600 1180081837 C Co:6:002:0 0 4 >
ffff000103558600 1180081860 S Ci:6:002:0 s c0 05 08ac 0000 0004 4 <
ffff000103558600 1180081908 C Ci:6:002:0 0 4 = 08faf00f
ffff000103558600 1180081931 S Co:6:002:0 s 40 05 08ac 0000 0004 4 = 08faf00f
ffff000103558600 1180081963 C Co:6:002:0 0 4 >
ffff000103558600 1180081986 S Ci:6:002:0 s c0 05 08c4 0000 0004 4 <
ffff000103558600 1180082033 C Ci:6:002:0 0 4 = 00000000
ffff000103558600 1180082056 S Co:6:002:0 s 40 05 08c4 0000 0004 4 = 00000000
ffff000103558600 1180082087 C Co:6:002:0 0 4 >
ffff000103558600 1180082111 S Ci:6:002:0 s c0 05 0c00 0000 0004 4 <
ffff000103558600 1180082158 C Ci:6:002:0 0 4 = 07000000
ffff000103558600 1180082182 S Ci:6:002:0 s c0 05 08b0 0000 0004 4 <
ffff000103558600 1180082216 C Ci:6:002:0 0 4 = 18060000
ffff000103558600 1180082238 S Co:6:002:0 s 40 05 08b0 0000 0004 4 = 18060000
ffff000103558600 1180082279 C Co:6:002:0 0 4 >
ffff000103558600 1180082322 S Ci:6:002:0 s c0 05 0d04 0000 0004 4 <
ffff000103558600 1180082355 C Ci:6:002:0 0 4 = 407d91b1
ffff000103558600 1180082379 S Co:6:002:0 s 40 05 0c90 0000 0004 4 = 407d8101
ffff000103558600 1180082409 C Co:6:002:0 0 4 >
ffff000103558600 1180082446 S Ci:6:002:0 s c0 05 0e00 0000 0004 4 <
ffff000103558600 1180082479 C Ci:6:002:0 0 4 = 07000000
ffff000103558600 1180082503 S Ci:6:002:0 s c0 05 08b0 0000 0004 4 <
ffff000103558600 1180082536 C Ci:6:002:0 0 4 = 18060000
ffff000103558600 1180082559 S Co:6:002:0 s 40 05 08b0 0000 0004 4 = 18060000
ffff000103558600 1180082590 C Co:6:002:0 0 4 >
ffff000103558600 1180082633 S Ci:6:002:0 s c0 05 0d44 0000 0004 4 <
ffff000103558600 1180082666 C Ci:6:002:0 0 4 = 407d91b1
ffff000103558600 1180082690 S Co:6:002:0 s 40 05 0e90 0000 0004 4 = 407d8101
ffff000103558600 1180082720 C Co:6:002:0 0 4 >
ffff000103558600 1180082757 S Ci:6:002:0 s c0 05 0073 0000 0001 1 <
ffff000103558600 1180082791 C Ci:6:002:0 0 1 = 07
ffff000103558600 1180082814 S Co:6:002:0 s 40 05 0073 0000 0001 1 = 07
ffff000103558600 1180082845 C Co:6:002:0 0 1 >
ffff000103558600 1180082889 S Ci:6:002:0 s c0 05 0c24 0000 0004 4 <
ffff000103558600 1180082923 C Ci:6:002:0 0 4 = 20202020
ffff000103558600 1180082946 S Co:6:002:0 s 40 05 0c24 0000 0004 4 = 1e1e1e1e
ffff000103558600 1180082977 C Co:6:002:0 0 4 >
ffff000103558600 1180083000 S Ci:6:002:0 s c0 05 0c28 0000 0004 4 <
ffff000103558600 1180083034 C Ci:6:002:0 0 4 = 20201e1c
ffff000103558600 1180083057 S Co:6:002:0 s 40 05 0c28 0000 0004 4 = 1e1e1e1e
ffff000103558600 1180083088 C Co:6:002:0 0 4 >
ffff000103558600 1180083111 S Ci:6:002:0 s c0 05 0c2c 0000 0004 4 <
ffff000103558600 1180083156 C Ci:6:002:0 0 4 = 20202020
ffff000103558600 1180083180 S Co:6:002:0 s 40 05 0c2c 0000 0004 4 = 23232323
ffff000103558600 1180083210 C Co:6:002:0 0 4 >
ffff000103558600 1180083233 S Ci:6:002:0 s c0 05 0c30 0000 0004 4 <
ffff000103558600 1180083281 C Ci:6:002:0 0 4 = 20201e1c
ffff000103558600 1180083304 S Co:6:002:0 s 40 05 0c30 0000 0004 4 = 2323211f
ffff000103558600 1180083335 C Co:6:002:0 0 4 >
ffff000103558600 1180083358 S Ci:6:002:0 s c0 05 0c34 0000 0004 4 <
ffff000103558600 1180083406 C Ci:6:002:0 0 4 = 20202020
ffff000103558600 1180083430 S Co:6:002:0 s 40 05 0c34 0000 0004 4 = 1f1f1f1f
ffff000103558600 1180083463 C Co:6:002:0 0 4 >
ffff000103558600 1180083486 S Ci:6:002:0 s c0 05 0c38 0000 0004 4 <
ffff000103558600 1180083531 C Ci:6:002:0 0 4 = 201e1c1a
ffff000103558600 1180083554 S Co:6:002:0 s 40 05 0c38 0000 0004 4 = 1f1f1f1d
ffff000103558600 1180083585 C Co:6:002:0 0 4 >
ffff000103558600 1180083608 S Ci:6:002:0 s c0 05 0c3c 0000 0004 4 <
ffff000103558600 1180083656 C Ci:6:002:0 0 4 = 20202020
ffff000103558600 1180083679 S Co:6:002:0 s 40 05 0c3c 0000 0004 4 = 23232323
ffff000103558600 1180083710 C Co:6:002:0 0 4 >
ffff000103558600 1180083733 S Ci:6:002:0 s c0 05 0c40 0000 0004 4 <
ffff000103558600 1180083781 C Ci:6:002:0 0 4 = 20201e1c
ffff000103558600 1180083804 S Co:6:002:0 s 40 05 0c40 0000 0004 4 = 2323211f
ffff000103558600 1180083835 C Co:6:002:0 0 4 >
ffff000103558600 1180083858 S Ci:6:002:0 s c0 05 0c44 0000 0004 4 <
ffff000103558600 1180083906 C Ci:6:002:0 0 4 = 1a181e1e
ffff000103558600 1180083929 S Co:6:002:0 s 40 05 0c44 0000 0004 4 = 1d1d1f1f
ffff000103558600 1180083960 C Co:6:002:0 0 4 >
ffff000103558600 1180083982 S Ci:6:002:0 s c0 05 0c48 0000 0004 4 <
ffff000103558600 1180084032 C Ci:6:002:0 0 4 = 1e1e1e1e
ffff000103558600 1180084057 S Co:6:002:0 s 40 05 0c48 0000 0004 4 = 1f1f1f1f
ffff000103558600 1180084088 C Co:6:002:0 0 4 >
ffff000103558600 1180084111 S Ci:6:002:0 s c0 05 0c4c 0000 0004 4 <
ffff000103558600 1180084156 C Ci:6:002:0 0 4 = 1c1a1816
ffff000103558600 1180084181 S Co:6:002:0 s 40 05 0c4c 0000 0004 4 = 1f1d1b1b
ffff000103558600 1180084212 C Co:6:002:0 0 4 >
ffff000103558600 1180084235 S Ci:6:002:0 s c0 05 0c54 0000 0004 4 <
ffff000103558600 1180084281 C Ci:6:002:0 0 4 = 120a0400
ffff000103558600 1180084305 S Co:6:002:0 s 40 05 0c54 0000 0004 4 = 150d0700
ffff000103558600 1180084335 C Co:6:002:0 0 4 >
ffff000103558600 1180084359 S Ci:6:002:0 s c0 05 0e24 0000 0004 4 <
ffff000103558600 1180084407 C Ci:6:002:0 0 4 = 1d1d1d1d
ffff000103558600 1180084429 S Co:6:002:0 s 40 05 0e24 0000 0004 4 = 1e1e1e1e
ffff000103558600 1180084460 C Co:6:002:0 0 4 >
ffff000103558600 1180084483 S Ci:6:002:0 s c0 05 0e28 0000 0004 4 <
ffff000103558600 1180084531 C Ci:6:002:0 0 4 = 1d1d1b19
ffff000103558600 1180084555 S Co:6:002:0 s 40 05 0e28 0000 0004 4 = 1e1e1e1e
ffff000103558600 1180084585 C Co:6:002:0 0 4 >
ffff000103558600 1180084609 S Ci:6:002:0 s c0 05 0e2c 0000 0004 4 <
ffff000103558600 1180084657 C Ci:6:002:0 0 4 = 1f1f1f1f
ffff000103558600 1180084679 S Co:6:002:0 s 40 05 0e2c 0000 0004 4 = 23232323
ffff000103558600 1180084710 C Co:6:002:0 0 4 >
ffff000103558600 1180084733 S Ci:6:002:0 s c0 05 0e30 0000 0004 4 <
ffff000103558600 1180084781 C Ci:6:002:0 0 4 = 1f1f1d1b
ffff000103558600 1180084804 S Co:6:002:0 s 40 05 0e30 0000 0004 4 = 2323211f
ffff000103558600 1180084835 C Co:6:002:0 0 4 >
ffff000103558600 1180084858 S Ci:6:002:0 s c0 05 0e34 0000 0004 4 <
ffff000103558600 1180084906 C Ci:6:002:0 0 4 = 1f1f1f1f
ffff000103558600 1180084930 S Co:6:002:0 s 40 05 0e34 0000 0004 4 = 1f1f1f1f
ffff000103558600 1180084960 C Co:6:002:0 0 4 >
ffff000103558600 1180084983 S Ci:6:002:0 s c0 05 0e38 0000 0004 4 <
ffff000103558600 1180085032 C Ci:6:002:0 0 4 = 1f1d1b19
ffff000103558600 1180085055 S Co:6:002:0 s 40 05 0e38 0000 0004 4 = 1f1f1f1d
ffff000103558600 1180085086 C Co:6:002:0 0 4 >
ffff000103558600 1180085109 S Ci:6:002:0 s c0 05 0e3c 0000 0004 4 <
ffff000103558600 1180085156 C Ci:6:002:0 0 4 = 1f1f1f1f
ffff000103558600 1180085180 S Co:6:002:0 s 40 05 0e3c 0000 0004 4 = 23232323
ffff000103558600 1180085210 C Co:6:002:0 0 4 >
ffff000103558600 1180085233 S Ci:6:002:0 s c0 05 0e40 0000 0004 4 <
ffff000103558600 1180085282 C Ci:6:002:0 0 4 = 1f1f1d1b
ffff000103558600 1180085305 S Co:6:002:0 s 40 05 0e40 0000 0004 4 = 2323211f
ffff000103558600 1180085336 C Co:6:002:0 0 4 >
ffff000103558600 1180085359 S Ci:6:002:0 s c0 05 0e44 0000 0004 4 <
ffff000103558600 1180085407 C Ci:6:002:0 0 4 = 19171d1d
ffff000103558600 1180085430 S Co:6:002:0 s 40 05 0e44 0000 0004 4 = 1d1d1f1f
ffff000103558600 1180085461 C Co:6:002:0 0 4 >
ffff000103558600 1180085484 S Ci:6:002:0 s c0 05 0e48 0000 0004 4 <
ffff000103558600 1180085532 C Ci:6:002:0 0 4 = 1d1d1d1d
ffff000103558600 1180085555 S Co:6:002:0 s 40 05 0e48 0000 0004 4 = 1f1f1f1f
ffff000103558600 1180085585 C Co:6:002:0 0 4 >
ffff000103558600 1180085609 S Ci:6:002:0 s c0 05 0e4c 0000 0004 4 <
ffff000103558600 1180085657 C Ci:6:002:0 0 4 = 1b191715
ffff000103558600 1180085680 S Co:6:002:0 s 40 05 0e4c 0000 0004 4 = 1f1d1b1b
ffff000103558600 1180085711 C Co:6:002:0 0 4 >
ffff000103558600 1180085734 S Ci:6:002:0 s c0 05 0e54 0000 0004 4 <
ffff000103558600 1180085782 C Ci:6:002:0 0 4 = 11090300
ffff000103558600 1180085805 S Co:6:002:0 s 40 05 0e54 0000 0004 4 = 150d0700
ffff000103558600 1180085835 C Co:6:002:0 0 4 >
ffff000103533900 1180086165 C Bi:6:002:1 0 476 = a4010484 00000f80 170e6000 04300000 00000000 48381101 2a260000 50d6d60f
ffff000103533900 1180086196 S Bi:6:002:1 -115 32768 <
ffff000103558cc0 1180087092 C Bi:6:002:1 0 469 = 9d010484 00000f80 65026000 04300000 00000000 fb3b1101 26260000 55d9d90f
ffff000103558cc0 1180087124 S Bi:6:002:1 -115 32768 <
ffff00014c2bf900 1180087956 C Bi:6:002:1 0 444 = 84010484 00000f80 d9076000 04300000 00000000 683f1101 2a280000 50d9d90f
ffff00014c2bf900 1180087982 S Bi:6:002:1 -115 32768 <
ffff00013d62e840 1180088885 C Bi:6:002:1 0 467 = 9b010484 00000f80 d90f6000 04300000 00000000 ee421101 28260000 4fd8d80f
ffff00013d62e840 1180088902 S Bi:6:002:1 -115 32768 <
ffff000103533900 1180089826 C Bi:6:002:1 0 477 = a5010484 00000f80 68086000 04300000 00000000 63461101 28260000 50d3d30f
ffff000103533900 1180089843 S Bi:6:002:1 -115 32768 <
ffff000103558cc0 1180188674 C Bi:6:002:1 0 476 = a4010484 00000f80 180e6000 04300000 00000000 4ac81201 282a0000 50d9d90f
ffff000103558cc0 1180188733 S Bi:6:002:1 -115 32768 <
ffff00014c2bf900 1180189635 C Bi:6:002:1 0 469 = 9d010484 00000f80 66026000 04300000 00000000 18cc1201 2a280000 4fd4d40f
ffff00014c2bf900 1180189660 S Bi:6:002:1 -115 32768 <
ffff00013d62e840 1180190506 C Bi:6:002:1 0 444 = 84010484 00000f80 da076000 04300000 00000000 aecf1201 28260000 52d4d40f
ffff00013d62e840 1180190531 S Bi:6:002:1 -115 32768 <
ffff000103533900 1180191396 C Bi:6:002:1 0 467 = 9b010484 00000f80 da0f6000 04300000 00000000 12d31201 26260000 52c8c80f
ffff000103533900 1180191422 S Bi:6:002:1 -115 32768 <
ffff000103558cc0 1180192300 C Bi:6:002:1 0 477 = a5010484 00000f80 69086000 04300000 00000000 87d61201 2c260000 53d6d60f
ffff000103558cc0 1180192326 S Bi:6:002:1 -115 32768 <
ffff00014c2bf900 1180291035 C Bi:6:002:1 0 476 = a4010484 00000f80 190e6000 04300000 00000000 4c581401 28280000 51d4d40f
ffff00014c2bf900 1180291086 S Bi:6:002:1 -115 32768 <
ffff00013d62e840 1180292035 C Bi:6:002:1 0 469 = 9d010484 00000f80 67026000 04300000 00000000 295c1401 28260000 53e1e10f
ffff00013d62e840 1180292063 S Bi:6:002:1 -115 32768 <
ffff000103533900 1180292883 C Bi:6:002:1 0 444 = 84010484 00000f80 db076000 04300000 00000000 975f1401 2a260000 4fd3d30f
ffff000103533900 1180292910 S Bi:6:002:1 -115 32768 <
ffff000103558cc0 1180293764 C Bi:6:002:1 0 467 = 9b010484 00000f80 db0f6000 04300000 00000000 f3621401 28260000 51d4d40f
ffff000103558cc0 1180293790 S Bi:6:002:1 -115 32768 <
ffff00014c2bf900 1180294768 C Bi:6:002:1 0 477 = a5010484 00000f80 6a086000 04300000 00000000 cd661401 2c260000 53d2d20f
ffff00014c2bf900 1180294794 S Bi:6:002:1 -115 32768 <
ffff00013d62e840 1180393442 C Bi:6:002:1 0 476 = a4010484 00000f80 1a0e6000 04300000 00000000 4ee81501 28280000 50dada0f
ffff00013d62e840 1180393498 S Bi:6:002:1 -115 32768 <
ffff000103533900 1180394425 C Bi:6:002:1 0 469 = 9d010484 00000f80 68026000 04300000 00000000 21ec1501 2a260000 4ed5d50f
ffff000103533900 1180394452 S Bi:6:002:1 -115 32768 <
ffff000103558cc0 1180396187 C Bi:6:002:1 0 467 = 9b010484 00000f80 dc0f6000 04300000 00000000 14f31501 28260000 4cd7d70f
ffff000103558cc0 1180396212 S Bi:6:002:1 -115 32768 <
ffff00014c2bf900 1180495887 C Bi:6:002:1 0 476 = a4010484 00000f80 1b0e6000 04300000 00000000 50781701 26260000 50d8d80f
ffff00014c2bf900 1180495945 S Bi:6:002:1 -115 32768 <
ffff00013d62e840 1180496813 C Bi:6:002:1 0 469 = 9d010484 00000f80 69026000 04300000 00000000 197c1701 28260000 4fdada0f
ffff00013d62e840 1180496839 S Bi:6:002:1 -115 32768 <
ffff000103533900 1180498645 C Bi:6:002:1 0 467 = 9b010484 00000f80 dd0f6000 04300000 00000000 44831701 2a2c0000 51d8d80f
ffff000103533900 1180498671 S Bi:6:002:1 -115 32768 <
ffff000103558cc0 1180499562 C Bi:6:002:1 0 477 = a5010484 00000f80 6c086000 04300000 00000000 cb861701 2a280000 4fd6d60f
ffff000103558cc0 1180499588 S Bi:6:002:1 -115 32768 <
ffff00014c2bf900 1180598238 C Bi:6:002:1 0 476 = a4010484 00000f80 1c0e6000 04300000 00000000 52081901 2a280000 50d5d50f
ffff00014c2bf900 1180598289 S Bi:6:002:1 -115 32768 <
ffff00013d62e840 1180599211 C Bi:6:002:1 0 469 = 9d010484 00000f80 6a026000 04300000 00000000 120c1901 2a280000 50dddd0f
ffff00013d62e840 1180599239 S Bi:6:002:1 -115 32768 <
ffff000103533900 1180600053 C Bi:6:002:1 0 444 = 84010484 00000f80 de076000 04300000 00000000 930f1901 2a280000 51d6d60f
ffff000103533900 1180600081 S Bi:6:002:1 -115 32768 <
ffff000103558cc0 1180600964 C Bi:6:002:1 0 467 = 9b010484 00000f80 de0f6000 04300000 00000000 f6121901 28260000 55d7d70f
ffff000103558cc0 1180600989 S Bi:6:002:1 -115 32768 <
ffff00014c2bf900 1180601892 C Bi:6:002:1 0 477 = a5010484 00000f80 6d086000 04300000 00000000 83161901 28260000 4fd9d90f
ffff00014c2bf900 1180601918 S Bi:6:002:1 -115 32768 <
ffff00013d62e840 1180700678 C Bi:6:002:1 0 476 = a4010484 00000f80 1d0e6000 04300000 00000000 54981a01 28280000 54d4d40f
ffff00013d62e840 1180700735 S Bi:6:002:1 -115 32768 <
ffff000103533900 1180701629 C Bi:6:002:1 0 469 = 9d010484 00000f80 6b026000 04300000 00000000 299c1a01 28280000 50d6d60f
ffff000103533900 1180701656 S Bi:6:002:1 -115 32768 <
ffff000103558cc0 1180702521 C Bi:6:002:1 0 444 = 84010484 00000f80 df076000 04300000 00000000 c89f1a01 2a280000 51d4d40f
ffff000103558cc0 1180702546 S Bi:6:002:1 -115 32768 <
ffff00014c2bf900 1180703407 C Bi:6:002:1 0 467 = 9b010484 00000f80 df0f6000 04300000 00000000 1fa31a01 28280000 52d6d60f
ffff00014c2bf900 1180703431 S Bi:6:002:1 -115 32768 <
ffff00013d62e840 1180704313 C Bi:6:002:1 0 477 = a5010484 00000f80 6e086000 04300000 00000000 96a61a01 28260000 53d3d30f
ffff00013d62e840 1180704339 S Bi:6:002:1 -115 32768 <
ffff000103533780 1180764191 S Ci:6:002:0 s c0 05 004c 0000 0001 1 <
ffff000103533780 1180764284 C Ci:6:002:0 0 1 = 20
ffff000103533780 1180764309 S Co:6:002:0 s 40 05 004c 0000 0001 1 = 20
ffff000103533780 1180764429 C Co:6:002:0 0 1 >
ffff000103533780 1180764625 S Ci:6:002:0 s c0 05 0770 0000 0004 4 <
ffff000103533780 1180764790 C Ci:6:002:0 0 4 = 00000000
ffff000103533780 1180765002 S Ci:6:002:0 s c0 05 0774 0000 0004 4 <
ffff000103533780 1180765169 C Ci:6:002:0 0 4 = 00000000
ffff000103533780 1180765332 S Co:6:002:0 s 40 05 076e 0000 0001 1 = 0c
ffff000103533780 1180765456 C Co:6:002:0 0 1 >
ffff000103533780 1180765659 S Ci:6:002:0 s c0 05 0808 0000 0004 4 <
ffff000103533780 1180765792 C Ci:6:002:0 0 4 = 3382023e
ffff000103533780 1180765841 S Ci:6:002:0 s c0 05 0a5c 0000 0002 2 <
ffff000103533780 1180765972 C Ci:6:002:0 0 2 = a200
ffff000103533780 1180766008 S Ci:6:002:0 s c0 05 0f48 0000 0002 2 <
ffff000103533780 1180766127 C Ci:6:002:0 0 2 = a302
ffff000103533780 1180766165 S Ci:6:002:0 s c0 05 0f04 0000 0004 4 <
ffff000103533780 1180766283 C Ci:6:002:0 0 4 = 00000700
ffff000103533780 1180766319 S Ci:6:002:0 s c0 05 0f14 0000 0004 4 <
ffff000103533780 1180766429 C Ci:6:002:0 0 4 = 96001700
ffff000103533780 1180766466 S Ci:6:002:0 s c0 05 0f10 0000 0004 4 <
ffff000103533780 1180766593 C Ci:6:002:0 0 4 = 00000000
ffff000103533780 1180766629 S Ci:6:002:0 s c0 05 0f0c 0000 0004 4 <
ffff000103533780 1180766739 C Ci:6:002:0 0 4 = 00000000
ffff000103533780 1180766776 S Ci:6:002:0 s c0 05 0f08 0000 0004 4 <
ffff000103533780 1180766886 C Ci:6:002:0 0 4 = e0005003
ffff000103533780 1180766923 S Ci:6:002:0 s c0 05 0fcc 0000 0004 4 <
ffff000103533780 1180767033 C Ci:6:002:0 0 4 = 00000000
ffff000103533780 1180767070 S Ci:6:002:0 s c0 05 09a4 0000 0004 4 <
ffff000103533780 1180767109 C Ci:6:002:0 0 4 = 80000800
ffff000103533780 1180767162 S Co:6:002:0 s 40 05 09a4 0000 0004 4 = 80000a00
ffff000103533780 1180767196 C Co:6:002:0 0 4 >
ffff000103533780 1180767225 S Ci:6:002:0 s c0 05 09a4 0000 0004 4 <
ffff000103533780 1180767276 C Ci:6:002:0 0 4 = 80000a00
ffff000103533780 1180767303 S Co:6:002:0 s 40 05 09a4 0000 0004 4 = 80000800
ffff000103533780 1180767346 C Co:6:002:0 0 4 >
ffff000103533780 1180767374 S Ci:6:002:0 s c0 05 0a2c 0000 0004 4 <
ffff000103533780 1180767421 C Ci:6:002:0 0 4 = 00809000
ffff000103533780 1180767448 S Co:6:002:0 s 40 05 0a2c 0000 0004 4 = 00009000
ffff000103533780 1180767490 C Co:6:002:0 0 4 >
ffff000103533780 1180767517 S Ci:6:002:0 s c0 05 0a2c 0000 0004 4 <
ffff000103533780 1180767563 C Ci:6:002:0 0 4 = 00009000
ffff000103533780 1180767591 S Co:6:002:0 s 40 05 0a2c 0000 0004 4 = 00809000
ffff000103533780 1180767647 C Co:6:002:0 0 4 >
ffff000103533780 1180767676 S Ci:6:002:0 s c0 05 0b58 0000 0004 4 <
ffff000103533780 1180767722 C Ci:6:002:0 0 4 = 00000000
ffff000103533780 1180767750 S Co:6:002:0 s 40 05 0b58 0000 0004 4 = 01000000
ffff000103533780 1180767792 C Co:6:002:0 0 4 >
ffff000103533780 1180767819 S Ci:6:002:0 s c0 05 0b58 0000 0004 4 <
ffff000103533780 1180767865 C Ci:6:002:0 0 4 = 01000000
ffff000103533780 1180767892 S Co:6:002:0 s 40 05 0b58 0000 0004 4 = 00000000
ffff000103533780 1180767934 C Co:6:002:0 0 4 >
ffff000103533780 1180767963 S Ci:6:002:0 s c0 05 01cc 0000 0001 1 <
ffff000103533780 1180768040 C Ci:6:002:0 0 1 = 00
ffff000103533780 1180768091 S Co:6:002:0 s 40 05 01f0 0000 0004 4 = 00000000
ffff000103533780 1180768209 C Co:6:002:0 0 4 >
ffff000103533780 1180768244 S Co:6:002:0 s 40 05 01d0 0000 0004 4 = 58000000
ffff000103533780 1180768358 C Co:6:002:0 0 4 >
ffff000103533780 1180768394 S Co:6:002:0 s 40 05 0440 0000 0004 4 = 00000000
ffff000103533780 1180768506 C Co:6:002:0 0 4 >
ffff000103533780 1180768545 S Ci:6:002:0 s c0 05 0c00 0000 0004 4 <
ffff000103533780 1180768663 C Ci:6:002:0 0 4 = 07000000
ffff000103533780 1180768699 S Ci:6:002:0 s c0 05 08b0 0000 0004 4 <
ffff000103533780 1180768811 C Ci:6:002:0 0 4 = 18060000
ffff000103533780 1180768847 S Co:6:002:0 s 40 05 08b0 0000 0004 4 = 42060000
ffff000103533780 1180768967 C Co:6:002:0 0 4 >
ffff000103533780 1180769026 S Ci:6:002:0 s c0 05 0d04 0000 0004 4 <
ffff000103533780 1180769135 C Ci:6:002:0 0 4 = 088d90b1
ffff000103533780 1180769175 S Co:6:002:0 s 40 05 0c90 0000 0004 4 = 088d2304
ffff000103533780 1180769281 C Co:6:002:0 0 4 >
ffff000103533780 1180769333 S Co:6:002:0 s 40 05 0280 0000 0002 2 = 0001
ffff000103533780 1180769436 C Co:6:002:0 0 2 >
ffff000103533780 1180769474 S Ci:6:002:0 s c0 05 010c 0000 0001 1 <
ffff000103533780 1180769597 C Ci:6:002:0 0 1 = b4
ffff000103533780 1180769635 S Co:6:002:0 s 40 05 010c 0000 0001 1 = b4
ffff000103533780 1180769741 C Co:6:002:0 0 1 >
ffff000103533900 1180803082 C Bi:6:002:1 0 476 = a4010484 00000f80 1e0e6000 04300000 00000000 56281c01 2a2a0000 52d7d70f
ffff000103533900 1180803138 S Bi:6:002:1 -115 32768 <
ffff000103558cc0 1180803980 C Bi:6:002:1 0 469 = 9d010484 00000f80 6c026000 04300000 00000000 042c1c01 28280000 50d4d40f
ffff000103558cc0 1180804001 S Bi:6:002:1 -115 32768 <
ffff00014c2bf900 1180804819 C Bi:6:002:1 0 444 = 84010484 00000f80 e0076000 04300000 00000000 782f1c01 2a280000 4cd9d90f
ffff00014c2bf900 1180804840 S Bi:6:002:1 -115 32768 <
ffff00013d62e840 1180805661 C Bi:6:002:1 0 467 = 9b010484 00000f80 e00f6000 04300000 00000000 dc321c01 2a280000 52d1d10f
ffff00013d62e840 1180805679 S Bi:6:002:1 -115 32768 <
ffff000103533900 1180806567 C Bi:6:002:1 0 477 = a5010484 00000f80 6f086000 04300000 00000000 60361c01 28260000 4dd8d80f
ffff000103533900 1180806584 S Bi:6:002:1 -115 32768 <
ffff000103558cc0 1180905477 C Bi:6:002:1 0 476 = a4010484 00000f80 1f0e6000 04300000 00000000 58b81d01 2a280000 54d4d40f
ffff000103558cc0 1180905524 S Bi:6:002:1 -115 32768 <
ffff00014c2bf900 1180906524 C Bi:6:002:1 0 469 = 9d010484 00000f80 6d026000 04300000 00000000 88bc1d01 28260000 4dd8d80f
ffff00014c2bf900 1180906550 S Bi:6:002:1 -115 32768 <
ffff00013d62e840 1180907378 C Bi:6:002:1 0 444 = 84010484 00000f80 e1076000 04300000 00000000 03c01d01 28280000 50d4d40f
ffff00013d62e840 1180907404 S Bi:6:002:1 -115 32768 <
ffff000103533900 1180908384 C Bi:6:002:1 0 467 = 9b010484 00000f80 e10f6000 04300000 00000000 cfc31d01 2a280000 4fd7d70f
ffff000103533900 1180908410 S Bi:6:002:1 -115 32768 <
ffff000103558cc0 1180909302 C Bi:6:002:1 0 477 = a5010484 00000f80 70086000 04300000 00000000 5bc71d01 26280000 50d7d70f
ffff000103558cc0 1180909329 S Bi:6:002:1 -115 32768 <
ffff00014c2bf900 1181007902 C Bi:6:002:1 0 476 = a4010484 00000f80 200e6000 04300000 00000000 5a481f01 2a280000 53d8d80f
ffff00014c2bf900 1181007937 S Bi:6:002:1 -115 32768 <
ffff00013d62e840 1181008791 C Bi:6:002:1 0 469 = 9d010484 00000f80 6e026000 04300000 00000000 164c1f01 28260000 4cd3d30f
ffff00013d62e840 1181008840 S Bi:6:002:1 -115 32768 <
ffff000103533900 1181010559 C Bi:6:002:1 0 467 = 9b010484 00000f80 e20f6000 04300000 00000000 ea521f01 28260000 4bdbdb0f
ffff000103533900 1181010585 S Bi:6:002:1 -115 32768 <
ffff000103558cc0 1181011474 C Bi:6:002:1 0 477 = a5010484 00000f80 71086000 04300000 00000000 75561f01 2a260000 51d3d30f
ffff000103558cc0 1181011499 S Bi:6:002:1 -115 32768 <
ffff00014c2bf900 1181110290 C Bi:6:002:1 0 476 = a4010484 00000f80 210e6000 04300000 00000000 5bd82001 28260000 50d5d50f
ffff00014c2bf900 1181110322 S Bi:6:002:1 -115 32768 <
ffff00013d62e840 1181111205 C Bi:6:002:1 0 469 = 9d010484 00000f80 6f026000 04300000 00000000 28dc2001 2a280000 54d4d40f
ffff00013d62e840 1181111227 S Bi:6:002:1 -115 32768 <
ffff000103533900 1181112984 C Bi:6:002:1 0 467 = 9b010484 00000f80 e30f6000 04300000 00000000 1de32001 2a280000 54d7d70f
ffff000103533900 1181113033 S Bi:6:002:1 -115 32768 <
ffff000103558cc0 1181113915 C Bi:6:002:1 0 477 = a5010484 00000f80 72086000 04300000 00000000 9ae62001 28260000 50dada0f
ffff000103558cc0 1181113942 S Bi:6:002:1 -115 32768 <
ffff00014c2bf900 1181212690 C Bi:6:002:1 0 476 = a4010484 00000f80 220e6000 04300000 00000000 5d682201 2a280000 54d7d70f
ffff00014c2bf900 1181212728 S Bi:6:002:1 -115 32768 <
ffff00013d62e840 1181213642 C Bi:6:002:1 0 469 = 9d010484 00000f80 70026000 04300000 00000000 386c2201 2a280000 51d5d50f
ffff00013d62e840 1181213669 S Bi:6:002:1 -115 32768 <
ffff000103533900 1181214510 C Bi:6:002:1 0 444 = 84010484 00000f80 e4076000 04300000 00000000 be6f2201 2a2a0000 51d5d50f
ffff000103533900 1181214534 S Bi:6:002:1 -115 32768 <
ffff000103558cc0 1181215433 C Bi:6:002:1 0 467 = 9b010484 00000f80 e40f6000 04300000 00000000 4f732201 2a2a0000 53d7d70f
ffff000103558cc0 1181215455 S Bi:6:002:1 -115 32768 <
ffff00014c2bf900 1181216393 C Bi:6:002:1 0 477 = a5010484 00000f80 73086000 04300000 00000000 dc762201 28280000 4ed4d40f
ffff00014c2bf900 1181216446 S Bi:6:002:1 -115 32768 <
ffff00013d62e840 1181315090 C Bi:6:002:1 0 476 = a4010484 00000f80 230e6000 04300000 00000000 5ff82301 2a280000 50d9d90f
ffff00013d62e840 1181315118 S Bi:6:002:1 -115 32768 <
ffff000103533900 1181315983 C Bi:6:002:1 0 469 = 9d010484 00000f80 71026000 04300000 00000000 14fc2301 28280000 52d7d70f
ffff000103533900 1181316005 S Bi:6:002:1 -115 32768 <
ffff000103558cc0 1181316816 C Bi:6:002:1 0 444 = 84010484 00000f80 e5076000 04300000 00000000 79ff2301 2a260000 51d8d80f
ffff000103558cc0 1181316836 S Bi:6:002:1 -115 32768 <
ffff00014c2bf900 1181317755 C Bi:6:002:1 0 467 = 9b010484 00000f80 e50f6000 04300000 00000000 d7022401 26260000 4ed7d70f
ffff00014c2bf900 1181317782 S Bi:6:002:1 -115 32768 <
ffff00013d62e840 1181318640 C Bi:6:002:1 0 477 = a5010484 00000f80 74086000 04300000 00000000 54062401 28280000 52dada0f
ffff00013d62e840 1181318665 S Bi:6:002:1 -115 32768 <
ffff000103533900 1181417494 C Bi:6:002:1 0 476 = a4010484 00000f80 240e6000 04300000 00000000 61882501 2a280000 53d4d40f
ffff000103533900 1181417523 S Bi:6:002:1 -115 32768 <
ffff000103558cc0 1181418520 C Bi:6:002:1 0 469 = 9d010484 00000f80 72026000 04300000 00000000 888c2501 2a2a0000 4fd8d80f
ffff000103558cc0 1181418550 S Bi:6:002:1 -115 32768 <
ffff00014c2bf900 1181419428 C Bi:6:002:1 0 444 = 84010484 00000f80 e6076000 04300000 00000000 36902501 2c260000 50d6d60f
ffff00014c2bf900 1181419454 S Bi:6:002:1 -115 32768 <
ffff00013d62e840 1181420432 C Bi:6:002:1 0 467 = 9b010484 00000f80 e60f6000 04300000 00000000 00942501 28280000 50d6d60f
ffff00013d62e840 1181420461 S Bi:6:002:1 -115 32768 <
ffff000103533900 1181421408 C Bi:6:002:1 0 477 = a5010484 00000f80 75086000 04300000 00000000 c6972501 2a260000 54d8d80f
ffff000103533900 1181421435 S Bi:6:002:1 -115 32768 <
ffff000103558cc0 1181519900 C Bi:6:002:1 0 476 = a4010484 00000f80 250e6000 04300000 00000000 63182701 28280000 51d6d60f
ffff000103558cc0 1181519928 S Bi:6:002:1 -115 32768 <
ffff00014c2bf900 1181520825 C Bi:6:002:1 0 469 = 9d010484 00000f80 73026000 04300000 00000000 2c1c2701 26260000 53d6d60f
ffff00014c2bf900 1181520852 S Bi:6:002:1 -115 32768 <
ffff00013d62e840 1181521683 C Bi:6:002:1 0 444 = 84010484 00000f80 e7076000 04300000 00000000 a41f2701 28280000 52d7d70f
ffff00013d62e840 1181521709 S Bi:6:002:1 -115 32768 <
ffff000103533900 1181522630 C Bi:6:002:1 0 467 = 9b010484 00000f80 e70f6000 04300000 00000000 3b232701 2c260000 52d8d80f
ffff000103533900 1181522658 S Bi:6:002:1 -115 32768 <
ffff000103558cc0 1181523554 C Bi:6:002:1 0 477 = a5010484 00000f80 76086000 04300000 00000000 c6262701 2a260000 53d4d40f
ffff000103558cc0 1181523580 S Bi:6:002:1 -115 32768 <
ffff00014c2bf900 1181622296 C Bi:6:002:1 0 476 = a4010484 00000f80 260e6000 04300000 00000000 65a82801 28260000 51d8d80f
ffff00014c2bf900 1181622334 S Bi:6:002:1 -115 32768 <
ffff00013d62e840 1181623216 C Bi:6:002:1 0 469 = 9d010484 00000f80 74026000 04300000 00000000 23ac2801 28260000 51dada0f
ffff00013d62e840 1181623243 S Bi:6:002:1 -115 32768 <
ffff000103533900 1181624123 C Bi:6:002:1 0 444 = 84010484 00000f80 e8076000 04300000 00000000 caaf2801 2a260000 54d5d50f
ffff000103533900 1181624147 S Bi:6:002:1 -115 32768 <
ffff000103558cc0 1181625078 C Bi:6:002:1 0 467 = 9b010484 00000f80 e80f6000 04300000 00000000 6ab32801 2a260000 54d9d90f
ffff000103558cc0 1181625106 S Bi:6:002:1 -115 32768 <
ffff00014c2bf900 1181625991 C Bi:6:002:1 0 477 = a5010484 00000f80 77086000 04300000 00000000 ebb62801 2e2a0000 52d4d40f
ffff00014c2bf900 1181626015 S Bi:6:002:1 -115 32768 <
ffff00013d62e840 1181724699 C Bi:6:002:1 0 476 = a4010484 00000f80 270e6000 04300000 00000000 67382a01 2a260000 55d6d60f
ffff00013d62e840 1181724737 S Bi:6:002:1 -115 32768 <
ffff000103533900 1181725643 C Bi:6:002:1 0 469 = 9d010484 00000f80 75026000 04300000 00000000 3e3c2a01 28260000 54d6d60f
ffff000103533900 1181725670 S Bi:6:002:1 -115 32768 <
ffff000103558cc0 1181726514 C Bi:6:002:1 0 444 = 84010484 00000f80 e9076000 04300000 00000000 c33f2a01 28260000 52d6d60f
ffff000103558cc0 1181726540 S Bi:6:002:1 -115 32768 <
ffff00014c2bf900 1181727428 C Bi:6:002:1 0 467 = 9b010484 00000f80 e90f6000 04300000 00000000 3c432a01 28280000 51d4d40f
ffff00014c2bf900 1181727453 S Bi:6:002:1 -115 32768 <
ffff00013d62e840 1181728373 C Bi:6:002:1 0 477 = a5010484 00000f80 78086000 04300000 00000000 c3462a01 2a260000 4dd7d70f
ffff00013d62e840 1181728398 S Bi:6:002:1 -115 32768 <
ffff000103533780 1181756245 S Ci:6:002:0 s c0 05 004c 0000 0001 1 <
ffff000103533780 1181756448 C Ci:6:002:0 0 1 = 20
ffff000103533780 1181756512 S Co:6:002:0 s 40 05 004c 0000 0001 1 = 20
ffff000103533780 1181756620 C Co:6:002:0 0 1 >
ffff000103533900 1181827093 C Bi:6:002:1 0 476 = a4010484 00000f80 280e6000 04300000 00000000 69c82b01 28260000 4cd6d60f
ffff000103533900 1181827129 S Bi:6:002:1 -115 32768 <
ffff000103558cc0 1181828082 C Bi:6:002:1 0 469 = 9d010484 00000f80 76026000 04300000 00000000 61cc2b01 2a280000 54dbdb0f
ffff000103558cc0 1181828108 S Bi:6:002:1 -115 32768 <
ffff00014c2bf900 1181828920 C Bi:6:002:1 0 444 = 84010484 00000f80 ea076000 04300000 00000000 cccf2b01 28280000 52d7d70f
ffff00014c2bf900 1181828946 S Bi:6:002:1 -115 32768 <
ffff00013d62e840 1181829866 C Bi:6:002:1 0 467 = 9b010484 00000f80 ea0f6000 04300000 00000000 54d32b01 2a260000 52dddd0f
ffff00013d62e840 1181829892 S Bi:6:002:1 -115 32768 <
ffff000103533900 1181830766 C Bi:6:002:1 0 477 = a5010484 00000f80 79086000 04300000 00000000 d6d62b01 2a260000 50d3d30f
ffff000103533900 1181830791 S Bi:6:002:1 -115 32768 <
ffff000103558cc0 1181929522 C Bi:6:002:1 0 476 = a4010484 00000f80 290e6000 04300000 00000000 6b582d01 2a280000 54d6d60f
ffff000103558cc0 1181929560 S Bi:6:002:1 -115 32768 <
ffff00014c2bf900 1181930505 C Bi:6:002:1 0 469 = 9d010484 00000f80 77026000 04300000 00000000 7e5c2d01 26260000 52d8d80f
ffff00014c2bf900 1181930532 S Bi:6:002:1 -115 32768 <
ffff00013d62e840 1181931387 C Bi:6:002:1 0 444 = 84010484 00000f80 eb076000 04300000 00000000 10602d01 28280000 53d6d60f
ffff00013d62e840 1181931413 S Bi:6:002:1 -115 32768 <
ffff000103533900 1181932369 C Bi:6:002:1 0 467 = 9b010484 00000f80 eb0f6000 04300000 00000000 ca632d01 2a260000 53d7d70f
ffff000103533900 1181932398 S Bi:6:002:1 -115 32768 <
ffff000103558cc0 1181933297 C Bi:6:002:1 0 477 = a5010484 00000f80 7a086000 04300000 00000000 58672d01 28280000 50d6d60f
ffff000103558cc0 1181933324 S Bi:6:002:1 -115 32768 <
ffff00014c2bf900 1182031848 C Bi:6:002:1 0 476 = a4010484 00000f80 2a0e6000 04300000 00000000 6de82e01 28260000 50d2d20f
ffff00014c2bf900 1182031880 S Bi:6:002:1 -115 32768 <
ffff00013d62e840 1182032938 C Bi:6:002:1 0 469 = 9d010484 00000f80 78026000 04300000 00000000 90ec2e01 2a260000 4ed5d50f
ffff00013d62e840 1182032965 S Bi:6:002:1 -115 32768 <
ffff000103533900 1182033802 C Bi:6:002:1 0 444 = 84010484 00000f80 ec076000 04300000 00000000 1ff02e01 2a260000 52caca0f
ffff000103533900 1182033827 S Bi:6:002:1 -115 32768 <
ffff000103558cc0 1182034698 C Bi:6:002:1 0 467 = 9b010484 00000f80 ec0f6000 04300000 00000000 81f32e01 28260000 54dbdb0f
ffff000103558cc0 1182034724 S Bi:6:002:1 -115 32768 <
ffff00014c2bf900 1182134299 C Bi:6:002:1 0 476 = a4010484 00000f80 2b0e6000 04300000 00000000 6f783001 28280000 50d5d50f
ffff00014c2bf900 1182134345 S Bi:6:002:1 -115 32768 <
ffff00013d62e840 1182135314 C Bi:6:002:1 0 469 = 9d010484 00000f80 79026000 04300000 00000000 867c3001 28260000 50dbdb0f
ffff00013d62e840 1182135340 S Bi:6:002:1 -115 32768 <
ffff000103533900 1182136162 C Bi:6:002:1 0 444 = 84010484 00000f80 ed076000 04300000 00000000 f57f3001 28280000 50d8d80f
ffff000103533900 1182136187 S Bi:6:002:1 -115 32768 <
ffff000103558cc0 1182137078 C Bi:6:002:1 0 467 = 9b010484 00000f80 ed0f6000 04300000 00000000 6d833001 2a280000 53d6d60f
ffff000103558cc0 1182137103 S Bi:6:002:1 -115 32768 <
ffff00014c2bf900 1182138017 C Bi:6:002:1 0 477 = a5010484 00000f80 7c086000 04300000 00000000 0b873001 2a280000 4fd6d60f
ffff00014c2bf900 1182138042 S Bi:6:002:1 -115 32768 <
ffff00013d62e840 1182236704 C Bi:6:002:1 0 476 = a4010484 00000f80 2c0e6000 04300000 00000000 71083201 28240000 51d4d40f
ffff00013d62e840 1182236742 S Bi:6:002:1 -115 32768 <
ffff000103533900 1182237680 C Bi:6:002:1 0 469 = 9d010484 00000f80 7a026000 04300000 00000000 670c3201 28260000 4dd6d60f
ffff000103533900 1182237707 S Bi:6:002:1 -115 32768 <
ffff000103558cc0 1182238554 C Bi:6:002:1 0 444 = 84010484 00000f80 ee076000 04300000 00000000 ee0f3201 26260000 53dddd0f
ffff000103558cc0 1182238579 S Bi:6:002:1 -115 32768 <
ffff00014c2bf900 1182239482 C Bi:6:002:1 0 467 = 9b010484 00000f80 ee0f6000 04300000 00000000 65133201 2c280000 54d7d70f
ffff00014c2bf900 1182239507 S Bi:6:002:1 -115 32768 <
ffff00013d62e840 1182240389 C Bi:6:002:1 0 477 = a5010484 00000f80 7d086000 04300000 00000000 e9163201 28280000 4cd9d90f
ffff00013d62e840 1182240415 S Bi:6:002:1 -115 32768 <
ffff000103533900 1182339101 C Bi:6:002:1 0 476 = a4010484 00000f80 2d0e6000 04300000 00000000 73983301 28280000 51d5d50f
ffff000103533900 1182339135 S Bi:6:002:1 -115 32768 <
ffff000103558cc0 1182340039 C Bi:6:002:1 0 469 = 9d010484 00000f80 7b026000 04300000 00000000 3d9c3301 2a280000 4ed2d20f
ffff000103558cc0 1182340065 S Bi:6:002:1 -115 32768 <
ffff00014c2bf900 1182340902 C Bi:6:002:1 0 444 = 84010484 00000f80 ef076000 04300000 00000000 be9f3301 28260000 50d7d70f
ffff00014c2bf900 1182340929 S Bi:6:002:1 -115 32768 <
ffff00013d62e840 1182341829 C Bi:6:002:1 0 467 = 9b010484 00000f80 ef0f6000 04300000 00000000 3ea33301 28260000 52d9d90f
ffff00013d62e840 1182341855 S Bi:6:002:1 -115 32768 <
ffff000103533900 1182342743 C Bi:6:002:1 0 477 = a5010484 00000f80 7e086000 04300000 00000000 c2a63301 28280000 52d9d90f
ffff000103533900 1182342769 S Bi:6:002:1 -115 32768 <
ffff000103558cc0 1182441509 C Bi:6:002:1 0 476 = a4010484 00000f80 2e0e6000 04300000 00000000 75283501 28260000 4cd2d20f
ffff000103558cc0 1182441562 S Bi:6:002:1 -115 32768 <
ffff00014c2bf900 1182442431 C Bi:6:002:1 0 469 = 9d010484 00000f80 7c026000 04300000 00000000 382c3501 2a280000 54d1d10f
ffff00014c2bf900 1182442458 S Bi:6:002:1 -115 32768 <
ffff00013d62e840 1182443389 C Bi:6:002:1 0 444 = 84010484 00000f80 f0076000 04300000 00000000 14303501 2a280000 4fd7d70f
ffff00013d62e840 1182443415 S Bi:6:002:1 -115 32768 <
ffff000103533900 1182444318 C Bi:6:002:1 0 467 = 9b010484 00000f80 f00f6000 04300000 00000000 98333501 2a280000 51d3d30f
ffff000103533900 1182444343 S Bi:6:002:1 -115 32768 <
ffff000103558cc0 1182445234 C Bi:6:002:1 0 477 = a5010484 00000f80 7f086000 04300000 00000000 0b373501 2a280000 51dada0f
ffff000103558cc0 1182445261 S Bi:6:002:1 -115 32768 <
ffff00014c2bf900 1182543911 C Bi:6:002:1 0 476 = a4010484 00000f80 2f0e6000 04300000 00000000 77b83601 2c260000 53d8d80f
ffff00014c2bf900 1182543941 S Bi:6:002:1 -115 32768 <
ffff00013d62e840 1182544903 C Bi:6:002:1 0 469 = 9d010484 00000f80 7d026000 04300000 00000000 7dbc3601 28260000 51d3d30f
ffff00013d62e840 1182544929 S Bi:6:002:1 -115 32768 <
ffff000103533900 1182545781 C Bi:6:002:1 0 444 = 84010484 00000f80 f1076000 04300000 00000000 0dc03601 26260000 4ad0d00f
ffff000103533900 1182545806 S Bi:6:002:1 -115 32768 <
ffff000103558cc0 1182546639 C Bi:6:002:1 0 467 = 9b010484 00000f80 f10f6000 04300000 00000000 5ec33601 2a280000 51dada0f
ffff000103558cc0 1182546664 S Bi:6:002:1 -115 32768 <
ffff00014c2bf900 1182547574 C Bi:6:002:1 0 477 = a5010484 00000f80 80086000 04300000 00000000 dac63601 2a260000 4fd3d30f
ffff00014c2bf900 1182547598 S Bi:6:002:1 -115 32768 <
ffff00013d62e840 1182646264 C Bi:6:002:1 0 476 = a4010484 00000f80 300e6000 04300000 00000000 79483801 2a260000 4fd5d50f
ffff00013d62e840 1182646294 S Bi:6:002:1 -115 32768 <
ffff000103533900 1182647236 C Bi:6:002:1 0 469 = 9d010484 00000f80 7e026000 04300000 00000000 2c4c3801 28260000 4ed7d70f
ffff000103533900 1182647264 S Bi:6:002:1 -115 32768 <
ffff000103558cc0 1182648059 C Bi:6:002:1 0 444 = 84010484 00000f80 f2076000 04300000 00000000 a44f3801 28280000 51d7d70f
ffff000103558cc0 1182648088 S Bi:6:002:1 -115 32768 <
ffff00014c2bf900 1182649017 C Bi:6:002:1 0 467 = 9b010484 00000f80 f20f6000 04300000 00000000 36533801 2a280000 52d2d20f
ffff00014c2bf900 1182649043 S Bi:6:002:1 -115 32768 <
ffff00013d62e840 1182649930 C Bi:6:002:1 0 477 = a5010484 00000f80 81086000 04300000 00000000 b3563801 28260000 4fdbdb0f
ffff00013d62e840 1182649955 S Bi:6:002:1 -115 32768 <
ffff000103533780 1182748209 S Ci:6:002:0 s c0 05 0770 0000 0004 4 <
ffff000103533780 1182748272 C Ci:6:002:0 0 4 = 00000000
ffff000103533780 1182748324 S Ci:6:002:0 s c0 05 0774 0000 0004 4 <
ffff000103533780 1182748454 C Ci:6:002:0 0 4 = 00000000
ffff000103533780 1182748631 S Co:6:002:0 s 40 05 076e 0000 0001 1 = 0c
ffff000103533900 1182748662 C Bi:6:002:1 0 476 = a4010484 00000f80 310e6000 04300000 00000000 7bd83901 2a280000 4cd4d40f
ffff000103533900 1182748704 S Bi:6:002:1 -115 32768 <
ffff000103533780 1182748749 C Co:6:002:0 0 1 >
ffff000103533780 1182748821 S Ci:6:002:0 s c0 05 0808 0000 0004 4 <
ffff000103533780 1182748962 C Ci:6:002:0 0 4 = 3382023e
ffff000103533780 1182749157 S Ci:6:002:0 s c0 05 0a5c 0000 0002 2 <
ffff000103533780 1182749325 C Ci:6:002:0 0 2 = 0000
ffff000103533780 1182749490 S Ci:6:002:0 s c0 05 0f48 0000 0002 2 <
ffff000103533780 1182749633 C Ci:6:002:0 0 2 = a002
ffff000103558cc0 1182749680 C Bi:6:002:1 0 469 = 9d010484 00000f80 7f026000 04300000 00000000 4adc3901 28260000 4ed6d60f
ffff000103558cc0 1182749689 S Bi:6:002:1 -115 32768 <
ffff000103533780 1182749842 S Ci:6:002:0 s c0 05 0f04 0000 0004 4 <
ffff000103533780 1182749986 C Ci:6:002:0 0 4 = 00000000
ffff000103533780 1182750145 S Ci:6:002:0 s c0 05 0f14 0000 0004 4 <
ffff000103533780 1182750277 C Ci:6:002:0 0 4 = 5e001a00
ffff00014c2bf900 1182750494 C Bi:6:002:1 0 444 = 84010484 00000f80 f3076000 04300000 00000000 cedf3901 2a260000 53d9d90f
ffff000103533780 1182750530 S Ci:6:002:0 s c0 05 0f10 0000 0004 4 <
ffff00014c2bf900 1182750534 S Bi:6:002:1 -115 32768 <
ffff000103533780 1182750589 C Ci:6:002:0 0 4 = 00000000
ffff000103533780 1182750624 S Ci:6:002:0 s c0 05 0f0c 0000 0004 4 <
ffff000103533780 1182750751 C Ci:6:002:0 0 4 = 00000000
ffff000103533780 1182750789 S Ci:6:002:0 s c0 05 0f08 0000 0004 4 <
ffff000103533780 1182750909 C Ci:6:002:0 0 4 = 00001a03
ffff000103533780 1182750947 S Ci:6:002:0 s c0 05 0fcc 0000 0004 4 <
ffff000103533780 1182751075 C Ci:6:002:0 0 4 = 00000000
ffff000103533780 1182751111 S Ci:6:002:0 s c0 05 09a4 0000 0004 4 <
ffff000103533780 1182751153 C Ci:6:002:0 0 4 = 80000800
ffff000103533780 1182751183 S Co:6:002:0 s 40 05 09a4 0000 0004 4 = 80000a00
ffff000103533780 1182751243 C Co:6:002:0 0 4 >
ffff000103533780 1182751270 S Ci:6:002:0 s c0 05 09a4 0000 0004 4 <
ffff000103533780 1182751319 C Ci:6:002:0 0 4 = 80000a00
ffff000103533240 1182751347 S Co:6:002:0 s 40 05 09a4 0000 0004 4 = 80000800
ffff00013d62e840 1182751372 C Bi:6:002:1 0 467 = 9b010484 00000f80 f30f6000 04300000 00000000 53e33901 2a280000 51d5d50f
ffff00013d62e840 1182751399 S Bi:6:002:1 -115 32768 <
ffff000103533240 1182751441 C Co:6:002:0 0 4 >
ffff000103533240 1182751471 S Ci:6:002:0 s c0 05 0a2c 0000 0004 4 <
ffff000103533240 1182751519 C Ci:6:002:0 0 4 = 00809000
ffff000103533240 1182751547 S Co:6:002:0 s 40 05 0a2c 0000 0004 4 = 00009000
ffff000103533240 1182751593 C Co:6:002:0 0 4 >
ffff000103533240 1182751622 S Ci:6:002:0 s c0 05 0a2c 0000 0004 4 <
ffff000103533240 1182751667 C Ci:6:002:0 0 4 = 00009000
ffff000103533240 1182751694 S Co:6:002:0 s 40 05 0a2c 0000 0004 4 = 00809000
ffff000103533240 1182751750 C Co:6:002:0 0 4 >
ffff000103533240 1182751776 S Ci:6:002:0 s c0 05 0b58 0000 0004 4 <
ffff000103533240 1182751822 C Ci:6:002:0 0 4 = 00000000
ffff000103533240 1182751849 S Co:6:002:0 s 40 05 0b58 0000 0004 4 = 01000000
ffff000103533240 1182751891 C Co:6:002:0 0 4 >
ffff000103533240 1182751919 S Ci:6:002:0 s c0 05 0b58 0000 0004 4 <
ffff000103533240 1182751964 C Ci:6:002:0 0 4 = 01000000
ffff000103533240 1182751991 S Co:6:002:0 s 40 05 0b58 0000 0004 4 = 00000000
ffff000103533240 1182752108 C Co:6:002:0 0 4 >
ffff000103533240 1182752140 S Ci:6:002:0 s c0 05 01cc 0000 0001 1 <
ffff000103533240 1182752258 C Ci:6:002:0 0 1 = 00
ffff000103533240 1182752295 S Co:6:002:0 s 40 05 01f4 0000 0004 4 = 00000000
ffff000103533240 1182752401 C Co:6:002:0 0 4 >
ffff000103533240 1182752439 S Co:6:002:0 s 40 05 01d4 0000 0004 4 = 58000000
ffff000103533240 1182752546 C Co:6:002:0 0 4 >
ffff000103533240 1182752585 S Co:6:002:0 s 40 05 0440 0000 0004 4 = 00000000
ffff000103533240 1182752695 C Co:6:002:0 0 4 >
ffff000103533240 1182752733 S Ci:6:002:0 s c0 05 0c00 0000 0004 4 <
ffff000103533240 1182752849 C Ci:6:002:0 0 4 = 07000000
ffff000103533240 1182752885 S Ci:6:002:0 s c0 05 08b0 0000 0004 4 <
ffff000103533240 1182752995 C Ci:6:002:0 0 4 = 42060000
ffff000103533240 1182753031 S Co:6:002:0 s 40 05 08b0 0000 0004 4 = 42060000
ffff000103533240 1182753138 C Co:6:002:0 0 4 >
ffff000103533240 1182753196 S Ci:6:002:0 s c0 05 0d04 0000 0004 4 <
ffff000103533240 1182753321 C Ci:6:002:0 0 4 = 088d90b1
ffff000103533240 1182753358 S Ci:6:002:0 s c0 05 0c1c 0000 0004 4 <
ffff000103533240 1182753475 C Ci:6:002:0 0 4 = 0300402d
ffff000103533240 1182753512 S Co:6:002:0 s 40 05 0c1c 0000 0004 4 = 0300e032
ffff000103533240 1182753626 C Co:6:002:0 0 4 >
ffff000103533240 1182753664 S Ci:6:002:0 s c0 05 0e1c 0000 0004 4 <
ffff000103533240 1182753773 C Ci:6:002:0 0 4 = 0300402d
ffff000103533240 1182753809 S Co:6:002:0 s 40 05 0e1c 0000 0004 4 = 0300e035
ffff000103533240 1182753916 C Co:6:002:0 0 4 >
ffff000103533240 1182753952 S Co:6:002:0 s 40 05 0280 0000 0002 2 = 0001
ffff000103533240 1182754070 C Co:6:002:0 0 2 >
ffff000103533240 1182754107 S Ci:6:002:0 s c0 05 010c 0000 0001 1 <
ffff000103533240 1182754223 C Ci:6:002:0 0 1 = b4
ffff000103533240 1182754261 S Co:6:002:0 s 40 05 010c 0000 0001 1 = b4
ffff000103533240 1182754365 C Co:6:002:0 0 1 >
ffff000103533240 1182754413 S Ci:6:002:0 s c0 05 004c 0000 0001 1 <
ffff000103533240 1182754520 C Ci:6:002:0 0 1 = 20
ffff000103533240 1182754558 S Co:6:002:0 s 40 05 004c 0000 0001 1 = 20
ffff000103533240 1182754664 C Co:6:002:0 0 1 >
ffff000103533900 1182851123 C Bi:6:002:1 0 476 = a4010484 00000f80 320e6000 04300000 00000000 7d683b01 28260000 53dfdf0f
ffff000103533900 1182851155 S Bi:6:002:1 -115 32768 <
ffff000103558cc0 1182852068 C Bi:6:002:1 0 469 = 9d010484 00000f80 80026000 04300000 00000000 596c3b01 28260000 52d5d50f
ffff000103558cc0 1182852094 S Bi:6:002:1 -115 32768 <
ffff00014c2bf900 1182852923 C Bi:6:002:1 0 444 = 84010484 00000f80 f4076000 04300000 00000000 d66f3b01 2a260000 50d7d70f
ffff00014c2bf900 1182852950 S Bi:6:002:1 -115 32768 <
ffff00013d62e840 1182853872 C Bi:6:002:1 0 467 = 9b010484 00000f80 f40f6000 04300000 00000000 6c733b01 2a260000 53d3d30f
ffff00013d62e840 1182853896 S Bi:6:002:1 -115 32768 <
ffff000103533900 1182854790 C Bi:6:002:1 0 477 = a5010484 00000f80 83086000 04300000 00000000 f5763b01 28280000 4fdada0f
ffff000103533900 1182854815 S Bi:6:002:1 -115 32768 <
ffff000103558cc0 1182953507 C Bi:6:002:1 0 476 = a4010484 00000f80 330e6000 04300000 00000000 7ff83c01 2a280000 4dcccc0f
ffff000103558cc0 1182953553 S Bi:6:002:1 -115 32768 <
ffff00014c2bf900 1182954453 C Bi:6:002:1 0 469 = 9d010484 00000f80 81026000 04300000 00000000 53fc3c01 2a260000 4cdddd0f
ffff00014c2bf900 1182954490 S Bi:6:002:1 -115 32768 <
ffff00013d62e840 1182955227 C Bi:6:002:1 0 444 = 84010484 00000f80 f5076000 04300000 00000000 c5ff3c01 28260000 50d4d40f
ffff00013d62e840 1182955250 S Bi:6:002:1 -115 32768 <
ffff000103533900 1182956154 C Bi:6:002:1 0 467 = 9b010484 00000f80 f50f6000 04300000 00000000 50033d01 2a260000 4fd6d60f
ffff000103533900 1182956172 S Bi:6:002:1 -115 32768 <
ffff000103558cc0 1182957065 C Bi:6:002:1 0 477 = a5010484 00000f80 84086000 04300000 00000000 d3063d01 2a280000 55d5d50f
ffff000103558cc0 1182957070 S Bi:6:002:1 -115 32768 <
ffff00014c2bf900 1183055869 C Bi:6:002:1 0 476 = a4010484 00000f80 340e6000 04300000 00000000 81883e01 2a280000 50d9d90f
ffff00014c2bf900 1183055901 S Bi:6:002:1 -115 32768 <
ffff00013d62e840 1183056872 C Bi:6:002:1 0 469 = 9d010484 00000f80 82026000 04300000 00000000 4c8c3e01 28280000 53dbdb0f
ffff00013d62e840 1183056898 S Bi:6:002:1 -115 32768 <
ffff000103533900 1183057724 C Bi:6:002:1 0 444 = 84010484 00000f80 f6076000 04300000 00000000 c88f3e01 26260000 50d6d60f
ffff000103533900 1183057748 S Bi:6:002:1 -115 32768 <
ffff000103558cc0 1183058652 C Bi:6:002:1 0 467 = 9b010484 00000f80 f60f6000 04300000 00000000 58933e01 28260000 4ed8d80f
ffff000103558cc0 1183058677 S Bi:6:002:1 -115 32768 <
ffff00014c2bf900 1183059573 C Bi:6:002:1 0 477 = a5010484 00000f80 85086000 04300000 00000000 e4963e01 28280000 50d9d90f
ffff00014c2bf900 1183059600 S Bi:6:002:1 -115 32768 <
