ffff000103533900 1184252778 C Bi:6:002:1 0 383 = 47010484 00000f80 310b6000 04300000 00000000 31cc5001 463c0000 8c090901
ffff000103533900 1184252846 S Bi:6:002:1 -115 32768 <
ffff000103558cc0 1184254832 C Bi:6:002:1 0 374 = 3e010484 00000f80 31076000 04300000 00000000 65d45001 463a0000 89f9f901
ffff000103558cc0 1184254857 S Bi:6:002:1 -115 32768 <
ffff00014c2bf900 1184257744 C Bi:6:002:1 0 384 = 48010484 00000f80 010a6000 04300000 00000000 a9df5001 463a0000 8afbfb01
ffff00014c2bf900 1184257771 S Bi:6:002:1 -115 32768 <
ffff00013d62e840 1184355114 C Bi:6:002:1 0 383 = 47010484 00000f80 320b6000 04300000 00000000 325c5201 46400000 84eaea01
ffff00013d62e840 1184355138 S Bi:6:002:1 -115 32768 <
ffff000103533900 1184361038 C Bi:6:002:1 0 351 = 27010484 00000f80 5f0c6000 04300000 00000000 83735201 443a0000 88f1f101
ffff000103533900 1184361070 S Bi:6:002:1 -115 32768 <
ffff000103558cc0 1184362095 C Bi:6:002:1 0 374 = 3e010484 00000f80 32076000 04300000 00000000 57775201 463c0000 87eeee01
ffff000103558cc0 1184362121 S Bi:6:002:1 -115 32768 <
ffff00014c2bf900 1184363211 C Bi:6:002:1 0 384 = 48010484 00000f80 020a6000 04300000 00000000 aa7b5201 463a0000 87f4f401
ffff00014c2bf900 1184363236 S Bi:6:002:1 -115 32768 <
ffff00013d62e840 1184457587 C Bi:6:002:1 0 383 = 47010484 00000f80 330b6000 04300000 00000000 49ec5301 483c0000 86fcfc01
ffff00013d62e840 1184457643 S Bi:6:002:1 -115 32768 <
ffff000103533900 1184458754 C Bi:6:002:1 0 376 = 40010484 00000f80 a0026000 04300000 00000000 fff05301 463a0000 8af9f901
ffff000103533900 1184458779 S Bi:6:002:1 -115 32768 <
ffff000103558cc0 1184459505 C Bi:6:002:1 0 351 = 27010484 00000f80 600c6000 04300000 00000000 13f45301 463e0000 8bf6f601
ffff000103558cc0 1184459531 S Bi:6:002:1 -115 32768 <
ffff00014c2bf900 1184460506 C Bi:6:002:1 0 374 = 3e010484 00000f80 33076000 04300000 00000000 daf75301 463a0000 88efef01
ffff00014c2bf900 1184460529 S Bi:6:002:1 -115 32768 <
ffff00013d62e840 1184463101 C Bi:6:002:1 0 384 = 48010484 00000f80 030a6000 04300000 00000000 f2015401 463a0000 85efef01
ffff00013d62e840 1184463126 S Bi:6:002:1 -115 32768 <
ffff000103533900 1184560475 C Bi:6:002:1 0 383 = 47010484 00000f80 340b6000 04300000 00000000 627e5501 483e0000 86f7f701
ffff000103533900 1184560505 S Bi:6:002:1 -115 32768 <
ffff000103558cc0 1184561796 C Bi:6:002:1 0 376 = 40010484 00000f80 a1026000 04300000 00000000 7a835501 463a0000 87e5e501
ffff000103558cc0 1184561822 S Bi:6:002:1 -115 32768 <
ffff00014c2bf900 1184562652 C Bi:6:002:1 0 351 = 27010484 00000f80 610c6000 04300000 00000000 f9865501 463a0000 89f3f301
ffff00014c2bf900 1184562676 S Bi:6:002:1 -115 32768 <
ffff00013d62e840 1184565450 C Bi:6:002:1 0 374 = 3e010484 00000f80 34076000 04300000 00000000 e3915501 463a0000 86efef01
ffff00013d62e840 1184565487 S Bi:6:002:1 -115 32768 <
ffff000103533900 1184566357 C Bi:6:002:1 0 384 = 48010484 00000f80 040a6000 04300000 00000000 3c955501 483a0000 87f6f601
ffff000103533900 1184566383 S Bi:6:002:1 -115 32768 <
ffff000103558cc0 1184662321 C Bi:6:002:1 0 383 = 47010484 00000f80 350b6000 04300000 00000000 370c5701 463a0000 89f2f201
ffff000103558cc0 1184662354 S Bi:6:002:1 -115 32768 <
ffff00014c2bf900 1184663559 C Bi:6:002:1 0 376 = 40010484 00000f80 a2026000 04300000 00000000 00115701 463e0000 84fbfb01
ffff00014c2bf900 1184663585 S Bi:6:002:1 -115 32768 <
ffff00013d62e840 1184664460 C Bi:6:002:1 0 351 = 27010484 00000f80 620c6000 04300000 00000000 ba145701 463a0000 87e4e401
ffff00013d62e840 1184664483 S Bi:6:002:1 -115 32768 <
ffff000103533900 1184665469 C Bi:6:002:1 0 374 = 3e010484 00000f80 35076000 04300000 00000000 64185701 463a0000 8bf6f601
ffff000103533900 1184665496 S Bi:6:002:1 -115 32768 <
ffff000103558cc0 1184667959 C Bi:6:002:1 0 384 = 48010484 00000f80 050a6000 04300000 00000000 2d225701 463a0000 89fdfd01
ffff000103558cc0 1184667983 S Bi:6:002:1 -115 32768 <
ffff000103533240 1184764305 S Ci:6:002:0 s c0 05 004c 0000 0001 1 <
ffff000103533240 1184764470 C Ci:6:002:0 0 1 = 20
ffff000103533240 1184764634 S Co:6:002:0 s 40 05 004c 0000 0001 1 = 20
ffff00014c2bf900 1184764727 C Bi:6:002:1 0 383 = 47010484 00000f80 360b6000 04300000 00000000 389c5801 463c0000 89f2f201
ffff00014c2bf900 1184764740 S Bi:6:002:1 -115 32768 <
ffff000103533240 1184764773 C Co:6:002:0 0 1 >
ffff000103533240 1184764936 S Ci:6:002:0 s c0 05 0770 0000 0004 4 <
ffff000103533240 1184765067 C Ci:6:002:0 0 4 = 00000000
ffff000103533240 1184765224 S Ci:6:002:0 s c0 05 0774 0000 0004 4 <
ffff000103533240 1184765371 C Ci:6:002:0 0 4 = 00000000
ffff000103533240 1184765528 S Co:6:002:0 s 40 05 076e 0000 0001 1 = 0c
ffff000103533240 1184765667 C Co:6:002:0 0 1 >
ffff000103533240 1184765828 S Ci:6:002:0 s c0 05 0808 0000 0004 4 <
ffff000103533240 1184765975 C Ci:6:002:0 0 4 = 3382023e
ffff00013d62e840 1184766037 C Bi:6:002:1 0 376 = 40010484 00000f80 a3026000 04300000 00000000 87a15801 443a0000 87000001
ffff00013d62e840 1184766054 S Bi:6:002:1 -115 32768 <
ffff000103533240 1184766142 S Ci:6:002:0 s c0 05 0a5c 0000 0002 2 <
ffff000103533240 1184766259 C Ci:6:002:0 0 2 = b800
ffff000103533240 1184766285 S Ci:6:002:0 s c0 05 0f48 0000 0002 2 <
ffff000103533240 1184766397 C Ci:6:002:0 0 2 = ab02
ffff000103533240 1184766426 S Ci:6:002:0 s c0 05 0f04 0000 0004 4 <
ffff000103533240 1184766552 C Ci:6:002:0 0 4 = 05000300
ffff000103533240 1184766581 S Ci:6:002:0 s c0 05 0f14 0000 0004 4 <
ffff000103533240 1184766693 C Ci:6:002:0 0 4 = e2002e00
ffff000103533240 1184766722 S Ci:6:002:0 s c0 05 0f10 0000 0004 4 <
ffff000103533240 1184766840 C Ci:6:002:0 0 4 = 00000000
ffff000103533480 1184766861 S Ci:6:002:0 s c0 05 0f0c 0000 0004 4 <
ffff000103533900 1184766888 C Bi:6:002:1 0 351 = 27010484 00000f80 630c6000 04300000 00000000 25a55801 463a0000 86f0f001
ffff000103533900 1184766915 S Bi:6:002:1 -115 32768 <
ffff000103533480 1184766954 C Ci:6:002:0 0 4 = 00000000
ffff000103533480 1184766970 S Ci:6:002:0 s c0 05 0f08 0000 0004 4 <
ffff000103533480 1184767027 C Ci:6:002:0 0 4 = 2001bb03
ffff000103533480 1184767085 S Ci:6:002:0 s c0 05 0fcc 0000 0004 4 <
ffff000103533480 1184767199 C Ci:6:002:0 0 4 = 00000000
ffff000103533480 1184767228 S Ci:6:002:0 s c0 05 09a4 0000 0004 4 <
ffff000103533480 1184767346 C Ci:6:002:0 0 4 = 80000800
ffff000103533480 1184767370 S Co:6:002:0 s 40 05 09a4 0000 0004 4 = 80000a00
ffff000103533480 1184767477 C Co:6:002:0 0 4 >
ffff000103533480 1184767506 S Ci:6:002:0 s c0 05 09a4 0000 0004 4 <
ffff000103533480 1184767622 C Ci:6:002:0 0 4 = 80000a00
ffff000103533480 1184767646 S Co:6:002:0 s 40 05 09a4 0000 0004 4 = 80000800
ffff000103533480 1184767755 C Co:6:002:0 0 4 >
ffff000103533480 1184767784 S Ci:6:002:0 s c0 05 0a2c 0000 0004 4 <
ffff000103533480 1184767903 C Ci:6:002:0 0 4 = 00809000
ffff000103533480 1184767926 S Co:6:002:0 s 40 05 0a2c 0000 0004 4 = 00009000
ffff000103533480 1184768049 C Co:6:002:0 0 4 >
ffff000103533480 1184768078 S Ci:6:002:0 s c0 05 0a2c 0000 0004 4 <
ffff000103533480 1184768198 C Ci:6:002:0 0 4 = 00009000
ffff000103533480 1184768321 S Co:6:002:0 s 40 05 0a2c 0000 0004 4 = 00809000
ffff000103533480 1184768437 C Co:6:002:0 0 4 >
ffff000103533480 1184768581 S Ci:6:002:0 s c0 05 0b58 0000 0004 4 <
ffff000103533480 1184768706 C Ci:6:002:0 0 4 = 00000000
ffff000103533480 1184768848 S Co:6:002:0 s 40 05 0b58 0000 0004 4 = 01000000
ffff000103558cc0 1184768885 C Bi:6:002:1 0 384 = 48010484 00000f80 060a6000 04300000 00000000 85ac5801 463c0000 8bfdfd01
ffff000103558cc0 1184768928 S Bi:6:002:1 -115 32768 <
ffff000103533480 1184768982 C Co:6:002:0 0 4 >
ffff000103533480 1184769103 S Ci:6:002:0 s c0 05 0b58 0000 0004 4 <
ffff000103533480 1184769245 C Ci:6:002:0 0 4 = 01000000
ffff000103533480 1184769400 S Co:6:002:0 s 40 05 0b58 0000 0004 4 = 00000000
ffff000103533480 1184769516 C Co:6:002:0 0 4 >
ffff000103533480 1184769546 S Ci:6:002:0 s c0 05 01cc 0000 0001 1 <
ffff000103533480 1184769670 C Ci:6:002:0 0 1 = 00
ffff000103533480 1184769699 S Co:6:002:0 s 40 05 01f8 0000 0004 4 = 00000000
ffff000103533480 1184769813 C Co:6:002:0 0 4 >
ffff000103533480 1184769834 S Co:6:002:0 s 40 05 01d8 0000 0004 4 = 58000000
ffff000103533480 1184769944 C Co:6:002:0 0 4 >
ffff000103533480 1184769973 S Co:6:002:0 s 40 05 0440 0000 0004 4 = 00000000
ffff000103533480 1184770082 C Co:6:002:0 0 4 >
ffff000103533480 1184770104 S Ci:6:002:0 s c0 05 0c00 0000 0004 4 <
ffff000103533480 1184770215 C Ci:6:002:0 0 4 = 07000000
ffff000103533480 1184770244 S Ci:6:002:0 s c0 05 08b0 0000 0004 4 <
ffff000103533480 1184770356 C Ci:6:002:0 0 4 = 18060000
ffff000103533480 1184770385 S Co:6:002:0 s 40 05 08b0 0000 0004 4 = 42060000
ffff000103533480 1184770493 C Co:6:002:0 0 4 >
ffff000103533480 1184770543 S Ci:6:002:0 s c0 05 0d04 0000 0004 4 <
ffff000103533480 1184770669 C Ci:6:002:0 0 4 = 088d90b1
ffff000103533480 1184770699 S Co:6:002:0 s 40 05 0c90 0000 0004 4 = 088d2304
ffff000103533480 1184770807 C Co:6:002:0 0 4 >
ffff000103533480 1184770850 S Co:6:002:0 s 40 05 0280 0000 0002 2 = 0001
ffff000103533480 1184770952 C Co:6:002:0 0 2 >
ffff000103533480 1184770982 S Ci:6:002:0 s c0 05 010c 0000 0001 1 <
ffff000103533480 1184771094 C Ci:6:002:0 0 1 = b4
ffff000103533480 1184771126 S Co:6:002:0 s 40 05 010c 0000 0001 1 = b4
ffff000103533480 1184771233 C Co:6:002:0 0 1 >
ffff00014c2bf900 1184868144 C Bi:6:002:1 0 376 = 40010484 00000f80 a4026000 04300000 00000000 14305a01 463c0000 88efef01
ffff00014c2bf900 1184868205 S Bi:6:002:1 -115 32768 <
ffff00013d62e840 1184869334 C Bi:6:002:1 0 351 = 27010484 00000f80 640c6000 04300000 00000000 fc345a01 463e0000 87fafa01
ffff00013d62e840 1184869360 S Bi:6:002:1 -115 32768 <
ffff000103533900 1184870146 C Bi:6:002:1 0 374 = 3e010484 00000f80 37076000 04300000 00000000 07385a01 483c0000 85e9e901
ffff000103533900 1184870171 S Bi:6:002:1 -115 32768 <
ffff000103558cc0 1184872644 C Bi:6:002:1 0 384 = 48010484 00000f80 070a6000 04300000 00000000 b8415a01 46380000 89f0f001
ffff000103558cc0 1184872668 S Bi:6:002:1 -115 32768 <
ffff00014c2bf900 1184969531 C Bi:6:002:1 0 383 = 47010484 00000f80 380b6000 04300000 00000000 3bbc5b01 463c0000 89f3f301
ffff00014c2bf900 1184969585 S Bi:6:002:1 -115 32768 <
ffff00013d62e840 1184970561 C Bi:6:002:1 0 376 = 40010484 00000f80 a5026000 04300000 00000000 3cc05b01 463c0000 87f2f201
ffff00013d62e840 1184970587 S Bi:6:002:1 -115 32768 <
ffff000103533900 1184971378 C Bi:6:002:1 0 351 = 27010484 00000f80 650c6000 04300000 00000000 93c35b01 46360000 87f6f601
ffff000103533900 1184971402 S Bi:6:002:1 -115 32768 <
ffff000103558cc0 1184972214 C Bi:6:002:1 0 374 = 3e010484 00000f80 38076000 04300000 00000000 d0c65b01 46360000 88f0f001
ffff000103558cc0 1184972236 S Bi:6:002:1 -115 32768 <
ffff00014c2bf900 1184973093 C Bi:6:002:1 0 384 = 48010484 00000f80 080a6000 04300000 00000000 33ca5b01 463c0000 89fbfb01
ffff00014c2bf900 1184973112 S Bi:6:002:1 -115 32768 <
ffff00013d62e840 1185071944 C Bi:6:002:1 0 383 = 47010484 00000f80 390b6000 04300000 00000000 3d4c5d01 463c0000 87f4f401
ffff00013d62e840 1185071994 S Bi:6:002:1 -115 32768 <
ffff000103533900 1185072923 C Bi:6:002:1 0 376 = 40010484 00000f80 a6026000 04300000 00000000 1b505d01 463c0000 89f5f501
ffff000103533900 1185072949 S Bi:6:002:1 -115 32768 <
ffff000103558cc0 1185073844 C Bi:6:002:1 0 351 = 27010484 00000f80 660c6000 04300000 00000000 d9535d01 463e0000 88f5f501
ffff000103558cc0 1185073869 S Bi:6:002:1 -115 32768 <
ffff00014c2bf900 1185074769 C Bi:6:002:1 0 374 = 3e010484 00000f80 39076000 04300000 00000000 57575d01 463a0000 86ecec01
ffff00014c2bf900 1185074793 S Bi:6:002:1 -115 32768 <
ffff00013d62e840 1185175453 C Bi:6:002:1 0 376 = 40010484 00000f80 a7026000 04300000 00000000 bae05e01 463e0000 87000001
ffff00013d62e840 1185175496 S Bi:6:002:1 -115 32768 <
ffff000103533900 1185180863 C Bi:6:002:1 0 374 = 3e010484 00000f80 3a076000 04300000 00000000 caf55e01 463c0000 87f4f401
ffff000103533900 1185180890 S Bi:6:002:1 -115 32768 <
ffff000103558cc0 1185181685 C Bi:6:002:1 0 384 = 48010484 00000f80 0a0a6000 04300000 00000000 edf85e01 463c0000 86fbfb01
ffff000103558cc0 1185181707 S Bi:6:002:1 -115 32768 <
ffff000105bdc540 1185190652 S Ci:6:002:0 s c0 05 0454 0000 0001 1 <
ffff000105bdc540 1185190810 C Ci:6:002:0 0 1 = 00
ffff000105bdc540 1185190841 S Ci:6:002:0 s c0 05 0860 0000 0004 4 <
ffff000105bdc540 1185190950 C Ci:6:002:0 0 4 = 21c3d572
ffff000103558600 1185190990 S Co:6:002:0 s 40 05 0860 0000 0004 4 = 21c3d572
ffff000103558600 1185191096 C Co:6:002:0 0 4 >
ffff0001197b9540 1185191135 S Ci:6:002:0 s c0 05 0c00 0000 0004 4 <
ffff0001197b9540 1185191247 C Ci:6:002:0 0 4 = 07000000
ffff0001197b9540 1185191311 S Ci:6:002:0 s c0 05 08b0 0000 0004 4 <
ffff0001197b9540 1185191425 C Ci:6:002:0 0 4 = 42060000
ffff0001197b9540 1185191471 S Co:6:002:0 s 40 05 08b0 0000 0004 4 = 18060000
ffff0001197b9540 1185191578 C Co:6:002:0 0 4 >
ffff0001197b9540 1185191646 S Ci:6:002:0 s c0 05 0d04 0000 0004 4 <
ffff0001197b9540 1185191771 C Ci:6:002:0 0 4 = 017c90b1
ffff0001197b9540 1185191817 S Co:6:002:0 s 40 05 0c90 0000 0004 4 = 017c8001
ffff0001197b9540 1185191922 C Co:6:002:0 0 4 >
ffff0001197b9540 1185191980 S Ci:6:002:0 s c0 05 08ac 0000 0004 4 <
ffff0001197b9540 1185192104 C Ci:6:002:0 0 4 = 08faf00f
ffff0001197b9540 1185192150 S Co:6:002:0 s 40 05 08ac 0000 0004 4 = 08faf00f
ffff0001197b9540 1185192263 C Co:6:002:0 0 4 >
ffff0001197b9540 1185192307 S Ci:6:002:0 s c0 05 08ac 0000 0004 4 <
ffff0001197b9540 1185192422 C Ci:6:002:0 0 4 = 08faf00f
ffff0001197b9540 1185192468 S Co:6:002:0 s 40 05 08ac 0000 0004 4 = 08faf00f
ffff0001197b9540 1185192574 C Co:6:002:0 0 4 >
ffff0001197b9540 1185192620 S Ci:6:002:0 s c0 05 08c4 0000 0004 4 <
ffff0001197b9540 1185192741 C Ci:6:002:0 0 4 = 00000000
ffff0001197b9540 1185192786 S Co:6:002:0 s 40 05 08c4 0000 0004 4 = 00000000
ffff0001197b9540 1185192892 C Co:6:002:0 0 4 >
ffff0001197b9540 1185192938 S Ci:6:002:0 s c0 05 0c00 0000 0004 4 <
ffff0001197b9540 1185193059 C Ci:6:002:0 0 4 = 07000000
ffff0001197b9540 1185193104 S Ci:6:002:0 s c0 05 08b0 0000 0004 4 <
ffff0001197b9540 1185193215 C Ci:6:002:0 0 4 = 18060000
ffff0001197b9540 1185193260 S Co:6:002:0 s 40 05 08b0 0000 0004 4 = 18060000
ffff0001197b9540 1185193367 C Co:6:002:0 0 4 >
ffff0001197b9540 1185193434 S Ci:6:002:0 s c0 05 0d04 0000 0004 4 <
ffff0001197b9540 1185193554 C Ci:6:002:0 0 4 = 017c90b1
ffff0001197b9540 1185193601 S Co:6:002:0 s 40 05 0c90 0000 0004 4 = 017c8001
ffff0001197b9540 1185193707 C Co:6:002:0 0 4 >
ffff0001197b9540 1185193767 S Ci:6:002:0 s c0 05 0e00 0000 0004 4 <
ffff0001197b9540 1185193888 C Ci:6:002:0 0 4 = 07000000
ffff0001197b9540 1185193933 S Ci:6:002:0 s c0 05 08b0 0000 0004 4 <
ffff0001197b9540 1185194047 C Ci:6:002:0 0 4 = 18060000
ffff0001197b9540 1185194091 S Co:6:002:0 s 40 05 08b0 0000 0004 4 = 18060000
ffff0001197b9540 1185194198 C Co:6:002:0 0 4 >
ffff0001197b9540 1185194264 S Ci:6:002:0 s c0 05 0d44 0000 0004 4 <
ffff0001197b9540 1185194385 C Ci:6:002:0 0 4 = 017c90b1
ffff0001197b9540 1185194430 S Co:6:002:0 s 40 05 0e90 0000 0004 4 = 017c8001
ffff0001197b9540 1185194542 C Co:6:002:0 0 4 >
ffff0001197b9540 1185194604 S Ci:6:002:0 s c0 05 08ac 0000 0004 4 <
ffff0001197b9540 1185194725 C Ci:6:002:0 0 4 = 08faf00f
ffff0001197b9540 1185194770 S Co:6:002:0 s 40 05 08ac 0000 0004 4 = 08faf00f
ffff0001197b9540 1185194876 C Co:6:002:0 0 4 >
ffff0001197b9540 1185194922 S Ci:6:002:0 s c0 05 08ac 0000 0004 4 <
ffff0001197b9540 1185195047 C Ci:6:002:0 0 4 = 08faf00f
ffff0001197b9540 1185195093 S Co:6:002:0 s 40 05 08ac 0000 0004 4 = 08faf00f
ffff0001197b9540 1185195199 C Co:6:002:0 0 4 >
ffff0001197b9540 1185195245 S Ci:6:002:0 s c0 05 08c4 0000 0004 4 <
ffff0001197b9540 1185195366 C Ci:6:002:0 0 4 = 00000000
ffff0001197b9540 1185195411 S Co:6:002:0 s 40 05 08c4 0000 0004 4 = 00000000
ffff0001197b9540 1185195518 C Co:6:002:0 0 4 >
ffff0001197b9540 1185195564 S Ci:6:002:0 s c0 05 0e00 0000 0004 4 <
ffff0001197b9540 1185195685 C Ci:6:002:0 0 4 = 07000000
ffff0001197b9540 1185195730 S Ci:6:002:0 s c0 05 08b0 0000 0004 4 <
ffff0001197b9540 1185195843 C Ci:6:002:0 0 4 = 18060000
ffff0001197b9540 1185195889 S Co:6:002:0 s 40 05 08b0 0000 0004 4 = 18060000
ffff0001197b9540 1185196003 C Co:6:002:0 0 4 >
ffff0001197b9540 1185196070 S Ci:6:002:0 s c0 05 0d44 0000 0004 4 <
ffff0001197b9540 1185196205 C Ci:6:002:0 0 4 = 017c90b1
ffff0001197b9540 1185196253 S Co:6:002:0 s 40 05 0e90 0000 0004 4 = 017c8001
ffff0001197b9540 1185196369 C Co:6:002:0 0 4 >
ffff0001197b9540 1185196428 S Ci:6:002:0 s c0 05 0668 0000 0002 2 <
ffff0001197b9540 1185196562 C Ci:6:002:0 0 2 = 0010
ffff0001197b9540 1185196608 S Co:6:002:0 s 40 05 0668 0000 0002 2 = 0010
ffff0001197b9540 1185196714 C Co:6:002:0 0 2 >
ffff0001197b9540 1185196761 S Co:6:002:0 s 40 05 0483 0000 0001 1 = 00
ffff0001197b9540 1185196875 C Co:6:002:0 0 1 >
ffff0001197b9540 1185196921 S Ci:6:002:0 s c0 05 0837 0000 0001 1 <
ffff0001197b9540 1185197049 C Ci:6:002:0 0 1 = 00
ffff0001197b9540 1185197094 S Ci:6:002:0 s c0 05 08ac 0000 0004 4 <
ffff0001197b9540 1185197206 C Ci:6:002:0 0 4 = 08faf00f
ffff0001197b9540 1185197252 S Co:6:002:0 s 40 05 08ac 0000 0004 4 = 08faf00f
ffff0001197b9540 1185197358 C Co:6:002:0 0 4 >
ffff0001197b9540 1185197405 S Ci:6:002:0 s c0 05 08c4 0000 0004 4 <
ffff0001197b9540 1185197543 C Ci:6:002:0 0 4 = 00000000
ffff0001197b9540 1185197589 S Co:6:002:0 s 40 05 08c4 0000 0004 4 = 00000000
ffff0001197b9540 1185197695 C Co:6:002:0 0 4 >
ffff0001197b9540 1185197742 S Ci:6:002:0 s c0 05 0848 0000 0004 4 <
ffff0001197b9540 1185197864 C Ci:6:002:0 0 4 = 8bffd061
ffff0001197b9540 1185197910 S Co:6:002:0 s 40 05 0848 0000 0004 4 = 8bffd061
ffff0001197b9540 1185198016 C Co:6:002:0 0 4 >
ffff0001197b9540 1185198063 S Ci:6:002:0 s c0 05 08ac 0000 0004 4 <
ffff0001197b9540 1185198185 C Ci:6:002:0 0 4 = 08faf00f
ffff0001197b9540 1185198229 S Co:6:002:0 s 40 05 08ac 0000 0004 4 = 08faf00f
ffff0001197b9540 1185198336 C Co:6:002:0 0 4 >
ffff0001197b9540 1185198382 S Ci:6:002:0 s c0 05 08ac 0000 0004 4 <
ffff0001197b9540 1185198503 C Ci:6:002:0 0 4 = 08faf00f
ffff0001197b9540 1185198548 S Co:6:002:0 s 40 05 08ac 0000 0004 4 = 08faf00f
ffff0001197b9540 1185198665 C Co:6:002:0 0 4 >
ffff0001197b9540 1185198711 S Ci:6:002:0 s c0 05 08c4 0000 0004 4 <
ffff0001197b9540 1185198833 C Ci:6:002:0 0 4 = 00000000
ffff0001197b9540 1185198878 S Co:6:002:0 s 40 05 08c4 0000 0004 4 = 00000000
ffff0001197b9540 1185198984 C Co:6:002:0 0 4 >
ffff0001197b9540 1185199031 S Ci:6:002:0 s c0 05 0c00 0000 0004 4 <
ffff0001197b9540 1185199169 C Ci:6:002:0 0 4 = 07000000
ffff0001197b9540 1185199214 S Ci:6:002:0 s c0 05 08b0 0000 0004 4 <
ffff0001197b9540 1185199324 C Ci:6:002:0 0 4 = 18060000
ffff0001197b9540 1185199369 S Co:6:002:0 s 40 05 08b0 0000 0004 4 = 18060000
ffff0001197b9540 1185199484 C Co:6:002:0 0 4 >
ffff0001197b9540 1185199549 S Ci:6:002:0 s c0 05 0d04 0000 0004 4 <
ffff0001197b9540 1185199670 C Ci:6:002:0 0 4 = 017c90b1
ffff0001197b9540 1185199714 S Co:6:002:0 s 40 05 0c90 0000 0004 4 = 017c8001
ffff0001197b9540 1185199822 C Co:6:002:0 0 4 >
ffff0001197b9540 1185199881 S Ci:6:002:0 s c0 05 0e00 0000 0004 4 <
ffff0001197b9540 1185200000 C Ci:6:002:0 0 4 = 07000000
ffff0001197b9540 1185200046 S Ci:6:002:0 s c0 05 08b0 0000 0004 4 <
ffff0001197b9540 1185200168 C Ci:6:002:0 0 4 = 18060000
ffff0001197b9540 1185200214 S Co:6:002:0 s 40 05 08b0 0000 0004 4 = 18060000
ffff0001197b9540 1185200321 C Co:6:002:0 0 4 >
ffff0001197b9540 1185200388 S Ci:6:002:0 s c0 05 0d44 0000 0004 4 <
ffff0001197b9540 1185200505 C Ci:6:002:0 0 4 = 017c90b1
ffff0001197b9540 1185200552 S Co:6:002:0 s 40 05 0e90 0000 0004 4 = 017c8001
ffff0001197b9540 1185200667 C Co:6:002:0 0 4 >
ffff0001197b9540 1185200749 S Ci:6:002:0 s c0 05 0c20 0000 0004 4 <
ffff0001197b9540 1185200868 C Ci:6:002:0 0 4 = 13131313
ffff0001197b9540 1185200914 S Co:6:002:0 s 40 05 0c20 0000 0004 4 = 13131313
ffff0001197b9540 1185201021 C Co:6:002:0 0 4 >
ffff0001197b9540 1185201068 S Ci:6:002:0 s c0 05 0c24 0000 0004 4 <
ffff0001197b9540 1185201187 C Ci:6:002:0 0 4 = 20202020
ffff0001197b9540 1185201234 S Co:6:002:0 s 40 05 0c24 0000 0004 4 = 20202020
ffff0001197b9540 1185201341 C Co:6:002:0 0 4 >
ffff0001197b9540 1185201387 S Ci:6:002:0 s c0 05 0c28 0000 0004 4 <
ffff0001197b9540 1185201506 C Ci:6:002:0 0 4 = 20201e1c
ffff0001197b9540 1185201552 S Co:6:002:0 s 40 05 0c28 0000 0004 4 = 20201e1c
ffff0001197b9540 1185201667 C Co:6:002:0 0 4 >
ffff0001197b9540 1185201714 S Ci:6:002:0 s c0 05 0c2c 0000 0004 4 <
ffff0001197b9540 1185201832 C Ci:6:002:0 0 4 = 20202020
ffff0001197b9540 1185201878 S Co:6:002:0 s 40 05 0c2c 0000 0004 4 = 20202020
ffff0001197b9540 1185201984 C Co:6:002:0 0 4 >
ffff0001197b9540 1185202034 S Ci:6:002:0 s c0 05 0c30 0000 0004 4 <
ffff0001197b9540 1185202171 C Ci:6:002:0 0 4 = 20201e1c
ffff0001197b9540 1185202217 S Co:6:002:0 s 40 05 0c30 0000 0004 4 = 20201e1c
ffff0001197b9540 1185202324 C Co:6:002:0 0 4 >
ffff0001197b9540 1185202370 S Ci:6:002:0 s c0 05 0c34 0000 0004 4 <
ffff0001197b9540 1185202488 C Ci:6:002:0 0 4 = 20202020
ffff0001197b9540 1185202534 S Co:6:002:0 s 40 05 0c34 0000 0004 4 = 20202020
ffff0001197b9540 1185202641 C Co:6:002:0 0 4 >
ffff0001197b9540 1185202687 S Ci:6:002:0 s c0 05 0c38 0000 0004 4 <
ffff0001197b9540 1185202806 C Ci:6:002:0 0 4 = 201e1c1a
ffff0001197b9540 1185202852 S Co:6:002:0 s 40 05 0c38 0000 0004 4 = 201e1c1a
ffff0001197b9540 1185202958 C Co:6:002:0 0 4 >
ffff0001197b9540 1185203005 S Ci:6:002:0 s c0 05 0c3c 0000 0004 4 <
ffff0001197b9540 1185203124 C Ci:6:002:0 0 4 = 20202020
ffff0001197b9540 1185203170 S Co:6:002:0 s 40 05 0c3c 0000 0004 4 = 20202020
ffff0001197b9540 1185203288 C Co:6:002:0 0 4 >
ffff0001197b9540 1185203335 S Ci:6:002:0 s c0 05 0c40 0000 0004 4 <
ffff0001197b9540 1185203453 C Ci:6:002:0 0 4 = 20201e1c
ffff0001197b9540 1185203499 S Co:6:002:0 s 40 05 0c40 0000 0004 4 = 20201e1c
ffff0001197b9540 1185203605 C Co:6:002:0 0 4 >
ffff0001197b9540 1185203652 S Ci:6:002:0 s c0 05 0c44 0000 0004 4 <
ffff0001197b9540 1185203789 C Ci:6:002:0 0 4 = 1a181e1e
ffff0001197b9540 1185203835 S Co:6:002:0 s 40 05 0c44 0000 0004 4 = 1a181e1e
ffff0001197b9540 1185203942 C Co:6:002:0 0 4 >
ffff0001197b9540 1185203988 S Ci:6:002:0 s c0 05 0c48 0000 0004 4 <
ffff0001197b9540 1185204121 C Ci:6:002:0 0 4 = 1e1e1e1e
ffff0001197b9540 1185204167 S Co:6:002:0 s 40 05 0c48 0000 0004 4 = 1e1e1e1e
ffff0001197b9540 1185204285 C Co:6:002:0 0 4 >
ffff0001197b9540 1185204334 S Ci:6:002:0 s c0 05 0c4c 0000 0004 4 <
ffff0001197b9540 1185204453 C Ci:6:002:0 0 4 = 1c1a1816
ffff0001197b9540 1185204498 S Co:6:002:0 s 40 05 0c4c 0000 0004 4 = 1c1a1816
ffff0001197b9540 1185204605 C Co:6:002:0 0 4 >
ffff0001197b9540 1185204651 S Ci:6:002:0 s c0 05 0c54 0000 0004 4 <
ffff0001197b9540 1185204770 C Ci:6:002:0 0 4 = 120a0400
ffff0001197b9540 1185204815 S Co:6:002:0 s 40 05 0c54 0000 0004 4 = 120a0400
ffff0001197b9540 1185204922 C Co:6:002:0 0 4 >
ffff0001197b9540 1185204969 S Ci:6:002:0 s c0 05 0e20 0000 0004 4 <
ffff0001197b9540 1185205087 C Ci:6:002:0 0 4 = 14141414
ffff0001197b9540 1185205132 S Co:6:002:0 s 40 05 0e20 0000 0004 4 = 14141414
ffff0001197b9540 1185205239 C Co:6:002:0 0 4 >
ffff0001197b9540 1185205286 S Ci:6:002:0 s c0 05 0e24 0000 0004 4 <
ffff0001197b9540 1185205421 C Ci:6:002:0 0 4 = 1d1d1d1d
ffff0001197b9540 1185205466 S Co:6:002:0 s 40 05 0e24 0000 0004 4 = 1d1d1d1d
ffff0001197b9540 1185205572 C Co:6:002:0 0 4 >
ffff0001197b9540 1185205619 S Ci:6:002:0 s c0 05 0e28 0000 0004 4 <
ffff0001197b9540 1185205737 C Ci:6:002:0 0 4 = 1d1d1b19
ffff0001197b9540 1185205783 S Co:6:002:0 s 40 05 0e28 0000 0004 4 = 1d1d1b19
ffff0001197b9540 1185205889 C Co:6:002:0 0 4 >
ffff0001197b9540 1185205936 S Ci:6:002:0 s c0 05 0e2c 0000 0004 4 <
ffff0001197b9540 1185206055 C Ci:6:002:0 0 4 = 1f1f1f1f
ffff0001197b9540 1185206100 S Co:6:002:0 s 40 05 0e2c 0000 0004 4 = 1f1f1f1f
ffff0001197b9540 1185206133 C Co:6:002:0 0 4 >
ffff0001197b9540 1185206169 S Ci:6:002:0 s c0 05 0e30 0000 0004 4 <
ffff0001197b9540 1185206225 C Ci:6:002:0 0 4 = 1f1f1d1b
ffff0001197b9540 1185206260 S Co:6:002:0 s 40 05 0e30 0000 0004 4 = 1f1f1d1b
ffff0001197b9540 1185206292 C Co:6:002:0 0 4 >
ffff0001197b9540 1185206327 S Ci:6:002:0 s c0 05 0e34 0000 0004 4 <
ffff0001197b9540 1185206363 C Ci:6:002:0 0 4 = 1f1f1f1f
ffff0001197b9540 1185206399 S Co:6:002:0 s 40 05 0e34 0000 0004 4 = 1f1f1f1f
ffff0001197b9540 1185206432 C Co:6:002:0 0 4 >
ffff0001197b9540 1185206467 S Ci:6:002:0 s c0 05 0e38 0000 0004 4 <
ffff0001197b9540 1185206504 C Ci:6:002:0 0 4 = 1f1d1b19
ffff0001197b9540 1185206540 S Co:6:002:0 s 40 05 0e38 0000 0004 4 = 1f1d1b19
ffff0001197b9540 1185206590 C Co:6:002:0 0 4 >
ffff0001197b9540 1185206625 S Ci:6:002:0 s c0 05 0e3c 0000 0004 4 <
ffff0001197b9540 1185206662 C Ci:6:002:0 0 4 = 1f1f1f1f
ffff0001197b9540 1185206697 S Co:6:002:0 s 40 05 0e3c 0000 0004 4 = 1f1f1f1f
ffff0001197b9540 1185206729 C Co:6:002:0 0 4 >
ffff0001197b9540 1185206764 S Ci:6:002:0 s c0 05 0e40 0000 0004 4 <
ffff0001197b9540 1185206802 C Ci:6:002:0 0 4 = 1f1f1d1b
ffff0001197b9540 1185206838 S Co:6:002:0 s 40 05 0e40 0000 0004 4 = 1f1f1d1b
ffff0001197b9540 1185206869 C Co:6:002:0 0 4 >
ffff0001197b9540 1185206904 S Ci:6:002:0 s c0 05 0e44 0000 0004 4 <
ffff0001197b9540 1185206941 C Ci:6:002:0 0 4 = 19171d1d
ffff00013d29e600 1185206976 S Co:6:002:0 s 40 05 0e44 0000 0004 4 = 19171d1d
ffff00013d29e600 1185207008 C Co:6:002:0 0 4 >
ffff00013d29e600 1185207044 S Ci:6:002:0 s c0 05 0e48 0000 0004 4 <
ffff00013d29e600 1185207170 C Ci:6:002:0 0 4 = 1d1d1d1d
ffff00013d29e600 1185207216 S Co:6:002:0 s 40 05 0e48 0000 0004 4 = 1d1d1d1d
ffff00013d29e600 1185207322 C Co:6:002:0 0 4 >
ffff00013d29e600 1185207368 S Ci:6:002:0 s c0 05 0e4c 0000 0004 4 <
ffff00013d29e600 1185207479 C Ci:6:002:0 0 4 = 1b191715
ffff00013d29e600 1185207525 S Co:6:002:0 s 40 05 0e4c 0000 0004 4 = 1b191715
ffff00013d29e600 1185207631 C Co:6:002:0 0 4 >
ffff00013d29e600 1185207677 S Ci:6:002:0 s c0 05 0e54 0000 0004 4 <
ffff00013d29e600 1185207796 C Ci:6:002:0 0 4 = 11090300
ffff00013d29e600 1185207843 S Co:6:002:0 s 40 05 0e54 0000 0004 4 = 11090300
ffff00013d29e600 1185207948 C Co:6:002:0 0 4 >
ffff00013d29e600 1185208026 S Ci:6:002:0 s c0 05 0454 0000 0001 1 <
ffff00013d29e600 1185208144 C Ci:6:002:0 0 1 = 00
ffff00013d29e600 1185208189 S Ci:6:002:0 s c0 05 0454 0000 0001 1 <
ffff00013d29e600 1185208301 C Ci:6:002:0 0 1 = 00
ffff00013d29e600 1185208346 S Co:6:002:0 s 40 05 0454 0000 0001 1 = 80
ffff00013d29e600 1185208461 C Co:6:002:0 0 1 >
ffff00013d29e600 1185208508 S Ci:6:002:0 s c0 05 041a 0000 0002 2 <
ffff00013d29e600 1185208628 C Ci:6:002:0 0 2 = ff0f
ffff00013d29e600 1185208674 S Ci:6:002:0 s c0 05 0808 0000 0004 4 <
ffff00013d29e600 1185208797 C Ci:6:002:0 0 4 = 3382023e
ffff00013d29e600 1185208841 S Co:6:002:0 s 40 05 0808 0000 0004 4 = 3382023e
ffff00013d29e600 1185208949 C Co:6:002:0 0 4 >
ffff00013d29e600 1185208997 S Ci:6:002:0 s c0 05 0834 0000 0004 4 <
ffff00013d29e600 1185209119 C Ci:6:002:0 0 4 = 05a73700
ffff00013d29e600 1185209164 S Co:6:002:0 s 40 05 0834 0000 0004 4 = 06a73700
ffff00013d29e600 1185209271 C Co:6:002:0 0 4 >
ffff00013d29e600 1185209317 S Ci:6:002:0 s c0 05 0830 0000 0004 4 <
ffff00013d29e600 1185209437 C Ci:6:002:0 0 4 = b8eeaa2e
ffff00013d29e600 1185209482 S Co:6:002:0 s 40 05 0830 0000 0004 4 = b8aeaa2e
ffff00013d29e600 1185209588 C Co:6:002:0 0 4 >
ffff00013d29e600 1185209635 S Ci:6:002:0 s c0 05 0830 0000 0004 4 <
ffff00013d29e600 1185209755 C Ci:6:002:0 0 4 = b8aeaa2e
ffff00013d29e600 1185209802 S Co:6:002:0 s 40 05 0830 0000 0004 4 = b8aeaa2e
ffff00013d29e600 1185209917 C Co:6:002:0 0 4 >
ffff00013d29e600 1185209964 S Ci:6:002:0 s c0 05 082c 0000 0004 4 <
ffff00013d29e600 1185210084 C Ci:6:002:0 0 4 = dc832000
ffff00013d29e600 1185210130 S Co:6:002:0 s 40 05 082c 0000 0004 4 = dd832000
ffff00013d29e600 1185210236 C Co:6:002:0 0 4 >
ffff00013d29e600 1185210283 S Co:6:002:0 s 40 05 0cb0 0000 0004 4 = 17773354
ffff00013d29e600 1185210415 C Co:6:002:0 0 4 >
ffff00013d29e600 1185210460 S Co:6:002:0 s 40 05 0eb0 0000 0004 4 = 17773354
ffff00013d29e600 1185210567 C Co:6:002:0 0 4 >
ffff00013d29e600 1185210614 S Ci:6:002:0 s c0 05 0cb4 0000 0004 4 <
ffff00013d29e600 1185210734 C Ci:6:002:0 0 4 = 77000001
ffff00013d29e600 1185210778 S Co:6:002:0 s 40 05 0cb4 0000 0004 4 = 77000001
ffff00013d29e600 1185210886 C Co:6:002:0 0 4 >
ffff00013d29e600 1185210931 S Ci:6:002:0 s c0 05 0eb4 0000 0004 4 <
ffff00013d29e600 1185211051 C Ci:6:002:0 0 4 = 77000001
ffff00013d29e600 1185211096 S Co:6:002:0 s 40 05 0eb4 0000 0004 4 = 77000001
ffff00013d29e600 1185211203 C Co:6:002:0 0 4 >
ffff00013d29e600 1185211249 S Ci:6:002:0 s c0 05 0900 0000 0004 4 <
ffff00013d29e600 1185211370 C Ci:6:002:0 0 4 = 01040000
ffff00013d29e600 1185211415 S Co:6:002:0 s 40 05 0900 0000 0004 4 = 01040000
ffff00013d29e600 1185211535 C Co:6:002:0 0 4 >
ffff00013d29e600 1185211581 S Ci:6:002:0 s c0 05 080c 0000 0004 4 <
ffff00013d29e600 1185211702 C Ci:6:002:0 0 4 = 13111312
ffff00013d29e600 1185211748 S Co:6:002:0 s 40 05 080c 0000 0004 4 = 03111312
ffff00013d29e600 1185211855 C Co:6:002:0 0 4 >
ffff00013d29e600 1185211901 S Ci:6:002:0 s c0 05 0a04 0000 0004 4 <
ffff00013d29e600 1185212040 C Ci:6:002:0 0 4 = 0c00ff01
ffff00013d29e600 1185212085 S Co:6:002:0 s 40 05 0a04 0000 0004 4 = 0c00ff0f
ffff00013d29e600 1185212199 C Co:6:002:0 0 4 >
ffff00013d29e600 1185212246 S Ci:6:002:0 s c0 05 0440 0000 0004 4 <
ffff00013d29e600 1185212368 C Ci:6:002:0 0 4 = 00000000
ffff00013d29e600 1185212413 S Co:6:002:0 s 40 05 0440 0000 0004 4 = 50010000
ffff00013d29e600 1185212520 C Co:6:002:0 0 4 >
ffff00013d29e600 1185212566 S Ci:6:002:0 s c0 05 0c1c 0000 0004 4 <
ffff00013d29e600 1185212687 C Ci:6:002:0 0 4 = 03000040
ffff00013d29e600 1185212732 S Co:6:002:0 s 40 05 0c1c 0000 0004 4 = 0300402d
ffff00013d29e600 1185212839 C Co:6:002:0 0 4 >
ffff00013d29e600 1185212885 S Ci:6:002:0 s c0 05 0e1c 0000 0004 4 <
ffff00013d29e600 1185213006 C Ci:6:002:0 0 4 = 03000040
ffff00013d29e600 1185213052 S Co:6:002:0 s 40 05 0e1c 0000 0004 4 = 0300402d
ffff00013d29e600 1185213167 C Co:6:002:0 0 4 >
ffff00013d29e600 1185213214 S Ci:6:002:0 s c0 05 0860 0000 0004 4 <
ffff00013d29e600 1185213336 C Ci:6:002:0 0 4 = 21c3d572
ffff00013d29e600 1185213381 S Co:6:002:0 s 40 05 0860 0000 0004 4 = 21c3a568
ffff00013d29e600 1185213489 C Co:6:002:0 0 4 >
ffff00013d29e600 1185213535 S Ci:6:002:0 s c0 05 0c00 0000 0004 4 <
ffff00013d29e600 1185213672 C Ci:6:002:0 0 4 = 07000000
ffff00013d29e600 1185213718 S Ci:6:002:0 s c0 05 08b0 0000 0004 4 <
ffff00013d29e600 1185213830 C Ci:6:002:0 0 4 = 18060000
ffff00013d29e600 1185213874 S Co:6:002:0 s 40 05 08b0 0000 0004 4 = 18060000
ffff00013d29e600 1185213982 C Co:6:002:0 0 4 >
ffff00013d29e600 1185214048 S Ci:6:002:0 s c0 05 0d04 0000 0004 4 <
ffff00013d29e600 1185214172 C Ci:6:002:0 0 4 = 017c90b1
ffff00013d29e600 1185214217 S Co:6:002:0 s 40 05 0c90 0000 0004 4 = 017d8301
ffff00013d29e600 1185214324 C Co:6:002:0 0 4 >
ffff00013d29e600 1185214384 S Ci:6:002:0 s c0 05 08ac 0000 0004 4 <
ffff00013d29e600 1185214505 C Ci:6:002:0 0 4 = 08faf00f
ffff00013d29e600 1185214550 S Co:6:002:0 s 40 05 08ac 0000 0004 4 = 08faf00f
ffff00013d29e600 1185214667 C Co:6:002:0 0 4 >
ffff00013d29e600 1185214713 S Ci:6:002:0 s c0 05 08ac 0000 0004 4 <
ffff00013d29e600 1185214834 C Ci:6:002:0 0 4 = 08faf00f
ffff00013d29e600 1185214880 S Co:6:002:0 s 40 05 08ac 0000 0004 4 = 08faf00f
ffff00013d29e600 1185214986 C Co:6:002:0 0 4 >
ffff00013d29e600 1185215033 S Ci:6:002:0 s c0 05 08c4 0000 0004 4 <
ffff00013d29e600 1185215171 C Ci:6:002:0 0 4 = 00000000
ffff00013d29e600 1185215216 S Co:6:002:0 s 40 05 08c4 0000 0004 4 = 00000000
ffff00013d29e600 1185215322 C Co:6:002:0 0 4 >
ffff00013d29e600 1185215369 S Ci:6:002:0 s c0 05 0c00 0000 0004 4 <
ffff00013d29e600 1185215491 C Ci:6:002:0 0 4 = 07000000
ffff00013d29e600 1185215537 S Ci:6:002:0 s c0 05 08b0 0000 0004 4 <
ffff00013d29e600 1185215648 C Ci:6:002:0 0 4 = 18060000
ffff00013d29e600 1185215692 S Co:6:002:0 s 40 05 08b0 0000 0004 4 = 18060000
ffff00013d29e600 1185215800 C Co:6:002:0 0 4 >
ffff00013d29e600 1185215867 S Ci:6:002:0 s c0 05 0d04 0000 0004 4 <
ffff00013d29e600 1185215987 C Ci:6:002:0 0 4 = 017d91b1
ffff00013d29e600 1185216050 S Co:6:002:0 s 40 05 0c90 0000 0004 4 = 687d8101
ffff00013d29e600 1185216181 C Co:6:002:0 0 4 >
ffff00013d29e600 1185216240 S Ci:6:002:0 s c0 05 0e00 0000 0004 4 <
ffff00013d29e600 1185216358 C Ci:6:002:0 0 4 = 07000000
ffff00013d29e600 1185216403 S Ci:6:002:0 s c0 05 08b0 0000 0004 4 <
ffff00013d29e600 1185216515 C Ci:6:002:0 0 4 = 18060000
ffff00013d29e600 1185216560 S Co:6:002:0 s 40 05 08b0 0000 0004 4 = 18060000
ffff00013d29e600 1185216668 C Co:6:002:0 0 4 >
ffff00013d29e600 1185216734 S Ci:6:002:0 s c0 05 0d44 0000 0004 4 <
ffff00013d29e600 1185216854 C Ci:6:002:0 0 4 = 017c90b1
ffff00013d29e600 1185216900 S Co:6:002:0 s 40 05 0e90 0000 0004 4 = 017d8301
ffff00013d29e600 1185217006 C Co:6:002:0 0 4 >
ffff00013d29e600 1185217066 S Ci:6:002:0 s c0 05 08ac 0000 0004 4 <
ffff00013d29e600 1185217188 C Ci:6:002:0 0 4 = 08faf00f
ffff00013d29e600 1185217234 S Co:6:002:0 s 40 05 08ac 0000 0004 4 = 08faf00f
ffff00013d29e600 1185217340 C Co:6:002:0 0 4 >
ffff00013d29e600 1185217387 S Ci:6:002:0 s c0 05 08ac 0000 0004 4 <
ffff00013d29e600 1185217508 C Ci:6:002:0 0 4 = 08faf00f
ffff00013d29e600 1185217553 S Co:6:002:0 s 40 05 08ac 0000 0004 4 = 08faf00f
ffff00013d29e600 1185217667 C Co:6:002:0 0 4 >
ffff00013d29e600 1185217713 S Ci:6:002:0 s c0 05 08c4 0000 0004 4 <
ffff00013d29e600 1185217834 C Ci:6:002:0 0 4 = 00000000
ffff00013d29e600 1185217880 S Co:6:002:0 s 40 05 08c4 0000 0004 4 = 00000000
ffff00013d29e600 1185217987 C Co:6:002:0 0 4 >
ffff00013d29e600 1185218033 S Ci:6:002:0 s c0 05 0e00 0000 0004 4 <
ffff00013d29e600 1185218170 C Ci:6:002:0 0 4 = 07000000
ffff00013d29e600 1185218209 S Ci:6:002:0 s c0 05 08b0 0000 0004 4 <
ffff00013d29e600 1185218319 C Ci:6:002:0 0 4 = 18060000
ffff00013d29e600 1185218363 S Co:6:002:0 s 40 05 08b0 0000 0004 4 = 18060000
ffff00013d29e600 1185218470 C Co:6:002:0 0 4 >
ffff00013d29e600 1185218536 S Ci:6:002:0 s c0 05 0d44 0000 0004 4 <
ffff00013d29e600 1185218670 C Ci:6:002:0 0 4 = 017d91b1
ffff00013d29e600 1185218716 S Co:6:002:0 s 40 05 0e90 0000 0004 4 = 687d8101
ffff00013d29e600 1185218821 C Co:6:002:0 0 4 >
ffff00013d29e600 1185218881 S Ci:6:002:0 s c0 05 0668 0000 0002 2 <
ffff00013d29e600 1185218998 C Ci:6:002:0 0 2 = 0010
ffff00013d29e600 1185219044 S Co:6:002:0 s 40 05 0668 0000 0002 2 = 0010
ffff00013d29e600 1185219094 C Co:6:002:0 0 2 >
ffff00013d29e600 1185219131 S Co:6:002:0 s 40 05 0483 0000 0001 1 = 00
ffff00013d29e600 1185219174 C Co:6:002:0 0 1 >
ffff00013d29e600 1185219209 S Ci:6:002:0 s c0 05 0837 0000 0001 1 <
ffff00013d29e600 1185219244 C Ci:6:002:0 0 1 = 00
ffff00013d29e600 1185219278 S Ci:6:002:0 s c0 05 08ac 0000 0004 4 <
ffff00013d29e600 1185219313 C Ci:6:002:0 0 4 = 08faf00f
ffff00013d29e600 1185219350 S Co:6:002:0 s 40 05 08ac 0000 0004 4 = 08faf00f
ffff00013d29e600 1185219381 C Co:6:002:0 0 4 >
ffff00013d29e600 1185219416 S Ci:6:002:0 s c0 05 08c4 0000 0004 4 <
ffff00013d29e600 1185219470 C Ci:6:002:0 0 4 = 00000000
ffff00013d29e600 1185219505 S Co:6:002:0 s 40 05 08c4 0000 0004 4 = 00000000
ffff00013d29e600 1185219537 C Co:6:002:0 0 4 >
ffff00013d29e600 1185219572 S Ci:6:002:0 s c0 05 0848 0000 0004 4 <
ffff00013d29e600 1185219608 C Ci:6:002:0 0 4 = 8bffd061
ffff00013d29e600 1185219643 S Co:6:002:0 s 40 05 0848 0000 0004 4 = 8bffd061
ffff00013d29e600 1185219674 C Co:6:002:0 0 4 >
ffff00013d29e600 1185219709 S Ci:6:002:0 s c0 05 08ac 0000 0004 4 <
ffff00013d29e600 1185219746 C Ci:6:002:0 0 4 = 08faf00f
ffff00013d29e600 1185219781 S Co:6:002:0 s 40 05 08ac 0000 0004 4 = 08faf00f
ffff00013d29e600 1185219812 C Co:6:002:0 0 4 >
ffff00013d29e600 1185219847 S Ci:6:002:0 s c0 05 08ac 0000 0004 4 <
ffff00013d29e600 1185219883 C Ci:6:002:0 0 4 = 08faf00f
ffff00013d29e600 1185219918 S Co:6:002:0 s 40 05 08ac 0000 0004 4 = 08faf00f
ffff00013d29e600 1185219968 C Co:6:002:0 0 4 >
ffff00013d29e600 1185220015 S Ci:6:002:0 s c0 05 08c4 0000 0004 4 <
ffff00013d29e600 1185220059 C Ci:6:002:0 0 4 = 00000000
ffff00013d29e600 1185220096 S Co:6:002:0 s 40 05 08c4 0000 0004 4 = 00000000
ffff00013d29e600 1185220209 C Co:6:002:0 0 4 >
ffff00013d29e600 1185220259 S Ci:6:002:0 s c0 05 0c00 0000 0004 4 <
ffff00013d29e600 1185220374 C Ci:6:002:0 0 4 = 07000000
ffff00013d29e600 1185220420 S Ci:6:002:0 s c0 05 08b0 0000 0004 4 <
ffff00013d29e600 1185220545 C Ci:6:002:0 0 4 = 18060000
ffff00013d29e600 1185220591 S Co:6:002:0 s 40 05 08b0 0000 0004 4 = 18060000
ffff00013d29e600 1185220696 C Co:6:002:0 0 4 >
ffff00013d29e600 1185220763 S Ci:6:002:0 s c0 05 0d04 0000 0004 4 <
ffff00013d29e600 1185220882 C Ci:6:002:0 0 4 = 687d93b1
ffff00013d29e600 1185220928 S Co:6:002:0 s 40 05 0c90 0000 0004 4 = 687d8301
ffff00013d29e600 1185221043 C Co:6:002:0 0 4 >
ffff00013d29e600 1185221103 S Ci:6:002:0 s c0 05 0e00 0000 0004 4 <
ffff00013d29e600 1185221221 C Ci:6:002:0 0 4 = 07000000
ffff00013d29e600 1185221267 S Ci:6:002:0 s c0 05 08b0 0000 0004 4 <
ffff00013d29e600 1185221375 C Ci:6:002:0 0 4 = 18060000
ffff00013d29e600 1185221420 S Co:6:002:0 s 40 05 08b0 0000 0004 4 = 18060000
ffff00013d29e600 1185221539 C Co:6:002:0 0 4 >
ffff00013d29e600 1185221606 S Ci:6:002:0 s c0 05 0d44 0000 0004 4 <
ffff00013d29e600 1185221724 C Ci:6:002:0 0 4 = 687d93b1
ffff00013d29e600 1185221770 S Co:6:002:0 s 40 05 0e90 0000 0004 4 = 687d8301
ffff00013d29e600 1185221875 C Co:6:002:0 0 4 >
ffff00013d29e600 1185221936 S Ci:6:002:0 s c0 05 0073 0000 0001 1 <
ffff00013d29e600 1185222056 C Ci:6:002:0 0 1 = 07
ffff00013d29e600 1185222101 S Co:6:002:0 s 40 05 0073 0000 0001 1 = 07
ffff00013d29e600 1185222207 C Co:6:002:0 0 1 >
ffff00013d29e600 1185222277 S Ci:6:002:0 s c0 05 0c24 0000 0004 4 <
ffff00013d29e600 1185222413 C Ci:6:002:0 0 4 = 20202020
ffff00013d29e600 1185222460 S Co:6:002:0 s 40 05 0c24 0000 0004 4 = 27272727
ffff00013d29e600 1185222565 C Co:6:002:0 0 4 >
ffff00013d29e600 1185222611 S Ci:6:002:0 s c0 05 0c28 0000 0004 4 <
ffff00013d29e600 1185222730 C Ci:6:002:0 0 4 = 20201e1c
ffff00013d29e600 1185222775 S Co:6:002:0 s 40 05 0c28 0000 0004 4 = 27272725
ffff00013d29e600 1185222880 C Co:6:002:0 0 4 >
ffff00013d29e600 1185222927 S Ci:6:002:0 s c0 05 0c2c 0000 0004 4 <
ffff00013d29e600 1185223046 C Ci:6:002:0 0 4 = 20202020
ffff00013d29e600 1185223092 S Co:6:002:0 s 40 05 0c2c 0000 0004 4 = 2c2c2c2c
ffff00013d29e600 1185223124 C Co:6:002:0 0 4 >
ffff00013d29e600 1185223160 S Ci:6:002:0 s c0 05 0c30 0000 0004 4 <
ffff00013d29e600 1185223225 C Ci:6:002:0 0 4 = 20201e1c
ffff00013d29e600 1185223260 S Co:6:002:0 s 40 05 0c30 0000 0004 4 = 2c2a2826
ffff00013d29e600 1185223291 C Co:6:002:0 0 4 >
ffff00013d29e600 1185223325 S Ci:6:002:0 s c0 05 0c34 0000 0004 4 <
ffff00013d29e600 1185223361 C Ci:6:002:0 0 4 = 20202020
ffff00013d29e600 1185223395 S Co:6:002:0 s 40 05 0c34 0000 0004 4 = 28282828
ffff00013d29e600 1185223425 C Co:6:002:0 0 4 >
ffff00013d29e600 1185223460 S Ci:6:002:0 s c0 05 0c38 0000 0004 4 <
ffff00013d29e600 1185223497 C Ci:6:002:0 0 4 = 201e1c1a
ffff00013d29e600 1185223532 S Co:6:002:0 s 40 05 0c38 0000 0004 4 = 28282624
ffff00013d29e600 1185223565 C Co:6:002:0 0 4 >
ffff00013d29e600 1185223600 S Ci:6:002:0 s c0 05 0c3c 0000 0004 4 <
ffff00013d29e600 1185223637 C Ci:6:002:0 0 4 = 20202020
ffff00013d29e600 1185223672 S Co:6:002:0 s 40 05 0c3c 0000 0004 4 = 2c2c2c2c
ffff00013d29e600 1185223721 C Co:6:002:0 0 4 >
ffff00013d29e600 1185223756 S Ci:6:002:0 s c0 05 0c40 0000 0004 4 <
ffff00013d29e600 1185223793 C Ci:6:002:0 0 4 = 20201e1c
ffff00013d29e600 1185223828 S Co:6:002:0 s 40 05 0c40 0000 0004 4 = 2c2a2826
ffff00013d29e600 1185223860 C Co:6:002:0 0 4 >
ffff00013d29e600 1185223895 S Ci:6:002:0 s c0 05 0c44 0000 0004 4 <
ffff00013d29e600 1185223932 C Ci:6:002:0 0 4 = 1a181e1e
ffff00013d29e600 1185223967 S Co:6:002:0 s 40 05 0c44 0000 0004 4 = 24242828
ffff00013d29e600 1185223998 C Co:6:002:0 0 4 >
ffff00013d29e600 1185224051 S Ci:6:002:0 s c0 05 0c48 0000 0004 4 <
ffff00013d29e600 1185224101 C Ci:6:002:0 0 4 = 1e1e1e1e
ffff00013d29e600 1185224139 S Co:6:002:0 s 40 05 0c48 0000 0004 4 = 28282828
ffff00013d29e600 1185224172 C Co:6:002:0 0 4 >
ffff00013d29e600 1185224209 S Ci:6:002:0 s c0 05 0c4c 0000 0004 4 <
ffff00013d29e600 1185224247 C Ci:6:002:0 0 4 = 1c1a1816
ffff00013d29e600 1185224282 S Co:6:002:0 s 40 05 0c4c 0000 0004 4 = 26242222
ffff00013d29e600 1185224313 C Co:6:002:0 0 4 >
ffff00013d29e600 1185224348 S Ci:6:002:0 s c0 05 0c54 0000 0004 4 <
ffff00013d29e600 1185224385 C Ci:6:002:0 0 4 = 120a0400
ffff00013d29e600 1185224420 S Co:6:002:0 s 40 05 0c54 0000 0004 4 = 1c140e00
ffff00013d29e600 1185224469 C Co:6:002:0 0 4 >
ffff00013d29e600 1185224504 S Ci:6:002:0 s c0 05 0e24 0000 0004 4 <
ffff00013d29e600 1185224541 C Ci:6:002:0 0 4 = 1d1d1d1d
ffff00013d29e600 1185224577 S Co:6:002:0 s 40 05 0e24 0000 0004 4 = 21212121
ffff00013d29e600 1185224609 C Co:6:002:0 0 4 >
ffff00013d29e600 1185224644 S Ci:6:002:0 s c0 05 0e28 0000 0004 4 <
ffff00013d29e600 1185224680 C Ci:6:002:0 0 4 = 1d1d1b19
ffff00013d29e600 1185224715 S Co:6:002:0 s 40 05 0e28 0000 0004 4 = 2121211f
ffff00013d29e600 1185224746 C Co:6:002:0 0 4 >
ffff00013d29e600 1185224774 S Ci:6:002:0 s c0 05 0e2c 0000 0004 4 <
ffff00013d29e600 1185224811 C Ci:6:002:0 0 4 = 1f1f1f1f
ffff00013d29e600 1185224846 S Co:6:002:0 s 40 05 0e2c 0000 0004 4 = 26262626
ffff00013d29e600 1185224877 C Co:6:002:0 0 4 >
ffff00013d29e600 1185224912 S Ci:6:002:0 s c0 05 0e30 0000 0004 4 <
ffff00013d29e600 1185224967 C Ci:6:002:0 0 4 = 1f1f1d1b
ffff00013d29e600 1185225002 S Co:6:002:0 s 40 05 0e30 0000 0004 4 = 26242220
ffff00013d29e600 1185225034 C Co:6:002:0 0 4 >
ffff00013d29e600 1185225069 S Ci:6:002:0 s c0 05 0e34 0000 0004 4 <
ffff00013d29e600 1185225106 C Ci:6:002:0 0 4 = 1f1f1f1f
ffff00013d29e600 1185225141 S Co:6:002:0 s 40 05 0e34 0000 0004 4 = 22222222
ffff00013d29e600 1185225172 C Co:6:002:0 0 4 >
ffff00013d29e600 1185225207 S Ci:6:002:0 s c0 05 0e38 0000 0004 4 <
ffff00013d29e600 1185225244 C Ci:6:002:0 0 4 = 1f1d1b19
ffff00013d29e600 1185225279 S Co:6:002:0 s 40 05 0e38 0000 0004 4 = 2222201e
ffff00013d29e600 1185225310 C Co:6:002:0 0 4 >
ffff00013d29e600 1185225344 S Ci:6:002:0 s c0 05 0e3c 0000 0004 4 <
ffff00013d29e600 1185225382 C Ci:6:002:0 0 4 = 1f1f1f1f
ffff00013d29e600 1185225418 S Co:6:002:0 s 40 05 0e3c 0000 0004 4 = 26262626
ffff00013d29e600 1185225467 C Co:6:002:0 0 4 >
ffff00013d29e600 1185225501 S Ci:6:002:0 s c0 05 0e40 0000 0004 4 <
ffff00013d29e600 1185225539 C Ci:6:002:0 0 4 = 1f1f1d1b
ffff00013d29e600 1185225573 S Co:6:002:0 s 40 05 0e40 0000 0004 4 = 26242220
ffff00013d29e600 1185225604 C Co:6:002:0 0 4 >
ffff00013d29e600 1185225639 S Ci:6:002:0 s c0 05 0e44 0000 0004 4 <
ffff00013d29e600 1185225676 C Ci:6:002:0 0 4 = 19171d1d
ffff00013d29e600 1185225711 S Co:6:002:0 s 40 05 0e44 0000 0004 4 = 1e1e2222
ffff00013d29e600 1185225742 C Co:6:002:0 0 4 >
ffff00013d29e600 1185225777 S Ci:6:002:0 s c0 05 0e48 0000 0004 4 <
ffff00013d29e600 1185225815 C Ci:6:002:0 0 4 = 1d1d1d1d
ffff00013d29e600 1185225850 S Co:6:002:0 s 40 05 0e48 0000 0004 4 = 22222222
ffff00013d29e600 1185225882 C Co:6:002:0 0 4 >
ffff00013d29e600 1185225916 S Ci:6:002:0 s c0 05 0e4c 0000 0004 4 <
ffff00013d29e600 1185225971 C Ci:6:002:0 0 4 = 1b191715
ffff00013d29e600 1185226005 S Co:6:002:0 s 40 05 0e4c 0000 0004 4 = 201e1c1c
ffff00013d29e600 1185226037 C Co:6:002:0 0 4 >
ffff00013d29e600 1185226070 S Ci:6:002:0 s c0 05 0e54 0000 0004 4 <
ffff00013d29e600 1185226107 C Ci:6:002:0 0 4 = 11090300
ffff00013d29e600 1185226142 S Co:6:002:0 s 40 05 0e54 0000 0004 4 = 160e0800
ffff00013d29e600 1185226173 C Co:6:002:0 0 4 >
ffff000103533480 1185756260 S Ci:6:002:0 s c0 05 004c 0000 0001 1 <
ffff000103533480 1185756342 C Ci:6:002:0 0 1 = 20
ffff000103533480 1185756488 S Co:6:002:0 s 40 05 004c 0000 0001 1 = 20
ffff000103533480 1185756607 C Co:6:002:0 0 1 >
ffff000103533480 1186748366 S Ci:6:002:0 s c0 05 0770 0000 0004 4 <
ffff000103533480 1186748508 C Ci:6:002:0 0 4 = 00000000
ffff000103533480 1186748657 S Ci:6:002:0 s c0 05 0774 0000 0004 4 <
ffff000103533480 1186748806 C Ci:6:002:0 0 4 = 00000000
ffff000103533480 1186748958 S Co:6:002:0 s 40 05 076e 0000 0001 1 = 0c
ffff000103533480 1186749100 C Co:6:002:0 0 1 >
ffff000103533480 1186749257 S Ci:6:002:0 s c0 05 0808 0000 0004 4 <
ffff000103533480 1186749405 C Ci:6:002:0 0 4 = 3382023e
ffff000103533480 1186749556 S Ci:6:002:0 s c0 05 0a5c 0000 0002 2 <
ffff000103533480 1186749706 C Ci:6:002:0 0 2 = 6200
ffff000103533480 1186749858 S Ci:6:002:0 s c0 05 0f48 0000 0002 2 <
ffff000103533480 1186750007 C Ci:6:002:0 0 2 = 1201
ffff000103533480 1186750145 S Ci:6:002:0 s c0 05 0f04 0000 0004 4 <
ffff000103533480 1186750282 C Ci:6:002:0 0 4 = 00000200
ffff000103533480 1186750320 S Ci:6:002:0 s c0 05 0f14 0000 0004 4 <
ffff000103533480 1186750430 C Ci:6:002:0 0 4 = 1d000c00
ffff000103533480 1186750460 S Ci:6:002:0 s c0 05 0f10 0000 0004 4 <
ffff000103533480 1186750572 C Ci:6:002:0 0 4 = 00000000
ffff000103533480 1186750601 S Ci:6:002:0 s c0 05 0f0c 0000 0004 4 <
ffff000103533480 1186750714 C Ci:6:002:0 0 4 = 00000000
ffff000103533480 1186750743 S Ci:6:002:0 s c0 05 0f08 0000 0004 4 <
ffff000103533480 1186750856 C Ci:6:002:0 0 4 = 8d003b01
ffff000103533480 1186750885 S Ci:6:002:0 s c0 05 0fcc 0000 0004 4 <
ffff000103533480 1186750998 C Ci:6:002:0 0 4 = 00000000
ffff000103533480 1186751027 S Ci:6:002:0 s c0 05 09a4 0000 0004 4 <
ffff000103533480 1186751154 C Ci:6:002:0 0 4 = 80000800
ffff000103533480 1186751185 S Co:6:002:0 s 40 05 09a4 0000 0004 4 = 80000a00
ffff000103533480 1186751291 C Co:6:002:0 0 4 >
ffff000103533480 1186751320 S Ci:6:002:0 s c0 05 09a4 0000 0004 4 <
ffff000103533480 1186751433 C Ci:6:002:0 0 4 = 80000a00
ffff000103533480 1186751463 S Co:6:002:0 s 40 05 09a4 0000 0004 4 = 80000800
ffff000103533480 1186751570 C Co:6:002:0 0 4 >
ffff000103533480 1186751599 S Ci:6:002:0 s c0 05 0a2c 0000 0004 4 <
ffff000103533480 1186751712 C Ci:6:002:0 0 4 = 00809000
ffff000103533480 1186751741 S Co:6:002:0 s 40 05 0a2c 0000 0004 4 = 00009000
ffff000103533480 1186751848 C Co:6:002:0 0 4 >
ffff000103533480 1186751878 S Ci:6:002:0 s c0 05 0a2c 0000 0004 4 <
ffff000103533480 1186751990 C Ci:6:002:0 0 4 = 00009000
ffff000103533480 1186752037 S Co:6:002:0 s 40 05 0a2c 0000 0004 4 = 00809000
ffff000103533480 1186752150 C Co:6:002:0 0 4 >
ffff000103533480 1186752180 S Ci:6:002:0 s c0 05 0b58 0000 0004 4 <
ffff000103533480 1186752292 C Ci:6:002:0 0 4 = 00000000
ffff000103533480 1186752321 S Co:6:002:0 s 40 05 0b58 0000 0004 4 = 01000000
ffff000103533480 1186752431 C Co:6:002:0 0 4 >
ffff000103533480 1186752461 S Ci:6:002:0 s c0 05 0b58 0000 0004 4 <
ffff000103533480 1186752572 C Ci:6:002:0 0 4 = 01000000
ffff000103533480 1186752601 S Co:6:002:0 s 40 05 0b58 0000 0004 4 = 00000000
ffff000103533480 1186752709 C Co:6:002:0 0 4 >
ffff000103533480 1186752740 S Ci:6:002:0 s c0 05 01cc 0000 0001 1 <
ffff000103533480 1186752851 C Ci:6:002:0 0 1 = 00
ffff000103533480 1186752880 S Co:6:002:0 s 40 05 01fc 0000 0004 4 = 00000000
ffff000103533480 1186752987 C Co:6:002:0 0 4 >
ffff000103533480 1186753017 S Co:6:002:0 s 40 05 01dc 0000 0004 4 = 58000000
ffff000103533480 1186753124 C Co:6:002:0 0 4 >
ffff000103533480 1186753155 S Co:6:002:0 s 40 05 0440 0000 0004 4 = 00000000
ffff000103533480 1186753274 C Co:6:002:0 0 4 >
ffff000103533480 1186753305 S Ci:6:002:0 s c0 05 0c00 0000 0004 4 <
ffff000103533480 1186753416 C Ci:6:002:0 0 4 = 07000000
ffff000103533480 1186753446 S Ci:6:002:0 s c0 05 08b0 0000 0004 4 <
ffff000103533480 1186753559 C Ci:6:002:0 0 4 = 18060000
ffff000103533480 1186753588 S Co:6:002:0 s 40 05 08b0 0000 0004 4 = 42060000
ffff000103533480 1186753696 C Co:6:002:0 0 4 >
ffff000103533480 1186753745 S Ci:6:002:0 s c0 05 0d04 0000 0004 4 <
ffff000103533480 1186753855 C Ci:6:002:0 0 4 = 088d90b1
ffff000103533480 1186753884 S Co:6:002:0 s 40 05 0c90 0000 0004 4 = 088d2304
ffff000103533480 1186753991 C Co:6:002:0 0 4 >
ffff000103533480 1186754034 S Co:6:002:0 s 40 05 0280 0000 0002 2 = 0001
ffff000103533480 1186754149 C Co:6:002:0 0 2 >
ffff000103533480 1186754179 S Ci:6:002:0 s c0 05 010c 0000 0001 1 <
ffff000103533480 1186754291 C Ci:6:002:0 0 1 = b4
ffff000103533480 1186754321 S Co:6:002:0 s 40 05 010c 0000 0001 1 = b4
ffff000103533480 1186754428 C Co:6:002:0 0 1 >
ffff000103533480 1186780293 S Ci:6:002:0 s c0 05 004c 0000 0001 1 <
ffff000103533480 1186780419 C Ci:6:002:0 0 1 = 20
ffff000103533480 1186780543 S Co:6:002:0 s 40 05 004c 0000 0001 1 = 20
ffff000103533480 1186780632 C Co:6:002:0 0 1 >
ffff000103533480 1187772220 S Ci:6:002:0 s c0 05 004c 0000 0001 1 <
ffff000103533480 1187772355 C Ci:6:002:0 0 1 = 20
ffff000103533480 1187772520 S Co:6:002:0 s 40 05 004c 0000 0001 1 = 20
ffff000103533480 1187772665 C Co:6:002:0 0 1 >
