ffff0001035330c0 4029339923 C Bi:6:002:1 0 172 = 74000484 00000f80 27026000 00300000 00000000 74b36500 443a0000 0e520001
ffff0001035330c0 4029339972 S Bi:6:002:1 -115 32768 <
ffff000103533480 4029427653 C Bi:6:002:1 0 351 = 27010484 00000f80 ad0c6000 04300000 00000000 e90b6700 423a0000 84000001
ffff000103533480 4029427713 S Bi:6:002:1 -115 32768 <
ffff000103533240 4029429361 C Bi:6:002:1 0 384 = 48010484 00000f80 500a6000 04300000 00000000 62126700 44360000 82fafa01
ffff000103533240 4029429391 S Bi:6:002:1 -115 32768 <
ffff000103533780 4029441209 C Bi:6:002:1 0 172 = 74000484 00000f80 28026000 00300000 00000000 dc3e6700 44360000 18510001
ffff000103533780 4029441241 S Bi:6:002:1 -115 32768 <
ffff0001035330c0 4029528234 C Bi:6:002:1 0 383 = 47010484 00000f80 7b0b6000 04300000 00000000 86946800 443e0000 86f5f501
ffff0001035330c0 4029528289 S Bi:6:002:1 -115 32768 <
ffff000103533480 4029529280 C Bi:6:002:1 0 376 = 40010484 00000f80 e9026000 04300000 00000000 be986800 3a2e0000 69f5f501
ffff000103533480 4029529305 S Bi:6:002:1 -115 32768 <
ffff000103533240 4029530055 C Bi:6:002:1 0 351 = 27010484 00000f80 ae0c6000 04300000 00000000 eb9b6800 443a0000 86f5f501
ffff000103533240 4029530080 S Bi:6:002:1 -115 32768 <
ffff000103533780 4029530907 C Bi:6:002:1 0 374 = 3e010484 00000f80 81076000 04300000 00000000 159f6800 46380000 83f3f301
ffff000103533780 4029530931 S Bi:6:002:1 -115 32768 <
ffff0001035330c0 4029531700 C Bi:6:002:1 0 384 = 48010484 00000f80 510a6000 04300000 00000000 2ba26800 463c0000 87e9e901
ffff0001035330c0 4029531723 S Bi:6:002:1 -115 32768 <
ffff000103533480 4029543527 C Bi:6:002:1 0 172 = 74000484 00000f80 29026000 00300000 00000000 64ce6800 463c0000 10510001
ffff000103533480 4029543562 S Bi:6:002:1 -115 32768 <
ffff000103533240 4029630639 C Bi:6:002:1 0 383 = 47010484 00000f80 7c0b6000 04300000 00000000 88246a00 46380000 83eeee01
ffff000103533240 4029630695 S Bi:6:002:1 -115 32768 <
ffff000103533780 4029631654 C Bi:6:002:1 0 376 = 40010484 00000f80 ea026000 04300000 00000000 ab286a00 443a0000 83f0f001
ffff000103533780 4029631682 S Bi:6:002:1 -115 32768 <
ffff0001035330c0 4029632506 C Bi:6:002:1 0 351 = 27010484 00000f80 af0c6000 04300000 00000000 1f2c6a00 46420000 8cecec01
ffff0001035330c0 4029632531 S Bi:6:002:1 -115 32768 <
ffff000103533480 4029634155 C Bi:6:002:1 0 384 = 48010484 00000f80 520a6000 04300000 00000000 5e326a00 46400000 8ce6e601
ffff000103533480 4029634179 S Bi:6:002:1 -115 32768 <
ffff000103533240 4029646072 C Bi:6:002:1 0 172 = 74000484 00000f80 2a026000 00300000 00000000 035f6a00 46400000 0c520001
ffff000103533240 4029646095 S Bi:6:002:1 -115 32768 <
ffff000103533780 4029733030 C Bi:6:002:1 0 383 = 47010484 00000f80 7d0b6000 04300000 00000000 89b46b00 443a0000 86f4f401
ffff000103533780 4029733064 S Bi:6:002:1 -115 32768 <
ffff0001035330c0 4029734111 C Bi:6:002:1 0 376 = 40010484 00000f80 eb026000 04300000 00000000 e3b86b00 423a0000 81f9f901
ffff0001035330c0 4029734136 S Bi:6:002:1 -115 32768 <
ffff000103533480 4029735279 C Bi:6:002:1 0 351 = 27010484 00000f80 b00c6000 04300000 00000000 8bbd6b00 443a0000 86eded01
ffff000103533480 4029735304 S Bi:6:002:1 -115 32768 <
ffff000103533240 4029736330 C Bi:6:002:1 0 374 = 3e010484 00000f80 83076000 04300000 00000000 91c16b00 42340000 82eaea01
ffff000103533240 4029736355 S Bi:6:002:1 -115 32768 <
ffff000103533780 4029737341 C Bi:6:002:1 0 384 = 48010484 00000f80 530a6000 04300000 00000000 7bc56b00 44380000 87f4f401
ffff000103533780 4029737367 S Bi:6:002:1 -115 32768 <
ffff000102d1dc00 4029756194 S Ci:6:002:0 s c0 05 004c 0000 0001 1 <
ffff000102d1dc00 4029756344 C Ci:6:002:0 0 1 = 20
ffff000102d1dc00 4029756490 S Co:6:002:0 s 40 05 004c 0000 0001 1 = 20
ffff000102d1dc00 4029756601 C Co:6:002:0 0 1 >
ffff000103150540 4029756854 S Ci:6:002:0 s c0 05 0770 0000 0004 4 <
ffff000103150540 4029757030 C Ci:6:002:0 0 4 = 00000000
ffff000103150540 4029757192 S Ci:6:002:0 s c0 05 0774 0000 0004 4 <
ffff000103150540 4029757340 C Ci:6:002:0 0 4 = 00000000
ffff000103150540 4029757501 S Co:6:002:0 s 40 05 076e 0000 0001 1 = 0c
ffff000103150540 4029757643 C Co:6:002:0 0 1 >
ffff000103150540 4029757803 S Ci:6:002:0 s c0 05 0808 0000 0004 4 <
ffff000103150540 4029757938 C Ci:6:002:0 0 4 = 3382023e
ffff000103150540 4029758081 S Ci:6:002:0 s c0 05 0a5c 0000 0002 2 <
ffff000103150540 4029758210 C Ci:6:002:0 0 2 = 5100
ffff000103150540 4029758355 S Ci:6:002:0 s c0 05 0f48 0000 0002 2 <
ffff000103150540 4029758484 C Ci:6:002:0 0 2 = ed10
ffff000103150540 4029758629 S Ci:6:002:0 s c0 05 0f04 0000 0004 4 <
ffff000103150540 4029758755 C Ci:6:002:0 0 4 = 0f000900
ffff000103150540 4029758791 S Ci:6:002:0 s c0 05 0f14 0000 0004 4 <
ffff000103150540 4029758903 C Ci:6:002:0 0 4 = 22016a00
ffff000103150540 4029758933 S Ci:6:002:0 s c0 05 0f10 0000 0004 4 <
ffff000103150540 4029759046 C Ci:6:002:0 0 4 = 00000000
ffff000103150540 4029759075 S Ci:6:002:0 s c0 05 0f0c 0000 0004 4 <
ffff000103150540 4029759188 C Ci:6:002:0 0 4 = 00000000
ffff000103150540 4029759216 S Ci:6:002:0 s c0 05 0f08 0000 0004 4 <
ffff000103150540 4029759336 C Ci:6:002:0 0 4 = 8b007912
ffff000103150540 4029759357 S Ci:6:002:0 s c0 05 0fcc 0000 0004 4 <
ffff000103150540 4029759471 C Ci:6:002:0 0 4 = 00000000
ffff000103150540 4029759499 S Ci:6:002:0 s c0 05 09a4 0000 0004 4 <
ffff000103150540 4029759626 C Ci:6:002:0 0 4 = 80000800
ffff000103150540 4029759650 S Co:6:002:0 s 40 05 09a4 0000 0004 4 = 80000a00
ffff000103150540 4029759757 C Co:6:002:0 0 4 >
ffff000103150540 4029759786 S Ci:6:002:0 s c0 05 09a4 0000 0004 4 <
ffff000103150540 4029759900 C Ci:6:002:0 0 4 = 80000a00
ffff000103150540 4029759920 S Co:6:002:0 s 40 05 09a4 0000 0004 4 = 80000800
ffff000103150540 4029760028 C Co:6:002:0 0 4 >
ffff000103150540 4029760058 S Ci:6:002:0 s c0 05 0a2c 0000 0004 4 <
ffff000103150540 4029760175 C Ci:6:002:0 0 4 = 00809000
ffff000103150540 4029760195 S Co:6:002:0 s 40 05 0a2c 0000 0004 4 = 00009000
ffff000103150540 4029760303 C Co:6:002:0 0 4 >
ffff000103150540 4029760332 S Ci:6:002:0 s c0 05 0a2c 0000 0004 4 <
ffff000103150540 4029760449 C Ci:6:002:0 0 4 = 00009000
ffff000103150540 4029760470 S Co:6:002:0 s 40 05 0a2c 0000 0004 4 = 00809000
ffff000103150540 4029760578 C Co:6:002:0 0 4 >
ffff000103150540 4029760606 S Ci:6:002:0 s c0 05 0b58 0000 0004 4 <
ffff000103150540 4029760724 C Ci:6:002:0 0 4 = 00000000
ffff000103150540 4029760744 S Co:6:002:0 s 40 05 0b58 0000 0004 4 = 01000000
ffff000103150540 4029760852 C Co:6:002:0 0 4 >
ffff000103150540 4029760914 S Ci:6:002:0 s c0 05 0b58 0000 0004 4 <
ffff000103150540 4029761026 C Ci:6:002:0 0 4 = 01000000
ffff000103150540 4029761056 S Co:6:002:0 s 40 05 0b58 0000 0004 4 = 00000000
ffff000103150540 4029761165 C Co:6:002:0 0 4 >
ffff000103150540 4029761188 S Ci:6:002:0 s c0 05 0c50 0000 0004 4 <
ffff000103150540 4029761297 C Ci:6:002:0 0 4 = 20000000
ffff000103150540 4029761326 S Co:6:002:0 s 40 05 0c50 0000 0004 4 = 21000000
ffff000103150540 4029761441 C Co:6:002:0 0 4 >
ffff000103150540 4029761462 S Ci:6:002:0 s c0 05 0e50 0000 0004 4 <
ffff000103150540 4029761573 C Ci:6:002:0 0 4 = 20000000
ffff000103150540 4029761602 S Co:6:002:0 s 40 05 0e50 0000 0004 4 = 21000000
ffff000103150540 4029761638 C Co:6:002:0 0 4 >
ffff000103150540 4029761654 S Ci:6:002:0 s c0 05 01cc 0000 0001 1 <
ffff000103150540 4029761762 C Ci:6:002:0 0 1 = 00
ffff000103150540 4029761792 S Co:6:002:0 s 40 05 01f8 0000 0004 4 = 00000000
ffff000103150540 4029761901 C Co:6:002:0 0 4 >
ffff000103150540 4029761931 S Co:6:002:0 s 40 05 01d8 0000 0004 4 = 58000000
ffff000103150540 4029762040 C Co:6:002:0 0 4 >
ffff000103150540 4029762062 S Co:6:002:0 s 40 05 0440 0000 0004 4 = 00000000
ffff000103150540 4029762169 C Co:6:002:0 0 4 >
ffff000103150540 4029762200 S Ci:6:002:0 s c0 05 0c00 0000 0004 4 <
ffff000103150540 4029762316 C Ci:6:002:0 0 4 = 07000000
ffff000103150540 4029762336 S Ci:6:002:0 s c0 05 08b0 0000 0004 4 <
ffff000103150540 4029762447 C Ci:6:002:0 0 4 = 18060000
ffff000103150540 4029762476 S Co:6:002:0 s 40 05 08b0 0000 0004 4 = 42060000
ffff000103150540 4029762511 C Co:6:002:0 0 4 >
ffff000103150540 4029762547 S Ci:6:002:0 s c0 05 0d04 0000 0004 4 <
ffff000103150540 4029762651 C Ci:6:002:0 0 4 = 108d90b1
ffff000103150540 4029762681 S Co:6:002:0 s 40 05 0c90 0000 0004 4 = 108d2304
ffff000103150540 4029762789 C Co:6:002:0 0 4 >
ffff000103150540 4029762832 S Co:6:002:0 s 40 05 0280 0000 0002 2 = 0001
ffff000103150540 4029762932 C Co:6:002:0 0 2 >
ffff000103150540 4029762953 S Ci:6:002:0 s c0 05 010c 0000 0001 1 <
ffff000103150540 4029763063 C Ci:6:002:0 0 1 = b4
ffff000103150540 4029763093 S Co:6:002:0 s 40 05 010c 0000 0001 1 = b4
ffff000103150540 4029763208 C Co:6:002:0 0 1 >
ffff0001035330c0 4029835437 C Bi:6:002:1 0 383 = 47010484 00000f80 7e0b6000 04300000 00000000 8b446d00 443a0000 83f5f501
ffff0001035330c0 4029835494 S Bi:6:002:1 -115 32768 <
ffff000103533480 4029836465 C Bi:6:002:1 0 376 = 40010484 00000f80 ec026000 04300000 00000000 ba486d00 443c0000 85eded01
ffff000103533480 4029836498 S Bi:6:002:1 -115 32768 <
ffff000103533240 4029837294 C Bi:6:002:1 0 351 = 27010484 00000f80 b10c6000 04300000 00000000 144c6d00 443a0000 86efef01
ffff000103533240 4029837319 S Bi:6:002:1 -115 32768 <
ffff000103533780 4029838230 C Bi:6:002:1 0 374 = 3e010484 00000f80 84076000 04300000 00000000 a24f6d00 443a0000 85eeee01
ffff000103533780 4029838254 S Bi:6:002:1 -115 32768 <
ffff0001035330c0 4029839713 C Bi:6:002:1 0 384 = 48010484 00000f80 540a6000 04300000 00000000 5b556d00 443e0000 84f4f401
ffff0001035330c0 4029839738 S Bi:6:002:1 -115 32768 <
ffff000103533480 4029851254 C Bi:6:002:1 0 172 = 74000484 00000f80 2c026000 00300000 00000000 9e806d00 443e0000 0a520001
ffff000103533480 4029851278 S Bi:6:002:1 -115 32768 <
ffff000103533240 4029937830 C Bi:6:002:1 0 383 = 47010484 00000f80 7f0b6000 04300000 00000000 8cd46e00 443a0000 85f7f701
ffff000103533240 4029937874 S Bi:6:002:1 -115 32768 <
ffff000103533780 4029938851 C Bi:6:002:1 0 376 = 40010484 00000f80 ed026000 04300000 00000000 abd86e00 443e0000 86f1f101
ffff000103533780 4029938880 S Bi:6:002:1 -115 32768 <
ffff0001035330c0 4029939677 C Bi:6:002:1 0 351 = 27010484 00000f80 b20c6000 04300000 00000000 04dc6e00 443e0000 88fdfd01
ffff0001035330c0 4029939701 S Bi:6:002:1 -115 32768 <
ffff000103533480 4029940566 C Bi:6:002:1 0 374 = 3e010484 00000f80 85076000 04300000 00000000 60df6e00 443e0000 83efef01
ffff000103533480 4029940590 S Bi:6:002:1 -115 32768 <
ffff000103533240 4029941605 C Bi:6:002:1 0 384 = 48010484 00000f80 550a6000 04300000 00000000 5ee36e00 463a0000 87efef01
ffff000103533240 4029941629 S Bi:6:002:1 -115 32768 <
ffff000103533780 4030040189 C Bi:6:002:1 0 383 = 47010484 00000f80 800b6000 04300000 00000000 8e647000 443a0000 81f1f101
ffff000103533780 4030040243 S Bi:6:002:1 -115 32768 <
ffff0001035330c0 4030041191 C Bi:6:002:1 0 376 = 40010484 00000f80 ee026000 04300000 00000000 62687000 423a0000 81f5f501
ffff0001035330c0 4030041217 S Bi:6:002:1 -115 32768 <
ffff000103533480 4030042025 C Bi:6:002:1 0 351 = 27010484 00000f80 b30c6000 04300000 00000000 c36b7000 423a0000 81fbfb01
ffff000103533480 4030042049 S Bi:6:002:1 -115 32768 <
ffff000103533240 4030042829 C Bi:6:002:1 0 374 = 3e010484 00000f80 86076000 04300000 00000000 d66e7000 443a0000 80f9f901
ffff000103533240 4030042853 S Bi:6:002:1 -115 32768 <
ffff000103533780 4030043631 C Bi:6:002:1 0 384 = 48010484 00000f80 560a6000 04300000 00000000 f0717000 443a0000 82f7f701
ffff000103533780 4030043652 S Bi:6:002:1 -115 32768 <
ffff0001035330c0 4030055456 C Bi:6:002:1 0 172 = 74000484 00000f80 2e026000 00300000 00000000 179e7000 443a0000 10510001
ffff0001035330c0 4030055485 S Bi:6:002:1 -115 32768 <
ffff000103533480 4030142600 C Bi:6:002:1 0 383 = 47010484 00000f80 810b6000 04300000 00000000 8ff47100 443a0000 85f3f301
ffff000103533480 4030142651 S Bi:6:002:1 -115 32768 <
ffff000103533240 4030144043 C Bi:6:002:1 0 351 = 27010484 00000f80 b40c6000 04300000 00000000 53fa7100 3e3a0000 82040401
ffff000103533240 4030144067 S Bi:6:002:1 -115 32768 <
ffff000103533780 4030144982 C Bi:6:002:1 0 374 = 3e010484 00000f80 87076000 04300000 00000000 e4fd7100 443a0000 82f4f401
ffff000103533780 4030145006 S Bi:6:002:1 -115 32768 <
ffff0001035330c0 4030146356 C Bi:6:002:1 0 384 = 48010484 00000f80 570a6000 04300000 00000000 2e037200 423a0000 85fcfc01
ffff0001035330c0 4030146379 S Bi:6:002:1 -115 32768 <
ffff000103533480 4030158655 C Bi:6:002:1 0 172 = 74000484 00000f80 2f026000 00300000 00000000 4d317200 34340000 0e520001
ffff000103533480 4030158679 S Bi:6:002:1 -115 32768 <
ffff000103533240 4030261109 C Bi:6:002:1 0 172 = 74000484 00000f80 30026000 00300000 00000000 63c17300 34360000 18500001
ffff000103533240 4030261161 S Bi:6:002:1 -115 32768 <
ffff000103533180 4030330148 S Ci:6:002:0 s c0 05 0454 0000 0001 1 <
ffff000103533180 4030330298 C Ci:6:002:0 0 1 = 00
ffff000103533180 4030330450 S Ci:6:002:0 s c0 05 0860 0000 0004 4 <
ffff000103533180 4030330557 C Ci:6:002:0 0 4 = 21c3d572
ffff000103533180 4030330675 S Co:6:002:0 s 40 05 0860 0000 0004 4 = 21c3d572
ffff000103533180 4030330775 C Co:6:002:0 0 4 >
ffff000103533180 4030330803 S Ci:6:002:0 s c0 05 0c00 0000 0004 4 <
ffff000103533180 4030330902 C Ci:6:002:0 0 4 = 07000000
ffff000103533180 4030330928 S Ci:6:002:0 s c0 05 08b0 0000 0004 4 <
ffff000103533180 4030331024 C Ci:6:002:0 0 4 = 42060000
ffff000103533180 4030331050 S Co:6:002:0 s 40 05 08b0 0000 0004 4 = 18060000
ffff000103533180 4030331143 C Co:6:002:0 0 4 >
ffff000103533180 4030331188 S Ci:6:002:0 s c0 05 0d04 0000 0004 4 <
ffff000103533180 4030331285 C Ci:6:002:0 0 4 = 017c90b1
ffff000103533180 4030331312 S Co:6:002:0 s 40 05 0c90 0000 0004 4 = 017c8001
ffff000103533180 4030331405 C Co:6:002:0 0 4 >
ffff000103533180 4030331444 S Ci:6:002:0 s c0 05 08ac 0000 0004 4 <
ffff000103533180 4030331540 C Ci:6:002:0 0 4 = 08faf00f
ffff000103533180 4030331565 S Co:6:002:0 s 40 05 08ac 0000 0004 4 = 08faf00f
ffff000103533180 4030331660 C Co:6:002:0 0 4 >
ffff000103533180 4030331685 S Ci:6:002:0 s c0 05 08ac 0000 0004 4 <
ffff000103533180 4030331782 C Ci:6:002:0 0 4 = 08faf00f
ffff000103533180 4030331807 S Co:6:002:0 s 40 05 08ac 0000 0004 4 = 08faf00f
ffff000103533180 4030331900 C Co:6:002:0 0 4 >
ffff000103533180 4030331925 S Ci:6:002:0 s c0 05 08c4 0000 0004 4 <
ffff000103533180 4030332025 C Ci:6:002:0 0 4 = 00000000
ffff000103533180 4030332052 S Co:6:002:0 s 40 05 08c4 0000 0004 4 = 00000000
ffff000103533180 4030332147 C Co:6:002:0 0 4 >
ffff000102d1dc00 4030332176 S Ci:6:002:0 s c0 05 0c00 0000 0004 4 <
ffff000102d1dc00 4030332295 C Ci:6:002:0 0 4 = 07000000
ffff000102d1dc00 4030332324 S Ci:6:002:0 s c0 05 08b0 0000 0004 4 <
ffff000102d1dc00 4030332435 C Ci:6:002:0 0 4 = 18060000
ffff000102d1dc00 4030332464 S Co:6:002:0 s 40 05 08b0 0000 0004 4 = 18060000
ffff000102d1dc00 4030332573 C Co:6:002:0 0 4 >
ffff000102d1dc00 4030332622 S Ci:6:002:0 s c0 05 0d04 0000 0004 4 <
ffff000102d1dc00 4030332745 C Ci:6:002:0 0 4 = 017c90b1
ffff000102d1dc00 4030332776 S Co:6:002:0 s 40 05 0c90 0000 0004 4 = 017c8001
ffff000102d1dc00 4030332882 C Co:6:002:0 0 4 >
ffff000102d1dc00 4030332925 S Ci:6:002:0 s c0 05 0e00 0000 0004 4 <
ffff000102d1dc00 4030333031 C Ci:6:002:0 0 4 = 07000000
ffff000102d1dc00 4030333061 S Ci:6:002:0 s c0 05 08b0 0000 0004 4 <
ffff000102d1dc00 4030333171 C Ci:6:002:0 0 4 = 18060000
ffff000102d1dc00 4030333201 S Co:6:002:0 s 40 05 08b0 0000 0004 4 = 18060000
ffff000102d1dc00 4030333308 C Co:6:002:0 0 4 >
ffff000102d1dc00 4030333358 S Ci:6:002:0 s c0 05 0d44 0000 0004 4 <
ffff000102d1dc00 4030333466 C Ci:6:002:0 0 4 = 017c90b1
ffff000102d1dc00 4030333498 S Co:6:002:0 s 40 05 0e90 0000 0004 4 = 017c8001
ffff000102d1dc00 4030333616 C Co:6:002:0 0 4 >
ffff000102d1dc00 4030333659 S Ci:6:002:0 s c0 05 08ac 0000 0004 4 <
ffff000102d1dc00 4030333766 C Ci:6:002:0 0 4 = 08faf00f
ffff000102d1dc00 4030333796 S Co:6:002:0 s 40 05 08ac 0000 0004 4 = 08faf00f
ffff000102d1dc00 4030333902 C Co:6:002:0 0 4 >
ffff000102d1dc00 4030333932 S Ci:6:002:0 s c0 05 08ac 0000 0004 4 <
ffff000102d1dc00 4030334042 C Ci:6:002:0 0 4 = 08faf00f
ffff000102d1dc00 4030334072 S Co:6:002:0 s 40 05 08ac 0000 0004 4 = 08faf00f
ffff000102d1dc00 4030334178 C Co:6:002:0 0 4 >
ffff000102d1dc00 4030334208 S Ci:6:002:0 s c0 05 08c4 0000 0004 4 <
ffff000102d1dc00 4030334318 C Ci:6:002:0 0 4 = 00000000
ffff000102d1dc00 4030334348 S Co:6:002:0 s 40 05 08c4 0000 0004 4 = 00000000
ffff000102d1dc00 4030334454 C Co:6:002:0 0 4 >
ffff000102d1dc00 4030334485 S Ci:6:002:0 s c0 05 0e00 0000 0004 4 <
ffff000102d1dc00 4030334595 C Ci:6:002:0 0 4 = 07000000
ffff000102d1dc00 4030334625 S Ci:6:002:0 s c0 05 08b0 0000 0004 4 <
ffff000102d1dc00 4030334745 C Ci:6:002:0 0 4 = 18060000
ffff000102d1dc00 4030334775 S Co:6:002:0 s 40 05 08b0 0000 0004 4 = 18060000
ffff000102d1dc00 4030334883 C Co:6:002:0 0 4 >
ffff000102d1dc00 4030334933 S Ci:6:002:0 s c0 05 0d44 0000 0004 4 <
ffff000102d1dc00 4030335040 C Ci:6:002:0 0 4 = 017c90b1
ffff000102d1dc00 4030335071 S Co:6:002:0 s 40 05 0e90 0000 0004 4 = 017c8001
ffff000102d1dc00 4030335177 C Co:6:002:0 0 4 >
ffff000102d1dc00 4030335220 S Ci:6:002:0 s c0 05 0668 0000 0002 2 <
ffff000102d1dc00 4030335327 C Ci:6:002:0 0 2 = 0010
ffff000102d1dc00 4030335357 S Co:6:002:0 s 40 05 0668 0000 0002 2 = 0010
ffff000102d1dc00 4030335464 C Co:6:002:0 0 2 >
ffff000102d1dc00 4030335495 S Co:6:002:0 s 40 05 0483 0000 0001 1 = 00
ffff000102d1dc00 4030335614 C Co:6:002:0 0 1 >
ffff000102d1dc00 4030335645 S Ci:6:002:0 s c0 05 0837 0000 0001 1 <
ffff000102d1dc00 4030335754 C Ci:6:002:0 0 1 = 00
ffff000102d1dc00 4030335784 S Ci:6:002:0 s c0 05 08ac 0000 0004 4 <
ffff000102d1dc00 4030335895 C Ci:6:002:0 0 4 = 08faf00f
ffff000102d1dc00 4030335925 S Co:6:002:0 s 40 05 08ac 0000 0004 4 = 08faf00f
ffff000102d1dc00 4030336032 C Co:6:002:0 0 4 >
ffff000102d1dc00 4030336062 S Ci:6:002:0 s c0 05 08c4 0000 0004 4 <
ffff000102d1dc00 4030336177 C Ci:6:002:0 0 4 = 00000000
ffff000102d1dc00 4030336206 S Co:6:002:0 s 40 05 08c4 0000 0004 4 = 00000000
ffff000102d1dc00 4030336320 C Co:6:002:0 0 4 >
ffff000102d1dc00 4030336350 S Ci:6:002:0 s c0 05 0848 0000 0004 4 <
ffff000102d1dc00 4030336467 C Ci:6:002:0 0 4 = 8bffd061
ffff000102d1dc00 4030336497 S Co:6:002:0 s 40 05 0848 0000 0004 4 = 8bffd061
ffff000102d1dc00 4030336616 C Co:6:002:0 0 4 >
ffff000102d1dc00 4030336647 S Ci:6:002:0 s c0 05 08ac 0000 0004 4 <
ffff000102d1dc00 4030336757 C Ci:6:002:0 0 4 = 08faf00f
ffff000102d1dc00 4030336787 S Co:6:002:0 s 40 05 08ac 0000 0004 4 = 08faf00f
ffff000102d1dc00 4030336893 C Co:6:002:0 0 4 >
ffff000102d1dc00 4030336923 S Ci:6:002:0 s c0 05 08ac 0000 0004 4 <
ffff000102d1dc00 4030337033 C Ci:6:002:0 0 4 = 08faf00f
ffff000102d1dc00 4030337063 S Co:6:002:0 s 40 05 08ac 0000 0004 4 = 08faf00f
ffff000102d1dc00 4030337170 C Co:6:002:0 0 4 >
ffff000102d1dc00 4030337199 S Ci:6:002:0 s c0 05 08c4 0000 0004 4 <
ffff000102d1dc00 4030337310 C Ci:6:002:0 0 4 = 00000000
ffff000102d1dc00 4030337340 S Co:6:002:0 s 40 05 08c4 0000 0004 4 = 00000000
ffff000102d1dc00 4030337447 C Co:6:002:0 0 4 >
ffff000102d1dc00 4030337477 S Ci:6:002:0 s c0 05 0c00 0000 0004 4 <
ffff000102d1dc00 4030337587 C Ci:6:002:0 0 4 = 07000000
ffff000102d1dc00 4030337617 S Ci:6:002:0 s c0 05 08b0 0000 0004 4 <
ffff000102d1dc00 4030337743 C Ci:6:002:0 0 4 = 18060000
ffff000102d1dc00 4030337774 S Co:6:002:0 s 40 05 08b0 0000 0004 4 = 18060000
ffff000102d1dc00 4030337881 C Co:6:002:0 0 4 >
ffff000102d1dc00 4030337931 S Ci:6:002:0 s c0 05 0d04 0000 0004 4 <
ffff000102d1dc00 4030338039 C Ci:6:002:0 0 4 = 017c90b1
ffff000102d1dc00 4030338069 S Co:6:002:0 s 40 05 0c90 0000 0004 4 = 017c8001
ffff000102d1dc00 4030338175 C Co:6:002:0 0 4 >
ffff000102d1dc00 4030338219 S Ci:6:002:0 s c0 05 0e00 0000 0004 4 <
ffff000102d1dc00 4030338326 C Ci:6:002:0 0 4 = 07000000
ffff000102d1dc00 4030338356 S Ci:6:002:0 s c0 05 08b0 0000 0004 4 <
ffff000102d1dc00 4030338467 C Ci:6:002:0 0 4 = 18060000
ffff000102d1dc00 4030338497 S Co:6:002:0 s 40 05 08b0 0000 0004 4 = 18060000
ffff000102d1dc00 4030338615 C Co:6:002:0 0 4 >
ffff000102d1dc00 4030338666 S Ci:6:002:0 s c0 05 0d44 0000 0004 4 <
ffff000102d1dc00 4030338774 C Ci:6:002:0 0 4 = 017c90b1
ffff000102d1dc00 4030338805 S Co:6:002:0 s 40 05 0e90 0000 0004 4 = 017c8001
ffff000102d1dc00 4030338911 C Co:6:002:0 0 4 >
ffff000102d1dc00 4030338978 S Ci:6:002:0 s c0 05 0c20 0000 0004 4 <
ffff000102d1dc00 4030339085 C Ci:6:002:0 0 4 = 13131313
ffff000102d1dc00 4030339116 S Co:6:002:0 s 40 05 0c20 0000 0004 4 = 13131313
ffff000102d1dc00 4030339233 C Co:6:002:0 0 4 >
ffff000102d1dc00 4030339263 S Ci:6:002:0 s c0 05 0c24 0000 0004 4 <
ffff000102d1dc00 4030339374 C Ci:6:002:0 0 4 = 20202020
ffff000102d1dc00 4030339404 S Co:6:002:0 s 40 05 0c24 0000 0004 4 = 20202020
ffff000102d1dc00 4030339511 C Co:6:002:0 0 4 >
ffff000102d1dc00 4030339541 S Ci:6:002:0 s c0 05 0c28 0000 0004 4 <
ffff000102d1dc00 4030339651 C Ci:6:002:0 0 4 = 20201e1c
ffff000102d1dc00 4030339682 S Co:6:002:0 s 40 05 0c28 0000 0004 4 = 20201e1c
ffff000102d1dc00 4030339788 C Co:6:002:0 0 4 >
ffff000102d1dc00 4030339819 S Ci:6:002:0 s c0 05 0c2c 0000 0004 4 <
ffff000102d1dc00 4030339929 C Ci:6:002:0 0 4 = 20202020
ffff000102d1dc00 4030339959 S Co:6:002:0 s 40 05 0c2c 0000 0004 4 = 20202020
ffff000102d1dc00 4030340065 C Co:6:002:0 0 4 >
ffff000102d1dc00 4030340096 S Ci:6:002:0 s c0 05 0c30 0000 0004 4 <
ffff000102d1dc00 4030340212 C Ci:6:002:0 0 4 = 20201e1c
ffff000102d1dc00 4030340242 S Co:6:002:0 s 40 05 0c30 0000 0004 4 = 20201e1c
ffff000102d1dc00 4030340362 C Co:6:002:0 0 4 >
ffff000102d1dc00 4030340412 S Ci:6:002:0 s c0 05 0c34 0000 0004 4 <
ffff000102d1dc00 4030340531 C Ci:6:002:0 0 4 = 20202020
ffff000102d1dc00 4030340561 S Co:6:002:0 s 40 05 0c34 0000 0004 4 = 20202020
ffff000102d1dc00 4030340667 C Co:6:002:0 0 4 >
ffff000102d1dc00 4030340697 S Ci:6:002:0 s c0 05 0c38 0000 0004 4 <
ffff000102d1dc00 4030340809 C Ci:6:002:0 0 4 = 201e1c1a
ffff000102d1dc00 4030340839 S Co:6:002:0 s 40 05 0c38 0000 0004 4 = 201e1c1a
ffff000102d1dc00 4030340945 C Co:6:002:0 0 4 >
ffff000102d1dc00 4030340977 S Ci:6:002:0 s c0 05 0c3c 0000 0004 4 <
ffff000102d1dc00 4030341086 C Ci:6:002:0 0 4 = 20202020
ffff000102d1dc00 4030341116 S Co:6:002:0 s 40 05 0c3c 0000 0004 4 = 20202020
ffff000102d1dc00 4030341233 C Co:6:002:0 0 4 >
ffff000102d1dc00 4030341263 S Ci:6:002:0 s c0 05 0c40 0000 0004 4 <
ffff000102d1dc00 4030341375 C Ci:6:002:0 0 4 = 20201e1c
ffff000102d1dc00 4030341405 S Co:6:002:0 s 40 05 0c40 0000 0004 4 = 20201e1c
ffff000102d1dc00 4030341511 C Co:6:002:0 0 4 >
ffff000102d1dc00 4030341541 S Ci:6:002:0 s c0 05 0c44 0000 0004 4 <
ffff000102d1dc00 4030341653 C Ci:6:002:0 0 4 = 1a181e1e
ffff000102d1dc00 4030341683 S Co:6:002:0 s 40 05 0c44 0000 0004 4 = 1a181e1e
ffff000102d1dc00 4030341790 C Co:6:002:0 0 4 >
ffff000102d1dc00 4030341820 S Ci:6:002:0 s c0 05 0c48 0000 0004 4 <
ffff000102d1dc00 4030341931 C Ci:6:002:0 0 4 = 1e1e1e1e
ffff000102d1dc00 4030341962 S Co:6:002:0 s 40 05 0c48 0000 0004 4 = 1e1e1e1e
ffff000102d1dc00 4030342068 C Co:6:002:0 0 4 >
ffff000102d1dc00 4030342098 S Ci:6:002:0 s c0 05 0c4c 0000 0004 4 <
ffff000102d1dc00 4030342230 C Ci:6:002:0 0 4 = 1c1a1816
ffff000102d1dc00 4030342260 S Co:6:002:0 s 40 05 0c4c 0000 0004 4 = 1c1a1816
ffff000102d1dc00 4030342355 C Co:6:002:0 0 4 >
ffff000102d1dc00 4030342380 S Ci:6:002:0 s c0 05 0c54 0000 0004 4 <
ffff000102d1dc00 4030342495 C Ci:6:002:0 0 4 = 120a0400
ffff000102d1dc00 4030342526 S Co:6:002:0 s 40 05 0c54 0000 0004 4 = 120a0400
ffff000102d1dc00 4030342631 C Co:6:002:0 0 4 >
ffff000102d1dc00 4030342661 S Ci:6:002:0 s c0 05 0e20 0000 0004 4 <
ffff000102d1dc00 4030342771 C Ci:6:002:0 0 4 = 14141414
ffff000102d1dc00 4030342801 S Co:6:002:0 s 40 05 0e20 0000 0004 4 = 14141414
ffff000102d1dc00 4030342907 C Co:6:002:0 0 4 >
ffff000102d1dc00 4030342937 S Ci:6:002:0 s c0 05 0e24 0000 0004 4 <
ffff000102d1dc00 4030343047 C Ci:6:002:0 0 4 = 1d1d1d1d
ffff000102d1dc00 4030343078 S Co:6:002:0 s 40 05 0e24 0000 0004 4 = 1d1d1d1d
ffff000102d1dc00 4030343110 C Co:6:002:0 0 4 >
ffff000102d1dc00 4030343135 S Ci:6:002:0 s c0 05 0e28 0000 0004 4 <
ffff000102d1dc00 4030343174 C Ci:6:002:0 0 4 = 1d1d1b19
ffff000102d1dc00 4030343198 S Co:6:002:0 s 40 05 0e28 0000 0004 4 = 1d1d1b19
ffff000102d1dc00 4030343230 C Co:6:002:0 0 4 >
ffff000102d1dc00 4030343254 S Ci:6:002:0 s c0 05 0e2c 0000 0004 4 <
ffff000102d1dc00 4030343299 C Ci:6:002:0 0 4 = 1f1f1f1f
ffff000102d1dc00 4030343323 S Co:6:002:0 s 40 05 0e2c 0000 0004 4 = 1f1f1f1f
ffff000102d1dc00 4030343354 C Co:6:002:0 0 4 >
ffff000102d1dc00 4030343377 S Ci:6:002:0 s c0 05 0e30 0000 0004 4 <
ffff000102d1dc00 4030343424 C Ci:6:002:0 0 4 = 1f1f1d1b
ffff000102d1dc00 4030343447 S Co:6:002:0 s 40 05 0e30 0000 0004 4 = 1f1f1d1b
ffff000102d1dc00 4030343478 C Co:6:002:0 0 4 >
ffff000102d1dc00 4030343502 S Ci:6:002:0 s c0 05 0e34 0000 0004 4 <
ffff000102d1dc00 4030343549 C Ci:6:002:0 0 4 = 1f1f1f1f
ffff000102d1dc00 4030343574 S Co:6:002:0 s 40 05 0e34 0000 0004 4 = 1f1f1f1f
ffff000102d1dc00 4030343605 C Co:6:002:0 0 4 >
ffff000102d1dc00 4030343629 S Ci:6:002:0 s c0 05 0e38 0000 0004 4 <
ffff000102d1dc00 4030343674 C Ci:6:002:0 0 4 = 1f1d1b19
ffff000102d1dc00 4030343698 S Co:6:002:0 s 40 05 0e38 0000 0004 4 = 1f1d1b19
ffff000102d1dc00 4030343729 C Co:6:002:0 0 4 >
ffff000102d1dc00 4030343753 S Ci:6:002:0 s c0 05 0e3c 0000 0004 4 <
ffff000102d1dc00 4030343799 C Ci:6:002:0 0 4 = 1f1f1f1f
ffff000102d1dc00 4030343823 S Co:6:002:0 s 40 05 0e3c 0000 0004 4 = 1f1f1f1f
ffff000102d1dc00 4030343854 C Co:6:002:0 0 4 >
ffff000102d1dc00 4030343877 S Ci:6:002:0 s c0 05 0e40 0000 0004 4 <
ffff000102d1dc00 4030343923 C Ci:6:002:0 0 4 = 1f1f1d1b
ffff000102d1dc00 4030343947 S Co:6:002:0 s 40 05 0e40 0000 0004 4 = 1f1f1d1b
ffff000102d1dc00 4030343978 C Co:6:002:0 0 4 >
ffff000102d1dc00 4030344009 S Ci:6:002:0 s c0 05 0e44 0000 0004 4 <
ffff000102d1dc00 4030344057 C Ci:6:002:0 0 4 = 19171d1d
ffff000102d1dc00 4030344083 S Co:6:002:0 s 40 05 0e44 0000 0004 4 = 19171d1d
ffff000102d1dc00 4030344192 C Co:6:002:0 0 4 >
ffff000102d1dc00 4030344222 S Ci:6:002:0 s c0 05 0e48 0000 0004 4 <
ffff000102d1dc00 4030344340 C Ci:6:002:0 0 4 = 1d1d1d1d
ffff000102d1dc00 4030344370 S Co:6:002:0 s 40 05 0e48 0000 0004 4 = 1d1d1d1d
ffff000102d1dc00 4030344488 C Co:6:002:0 0 4 >
ffff000102d1dc00 4030344518 S Ci:6:002:0 s c0 05 0e4c 0000 0004 4 <
ffff000102d1dc00 4030344626 C Ci:6:002:0 0 4 = 1b191715
ffff000102d1dc00 4030344656 S Co:6:002:0 s 40 05 0e4c 0000 0004 4 = 1b191715
ffff000102d1dc00 4030344761 C Co:6:002:0 0 4 >
ffff000102d1dc00 4030344791 S Ci:6:002:0 s c0 05 0e54 0000 0004 4 <
ffff000102d1dc00 4030344899 C Ci:6:002:0 0 4 = 11090300
ffff000102d1dc00 4030344929 S Co:6:002:0 s 40 05 0e54 0000 0004 4 = 11090300
ffff000102d1dc00 4030345034 C Co:6:002:0 0 4 >
ffff000102d1dc00 4030345076 S Ci:6:002:0 s c0 05 0454 0000 0001 1 <
ffff000102d1dc00 4030345182 C Ci:6:002:0 0 1 = 00
ffff000102d1dc00 4030345213 S Ci:6:002:0 s c0 05 0454 0000 0001 1 <
ffff000102d1dc00 4030345320 C Ci:6:002:0 0 1 = 00
ffff000102d1dc00 4030345350 S Co:6:002:0 s 40 05 0454 0000 0001 1 = 80
ffff000102d1dc00 4030345455 C Co:6:002:0 0 1 >
ffff000102d1dc00 4030345484 S Ci:6:002:0 s c0 05 041a 0000 0002 2 <
ffff000102d1dc00 4030345593 C Ci:6:002:0 0 2 = ff0f
ffff000102d1dc00 4030345623 S Ci:6:002:0 s c0 05 0808 0000 0004 4 <
ffff000102d1dc00 4030345743 C Ci:6:002:0 0 4 = 3382023e
ffff000102d1dc00 4030345773 S Co:6:002:0 s 40 05 0808 0000 0004 4 = 3382023e
ffff000102d1dc00 4030345878 C Co:6:002:0 0 4 >
ffff000102d1dc00 4030345908 S Ci:6:002:0 s c0 05 0834 0000 0004 4 <
ffff000102d1dc00 4030346016 C Ci:6:002:0 0 4 = 05a73700
ffff000102d1dc00 4030346046 S Co:6:002:0 s 40 05 0834 0000 0004 4 = 06a73700
ffff000102d1dc00 4030346151 C Co:6:002:0 0 4 >
ffff000102d1dc00 4030346181 S Ci:6:002:0 s c0 05 0830 0000 0004 4 <
ffff000102d1dc00 4030346289 C Ci:6:002:0 0 4 = b8eeaa2e
ffff000102d1dc00 4030346321 S Co:6:002:0 s 40 05 0830 0000 0004 4 = b8aeaa2e
ffff000102d1dc00 4030346425 C Co:6:002:0 0 4 >
ffff000102d1dc00 4030346455 S Ci:6:002:0 s c0 05 0830 0000 0004 4 <
ffff000102d1dc00 4030346564 C Ci:6:002:0 0 4 = b8aeaa2e
ffff000102d1dc00 4030346593 S Co:6:002:0 s 40 05 0830 0000 0004 4 = b8aeaa2e
ffff000102d1dc00 4030346698 C Co:6:002:0 0 4 >
ffff000102d1dc00 4030346728 S Ci:6:002:0 s c0 05 082c 0000 0004 4 <
ffff000102d1dc00 4030346837 C Ci:6:002:0 0 4 = dc832000
ffff000102d1dc00 4030346867 S Co:6:002:0 s 40 05 082c 0000 0004 4 = dd832000
ffff000102d1dc00 4030346987 C Co:6:002:0 0 4 >
ffff000102d1dc00 4030347016 S Co:6:002:0 s 40 05 0cb0 0000 0004 4 = 17773354
ffff000102d1dc00 4030347048 C Co:6:002:0 0 4 >
ffff000102d1dc00 4030347072 S Co:6:002:0 s 40 05 0eb0 0000 0004 4 = 17773354
ffff000102d1dc00 4030347103 C Co:6:002:0 0 4 >
ffff000102d1dc00 4030347126 S Ci:6:002:0 s c0 05 0cb4 0000 0004 4 <
ffff000102d1dc00 4030347173 C Ci:6:002:0 0 4 = 77000001
ffff000102d1dc00 4030347196 S Co:6:002:0 s 40 05 0cb4 0000 0004 4 = 77000001
ffff000102d1dc00 4030347227 C Co:6:002:0 0 4 >
ffff000102d1dc00 4030347250 S Ci:6:002:0 s c0 05 0eb4 0000 0004 4 <
ffff000102d1dc00 4030347297 C Ci:6:002:0 0 4 = 77000001
ffff000102d1dc00 4030347322 S Co:6:002:0 s 40 05 0eb4 0000 0004 4 = 77000001
ffff000102d1dc00 4030347352 C Co:6:002:0 0 4 >
ffff000102d1dc00 4030347376 S Ci:6:002:0 s c0 05 0900 0000 0004 4 <
ffff000102d1dc00 4030347422 C Ci:6:002:0 0 4 = 01040000
ffff000102d1dc00 4030347445 S Co:6:002:0 s 40 05 0900 0000 0004 4 = 01040000
ffff000102d1dc00 4030347476 C Co:6:002:0 0 4 >
ffff000102d1dc00 4030347499 S Ci:6:002:0 s c0 05 080c 0000 0004 4 <
ffff000102d1dc00 4030347547 C Ci:6:002:0 0 4 = 13111312
ffff000102d1dc00 4030347570 S Co:6:002:0 s 40 05 080c 0000 0004 4 = 03111312
ffff000102d1dc00 4030347601 C Co:6:002:0 0 4 >
ffff000102d1dc00 4030347624 S Ci:6:002:0 s c0 05 0a04 0000 0004 4 <
ffff000102d1dc00 4030347672 C Ci:6:002:0 0 4 = 0c00ff01
ffff000102d1dc00 4030347695 S Co:6:002:0 s 40 05 0a04 0000 0004 4 = 0c00ff0f
ffff000102d1dc00 4030347726 C Co:6:002:0 0 4 >
ffff000102d1dc00 4030347749 S Ci:6:002:0 s c0 05 0440 0000 0004 4 <
ffff000102d1dc00 4030347797 C Ci:6:002:0 0 4 = 00000000
ffff000102d1dc00 4030347820 S Co:6:002:0 s 40 05 0440 0000 0004 4 = 50010000
ffff000102d1dc00 4030347851 C Co:6:002:0 0 4 >
ffff000102d1dc00 4030347875 S Ci:6:002:0 s c0 05 0c1c 0000 0004 4 <
ffff000102d1dc00 4030347922 C Ci:6:002:0 0 4 = 03000040
ffff000102d1dc00 4030347945 S Co:6:002:0 s 40 05 0c1c 0000 0004 4 = 0300402d
ffff000102d1dc00 4030347976 C Co:6:002:0 0 4 >
ffff000102d1dc00 4030347999 S Ci:6:002:0 s c0 05 0e1c 0000 0004 4 <
ffff000102d1dc00 4030348051 C Ci:6:002:0 0 4 = 03000040
ffff000102d1dc00 4030348076 S Co:6:002:0 s 40 05 0e1c 0000 0004 4 = 0300402d
ffff000102d1dc00 4030348184 C Co:6:002:0 0 4 >
ffff000102d1dc00 4030348215 S Ci:6:002:0 s c0 05 0860 0000 0004 4 <
ffff000102d1dc00 4030348324 C Ci:6:002:0 0 4 = 21c3d572
ffff000102d1dc00 4030348353 S Co:6:002:0 s 40 05 0860 0000 0004 4 = 21c32969
ffff000102d1dc00 4030348464 C Co:6:002:0 0 4 >
ffff000102d1dc00 4030348495 S Ci:6:002:0 s c0 05 0c00 0000 0004 4 <
ffff000103533780 4030348503 C Bi:6:002:1 0 376 = 40010484 00000f80 f1026000 04300000 00000000 f0187500 7e7e0000 fff6f60f
ffff000103533780 4030348511 S Bi:6:002:1 -115 32768 <
ffff000102d1dc00 4030348571 C Ci:6:002:0 0 4 = 07000000
ffff000102d1dc00 4030348597 S Ci:6:002:0 s c0 05 08b0 0000 0004 4 <
ffff000102d1dc00 4030348640 C Ci:6:002:0 0 4 = 18060000
ffff000102d1dc00 4030348664 S Co:6:002:0 s 40 05 08b0 0000 0004 4 = 18060000
ffff000102d1dc00 4030348771 C Co:6:002:0 0 4 >
ffff000102d1dc00 4030348821 S Ci:6:002:0 s c0 05 0d04 0000 0004 4 <
ffff000102d1dc00 4030348927 C Ci:6:002:0 0 4 = 017c90b1
ffff000102d1dc00 4030348956 S Co:6:002:0 s 40 05 0c90 0000 0004 4 = 017d8101
ffff000102d1dc00 4030349062 C Co:6:002:0 0 4 >
ffff000102d1dc00 4030349105 S Ci:6:002:0 s c0 05 08ac 0000 0004 4 <
ffff000102d1dc00 4030349213 C Ci:6:002:0 0 4 = 08faf00f
ffff000102d1dc00 4030349243 S Co:6:002:0 s 40 05 08ac 0000 0004 4 = 08faf00f
ffff000102d1dc00 4030349362 C Co:6:002:0 0 4 >
ffff000102d1dc00 4030349391 S Ci:6:002:0 s c0 05 08ac 0000 0004 4 <
ffff000102d1dc00 4030349501 C Ci:6:002:0 0 4 = 08faf00f
ffff000102d1dc00 4030349532 S Co:6:002:0 s 40 05 08ac 0000 0004 4 = 08faf00f
ffff000102d1dc00 4030349637 C Co:6:002:0 0 4 >
ffff000102d1dc00 4030349667 S Ci:6:002:0 s c0 05 08c4 0000 0004 4 <
ffff000102d1dc00 4030349775 C Ci:6:002:0 0 4 = 00000000
ffff000102d1dc00 4030349805 S Co:6:002:0 s 40 05 08c4 0000 0004 4 = 00000000
ffff000102d1dc00 4030349911 C Co:6:002:0 0 4 >
ffff000102d1dc00 4030349941 S Ci:6:002:0 s c0 05 0c00 0000 0004 4 <
ffff000102d1dc00 4030350049 C Ci:6:002:0 0 4 = 07000000
ffff000102d1dc00 4030350079 S Ci:6:002:0 s c0 05 08b0 0000 0004 4 <
ffff000102d1dc00 4030350188 C Ci:6:002:0 0 4 = 18060000
ffff000102d1dc00 4030350218 S Co:6:002:0 s 40 05 08b0 0000 0004 4 = 18060000
ffff000102d1dc00 4030350323 C Co:6:002:0 0 4 >
ffff000102d1dc00 4030350373 S Ci:6:002:0 s c0 05 0d04 0000 0004 4 <
ffff000102d1dc00 4030350495 C Ci:6:002:0 0 4 = 017d91b1
ffff000102d1dc00 4030350526 S Co:6:002:0 s 40 05 0c90 0000 0004 4 = 307d8101
ffff000102d1dc00 4030350630 C Co:6:002:0 0 4 >
ffff000102d1dc00 4030350673 S Ci:6:002:0 s c0 05 0e00 0000 0004 4 <
ffff000102d1dc00 4030350780 C Ci:6:002:0 0 4 = 07000000
ffff000102d1dc00 4030350810 S Ci:6:002:0 s c0 05 08b0 0000 0004 4 <
ffff000102d1dc00 4030350920 C Ci:6:002:0 0 4 = 18060000
ffff000102d1dc00 4030350949 S Co:6:002:0 s 40 05 08b0 0000 0004 4 = 18060000
ffff000102d1dc00 4030351054 C Co:6:002:0 0 4 >
ffff000102d1dc00 4030351104 S Ci:6:002:0 s c0 05 0d44 0000 0004 4 <
ffff000102d1dc00 4030351142 C Ci:6:002:0 0 4 = 017c90b1
ffff000102d1dc00 4030351165 S Co:6:002:0 s 40 05 0e90 0000 0004 4 = 017d8101
ffff000102d1dc00 4030351196 C Co:6:002:0 0 4 >
ffff000102d1dc00 4030351233 S Ci:6:002:0 s c0 05 08ac 0000 0004 4 <
ffff000102d1dc00 4030351270 C Ci:6:002:0 0 4 = 08faf00f
ffff000102d1dc00 4030351293 S Co:6:002:0 s 40 05 08ac 0000 0004 4 = 08faf00f
ffff000102d1dc00 4030351324 C Co:6:002:0 0 4 >
ffff000102d1dc00 4030351347 S Ci:6:002:0 s c0 05 08ac 0000 0004 4 <
ffff000102d1dc00 4030351383 C Ci:6:002:0 0 4 = 08faf00f
ffff000102d1dc00 4030351406 S Co:6:002:0 s 40 05 08ac 0000 0004 4 = 08faf00f
ffff000102d1dc00 4030351437 C Co:6:002:0 0 4 >
ffff000102d1dc00 4030351460 S Ci:6:002:0 s c0 05 08c4 0000 0004 4 <
ffff000102d1dc00 4030351496 C Ci:6:002:0 0 4 = 00000000
ffff000102d1dc00 4030351520 S Co:6:002:0 s 40 05 08c4 0000 0004 4 = 00000000
ffff000102d1dc00 4030351551 C Co:6:002:0 0 4 >
ffff000102d1dc00 4030351575 S Ci:6:002:0 s c0 05 0e00 0000 0004 4 <
ffff000102d1dc00 4030351611 C Ci:6:002:0 0 4 = 07000000
ffff000102d1dc00 4030351635 S Ci:6:002:0 s c0 05 08b0 0000 0004 4 <
ffff000102d1dc00 4030351673 C Ci:6:002:0 0 4 = 18060000
ffff000102d1dc00 4030351696 S Co:6:002:0 s 40 05 08b0 0000 0004 4 = 18060000
ffff000102d1dc00 4030351727 C Co:6:002:0 0 4 >
ffff000102d1dc00 4030351770 S Ci:6:002:0 s c0 05 0d44 0000 0004 4 <
ffff000102d1dc00 4030351806 C Ci:6:002:0 0 4 = 017d91b1
ffff000102d1dc00 4030351829 S Co:6:002:0 s 40 05 0e90 0000 0004 4 = 307d8101
ffff000102d1dc00 4030351860 C Co:6:002:0 0 4 >
ffff000102d1dc00 4030351896 S Ci:6:002:0 s c0 05 0668 0000 0002 2 <
ffff000102d1dc00 4030351933 C Ci:6:002:0 0 2 = 0010
ffff000102d1dc00 4030351957 S Co:6:002:0 s 40 05 0668 0000 0002 2 = 0010
ffff000102d1dc00 4030351988 C Co:6:002:0 0 2 >
ffff00014c2bf840 4030352015 S Co:6:002:0 s 40 05 0483 0000 0001 1 = 00
ffff00014c2bf840 4030352073 C Co:6:002:0 0 1 >
ffff00014c2bf840 4030352097 S Ci:6:002:0 s c0 05 0837 0000 0001 1 <
ffff00014c2bf840 4030352138 C Ci:6:002:0 0 1 = 00
ffff00014c2bf840 4030352163 S Ci:6:002:0 s c0 05 08ac 0000 0004 4 <
ffff00014c2bf840 4030352199 C Ci:6:002:0 0 4 = 08faf00f
ffff00014c2bf840 4030352223 S Co:6:002:0 s 40 05 08ac 0000 0004 4 = 08faf00f
ffff00014c2bf840 4030352253 C Co:6:002:0 0 4 >
ffff00014c2bf840 4030352276 S Ci:6:002:0 s c0 05 08c4 0000 0004 4 <
ffff00014c2bf840 4030352313 C Ci:6:002:0 0 4 = 00000000
ffff00014c2bf840 4030352336 S Co:6:002:0 s 40 05 08c4 0000 0004 4 = 00000000
ffff00014c2bf840 4030352366 C Co:6:002:0 0 4 >
ffff00014c2bf840 4030352389 S Ci:6:002:0 s c0 05 0848 0000 0004 4 <
ffff00014c2bf840 4030352425 C Ci:6:002:0 0 4 = 8bffd061
ffff00014c2bf840 4030352448 S Co:6:002:0 s 40 05 0848 0000 0004 4 = 8bffd061
ffff00014c2bf840 4030352479 C Co:6:002:0 0 4 >
ffff00014c2bf840 4030352502 S Ci:6:002:0 s c0 05 08ac 0000 0004 4 <
ffff00014c2bf840 4030352548 C Ci:6:002:0 0 4 = 08faf00f
ffff00014c2bf840 4030352571 S Co:6:002:0 s 40 05 08ac 0000 0004 4 = 08faf00f
ffff00014c2bf840 4030352601 C Co:6:002:0 0 4 >
ffff00014c2bf840 4030352624 S Ci:6:002:0 s c0 05 08ac 0000 0004 4 <
ffff00014c2bf840 4030352673 C Ci:6:002:0 0 4 = 08faf00f
ffff00014c2bf840 4030352697 S Co:6:002:0 s 40 05 08ac 0000 0004 4 = 08faf00f
ffff00014c2bf840 4030352729 C Co:6:002:0 0 4 >
ffff00014c2bf840 4030352752 S Ci:6:002:0 s c0 05 08c4 0000 0004 4 <
ffff00014c2bf840 4030352798 C Ci:6:002:0 0 4 = 00000000
ffff00014c2bf840 4030352821 S Co:6:002:0 s 40 05 08c4 0000 0004 4 = 00000000
ffff00014c2bf840 4030352852 C Co:6:002:0 0 4 >
ffff00014c2bf840 4030352874 S Ci:6:002:0 s c0 05 0c00 0000 0004 4 <
ffff00014c2bf840 4030352922 C Ci:6:002:0 0 4 = 07000000
ffff00014c2bf840 4030352946 S Ci:6:002:0 s c0 05 08b0 0000 0004 4 <
ffff00014c2bf840 4030352982 C Ci:6:002:0 0 4 = 18060000
ffff00014c2bf840 4030353006 S Co:6:002:0 s 40 05 08b0 0000 0004 4 = 18060000
ffff00014c2bf840 4030353044 C Co:6:002:0 0 4 >
ffff00014c2bf840 4030353087 S Ci:6:002:0 s c0 05 0d04 0000 0004 4 <
ffff00014c2bf840 4030353123 C Ci:6:002:0 0 4 = 307d91b1
ffff00014c2bf840 4030353146 S Co:6:002:0 s 40 05 0c90 0000 0004 4 = 307d8101
ffff00014c2bf840 4030353176 C Co:6:002:0 0 4 >
ffff00014c2bf840 4030353212 S Ci:6:002:0 s c0 05 0e00 0000 0004 4 <
ffff00014c2bf840 4030353248 C Ci:6:002:0 0 4 = 07000000
ffff00014c2bf840 4030353271 S Ci:6:002:0 s c0 05 08b0 0000 0004 4 <
ffff00014c2bf840 4030353307 C Ci:6:002:0 0 4 = 18060000
ffff00014c2bf840 4030353330 S Co:6:002:0 s 40 05 08b0 0000 0004 4 = 18060000
ffff00014c2bf840 4030353360 C Co:6:002:0 0 4 >
ffff00014c2bf840 4030353403 S Ci:6:002:0 s c0 05 0d44 0000 0004 4 <
ffff00014c2bf840 4030353440 C Ci:6:002:0 0 4 = 307d91b1
ffff00014c2bf840 4030353463 S Co:6:002:0 s 40 05 0e90 0000 0004 4 = 307d8101
ffff00014c2bf840 4030353493 C Co:6:002:0 0 4 >
ffff00014c2bf840 4030353530 S Ci:6:002:0 s c0 05 0073 0000 0001 1 <
ffff00014c2bf840 4030353567 C Ci:6:002:0 0 1 = 07
ffff00014c2bf840 4030353590 S Co:6:002:0 s 40 05 0073 0000 0001 1 = 07
ffff00014c2bf840 4030353621 C Co:6:002:0 0 1 >
ffff00014c2bf840 4030353662 S Ci:6:002:0 s c0 05 0c24 0000 0004 4 <
ffff00014c2bf840 4030353699 C Ci:6:002:0 0 4 = 20202020
ffff00014c2bf840 4030353722 S Co:6:002:0 s 40 05 0c24 0000 0004 4 = 24242424
ffff00014c2bf840 4030353752 C Co:6:002:0 0 4 >
ffff00014c2bf840 4030353776 S Ci:6:002:0 s c0 05 0c28 0000 0004 4 <
ffff00014c2bf840 4030353812 C Ci:6:002:0 0 4 = 20201e1c
ffff00014c2bf840 4030353835 S Co:6:002:0 s 40 05 0c28 0000 0004 4 = 24242422
ffff00014c2bf840 4030353866 C Co:6:002:0 0 4 >
ffff00014c2bf840 4030353889 S Ci:6:002:0 s c0 05 0c2c 0000 0004 4 <
ffff00014c2bf840 4030353926 C Ci:6:002:0 0 4 = 20202020
ffff00014c2bf840 4030353949 S Co:6:002:0 s 40 05 0c2c 0000 0004 4 = 29292929
ffff00014c2bf840 4030353981 C Co:6:002:0 0 4 >
ffff00014c2bf840 4030354003 S Ci:6:002:0 s c0 05 0c30 0000 0004 4 <
ffff00014c2bf840 4030354048 C Ci:6:002:0 0 4 = 20201e1c
ffff00014c2bf840 4030354071 S Co:6:002:0 s 40 05 0c30 0000 0004 4 = 29272523
ffff00014c2bf840 4030354102 C Co:6:002:0 0 4 >
ffff00014c2bf840 4030354125 S Ci:6:002:0 s c0 05 0c34 0000 0004 4 <
ffff00014c2bf840 4030354173 C Ci:6:002:0 0 4 = 20202020
ffff00014c2bf840 4030354196 S Co:6:002:0 s 40 05 0c34 0000 0004 4 = 25252525
ffff00014c2bf840 4030354227 C Co:6:002:0 0 4 >
ffff00014c2bf840 4030354250 S Ci:6:002:0 s c0 05 0c38 0000 0004 4 <
ffff00014c2bf840 4030354298 C Ci:6:002:0 0 4 = 201e1c1a
ffff00014c2bf840 4030354321 S Co:6:002:0 s 40 05 0c38 0000 0004 4 = 25252321
ffff00014c2bf840 4030354352 C Co:6:002:0 0 4 >
ffff00014c2bf840 4030354375 S Ci:6:002:0 s c0 05 0c3c 0000 0004 4 <
ffff00014c2bf840 4030354423 C Ci:6:002:0 0 4 = 20202020
ffff00014c2bf840 4030354446 S Co:6:002:0 s 40 05 0c3c 0000 0004 4 = 29292929
ffff00014c2bf840 4030354476 C Co:6:002:0 0 4 >
ffff00014c2bf840 4030354499 S Ci:6:002:0 s c0 05 0c40 0000 0004 4 <
ffff00014c2bf840 4030354548 C Ci:6:002:0 0 4 = 20201e1c
ffff00014c2bf840 4030354571 S Co:6:002:0 s 40 05 0c40 0000 0004 4 = 29272523
ffff00014c2bf840 4030354602 C Co:6:002:0 0 4 >
ffff00014c2bf840 4030354624 S Ci:6:002:0 s c0 05 0c44 0000 0004 4 <
ffff00014c2bf840 4030354674 C Ci:6:002:0 0 4 = 1a181e1e
ffff00014c2bf840 4030354697 S Co:6:002:0 s 40 05 0c44 0000 0004 4 = 21212525
ffff00014c2bf840 4030354727 C Co:6:002:0 0 4 >
ffff00014c2bf840 4030354750 S Ci:6:002:0 s c0 05 0c48 0000 0004 4 <
ffff00014c2bf840 4030354798 C Ci:6:002:0 0 4 = 1e1e1e1e
ffff00014c2bf840 4030354822 S Co:6:002:0 s 40 05 0c48 0000 0004 4 = 25252525
ffff00014c2bf840 4030354853 C Co:6:002:0 0 4 >
ffff00014c2bf840 4030354875 S Ci:6:002:0 s c0 05 0c4c 0000 0004 4 <
ffff00014c2bf840 4030354923 C Ci:6:002:0 0 4 = 1c1a1816
ffff00014c2bf840 4030354947 S Co:6:002:0 s 40 05 0c4c 0000 0004 4 = 23211f1f
ffff00014c2bf840 4030354977 C Co:6:002:0 0 4 >
ffff00014c2bf840 4030355000 S Ci:6:002:0 s c0 05 0c54 0000 0004 4 <
ffff00014c2bf840 4030355048 C Ci:6:002:0 0 4 = 120a0400
ffff00014c2bf840 4030355071 S Co:6:002:0 s 40 05 0c54 0000 0004 4 = 19110b00
ffff00014c2bf840 4030355102 C Co:6:002:0 0 4 >
ffff00014c2bf840 4030355125 S Ci:6:002:0 s c0 05 0e24 0000 0004 4 <
ffff00014c2bf840 4030355171 C Ci:6:002:0 0 4 = 1d1d1d1d
ffff00014c2bf840 4030355194 S Co:6:002:0 s 40 05 0e24 0000 0004 4 = 21212121
ffff00014c2bf840 4030355225 C Co:6:002:0 0 4 >
ffff00014c2bf840 4030355247 S Ci:6:002:0 s c0 05 0e28 0000 0004 4 <
ffff00014c2bf840 4030355296 C Ci:6:002:0 0 4 = 1d1d1b19
ffff00014c2bf840 4030355319 S Co:6:002:0 s 40 05 0e28 0000 0004 4 = 2121211f
ffff00014c2bf840 4030355349 C Co:6:002:0 0 4 >
ffff00014c2bf840 4030355372 S Ci:6:002:0 s c0 05 0e2c 0000 0004 4 <
ffff00014c2bf840 4030355421 C Ci:6:002:0 0 4 = 1f1f1f1f
ffff00014c2bf840 4030355444 S Co:6:002:0 s 40 05 0e2c 0000 0004 4 = 26262626
ffff00014c2bf840 4030355474 C Co:6:002:0 0 4 >
ffff00014c2bf840 4030355497 S Ci:6:002:0 s c0 05 0e30 0000 0004 4 <
ffff00014c2bf840 4030355546 C Ci:6:002:0 0 4 = 1f1f1d1b
ffff00014c2bf840 4030355569 S Co:6:002:0 s 40 05 0e30 0000 0004 4 = 26242220
ffff00014c2bf840 4030355599 C Co:6:002:0 0 4 >
ffff00014c2bf840 4030355622 S Ci:6:002:0 s c0 05 0e34 0000 0004 4 <
ffff00014c2bf840 4030355671 C Ci:6:002:0 0 4 = 1f1f1f1f
ffff00014c2bf840 4030355695 S Co:6:002:0 s 40 05 0e34 0000 0004 4 = 22222222
ffff00014c2bf840 4030355725 C Co:6:002:0 0 4 >
ffff00014c2bf840 4030355748 S Ci:6:002:0 s c0 05 0e38 0000 0004 4 <
ffff00014c2bf840 4030355796 C Ci:6:002:0 0 4 = 1f1d1b19
ffff00014c2bf840 4030355819 S Co:6:002:0 s 40 05 0e38 0000 0004 4 = 2222201e
ffff00014c2bf840 4030355849 C Co:6:002:0 0 4 >
ffff00014c2bf840 4030355872 S Ci:6:002:0 s c0 05 0e3c 0000 0004 4 <
ffff00014c2bf840 4030355921 C Ci:6:002:0 0 4 = 1f1f1f1f
ffff00014c2bf840 4030355945 S Co:6:002:0 s 40 05 0e3c 0000 0004 4 = 26262626
ffff00014c2bf840 4030355976 C Co:6:002:0 0 4 >
ffff00014c2bf840 4030355998 S Ci:6:002:0 s c0 05 0e40 0000 0004 4 <
ffff00014c2bf840 4030356047 C Ci:6:002:0 0 4 = 1f1f1d1b
ffff00014c2bf840 4030356072 S Co:6:002:0 s 40 05 0e40 0000 0004 4 = 26242220
ffff00014c2bf840 4030356103 C Co:6:002:0 0 4 >
ffff00014c2bf840 4030356127 S Ci:6:002:0 s c0 05 0e44 0000 0004 4 <
ffff00014c2bf840 4030356171 C Ci:6:002:0 0 4 = 19171d1d
ffff00014c2bf840 4030356195 S Co:6:002:0 s 40 05 0e44 0000 0004 4 = 1e1e2222
ffff00014c2bf840 4030356225 C Co:6:002:0 0 4 >
ffff00014c2bf840 4030356248 S Ci:6:002:0 s c0 05 0e48 0000 0004 4 <
ffff00014c2bf840 4030356296 C Ci:6:002:0 0 4 = 1d1d1d1d
ffff00014c2bf840 4030356319 S Co:6:002:0 s 40 05 0e48 0000 0004 4 = 22222222
ffff00014c2bf840 4030356350 C Co:6:002:0 0 4 >
ffff00014c2bf840 4030356373 S Ci:6:002:0 s c0 05 0e4c 0000 0004 4 <
ffff00014c2bf840 4030356422 C Ci:6:002:0 0 4 = 1b191715
ffff00014c2bf840 4030356445 S Co:6:002:0 s 40 05 0e4c 0000 0004 4 = 201e1c1c
ffff00014c2bf840 4030356475 C Co:6:002:0 0 4 >
ffff00014c2bf840 4030356498 S Ci:6:002:0 s c0 05 0e54 0000 0004 4 <
ffff00014c2bf840 4030356546 C Ci:6:002:0 0 4 = 11090300
ffff00014c2bf840 4030356569 S Co:6:002:0 s 40 05 0e54 0000 0004 4 = 160e0800
ffff00014c2bf840 4030356600 C Co:6:002:0 0 4 >
ffff000103150540 4030748216 S Ci:6:002:0 s c0 05 004c 0000 0001 1 <
ffff000103150540 4030748375 C Ci:6:002:0 0 1 = 20
ffff000103150540 4030748523 S Co:6:002:0 s 40 05 004c 0000 0001 1 = 20
ffff000103150540 4030748633 C Co:6:002:0 0 1 >
ffff00014c2bf840 4031772275 S Ci:6:002:0 s c0 05 0770 0000 0004 4 <
ffff00014c2bf840 4031772408 C Ci:6:002:0 0 4 = 00000000
ffff00014c2bf840 4031772533 S Ci:6:002:0 s c0 05 0774 0000 0004 4 <
ffff00014c2bf840 4031772680 C Ci:6:002:0 0 4 = 00000000
ffff00014c2bf840 4031772839 S Co:6:002:0 s 40 05 076e 0000 0001 1 = 0c
ffff00014c2bf840 4031772978 C Co:6:002:0 0 1 >
ffff00014c2bf840 4031773140 S Ci:6:002:0 s c0 05 0808 0000 0004 4 <
ffff00014c2bf840 4031773286 C Ci:6:002:0 0 4 = 3382023e
ffff00014c2bf840 4031773439 S Ci:6:002:0 s c0 05 0a5c 0000 0002 2 <
ffff00014c2bf840 4031773575 C Ci:6:002:0 0 2 = 3100
ffff00014c2bf840 4031773732 S Ci:6:002:0 s c0 05 0f48 0000 0002 2 <
ffff00014c2bf840 4031773878 C Ci:6:002:0 0 2 = fc08
ffff00014c2bf840 4031774022 S Ci:6:002:0 s c0 05 0f04 0000 0004 4 <
ffff00014c2bf840 4031774142 C Ci:6:002:0 0 4 = 04000400
ffff00014c2bf840 4031774178 S Ci:6:002:0 s c0 05 0f14 0000 0004 4 <
ffff00014c2bf840 4031774287 C Ci:6:002:0 0 4 = 7d005d00
ffff00014c2bf840 4031774317 S Ci:6:002:0 s c0 05 0f10 0000 0004 4 <
ffff00014c2bf840 4031774427 C Ci:6:002:0 0 4 = 00000000
ffff00014c2bf840 4031774457 S Ci:6:002:0 s c0 05 0f0c 0000 0004 4 <
ffff00014c2bf840 4031774567 C Ci:6:002:0 0 4 = 00000000
ffff00014c2bf840 4031774596 S Ci:6:002:0 s c0 05 0f08 0000 0004 4 <
ffff00014c2bf840 4031774722 C Ci:6:002:0 0 4 = 4000d609
ffff00014c2bf840 4031774751 S Ci:6:002:0 s c0 05 0fcc 0000 0004 4 <
ffff00014c2bf840 4031774868 C Ci:6:002:0 0 4 = 00000000
ffff00014c2bf840 4031774889 S Ci:6:002:0 s c0 05 09a4 0000 0004 4 <
ffff00014c2bf840 4031775000 C Ci:6:002:0 0 4 = 80000800
ffff00014c2bf840 4031775030 S Co:6:002:0 s 40 05 09a4 0000 0004 4 = 80000a00
ffff00014c2bf840 4031775059 C Co:6:002:0 0 4 >
ffff00014c2bf840 4031775075 S Ci:6:002:0 s c0 05 09a4 0000 0004 4 <
ffff00014c2bf840 4031775109 C Ci:6:002:0 0 4 = 80000a00
ffff00014c2bf840 4031775124 S Co:6:002:0 s 40 05 09a4 0000 0004 4 = 80000800
ffff00014c2bf840 4031775157 C Co:6:002:0 0 4 >
ffff00014c2bf840 4031775172 S Ci:6:002:0 s c0 05 0a2c 0000 0004 4 <
ffff00014c2bf840 4031775206 C Ci:6:002:0 0 4 = 00809000
ffff00014c2bf840 4031775229 S Co:6:002:0 s 40 05 0a2c 0000 0004 4 = 00009000
ffff00014c2bf840 4031775276 C Co:6:002:0 0 4 >
ffff00014c2bf840 4031775400 S Ci:6:002:0 s c0 05 0a2c 0000 0004 4 <
ffff00014c2bf840 4031775441 C Ci:6:002:0 0 4 = 00009000
ffff00014c2bf840 4031775465 S Co:6:002:0 s 40 05 0a2c 0000 0004 4 = 00809000
ffff00014c2bf840 4031775494 C Co:6:002:0 0 4 >
ffff00014c2bf840 4031775509 S Ci:6:002:0 s c0 05 0b58 0000 0004 4 <
ffff00014c2bf840 4031775544 C Ci:6:002:0 0 4 = 00000000
ffff00014c2bf840 4031775559 S Co:6:002:0 s 40 05 0b58 0000 0004 4 = 01000000
ffff00014c2bf840 4031775588 C Co:6:002:0 0 4 >
ffff00014c2bf840 4031775602 S Ci:6:002:0 s c0 05 0b58 0000 0004 4 <
ffff00014c2bf840 4031775654 C Ci:6:002:0 0 4 = 01000000
ffff00014c2bf840 4031775676 S Co:6:002:0 s 40 05 0b58 0000 0004 4 = 00000000
ffff00014c2bf840 4031775706 C Co:6:002:0 0 4 >
ffff00014c2bf840 4031775722 S Ci:6:002:0 s c0 05 01cc 0000 0001 1 <
ffff00014c2bf840 4031775756 C Ci:6:002:0 0 1 = 00
ffff00014c2bf840 4031775771 S Co:6:002:0 s 40 05 01fc 0000 0004 4 = 00000000
ffff00014c2bf840 4031775799 C Co:6:002:0 0 4 >
ffff00014c2bf840 4031775814 S Co:6:002:0 s 40 05 01dc 0000 0004 4 = 58000000
ffff00014c2bf840 4031775842 C Co:6:002:0 0 4 >
ffff00014c2bf840 4031775860 S Co:6:002:0 s 40 05 0440 0000 0004 4 = 00000000
ffff00014c2bf840 4031775904 C Co:6:002:0 0 4 >
ffff00014c2bf840 4031775929 S Ci:6:002:0 s c0 05 0c00 0000 0004 4 <
ffff00014c2bf840 4031775963 C Ci:6:002:0 0 4 = 07000000
ffff00014c2bf840 4031775978 S Ci:6:002:0 s c0 05 08b0 0000 0004 4 <
ffff00014c2bf840 4031776039 C Ci:6:002:0 0 4 = 18060000
ffff00014c2bf840 4031776055 S Co:6:002:0 s 40 05 08b0 0000 0004 4 = 42060000
ffff00014c2bf840 4031776169 C Co:6:002:0 0 4 >
ffff00014c2bf840 4031776219 S Ci:6:002:0 s c0 05 0d04 0000 0004 4 <
ffff00014c2bf840 4031776337 C Ci:6:002:0 0 4 = 108d90b1
ffff00014c2bf840 4031776366 S Co:6:002:0 s 40 05 0c90 0000 0004 4 = 108d2304
ffff00014c2bf840 4031776480 C Co:6:002:0 0 4 >
ffff00014c2bf840 4031776623 S Co:6:002:0 s 40 05 0280 0000 0002 2 = 0001
ffff00014c2bf840 4031776764 C Co:6:002:0 0 2 >
ffff00014c2bf840 4031776925 S Ci:6:002:0 s c0 05 010c 0000 0001 1 <
ffff00014c2bf840 4031777072 C Ci:6:002:0 0 1 = b4
ffff00014c2bf840 4031777229 S Co:6:002:0 s 40 05 010c 0000 0001 1 = b4
ffff00014c2bf840 4031777373 C Co:6:002:0 0 1 >
ffff000103150540 4031777643 S Ci:6:002:0 s c0 05 004c 0000 0001 1 <
ffff000103150540 4031777768 C Ci:6:002:0 0 1 = 20
ffff000103150540 4031777887 S Co:6:002:0 s 40 05 004c 0000 0001 1 = 20
ffff000103150540 4031778003 C Co:6:002:0 0 1 >
ffff0001035330c0 4032018833 C Bi:6:002:1 0 228 = ac000484 00000f80 3b0a6000 04300000 00000000 75968e00 20200000 46f3f30f
ffff0001035330c0 4032018872 S Bi:6:002:1 -115 32768 <
ffff000103533480 4032035606 C Bi:6:002:1 0 228 = ac000484 00000f80 3c0a6000 04300000 00000000 f2d78e00 20220000 46f1f10f
ffff000103533480 4032035639 S Bi:6:002:1 -115 32768 <
ffff000103150540 4032732208 S Ci:6:002:0 s c0 05 004c 0000 0001 1 <
ffff000103150540 4032732353 C Ci:6:002:0 0 1 = 20
ffff000103150540 4032732688 S Co:6:002:0 s 40 05 004c 0000 0001 1 = 20
ffff000103150540 4032732791 C Co:6:002:0 0 1 >
ffff000103533240 4033115567 C Bi:6:002:1 0 105 = 31000484 00000f80 34076000 04300000 00000000 3f539f00 282c0000 58eeee0f
ffff000103533240 4033115596 S Bi:6:002:1 -115 32768 <
ffff000103533780 4033115664 C Bi:6:002:1 0 105 = 31000484 00000f80 35076000 04300000 00000000 da539f00 2a2e0000 5de8e80f
ffff000103533780 4033115669 S Bi:6:002:1 -115 32768 <
