ffff00014c2bf900 1194492845 C Bi:6:002:1 0 383 = 47010484 00000f80 950b6000 04300000 00000000 e00ced01 46380000 89eeee01
ffff00014c2bf900 1194492925 S Bi:6:002:1 -115 32768 <
ffff00013d62e840 1194493843 C Bi:6:002:1 0 376 = 40010484 00000f80 02036000 04300000 00000000 cc10ed01 463c0000 88ebeb01
ffff00013d62e840 1194493869 S Bi:6:002:1 -115 32768 <
ffff000103533900 1194494662 C Bi:6:002:1 0 351 = 27010484 00000f80 c30c6000 04300000 00000000 2214ed01 463e0000 89f5f501
ffff000103533900 1194494687 S Bi:6:002:1 -115 32768 <
ffff000103558cc0 1194495827 C Bi:6:002:1 0 374 = 3e010484 00000f80 95076000 04300000 00000000 9f18ed01 463a0000 85f2f201
ffff000103558cc0 1194495849 S Bi:6:002:1 -115 32768 <
ffff00014c2bf900 1194496785 C Bi:6:002:1 0 384 = 48010484 00000f80 650a6000 04300000 00000000 551ced01 463a0000 8af0f001
ffff00014c2bf900 1194496819 S Bi:6:002:1 -115 32768 <
ffff00013d62e840 1194548254 C Bi:6:002:1 0 377 = 41010484 00000f00 460d6000 04300000 00000000 2de5ed01 463a0000 89f7f701
ffff00013d62e840 1194548313 S Bi:6:002:1 -115 32768 <
ffff000103533900 1194548860 C Bi:6:002:1 0 377 = 41010484 00000f00 460d6000 04300000 00000000 b6e7ed01 463c0000 87f3f301
ffff000103533900 1194548886 S Bi:6:002:1 -115 32768 <
ffff000103558cc0 1194549482 C Bi:6:002:1 0 377 = 41010484 00000f00 460d6000 04300000 00000000 24eaed01 46380000 8af5f501
ffff000103558cc0 1194549505 S Bi:6:002:1 -115 32768 <
ffff00014c2bf900 1194550092 C Bi:6:002:1 0 377 = 41010484 00000f00 460d6000 04300000 00000000 89eced01 463a0000 87eaea01
ffff00014c2bf900 1194550117 S Bi:6:002:1 -115 32768 <
ffff00013d62e840 1194550719 C Bi:6:002:1 0 370 = 3a010484 00000f00 29066000 04300000 00000000 f4eeed01 463c0000 8cfcfc01
ffff00013d62e840 1194550744 S Bi:6:002:1 -115 32768 <
ffff000103533900 1194551341 C Bi:6:002:1 0 370 = 3a010484 00000f00 29066000 04300000 00000000 63f1ed01 46400000 89f5f501
ffff000103533900 1194551365 S Bi:6:002:1 -115 32768 <
ffff000103558cc0 1194551936 C Bi:6:002:1 0 370 = 3a010484 00000f00 29066000 04300000 00000000 c0f3ed01 483c0000 89f9f901
ffff000103558cc0 1194551960 S Bi:6:002:1 -115 32768 <
ffff00014c2bf900 1194552518 C Bi:6:002:1 0 370 = 3a010484 00000f00 29066000 04300000 00000000 1df6ed01 463a0000 8afcfc01
ffff00014c2bf900 1194552539 S Bi:6:002:1 -115 32768 <
ffff00013d62e840 1194553096 C Bi:6:002:1 0 345 = 21010484 00000f00 d9086000 04300000 00000000 83f8ed01 463c0000 8af4f401
ffff00013d62e840 1194553115 S Bi:6:002:1 -115 32768 <
ffff000103533900 1194553692 C Bi:6:002:1 0 345 = 21010484 00000f00 d9086000 04300000 00000000 d2faed01 463a0000 88f5f501
ffff000103533900 1194553712 S Bi:6:002:1 -115 32768 <
ffff000103558cc0 1194554269 C Bi:6:002:1 0 345 = 21010484 00000f00 d9086000 04300000 00000000 18fded01 463c0000 88eded01
ffff000103558cc0 1194554288 S Bi:6:002:1 -115 32768 <
ffff00014c2bf900 1194555002 C Bi:6:002:1 0 345 = 21010484 00000f00 d9086000 04300000 00000000 f8ffed01 443c0000 86fcfc01
ffff00014c2bf900 1194555021 S Bi:6:002:1 -115 32768 <
ffff00013d62e840 1194555667 C Bi:6:002:1 0 378 = 42010484 00000f00 7b0a6000 04300000 00000000 5902ee01 463a0000 88e9e901
ffff00013d62e840 1194555689 S Bi:6:002:1 -115 32768 <
ffff000103533900 1194556283 C Bi:6:002:1 0 378 = 42010484 00000f00 7b0a6000 04300000 00000000 cb04ee01 463c0000 88f2f201
ffff000103533900 1194556303 S Bi:6:002:1 -115 32768 <
ffff000103558cc0 1194556919 C Bi:6:002:1 0 378 = 42010484 00000f00 7b0a6000 04300000 00000000 4607ee01 463a0000 86ecec01
ffff000103558cc0 1194556938 S Bi:6:002:1 -115 32768 <
ffff00014c2bf900 1194595556 C Bi:6:002:1 0 383 = 47010484 00000f80 960b6000 04300000 00000000 219eee01 463a0000 87f1f101
ffff00014c2bf900 1194595582 S Bi:6:002:1 -115 32768 <
ffff00013d62e840 1194596623 C Bi:6:002:1 0 376 = 40010484 00000f80 03036000 04300000 00000000 3fa2ee01 46380000 85eeee01
ffff00013d62e840 1194596650 S Bi:6:002:1 -115 32768 <
ffff000103533900 1194598738 C Bi:6:002:1 0 374 = 3e010484 00000f80 96076000 04300000 00000000 93aaee01 463c0000 87f9f901
ffff000103533900 1194598766 S Bi:6:002:1 -115 32768 <
ffff000103558cc0 1194599818 C Bi:6:002:1 0 384 = 48010484 00000f80 660a6000 04300000 00000000 b7aeee01 463a0000 89f2f201
ffff000103558cc0 1194599843 S Bi:6:002:1 -115 32768 <
ffff00014c2bf900 1194697613 C Bi:6:002:1 0 383 = 47010484 00000f80 970b6000 04300000 00000000 c82cf001 463a0000 89efef01
ffff00014c2bf900 1194697648 S Bi:6:002:1 -115 32768 <
ffff00013d62e840 1194698614 C Bi:6:002:1 0 376 = 40010484 00000f80 04036000 04300000 00000000 b230f001 463a0000 87fdfd01
ffff00013d62e840 1194698639 S Bi:6:002:1 -115 32768 <
ffff000103533900 1194699506 C Bi:6:002:1 0 351 = 27010484 00000f80 c50c6000 04300000 00000000 5034f001 463a0000 89f8f801
ffff000103533900 1194699531 S Bi:6:002:1 -115 32768 <
ffff000103533480 1194748286 S Ci:6:002:0 s c0 05 0770 0000 0004 4 <
ffff000103533480 1194748462 C Ci:6:002:0 0 4 = 00000000
ffff000103533480 1194748619 S Ci:6:002:0 s c0 05 0774 0000 0004 4 <
ffff000103533480 1194748763 C Ci:6:002:0 0 4 = 00000000
ffff000103533480 1194748926 S Co:6:002:0 s 40 05 076e 0000 0001 1 = 0c
ffff000103533480 1194749070 C Co:6:002:0 0 1 >
ffff000103533480 1194749231 S Ci:6:002:0 s c0 05 0808 0000 0004 4 <
ffff000103533480 1194749376 C Ci:6:002:0 0 4 = 3382023e
ffff000103533480 1194749535 S Ci:6:002:0 s c0 05 0a5c 0000 0002 2 <
ffff000103533480 1194749679 C Ci:6:002:0 0 2 = 9f00
ffff000103533480 1194749841 S Ci:6:002:0 s c0 05 0f48 0000 0002 2 <
ffff000103533480 1194749985 C Ci:6:002:0 0 2 = 4406
ffff000103533480 1194750146 S Ci:6:002:0 s c0 05 0f04 0000 0004 4 <
ffff000103533480 1194750267 C Ci:6:002:0 0 4 = 06000600
ffff000103533480 1194750294 S Ci:6:002:0 s c0 05 0f14 0000 0004 4 <
ffff000103533480 1194750412 C Ci:6:002:0 0 4 = d3002600
ffff000103533480 1194750483 S Ci:6:002:0 s c0 05 0f10 0000 0004 4 <
ffff000103533480 1194750595 C Ci:6:002:0 0 4 = 00000000
ffff000103533480 1194750624 S Ci:6:002:0 s c0 05 0f0c 0000 0004 4 <
ffff000103533480 1194750736 C Ci:6:002:0 0 4 = 00000000
ffff000103533480 1194750764 S Ci:6:002:0 s c0 05 0f08 0000 0004 4 <
ffff000103533480 1194750881 C Ci:6:002:0 0 4 = 0e013d07
ffff000103533480 1194750904 S Ci:6:002:0 s c0 05 0fcc 0000 0004 4 <
ffff000103533480 1194751013 C Ci:6:002:0 0 4 = 00000000
ffff000103533480 1194751044 S Ci:6:002:0 s c0 05 09a4 0000 0004 4 <
ffff000103533480 1194751155 C Ci:6:002:0 0 4 = 80000800
ffff000103533480 1194751177 S Co:6:002:0 s 40 05 09a4 0000 0004 4 = 80000a00
ffff000103533480 1194751284 C Co:6:002:0 0 4 >
ffff000103533480 1194751312 S Ci:6:002:0 s c0 05 09a4 0000 0004 4 <
ffff000103533480 1194751435 C Ci:6:002:0 0 4 = 80000a00
ffff000103533480 1194751455 S Co:6:002:0 s 40 05 09a4 0000 0004 4 = 80000800
ffff000103533480 1194751563 C Co:6:002:0 0 4 >
ffff000103533480 1194751592 S Ci:6:002:0 s c0 05 0a2c 0000 0004 4 <
ffff000103533480 1194751704 C Ci:6:002:0 0 4 = 00809000
ffff000103533480 1194751725 S Co:6:002:0 s 40 05 0a2c 0000 0004 4 = 00009000
ffff000103533480 1194751833 C Co:6:002:0 0 4 >
ffff000103533480 1194751861 S Ci:6:002:0 s c0 05 0a2c 0000 0004 4 <
ffff000103533480 1194751978 C Ci:6:002:0 0 4 = 00009000
ffff000103533480 1194751999 S Co:6:002:0 s 40 05 0a2c 0000 0004 4 = 00809000
ffff000103533480 1194752119 C Co:6:002:0 0 4 >
ffff000103533480 1194752148 S Ci:6:002:0 s c0 05 0b58 0000 0004 4 <
ffff000103533480 1194752264 C Ci:6:002:0 0 4 = 00000000
ffff000103533480 1194752285 S Co:6:002:0 s 40 05 0b58 0000 0004 4 = 01000000
ffff000103533480 1194752392 C Co:6:002:0 0 4 >
ffff000103533480 1194752421 S Ci:6:002:0 s c0 05 0b58 0000 0004 4 <
ffff000103533480 1194752532 C Ci:6:002:0 0 4 = 01000000
ffff000103533480 1194752561 S Co:6:002:0 s 40 05 0b58 0000 0004 4 = 00000000
ffff000103533480 1194752680 C Co:6:002:0 0 4 >
ffff000103533480 1194752710 S Ci:6:002:0 s c0 05 01cc 0000 0001 1 <
ffff000103533480 1194752826 C Ci:6:002:0 0 1 = 00
ffff000103533480 1194752849 S Co:6:002:0 s 40 05 01fc 0000 0004 4 = 00000000
ffff000103533480 1194752957 C Co:6:002:0 0 4 >
ffff000103533480 1194752988 S Co:6:002:0 s 40 05 01dc 0000 0004 4 = 58000000
ffff000103533480 1194753093 C Co:6:002:0 0 4 >
ffff000103533480 1194753123 S Co:6:002:0 s 40 05 0440 0000 0004 4 = 00000000
ffff000103533480 1194753229 C Co:6:002:0 0 4 >
ffff000103533480 1194753259 S Ci:6:002:0 s c0 05 0c00 0000 0004 4 <
ffff000103533480 1194753375 C Ci:6:002:0 0 4 = 07000000
ffff000103533480 1194753398 S Ci:6:002:0 s c0 05 08b0 0000 0004 4 <
ffff000103533480 1194753509 C Ci:6:002:0 0 4 = 18060000
ffff000103533480 1194753537 S Co:6:002:0 s 40 05 08b0 0000 0004 4 = 42060000
ffff000103533480 1194753651 C Co:6:002:0 0 4 >
ffff000103533480 1194753692 S Ci:6:002:0 s c0 05 0d04 0000 0004 4 <
ffff000103533480 1194753813 C Ci:6:002:0 0 4 = 088d90b1
ffff000103533480 1194753834 S Co:6:002:0 s 40 05 0c90 0000 0004 4 = 088d2304
ffff000103533480 1194753941 C Co:6:002:0 0 4 >
ffff000103533480 1194753984 S Co:6:002:0 s 40 05 0280 0000 0002 2 = 0001
ffff000103533480 1194754088 C Co:6:002:0 0 2 >
ffff000103533480 1194754119 S Ci:6:002:0 s c0 05 010c 0000 0001 1 <
ffff000103533480 1194754230 C Ci:6:002:0 0 1 = b4
ffff000103533480 1194754259 S Co:6:002:0 s 40 05 010c 0000 0001 1 = b4
ffff000103533480 1194754366 C Co:6:002:0 0 1 >
ffff000103533480 1194780200 S Ci:6:002:0 s c0 05 004c 0000 0001 1 <
ffff000103533480 1194780348 C Ci:6:002:0 0 1 = 20
ffff000103533480 1194780505 S Co:6:002:0 s 40 05 004c 0000 0001 1 = 20
ffff000103533480 1194780644 C Co:6:002:0 0 1 >
ffff000103558cc0 1194805811 C Bi:6:002:1 0 351 = 27010484 00000f80 c60c6000 04300000 00000000 70d3f101 44360000 8aeaea01
ffff000103558cc0 1194805839 S Bi:6:002:1 -115 32768 <
ffff00014c2bf900 1194806588 C Bi:6:002:1 0 374 = 3e010484 00000f80 98076000 04300000 00000000 81d6f101 463a0000 83fafa01
ffff00014c2bf900 1194806614 S Bi:6:002:1 -115 32768 <
ffff00013d62e840 1194807414 C Bi:6:002:1 0 384 = 48010484 00000f80 680a6000 04300000 00000000 a5d9f101 443a0000 84f7f701
ffff00013d62e840 1194807438 S Bi:6:002:1 -115 32768 <
ffff000103533900 1194832145 C Bi:6:002:1 0 84 = 1c000484 00000f22 1c046000 04300000 00000000 b23bf201 3e3c0000 75f0f001
ffff000103533900 1194832180 S Bi:6:002:1 -115 32768 <
ffff000103558cc0 1194904083 C Bi:6:002:1 0 376 = 40010484 00000f80 06036000 04300000 00000000 3053f301 463c0000 86f5f501
ffff000103558cc0 1194904136 S Bi:6:002:1 -115 32768 <
ffff00014c2bf900 1194904838 C Bi:6:002:1 0 351 = 27010484 00000f80 c70c6000 04300000 00000000 5f56f301 463a0000 87f0f001
ffff00014c2bf900 1194904867 S Bi:6:002:1 -115 32768 <
ffff00013d62e840 1194905624 C Bi:6:002:1 0 374 = 3e010484 00000f80 99076000 04300000 00000000 5859f301 463a0000 87efef01
ffff00013d62e840 1194905649 S Bi:6:002:1 -115 32768 <
ffff000103533900 1194906587 C Bi:6:002:1 0 384 = 48010484 00000f80 690a6000 04300000 00000000 0a5df301 463e0000 88fbfb01
ffff000103533900 1194906611 S Bi:6:002:1 -115 32768 <
ffff000103558cc0 1195004864 C Bi:6:002:1 0 383 = 47010484 00000f80 9a0b6000 04300000 00000000 cddcf401 463e0000 8bf1f101
ffff000103558cc0 1195004901 S Bi:6:002:1 -115 32768 <
ffff00014c2bf900 1195006775 C Bi:6:002:1 0 351 = 27010484 00000f80 c80c6000 04300000 00000000 97e4f401 463a0000 88f7f701
ffff00014c2bf900 1195006801 S Bi:6:002:1 -115 32768 <
ffff00013d62e840 1195009909 C Bi:6:002:1 0 384 = 48010484 00000f80 6a0a6000 04300000 00000000 8df0f401 463a0000 87eaea01
ffff00013d62e840 1195009947 S Bi:6:002:1 -115 32768 <
ffff000103533900 1195107685 C Bi:6:002:1 0 383 = 47010484 00000f80 9b0b6000 04300000 00000000 796ef601 463c0000 8af3f301
ffff000103533900 1195107742 S Bi:6:002:1 -115 32768 <
ffff000103558cc0 1195109655 C Bi:6:002:1 0 351 = 27010484 00000f80 c90c6000 04300000 00000000 7276f601 463a0000 88efef01
ffff000103558cc0 1195109681 S Bi:6:002:1 -115 32768 <
ffff00014c2bf900 1195110729 C Bi:6:002:1 0 374 = 3e010484 00000f80 9b076000 04300000 00000000 8d7af601 463a0000 86fafa01
ffff00014c2bf900 1195110754 S Bi:6:002:1 -115 32768 <
ffff00013d62e840 1195111563 C Bi:6:002:1 0 384 = 48010484 00000f80 6b0a6000 04300000 00000000 bd7df601 463c0000 85f6f601
ffff00013d62e840 1195111588 S Bi:6:002:1 -115 32768 <
ffff000103533900 1195209999 C Bi:6:002:1 0 383 = 47010484 00000f80 9c0b6000 04300000 00000000 25fef701 46380000 87f2f201
ffff000103533900 1195210056 S Bi:6:002:1 -115 32768 <
ffff000103558cc0 1195210906 C Bi:6:002:1 0 376 = 40010484 00000f80 09036000 04300000 00000000 cb01f801 463e0000 86f2f201
ffff000103558cc0 1195210934 S Bi:6:002:1 -115 32768 <
ffff00014c2bf900 1195211812 C Bi:6:002:1 0 351 = 27010484 00000f80 ca0c6000 04300000 00000000 8505f801 46380000 87f1f101
ffff00014c2bf900 1195211838 S Bi:6:002:1 -115 32768 <
ffff00013d62e840 1195212771 C Bi:6:002:1 0 374 = 3e010484 00000f80 9c076000 04300000 00000000 2f09f801 463a0000 86fbfb01
ffff00013d62e840 1195212793 S Bi:6:002:1 -115 32768 <
ffff000103533900 1195213683 C Bi:6:002:1 0 384 = 48010484 00000f80 6c0a6000 04300000 00000000 9b0cf801 463c0000 8af6f601
ffff000103533900 1195213710 S Bi:6:002:1 -115 32768 <
ffff000103558cc0 1195312059 C Bi:6:002:1 0 383 = 47010484 00000f80 9d0b6000 04300000 00000000 d18cf901 46380000 89eded01
ffff000103558cc0 1195312112 S Bi:6:002:1 -115 32768 <
ffff00014c2bf900 1195313167 C Bi:6:002:1 0 376 = 40010484 00000f80 0a036000 04300000 00000000 5091f901 463a0000 87ecec01
ffff00014c2bf900 1195313194 S Bi:6:002:1 -115 32768 <
ffff00013d62e840 1195314090 C Bi:6:002:1 0 351 = 27010484 00000f80 cb0c6000 04300000 00000000 0995f901 463a0000 88f9f901
ffff00013d62e840 1195314115 S Bi:6:002:1 -115 32768 <
ffff000103533900 1195315053 C Bi:6:002:1 0 374 = 3e010484 00000f80 9d076000 04300000 00000000 b298f901 46380000 89f4f401
ffff000103533900 1195315077 S Bi:6:002:1 -115 32768 <
ffff000103558cc0 1195315957 C Bi:6:002:1 0 384 = 48010484 00000f80 6d0a6000 04300000 00000000 319cf901 463a0000 89eded01
ffff000103558cc0 1195315980 S Bi:6:002:1 -115 32768 <
ffff00014c2bf900 1195415693 C Bi:6:002:1 0 376 = 40010484 00000f80 0b036000 04300000 00000000 dd21fb01 463c0000 88e7e701
ffff00014c2bf900 1195415745 S Bi:6:002:1 -115 32768 <
ffff00013d62e840 1195416564 C Bi:6:002:1 0 351 = 27010484 00000f80 cc0c6000 04300000 00000000 9725fb01 463a0000 87eeee01
ffff00013d62e840 1195416583 S Bi:6:002:1 -115 32768 <
ffff000103533900 1195417610 C Bi:6:002:1 0 374 = 3e010484 00000f80 9e076000 04300000 00000000 4129fb01 463c0000 87f8f801
ffff000103533900 1195417634 S Bi:6:002:1 -115 32768 <
ffff000103a6ec00 1195459601 S Ci:6:002:0 s c0 05 0454 0000 0001 1 <
ffff000103a6ec00 1195459773 C Ci:6:002:0 0 1 = 00
ffff000103a6ec00 1195459825 S Ci:6:002:0 s c0 05 0860 0000 0004 4 <
ffff000103a6ec00 1195459866 C Ci:6:002:0 0 4 = 21c3d572
ffff000103a6ec00 1195459899 S Co:6:002:0 s 40 05 0860 0000 0004 4 = 21c3d572
ffff000103a6ec00 1195459929 C Co:6:002:0 0 4 >
ffff000103a6ec00 1195459960 S Ci:6:002:0 s c0 05 0c00 0000 0004 4 <
ffff000103a6ec00 1195459995 C Ci:6:002:0 0 4 = 07000000
ffff000103a6ec00 1195460157 S Ci:6:002:0 s c0 05 08b0 0000 0004 4 <
ffff000103a6ec00 1195460216 C Ci:6:002:0 0 4 = 42060000
ffff000103a6ec00 1195460251 S Co:6:002:0 s 40 05 08b0 0000 0004 4 = 18060000
ffff000103a6ec00 1195460283 C Co:6:002:0 0 4 >
ffff000102da6480 1195460336 S Ci:6:002:0 s c0 05 0d04 0000 0004 4 <
ffff000102da6480 1195460390 C Ci:6:002:0 0 4 = 017c90b1
ffff00013d29e600 1195460426 S Co:6:002:0 s 40 05 0c90 0000 0004 4 = 017c8001
ffff00013d29e600 1195460472 C Co:6:002:0 0 4 >
ffff00013d29e600 1195460520 S Ci:6:002:0 s c0 05 08ac 0000 0004 4 <
ffff00013d29e600 1195460572 C Ci:6:002:0 0 4 = 08faf00f
ffff00013d29e600 1195460606 S Co:6:002:0 s 40 05 08ac 0000 0004 4 = 08faf00f
ffff00013d29e600 1195460640 C Co:6:002:0 0 4 >
ffff00013d29e600 1195460673 S Ci:6:002:0 s c0 05 08ac 0000 0004 4 <
ffff00013d29e600 1195460727 C Ci:6:002:0 0 4 = 08faf00f
ffff00013d29e600 1195460762 S Co:6:002:0 s 40 05 08ac 0000 0004 4 = 08faf00f
ffff00013d29e600 1195460793 C Co:6:002:0 0 4 >
ffff00013d29e600 1195460828 S Ci:6:002:0 s c0 05 08c4 0000 0004 4 <
ffff00013d29e600 1195460863 C Ci:6:002:0 0 4 = 00000000
ffff00013d29e600 1195460897 S Co:6:002:0 s 40 05 08c4 0000 0004 4 = 00000000
ffff00013d29e600 1195460929 C Co:6:002:0 0 4 >
ffff00013d29e600 1195460965 S Ci:6:002:0 s c0 05 0c00 0000 0004 4 <
ffff00013d29e600 1195461000 C Ci:6:002:0 0 4 = 07000000
ffff00013d29e600 1195461035 S Ci:6:002:0 s c0 05 08b0 0000 0004 4 <
ffff00013d29e600 1195461069 C Ci:6:002:0 0 4 = 18060000
ffff00013d29e600 1195461105 S Co:6:002:0 s 40 05 08b0 0000 0004 4 = 18060000
ffff00013d29e600 1195461136 C Co:6:002:0 0 4 >
ffff00013d29e600 1195461207 S Ci:6:002:0 s c0 05 0d04 0000 0004 4 <
ffff00013d29e600 1195461253 C Ci:6:002:0 0 4 = 017c90b1
ffff00013d29e600 1195461288 S Co:6:002:0 s 40 05 0c90 0000 0004 4 = 017c8001
ffff00013d29e600 1195461348 C Co:6:002:0 0 4 >
ffff00013d29e600 1195461396 S Ci:6:002:0 s c0 05 0e00 0000 0004 4 <
ffff00013d29e600 1195461443 C Ci:6:002:0 0 4 = 07000000
ffff00013d29e600 1195461476 S Ci:6:002:0 s c0 05 08b0 0000 0004 4 <
ffff00013d29e600 1195461511 C Ci:6:002:0 0 4 = 18060000
ffff00013d29e600 1195461545 S Co:6:002:0 s 40 05 08b0 0000 0004 4 = 18060000
ffff00013d29e600 1195461577 C Co:6:002:0 0 4 >
ffff00013d29e600 1195461630 S Ci:6:002:0 s c0 05 0d44 0000 0004 4 <
ffff00013d29e600 1195461678 C Ci:6:002:0 0 4 = 017c90b1
ffff00013d29e600 1195461713 S Co:6:002:0 s 40 05 0e90 0000 0004 4 = 017c8001
ffff00013d29e600 1195461744 C Co:6:002:0 0 4 >
ffff00013d29e600 1195461791 S Ci:6:002:0 s c0 05 08ac 0000 0004 4 <
ffff00013d29e600 1195461857 C Ci:6:002:0 0 4 = 08faf00f
ffff00013d29e600 1195461891 S Co:6:002:0 s 40 05 08ac 0000 0004 4 = 08faf00f
ffff00013d29e600 1195461922 C Co:6:002:0 0 4 >
ffff00013d29e600 1195461955 S Ci:6:002:0 s c0 05 08ac 0000 0004 4 <
ffff00013d29e600 1195461990 C Ci:6:002:0 0 4 = 08faf00f
ffff00013d29e600 1195462026 S Co:6:002:0 s 40 05 08ac 0000 0004 4 = 08faf00f
ffff00013d29e600 1195462057 C Co:6:002:0 0 4 >
ffff00013d29e600 1195462091 S Ci:6:002:0 s c0 05 08c4 0000 0004 4 <
ffff00013d29e600 1195462127 C Ci:6:002:0 0 4 = 00000000
ffff00013d29e600 1195462161 S Co:6:002:0 s 40 05 08c4 0000 0004 4 = 00000000
ffff00013d29e600 1195462193 C Co:6:002:0 0 4 >
ffff00013d29e600 1195462227 S Ci:6:002:0 s c0 05 0e00 0000 0004 4 <
ffff00013d29e600 1195462263 C Ci:6:002:0 0 4 = 07000000
ffff00013d29e600 1195462297 S Ci:6:002:0 s c0 05 08b0 0000 0004 4 <
ffff00013d29e600 1195462350 C Ci:6:002:0 0 4 = 18060000
ffff00013d29e600 1195462385 S Co:6:002:0 s 40 05 08b0 0000 0004 4 = 18060000
ffff00013d29e600 1195462416 C Co:6:002:0 0 4 >
ffff00013d29e600 1195462471 S Ci:6:002:0 s c0 05 0d44 0000 0004 4 <
ffff00013d29e600 1195462518 C Ci:6:002:0 0 4 = 017c90b1
ffff00013d29e600 1195462552 S Co:6:002:0 s 40 05 0e90 0000 0004 4 = 017c8001
ffff00013d29e600 1195462601 C Co:6:002:0 0 4 >
ffff00013d29e600 1195462648 S Ci:6:002:0 s c0 05 0668 0000 0002 2 <
ffff00013d29e600 1195462695 C Ci:6:002:0 0 2 = 0010
ffff00013d29e600 1195462729 S Co:6:002:0 s 40 05 0668 0000 0002 2 = 0010
ffff00013d29e600 1195462760 C Co:6:002:0 0 2 >
ffff00013d29e600 1195462793 S Co:6:002:0 s 40 05 0483 0000 0001 1 = 00
ffff00013d29e600 1195462824 C Co:6:002:0 0 1 >
ffff00013d29e600 1195462857 S Ci:6:002:0 s c0 05 0837 0000 0001 1 <
ffff00013d29e600 1195462892 C Ci:6:002:0 0 1 = 00
ffff00013d29e600 1195462929 S Ci:6:002:0 s c0 05 08ac 0000 0004 4 <
ffff00013d29e600 1195462982 C Ci:6:002:0 0 4 = 08faf00f
ffff00013d29e600 1195463016 S Co:6:002:0 s 40 05 08ac 0000 0004 4 = 08faf00f
ffff00013d29e600 1195463047 C Co:6:002:0 0 4 >
ffff00013d29e600 1195463081 S Ci:6:002:0 s c0 05 08c4 0000 0004 4 <
ffff00013d29e600 1195463118 C Ci:6:002:0 0 4 = 00000000
ffff00013d29e600 1195463152 S Co:6:002:0 s 40 05 08c4 0000 0004 4 = 00000000
ffff00013d29e600 1195463184 C Co:6:002:0 0 4 >
ffff00013d29e600 1195463218 S Ci:6:002:0 s c0 05 0848 0000 0004 4 <
ffff00013d29e600 1195463254 C Ci:6:002:0 0 4 = 8bffd061
ffff00013d29e600 1195463289 S Co:6:002:0 s 40 05 0848 0000 0004 4 = 8bffd061
ffff00013d29e600 1195463321 C Co:6:002:0 0 4 >
ffff00013d29e600 1195463355 S Ci:6:002:0 s c0 05 08ac 0000 0004 4 <
ffff00013d29e600 1195463392 C Ci:6:002:0 0 4 = 08faf00f
ffff00013d29e600 1195463426 S Co:6:002:0 s 40 05 08ac 0000 0004 4 = 08faf00f
ffff00013d29e600 1195463475 C Co:6:002:0 0 4 >
ffff00013d29e600 1195463510 S Ci:6:002:0 s c0 05 08ac 0000 0004 4 <
ffff00013d29e600 1195463547 C Ci:6:002:0 0 4 = 08faf00f
ffff00013d29e600 1195463582 S Co:6:002:0 s 40 05 08ac 0000 0004 4 = 08faf00f
ffff00013d29e600 1195463613 C Co:6:002:0 0 4 >
ffff00013d29e600 1195463648 S Ci:6:002:0 s c0 05 08c4 0000 0004 4 <
ffff00013d29e600 1195463685 C Ci:6:002:0 0 4 = 00000000
ffff00013d29e600 1195463719 S Co:6:002:0 s 40 05 08c4 0000 0004 4 = 00000000
ffff00013d29e600 1195463750 C Co:6:002:0 0 4 >
ffff00013d29e600 1195463777 S Ci:6:002:0 s c0 05 0c00 0000 0004 4 <
ffff00013d29e600 1195463814 C Ci:6:002:0 0 4 = 07000000
ffff00013d29e600 1195463848 S Ci:6:002:0 s c0 05 08b0 0000 0004 4 <
ffff00013d29e600 1195463885 C Ci:6:002:0 0 4 = 18060000
ffff00013d29e600 1195463919 S Co:6:002:0 s 40 05 08b0 0000 0004 4 = 18060000
ffff00013d29e600 1195463951 C Co:6:002:0 0 4 >
ffff00013d29e600 1195464017 S Ci:6:002:0 s c0 05 0d04 0000 0004 4 <
ffff00013d29e600 1195464053 C Ci:6:002:0 0 4 = 017c90b1
ffff00013d29e600 1195464083 S Co:6:002:0 s 40 05 0c90 0000 0004 4 = 017c8001
ffff00013d29e600 1195464115 C Co:6:002:0 0 4 >
ffff00013d29e600 1195464163 S Ci:6:002:0 s c0 05 0e00 0000 0004 4 <
ffff00013d29e600 1195464229 C Ci:6:002:0 0 4 = 07000000
ffff00013d29e600 1195464263 S Ci:6:002:0 s c0 05 08b0 0000 0004 4 <
ffff00013d29e600 1195464299 C Ci:6:002:0 0 4 = 18060000
ffff00013d29e600 1195464333 S Co:6:002:0 s 40 05 08b0 0000 0004 4 = 18060000
ffff00013d29e600 1195464364 C Co:6:002:0 0 4 >
ffff00013d29e600 1195464418 S Ci:6:002:0 s c0 05 0d44 0000 0004 4 <
ffff00013d29e600 1195464483 C Ci:6:002:0 0 4 = 017c90b1
ffff00013d29e600 1195464517 S Co:6:002:0 s 40 05 0e90 0000 0004 4 = 017c8001
ffff00013d29e600 1195464547 C Co:6:002:0 0 4 >
ffff00013d29e600 1195464616 S Ci:6:002:0 s c0 05 0c20 0000 0004 4 <
ffff00013d29e600 1195464665 C Ci:6:002:0 0 4 = 13131313
ffff00013d29e600 1195464699 S Co:6:002:0 s 40 05 0c20 0000 0004 4 = 13131313
ffff00013d29e600 1195464731 C Co:6:002:0 0 4 >
ffff00013d29e600 1195464764 S Ci:6:002:0 s c0 05 0c24 0000 0004 4 <
ffff00013d29e600 1195464801 C Ci:6:002:0 0 4 = 20202020
ffff00013d29e600 1195464836 S Co:6:002:0 s 40 05 0c24 0000 0004 4 = 20202020
ffff00013d29e600 1195464867 C Co:6:002:0 0 4 >
ffff00013d29e600 1195464901 S Ci:6:002:0 s c0 05 0c28 0000 0004 4 <
ffff00013d29e600 1195464938 C Ci:6:002:0 0 4 = 20201e1c
ffff00013d29e600 1195464973 S Co:6:002:0 s 40 05 0c28 0000 0004 4 = 20201e1c
ffff00013d29e600 1195465004 C Co:6:002:0 0 4 >
ffff00013d29e600 1195465039 S Ci:6:002:0 s c0 05 0c2c 0000 0004 4 <
ffff00013d29e600 1195465076 C Ci:6:002:0 0 4 = 20202020
ffff00013d29e600 1195465111 S Co:6:002:0 s 40 05 0c2c 0000 0004 4 = 20202020
ffff00013d29e600 1195465143 C Co:6:002:0 0 4 >
ffff00013d29e600 1195465177 S Ci:6:002:0 s c0 05 0c30 0000 0004 4 <
ffff00013d29e600 1195465232 C Ci:6:002:0 0 4 = 20201e1c
ffff00013d29e600 1195465267 S Co:6:002:0 s 40 05 0c30 0000 0004 4 = 20201e1c
ffff00013d29e600 1195465299 C Co:6:002:0 0 4 >
ffff00013d29e600 1195465334 S Ci:6:002:0 s c0 05 0c34 0000 0004 4 <
ffff00013d29e600 1195465372 C Ci:6:002:0 0 4 = 20202020
ffff00013d29e600 1195465407 S Co:6:002:0 s 40 05 0c34 0000 0004 4 = 20202020
ffff00013d29e600 1195465439 C Co:6:002:0 0 4 >
ffff00013d29e600 1195465474 S Ci:6:002:0 s c0 05 0c38 0000 0004 4 <
ffff00013d29e600 1195465511 C Ci:6:002:0 0 4 = 201e1c1a
ffff00013d29e600 1195465546 S Co:6:002:0 s 40 05 0c38 0000 0004 4 = 201e1c1a
ffff00013d29e600 1195465577 C Co:6:002:0 0 4 >
ffff00013d29e600 1195465612 S Ci:6:002:0 s c0 05 0c3c 0000 0004 4 <
ffff00013d29e600 1195465650 C Ci:6:002:0 0 4 = 20202020
ffff00013d29e600 1195465685 S Co:6:002:0 s 40 05 0c3c 0000 0004 4 = 20202020
ffff00013d29e600 1195465729 C Co:6:002:0 0 4 >
ffff00013d29e600 1195465764 S Ci:6:002:0 s c0 05 0c40 0000 0004 4 <
ffff00013d29e600 1195465802 C Ci:6:002:0 0 4 = 20201e1c
ffff00013d29e600 1195465839 S Co:6:002:0 s 40 05 0c40 0000 0004 4 = 20201e1c
ffff00013d29e600 1195465871 C Co:6:002:0 0 4 >
ffff00013d29e600 1195465906 S Ci:6:002:0 s c0 05 0c44 0000 0004 4 <
ffff00013d29e600 1195465945 C Ci:6:002:0 0 4 = 1a181e1e
ffff00013d29e600 1195465979 S Co:6:002:0 s 40 05 0c44 0000 0004 4 = 1a181e1e
ffff00013d29e600 1195466013 C Co:6:002:0 0 4 >
ffff00013d29e600 1195466047 S Ci:6:002:0 s c0 05 0c48 0000 0004 4 <
ffff00013d29e600 1195466100 C Ci:6:002:0 0 4 = 1e1e1e1e
ffff00013d29e600 1195466135 S Co:6:002:0 s 40 05 0c48 0000 0004 4 = 1e1e1e1e
ffff00013d29e600 1195466167 C Co:6:002:0 0 4 >
ffff00013d29e600 1195466202 S Ci:6:002:0 s c0 05 0c4c 0000 0004 4 <
ffff00013d29e600 1195466239 C Ci:6:002:0 0 4 = 1c1a1816
ffff00013d29e600 1195466275 S Co:6:002:0 s 40 05 0c4c 0000 0004 4 = 1c1a1816
ffff00013d29e600 1195466307 C Co:6:002:0 0 4 >
ffff00013d29e600 1195466341 S Ci:6:002:0 s c0 05 0c54 0000 0004 4 <
ffff00013d29e600 1195466379 C Ci:6:002:0 0 4 = 120a0400
ffff00013d29e600 1195466413 S Co:6:002:0 s 40 05 0c54 0000 0004 4 = 120a0400
ffff00013d29e600 1195466444 C Co:6:002:0 0 4 >
ffff00013d29e600 1195466478 S Ci:6:002:0 s c0 05 0e20 0000 0004 4 <
ffff00013d29e600 1195466517 C Ci:6:002:0 0 4 = 14141414
ffff00013d29e600 1195466551 S Co:6:002:0 s 40 05 0e20 0000 0004 4 = 14141414
ffff00013d29e600 1195466601 C Co:6:002:0 0 4 >
ffff00013d29e600 1195466641 S Ci:6:002:0 s c0 05 0e24 0000 0004 4 <
ffff00013d29e600 1195466679 C Ci:6:002:0 0 4 = 1d1d1d1d
ffff00013d29e600 1195466714 S Co:6:002:0 s 40 05 0e24 0000 0004 4 = 1d1d1d1d
ffff00013d29e600 1195466745 C Co:6:002:0 0 4 >
ffff00013d29e600 1195466780 S Ci:6:002:0 s c0 05 0e28 0000 0004 4 <
ffff00013d29e600 1195466818 C Ci:6:002:0 0 4 = 1d1d1b19
ffff00013d29e600 1195466853 S Co:6:002:0 s 40 05 0e28 0000 0004 4 = 1d1d1b19
ffff00013d29e600 1195466884 C Co:6:002:0 0 4 >
ffff00013d29e600 1195466919 S Ci:6:002:0 s c0 05 0e2c 0000 0004 4 <
ffff00013d29e600 1195466957 C Ci:6:002:0 0 4 = 1f1f1f1f
ffff00013d29e600 1195466992 S Co:6:002:0 s 40 05 0e2c 0000 0004 4 = 1f1f1f1f
ffff00013d29e600 1195467023 C Co:6:002:0 0 4 >
ffff00013d29e600 1195467058 S Ci:6:002:0 s c0 05 0e30 0000 0004 4 <
ffff00013d29e600 1195467108 C Ci:6:002:0 0 4 = 1f1f1d1b
ffff00013d29e600 1195467143 S Co:6:002:0 s 40 05 0e30 0000 0004 4 = 1f1f1d1b
ffff00013d29e600 1195467175 C Co:6:002:0 0 4 >
ffff00013d29e600 1195467209 S Ci:6:002:0 s c0 05 0e34 0000 0004 4 <
ffff00013d29e600 1195467248 C Ci:6:002:0 0 4 = 1f1f1f1f
ffff00013d29e600 1195467282 S Co:6:002:0 s 40 05 0e34 0000 0004 4 = 1f1f1f1f
ffff00013d29e600 1195467314 C Co:6:002:0 0 4 >
ffff00013d29e600 1195467349 S Ci:6:002:0 s c0 05 0e38 0000 0004 4 <
ffff00013d29e600 1195467388 C Ci:6:002:0 0 4 = 1f1d1b19
ffff00013d29e600 1195467423 S Co:6:002:0 s 40 05 0e38 0000 0004 4 = 1f1d1b19
ffff00013d29e600 1195467472 C Co:6:002:0 0 4 >
ffff00013d29e600 1195467507 S Ci:6:002:0 s c0 05 0e3c 0000 0004 4 <
ffff00013d29e600 1195467545 C Ci:6:002:0 0 4 = 1f1f1f1f
ffff00013d29e600 1195467580 S Co:6:002:0 s 40 05 0e3c 0000 0004 4 = 1f1f1f1f
ffff00013d29e600 1195467611 C Co:6:002:0 0 4 >
ffff00013d29e600 1195467646 S Ci:6:002:0 s c0 05 0e40 0000 0004 4 <
ffff00013d29e600 1195467684 C Ci:6:002:0 0 4 = 1f1f1d1b
ffff00013d29e600 1195467719 S Co:6:002:0 s 40 05 0e40 0000 0004 4 = 1f1f1d1b
ffff00013d29e600 1195467751 C Co:6:002:0 0 4 >
ffff00013d29e600 1195467786 S Ci:6:002:0 s c0 05 0e44 0000 0004 4 <
ffff00013d29e600 1195467824 C Ci:6:002:0 0 4 = 19171d1d
ffff00013d29e600 1195467859 S Co:6:002:0 s 40 05 0e44 0000 0004 4 = 19171d1d
ffff00013d29e600 1195467891 C Co:6:002:0 0 4 >
ffff00013d29e600 1195467925 S Ci:6:002:0 s c0 05 0e48 0000 0004 4 <
ffff00013d29e600 1195467982 C Ci:6:002:0 0 4 = 1d1d1d1d
ffff00013d29e600 1195468119 S Co:6:002:0 s 40 05 0e48 0000 0004 4 = 1d1d1d1d
ffff00013d29e600 1195468157 C Co:6:002:0 0 4 >
ffff00013d29e600 1195468197 S Ci:6:002:0 s c0 05 0e4c 0000 0004 4 <
ffff00013d29e600 1195468237 C Ci:6:002:0 0 4 = 1b191715
ffff00013d29e600 1195468274 S Co:6:002:0 s 40 05 0e4c 0000 0004 4 = 1b191715
ffff00013d29e600 1195468307 C Co:6:002:0 0 4 >
ffff00013d29e600 1195468343 S Ci:6:002:0 s c0 05 0e54 0000 0004 4 <
ffff00013d29e600 1195468382 C Ci:6:002:0 0 4 = 11090300
ffff00013d29e600 1195468417 S Co:6:002:0 s 40 05 0e54 0000 0004 4 = 11090300
ffff00013d29e600 1195468449 C Co:6:002:0 0 4 >
ffff00013d29e600 1195468500 S Ci:6:002:0 s c0 05 0454 0000 0001 1 <
ffff00013d29e600 1195468551 C Ci:6:002:0 0 1 = 00
ffff00013d29e600 1195468586 S Ci:6:002:0 s c0 05 0454 0000 0001 1 <
ffff00013d29e600 1195468623 C Ci:6:002:0 0 1 = 00
ffff00013d29e600 1195468657 S Co:6:002:0 s 40 05 0454 0000 0001 1 = 80
ffff00013d29e600 1195468688 C Co:6:002:0 0 1 >
ffff00013d29e600 1195468723 S Ci:6:002:0 s c0 05 041a 0000 0002 2 <
ffff00013d29e600 1195468760 C Ci:6:002:0 0 2 = ff0f
ffff00013d29e600 1195468795 S Ci:6:002:0 s c0 05 0808 0000 0004 4 <
ffff00013d29e600 1195468832 C Ci:6:002:0 0 4 = 3382023e
ffff00013d29e600 1195468867 S Co:6:002:0 s 40 05 0808 0000 0004 4 = 3382023e
ffff00013d29e600 1195468899 C Co:6:002:0 0 4 >
ffff00013d29e600 1195468933 S Ci:6:002:0 s c0 05 0834 0000 0004 4 <
ffff00013d29e600 1195468984 C Ci:6:002:0 0 4 = 05a73700
ffff00013d29e600 1195469019 S Co:6:002:0 s 40 05 0834 0000 0004 4 = 06a73700
ffff00013d29e600 1195469050 C Co:6:002:0 0 4 >
ffff00013d29e600 1195469084 S Ci:6:002:0 s c0 05 0830 0000 0004 4 <
ffff00013d29e600 1195469124 C Ci:6:002:0 0 4 = b8eeaa2e
ffff00013d29e600 1195469159 S Co:6:002:0 s 40 05 0830 0000 0004 4 = b8aeaa2e
ffff00013d29e600 1195469190 C Co:6:002:0 0 4 >
ffff00013d29e600 1195469225 S Ci:6:002:0 s c0 05 0830 0000 0004 4 <
ffff00013d29e600 1195469264 C Ci:6:002:0 0 4 = b8aeaa2e
ffff00013d29e600 1195469298 S Co:6:002:0 s 40 05 0830 0000 0004 4 = b8aeaa2e
ffff00013d29e600 1195469347 C Co:6:002:0 0 4 >
ffff00013d29e600 1195469381 S Ci:6:002:0 s c0 05 082c 0000 0004 4 <
ffff00013d29e600 1195469420 C Ci:6:002:0 0 4 = dc832000
ffff00013d29e600 1195469454 S Co:6:002:0 s 40 05 082c 0000 0004 4 = dd832000
ffff00013d29e600 1195469486 C Co:6:002:0 0 4 >
ffff00013d29e600 1195469521 S Co:6:002:0 s 40 05 0cb0 0000 0004 4 = 17773354
ffff00013d29e600 1195469552 C Co:6:002:0 0 4 >
ffff00013d29e600 1195469586 S Co:6:002:0 s 40 05 0eb0 0000 0004 4 = 17773354
ffff00013d29e600 1195469618 C Co:6:002:0 0 4 >
ffff00013d29e600 1195469652 S Ci:6:002:0 s c0 05 0cb4 0000 0004 4 <
ffff00013d29e600 1195469692 C Ci:6:002:0 0 4 = 77000001
ffff00013d29e600 1195469727 S Co:6:002:0 s 40 05 0cb4 0000 0004 4 = 77000001
ffff00013d29e600 1195469758 C Co:6:002:0 0 4 >
ffff00013d29e600 1195469792 S Ci:6:002:0 s c0 05 0eb4 0000 0004 4 <
ffff00013d29e600 1195469831 C Ci:6:002:0 0 4 = 77000001
ffff00013d29e600 1195469865 S Co:6:002:0 s 40 05 0eb4 0000 0004 4 = 77000001
ffff00013d29e600 1195469897 C Co:6:002:0 0 4 >
ffff00013d29e600 1195469931 S Ci:6:002:0 s c0 05 0900 0000 0004 4 <
ffff00013d29e600 1195469984 C Ci:6:002:0 0 4 = 01040000
ffff00013d29e600 1195470019 S Co:6:002:0 s 40 05 0900 0000 0004 4 = 01040000
ffff00013d29e600 1195470051 C Co:6:002:0 0 4 >
ffff00013d29e600 1195470085 S Ci:6:002:0 s c0 05 080c 0000 0004 4 <
ffff00013d29e600 1195470122 C Ci:6:002:0 0 4 = 13111312
ffff00013d29e600 1195470157 S Co:6:002:0 s 40 05 080c 0000 0004 4 = 03111312
ffff00013d29e600 1195470188 C Co:6:002:0 0 4 >
ffff00013d29e600 1195470223 S Ci:6:002:0 s c0 05 0a04 0000 0004 4 <
ffff00013d29e600 1195470258 C Ci:6:002:0 0 4 = 0c00ff01
ffff00013d29e600 1195470293 S Co:6:002:0 s 40 05 0a04 0000 0004 4 = 0c00ff0f
ffff00013d29e600 1195470325 C Co:6:002:0 0 4 >
ffff00013d29e600 1195470359 S Ci:6:002:0 s c0 05 0440 0000 0004 4 <
ffff00013d29e600 1195470396 C Ci:6:002:0 0 4 = 00000000
ffff00013d29e600 1195470431 S Co:6:002:0 s 40 05 0440 0000 0004 4 = 50010000
ffff00013d29e600 1195470480 C Co:6:002:0 0 4 >
ffff00013d29e600 1195470514 S Ci:6:002:0 s c0 05 0c1c 0000 0004 4 <
ffff00013d29e600 1195470549 C Ci:6:002:0 0 4 = 03000040
ffff00013d29e600 1195470584 S Co:6:002:0 s 40 05 0c1c 0000 0004 4 = 0300402d
ffff00013d29e600 1195470615 C Co:6:002:0 0 4 >
ffff00013d29e600 1195470650 S Ci:6:002:0 s c0 05 0e1c 0000 0004 4 <
ffff00013d29e600 1195470685 C Ci:6:002:0 0 4 = 03000040
ffff00013d29e600 1195470720 S Co:6:002:0 s 40 05 0e1c 0000 0004 4 = 0300402d
ffff00013d29e600 1195470752 C Co:6:002:0 0 4 >
ffff00013d29e600 1195470788 S Ci:6:002:0 s c0 05 0860 0000 0004 4 <
ffff00013d29e600 1195470824 C Ci:6:002:0 0 4 = 21c3d572
ffff00013d29e600 1195470858 S Co:6:002:0 s 40 05 0860 0000 0004 4 = 21c3a568
ffff00013d29e600 1195470890 C Co:6:002:0 0 4 >
ffff00013d29e600 1195470924 S Ci:6:002:0 s c0 05 0c00 0000 0004 4 <
ffff00013d29e600 1195470978 C Ci:6:002:0 0 4 = 07000000
ffff00013d29e600 1195471012 S Ci:6:002:0 s c0 05 08b0 0000 0004 4 <
ffff00013d29e600 1195471048 C Ci:6:002:0 0 4 = 18060000
ffff00013d29e600 1195471082 S Co:6:002:0 s 40 05 08b0 0000 0004 4 = 18060000
ffff00013d29e600 1195471113 C Co:6:002:0 0 4 >
ffff00013d29e600 1195471168 S Ci:6:002:0 s c0 05 0d04 0000 0004 4 <
ffff00013d29e600 1195471232 C Ci:6:002:0 0 4 = 017c90b1
ffff00013d29e600 1195471267 S Co:6:002:0 s 40 05 0c90 0000 0004 4 = 017d8301
ffff00013d29e600 1195471298 C Co:6:002:0 0 4 >
ffff00013d29e600 1195471345 S Ci:6:002:0 s c0 05 08ac 0000 0004 4 <
ffff00013d29e600 1195471393 C Ci:6:002:0 0 4 = 08faf00f
ffff00013d29e600 1195471428 S Co:6:002:0 s 40 05 08ac 0000 0004 4 = 08faf00f
ffff00013d29e600 1195471476 C Co:6:002:0 0 4 >
ffff00013d29e600 1195471509 S Ci:6:002:0 s c0 05 08ac 0000 0004 4 <
ffff00013d29e600 1195471544 C Ci:6:002:0 0 4 = 08faf00f
ffff00013d29e600 1195471579 S Co:6:002:0 s 40 05 08ac 0000 0004 4 = 08faf00f
ffff00013d29e600 1195471610 C Co:6:002:0 0 4 >
ffff00013d29e600 1195471644 S Ci:6:002:0 s c0 05 08c4 0000 0004 4 <
ffff00013d29e600 1195471680 C Ci:6:002:0 0 4 = 00000000
ffff00013d29e600 1195471715 S Co:6:002:0 s 40 05 08c4 0000 0004 4 = 00000000
ffff00013d29e600 1195471746 C Co:6:002:0 0 4 >
ffff00013d29e600 1195471782 S Ci:6:002:0 s c0 05 0c00 0000 0004 4 <
ffff00013d29e600 1195471818 C Ci:6:002:0 0 4 = 07000000
ffff00013d29e600 1195471854 S Ci:6:002:0 s c0 05 08b0 0000 0004 4 <
ffff00013d29e600 1195471889 C Ci:6:002:0 0 4 = 18060000
ffff00013d29e600 1195471924 S Co:6:002:0 s 40 05 08b0 0000 0004 4 = 18060000
ffff00013d29e600 1195471972 C Co:6:002:0 0 4 >
ffff00013d29e600 1195472040 S Ci:6:002:0 s c0 05 0d04 0000 0004 4 <
ffff00013d29e600 1195472109 C Ci:6:002:0 0 4 = 017d91b1
ffff00013d29e600 1195472146 S Co:6:002:0 s 40 05 0c90 0000 0004 4 = 707d8101
ffff00013d29e600 1195472177 C Co:6:002:0 0 4 >
ffff00013d29e600 1195472234 S Ci:6:002:0 s c0 05 0e00 0000 0004 4 <
ffff00013d29e600 1195472283 C Ci:6:002:0 0 4 = 07000000
ffff00013d29e600 1195472321 S Ci:6:002:0 s c0 05 08b0 0000 0004 4 <
ffff00013d29e600 1195472368 C Ci:6:002:0 0 4 = 18060000
ffff00013d29e600 1195472402 S Co:6:002:0 s 40 05 08b0 0000 0004 4 = 18060000
ffff00013d29e600 1195472435 C Co:6:002:0 0 4 >
ffff00013d29e600 1195472488 S Ci:6:002:0 s c0 05 0d44 0000 0004 4 <
ffff00013d29e600 1195472535 C Ci:6:002:0 0 4 = 017c90b1
ffff00013d29e600 1195472570 S Co:6:002:0 s 40 05 0e90 0000 0004 4 = 017d8301
ffff00013d29e600 1195472605 C Co:6:002:0 0 4 >
ffff00013d29e600 1195472651 S Ci:6:002:0 s c0 05 08ac 0000 0004 4 <
ffff00013d29e600 1195472698 C Ci:6:002:0 0 4 = 08faf00f
ffff00013d29e600 1195472733 S Co:6:002:0 s 40 05 08ac 0000 0004 4 = 08faf00f
ffff00013d29e600 1195472764 C Co:6:002:0 0 4 >
ffff00013d29e600 1195472797 S Ci:6:002:0 s c0 05 08ac 0000 0004 4 <
ffff00013d29e600 1195472850 C Ci:6:002:0 0 4 = 08faf00f
ffff00013d29e600 1195472885 S Co:6:002:0 s 40 05 08ac 0000 0004 4 = 08faf00f
ffff00013d29e600 1195472915 C Co:6:002:0 0 4 >
ffff00013d29e600 1195472950 S Ci:6:002:0 s c0 05 08c4 0000 0004 4 <
ffff00013d29e600 1195472986 C Ci:6:002:0 0 4 = 00000000
ffff00013d29e600 1195473021 S Co:6:002:0 s 40 05 08c4 0000 0004 4 = 00000000
ffff00013d29e600 1195473052 C Co:6:002:0 0 4 >
ffff00013d29e600 1195473087 S Ci:6:002:0 s c0 05 0e00 0000 0004 4 <
ffff00013d29e600 1195473123 C Ci:6:002:0 0 4 = 07000000
ffff00013d29e600 1195473158 S Ci:6:002:0 s c0 05 08b0 0000 0004 4 <
ffff00013d29e600 1195473195 C Ci:6:002:0 0 4 = 18060000
ffff00013d29e600 1195473229 S Co:6:002:0 s 40 05 08b0 0000 0004 4 = 18060000
ffff00013d29e600 1195473260 C Co:6:002:0 0 4 >
ffff00013d29e600 1195473314 S Ci:6:002:0 s c0 05 0d44 0000 0004 4 <
ffff00013d29e600 1195473361 C Ci:6:002:0 0 4 = 017d91b1
ffff00013d29e600 1195473396 S Co:6:002:0 s 40 05 0e90 0000 0004 4 = 707d8101
ffff00013d29e600 1195473427 C Co:6:002:0 0 4 >
ffff00013d29e600 1195473475 S Ci:6:002:0 s c0 05 0668 0000 0002 2 <
ffff00013d29e600 1195473522 C Ci:6:002:0 0 2 = 0010
ffff00013d29e600 1195473557 S Co:6:002:0 s 40 05 0668 0000 0002 2 = 0010
ffff00013d29e600 1195473605 C Co:6:002:0 0 2 >
ffff00013d29e600 1195473639 S Co:6:002:0 s 40 05 0483 0000 0001 1 = 00
ffff00013d29e600 1195473669 C Co:6:002:0 0 1 >
ffff00013d29e600 1195473702 S Ci:6:002:0 s c0 05 0837 0000 0001 1 <
ffff00013d29e600 1195473738 C Ci:6:002:0 0 1 = 00
ffff00013d29e600 1195473775 S Ci:6:002:0 s c0 05 08ac 0000 0004 4 <
ffff00013d29e600 1195473811 C Ci:6:002:0 0 4 = 08faf00f
ffff00013d29e600 1195473846 S Co:6:002:0 s 40 05 08ac 0000 0004 4 = 08faf00f
ffff00013d29e600 1195473878 C Co:6:002:0 0 4 >
ffff00013d29e600 1195473912 S Ci:6:002:0 s c0 05 08c4 0000 0004 4 <
ffff00013d29e600 1195473950 C Ci:6:002:0 0 4 = 00000000
ffff00013d29e600 1195473984 S Co:6:002:0 s 40 05 08c4 0000 0004 4 = 00000000
ffff00013d29e600 1195474015 C Co:6:002:0 0 4 >
ffff00013d29e600 1195474050 S Ci:6:002:0 s c0 05 0848 0000 0004 4 <
ffff00013d29e600 1195474104 C Ci:6:002:0 0 4 = 8bffd061
ffff00013d29e600 1195474138 S Co:6:002:0 s 40 05 0848 0000 0004 4 = 8bffd061
ffff00013d29e600 1195474171 C Co:6:002:0 0 4 >
ffff00013d29e600 1195474205 S Ci:6:002:0 s c0 05 08ac 0000 0004 4 <
ffff00013d29e600 1195474242 C Ci:6:002:0 0 4 = 08faf00f
ffff00013d29e600 1195474277 S Co:6:002:0 s 40 05 08ac 0000 0004 4 = 08faf00f
ffff00013d29e600 1195474309 C Co:6:002:0 0 4 >
ffff00013d29e600 1195474343 S Ci:6:002:0 s c0 05 08ac 0000 0004 4 <
ffff00013d29e600 1195474380 C Ci:6:002:0 0 4 = 08faf00f
ffff00013d29e600 1195474415 S Co:6:002:0 s 40 05 08ac 0000 0004 4 = 08faf00f
ffff00013d29e600 1195474447 C Co:6:002:0 0 4 >
ffff00013d29e600 1195474481 S Ci:6:002:0 s c0 05 08c4 0000 0004 4 <
ffff00013d29e600 1195474519 C Ci:6:002:0 0 4 = 00000000
ffff00013d29e600 1195474553 S Co:6:002:0 s 40 05 08c4 0000 0004 4 = 00000000
ffff00013d29e600 1195474602 C Co:6:002:0 0 4 >
ffff00013d29e600 1195474638 S Ci:6:002:0 s c0 05 0c00 0000 0004 4 <
ffff00013d29e600 1195474675 C Ci:6:002:0 0 4 = 07000000
ffff00013d29e600 1195474710 S Ci:6:002:0 s c0 05 08b0 0000 0004 4 <
ffff00013d29e600 1195474748 C Ci:6:002:0 0 4 = 18060000
ffff00013d29e600 1195474783 S Co:6:002:0 s 40 05 08b0 0000 0004 4 = 18060000
ffff00013d29e600 1195474814 C Co:6:002:0 0 4 >
ffff00013d29e600 1195474868 S Ci:6:002:0 s c0 05 0d04 0000 0004 4 <
ffff00013d29e600 1195474916 C Ci:6:002:0 0 4 = 707d93b1
ffff00013d29e600 1195474950 S Co:6:002:0 s 40 05 0c90 0000 0004 4 = 707d8301
ffff00013d29e600 1195474981 C Co:6:002:0 0 4 >
ffff00013d29e600 1195475028 S Ci:6:002:0 s c0 05 0e00 0000 0004 4 <
ffff00013d29e600 1195475077 C Ci:6:002:0 0 4 = 07000000
ffff00013d29e600 1195475111 S Ci:6:002:0 s c0 05 08b0 0000 0004 4 <
ffff00013d29e600 1195475148 C Ci:6:002:0 0 4 = 18060000
ffff00013d29e600 1195475181 S Co:6:002:0 s 40 05 08b0 0000 0004 4 = 18060000
ffff00013d29e600 1195475230 C Co:6:002:0 0 4 >
ffff00013d29e600 1195475285 S Ci:6:002:0 s c0 05 0d44 0000 0004 4 <
ffff00013d29e600 1195475351 C Ci:6:002:0 0 4 = 707d93b1
ffff00013d29e600 1195475385 S Co:6:002:0 s 40 05 0e90 0000 0004 4 = 707d8301
ffff00013d29e600 1195475417 C Co:6:002:0 0 4 >
ffff00013d29e600 1195475466 S Ci:6:002:0 s c0 05 0073 0000 0001 1 <
ffff00013d29e600 1195475515 C Ci:6:002:0 0 1 = 07
ffff00013d29e600 1195475549 S Co:6:002:0 s 40 05 0073 0000 0001 1 = 07
ffff00013d29e600 1195475597 C Co:6:002:0 0 1 >
ffff00013d29e600 1195475655 S Ci:6:002:0 s c0 05 0c24 0000 0004 4 <
ffff00013d29e600 1195475704 C Ci:6:002:0 0 4 = 20202020
ffff00013d29e600 1195475738 S Co:6:002:0 s 40 05 0c24 0000 0004 4 = 29292929
ffff00013d29e600 1195475769 C Co:6:002:0 0 4 >
ffff00013d29e600 1195475802 S Ci:6:002:0 s c0 05 0c28 0000 0004 4 <
ffff00013d29e600 1195475856 C Ci:6:002:0 0 4 = 20201e1c
ffff00013d29e600 1195475891 S Co:6:002:0 s 40 05 0c28 0000 0004 4 = 29292725
ffff00013d29e600 1195475922 C Co:6:002:0 0 4 >
ffff00013d29e600 1195475956 S Ci:6:002:0 s c0 05 0c2c 0000 0004 4 <
ffff00013d29e600 1195475994 C Ci:6:002:0 0 4 = 20202020
ffff00013d29e600 1195476095 S Co:6:002:0 s 40 05 0c2c 0000 0004 4 = 2e2e2e2e
ffff00013d29e600 1195476129 C Co:6:002:0 0 4 >
ffff00013d29e600 1195476169 S Ci:6:002:0 s c0 05 0c30 0000 0004 4 <
ffff00013d29e600 1195476234 C Ci:6:002:0 0 4 = 20201e1c
ffff00013d29e600 1195476269 S Co:6:002:0 s 40 05 0c30 0000 0004 4 = 2c2a2826
ffff00013d29e600 1195476301 C Co:6:002:0 0 4 >
ffff00013d29e600 1195476334 S Ci:6:002:0 s c0 05 0c34 0000 0004 4 <
ffff00013d29e600 1195476371 C Ci:6:002:0 0 4 = 20202020
ffff00013d29e600 1195476410 S Co:6:002:0 s 40 05 0c34 0000 0004 4 = 2a2a2a2a
ffff00013d29e600 1195476441 C Co:6:002:0 0 4 >
ffff00013d29e600 1195476476 S Ci:6:002:0 s c0 05 0c38 0000 0004 4 <
ffff00013d29e600 1195476514 C Ci:6:002:0 0 4 = 201e1c1a
ffff00013d29e600 1195476549 S Co:6:002:0 s 40 05 0c38 0000 0004 4 = 2a282624
ffff00013d29e600 1195476597 C Co:6:002:0 0 4 >
ffff00013d29e600 1195476633 S Ci:6:002:0 s c0 05 0c3c 0000 0004 4 <
ffff00013d29e600 1195476670 C Ci:6:002:0 0 4 = 20202020
ffff00013d29e600 1195476705 S Co:6:002:0 s 40 05 0c3c 0000 0004 4 = 2e2e2e2e
ffff00013d29e600 1195476737 C Co:6:002:0 0 4 >
ffff00013d29e600 1195476772 S Ci:6:002:0 s c0 05 0c40 0000 0004 4 <
ffff00013d29e600 1195476810 C Ci:6:002:0 0 4 = 20201e1c
ffff00013d29e600 1195476846 S Co:6:002:0 s 40 05 0c40 0000 0004 4 = 2c2a2826
ffff00013d29e600 1195476877 C Co:6:002:0 0 4 >
ffff00013d29e600 1195476912 S Ci:6:002:0 s c0 05 0c44 0000 0004 4 <
ffff00013d29e600 1195476950 C Ci:6:002:0 0 4 = 1a181e1e
ffff00013d29e600 1195476985 S Co:6:002:0 s 40 05 0c44 0000 0004 4 = 24242a2a
ffff00013d29e600 1195477017 C Co:6:002:0 0 4 >
ffff00013d29e600 1195477051 S Ci:6:002:0 s c0 05 0c48 0000 0004 4 <
ffff00013d29e600 1195477107 C Ci:6:002:0 0 4 = 1e1e1e1e
ffff00013d29e600 1195477142 S Co:6:002:0 s 40 05 0c48 0000 0004 4 = 2a2a2a28
ffff00013d29e600 1195477173 C Co:6:002:0 0 4 >
ffff00013d29e600 1195477208 S Ci:6:002:0 s c0 05 0c4c 0000 0004 4 <
ffff00013d29e600 1195477246 C Ci:6:002:0 0 4 = 1c1a1816
ffff00013d29e600 1195477281 S Co:6:002:0 s 40 05 0c4c 0000 0004 4 = 26242222
ffff00013d29e600 1195477313 C Co:6:002:0 0 4 >
ffff00013d29e600 1195477347 S Ci:6:002:0 s c0 05 0c54 0000 0004 4 <
ffff00013d29e600 1195477386 C Ci:6:002:0 0 4 = 120a0400
ffff00013d29e600 1195477421 S Co:6:002:0 s 40 05 0c54 0000 0004 4 = 1c140e00
ffff00013d29e600 1195477452 C Co:6:002:0 0 4 >
ffff00013d29e600 1195477486 S Ci:6:002:0 s c0 05 0e24 0000 0004 4 <
ffff00013d29e600 1195477525 C Ci:6:002:0 0 4 = 1d1d1d1d
ffff00013d29e600 1195477560 S Co:6:002:0 s 40 05 0e24 0000 0004 4 = 20202020
ffff00013d29e600 1195477605 C Co:6:002:0 0 4 >
ffff00013d29e600 1195477639 S Ci:6:002:0 s c0 05 0e28 0000 0004 4 <
ffff00013d29e600 1195477678 C Ci:6:002:0 0 4 = 1d1d1b19
ffff00013d29e600 1195477712 S Co:6:002:0 s 40 05 0e28 0000 0004 4 = 20201e1c
ffff00013d29e600 1195477743 C Co:6:002:0 0 4 >
ffff00013d29e600 1195477778 S Ci:6:002:0 s c0 05 0e2c 0000 0004 4 <
ffff00013d29e600 1195477815 C Ci:6:002:0 0 4 = 1f1f1f1f
ffff00013d29e600 1195477850 S Co:6:002:0 s 40 05 0e2c 0000 0004 4 = 25252525
ffff00013d29e600 1195477882 C Co:6:002:0 0 4 >
ffff00013d29e600 1195477916 S Ci:6:002:0 s c0 05 0e30 0000 0004 4 <
ffff00013d29e600 1195477955 C Ci:6:002:0 0 4 = 1f1f1d1b
ffff00013d29e600 1195477990 S Co:6:002:0 s 40 05 0e30 0000 0004 4 = 23211f1d
ffff00013d29e600 1195478022 C Co:6:002:0 0 4 >
ffff00013d29e600 1195478056 S Ci:6:002:0 s c0 05 0e34 0000 0004 4 <
ffff00013d29e600 1195478109 C Ci:6:002:0 0 4 = 1f1f1f1f
ffff00013d29e600 1195478144 S Co:6:002:0 s 40 05 0e34 0000 0004 4 = 21212121
ffff00013d29e600 1195478175 C Co:6:002:0 0 4 >
ffff00013d29e600 1195478210 S Ci:6:002:0 s c0 05 0e38 0000 0004 4 <
ffff00013d29e600 1195478249 C Ci:6:002:0 0 4 = 1f1d1b19
ffff00013d29e600 1195478284 S Co:6:002:0 s 40 05 0e38 0000 0004 4 = 211f1d1b
ffff00013d29e600 1195478315 C Co:6:002:0 0 4 >
ffff00013d29e600 1195478350 S Ci:6:002:0 s c0 05 0e3c 0000 0004 4 <
ffff00013d29e600 1195478389 C Ci:6:002:0 0 4 = 1f1f1f1f
ffff00013d29e600 1195478424 S Co:6:002:0 s 40 05 0e3c 0000 0004 4 = 25252525
ffff00013d29e600 1195478472 C Co:6:002:0 0 4 >
ffff00013d29e600 1195478507 S Ci:6:002:0 s c0 05 0e40 0000 0004 4 <
ffff00013d29e600 1195478545 C Ci:6:002:0 0 4 = 1f1f1d1b
ffff00013d29e600 1195478580 S Co:6:002:0 s 40 05 0e40 0000 0004 4 = 23211f1d
ffff00013d29e600 1195478611 C Co:6:002:0 0 4 >
ffff00013d29e600 1195478646 S Ci:6:002:0 s c0 05 0e44 0000 0004 4 <
ffff00013d29e600 1195478685 C Ci:6:002:0 0 4 = 19171d1d
ffff00013d29e600 1195478720 S Co:6:002:0 s 40 05 0e44 0000 0004 4 = 1b1b2121
ffff00013d29e600 1195478751 C Co:6:002:0 0 4 >
ffff00013d29e600 1195478787 S Ci:6:002:0 s c0 05 0e48 0000 0004 4 <
ffff00013d29e600 1195478827 C Ci:6:002:0 0 4 = 1d1d1d1d
ffff00013d29e600 1195478862 S Co:6:002:0 s 40 05 0e48 0000 0004 4 = 2121211f
ffff00013d29e600 1195478896 C Co:6:002:0 0 4 >
ffff00013d29e600 1195478931 S Ci:6:002:0 s c0 05 0e4c 0000 0004 4 <
ffff00013d29e600 1195478984 C Ci:6:002:0 0 4 = 1b191715
ffff00013d29e600 1195479019 S Co:6:002:0 s 40 05 0e4c 0000 0004 4 = 1d1b1919
ffff00013d29e600 1195479050 C Co:6:002:0 0 4 >
ffff00013d29e600 1195479084 S Ci:6:002:0 s c0 05 0e54 0000 0004 4 <
ffff00013d29e600 1195479124 C Ci:6:002:0 0 4 = 11090300
ffff00013d29e600 1195479158 S Co:6:002:0 s 40 05 0e54 0000 0004 4 = 130b0500
ffff00013d29e600 1195479189 C Co:6:002:0 0 4 >
ffff000103533480 1195772210 S Ci:6:002:0 s c0 05 004c 0000 0001 1 <
ffff000103533480 1195772368 C Ci:6:002:0 0 1 = 20
ffff000103533480 1195772525 S Co:6:002:0 s 40 05 004c 0000 0001 1 = 20
ffff000103533480 1195772663 C Co:6:002:0 0 1 >
ffff000103533480 1196764188 S Ci:6:002:0 s c0 05 0770 0000 0004 4 <
ffff000103533480 1196764339 C Ci:6:002:0 0 4 = 00000000
ffff000103533480 1196764494 S Ci:6:002:0 s c0 05 0774 0000 0004 4 <
ffff000103533480 1196764642 C Ci:6:002:0 0 4 = 00000000
ffff000103533480 1196764804 S Co:6:002:0 s 40 05 076e 0000 0001 1 = 0c
ffff000103533480 1196764942 C Co:6:002:0 0 1 >
ffff000103533480 1196765107 S Ci:6:002:0 s c0 05 0808 0000 0004 4 <
ffff000103533480 1196765252 C Ci:6:002:0 0 4 = 3382023e
ffff000103533480 1196765414 S Ci:6:002:0 s c0 05 0a5c 0000 0002 2 <
ffff000103533480 1196765562 C Ci:6:002:0 0 2 = 6a00
ffff000103533480 1196765722 S Ci:6:002:0 s c0 05 0f48 0000 0002 2 <
ffff000103533480 1196765868 C Ci:6:002:0 0 2 = 7501
ffff000103533480 1196766029 S Ci:6:002:0 s c0 05 0f04 0000 0004 4 <
ffff000103533480 1196766167 C Ci:6:002:0 0 4 = 03000200
ffff000103533480 1196766194 S Ci:6:002:0 s c0 05 0f14 0000 0004 4 <
ffff000103533480 1196766314 C Ci:6:002:0 0 4 = 6c002c00
ffff000103533480 1196766345 S Ci:6:002:0 s c0 05 0f10 0000 0004 4 <
ffff000103533480 1196766456 C Ci:6:002:0 0 4 = 00000000
ffff000103533480 1196766485 S Ci:6:002:0 s c0 05 0f0c 0000 0004 4 <
ffff000103533480 1196766597 C Ci:6:002:0 0 4 = 00000000
ffff000103533480 1196766627 S Ci:6:002:0 s c0 05 0f08 0000 0004 4 <
ffff000103533480 1196766739 C Ci:6:002:0 0 4 = 97000d02
ffff000103533480 1196766768 S Ci:6:002:0 s c0 05 0fcc 0000 0004 4 <
ffff000103533480 1196766881 C Ci:6:002:0 0 4 = 00000000
ffff000103533480 1196766909 S Ci:6:002:0 s c0 05 09a4 0000 0004 4 <
ffff000103533480 1196767032 C Ci:6:002:0 0 4 = 80000800
ffff000103533480 1196767056 S Co:6:002:0 s 40 05 09a4 0000 0004 4 = 80000a00
ffff000103533480 1196767163 C Co:6:002:0 0 4 >
ffff000103533480 1196767192 S Ci:6:002:0 s c0 05 09a4 0000 0004 4 <
ffff000103533480 1196767305 C Ci:6:002:0 0 4 = 80000a00
ffff000103533480 1196767326 S Co:6:002:0 s 40 05 09a4 0000 0004 4 = 80000800
ffff000103533480 1196767434 C Co:6:002:0 0 4 >
ffff000103533480 1196767463 S Ci:6:002:0 s c0 05 0a2c 0000 0004 4 <
ffff000103533480 1196767581 C Ci:6:002:0 0 4 = 00809000
ffff000103533480 1196767601 S Co:6:002:0 s 40 05 0a2c 0000 0004 4 = 00009000
ffff000103533480 1196767709 C Co:6:002:0 0 4 >
ffff000103533480 1196767738 S Ci:6:002:0 s c0 05 0a2c 0000 0004 4 <
ffff000103533480 1196767850 C Ci:6:002:0 0 4 = 00009000
ffff000103533480 1196767879 S Co:6:002:0 s 40 05 0a2c 0000 0004 4 = 00809000
ffff000103533480 1196767993 C Co:6:002:0 0 4 >
ffff000103533480 1196768022 S Ci:6:002:0 s c0 05 0b58 0000 0004 4 <
ffff000103533480 1196768128 C Ci:6:002:0 0 4 = 00000000
ffff000103533480 1196768157 S Co:6:002:0 s 40 05 0b58 0000 0004 4 = 01000000
ffff000103533480 1196768272 C Co:6:002:0 0 4 >
ffff000103533480 1196768294 S Ci:6:002:0 s c0 05 0b58 0000 0004 4 <
ffff000103533480 1196768415 C Ci:6:002:0 0 4 = 01000000
ffff000103533480 1196768444 S Co:6:002:0 s 40 05 0b58 0000 0004 4 = 00000000
ffff000103533480 1196768552 C Co:6:002:0 0 4 >
ffff000103533480 1196768583 S Ci:6:002:0 s c0 05 01cc 0000 0001 1 <
ffff000103533480 1196768693 C Ci:6:002:0 0 1 = 00
ffff000103533480 1196768723 S Co:6:002:0 s 40 05 01f0 0000 0004 4 = 00000000
ffff000103533480 1196768830 C Co:6:002:0 0 4 >
ffff000103533480 1196768858 S Co:6:002:0 s 40 05 01d0 0000 0004 4 = 58000000
ffff000103533480 1196768972 C Co:6:002:0 0 4 >
ffff000103533480 1196768994 S Co:6:002:0 s 40 05 0440 0000 0004 4 = 00000000
ffff000103533480 1196769100 C Co:6:002:0 0 4 >
ffff000103533480 1196769130 S Ci:6:002:0 s c0 05 0c00 0000 0004 4 <
ffff000103533480 1196769241 C Ci:6:002:0 0 4 = 07000000
ffff000103533480 1196769270 S Ci:6:002:0 s c0 05 08b0 0000 0004 4 <
ffff000103533480 1196769388 C Ci:6:002:0 0 4 = 18060000
ffff000103533480 1196769409 S Co:6:002:0 s 40 05 08b0 0000 0004 4 = 42060000
ffff000103533480 1196769516 C Co:6:002:0 0 4 >
ffff000103533480 1196769566 S Ci:6:002:0 s c0 05 0d04 0000 0004 4 <
ffff000103533480 1196769672 C Ci:6:002:0 0 4 = 088d90b1
ffff000103533480 1196769695 S Co:6:002:0 s 40 05 0c90 0000 0004 4 = 088d2304
ffff000103533480 1196769803 C Co:6:002:0 0 4 >
ffff000103533480 1196769845 S Co:6:002:0 s 40 05 0280 0000 0002 2 = 0001
ffff000103533480 1196769945 C Co:6:002:0 0 2 >
ffff000103533480 1196769966 S Ci:6:002:0 s c0 05 010c 0000 0001 1 <
ffff000103533480 1196770079 C Ci:6:002:0 0 1 = b4
ffff000103533480 1196770108 S Co:6:002:0 s 40 05 010c 0000 0001 1 = b4
ffff000103533480 1196770216 C Co:6:002:0 0 1 >
ffff000103533480 1196770257 S Ci:6:002:0 s c0 05 004c 0000 0001 1 <
ffff000103533480 1196770365 C Ci:6:002:0 0 1 = 20
ffff000103533480 1196770395 S Co:6:002:0 s 40 05 004c 0000 0001 1 = 20
ffff000103533480 1196770502 C Co:6:002:0 0 1 >
ffff000103533480 1197756168 S Ci:6:002:0 s c0 05 004c 0000 0001 1 <
ffff000103533480 1197756323 C Ci:6:002:0 0 1 = 20
ffff000103533480 1197756481 S Co:6:002:0 s 40 05 004c 0000 0001 1 = 20
ffff000103533480 1197756619 C Co:6:002:0 0 1 >
