ffff0001035330c0 4060149685 C Bi:6:002:1 0 376 = 40010484 00000f80 14046000 04300000 00000000 51d43b02 463e0000 86e7e701
ffff0001035330c0 4060149763 S Bi:6:002:1 -115 32768 <
ffff000103533480 4060152039 C Bi:6:002:1 0 384 = 48010484 00000f80 7c0b6000 04300000 00000000 78dd3b02 463a0000 87ecec01
ffff000103533480 4060152064 S Bi:6:002:1 -115 32768 <
ffff000103533240 4060249961 C Bi:6:002:1 0 383 = 47010484 00000f80 a70c6000 04300000 00000000 095c3d02 443a0000 84f9f901
ffff000103533240 4060250010 S Bi:6:002:1 -115 32768 <
ffff000103533780 4060250832 C Bi:6:002:1 0 376 = 40010484 00000f80 15046000 04300000 00000000 635f3d02 443c0000 81f7f701
ffff000103533780 4060250861 S Bi:6:002:1 -115 32768 <
ffff0001035330c0 4060251580 C Bi:6:002:1 0 351 = 27010484 00000f80 da0d6000 04300000 00000000 76623d02 423a0000 83eded01
ffff0001035330c0 4060251603 S Bi:6:002:1 -115 32768 <
ffff000103533480 4060252372 C Bi:6:002:1 0 374 = 3e010484 00000f80 ad086000 04300000 00000000 78653d02 423a0000 84eeee01
ffff000103533480 4060252397 S Bi:6:002:1 -115 32768 <
ffff000103533240 4060253228 C Bi:6:002:1 0 384 = 48010484 00000f80 7d0b6000 04300000 00000000 bc683d02 423c0000 84f0f001
ffff000103533240 4060253252 S Bi:6:002:1 -115 32768 <
ffff000103533780 4060350986 C Bi:6:002:1 0 383 = 47010484 00000f80 a80c6000 04300000 00000000 b3e63e02 463a0000 86efef01
ffff000103533780 4060351013 S Bi:6:002:1 -115 32768 <
ffff0001035330c0 4060351863 C Bi:6:002:1 0 376 = 40010484 00000f80 16046000 04300000 00000000 5fea3e02 443a0000 86eded01
ffff0001035330c0 4060351880 S Bi:6:002:1 -115 32768 <
ffff000103533480 4060453484 C Bi:6:002:1 0 383 = 47010484 00000f80 a90c6000 04300000 00000000 d6764002 463a0000 86f4f401
ffff000103533480 4060453537 S Bi:6:002:1 -115 32768 <
ffff000103533240 4060454481 C Bi:6:002:1 0 376 = 40010484 00000f80 17046000 04300000 00000000 ee7a4002 443c0000 83ebeb01
ffff000103533240 4060454509 S Bi:6:002:1 -115 32768 <
ffff000103533780 4060455485 C Bi:6:002:1 0 351 = 27010484 00000f80 dc0d6000 04300000 00000000 fe7e4002 443a0000 82f8f801
ffff000103533780 4060455509 S Bi:6:002:1 -115 32768 <
ffff0001035330c0 4060456394 C Bi:6:002:1 0 374 = 3e010484 00000f80 af086000 04300000 00000000 6c824002 42380000 84fefe01
ffff0001035330c0 4060456418 S Bi:6:002:1 -115 32768 <
ffff000103533480 4060461494 C Bi:6:002:1 0 384 = 48010484 00000f80 7f0b6000 04300000 00000000 47964002 443c0000 88fafa01
ffff000103533480 4060461518 S Bi:6:002:1 -115 32768 <
ffff000103533240 4060557211 C Bi:6:002:1 0 383 = 47010484 00000f80 aa0c6000 04300000 00000000 0d0c4202 463a0000 81eeee01
ffff000103533240 4060557244 S Bi:6:002:1 -115 32768 <
ffff000103533780 4060558826 C Bi:6:002:1 0 374 = 3e010484 00000f80 b0086000 04300000 00000000 81124202 443c0000 85e8e801
ffff000103533780 4060558854 S Bi:6:002:1 -115 32768 <
ffff0001035330c0 4060559585 C Bi:6:002:1 0 384 = 48010484 00000f80 800b6000 04300000 00000000 73154202 443a0000 85ecec01
ffff0001035330c0 4060559610 S Bi:6:002:1 -115 32768 <
ffff000103533480 4060658123 C Bi:6:002:1 0 383 = 47010484 00000f80 ab0c6000 04300000 00000000 46964302 463c0000 87eaea01
ffff000103533480 4060658180 S Bi:6:002:1 -115 32768 <
ffff000103533240 4060659158 C Bi:6:002:1 0 376 = 40010484 00000f80 19046000 04300000 00000000 749a4302 463c0000 84ecec01
ffff000103533240 4060659186 S Bi:6:002:1 -115 32768 <
ffff000103533780 4060660011 C Bi:6:002:1 0 351 = 27010484 00000f80 de0d6000 04300000 00000000 ed9d4302 443c0000 89efef01
ffff000103533780 4060660036 S Bi:6:002:1 -115 32768 <
ffff0001035330c0 4060660847 C Bi:6:002:1 0 374 = 3e010484 00000f80 b1086000 04300000 00000000 13a14302 443a0000 88eeee01
ffff0001035330c0 4060660872 S Bi:6:002:1 -115 32768 <
ffff000103533480 4060661705 C Bi:6:002:1 0 384 = 48010484 00000f80 810b6000 04300000 00000000 5ea44302 443a0000 82f4f401
ffff000103533480 4060661729 S Bi:6:002:1 -115 32768 <
ffff000103533240 4060760478 C Bi:6:002:1 0 383 = 47010484 00000f80 ac0c6000 04300000 00000000 48264502 42380000 80ecec01
ffff000103533240 4060760503 S Bi:6:002:1 -115 32768 <
ffff000103533780 4060761465 C Bi:6:002:1 0 376 = 40010484 00000f80 1a046000 04300000 00000000 102a4502 443c0000 86eded01
ffff000103533780 4060761495 S Bi:6:002:1 -115 32768 <
ffff0001035330c0 4060762302 C Bi:6:002:1 0 351 = 27010484 00000f80 df0d6000 04300000 00000000 7e2d4502 463c0000 85fefe01
ffff0001035330c0 4060762328 S Bi:6:002:1 -115 32768 <
ffff000103533480 4060763181 C Bi:6:002:1 0 374 = 3e010484 00000f80 b2086000 04300000 00000000 e6304502 443c0000 86efef01
ffff000103533480 4060763202 S Bi:6:002:1 -115 32768 <
ffff00011ac9e840 4060796160 S Ci:6:002:0 s c0 05 004c 0000 0001 1 <
ffff00011ac9e840 4060796315 C Ci:6:002:0 0 1 = 20
ffff00011ac9e840 4060796465 S Co:6:002:0 s 40 05 004c 0000 0001 1 = 20
ffff00011ac9e840 4060796576 C Co:6:002:0 0 1 >
ffff000103533240 4060864369 C Bi:6:002:1 0 383 = 47010484 00000f80 ad0c6000 04300000 00000000 10bc4602 423a0000 82f5f501
ffff000103533240 4060864424 S Bi:6:002:1 -115 32768 <
ffff000103533780 4060865206 C Bi:6:002:1 0 376 = 40010484 00000f80 1b046000 04300000 00000000 5abf4602 443a0000 80f3f301
ffff000103533780 4060865234 S Bi:6:002:1 -115 32768 <
ffff0001035330c0 4060865972 C Bi:6:002:1 0 351 = 27010484 00000f80 e00d6000 04300000 00000000 75c24602 463c0000 89020201
ffff0001035330c0 4060865997 S Bi:6:002:1 -115 32768 <
ffff000103533480 4060867624 C Bi:6:002:1 0 384 = 48010484 00000f80 830b6000 04300000 00000000 c0c84602 443c0000 86f7f701
ffff000103533480 4060867649 S Bi:6:002:1 -115 32768 <
ffff000103533240 4060965329 C Bi:6:002:1 0 383 = 47010484 00000f80 ae0c6000 04300000 00000000 4b464802 46380000 83f5f501
ffff000103533240 4060965364 S Bi:6:002:1 -115 32768 <
ffff000103533780 4060967696 C Bi:6:002:1 0 376 = 40010484 00000f80 1c046000 04300000 00000000 af4f4802 423e0000 88f5f501
ffff000103533780 4060967764 S Bi:6:002:1 -115 32768 <
ffff0001035330c0 4060969669 C Bi:6:002:1 0 351 = 27010484 00000f80 e10d6000 04300000 00000000 80574802 443e0000 87f2f201
ffff0001035330c0 4060969694 S Bi:6:002:1 -115 32768 <
ffff000103533480 4060971696 C Bi:6:002:1 0 374 = 3e010484 00000f80 b4086000 04300000 00000000 4e5f4802 463e0000 86eded01
ffff000103533480 4060971728 S Bi:6:002:1 -115 32768 <
ffff000103533240 4060973706 C Bi:6:002:1 0 384 = 48010484 00000f80 840b6000 04300000 00000000 1c674802 463a0000 86fdfd01
ffff000103533240 4060973731 S Bi:6:002:1 -115 32768 <
ffff000103533780 4061067726 C Bi:6:002:1 0 383 = 47010484 00000f80 af0c6000 04300000 00000000 4cd64902 443a0000 83fdfd01
ffff000103533780 4061067783 S Bi:6:002:1 -115 32768 <
ffff0001035330c0 4061068742 C Bi:6:002:1 0 376 = 40010484 00000f80 1d046000 04300000 00000000 68da4902 4a3e0000 95fdfd01
ffff0001035330c0 4061068767 S Bi:6:002:1 -115 32768 <
ffff000103533480 4061069573 C Bi:6:002:1 0 351 = 27010484 00000f80 e20d6000 04300000 00000000 cadd4902 4c3e0000 96fcfc01
ffff000103533480 4061069598 S Bi:6:002:1 -115 32768 <
ffff000103533240 4061070392 C Bi:6:002:1 0 374 = 3e010484 00000f80 b5086000 04300000 00000000 dde04902 443a0000 85f6f601
ffff000103533240 4061070416 S Bi:6:002:1 -115 32768 <
ffff000103533780 4061071210 C Bi:6:002:1 0 384 = 48010484 00000f80 850b6000 04300000 00000000 04e44902 443a0000 83fbfb01
ffff000103533780 4061071233 S Bi:6:002:1 -115 32768 <
ffff0001031510c0 4061121427 S Ci:6:002:0 s c0 05 0454 0000 0001 1 <
ffff0001031510c0 4061121514 C Ci:6:002:0 0 1 = 00
ffff0001031510c0 4061121557 S Ci:6:002:0 s c0 05 0860 0000 0004 4 <
ffff0001031510c0 4061121598 C Ci:6:002:0 0 4 = 21c3d572
ffff0001031510c0 4061121630 S Co:6:002:0 s 40 05 0860 0000 0004 4 = 21c3d572
ffff0001031510c0 4061121672 C Co:6:002:0 0 4 >
ffff0001031510c0 4061121704 S Ci:6:002:0 s c0 05 0c00 0000 0004 4 <
ffff0001031510c0 4061121753 C Ci:6:002:0 0 4 = 07000000
ffff0001031510c0 4061121782 S Ci:6:002:0 s c0 05 08b0 0000 0004 4 <
ffff0001031510c0 4061121816 C Ci:6:002:0 0 4 = 42060000
ffff0001031510c0 4061121845 S Co:6:002:0 s 40 05 08b0 0000 0004 4 = 18060000
ffff0001031510c0 4061121874 C Co:6:002:0 0 4 >
ffff0001031510c0 4061121924 S Ci:6:002:0 s c0 05 0d04 0000 0004 4 <
ffff0001031510c0 4061121968 C Ci:6:002:0 0 4 = 017c90b1
ffff0001031510c0 4061121999 S Co:6:002:0 s 40 05 0c90 0000 0004 4 = 017c8001
ffff0001031510c0 4061122040 C Co:6:002:0 0 4 >
ffff0001031510c0 4061122081 S Ci:6:002:0 s c0 05 08ac 0000 0004 4 <
ffff0001031510c0 4061122111 C Ci:6:002:0 0 4 = 08faf00f
ffff0001031510c0 4061122130 S Co:6:002:0 s 40 05 08ac 0000 0004 4 = 08faf00f
ffff0001031510c0 4061122172 C Co:6:002:0 0 4 >
ffff0001031510c0 4061122200 S Ci:6:002:0 s c0 05 08ac 0000 0004 4 <
ffff0001031510c0 4061122233 C Ci:6:002:0 0 4 = 08faf00f
ffff0001031510c0 4061122261 S Co:6:002:0 s 40 05 08ac 0000 0004 4 = 08faf00f
ffff0001031510c0 4061122289 C Co:6:002:0 0 4 >
ffff0001031510c0 4061122318 S Ci:6:002:0 s c0 05 08c4 0000 0004 4 <
ffff0001031510c0 4061122351 C Ci:6:002:0 0 4 = 00000000
ffff0001031510c0 4061122380 S Co:6:002:0 s 40 05 08c4 0000 0004 4 = 00000000
ffff0001031510c0 4061122409 C Co:6:002:0 0 4 >
ffff0001031510c0 4061122438 S Ci:6:002:0 s c0 05 0c00 0000 0004 4 <
ffff0001031510c0 4061122481 C Ci:6:002:0 0 4 = 07000000
ffff0001031510c0 4061122510 S Ci:6:002:0 s c0 05 08b0 0000 0004 4 <
ffff0001031510c0 4061122541 C Ci:6:002:0 0 4 = 18060000
ffff0001031510c0 4061122569 S Co:6:002:0 s 40 05 08b0 0000 0004 4 = 18060000
ffff0001031510c0 4061122598 C Co:6:002:0 0 4 >
ffff0001031510c0 4061122647 S Ci:6:002:0 s c0 05 0d04 0000 0004 4 <
ffff0001031510c0 4061122709 C Ci:6:002:0 0 4 = 017c90b1
ffff0001031510c0 4061122738 S Co:6:002:0 s 40 05 0c90 0000 0004 4 = 017c8001
ffff0001031510c0 4061122767 C Co:6:002:0 0 4 >
ffff0001031510c0 4061122807 S Ci:6:002:0 s c0 05 0e00 0000 0004 4 <
ffff0001031510c0 4061122851 C Ci:6:002:0 0 4 = 07000000
ffff0001031510c0 4061122880 S Ci:6:002:0 s c0 05 08b0 0000 0004 4 <
ffff0001031510c0 4061122912 C Ci:6:002:0 0 4 = 18060000
ffff0001031510c0 4061122940 S Co:6:002:0 s 40 05 08b0 0000 0004 4 = 18060000
ffff0001031510c0 4061122969 C Co:6:002:0 0 4 >
ffff0001031510c0 4061123018 S Ci:6:002:0 s c0 05 0d44 0000 0004 4 <
ffff0001031510c0 4061123061 C Ci:6:002:0 0 4 = 017c90b1
ffff0001031510c0 4061123090 S Co:6:002:0 s 40 05 0e90 0000 0004 4 = 017c8001
ffff0001031510c0 4061123119 C Co:6:002:0 0 4 >
ffff0001031510c0 4061123160 S Ci:6:002:0 s c0 05 08ac 0000 0004 4 <
ffff0001031510c0 4061123217 C Ci:6:002:0 0 4 = 08faf00f
ffff0001031510c0 4061123245 S Co:6:002:0 s 40 05 08ac 0000 0004 4 = 08faf00f
ffff0001031510c0 4061123274 C Co:6:002:0 0 4 >
ffff0001031510c0 4061123302 S Ci:6:002:0 s c0 05 08ac 0000 0004 4 <
ffff0001031510c0 4061123343 C Ci:6:002:0 0 4 = 08faf00f
ffff0001031510c0 4061123372 S Co:6:002:0 s 40 05 08ac 0000 0004 4 = 08faf00f
ffff0001031510c0 4061123412 C Co:6:002:0 0 4 >
ffff0001031510c0 4061123441 S Ci:6:002:0 s c0 05 08c4 0000 0004 4 <
ffff0001031510c0 4061123484 C Ci:6:002:0 0 4 = 00000000
ffff0001031510c0 4061123512 S Co:6:002:0 s 40 05 08c4 0000 0004 4 = 00000000
ffff0001031510c0 4061123541 C Co:6:002:0 0 4 >
ffff0001031510c0 4061123569 S Ci:6:002:0 s c0 05 0e00 0000 0004 4 <
ffff0001031510c0 4061123602 C Ci:6:002:0 0 4 = 07000000
ffff0001031510c0 4061123631 S Ci:6:002:0 s c0 05 08b0 0000 0004 4 <
ffff0001031510c0 4061123664 C Ci:6:002:0 0 4 = 18060000
ffff0001031510c0 4061123694 S Co:6:002:0 s 40 05 08b0 0000 0004 4 = 18060000
ffff0001031510c0 4061123723 C Co:6:002:0 0 4 >
ffff0001031510c0 4061123772 S Ci:6:002:0 s c0 05 0d44 0000 0004 4 <
ffff0001031510c0 4061123835 C Ci:6:002:0 0 4 = 017c90b1
ffff0001031510c0 4061123864 S Co:6:002:0 s 40 05 0e90 0000 0004 4 = 017c8001
ffff0001031510c0 4061123892 C Co:6:002:0 0 4 >
ffff0001031510c0 4061123933 S Ci:6:002:0 s c0 05 0668 0000 0002 2 <
ffff0001031510c0 4061123977 C Ci:6:002:0 0 2 = 0010
ffff0001031510c0 4061124019 S Co:6:002:0 s 40 05 0668 0000 0002 2 = 0010
ffff0001031510c0 4061124073 C Co:6:002:0 0 2 >
ffff0001031510c0 4061124102 S Co:6:002:0 s 40 05 0483 0000 0001 1 = 00
ffff0001031510c0 4061124133 C Co:6:002:0 0 1 >
ffff0001031510c0 4061124163 S Ci:6:002:0 s c0 05 0837 0000 0001 1 <
ffff0001031510c0 4061124214 C Ci:6:002:0 0 1 = 00
ffff0001031510c0 4061124246 S Ci:6:002:0 s c0 05 08ac 0000 0004 4 <
ffff0001031510c0 4061124288 C Ci:6:002:0 0 4 = 08faf00f
ffff0001031510c0 4061124320 S Co:6:002:0 s 40 05 08ac 0000 0004 4 = 08faf00f
ffff0001031510c0 4061124352 C Co:6:002:0 0 4 >
ffff0001031510c0 4061124425 S Ci:6:002:0 s c0 05 08c4 0000 0004 4 <
ffff0001031510c0 4061124468 C Ci:6:002:0 0 4 = 00000000
ffff0001031510c0 4061124499 S Co:6:002:0 s 40 05 08c4 0000 0004 4 = 00000000
ffff0001031510c0 4061124535 C Co:6:002:0 0 4 >
ffff0001031510c0 4061124571 S Ci:6:002:0 s c0 05 0848 0000 0004 4 <
ffff0001031510c0 4061124608 C Ci:6:002:0 0 4 = 8bffd061
ffff0001031510c0 4061124642 S Co:6:002:0 s 40 05 0848 0000 0004 4 = 8bffd061
ffff0001031510c0 4061124673 C Co:6:002:0 0 4 >
ffff0001031510c0 4061124708 S Ci:6:002:0 s c0 05 08ac 0000 0004 4 <
ffff0001031510c0 4061124745 C Ci:6:002:0 0 4 = 08faf00f
ffff0001031510c0 4061124779 S Co:6:002:0 s 40 05 08ac 0000 0004 4 = 08faf00f
ffff0001031510c0 4061124810 C Co:6:002:0 0 4 >
ffff0001031510c0 4061124845 S Ci:6:002:0 s c0 05 08ac 0000 0004 4 <
ffff0001031510c0 4061124882 C Ci:6:002:0 0 4 = 08faf00f
ffff0001031510c0 4061124916 S Co:6:002:0 s 40 05 08ac 0000 0004 4 = 08faf00f
ffff0001031510c0 4061124965 C Co:6:002:0 0 4 >
ffff0001031510c0 4061124999 S Ci:6:002:0 s c0 05 08c4 0000 0004 4 <
ffff0001031510c0 4061125036 C Ci:6:002:0 0 4 = 00000000
ffff0001031510c0 4061125071 S Co:6:002:0 s 40 05 08c4 0000 0004 4 = 00000000
ffff0001031510c0 4061125102 C Co:6:002:0 0 4 >
ffff0001031510c0 4061125136 S Ci:6:002:0 s c0 05 0c00 0000 0004 4 <
ffff0001031510c0 4061125173 C Ci:6:002:0 0 4 = 07000000
ffff0001031510c0 4061125207 S Ci:6:002:0 s c0 05 08b0 0000 0004 4 <
ffff0001031510c0 4061125244 C Ci:6:002:0 0 4 = 18060000
ffff0001031510c0 4061125279 S Co:6:002:0 s 40 05 08b0 0000 0004 4 = 18060000
ffff0001031510c0 4061125310 C Co:6:002:0 0 4 >
ffff0001031510c0 4061125365 S Ci:6:002:0 s c0 05 0d04 0000 0004 4 <
ffff0001031510c0 4061125412 C Ci:6:002:0 0 4 = 017c90b1
ffff0001031510c0 4061125447 S Co:6:002:0 s 40 05 0c90 0000 0004 4 = 017c8001
ffff0001031510c0 4061125477 C Co:6:002:0 0 4 >
ffff0001031510c0 4061125524 S Ci:6:002:0 s c0 05 0e00 0000 0004 4 <
ffff0001031510c0 4061125587 C Ci:6:002:0 0 4 = 07000000
ffff0001031510c0 4061125622 S Ci:6:002:0 s c0 05 08b0 0000 0004 4 <
ffff0001031510c0 4061125657 C Ci:6:002:0 0 4 = 18060000
ffff0001031510c0 4061125691 S Co:6:002:0 s 40 05 08b0 0000 0004 4 = 18060000
ffff0001031510c0 4061125722 C Co:6:002:0 0 4 >
ffff0001031510c0 4061125776 S Ci:6:002:0 s c0 05 0d44 0000 0004 4 <
ffff0001031510c0 4061125841 C Ci:6:002:0 0 4 = 017c90b1
ffff0001031510c0 4061125876 S Co:6:002:0 s 40 05 0e90 0000 0004 4 = 017c8001
ffff0001031510c0 4061125906 C Co:6:002:0 0 4 >
ffff0001031510c0 4061125975 S Ci:6:002:0 s c0 05 0c20 0000 0004 4 <
ffff0001031510c0 4061126025 C Ci:6:002:0 0 4 = 13131313
ffff0001031510c0 4061126059 S Co:6:002:0 s 40 05 0c20 0000 0004 4 = 13131313
ffff0001031510c0 4061126091 C Co:6:002:0 0 4 >
ffff0001031510c0 4061126125 S Ci:6:002:0 s c0 05 0c24 0000 0004 4 <
ffff0001031510c0 4061126161 C Ci:6:002:0 0 4 = 20202020
ffff0001031510c0 4061126196 S Co:6:002:0 s 40 05 0c24 0000 0004 4 = 20202020
ffff0001031510c0 4061126226 C Co:6:002:0 0 4 >
ffff0001031510c0 4061126260 S Ci:6:002:0 s c0 05 0c28 0000 0004 4 <
ffff0001031510c0 4061126298 C Ci:6:002:0 0 4 = 20201e1c
ffff0001031510c0 4061126332 S Co:6:002:0 s 40 05 0c28 0000 0004 4 = 20201e1c
ffff0001031510c0 4061126364 C Co:6:002:0 0 4 >
ffff0001031510c0 4061126398 S Ci:6:002:0 s c0 05 0c2c 0000 0004 4 <
ffff0001031510c0 4061126436 C Ci:6:002:0 0 4 = 20202020
ffff0001031510c0 4061126470 S Co:6:002:0 s 40 05 0c2c 0000 0004 4 = 20202020
ffff0001031510c0 4061126502 C Co:6:002:0 0 4 >
ffff0001031510c0 4061126537 S Ci:6:002:0 s c0 05 0c30 0000 0004 4 <
ffff0001031510c0 4061126591 C Ci:6:002:0 0 4 = 20201e1c
ffff0001031510c0 4061126625 S Co:6:002:0 s 40 05 0c30 0000 0004 4 = 20201e1c
ffff0001031510c0 4061126657 C Co:6:002:0 0 4 >
ffff0001031510c0 4061126691 S Ci:6:002:0 s c0 05 0c34 0000 0004 4 <
ffff0001031510c0 4061126730 C Ci:6:002:0 0 4 = 20202020
ffff0001031510c0 4061126765 S Co:6:002:0 s 40 05 0c34 0000 0004 4 = 20202020
ffff0001031510c0 4061126796 C Co:6:002:0 0 4 >
ffff0001031510c0 4061126831 S Ci:6:002:0 s c0 05 0c38 0000 0004 4 <
ffff0001031510c0 4061126868 C Ci:6:002:0 0 4 = 201e1c1a
ffff0001031510c0 4061126906 S Co:6:002:0 s 40 05 0c38 0000 0004 4 = 201e1c1a
ffff0001031510c0 4061126938 C Co:6:002:0 0 4 >
ffff0001031510c0 4061126972 S Ci:6:002:0 s c0 05 0c3c 0000 0004 4 <
ffff0001031510c0 4061127010 C Ci:6:002:0 0 4 = 20202020
ffff0001031510c0 4061127044 S Co:6:002:0 s 40 05 0c3c 0000 0004 4 = 20202020
ffff0001031510c0 4061127092 C Co:6:002:0 0 4 >
ffff0001031510c0 4061127125 S Ci:6:002:0 s c0 05 0c40 0000 0004 4 <
ffff0001031510c0 4061127163 C Ci:6:002:0 0 4 = 20201e1c
ffff0001031510c0 4061127197 S Co:6:002:0 s 40 05 0c40 0000 0004 4 = 20201e1c
ffff0001031510c0 4061127228 C Co:6:002:0 0 4 >
ffff0001031510c0 4061127262 S Ci:6:002:0 s c0 05 0c44 0000 0004 4 <
ffff0001031510c0 4061127300 C Ci:6:002:0 0 4 = 1a181e1e
ffff0001031510c0 4061127335 S Co:6:002:0 s 40 05 0c44 0000 0004 4 = 1a181e1e
ffff0001031510c0 4061127366 C Co:6:002:0 0 4 >
ffff0001031510c0 4061127400 S Ci:6:002:0 s c0 05 0c48 0000 0004 4 <
ffff0001031510c0 4061127438 C Ci:6:002:0 0 4 = 1e1e1e1e
ffff0001031510c0 4061127473 S Co:6:002:0 s 40 05 0c48 0000 0004 4 = 1e1e1e1e
ffff0001031510c0 4061127505 C Co:6:002:0 0 4 >
ffff0001031510c0 4061127540 S Ci:6:002:0 s c0 05 0c4c 0000 0004 4 <
ffff0001031510c0 4061127595 C Ci:6:002:0 0 4 = 1c1a1816
ffff0001031510c0 4061127630 S Co:6:002:0 s 40 05 0c4c 0000 0004 4 = 1c1a1816
ffff0001031510c0 4061127662 C Co:6:002:0 0 4 >
ffff0001031510c0 4061127696 S Ci:6:002:0 s c0 05 0c54 0000 0004 4 <
ffff0001031510c0 4061127733 C Ci:6:002:0 0 4 = 120a0400
ffff0001031510c0 4061127768 S Co:6:002:0 s 40 05 0c54 0000 0004 4 = 120a0400
ffff0001031510c0 4061127800 C Co:6:002:0 0 4 >
ffff0001031510c0 4061127834 S Ci:6:002:0 s c0 05 0e20 0000 0004 4 <
ffff0001031510c0 4061127873 C Ci:6:002:0 0 4 = 14141414
ffff0001031510c0 4061127908 S Co:6:002:0 s 40 05 0e20 0000 0004 4 = 14141414
ffff0001031510c0 4061127939 C Co:6:002:0 0 4 >
ffff0001031510c0 4061127974 S Ci:6:002:0 s c0 05 0e24 0000 0004 4 <
ffff0001031510c0 4061128026 C Ci:6:002:0 0 4 = 1d1d1d1d
ffff0001031510c0 4061128113 S Co:6:002:0 s 40 05 0e24 0000 0004 4 = 1d1d1d1d
ffff0001031510c0 4061128148 C Co:6:002:0 0 4 >
ffff0001031510c0 4061128187 S Ci:6:002:0 s c0 05 0e28 0000 0004 4 <
ffff0001031510c0 4061128238 C Ci:6:002:0 0 4 = 1d1d1b19
ffff0001031510c0 4061128273 S Co:6:002:0 s 40 05 0e28 0000 0004 4 = 1d1d1b19
ffff0001031510c0 4061128303 C Co:6:002:0 0 4 >
ffff0001031510c0 4061128337 S Ci:6:002:0 s c0 05 0e2c 0000 0004 4 <
ffff0001031510c0 4061128374 C Ci:6:002:0 0 4 = 1f1f1f1f
ffff0001031510c0 4061128408 S Co:6:002:0 s 40 05 0e2c 0000 0004 4 = 1f1f1f1f
ffff0001031510c0 4061128439 C Co:6:002:0 0 4 >
ffff0001031510c0 4061128474 S Ci:6:002:0 s c0 05 0e30 0000 0004 4 <
ffff0001031510c0 4061128512 C Ci:6:002:0 0 4 = 1f1f1d1b
ffff0001031510c0 4061128546 S Co:6:002:0 s 40 05 0e30 0000 0004 4 = 1f1f1d1b
ffff0001031510c0 4061128592 C Co:6:002:0 0 4 >
ffff0001031510c0 4061128627 S Ci:6:002:0 s c0 05 0e34 0000 0004 4 <
ffff0001031510c0 4061128666 C Ci:6:002:0 0 4 = 1f1f1f1f
ffff0001031510c0 4061128702 S Co:6:002:0 s 40 05 0e34 0000 0004 4 = 1f1f1f1f
ffff0001031510c0 4061128733 C Co:6:002:0 0 4 >
ffff0001031510c0 4061128768 S Ci:6:002:0 s c0 05 0e38 0000 0004 4 <
ffff0001031510c0 4061128807 C Ci:6:002:0 0 4 = 1f1d1b19
ffff0001031510c0 4061128841 S Co:6:002:0 s 40 05 0e38 0000 0004 4 = 1f1d1b19
ffff0001031510c0 4061128873 C Co:6:002:0 0 4 >
ffff0001031510c0 4061128908 S Ci:6:002:0 s c0 05 0e3c 0000 0004 4 <
ffff0001031510c0 4061128964 C Ci:6:002:0 0 4 = 1f1f1f1f
ffff0001031510c0 4061128998 S Co:6:002:0 s 40 05 0e3c 0000 0004 4 = 1f1f1f1f
ffff0001031510c0 4061129031 C Co:6:002:0 0 4 >
ffff0001031510c0 4061129066 S Ci:6:002:0 s c0 05 0e40 0000 0004 4 <
ffff0001031510c0 4061129105 C Ci:6:002:0 0 4 = 1f1f1d1b
ffff0001031510c0 4061129140 S Co:6:002:0 s 40 05 0e40 0000 0004 4 = 1f1f1d1b
ffff0001031510c0 4061129172 C Co:6:002:0 0 4 >
ffff0001031510c0 4061129207 S Ci:6:002:0 s c0 05 0e44 0000 0004 4 <
ffff0001031510c0 4061129245 C Ci:6:002:0 0 4 = 19171d1d
ffff0001031510c0 4061129280 S Co:6:002:0 s 40 05 0e44 0000 0004 4 = 19171d1d
ffff0001031510c0 4061129312 C Co:6:002:0 0 4 >
ffff0001031510c0 4061129346 S Ci:6:002:0 s c0 05 0e48 0000 0004 4 <
ffff0001031510c0 4061129384 C Ci:6:002:0 0 4 = 1d1d1d1d
ffff0001031510c0 4061129419 S Co:6:002:0 s 40 05 0e48 0000 0004 4 = 1d1d1d1d
ffff0001031510c0 4061129467 C Co:6:002:0 0 4 >
ffff0001031510c0 4061129502 S Ci:6:002:0 s c0 05 0e4c 0000 0004 4 <
ffff0001031510c0 4061129541 C Ci:6:002:0 0 4 = 1b191715
ffff0001031510c0 4061129575 S Co:6:002:0 s 40 05 0e4c 0000 0004 4 = 1b191715
ffff0001031510c0 4061129607 C Co:6:002:0 0 4 >
ffff0001031510c0 4061129641 S Ci:6:002:0 s c0 05 0e54 0000 0004 4 <
ffff0001031510c0 4061129681 C Ci:6:002:0 0 4 = 11090300
ffff0001031510c0 4061129715 S Co:6:002:0 s 40 05 0e54 0000 0004 4 = 11090300
ffff0001031510c0 4061129746 C Co:6:002:0 0 4 >
ffff0001031510c0 4061129797 S Ci:6:002:0 s c0 05 0454 0000 0001 1 <
ffff0001031510c0 4061129848 C Ci:6:002:0 0 1 = 00
ffff0001031510c0 4061129882 S Ci:6:002:0 s c0 05 0454 0000 0001 1 <
ffff0001031510c0 4061129920 C Ci:6:002:0 0 1 = 00
ffff0001031510c0 4061129954 S Co:6:002:0 s 40 05 0454 0000 0001 1 = 80
ffff0001031510c0 4061129985 C Co:6:002:0 0 1 >
ffff00014a4c29c0 4061130019 S Ci:6:002:0 s c0 05 041a 0000 0002 2 <
ffff00014a4c29c0 4061130057 C Ci:6:002:0 0 2 = ff0f
ffff00014a4c29c0 4061130092 S Ci:6:002:0 s c0 05 0808 0000 0004 4 <
ffff00014a4c29c0 4061130131 C Ci:6:002:0 0 4 = 3382023e
ffff00014a4c29c0 4061130166 S Co:6:002:0 s 40 05 0808 0000 0004 4 = 3382023e
ffff00014a4c29c0 4061130218 C Co:6:002:0 0 4 >
ffff00014a4c29c0 4061130253 S Ci:6:002:0 s c0 05 0834 0000 0004 4 <
ffff00014a4c29c0 4061130291 C Ci:6:002:0 0 4 = 05a73700
ffff00014a4c29c0 4061130326 S Co:6:002:0 s 40 05 0834 0000 0004 4 = 06a73700
ffff00014a4c29c0 4061130358 C Co:6:002:0 0 4 >
ffff00014a4c29c0 4061130392 S Ci:6:002:0 s c0 05 0830 0000 0004 4 <
ffff00014a4c29c0 4061130431 C Ci:6:002:0 0 4 = b8eeaa2e
ffff00014a4c29c0 4061130465 S Co:6:002:0 s 40 05 0830 0000 0004 4 = b8aeaa2e
ffff00014a4c29c0 4061130497 C Co:6:002:0 0 4 >
ffff00014a4c29c0 4061130531 S Ci:6:002:0 s c0 05 0830 0000 0004 4 <
ffff00014a4c29c0 4061130569 C Ci:6:002:0 0 4 = b8aeaa2e
ffff00014a4c29c0 4061130604 S Co:6:002:0 s 40 05 0830 0000 0004 4 = b8aeaa2e
ffff00014a4c29c0 4061130636 C Co:6:002:0 0 4 >
ffff00014a4c29c0 4061130669 S Ci:6:002:0 s c0 05 082c 0000 0004 4 <
ffff00014a4c29c0 4061130720 C Ci:6:002:0 0 4 = dc832000
ffff00014a4c29c0 4061130754 S Co:6:002:0 s 40 05 082c 0000 0004 4 = dd832000
ffff00014a4c29c0 4061130785 C Co:6:002:0 0 4 >
ffff00014a4c29c0 4061130820 S Co:6:002:0 s 40 05 0cb0 0000 0004 4 = 17773354
ffff00014a4c29c0 4061130851 C Co:6:002:0 0 4 >
ffff00014a4c29c0 4061130886 S Co:6:002:0 s 40 05 0eb0 0000 0004 4 = 17773354
ffff00014a4c29c0 4061130917 C Co:6:002:0 0 4 >
ffff00014a4c29c0 4061130951 S Ci:6:002:0 s c0 05 0cb4 0000 0004 4 <
ffff00014a4c29c0 4061130986 C Ci:6:002:0 0 4 = 77000001
ffff00014a4c29c0 4061131021 S Co:6:002:0 s 40 05 0cb4 0000 0004 4 = 77000001
ffff00014a4c29c0 4061131052 C Co:6:002:0 0 4 >
ffff00014a4c29c0 4061131087 S Ci:6:002:0 s c0 05 0eb4 0000 0004 4 <
ffff00014a4c29c0 4061131122 C Ci:6:002:0 0 4 = 77000001
ffff00014a4c29c0 4061131157 S Co:6:002:0 s 40 05 0eb4 0000 0004 4 = 77000001
ffff00014a4c29c0 4061131189 C Co:6:002:0 0 4 >
ffff00014a4c29c0 4061131223 S Ci:6:002:0 s c0 05 0900 0000 0004 4 <
ffff00014a4c29c0 4061131259 C Ci:6:002:0 0 4 = 01040000
ffff00014a4c29c0 4061131294 S Co:6:002:0 s 40 05 0900 0000 0004 4 = 01040000
ffff00014a4c29c0 4061131342 C Co:6:002:0 0 4 >
ffff00014a4c29c0 4061131376 S Ci:6:002:0 s c0 05 080c 0000 0004 4 <
ffff00014a4c29c0 4061131413 C Ci:6:002:0 0 4 = 13111312
ffff00014a4c29c0 4061131448 S Co:6:002:0 s 40 05 080c 0000 0004 4 = 03111312
ffff00014a4c29c0 4061131479 C Co:6:002:0 0 4 >
ffff00014a4c29c0 4061131513 S Ci:6:002:0 s c0 05 0a04 0000 0004 4 <
ffff00014a4c29c0 4061131549 C Ci:6:002:0 0 4 = 0c00ff01
ffff00014a4c29c0 4061131583 S Co:6:002:0 s 40 05 0a04 0000 0004 4 = 0c00ff0f
ffff00014a4c29c0 4061131615 C Co:6:002:0 0 4 >
ffff00014a4c29c0 4061131649 S Ci:6:002:0 s c0 05 0440 0000 0004 4 <
ffff00014a4c29c0 4061131685 C Ci:6:002:0 0 4 = 00000000
ffff00014a4c29c0 4061131720 S Co:6:002:0 s 40 05 0440 0000 0004 4 = 50010000
ffff00014a4c29c0 4061131751 C Co:6:002:0 0 4 >
ffff00014a4c29c0 4061131786 S Ci:6:002:0 s c0 05 0c1c 0000 0004 4 <
ffff00014a4c29c0 4061131840 C Ci:6:002:0 0 4 = 03000040
ffff00014a4c29c0 4061131875 S Co:6:002:0 s 40 05 0c1c 0000 0004 4 = 0300402d
ffff00014a4c29c0 4061131907 C Co:6:002:0 0 4 >
ffff00014a4c29c0 4061131942 S Ci:6:002:0 s c0 05 0e1c 0000 0004 4 <
ffff00014a4c29c0 4061131978 C Ci:6:002:0 0 4 = 03000040
ffff00014a4c29c0 4061132026 S Co:6:002:0 s 40 05 0e1c 0000 0004 4 = 0300402d
ffff00014a4c29c0 4061132064 C Co:6:002:0 0 4 >
ffff00014a4c29c0 4061132102 S Ci:6:002:0 s c0 05 0860 0000 0004 4 <
ffff00014a4c29c0 4061132140 C Ci:6:002:0 0 4 = 21c3d572
ffff00014a4c29c0 4061132177 S Co:6:002:0 s 40 05 0860 0000 0004 4 = 21c32568
ffff00014a4c29c0 4061132218 C Co:6:002:0 0 4 >
ffff00014a4c29c0 4061132253 S Ci:6:002:0 s c0 05 0c00 0000 0004 4 <
ffff00014a4c29c0 4061132290 C Ci:6:002:0 0 4 = 07000000
ffff00014a4c29c0 4061132324 S Ci:6:002:0 s c0 05 08b0 0000 0004 4 <
ffff00014a4c29c0 4061132359 C Ci:6:002:0 0 4 = 18060000
ffff00014a4c29c0 4061132394 S Co:6:002:0 s 40 05 08b0 0000 0004 4 = 18060000
ffff00014a4c29c0 4061132425 C Co:6:002:0 0 4 >
ffff00014a4c29c0 4061132481 S Ci:6:002:0 s c0 05 0d04 0000 0004 4 <
ffff00014a4c29c0 4061132528 C Ci:6:002:0 0 4 = 017c90b1
ffff00014a4c29c0 4061132562 S Co:6:002:0 s 40 05 0c90 0000 0004 4 = 017d8501
ffff00014a4c29c0 4061132592 C Co:6:002:0 0 4 >
ffff00014a4c29c0 4061132639 S Ci:6:002:0 s c0 05 08ac 0000 0004 4 <
ffff00014a4c29c0 4061132686 C Ci:6:002:0 0 4 = 08faf00f
ffff00014a4c29c0 4061132720 S Co:6:002:0 s 40 05 08ac 0000 0004 4 = 08faf00f
ffff00014a4c29c0 4061132751 C Co:6:002:0 0 4 >
ffff00014a4c29c0 4061132785 S Ci:6:002:0 s c0 05 08ac 0000 0004 4 <
ffff00014a4c29c0 4061132837 C Ci:6:002:0 0 4 = 08faf00f
ffff00014a4c29c0 4061132871 S Co:6:002:0 s 40 05 08ac 0000 0004 4 = 08faf00f
ffff00014a4c29c0 4061132902 C Co:6:002:0 0 4 >
ffff00014a4c29c0 4061132936 S Ci:6:002:0 s c0 05 08c4 0000 0004 4 <
ffff00014a4c29c0 4061132973 C Ci:6:002:0 0 4 = 00000000
ffff00014a4c29c0 4061133007 S Co:6:002:0 s 40 05 08c4 0000 0004 4 = 00000000
ffff00014a4c29c0 4061133039 C Co:6:002:0 0 4 >
ffff00014a4c29c0 4061133073 S Ci:6:002:0 s c0 05 0c00 0000 0004 4 <
ffff00014a4c29c0 4061133109 C Ci:6:002:0 0 4 = 07000000
ffff00014a4c29c0 4061133144 S Ci:6:002:0 s c0 05 08b0 0000 0004 4 <
ffff00014a4c29c0 4061133180 C Ci:6:002:0 0 4 = 18060000
ffff00014a4c29c0 4061133215 S Co:6:002:0 s 40 05 08b0 0000 0004 4 = 18060000
ffff00014a4c29c0 4061133246 C Co:6:002:0 0 4 >
ffff00014a4c29c0 4061133301 S Ci:6:002:0 s c0 05 0d04 0000 0004 4 <
ffff00014a4c29c0 4061133348 C Ci:6:002:0 0 4 = 017d91b1
ffff00014a4c29c0 4061133382 S Co:6:002:0 s 40 05 0c90 0000 0004 4 = a17d8101
ffff00014a4c29c0 4061133414 C Co:6:002:0 0 4 >
ffff00014a4c29c0 4061133462 S Ci:6:002:0 s c0 05 0e00 0000 0004 4 <
ffff00014a4c29c0 4061133510 C Ci:6:002:0 0 4 = 07000000
ffff00014a4c29c0 4061133544 S Ci:6:002:0 s c0 05 08b0 0000 0004 4 <
ffff00014a4c29c0 4061133594 C Ci:6:002:0 0 4 = 18060000
ffff00014a4c29c0 4061133628 S Co:6:002:0 s 40 05 08b0 0000 0004 4 = 18060000
ffff00014a4c29c0 4061133659 C Co:6:002:0 0 4 >
ffff00014a4c29c0 4061133712 S Ci:6:002:0 s c0 05 0d44 0000 0004 4 <
ffff00014a4c29c0 4061133759 C Ci:6:002:0 0 4 = 017c90b1
ffff00014a4c29c0 4061133793 S Co:6:002:0 s 40 05 0e90 0000 0004 4 = 017d8501
ffff00014a4c29c0 4061133842 C Co:6:002:0 0 4 >
ffff00014a4c29c0 4061133888 S Ci:6:002:0 s c0 05 08ac 0000 0004 4 <
ffff00014a4c29c0 4061133935 C Ci:6:002:0 0 4 = 08faf00f
ffff00014a4c29c0 4061133969 S Co:6:002:0 s 40 05 08ac 0000 0004 4 = 08faf00f
ffff00014a4c29c0 4061134000 C Co:6:002:0 0 4 >
ffff00014a4c29c0 4061134033 S Ci:6:002:0 s c0 05 08ac 0000 0004 4 <
ffff00014a4c29c0 4061134069 C Ci:6:002:0 0 4 = 08faf00f
ffff00014a4c29c0 4061134104 S Co:6:002:0 s 40 05 08ac 0000 0004 4 = 08faf00f
ffff00014a4c29c0 4061134134 C Co:6:002:0 0 4 >
ffff00014a4c29c0 4061134169 S Ci:6:002:0 s c0 05 08c4 0000 0004 4 <
ffff00014a4c29c0 4061134220 C Ci:6:002:0 0 4 = 00000000
ffff00014a4c29c0 4061134255 S Co:6:002:0 s 40 05 08c4 0000 0004 4 = 00000000
ffff00014a4c29c0 4061134286 C Co:6:002:0 0 4 >
ffff00014a4c29c0 4061134320 S Ci:6:002:0 s c0 05 0e00 0000 0004 4 <
ffff00014a4c29c0 4061134358 C Ci:6:002:0 0 4 = 07000000
ffff00014a4c29c0 4061134392 S Ci:6:002:0 s c0 05 08b0 0000 0004 4 <
ffff00014a4c29c0 4061134429 C Ci:6:002:0 0 4 = 18060000
ffff00014a4c29c0 4061134464 S Co:6:002:0 s 40 05 08b0 0000 0004 4 = 18060000
ffff00014a4c29c0 4061134495 C Co:6:002:0 0 4 >
ffff00014a4c29c0 4061134551 S Ci:6:002:0 s c0 05 0d44 0000 0004 4 <
ffff00014a4c29c0 4061134599 C Ci:6:002:0 0 4 = 017d91b1
ffff00014a4c29c0 4061134633 S Co:6:002:0 s 40 05 0e90 0000 0004 4 = a17d8101
ffff00014a4c29c0 4061134664 C Co:6:002:0 0 4 >
ffff00014a4c29c0 4061134711 S Ci:6:002:0 s c0 05 0668 0000 0002 2 <
ffff00014a4c29c0 4061134759 C Ci:6:002:0 0 2 = 0010
ffff00014a4c29c0 4061134794 S Co:6:002:0 s 40 05 0668 0000 0002 2 = 0010
ffff00014a4c29c0 4061134842 C Co:6:002:0 0 2 >
ffff00014a4c29c0 4061134875 S Co:6:002:0 s 40 05 0483 0000 0001 1 = 00
ffff00014a4c29c0 4061134906 C Co:6:002:0 0 1 >
ffff00014a4c29c0 4061134939 S Ci:6:002:0 s c0 05 0837 0000 0001 1 <
ffff00014a4c29c0 4061134976 C Ci:6:002:0 0 1 = 00
ffff00014a4c29c0 4061135010 S Ci:6:002:0 s c0 05 08ac 0000 0004 4 <
ffff00014a4c29c0 4061135047 C Ci:6:002:0 0 4 = 08faf00f
ffff00014a4c29c0 4061135082 S Co:6:002:0 s 40 05 08ac 0000 0004 4 = 08faf00f
ffff00014a4c29c0 4061135113 C Co:6:002:0 0 4 >
ffff00014a4c29c0 4061135147 S Ci:6:002:0 s c0 05 08c4 0000 0004 4 <
ffff00014a4c29c0 4061135184 C Ci:6:002:0 0 4 = 00000000
ffff00014a4c29c0 4061135219 S Co:6:002:0 s 40 05 08c4 0000 0004 4 = 00000000
ffff00014a4c29c0 4061135251 C Co:6:002:0 0 4 >
ffff00014a4c29c0 4061135285 S Ci:6:002:0 s c0 05 0848 0000 0004 4 <
ffff00014a4c29c0 4061135337 C Ci:6:002:0 0 4 = 8bffd061
ffff00014a4c29c0 4061135372 S Co:6:002:0 s 40 05 0848 0000 0004 4 = 8bffd061
ffff00014a4c29c0 4061135404 C Co:6:002:0 0 4 >
ffff00014a4c29c0 4061135439 S Ci:6:002:0 s c0 05 08ac 0000 0004 4 <
ffff00014a4c29c0 4061135476 C Ci:6:002:0 0 4 = 08faf00f
ffff00014a4c29c0 4061135511 S Co:6:002:0 s 40 05 08ac 0000 0004 4 = 08faf00f
ffff00014a4c29c0 4061135542 C Co:6:002:0 0 4 >
ffff00014a4c29c0 4061135577 S Ci:6:002:0 s c0 05 08ac 0000 0004 4 <
ffff00014a4c29c0 4061135614 C Ci:6:002:0 0 4 = 08faf00f
ffff00014a4c29c0 4061135649 S Co:6:002:0 s 40 05 08ac 0000 0004 4 = 08faf00f
ffff00014a4c29c0 4061135681 C Co:6:002:0 0 4 >
ffff00014a4c29c0 4061135715 S Ci:6:002:0 s c0 05 08c4 0000 0004 4 <
ffff00014a4c29c0 4061135752 C Ci:6:002:0 0 4 = 00000000
ffff00014a4c29c0 4061135787 S Co:6:002:0 s 40 05 08c4 0000 0004 4 = 00000000
ffff00014a4c29c0 4061135834 C Co:6:002:0 0 4 >
ffff00014a4c29c0 4061135869 S Ci:6:002:0 s c0 05 0c00 0000 0004 4 <
ffff00014a4c29c0 4061135907 C Ci:6:002:0 0 4 = 07000000
ffff00014a4c29c0 4061135942 S Ci:6:002:0 s c0 05 08b0 0000 0004 4 <
ffff00014a4c29c0 4061135979 C Ci:6:002:0 0 4 = 18060000
ffff000103533a80 4061136026 S Co:6:002:0 s 40 05 08b0 0000 0004 4 = 18060000
ffff000103533a80 4061136056 C Co:6:002:0 0 4 >
ffff000103533a80 4061136112 S Ci:6:002:0 s c0 05 0d04 0000 0004 4 <
ffff000103533a80 4061136162 C Ci:6:002:0 0 4 = a17d95b1
ffff000103533a80 4061136196 S Co:6:002:0 s 40 05 0c90 0000 0004 4 = a17d8501
ffff000103533a80 4061136228 C Co:6:002:0 0 4 >
ffff000103533a80 4061136275 S Ci:6:002:0 s c0 05 0e00 0000 0004 4 <
ffff000103533a80 4061136341 C Ci:6:002:0 0 4 = 07000000
ffff000103533a80 4061136376 S Ci:6:002:0 s c0 05 08b0 0000 0004 4 <
ffff000103533a80 4061136413 C Ci:6:002:0 0 4 = 18060000
ffff000103533a80 4061136446 S Co:6:002:0 s 40 05 08b0 0000 0004 4 = 18060000
ffff000103533a80 4061136477 C Co:6:002:0 0 4 >
ffff000103533a80 4061136530 S Ci:6:002:0 s c0 05 0d44 0000 0004 4 <
ffff000103533a80 4061136596 C Ci:6:002:0 0 4 = a17d95b1
ffff000103533a80 4061136630 S Co:6:002:0 s 40 05 0e90 0000 0004 4 = a17d8501
ffff000103533a80 4061136661 C Co:6:002:0 0 4 >
ffff000103533a80 4061136710 S Ci:6:002:0 s c0 05 0073 0000 0001 1 <
ffff000103533a80 4061136758 C Ci:6:002:0 0 1 = 07
ffff000103533a80 4061136792 S Co:6:002:0 s 40 05 0073 0000 0001 1 = 07
ffff000103533a80 4061136840 C Co:6:002:0 0 1 >
ffff000103533a80 4061136905 S Ci:6:002:0 s c0 05 0c24 0000 0004 4 <
ffff000103533a80 4061136970 C Ci:6:002:0 0 4 = 20202020
ffff000103533a80 4061137004 S Co:6:002:0 s 40 05 0c24 0000 0004 4 = 30303030
ffff000103533a80 4061137035 C Co:6:002:0 0 4 >
ffff000103533a80 4061137068 S Ci:6:002:0 s c0 05 0c28 0000 0004 4 <
ffff000103533a80 4061137106 C Ci:6:002:0 0 4 = 20201e1c
ffff000103533a80 4061137141 S Co:6:002:0 s 40 05 0c28 0000 0004 4 = 30302e2c
ffff000103533a80 4061137171 C Co:6:002:0 0 4 >
ffff000103533a80 4061137206 S Ci:6:002:0 s c0 05 0c2c 0000 0004 4 <
ffff000103533a80 4061137243 C Ci:6:002:0 0 4 = 20202020
ffff000103533a80 4061137277 S Co:6:002:0 s 40 05 0c2c 0000 0004 4 = 35353535
ffff000103533a80 4061137307 C Co:6:002:0 0 4 >
ffff000103533a80 4061137341 S Ci:6:002:0 s c0 05 0c30 0000 0004 4 <
ffff000103533a80 4061137379 C Ci:6:002:0 0 4 = 20201e1c
ffff000103533a80 4061137413 S Co:6:002:0 s 40 05 0c30 0000 0004 4 = 33312f2d
ffff000103533a80 4061137460 C Co:6:002:0 0 4 >
ffff000103533a80 4061137494 S Ci:6:002:0 s c0 05 0c34 0000 0004 4 <
ffff000103533a80 4061137532 C Ci:6:002:0 0 4 = 20202020
ffff000103533a80 4061137567 S Co:6:002:0 s 40 05 0c34 0000 0004 4 = 31313131
ffff000103533a80 4061137598 C Co:6:002:0 0 4 >
ffff000103533a80 4061137632 S Ci:6:002:0 s c0 05 0c38 0000 0004 4 <
ffff000103533a80 4061137671 C Ci:6:002:0 0 4 = 201e1c1a
ffff000103533a80 4061137705 S Co:6:002:0 s 40 05 0c38 0000 0004 4 = 312f2d2b
ffff000103533a80 4061137736 C Co:6:002:0 0 4 >
ffff000103533a80 4061137771 S Ci:6:002:0 s c0 05 0c3c 0000 0004 4 <
ffff000103533a80 4061137809 C Ci:6:002:0 0 4 = 20202020
ffff000103533a80 4061137844 S Co:6:002:0 s 40 05 0c3c 0000 0004 4 = 35353535
ffff000103533a80 4061137876 C Co:6:002:0 0 4 >
ffff000103533a80 4061137910 S Ci:6:002:0 s c0 05 0c40 0000 0004 4 <
ffff000103533a80 4061137964 C Ci:6:002:0 0 4 = 20201e1c
ffff000103533a80 4061137998 S Co:6:002:0 s 40 05 0c40 0000 0004 4 = 33312f2d
ffff000103533a80 4061138030 C Co:6:002:0 0 4 >
ffff000103533a80 4061138065 S Ci:6:002:0 s c0 05 0c44 0000 0004 4 <
ffff000103533a80 4061138103 C Ci:6:002:0 0 4 = 1a181e1e
ffff000103533a80 4061138138 S Co:6:002:0 s 40 05 0c44 0000 0004 4 = 2b2b3131
ffff000103533a80 4061138170 C Co:6:002:0 0 4 >
ffff000103533a80 4061138204 S Ci:6:002:0 s c0 05 0c48 0000 0004 4 <
ffff000103533a80 4061138242 C Ci:6:002:0 0 4 = 1e1e1e1e
ffff000103533a80 4061138277 S Co:6:002:0 s 40 05 0c48 0000 0004 4 = 3131312f
ffff000103533a80 4061138308 C Co:6:002:0 0 4 >
ffff000103533a80 4061138343 S Ci:6:002:0 s c0 05 0c4c 0000 0004 4 <
ffff000103533a80 4061138381 C Ci:6:002:0 0 4 = 1c1a1816
ffff000103533a80 4061138415 S Co:6:002:0 s 40 05 0c4c 0000 0004 4 = 2d2b2929
ffff000103533a80 4061138463 C Co:6:002:0 0 4 >
ffff000103533a80 4061138498 S Ci:6:002:0 s c0 05 0c54 0000 0004 4 <
ffff000103533a80 4061138537 C Ci:6:002:0 0 4 = 120a0400
ffff000103533a80 4061138571 S Co:6:002:0 s 40 05 0c54 0000 0004 4 = 231b1500
ffff000103533a80 4061138603 C Co:6:002:0 0 4 >
ffff000103533a80 4061138637 S Ci:6:002:0 s c0 05 0e24 0000 0004 4 <
ffff000103533a80 4061138676 C Ci:6:002:0 0 4 = 1d1d1d1d
ffff000103533a80 4061138710 S Co:6:002:0 s 40 05 0e24 0000 0004 4 = 20202020
ffff000103533a80 4061138742 C Co:6:002:0 0 4 >
ffff000103533a80 4061138776 S Ci:6:002:0 s c0 05 0e28 0000 0004 4 <
ffff000103533a80 4061138815 C Ci:6:002:0 0 4 = 1d1d1b19
ffff000103533a80 4061138850 S Co:6:002:0 s 40 05 0e28 0000 0004 4 = 20201e1c
ffff000103533a80 4061138881 C Co:6:002:0 0 4 >
ffff000103533a80 4061138916 S Ci:6:002:0 s c0 05 0e2c 0000 0004 4 <
ffff000103533a80 4061138971 C Ci:6:002:0 0 4 = 1f1f1f1f
ffff000103533a80 4061139005 S Co:6:002:0 s 40 05 0e2c 0000 0004 4 = 25252525
ffff000103533a80 4061139037 C Co:6:002:0 0 4 >
ffff000103533a80 4061139071 S Ci:6:002:0 s c0 05 0e30 0000 0004 4 <
ffff000103533a80 4061139110 C Ci:6:002:0 0 4 = 1f1f1d1b
ffff000103533a80 4061139145 S Co:6:002:0 s 40 05 0e30 0000 0004 4 = 23211f1d
ffff000103533a80 4061139175 C Co:6:002:0 0 4 >
ffff000103533a80 4061139209 S Ci:6:002:0 s c0 05 0e34 0000 0004 4 <
ffff000103533a80 4061139248 C Ci:6:002:0 0 4 = 1f1f1f1f
ffff000103533a80 4061139285 S Co:6:002:0 s 40 05 0e34 0000 0004 4 = 21212121
ffff000103533a80 4061139316 C Co:6:002:0 0 4 >
ffff000103533a80 4061139350 S Ci:6:002:0 s c0 05 0e38 0000 0004 4 <
ffff000103533a80 4061139389 C Ci:6:002:0 0 4 = 1f1d1b19
ffff000103533a80 4061139424 S Co:6:002:0 s 40 05 0e38 0000 0004 4 = 211f1d1b
ffff000103533a80 4061139467 C Co:6:002:0 0 4 >
ffff000103533a80 4061139501 S Ci:6:002:0 s c0 05 0e3c 0000 0004 4 <
ffff000103533a80 4061139540 C Ci:6:002:0 0 4 = 1f1f1f1f
ffff000103533a80 4061139574 S Co:6:002:0 s 40 05 0e3c 0000 0004 4 = 25252525
ffff000103533a80 4061139606 C Co:6:002:0 0 4 >
ffff000103533a80 4061139640 S Ci:6:002:0 s c0 05 0e40 0000 0004 4 <
ffff000103533a80 4061139678 C Ci:6:002:0 0 4 = 1f1f1d1b
ffff000103533a80 4061139713 S Co:6:002:0 s 40 05 0e40 0000 0004 4 = 23211f1d
ffff000103533a80 4061139744 C Co:6:002:0 0 4 >
ffff000103533a80 4061139779 S Ci:6:002:0 s c0 05 0e44 0000 0004 4 <
ffff000103533a80 4061139818 C Ci:6:002:0 0 4 = 19171d1d
ffff000103533a80 4061139852 S Co:6:002:0 s 40 05 0e44 0000 0004 4 = 1b1b2121
ffff000103533a80 4061139884 C Co:6:002:0 0 4 >
ffff000103533a80 4061139918 S Ci:6:002:0 s c0 05 0e48 0000 0004 4 <
ffff000103533a80 4061139970 C Ci:6:002:0 0 4 = 1d1d1d1d
ffff000103533a80 4061140017 S Co:6:002:0 s 40 05 0e48 0000 0004 4 = 2121211f
ffff000103533a80 4061140048 C Co:6:002:0 0 4 >
ffff000103533a80 4061140085 S Ci:6:002:0 s c0 05 0e4c 0000 0004 4 <
ffff000103533a80 4061140120 C Ci:6:002:0 0 4 = 1b191715
ffff000103533a80 4061140155 S Co:6:002:0 s 40 05 0e4c 0000 0004 4 = 1d1b1919
ffff000103533a80 4061140186 C Co:6:002:0 0 4 >
ffff000103533a80 4061140221 S Ci:6:002:0 s c0 05 0e54 0000 0004 4 <
ffff000103533a80 4061140256 C Ci:6:002:0 0 4 = 11090300
ffff000103533a80 4061140289 S Co:6:002:0 s 40 05 0e54 0000 0004 4 = 130b0500
ffff000103533a80 4061140338 C Co:6:002:0 0 4 >
ffff00011ac9e840 4061756198 S Ci:6:002:0 s c0 05 004c 0000 0001 1 <
ffff00011ac9e840 4061756341 C Ci:6:002:0 0 1 = 20
ffff00011ac9e840 4061756497 S Co:6:002:0 s 40 05 004c 0000 0001 1 = 20
ffff00011ac9e840 4061756608 C Co:6:002:0 0 1 >
ffff00011ac9e840 4061788261 S Ci:6:002:0 s c0 05 0770 0000 0004 4 <
ffff00011ac9e840 4061788423 C Ci:6:002:0 0 4 = 00000000
ffff00011ac9e840 4061788577 S Ci:6:002:0 s c0 05 0774 0000 0004 4 <
ffff00011ac9e840 4061788726 C Ci:6:002:0 0 4 = 00000000
ffff00011ac9e840 4061788887 S Co:6:002:0 s 40 05 076e 0000 0001 1 = 0c
ffff00011ac9e840 4061789024 C Co:6:002:0 0 1 >
ffff00011ac9e840 4061789190 S Ci:6:002:0 s c0 05 0808 0000 0004 4 <
ffff00011ac9e840 4061789337 C Ci:6:002:0 0 4 = 3382023e
ffff00011ac9e840 4061789485 S Ci:6:002:0 s c0 05 0a5c 0000 0002 2 <
ffff00011ac9e840 4061789613 C Ci:6:002:0 0 2 = 5700
ffff00011ac9e840 4061789760 S Ci:6:002:0 s c0 05 0f48 0000 0002 2 <
ffff00011ac9e840 4061789908 C Ci:6:002:0 0 2 = 6c27
ffff00011ac9e840 4061790053 S Ci:6:002:0 s c0 05 0f04 0000 0004 4 <
ffff00011ac9e840 4061790178 C Ci:6:002:0 0 4 = 01000500
ffff00011ac9e840 4061790215 S Ci:6:002:0 s c0 05 0f14 0000 0004 4 <
ffff00011ac9e840 4061790327 C Ci:6:002:0 0 4 = 46009700
ffff00011ac9e840 4061790357 S Ci:6:002:0 s c0 05 0f10 0000 0004 4 <
ffff00011ac9e840 4061790470 C Ci:6:002:0 0 4 = 00000000
ffff00011ac9e840 4061790499 S Ci:6:002:0 s c0 05 0f0c 0000 0004 4 <
ffff00011ac9e840 4061790621 C Ci:6:002:0 0 4 = 00000000
ffff00011ac9e840 4061790646 S Ci:6:002:0 s c0 05 0f08 0000 0004 4 <
ffff00011ac9e840 4061790758 C Ci:6:002:0 0 4 = 83005328
ffff00011ac9e840 4061790787 S Ci:6:002:0 s c0 05 0fcc 0000 0004 4 <
ffff00011ac9e840 4061790910 C Ci:6:002:0 0 4 = 00000000
ffff00011ac9e840 4061790931 S Ci:6:002:0 s c0 05 09a4 0000 0004 4 <
ffff00011ac9e840 4061791045 C Ci:6:002:0 0 4 = 80000800
ffff00011ac9e840 4061791075 S Co:6:002:0 s 40 05 09a4 0000 0004 4 = 80000a00
ffff00011ac9e840 4061791183 C Co:6:002:0 0 4 >
ffff00011ac9e840 4061791204 S Ci:6:002:0 s c0 05 09a4 0000 0004 4 <
ffff00011ac9e840 4061791318 C Ci:6:002:0 0 4 = 80000a00
ffff00011ac9e840 4061791346 S Co:6:002:0 s 40 05 09a4 0000 0004 4 = 80000800
ffff00011ac9e840 4061791461 C Co:6:002:0 0 4 >
ffff00011ac9e840 4061791482 S Ci:6:002:0 s c0 05 0a2c 0000 0004 4 <
ffff00011ac9e840 4061791595 C Ci:6:002:0 0 4 = 00809000
ffff00011ac9e840 4061791624 S Co:6:002:0 s 40 05 0a2c 0000 0004 4 = 00009000
ffff00011ac9e840 4061791739 C Co:6:002:0 0 4 >
ffff00011ac9e840 4061791760 S Ci:6:002:0 s c0 05 0a2c 0000 0004 4 <
ffff00011ac9e840 4061791874 C Ci:6:002:0 0 4 = 00009000
ffff00011ac9e840 4061791903 S Co:6:002:0 s 40 05 0a2c 0000 0004 4 = 00809000
ffff00011ac9e840 4061792016 C Co:6:002:0 0 4 >
ffff00011ac9e840 4061792038 S Ci:6:002:0 s c0 05 0b58 0000 0004 4 <
ffff00011ac9e840 4061792161 C Ci:6:002:0 0 4 = 00000000
ffff00011ac9e840 4061792190 S Co:6:002:0 s 40 05 0b58 0000 0004 4 = 01000000
ffff00011ac9e840 4061792305 C Co:6:002:0 0 4 >
ffff00011ac9e840 4061792325 S Ci:6:002:0 s c0 05 0b58 0000 0004 4 <
ffff00011ac9e840 4061792439 C Ci:6:002:0 0 4 = 01000000
ffff00011ac9e840 4061792469 S Co:6:002:0 s 40 05 0b58 0000 0004 4 = 00000000
ffff00011ac9e840 4061792577 C Co:6:002:0 0 4 >
ffff00011ac9e840 4061792609 S Ci:6:002:0 s c0 05 0c50 0000 0004 4 <
ffff00011ac9e840 4061792717 C Ci:6:002:0 0 4 = 1c000000
ffff00011ac9e840 4061792747 S Co:6:002:0 s 40 05 0c50 0000 0004 4 = 1e000000
ffff00011ac9e840 4061792860 C Co:6:002:0 0 4 >
ffff00011ac9e840 4061792883 S Ci:6:002:0 s c0 05 0e50 0000 0004 4 <
ffff00011ac9e840 4061792993 C Ci:6:002:0 0 4 = 1c000000
ffff00011ac9e840 4061793023 S Co:6:002:0 s 40 05 0e50 0000 0004 4 = 1e000000
ffff00011ac9e840 4061793137 C Co:6:002:0 0 4 >
ffff00011ac9e840 4061793159 S Ci:6:002:0 s c0 05 01cc 0000 0001 1 <
ffff00011ac9e840 4061793281 C Ci:6:002:0 0 1 = 00
ffff00011ac9e840 4061793311 S Co:6:002:0 s 40 05 01f8 0000 0004 4 = 00000000
ffff00011ac9e840 4061793419 C Co:6:002:0 0 4 >
ffff00011ac9e840 4061793449 S Co:6:002:0 s 40 05 01d8 0000 0004 4 = 58000000
ffff00011ac9e840 4061793563 C Co:6:002:0 0 4 >
ffff00011ac9e840 4061793585 S Co:6:002:0 s 40 05 0440 0000 0004 4 = 00000000
ffff00011ac9e840 4061793692 C Co:6:002:0 0 4 >
ffff00011ac9e840 4061793724 S Ci:6:002:0 s c0 05 0c00 0000 0004 4 <
ffff00011ac9e840 4061793839 C Ci:6:002:0 0 4 = 07000000
ffff00011ac9e840 4061793859 S Ci:6:002:0 s c0 05 08b0 0000 0004 4 <
ffff00011ac9e840 4061793970 C Ci:6:002:0 0 4 = 18060000
ffff00011ac9e840 4061794000 S Co:6:002:0 s 40 05 08b0 0000 0004 4 = 42060000
ffff00011ac9e840 4061794107 C Co:6:002:0 0 4 >
ffff00011ac9e840 4061794158 S Ci:6:002:0 s c0 05 0d04 0000 0004 4 <
ffff00011ac9e840 4061794281 C Ci:6:002:0 0 4 = 108d90b1
ffff00011ac9e840 4061794311 S Co:6:002:0 s 40 05 0c90 0000 0004 4 = 108d2304
ffff00011ac9e840 4061794425 C Co:6:002:0 0 4 >
ffff00011ac9e840 4061794459 S Co:6:002:0 s 40 05 0280 0000 0002 2 = 0001
ffff00011ac9e840 4061794561 C Co:6:002:0 0 2 >
ffff00011ac9e840 4061794584 S Ci:6:002:0 s c0 05 010c 0000 0001 1 <
ffff00011ac9e840 4061794696 C Ci:6:002:0 0 1 = b4
ffff00011ac9e840 4061794726 S Co:6:002:0 s 40 05 010c 0000 0001 1 = b4
ffff00011ac9e840 4061794835 C Co:6:002:0 0 1 >
ffff000102d1d840 4062780211 S Ci:6:002:0 s c0 05 004c 0000 0001 1 <
ffff000102d1d840 4062780386 C Ci:6:002:0 0 1 = 20
ffff000102d1d840 4062780544 S Co:6:002:0 s 40 05 004c 0000 0001 1 = 20
ffff000102d1d840 4062780683 C Co:6:002:0 0 1 >
ffff000102d1d840 4063772226 S Ci:6:002:0 s c0 05 0770 0000 0004 4 <
ffff000102d1d840 4063772314 C Ci:6:002:0 0 4 = 00000000
ffff000102d1d840 4063772449 S Ci:6:002:0 s c0 05 0774 0000 0004 4 <
ffff000102d1d840 4063772581 C Ci:6:002:0 0 4 = 00000000
ffff000102d1d840 4063772738 S Co:6:002:0 s 40 05 076e 0000 0001 1 = 0c
ffff000102d1d840 4063772879 C Co:6:002:0 0 1 >
ffff000102d1d840 4063773047 S Ci:6:002:0 s c0 05 0808 0000 0004 4 <
ffff000102d1d840 4063773190 C Ci:6:002:0 0 4 = 3382023e
ffff000102d1d840 4063773354 S Ci:6:002:0 s c0 05 0a5c 0000 0002 2 <
ffff000102d1d840 4063773499 C Ci:6:002:0 0 2 = 0000
ffff000102d1d840 4063773662 S Ci:6:002:0 s c0 05 0f48 0000 0002 2 <
ffff000102d1d840 4063773807 C Ci:6:002:0 0 2 = a743
ffff000102d1d840 4063773969 S Ci:6:002:0 s c0 05 0f04 0000 0004 4 <
ffff000102d1d840 4063774090 C Ci:6:002:0 0 4 = 00000000
ffff000102d1d840 4063774120 S Ci:6:002:0 s c0 05 0f14 0000 0004 4 <
ffff000102d1d840 4063774234 C Ci:6:002:0 0 4 = 1700e101
ffff000102d1d840 4063774263 S Ci:6:002:0 s c0 05 0f10 0000 0004 4 <
ffff000102d1d840 4063774387 C Ci:6:002:0 0 4 = 00000000
ffff000102d1d840 4063774417 S Ci:6:002:0 s c0 05 0f0c 0000 0004 4 <
ffff000102d1d840 4063774527 C Ci:6:002:0 0 4 = 00000000
ffff000102d1d840 4063774557 S Ci:6:002:0 s c0 05 0f08 0000 0004 4 <
ffff000102d1d840 4063774667 C Ci:6:002:0 0 4 = 00009d45
ffff000102d1d840 4063774696 S Ci:6:002:0 s c0 05 0fcc 0000 0004 4 <
ffff000102d1d840 4063774813 C Ci:6:002:0 0 4 = 00000000
ffff000102d1d840 4063774833 S Ci:6:002:0 s c0 05 09a4 0000 0004 4 <
ffff000102d1d840 4063774945 C Ci:6:002:0 0 4 = 80000800
ffff000102d1d840 4063774975 S Co:6:002:0 s 40 05 09a4 0000 0004 4 = 80000a00
ffff000102d1d840 4063775087 C Co:6:002:0 0 4 >
ffff000102d1d840 4063775109 S Ci:6:002:0 s c0 05 09a4 0000 0004 4 <
ffff000102d1d840 4063775220 C Ci:6:002:0 0 4 = 80000a00
ffff000102d1d840 4063775249 S Co:6:002:0 s 40 05 09a4 0000 0004 4 = 80000800
ffff000102d1d840 4063775358 C Co:6:002:0 0 4 >
ffff000102d1d840 4063775379 S Ci:6:002:0 s c0 05 0a2c 0000 0004 4 <
ffff000102d1d840 4063775491 C Ci:6:002:0 0 4 = 00809000
ffff000102d1d840 4063775519 S Co:6:002:0 s 40 05 0a2c 0000 0004 4 = 00009000
ffff000102d1d840 4063775634 C Co:6:002:0 0 4 >
ffff000102d1d840 4063775654 S Ci:6:002:0 s c0 05 0a2c 0000 0004 4 <
ffff000102d1d840 4063775768 C Ci:6:002:0 0 4 = 00009000
ffff000102d1d840 4063775797 S Co:6:002:0 s 40 05 0a2c 0000 0004 4 = 00809000
ffff000102d1d840 4063775908 C Co:6:002:0 0 4 >
ffff000102d1d840 4063775929 S Ci:6:002:0 s c0 05 0b58 0000 0004 4 <
ffff000102d1d840 4063776041 C Ci:6:002:0 0 4 = 00000000
ffff000102d1d840 4063776071 S Co:6:002:0 s 40 05 0b58 0000 0004 4 = 01000000
ffff000102d1d840 4063776185 C Co:6:002:0 0 4 >
ffff000102d1d840 4063776207 S Ci:6:002:0 s c0 05 0b58 0000 0004 4 <
ffff000102d1d840 4063776318 C Ci:6:002:0 0 4 = 01000000
ffff000102d1d840 4063776348 S Co:6:002:0 s 40 05 0b58 0000 0004 4 = 00000000
ffff000102d1d840 4063776455 C Co:6:002:0 0 4 >
ffff000102d1d840 4063776486 S Ci:6:002:0 s c0 05 0c50 0000 0004 4 <
ffff000102d1d840 4063776602 C Ci:6:002:0 0 4 = 1e000000
ffff000102d1d840 4063776622 S Co:6:002:0 s 40 05 0c50 0000 0004 4 = 20000000
ffff000102d1d840 4063776730 C Co:6:002:0 0 4 >
ffff000102d1d840 4063776759 S Ci:6:002:0 s c0 05 0e50 0000 0004 4 <
ffff000102d1d840 4063776880 C Ci:6:002:0 0 4 = 1e000000
ffff000102d1d840 4063776901 S Co:6:002:0 s 40 05 0e50 0000 0004 4 = 20000000
ffff000102d1d840 4063777010 C Co:6:002:0 0 4 >
ffff000102d1d840 4063777040 S Ci:6:002:0 s c0 05 01cc 0000 0001 1 <
ffff000102d1d840 4063777152 C Ci:6:002:0 0 1 = 00
ffff000102d1d840 4063777173 S Co:6:002:0 s 40 05 01fc 0000 0004 4 = 00000000
ffff000102d1d840 4063777281 C Co:6:002:0 0 4 >
ffff000102d1d840 4063777311 S Co:6:002:0 s 40 05 01dc 0000 0004 4 = 58000000
ffff000102d1d840 4063777424 C Co:6:002:0 0 4 >
ffff000102d1d840 4063777446 S Co:6:002:0 s 40 05 0440 0000 0004 4 = 00000000
ffff000102d1d840 4063777553 C Co:6:002:0 0 4 >
ffff000102d1d840 4063777585 S Ci:6:002:0 s c0 05 0c00 0000 0004 4 <
ffff000102d1d840 4063777700 C Ci:6:002:0 0 4 = 07000000
ffff000102d1d840 4063777721 S Ci:6:002:0 s c0 05 08b0 0000 0004 4 <
ffff000102d1d840 4063777832 C Ci:6:002:0 0 4 = 42060000
ffff000102d1d840 4063777861 S Co:6:002:0 s 40 05 08b0 0000 0004 4 = 42060000
ffff000102d1d840 4063777970 C Co:6:002:0 0 4 >
ffff000102d1d840 4063778012 S Ci:6:002:0 s c0 05 0d04 0000 0004 4 <
ffff000102d1d840 4063778136 C Ci:6:002:0 0 4 = 108d90b1
ffff000102d1d840 4063778157 S Ci:6:002:0 s c0 05 0c1c 0000 0004 4 <
ffff000102d1d840 4063778274 C Ci:6:002:0 0 4 = 0300402d
ffff000102d1d840 4063778304 S Co:6:002:0 s 40 05 0c1c 0000 0004 4 = 03000039
ffff000102d1d840 4063778411 C Co:6:002:0 0 4 >
ffff000102d1d840 4063778441 S Ci:6:002:0 s c0 05 0e1c 0000 0004 4 <
ffff000102d1d840 4063778552 C Ci:6:002:0 0 4 = 0300402d
ffff000102d1d840 4063778582 S Co:6:002:0 s 40 05 0e1c 0000 0004 4 = 0300e032
ffff000102d1d840 4063778696 C Co:6:002:0 0 4 >
ffff000102d1d840 4063778717 S Co:6:002:0 s 40 05 0280 0000 0002 2 = 0001
ffff000102d1d840 4063778824 C Co:6:002:0 0 2 >
ffff000102d1d840 4063778854 S Ci:6:002:0 s c0 05 010c 0000 0001 1 <
ffff000102d1d840 4063778967 C Ci:6:002:0 0 1 = b4
ffff000102d1d840 4063778988 S Co:6:002:0 s 40 05 010c 0000 0001 1 = b4
ffff000102d1d840 4063779096 C Co:6:002:0 0 1 >
ffff00011ac9e840 4063779233 S Ci:6:002:0 s c0 05 004c 0000 0001 1 <
ffff00011ac9e840 4063779348 C Ci:6:002:0 0 1 = 20
ffff00011ac9e840 4063779473 S Co:6:002:0 s 40 05 004c 0000 0001 1 = 20
ffff00011ac9e840 4063779581 C Co:6:002:0 0 1 >
