ffff000103533d80 2991592565 C Bi:6:002:1 0 376 = 40010484 00000f80 4c0b6000 04300000 00000000 14c57400 44400000 83e2e201
ffff000103533d80 2991592616 S Bi:6:002:1 -115 32768 <
ffff0001035339c0 2991594142 C Bi:6:002:1 0 374 = 3e010484 00000f80 ef0f6000 04300000 00000000 4fcb7400 402e0000 7af7f701
ffff0001035339c0 2991594157 S Bi:6:002:1 -115 32768 <
ffff000103533840 2991594974 C Bi:6:002:1 0 384 = 48010484 00000f80 c0026000 04300000 00000000 80ce7400 463c0000 84f7f701
ffff000103533840 2991594988 S Bi:6:002:1 -115 32768 <
ffff000103533b40 2991603710 C Bi:6:002:1 0 310 = fe000484 00000f80 060a6000 00300000 00000000 1dea7400 463c0000 3e500001
ffff000103533b40 2991603739 S Bi:6:002:1 -115 32768 <
ffff000103533d80 2991605349 C Bi:6:002:1 0 377 = 41010484 00000f00 b4046000 04300000 00000000 c7f67400 443c0000 86f5f501
ffff000103533d80 2991605373 S Bi:6:002:1 -115 32768 <
ffff0001035339c0 2991606015 C Bi:6:002:1 0 377 = 41010484 00000f00 b4046000 04300000 00000000 5af97400 443a0000 86fbfb01
ffff0001035339c0 2991606040 S Bi:6:002:1 -115 32768 <
ffff000103533840 2991606824 C Bi:6:002:1 0 377 = 41010484 00000f00 b4046000 04300000 00000000 83fc7400 44380000 84efef01
ffff000103533840 2991606848 S Bi:6:002:1 -115 32768 <
ffff000103533b40 2991607445 C Bi:6:002:1 0 370 = 3a010484 00000f00 0d0b6000 04300000 00000000 fafe7400 443e0000 86f8f801
ffff000103533b40 2991607468 S Bi:6:002:1 -115 32768 <
ffff000103533d80 2991608083 C Bi:6:002:1 0 370 = 3a010484 00000f00 0d0b6000 04300000 00000000 72017500 3e3a0000 88ecec01
ffff000103533d80 2991608106 S Bi:6:002:1 -115 32768 <
ffff0001035339c0 2991611157 C Bi:6:002:1 0 370 = 3a010484 00000f00 0d0b6000 04300000 00000000 7d0d7500 463c0000 88f6f601
ffff0001035339c0 2991611181 S Bi:6:002:1 -115 32768 <
ffff000103533840 2991611800 C Bi:6:002:1 0 370 = 3a010484 00000f00 0d0b6000 04300000 00000000 ec0f7500 44400000 83efef01
ffff000103533840 2991611824 S Bi:6:002:1 -115 32768 <
ffff000103533b40 2991612413 C Bi:6:002:1 0 345 = 21010484 00000f00 13006000 04300000 00000000 5b127500 443a0000 86f5f501
ffff000103533b40 2991612439 S Bi:6:002:1 -115 32768 <
ffff000103533d80 2991613546 C Bi:6:002:1 0 345 = 21010484 00000f00 13006000 04300000 00000000 de167500 443a0000 88f7f701
ffff000103533d80 2991613570 S Bi:6:002:1 -115 32768 <
ffff0001035339c0 2991614116 C Bi:6:002:1 0 345 = 21010484 00000f00 13006000 04300000 00000000 1b197500 44380000 82ecec01
ffff0001035339c0 2991614141 S Bi:6:002:1 -115 32768 <
ffff000103533840 2991614743 C Bi:6:002:1 0 378 = 42010484 00000f00 ab016000 04300000 00000000 611b7500 443a0000 88f5f501
ffff000103533840 2991614767 S Bi:6:002:1 -115 32768 <
ffff000103533b40 2991615345 C Bi:6:002:1 0 378 = 42010484 00000f00 ab016000 04300000 00000000 cb1d7500 443c0000 84f4f401
ffff000103533b40 2991615366 S Bi:6:002:1 -115 32768 <
ffff000103533d80 2991616231 C Bi:6:002:1 0 378 = 42010484 00000f00 ab016000 04300000 00000000 35217500 443e0000 85f5f501
ffff000103533d80 2991616264 S Bi:6:002:1 -115 32768 <
ffff00014c2bfc00 2991616266 S Ci:6:002:0 s c0 05 004c 0000 0001 1 <
ffff00014c2bfc00 2991616334 C Ci:6:002:0 0 1 = 28
ffff00014c2bfc00 2991616458 S Co:6:002:0 s 40 05 004c 0000 0001 1 = 20
ffff00014c2bfc00 2991616591 C Co:6:002:0 0 1 >
ffff0001035339c0 2991616846 C Bi:6:002:1 0 378 = 42010484 00000f00 ab016000 04300000 00000000 9e237500 443c0000 82f7f701
ffff0001035339c0 2991616872 S Bi:6:002:1 -115 32768 <
ffff000103533840 2991631439 C Bi:6:002:1 0 377 = 41010484 00000f00 b5046000 04300000 00000000 825c7500 3e3a0000 87efef01
ffff000103533840 2991631468 S Bi:6:002:1 -115 32768 <
ffff000103533b40 2991632086 C Bi:6:002:1 0 377 = 41010484 00000f00 b5046000 04300000 00000000 205f7500 443e0000 83f7f701
ffff000103533b40 2991632112 S Bi:6:002:1 -115 32768 <
ffff000103533d80 2991633305 C Bi:6:002:1 0 377 = 41010484 00000f00 b5046000 04300000 00000000 fc637500 463c0000 84efef01
ffff000103533d80 2991633329 S Bi:6:002:1 -115 32768 <
ffff0001035339c0 2991633960 C Bi:6:002:1 0 370 = 3a010484 00000f00 0e0b6000 04300000 00000000 74667500 443c0000 82f4f401
ffff0001035339c0 2991633985 S Bi:6:002:1 -115 32768 <
ffff000103533840 2991634574 C Bi:6:002:1 0 370 = 3a010484 00000f00 0e0b6000 04300000 00000000 e2687500 443c0000 82fcfc01
ffff000103533840 2991634598 S Bi:6:002:1 -115 32768 <
ffff000103533b40 2991637007 C Bi:6:002:1 0 345 = 21010484 00000f00 14006000 04300000 00000000 63727500 46400000 85f4f401
ffff000103533b40 2991637034 S Bi:6:002:1 -115 32768 <
ffff000103533d80 2991637540 C Bi:6:002:1 0 345 = 21010484 00000f00 14006000 04300000 00000000 9b747500 443c0000 83f7f701
ffff000103533d80 2991637565 S Bi:6:002:1 -115 32768 <
ffff0001035339c0 2991638739 C Bi:6:002:1 0 378 = 42010484 00000f00 ac016000 04300000 00000000 19797500 463e0000 86fcfc01
ffff0001035339c0 2991638763 S Bi:6:002:1 -115 32768 <
ffff000103533840 2991639367 C Bi:6:002:1 0 378 = 42010484 00000f00 ac016000 04300000 00000000 8b7b7500 463e0000 83ebeb01
ffff000103533840 2991639392 S Bi:6:002:1 -115 32768 <
ffff000103533b40 2991639897 C Bi:6:002:1 0 378 = 42010484 00000f00 ac016000 04300000 00000000 f27d7500 443a0000 84f3f301
ffff000103533b40 2991639913 S Bi:6:002:1 -115 32768 <
ffff000103533d80 2991640579 C Bi:6:002:1 0 378 = 42010484 00000f00 ac016000 04300000 00000000 55807500 403c0000 84ecec01
ffff000103533d80 2991640600 S Bi:6:002:1 -115 32768 <
ffff0001035339c0 2991648322 C Bi:6:002:1 0 172 = 74000484 00000f80 cd026000 00300000 00000000 b19c7500 3a360000 1a520001
ffff0001035339c0 2991648392 S Bi:6:002:1 -115 32768 <
ffff000103533840 2991666807 C Bi:6:002:1 0 86 = 1e008484 00000f22 00006900 01300000 00000000 06e87500 3a360000 0d750001
ffff000103533840 2991666840 S Bi:6:002:1 -115 32768 <
ffff000103533b40 2991694085 C Bi:6:002:1 0 383 = 47010484 00000f80 e4036000 04300000 00000000 3c517600 463c0000 87ebeb01
ffff000103533b40 2991694112 S Bi:6:002:1 -115 32768 <
ffff000103533d80 2991695096 C Bi:6:002:1 0 376 = 40010484 00000f80 4d0b6000 04300000 00000000 49557600 443e0000 88f2f201
ffff000103533d80 2991695119 S Bi:6:002:1 -115 32768 <
ffff0001035339c0 2991695793 C Bi:6:002:1 0 351 = 27010484 00000f80 1c056000 04300000 00000000 7a587600 483e0000 86efef01
ffff0001035339c0 2991695812 S Bi:6:002:1 -115 32768 <
ffff000103533840 2991696709 C Bi:6:002:1 0 374 = 3e010484 00000f80 f00f6000 04300000 00000000 7f5b7600 40380000 86fcfc01
ffff000103533840 2991696735 S Bi:6:002:1 -115 32768 <
ffff000103533b40 2991697490 C Bi:6:002:1 0 384 = 48010484 00000f80 c1026000 04300000 00000000 945e7600 443c0000 84f3f301
ffff000103533b40 2991697514 S Bi:6:002:1 -115 32768 <
ffff000103533d80 2991708207 C Bi:6:002:1 0 310 = fe000484 00000f80 070a6000 00300000 00000000 1e827600 443c0000 28500001
ffff000103533d80 2991708236 S Bi:6:002:1 -115 32768 <
ffff0001035339c0 2991720472 C Bi:6:002:1 0 249 = c1000484 00000f80 da0f6000 00300000 00000000 15b47600 443c0000 2d550001
ffff0001035339c0 2991720525 S Bi:6:002:1 -115 32768 <
ffff000103533840 2991742351 C Bi:6:002:1 0 304 = f8000484 00000f00 020b6000 00300000 00000000 c7077700 34320000 37500001
ffff000103533840 2991742381 S Bi:6:002:1 -115 32768 <
ffff00014c2bfc00 2991748289 S Ci:6:002:0 s c0 05 004c 0000 0001 1 <
ffff00014c2bfc00 2991748429 C Ci:6:002:0 0 1 = 20
ffff00014c2bfc00 2991748585 S Co:6:002:0 s 40 05 004c 0000 0001 1 = 28
ffff00014c2bfc00 2991748728 C Co:6:002:0 0 1 >
ffff000103533b40 2991751410 C Bi:6:002:1 0 304 = f8000484 00000f00 020b6000 00300000 00000000 1b2b7700 34320000 c2500001
ffff000103533b40 2991751436 S Bi:6:002:1 -115 32768 <
ffff000103533d80 2991755745 C Bi:6:002:1 0 172 = 74000484 00000f80 ce026000 00300000 00000000 34407700 34320000 0b760001
ffff000103533d80 2991755769 S Bi:6:002:1 -115 32768 <
ffff0001035339c0 2991771113 C Bi:6:002:1 0 86 = 1e008484 00000f20 00006900 01300000 00000000 5b7f7700 34360000 10760001
ffff0001035339c0 2991771139 S Bi:6:002:1 -115 32768 <
ffff000103533840 2991771827 C Bi:6:002:1 0 492 = b401048c 00000f20 76067000 03300000 01000000 6c817700 34360000 0f750001
ffff000103533840 2991771852 S Bi:6:002:1 -115 32768 <
ffff000103533b40 2991772392 C Bi:6:002:1 0 160 = 6800048c 00000f20 96087000 03300000 00000000 a7847700 34360000 1b510001
ffff000103533b40 2991772421 S Bi:6:002:1 -115 32768 <
ffff000103533d80 2991773076 C Bi:6:002:1 0 160 = 6800048c 00000f20 97087000 03300000 00000000 34877700 34360000 14500001
ffff000103533d80 2991773100 S Bi:6:002:1 -115 32768 <
ffff0001035339c0 2991773522 C Bi:6:002:1 0 148 = 5c00048c 00000f20 77067000 03300000 01000000 09897700 34360000 244f0001
ffff0001035339c0 2991773545 S Bi:6:002:1 -115 32768 <
ffff000103533840 2991773991 C Bi:6:002:1 0 148 = 5c00048c 00000f20 78067000 03300000 01000000 dc8a7700 34360000 1b500001
ffff000103533840 2991774015 S Bi:6:002:1 -115 32768 <
ffff000103533b40 2991796467 C Bi:6:002:1 0 383 = 47010484 00000f80 e5036000 04300000 00000000 3ee17700 443c0000 85ecec01
ffff000103533b40 2991796491 S Bi:6:002:1 -115 32768 <
ffff000103533d80 2991797500 C Bi:6:002:1 0 376 = 40010484 00000f80 4e0b6000 04300000 00000000 37e57700 463c0000 85ebeb01
ffff000103533d80 2991797526 S Bi:6:002:1 -115 32768 <
ffff0001035339c0 2991799915 C Bi:6:002:1 0 384 = 48010484 00000f80 c2026000 04300000 00000000 b0ee7700 443c0000 82efef01
ffff0001035339c0 2991799939 S Bi:6:002:1 -115 32768 <
ffff000103533840 2991812641 C Bi:6:002:1 0 310 = fe000484 00000f80 080a6000 00300000 00000000 1f1a7800 38360000 2d510001
ffff000103533840 2991812672 S Bi:6:002:1 -115 32768 <
ffff000103533b40 2991823775 C Bi:6:002:1 0 249 = c1000484 00000f80 db0f6000 00300000 00000000 9b477800 38360000 33530001
ffff000103533b40 2991823828 S Bi:6:002:1 -115 32768 <
ffff000103533d80 2991833469 C Bi:6:002:1 0 154 = 6200048c 00000f20 98087000 03300000 00000000 0f737800 38360000 0c500001
ffff000103533d80 2991833496 S Bi:6:002:1 -115 32768 <
ffff0001035339c0 2991853137 C Bi:6:002:1 0 172 = 74000484 00000f80 cf026000 00300000 00000000 7fbc7800 38360000 0c740001
ffff0001035339c0 2991853166 S Bi:6:002:1 -115 32768 <
ffff000103533840 2991887142 C Bi:6:002:1 0 160 = 6800048c 00000f20 99087000 03300000 00000000 a9447900 30360000 14520001
ffff000103533840 2991887178 S Bi:6:002:1 -115 32768 <
ffff000103533b40 2991887706 C Bi:6:002:1 0 160 = 6800048c 00000f20 9a087000 03300000 00000000 0a477900 30360000 14520001
ffff000103533b40 2991887733 S Bi:6:002:1 -115 32768 <
ffff000103533d80 2991888031 C Bi:6:002:1 0 148 = 5c00048c 00000f20 79067000 03300000 01000000 53487900 30360000 0a750001
ffff000103533d80 2991888054 S Bi:6:002:1 -115 32768 <
ffff0001035339c0 2991888651 C Bi:6:002:1 0 160 = 6800048c 00000f20 9a087000 03300000 00000000 bb4a7900 30360000 16520001
ffff0001035339c0 2991888676 S Bi:6:002:1 -115 32768 <
ffff000103533840 2991889112 C Bi:6:002:1 0 148 = 5c00048c 00000f20 7a067000 03300000 01000000 864c7900 30360000 0c750001
ffff000103533840 2991889137 S Bi:6:002:1 -115 32768 <
ffff000103533b40 2991889685 C Bi:6:002:1 0 160 = 6800048c 00000f20 9b087000 03300000 00000000 c44e7900 30360000 08520001
ffff000103533b40 2991889712 S Bi:6:002:1 -115 32768 <
ffff000103533d80 2991890457 C Bi:6:002:1 0 148 = 5c00048c 00000f20 7b067000 03300000 01000000 ce517900 30360000 2b4f0001
ffff000103533d80 2991890481 S Bi:6:002:1 -115 32768 <
ffff0001035339c0 2991891040 C Bi:6:002:1 0 160 = 6800048c 00000f20 9c087000 03300000 00000000 0e547900 30360000 0b510001
ffff0001035339c0 2991891065 S Bi:6:002:1 -115 32768 <
ffff000103533840 2991891482 C Bi:6:002:1 0 148 = 5c00048c 00000f20 7c067000 03300000 01000000 e3557900 30360000 0f750001
ffff000103533840 2991891503 S Bi:6:002:1 -115 32768 <
ffff000103533b40 2991898890 C Bi:6:002:1 0 383 = 47010484 00000f80 e6036000 04300000 00000000 3f717900 423c0000 85f6f601
ffff000103533b40 2991898917 S Bi:6:002:1 -115 32768 <
ffff000103533d80 2991899856 C Bi:6:002:1 0 376 = 40010484 00000f80 4f0b6000 04300000 00000000 31757900 443c0000 85fafa01
ffff000103533d80 2991899878 S Bi:6:002:1 -115 32768 <
ffff0001035339c0 2991900656 C Bi:6:002:1 0 351 = 27010484 00000f80 1e056000 04300000 00000000 78787900 403a0000 83efef01
ffff0001035339c0 2991900676 S Bi:6:002:1 -115 32768 <
ffff000103533840 2991902339 C Bi:6:002:1 0 384 = 48010484 00000f80 c3026000 04300000 00000000 c17e7900 443a0000 85f2f201
ffff000103533840 2991902364 S Bi:6:002:1 -115 32768 <
ffff000103533b40 2991909354 C Bi:6:002:1 0 182 = 7e00048c 00000f60 e3057000 00300000 00000000 da977900 443a0000 08760001
ffff000103533b40 2991909388 S Bi:6:002:1 -115 32768 <
ffff000103533d80 2991911432 C Bi:6:002:1 0 202 = 9200048c 00000f60 e4057000 00300000 00000000 6f9f7900 443a0000 0d760001
ffff000103533d80 2991911458 S Bi:6:002:1 -115 32768 <
ffff00014c2bfc00 2991920294 S Ci:6:002:0 s c0 05 004c 0000 0001 1 <
ffff00014c2bfc00 2991920364 C Ci:6:002:0 0 1 = 28
ffff00014c2bfc00 2991920508 S Co:6:002:0 s 40 05 004c 0000 0001 1 = 20
ffff00014c2bfc00 2991920630 C Co:6:002:0 0 1 >
ffff0001035339c0 2991928176 C Bi:6:002:1 0 160 = 6800048c 00000f20 a1087000 03300000 00000000 30e57900 443a0000 24530001
ffff0001035339c0 2991928201 S Bi:6:002:1 -115 32768 <
ffff000103533840 2991928646 C Bi:6:002:1 0 148 = 5c00048c 00000f20 7d067000 03300000 01000000 fbe67900 443a0000 0d750001
ffff000103533840 2991928672 S Bi:6:002:1 -115 32768 <
ffff000103533b40 2991929237 C Bi:6:002:1 0 148 = 5c00048c 00000f20 7e067000 03300000 01000000 4ce97900 443a0000 22750001
ffff000103533b40 2991929260 S Bi:6:002:1 -115 32768 <
ffff000103533d80 2991957926 C Bi:6:002:1 0 697 = 8102048c 00000f20 7f067000 03300000 01000000 c0577a00 38380000 1c750001
ffff000103533d80 2991957954 S Bi:6:002:1 -115 32768 <
ffff0001035339c0 2991959328 C Bi:6:002:1 0 172 = 74000484 00000f80 d0026000 00300000 00000000 7c5b7a00 38380000 0e750001
ffff0001035339c0 2991959354 S Bi:6:002:1 -115 32768 <
ffff000103533840 2991959575 C Bi:6:002:1 0 160 = 6800048c 00000f20 a2087000 03300000 00000000 20607a00 38380000 14530001
ffff000103533840 2991959593 S Bi:6:002:1 -115 32768 <
ffff000103533b40 2991960739 C Bi:6:002:1 0 148 = 5c00048c 00000f20 80067000 03300000 01000000 71647a00 38380000 0c500001
ffff000103533b40 2991960762 S Bi:6:002:1 -115 32768 <
ffff000103533d80 2991961252 C Bi:6:002:1 0 148 = 5c00048c 00000f20 81067000 03300000 01000000 4f667a00 38380000 12760001
ffff000103533d80 2991961276 S Bi:6:002:1 -115 32768 <
ffff0001035339c0 2991962266 C Bi:6:002:1 0 148 = 5c00048c 00000f20 82067000 03300000 01000000 536a7a00 38380000 0b760001
ffff0001035339c0 2991962291 S Bi:6:002:1 -115 32768 <
ffff000103533840 2991963273 C Bi:6:002:1 0 148 = 5c00048c 00000f20 83067000 03300000 01000000 906e7a00 38380000 0c4f0001
ffff000103533840 2991963290 S Bi:6:002:1 -115 32768 <
ffff000103533b40 2991964402 C Bi:6:002:1 0 148 = 5c00048c 00000f20 84067000 03300000 01000000 b0727a00 38380000 11760001
ffff000103533b40 2991964426 S Bi:6:002:1 -115 32768 <
ffff000103533d80 2991965476 C Bi:6:002:1 0 148 = 5c00048c 00000f20 85067000 03300000 01000000 d0767a00 38380000 0c500001
ffff000103533d80 2991965503 S Bi:6:002:1 -115 32768 <
ffff0001035339c0 2991972625 C Bi:6:002:1 0 164 = 6c00048c 00000f20 86067000 03300000 01000000 d3927a00 38380000 0b760001
ffff0001035339c0 2991972649 S Bi:6:002:1 -115 32768 <
ffff000103533840 2992001268 C Bi:6:002:1 0 383 = 47010484 00000f80 e7036000 04300000 00000000 41017b00 443e0000 85f2f201
ffff000103533840 2992001303 S Bi:6:002:1 -115 32768 <
ffff000103533b40 2992003088 C Bi:6:002:1 0 351 = 27010484 00000f80 1f056000 04300000 00000000 7f087b00 463c0000 86fefe01
ffff000103533b40 2992003115 S Bi:6:002:1 -115 32768 <
ffff000103533d80 2992003873 C Bi:6:002:1 0 374 = 3e010484 00000f80 f30f6000 04300000 00000000 870b7b00 40400000 83f5f501
ffff000103533d80 2992003895 S Bi:6:002:1 -115 32768 <
ffff0001035339c0 2992004678 C Bi:6:002:1 0 384 = 48010484 00000f80 c4026000 04300000 00000000 a00e7b00 44400000 83e5e501
ffff0001035339c0 2992004701 S Bi:6:002:1 -115 32768 <
ffff000103533840 2992014404 C Bi:6:002:1 0 248 = c000048c 00000f60 e5057000 00300000 00000000 26307b00 44400000 114f0001
ffff000103533840 2992014430 S Bi:6:002:1 -115 32768 <
ffff000103533b40 2992021508 C Bi:6:002:1 0 310 = fe000484 00000f80 0a0a6000 00300000 00000000 214a7b00 44400000 24500001
ffff000103533b40 2992021543 S Bi:6:002:1 -115 32768 <
ffff000103533d80 2992028604 C Bi:6:002:1 0 249 = c1000484 00000f80 dd0f6000 00300000 00000000 b3677b00 44400000 2b550001
ffff000103533d80 2992028660 S Bi:6:002:1 -115 32768 <
ffff0001035339c0 2992036735 C Bi:6:002:1 0 160 = 6800048c 00000f20 a9087000 03300000 00000000 448d7b00 44400000 19540001
ffff0001035339c0 2992036761 S Bi:6:002:1 -115 32768 <
ffff000103533840 2992037595 C Bi:6:002:1 0 160 = 6800048c 00000f20 a9087000 03300000 00000000 7e907b00 44400000 0f510001
ffff000103533840 2992037621 S Bi:6:002:1 -115 32768 <
ffff000103533b40 2992038235 C Bi:6:002:1 0 160 = 6800048c 00000f20 aa087000 03300000 00000000 0a937b00 44400000 0b520001
ffff000103533b40 2992038259 S Bi:6:002:1 -115 32768 <
ffff000103533d80 2992039950 C Bi:6:002:1 0 148 = 5c00048c 00000f20 87067000 03300000 01000000 ae997b00 44400000 05740001
ffff000103533d80 2992039977 S Bi:6:002:1 -115 32768 <
ffff0001035339c0 2992040870 C Bi:6:002:1 0 148 = 5c00048c 00000f20 88067000 03300000 01000000 709d7b00 44400000 11740001
ffff0001035339c0 2992040897 S Bi:6:002:1 -115 32768 <
ffff000103533840 2992042140 C Bi:6:002:1 0 160 = 6800048c 00000f20 ab087000 03300000 00000000 3ea27b00 44400000 0a520001
ffff000103533840 2992042165 S Bi:6:002:1 -115 32768 <
ffff000103533b40 2992043071 C Bi:6:002:1 0 148 = 5c00048c 00000f20 89067000 03300000 01000000 f7a57b00 44400000 06740001
ffff000103533b40 2992043097 S Bi:6:002:1 -115 32768 <
ffff000103533d80 2992044200 C Bi:6:002:1 0 160 = 6800048c 00000f20 ac087000 03300000 00000000 50aa7b00 44400000 1c520001
ffff000103533d80 2992044228 S Bi:6:002:1 -115 32768 <
ffff0001035339c0 2992044859 C Bi:6:002:1 0 160 = 6800048c 00000f20 ac087000 03300000 00000000 e8ac7b00 44400000 16520001
ffff0001035339c0 2992044885 S Bi:6:002:1 -115 32768 <
ffff000103533840 2992045889 C Bi:6:002:1 0 148 = 5c00048c 00000f20 8a067000 03300000 01000000 f6b07b00 44400000 22740001
ffff000103533840 2992045914 S Bi:6:002:1 -115 32768 <
ffff000103533b40 2992055424 C Bi:6:002:1 0 157 = 6500048c 00000f20 8b067000 03300000 01000000 19d67b00 36380000 0b740001
ffff000103533b40 2992055451 S Bi:6:002:1 -115 32768 <
ffff000103533d80 2992057806 C Bi:6:002:1 0 172 = 74000484 00000f80 d1026000 00300000 00000000 27dc7b00 36380000 08740001
ffff000103533d80 2992057833 S Bi:6:002:1 -115 32768 <
ffff0001035339c0 2992060371 C Bi:6:002:1 0 157 = 6500048c 00000f20 8c067000 03300000 01000000 71e97b00 36380000 03740001
ffff0001035339c0 2992060406 S Bi:6:002:1 -115 32768 <
ffff000103533840 2992066719 C Bi:6:002:1 0 419 = 6b01048c 00000f20 8d067000 03300000 01000000 a5017c00 36380000 20740001
ffff000103533840 2992066743 S Bi:6:002:1 -115 32768 <
ffff00014c2bfc00 2992092318 S Ci:6:002:0 s c0 05 004c 0000 0001 1 <
ffff00014c2bfc00 2992092477 C Ci:6:002:0 0 1 = 20
ffff00014c2bfc00 2992092633 S Co:6:002:0 s 40 05 004c 0000 0001 1 = 28
ffff00014c2bfc00 2992092774 C Co:6:002:0 0 1 >
ffff000103533b40 2992103650 C Bi:6:002:1 0 383 = 47010484 00000f80 e8036000 04300000 00000000 42917c00 443c0000 85f0f001
ffff000103533b40 2992103685 S Bi:6:002:1 -115 32768 <
ffff000103533d80 2992104650 C Bi:6:002:1 0 376 = 40010484 00000f80 510b6000 04300000 00000000 18957c00 443c0000 85f2f201
ffff000103533d80 2992104675 S Bi:6:002:1 -115 32768 <
ffff0001035339c0 2992105447 C Bi:6:002:1 0 351 = 27010484 00000f80 20056000 04300000 00000000 5a987c00 443e0000 85eeee01
ffff0001035339c0 2992105473 S Bi:6:002:1 -115 32768 <
ffff000103533840 2992106256 C Bi:6:002:1 0 374 = 3e010484 00000f80 f40f6000 04300000 00000000 619b7c00 463e0000 81f1f101
ffff000103533840 2992106280 S Bi:6:002:1 -115 32768 <
ffff000103533b40 2992126018 C Bi:6:002:1 0 310 = fe000484 00000f80 0b0a6000 00300000 00000000 22e27c00 463e0000 33510001
ffff000103533b40 2992126049 S Bi:6:002:1 -115 32768 <
ffff000103533d80 2992130848 C Bi:6:002:1 0 249 = c1000484 00000f80 de0f6000 00300000 00000000 16f77c00 463e0000 15540001
ffff000103533d80 2992130904 S Bi:6:002:1 -115 32768 <
ffff0001035339c0 2992166399 C Bi:6:002:1 0 230 = ae00048c 00000f20 8e067000 03300000 01000000 84877d00 463e0000 13740001
ffff0001035339c0 2992166429 S Bi:6:002:1 -115 32768 <
ffff000103533840 2992167281 C Bi:6:002:1 0 230 = ae00048c 00000f20 8e067000 03300000 01000000 ed8a7d00 463e0000 23740001
ffff000103533840 2992167305 S Bi:6:002:1 -115 32768 <
ffff000103533b40 2992206063 C Bi:6:002:1 0 383 = 47010484 00000f80 e9036000 04300000 00000000 44217e00 44360000 86f1f101
ffff000103533b40 2992206088 S Bi:6:002:1 -115 32768 <
ffff000103533d80 2992207084 C Bi:6:002:1 0 376 = 40010484 00000f80 520b6000 04300000 00000000 3e257e00 443c0000 82efef01
ffff000103533d80 2992207109 S Bi:6:002:1 -115 32768 <
ffff0001035339c0 2992207901 C Bi:6:002:1 0 351 = 27010484 00000f80 21056000 04300000 00000000 8f287e00 443e0000 86eded01
ffff0001035339c0 2992207925 S Bi:6:002:1 -115 32768 <
ffff000103533840 2992208734 C Bi:6:002:1 0 374 = 3e010484 00000f80 f50f6000 04300000 00000000 a52b7e00 463a0000 84f7f701
ffff000103533840 2992208758 S Bi:6:002:1 -115 32768 <
ffff000103533b40 2992262344 C Bi:6:002:1 0 172 = 74000484 00000f80 d3026000 00300000 00000000 29fb7e00 36360000 09740001
ffff000103533b40 2992262376 S Bi:6:002:1 -115 32768 <
ffff00014c2bfc00 2992264160 S Ci:6:002:0 s c0 05 004c 0000 0001 1 <
ffff00014c2bfc00 2992264317 C Ci:6:002:0 0 1 = 28
ffff00014c2bfc00 2992264471 S Co:6:002:0 s 40 05 004c 0000 0001 1 = 20
ffff00014c2bfc00 2992264611 C Co:6:002:0 0 1 >
ffff000103533d80 2992266425 C Bi:6:002:1 0 230 = ae00048c 00000f20 8f067000 03300000 01000000 240e7f00 36360000 13740001
ffff000103533d80 2992266451 S Bi:6:002:1 -115 32768 <
ffff0001035339c0 2992308498 C Bi:6:002:1 0 383 = 47010484 00000f80 ea036000 04300000 00000000 45b17f00 423a0000 84f2f201
ffff0001035339c0 2992308525 S Bi:6:002:1 -115 32768 <
ffff000103533840 2992309865 C Bi:6:002:1 0 376 = 40010484 00000f80 530b6000 04300000 00000000 bab67f00 443c0000 85eded01
ffff000103533840 2992309893 S Bi:6:002:1 -115 32768 <
ffff000103533b40 2992311074 C Bi:6:002:1 0 351 = 27010484 00000f80 22056000 04300000 00000000 96bb7f00 443c0000 84fdfd01
ffff000103533b40 2992311098 S Bi:6:002:1 -115 32768 <
ffff000103533d80 2992311847 C Bi:6:002:1 0 374 = 3e010484 00000f80 f60f6000 04300000 00000000 8fbe7f00 443c0000 88f9f901
ffff000103533d80 2992311868 S Bi:6:002:1 -115 32768 <
ffff0001035339c0 2992314363 C Bi:6:002:1 0 384 = 48010484 00000f80 c7026000 04300000 00000000 56c87f00 463a0000 84f2f201
ffff0001035339c0 2992314385 S Bi:6:002:1 -115 32768 <
ffff000103533840 2992335192 C Bi:6:002:1 0 310 = fe000484 00000f80 0d0a6000 00300000 00000000 47138000 38380000 3d500001
ffff000103533840 2992335226 S Bi:6:002:1 -115 32768 <
ffff000103533b40 2992336978 C Bi:6:002:1 0 249 = c1000484 00000f80 e00f6000 00300000 00000000 2e1c8000 38380000 25530001
ffff000103533b40 2992337030 S Bi:6:002:1 -115 32768 <
ffff000103533d80 2992364708 C Bi:6:002:1 0 172 = 74000484 00000f80 d4026000 00300000 00000000 e88a8000 38380000 18750001
ffff000103533d80 2992364733 S Bi:6:002:1 -115 32768 <
ffff0001035339c0 2992392305 C Bi:6:002:1 0 160 = 6800048c 00000f20 ae087000 03300000 00000000 2cfa8000 38380000 13530001
ffff0001035339c0 2992392332 S Bi:6:002:1 -115 32768 <
ffff000103533840 2992392906 C Bi:6:002:1 0 160 = 6800048c 00000f20 af087000 03300000 00000000 7afc8000 38380000 1c520001
ffff000103533840 2992392931 S Bi:6:002:1 -115 32768 <
ffff000103533b40 2992393354 C Bi:6:002:1 0 148 = 5c00048c 00000f20 90067000 03300000 01000000 46fe8000 38380000 094f0001
ffff000103533b40 2992393378 S Bi:6:002:1 -115 32768 <
ffff000103533d80 2992393817 C Bi:6:002:1 0 148 = 5c00048c 00000f20 91067000 03300000 01000000 11008100 38380000 0e750001
ffff000103533d80 2992393839 S Bi:6:002:1 -115 32768 <
ffff0001035339c0 2992394928 C Bi:6:002:1 0 148 = 5c00048c 00000f20 92067000 03300000 01000000 69048100 38380000 16760001
ffff0001035339c0 2992394951 S Bi:6:002:1 -115 32768 <
ffff000103533840 2992395535 C Bi:6:002:1 0 160 = 6800048c 00000f20 b1087000 03300000 00000000 bf068100 38380000 18530001
ffff000103533840 2992395560 S Bi:6:002:1 -115 32768 <
ffff000103533b40 2992395994 C Bi:6:002:1 0 148 = 5c00048c 00000f20 93067000 03300000 01000000 94088100 38380000 0a760001
ffff000103533b40 2992396018 S Bi:6:002:1 -115 32768 <
ffff000103533d80 2992402937 C Bi:6:002:1 0 681 = 7102048c 00000f20 94067000 03300000 01000000 26228100 38380000 0b4f0001
ffff000103533d80 2992402961 S Bi:6:002:1 -115 32768 <
ffff0001035339c0 2992410878 C Bi:6:002:1 0 383 = 47010484 00000f80 eb036000 04300000 00000000 47418100 443e0000 85fcfc01
ffff0001035339c0 2992410903 S Bi:6:002:1 -115 32768 <
ffff000103533840 2992411888 C Bi:6:002:1 0 376 = 40010484 00000f80 540b6000 04300000 00000000 57458100 44400000 88f4f401
ffff000103533840 2992411910 S Bi:6:002:1 -115 32768 <
ffff000103533b40 2992412758 C Bi:6:002:1 0 351 = 27010484 00000f80 23056000 04300000 00000000 e1488100 403a0000 86f5f501
ffff000103533b40 2992412780 S Bi:6:002:1 -115 32768 <
ffff000103533d80 2992413625 C Bi:6:002:1 0 374 = 3e010484 00000f80 f70f6000 04300000 00000000 0d4c8100 443a0000 87f0f001
ffff000103533d80 2992413652 S Bi:6:002:1 -115 32768 <
ffff00014c2bfc00 2992436271 S Ci:6:002:0 s c0 05 004c 0000 0001 1 <
ffff00014c2bfc00 2992436419 C Ci:6:002:0 0 1 = 20
ffff00014c2bfc00 2992436571 S Co:6:002:0 s 40 05 004c 0000 0001 1 = 28
ffff00014c2bfc00 2992436717 C Co:6:002:0 0 1 >
ffff0001035339c0 2992440967 C Bi:6:002:1 0 160 = 6800048c 00000f20 b2087000 02300000 00000000 fab78100 463c0000 10500001
ffff0001035339c0 2992441019 S Bi:6:002:1 -115 32768 <
ffff000103533840 2992441755 C Bi:6:002:1 0 160 = 6800048c 00000f20 b2087000 02300000 00000000 02bb8100 463c0000 0d500001
ffff000103533840 2992441780 S Bi:6:002:1 -115 32768 <
ffff000103533b40 2992444878 C Bi:6:002:1 0 160 = 6800048c 00000f20 b2087000 01300000 00000000 05c68100 463c0000 0f760001
ffff000103533b40 2992444904 S Bi:6:002:1 -115 32768 <
ffff000103533d80 2992445381 C Bi:6:002:1 0 148 = 5c00048c 00000f20 95067000 03300000 01000000 7ec98100 463c0000 16750001
ffff000103533d80 2992445409 S Bi:6:002:1 -115 32768 <
ffff0001035339c0 2992445979 C Bi:6:002:1 0 160 = 6800048c 00000f20 b3087000 03300000 00000000 cecb8100 463c0000 0c500001
ffff0001035339c0 2992446003 S Bi:6:002:1 -115 32768 <
ffff000103533840 2992447204 C Bi:6:002:1 0 148 = 5c00048c 00000f20 96067000 03300000 01000000 9ed08100 463c0000 09760001
ffff000103533840 2992447230 S Bi:6:002:1 -115 32768 <
ffff000103533b40 2992467040 C Bi:6:002:1 0 172 = 74000484 00000f80 d5026000 00300000 00000000 ab1a8200 463c0000 05750001
ffff000103533b40 2992467066 S Bi:6:002:1 -115 32768 <
ffff000103533d80 2992470057 C Bi:6:002:1 0 160 = 6800048c 00000f20 b4087000 03300000 00000000 d7298200 463c0000 11510001
ffff000103533d80 2992470084 S Bi:6:002:1 -115 32768 <
ffff0001035339c0 2992470522 C Bi:6:002:1 0 148 = 5c00048c 00000f20 97067000 03300000 01000000 b42b8200 463c0000 14740001
ffff0001035339c0 2992470549 S Bi:6:002:1 -115 32768 <
ffff000103533840 2992471149 C Bi:6:002:1 0 160 = 6800048c 00000f20 b5087000 03300000 00000000 1d2e8200 463c0000 25500001
ffff000103533840 2992471172 S Bi:6:002:1 -115 32768 <
ffff000103533b40 2992471763 C Bi:6:002:1 0 160 = 6800048c 00000f20 b6087000 03300000 00000000 98308200 463c0000 0a770001
ffff000103533b40 2992471786 S Bi:6:002:1 -115 32768 <
ffff000103533d80 2992472373 C Bi:6:002:1 0 160 = 6800048c 00000f20 b7087000 03300000 00000000 f8328200 463c0000 0e750001
ffff000103533d80 2992472396 S Bi:6:002:1 -115 32768 <
ffff0001035339c0 2992472875 C Bi:6:002:1 0 148 = 5c00048c 00000f20 98067000 03300000 01000000 de348200 463c0000 0b500001
ffff0001035339c0 2992472901 S Bi:6:002:1 -115 32768 <
ffff000103533840 2992473485 C Bi:6:002:1 0 160 = 6800048c 00000f20 b8087000 03300000 00000000 3e378200 463c0000 0d500001
ffff000103533840 2992473508 S Bi:6:002:1 -115 32768 <
ffff000103533b40 2992473960 C Bi:6:002:1 0 148 = 5c00048c 00000f20 99067000 03300000 01000000 24398200 463c0000 0c760001
ffff000103533b40 2992473981 S Bi:6:002:1 -115 32768 <
ffff000103533d80 2992474387 C Bi:6:002:1 0 148 = 5c00048c 00000f20 9a067000 03300000 01000000 e63a8200 463c0000 0d760001
ffff000103533d80 2992474407 S Bi:6:002:1 -115 32768 <
ffff0001035339c0 2992474828 C Bi:6:002:1 0 148 = 5c00048c 00000f20 9b067000 03300000 01000000 963c8200 463c0000 0c500001
ffff0001035339c0 2992474848 S Bi:6:002:1 -115 32768 <
ffff000103533840 2992475455 C Bi:6:002:1 0 160 = 6800048c 00000f20 b9087000 03300000 00000000 f63e8200 463c0000 0f500001
ffff000103533840 2992475475 S Bi:6:002:1 -115 32768 <
ffff000103533b40 2992475903 C Bi:6:002:1 0 148 = 5c00048c 00000f20 9c067000 03300000 01000000 d3408200 463c0000 17750001
ffff000103533b40 2992475923 S Bi:6:002:1 -115 32768 <
ffff000103533d80 2992482525 C Bi:6:002:1 0 354 = 2a01048c 00000f20 9d067000 03300000 01000000 e5598200 463c0000 0a750001
ffff000103533d80 2992482555 S Bi:6:002:1 -115 32768 <
ffff0001035339c0 2992513269 C Bi:6:002:1 0 383 = 47010484 00000f80 ec036000 04300000 00000000 48d18200 443c0000 86f0f001
ffff0001035339c0 2992513298 S Bi:6:002:1 -115 32768 <
ffff000103533840 2992514175 C Bi:6:002:1 0 376 = 40010484 00000f80 550b6000 04300000 00000000 d0d48200 42380000 86ffff01
ffff000103533840 2992514202 S Bi:6:002:1 -115 32768 <
ffff000103533b40 2992514978 C Bi:6:002:1 0 351 = 27010484 00000f80 24056000 04300000 00000000 0ad88200 443c0000 87f9f901
ffff000103533b40 2992515002 S Bi:6:002:1 -115 32768 <
ffff000103533d80 2992515755 C Bi:6:002:1 0 374 = 3e010484 00000f80 f80f6000 04300000 00000000 14db8200 403a0000 84f1f101
ffff000103533d80 2992515776 S Bi:6:002:1 -115 32768 <
ffff0001035339c0 2992516588 C Bi:6:002:1 0 384 = 48010484 00000f80 c9026000 04300000 00000000 48de8200 3e3a0000 84f7f701
ffff0001035339c0 2992516609 S Bi:6:002:1 -115 32768 <
ffff000103533840 2992540564 C Bi:6:002:1 0 249 = c1000484 00000f80 e20f6000 00300000 00000000 6b378300 3e3a0000 30530001
ffff000103533840 2992540597 S Bi:6:002:1 -115 32768 <
ffff000103533b40 2992543767 C Bi:6:002:1 0 310 = fe000484 00000f80 0f0a6000 00300000 00000000 25428300 3e3a0000 3d500001
ffff000103533b40 2992543792 S Bi:6:002:1 -115 32768 <
ffff000103533d80 2992547947 C Bi:6:002:1 0 160 = 6800048c 00000f20 ba087000 03300000 00000000 035a8300 3e3a0000 15510001
ffff000103533d80 2992548003 S Bi:6:002:1 -115 32768 <
ffff0001035339c0 2992548526 C Bi:6:002:1 0 160 = 6800048c 00000f20 bb087000 03300000 00000000 745c8300 3e3a0000 0e500001
ffff0001035339c0 2992548552 S Bi:6:002:1 -115 32768 <
ffff000103533840 2992549838 C Bi:6:002:1 0 148 = 5c00048c 00000f20 9e067000 03300000 01000000 9a618300 3e3a0000 18500001
ffff000103533840 2992549866 S Bi:6:002:1 -115 32768 <
ffff000103533b40 2992550510 C Bi:6:002:1 0 160 = 6800048c 00000f20 bc087000 03300000 00000000 7d648300 3e3a0000 08500001
ffff000103533b40 2992550528 S Bi:6:002:1 -115 32768 <
ffff000103533d80 2992551061 C Bi:6:002:1 0 148 = 5c00048c 00000f20 9f067000 03300000 01000000 ab668300 3e3a0000 18500001
ffff000103533d80 2992551081 S Bi:6:002:1 -115 32768 <
ffff0001035339c0 2992551511 C Bi:6:002:1 0 148 = 5c00048c 00000f20 a0067000 03300000 01000000 6d688300 3e3a0000 1d500001
ffff0001035339c0 2992551528 S Bi:6:002:1 -115 32768 <
ffff000103533840 2992552128 C Bi:6:002:1 0 160 = 6800048c 00000f20 bd087000 03300000 00000000 b36a8300 3e3a0000 15510001
ffff000103533840 2992552142 S Bi:6:002:1 -115 32768 <
ffff000103533b40 2992553027 C Bi:6:002:1 0 148 = 5c00048c 00000f20 a1067000 03300000 01000000 5e6e8300 3e3a0000 0d500001
ffff000103533b40 2992553040 S Bi:6:002:1 -115 32768 <
ffff000103533d80 2992566393 C Bi:6:002:1 0 230 = ae00048c 00000f20 a2067000 03300000 01000000 0ba28300 3e3a0000 16500001
ffff000103533d80 2992566415 S Bi:6:002:1 -115 32768 <
ffff0001035339c0 2992569345 C Bi:6:002:1 0 172 = 74000484 00000f80 d6026000 00300000 00000000 7eaa8300 3e3a0000 14510001
ffff0001035339c0 2992569362 S Bi:6:002:1 -115 32768 <
ffff0001035333c0 2992584540 S Ci:6:002:0 s c0 05 0454 0000 0001 1 <
ffff0001035333c0 2992584693 C Ci:6:002:0 0 1 = 00
ffff0001035333c0 2992584738 S Ci:6:002:0 s c0 05 0860 0000 0004 4 <
ffff0001035333c0 2992584834 C Ci:6:002:0 0 4 = 21c3d572
ffff0001035333c0 2992584870 S Co:6:002:0 s 40 05 0860 0000 0004 4 = 21c3d572
ffff0001035333c0 2992584959 C Co:6:002:0 0 4 >
ffff0001035333c0 2992584993 S Ci:6:002:0 s c0 05 0c00 0000 0004 4 <
ffff0001035333c0 2992585085 C Ci:6:002:0 0 4 = 07000000
ffff0001035333c0 2992585120 S Ci:6:002:0 s c0 05 08b0 0000 0004 4 <
ffff0001035333c0 2992585213 C Ci:6:002:0 0 4 = 42060000
ffff0001035333c0 2992585247 S Co:6:002:0 s 40 05 08b0 0000 0004 4 = 18060000
ffff0001035333c0 2992585414 C Co:6:002:0 0 4 >
ffff0001035333c0 2992585469 S Ci:6:002:0 s c0 05 0d04 0000 0004 4 <
ffff0001035333c0 2992585572 C Ci:6:002:0 0 4 = 017c90b1
ffff0001035333c0 2992585607 S Co:6:002:0 s 40 05 0c90 0000 0004 4 = 017c8001
ffff0001035333c0 2992585694 C Co:6:002:0 0 4 >
ffff0001035333c0 2992585781 S Ci:6:002:0 s c0 05 08ac 0000 0004 4 <
ffff0001035333c0 2992585884 C Ci:6:002:0 0 4 = 08faf00f
ffff0001035333c0 2992585918 S Co:6:002:0 s 40 05 08ac 0000 0004 4 = 08faf00f
ffff0001035333c0 2992586005 C Co:6:002:0 0 4 >
ffff0001035333c0 2992586038 S Ci:6:002:0 s c0 05 08ac 0000 0004 4 <
ffff0001035333c0 2992586130 C Ci:6:002:0 0 4 = 08faf00f
ffff0001035333c0 2992586164 S Co:6:002:0 s 40 05 08ac 0000 0004 4 = 08faf00f
ffff0001035333c0 2992586251 C Co:6:002:0 0 4 >
ffff0001035333c0 2992586285 S Ci:6:002:0 s c0 05 08c4 0000 0004 4 <
ffff0001035333c0 2992586377 C Ci:6:002:0 0 4 = 00000000
ffff0001035333c0 2992586411 S Co:6:002:0 s 40 05 08c4 0000 0004 4 = 00000000
ffff0001035333c0 2992586499 C Co:6:002:0 0 4 >
ffff0001035333c0 2992586533 S Ci:6:002:0 s c0 05 0c00 0000 0004 4 <
ffff0001035333c0 2992586625 C Ci:6:002:0 0 4 = 07000000
ffff0001035333c0 2992586659 S Ci:6:002:0 s c0 05 08b0 0000 0004 4 <
ffff0001035333c0 2992586751 C Ci:6:002:0 0 4 = 18060000
ffff0001035333c0 2992586784 S Co:6:002:0 s 40 05 08b0 0000 0004 4 = 18060000
ffff0001035333c0 2992586872 C Co:6:002:0 0 4 >
ffff0001035333c0 2992586927 S Ci:6:002:0 s c0 05 0d04 0000 0004 4 <
ffff0001035333c0 2992587030 C Ci:6:002:0 0 4 = 017c90b1
ffff0001035333c0 2992587064 S Co:6:002:0 s 40 05 0c90 0000 0004 4 = 017c8001
ffff0001035333c0 2992587150 C Co:6:002:0 0 4 >
ffff0001035333c0 2992587197 S Ci:6:002:0 s c0 05 0e00 0000 0004 4 <
ffff0001035333c0 2992587309 C Ci:6:002:0 0 4 = 07000000
ffff0001035333c0 2992587343 S Ci:6:002:0 s c0 05 08b0 0000 0004 4 <
ffff0001035333c0 2992587435 C Ci:6:002:0 0 4 = 18060000
ffff0001035333c0 2992587469 S Co:6:002:0 s 40 05 08b0 0000 0004 4 = 18060000
ffff0001035333c0 2992587557 C Co:6:002:0 0 4 >
ffff0001035333c0 2992587611 S Ci:6:002:0 s c0 05 0d44 0000 0004 4 <
ffff0001035333c0 2992587714 C Ci:6:002:0 0 4 = 017c90b1
ffff0001035333c0 2992587747 S Co:6:002:0 s 40 05 0e90 0000 0004 4 = 017c8001
ffff0001035333c0 2992587835 C Co:6:002:0 0 4 >
ffff0001035333c0 2992587881 S Ci:6:002:0 s c0 05 08ac 0000 0004 4 <
ffff0001035333c0 2992587984 C Ci:6:002:0 0 4 = 08faf00f
ffff0001035333c0 2992588137 S Co:6:002:0 s 40 05 08ac 0000 0004 4 = 08faf00f
ffff0001035333c0 2992588231 C Co:6:002:0 0 4 >
ffff0001035333c0 2992588267 S Ci:6:002:0 s c0 05 08ac 0000 0004 4 <
ffff0001035333c0 2992588384 C Ci:6:002:0 0 4 = 08faf00f
ffff0001035333c0 2992588423 S Co:6:002:0 s 40 05 08ac 0000 0004 4 = 08faf00f
ffff0001035333c0 2992588525 C Co:6:002:0 0 4 >
ffff0001035333c0 2992588566 S Ci:6:002:0 s c0 05 08c4 0000 0004 4 <
ffff0001035333c0 2992588678 C Ci:6:002:0 0 4 = 00000000
ffff0001035333c0 2992588723 S Co:6:002:0 s 40 05 08c4 0000 0004 4 = 00000000
ffff0001035333c0 2992588829 C Co:6:002:0 0 4 >
ffff0001035333c0 2992588876 S Ci:6:002:0 s c0 05 0e00 0000 0004 4 <
ffff0001035333c0 2992588997 C Ci:6:002:0 0 4 = 07000000
ffff0001035333c0 2992589042 S Ci:6:002:0 s c0 05 08b0 0000 0004 4 <
ffff0001035333c0 2992589152 C Ci:6:002:0 0 4 = 18060000
ffff0001035333c0 2992589199 S Co:6:002:0 s 40 05 08b0 0000 0004 4 = 18060000
ffff0001035333c0 2992589321 C Co:6:002:0 0 4 >
ffff0001035333c0 2992589386 S Ci:6:002:0 s c0 05 0d44 0000 0004 4 <
ffff0001035333c0 2992589505 C Ci:6:002:0 0 4 = 017c90b1
ffff0001035333c0 2992589550 S Co:6:002:0 s 40 05 0e90 0000 0004 4 = 017c8001
ffff0001035333c0 2992589656 C Co:6:002:0 0 4 >
ffff0001035333c0 2992589715 S Ci:6:002:0 s c0 05 0668 0000 0002 2 <
ffff0001035333c0 2992589834 C Ci:6:002:0 0 2 = 0010
ffff0001035333c0 2992589880 S Co:6:002:0 s 40 05 0668 0000 0002 2 = 0010
ffff0001035333c0 2992589985 C Co:6:002:0 0 2 >
ffff0001035333c0 2992590032 S Co:6:002:0 s 40 05 0483 0000 0001 1 = 00
ffff0001035333c0 2992590145 C Co:6:002:0 0 1 >
ffff0001035333c0 2992590190 S Ci:6:002:0 s c0 05 0837 0000 0001 1 <
ffff0001035333c0 2992590300 C Ci:6:002:0 0 1 = 00
ffff0001035333c0 2992590346 S Ci:6:002:0 s c0 05 08ac 0000 0004 4 <
ffff0001035333c0 2992590465 C Ci:6:002:0 0 4 = 08faf00f
ffff0001035333c0 2992590509 S Co:6:002:0 s 40 05 08ac 0000 0004 4 = 08faf00f
ffff0001035333c0 2992590616 C Co:6:002:0 0 4 >
ffff0001035333c0 2992590663 S Ci:6:002:0 s c0 05 08c4 0000 0004 4 <
ffff0001035333c0 2992590782 C Ci:6:002:0 0 4 = 00000000
ffff0001035333c0 2992590827 S Co:6:002:0 s 40 05 08c4 0000 0004 4 = 00000000
ffff0001035333c0 2992590946 C Co:6:002:0 0 4 >
ffff0001035333c0 2992590992 S Ci:6:002:0 s c0 05 0848 0000 0004 4 <
ffff0001035333c0 2992591111 C Ci:6:002:0 0 4 = 8bffd061
ffff0001035333c0 2992591157 S Co:6:002:0 s 40 05 0848 0000 0004 4 = 8bffd061
ffff0001035333c0 2992591262 C Co:6:002:0 0 4 >
ffff0001035333c0 2992591309 S Ci:6:002:0 s c0 05 08ac 0000 0004 4 <
ffff0001035333c0 2992591446 C Ci:6:002:0 0 4 = 08faf00f
ffff0001035333c0 2992591491 S Co:6:002:0 s 40 05 08ac 0000 0004 4 = 08faf00f
ffff0001035333c0 2992591597 C Co:6:002:0 0 4 >
ffff0001035333c0 2992591644 S Ci:6:002:0 s c0 05 08ac 0000 0004 4 <
ffff0001035333c0 2992591763 C Ci:6:002:0 0 4 = 08faf00f
ffff0001035333c0 2992591809 S Co:6:002:0 s 40 05 08ac 0000 0004 4 = 08faf00f
ffff0001035333c0 2992591914 C Co:6:002:0 0 4 >
ffff0001035333c0 2992591960 S Ci:6:002:0 s c0 05 08c4 0000 0004 4 <
ffff0001035333c0 2992592083 C Ci:6:002:0 0 4 = 00000000
ffff0001035333c0 2992592130 S Co:6:002:0 s 40 05 08c4 0000 0004 4 = 00000000
ffff0001035333c0 2992592235 C Co:6:002:0 0 4 >
ffff0001035333c0 2992592283 S Ci:6:002:0 s c0 05 0c00 0000 0004 4 <
ffff0001035333c0 2992592402 C Ci:6:002:0 0 4 = 07000000
ffff0001035333c0 2992592447 S Ci:6:002:0 s c0 05 08b0 0000 0004 4 <
ffff0001035333c0 2992592572 C Ci:6:002:0 0 4 = 18060000
ffff0001035333c0 2992592618 S Co:6:002:0 s 40 05 08b0 0000 0004 4 = 18060000
ffff0001035333c0 2992592732 C Co:6:002:0 0 4 >
ffff0001035333c0 2992592797 S Ci:6:002:0 s c0 05 0d04 0000 0004 4 <
ffff0001035333c0 2992592915 C Ci:6:002:0 0 4 = 017c90b1
ffff0001035333c0 2992592961 S Co:6:002:0 s 40 05 0c90 0000 0004 4 = 017c8001
ffff0001035333c0 2992593072 C Co:6:002:0 0 4 >
ffff0001035333c0 2992593132 S Ci:6:002:0 s c0 05 0e00 0000 0004 4 <
ffff0001035333c0 2992593251 C Ci:6:002:0 0 4 = 07000000
ffff0001035333c0 2992593296 S Ci:6:002:0 s c0 05 08b0 0000 0004 4 <
ffff0001035333c0 2992593407 C Ci:6:002:0 0 4 = 18060000
ffff0001035333c0 2992593451 S Co:6:002:0 s 40 05 08b0 0000 0004 4 = 18060000
ffff0001035333c0 2992593569 C Co:6:002:0 0 4 >
ffff0001035333c0 2992593637 S Ci:6:002:0 s c0 05 0d44 0000 0004 4 <
ffff0001035333c0 2992593756 C Ci:6:002:0 0 4 = 017c90b1
ffff0001035333c0 2992593801 S Co:6:002:0 s 40 05 0e90 0000 0004 4 = 017c8001
ffff0001035333c0 2992593908 C Co:6:002:0 0 4 >
ffff0001035333c0 2992593990 S Ci:6:002:0 s c0 05 0c20 0000 0004 4 <
ffff0001035333c0 2992594110 C Ci:6:002:0 0 4 = 13131313
ffff0001035333c0 2992594155 S Co:6:002:0 s 40 05 0c20 0000 0004 4 = 13131313
ffff0001035333c0 2992594261 C Co:6:002:0 0 4 >
ffff0001035333c0 2992594309 S Ci:6:002:0 s c0 05 0c24 0000 0004 4 <
ffff0001035333c0 2992594447 C Ci:6:002:0 0 4 = 20202020
ffff0001035333c0 2992594493 S Co:6:002:0 s 40 05 0c24 0000 0004 4 = 20202020
ffff0001035333c0 2992594599 C Co:6:002:0 0 4 >
ffff0001035333c0 2992594646 S Ci:6:002:0 s c0 05 0c28 0000 0004 4 <
ffff0001035333c0 2992594769 C Ci:6:002:0 0 4 = 20201e1c
ffff0001035333c0 2992594814 S Co:6:002:0 s 40 05 0c28 0000 0004 4 = 20201e1c
ffff0001035333c0 2992594920 C Co:6:002:0 0 4 >
ffff0001035333c0 2992594967 S Ci:6:002:0 s c0 05 0c2c 0000 0004 4 <
ffff0001035333c0 2992595086 C Ci:6:002:0 0 4 = 20202020
ffff0001035333c0 2992595133 S Co:6:002:0 s 40 05 0c2c 0000 0004 4 = 20202020
ffff0001035333c0 2992595239 C Co:6:002:0 0 4 >
ffff0001035333c0 2992595286 S Ci:6:002:0 s c0 05 0c30 0000 0004 4 <
ffff0001035333c0 2992595406 C Ci:6:002:0 0 4 = 20201e1c
ffff0001035333c0 2992595452 S Co:6:002:0 s 40 05 0c30 0000 0004 4 = 20201e1c
ffff0001035333c0 2992595571 C Co:6:002:0 0 4 >
ffff0001035333c0 2992595618 S Ci:6:002:0 s c0 05 0c34 0000 0004 4 <
ffff0001035333c0 2992595738 C Ci:6:002:0 0 4 = 20202020
ffff0001035333c0 2992595783 S Co:6:002:0 s 40 05 0c34 0000 0004 4 = 20202020
ffff0001035333c0 2992595889 C Co:6:002:0 0 4 >
ffff0001035333c0 2992595936 S Ci:6:002:0 s c0 05 0c38 0000 0004 4 <
ffff0001035333c0 2992596076 C Ci:6:002:0 0 4 = 201e1c1a
ffff0001035333c0 2992596130 S Co:6:002:0 s 40 05 0c38 0000 0004 4 = 201e1c1a
ffff0001035333c0 2992596234 C Co:6:002:0 0 4 >
ffff0001035333c0 2992596281 S Ci:6:002:0 s c0 05 0c3c 0000 0004 4 <
ffff0001035333c0 2992596402 C Ci:6:002:0 0 4 = 20202020
ffff0001035333c0 2992596448 S Co:6:002:0 s 40 05 0c3c 0000 0004 4 = 20202020
ffff0001035333c0 2992596564 C Co:6:002:0 0 4 >
ffff0001035333c0 2992596610 S Ci:6:002:0 s c0 05 0c40 0000 0004 4 <
ffff0001035333c0 2992596731 C Ci:6:002:0 0 4 = 20201e1c
ffff0001035333c0 2992596776 S Co:6:002:0 s 40 05 0c40 0000 0004 4 = 20201e1c
ffff0001035333c0 2992596883 C Co:6:002:0 0 4 >
ffff0001035333c0 2992596929 S Ci:6:002:0 s c0 05 0c44 0000 0004 4 <
ffff0001035333c0 2992597049 C Ci:6:002:0 0 4 = 1a181e1e
ffff0001035333c0 2992597095 S Co:6:002:0 s 40 05 0c44 0000 0004 4 = 1a181e1e
ffff0001035333c0 2992597200 C Co:6:002:0 0 4 >
ffff0001035333c0 2992597247 S Ci:6:002:0 s c0 05 0c48 0000 0004 4 <
ffff0001035333c0 2992597367 C Ci:6:002:0 0 4 = 1e1e1e1e
ffff0001035333c0 2992597412 S Co:6:002:0 s 40 05 0c48 0000 0004 4 = 1e1e1e1e
ffff0001035333c0 2992597518 C Co:6:002:0 0 4 >
ffff0001035333c0 2992597565 S Ci:6:002:0 s c0 05 0c4c 0000 0004 4 <
ffff0001035333c0 2992597701 C Ci:6:002:0 0 4 = 1c1a1816
ffff0001035333c0 2992597746 S Co:6:002:0 s 40 05 0c4c 0000 0004 4 = 1c1a1816
ffff0001035333c0 2992597852 C Co:6:002:0 0 4 >
ffff0001035333c0 2992597899 S Ci:6:002:0 s c0 05 0c54 0000 0004 4 <
ffff0001035333c0 2992598019 C Ci:6:002:0 0 4 = 120a0400
ffff0001035333c0 2992598064 S Co:6:002:0 s 40 05 0c54 0000 0004 4 = 120a0400
ffff0001035333c0 2992598170 C Co:6:002:0 0 4 >
ffff0001035333c0 2992598217 S Ci:6:002:0 s c0 05 0e20 0000 0004 4 <
ffff0001035333c0 2992598337 C Ci:6:002:0 0 4 = 14141414
ffff0001035333c0 2992598382 S Co:6:002:0 s 40 05 0e20 0000 0004 4 = 14141414
ffff0001035333c0 2992598488 C Co:6:002:0 0 4 >
ffff0001035333c0 2992598534 S Ci:6:002:0 s c0 05 0e24 0000 0004 4 <
ffff0001035333c0 2992598655 C Ci:6:002:0 0 4 = 1d1d1d1d
ffff0001035333c0 2992598701 S Co:6:002:0 s 40 05 0e24 0000 0004 4 = 1d1d1d1d
ffff0001035333c0 2992598819 C Co:6:002:0 0 4 >
ffff0001035333c0 2992598866 S Ci:6:002:0 s c0 05 0e28 0000 0004 4 <
ffff0001035333c0 2992598986 C Ci:6:002:0 0 4 = 1d1d1b19
ffff0001035333c0 2992599031 S Co:6:002:0 s 40 05 0e28 0000 0004 4 = 1d1d1b19
ffff0001035333c0 2992599137 C Co:6:002:0 0 4 >
ffff0001035333c0 2992599183 S Ci:6:002:0 s c0 05 0e2c 0000 0004 4 <
ffff0001035333c0 2992599323 C Ci:6:002:0 0 4 = 1f1f1f1f
ffff0001035333c0 2992599368 S Co:6:002:0 s 40 05 0e2c 0000 0004 4 = 1f1f1f1f
ffff0001035333c0 2992599475 C Co:6:002:0 0 4 >
ffff0001035333c0 2992599521 S Ci:6:002:0 s c0 05 0e30 0000 0004 4 <
ffff0001035333c0 2992599642 C Ci:6:002:0 0 4 = 1f1f1d1b
ffff0001035333c0 2992599687 S Co:6:002:0 s 40 05 0e30 0000 0004 4 = 1f1f1d1b
ffff0001035333c0 2992599794 C Co:6:002:0 0 4 >
ffff0001035333c0 2992599841 S Ci:6:002:0 s c0 05 0e34 0000 0004 4 <
ffff0001035333c0 2992599961 C Ci:6:002:0 0 4 = 1f1f1f1f
ffff0001035333c0 2992600018 S Co:6:002:0 s 40 05 0e34 0000 0004 4 = 1f1f1f1f
ffff0001035333c0 2992600086 C Co:6:002:0 0 4 >
ffff0001035333c0 2992600125 S Ci:6:002:0 s c0 05 0e38 0000 0004 4 <
ffff0001035333c0 2992600249 C Ci:6:002:0 0 4 = 1f1d1b19
ffff0001035333c0 2992600296 S Co:6:002:0 s 40 05 0e38 0000 0004 4 = 1f1d1b19
ffff0001035333c0 2992600402 C Co:6:002:0 0 4 >
ffff0001035333c0 2992600448 S Ci:6:002:0 s c0 05 0e3c 0000 0004 4 <
ffff0001035333c0 2992600576 C Ci:6:002:0 0 4 = 1f1f1f1f
ffff0001035333c0 2992600622 S Co:6:002:0 s 40 05 0e3c 0000 0004 4 = 1f1f1f1f
ffff0001035333c0 2992600728 C Co:6:002:0 0 4 >
ffff0001035333c0 2992600774 S Ci:6:002:0 s c0 05 0e40 0000 0004 4 <
ffff0001035333c0 2992600895 C Ci:6:002:0 0 4 = 1f1f1d1b
ffff0001035333c0 2992600941 S Co:6:002:0 s 40 05 0e40 0000 0004 4 = 1f1f1d1b
ffff0001035333c0 2992601047 C Co:6:002:0 0 4 >
ffff0001035333c0 2992601093 S Ci:6:002:0 s c0 05 0e44 0000 0004 4 <
ffff0001035333c0 2992601213 C Ci:6:002:0 0 4 = 19171d1d
ffff0001035333c0 2992601258 S Co:6:002:0 s 40 05 0e44 0000 0004 4 = 19171d1d
ffff0001035333c0 2992601365 C Co:6:002:0 0 4 >
ffff0001035333c0 2992601411 S Ci:6:002:0 s c0 05 0e48 0000 0004 4 <
ffff0001035333c0 2992601530 C Ci:6:002:0 0 4 = 1d1d1d1d
ffff0001035333c0 2992601575 S Co:6:002:0 s 40 05 0e48 0000 0004 4 = 1d1d1d1d
ffff0001035333c0 2992601694 C Co:6:002:0 0 4 >
ffff0001035333c0 2992601740 S Ci:6:002:0 s c0 05 0e4c 0000 0004 4 <
ffff0001035333c0 2992601857 C Ci:6:002:0 0 4 = 1b191715
ffff0001035333c0 2992601903 S Co:6:002:0 s 40 05 0e4c 0000 0004 4 = 1b191715
ffff0001035333c0 2992602008 C Co:6:002:0 0 4 >
ffff0001035333c0 2992602055 S Ci:6:002:0 s c0 05 0e54 0000 0004 4 <
ffff0001035333c0 2992602173 C Ci:6:002:0 0 4 = 11090300
ffff0001035333c0 2992602218 S Co:6:002:0 s 40 05 0e54 0000 0004 4 = 11090300
ffff0001035333c0 2992602324 C Co:6:002:0 0 4 >
ffff0001035333c0 2992602385 S Ci:6:002:0 s c0 05 0454 0000 0001 1 <
ffff0001035333c0 2992602508 C Ci:6:002:0 0 1 = 00
ffff0001035333c0 2992602554 S Ci:6:002:0 s c0 05 0454 0000 0001 1 <
ffff0001035333c0 2992602662 C Ci:6:002:0 0 1 = 00
ffff0001035333c0 2992602707 S Co:6:002:0 s 40 05 0454 0000 0001 1 = 80
ffff0001035333c0 2992602822 C Co:6:002:0 0 1 >
ffff0001035333c0 2992602869 S Ci:6:002:0 s c0 05 041a 0000 0002 2 <
ffff0001035333c0 2992602987 C Ci:6:002:0 0 2 = ff0f
ffff0001035333c0 2992603033 S Ci:6:002:0 s c0 05 0808 0000 0004 4 <
ffff0001035333c0 2992603142 C Ci:6:002:0 0 4 = 3382023e
ffff0001035333c0 2992603188 S Co:6:002:0 s 40 05 0808 0000 0004 4 = 3382023e
ffff0001035333c0 2992603319 C Co:6:002:0 0 4 >
ffff0001035333c0 2992603364 S Ci:6:002:0 s c0 05 0834 0000 0004 4 <
ffff0001035333c0 2992603474 C Ci:6:002:0 0 4 = 05a73700
ffff0001035333c0 2992603520 S Co:6:002:0 s 40 05 0834 0000 0004 4 = 06a73700
ffff0001035333c0 2992603634 C Co:6:002:0 0 4 >
ffff0001035333c0 2992603679 S Ci:6:002:0 s c0 05 0830 0000 0004 4 <
ffff0001035333c0 2992603789 C Ci:6:002:0 0 4 = b8eeaa2e
ffff0001035333c0 2992603833 S Co:6:002:0 s 40 05 0830 0000 0004 4 = b8aeaa2e
ffff0001035333c0 2992603946 C Co:6:002:0 0 4 >
ffff0001035333c0 2992603992 S Ci:6:002:0 s c0 05 0830 0000 0004 4 <
ffff0001035333c0 2992604215 C Ci:6:002:0 0 4 = b8aeaa2e
ffff0001035333c0 2992604266 S Co:6:002:0 s 40 05 0830 0000 0004 4 = b8aeaa2e
ffff0001035333c0 2992604372 C Co:6:002:0 0 4 >
ffff0001035333c0 2992604419 S Ci:6:002:0 s c0 05 082c 0000 0004 4 <
ffff0001035333c0 2992604528 C Ci:6:002:0 0 4 = dc832000
ffff0001035333c0 2992604575 S Co:6:002:0 s 40 05 082c 0000 0004 4 = dd832000
ffff0001035333c0 2992604696 C Co:6:002:0 0 4 >
ffff0001035333c0 2992604741 S Co:6:002:0 s 40 05 0cb0 0000 0004 4 = 17773354
ffff0001035333c0 2992604847 C Co:6:002:0 0 4 >
ffff0001035333c0 2992604894 S Co:6:002:0 s 40 05 0eb0 0000 0004 4 = 17773354
ffff0001035333c0 2992605008 C Co:6:002:0 0 4 >
ffff0001035333c0 2992605052 S Ci:6:002:0 s c0 05 0cb4 0000 0004 4 <
ffff0001035333c0 2992605162 C Ci:6:002:0 0 4 = 77000001
ffff0001035333c0 2992605207 S Co:6:002:0 s 40 05 0cb4 0000 0004 4 = 77000001
ffff0001035333c0 2992605321 C Co:6:002:0 0 4 >
ffff0001035333c0 2992605367 S Ci:6:002:0 s c0 05 0eb4 0000 0004 4 <
ffff0001035333c0 2992605484 C Ci:6:002:0 0 4 = 77000001
ffff0001035333c0 2992605529 S Co:6:002:0 s 40 05 0eb4 0000 0004 4 = 77000001
ffff0001035333c0 2992605635 C Co:6:002:0 0 4 >
ffff0001035333c0 2992605682 S Ci:6:002:0 s c0 05 0900 0000 0004 4 <
ffff0001035333c0 2992605817 C Ci:6:002:0 0 4 = 01040000
ffff0001035333c0 2992605862 S Co:6:002:0 s 40 05 0900 0000 0004 4 = 01040000
ffff0001035333c0 2992605968 C Co:6:002:0 0 4 >
ffff0001035333c0 2992606014 S Ci:6:002:0 s c0 05 080c 0000 0004 4 <
ffff0001035333c0 2992606131 C Ci:6:002:0 0 4 = 13111312
ffff0001035333c0 2992606177 S Co:6:002:0 s 40 05 080c 0000 0004 4 = 03111312
ffff0001035333c0 2992606283 C Co:6:002:0 0 4 >
ffff0001035333c0 2992606329 S Ci:6:002:0 s c0 05 0a04 0000 0004 4 <
ffff0001035333c0 2992606449 C Ci:6:002:0 0 4 = 0c00ff01
ffff0001035333c0 2992606494 S Co:6:002:0 s 40 05 0a04 0000 0004 4 = 0c00ff0f
ffff0001035333c0 2992606600 C Co:6:002:0 0 4 >
ffff0001035333c0 2992606647 S Ci:6:002:0 s c0 05 0440 0000 0004 4 <
ffff0001035333c0 2992606766 C Ci:6:002:0 0 4 = 00000000
ffff0001035333c0 2992606812 S Co:6:002:0 s 40 05 0440 0000 0004 4 = 50010000
ffff0001035333c0 2992606917 C Co:6:002:0 0 4 >
ffff0001035333c0 2992606964 S Ci:6:002:0 s c0 05 0c1c 0000 0004 4 <
ffff0001035333c0 2992607082 C Ci:6:002:0 0 4 = 03000040
ffff0001035333c0 2992607127 S Co:6:002:0 s 40 05 0c1c 0000 0004 4 = 0300402d
ffff0001035333c0 2992607233 C Co:6:002:0 0 4 >
ffff0001035333c0 2992607280 S Ci:6:002:0 s c0 05 0e1c 0000 0004 4 <
ffff0001035333c0 2992607398 C Ci:6:002:0 0 4 = 03000040
ffff0001035333c0 2992607443 S Co:6:002:0 s 40 05 0e1c 0000 0004 4 = 0300402d
ffff0001035333c0 2992607550 C Co:6:002:0 0 4 >
ffff0001035333c0 2992607596 S Ci:6:002:0 s c0 05 0860 0000 0004 4 <
ffff0001035333c0 2992607715 C Ci:6:002:0 0 4 = 21c3d572
ffff0001035333c0 2992607760 S Co:6:002:0 s 40 05 0860 0000 0004 4 = 21c32568
ffff0001035333c0 2992607867 C Co:6:002:0 0 4 >
ffff0001035333c0 2992607913 S Ci:6:002:0 s c0 05 0c00 0000 0004 4 <
ffff0001035333c0 2992608034 C Ci:6:002:0 0 4 = 07000000
ffff0001035333c0 2992608080 S Ci:6:002:0 s c0 05 08b0 0000 0004 4 <
ffff0001035333c0 2992608202 C Ci:6:002:0 0 4 = 18060000
ffff0001035333c0 2992608250 S Co:6:002:0 s 40 05 08b0 0000 0004 4 = 18060000
ffff0001035333c0 2992608371 C Co:6:002:0 0 4 >
ffff0001035333c0 2992608441 S Ci:6:002:0 s c0 05 0d04 0000 0004 4 <
ffff0001035333c0 2992608575 C Ci:6:002:0 0 4 = 017c90b1
ffff0001035333c0 2992608621 S Co:6:002:0 s 40 05 0c90 0000 0004 4 = 017d8501
ffff0001035333c0 2992608727 C Co:6:002:0 0 4 >
ffff0001035333c0 2992608786 S Ci:6:002:0 s c0 05 08ac 0000 0004 4 <
ffff0001035333c0 2992608905 C Ci:6:002:0 0 4 = 08faf00f
ffff0001035333c0 2992608950 S Co:6:002:0 s 40 05 08ac 0000 0004 4 = 08faf00f
ffff0001035333c0 2992609068 C Co:6:002:0 0 4 >
ffff0001035333c0 2992609115 S Ci:6:002:0 s c0 05 08ac 0000 0004 4 <
ffff0001035333c0 2992609234 C Ci:6:002:0 0 4 = 08faf00f
ffff0001035333c0 2992609279 S Co:6:002:0 s 40 05 08ac 0000 0004 4 = 08faf00f
ffff0001035333c0 2992609385 C Co:6:002:0 0 4 >
ffff0001035333c0 2992609431 S Ci:6:002:0 s c0 05 08c4 0000 0004 4 <
ffff0001035333c0 2992609568 C Ci:6:002:0 0 4 = 00000000
ffff0001035333c0 2992609613 S Co:6:002:0 s 40 05 08c4 0000 0004 4 = 00000000
ffff0001035333c0 2992609719 C Co:6:002:0 0 4 >
ffff0001035333c0 2992609766 S Ci:6:002:0 s c0 05 0c00 0000 0004 4 <
ffff0001035333c0 2992609884 C Ci:6:002:0 0 4 = 07000000
ffff0001035333c0 2992609929 S Ci:6:002:0 s c0 05 08b0 0000 0004 4 <
ffff0001035333c0 2992610039 C Ci:6:002:0 0 4 = 18060000
ffff0001035333c0 2992610085 S Co:6:002:0 s 40 05 08b0 0000 0004 4 = 18060000
ffff0001035333c0 2992610198 C Co:6:002:0 0 4 >
ffff0001035333c0 2992610264 S Ci:6:002:0 s c0 05 0d04 0000 0004 4 <
ffff0001035333c0 2992610383 C Ci:6:002:0 0 4 = 017d91b1
ffff0001035333c0 2992610428 S Co:6:002:0 s 40 05 0c90 0000 0004 4 = 9d7d8101
ffff0001035333c0 2992610534 C Co:6:002:0 0 4 >
ffff0001035333c0 2992610594 S Ci:6:002:0 s c0 05 0e00 0000 0004 4 <
ffff0001035333c0 2992610713 C Ci:6:002:0 0 4 = 07000000
ffff0001035333c0 2992610758 S Ci:6:002:0 s c0 05 08b0 0000 0004 4 <
ffff0001035333c0 2992610868 C Ci:6:002:0 0 4 = 18060000
ffff0001035333c0 2992610913 S Co:6:002:0 s 40 05 08b0 0000 0004 4 = 18060000
ffff0001035333c0 2992611019 C Co:6:002:0 0 4 >
ffff0001035333c0 2992611085 S Ci:6:002:0 s c0 05 0d44 0000 0004 4 <
ffff0001035333c0 2992611204 C Ci:6:002:0 0 4 = 017c90b1
ffff0001035333c0 2992611249 S Co:6:002:0 s 40 05 0e90 0000 0004 4 = 017d8501
ffff0001035333c0 2992611355 C Co:6:002:0 0 4 >
ffff0001035333c0 2992611415 S Ci:6:002:0 s c0 05 08ac 0000 0004 4 <
ffff0001035333c0 2992611534 C Ci:6:002:0 0 4 = 08faf00f
ffff0001035333c0 2992611580 S Co:6:002:0 s 40 05 08ac 0000 0004 4 = 08faf00f
ffff0001035333c0 2992611696 C Co:6:002:0 0 4 >
ffff0001035333c0 2992611742 S Ci:6:002:0 s c0 05 08ac 0000 0004 4 <
ffff0001035333c0 2992611862 C Ci:6:002:0 0 4 = 08faf00f
ffff0001035333c0 2992611907 S Co:6:002:0 s 40 05 08ac 0000 0004 4 = 08faf00f
ffff0001035333c0 2992612013 C Co:6:002:0 0 4 >
ffff0001035333c0 2992612060 S Ci:6:002:0 s c0 05 08c4 0000 0004 4 <
ffff0001035333c0 2992612218 C Ci:6:002:0 0 4 = 00000000
ffff0001035333c0 2992612267 S Co:6:002:0 s 40 05 08c4 0000 0004 4 = 00000000
ffff0001035333c0 2992612379 C Co:6:002:0 0 4 >
ffff0001035333c0 2992612426 S Ci:6:002:0 s c0 05 0e00 0000 0004 4 <
ffff0001035333c0 2992612546 C Ci:6:002:0 0 4 = 07000000
ffff0001035333c0 2992612592 S Ci:6:002:0 s c0 05 08b0 0000 0004 4 <
ffff0001035333c0 2992612703 C Ci:6:002:0 0 4 = 18060000
ffff0001035333c0 2992612748 S Co:6:002:0 s 40 05 08b0 0000 0004 4 = 18060000
ffff0001035333c0 2992612855 C Co:6:002:0 0 4 >
ffff0001035333c0 2992612923 S Ci:6:002:0 s c0 05 0d44 0000 0004 4 <
ffff0001035333c0 2992613042 C Ci:6:002:0 0 4 = 017d91b1
ffff0001035333c0 2992613088 S Co:6:002:0 s 40 05 0e90 0000 0004 4 = 9d7d8101
ffff0001035333c0 2992613205 C Co:6:002:0 0 4 >
ffff0001035333c0 2992613347 S Ci:6:002:0 s c0 05 0668 0000 0002 2 <
ffff0001035333c0 2992613469 C Ci:6:002:0 0 2 = 0010
ffff0001035333c0 2992613522 S Co:6:002:0 s 40 05 0668 0000 0002 2 = 0010
ffff0001035333c0 2992613629 C Co:6:002:0 0 2 >
ffff0001035333c0 2992613678 S Co:6:002:0 s 40 05 0483 0000 0001 1 = 00
ffff0001035333c0 2992613813 C Co:6:002:0 0 1 >
ffff0001035333c0 2992613860 S Ci:6:002:0 s c0 05 0837 0000 0001 1 <
ffff0001035333c0 2992613969 C Ci:6:002:0 0 1 = 00
ffff0001035333c0 2992614014 S Ci:6:002:0 s c0 05 08ac 0000 0004 4 <
ffff0001035333c0 2992614125 C Ci:6:002:0 0 4 = 08faf00f
ffff0001035333c0 2992614172 S Co:6:002:0 s 40 05 08ac 0000 0004 4 = 08faf00f
ffff0001035333c0 2992614287 C Co:6:002:0 0 4 >
ffff0001035333c0 2992614331 S Ci:6:002:0 s c0 05 08c4 0000 0004 4 <
ffff0001035333c0 2992614450 C Ci:6:002:0 0 4 = 00000000
ffff0001035333c0 2992614497 S Co:6:002:0 s 40 05 08c4 0000 0004 4 = 00000000
ffff0001035333c0 2992614610 C Co:6:002:0 0 4 >
ffff0001035333c0 2992614656 S Ci:6:002:0 s c0 05 0848 0000 0004 4 <
ffff0001035333c0 2992614766 C Ci:6:002:0 0 4 = 8bffd061
ffff0001035333c0 2992614812 S Co:6:002:0 s 40 05 0848 0000 0004 4 = 8bffd061
ffff0001035333c0 2992614919 C Co:6:002:0 0 4 >
ffff0001035333c0 2992614966 S Ci:6:002:0 s c0 05 08ac 0000 0004 4 <
ffff0001035333c0 2992615085 C Ci:6:002:0 0 4 = 08faf00f
ffff0001035333c0 2992615131 S Co:6:002:0 s 40 05 08ac 0000 0004 4 = 08faf00f
ffff0001035333c0 2992615237 C Co:6:002:0 0 4 >
ffff0001035333c0 2992615282 S Ci:6:002:0 s c0 05 08ac 0000 0004 4 <
ffff0001035333c0 2992615403 C Ci:6:002:0 0 4 = 08faf00f
ffff0001035333c0 2992615448 S Co:6:002:0 s 40 05 08ac 0000 0004 4 = 08faf00f
ffff0001035333c0 2992615567 C Co:6:002:0 0 4 >
ffff0001035333c0 2992615613 S Ci:6:002:0 s c0 05 08c4 0000 0004 4 <
ffff0001035333c0 2992615733 C Ci:6:002:0 0 4 = 00000000
ffff0001035333c0 2992615778 S Co:6:002:0 s 40 05 08c4 0000 0004 4 = 00000000
ffff0001035333c0 2992615884 C Co:6:002:0 0 4 >
ffff0001035333c0 2992615931 S Ci:6:002:0 s c0 05 0c00 0000 0004 4 <
ffff0001035333c0 2992616068 C Ci:6:002:0 0 4 = 07000000
ffff0001035333c0 2992616115 S Ci:6:002:0 s c0 05 08b0 0000 0004 4 <
ffff0001035333c0 2992616226 C Ci:6:002:0 0 4 = 18060000
ffff0001035333c0 2992616272 S Co:6:002:0 s 40 05 08b0 0000 0004 4 = 18060000
ffff0001035333c0 2992616385 C Co:6:002:0 0 4 >
ffff0001035333c0 2992616453 S Ci:6:002:0 s c0 05 0d04 0000 0004 4 <
ffff0001035333c0 2992616575 C Ci:6:002:0 0 4 = 9d7d95b1
ffff0001035333c0 2992616621 S Co:6:002:0 s 40 05 0c90 0000 0004 4 = 9d7d8501
ffff0001035333c0 2992616726 C Co:6:002:0 0 4 >
ffff0001035333c0 2992616786 S Ci:6:002:0 s c0 05 0e00 0000 0004 4 <
ffff0001035333c0 2992616906 C Ci:6:002:0 0 4 = 07000000
ffff0001035333c0 2992616952 S Ci:6:002:0 s c0 05 08b0 0000 0004 4 <
ffff0001035333c0 2992617076 C Ci:6:002:0 0 4 = 18060000
ffff0001035333c0 2992617120 S Co:6:002:0 s 40 05 08b0 0000 0004 4 = 18060000
ffff0001035333c0 2992617227 C Co:6:002:0 0 4 >
ffff0001035333c0 2992617294 S Ci:6:002:0 s c0 05 0d44 0000 0004 4 <
ffff0001035333c0 2992617414 C Ci:6:002:0 0 4 = 9d7d95b1
ffff0001035333c0 2992617459 S Co:6:002:0 s 40 05 0e90 0000 0004 4 = 9d7d8501
ffff0001035333c0 2992617570 C Co:6:002:0 0 4 >
ffff0001035333c0 2992617631 S Ci:6:002:0 s c0 05 0073 0000 0001 1 <
ffff0001035333c0 2992617752 C Ci:6:002:0 0 1 = 07
ffff0001035333c0 2992617798 S Co:6:002:0 s 40 05 0073 0000 0001 1 = 07
ffff0001035333c0 2992617903 C Co:6:002:0 0 1 >
ffff0001035333c0 2992617979 S Ci:6:002:0 s c0 05 0c24 0000 0004 4 <
ffff0001035333c0 2992618101 C Ci:6:002:0 0 4 = 20202020
ffff0001035333c0 2992618146 S Co:6:002:0 s 40 05 0c24 0000 0004 4 = 30303030
ffff0001035333c0 2992618253 C Co:6:002:0 0 4 >
ffff0001035333c0 2992618299 S Ci:6:002:0 s c0 05 0c28 0000 0004 4 <
ffff0001035333c0 2992618420 C Ci:6:002:0 0 4 = 20201e1c
ffff0001035333c0 2992618465 S Co:6:002:0 s 40 05 0c28 0000 0004 4 = 30302e2c
ffff0001035333c0 2992618571 C Co:6:002:0 0 4 >
ffff0001035333c0 2992618617 S Ci:6:002:0 s c0 05 0c2c 0000 0004 4 <
ffff0001035333c0 2992618738 C Ci:6:002:0 0 4 = 20202020
ffff0001035333c0 2992618783 S Co:6:002:0 s 40 05 0c2c 0000 0004 4 = 35353535
ffff0001035333c0 2992618889 C Co:6:002:0 0 4 >
ffff0001035333c0 2992618935 S Ci:6:002:0 s c0 05 0c30 0000 0004 4 <
ffff0001035333c0 2992619072 C Ci:6:002:0 0 4 = 20201e1c
ffff0001035333c0 2992619117 S Co:6:002:0 s 40 05 0c30 0000 0004 4 = 33312f2d
ffff0001035333c0 2992619224 C Co:6:002:0 0 4 >
ffff0001035333c0 2992619270 S Ci:6:002:0 s c0 05 0c34 0000 0004 4 <
ffff0001035333c0 2992619390 C Ci:6:002:0 0 4 = 20202020
ffff0001035333c0 2992619436 S Co:6:002:0 s 40 05 0c34 0000 0004 4 = 31313131
ffff0001035333c0 2992619542 C Co:6:002:0 0 4 >
ffff0001035333c0 2992619588 S Ci:6:002:0 s c0 05 0c38 0000 0004 4 <
ffff0001035333c0 2992619710 C Ci:6:002:0 0 4 = 201e1c1a
ffff0001035333c0 2992619754 S Co:6:002:0 s 40 05 0c38 0000 0004 4 = 312f2d2b
ffff0001035333c0 2992619861 C Co:6:002:0 0 4 >
ffff0001035333c0 2992619907 S Ci:6:002:0 s c0 05 0c3c 0000 0004 4 <
ffff0001035333c0 2992620031 C Ci:6:002:0 0 4 = 20202020
ffff0001035333c0 2992620076 S Co:6:002:0 s 40 05 0c3c 0000 0004 4 = 35353535
ffff0001035333c0 2992620202 C Co:6:002:0 0 4 >
ffff0001035333c0 2992620250 S Ci:6:002:0 s c0 05 0c40 0000 0004 4 <
ffff0001035333c0 2992620371 C Ci:6:002:0 0 4 = 20201e1c
ffff0001035333c0 2992620417 S Co:6:002:0 s 40 05 0c40 0000 0004 4 = 33312f2d
ffff0001035333c0 2992620523 C Co:6:002:0 0 4 >
ffff0001035333c0 2992620570 S Ci:6:002:0 s c0 05 0c44 0000 0004 4 <
ffff0001035333c0 2992620701 C Ci:6:002:0 0 4 = 1a181e1e
ffff0001035333c0 2992620746 S Co:6:002:0 s 40 05 0c44 0000 0004 4 = 2b2b3131
ffff0001035333c0 2992620853 C Co:6:002:0 0 4 >
ffff0001035333c0 2992620899 S Ci:6:002:0 s c0 05 0c48 0000 0004 4 <
ffff0001035333c0 2992621020 C Ci:6:002:0 0 4 = 1e1e1e1e
ffff0001035333c0 2992621065 S Co:6:002:0 s 40 05 0c48 0000 0004 4 = 3131312f
ffff0001035333c0 2992621171 C Co:6:002:0 0 4 >
ffff0001035333c0 2992621218 S Ci:6:002:0 s c0 05 0c4c 0000 0004 4 <
ffff0001035333c0 2992621337 C Ci:6:002:0 0 4 = 1c1a1816
ffff0001035333c0 2992621383 S Co:6:002:0 s 40 05 0c4c 0000 0004 4 = 2d2b2929
ffff0001035333c0 2992621489 C Co:6:002:0 0 4 >
ffff0001035333c0 2992621536 S Ci:6:002:0 s c0 05 0c54 0000 0004 4 <
ffff0001035333c0 2992621652 C Ci:6:002:0 0 4 = 120a0400
ffff0001035333c0 2992621698 S Co:6:002:0 s 40 05 0c54 0000 0004 4 = 231b1500
ffff0001035333c0 2992621817 C Co:6:002:0 0 4 >
ffff0001035333c0 2992621863 S Ci:6:002:0 s c0 05 0e24 0000 0004 4 <
ffff0001035333c0 2992621981 C Ci:6:002:0 0 4 = 1d1d1d1d
ffff0001035333c0 2992622026 S Co:6:002:0 s 40 05 0e24 0000 0004 4 = 20202020
ffff0001035333c0 2992622132 C Co:6:002:0 0 4 >
ffff0001035333c0 2992622179 S Ci:6:002:0 s c0 05 0e28 0000 0004 4 <
ffff0001035333c0 2992622295 C Ci:6:002:0 0 4 = 1d1d1b19
ffff0001035333c0 2992622342 S Co:6:002:0 s 40 05 0e28 0000 0004 4 = 20201e1c
ffff0001035333c0 2992622448 C Co:6:002:0 0 4 >
ffff0001035333c0 2992622495 S Ci:6:002:0 s c0 05 0e2c 0000 0004 4 <
ffff0001035333c0 2992622616 C Ci:6:002:0 0 4 = 1f1f1f1f
ffff0001035333c0 2992622662 S Co:6:002:0 s 40 05 0e2c 0000 0004 4 = 25252525
ffff0001035333c0 2992622768 C Co:6:002:0 0 4 >
ffff0001035333c0 2992622815 S Ci:6:002:0 s c0 05 0e30 0000 0004 4 <
ffff0001035333c0 2992622948 C Ci:6:002:0 0 4 = 1f1f1d1b
ffff0001035333c0 2992622994 S Co:6:002:0 s 40 05 0e30 0000 0004 4 = 23211f1d
ffff0001035333c0 2992623100 C Co:6:002:0 0 4 >
ffff0001035333c0 2992623146 S Ci:6:002:0 s c0 05 0e34 0000 0004 4 <
ffff0001035333c0 2992623275 C Ci:6:002:0 0 4 = 1f1f1f1f
ffff0001035333c0 2992623321 S Co:6:002:0 s 40 05 0e34 0000 0004 4 = 21212121
ffff0001035333c0 2992623438 C Co:6:002:0 0 4 >
ffff0001035333c0 2992623485 S Ci:6:002:0 s c0 05 0e38 0000 0004 4 <
ffff0001035333c0 2992623603 C Ci:6:002:0 0 4 = 1f1d1b19
ffff0001035333c0 2992623648 S Co:6:002:0 s 40 05 0e38 0000 0004 4 = 211f1d1b
ffff0001035333c0 2992623755 C Co:6:002:0 0 4 >
ffff0001035333c0 2992623801 S Ci:6:002:0 s c0 05 0e3c 0000 0004 4 <
ffff0001035333c0 2992623919 C Ci:6:002:0 0 4 = 1f1f1f1f
ffff0001035333c0 2992623965 S Co:6:002:0 s 40 05 0e3c 0000 0004 4 = 25252525
ffff0001035333c0 2992624071 C Co:6:002:0 0 4 >
ffff0001035333c0 2992624119 S Ci:6:002:0 s c0 05 0e40 0000 0004 4 <
ffff0001035333c0 2992624240 C Ci:6:002:0 0 4 = 1f1f1d1b
ffff0001035333c0 2992624287 S Co:6:002:0 s 40 05 0e40 0000 0004 4 = 23211f1d
ffff0001035333c0 2992624399 C Co:6:002:0 0 4 >
ffff0001035333c0 2992624446 S Ci:6:002:0 s c0 05 0e44 0000 0004 4 <
ffff0001035333c0 2992624574 C Ci:6:002:0 0 4 = 19171d1d
ffff0001035333c0 2992624620 S Co:6:002:0 s 40 05 0e44 0000 0004 4 = 1b1b2121
ffff0001035333c0 2992624726 C Co:6:002:0 0 4 >
ffff0001035333c0 2992624773 S Ci:6:002:0 s c0 05 0e48 0000 0004 4 <
ffff0001035333c0 2992624891 C Ci:6:002:0 0 4 = 1d1d1d1d
ffff0001035333c0 2992624936 S Co:6:002:0 s 40 05 0e48 0000 0004 4 = 2121211f
ffff0001035333c0 2992625042 C Co:6:002:0 0 4 >
ffff0001035333c0 2992625088 S Ci:6:002:0 s c0 05 0e4c 0000 0004 4 <
ffff0001035333c0 2992625206 C Ci:6:002:0 0 4 = 1b191715
ffff0001035333c0 2992625251 S Co:6:002:0 s 40 05 0e4c 0000 0004 4 = 1d1b1919
ffff0001035333c0 2992625358 C Co:6:002:0 0 4 >
ffff0001035333c0 2992625404 S Ci:6:002:0 s c0 05 0e54 0000 0004 4 <
ffff0001035333c0 2992625521 C Ci:6:002:0 0 4 = 11090300
ffff0001035333c0 2992625566 S Co:6:002:0 s 40 05 0e54 0000 0004 4 = 130b0500
ffff0001035333c0 2992625673 C Co:6:002:0 0 4 >
ffff00014c2bfc00 2992625834 S Ci:6:002:0 s c0 05 004c 0000 0001 1 <
ffff00014c2bfc00 2992625978 C Ci:6:002:0 0 1 = 28
ffff00014c2bfc00 2992626133 S Co:6:002:0 s 40 05 004c 0000 0001 1 = 20
ffff00014c2bfc00 2992626250 C Co:6:002:0 0 1 >
ffff000103533840 2992697787 C Bi:6:002:1 0 478 = a6010484 00000f80 8e036000 04300000 00000000 58a18500 2c300000 52cbcb0f
ffff000103533840 2992697854 S Bi:6:002:1 -115 32768 <
ffff000103533b40 2992698747 C Bi:6:002:1 0 471 = 9f010484 00000f80 ee036000 04300000 00000000 50a58500 2e2a0000 5ac9c90f
ffff000103533b40 2992698774 S Bi:6:002:1 -115 32768 <
ffff000103533d80 2992699614 C Bi:6:002:1 0 446 = 86010484 00000f80 740b6000 04300000 00000000 d5a88500 2e2c0000 59d0d00f
ffff000103533d80 2992699638 S Bi:6:002:1 -115 32768 <
ffff0001035339c0 2992700520 C Bi:6:002:1 0 469 = 9d010484 00000f80 16086000 04300000 00000000 3cac8500 2e300000 5acfcf0f
ffff0001035339c0 2992700545 S Bi:6:002:1 -115 32768 <
ffff000103533840 2992701422 C Bi:6:002:1 0 479 = a7010484 00000f80 2b096000 04300000 00000000 baaf8500 2e300000 57cccc0f
ffff000103533840 2992701448 S Bi:6:002:1 -115 32768 <
ffff00014c2bfc00 2992764237 S Ci:6:002:0 s c0 05 0073 0000 0001 1 <
ffff00014c2bfc00 2992764297 C Ci:6:002:0 0 1 = 07
ffff00014c2bfc00 2992764438 S Co:6:002:0 s 40 05 0073 0000 0001 1 = 07
ffff00014c2bfc00 2992764578 C Co:6:002:0 0 1 >
ffff00014c2bfc00 2992764737 S Ci:6:002:0 s c0 05 0770 0000 0004 4 <
ffff00014c2bfc00 2992764883 C Ci:6:002:0 0 4 = 00000000
ffff00014c2bfc00 2992765039 S Ci:6:002:0 s c0 05 0774 0000 0004 4 <
ffff00014c2bfc00 2992765186 C Ci:6:002:0 0 4 = 00000000
ffff00014c2bfc00 2992765344 S Co:6:002:0 s 40 05 076e 0000 0001 1 = 0c
ffff00014c2bfc00 2992765485 C Co:6:002:0 0 1 >
ffff00014c2bfc00 2992765645 S Ci:6:002:0 s c0 05 0808 0000 0004 4 <
ffff00014c2bfc00 2992765793 C Ci:6:002:0 0 4 = 3382023e
ffff00014c2bfc00 2992765949 S Ci:6:002:0 s c0 05 0a5c 0000 0002 2 <
ffff00014c2bfc00 2992766074 C Ci:6:002:0 0 2 = 4400
ffff00014c2bfc00 2992766101 S Ci:6:002:0 s c0 05 0f48 0000 0002 2 <
ffff00014c2bfc00 2992766213 C Ci:6:002:0 0 2 = f400
ffff00014c2bfc00 2992766243 S Ci:6:002:0 s c0 05 0f04 0000 0004 4 <
ffff00014c2bfc00 2992766354 C Ci:6:002:0 0 4 = b0011e00
ffff00014c2bfc00 2992766383 S Ci:6:002:0 s c0 05 0f14 0000 0004 4 <
ffff00014c2bfc00 2992766493 C Ci:6:002:0 0 4 = 79001300
ffff00014c2bfc00 2992766523 S Ci:6:002:0 s c0 05 0f10 0000 0004 4 <
ffff00014c2bfc00 2992766634 C Ci:6:002:0 0 4 = 00000000
ffff00014c2bfc00 2992766662 S Ci:6:002:0 s c0 05 0f0c 0000 0004 4 <
ffff00014c2bfc00 2992766779 C Ci:6:002:0 0 4 = 00000000
ffff00014c2bfc00 2992766799 S Ci:6:002:0 s c0 05 0f08 0000 0004 4 <
ffff00014c2bfc00 2992766911 C Ci:6:002:0 0 4 = 23028001
ffff00014c2bfc00 2992766940 S Ci:6:002:0 s c0 05 0fcc 0000 0004 4 <
ffff00014c2bfc00 2992767057 C Ci:6:002:0 0 4 = 00000000
ffff00014c2bfc00 2992767078 S Ci:6:002:0 s c0 05 09a4 0000 0004 4 <
ffff00014c2bfc00 2992767197 C Ci:6:002:0 0 4 = 80000800
ffff00014c2bfc00 2992767227 S Co:6:002:0 s 40 05 09a4 0000 0004 4 = 80000a00
ffff00014c2bfc00 2992767339 C Co:6:002:0 0 4 >
ffff00014c2bfc00 2992767359 S Ci:6:002:0 s c0 05 09a4 0000 0004 4 <
ffff00014c2bfc00 2992767471 C Ci:6:002:0 0 4 = 80000a00
ffff00014c2bfc00 2992767499 S Co:6:002:0 s 40 05 09a4 0000 0004 4 = 80000800
ffff00014c2bfc00 2992767608 C Co:6:002:0 0 4 >
ffff00014c2bfc00 2992767629 S Ci:6:002:0 s c0 05 0a2c 0000 0004 4 <
ffff00014c2bfc00 2992767740 C Ci:6:002:0 0 4 = 00809000
ffff00014c2bfc00 2992767769 S Co:6:002:0 s 40 05 0a2c 0000 0004 4 = 00009000
ffff00014c2bfc00 2992767883 C Co:6:002:0 0 4 >
ffff00014c2bfc00 2992767903 S Ci:6:002:0 s c0 05 0a2c 0000 0004 4 <
ffff00014c2bfc00 2992768014 C Ci:6:002:0 0 4 = 00009000
ffff00014c2bfc00 2992768045 S Co:6:002:0 s 40 05 0a2c 0000 0004 4 = 00809000
ffff00014c2bfc00 2992768151 C Co:6:002:0 0 4 >
ffff00014c2bfc00 2992768181 S Ci:6:002:0 s c0 05 0b58 0000 0004 4 <
ffff00014c2bfc00 2992768292 C Ci:6:002:0 0 4 = 00000000
ffff00014c2bfc00 2992768322 S Co:6:002:0 s 40 05 0b58 0000 0004 4 = 01000000
ffff00014c2bfc00 2992768442 C Co:6:002:0 0 4 >
ffff00014c2bfc00 2992768473 S Ci:6:002:0 s c0 05 0b58 0000 0004 4 <
ffff00014c2bfc00 2992768584 C Ci:6:002:0 0 4 = 01000000
ffff00014c2bfc00 2992768614 S Co:6:002:0 s 40 05 0b58 0000 0004 4 = 00000000
ffff00014c2bfc00 2992768721 C Co:6:002:0 0 4 >
ffff00014c2bfc00 2992768752 S Ci:6:002:0 s c0 05 0c50 0000 0004 4 <
ffff00014c2bfc00 2992768861 C Ci:6:002:0 0 4 = 1e000000
ffff00014c2bfc00 2992768891 S Co:6:002:0 s 40 05 0c50 0000 0004 4 = 1c000000
ffff00014c2bfc00 2992768998 C Co:6:002:0 0 4 >
ffff00014c2bfc00 2992769028 S Ci:6:002:0 s c0 05 0e50 0000 0004 4 <
ffff00014c2bfc00 2992769139 C Ci:6:002:0 0 4 = 1e000000
ffff00014c2bfc00 2992769168 S Co:6:002:0 s 40 05 0e50 0000 0004 4 = 1c000000
ffff00014c2bfc00 2992769275 C Co:6:002:0 0 4 >
ffff00014c2bfc00 2992769306 S Ci:6:002:0 s c0 05 01cc 0000 0001 1 <
ffff00014c2bfc00 2992769416 C Ci:6:002:0 0 1 = 00
ffff00014c2bfc00 2992769447 S Co:6:002:0 s 40 05 01fc 0000 0004 4 = 00000000
ffff00014c2bfc00 2992769567 C Co:6:002:0 0 4 >
ffff00014c2bfc00 2992769597 S Co:6:002:0 s 40 05 01dc 0000 0004 4 = 58000000
ffff00014c2bfc00 2992769704 C Co:6:002:0 0 4 >
ffff00014c2bfc00 2992769735 S Co:6:002:0 s 40 05 0440 0000 0004 4 = 00000000
ffff00014c2bfc00 2992769841 C Co:6:002:0 0 4 >
ffff00014c2bfc00 2992769872 S Ci:6:002:0 s c0 05 0c00 0000 0004 4 <
ffff00014c2bfc00 2992769982 C Ci:6:002:0 0 4 = 07000000
ffff00014c2bfc00 2992770012 S Ci:6:002:0 s c0 05 08b0 0000 0004 4 <
ffff00014c2bfc00 2992770123 C Ci:6:002:0 0 4 = 18060000
ffff00014c2bfc00 2992770153 S Co:6:002:0 s 40 05 08b0 0000 0004 4 = 42060000
ffff00014c2bfc00 2992770260 C Co:6:002:0 0 4 >
ffff00014c2bfc00 2992770310 S Ci:6:002:0 s c0 05 0d04 0000 0004 4 <
ffff00014c2bfc00 2992770417 C Ci:6:002:0 0 4 = 108d90b1
ffff00014c2bfc00 2992770448 S Co:6:002:0 s 40 05 0c90 0000 0004 4 = 108d2304
ffff00014c2bfc00 2992770569 C Co:6:002:0 0 4 >
ffff00014c2bfc00 2992770613 S Co:6:002:0 s 40 05 0280 0000 0002 2 = 0001
ffff00014c2bfc00 2992770715 C Co:6:002:0 0 2 >
ffff00014c2bfc00 2992770745 S Ci:6:002:0 s c0 05 010c 0000 0001 1 <
ffff00014c2bfc00 2992770856 C Ci:6:002:0 0 1 = b4
ffff00014c2bfc00 2992770886 S Co:6:002:0 s 40 05 010c 0000 0001 1 = b4
ffff00014c2bfc00 2992770993 C Co:6:002:0 0 1 >
ffff00014c2bfc00 2992772019 S Ci:6:002:0 s c0 05 004c 0000 0001 1 <
ffff00014c2bfc00 2992772129 C Ci:6:002:0 0 1 = 20
ffff00014c2bfc00 2992772160 S Co:6:002:0 s 40 05 004c 0000 0001 1 = 28
ffff00014c2bfc00 2992772274 C Co:6:002:0 0 1 >
ffff000103533b40 2992800124 C Bi:6:002:1 0 478 = a6010484 00000f80 8f036000 04300000 00000000 5a318700 2c2a0000 5bcbcb0f
ffff000103533b40 2992800146 S Bi:6:002:1 -115 32768 <
ffff000103533d80 2992801156 C Bi:6:002:1 0 471 = 9f010484 00000f80 ef036000 04300000 00000000 5c358700 2c2c0000 5bcdcd0f
ffff000103533d80 2992801184 S Bi:6:002:1 -115 32768 <
ffff0001035339c0 2992802037 C Bi:6:002:1 0 446 = 86010484 00000f80 750b6000 04300000 00000000 ed388700 2e2c0000 5acfcf0f
ffff0001035339c0 2992802063 S Bi:6:002:1 -115 32768 <
ffff000103533840 2992802933 C Bi:6:002:1 0 469 = 9d010484 00000f80 17086000 04300000 00000000 513c8700 2c340000 5fcfcf0f
ffff000103533840 2992802958 S Bi:6:002:1 -115 32768 <
ffff000103533b40 2992803852 C Bi:6:002:1 0 479 = a7010484 00000f80 2c096000 04300000 00000000 cf3f8700 2e2a0000 56d1d10f
ffff000103533b40 2992803878 S Bi:6:002:1 -115 32768 <
ffff000103533d80 2992902575 C Bi:6:002:1 0 478 = a6010484 00000f80 90036000 04300000 00000000 5cc18800 34340000 5dcccc0f
ffff000103533d80 2992902635 S Bi:6:002:1 -115 32768 <
ffff0001035339c0 2992903552 C Bi:6:002:1 0 471 = 9f010484 00000f80 f0036000 04300000 00000000 53c58800 2e2a0000 5cd1d10f
ffff0001035339c0 2992903581 S Bi:6:002:1 -115 32768 <
ffff000103533840 2992904479 C Bi:6:002:1 0 446 = 86010484 00000f80 760b6000 04300000 00000000 10c98800 302a0000 5ad1d10f
ffff000103533840 2992904504 S Bi:6:002:1 -115 32768 <
ffff000103533b40 2992905349 C Bi:6:002:1 0 469 = 9d010484 00000f80 18086000 04300000 00000000 6fcc8800 2c300000 59d0d00f
ffff000103533b40 2992905370 S Bi:6:002:1 -115 32768 <
ffff000103533d80 2992906246 C Bi:6:002:1 0 479 = a7010484 00000f80 2d096000 04300000 00000000 eecf8800 32300000 5ccccc0f
ffff000103533d80 2992906265 S Bi:6:002:1 -115 32768 <
ffff00014c2bfc00 2992944183 S Ci:6:002:0 s c0 05 004c 0000 0001 1 <
ffff00014c2bfc00 2992944346 C Ci:6:002:0 0 1 = 28
ffff00014c2bfc00 2992944427 S Co:6:002:0 s 40 05 004c 0000 0001 1 = 20
ffff00014c2bfc00 2992944553 C Co:6:002:0 0 1 >
ffff0001035339c0 2993004975 C Bi:6:002:1 0 478 = a6010484 00000f80 91036000 04300000 00000000 5e518a00 302c0000 58cfcf0f
ffff0001035339c0 2993005014 S Bi:6:002:1 -115 32768 <
ffff000103533840 2993005978 C Bi:6:002:1 0 471 = 9f010484 00000f80 f1036000 04300000 00000000 75558a00 2e300000 59d3d30f
ffff000103533840 2993006002 S Bi:6:002:1 -115 32768 <
ffff000103533b40 2993006854 C Bi:6:002:1 0 446 = 86010484 00000f80 770b6000 04300000 00000000 fe588a00 2c2a0000 59d1d10f
ffff000103533b40 2993006879 S Bi:6:002:1 -115 32768 <
ffff000103533d80 2993007746 C Bi:6:002:1 0 469 = 9d010484 00000f80 19086000 04300000 00000000 5d5c8a00 2c2c0000 59cbcb0f
ffff000103533d80 2993007770 S Bi:6:002:1 -115 32768 <
ffff0001035339c0 2993008639 C Bi:6:002:1 0 479 = a7010484 00000f80 2e096000 04300000 00000000 e55f8a00 30300000 5acfcf0f
ffff0001035339c0 2993008660 S Bi:6:002:1 -115 32768 <
ffff000103533840 2993107331 C Bi:6:002:1 0 478 = a6010484 00000f80 92036000 04300000 00000000 61e18b00 282c0000 58d0d00f
ffff000103533840 2993107364 S Bi:6:002:1 -115 32768 <
ffff000103533b40 2993108348 C Bi:6:002:1 0 471 = 9f010484 00000f80 f2036000 04300000 00000000 68e58b00 2c340000 5dcccc0f
ffff000103533b40 2993108370 S Bi:6:002:1 -115 32768 <
ffff000103533d80 2993109208 C Bi:6:002:1 0 446 = 86010484 00000f80 780b6000 04300000 00000000 eee88b00 2c340000 60cfcf0f
ffff000103533d80 2993109227 S Bi:6:002:1 -115 32768 <
ffff0001035339c0 2993110127 C Bi:6:002:1 0 469 = 9d010484 00000f80 1a086000 04300000 00000000 63ec8b00 302c0000 55cdcd0f
ffff0001035339c0 2993110147 S Bi:6:002:1 -115 32768 <
ffff000103533840 2993111033 C Bi:6:002:1 0 479 = a7010484 00000f80 2f096000 04300000 00000000 e3ef8b00 2c2c0000 58caca0f
ffff000103533840 2993111052 S Bi:6:002:1 -115 32768 <
ffff00014c2bfc00 2993116125 S Ci:6:002:0 s c0 05 004c 0000 0001 1 <
ffff00014c2bfc00 2993116277 C Ci:6:002:0 0 1 = 20
ffff00014c2bfc00 2993116431 S Co:6:002:0 s 40 05 004c 0000 0001 1 = 28
ffff00014c2bfc00 2993116573 C Co:6:002:0 0 1 >
ffff000103533b40 2993209781 C Bi:6:002:1 0 478 = a6010484 00000f80 93036000 04300000 00000000 63718d00 2e300000 58d2d20f
ffff000103533b40 2993209834 S Bi:6:002:1 -115 32768 <
ffff000103533d80 2993210745 C Bi:6:002:1 0 471 = 9f010484 00000f80 f3036000 04300000 00000000 66758d00 302a0000 5bd0d00f
ffff000103533d80 2993210768 S Bi:6:002:1 -115 32768 <
ffff0001035339c0 2993211610 C Bi:6:002:1 0 446 = 86010484 00000f80 790b6000 04300000 00000000 ed788d00 2c340000 5dcaca0f
ffff0001035339c0 2993211629 S Bi:6:002:1 -115 32768 <
ffff000103533840 2993212503 C Bi:6:002:1 0 469 = 9d010484 00000f80 1b086000 04300000 00000000 497c8d00 2e2c0000 5cd3d30f
ffff000103533840 2993212524 S Bi:6:002:1 -115 32768 <
ffff000103533b40 2993213427 C Bi:6:002:1 0 479 = a7010484 00000f80 30096000 04300000 00000000 d67f8d00 2c300000 58cfcf0f
ffff000103533b40 2993213448 S Bi:6:002:1 -115 32768 <
ffff00014c2bfc00 2993288171 S Ci:6:002:0 s c0 05 004c 0000 0001 1 <
ffff00014c2bfc00 2993288306 C Ci:6:002:0 0 1 = 28
ffff00014c2bfc00 2993288469 S Co:6:002:0 s 40 05 004c 0000 0001 1 = 20
ffff00014c2bfc00 2993288609 C Co:6:002:0 0 1 >
ffff000103533d80 2993312168 C Bi:6:002:1 0 478 = a6010484 00000f80 94036000 04300000 00000000 65018f00 2e300000 56d4d40f
ffff000103533d80 2993312193 S Bi:6:002:1 -115 32768 <
ffff0001035339c0 2993313149 C Bi:6:002:1 0 471 = 9f010484 00000f80 f4036000 04300000 00000000 56058f00 2e2c0000 59d0d00f
ffff0001035339c0 2993313174 S Bi:6:002:1 -115 32768 <
ffff000103533840 2993314021 C Bi:6:002:1 0 446 = 86010484 00000f80 7a0b6000 04300000 00000000 e3088f00 2c2c0000 55d1d10f
ffff000103533840 2993314046 S Bi:6:002:1 -115 32768 <
ffff000103533b40 2993314920 C Bi:6:002:1 0 469 = 9d010484 00000f80 1c086000 04300000 00000000 420c8f00 30300000 5ad3d30f
ffff000103533b40 2993314944 S Bi:6:002:1 -115 32768 <
ffff000103533d80 2993315848 C Bi:6:002:1 0 479 = a7010484 00000f80 31096000 04300000 00000000 d50f8f00 2c300000 58cfcf0f
ffff000103533d80 2993315872 S Bi:6:002:1 -115 32768 <
ffff0001035339c0 2993414587 C Bi:6:002:1 0 478 = a6010484 00000f80 95036000 04300000 00000000 67919000 30300000 5bd2d20f
ffff0001035339c0 2993414647 S Bi:6:002:1 -115 32768 <
ffff000103533840 2993415595 C Bi:6:002:1 0 471 = 9f010484 00000f80 f5036000 04300000 00000000 74959000 2c2c0000 59d4d40f
ffff000103533840 2993415623 S Bi:6:002:1 -115 32768 <
ffff000103533b40 2993416475 C Bi:6:002:1 0 446 = 86010484 00000f80 7b0b6000 04300000 00000000 06999000 2e300000 59cdcd0f
ffff000103533b40 2993416499 S Bi:6:002:1 -115 32768 <
ffff000103533d80 2993417359 C Bi:6:002:1 0 469 = 9d010484 00000f80 1d086000 04300000 00000000 6d9c9000 2e2c0000 59cfcf0f
ffff000103533d80 2993417384 S Bi:6:002:1 -115 32768 <
ffff0001035339c0 2993418274 C Bi:6:002:1 0 479 = a7010484 00000f80 32096000 04300000 00000000 f09f9000 2e300000 59d7d70f
ffff0001035339c0 2993418298 S Bi:6:002:1 -115 32768 <
ffff000103a6f600 2993460168 S Ci:6:002:0 s c0 05 004c 0000 0001 1 <
ffff000103a6f600 2993460338 C Ci:6:002:0 0 1 = 20
ffff000103a6f600 2993460488 S Co:6:002:0 s 40 05 004c 0000 0001 1 = 28
ffff000103a6f600 2993460628 C Co:6:002:0 0 1 >
ffff000103533840 2993517006 C Bi:6:002:1 0 478 = a6010484 00000f80 96036000 04300000 00000000 69219200 2c2e0000 5acaca0f
ffff000103533840 2993517063 S Bi:6:002:1 -115 32768 <
ffff000103533b40 2993517967 C Bi:6:002:1 0 471 = 9f010484 00000f80 f6036000 04300000 00000000 67259200 2c2c0000 55d2d20f
ffff000103533b40 2993517994 S Bi:6:002:1 -115 32768 <
ffff000103533d80 2993518842 C Bi:6:002:1 0 446 = 86010484 00000f80 7c0b6000 04300000 00000000 ea289200 2c300000 5ad9d90f
ffff000103533d80 2993518867 S Bi:6:002:1 -115 32768 <
ffff0001035339c0 2993519727 C Bi:6:002:1 0 469 = 9d010484 00000f80 1e086000 04300000 00000000 482c9200 2c2c0000 5ad3d30f
ffff0001035339c0 2993519751 S Bi:6:002:1 -115 32768 <
ffff000103533840 2993520629 C Bi:6:002:1 0 479 = a7010484 00000f80 33096000 04300000 00000000 c62f9200 2c2a0000 5acfcf0f
ffff000103533840 2993520656 S Bi:6:002:1 -115 32768 <
ffff000103533b40 2993619347 C Bi:6:002:1 0 478 = a6010484 00000f80 97036000 04300000 00000000 6bb19300 2c2c0000 56d3d30f
ffff000103533b40 2993619397 S Bi:6:002:1 -115 32768 <
ffff000103533d80 2993620371 C Bi:6:002:1 0 471 = 9f010484 00000f80 f7036000 04300000 00000000 66b59300 2e2e0000 5ad4d40f
ffff000103533d80 2993620400 S Bi:6:002:1 -115 32768 <
ffff0001035339c0 2993621233 C Bi:6:002:1 0 446 = 86010484 00000f80 7d0b6000 04300000 00000000 eeb89300 2e300000 5bcbcb0f
ffff0001035339c0 2993621258 S Bi:6:002:1 -115 32768 <
ffff000103533840 2993623092 C Bi:6:002:1 0 479 = a7010484 00000f80 34096000 04300000 00000000 f3bf9300 2e300000 5bd8d80f
ffff000103533840 2993623116 S Bi:6:002:1 -115 32768 <
ffff000103a6f600 2993632399 S Ci:6:002:0 s c0 05 004c 0000 0001 1 <
ffff000103a6f600 2993632560 C Ci:6:002:0 0 1 = 28
ffff000103a6f600 2993632718 S Co:6:002:0 s 40 05 004c 0000 0001 1 = 20
ffff000103a6f600 2993632855 C Co:6:002:0 0 1 >
ffff000103533b40 2993721790 C Bi:6:002:1 0 478 = a6010484 00000f80 98036000 04300000 00000000 6d419500 30300000 5ad3d30f
ffff000103533b40 2993721848 S Bi:6:002:1 -115 32768 <
ffff000103533d80 2993722769 C Bi:6:002:1 0 471 = 9f010484 00000f80 f8036000 04300000 00000000 6e459500 2a2a0000 58caca0f
ffff000103533d80 2993722797 S Bi:6:002:1 -115 32768 <
ffff0001035339c0 2993723656 C Bi:6:002:1 0 446 = 86010484 00000f80 7e0b6000 04300000 00000000 04499500 2c300000 57d3d30f
ffff0001035339c0 2993723680 S Bi:6:002:1 -115 32768 <
ffff000103533840 2993724561 C Bi:6:002:1 0 469 = 9d010484 00000f80 20086000 04300000 00000000 6d4c9500 2e300000 58d5d50f
ffff000103533840 2993724584 S Bi:6:002:1 -115 32768 <
ffff000103533b40 2993725524 C Bi:6:002:1 0 479 = a7010484 00000f80 35096000 04300000 00000000 25509500 2c2c0000 59d3d30f
ffff000103533b40 2993725550 S Bi:6:002:1 -115 32768 <
ffff000103a6f600 2993756161 S Ci:6:002:0 s c0 05 004c 0000 0001 1 <
ffff000103a6f600 2993756302 C Ci:6:002:0 0 1 = 20
ffff000103a6f600 2993756457 S Co:6:002:0 s 40 05 004c 0000 0001 1 = 20
ffff000103a6f600 2993756599 C Co:6:002:0 0 1 >
ffff000103533d80 2993824131 C Bi:6:002:1 0 478 = a6010484 00000f80 99036000 04300000 00000000 70d19600 2c2c0000 56d2d20f
ffff000103533d80 2993824162 S Bi:6:002:1 -115 32768 <
ffff0001035339c0 2993825209 C Bi:6:002:1 0 471 = 9f010484 00000f80 f9036000 04300000 00000000 92d59600 2e340000 61d3d30f
ffff0001035339c0 2993825231 S Bi:6:002:1 -115 32768 <
ffff000103533840 2993826101 C Bi:6:002:1 0 446 = 86010484 00000f80 7f0b6000 04300000 00000000 21d99600 30300000 58d3d30f
ffff000103533840 2993826126 S Bi:6:002:1 -115 32768 <
ffff000103533b40 2993826978 C Bi:6:002:1 0 469 = 9d010484 00000f80 21086000 04300000 00000000 81dc9600 2c300000 5cd5d50f
ffff000103533b40 2993827003 S Bi:6:002:1 -115 32768 <
ffff000103533d80 2993827801 C Bi:6:002:1 0 479 = a7010484 00000f80 36096000 04300000 00000000 05e09600 2e300000 5acccc0f
ffff000103533d80 2993827818 S Bi:6:002:1 -115 32768 <
ffff0001035339c0 2993926550 C Bi:6:002:1 0 478 = a6010484 00000f80 9a036000 04300000 00000000 72619800 2a2c0000 5acbcb0f
ffff0001035339c0 2993926593 S Bi:6:002:1 -115 32768 <
ffff000103533840 2993927572 C Bi:6:002:1 0 471 = 9f010484 00000f80 fa036000 04300000 00000000 68659800 2c340000 60cfcf0f
ffff000103533840 2993927598 S Bi:6:002:1 -115 32768 <
ffff000103533b40 2993928472 C Bi:6:002:1 0 446 = 86010484 00000f80 800b6000 04300000 00000000 13699800 2c300000 58cfcf0f
ffff000103533b40 2993928498 S Bi:6:002:1 -115 32768 <
ffff000103533d80 2993929379 C Bi:6:002:1 0 469 = 9d010484 00000f80 22086000 04300000 00000000 976c9800 2a300000 5acfcf0f
ffff000103533d80 2993929402 S Bi:6:002:1 -115 32768 <
ffff0001035339c0 2993930284 C Bi:6:002:1 0 479 = a7010484 00000f80 37096000 04300000 00000000 18709800 2e300000 58cece0f
ffff0001035339c0 2993930303 S Bi:6:002:1 -115 32768 <
ffff000103533840 2994028937 C Bi:6:002:1 0 478 = a6010484 00000f80 9b036000 04300000 00000000 74f19900 2e340000 5fd3d30f
ffff000103533840 2994028968 S Bi:6:002:1 -115 32768 <
ffff000103533b40 2994029957 C Bi:6:002:1 0 471 = 9f010484 00000f80 fb036000 04300000 00000000 75f59900 2c300000 5cd5d50f
ffff000103533b40 2994029994 S Bi:6:002:1 -115 32768 <
ffff000103533d80 2994030752 C Bi:6:002:1 0 446 = 86010484 00000f80 810b6000 04300000 00000000 f9f89900 2c300000 57cccc0f
ffff000103533d80 2994030775 S Bi:6:002:1 -115 32768 <
ffff0001035339c0 2994031658 C Bi:6:002:1 0 469 = 9d010484 00000f80 23086000 04300000 00000000 66fc9900 2e300000 54d1d10f
ffff0001035339c0 2994031677 S Bi:6:002:1 -115 32768 <
ffff000103533840 2994032565 C Bi:6:002:1 0 479 = a7010484 00000f80 38096000 04300000 00000000 e6ff9900 2e340000 5ecece0f
ffff000103533840 2994032581 S Bi:6:002:1 -115 32768 <
ffff000103533b40 2994131398 C Bi:6:002:1 0 478 = a6010484 00000f80 9c036000 04300000 00000000 76819b00 2e340000 62d0d00f
ffff000103533b40 2994131447 S Bi:6:002:1 -115 32768 <
ffff000103533d80 2994132385 C Bi:6:002:1 0 471 = 9f010484 00000f80 fc036000 04300000 00000000 7f859b00 2e340000 5bcfcf0f
ffff000103533d80 2994132412 S Bi:6:002:1 -115 32768 <
ffff0001035339c0 2994133252 C Bi:6:002:1 0 446 = 86010484 00000f80 820b6000 04300000 00000000 04899b00 2c2c0000 59d3d30f
ffff0001035339c0 2994133278 S Bi:6:002:1 -115 32768 <
ffff000103533840 2994134121 C Bi:6:002:1 0 469 = 9d010484 00000f80 24086000 04300000 00000000 5e8c9b00 2c2c0000 57cfcf0f
ffff000103533840 2994134142 S Bi:6:002:1 -115 32768 <
ffff000103533b40 2994135023 C Bi:6:002:1 0 479 = a7010484 00000f80 39096000 04300000 00000000 dc8f9b00 2c300000 5bd3d30f
ffff000103533b40 2994135042 S Bi:6:002:1 -115 32768 <
ffff000103533d80 2994233790 C Bi:6:002:1 0 478 = a6010484 00000f80 9d036000 04300000 00000000 78119d00 2c2c0000 59cdcd0f
ffff000103533d80 2994233845 S Bi:6:002:1 -115 32768 <
ffff0001035339c0 2994234767 C Bi:6:002:1 0 471 = 9f010484 00000f80 fd036000 04300000 00000000 6b159d00 2e2e0000 58d3d30f
ffff0001035339c0 2994234793 S Bi:6:002:1 -115 32768 <
ffff000103533840 2994235617 C Bi:6:002:1 0 446 = 86010484 00000f80 830b6000 04300000 00000000 f6189d00 2c340000 60cfcf0f
ffff000103533840 2994235638 S Bi:6:002:1 -115 32768 <
ffff000103533b40 2994236509 C Bi:6:002:1 0 469 = 9d010484 00000f80 25086000 04300000 00000000 561c9d00 2c300000 57d3d30f
ffff000103533b40 2994236531 S Bi:6:002:1 -115 32768 <
ffff000103533d80 2994237439 C Bi:6:002:1 0 479 = a7010484 00000f80 3a096000 04300000 00000000 db1f9d00 2e2e0000 5bd6d60f
ffff000103533d80 2994237460 S Bi:6:002:1 -115 32768 <
ffff0001035339c0 2994336198 C Bi:6:002:1 0 478 = a6010484 00000f80 9e036000 04300000 00000000 7aa19e00 2c300000 5ad1d10f
ffff0001035339c0 2994336252 S Bi:6:002:1 -115 32768 <
ffff000103533840 2994337210 C Bi:6:002:1 0 471 = 9f010484 00000f80 fe036000 04300000 00000000 89a59e00 2e2e0000 58d3d30f
ffff000103533840 2994337236 S Bi:6:002:1 -115 32768 <
ffff000103533b40 2994338061 C Bi:6:002:1 0 446 = 86010484 00000f80 840b6000 04300000 00000000 11a99e00 2e2e0000 58d7d70f
ffff000103533b40 2994338086 S Bi:6:002:1 -115 32768 <
ffff000103533d80 2994338982 C Bi:6:002:1 0 469 = 9d010484 00000f80 26086000 04300000 00000000 86ac9e00 2c300000 5acccc0f
ffff000103533d80 2994339006 S Bi:6:002:1 -115 32768 <
ffff0001035339c0 2994339886 C Bi:6:002:1 0 479 = a7010484 00000f80 3b096000 04300000 00000000 03b09e00 2e2e0000 56cfcf0f
ffff0001035339c0 2994339909 S Bi:6:002:1 -115 32768 <
ffff000103533840 2994438578 C Bi:6:002:1 0 478 = a6010484 00000f80 9f036000 04300000 00000000 7d31a000 2c2c0000 5fd0d00f
ffff000103533840 2994438633 S Bi:6:002:1 -115 32768 <
ffff000103533b40 2994439583 C Bi:6:002:1 0 471 = 9f010484 00000f80 ff036000 04300000 00000000 7735a000 30340000 60cdcd0f
ffff000103533b40 2994439612 S Bi:6:002:1 -115 32768 <
ffff000103533d80 2994440461 C Bi:6:002:1 0 446 = 86010484 00000f80 850b6000 04300000 00000000 0539a000 2c340000 60d1d10f
ffff000103533d80 2994440486 S Bi:6:002:1 -115 32768 <
ffff0001035339c0 2994441341 C Bi:6:002:1 0 469 = 9d010484 00000f80 27086000 04300000 00000000 753ca000 2c300000 58d3d30f
ffff0001035339c0 2994441363 S Bi:6:002:1 -115 32768 <
ffff000103533840 2994442242 C Bi:6:002:1 0 479 = a7010484 00000f80 3c096000 04300000 00000000 f23fa000 2e300000 5acdcd0f
ffff000103533840 2994442262 S Bi:6:002:1 -115 32768 <
ffff000103533b40 2994540951 C Bi:6:002:1 0 478 = a6010484 00000f80 a0036000 04300000 00000000 7fc1a100 2e2e0000 5ccaca0f
ffff000103533b40 2994540976 S Bi:6:002:1 -115 32768 <
ffff000103533d80 2994542862 C Bi:6:002:1 0 446 = 86010484 00000f80 860b6000 04300000 00000000 07c9a100 2e340000 61cfcf0f
ffff000103533d80 2994542888 S Bi:6:002:1 -115 32768 <
ffff0001035339c0 2994543730 C Bi:6:002:1 0 469 = 9d010484 00000f80 28086000 04300000 00000000 69cca100 2a340000 5fcfcf0f
ffff0001035339c0 2994543751 S Bi:6:002:1 -115 32768 <
ffff000103533840 2994544673 C Bi:6:002:1 0 479 = a7010484 00000f80 3d096000 04300000 00000000 e5cfa100 2e2e0000 5cd2d20f
ffff000103533840 2994544704 S Bi:6:002:1 -115 32768 <
ffff000103533b40 2994643396 C Bi:6:002:1 0 478 = a6010484 00000f80 a1036000 04300000 00000000 8151a300 2e340000 62cfcf0f
ffff000103533b40 2994643433 S Bi:6:002:1 -115 32768 <
ffff000103533d80 2994645298 C Bi:6:002:1 0 446 = 86010484 00000f80 870b6000 04300000 00000000 1e59a300 2c300000 59cece0f
ffff000103533d80 2994645333 S Bi:6:002:1 -115 32768 <
ffff0001035339c0 2994646166 C Bi:6:002:1 0 469 = 9d010484 00000f80 29086000 04300000 00000000 7d5ca300 30300000 54d0d00f
ffff0001035339c0 2994646191 S Bi:6:002:1 -115 32768 <
ffff000103533840 2994647086 C Bi:6:002:1 0 479 = a7010484 00000f80 3e096000 04300000 00000000 0560a300 2e300000 5ad3d30f
ffff000103533840 2994647111 S Bi:6:002:1 -115 32768 <
ffff000103533b40 2994745765 C Bi:6:002:1 0 478 = a6010484 00000f80 a2036000 04300000 00000000 83e1a400 2a300000 54cccc0f
ffff000103533b40 2994745812 S Bi:6:002:1 -115 32768 <
ffff000103533d80 2994746807 C Bi:6:002:1 0 471 = 9f010484 00000f80 02046000 04300000 00000000 96e5a400 34300000 5dcaca0f
ffff000103533d80 2994746834 S Bi:6:002:1 -115 32768 <
ffff0001035339c0 2994747691 C Bi:6:002:1 0 446 = 86010484 00000f80 880b6000 04300000 00000000 43e9a400 2e300000 5ad3d30f
ffff0001035339c0 2994747712 S Bi:6:002:1 -115 32768 <
ffff00014c2bfc00 2994748163 S Ci:6:002:0 s c0 05 004c 0000 0001 1 <
ffff00014c2bfc00 2994748319 C Ci:6:002:0 0 1 = 20
ffff00014c2bfc00 2994748479 S Co:6:002:0 s 40 05 004c 0000 0001 1 = 20
ffff00014c2bfc00 2994748595 C Co:6:002:0 0 1 >
ffff000103533840 2994748640 C Bi:6:002:1 0 469 = 9d010484 00000f80 2a086000 04300000 00000000 cfeca400 2e2c0000 5ad3d30f
ffff000103533840 2994748648 S Bi:6:002:1 -115 32768 <
ffff000103533b40 2994749553 C Bi:6:002:1 0 479 = a7010484 00000f80 3f096000 04300000 00000000 5ef0a400 302c0000 5dd0d00f
ffff000103533b40 2994749576 S Bi:6:002:1 -115 32768 <
ffff00014c2bfc00 2994780278 S Ci:6:002:0 s c0 05 0073 0000 0001 1 <
ffff00014c2bfc00 2994780440 C Ci:6:002:0 0 1 = 07
ffff00014c2bfc00 2994780592 S Co:6:002:0 s 40 05 0073 0000 0001 1 = 07
ffff00014c2bfc00 2994780734 C Co:6:002:0 0 1 >
ffff00014c2bfc00 2994780895 S Ci:6:002:0 s c0 05 0770 0000 0004 4 <
ffff00014c2bfc00 2994781043 C Ci:6:002:0 0 4 = 00000000
ffff00014c2bfc00 2994781199 S Ci:6:002:0 s c0 05 0774 0000 0004 4 <
ffff00014c2bfc00 2994781347 C Ci:6:002:0 0 4 = 00000000
ffff00014c2bfc00 2994781489 S Co:6:002:0 s 40 05 076e 0000 0001 1 = 0c
ffff00014c2bfc00 2994781601 C Co:6:002:0 0 1 >
ffff00014c2bfc00 2994781640 S Ci:6:002:0 s c0 05 0808 0000 0004 4 <
ffff00014c2bfc00 2994781755 C Ci:6:002:0 0 4 = 3382023e
ffff00014c2bfc00 2994781785 S Ci:6:002:0 s c0 05 0a5c 0000 0002 2 <
ffff00014c2bfc00 2994781896 C Ci:6:002:0 0 2 = 0000
ffff00014c2bfc00 2994781926 S Ci:6:002:0 s c0 05 0f48 0000 0002 2 <
ffff00014c2bfc00 2994782050 C Ci:6:002:0 0 2 = cb00
ffff00014c2bfc00 2994782080 S Ci:6:002:0 s c0 05 0f04 0000 0004 4 <
ffff00014c2bfc00 2994782192 C Ci:6:002:0 0 4 = 00000000
ffff00014c2bfc00 2994782222 S Ci:6:002:0 s c0 05 0f14 0000 0004 4 <
ffff00014c2bfc00 2994782333 C Ci:6:002:0 0 4 = 86003e00
ffff00014c2bfc00 2994782362 S Ci:6:002:0 s c0 05 0f10 0000 0004 4 <
ffff00014c2bfc00 2994782475 C Ci:6:002:0 0 4 = 00000000
ffff00014c2bfc00 2994782504 S Ci:6:002:0 s c0 05 0f0c 0000 0004 4 <
ffff00014c2bfc00 2994782616 C Ci:6:002:0 0 4 = 00000000
ffff00014c2bfc00 2994782645 S Ci:6:002:0 s c0 05 0f08 0000 0004 4 <
ffff00014c2bfc00 2994782757 C Ci:6:002:0 0 4 = 00008f01
ffff00014c2bfc00 2994782786 S Ci:6:002:0 s c0 05 0fcc 0000 0004 4 <
ffff00014c2bfc00 2994782898 C Ci:6:002:0 0 4 = 00000000
ffff00014c2bfc00 2994782927 S Ci:6:002:0 s c0 05 09a4 0000 0004 4 <
ffff00014c2bfc00 2994783050 C Ci:6:002:0 0 4 = 80000800
ffff00014c2bfc00 2994783080 S Co:6:002:0 s 40 05 09a4 0000 0004 4 = 80000a00
ffff00014c2bfc00 2994783187 C Co:6:002:0 0 4 >
ffff00014c2bfc00 2994783217 S Ci:6:002:0 s c0 05 09a4 0000 0004 4 <
ffff00014c2bfc00 2994783328 C Ci:6:002:0 0 4 = 80000a00
ffff00014c2bfc00 2994783357 S Co:6:002:0 s 40 05 09a4 0000 0004 4 = 80000800
ffff00014c2bfc00 2994783464 C Co:6:002:0 0 4 >
ffff00014c2bfc00 2994783494 S Ci:6:002:0 s c0 05 0a2c 0000 0004 4 <
ffff00014c2bfc00 2994783606 C Ci:6:002:0 0 4 = 00809000
ffff00014c2bfc00 2994783635 S Co:6:002:0 s 40 05 0a2c 0000 0004 4 = 00009000
ffff00014c2bfc00 2994783742 C Co:6:002:0 0 4 >
ffff00014c2bfc00 2994783771 S Ci:6:002:0 s c0 05 0a2c 0000 0004 4 <
ffff00014c2bfc00 2994783884 C Ci:6:002:0 0 4 = 00009000
ffff00014c2bfc00 2994783913 S Co:6:002:0 s 40 05 0a2c 0000 0004 4 = 00809000
ffff00014c2bfc00 2994784020 C Co:6:002:0 0 4 >
ffff00014c2bfc00 2994784050 S Ci:6:002:0 s c0 05 0b58 0000 0004 4 <
ffff00014c2bfc00 2994784174 C Ci:6:002:0 0 4 = 00000000
ffff00014c2bfc00 2994784202 S Co:6:002:0 s 40 05 0b58 0000 0004 4 = 01000000
ffff00014c2bfc00 2994784312 C Co:6:002:0 0 4 >
ffff00014c2bfc00 2994784333 S Ci:6:002:0 s c0 05 0b58 0000 0004 4 <
ffff00014c2bfc00 2994784445 C Ci:6:002:0 0 4 = 01000000
ffff00014c2bfc00 2994784474 S Co:6:002:0 s 40 05 0b58 0000 0004 4 = 00000000
ffff00014c2bfc00 2994784588 C Co:6:002:0 0 4 >
ffff00014c2bfc00 2994784610 S Ci:6:002:0 s c0 05 01cc 0000 0001 1 <
ffff00014c2bfc00 2994784723 C Ci:6:002:0 0 1 = 00
ffff00014c2bfc00 2994784752 S Co:6:002:0 s 40 05 01f0 0000 0004 4 = 00000000
ffff00014c2bfc00 2994784862 C Co:6:002:0 0 4 >
ffff00014c2bfc00 2994784883 S Co:6:002:0 s 40 05 01d0 0000 0004 4 = 58000000
ffff00014c2bfc00 2994784990 C Co:6:002:0 0 4 >
ffff00014c2bfc00 2994785019 S Co:6:002:0 s 40 05 0440 0000 0004 4 = 00000000
ffff00014c2bfc00 2994785133 C Co:6:002:0 0 4 >
ffff00014c2bfc00 2994785155 S Ci:6:002:0 s c0 05 0c00 0000 0004 4 <
ffff00014c2bfc00 2994785267 C Ci:6:002:0 0 4 = 07000000
ffff00014c2bfc00 2994785296 S Ci:6:002:0 s c0 05 08b0 0000 0004 4 <
ffff00014c2bfc00 2994785423 C Ci:6:002:0 0 4 = 42060000
ffff00014c2bfc00 2994785453 S Co:6:002:0 s 40 05 08b0 0000 0004 4 = 42060000
ffff00014c2bfc00 2994785561 C Co:6:002:0 0 4 >
ffff00014c2bfc00 2994785603 S Ci:6:002:0 s c0 05 0d04 0000 0004 4 <
ffff00014c2bfc00 2994785711 C Ci:6:002:0 0 4 = 108d90b1
ffff00014c2bfc00 2994785733 S Ci:6:002:0 s c0 05 0c1c 0000 0004 4 <
ffff00014c2bfc00 2994785851 C Ci:6:002:0 0 4 = 0300402d
ffff00014c2bfc00 2994785880 S Co:6:002:0 s 40 05 0c1c 0000 0004 4 = 03000039
ffff00014c2bfc00 2994785915 C Co:6:002:0 0 4 >
ffff00014c2bfc00 2994785931 S Ci:6:002:0 s c0 05 0e1c 0000 0004 4 <
ffff00014c2bfc00 2994786050 C Ci:6:002:0 0 4 = 0300402d
ffff00014c2bfc00 2994786080 S Co:6:002:0 s 40 05 0e1c 0000 0004 4 = 0300e032
ffff00014c2bfc00 2994786188 C Co:6:002:0 0 4 >
ffff00014c2bfc00 2994786217 S Co:6:002:0 s 40 05 0280 0000 0002 2 = 0001
ffff00014c2bfc00 2994786326 C Co:6:002:0 0 2 >
ffff00014c2bfc00 2994786347 S Ci:6:002:0 s c0 05 010c 0000 0001 1 <
ffff00014c2bfc00 2994786460 C Ci:6:002:0 0 1 = b4
ffff00014c2bfc00 2994786489 S Co:6:002:0 s 40 05 010c 0000 0001 1 = b4
ffff00014c2bfc00 2994786604 C Co:6:002:0 0 1 >
ffff000103533d80 2994848204 C Bi:6:002:1 0 478 = a6010484 00000f80 a3036000 04300000 00000000 8571a600 322c0000 5ad1d10f
ffff000103533d80 2994848258 S Bi:6:002:1 -115 32768 <
ffff0001035339c0 2994849182 C Bi:6:002:1 0 471 = 9f010484 00000f80 03046000 04300000 00000000 8975a600 2e300000 59cfcf0f
ffff0001035339c0 2994849205 S Bi:6:002:1 -115 32768 <
ffff000103533840 2994850941 C Bi:6:002:1 0 469 = 9d010484 00000f80 2b086000 04300000 00000000 7b7ca600 2e2c0000 5bcece0f
ffff000103533840 2994850961 S Bi:6:002:1 -115 32768 <
ffff000103533b40 2994851843 C Bi:6:002:1 0 479 = a7010484 00000f80 40096000 04300000 00000000 f67fa600 2c2c0000 58d9d90f
ffff000103533b40 2994851862 S Bi:6:002:1 -115 32768 <
ffff000103533d80 2994950570 C Bi:6:002:1 0 478 = a6010484 00000f80 a4036000 04300000 00000000 8701a800 2e2c0000 5cd3d30f
ffff000103533d80 2994950620 S Bi:6:002:1 -115 32768 <
ffff0001035339c0 2994951589 C Bi:6:002:1 0 471 = 9f010484 00000f80 04046000 04300000 00000000 8805a800 30300000 56d0d00f
ffff0001035339c0 2994951615 S Bi:6:002:1 -115 32768 <
ffff000103533840 2994952480 C Bi:6:002:1 0 446 = 86010484 00000f80 8a0b6000 04300000 00000000 2209a800 2c2c0000 59d0d00f
ffff000103533840 2994952504 S Bi:6:002:1 -115 32768 <
ffff000103533b40 2994953370 C Bi:6:002:1 0 469 = 9d010484 00000f80 2c086000 04300000 00000000 830ca800 2c2c0000 59d0d00f
ffff000103533b40 2994953399 S Bi:6:002:1 -115 32768 <
ffff000103533d80 2994954282 C Bi:6:002:1 0 479 = a7010484 00000f80 41096000 04300000 00000000 0310a800 282a0000 55dada0f
ffff000103533d80 2994954306 S Bi:6:002:1 -115 32768 <
ffff0001035339c0 2995053010 C Bi:6:002:1 0 478 = a6010484 00000f80 a5036000 04300000 00000000 8991a900 2e340000 61cece0f
ffff0001035339c0 2995053063 S Bi:6:002:1 -115 32768 <
ffff000103533840 2995053981 C Bi:6:002:1 0 471 = 9f010484 00000f80 05046000 04300000 00000000 7e95a900 2e300000 56cfcf0f
ffff000103533840 2995054009 S Bi:6:002:1 -115 32768 <
ffff000103533b40 2995054864 C Bi:6:002:1 0 446 = 86010484 00000f80 8b0b6000 04300000 00000000 0f99a900 2e2c0000 5ad0d00f
ffff000103533b40 2995054888 S Bi:6:002:1 -115 32768 <
ffff000103533d80 2995055732 C Bi:6:002:1 0 469 = 9d010484 00000f80 2d086000 04300000 00000000 6b9ca900 2e300000 59d2d20f
ffff000103533d80 2995055754 S Bi:6:002:1 -115 32768 <
ffff0001035339c0 2995056672 C Bi:6:002:1 0 479 = a7010484 00000f80 42096000 04300000 00000000 ea9fa900 2e2c0000 5bcfcf0f
ffff0001035339c0 2995056698 S Bi:6:002:1 -115 32768 <
ffff000103533840 2995155369 C Bi:6:002:1 0 478 = a6010484 00000f80 a6036000 04300000 00000000 8c21ab00 32300000 51cfcf0f
ffff000103533840 2995155423 S Bi:6:002:1 -115 32768 <
ffff000103533b40 2995156432 C Bi:6:002:1 0 471 = 9f010484 00000f80 06046000 04300000 00000000 ae25ab00 30300000 55cccc0f
ffff000103533b40 2995156458 S Bi:6:002:1 -115 32768 <
ffff000103533d80 2995157303 C Bi:6:002:1 0 446 = 86010484 00000f80 8c0b6000 04300000 00000000 4029ab00 2c300000 58d1d10f
ffff000103533d80 2995157329 S Bi:6:002:1 -115 32768 <
ffff0001035339c0 2995158207 C Bi:6:002:1 0 469 = 9d010484 00000f80 2e086000 04300000 00000000 a82cab00 2c300000 5bd4d40f
ffff0001035339c0 2995158231 S Bi:6:002:1 -115 32768 <
ffff000103533840 2995159118 C Bi:6:002:1 0 479 = a7010484 00000f80 43096000 04300000 00000000 2930ab00 2e300000 58d4d40f
ffff000103533840 2995159142 S Bi:6:002:1 -115 32768 <
ffff000103533b40 2995257813 C Bi:6:002:1 0 478 = a6010484 00000f80 a7036000 04300000 00000000 8eb1ac00 32300000 5acfcf0f
ffff000103533b40 2995257869 S Bi:6:002:1 -115 32768 <
ffff000103533d80 2995258787 C Bi:6:002:1 0 471 = 9f010484 00000f80 07046000 04300000 00000000 84b5ac00 2c2c0000 59d5d50f
ffff000103533d80 2995258815 S Bi:6:002:1 -115 32768 <
ffff0001035339c0 2995259631 C Bi:6:002:1 0 446 = 86010484 00000f80 8d0b6000 04300000 00000000 0ab9ac00 2e300000 57d0d00f
ffff0001035339c0 2995259652 S Bi:6:002:1 -115 32768 <
ffff000103533840 2995260532 C Bi:6:002:1 0 469 = 9d010484 00000f80 2f086000 04300000 00000000 6dbcac00 2e300000 58cece0f
ffff000103533840 2995260558 S Bi:6:002:1 -115 32768 <
ffff000103533b40 2995261432 C Bi:6:002:1 0 479 = a7010484 00000f80 44096000 04300000 00000000 eabfac00 2a2a0000 55d3d30f
ffff000103533b40 2995261453 S Bi:6:002:1 -115 32768 <
ffff000103533d80 2995360232 C Bi:6:002:1 0 478 = a6010484 00000f80 a8036000 04300000 00000000 9041ae00 2e2a0000 5ad2d20f
ffff000103533d80 2995360288 S Bi:6:002:1 -115 32768 <
ffff0001035339c0 2995361197 C Bi:6:002:1 0 471 = 9f010484 00000f80 08046000 04300000 00000000 9045ae00 2e2c0000 57d6d60f
ffff0001035339c0 2995361221 S Bi:6:002:1 -115 32768 <
ffff000103533840 2995362072 C Bi:6:002:1 0 446 = 86010484 00000f80 8e0b6000 04300000 00000000 1b49ae00 2c2a0000 58cece0f
ffff000103533840 2995362097 S Bi:6:002:1 -115 32768 <
ffff000103533b40 2995362962 C Bi:6:002:1 0 469 = 9d010484 00000f80 30086000 04300000 00000000 7c4cae00 2c2a0000 5dcaca0f
ffff000103533b40 2995362986 S Bi:6:002:1 -115 32768 <
ffff000103533d80 2995363851 C Bi:6:002:1 0 479 = a7010484 00000f80 45096000 04300000 00000000 f94fae00 2c340000 60d2d20f
ffff000103533d80 2995363872 S Bi:6:002:1 -115 32768 <
ffff0001035339c0 2995462570 C Bi:6:002:1 0 478 = a6010484 00000f80 a9036000 04300000 00000000 92d1af00 302e0000 57d3d30f
ffff0001035339c0 2995462618 S Bi:6:002:1 -115 32768 <
ffff000103533840 2995463604 C Bi:6:002:1 0 471 = 9f010484 00000f80 09046000 04300000 00000000 90d5af00 2c2a0000 55d5d50f
ffff000103533840 2995463630 S Bi:6:002:1 -115 32768 <
ffff000103533b40 2995464482 C Bi:6:002:1 0 446 = 86010484 00000f80 8f0b6000 04300000 00000000 29d9af00 2e300000 57cfcf0f
ffff000103533b40 2995464506 S Bi:6:002:1 -115 32768 <
ffff000103533d80 2995465376 C Bi:6:002:1 0 469 = 9d010484 00000f80 31086000 04300000 00000000 88dcaf00 2e2a0000 5bcccc0f
ffff000103533d80 2995465405 S Bi:6:002:1 -115 32768 <
ffff0001035339c0 2995466319 C Bi:6:002:1 0 479 = a7010484 00000f80 46096000 04300000 00000000 1ee0af00 2e2c0000 56cccc0f
ffff0001035339c0 2995466343 S Bi:6:002:1 -115 32768 <
ffff000103533840 2995564968 C Bi:6:002:1 0 478 = a6010484 00000f80 aa036000 04300000 00000000 9461b100 2e300000 56d1d10f
ffff000103533840 2995565017 S Bi:6:002:1 -115 32768 <
ffff000103533b40 2995565991 C Bi:6:002:1 0 471 = 9f010484 00000f80 0a046000 04300000 00000000 8b65b100 2c2c0000 5bd1d10f
ffff000103533b40 2995566020 S Bi:6:002:1 -115 32768 <
ffff000103533d80 2995566843 C Bi:6:002:1 0 446 = 86010484 00000f80 900b6000 04300000 00000000 0369b100 2c2c0000 58cccc0f
ffff000103533d80 2995566868 S Bi:6:002:1 -115 32768 <
ffff0001035339c0 2995567727 C Bi:6:002:1 0 469 = 9d010484 00000f80 32086000 04300000 00000000 6b6cb100 30300000 5ad1d10f
ffff0001035339c0 2995567748 S Bi:6:002:1 -115 32768 <
ffff000103533840 2995568631 C Bi:6:002:1 0 479 = a7010484 00000f80 47096000 04300000 00000000 e66fb100 2c2c0000 59cdcd0f
ffff000103533840 2995568661 S Bi:6:002:1 -115 32768 <
ffff000103533b40 2995667368 C Bi:6:002:1 0 478 = a6010484 00000f80 ab036000 04300000 00000000 96f1b200 2a300000 55caca0f
ffff000103533b40 2995667421 S Bi:6:002:1 -115 32768 <
ffff000103533d80 2995668413 C Bi:6:002:1 0 471 = 9f010484 00000f80 0b046000 04300000 00000000 9cf5b200 2c2c0000 58cfcf0f
ffff000103533d80 2995668439 S Bi:6:002:1 -115 32768 <
ffff0001035339c0 2995669289 C Bi:6:002:1 0 446 = 86010484 00000f80 910b6000 04300000 00000000 34f9b200 2c2a0000 5ad1d10f
ffff0001035339c0 2995669315 S Bi:6:002:1 -115 32768 <
ffff000103533840 2995670205 C Bi:6:002:1 0 469 = 9d010484 00000f80 33086000 04300000 00000000 a6fcb200 2c2a0000 58d0d00f
ffff000103533840 2995670231 S Bi:6:002:1 -115 32768 <
ffff000103533b40 2995671120 C Bi:6:002:1 0 479 = a7010484 00000f80 48096000 04300000 00000000 2f00b300 2e300000 5bd2d20f
ffff000103533b40 2995671146 S Bi:6:002:1 -115 32768 <
ffff000103533d80 2995769777 C Bi:6:002:1 0 478 = a6010484 00000f80 ac036000 04300000 00000000 9981b400 2e300000 5ad0d00f
ffff000103533d80 2995769829 S Bi:6:002:1 -115 32768 <
ffff0001035339c0 2995770815 C Bi:6:002:1 0 471 = 9f010484 00000f80 0c046000 04300000 00000000 9c85b400 2c2c0000 59d4d40f
ffff0001035339c0 2995770840 S Bi:6:002:1 -115 32768 <
ffff000103533840 2995771694 C Bi:6:002:1 0 446 = 86010484 00000f80 920b6000 04300000 00000000 2889b400 30300000 57d1d10f
ffff000103533840 2995771718 S Bi:6:002:1 -115 32768 <
ffff00014c2bfc00 2995772175 S Ci:6:002:0 s c0 05 004c 0000 0001 1 <
ffff00014c2bfc00 2995772328 C Ci:6:002:0 0 1 = 20
ffff00014c2bfc00 2995772485 S Co:6:002:0 s 40 05 004c 0000 0001 1 = 20
ffff000103533b40 2995772570 C Bi:6:002:1 0 469 = 9d010484 00000f80 34086000 04300000 00000000 8d8cb400 2c2c0000 58d2d20f
ffff000103533b40 2995772585 S Bi:6:002:1 -115 32768 <
ffff00014c2bfc00 2995772617 C Co:6:002:0 0 1 >
ffff000103533d80 2995773501 C Bi:6:002:1 0 479 = a7010484 00000f80 49096000 04300000 00000000 0f90b400 2a300000 57cccc0f
ffff000103533d80 2995773525 S Bi:6:002:1 -115 32768 <
ffff0001035339c0 2995872178 C Bi:6:002:1 0 478 = a6010484 00000f80 ad036000 04300000 00000000 9b11b600 2e300000 5ad5d50f
ffff0001035339c0 2995872203 S Bi:6:002:1 -115 32768 <
ffff000103533840 2995873205 C Bi:6:002:1 0 471 = 9f010484 00000f80 0d046000 04300000 00000000 9f15b600 2c2a0000 59d3d30f
ffff000103533840 2995873229 S Bi:6:002:1 -115 32768 <
ffff000103533b40 2995874093 C Bi:6:002:1 0 446 = 86010484 00000f80 930b6000 04300000 00000000 3a19b600 2e300000 56cece0f
ffff000103533b40 2995874117 S Bi:6:002:1 -115 32768 <
ffff000103533d80 2995874992 C Bi:6:002:1 0 469 = 9d010484 00000f80 35086000 04300000 00000000 9b1cb600 302e0000 56d3d30f
ffff000103533d80 2995875017 S Bi:6:002:1 -115 32768 <
ffff0001035339c0 2995875896 C Bi:6:002:1 0 479 = a7010484 00000f80 4a096000 04300000 00000000 1920b600 2c2c0000 57d3d30f
ffff0001035339c0 2995875920 S Bi:6:002:1 -115 32768 <
ffff000103533840 2995974575 C Bi:6:002:1 0 478 = a6010484 00000f80 ae036000 04300000 00000000 9da1b700 2e2a0000 5cd4d40f
ffff000103533840 2995974609 S Bi:6:002:1 -115 32768 <
ffff000103533b40 2995975612 C Bi:6:002:1 0 471 = 9f010484 00000f80 0e046000 04300000 00000000 b7a5b700 2e2c0000 53cfcf0f
ffff000103533b40 2995975634 S Bi:6:002:1 -115 32768 <
ffff000103533d80 2995976502 C Bi:6:002:1 0 446 = 86010484 00000f80 940b6000 04300000 00000000 50a9b700 2e2e0000 5cd2d20f
ffff000103533d80 2995976555 S Bi:6:002:1 -115 32768 <
ffff0001035339c0 2995977413 C Bi:6:002:1 0 469 = 9d010484 00000f80 36086000 04300000 00000000 b1acb700 2e2a0000 59c6c60f
ffff0001035339c0 2995977435 S Bi:6:002:1 -115 32768 <
ffff000103533840 2995978325 C Bi:6:002:1 0 479 = a7010484 00000f80 4b096000 04300000 00000000 34b0b700 34300000 5dcccc0f
ffff000103533840 2995978349 S Bi:6:002:1 -115 32768 <
ffff000103533b40 2996076987 C Bi:6:002:1 0 478 = a6010484 00000f80 af036000 04300000 00000000 9f31b900 2c300000 5bd3d30f
ffff000103533b40 2996077015 S Bi:6:002:1 -115 32768 <
ffff000103533d80 2996078017 C Bi:6:002:1 0 471 = 9f010484 00000f80 0f046000 04300000 00000000 ac35b900 2c340000 62cfcf0f
ffff000103533d80 2996078042 S Bi:6:002:1 -115 32768 <
ffff0001035339c0 2996078902 C Bi:6:002:1 0 446 = 86010484 00000f80 950b6000 04300000 00000000 4139b900 302e0000 58d1d10f
ffff0001035339c0 2996078927 S Bi:6:002:1 -115 32768 <
ffff000103533840 2996079815 C Bi:6:002:1 0 469 = 9d010484 00000f80 37086000 04300000 00000000 a13cb900 30300000 55d1d10f
ffff000103533840 2996079840 S Bi:6:002:1 -115 32768 <
ffff000103533b40 2996080725 C Bi:6:002:1 0 479 = a7010484 00000f80 4c096000 04300000 00000000 2640b900 2c2c0000 59d5d50f
ffff000103533b40 2996080767 S Bi:6:002:1 -115 32768 <
ffff000103533d80 2996113793 C Bi:6:002:1 0 86 = 1e008484 00000f20 78076900 04300000 00000000 7cc3b900 24240000 47f1f10f
ffff000103533d80 2996113819 S Bi:6:002:1 -115 32768 <
ffff0001035339c0 2996179420 C Bi:6:002:1 0 478 = a6010484 00000f80 b0036000 04300000 00000000 a1c1ba00 2c300000 5cd0d00f
ffff0001035339c0 2996179447 S Bi:6:002:1 -115 32768 <
ffff000103533840 2996180438 C Bi:6:002:1 0 471 = 9f010484 00000f80 10046000 04300000 00000000 b7c5ba00 302a0000 5acece0f
ffff000103533840 2996180467 S Bi:6:002:1 -115 32768 <
ffff000103533b40 2996181310 C Bi:6:002:1 0 446 = 86010484 00000f80 960b6000 04300000 00000000 45c9ba00 2e300000 56d0d00f
ffff000103533b40 2996181334 S Bi:6:002:1 -115 32768 <
ffff000103533d80 2996182198 C Bi:6:002:1 0 469 = 9d010484 00000f80 38086000 04300000 00000000 a1ccba00 2a300000 56caca0f
ffff000103533d80 2996182223 S Bi:6:002:1 -115 32768 <
ffff0001035339c0 2996183084 C Bi:6:002:1 0 479 = a7010484 00000f80 4d096000 04300000 00000000 20d0ba00 302a0000 56cdcd0f
ffff0001035339c0 2996183105 S Bi:6:002:1 -115 32768 <
ffff000103533840 2996217355 C Bi:6:002:1 0 86 = 1e008484 00060f22 79076900 04300000 00000000 da57bb00 24220000 49ebeb0f
ffff000103533840 2996217409 S Bi:6:002:1 -115 32768 <
ffff000103533b40 2996267592 C Bi:6:002:1 0 86 = 1e008484 00000f20 7a076900 04300000 00000000 121cbc00 22220000 46e8e80f
ffff000103533b40 2996267629 S Bi:6:002:1 -115 32768 <
ffff000103533d80 2996281842 C Bi:6:002:1 0 478 = a6010484 00000f80 b1036000 04300000 00000000 a351bc00 2e2c0000 59d2d20f
ffff000103533d80 2996281871 S Bi:6:002:1 -115 32768 <
ffff0001035339c0 2996282786 C Bi:6:002:1 0 471 = 9f010484 00000f80 11046000 04300000 00000000 8e55bc00 2c300000 58d3d30f
ffff0001035339c0 2996282811 S Bi:6:002:1 -115 32768 <
ffff000103533840 2996284561 C Bi:6:002:1 0 469 = 9d010484 00000f80 39086000 04300000 00000000 825cbc00 2c2c0000 58d6d60f
ffff000103533840 2996284590 S Bi:6:002:1 -115 32768 <
ffff000103533b40 2996285477 C Bi:6:002:1 0 479 = a7010484 00000f80 4e096000 04300000 00000000 1960bc00 2c340000 5ccdcd0f
ffff000103533b40 2996285499 S Bi:6:002:1 -115 32768 <
ffff000103533d80 2996382397 C Bi:6:002:1 0 86 = 1e008484 00060f22 7b076900 04300000 00000000 b7dcbd00 24240000 4cebeb0f
ffff000103533d80 2996382431 S Bi:6:002:1 -115 32768 <
ffff0001035339c0 2996384198 C Bi:6:002:1 0 478 = a6010484 00000f80 b2036000 04300000 00000000 a5e1bd00 2e300000 56cdcd0f
ffff0001035339c0 2996384224 S Bi:6:002:1 -115 32768 <
ffff000103533840 2996385255 C Bi:6:002:1 0 471 = 9f010484 00000f80 12046000 04300000 00000000 cfe5bd00 302c0000 55d2d20f
ffff000103533840 2996385284 S Bi:6:002:1 -115 32768 <
ffff000103533b40 2996386127 C Bi:6:002:1 0 446 = 86010484 00000f80 980b6000 04300000 00000000 5fe9bd00 2c2c0000 58d4d40f
ffff000103533b40 2996386152 S Bi:6:002:1 -115 32768 <
ffff000103533d80 2996387009 C Bi:6:002:1 0 469 = 9d010484 00000f80 3a086000 04300000 00000000 c1ecbd00 2c2a0000 5ad2d20f
ffff000103533d80 2996387035 S Bi:6:002:1 -115 32768 <
ffff0001035339c0 2996387926 C Bi:6:002:1 0 479 = a7010484 00000f80 4f096000 04300000 00000000 4df0bd00 2e300000 53d2d20f
ffff0001035339c0 2996387948 S Bi:6:002:1 -115 32768 <
ffff000103533840 2996432866 C Bi:6:002:1 0 86 = 1e008484 00000f20 7c076900 04300000 00000000 b0a1be00 24200000 48ebeb0f
ffff000103533840 2996432915 S Bi:6:002:1 -115 32768 <
ffff000103533b40 2996459368 C Bi:6:002:1 0 86 = 1e008484 00060f22 7d076900 04300000 00000000 5509bf00 24220000 4ceaea0f
ffff000103533b40 2996459396 S Bi:6:002:1 -115 32768 <
ffff000103533d80 2996486580 C Bi:6:002:1 0 478 = a6010484 00000f80 b3036000 04300000 00000000 a871bf00 2c2a0000 5bd2d20f
ffff000103533d80 2996486612 S Bi:6:002:1 -115 32768 <
ffff0001035339c0 2996487636 C Bi:6:002:1 0 471 = 9f010484 00000f80 13046000 04300000 00000000 a975bf00 2e300000 55cccc0f
ffff0001035339c0 2996487664 S Bi:6:002:1 -115 32768 <
ffff000103533840 2996488499 C Bi:6:002:1 0 446 = 86010484 00000f80 990b6000 04300000 00000000 3f79bf00 2a2c0000 5ad1d10f
ffff000103533840 2996488524 S Bi:6:002:1 -115 32768 <
ffff000103533b40 2996489391 C Bi:6:002:1 0 469 = 9d010484 00000f80 3b086000 04300000 00000000 a17cbf00 2e2c0000 59cfcf0f
ffff000103533b40 2996489416 S Bi:6:002:1 -115 32768 <
ffff000103533d80 2996490309 C Bi:6:002:1 0 479 = a7010484 00000f80 50096000 04300000 00000000 1f80bf00 2c2c0000 58d1d10f
ffff000103533d80 2996490334 S Bi:6:002:1 -115 32768 <
ffff0001035339c0 2996578119 C Bi:6:002:1 0 86 = 1e008484 00000f20 7e076900 04300000 00000000 22d9c000 24200000 45ecec0f
ffff0001035339c0 2996578145 S Bi:6:002:1 -115 32768 <
