ffff000103558cc0 1168892867 C Bi:6:002:1 0 383 = 47010484 00000f80 9b0a6000 04300000 00000000 426c6600 463c0000 89f3f301
ffff000103558cc0 1168892931 S Bi:6:002:1 -115 32768 <
ffff00014c2bf900 1168893764 C Bi:6:002:1 0 376 = 40010484 00000f80 08026000 04300000 00000000 e86f6600 463c0000 8aefef01
ffff00014c2bf900 1168893790 S Bi:6:002:1 -115 32768 <
ffff00013d62e840 1168894684 C Bi:6:002:1 0 351 = 27010484 00000f80 c80b6000 04300000 00000000 a2736600 463c0000 86f1f101
ffff00013d62e840 1168894709 S Bi:6:002:1 -115 32768 <
ffff000103533900 1168895654 C Bi:6:002:1 0 374 = 3e010484 00000f80 9b066000 04300000 00000000 4c776600 463c0000 86f1f101
ffff000103533900 1168895678 S Bi:6:002:1 -115 32768 <
ffff000103558cc0 1168896559 C Bi:6:002:1 0 384 = 48010484 00000f80 6b096000 04300000 00000000 c27a6600 463a0000 89f2f201
ffff000103558cc0 1168896585 S Bi:6:002:1 -115 32768 <
ffff00014c2bf900 1168994994 C Bi:6:002:1 0 383 = 47010484 00000f80 9c0a6000 04300000 00000000 53fb6700 463c0000 87efef01
ffff00014c2bf900 1168995022 S Bi:6:002:1 -115 32768 <
ffff00013d62e840 1168995994 C Bi:6:002:1 0 376 = 40010484 00000f80 09026000 04300000 00000000 34ff6700 463a0000 8bf4f401
ffff00013d62e840 1168996021 S Bi:6:002:1 -115 32768 <
ffff000103533900 1168996765 C Bi:6:002:1 0 351 = 27010484 00000f80 c90b6000 04300000 00000000 62026800 463a0000 86ecec01
ffff000103533900 1168996791 S Bi:6:002:1 -115 32768 <
ffff000103558cc0 1168997564 C Bi:6:002:1 0 374 = 3e010484 00000f80 9c066000 04300000 00000000 65056800 463c0000 88e9e901
ffff000103558cc0 1168997589 S Bi:6:002:1 -115 32768 <
ffff00014c2bf900 1168998386 C Bi:6:002:1 0 384 = 48010484 00000f80 6c096000 04300000 00000000 7e086800 46380000 86f4f401
ffff00014c2bf900 1168998411 S Bi:6:002:1 -115 32768 <
ffff00013d62e840 1169097381 C Bi:6:002:1 0 383 = 47010484 00000f80 9d0a6000 04300000 00000000 558b6900 463c0000 84eaea01
ffff00013d62e840 1169097404 S Bi:6:002:1 -115 32768 <
ffff000103533900 1169098413 C Bi:6:002:1 0 376 = 40010484 00000f80 0a026000 04300000 00000000 488f6900 463a0000 86eded01
ffff000103533900 1169098443 S Bi:6:002:1 -115 32768 <
ffff000103558cc0 1169099312 C Bi:6:002:1 0 351 = 27010484 00000f80 ca0b6000 04300000 00000000 f5926900 463c0000 89f6f601
ffff000103558cc0 1169099337 S Bi:6:002:1 -115 32768 <
ffff00014c2bf900 1169100138 C Bi:6:002:1 0 374 = 3e010484 00000f80 9d066000 04300000 00000000 0b966900 463a0000 87f4f401
ffff00014c2bf900 1169100164 S Bi:6:002:1 -115 32768 <
ffff00013d62e840 1169100938 C Bi:6:002:1 0 384 = 48010484 00000f80 6d096000 04300000 00000000 24996900 463a0000 88fbfb01
ffff00013d62e840 1169100964 S Bi:6:002:1 -115 32768 <
ffff000103533900 1169105550 C Bi:6:002:1 0 377 = 41010484 00000f00 330d6000 04300000 00000000 31ab6900 46380000 89f9f901
ffff000103533900 1169105574 S Bi:6:002:1 -115 32768 <
ffff000103558cc0 1169106176 C Bi:6:002:1 0 377 = 41010484 00000f00 330d6000 04300000 00000000 a6ad6900 46380000 87f4f401
ffff000103558cc0 1169106203 S Bi:6:002:1 -115 32768 <
ffff00014c2bf900 1169106792 C Bi:6:002:1 0 377 = 41010484 00000f00 330d6000 04300000 00000000 0bb06900 463a0000 89efef01
ffff00014c2bf900 1169106816 S Bi:6:002:1 -115 32768 <
ffff00013d62e840 1169107402 C Bi:6:002:1 0 377 = 41010484 00000f00 330d6000 04300000 00000000 70b26900 463a0000 84f8f801
ffff00013d62e840 1169107428 S Bi:6:002:1 -115 32768 <
ffff000103533900 1169107999 C Bi:6:002:1 0 370 = 3a010484 00000f00 12066000 04300000 00000000 deb46900 463a0000 89eded01
ffff000103533900 1169108019 S Bi:6:002:1 -115 32768 <
ffff000103558cc0 1169108608 C Bi:6:002:1 0 370 = 3a010484 00000f00 12066000 04300000 00000000 44b76900 463c0000 87f7f701
ffff000103558cc0 1169108628 S Bi:6:002:1 -115 32768 <
ffff00014c2bf900 1169109850 C Bi:6:002:1 0 370 = 3a010484 00000f00 12066000 04300000 00000000 fabb6900 44360000 87f8f801
ffff00014c2bf900 1169109875 S Bi:6:002:1 -115 32768 <
ffff00013d62e840 1169110324 C Bi:6:002:1 0 345 = 21010484 00000f00 bf086000 04300000 00000000 5cbe6900 463a0000 8cf7f701
ffff00013d62e840 1169110342 S Bi:6:002:1 -115 32768 <
ffff000103533900 1169111482 C Bi:6:002:1 0 345 = 21010484 00000f00 bf086000 04300000 00000000 dfc26900 463a0000 8aefef01
ffff000103533900 1169111499 S Bi:6:002:1 -115 32768 <
ffff000103558cc0 1169112195 C Bi:6:002:1 0 345 = 21010484 00000f00 bf086000 04300000 00000000 25c56900 46380000 89efef01
ffff000103558cc0 1169112212 S Bi:6:002:1 -115 32768 <
ffff00014c2bf900 1169112775 C Bi:6:002:1 0 378 = 42010484 00000f00 680a6000 04300000 00000000 7dc76900 463c0000 8af4f401
ffff00014c2bf900 1169112799 S Bi:6:002:1 -115 32768 <
ffff00013d62e840 1169113431 C Bi:6:002:1 0 378 = 42010484 00000f00 680a6000 04300000 00000000 efc96900 46380000 87f2f201
ffff00013d62e840 1169113456 S Bi:6:002:1 -115 32768 <
ffff000103533900 1169114536 C Bi:6:002:1 0 378 = 42010484 00000f00 680a6000 04300000 00000000 48ce6900 3e3a0000 8afefe01
ffff000103533900 1169114561 S Bi:6:002:1 -115 32768 <
ffff000103558cc0 1169115961 C Bi:6:002:1 0 378 = 42010484 00000f00 680a6000 04300000 00000000 dbd36900 463c0000 89f5f501
ffff000103558cc0 1169115985 S Bi:6:002:1 -115 32768 <
ffff00014c2bf900 1169116633 C Bi:6:002:1 0 377 = 41010484 00000f00 340d6000 04300000 00000000 7ad66900 463e0000 8aecec01
ffff00014c2bf900 1169116659 S Bi:6:002:1 -115 32768 <
ffff00013d62e840 1169117258 C Bi:6:002:1 0 377 = 41010484 00000f00 340d6000 04300000 00000000 f1d86900 443a0000 86eeee01
ffff00013d62e840 1169117283 S Bi:6:002:1 -115 32768 <
ffff000103533900 1169117879 C Bi:6:002:1 0 377 = 41010484 00000f00 340d6000 04300000 00000000 56db6900 463e0000 89f2f201
ffff000103533900 1169117904 S Bi:6:002:1 -115 32768 <
ffff000103558cc0 1169118487 C Bi:6:002:1 0 377 = 41010484 00000f00 340d6000 04300000 00000000 c4dd6900 463a0000 8af5f501
ffff000103558cc0 1169118509 S Bi:6:002:1 -115 32768 <
ffff00014c2bf900 1169119112 C Bi:6:002:1 0 370 = 3a010484 00000f00 13066000 04300000 00000000 4de06900 463a0000 83e2e201
ffff00014c2bf900 1169119131 S Bi:6:002:1 -115 32768 <
ffff00013d62e840 1169119770 C Bi:6:002:1 0 370 = 3a010484 00000f00 13066000 04300000 00000000 bce26900 463a0000 89f1f101
ffff00013d62e840 1169119795 S Bi:6:002:1 -115 32768 <
ffff000103533900 1169120384 C Bi:6:002:1 0 370 = 3a010484 00000f00 13066000 04300000 00000000 19e56900 46380000 84f0f001
ffff000103533900 1169120410 S Bi:6:002:1 -115 32768 <
ffff000103558cc0 1169120986 C Bi:6:002:1 0 370 = 3a010484 00000f00 13066000 04300000 00000000 88e76900 46380000 86f5f501
ffff000103558cc0 1169121011 S Bi:6:002:1 -115 32768 <
ffff00014c2bf900 1169121570 C Bi:6:002:1 0 345 = 21010484 00000f00 c0086000 04300000 00000000 eee96900 46380000 87f5f501
ffff00014c2bf900 1169121595 S Bi:6:002:1 -115 32768 <
ffff00013d62e840 1169122148 C Bi:6:002:1 0 345 = 21010484 00000f00 c0086000 04300000 00000000 34ec6900 423a0000 8af3f301
ffff00013d62e840 1169122174 S Bi:6:002:1 -115 32768 <
ffff000103533900 1169122726 C Bi:6:002:1 0 345 = 21010484 00000f00 c0086000 04300000 00000000 71ee6900 463e0000 88f3f301
ffff000103533900 1169122752 S Bi:6:002:1 -115 32768 <
ffff000103558cc0 1169123276 C Bi:6:002:1 0 345 = 21010484 00000f00 c0086000 04300000 00000000 aef06900 463c0000 89fafa01
ffff000103558cc0 1169123298 S Bi:6:002:1 -115 32768 <
ffff00014c2bf900 1169123899 C Bi:6:002:1 0 378 = 42010484 00000f00 690a6000 04300000 00000000 f4f26900 463c0000 87efef01
ffff00014c2bf900 1169123919 S Bi:6:002:1 -115 32768 <
ffff00013d62e840 1169125141 C Bi:6:002:1 0 378 = 42010484 00000f00 690a6000 04300000 00000000 cff76900 44380000 88f7f701
ffff00013d62e840 1169125162 S Bi:6:002:1 -115 32768 <
ffff000103533900 1169125753 C Bi:6:002:1 0 378 = 42010484 00000f00 690a6000 04300000 00000000 32fa6900 463c0000 87f7f701
ffff000103533900 1169125773 S Bi:6:002:1 -115 32768 <
ffff000103558cc0 1169199815 C Bi:6:002:1 0 383 = 47010484 00000f80 9e0a6000 04300000 00000000 561b6b00 463a0000 87eeee01
ffff000103558cc0 1169199844 S Bi:6:002:1 -115 32768 <
ffff00014c2bf900 1169200807 C Bi:6:002:1 0 376 = 40010484 00000f80 0b026000 04300000 00000000 561f6b00 463a0000 88eaea01
ffff00014c2bf900 1169200837 S Bi:6:002:1 -115 32768 <
ffff00013d62e840 1169201763 C Bi:6:002:1 0 351 = 27010484 00000f80 cb0b6000 04300000 00000000 10236b00 443a0000 88f4f401
ffff00013d62e840 1169201790 S Bi:6:002:1 -115 32768 <
ffff000103533900 1169202706 C Bi:6:002:1 0 374 = 3e010484 00000f80 9e066000 04300000 00000000 ba266b00 463c0000 88f2f201
ffff000103533900 1169202732 S Bi:6:002:1 -115 32768 <
ffff000103558cc0 1169203588 C Bi:6:002:1 0 384 = 48010484 00000f80 6e096000 04300000 00000000 1f2a6b00 463a0000 86efef01
ffff000103558cc0 1169203614 S Bi:6:002:1 -115 32768 <
ffff00014c2bf900 1169304041 C Bi:6:002:1 0 376 = 40010484 00000f80 0c026000 04300000 00000000 96b26c00 463a0000 89f4f401
ffff00014c2bf900 1169304094 S Bi:6:002:1 -115 32768 <
ffff00013d62e840 1169304865 C Bi:6:002:1 0 351 = 27010484 00000f80 cc0b6000 04300000 00000000 e3b56c00 46400000 88000001
ffff00013d62e840 1169304894 S Bi:6:002:1 -115 32768 <
ffff000103533900 1169306508 C Bi:6:002:1 0 384 = 48010484 00000f80 6f096000 04300000 00000000 26bc6c00 46380000 8af0f001
ffff000103533900 1169306534 S Bi:6:002:1 -115 32768 <
ffff000103558cc0 1169404806 C Bi:6:002:1 0 383 = 47010484 00000f80 a00a6000 04300000 00000000 2e3c6e00 463e0000 85f7f701
ffff000103558cc0 1169404837 S Bi:6:002:1 -115 32768 <
ffff00014c2bf900 1169405780 C Bi:6:002:1 0 376 = 40010484 00000f80 0d026000 04300000 00000000 d43f6e00 463a0000 87fcfc01
ffff00014c2bf900 1169405806 S Bi:6:002:1 -115 32768 <
ffff00013d62e840 1169406661 C Bi:6:002:1 0 351 = 27010484 00000f80 cd0b6000 04300000 00000000 8e436e00 463c0000 87f0f001
ffff00013d62e840 1169406684 S Bi:6:002:1 -115 32768 <
ffff000103533900 1169407569 C Bi:6:002:1 0 374 = 3e010484 00000f80 a0066000 04300000 00000000 38476e00 46380000 88f4f401
ffff000103533900 1169407593 S Bi:6:002:1 -115 32768 <
ffff000103558cc0 1169408539 C Bi:6:002:1 0 384 = 48010484 00000f80 70096000 04300000 00000000 a04a6e00 463a0000 88f1f101
ffff000103558cc0 1169408564 S Bi:6:002:1 -115 32768 <
ffff00014c2bf900 1169507030 C Bi:6:002:1 0 383 = 47010484 00000f80 a10a6000 04300000 00000000 5bcb6f00 483c0000 87f0f001
ffff00014c2bf900 1169507087 S Bi:6:002:1 -115 32768 <
ffff00013d62e840 1169507966 C Bi:6:002:1 0 376 = 40010484 00000f80 0e026000 04300000 00000000 27cf6f00 463a0000 89f5f501
ffff00013d62e840 1169507995 S Bi:6:002:1 -115 32768 <
ffff000103533900 1169508778 C Bi:6:002:1 0 351 = 27010484 00000f80 ce0b6000 04300000 00000000 72d26f00 483c0000 88f1f101
ffff000103533900 1169508805 S Bi:6:002:1 -115 32768 <
ffff000103558cc0 1169509840 C Bi:6:002:1 0 374 = 3e010484 00000f80 a1066000 04300000 00000000 7dd66f00 403c0000 89fafa01
ffff000103558cc0 1169509864 S Bi:6:002:1 -115 32768 <
ffff00014c2bf900 1169510755 C Bi:6:002:1 0 384 = 48010484 00000f80 71096000 04300000 00000000 f5d96f00 463a0000 86f5f501
ffff00014c2bf900 1169510780 S Bi:6:002:1 -115 32768 <
ffff00013d62e840 1169609388 C Bi:6:002:1 0 383 = 47010484 00000f80 a20a6000 04300000 00000000 5c5b7100 463c0000 89ecec01
ffff00013d62e840 1169609444 S Bi:6:002:1 -115 32768 <
ffff000103533900 1169610420 C Bi:6:002:1 0 376 = 40010484 00000f80 0f026000 04300000 00000000 545f7100 463a0000 84e6e601
ffff000103533900 1169610450 S Bi:6:002:1 -115 32768 <
ffff000103558cc0 1169611332 C Bi:6:002:1 0 351 = 27010484 00000f80 cf0b6000 04300000 00000000 0e637100 463a0000 88eded01
ffff000103558cc0 1169611359 S Bi:6:002:1 -115 32768 <
ffff00014c2bf900 1169612305 C Bi:6:002:1 0 374 = 3e010484 00000f80 a2066000 04300000 00000000 b8667100 463a0000 83fbfb01
ffff00014c2bf900 1169612330 S Bi:6:002:1 -115 32768 <
ffff00013d62e840 1169613200 C Bi:6:002:1 0 384 = 48010484 00000f80 72096000 04300000 00000000 2c6a7100 463a0000 8aefef01
ffff00013d62e840 1169613227 S Bi:6:002:1 -115 32768 <
ffff000103533900 1169711791 C Bi:6:002:1 0 383 = 47010484 00000f80 a30a6000 04300000 00000000 5deb7200 463c0000 8afbfb01
ffff000103533900 1169711822 S Bi:6:002:1 -115 32768 <
ffff000103558cc0 1169712830 C Bi:6:002:1 0 376 = 40010484 00000f80 10026000 04300000 00000000 5def7200 443a0000 8af2f201
ffff000103558cc0 1169712860 S Bi:6:002:1 -115 32768 <
ffff00014c2bf900 1169713751 C Bi:6:002:1 0 351 = 27010484 00000f80 d00b6000 04300000 00000000 18f37200 463c0000 87efef01
ffff00014c2bf900 1169713778 S Bi:6:002:1 -115 32768 <
ffff00013d62e840 1169715041 C Bi:6:002:1 0 374 = 3e010484 00000f80 a3066000 04300000 00000000 10f87200 463e0000 8cf8f801
ffff00013d62e840 1169715066 S Bi:6:002:1 -115 32768 <
ffff000103533900 1169715845 C Bi:6:002:1 0 384 = 48010484 00000f80 73096000 04300000 00000000 22fb7200 463a0000 87f5f501
ffff000103533900 1169715870 S Bi:6:002:1 -115 32768 <
ffff000103533780 1169756173 S Ci:6:002:0 s c0 05 004c 0000 0001 1 <
ffff000103533780 1169756306 C Ci:6:002:0 0 1 = 20
ffff000103533780 1169756513 S Co:6:002:0 s 40 05 004c 0000 0001 1 = 20
ffff000103533780 1169756668 C Co:6:002:0 0 1 >
ffff0001035330c0 1169797992 S Ci:6:002:0 s c0 05 0454 0000 0001 1 <
ffff0001035330c0 1169798078 C Ci:6:002:0 0 1 = 00
ffff0001035330c0 1169798178 S Ci:6:002:0 s c0 05 0860 0000 0004 4 <
ffff0001035330c0 1169798216 C Ci:6:002:0 0 4 = 21c3d572
ffff0001035330c0 1169798254 S Co:6:002:0 s 40 05 0860 0000 0004 4 = 21c3d572
ffff0001035330c0 1169798284 C Co:6:002:0 0 4 >
ffff0001035330c0 1169798315 S Ci:6:002:0 s c0 05 0c00 0000 0004 4 <
ffff0001035330c0 1169798348 C Ci:6:002:0 0 4 = 07000000
ffff0001035330c0 1169798381 S Ci:6:002:0 s c0 05 08b0 0000 0004 4 <
ffff0001035330c0 1169798414 C Ci:6:002:0 0 4 = 42060000
ffff0001035330c0 1169798444 S Co:6:002:0 s 40 05 08b0 0000 0004 4 = 18060000
ffff0001035330c0 1169798473 C Co:6:002:0 0 4 >
ffff0001035330c0 1169798524 S Ci:6:002:0 s c0 05 0d04 0000 0004 4 <
ffff0001035330c0 1169798569 C Ci:6:002:0 0 4 = 017c90b1
ffff0001035330c0 1169798598 S Co:6:002:0 s 40 05 0c90 0000 0004 4 = 017c8001
ffff0001035330c0 1169798643 C Co:6:002:0 0 4 >
ffff0001035330c0 1169798685 S Ci:6:002:0 s c0 05 08ac 0000 0004 4 <
ffff0001035330c0 1169798730 C Ci:6:002:0 0 4 = 08faf00f
ffff0001035330c0 1169798761 S Co:6:002:0 s 40 05 08ac 0000 0004 4 = 08faf00f
ffff0001035330c0 1169798790 C Co:6:002:0 0 4 >
ffff0001035330c0 1169798818 S Ci:6:002:0 s c0 05 08ac 0000 0004 4 <
ffff0001035330c0 1169798852 C Ci:6:002:0 0 4 = 08faf00f
ffff0001035330c0 1169798881 S Co:6:002:0 s 40 05 08ac 0000 0004 4 = 08faf00f
ffff0001035330c0 1169798911 C Co:6:002:0 0 4 >
ffff0001035330c0 1169798939 S Ci:6:002:0 s c0 05 08c4 0000 0004 4 <
ffff0001035330c0 1169798973 C Ci:6:002:0 0 4 = 00000000
ffff0001035330c0 1169799003 S Co:6:002:0 s 40 05 08c4 0000 0004 4 = 00000000
ffff0001035330c0 1169799033 C Co:6:002:0 0 4 >
ffff0001035330c0 1169799062 S Ci:6:002:0 s c0 05 0c00 0000 0004 4 <
ffff0001035330c0 1169799096 C Ci:6:002:0 0 4 = 07000000
ffff0001035330c0 1169799126 S Ci:6:002:0 s c0 05 08b0 0000 0004 4 <
ffff0001035330c0 1169799171 C Ci:6:002:0 0 4 = 18060000
ffff0001035330c0 1169799200 S Co:6:002:0 s 40 05 08b0 0000 0004 4 = 18060000
ffff0001035330c0 1169799228 C Co:6:002:0 0 4 >
ffff0001035330c0 1169799277 S Ci:6:002:0 s c0 05 0d04 0000 0004 4 <
ffff0001035330c0 1169799323 C Ci:6:002:0 0 4 = 017c90b1
ffff0001035330c0 1169799353 S Co:6:002:0 s 40 05 0c90 0000 0004 4 = 017c8001
ffff0001035330c0 1169799395 C Co:6:002:0 0 4 >
ffff0001035330c0 1169799438 S Ci:6:002:0 s c0 05 0e00 0000 0004 4 <
ffff0001035330c0 1169799484 C Ci:6:002:0 0 4 = 07000000
ffff0001035330c0 1169799513 S Ci:6:002:0 s c0 05 08b0 0000 0004 4 <
ffff0001035330c0 1169799546 C Ci:6:002:0 0 4 = 18060000
ffff0001035330c0 1169799575 S Co:6:002:0 s 40 05 08b0 0000 0004 4 = 18060000
ffff0001035330c0 1169799603 C Co:6:002:0 0 4 >
ffff0001035330c0 1169799653 S Ci:6:002:0 s c0 05 0d44 0000 0004 4 <
ffff0001035330c0 1169799698 C Ci:6:002:0 0 4 = 017c90b1
ffff0001035330c0 1169799727 S Co:6:002:0 s 40 05 0e90 0000 0004 4 = 017c8001
ffff0001035330c0 1169799770 C Co:6:002:0 0 4 >
ffff0001035330c0 1169799813 S Ci:6:002:0 s c0 05 08ac 0000 0004 4 <
ffff0001035330c0 1169799859 C Ci:6:002:0 0 4 = 08faf00f
ffff0001035330c0 1169799888 S Co:6:002:0 s 40 05 08ac 0000 0004 4 = 08faf00f
ffff0001035330c0 1169799916 C Co:6:002:0 0 4 >
ffff0001035330c0 1169799945 S Ci:6:002:0 s c0 05 08ac 0000 0004 4 <
ffff0001035330c0 1169799978 C Ci:6:002:0 0 4 = 08faf00f
ffff0001035330c0 1169800066 S Co:6:002:0 s 40 05 08ac 0000 0004 4 = 08faf00f
ffff0001035330c0 1169800098 C Co:6:002:0 0 4 >
ffff0001035330c0 1169800130 S Ci:6:002:0 s c0 05 08c4 0000 0004 4 <
ffff0001035330c0 1169800165 C Ci:6:002:0 0 4 = 00000000
ffff0001035330c0 1169800209 S Co:6:002:0 s 40 05 08c4 0000 0004 4 = 00000000
ffff0001035330c0 1169800239 C Co:6:002:0 0 4 >
ffff0001035330c0 1169800273 S Ci:6:002:0 s c0 05 0e00 0000 0004 4 <
ffff0001035330c0 1169800323 C Ci:6:002:0 0 4 = 07000000
ffff000103533780 1169800355 S Ci:6:002:0 s c0 05 08b0 0000 0004 4 <
ffff000103533780 1169800399 C Ci:6:002:0 0 4 = 18060000
ffff000103533780 1169800432 S Co:6:002:0 s 40 05 08b0 0000 0004 4 = 18060000
ffff000103533780 1169800462 C Co:6:002:0 0 4 >
ffff000103533780 1169800515 S Ci:6:002:0 s c0 05 0d44 0000 0004 4 <
ffff000103533780 1169800558 C Ci:6:002:0 0 4 = 017c90b1
ffff000103533780 1169800594 S Co:6:002:0 s 40 05 0e90 0000 0004 4 = 017c8001
ffff000103533780 1169800643 C Co:6:002:0 0 4 >
ffff000103533780 1169800692 S Ci:6:002:0 s c0 05 0668 0000 0002 2 <
ffff000103533780 1169800740 C Ci:6:002:0 0 2 = 0010
ffff000103533780 1169800774 S Co:6:002:0 s 40 05 0668 0000 0002 2 = 0010
ffff000103533780 1169800805 C Co:6:002:0 0 2 >
ffff000103533780 1169800838 S Co:6:002:0 s 40 05 0483 0000 0001 1 = 00
ffff000103533780 1169800869 C Co:6:002:0 0 1 >
ffff000103533780 1169800904 S Ci:6:002:0 s c0 05 0837 0000 0001 1 <
ffff000103533780 1169800942 C Ci:6:002:0 0 1 = 00
ffff000103533780 1169800977 S Ci:6:002:0 s c0 05 08ac 0000 0004 4 <
ffff000103533780 1169801026 C Ci:6:002:0 0 4 = 08faf00f
ffff000103533780 1169801061 S Co:6:002:0 s 40 05 08ac 0000 0004 4 = 08faf00f
ffff000103533780 1169801092 C Co:6:002:0 0 4 >
ffff000103533780 1169801127 S Ci:6:002:0 s c0 05 08c4 0000 0004 4 <
ffff000103533780 1169801165 C Ci:6:002:0 0 4 = 00000000
ffff000103533780 1169801200 S Co:6:002:0 s 40 05 08c4 0000 0004 4 = 00000000
ffff000103533780 1169801232 C Co:6:002:0 0 4 >
ffff000103533780 1169801266 S Ci:6:002:0 s c0 05 0848 0000 0004 4 <
ffff000103533780 1169801304 C Ci:6:002:0 0 4 = 8bffd061
ffff000103533780 1169801340 S Co:6:002:0 s 40 05 0848 0000 0004 4 = 8bffd061
ffff000103533780 1169801372 C Co:6:002:0 0 4 >
ffff000103533780 1169801407 S Ci:6:002:0 s c0 05 08ac 0000 0004 4 <
ffff000103533780 1169801448 C Ci:6:002:0 0 4 = 08faf00f
ffff000103533780 1169801483 S Co:6:002:0 s 40 05 08ac 0000 0004 4 = 08faf00f
ffff000103533780 1169801522 C Co:6:002:0 0 4 >
ffff000103533780 1169801556 S Ci:6:002:0 s c0 05 08ac 0000 0004 4 <
ffff000103533780 1169801595 C Ci:6:002:0 0 4 = 08faf00f
ffff000103533780 1169801631 S Co:6:002:0 s 40 05 08ac 0000 0004 4 = 08faf00f
ffff000103533780 1169801663 C Co:6:002:0 0 4 >
ffff000103533780 1169801697 S Ci:6:002:0 s c0 05 08c4 0000 0004 4 <
ffff000103533780 1169801736 C Ci:6:002:0 0 4 = 00000000
ffff000103533780 1169801771 S Co:6:002:0 s 40 05 08c4 0000 0004 4 = 00000000
ffff000103533780 1169801803 C Co:6:002:0 0 4 >
ffff000103533780 1169801837 S Ci:6:002:0 s c0 05 0c00 0000 0004 4 <
ffff000103533780 1169801894 C Ci:6:002:0 0 4 = 07000000
ffff000103533780 1169801928 S Ci:6:002:0 s c0 05 08b0 0000 0004 4 <
ffff000103533780 1169801966 C Ci:6:002:0 0 4 = 18060000
ffff000103533780 1169802001 S Co:6:002:0 s 40 05 08b0 0000 0004 4 = 18060000
ffff000103533780 1169802032 C Co:6:002:0 0 4 >
ffff000103533780 1169802088 S Ci:6:002:0 s c0 05 0d04 0000 0004 4 <
ffff000103533780 1169802151 C Ci:6:002:0 0 4 = 017c90b1
ffff000103533780 1169802186 S Co:6:002:0 s 40 05 0c90 0000 0004 4 = 017c8001
ffff000103533780 1169802216 C Co:6:002:0 0 4 >
ffff000103533780 1169802263 S Ci:6:002:0 s c0 05 0e00 0000 0004 4 <
ffff000103533780 1169802313 C Ci:6:002:0 0 4 = 07000000
ffff000103533780 1169802348 S Ci:6:002:0 s c0 05 08b0 0000 0004 4 <
ffff000103533780 1169802401 C Ci:6:002:0 0 4 = 18060000
ffff000103533780 1169802436 S Co:6:002:0 s 40 05 08b0 0000 0004 4 = 18060000
ffff000103533780 1169802466 C Co:6:002:0 0 4 >
ffff000103533780 1169802522 S Ci:6:002:0 s c0 05 0d44 0000 0004 4 <
ffff000103533780 1169802571 C Ci:6:002:0 0 4 = 017c90b1
ffff000103533780 1169802605 S Co:6:002:0 s 40 05 0e90 0000 0004 4 = 017c8001
ffff000103533780 1169802647 C Co:6:002:0 0 4 >
ffff000103533780 1169802716 S Ci:6:002:0 s c0 05 0c20 0000 0004 4 <
ffff000103533780 1169802777 C Ci:6:002:0 0 4 = 13131313
ffff000103533780 1169802820 S Co:6:002:0 s 40 05 0c20 0000 0004 4 = 13131313
ffff000103533780 1169802851 C Co:6:002:0 0 4 >
ffff000103533780 1169802887 S Ci:6:002:0 s c0 05 0c24 0000 0004 4 <
ffff000103533780 1169802938 C Ci:6:002:0 0 4 = 20202020
ffff000103533780 1169802972 S Co:6:002:0 s 40 05 0c24 0000 0004 4 = 20202020
ffff000103533780 1169803020 C Co:6:002:0 0 4 >
ffff000103533780 1169803054 S Ci:6:002:0 s c0 05 0c28 0000 0004 4 <
ffff000103533780 1169803092 C Ci:6:002:0 0 4 = 20201e1c
ffff000103533780 1169803127 S Co:6:002:0 s 40 05 0c28 0000 0004 4 = 20201e1c
ffff000103533780 1169803157 C Co:6:002:0 0 4 >
ffff000103533780 1169803192 S Ci:6:002:0 s c0 05 0c2c 0000 0004 4 <
ffff000103533780 1169803231 C Ci:6:002:0 0 4 = 20202020
ffff000103533780 1169803267 S Co:6:002:0 s 40 05 0c2c 0000 0004 4 = 20202020
ffff000103533780 1169803298 C Co:6:002:0 0 4 >
ffff000103533780 1169803332 S Ci:6:002:0 s c0 05 0c30 0000 0004 4 <
ffff000103533780 1169803372 C Ci:6:002:0 0 4 = 20201e1c
ffff000103533780 1169803407 S Co:6:002:0 s 40 05 0c30 0000 0004 4 = 20201e1c
ffff000103533780 1169803439 C Co:6:002:0 0 4 >
ffff000103533780 1169803474 S Ci:6:002:0 s c0 05 0c34 0000 0004 4 <
ffff000103533780 1169803523 C Ci:6:002:0 0 4 = 20202020
ffff000103533780 1169803558 S Co:6:002:0 s 40 05 0c34 0000 0004 4 = 20202020
ffff000103533780 1169803590 C Co:6:002:0 0 4 >
ffff000103533780 1169803625 S Ci:6:002:0 s c0 05 0c38 0000 0004 4 <
ffff000103533780 1169803660 C Ci:6:002:0 0 4 = 201e1c1a
ffff000103533780 1169803695 S Co:6:002:0 s 40 05 0c38 0000 0004 4 = 201e1c1a
ffff000103533780 1169803726 C Co:6:002:0 0 4 >
ffff000103533780 1169803761 S Ci:6:002:0 s c0 05 0c3c 0000 0004 4 <
ffff000103533780 1169803796 C Ci:6:002:0 0 4 = 20202020
ffff000103533780 1169803831 S Co:6:002:0 s 40 05 0c3c 0000 0004 4 = 20202020
ffff000103533780 1169803862 C Co:6:002:0 0 4 >
ffff000103533780 1169803897 S Ci:6:002:0 s c0 05 0c40 0000 0004 4 <
ffff000103533780 1169803933 C Ci:6:002:0 0 4 = 20201e1c
ffff000103533780 1169803968 S Co:6:002:0 s 40 05 0c40 0000 0004 4 = 20201e1c
ffff000103533780 1169804028 C Co:6:002:0 0 4 >
ffff000103533780 1169804064 S Ci:6:002:0 s c0 05 0c44 0000 0004 4 <
ffff000103533780 1169804100 C Ci:6:002:0 0 4 = 1a181e1e
ffff000103533780 1169804135 S Co:6:002:0 s 40 05 0c44 0000 0004 4 = 1a181e1e
ffff000103533780 1169804167 C Co:6:002:0 0 4 >
ffff000103533780 1169804202 S Ci:6:002:0 s c0 05 0c48 0000 0004 4 <
ffff000103533780 1169804238 C Ci:6:002:0 0 4 = 1e1e1e1e
ffff000103533780 1169804273 S Co:6:002:0 s 40 05 0c48 0000 0004 4 = 1e1e1e1e
ffff000103533780 1169804305 C Co:6:002:0 0 4 >
ffff000103533780 1169804340 S Ci:6:002:0 s c0 05 0c4c 0000 0004 4 <
ffff000103533780 1169804391 C Ci:6:002:0 0 4 = 1c1a1816
ffff000103533780 1169804426 S Co:6:002:0 s 40 05 0c4c 0000 0004 4 = 1c1a1816
ffff000103533780 1169804457 C Co:6:002:0 0 4 >
ffff000103533780 1169804492 S Ci:6:002:0 s c0 05 0c54 0000 0004 4 <
ffff000103533780 1169804528 C Ci:6:002:0 0 4 = 120a0400
ffff000103533780 1169804562 S Co:6:002:0 s 40 05 0c54 0000 0004 4 = 120a0400
ffff000103533780 1169804594 C Co:6:002:0 0 4 >
ffff000103533780 1169804628 S Ci:6:002:0 s c0 05 0e20 0000 0004 4 <
ffff000103533780 1169804664 C Ci:6:002:0 0 4 = 14141414
ffff000103533780 1169804699 S Co:6:002:0 s 40 05 0e20 0000 0004 4 = 14141414
ffff000103533780 1169804731 C Co:6:002:0 0 4 >
ffff000103533780 1169804766 S Ci:6:002:0 s c0 05 0e24 0000 0004 4 <
ffff000103533780 1169804802 C Ci:6:002:0 0 4 = 1d1d1d1d
ffff000103533780 1169804837 S Co:6:002:0 s 40 05 0e24 0000 0004 4 = 1d1d1d1d
ffff000103533780 1169804868 C Co:6:002:0 0 4 >
ffff000103533780 1169804903 S Ci:6:002:0 s c0 05 0e28 0000 0004 4 <
ffff000103533780 1169804940 C Ci:6:002:0 0 4 = 1d1d1b19
ffff000103533780 1169804975 S Co:6:002:0 s 40 05 0e28 0000 0004 4 = 1d1d1b19
ffff000103533780 1169805022 C Co:6:002:0 0 4 >
ffff000103533780 1169805056 S Ci:6:002:0 s c0 05 0e2c 0000 0004 4 <
ffff000103533780 1169805093 C Ci:6:002:0 0 4 = 1f1f1f1f
ffff000103533780 1169805128 S Co:6:002:0 s 40 05 0e2c 0000 0004 4 = 1f1f1f1f
ffff000103533780 1169805159 C Co:6:002:0 0 4 >
ffff000103533780 1169805198 S Ci:6:002:0 s c0 05 0e30 0000 0004 4 <
ffff000103533780 1169805235 C Ci:6:002:0 0 4 = 1f1f1d1b
ffff000103533780 1169805271 S Co:6:002:0 s 40 05 0e30 0000 0004 4 = 1f1f1d1b
ffff000103533780 1169805303 C Co:6:002:0 0 4 >
ffff000103533780 1169805337 S Ci:6:002:0 s c0 05 0e34 0000 0004 4 <
ffff000103533780 1169805392 C Ci:6:002:0 0 4 = 1f1f1f1f
ffff000103533780 1169805429 S Co:6:002:0 s 40 05 0e34 0000 0004 4 = 1f1f1f1f
ffff000103533780 1169805461 C Co:6:002:0 0 4 >
ffff000103533780 1169805495 S Ci:6:002:0 s c0 05 0e38 0000 0004 4 <
ffff000103533780 1169805532 C Ci:6:002:0 0 4 = 1f1d1b19
ffff000103533780 1169805567 S Co:6:002:0 s 40 05 0e38 0000 0004 4 = 1f1d1b19
ffff000103533780 1169805599 C Co:6:002:0 0 4 >
ffff000103533780 1169805633 S Ci:6:002:0 s c0 05 0e3c 0000 0004 4 <
ffff000103533780 1169805670 C Ci:6:002:0 0 4 = 1f1f1f1f
ffff000103533780 1169805705 S Co:6:002:0 s 40 05 0e3c 0000 0004 4 = 1f1f1f1f
ffff000103533780 1169805736 C Co:6:002:0 0 4 >
ffff000103533780 1169805771 S Ci:6:002:0 s c0 05 0e40 0000 0004 4 <
ffff000103533780 1169805807 C Ci:6:002:0 0 4 = 1f1f1d1b
ffff000103533780 1169805841 S Co:6:002:0 s 40 05 0e40 0000 0004 4 = 1f1f1d1b
ffff000103533780 1169805890 C Co:6:002:0 0 4 >
ffff000103533780 1169805924 S Ci:6:002:0 s c0 05 0e44 0000 0004 4 <
ffff000103533780 1169805961 C Ci:6:002:0 0 4 = 19171d1d
ffff000103533780 1169805996 S Co:6:002:0 s 40 05 0e44 0000 0004 4 = 19171d1d
ffff000103533780 1169806027 C Co:6:002:0 0 4 >
ffff000103533780 1169806062 S Ci:6:002:0 s c0 05 0e48 0000 0004 4 <
ffff000103533780 1169806100 C Ci:6:002:0 0 4 = 1d1d1d1d
ffff000103533780 1169806135 S Co:6:002:0 s 40 05 0e48 0000 0004 4 = 1d1d1d1d
ffff000103533780 1169806167 C Co:6:002:0 0 4 >
ffff000103533780 1169806202 S Ci:6:002:0 s c0 05 0e4c 0000 0004 4 <
ffff000103533780 1169806238 C Ci:6:002:0 0 4 = 1b191715
ffff000103533780 1169806273 S Co:6:002:0 s 40 05 0e4c 0000 0004 4 = 1b191715
ffff000103533780 1169806304 C Co:6:002:0 0 4 >
ffff000103533780 1169806339 S Ci:6:002:0 s c0 05 0e54 0000 0004 4 <
ffff000103533780 1169806393 C Ci:6:002:0 0 4 = 11090300
ffff000103533780 1169806427 S Co:6:002:0 s 40 05 0e54 0000 0004 4 = 11090300
ffff000103533780 1169806459 C Co:6:002:0 0 4 >
ffff000103533780 1169806508 S Ci:6:002:0 s c0 05 0454 0000 0001 1 <
ffff000103533780 1169806556 C Ci:6:002:0 0 1 = 00
ffff000103533780 1169806590 S Ci:6:002:0 s c0 05 0454 0000 0001 1 <
ffff000103533780 1169806643 C Ci:6:002:0 0 1 = 00
ffff000103533780 1169806676 S Co:6:002:0 s 40 05 0454 0000 0001 1 = 80
ffff000103533780 1169806707 C Co:6:002:0 0 1 >
ffff000103533780 1169806741 S Ci:6:002:0 s c0 05 041a 0000 0002 2 <
ffff000103533780 1169806778 C Ci:6:002:0 0 2 = ff0f
ffff000103533780 1169806812 S Ci:6:002:0 s c0 05 0808 0000 0004 4 <
ffff000103533780 1169806848 C Ci:6:002:0 0 4 = 3382023e
ffff000103533780 1169806883 S Co:6:002:0 s 40 05 0808 0000 0004 4 = 3382023e
ffff000103533780 1169806913 C Co:6:002:0 0 4 >
ffff000103533780 1169806947 S Ci:6:002:0 s c0 05 0834 0000 0004 4 <
ffff000103533780 1169806983 C Ci:6:002:0 0 4 = 05a73700
ffff000103533780 1169807018 S Co:6:002:0 s 40 05 0834 0000 0004 4 = 06a73700
ffff000103533780 1169807049 C Co:6:002:0 0 4 >
ffff000103533780 1169807084 S Ci:6:002:0 s c0 05 0830 0000 0004 4 <
ffff000103533780 1169807121 C Ci:6:002:0 0 4 = b8eeaa2e
ffff000103533780 1169807156 S Co:6:002:0 s 40 05 0830 0000 0004 4 = b8aeaa2e
ffff000103533780 1169807187 C Co:6:002:0 0 4 >
ffff000103533780 1169807221 S Ci:6:002:0 s c0 05 0830 0000 0004 4 <
ffff000103533780 1169807275 C Ci:6:002:0 0 4 = b8aeaa2e
ffff000103533780 1169807310 S Co:6:002:0 s 40 05 0830 0000 0004 4 = b8aeaa2e
ffff000103533780 1169807341 C Co:6:002:0 0 4 >
ffff000103533780 1169807375 S Ci:6:002:0 s c0 05 082c 0000 0004 4 <
ffff000103533780 1169807413 C Ci:6:002:0 0 4 = dc832000
ffff000103533780 1169807448 S Co:6:002:0 s 40 05 082c 0000 0004 4 = dd832000
ffff000103533780 1169807479 C Co:6:002:0 0 4 >
ffff000103533780 1169807514 S Co:6:002:0 s 40 05 0cb0 0000 0004 4 = 17773354
ffff000103533780 1169807545 C Co:6:002:0 0 4 >
ffff000103533780 1169807579 S Co:6:002:0 s 40 05 0eb0 0000 0004 4 = 17773354
ffff000103533780 1169807610 C Co:6:002:0 0 4 >
ffff000103533780 1169807644 S Ci:6:002:0 s c0 05 0cb4 0000 0004 4 <
ffff000103533780 1169807681 C Ci:6:002:0 0 4 = 77000001
ffff000103533780 1169807715 S Co:6:002:0 s 40 05 0cb4 0000 0004 4 = 77000001
ffff000103533780 1169807765 C Co:6:002:0 0 4 >
ffff000103533780 1169807799 S Ci:6:002:0 s c0 05 0eb4 0000 0004 4 <
ffff000103533780 1169807836 C Ci:6:002:0 0 4 = 77000001
ffff000103533780 1169807871 S Co:6:002:0 s 40 05 0eb4 0000 0004 4 = 77000001
ffff000103533780 1169807903 C Co:6:002:0 0 4 >
ffff000103533780 1169807937 S Ci:6:002:0 s c0 05 0900 0000 0004 4 <
ffff000103533780 1169807974 C Ci:6:002:0 0 4 = 01040000
ffff000103533780 1169808029 S Co:6:002:0 s 40 05 0900 0000 0004 4 = 01040000
ffff000103533780 1169808090 C Co:6:002:0 0 4 >
ffff000103533780 1169808127 S Ci:6:002:0 s c0 05 080c 0000 0004 4 <
ffff000103533780 1169808164 C Ci:6:002:0 0 4 = 13111312
ffff000103533780 1169808198 S Co:6:002:0 s 40 05 080c 0000 0004 4 = 03111312
ffff000103533780 1169808229 C Co:6:002:0 0 4 >
ffff000103533780 1169808264 S Ci:6:002:0 s c0 05 0a04 0000 0004 4 <
ffff000103533780 1169808299 C Ci:6:002:0 0 4 = 0c00ff01
ffff000103533780 1169808334 S Co:6:002:0 s 40 05 0a04 0000 0004 4 = 0c00ff0f
ffff000103533780 1169808365 C Co:6:002:0 0 4 >
ffff000103533780 1169808399 S Ci:6:002:0 s c0 05 0440 0000 0004 4 <
ffff000103533780 1169808436 C Ci:6:002:0 0 4 = 00000000
ffff000103533780 1169808471 S Co:6:002:0 s 40 05 0440 0000 0004 4 = 50010000
ffff000103533780 1169808520 C Co:6:002:0 0 4 >
ffff000103533780 1169808559 S Ci:6:002:0 s c0 05 0c1c 0000 0004 4 <
ffff000103533780 1169808596 C Ci:6:002:0 0 4 = 03000040
ffff000103533780 1169808631 S Co:6:002:0 s 40 05 0c1c 0000 0004 4 = 0300402d
ffff000103533780 1169808662 C Co:6:002:0 0 4 >
ffff000103533780 1169808697 S Ci:6:002:0 s c0 05 0e1c 0000 0004 4 <
ffff000103533780 1169808735 C Ci:6:002:0 0 4 = 03000040
ffff000103533780 1169808770 S Co:6:002:0 s 40 05 0e1c 0000 0004 4 = 0300402d
ffff000103533780 1169808801 C Co:6:002:0 0 4 >
ffff000103533780 1169808836 S Ci:6:002:0 s c0 05 0860 0000 0004 4 <
ffff000103533780 1169808873 C Ci:6:002:0 0 4 = 21c3d572
ffff000103533780 1169808908 S Co:6:002:0 s 40 05 0860 0000 0004 4 = 21c3a768
ffff000103533780 1169808939 C Co:6:002:0 0 4 >
ffff000103533780 1169808973 S Ci:6:002:0 s c0 05 0c00 0000 0004 4 <
ffff000103533780 1169809025 C Ci:6:002:0 0 4 = 07000000
ffff000103533780 1169809060 S Ci:6:002:0 s c0 05 08b0 0000 0004 4 <
ffff000103533780 1169809097 C Ci:6:002:0 0 4 = 18060000
ffff000103533780 1169809132 S Co:6:002:0 s 40 05 08b0 0000 0004 4 = 18060000
ffff000103533780 1169809163 C Co:6:002:0 0 4 >
ffff000103533780 1169809219 S Ci:6:002:0 s c0 05 0d04 0000 0004 4 <
ffff000103533780 1169809276 C Ci:6:002:0 0 4 = 017c90b1
ffff000103533780 1169809310 S Co:6:002:0 s 40 05 0c90 0000 0004 4 = 017d8101
ffff000103533780 1169809340 C Co:6:002:0 0 4 >
ffff000103533780 1169809387 S Ci:6:002:0 s c0 05 08ac 0000 0004 4 <
ffff000103533780 1169809436 C Ci:6:002:0 0 4 = 08faf00f
ffff000103533780 1169809470 S Co:6:002:0 s 40 05 08ac 0000 0004 4 = 08faf00f
ffff000103533780 1169809518 C Co:6:002:0 0 4 >
ffff000103533780 1169809552 S Ci:6:002:0 s c0 05 08ac 0000 0004 4 <
ffff000103533780 1169809589 C Ci:6:002:0 0 4 = 08faf00f
ffff000103533780 1169809624 S Co:6:002:0 s 40 05 08ac 0000 0004 4 = 08faf00f
ffff000103533780 1169809655 C Co:6:002:0 0 4 >
ffff000103533780 1169809690 S Ci:6:002:0 s c0 05 08c4 0000 0004 4 <
ffff000103533780 1169809728 C Ci:6:002:0 0 4 = 00000000
ffff000103533780 1169809762 S Co:6:002:0 s 40 05 08c4 0000 0004 4 = 00000000
ffff000103533780 1169809794 C Co:6:002:0 0 4 >
ffff000103533780 1169809829 S Ci:6:002:0 s c0 05 0c00 0000 0004 4 <
ffff000103533780 1169809867 C Ci:6:002:0 0 4 = 07000000
ffff000103533780 1169809902 S Ci:6:002:0 s c0 05 08b0 0000 0004 4 <
ffff000103533780 1169809939 C Ci:6:002:0 0 4 = 18060000
ffff000103533780 1169809974 S Co:6:002:0 s 40 05 08b0 0000 0004 4 = 18060000
ffff000103533780 1169810022 C Co:6:002:0 0 4 >
ffff000103533780 1169810076 S Ci:6:002:0 s c0 05 0d04 0000 0004 4 <
ffff000103533780 1169810151 C Ci:6:002:0 0 4 = 017d91b1
ffff000103533780 1169810185 S Co:6:002:0 s 40 05 0c90 0000 0004 4 = 387d8101
ffff000103533780 1169810216 C Co:6:002:0 0 4 >
ffff000103533780 1169810263 S Ci:6:002:0 s c0 05 0e00 0000 0004 4 <
ffff000103533780 1169810312 C Ci:6:002:0 0 4 = 07000000
ffff000103533780 1169810346 S Ci:6:002:0 s c0 05 08b0 0000 0004 4 <
ffff000103533780 1169810401 C Ci:6:002:0 0 4 = 18060000
ffff000103533780 1169810434 S Co:6:002:0 s 40 05 08b0 0000 0004 4 = 18060000
ffff000103533780 1169810465 C Co:6:002:0 0 4 >
ffff000103533780 1169810520 S Ci:6:002:0 s c0 05 0d44 0000 0004 4 <
ffff000103533780 1169810569 C Ci:6:002:0 0 4 = 017c90b1
ffff000103533780 1169810603 S Co:6:002:0 s 40 05 0e90 0000 0004 4 = 017d8101
ffff000103533780 1169810647 C Co:6:002:0 0 4 >
ffff000103533780 1169810694 S Ci:6:002:0 s c0 05 08ac 0000 0004 4 <
ffff000103533780 1169810743 C Ci:6:002:0 0 4 = 08faf00f
ffff000103533780 1169810778 S Co:6:002:0 s 40 05 08ac 0000 0004 4 = 08faf00f
ffff000103533780 1169810808 C Co:6:002:0 0 4 >
ffff000103533780 1169810842 S Ci:6:002:0 s c0 05 08ac 0000 0004 4 <
ffff000103533780 1169810897 C Ci:6:002:0 0 4 = 08faf00f
ffff000103533780 1169810933 S Co:6:002:0 s 40 05 08ac 0000 0004 4 = 08faf00f
ffff000103533780 1169810964 C Co:6:002:0 0 4 >
ffff000103533780 1169810999 S Ci:6:002:0 s c0 05 08c4 0000 0004 4 <
ffff000103533780 1169811037 C Ci:6:002:0 0 4 = 00000000
ffff000103533780 1169811072 S Co:6:002:0 s 40 05 08c4 0000 0004 4 = 00000000
ffff000103533780 1169811103 C Co:6:002:0 0 4 >
ffff000103533780 1169811138 S Ci:6:002:0 s c0 05 0e00 0000 0004 4 <
ffff000103533780 1169811177 C Ci:6:002:0 0 4 = 07000000
ffff000103533780 1169811211 S Ci:6:002:0 s c0 05 08b0 0000 0004 4 <
ffff000103533780 1169811250 C Ci:6:002:0 0 4 = 18060000
ffff000103533780 1169811285 S Co:6:002:0 s 40 05 08b0 0000 0004 4 = 18060000
ffff000103533780 1169811316 C Co:6:002:0 0 4 >
ffff000103533780 1169811371 S Ci:6:002:0 s c0 05 0d44 0000 0004 4 <
ffff000103533780 1169811420 C Ci:6:002:0 0 4 = 017d91b1
ffff000103533780 1169811454 S Co:6:002:0 s 40 05 0e90 0000 0004 4 = 387d8101
ffff000103533780 1169811485 C Co:6:002:0 0 4 >
ffff000103533780 1169811533 S Ci:6:002:0 s c0 05 0668 0000 0002 2 <
ffff000103533780 1169811583 C Ci:6:002:0 0 2 = 0010
ffff000103533780 1169811617 S Co:6:002:0 s 40 05 0668 0000 0002 2 = 0010
ffff000103533780 1169811648 C Co:6:002:0 0 2 >
ffff000103533780 1169811681 S Co:6:002:0 s 40 05 0483 0000 0001 1 = 00
ffff000103533780 1169811712 C Co:6:002:0 0 1 >
ffff000103533780 1169811745 S Ci:6:002:0 s c0 05 0837 0000 0001 1 <
ffff000103533780 1169811783 C Ci:6:002:0 0 1 = 00
ffff000103533780 1169811817 S Ci:6:002:0 s c0 05 08ac 0000 0004 4 <
ffff000103533780 1169811856 C Ci:6:002:0 0 4 = 08faf00f
ffff000103533780 1169811891 S Co:6:002:0 s 40 05 08ac 0000 0004 4 = 08faf00f
ffff000103533780 1169811921 C Co:6:002:0 0 4 >
ffff000103533780 1169811956 S Ci:6:002:0 s c0 05 08c4 0000 0004 4 <
ffff000103533780 1169811995 C Ci:6:002:0 0 4 = 00000000
ffff000103533780 1169812093 S Co:6:002:0 s 40 05 08c4 0000 0004 4 = 00000000
ffff000103533780 1169812147 C Co:6:002:0 0 4 >
ffff000103533780 1169812186 S Ci:6:002:0 s c0 05 0848 0000 0004 4 <
ffff000103533780 1169812226 C Ci:6:002:0 0 4 = 8bffd061
ffff000103533780 1169812262 S Co:6:002:0 s 40 05 0848 0000 0004 4 = 8bffd061
ffff000103533780 1169812293 C Co:6:002:0 0 4 >
ffff000103533780 1169812327 S Ci:6:002:0 s c0 05 08ac 0000 0004 4 <
ffff000103533780 1169812366 C Ci:6:002:0 0 4 = 08faf00f
ffff000103533780 1169812401 S Co:6:002:0 s 40 05 08ac 0000 0004 4 = 08faf00f
ffff000103533780 1169812432 C Co:6:002:0 0 4 >
ffff000103533780 1169812467 S Ci:6:002:0 s c0 05 08ac 0000 0004 4 <
ffff000103533780 1169812522 C Ci:6:002:0 0 4 = 08faf00f
ffff000103533780 1169812557 S Co:6:002:0 s 40 05 08ac 0000 0004 4 = 08faf00f
ffff000103533780 1169812588 C Co:6:002:0 0 4 >
ffff000103533780 1169812623 S Ci:6:002:0 s c0 05 08c4 0000 0004 4 <
ffff000103533780 1169812662 C Ci:6:002:0 0 4 = 00000000
ffff000103533780 1169812697 S Co:6:002:0 s 40 05 08c4 0000 0004 4 = 00000000
ffff000103533780 1169812728 C Co:6:002:0 0 4 >
ffff000103533780 1169812762 S Ci:6:002:0 s c0 05 0c00 0000 0004 4 <
ffff000103533780 1169812798 C Ci:6:002:0 0 4 = 07000000
ffff000103533780 1169812832 S Ci:6:002:0 s c0 05 08b0 0000 0004 4 <
ffff000103533780 1169812867 C Ci:6:002:0 0 4 = 18060000
ffff000103533780 1169812902 S Co:6:002:0 s 40 05 08b0 0000 0004 4 = 18060000
ffff000103533780 1169812933 C Co:6:002:0 0 4 >
ffff000103533780 1169812988 S Ci:6:002:0 s c0 05 0d04 0000 0004 4 <
ffff000103533780 1169813035 C Ci:6:002:0 0 4 = 387d91b1
ffff000103533780 1169813068 S Co:6:002:0 s 40 05 0c90 0000 0004 4 = 387d8101
ffff000103533780 1169813099 C Co:6:002:0 0 4 >
ffff000103533780 1169813146 S Ci:6:002:0 s c0 05 0e00 0000 0004 4 <
ffff000103533780 1169813193 C Ci:6:002:0 0 4 = 07000000
ffff000103533780 1169813227 S Ci:6:002:0 s c0 05 08b0 0000 0004 4 <
ffff000103533780 1169813274 C Ci:6:002:0 0 4 = 18060000
ffff000103533780 1169813308 S Co:6:002:0 s 40 05 08b0 0000 0004 4 = 18060000
ffff000103533780 1169813338 C Co:6:002:0 0 4 >
ffff000103533780 1169813392 S Ci:6:002:0 s c0 05 0d44 0000 0004 4 <
ffff000103533780 1169813438 C Ci:6:002:0 0 4 = 387d91b1
ffff000103533780 1169813472 S Co:6:002:0 s 40 05 0e90 0000 0004 4 = 387d8101
ffff000103533780 1169813520 C Co:6:002:0 0 4 >
ffff000103533780 1169813568 S Ci:6:002:0 s c0 05 0073 0000 0001 1 <
ffff000103533780 1169813615 C Ci:6:002:0 0 1 = 07
ffff000103533780 1169813649 S Co:6:002:0 s 40 05 0073 0000 0001 1 = 07
ffff000103533780 1169813680 C Co:6:002:0 0 1 >
ffff000103533780 1169813735 S Ci:6:002:0 s c0 05 0c24 0000 0004 4 <
ffff000103533780 1169813783 C Ci:6:002:0 0 4 = 20202020
ffff000103533780 1169813817 S Co:6:002:0 s 40 05 0c24 0000 0004 4 = 24242424
ffff000103533780 1169813849 C Co:6:002:0 0 4 >
ffff000103533780 1169813882 S Ci:6:002:0 s c0 05 0c28 0000 0004 4 <
ffff000103533780 1169813917 C Ci:6:002:0 0 4 = 20201e1c
ffff000103533780 1169813952 S Co:6:002:0 s 40 05 0c28 0000 0004 4 = 24242220
ffff000103533780 1169813983 C Co:6:002:0 0 4 >
ffff000103533780 1169814018 S Ci:6:002:0 s c0 05 0c2c 0000 0004 4 <
ffff000103533780 1169814054 C Ci:6:002:0 0 4 = 20202020
ffff000103533780 1169814089 S Co:6:002:0 s 40 05 0c2c 0000 0004 4 = 29292929
ffff000103533780 1169814121 C Co:6:002:0 0 4 >
ffff000103533780 1169814155 S Ci:6:002:0 s c0 05 0c30 0000 0004 4 <
ffff000103533780 1169814192 C Ci:6:002:0 0 4 = 20201e1c
ffff000103533780 1169814226 S Co:6:002:0 s 40 05 0c30 0000 0004 4 = 27252321
ffff000103533780 1169814272 C Co:6:002:0 0 4 >
ffff000103533780 1169814307 S Ci:6:002:0 s c0 05 0c34 0000 0004 4 <
ffff000103533780 1169814342 C Ci:6:002:0 0 4 = 20202020
ffff000103533780 1169814377 S Co:6:002:0 s 40 05 0c34 0000 0004 4 = 25252525
ffff000103533780 1169814408 C Co:6:002:0 0 4 >
ffff000103533780 1169814443 S Ci:6:002:0 s c0 05 0c38 0000 0004 4 <
ffff000103533780 1169814479 C Ci:6:002:0 0 4 = 201e1c1a
ffff000103533780 1169814514 S Co:6:002:0 s 40 05 0c38 0000 0004 4 = 2523211f
ffff000103533780 1169814546 C Co:6:002:0 0 4 >
ffff000103533780 1169814580 S Ci:6:002:0 s c0 05 0c3c 0000 0004 4 <
ffff000103533780 1169814616 C Ci:6:002:0 0 4 = 20202020
ffff000103533780 1169814651 S Co:6:002:0 s 40 05 0c3c 0000 0004 4 = 29292929
ffff000103533780 1169814682 C Co:6:002:0 0 4 >
ffff000103533780 1169814716 S Ci:6:002:0 s c0 05 0c40 0000 0004 4 <
ffff000103533780 1169814770 C Ci:6:002:0 0 4 = 20201e1c
ffff000103533780 1169814805 S Co:6:002:0 s 40 05 0c40 0000 0004 4 = 27252321
ffff000103533780 1169814837 C Co:6:002:0 0 4 >
ffff000103533780 1169814871 S Ci:6:002:0 s c0 05 0c44 0000 0004 4 <
ffff000103533780 1169814907 C Ci:6:002:0 0 4 = 1a181e1e
ffff000103533780 1169814942 S Co:6:002:0 s 40 05 0c44 0000 0004 4 = 1f1f2525
ffff000103533780 1169814974 C Co:6:002:0 0 4 >
ffff000103533780 1169815008 S Ci:6:002:0 s c0 05 0c48 0000 0004 4 <
ffff000103533780 1169815046 C Ci:6:002:0 0 4 = 1e1e1e1e
ffff000103533780 1169815083 S Co:6:002:0 s 40 05 0c48 0000 0004 4 = 25252523
ffff000103533780 1169815143 C Co:6:002:0 0 4 >
ffff000103533780 1169815178 S Ci:6:002:0 s c0 05 0c4c 0000 0004 4 <
ffff000103533780 1169815236 C Ci:6:002:0 0 4 = 1c1a1816
ffff000103533780 1169815270 S Co:6:002:0 s 40 05 0c4c 0000 0004 4 = 211f1d1d
ffff000103533780 1169815301 C Co:6:002:0 0 4 >
ffff000103533780 1169815334 S Ci:6:002:0 s c0 05 0c54 0000 0004 4 <
ffff000103533780 1169815370 C Ci:6:002:0 0 4 = 120a0400
ffff000103533780 1169815405 S Co:6:002:0 s 40 05 0c54 0000 0004 4 = 170f0900
ffff000103533780 1169815436 C Co:6:002:0 0 4 >
ffff000103533780 1169815471 S Ci:6:002:0 s c0 05 0e24 0000 0004 4 <
ffff000103533780 1169815523 C Ci:6:002:0 0 4 = 1d1d1d1d
ffff000103533780 1169815557 S Co:6:002:0 s 40 05 0e24 0000 0004 4 = 23232323
ffff000103533780 1169815588 C Co:6:002:0 0 4 >
ffff000103533780 1169815623 S Ci:6:002:0 s c0 05 0e28 0000 0004 4 <
ffff000103533780 1169815660 C Ci:6:002:0 0 4 = 1d1d1b19
ffff000103533780 1169815695 S Co:6:002:0 s 40 05 0e28 0000 0004 4 = 2323211f
ffff000103533780 1169815726 C Co:6:002:0 0 4 >
ffff000103533780 1169815761 S Ci:6:002:0 s c0 05 0e2c 0000 0004 4 <
ffff000103533780 1169815797 C Ci:6:002:0 0 4 = 1f1f1f1f
ffff000103533780 1169815832 S Co:6:002:0 s 40 05 0e2c 0000 0004 4 = 28282828
ffff000103533780 1169815863 C Co:6:002:0 0 4 >
ffff000103533780 1169815898 S Ci:6:002:0 s c0 05 0e30 0000 0004 4 <
ffff000103533780 1169815935 C Ci:6:002:0 0 4 = 1f1f1d1b
ffff000103533780 1169815969 S Co:6:002:0 s 40 05 0e30 0000 0004 4 = 26242220
ffff000103533780 1169816027 C Co:6:002:0 0 4 >
ffff000103533780 1169816063 S Ci:6:002:0 s c0 05 0e34 0000 0004 4 <
ffff000103533780 1169816099 C Ci:6:002:0 0 4 = 1f1f1f1f
ffff000103533780 1169816135 S Co:6:002:0 s 40 05 0e34 0000 0004 4 = 24242424
ffff000103533780 1169816167 C Co:6:002:0 0 4 >
ffff000103533780 1169816202 S Ci:6:002:0 s c0 05 0e38 0000 0004 4 <
ffff000103533780 1169816239 C Ci:6:002:0 0 4 = 1f1d1b19
ffff000103533780 1169816274 S Co:6:002:0 s 40 05 0e38 0000 0004 4 = 2422201e
ffff000103533780 1169816305 C Co:6:002:0 0 4 >
ffff000103533780 1169816339 S Ci:6:002:0 s c0 05 0e3c 0000 0004 4 <
ffff000103533780 1169816393 C Ci:6:002:0 0 4 = 1f1f1f1f
ffff000103533780 1169816428 S Co:6:002:0 s 40 05 0e3c 0000 0004 4 = 28282828
ffff000103533780 1169816459 C Co:6:002:0 0 4 >
ffff000103533780 1169816494 S Ci:6:002:0 s c0 05 0e40 0000 0004 4 <
ffff000103533780 1169816531 C Ci:6:002:0 0 4 = 1f1f1d1b
ffff000103533780 1169816565 S Co:6:002:0 s 40 05 0e40 0000 0004 4 = 26242220
ffff000103533780 1169816597 C Co:6:002:0 0 4 >
ffff000103533780 1169816632 S Ci:6:002:0 s c0 05 0e44 0000 0004 4 <
ffff000103533780 1169816668 C Ci:6:002:0 0 4 = 19171d1d
ffff000103533780 1169816703 S Co:6:002:0 s 40 05 0e44 0000 0004 4 = 1e1e2424
ffff000103533780 1169816735 C Co:6:002:0 0 4 >
ffff000103533780 1169816770 S Ci:6:002:0 s c0 05 0e48 0000 0004 4 <
ffff000103533780 1169816806 C Ci:6:002:0 0 4 = 1d1d1d1d
ffff000103533780 1169816841 S Co:6:002:0 s 40 05 0e48 0000 0004 4 = 24242422
ffff000103533780 1169816890 C Co:6:002:0 0 4 >
ffff000103533780 1169816924 S Ci:6:002:0 s c0 05 0e4c 0000 0004 4 <
ffff000103533780 1169816962 C Ci:6:002:0 0 4 = 1b191715
ffff000103533780 1169816996 S Co:6:002:0 s 40 05 0e4c 0000 0004 4 = 201e1c1c
ffff000103533780 1169817027 C Co:6:002:0 0 4 >
ffff000103533780 1169817061 S Ci:6:002:0 s c0 05 0e54 0000 0004 4 <
ffff000103533780 1169817098 C Ci:6:002:0 0 4 = 11090300
ffff000103533780 1169817133 S Co:6:002:0 s 40 05 0e54 0000 0004 4 = 160e0800
ffff000103533780 1169817165 C Co:6:002:0 0 4 >
ffff000103558cc0 1169883066 C Bi:6:002:1 0 329 = 11010484 00000f00 af026000 04300000 00000000 89887500 383a0000 73f2f20f
ffff000103558cc0 1169883130 S Bi:6:002:1 -115 32768 <
ffff00014c2bf900 1169883498 C Bi:6:002:1 0 329 = 11010484 00000f00 af026000 04300000 00000000 478a7500 383a0000 75f2f20f
ffff00014c2bf900 1169883523 S Bi:6:002:1 -115 32768 <
ffff00013d62e840 1169899584 C Bi:6:002:1 0 335 = 17010484 00000f80 060e6000 04300000 00000000 04c97500 383a0000 75f2f20f
ffff00013d62e840 1169899610 S Bi:6:002:1 -115 32768 <
ffff000103533900 1170003991 C Bi:6:002:1 0 335 = 17010484 00000f80 070e6000 04300000 00000000 04617700 383a0000 76f1f10f
ffff000103533900 1170004042 S Bi:6:002:1 -115 32768 <
ffff000103558cc0 1170108493 C Bi:6:002:1 0 335 = 17010484 00000f80 080e6000 04300000 00000000 05f97800 3a3e0000 76eded0f
ffff000103558cc0 1170108549 S Bi:6:002:1 -115 32768 <
ffff00014c2bf900 1170212921 C Bi:6:002:1 0 335 = 17010484 00000f80 090e6000 04300000 00000000 06917a00 363c0000 76f4f40f
ffff00014c2bf900 1170212948 S Bi:6:002:1 -115 32768 <
ffff00013d62e840 1170317381 C Bi:6:002:1 0 335 = 17010484 00000f80 0a0e6000 04300000 00000000 07297c00 363a0000 76f1f10f
ffff00013d62e840 1170317430 S Bi:6:002:1 -115 32768 <
ffff000103533900 1170421781 C Bi:6:002:1 0 335 = 17010484 00000f80 0b0e6000 04300000 00000000 07c17d00 383a0000 75f1f10f
ffff000103533900 1170421814 S Bi:6:002:1 -115 32768 <
ffff000103558cc0 1170526231 C Bi:6:002:1 0 335 = 17010484 00000f80 0c0e6000 04300000 00000000 08597f00 363c0000 76f2f20f
ffff000103558cc0 1170526276 S Bi:6:002:1 -115 32768 <
ffff00014c2bf900 1170630724 C Bi:6:002:1 0 335 = 17010484 00000f80 0d0e6000 04300000 00000000 09f18000 383a0000 76f2f20f
ffff00014c2bf900 1170630781 S Bi:6:002:1 -115 32768 <
ffff00013d62e840 1170735135 C Bi:6:002:1 0 335 = 17010484 00000f80 0e0e6000 04300000 00000000 0a898200 363a0000 75f2f20f
ffff00013d62e840 1170735189 S Bi:6:002:1 -115 32768 <
ffff000103533780 1170748169 S Ci:6:002:0 s c0 05 004c 0000 0001 1 <
ffff000103533780 1170748291 C Ci:6:002:0 0 1 = 20
ffff000103533780 1170748494 S Co:6:002:0 s 40 05 004c 0000 0001 1 = 20
ffff000103533780 1170748649 C Co:6:002:0 0 1 >
ffff000103533780 1170748831 S Ci:6:002:0 s c0 05 0770 0000 0004 4 <
ffff000103533780 1170748996 C Ci:6:002:0 0 4 = 00000000
ffff000103533780 1170749206 S Ci:6:002:0 s c0 05 0774 0000 0004 4 <
ffff000103533780 1170749381 C Ci:6:002:0 0 4 = 00000000
ffff000103533780 1170749544 S Co:6:002:0 s 40 05 076e 0000 0001 1 = 0c
ffff000103533780 1170749663 C Co:6:002:0 0 1 >
ffff000103533780 1170749866 S Ci:6:002:0 s c0 05 0808 0000 0004 4 <
ffff000103533780 1170750032 C Ci:6:002:0 0 4 = 3382023e
ffff000103533780 1170750196 S Ci:6:002:0 s c0 05 0a5c 0000 0002 2 <
ffff000103533780 1170750325 C Ci:6:002:0 0 2 = 9800
ffff000103533780 1170750527 S Ci:6:002:0 s c0 05 0f48 0000 0002 2 <
ffff000103533780 1170750693 C Ci:6:002:0 0 2 = ef00
ffff000103533780 1170750857 S Ci:6:002:0 s c0 05 0f04 0000 0004 4 <
ffff000103533780 1170750987 C Ci:6:002:0 0 4 = 00000d00
ffff000103533780 1170751188 S Ci:6:002:0 s c0 05 0f14 0000 0004 4 <
ffff000103533780 1170751319 C Ci:6:002:0 0 4 = 86001200
ffff000103533780 1170751368 S Ci:6:002:0 s c0 05 0f10 0000 0004 4 <
ffff000103533780 1170751492 C Ci:6:002:0 0 4 = 00000000
ffff000103533780 1170751529 S Ci:6:002:0 s c0 05 0f0c 0000 0004 4 <
ffff000103533780 1170751642 C Ci:6:002:0 0 4 = 00000000
ffff000103533780 1170751678 S Ci:6:002:0 s c0 05 0f08 0000 0004 4 <
ffff000103533780 1170751791 C Ci:6:002:0 0 4 = f6008701
ffff000103533780 1170751827 S Ci:6:002:0 s c0 05 0fcc 0000 0004 4 <
ffff000103533780 1170751954 C Ci:6:002:0 0 4 = 00000000
ffff000103533780 1170751991 S Ci:6:002:0 s c0 05 09a4 0000 0004 4 <
ffff000103533780 1170752108 C Ci:6:002:0 0 4 = 80000800
ffff000103533780 1170752146 S Co:6:002:0 s 40 05 09a4 0000 0004 4 = 80000a00
ffff000103533780 1170752193 C Co:6:002:0 0 4 >
ffff000103533780 1170752223 S Ci:6:002:0 s c0 05 09a4 0000 0004 4 <
ffff000103533780 1170752343 C Ci:6:002:0 0 4 = 80000a00
ffff000103533780 1170752379 S Co:6:002:0 s 40 05 09a4 0000 0004 4 = 80000800
ffff000103533780 1170752488 C Co:6:002:0 0 4 >
ffff000103533780 1170752524 S Ci:6:002:0 s c0 05 0a2c 0000 0004 4 <
ffff000103533780 1170752637 C Ci:6:002:0 0 4 = 00809000
ffff000103533780 1170752673 S Co:6:002:0 s 40 05 0a2c 0000 0004 4 = 00009000
ffff000103533780 1170752781 C Co:6:002:0 0 4 >
ffff000103533780 1170752817 S Ci:6:002:0 s c0 05 0a2c 0000 0004 4 <
ffff000103533780 1170752929 C Ci:6:002:0 0 4 = 00009000
ffff000103533780 1170752965 S Co:6:002:0 s 40 05 0a2c 0000 0004 4 = 00809000
ffff000103533780 1170753082 C Co:6:002:0 0 4 >
ffff000103533780 1170753120 S Ci:6:002:0 s c0 05 0b58 0000 0004 4 <
ffff000103533780 1170753160 C Ci:6:002:0 0 4 = 00000000
ffff000103533780 1170753188 S Co:6:002:0 s 40 05 0b58 0000 0004 4 = 01000000
ffff000103533780 1170753278 C Co:6:002:0 0 4 >
ffff000103533780 1170753307 S Ci:6:002:0 s c0 05 0b58 0000 0004 4 <
ffff000103533780 1170753347 C Ci:6:002:0 0 4 = 01000000
ffff000103533780 1170753376 S Co:6:002:0 s 40 05 0b58 0000 0004 4 = 00000000
ffff000103533780 1170753409 C Co:6:002:0 0 4 >
ffff000103533780 1170753440 S Ci:6:002:0 s c0 05 0c50 0000 0004 4 <
ffff000103533780 1170753487 C Ci:6:002:0 0 4 = 1e000000
ffff000103533780 1170753515 S Co:6:002:0 s 40 05 0c50 0000 0004 4 = 1c000000
ffff000103533780 1170753558 C Co:6:002:0 0 4 >
ffff000103533780 1170753586 S Ci:6:002:0 s c0 05 0e50 0000 0004 4 <
ffff000103533780 1170753640 C Ci:6:002:0 0 4 = 1e000000
ffff000103533780 1170753667 S Co:6:002:0 s 40 05 0e50 0000 0004 4 = 1c000000
ffff000103533780 1170753710 C Co:6:002:0 0 4 >
ffff000103533780 1170753739 S Ci:6:002:0 s c0 05 01cc 0000 0001 1 <
ffff000103533780 1170753790 C Ci:6:002:0 0 1 = 00
ffff000103533780 1170753817 S Co:6:002:0 s 40 05 01fc 0000 0004 4 = 00000000
ffff000103533780 1170753879 C Co:6:002:0 0 4 >
ffff000103533780 1170753907 S Co:6:002:0 s 40 05 01dc 0000 0004 4 = 58000000
ffff000103533780 1170753949 C Co:6:002:0 0 4 >
ffff000103533780 1170753977 S Co:6:002:0 s 40 05 0440 0000 0004 4 = 00000000
ffff000103533780 1170754026 C Co:6:002:0 0 4 >
ffff000103533780 1170754055 S Ci:6:002:0 s c0 05 0c00 0000 0004 4 <
ffff000103533780 1170754174 C Ci:6:002:0 0 4 = 07000000
ffff000103533780 1170754210 S Ci:6:002:0 s c0 05 08b0 0000 0004 4 <
ffff000103533780 1170754336 C Ci:6:002:0 0 4 = 18060000
ffff000103533780 1170754372 S Co:6:002:0 s 40 05 08b0 0000 0004 4 = 42060000
ffff000103533780 1170754480 C Co:6:002:0 0 4 >
ffff000103533780 1170754539 S Ci:6:002:0 s c0 05 0d04 0000 0004 4 <
ffff000103533780 1170754648 C Ci:6:002:0 0 4 = 088990b1
ffff000103533780 1170754685 S Co:6:002:0 s 40 05 0c90 0000 0004 4 = 08892304
ffff000103533780 1170754793 C Co:6:002:0 0 4 >
ffff000103533780 1170754844 S Co:6:002:0 s 40 05 0280 0000 0002 2 = 0001
ffff000103533780 1170754957 C Co:6:002:0 0 2 >
ffff000103533780 1170754994 S Ci:6:002:0 s c0 05 010c 0000 0001 1 <
ffff000103533780 1170755107 C Ci:6:002:0 0 1 = b4
ffff000103533780 1170755144 S Co:6:002:0 s 40 05 010c 0000 0001 1 = b4
ffff000103533780 1170755252 C Co:6:002:0 0 1 >
ffff000103533900 1170839616 C Bi:6:002:1 0 335 = 17010484 00000f80 0f0e6000 04300000 00000000 0a218400 363c0000 76f2f20f
ffff000103533900 1170839673 S Bi:6:002:1 -115 32768 <
ffff000103558cc0 1170922780 C Bi:6:002:1 0 131 = 4b000484 00000f80 92016000 04300000 00000000 1b678500 262c0000 58f4f40f
ffff000103558cc0 1170922836 S Bi:6:002:1 -115 32768 <
ffff00014c2bf900 1170944022 C Bi:6:002:1 0 335 = 17010484 00000f80 100e6000 04300000 00000000 0bb98500 363c0000 76f2f20f
ffff00014c2bf900 1170944057 S Bi:6:002:1 -115 32768 <
ffff00013d62e840 1171048481 C Bi:6:002:1 0 335 = 17010484 00000f80 110e6000 04300000 00000000 0c518700 383c0000 76f2f20f
ffff00013d62e840 1171048533 S Bi:6:002:1 -115 32768 <
ffff000103533900 1171152925 C Bi:6:002:1 0 335 = 17010484 00000f80 120e6000 04300000 00000000 0de98800 383c0000 76f2f20f
ffff000103533900 1171152978 S Bi:6:002:1 -115 32768 <
ffff000103558cc0 1171178284 C Bi:6:002:1 0 225 = a9000484 00000f00 0b016000 04300000 00000000 b74c8900 342c0000 63acac0f
ffff000103558cc0 1171178309 S Bi:6:002:1 -115 32768 <
ffff00014c2bf900 1171200610 C Bi:6:002:1 0 329 = 11010484 00000f00 b0026000 04300000 00000000 37a38900 363c0000 76f2f20f
ffff00014c2bf900 1171200639 S Bi:6:002:1 -115 32768 <
ffff00013d62e840 1171201047 C Bi:6:002:1 0 329 = 11010484 00000f00 b0026000 04300000 00000000 07a58900 383c0000 76f2f20f
ffff00013d62e840 1171201073 S Bi:6:002:1 -115 32768 <
ffff000103533900 1171257365 C Bi:6:002:1 0 335 = 17010484 00000f80 130e6000 04300000 00000000 0d818a00 383c0000 76f4f40f
ffff000103533900 1171257398 S Bi:6:002:1 -115 32768 <
ffff000103558cc0 1171361816 C Bi:6:002:1 0 335 = 17010484 00000f80 140e6000 04300000 00000000 0e198c00 363c0000 76f2f20f
ffff000103558cc0 1171361842 S Bi:6:002:1 -115 32768 <
ffff00014c2bf900 1171466260 C Bi:6:002:1 0 335 = 17010484 00000f80 150e6000 04300000 00000000 0fb18d00 363c0000 76f4f40f
ffff00014c2bf900 1171466311 S Bi:6:002:1 -115 32768 <
ffff00013d62e840 1171570718 C Bi:6:002:1 0 335 = 17010484 00000f80 160e6000 04300000 00000000 10498f00 383a0000 75f4f40f
ffff00013d62e840 1171570771 S Bi:6:002:1 -115 32768 <
ffff000103533900 1171675158 C Bi:6:002:1 0 335 = 17010484 00000f80 170e6000 04300000 00000000 10e19000 383c0000 75f2f20f
ffff000103533900 1171675212 S Bi:6:002:1 -115 32768 <
ffff000103533780 1171772223 S Ci:6:002:0 s c0 05 004c 0000 0001 1 <
ffff000103533780 1171772285 C Ci:6:002:0 0 1 = 20
ffff000103533780 1171772313 S Co:6:002:0 s 40 05 004c 0000 0001 1 = 20
ffff000103533780 1171772415 C Co:6:002:0 0 1 >
ffff000103558cc0 1171779641 C Bi:6:002:1 0 335 = 17010484 00000f80 180e6000 04300000 00000000 11799200 363c0000 76f2f20f
ffff000103558cc0 1171779668 S Bi:6:002:1 -115 32768 <
ffff00014c2bf900 1171884051 C Bi:6:002:1 0 335 = 17010484 00000f80 190e6000 04300000 00000000 12119400 383c0000 76f2f20f
ffff00014c2bf900 1171884099 S Bi:6:002:1 -115 32768 <
ffff00013d62e840 1171909210 C Bi:6:002:1 0 131 = 4b000484 00000f80 b5016000 04300000 00000000 63749400 34280000 65ecec0f
ffff00013d62e840 1171909235 S Bi:6:002:1 -115 32768 <
ffff000103533900 1171919693 C Bi:6:002:1 0 131 = 4b000484 00000f80 b6016000 04300000 00000000 469d9400 32280000 5ff1f10f
ffff000103533900 1171919719 S Bi:6:002:1 -115 32768 <
ffff000103558cc0 1171988511 C Bi:6:002:1 0 335 = 17010484 00000f80 1a0e6000 04300000 00000000 13a99500 343c0000 75f2f20f
ffff000103558cc0 1171988562 S Bi:6:002:1 -115 32768 <
ffff00014c2bf900 1172092961 C Bi:6:002:1 0 335 = 17010484 00000f80 1b0e6000 04300000 00000000 13419700 383c0000 76f3f30f
ffff00014c2bf900 1172093009 S Bi:6:002:1 -115 32768 <
ffff00013d62e840 1172197404 C Bi:6:002:1 0 335 = 17010484 00000f80 1c0e6000 04300000 00000000 14d99800 363c0000 76f1f10f
ffff00013d62e840 1172197456 S Bi:6:002:1 -115 32768 <
ffff000103533900 1172301850 C Bi:6:002:1 0 335 = 17010484 00000f80 1d0e6000 04300000 00000000 15719a00 383c0000 76f1f10f
ffff000103533900 1172301902 S Bi:6:002:1 -115 32768 <
ffff000103558cc0 1172406342 C Bi:6:002:1 0 335 = 17010484 00000f80 1e0e6000 04300000 00000000 16099c00 383c0000 75f1f10f
ffff000103558cc0 1172406399 S Bi:6:002:1 -115 32768 <
ffff00014c2bf900 1172510781 C Bi:6:002:1 0 335 = 17010484 00000f80 1f0e6000 04300000 00000000 16a19d00 383c0000 76f3f30f
ffff00014c2bf900 1172510807 S Bi:6:002:1 -115 32768 <
ffff00013d62e840 1172615211 C Bi:6:002:1 0 335 = 17010484 00000f80 200e6000 04300000 00000000 17399f00 383c0000 75f2f20f
ffff00013d62e840 1172615244 S Bi:6:002:1 -115 32768 <
ffff000103533900 1172719635 C Bi:6:002:1 0 335 = 17010484 00000f80 210e6000 04300000 00000000 18d1a000 383c0000 76f2f20f
ffff000103533900 1172719669 S Bi:6:002:1 -115 32768 <
ffff000103533780 1172764216 S Ci:6:002:0 s c0 05 0770 0000 0004 4 <
ffff000103533780 1172764357 C Ci:6:002:0 0 4 = 00000000
ffff000103533780 1172764567 S Ci:6:002:0 s c0 05 0774 0000 0004 4 <
ffff000103533780 1172764736 C Ci:6:002:0 0 4 = 00000000
ffff000103533780 1172764900 S Co:6:002:0 s 40 05 076e 0000 0001 1 = 0c
ffff000103533780 1172765019 C Co:6:002:0 0 1 >
ffff000103533780 1172765224 S Ci:6:002:0 s c0 05 0808 0000 0004 4 <
ffff000103533780 1172765391 C Ci:6:002:0 0 4 = 3382023e
ffff000103533780 1172765554 S Ci:6:002:0 s c0 05 0a5c 0000 0002 2 <
ffff000103533780 1172765724 C Ci:6:002:0 0 2 = 0000
ffff000103533780 1172765927 S Ci:6:002:0 s c0 05 0f48 0000 0002 2 <
ffff000103533780 1172766111 C Ci:6:002:0 0 2 = 0801
ffff000103533780 1172766277 S Ci:6:002:0 s c0 05 0f04 0000 0004 4 <
ffff000103533780 1172766408 C Ci:6:002:0 0 4 = 00000000
ffff000103533780 1172766610 S Ci:6:002:0 s c0 05 0f14 0000 0004 4 <
ffff000103533780 1172766778 C Ci:6:002:0 0 4 = 1e003a00
ffff000103533780 1172766943 S Ci:6:002:0 s c0 05 0f10 0000 0004 4 <
ffff000103533780 1172767072 C Ci:6:002:0 0 4 = 00000900
ffff000103533780 1172767114 S Ci:6:002:0 s c0 05 0f0c 0000 0004 4 <
ffff000103533780 1172767236 C Ci:6:002:0 0 4 = 00000000
ffff000103533780 1172767275 S Ci:6:002:0 s c0 05 0f08 0000 0004 4 <
ffff000103533780 1172767436 C Ci:6:002:0 0 4 = 00006901
ffff000103533780 1172767475 S Ci:6:002:0 s c0 05 0fcc 0000 0004 4 <
ffff000103533780 1172767593 C Ci:6:002:0 0 4 = 00000000
ffff000103533780 1172767629 S Ci:6:002:0 s c0 05 09a4 0000 0004 4 <
ffff000103533780 1172767740 C Ci:6:002:0 0 4 = 80000800
ffff000103533780 1172767777 S Co:6:002:0 s 40 05 09a4 0000 0004 4 = 80000a00
ffff000103533780 1172767889 C Co:6:002:0 0 4 >
ffff000103533780 1172767928 S Ci:6:002:0 s c0 05 09a4 0000 0004 4 <
ffff000103533780 1172768039 C Ci:6:002:0 0 4 = 80000a00
ffff000103533780 1172768084 S Co:6:002:0 s 40 05 09a4 0000 0004 4 = 80000800
ffff000103533780 1172768188 C Co:6:002:0 0 4 >
ffff000103533780 1172768227 S Ci:6:002:0 s c0 05 0a2c 0000 0004 4 <
ffff000103533780 1172768344 C Ci:6:002:0 0 4 = 00809000
ffff000103533780 1172768380 S Co:6:002:0 s 40 05 0a2c 0000 0004 4 = 00009000
ffff000103533780 1172768488 C Co:6:002:0 0 4 >
ffff000103533780 1172768526 S Ci:6:002:0 s c0 05 0a2c 0000 0004 4 <
ffff000103533780 1172768637 C Ci:6:002:0 0 4 = 00009000
ffff000103533780 1172768673 S Co:6:002:0 s 40 05 0a2c 0000 0004 4 = 00809000
ffff000103533780 1172768781 C Co:6:002:0 0 4 >
ffff000103533780 1172768819 S Ci:6:002:0 s c0 05 0b58 0000 0004 4 <
ffff000103533780 1172768937 C Ci:6:002:0 0 4 = 00000000
ffff000103533780 1172768973 S Co:6:002:0 s 40 05 0b58 0000 0004 4 = 01000000
ffff000103533780 1172769081 C Co:6:002:0 0 4 >
ffff000103533780 1172769119 S Ci:6:002:0 s c0 05 0b58 0000 0004 4 <
ffff000103533780 1172769230 C Ci:6:002:0 0 4 = 01000000
ffff000103533780 1172769267 S Co:6:002:0 s 40 05 0b58 0000 0004 4 = 00000000
ffff000103533780 1172769374 C Co:6:002:0 0 4 >
ffff000103533780 1172769414 S Ci:6:002:0 s c0 05 01cc 0000 0001 1 <
ffff000103533780 1172769524 C Ci:6:002:0 0 1 = 00
ffff000103533780 1172769560 S Co:6:002:0 s 40 05 01f0 0000 0004 4 = 00000000
ffff000103533780 1172769679 C Co:6:002:0 0 4 >
ffff000103533780 1172769717 S Co:6:002:0 s 40 05 01d0 0000 0004 4 = 58000000
ffff000103533780 1172769825 C Co:6:002:0 0 4 >
ffff000103533780 1172769864 S Co:6:002:0 s 40 05 0440 0000 0004 4 = 00000000
ffff000103533780 1172769971 C Co:6:002:0 0 4 >
ffff000103533780 1172770009 S Ci:6:002:0 s c0 05 0c00 0000 0004 4 <
ffff000103533780 1172770126 C Ci:6:002:0 0 4 = 07000000
ffff000103533780 1172770163 S Ci:6:002:0 s c0 05 08b0 0000 0004 4 <
ffff000103533780 1172770274 C Ci:6:002:0 0 4 = 42060000
ffff000103533780 1172770311 S Co:6:002:0 s 40 05 08b0 0000 0004 4 = 42060000
ffff000103533780 1172770432 C Co:6:002:0 0 4 >
ffff000103533780 1172770490 S Ci:6:002:0 s c0 05 0d04 0000 0004 4 <
ffff000103533780 1172770598 C Ci:6:002:0 0 4 = 088d90b1
ffff000103533780 1172770635 S Ci:6:002:0 s c0 05 0c1c 0000 0004 4 <
ffff000103533780 1172770752 C Ci:6:002:0 0 4 = 0300402d
ffff000103533780 1172770789 S Co:6:002:0 s 40 05 0c1c 0000 0004 4 = 0300e032
ffff000103533780 1172770901 C Co:6:002:0 0 4 >
ffff000103533780 1172770939 S Ci:6:002:0 s c0 05 0e1c 0000 0004 4 <
ffff000103533780 1172771062 C Ci:6:002:0 0 4 = 0300402d
ffff000103533780 1172771098 S Co:6:002:0 s 40 05 0e1c 0000 0004 4 = 0300e035
ffff000103533780 1172771205 C Co:6:002:0 0 4 >
ffff000103533780 1172771244 S Co:6:002:0 s 40 05 0280 0000 0002 2 = 0001
ffff000103533780 1172771351 C Co:6:002:0 0 2 >
ffff000103533780 1172771388 S Ci:6:002:0 s c0 05 010c 0000 0001 1 <
ffff000103533780 1172771499 C Ci:6:002:0 0 1 = b4
ffff000103533780 1172771535 S Co:6:002:0 s 40 05 010c 0000 0001 1 = b4
ffff000103533780 1172771643 C Co:6:002:0 0 1 >
