ffff000103558cc0 1220142291 C Bi:6:002:1 0 304 = f8000484 00000f00 de0c6000 00300000 00000000 6a687403 463c0000 63530001
ffff000103558cc0 1220142360 S Bi:6:002:1 -115 32768 <
ffff00014c2bf900 1220164526 C Bi:6:002:1 0 304 = f8000484 00000f00 e00c6000 00300000 00000000 60bf7403 463c0000 36520001
ffff00014c2bf900 1220164558 S Bi:6:002:1 -115 32768 <
ffff00013d62e840 1220180544 C Bi:6:002:1 0 304 = f8000484 00000f00 e10c6000 00300000 00000000 edfd7403 463c0000 38520001
ffff00013d62e840 1220180575 S Bi:6:002:1 -115 32768 <
ffff000103533900 1220188871 C Bi:6:002:1 0 377 = 41010484 00000f00 5e0d6000 04300000 00000000 a6247503 443a0000 88e9e901
ffff000103533900 1220188899 S Bi:6:002:1 -115 32768 <
ffff000103558cc0 1220190049 C Bi:6:002:1 0 377 = 41010484 00000f00 5e0d6000 04300000 00000000 25297503 46400000 86f0f001
ffff000103558cc0 1220190075 S Bi:6:002:1 -115 32768 <
ffff00014c2bf900 1220191324 C Bi:6:002:1 0 377 = 41010484 00000f00 5e0d6000 04300000 00000000 2e2e7503 46400000 87f6f601
ffff00014c2bf900 1220191349 S Bi:6:002:1 -115 32768 <
ffff00013d62e840 1220191947 C Bi:6:002:1 0 370 = 3a010484 00000f00 4c066000 04300000 00000000 a5307503 443c0000 86f7f701
ffff00013d62e840 1220191972 S Bi:6:002:1 -115 32768 <
ffff000103533900 1220192571 C Bi:6:002:1 0 370 = 3a010484 00000f00 4c066000 04300000 00000000 14337503 463a0000 88f8f801
ffff000103533900 1220192597 S Bi:6:002:1 -115 32768 <
ffff000103558cc0 1220193175 C Bi:6:002:1 0 370 = 3a010484 00000f00 4c066000 04300000 00000000 6b357503 463c0000 84f6f601
ffff000103558cc0 1220193198 S Bi:6:002:1 -115 32768 <
ffff00014c2bf900 1220193800 C Bi:6:002:1 0 370 = 3a010484 00000f00 4c066000 04300000 00000000 d1377503 463e0000 87eded01
ffff00014c2bf900 1220193825 S Bi:6:002:1 -115 32768 <
ffff00013d62e840 1220195440 C Bi:6:002:1 0 383 = 47010484 00000f80 900c6000 04300000 00000000 3a3e7503 443a0000 88f0f001
ffff00013d62e840 1220195464 S Bi:6:002:1 -115 32768 <
ffff000103533900 1220196315 C Bi:6:002:1 0 376 = 40010484 00000f80 fd036000 04300000 00000000 a8417503 463c0000 87f1f101
ffff000103533900 1220196340 S Bi:6:002:1 -115 32768 <
ffff000103558cc0 1220196775 C Bi:6:002:1 0 345 = 21010484 00000f00 f3086000 04300000 00000000 a1437503 423a0000 88070701
ffff000103558cc0 1220196800 S Bi:6:002:1 -115 32768 <
ffff00014c2bf900 1220197257 C Bi:6:002:1 0 351 = 27010484 00000f80 bf0d6000 04300000 00000000 79457503 463c0000 84f3f301
ffff00014c2bf900 1220197281 S Bi:6:002:1 -115 32768 <
ffff00013d62e840 1220197701 C Bi:6:002:1 0 345 = 21010484 00000f00 f3086000 04300000 00000000 40477503 463c0000 86f9f901
ffff00013d62e840 1220197726 S Bi:6:002:1 -115 32768 <
ffff000103533900 1220198678 C Bi:6:002:1 0 374 = 3e010484 00000f80 90086000 04300000 00000000 e74a7503 463c0000 84f1f101
ffff000103533900 1220198702 S Bi:6:002:1 -115 32768 <
ffff000103558cc0 1220199704 C Bi:6:002:1 0 384 = 48010484 00000f80 600b6000 04300000 00000000 df4e7503 463c0000 84fbfb01
ffff000103558cc0 1220199729 S Bi:6:002:1 -115 32768 <
ffff00014c2bf900 1220201239 C Bi:6:002:1 0 345 = 21010484 00000f00 f3086000 04300000 00000000 0e557503 3e3c0000 87000001
ffff00014c2bf900 1220201264 S Bi:6:002:1 -115 32768 <
ffff00013d62e840 1220202307 C Bi:6:002:1 0 345 = 21010484 00000f00 f3086000 04300000 00000000 40597503 443a0000 84f0f001
ffff00013d62e840 1220202333 S Bi:6:002:1 -115 32768 <
ffff000103533900 1220207022 C Bi:6:002:1 0 378 = 42010484 00000f00 930a6000 04300000 00000000 656b7503 46380000 86fdfd01
ffff000103533900 1220207048 S Bi:6:002:1 -115 32768 <
ffff000103558cc0 1220244537 C Bi:6:002:1 0 304 = f8000484 00000f00 e30c6000 00300000 00000000 def77503 383a0000 4e530001
ffff000103558cc0 1220244596 S Bi:6:002:1 -115 32768 <
ffff00014c2bf900 1220260629 C Bi:6:002:1 0 304 = f8000484 00000f00 e40c6000 00300000 00000000 be367603 383a0000 5e520001
ffff00014c2bf900 1220260654 S Bi:6:002:1 -115 32768 <
ffff00013d62e840 1220297830 C Bi:6:002:1 0 383 = 47010484 00000f80 910c6000 04300000 00000000 3cce7603 463c0000 87f0f001
ffff00013d62e840 1220297863 S Bi:6:002:1 -115 32768 <
ffff000103533900 1220299060 C Bi:6:002:1 0 376 = 40010484 00000f80 fe036000 04300000 00000000 efd27603 46400000 89e9e901
ffff000103533900 1220299087 S Bi:6:002:1 -115 32768 <
ffff000103558cc0 1220300946 C Bi:6:002:1 0 374 = 3e010484 00000f80 91086000 04300000 00000000 69da7603 463c0000 85f1f101
ffff000103558cc0 1220300970 S Bi:6:002:1 -115 32768 <
ffff00014c2bf900 1220301858 C Bi:6:002:1 0 384 = 48010484 00000f80 610b6000 04300000 00000000 eadd7603 463a0000 87f1f101
ffff00014c2bf900 1220301885 S Bi:6:002:1 -115 32768 <
ffff00013d62e840 1220400282 C Bi:6:002:1 0 383 = 47010484 00000f80 920c6000 04300000 00000000 3d5e7803 463c0000 83eded01
ffff00013d62e840 1220400338 S Bi:6:002:1 -115 32768 <
ffff000103533900 1220401400 C Bi:6:002:1 0 376 = 40010484 00000f80 ff036000 04300000 00000000 c9627803 463c0000 86f3f301
ffff000103533900 1220401428 S Bi:6:002:1 -115 32768 <
ffff000103558cc0 1220402318 C Bi:6:002:1 0 351 = 27010484 00000f80 c10d6000 04300000 00000000 83667803 463a0000 86ecec01
ffff000103558cc0 1220402343 S Bi:6:002:1 -115 32768 <
ffff00014c2bf900 1220403299 C Bi:6:002:1 0 374 = 3e010484 00000f80 92086000 04300000 00000000 2d6a7803 443a0000 86f0f001
ffff00014c2bf900 1220403324 S Bi:6:002:1 -115 32768 <
ffff00013d62e840 1220404190 C Bi:6:002:1 0 384 = 48010484 00000f80 620b6000 04300000 00000000 a46d7803 463c0000 88f4f401
ffff00013d62e840 1220404215 S Bi:6:002:1 -115 32768 <
ffff000103533900 1220414835 C Bi:6:002:1 0 310 = fe000484 00000f80 f8006000 00300000 00000000 fb907803 463c0000 88520001
ffff000103533900 1220414860 S Bi:6:002:1 -115 32768 <
ffff000103558cc0 1220502635 C Bi:6:002:1 0 383 = 47010484 00000f80 930c6000 04300000 00000000 3fee7903 443c0000 83e9e901
ffff000103558cc0 1220502669 S Bi:6:002:1 -115 32768 <
ffff00014c2bf900 1220503858 C Bi:6:002:1 0 376 = 40010484 00000f80 00046000 04300000 00000000 03f37903 463e0000 87f5f501
ffff00014c2bf900 1220503884 S Bi:6:002:1 -115 32768 <
ffff00013d62e840 1220505742 C Bi:6:002:1 0 374 = 3e010484 00000f80 93086000 04300000 00000000 67fa7903 44380000 82f5f501
ffff00013d62e840 1220505767 S Bi:6:002:1 -115 32768 <
ffff000103533900 1220606202 C Bi:6:002:1 0 376 = 40010484 00000f80 01046000 04300000 00000000 b2827b03 463a0000 86f7f701
ffff000103533900 1220606239 S Bi:6:002:1 -115 32768 <
ffff000103558cc0 1220607093 C Bi:6:002:1 0 351 = 27010484 00000f80 c30d6000 04300000 00000000 6a867b03 463c0000 86f3f301
ffff000103558cc0 1220607119 S Bi:6:002:1 -115 32768 <
ffff00014c2bf900 1220608064 C Bi:6:002:1 0 374 = 3e010484 00000f80 94086000 04300000 00000000 138a7b03 463a0000 83eaea01
ffff00014c2bf900 1220608089 S Bi:6:002:1 -115 32768 <
ffff00013d62e840 1220608932 C Bi:6:002:1 0 384 = 48010484 00000f80 640b6000 04300000 00000000 6d8d7b03 463a0000 86f1f101
ffff00013d62e840 1220608958 S Bi:6:002:1 -115 32768 <
ffff000103533900 1220623495 C Bi:6:002:1 0 310 = fe000484 00000f80 fa006000 00300000 00000000 1cc07b03 443c0000 4a530001
ffff000103533900 1220623528 S Bi:6:002:1 -115 32768 <
ffff000103558cc0 1220707473 C Bi:6:002:1 0 383 = 47010484 00000f80 950c6000 04300000 00000000 420e7d03 44380000 88eeee01
ffff000103558cc0 1220707522 S Bi:6:002:1 -115 32768 <
ffff00014c2bf900 1220708738 C Bi:6:002:1 0 376 = 40010484 00000f80 02046000 04300000 00000000 54137d03 443e0000 85e9e901
ffff00014c2bf900 1220708766 S Bi:6:002:1 -115 32768 <
ffff00013d62e840 1220709514 C Bi:6:002:1 0 351 = 27010484 00000f80 c40d6000 04300000 00000000 82167d03 443e0000 88eeee01
ffff00013d62e840 1220709538 S Bi:6:002:1 -115 32768 <
ffff000103533900 1220710351 C Bi:6:002:1 0 374 = 3e010484 00000f80 95086000 04300000 00000000 a6197d03 443a0000 85f3f301
ffff000103533900 1220710375 S Bi:6:002:1 -115 32768 <
ffff000103558cc0 1220711196 C Bi:6:002:1 0 384 = 48010484 00000f80 650b6000 04300000 00000000 e81c7d03 463c0000 87eded01
ffff000103558cc0 1220711220 S Bi:6:002:1 -115 32768 <
ffff00014c2bf900 1220716549 C Bi:6:002:1 0 377 = 41010484 00000f00 5f0d6000 04300000 00000000 cd317d03 463a0000 8af4f401
ffff00014c2bf900 1220716573 S Bi:6:002:1 -115 32768 <
ffff00013d62e840 1220717175 C Bi:6:002:1 0 377 = 41010484 00000f00 5f0d6000 04300000 00000000 4d347d03 463c0000 87020201
ffff00013d62e840 1220717201 S Bi:6:002:1 -115 32768 <
ffff000103533900 1220717799 C Bi:6:002:1 0 377 = 41010484 00000f00 5f0d6000 04300000 00000000 b2367d03 403a0000 88fbfb01
ffff000103533900 1220717823 S Bi:6:002:1 -115 32768 <
ffff000103558cc0 1220718418 C Bi:6:002:1 0 377 = 41010484 00000f00 5f0d6000 04300000 00000000 17397d03 463c0000 88f7f701
ffff000103558cc0 1220718445 S Bi:6:002:1 -115 32768 <
ffff00014c2bf900 1220719025 C Bi:6:002:1 0 370 = 3a010484 00000f00 4d066000 04300000 00000000 8e3b7d03 443a0000 83f6f601
ffff00014c2bf900 1220719048 S Bi:6:002:1 -115 32768 <
ffff00013d62e840 1220719618 C Bi:6:002:1 0 370 = 3a010484 00000f00 4d066000 04300000 00000000 f43d7d03 443c0000 87f1f101
ffff00013d62e840 1220719639 S Bi:6:002:1 -115 32768 <
ffff000103533900 1220720224 C Bi:6:002:1 0 370 = 3a010484 00000f00 4d066000 04300000 00000000 51407d03 443a0000 87f5f501
ffff000103533900 1220720244 S Bi:6:002:1 -115 32768 <
ffff000103558cc0 1220720851 C Bi:6:002:1 0 370 = 3a010484 00000f00 4d066000 04300000 00000000 ae427d03 42380000 87000001
ffff000103558cc0 1220720877 S Bi:6:002:1 -115 32768 <
ffff00014c2bf900 1220721413 C Bi:6:002:1 0 345 = 21010484 00000f00 f4086000 04300000 00000000 14457d03 463c0000 88efef01
ffff00014c2bf900 1220721434 S Bi:6:002:1 -115 32768 <
ffff00013d62e840 1220721995 C Bi:6:002:1 0 345 = 21010484 00000f00 f4086000 04300000 00000000 63477d03 443a0000 87f4f401
ffff00013d62e840 1220722015 S Bi:6:002:1 -115 32768 <
ffff000103533900 1220722581 C Bi:6:002:1 0 345 = 21010484 00000f00 f4086000 04300000 00000000 a0497d03 463e0000 86f1f101
ffff000103533900 1220722602 S Bi:6:002:1 -115 32768 <
ffff000103558cc0 1220723143 C Bi:6:002:1 0 345 = 21010484 00000f00 f4086000 04300000 00000000 dd4b7d03 463a0000 87f1f101
ffff000103558cc0 1220723163 S Bi:6:002:1 -115 32768 <
ffff00014c2bf900 1220724401 C Bi:6:002:1 0 378 = 42010484 00000f00 940a6000 04300000 00000000 95507d03 463a0000 86ebeb01
ffff00014c2bf900 1220724422 S Bi:6:002:1 -115 32768 <
ffff00013d62e840 1220725049 C Bi:6:002:1 0 378 = 42010484 00000f00 940a6000 04300000 00000000 07537d03 463a0000 89f7f701
ffff00013d62e840 1220725075 S Bi:6:002:1 -115 32768 <
ffff000103533900 1220748977 C Bi:6:002:1 0 370 = 3a010484 00000f00 4e066000 04300000 00000000 72b07d03 463a0000 83fafa01
ffff000103533900 1220749002 S Bi:6:002:1 -115 32768 <
ffff00013d9fb000 1220764333 S Ci:6:002:0 s c0 05 004c 0000 0001 1 <
ffff00013d9fb000 1220764503 C Ci:6:002:0 0 1 = 20
ffff00013d9fb000 1220764680 S Co:6:002:0 s 40 05 004c 0000 0001 1 = 20
ffff00013d9fb000 1220764819 C Co:6:002:0 0 1 >
ffff00013d9fb000 1220764997 S Ci:6:002:0 s c0 05 0770 0000 0004 4 <
ffff00013d9fb000 1220765142 C Ci:6:002:0 0 4 = 00000000
ffff00013d9fb000 1220765300 S Ci:6:002:0 s c0 05 0774 0000 0004 4 <
ffff00013d9fb000 1220765450 C Ci:6:002:0 0 4 = 00000000
ffff00013d9fb000 1220765612 S Co:6:002:0 s 40 05 076e 0000 0001 1 = 0c
ffff00013d9fb000 1220765751 C Co:6:002:0 0 1 >
ffff00013d9fb000 1220765916 S Ci:6:002:0 s c0 05 0808 0000 0004 4 <
ffff00013d9fb000 1220766063 C Ci:6:002:0 0 4 = 3382023e
ffff00013d9fb000 1220766206 S Ci:6:002:0 s c0 05 0a5c 0000 0002 2 <
ffff00013d9fb000 1220766328 C Ci:6:002:0 0 2 = 9e00
ffff00013d9fb000 1220766376 S Ci:6:002:0 s c0 05 0f48 0000 0002 2 <
ffff000103558cc0 1220766386 C Bi:6:002:1 0 370 = 3a010484 00000f00 4f066000 04300000 00000000 d2f47d03 443a0000 85fbfb01
ffff000103558cc0 1220766392 S Bi:6:002:1 -115 32768 <
ffff00013d9fb000 1220766442 C Ci:6:002:0 0 2 = 1b01
ffff00013d9fb000 1220766468 S Ci:6:002:0 s c0 05 0f04 0000 0004 4 <
ffff00013d9fb000 1220766518 C Ci:6:002:0 0 4 = 0e000e00
ffff00013d9fb000 1220766541 S Ci:6:002:0 s c0 05 0f14 0000 0004 4 <
ffff00013d9fb000 1220766651 C Ci:6:002:0 0 4 = 74001700
ffff00013d9fb000 1220766671 S Ci:6:002:0 s c0 05 0f10 0000 0004 4 <
ffff00013d9fb000 1220766782 C Ci:6:002:0 0 4 = 00000000
ffff00013d9fb000 1220766810 S Ci:6:002:0 s c0 05 0f0c 0000 0004 4 <
ffff00013d9fb000 1220766928 C Ci:6:002:0 0 4 = 00000000
ffff00013d9fb000 1220766949 S Ci:6:002:0 s c0 05 0f08 0000 0004 4 <
ffff00014c2bf900 1220766974 C Bi:6:002:1 0 370 = 3a010484 00000f00 4f066000 04300000 00000000 3bf77d03 463a0000 87f7f701
ffff00014c2bf900 1220767002 S Bi:6:002:1 -115 32768 <
ffff00013d9fb000 1220767038 C Ci:6:002:0 0 4 = 0b01a601
ffff00013d9fb000 1220767054 S Ci:6:002:0 s c0 05 0fcc 0000 0004 4 <
ffff00013d9fb000 1220767111 C Ci:6:002:0 0 4 = 00000000
ffff00013d9fb000 1220767127 S Ci:6:002:0 s c0 05 09a4 0000 0004 4 <
ffff00013d9fb000 1220767238 C Ci:6:002:0 0 4 = 80000800
ffff00013d9fb000 1220767365 S Co:6:002:0 s 40 05 09a4 0000 0004 4 = 80000a00
ffff00013d9fb000 1220767482 C Co:6:002:0 0 4 >
ffff00013d9fb000 1220767626 S Ci:6:002:0 s c0 05 09a4 0000 0004 4 <
ffff00013d9fb000 1220767761 C Ci:6:002:0 0 4 = 80000a00
ffff00013d9fb000 1220767797 S Co:6:002:0 s 40 05 09a4 0000 0004 4 = 80000800
ffff00013d9fb000 1220767905 C Co:6:002:0 0 4 >
ffff00013d9fb000 1220767937 S Ci:6:002:0 s c0 05 0a2c 0000 0004 4 <
ffff00013d9fb000 1220768047 C Ci:6:002:0 0 4 = 00809000
ffff00013d9fb000 1220768076 S Co:6:002:0 s 40 05 0a2c 0000 0004 4 = 00009000
ffff00013d9fb000 1220768189 C Co:6:002:0 0 4 >
ffff00013d62e840 1220768227 C Bi:6:002:1 0 370 = 3a010484 00000f00 4f066000 04300000 00000000 d3fb7d03 463c0000 82f4f401
ffff00013d62e840 1220768235 S Bi:6:002:1 -115 32768 <
ffff00013d9fb000 1220768321 S Ci:6:002:0 s c0 05 0a2c 0000 0004 4 <
ffff00013d9fb000 1220768437 C Ci:6:002:0 0 4 = 00009000
ffff00013d9fb000 1220768576 S Co:6:002:0 s 40 05 0a2c 0000 0004 4 = 00809000
ffff00013d9fb000 1220768682 C Co:6:002:0 0 4 >
ffff00013d9fb000 1220768715 S Ci:6:002:0 s c0 05 0b58 0000 0004 4 <
ffff00013d9fb000 1220768832 C Ci:6:002:0 0 4 = 00000000
ffff00013d9fb000 1220768853 S Co:6:002:0 s 40 05 0b58 0000 0004 4 = 01000000
ffff00013d9fb000 1220768962 C Co:6:002:0 0 4 >
ffff00013d9fb000 1220768992 S Ci:6:002:0 s c0 05 0b58 0000 0004 4 <
ffff00013d9fb000 1220769102 C Ci:6:002:0 0 4 = 01000000
ffff00013d9fb000 1220769123 S Co:6:002:0 s 40 05 0b58 0000 0004 4 = 00000000
ffff00013d9fb000 1220769230 C Co:6:002:0 0 4 >
ffff00013d9fb000 1220769260 S Ci:6:002:0 s c0 05 01cc 0000 0001 1 <
ffff00013d9fb000 1220769383 C Ci:6:002:0 0 1 = 00
ffff00013d9fb000 1220769406 S Co:6:002:0 s 40 05 01f0 0000 0004 4 = 00000000
ffff00013d9fb000 1220769520 C Co:6:002:0 0 4 >
ffff00013d9fb000 1220769543 S Co:6:002:0 s 40 05 01d0 0000 0004 4 = 58000000
ffff00013d9fb000 1220769651 C Co:6:002:0 0 4 >
ffff00013d9fb000 1220769681 S Co:6:002:0 s 40 05 0440 0000 0004 4 = 00000000
ffff00013d9fb000 1220769787 C Co:6:002:0 0 4 >
ffff00013d9fb000 1220769817 S Ci:6:002:0 s c0 05 0c00 0000 0004 4 <
ffff00013d9fb000 1220769928 C Ci:6:002:0 0 4 = 07000000
ffff00013d9fb000 1220769956 S Ci:6:002:0 s c0 05 08b0 0000 0004 4 <
ffff00013d9fb000 1220770073 C Ci:6:002:0 0 4 = 18060000
ffff00013d9fb000 1220770096 S Co:6:002:0 s 40 05 08b0 0000 0004 4 = 42060000
ffff00013d9fb000 1220770204 C Co:6:002:0 0 4 >
ffff00013d9fb000 1220770253 S Ci:6:002:0 s c0 05 0d04 0000 0004 4 <
ffff00013d9fb000 1220770357 C Ci:6:002:0 0 4 = 088d90b1
ffff00013d9fb000 1220770380 S Co:6:002:0 s 40 05 0c90 0000 0004 4 = 088d2304
ffff00013d9fb000 1220770495 C Co:6:002:0 0 4 >
ffff00013d9fb000 1220770531 S Co:6:002:0 s 40 05 0280 0000 0002 2 = 0001
ffff00013d9fb000 1220770637 C Co:6:002:0 0 2 >
ffff00013d9fb000 1220770666 S Ci:6:002:0 s c0 05 010c 0000 0001 1 <
ffff00013d9fb000 1220770777 C Ci:6:002:0 0 1 = b4
ffff00013d9fb000 1220770806 S Co:6:002:0 s 40 05 010c 0000 0001 1 = b4
ffff00013d9fb000 1220770914 C Co:6:002:0 0 1 >
ffff000103533900 1220809873 C Bi:6:002:1 0 383 = 47010484 00000f80 960c6000 04300000 00000000 439e7e03 463a0000 85f7f701
ffff000103533900 1220809902 S Bi:6:002:1 -115 32768 <
ffff000103558cc0 1220810833 C Bi:6:002:1 0 376 = 40010484 00000f80 03046000 04300000 00000000 2ba27e03 463a0000 87f8f801
ffff000103558cc0 1220810861 S Bi:6:002:1 -115 32768 <
ffff00014c2bf900 1220811755 C Bi:6:002:1 0 351 = 27010484 00000f80 c50d6000 04300000 00000000 f3a57e03 443c0000 88eaea01
ffff00014c2bf900 1220811777 S Bi:6:002:1 -115 32768 <
ffff00013d62e840 1220812649 C Bi:6:002:1 0 374 = 3e010484 00000f80 96086000 04300000 00000000 4ba97e03 46380000 81f3f301
ffff00013d62e840 1220812669 S Bi:6:002:1 -115 32768 <
ffff000103533900 1220816896 C Bi:6:002:1 0 384 = 48010484 00000f80 660b6000 04300000 00000000 beb97e03 443a0000 84f2f201
ffff000103533900 1220816922 S Bi:6:002:1 -115 32768 <
ffff000103558cc0 1220912280 C Bi:6:002:1 0 383 = 47010484 00000f80 970c6000 04300000 00000000 452e8003 463c0000 87f4f401
ffff000103558cc0 1220912331 S Bi:6:002:1 -115 32768 <
ffff00014c2bf900 1220913455 C Bi:6:002:1 0 376 = 40010484 00000f80 04046000 04300000 00000000 04338003 443a0000 87f9f901
ffff00014c2bf900 1220913483 S Bi:6:002:1 -115 32768 <
ffff00013d62e840 1220914372 C Bi:6:002:1 0 351 = 27010484 00000f80 c60d6000 04300000 00000000 be368003 423a0000 84f7f701
ffff00013d62e840 1220914397 S Bi:6:002:1 -115 32768 <
ffff000103533900 1220915344 C Bi:6:002:1 0 374 = 3e010484 00000f80 97086000 04300000 00000000 683a8003 463c0000 84f9f901
ffff000103533900 1220915369 S Bi:6:002:1 -115 32768 <
ffff000103558cc0 1220928335 C Bi:6:002:1 0 377 = 41010484 00000f00 600d6000 04300000 00000000 fd6c8003 463e0000 84eaea01
ffff000103558cc0 1220928373 S Bi:6:002:1 -115 32768 <
ffff00014c2bf900 1220928949 C Bi:6:002:1 0 377 = 41010484 00000f00 600d6000 04300000 00000000 8c6f8003 463a0000 87f7f701
ffff00014c2bf900 1220928975 S Bi:6:002:1 -115 32768 <
ffff00013d62e840 1220929568 C Bi:6:002:1 0 377 = 41010484 00000f00 600d6000 04300000 00000000 fa718003 443e0000 84f3f301
ffff00013d62e840 1220929593 S Bi:6:002:1 -115 32768 <
ffff000103533900 1220930186 C Bi:6:002:1 0 377 = 41010484 00000f00 600d6000 04300000 00000000 5f748003 463c0000 88f1f101
ffff000103533900 1220930211 S Bi:6:002:1 -115 32768 <
ffff000103558cc0 1220930805 C Bi:6:002:1 0 370 = 3a010484 00000f00 50066000 04300000 00000000 d6768003 443c0000 85f9f901
ffff000103558cc0 1220930829 S Bi:6:002:1 -115 32768 <
ffff00014c2bf900 1220931431 C Bi:6:002:1 0 370 = 3a010484 00000f00 50066000 04300000 00000000 45798003 443a0000 88eded01
ffff00014c2bf900 1220931455 S Bi:6:002:1 -115 32768 <
ffff00013d62e840 1220932043 C Bi:6:002:1 0 370 = 3a010484 00000f00 50066000 04300000 00000000 a27b8003 463e0000 88eded01
ffff00013d62e840 1220932067 S Bi:6:002:1 -115 32768 <
ffff000103533900 1220932552 C Bi:6:002:1 0 370 = 3a010484 00000f00 50066000 04300000 00000000 ff7d8003 463c0000 87f5f501
ffff000103533900 1220932569 S Bi:6:002:1 -115 32768 <
ffff000103558cc0 1220937271 C Bi:6:002:1 0 345 = 21010484 00000f00 f5086000 04300000 00000000 94908003 463c0000 85fafa01
ffff000103558cc0 1220937288 S Bi:6:002:1 -115 32768 <
ffff00014c2bf900 1220937882 C Bi:6:002:1 0 345 = 21010484 00000f00 f5086000 04300000 00000000 f5928003 443c0000 84efef01
ffff00014c2bf900 1220937897 S Bi:6:002:1 -115 32768 <
ffff00013d62e840 1220938530 C Bi:6:002:1 0 345 = 21010484 00000f00 f5086000 04300000 00000000 32958003 463c0000 87f9f901
ffff00013d62e840 1220938552 S Bi:6:002:1 -115 32768 <
ffff000103533900 1220941832 C Bi:6:002:1 0 378 = 42010484 00000f00 950a6000 04300000 00000000 c4a18003 463c0000 88f0f001
ffff000103533900 1220941855 S Bi:6:002:1 -115 32768 <
ffff000103558cc0 1220942425 C Bi:6:002:1 0 378 = 42010484 00000f00 950a6000 04300000 00000000 2da48003 463c0000 86f5f501
ffff000103558cc0 1220942450 S Bi:6:002:1 -115 32768 <
ffff00014c2bf900 1220943043 C Bi:6:002:1 0 378 = 42010484 00000f00 950a6000 04300000 00000000 96a68003 463c0000 84f9f901
ffff00014c2bf900 1220943068 S Bi:6:002:1 -115 32768 <
ffff00013d62e840 1221014676 C Bi:6:002:1 0 383 = 47010484 00000f80 980c6000 04300000 00000000 46be8103 463a0000 86f4f401
ffff00013d62e840 1221014714 S Bi:6:002:1 -115 32768 <
ffff000103533900 1221015699 C Bi:6:002:1 0 376 = 40010484 00000f80 05046000 04300000 00000000 6bc28103 423a0000 88f2f201
ffff000103533900 1221015727 S Bi:6:002:1 -115 32768 <
ffff000103558cc0 1221017417 C Bi:6:002:1 0 374 = 3e010484 00000f80 98086000 04300000 00000000 1cc98103 463c0000 85f7f701
ffff000103558cc0 1221017442 S Bi:6:002:1 -115 32768 <
ffff00014c2bf900 1221018292 C Bi:6:002:1 0 384 = 48010484 00000f80 680b6000 04300000 00000000 6fcc8103 463e0000 88f5f501
ffff00014c2bf900 1221018318 S Bi:6:002:1 -115 32768 <
ffff00013d62e840 1221041291 C Bi:6:002:1 0 310 = fe000484 00000f80 fe006000 00300000 00000000 20208203 463e0000 44520001
ffff00013d62e840 1221041321 S Bi:6:002:1 -115 32768 <
ffff00013d9fb180 1221114022 S Ci:6:002:0 s c0 05 0454 0000 0001 1 <
ffff00013d9fb180 1221114123 C Ci:6:002:0 0 1 = 00
ffff00013d9fb180 1221114167 S Ci:6:002:0 s c0 05 0860 0000 0004 4 <
ffff00013d9fb180 1221114209 C Ci:6:002:0 0 4 = 21c3d572
ffff00013d9fb180 1221114244 S Co:6:002:0 s 40 05 0860 0000 0004 4 = 21c3d572
ffff00013d9fb180 1221114308 C Co:6:002:0 0 4 >
ffff00013d9fb180 1221114343 S Ci:6:002:0 s c0 05 0c00 0000 0004 4 <
ffff00013d9fb180 1221114393 C Ci:6:002:0 0 4 = 07000000
ffff00013d9fb180 1221114424 S Ci:6:002:0 s c0 05 08b0 0000 0004 4 <
ffff00013d9fb180 1221114459 C Ci:6:002:0 0 4 = 42060000
ffff00013d9fb180 1221114490 S Co:6:002:0 s 40 05 08b0 0000 0004 4 = 18060000
ffff00013d9fb180 1221114526 C Co:6:002:0 0 4 >
ffff00013d9fb180 1221114577 S Ci:6:002:0 s c0 05 0d04 0000 0004 4 <
ffff00013d9fb180 1221114626 C Ci:6:002:0 0 4 = 017c90b1
ffff00013d9fb180 1221114659 S Co:6:002:0 s 40 05 0c90 0000 0004 4 = 017c8001
ffff00013d9fb180 1221114704 C Co:6:002:0 0 4 >
ffff00013d9fb180 1221114750 S Ci:6:002:0 s c0 05 08ac 0000 0004 4 <
ffff00013d9fb180 1221114828 C Ci:6:002:0 0 4 = 08faf00f
ffff00013d9fb180 1221114865 S Co:6:002:0 s 40 05 08ac 0000 0004 4 = 08faf00f
ffff00013d9fb180 1221114896 C Co:6:002:0 0 4 >
ffff00013d9fb180 1221114933 S Ci:6:002:0 s c0 05 08ac 0000 0004 4 <
ffff00013d9fb180 1221114973 C Ci:6:002:0 0 4 = 08faf00f
ffff00013d9fb180 1221115011 S Co:6:002:0 s 40 05 08ac 0000 0004 4 = 08faf00f
ffff00013d9fb180 1221115059 C Co:6:002:0 0 4 >
ffff00013d9fb180 1221115094 S Ci:6:002:0 s c0 05 08c4 0000 0004 4 <
ffff00013d9fb180 1221115135 C Ci:6:002:0 0 4 = 00000000
ffff00013d9fb180 1221115171 S Co:6:002:0 s 40 05 08c4 0000 0004 4 = 00000000
ffff00013d9fb180 1221115202 C Co:6:002:0 0 4 >
ffff00013d9fb180 1221115238 S Ci:6:002:0 s c0 05 0c00 0000 0004 4 <
ffff00013d9fb180 1221115277 C Ci:6:002:0 0 4 = 07000000
ffff00013d9fb180 1221115311 S Ci:6:002:0 s c0 05 08b0 0000 0004 4 <
ffff00013d9fb180 1221115350 C Ci:6:002:0 0 4 = 18060000
ffff00013d9fb180 1221115385 S Co:6:002:0 s 40 05 08b0 0000 0004 4 = 18060000
ffff00013d9fb180 1221115434 C Co:6:002:0 0 4 >
ffff00013d9fb180 1221115489 S Ci:6:002:0 s c0 05 0d04 0000 0004 4 <
ffff00013d9fb180 1221115538 C Ci:6:002:0 0 4 = 017c90b1
ffff00013d9fb180 1221115573 S Co:6:002:0 s 40 05 0c90 0000 0004 4 = 017c8001
ffff00013d9fb180 1221115603 C Co:6:002:0 0 4 >
ffff00013d9fb180 1221115651 S Ci:6:002:0 s c0 05 0e00 0000 0004 4 <
ffff00013d9fb180 1221115697 C Ci:6:002:0 0 4 = 07000000
ffff00013d9fb180 1221115732 S Ci:6:002:0 s c0 05 08b0 0000 0004 4 <
ffff00013d9fb180 1221115766 C Ci:6:002:0 0 4 = 18060000
ffff00013d9fb180 1221115801 S Co:6:002:0 s 40 05 08b0 0000 0004 4 = 18060000
ffff00013d9fb180 1221115832 C Co:6:002:0 0 4 >
ffff00013d9fb180 1221115888 S Ci:6:002:0 s c0 05 0d44 0000 0004 4 <
ffff00013d9fb180 1221115939 C Ci:6:002:0 0 4 = 017c90b1
ffff00013d9fb180 1221115975 S Co:6:002:0 s 40 05 0e90 0000 0004 4 = 017c8001
ffff00013d9fb180 1221116027 C Co:6:002:0 0 4 >
ffff00013d9fb180 1221116131 S Ci:6:002:0 s c0 05 08ac 0000 0004 4 <
ffff00013d9fb180 1221116192 C Ci:6:002:0 0 4 = 08faf00f
ffff00013d9fb180 1221116229 S Co:6:002:0 s 40 05 08ac 0000 0004 4 = 08faf00f
ffff00013d9fb180 1221116260 C Co:6:002:0 0 4 >
ffff00013d9fb180 1221116296 S Ci:6:002:0 s c0 05 08ac 0000 0004 4 <
ffff00013d9fb180 1221116332 C Ci:6:002:0 0 4 = 08faf00f
ffff00013d9fb180 1221116367 S Co:6:002:0 s 40 05 08ac 0000 0004 4 = 08faf00f
ffff00013d9fb180 1221116399 C Co:6:002:0 0 4 >
ffff00013d9fb180 1221116433 S Ci:6:002:0 s c0 05 08c4 0000 0004 4 <
ffff00013d9fb180 1221116470 C Ci:6:002:0 0 4 = 00000000
ffff00013d9fb180 1221116505 S Co:6:002:0 s 40 05 08c4 0000 0004 4 = 00000000
ffff00013d9fb180 1221116536 C Co:6:002:0 0 4 >
ffff00013d9fb180 1221116571 S Ci:6:002:0 s c0 05 0e00 0000 0004 4 <
ffff00013d9fb180 1221116608 C Ci:6:002:0 0 4 = 07000000
ffff00013d9fb180 1221116643 S Ci:6:002:0 s c0 05 08b0 0000 0004 4 <
ffff00013d9fb180 1221116690 C Ci:6:002:0 0 4 = 18060000
ffff00013d9fb180 1221116725 S Co:6:002:0 s 40 05 08b0 0000 0004 4 = 18060000
ffff00013d9fb180 1221116757 C Co:6:002:0 0 4 >
ffff00013d9fb180 1221116793 S Ci:6:002:0 s c0 05 0d44 0000 0004 4 <
ffff00013d9fb180 1221116826 C Ci:6:002:0 0 4 = 017c90b1
ffff00013d9fb180 1221116861 S Co:6:002:0 s 40 05 0e90 0000 0004 4 = 017c8001
ffff00013d9fb180 1221116892 C Co:6:002:0 0 4 >
ffff00013d9fb180 1221116939 S Ci:6:002:0 s c0 05 0668 0000 0002 2 <
ffff00013d9fb180 1221116986 C Ci:6:002:0 0 2 = 0010
ffff00013d9fb180 1221117020 S Co:6:002:0 s 40 05 0668 0000 0002 2 = 0010
ffff00013d9fb180 1221117063 C Co:6:002:0 0 2 >
ffff00013d9fb180 1221117097 S Co:6:002:0 s 40 05 0483 0000 0001 1 = 00
ffff00013d9fb180 1221117127 C Co:6:002:0 0 1 >
ffff00013d9fb180 1221117162 S Ci:6:002:0 s c0 05 0837 0000 0001 1 <
ffff00013d9fb180 1221117198 C Ci:6:002:0 0 1 = 00
ffff00013d9fb180 1221117232 S Ci:6:002:0 s c0 05 08ac 0000 0004 4 <
ffff00013d9fb180 1221117279 C Ci:6:002:0 0 4 = 08faf00f
ffff00013d9fb180 1221117314 S Co:6:002:0 s 40 05 08ac 0000 0004 4 = 08faf00f
ffff000103533900 1221117322 C Bi:6:002:1 0 383 = 47010484 00000f80 990c6000 04300000 00000000 944f8303 443c0000 88ecec01
ffff000103533900 1221117331 S Bi:6:002:1 -115 32768 <
ffff00013d9fb180 1221117389 C Co:6:002:0 0 4 >
ffff00013d9fb180 1221117427 S Ci:6:002:0 s c0 05 08c4 0000 0004 4 <
ffff00013d9fb180 1221117472 C Ci:6:002:0 0 4 = 00000000
ffff00013d9fb180 1221117509 S Co:6:002:0 s 40 05 08c4 0000 0004 4 = 00000000
ffff00013d9fb180 1221117556 C Co:6:002:0 0 4 >
ffff00013d9fb180 1221117591 S Ci:6:002:0 s c0 05 0848 0000 0004 4 <
ffff00013d9fb180 1221117628 C Ci:6:002:0 0 4 = 8bffd061
ffff00013d9fb180 1221117663 S Co:6:002:0 s 40 05 0848 0000 0004 4 = 8bffd061
ffff00013d9fb180 1221117695 C Co:6:002:0 0 4 >
ffff00013d9fb180 1221117729 S Ci:6:002:0 s c0 05 08ac 0000 0004 4 <
ffff00013d9fb180 1221117766 C Ci:6:002:0 0 4 = 08faf00f
ffff00013d9fb180 1221117802 S Co:6:002:0 s 40 05 08ac 0000 0004 4 = 08faf00f
ffff00013d9fb180 1221117836 C Co:6:002:0 0 4 >
ffff00013d9fb180 1221117870 S Ci:6:002:0 s c0 05 08ac 0000 0004 4 <
ffff00013d9fb180 1221117906 C Ci:6:002:0 0 4 = 08faf00f
ffff00013d9fb180 1221117941 S Co:6:002:0 s 40 05 08ac 0000 0004 4 = 08faf00f
ffff00013d9fb180 1221117973 C Co:6:002:0 0 4 >
ffff00013d9fb180 1221118008 S Ci:6:002:0 s c0 05 08c4 0000 0004 4 <
ffff00013d9fb180 1221118061 C Ci:6:002:0 0 4 = 00000000
ffff00013d9fb180 1221118096 S Co:6:002:0 s 40 05 08c4 0000 0004 4 = 00000000
ffff00013d9fb180 1221118128 C Co:6:002:0 0 4 >
ffff00013d9fb180 1221118162 S Ci:6:002:0 s c0 05 0c00 0000 0004 4 <
ffff00013d9fb180 1221118203 C Ci:6:002:0 0 4 = 07000000
ffff00013d9fb180 1221118239 S Ci:6:002:0 s c0 05 08b0 0000 0004 4 <
ffff000103558cc0 1221118246 C Bi:6:002:1 0 376 = 40010484 00000f80 06046000 04300000 00000000 3a538303 463a0000 87eded01
ffff000103558cc0 1221118252 S Bi:6:002:1 -115 32768 <
ffff00013d9fb180 1221118302 C Ci:6:002:0 0 4 = 18060000
ffff00013d9fb180 1221118341 S Co:6:002:0 s 40 05 08b0 0000 0004 4 = 18060000
ffff00013d9fb180 1221118374 C Co:6:002:0 0 4 >
ffff00013d9fb180 1221118431 S Ci:6:002:0 s c0 05 0d04 0000 0004 4 <
ffff00013d9fb180 1221118479 C Ci:6:002:0 0 4 = 017c90b1
ffff00013d9fb180 1221118514 S Co:6:002:0 s 40 05 0c90 0000 0004 4 = 017c8001
ffff00013d9fb180 1221118563 C Co:6:002:0 0 4 >
ffff00013d9fb180 1221118610 S Ci:6:002:0 s c0 05 0e00 0000 0004 4 <
ffff00013d9fb180 1221118658 C Ci:6:002:0 0 4 = 07000000
ffff00013d9fb180 1221118693 S Ci:6:002:0 s c0 05 08b0 0000 0004 4 <
ffff00013d9fb180 1221118729 C Ci:6:002:0 0 4 = 18060000
ffff00013d9fb180 1221118762 S Co:6:002:0 s 40 05 08b0 0000 0004 4 = 18060000
ffff00013d9fb180 1221118811 C Co:6:002:0 0 4 >
ffff00013d9fb180 1221118866 S Ci:6:002:0 s c0 05 0d44 0000 0004 4 <
ffff00013d9fb180 1221118913 C Ci:6:002:0 0 4 = 017c90b1
ffff00013d9fb180 1221118948 S Co:6:002:0 s 40 05 0e90 0000 0004 4 = 017c8001
ffff00013d9fb180 1221118979 C Co:6:002:0 0 4 >
ffff00013d9fb180 1221119047 S Ci:6:002:0 s c0 05 0c20 0000 0004 4 <
ffff00013d9fb180 1221119096 C Ci:6:002:0 0 4 = 13131313
ffff00013d9fb180 1221119131 S Co:6:002:0 s 40 05 0c20 0000 0004 4 = 13131313
ffff00013d9fb180 1221119181 C Co:6:002:0 0 4 >
ffff00013d9fb180 1221119215 S Ci:6:002:0 s c0 05 0c24 0000 0004 4 <
ffff00013d9fb180 1221119252 C Ci:6:002:0 0 4 = 20202020
ffff00013d9fb180 1221119287 S Co:6:002:0 s 40 05 0c24 0000 0004 4 = 20202020
ffff00013d9fb180 1221119318 C Co:6:002:0 0 4 >
ffff00013d9fb180 1221119353 S Ci:6:002:0 s c0 05 0c28 0000 0004 4 <
ffff00013d9fb180 1221119391 C Ci:6:002:0 0 4 = 20201e1c
ffff00013d9fb180 1221119425 S Co:6:002:0 s 40 05 0c28 0000 0004 4 = 20201e1c
ffff00013d9fb180 1221119457 C Co:6:002:0 0 4 >
ffff00013d9fb180 1221119492 S Ci:6:002:0 s c0 05 0c2c 0000 0004 4 <
ffff00013d9fb180 1221119529 C Ci:6:002:0 0 4 = 20202020
ffff00013d9fb180 1221119564 S Co:6:002:0 s 40 05 0c2c 0000 0004 4 = 20202020
ffff00013d9fb180 1221119595 C Co:6:002:0 0 4 >
ffff00013d9fb180 1221119630 S Ci:6:002:0 s c0 05 0c30 0000 0004 4 <
ffff00013d9fb180 1221119684 C Ci:6:002:0 0 4 = 20201e1c
ffff00013d9fb180 1221119718 S Co:6:002:0 s 40 05 0c30 0000 0004 4 = 20201e1c
ffff00013d9fb180 1221119750 C Co:6:002:0 0 4 >
ffff00013d9fb180 1221119785 S Ci:6:002:0 s c0 05 0c34 0000 0004 4 <
ffff00013d9fb180 1221119823 C Ci:6:002:0 0 4 = 20202020
ffff00013d9fb180 1221119858 S Co:6:002:0 s 40 05 0c34 0000 0004 4 = 20202020
ffff00013d9fb180 1221119890 C Co:6:002:0 0 4 >
ffff00013d9fb180 1221119924 S Ci:6:002:0 s c0 05 0c38 0000 0004 4 <
ffff00013d9fb180 1221119962 C Ci:6:002:0 0 4 = 201e1c1a
ffff00013d9fb180 1221119997 S Co:6:002:0 s 40 05 0c38 0000 0004 4 = 201e1c1a
ffff00013d9fb180 1221120030 C Co:6:002:0 0 4 >
ffff00013d9fb180 1221120066 S Ci:6:002:0 s c0 05 0c3c 0000 0004 4 <
ffff00014c2bf900 1221120104 C Bi:6:002:1 0 374 = 3e010484 00000f80 99086000 04300000 00000000 9e5a8303 463c0000 85eded01
ffff00014c2bf900 1221120131 S Bi:6:002:1 -115 32768 <
ffff00013d9fb180 1221120168 C Ci:6:002:0 0 4 = 20202020
ffff00013d9fb180 1221120208 S Co:6:002:0 s 40 05 0c3c 0000 0004 4 = 20202020
ffff00013d9fb180 1221120241 C Co:6:002:0 0 4 >
ffff00013d9fb180 1221120278 S Ci:6:002:0 s c0 05 0c40 0000 0004 4 <
ffff00013d9fb180 1221120317 C Ci:6:002:0 0 4 = 20201e1c
ffff00013d9fb180 1221120352 S Co:6:002:0 s 40 05 0c40 0000 0004 4 = 20201e1c
ffff00013d9fb180 1221120383 C Co:6:002:0 0 4 >
ffff00013d9fb180 1221120418 S Ci:6:002:0 s c0 05 0c44 0000 0004 4 <
ffff00013d9fb180 1221120456 C Ci:6:002:0 0 4 = 1a181e1e
ffff00013d9fb180 1221120492 S Co:6:002:0 s 40 05 0c44 0000 0004 4 = 1a181e1e
ffff00013d9fb180 1221120523 C Co:6:002:0 0 4 >
ffff00013d9fb180 1221120558 S Ci:6:002:0 s c0 05 0c48 0000 0004 4 <
ffff00013d9fb180 1221120596 C Ci:6:002:0 0 4 = 1e1e1e1e
ffff00013d9fb180 1221120631 S Co:6:002:0 s 40 05 0c48 0000 0004 4 = 1e1e1e1e
ffff00013d9fb180 1221120680 C Co:6:002:0 0 4 >
ffff00013d9fb180 1221120715 S Ci:6:002:0 s c0 05 0c4c 0000 0004 4 <
ffff00013d9fb180 1221120752 C Ci:6:002:0 0 4 = 1c1a1816
ffff00013d9fb180 1221120787 S Co:6:002:0 s 40 05 0c4c 0000 0004 4 = 1c1a1816
ffff00013d9fb180 1221120819 C Co:6:002:0 0 4 >
ffff00013d9fb180 1221120855 S Ci:6:002:0 s c0 05 0c54 0000 0004 4 <
ffff00013d9fb180 1221120893 C Ci:6:002:0 0 4 = 120a0400
ffff00013d9fb180 1221120928 S Co:6:002:0 s 40 05 0c54 0000 0004 4 = 120a0400
ffff00013d9fb180 1221120963 C Co:6:002:0 0 4 >
ffff00013d9fb180 1221120998 S Ci:6:002:0 s c0 05 0e20 0000 0004 4 <
ffff00013d62e840 1221121006 C Bi:6:002:1 0 384 = 48010484 00000f80 690b6000 04300000 00000000 015e8303 423a0000 86070701
ffff00013d62e840 1221121011 S Bi:6:002:1 -115 32768 <
ffff00013d9fb180 1221121064 C Ci:6:002:0 0 4 = 14141414
ffff00013d9fb180 1221121103 S Co:6:002:0 s 40 05 0e20 0000 0004 4 = 14141414
ffff00013d9fb180 1221121138 C Co:6:002:0 0 4 >
ffff00013d9fb180 1221121174 S Ci:6:002:0 s c0 05 0e24 0000 0004 4 <
ffff00013d9fb180 1221121213 C Ci:6:002:0 0 4 = 1d1d1d1d
ffff00013d9fb180 1221121248 S Co:6:002:0 s 40 05 0e24 0000 0004 4 = 1d1d1d1d
ffff00013d9fb180 1221121280 C Co:6:002:0 0 4 >
ffff00013d9fb180 1221121315 S Ci:6:002:0 s c0 05 0e28 0000 0004 4 <
ffff00013d9fb180 1221121353 C Ci:6:002:0 0 4 = 1d1d1b19
ffff00013d9fb180 1221121388 S Co:6:002:0 s 40 05 0e28 0000 0004 4 = 1d1d1b19
ffff00013d9fb180 1221121435 C Co:6:002:0 0 4 >
ffff00013d9fb180 1221121475 S Ci:6:002:0 s c0 05 0e2c 0000 0004 4 <
ffff00013d9fb180 1221121513 C Ci:6:002:0 0 4 = 1f1f1f1f
ffff00013d9fb180 1221121548 S Co:6:002:0 s 40 05 0e2c 0000 0004 4 = 1f1f1f1f
ffff00013d9fb180 1221121580 C Co:6:002:0 0 4 >
ffff00013d9fb180 1221121614 S Ci:6:002:0 s c0 05 0e30 0000 0004 4 <
ffff00013d9fb180 1221121652 C Ci:6:002:0 0 4 = 1f1f1d1b
ffff00013d9fb180 1221121687 S Co:6:002:0 s 40 05 0e30 0000 0004 4 = 1f1f1d1b
ffff00013d9fb180 1221121719 C Co:6:002:0 0 4 >
ffff00013d9fb180 1221121754 S Ci:6:002:0 s c0 05 0e34 0000 0004 4 <
ffff00013d9fb180 1221121809 C Ci:6:002:0 0 4 = 1f1f1f1f
ffff00013d9fb180 1221121844 S Co:6:002:0 s 40 05 0e34 0000 0004 4 = 1f1f1f1f
ffff00013d9fb180 1221121875 C Co:6:002:0 0 4 >
ffff00013d9fb180 1221121910 S Ci:6:002:0 s c0 05 0e38 0000 0004 4 <
ffff00013d9fb180 1221121948 C Ci:6:002:0 0 4 = 1f1d1b19
ffff00013d9fb180 1221121983 S Co:6:002:0 s 40 05 0e38 0000 0004 4 = 1f1d1b19
ffff00013d9fb180 1221122016 C Co:6:002:0 0 4 >
ffff00013d9fb180 1221122051 S Ci:6:002:0 s c0 05 0e3c 0000 0004 4 <
ffff00013d9fb180 1221122089 C Ci:6:002:0 0 4 = 1f1f1f1f
ffff00013d9fb180 1221122124 S Co:6:002:0 s 40 05 0e3c 0000 0004 4 = 1f1f1f1f
ffff00013d9fb180 1221122155 C Co:6:002:0 0 4 >
ffff00013d9fb180 1221122189 S Ci:6:002:0 s c0 05 0e40 0000 0004 4 <
ffff00013d9fb180 1221122228 C Ci:6:002:0 0 4 = 1f1f1d1b
ffff00013d9fb180 1221122263 S Co:6:002:0 s 40 05 0e40 0000 0004 4 = 1f1f1d1b
ffff00013d9fb180 1221122311 C Co:6:002:0 0 4 >
ffff00013d9fb180 1221122345 S Ci:6:002:0 s c0 05 0e44 0000 0004 4 <
ffff00013d9fb180 1221122385 C Ci:6:002:0 0 4 = 19171d1d
ffff00013d9fb180 1221122420 S Co:6:002:0 s 40 05 0e44 0000 0004 4 = 19171d1d
ffff00013d9fb180 1221122452 C Co:6:002:0 0 4 >
ffff00013d9fb180 1221122487 S Ci:6:002:0 s c0 05 0e48 0000 0004 4 <
ffff00013d9fb180 1221122525 C Ci:6:002:0 0 4 = 1d1d1d1d
ffff00013d9fb180 1221122560 S Co:6:002:0 s 40 05 0e48 0000 0004 4 = 1d1d1d1d
ffff00013d9fb180 1221122591 C Co:6:002:0 0 4 >
ffff00013d9fb180 1221122626 S Ci:6:002:0 s c0 05 0e4c 0000 0004 4 <
ffff00013d9fb180 1221122665 C Ci:6:002:0 0 4 = 1b191715
ffff00013d9fb180 1221122700 S Co:6:002:0 s 40 05 0e4c 0000 0004 4 = 1b191715
ffff00013d9fb180 1221122733 C Co:6:002:0 0 4 >
ffff00013d9fb180 1221122767 S Ci:6:002:0 s c0 05 0e54 0000 0004 4 <
ffff00013d9fb180 1221122817 C Ci:6:002:0 0 4 = 11090300
ffff00013d9fb180 1221122852 S Co:6:002:0 s 40 05 0e54 0000 0004 4 = 11090300
ffff00013d9fb180 1221122884 C Co:6:002:0 0 4 >
ffff00013d9fb180 1221122933 S Ci:6:002:0 s c0 05 0454 0000 0001 1 <
ffff00013d9fb180 1221122984 C Ci:6:002:0 0 1 = 00
ffff00013d9fb180 1221123017 S Ci:6:002:0 s c0 05 0454 0000 0001 1 <
ffff00013d9fb180 1221123067 C Ci:6:002:0 0 1 = 00
ffff00013d9fb180 1221123101 S Co:6:002:0 s 40 05 0454 0000 0001 1 = 80
ffff00013d9fb180 1221123132 C Co:6:002:0 0 1 >
ffff00013d9fb180 1221123166 S Ci:6:002:0 s c0 05 041a 0000 0002 2 <
ffff00013d9fb180 1221123204 C Ci:6:002:0 0 2 = ff0f
ffff00013d9fb180 1221123237 S Ci:6:002:0 s c0 05 0808 0000 0004 4 <
ffff00013d9fb180 1221123275 C Ci:6:002:0 0 4 = 3382023e
ffff00013d9fb180 1221123310 S Co:6:002:0 s 40 05 0808 0000 0004 4 = 3382023e
ffff00013d9fb180 1221123341 C Co:6:002:0 0 4 >
ffff00013d9fb180 1221123375 S Ci:6:002:0 s c0 05 0834 0000 0004 4 <
ffff00013d9fb180 1221123414 C Ci:6:002:0 0 4 = 05a73700
ffff00013d9fb180 1221123448 S Co:6:002:0 s 40 05 0834 0000 0004 4 = 06a73700
ffff00013d9fb180 1221123480 C Co:6:002:0 0 4 >
ffff00013d9fb180 1221123514 S Ci:6:002:0 s c0 05 0830 0000 0004 4 <
ffff00013d9fb180 1221123567 C Ci:6:002:0 0 4 = b8eeaa2e
ffff00013d9fb180 1221123605 S Co:6:002:0 s 40 05 0830 0000 0004 4 = b8aeaa2e
ffff00013d9fb180 1221123637 C Co:6:002:0 0 4 >
ffff00013d9fb180 1221123671 S Ci:6:002:0 s c0 05 0830 0000 0004 4 <
ffff00013d9fb180 1221123710 C Ci:6:002:0 0 4 = b8aeaa2e
ffff00013d9fb180 1221123745 S Co:6:002:0 s 40 05 0830 0000 0004 4 = b8aeaa2e
ffff00013d9fb180 1221123776 C Co:6:002:0 0 4 >
ffff00013d9fb180 1221123810 S Ci:6:002:0 s c0 05 082c 0000 0004 4 <
ffff00013d9fb180 1221123849 C Ci:6:002:0 0 4 = dc832000
ffff00013d9fb180 1221123887 S Co:6:002:0 s 40 05 082c 0000 0004 4 = dd832000
ffff00013d9fb180 1221123936 C Co:6:002:0 0 4 >
ffff00013d9fb180 1221123970 S Co:6:002:0 s 40 05 0cb0 0000 0004 4 = 17773354
ffff00013d9fb180 1221124015 C Co:6:002:0 0 4 >
ffff00013d9fb180 1221124050 S Co:6:002:0 s 40 05 0eb0 0000 0004 4 = 17773354
ffff00013d9fb180 1221124082 C Co:6:002:0 0 4 >
ffff00013d9fb180 1221124116 S Ci:6:002:0 s c0 05 0cb4 0000 0004 4 <
ffff00013d9fb180 1221124156 C Ci:6:002:0 0 4 = 77000001
ffff00013d9fb180 1221124191 S Co:6:002:0 s 40 05 0cb4 0000 0004 4 = 77000001
ffff00013d9fb180 1221124223 C Co:6:002:0 0 4 >
ffff00013d9fb180 1221124257 S Ci:6:002:0 s c0 05 0eb4 0000 0004 4 <
ffff00013d9fb180 1221124315 C Ci:6:002:0 0 4 = 77000001
ffff00013d9fb180 1221124350 S Co:6:002:0 s 40 05 0eb4 0000 0004 4 = 77000001
ffff00013d9fb180 1221124382 C Co:6:002:0 0 4 >
ffff00013d9fb180 1221124416 S Ci:6:002:0 s c0 05 0900 0000 0004 4 <
ffff00013d9fb180 1221124455 C Ci:6:002:0 0 4 = 01040000
ffff00013d9fb180 1221124489 S Co:6:002:0 s 40 05 0900 0000 0004 4 = 01040000
ffff00013d9fb180 1221124520 C Co:6:002:0 0 4 >
ffff00013d9fb180 1221124555 S Ci:6:002:0 s c0 05 080c 0000 0004 4 <
ffff00013d9fb180 1221124594 C Ci:6:002:0 0 4 = 13111312
ffff00013d9fb180 1221124629 S Co:6:002:0 s 40 05 080c 0000 0004 4 = 03111312
ffff00013d9fb180 1221124660 C Co:6:002:0 0 4 >
ffff00013d9fb180 1221124695 S Ci:6:002:0 s c0 05 0a04 0000 0004 4 <
ffff00013d9fb180 1221124733 C Ci:6:002:0 0 4 = 0c00ff01
ffff00013d9fb180 1221124769 S Co:6:002:0 s 40 05 0a04 0000 0004 4 = 0c00ff0f
ffff00013d9fb180 1221124813 C Co:6:002:0 0 4 >
ffff00013d9fb180 1221124847 S Ci:6:002:0 s c0 05 0440 0000 0004 4 <
ffff00013d9fb180 1221124886 C Ci:6:002:0 0 4 = 00000000
ffff00013d9fb180 1221124921 S Co:6:002:0 s 40 05 0440 0000 0004 4 = 50010000
ffff00013d9fb180 1221124952 C Co:6:002:0 0 4 >
ffff00013d9fb180 1221124986 S Ci:6:002:0 s c0 05 0c1c 0000 0004 4 <
ffff00013d9fb180 1221125024 C Ci:6:002:0 0 4 = 03000040
ffff00013d9fb180 1221125058 S Co:6:002:0 s 40 05 0c1c 0000 0004 4 = 0300402d
ffff00013d9fb180 1221125090 C Co:6:002:0 0 4 >
ffff00013d9fb180 1221125124 S Ci:6:002:0 s c0 05 0e1c 0000 0004 4 <
ffff00013d9fb180 1221125159 C Ci:6:002:0 0 4 = 03000040
ffff00013d9fb180 1221125194 S Co:6:002:0 s 40 05 0e1c 0000 0004 4 = 0300402d
ffff00013d9fb180 1221125226 C Co:6:002:0 0 4 >
ffff00013d9fb180 1221125261 S Ci:6:002:0 s c0 05 0860 0000 0004 4 <
ffff00013d9fb180 1221125313 C Ci:6:002:0 0 4 = 21c3d572
ffff00013d9fb180 1221125347 S Co:6:002:0 s 40 05 0860 0000 0004 4 = 21c32568
ffff00013d9fb180 1221125378 C Co:6:002:0 0 4 >
ffff00013d9fb180 1221125413 S Ci:6:002:0 s c0 05 0c00 0000 0004 4 <
ffff00013d9fb180 1221125448 C Ci:6:002:0 0 4 = 07000000
ffff00013d9fb180 1221125482 S Ci:6:002:0 s c0 05 08b0 0000 0004 4 <
ffff00013d9fb180 1221125517 C Ci:6:002:0 0 4 = 18060000
ffff00013d9fb180 1221125551 S Co:6:002:0 s 40 05 08b0 0000 0004 4 = 18060000
ffff00013d9fb180 1221125582 C Co:6:002:0 0 4 >
ffff00013d9fb180 1221125636 S Ci:6:002:0 s c0 05 0d04 0000 0004 4 <
ffff00013d9fb180 1221125689 C Ci:6:002:0 0 4 = 017c90b1
ffff00013d9fb180 1221125724 S Co:6:002:0 s 40 05 0c90 0000 0004 4 = 017d8501
ffff00013d9fb180 1221125754 C Co:6:002:0 0 4 >
ffff00013d9fb180 1221125801 S Ci:6:002:0 s c0 05 08ac 0000 0004 4 <
ffff00013d9fb180 1221125848 C Ci:6:002:0 0 4 = 08faf00f
ffff00013d9fb180 1221125882 S Co:6:002:0 s 40 05 08ac 0000 0004 4 = 08faf00f
ffff00013d9fb180 1221125930 C Co:6:002:0 0 4 >
ffff00013d9fb180 1221125964 S Ci:6:002:0 s c0 05 08ac 0000 0004 4 <
ffff00013d9fb180 1221125998 C Ci:6:002:0 0 4 = 08faf00f
ffff00013d9fb180 1221126033 S Co:6:002:0 s 40 05 08ac 0000 0004 4 = 08faf00f
ffff00013d9fb180 1221126064 C Co:6:002:0 0 4 >
ffff00013d9fb180 1221126098 S Ci:6:002:0 s c0 05 08c4 0000 0004 4 <
ffff00013d9fb180 1221126135 C Ci:6:002:0 0 4 = 00000000
ffff00013d9fb180 1221126170 S Co:6:002:0 s 40 05 08c4 0000 0004 4 = 00000000
ffff00013d9fb180 1221126201 C Co:6:002:0 0 4 >
ffff00013d9fb180 1221126236 S Ci:6:002:0 s c0 05 0c00 0000 0004 4 <
ffff00013d9fb180 1221126272 C Ci:6:002:0 0 4 = 07000000
ffff00013d9fb180 1221126307 S Ci:6:002:0 s c0 05 08b0 0000 0004 4 <
ffff00013d9fb180 1221126343 C Ci:6:002:0 0 4 = 18060000
ffff00013d9fb180 1221126378 S Co:6:002:0 s 40 05 08b0 0000 0004 4 = 18060000
ffff00013d9fb180 1221126410 C Co:6:002:0 0 4 >
ffff00013d9fb180 1221126466 S Ci:6:002:0 s c0 05 0d04 0000 0004 4 <
ffff00013d9fb180 1221126513 C Ci:6:002:0 0 4 = 017d91b1
ffff00013d9fb180 1221126547 S Co:6:002:0 s 40 05 0c90 0000 0004 4 = 907d8101
ffff00013d9fb180 1221126578 C Co:6:002:0 0 4 >
ffff00013d9fb180 1221126625 S Ci:6:002:0 s c0 05 0e00 0000 0004 4 <
ffff00013d9fb180 1221126690 C Ci:6:002:0 0 4 = 07000000
ffff00013d9fb180 1221126725 S Ci:6:002:0 s c0 05 08b0 0000 0004 4 <
ffff00013d9fb180 1221126760 C Ci:6:002:0 0 4 = 18060000
ffff00013d9fb180 1221126794 S Co:6:002:0 s 40 05 08b0 0000 0004 4 = 18060000
ffff00013d9fb180 1221126824 C Co:6:002:0 0 4 >
ffff00013d9fb180 1221126879 S Ci:6:002:0 s c0 05 0d44 0000 0004 4 <
ffff00013d9fb180 1221126940 C Ci:6:002:0 0 4 = 017c90b1
ffff00013d9fb180 1221126974 S Co:6:002:0 s 40 05 0e90 0000 0004 4 = 017d8501
ffff00013d9fb180 1221127005 C Co:6:002:0 0 4 >
ffff00013d9fb180 1221127052 S Ci:6:002:0 s c0 05 08ac 0000 0004 4 <
ffff00013d9fb180 1221127099 C Ci:6:002:0 0 4 = 08faf00f
ffff00013d9fb180 1221127133 S Co:6:002:0 s 40 05 08ac 0000 0004 4 = 08faf00f
ffff00013d9fb180 1221127180 C Co:6:002:0 0 4 >
ffff00013d9fb180 1221127214 S Ci:6:002:0 s c0 05 08ac 0000 0004 4 <
ffff00013d9fb180 1221127250 C Ci:6:002:0 0 4 = 08faf00f
ffff00013d9fb180 1221127285 S Co:6:002:0 s 40 05 08ac 0000 0004 4 = 08faf00f
ffff00013d9fb180 1221127315 C Co:6:002:0 0 4 >
ffff00013d9fb180 1221127350 S Ci:6:002:0 s c0 05 08c4 0000 0004 4 <
ffff00013d9fb180 1221127387 C Ci:6:002:0 0 4 = 00000000
ffff00013d9fb180 1221127422 S Co:6:002:0 s 40 05 08c4 0000 0004 4 = 00000000
ffff00013d9fb180 1221127453 C Co:6:002:0 0 4 >
ffff00013d9fb180 1221127488 S Ci:6:002:0 s c0 05 0e00 0000 0004 4 <
ffff00013d9fb180 1221127524 C Ci:6:002:0 0 4 = 07000000
ffff00013d9fb180 1221127558 S Ci:6:002:0 s c0 05 08b0 0000 0004 4 <
ffff00013d9fb180 1221127595 C Ci:6:002:0 0 4 = 18060000
ffff00013d9fb180 1221127630 S Co:6:002:0 s 40 05 08b0 0000 0004 4 = 18060000
ffff00013d9fb180 1221127661 C Co:6:002:0 0 4 >
ffff00013d9fb180 1221127716 S Ci:6:002:0 s c0 05 0d44 0000 0004 4 <
ffff00013d9fb180 1221127763 C Ci:6:002:0 0 4 = 017d91b1
ffff00013d9fb180 1221127797 S Co:6:002:0 s 40 05 0e90 0000 0004 4 = 907d8101
ffff00013d9fb180 1221127828 C Co:6:002:0 0 4 >
ffff00013d9fb180 1221127875 S Ci:6:002:0 s c0 05 0668 0000 0002 2 <
ffff00013d9fb180 1221127938 C Ci:6:002:0 0 2 = 0010
ffff00013d9fb180 1221127973 S Co:6:002:0 s 40 05 0668 0000 0002 2 = 0010
ffff00013d9fb180 1221128015 C Co:6:002:0 0 2 >
ffff00013d9fb180 1221128050 S Co:6:002:0 s 40 05 0483 0000 0001 1 = 00
ffff00013d9fb180 1221128082 C Co:6:002:0 0 1 >
ffff00013d9fb180 1221128117 S Ci:6:002:0 s c0 05 0837 0000 0001 1 <
ffff00013d9fb180 1221128154 C Ci:6:002:0 0 1 = 00
ffff00013d9fb180 1221128189 S Ci:6:002:0 s c0 05 08ac 0000 0004 4 <
ffff00013d9fb180 1221128225 C Ci:6:002:0 0 4 = 08faf00f
ffff00013d9fb180 1221128260 S Co:6:002:0 s 40 05 08ac 0000 0004 4 = 08faf00f
ffff00013d9fb180 1221128309 C Co:6:002:0 0 4 >
ffff00013d9fb180 1221128343 S Ci:6:002:0 s c0 05 08c4 0000 0004 4 <
ffff00013d9fb180 1221128380 C Ci:6:002:0 0 4 = 00000000
ffff00013d9fb180 1221128414 S Co:6:002:0 s 40 05 08c4 0000 0004 4 = 00000000
ffff00013d9fb180 1221128445 C Co:6:002:0 0 4 >
ffff00013d9fb180 1221128479 S Ci:6:002:0 s c0 05 0848 0000 0004 4 <
ffff00013d9fb180 1221128515 C Ci:6:002:0 0 4 = 8bffd061
ffff00013d9fb180 1221128550 S Co:6:002:0 s 40 05 0848 0000 0004 4 = 8bffd061
ffff00013d9fb180 1221128581 C Co:6:002:0 0 4 >
ffff00013d9fb180 1221128616 S Ci:6:002:0 s c0 05 08ac 0000 0004 4 <
ffff00013d9fb180 1221128653 C Ci:6:002:0 0 4 = 08faf00f
ffff00013d9fb180 1221128687 S Co:6:002:0 s 40 05 08ac 0000 0004 4 = 08faf00f
ffff00013d9fb180 1221128717 C Co:6:002:0 0 4 >
ffff00013d9fb180 1221128751 S Ci:6:002:0 s c0 05 08ac 0000 0004 4 <
ffff00013d9fb180 1221128788 C Ci:6:002:0 0 4 = 08faf00f
ffff00013d9fb180 1221128822 S Co:6:002:0 s 40 05 08ac 0000 0004 4 = 08faf00f
ffff00013d9fb180 1221128854 C Co:6:002:0 0 4 >
ffff00013d9fb180 1221128888 S Ci:6:002:0 s c0 05 08c4 0000 0004 4 <
ffff00013d9fb180 1221128940 C Ci:6:002:0 0 4 = 00000000
ffff00013d9fb180 1221128976 S Co:6:002:0 s 40 05 08c4 0000 0004 4 = 00000000
ffff00013d9fb180 1221129007 C Co:6:002:0 0 4 >
ffff00013d9fb180 1221129041 S Ci:6:002:0 s c0 05 0c00 0000 0004 4 <
ffff00013d9fb180 1221129079 C Ci:6:002:0 0 4 = 07000000
ffff00013d9fb180 1221129113 S Ci:6:002:0 s c0 05 08b0 0000 0004 4 <
ffff00013d9fb180 1221129151 C Ci:6:002:0 0 4 = 18060000
ffff00013d9fb180 1221129185 S Co:6:002:0 s 40 05 08b0 0000 0004 4 = 18060000
ffff00013d9fb180 1221129216 C Co:6:002:0 0 4 >
ffff00013d9fb180 1221129271 S Ci:6:002:0 s c0 05 0d04 0000 0004 4 <
ffff00013d9fb180 1221129320 C Ci:6:002:0 0 4 = 907d95b1
ffff00013d9fb180 1221129354 S Co:6:002:0 s 40 05 0c90 0000 0004 4 = 907d8501
ffff00013d9fb180 1221129385 C Co:6:002:0 0 4 >
ffff00013d9fb180 1221129432 S Ci:6:002:0 s c0 05 0e00 0000 0004 4 <
ffff00013d9fb180 1221129480 C Ci:6:002:0 0 4 = 07000000
ffff00013d9fb180 1221129515 S Ci:6:002:0 s c0 05 08b0 0000 0004 4 <
ffff00013d9fb180 1221129566 C Ci:6:002:0 0 4 = 18060000
ffff00013d9fb180 1221129600 S Co:6:002:0 s 40 05 08b0 0000 0004 4 = 18060000
ffff00013d9fb180 1221129631 C Co:6:002:0 0 4 >
ffff00013d9fb180 1221129684 S Ci:6:002:0 s c0 05 0d44 0000 0004 4 <
ffff00013d9fb180 1221129732 C Ci:6:002:0 0 4 = 907d95b1
ffff00013d9fb180 1221129766 S Co:6:002:0 s 40 05 0e90 0000 0004 4 = 907d8501
ffff00013d9fb180 1221129812 C Co:6:002:0 0 4 >
ffff00013d9fb180 1221129861 S Ci:6:002:0 s c0 05 0073 0000 0001 1 <
ffff00013d9fb180 1221129909 C Ci:6:002:0 0 1 = 07
ffff00013d9fb180 1221129944 S Co:6:002:0 s 40 05 0073 0000 0001 1 = 07
ffff00013d9fb180 1221129975 C Co:6:002:0 0 1 >
ffff00013d9fb180 1221130037 S Ci:6:002:0 s c0 05 0c24 0000 0004 4 <
ffff00013d9fb180 1221130086 C Ci:6:002:0 0 4 = 20202020
ffff00013d9fb180 1221130120 S Co:6:002:0 s 40 05 0c24 0000 0004 4 = 2f2f2f2f
ffff00013d9fb180 1221130151 C Co:6:002:0 0 4 >
ffff00013d9fb180 1221130185 S Ci:6:002:0 s c0 05 0c28 0000 0004 4 <
ffff00013d9fb180 1221130222 C Ci:6:002:0 0 4 = 20201e1c
ffff00013d9fb180 1221130256 S Co:6:002:0 s 40 05 0c28 0000 0004 4 = 2f2f2d2b
ffff00013d9fb180 1221130286 C Co:6:002:0 0 4 >
ffff00013d9fb180 1221130321 S Ci:6:002:0 s c0 05 0c2c 0000 0004 4 <
ffff00013d9fb180 1221130358 C Ci:6:002:0 0 4 = 20202020
ffff00013d9fb180 1221130392 S Co:6:002:0 s 40 05 0c2c 0000 0004 4 = 34343434
ffff00013d9fb180 1221130437 C Co:6:002:0 0 4 >
ffff00013d9fb180 1221130472 S Ci:6:002:0 s c0 05 0c30 0000 0004 4 <
ffff00013d9fb180 1221130509 C Ci:6:002:0 0 4 = 20201e1c
ffff00013d9fb180 1221130544 S Co:6:002:0 s 40 05 0c30 0000 0004 4 = 32302e2c
ffff00013d9fb180 1221130576 C Co:6:002:0 0 4 >
ffff00013d9fb180 1221130610 S Ci:6:002:0 s c0 05 0c34 0000 0004 4 <
ffff00013d9fb180 1221130649 C Ci:6:002:0 0 4 = 20202020
ffff00013d9fb180 1221130684 S Co:6:002:0 s 40 05 0c34 0000 0004 4 = 32323232
ffff00013d9fb180 1221130717 C Co:6:002:0 0 4 >
ffff00013d9fb180 1221130752 S Ci:6:002:0 s c0 05 0c38 0000 0004 4 <
ffff00013d9fb180 1221130789 C Ci:6:002:0 0 4 = 201e1c1a
ffff00013d9fb180 1221130824 S Co:6:002:0 s 40 05 0c38 0000 0004 4 = 302e2c2a
ffff00013d9fb180 1221130855 C Co:6:002:0 0 4 >
ffff00013d9fb180 1221130889 S Ci:6:002:0 s c0 05 0c3c 0000 0004 4 <
ffff00013d9fb180 1221130941 C Ci:6:002:0 0 4 = 20202020
ffff00013d9fb180 1221130976 S Co:6:002:0 s 40 05 0c3c 0000 0004 4 = 34343434
ffff00013d9fb180 1221131008 C Co:6:002:0 0 4 >
ffff00013d9fb180 1221131043 S Ci:6:002:0 s c0 05 0c40 0000 0004 4 <
ffff00013d9fb180 1221131081 C Ci:6:002:0 0 4 = 20201e1c
ffff00013d9fb180 1221131115 S Co:6:002:0 s 40 05 0c40 0000 0004 4 = 32302e2c
ffff00013d9fb180 1221131146 C Co:6:002:0 0 4 >
ffff00013d9fb180 1221131181 S Ci:6:002:0 s c0 05 0c44 0000 0004 4 <
ffff00013d9fb180 1221131219 C Ci:6:002:0 0 4 = 1a181e1e
ffff00013d9fb180 1221131253 S Co:6:002:0 s 40 05 0c44 0000 0004 4 = 2a2a3232
ffff00013d9fb180 1221131285 C Co:6:002:0 0 4 >
ffff00013d9fb180 1221131319 S Ci:6:002:0 s c0 05 0c48 0000 0004 4 <
ffff00013d9fb180 1221131356 C Ci:6:002:0 0 4 = 1e1e1e1e
ffff00013d9fb180 1221131391 S Co:6:002:0 s 40 05 0c48 0000 0004 4 = 3232302e
ffff00013d9fb180 1221131437 C Co:6:002:0 0 4 >
ffff00013d9fb180 1221131472 S Ci:6:002:0 s c0 05 0c4c 0000 0004 4 <
ffff00013d9fb180 1221131510 C Ci:6:002:0 0 4 = 1c1a1816
ffff00013d9fb180 1221131545 S Co:6:002:0 s 40 05 0c4c 0000 0004 4 = 2c2a2828
ffff00013d9fb180 1221131576 C Co:6:002:0 0 4 >
ffff00013d9fb180 1221131610 S Ci:6:002:0 s c0 05 0c54 0000 0004 4 <
ffff00013d9fb180 1221131649 C Ci:6:002:0 0 4 = 120a0400
ffff00013d9fb180 1221131683 S Co:6:002:0 s 40 05 0c54 0000 0004 4 = 221a1400
ffff00013d9fb180 1221131716 C Co:6:002:0 0 4 >
ffff00013d9fb180 1221131750 S Ci:6:002:0 s c0 05 0e24 0000 0004 4 <
ffff00013d9fb180 1221131789 C Ci:6:002:0 0 4 = 1d1d1d1d
ffff00013d9fb180 1221131823 S Co:6:002:0 s 40 05 0e24 0000 0004 4 = 1b1b1b1b
ffff00013d9fb180 1221131854 C Co:6:002:0 0 4 >
ffff00013d9fb180 1221131888 S Ci:6:002:0 s c0 05 0e28 0000 0004 4 <
ffff00013d9fb180 1221131941 C Ci:6:002:0 0 4 = 1d1d1b19
ffff00013d9fb180 1221131976 S Co:6:002:0 s 40 05 0e28 0000 0004 4 = 1b1b1917
ffff00013d9fb180 1221132019 C Co:6:002:0 0 4 >
ffff00013d9fb180 1221132105 S Ci:6:002:0 s c0 05 0e2c 0000 0004 4 <
ffff00013d9fb180 1221132145 C Ci:6:002:0 0 4 = 1f1f1f1f
ffff00013d9fb180 1221132181 S Co:6:002:0 s 40 05 0e2c 0000 0004 4 = 20202020
ffff00013d9fb180 1221132212 C Co:6:002:0 0 4 >
ffff00013d9fb180 1221132247 S Ci:6:002:0 s c0 05 0e30 0000 0004 4 <
ffff00013d9fb180 1221132285 C Ci:6:002:0 0 4 = 1f1f1d1b
ffff00013d9fb180 1221132320 S Co:6:002:0 s 40 05 0e30 0000 0004 4 = 1e1c1a18
ffff00013d9fb180 1221132351 C Co:6:002:0 0 4 >
ffff00013d9fb180 1221132386 S Ci:6:002:0 s c0 05 0e34 0000 0004 4 <
ffff00013d9fb180 1221132441 C Ci:6:002:0 0 4 = 1f1f1f1f
ffff00013d9fb180 1221132476 S Co:6:002:0 s 40 05 0e34 0000 0004 4 = 1e1e1e1e
ffff00013d9fb180 1221132507 C Co:6:002:0 0 4 >
ffff00013d9fb180 1221132542 S Ci:6:002:0 s c0 05 0e38 0000 0004 4 <
ffff00013d9fb180 1221132581 C Ci:6:002:0 0 4 = 1f1d1b19
ffff00013d9fb180 1221132616 S Co:6:002:0 s 40 05 0e38 0000 0004 4 = 1c1a1816
ffff00013d9fb180 1221132647 C Co:6:002:0 0 4 >
ffff00013d9fb180 1221132682 S Ci:6:002:0 s c0 05 0e3c 0000 0004 4 <
ffff00013d9fb180 1221132721 C Ci:6:002:0 0 4 = 1f1f1f1f
ffff00013d9fb180 1221132756 S Co:6:002:0 s 40 05 0e3c 0000 0004 4 = 20202020
ffff00013d9fb180 1221132805 C Co:6:002:0 0 4 >
ffff00013d9fb180 1221132839 S Ci:6:002:0 s c0 05 0e40 0000 0004 4 <
ffff00013d9fb180 1221132877 C Ci:6:002:0 0 4 = 1f1f1d1b
ffff00013d9fb180 1221132911 S Co:6:002:0 s 40 05 0e40 0000 0004 4 = 1e1c1a18
ffff00013d9fb180 1221132942 C Co:6:002:0 0 4 >
ffff00013d9fb180 1221132976 S Ci:6:002:0 s c0 05 0e44 0000 0004 4 <
ffff00013d9fb180 1221133015 C Ci:6:002:0 0 4 = 19171d1d
ffff00013d9fb180 1221133050 S Co:6:002:0 s 40 05 0e44 0000 0004 4 = 16161e1e
ffff00013d9fb180 1221133082 C Co:6:002:0 0 4 >
ffff00013d9fb180 1221133116 S Ci:6:002:0 s c0 05 0e48 0000 0004 4 <
ffff00013d9fb180 1221133155 C Ci:6:002:0 0 4 = 1d1d1d1d
ffff00013d9fb180 1221133189 S Co:6:002:0 s 40 05 0e48 0000 0004 4 = 1e1e1c1a
ffff00013d9fb180 1221133221 C Co:6:002:0 0 4 >
ffff00013d9fb180 1221133256 S Ci:6:002:0 s c0 05 0e4c 0000 0004 4 <
ffff00013d9fb180 1221133309 C Ci:6:002:0 0 4 = 1b191715
ffff00013d9fb180 1221133344 S Co:6:002:0 s 40 05 0e4c 0000 0004 4 = 18161414
ffff00013d9fb180 1221133375 C Co:6:002:0 0 4 >
ffff00013d9fb180 1221133409 S Ci:6:002:0 s c0 05 0e54 0000 0004 4 <
ffff00013d9fb180 1221133448 C Ci:6:002:0 0 4 = 11090300
ffff00013d9fb180 1221133482 S Co:6:002:0 s 40 05 0e54 0000 0004 4 = 0e060200
ffff00013d9fb180 1221133514 C Co:6:002:0 0 4 >
ffff00013d9fb000 1221756218 S Ci:6:002:0 s c0 05 004c 0000 0001 1 <
ffff00013d9fb000 1221756377 C Ci:6:002:0 0 1 = 20
ffff00013d9fb000 1221756543 S Co:6:002:0 s 40 05 004c 0000 0001 1 = 20
ffff00013d9fb000 1221756680 C Co:6:002:0 0 1 >
ffff00013d9fb000 1222748223 S Ci:6:002:0 s c0 05 004c 0000 0001 1 <
ffff00013d9fb000 1222748374 C Ci:6:002:0 0 1 = 20
ffff00013d9fb000 1222748539 S Co:6:002:0 s 40 05 004c 0000 0001 1 = 20
ffff00013d9fb000 1222748676 C Co:6:002:0 0 1 >
ffff00013d9fb000 1222748850 S Ci:6:002:0 s c0 05 0770 0000 0004 4 <
ffff00013d9fb000 1222748982 C Ci:6:002:0 0 4 = 00000000
ffff00013d9fb000 1222749139 S Ci:6:002:0 s c0 05 0774 0000 0004 4 <
ffff00013d9fb000 1222749286 C Ci:6:002:0 0 4 = 00000000
ffff00013d9fb000 1222749447 S Co:6:002:0 s 40 05 076e 0000 0001 1 = 0c
ffff00013d9fb000 1222749585 C Co:6:002:0 0 1 >
ffff00013d9fb000 1222749748 S Ci:6:002:0 s c0 05 0808 0000 0004 4 <
ffff00013d9fb000 1222749896 C Ci:6:002:0 0 4 = 3382023e
ffff00013d9fb000 1222750056 S Ci:6:002:0 s c0 05 0a5c 0000 0002 2 <
ffff00013d9fb000 1222750177 C Ci:6:002:0 0 2 = 0900
ffff00013d9fb000 1222750205 S Ci:6:002:0 s c0 05 0f48 0000 0002 2 <
ffff00013d9fb000 1222750324 C Ci:6:002:0 0 2 = 6f00
ffff00013d9fb000 1222750353 S Ci:6:002:0 s c0 05 0f04 0000 0004 4 <
ffff00013d9fb000 1222750464 C Ci:6:002:0 0 4 = 01000400
ffff00013d9fb000 1222750494 S Ci:6:002:0 s c0 05 0f14 0000 0004 4 <
ffff00013d9fb000 1222750618 C Ci:6:002:0 0 4 = 20000100
ffff00013d9fb000 1222750648 S Ci:6:002:0 s c0 05 0f10 0000 0004 4 <
ffff00013d9fb000 1222750759 C Ci:6:002:0 0 4 = 00000000
ffff00013d9fb000 1222750789 S Ci:6:002:0 s c0 05 0f0c 0000 0004 4 <
ffff00013d9fb000 1222750900 C Ci:6:002:0 0 4 = 00000000
ffff00013d9fb000 1222750930 S Ci:6:002:0 s c0 05 0f08 0000 0004 4 <
ffff00013d9fb000 1222751047 C Ci:6:002:0 0 4 = 15009000
ffff00013d9fb000 1222751068 S Ci:6:002:0 s c0 05 0fcc 0000 0004 4 <
ffff00013d9fb000 1222751180 C Ci:6:002:0 0 4 = 00000000
ffff00013d9fb000 1222751209 S Ci:6:002:0 s c0 05 09a4 0000 0004 4 <
ffff00013d9fb000 1222751327 C Ci:6:002:0 0 4 = 80000800
ffff00013d9fb000 1222751349 S Co:6:002:0 s 40 05 09a4 0000 0004 4 = 80000a00
ffff00013d9fb000 1222751455 C Co:6:002:0 0 4 >
ffff00013d9fb000 1222751485 S Ci:6:002:0 s c0 05 09a4 0000 0004 4 <
ffff00013d9fb000 1222751596 C Ci:6:002:0 0 4 = 80000a00
ffff00013d9fb000 1222751626 S Co:6:002:0 s 40 05 09a4 0000 0004 4 = 80000800
ffff00013d9fb000 1222751739 C Co:6:002:0 0 4 >
ffff00013d9fb000 1222751768 S Ci:6:002:0 s c0 05 0a2c 0000 0004 4 <
ffff00013d9fb000 1222751880 C Ci:6:002:0 0 4 = 00809000
ffff00013d9fb000 1222751910 S Co:6:002:0 s 40 05 0a2c 0000 0004 4 = 00009000
ffff00013d9fb000 1222752017 C Co:6:002:0 0 4 >
ffff00013d9fb000 1222752047 S Ci:6:002:0 s c0 05 0a2c 0000 0004 4 <
ffff00013d9fb000 1222752165 C Ci:6:002:0 0 4 = 00009000
ffff00013d9fb000 1222752186 S Co:6:002:0 s 40 05 0a2c 0000 0004 4 = 00809000
ffff00013d9fb000 1222752293 C Co:6:002:0 0 4 >
ffff00013d9fb000 1222752321 S Ci:6:002:0 s c0 05 0b58 0000 0004 4 <
ffff00013d9fb000 1222752440 C Ci:6:002:0 0 4 = 00000000
ffff00013d9fb000 1222752461 S Co:6:002:0 s 40 05 0b58 0000 0004 4 = 01000000
ffff00013d9fb000 1222752571 C Co:6:002:0 0 4 >
ffff00013d9fb000 1222752600 S Ci:6:002:0 s c0 05 0b58 0000 0004 4 <
ffff00013d9fb000 1222752718 C Ci:6:002:0 0 4 = 01000000
ffff00013d9fb000 1222752739 S Co:6:002:0 s 40 05 0b58 0000 0004 4 = 00000000
ffff00013d9fb000 1222752846 C Co:6:002:0 0 4 >
ffff00013d9fb000 1222752876 S Ci:6:002:0 s c0 05 01cc 0000 0001 1 <
ffff00013d9fb000 1222752994 C Ci:6:002:0 0 1 = 00
ffff00013d9fb000 1222753014 S Co:6:002:0 s 40 05 01f4 0000 0004 4 = 00000000
ffff00013d9fb000 1222753194 C Co:6:002:0 0 4 >
ffff00013d9fb000 1222753217 S Co:6:002:0 s 40 05 01d4 0000 0004 4 = 58000000
ffff00013d9fb000 1222753263 C Co:6:002:0 0 4 >
ffff00013d9fb000 1222753280 S Co:6:002:0 s 40 05 0440 0000 0004 4 = 00000000
ffff00013d9fb000 1222753386 C Co:6:002:0 0 4 >
ffff00013d9fb000 1222753416 S Ci:6:002:0 s c0 05 0c00 0000 0004 4 <
ffff00013d9fb000 1222753532 C Ci:6:002:0 0 4 = 07000000
ffff00013d9fb000 1222753553 S Ci:6:002:0 s c0 05 08b0 0000 0004 4 <
ffff00013d9fb000 1222753666 C Ci:6:002:0 0 4 = 18060000
ffff00013d9fb000 1222753695 S Co:6:002:0 s 40 05 08b0 0000 0004 4 = 42060000
ffff00013d9fb000 1222753803 C Co:6:002:0 0 4 >
ffff00013d9fb000 1222753844 S Ci:6:002:0 s c0 05 0d04 0000 0004 4 <
ffff00013d9fb000 1222753952 C Ci:6:002:0 0 4 = 088990b1
ffff00013d9fb000 1222753980 S Co:6:002:0 s 40 05 0c90 0000 0004 4 = 08892304
ffff00013d9fb000 1222754093 C Co:6:002:0 0 4 >
ffff00013d9fb000 1222754127 S Co:6:002:0 s 40 05 0280 0000 0002 2 = 0001
ffff00013d9fb000 1222754239 C Co:6:002:0 0 2 >
ffff00013d9fb000 1222754268 S Ci:6:002:0 s c0 05 010c 0000 0001 1 <
ffff00013d9fb000 1222754385 C Ci:6:002:0 0 1 = b4
ffff00013d9fb000 1222754406 S Co:6:002:0 s 40 05 010c 0000 0001 1 = b4
ffff00013d9fb000 1222754512 C Co:6:002:0 0 1 >
ffff00013d9fb000 1223772174 S Ci:6:002:0 s c0 05 004c 0000 0001 1 <
ffff00013d9fb000 1223772230 C Ci:6:002:0 0 1 = 20
ffff00013d9fb000 1223772368 S Co:6:002:0 s 40 05 004c 0000 0001 1 = 20
ffff00013d9fb000 1223772486 C Co:6:002:0 0 1 >
