ffff00014c2bf900 1163747200 C Bi:6:002:1 0 471 = 9f010484 00000f80 7d056000 04300000 00000000 86e71700 40420080 87dcdc01
ffff00014c2bf900 1163747251 S Bi:6:002:1 -115 32768 <
ffff00013d62e840 1163748081 C Bi:6:002:1 0 446 = 86010484 00000f80 820b6000 04300000 00000000 15eb1700 46400080 86dbdb01
ffff00013d62e840 1163748107 S Bi:6:002:1 -115 32768 <
ffff000103533900 1163748988 C Bi:6:002:1 0 469 = 9d010484 00000f80 27046000 04300000 00000000 82ee1700 44420080 87dbdb01
ffff000103533900 1163749014 S Bi:6:002:1 -115 32768 <
ffff000103558cc0 1163749891 C Bi:6:002:1 0 479 = a7010484 00000f80 62026000 04300000 00000000 fbf11700 44400080 85dcdc01
ffff000103558cc0 1163749915 S Bi:6:002:1 -115 32768 <
ffff000103533780 1163772234 S Ci:6:002:0 s c0 05 004c 0000 0001 1 <
ffff000103533780 1163772392 C Ci:6:002:0 0 1 = 20
ffff000103533780 1163772546 S Co:6:002:0 s 40 05 004c 0000 0001 1 = 20
ffff000103533780 1163772686 C Co:6:002:0 0 1 >
ffff00014c2bf900 1163849605 C Bi:6:002:1 0 471 = 9f010484 00000f80 7e056000 04300000 00000000 90771900 46400080 8adbdb01
ffff00014c2bf900 1163849658 S Bi:6:002:1 -115 32768 <
ffff00013d62e840 1163850483 C Bi:6:002:1 0 446 = 86010484 00000f80 830b6000 04300000 00000000 197b1900 44400080 84e0e001
ffff00013d62e840 1163850508 S Bi:6:002:1 -115 32768 <
ffff000103533900 1163851380 C Bi:6:002:1 0 469 = 9d010484 00000f80 28046000 04300000 00000000 7b7e1900 46400080 86dbdb01
ffff000103533900 1163851403 S Bi:6:002:1 -115 32768 <
ffff000103558cc0 1163852322 C Bi:6:002:1 0 479 = a7010484 00000f80 63026000 04300000 00000000 11821900 46400080 84dcdc01
ffff000103558cc0 1163852346 S Bi:6:002:1 -115 32768 <
ffff00014c2bf900 1163950974 C Bi:6:002:1 0 478 = a6010484 00000f80 ee076000 04300000 00000000 83031b00 46400080 8cdcdc01
ffff00014c2bf900 1163951020 S Bi:6:002:1 -115 32768 <
ffff00013d62e840 1163952043 C Bi:6:002:1 0 471 = 9f010484 00000f80 7f056000 04300000 00000000 a8071b00 46400080 86dbdb01
ffff00013d62e840 1163952069 S Bi:6:002:1 -115 32768 <
ffff000103533900 1163952941 C Bi:6:002:1 0 446 = 86010484 00000f80 840b6000 04300000 00000000 550b1b00 46420080 8cdbdb01
ffff000103533900 1163952966 S Bi:6:002:1 -115 32768 <
ffff000103558cc0 1163953844 C Bi:6:002:1 0 469 = 9d010484 00000f80 29046000 04300000 00000000 bb0e1b00 46400080 88dada01
ffff000103558cc0 1163953868 S Bi:6:002:1 -115 32768 <
ffff00014c2bf900 1164053404 C Bi:6:002:1 0 478 = a6010484 00000f80 ef076000 04300000 00000000 85931c00 46400080 89dbdb01
ffff00014c2bf900 1164053447 S Bi:6:002:1 -115 32768 <
ffff00013d62e840 1164057092 C Bi:6:002:1 0 479 = a7010484 00000f80 65026000 04300000 00000000 fca11c00 46400080 86e7e701
ffff00013d62e840 1164057118 S Bi:6:002:1 -115 32768 <
ffff000103533900 1164157728 C Bi:6:002:1 0 446 = 86010484 00000f80 860b6000 04300000 00000000 302b1e00 46400080 81dada01
ffff000103533900 1164157774 S Bi:6:002:1 -115 32768 <
ffff000103558cc0 1164158629 C Bi:6:002:1 0 469 = 9d010484 00000f80 2b046000 04300000 00000000 ad2e1e00 46400080 87dbdb01
ffff000103558cc0 1164158654 S Bi:6:002:1 -115 32768 <
ffff00014c2bf900 1164159545 C Bi:6:002:1 0 479 = a7010484 00000f80 66026000 04300000 00000000 39321e00 46400080 86dcdc01
ffff00014c2bf900 1164159567 S Bi:6:002:1 -115 32768 <
ffff00013d62e840 1164258216 C Bi:6:002:1 0 478 = a6010484 00000f80 f1076000 04300000 00000000 89b31f00 46400080 88dcdc01
ffff00013d62e840 1164258269 S Bi:6:002:1 -115 32768 <
ffff000103533900 1164259220 C Bi:6:002:1 0 471 = 9f010484 00000f80 82056000 04300000 00000000 9bb71f00 46400080 86dbdb01
ffff000103533900 1164259246 S Bi:6:002:1 -115 32768 <
ffff000103558cc0 1164360573 C Bi:6:002:1 0 478 = a6010484 00000f80 f2076000 04300000 00000000 8a432100 46400080 87dcdc01
ffff000103558cc0 1164360614 S Bi:6:002:1 -115 32768 <
ffff00014c2bf900 1164363406 C Bi:6:002:1 0 469 = 9d010484 00000f80 2d046000 04300000 00000000 904e2100 46400080 88dbdb01
ffff00014c2bf900 1164363433 S Bi:6:002:1 -115 32768 <
ffff00013d62e840 1164364327 C Bi:6:002:1 0 479 = a7010484 00000f80 68026000 04300000 00000000 15522100 44400080 83dfdf01
ffff00013d62e840 1164364361 S Bi:6:002:1 -115 32768 <
ffff000103533900 1164464092 C Bi:6:002:1 0 471 = 9f010484 00000f80 84056000 04300000 00000000 bad72200 44400080 83dcdc01
ffff000103533900 1164464118 S Bi:6:002:1 -115 32768 <
ffff000103558cc0 1164465818 C Bi:6:002:1 0 469 = 9d010484 00000f80 2e046000 04300000 00000000 b8de2200 46420080 88dcdc01
ffff000103558cc0 1164465840 S Bi:6:002:1 -115 32768 <
ffff00014c2bf900 1164466733 C Bi:6:002:1 0 479 = a7010484 00000f80 69026000 04300000 00000000 2ce22200 46400080 83dcdc01
ffff00014c2bf900 1164466757 S Bi:6:002:1 -115 32768 <
ffff000102d1c840 1164654012 S Ci:6:002:0 s c0 05 0454 0000 0001 1 <
ffff000102d1c840 1164654201 C Ci:6:002:0 0 1 = 00
ffff000102d1c840 1164654245 S Ci:6:002:0 s c0 05 0860 0000 0004 4 <
ffff000102d1c840 1164654361 C Ci:6:002:0 0 4 = 21c32969
ffff000102d1c840 1164654512 S Co:6:002:0 s 40 05 0860 0000 0004 4 = 21c3d572
ffff000102d1c840 1164654561 C Co:6:002:0 0 4 >
ffff000102d1c840 1164654608 S Ci:6:002:0 s c0 05 0c00 0000 0004 4 <
ffff000102d1c840 1164654737 C Ci:6:002:0 0 4 = 07000000
ffff000102d1c840 1164654781 S Ci:6:002:0 s c0 05 08b0 0000 0004 4 <
ffff000102d1c840 1164654907 C Ci:6:002:0 0 4 = 00060000
ffff000102d1c840 1164654952 S Co:6:002:0 s 40 05 08b0 0000 0004 4 = 18060000
ffff000102d1c840 1164655059 C Co:6:002:0 0 4 >
ffff000102d1c840 1164655127 S Ci:6:002:0 s c0 05 0d04 0000 0004 4 <
ffff000102d1c840 1164655249 C Ci:6:002:0 0 4 = 2a7191b1
ffff000102d1c840 1164655295 S Co:6:002:0 s 40 05 0c90 0000 0004 4 = 2a708001
ffff000102d1c840 1164655402 C Co:6:002:0 0 4 >
ffff000102d1c840 1164655459 S Ci:6:002:0 s c0 05 08ac 0000 0004 4 <
ffff000102d1c840 1164655580 C Ci:6:002:0 0 4 = 0afaf00f
ffff000102d1c840 1164655624 S Co:6:002:0 s 40 05 08ac 0000 0004 4 = 0afaf00f
ffff000102d1c840 1164655731 C Co:6:002:0 0 4 >
ffff000102d1c840 1164655777 S Ci:6:002:0 s c0 05 08ac 0000 0004 4 <
ffff000102d1c840 1164655907 C Ci:6:002:0 0 4 = 0afaf00f
ffff000102d1c840 1164655952 S Co:6:002:0 s 40 05 08ac 0000 0004 4 = 0afaf00f
ffff000102d1c840 1164656060 C Co:6:002:0 0 4 >
ffff000102d1c840 1164656106 S Ci:6:002:0 s c0 05 08c4 0000 0004 4 <
ffff000102d1c840 1164656224 C Ci:6:002:0 0 4 = 00000000
ffff000102d1c840 1164656270 S Co:6:002:0 s 40 05 08c4 0000 0004 4 = 00000000
ffff000102d1c840 1164656375 C Co:6:002:0 0 4 >
ffff000102d1c840 1164656422 S Ci:6:002:0 s c0 05 0c00 0000 0004 4 <
ffff000102d1c840 1164656543 C Ci:6:002:0 0 4 = 07000000
ffff000102d1c840 1164656588 S Ci:6:002:0 s c0 05 08b0 0000 0004 4 <
ffff000102d1c840 1164656697 C Ci:6:002:0 0 4 = 18060000
ffff000102d1c840 1164656761 S Co:6:002:0 s 40 05 08b0 0000 0004 4 = 18060000
ffff000102d1c840 1164656869 C Co:6:002:0 0 4 >
ffff000102d1c840 1164656937 S Ci:6:002:0 s c0 05 0d04 0000 0004 4 <
ffff000102d1c840 1164657054 C Ci:6:002:0 0 4 = 2a7090b1
ffff000102d1c840 1164657099 S Co:6:002:0 s 40 05 0c90 0000 0004 4 = 01708001
ffff000102d1c840 1164657205 C Co:6:002:0 0 4 >
ffff000102d1c840 1164657262 S Ci:6:002:0 s c0 05 0e00 0000 0004 4 <
ffff000102d1c840 1164657397 C Ci:6:002:0 0 4 = 07000000
ffff000102d1c840 1164657442 S Ci:6:002:0 s c0 05 08b0 0000 0004 4 <
ffff000102d1c840 1164657551 C Ci:6:002:0 0 4 = 18060000
ffff000102d1c840 1164657597 S Co:6:002:0 s 40 05 08b0 0000 0004 4 = 18060000
ffff000102d1c840 1164657710 C Co:6:002:0 0 4 >
ffff000102d1c840 1164657776 S Ci:6:002:0 s c0 05 0d44 0000 0004 4 <
ffff000102d1c840 1164657905 C Ci:6:002:0 0 4 = 2a7191b1
ffff000102d1c840 1164657950 S Co:6:002:0 s 40 05 0e90 0000 0004 4 = 2a708001
ffff000102d1c840 1164658057 C Co:6:002:0 0 4 >
ffff000102d1c840 1164658116 S Ci:6:002:0 s c0 05 08ac 0000 0004 4 <
ffff000102d1c840 1164658235 C Ci:6:002:0 0 4 = 0afaf00f
ffff000102d1c840 1164658279 S Co:6:002:0 s 40 05 08ac 0000 0004 4 = 0afaf00f
ffff000102d1c840 1164658398 C Co:6:002:0 0 4 >
ffff000102d1c840 1164658444 S Ci:6:002:0 s c0 05 08ac 0000 0004 4 <
ffff000102d1c840 1164658562 C Ci:6:002:0 0 4 = 0afaf00f
ffff000102d1c840 1164658607 S Co:6:002:0 s 40 05 08ac 0000 0004 4 = 0afaf00f
ffff000102d1c840 1164658713 C Co:6:002:0 0 4 >
ffff000102d1c840 1164658758 S Ci:6:002:0 s c0 05 08c4 0000 0004 4 <
ffff000102d1c840 1164658876 C Ci:6:002:0 0 4 = 00000000
ffff000102d1c840 1164658931 S Co:6:002:0 s 40 05 08c4 0000 0004 4 = 00000000
ffff000102d1c840 1164659033 C Co:6:002:0 0 4 >
ffff000102d1c840 1164659079 S Ci:6:002:0 s c0 05 0e00 0000 0004 4 <
ffff000102d1c840 1164659199 C Ci:6:002:0 0 4 = 07000000
ffff000102d1c840 1164659243 S Ci:6:002:0 s c0 05 08b0 0000 0004 4 <
ffff000102d1c840 1164659353 C Ci:6:002:0 0 4 = 18060000
ffff000102d1c840 1164659399 S Co:6:002:0 s 40 05 08b0 0000 0004 4 = 18060000
ffff000102d1c840 1164659527 C Co:6:002:0 0 4 >
ffff000102d1c840 1164659592 S Ci:6:002:0 s c0 05 0d44 0000 0004 4 <
ffff000102d1c840 1164659710 C Ci:6:002:0 0 4 = 2a7090b1
ffff000102d1c840 1164659754 S Co:6:002:0 s 40 05 0e90 0000 0004 4 = 01708001
ffff000102d1c840 1164659863 C Co:6:002:0 0 4 >
ffff000102d1c840 1164659922 S Ci:6:002:0 s c0 05 0668 0000 0002 2 <
ffff000102d1c840 1164660041 C Ci:6:002:0 0 2 = 0010
ffff000102d1c840 1164660088 S Co:6:002:0 s 40 05 0668 0000 0002 2 = 0010
ffff000102d1c840 1164660198 C Co:6:002:0 0 2 >
ffff000102d1c840 1164660244 S Co:6:002:0 s 40 05 0483 0000 0001 1 = 00
ffff000102d1c840 1164660358 C Co:6:002:0 0 1 >
ffff000102d1c840 1164660403 S Ci:6:002:0 s c0 05 0837 0000 0001 1 <
ffff000102d1c840 1164660526 C Ci:6:002:0 0 1 = 00
ffff000102d1c840 1164660570 S Ci:6:002:0 s c0 05 08ac 0000 0004 4 <
ffff000102d1c840 1164660681 C Ci:6:002:0 0 4 = 0afaf00f
ffff000102d1c840 1164660728 S Co:6:002:0 s 40 05 08ac 0000 0004 4 = 08faf00f
ffff000102d1c840 1164660843 C Co:6:002:0 0 4 >
ffff000102d1c840 1164660887 S Ci:6:002:0 s c0 05 08c4 0000 0004 4 <
ffff000102d1c840 1164660997 C Ci:6:002:0 0 4 = 00000000
ffff000102d1c840 1164661043 S Co:6:002:0 s 40 05 08c4 0000 0004 4 = 00000000
ffff000102d1c840 1164661158 C Co:6:002:0 0 4 >
ffff000102d1c840 1164661203 S Ci:6:002:0 s c0 05 0848 0000 0004 4 <
ffff000102d1c840 1164661313 C Ci:6:002:0 0 4 = 8bff1062
ffff000102d1c840 1164661357 S Co:6:002:0 s 40 05 0848 0000 0004 4 = 8bffd061
ffff000102d1c840 1164661464 C Co:6:002:0 0 4 >
ffff000102d1c840 1164661511 S Ci:6:002:0 s c0 05 08ac 0000 0004 4 <
ffff000102d1c840 1164661648 C Ci:6:002:0 0 4 = 08faf00f
ffff000102d1c840 1164661693 S Co:6:002:0 s 40 05 08ac 0000 0004 4 = 08faf00f
ffff000102d1c840 1164661800 C Co:6:002:0 0 4 >
ffff000102d1c840 1164661845 S Ci:6:002:0 s c0 05 08ac 0000 0004 4 <
ffff000102d1c840 1164661964 C Ci:6:002:0 0 4 = 08faf00f
ffff000102d1c840 1164662009 S Co:6:002:0 s 40 05 08ac 0000 0004 4 = 08faf00f
ffff000102d1c840 1164662115 C Co:6:002:0 0 4 >
ffff000102d1c840 1164662161 S Ci:6:002:0 s c0 05 08c4 0000 0004 4 <
ffff000102d1c840 1164662280 C Ci:6:002:0 0 4 = 00000000
ffff000102d1c840 1164662325 S Co:6:002:0 s 40 05 08c4 0000 0004 4 = 00000000
ffff000102d1c840 1164662432 C Co:6:002:0 0 4 >
ffff000102d1c840 1164662478 S Ci:6:002:0 s c0 05 0c00 0000 0004 4 <
ffff000102d1c840 1164662596 C Ci:6:002:0 0 4 = 07000000
ffff000102d1c840 1164662641 S Ci:6:002:0 s c0 05 08b0 0000 0004 4 <
ffff000102d1c840 1164662751 C Ci:6:002:0 0 4 = 18060000
ffff000102d1c840 1164662797 S Co:6:002:0 s 40 05 08b0 0000 0004 4 = 18060000
ffff000102d1c840 1164662911 C Co:6:002:0 0 4 >
ffff000102d1c840 1164662975 S Ci:6:002:0 s c0 05 0d04 0000 0004 4 <
ffff000102d1c840 1164663094 C Ci:6:002:0 0 4 = 017090b1
ffff000102d1c840 1164663139 S Co:6:002:0 s 40 05 0c90 0000 0004 4 = 017c8001
ffff000102d1c840 1164663246 C Co:6:002:0 0 4 >
ffff000102d1c840 1164663305 S Ci:6:002:0 s c0 05 0e00 0000 0004 4 <
ffff000102d1c840 1164663425 C Ci:6:002:0 0 4 = 07000000
ffff000102d1c840 1164663470 S Ci:6:002:0 s c0 05 08b0 0000 0004 4 <
ffff000102d1c840 1164663580 C Ci:6:002:0 0 4 = 18060000
ffff000102d1c840 1164663624 S Co:6:002:0 s 40 05 08b0 0000 0004 4 = 18060000
ffff000102d1c840 1164663731 C Co:6:002:0 0 4 >
ffff000102d1c840 1164663798 S Ci:6:002:0 s c0 05 0d44 0000 0004 4 <
ffff000102d1c840 1164663917 C Ci:6:002:0 0 4 = 017090b1
ffff000102d1c840 1164663962 S Co:6:002:0 s 40 05 0e90 0000 0004 4 = 017c8001
ffff000102d1c840 1164664069 C Co:6:002:0 0 4 >
ffff000102d1c840 1164664131 S Ci:6:002:0 s c0 05 0073 0000 0001 1 <
ffff000102d1c840 1164664252 C Ci:6:002:0 0 1 = 07
ffff000102d1c840 1164664300 S Co:6:002:0 s 40 05 0073 0000 0001 1 = 07
ffff000102d1c840 1164664406 C Co:6:002:0 0 1 >
ffff000102d1c840 1164664474 S Ci:6:002:0 s c0 05 0c20 0000 0004 4 <
ffff000102d1c840 1164664595 C Ci:6:002:0 0 4 = 12121212
ffff000102d1c840 1164664641 S Co:6:002:0 s 40 05 0c20 0000 0004 4 = 13131313
ffff000102d1c840 1164664747 C Co:6:002:0 0 4 >
ffff000102d1c840 1164664793 S Ci:6:002:0 s c0 05 0c24 0000 0004 4 <
ffff000102d1c840 1164664915 C Ci:6:002:0 0 4 = 12121212
ffff000102d1c840 1164664960 S Co:6:002:0 s 40 05 0c24 0000 0004 4 = 20202020
ffff000102d1c840 1164665067 C Co:6:002:0 0 4 >
ffff000102d1c840 1164665113 S Ci:6:002:0 s c0 05 0c28 0000 0004 4 <
ffff000102d1c840 1164665232 C Ci:6:002:0 0 4 = 12121212
ffff000102d1c840 1164665277 S Co:6:002:0 s 40 05 0c28 0000 0004 4 = 20201e1c
ffff000102d1c840 1164665394 C Co:6:002:0 0 4 >
ffff000102d1c840 1164665440 S Ci:6:002:0 s c0 05 0c2c 0000 0004 4 <
ffff000102d1c840 1164665559 C Ci:6:002:0 0 4 = 12121212
ffff000102d1c840 1164665605 S Co:6:002:0 s 40 05 0c2c 0000 0004 4 = 20202020
ffff000102d1c840 1164665712 C Co:6:002:0 0 4 >
ffff000102d1c840 1164665758 S Ci:6:002:0 s c0 05 0c30 0000 0004 4 <
ffff000102d1c840 1164665878 C Ci:6:002:0 0 4 = 12121212
ffff000102d1c840 1164665924 S Co:6:002:0 s 40 05 0c30 0000 0004 4 = 20201e1c
ffff000102d1c840 1164666031 C Co:6:002:0 0 4 >
ffff000102d1c840 1164666077 S Ci:6:002:0 s c0 05 0c34 0000 0004 4 <
ffff000102d1c840 1164666198 C Ci:6:002:0 0 4 = 12121212
ffff000102d1c840 1164666244 S Co:6:002:0 s 40 05 0c34 0000 0004 4 = 20202020
ffff000102d1c840 1164666350 C Co:6:002:0 0 4 >
ffff000102d1c840 1164666396 S Ci:6:002:0 s c0 05 0c38 0000 0004 4 <
ffff000102d1c840 1164666531 C Ci:6:002:0 0 4 = 12121212
ffff000102d1c840 1164666577 S Co:6:002:0 s 40 05 0c38 0000 0004 4 = 201e1c1a
ffff000102d1c840 1164666683 C Co:6:002:0 0 4 >
ffff000102d1c840 1164666729 S Ci:6:002:0 s c0 05 0c3c 0000 0004 4 <
ffff000102d1c840 1164666848 C Ci:6:002:0 0 4 = 12121212
ffff000102d1c840 1164666894 S Co:6:002:0 s 40 05 0c3c 0000 0004 4 = 20202020
ffff000102d1c840 1164667000 C Co:6:002:0 0 4 >
ffff000102d1c840 1164667047 S Ci:6:002:0 s c0 05 0c40 0000 0004 4 <
ffff000102d1c840 1164667166 C Ci:6:002:0 0 4 = 12121212
ffff000102d1c840 1164667212 S Co:6:002:0 s 40 05 0c40 0000 0004 4 = 20201e1c
ffff000102d1c840 1164667318 C Co:6:002:0 0 4 >
ffff000102d1c840 1164667365 S Ci:6:002:0 s c0 05 0c44 0000 0004 4 <
ffff000102d1c840 1164667485 C Ci:6:002:0 0 4 = 12121212
ffff000102d1c840 1164667531 S Co:6:002:0 s 40 05 0c44 0000 0004 4 = 1a181e1e
ffff000102d1c840 1164667649 C Co:6:002:0 0 4 >
ffff000102d1c840 1164667695 S Ci:6:002:0 s c0 05 0c48 0000 0004 4 <
ffff000102d1c840 1164667815 C Ci:6:002:0 0 4 = 12121212
ffff000102d1c840 1164667861 S Co:6:002:0 s 40 05 0c48 0000 0004 4 = 1e1e1e1e
ffff000102d1c840 1164667967 C Co:6:002:0 0 4 >
ffff000102d1c840 1164668030 S Ci:6:002:0 s c0 05 0c4c 0000 0004 4 <
ffff000102d1c840 1164668098 C Ci:6:002:0 0 4 = 12121212
ffff000102d1c840 1164668137 S Co:6:002:0 s 40 05 0c4c 0000 0004 4 = 1c1a1816
ffff000102d1c840 1164668244 C Co:6:002:0 0 4 >
ffff000102d1c840 1164668295 S Ci:6:002:0 s c0 05 0c54 0000 0004 4 <
ffff000102d1c840 1164668414 C Ci:6:002:0 0 4 = 1c120800
ffff000102d1c840 1164668460 S Co:6:002:0 s 40 05 0c54 0000 0004 4 = 120a0400
ffff000102d1c840 1164668567 C Co:6:002:0 0 4 >
ffff000102d1c840 1164668613 S Ci:6:002:0 s c0 05 0e20 0000 0004 4 <
ffff000102d1c840 1164668724 C Ci:6:002:0 0 4 = 12121212
ffff000102d1c840 1164668771 S Co:6:002:0 s 40 05 0e20 0000 0004 4 = 14141414
ffff000102d1c840 1164668877 C Co:6:002:0 0 4 >
ffff000102d1c840 1164668924 S Ci:6:002:0 s c0 05 0e24 0000 0004 4 <
ffff000102d1c840 1164669045 C Ci:6:002:0 0 4 = 12121212
ffff000102d1c840 1164669093 S Co:6:002:0 s 40 05 0e24 0000 0004 4 = 1d1d1d1d
ffff000102d1c840 1164669200 C Co:6:002:0 0 4 >
ffff000102d1c840 1164669246 S Ci:6:002:0 s c0 05 0e28 0000 0004 4 <
ffff000102d1c840 1164669366 C Ci:6:002:0 0 4 = 12121212
ffff000102d1c840 1164669412 S Co:6:002:0 s 40 05 0e28 0000 0004 4 = 1d1d1b19
ffff000102d1c840 1164669528 C Co:6:002:0 0 4 >
ffff000102d1c840 1164669574 S Ci:6:002:0 s c0 05 0e2c 0000 0004 4 <
ffff000102d1c840 1164669704 C Ci:6:002:0 0 4 = 12121212
ffff000102d1c840 1164669750 S Co:6:002:0 s 40 05 0e2c 0000 0004 4 = 1f1f1f1f
ffff000102d1c840 1164669858 C Co:6:002:0 0 4 >
ffff000102d1c840 1164669904 S Ci:6:002:0 s c0 05 0e30 0000 0004 4 <
ffff000102d1c840 1164670031 C Ci:6:002:0 0 4 = 12121212
ffff000102d1c840 1164670076 S Co:6:002:0 s 40 05 0e30 0000 0004 4 = 1f1f1d1b
ffff000102d1c840 1164670182 C Co:6:002:0 0 4 >
ffff000102d1c840 1164670229 S Ci:6:002:0 s c0 05 0e34 0000 0004 4 <
ffff000102d1c840 1164670350 C Ci:6:002:0 0 4 = 12121212
ffff000102d1c840 1164670396 S Co:6:002:0 s 40 05 0e34 0000 0004 4 = 1f1f1f1f
ffff000102d1c840 1164670502 C Co:6:002:0 0 4 >
ffff000102d1c840 1164670549 S Ci:6:002:0 s c0 05 0e38 0000 0004 4 <
ffff000102d1c840 1164670670 C Ci:6:002:0 0 4 = 12121212
ffff000102d1c840 1164670715 S Co:6:002:0 s 40 05 0e38 0000 0004 4 = 1f1d1b19
ffff000102d1c840 1164670822 C Co:6:002:0 0 4 >
ffff000102d1c840 1164670868 S Ci:6:002:0 s c0 05 0e3c 0000 0004 4 <
ffff000102d1c840 1164670989 C Ci:6:002:0 0 4 = 12121212
ffff000102d1c840 1164671035 S Co:6:002:0 s 40 05 0e3c 0000 0004 4 = 1f1f1f1f
ffff000102d1c840 1164671151 C Co:6:002:0 0 4 >
ffff000102d1c840 1164671197 S Ci:6:002:0 s c0 05 0e40 0000 0004 4 <
ffff000102d1c840 1164671319 C Ci:6:002:0 0 4 = 12121212
ffff000102d1c840 1164671364 S Co:6:002:0 s 40 05 0e40 0000 0004 4 = 1f1f1d1b
ffff000102d1c840 1164671471 C Co:6:002:0 0 4 >
ffff000102d1c840 1164671517 S Ci:6:002:0 s c0 05 0e44 0000 0004 4 <
ffff000102d1c840 1164671655 C Ci:6:002:0 0 4 = 12121212
ffff000102d1c840 1164671700 S Co:6:002:0 s 40 05 0e44 0000 0004 4 = 19171d1d
ffff000102d1c840 1164671807 C Co:6:002:0 0 4 >
ffff000102d1c840 1164671853 S Ci:6:002:0 s c0 05 0e48 0000 0004 4 <
ffff000102d1c840 1164671974 C Ci:6:002:0 0 4 = 12121212
ffff000102d1c840 1164672035 S Co:6:002:0 s 40 05 0e48 0000 0004 4 = 1d1d1d1d
ffff000102d1c840 1164672155 C Co:6:002:0 0 4 >
ffff000102d1c840 1164672205 S Ci:6:002:0 s c0 05 0e4c 0000 0004 4 <
ffff000102d1c840 1164672325 C Ci:6:002:0 0 4 = 12121212
ffff000102d1c840 1164672390 S Co:6:002:0 s 40 05 0e4c 0000 0004 4 = 1b191715
ffff000102d1c840 1164672505 C Co:6:002:0 0 4 >
ffff000102d1c840 1164672551 S Ci:6:002:0 s c0 05 0e54 0000 0004 4 <
ffff000102d1c840 1164672673 C Ci:6:002:0 0 4 = 1c120800
ffff000102d1c840 1164672718 S Co:6:002:0 s 40 05 0e54 0000 0004 4 = 11090300
ffff000102d1c840 1164672825 C Co:6:002:0 0 4 >
ffff000102d1c840 1164672887 S Ci:6:002:0 s c0 05 0454 0000 0001 1 <
ffff000102d1c840 1164673031 C Ci:6:002:0 0 1 = 00
ffff000102d1c840 1164673077 S Ci:6:002:0 s c0 05 0454 0000 0001 1 <
ffff000102d1c840 1164673189 C Ci:6:002:0 0 1 = 00
ffff000102d1c840 1164673234 S Co:6:002:0 s 40 05 0454 0000 0001 1 = 80
ffff000102d1c840 1164673341 C Co:6:002:0 0 1 >
ffff000102d1c840 1164673388 S Ci:6:002:0 s c0 05 041a 0000 0002 2 <
ffff000102d1c840 1164673528 C Ci:6:002:0 0 2 = ff0f
ffff000102d1c840 1164673572 S Ci:6:002:0 s c0 05 0808 0000 0004 4 <
ffff000102d1c840 1164673685 C Ci:6:002:0 0 4 = 3382023e
ffff000102d1c840 1164673729 S Co:6:002:0 s 40 05 0808 0000 0004 4 = 3382023e
ffff000102d1c840 1164673836 C Co:6:002:0 0 4 >
ffff000102d1c840 1164673883 S Ci:6:002:0 s c0 05 0834 0000 0004 4 <
ffff000102d1c840 1164674003 C Ci:6:002:0 0 4 = 05a73700
ffff000102d1c840 1164674048 S Co:6:002:0 s 40 05 0834 0000 0004 4 = 06a73700
ffff000102d1c840 1164674155 C Co:6:002:0 0 4 >
ffff000102d1c840 1164674201 S Ci:6:002:0 s c0 05 0830 0000 0004 4 <
ffff000102d1c840 1164674321 C Ci:6:002:0 0 4 = b8eeaa2e
ffff000102d1c840 1164674366 S Co:6:002:0 s 40 05 0830 0000 0004 4 = b8aeaa2e
ffff000102d1c840 1164674473 C Co:6:002:0 0 4 >
ffff000102d1c840 1164674520 S Ci:6:002:0 s c0 05 0830 0000 0004 4 <
ffff000102d1c840 1164674657 C Ci:6:002:0 0 4 = b8aeaa2e
ffff000102d1c840 1164674702 S Co:6:002:0 s 40 05 0830 0000 0004 4 = b8aeaa2e
ffff000102d1c840 1164674809 C Co:6:002:0 0 4 >
ffff000102d1c840 1164674855 S Ci:6:002:0 s c0 05 082c 0000 0004 4 <
ffff000102d1c840 1164674976 C Ci:6:002:0 0 4 = dc832000
ffff000102d1c840 1164675021 S Co:6:002:0 s 40 05 082c 0000 0004 4 = dd832000
ffff000102d1c840 1164675128 C Co:6:002:0 0 4 >
ffff000102d1c840 1164675175 S Co:6:002:0 s 40 05 0cb0 0000 0004 4 = 17773354
ffff000102d1c840 1164675290 C Co:6:002:0 0 4 >
ffff000102d1c840 1164675335 S Co:6:002:0 s 40 05 0eb0 0000 0004 4 = 17773354
ffff000102d1c840 1164675441 C Co:6:002:0 0 4 >
ffff000102d1c840 1164675487 S Ci:6:002:0 s c0 05 0cb4 0000 0004 4 <
ffff000102d1c840 1164675609 C Ci:6:002:0 0 4 = 77000001
ffff000102d1c840 1164675654 S Co:6:002:0 s 40 05 0cb4 0000 0004 4 = 77000001
ffff000102d1c840 1164675772 C Co:6:002:0 0 4 >
ffff000102d1c840 1164675818 S Ci:6:002:0 s c0 05 0eb4 0000 0004 4 <
ffff000102d1c840 1164675940 C Ci:6:002:0 0 4 = 77000001
ffff000102d1c840 1164675985 S Co:6:002:0 s 40 05 0eb4 0000 0004 4 = 77000001
ffff000102d1c840 1164676096 C Co:6:002:0 0 4 >
ffff000102d1c840 1164676144 S Ci:6:002:0 s c0 05 0900 0000 0004 4 <
ffff000102d1c840 1164676281 C Ci:6:002:0 0 4 = 01040000
ffff000102d1c840 1164676335 S Co:6:002:0 s 40 05 0900 0000 0004 4 = 01040000
ffff000102d1c840 1164676449 C Co:6:002:0 0 4 >
ffff000102d1c840 1164676496 S Ci:6:002:0 s c0 05 080c 0000 0004 4 <
ffff000102d1c840 1164676617 C Ci:6:002:0 0 4 = 13111312
ffff000102d1c840 1164676662 S Co:6:002:0 s 40 05 080c 0000 0004 4 = 03111312
ffff000102d1c840 1164676776 C Co:6:002:0 0 4 >
ffff000102d1c840 1164676822 S Ci:6:002:0 s c0 05 0a04 0000 0004 4 <
ffff000102d1c840 1164676940 C Ci:6:002:0 0 4 = 0c00ff01
ffff000102d1c840 1164676986 S Co:6:002:0 s 40 05 0a04 0000 0004 4 = 0c00ff0f
ffff000102d1c840 1164677093 C Co:6:002:0 0 4 >
ffff000102d1c840 1164677139 S Ci:6:002:0 s c0 05 0440 0000 0004 4 <
ffff000102d1c840 1164677272 C Ci:6:002:0 0 4 = 5f010000
ffff000102d1c840 1164677316 S Co:6:002:0 s 40 05 0440 0000 0004 4 = 50010000
ffff000102d1c840 1164677423 C Co:6:002:0 0 4 >
ffff000102d1c840 1164677470 S Ci:6:002:0 s c0 05 0c1c 0000 0004 4 <
ffff000102d1c840 1164677588 C Ci:6:002:0 0 4 = 03000040
ffff000102d1c840 1164677632 S Co:6:002:0 s 40 05 0c1c 0000 0004 4 = 0300402d
ffff000102d1c840 1164677740 C Co:6:002:0 0 4 >
ffff000102d1c840 1164677786 S Ci:6:002:0 s c0 05 0e1c 0000 0004 4 <
ffff000102d1c840 1164677904 C Ci:6:002:0 0 4 = 03000040
ffff000102d1c840 1164677949 S Co:6:002:0 s 40 05 0e1c 0000 0004 4 = 0300402d
ffff000102d1c840 1164678056 C Co:6:002:0 0 4 >
ffff000102d1c840 1164678103 S Ci:6:002:0 s c0 05 0860 0000 0004 4 <
ffff000102d1c840 1164678221 C Ci:6:002:0 0 4 = 21c3d572
ffff000102d1c840 1164678266 S Co:6:002:0 s 40 05 0860 0000 0004 4 = 21c3a768
ffff000102d1c840 1164678373 C Co:6:002:0 0 4 >
ffff000102d1c840 1164678419 S Ci:6:002:0 s c0 05 0c00 0000 0004 4 <
ffff000102d1c840 1164678537 C Ci:6:002:0 0 4 = 07000000
ffff000102d1c840 1164678582 S Ci:6:002:0 s c0 05 08b0 0000 0004 4 <
ffff000102d1c840 1164678692 C Ci:6:002:0 0 4 = 18060000
ffff000102d1c840 1164678739 S Co:6:002:0 s 40 05 08b0 0000 0004 4 = 18060000
ffff000102d1c840 1164678853 C Co:6:002:0 0 4 >
ffff000102d1c840 1164678918 S Ci:6:002:0 s c0 05 0d04 0000 0004 4 <
ffff000102d1c840 1164679035 C Ci:6:002:0 0 4 = 017c90b1
ffff000102d1c840 1164679080 S Co:6:002:0 s 40 05 0c90 0000 0004 4 = 017d8101
ffff000102d1c840 1164679187 C Co:6:002:0 0 4 >
ffff000102d1c840 1164679246 S Ci:6:002:0 s c0 05 08ac 0000 0004 4 <
ffff000102d1c840 1164679366 C Ci:6:002:0 0 4 = 08faf00f
ffff000102d1c840 1164679411 S Co:6:002:0 s 40 05 08ac 0000 0004 4 = 08faf00f
ffff000102d1c840 1164679526 C Co:6:002:0 0 4 >
ffff000102d1c840 1164679572 S Ci:6:002:0 s c0 05 08ac 0000 0004 4 <
ffff000102d1c840 1164679690 C Ci:6:002:0 0 4 = 08faf00f
ffff000102d1c840 1164679736 S Co:6:002:0 s 40 05 08ac 0000 0004 4 = 08faf00f
ffff000102d1c840 1164679842 C Co:6:002:0 0 4 >
ffff000102d1c840 1164679888 S Ci:6:002:0 s c0 05 08c4 0000 0004 4 <
ffff000102d1c840 1164680028 C Ci:6:002:0 0 4 = 00000000
ffff000102d1c840 1164680074 S Co:6:002:0 s 40 05 08c4 0000 0004 4 = 00000000
ffff000102d1c840 1164680196 C Co:6:002:0 0 4 >
ffff000102d1c840 1164680245 S Ci:6:002:0 s c0 05 0c00 0000 0004 4 <
ffff000102d1c840 1164680366 C Ci:6:002:0 0 4 = 07000000
ffff000102d1c840 1164680411 S Ci:6:002:0 s c0 05 08b0 0000 0004 4 <
ffff000102d1c840 1164680530 C Ci:6:002:0 0 4 = 18060000
ffff000102d1c840 1164680576 S Co:6:002:0 s 40 05 08b0 0000 0004 4 = 18060000
ffff000102d1c840 1164680691 C Co:6:002:0 0 4 >
ffff000102d1c840 1164680756 S Ci:6:002:0 s c0 05 0d04 0000 0004 4 <
ffff000102d1c840 1164680875 C Ci:6:002:0 0 4 = 017d91b1
ffff000102d1c840 1164680920 S Co:6:002:0 s 40 05 0c90 0000 0004 4 = 347d8101
ffff000102d1c840 1164681026 C Co:6:002:0 0 4 >
ffff000102d1c840 1164681085 S Ci:6:002:0 s c0 05 0e00 0000 0004 4 <
ffff000102d1c840 1164681204 C Ci:6:002:0 0 4 = 07000000
ffff000102d1c840 1164681249 S Ci:6:002:0 s c0 05 08b0 0000 0004 4 <
ffff000102d1c840 1164681359 C Ci:6:002:0 0 4 = 18060000
ffff000102d1c840 1164681404 S Co:6:002:0 s 40 05 08b0 0000 0004 4 = 18060000
ffff000102d1c840 1164681523 C Co:6:002:0 0 4 >
ffff000102d1c840 1164681589 S Ci:6:002:0 s c0 05 0d44 0000 0004 4 <
ffff000102d1c840 1164681708 C Ci:6:002:0 0 4 = 017c90b1
ffff000102d1c840 1164681752 S Co:6:002:0 s 40 05 0e90 0000 0004 4 = 017d8101
ffff000102d1c840 1164681860 C Co:6:002:0 0 4 >
ffff000102d1c840 1164681919 S Ci:6:002:0 s c0 05 08ac 0000 0004 4 <
ffff000102d1c840 1164682038 C Ci:6:002:0 0 4 = 08faf00f
ffff000102d1c840 1164682084 S Co:6:002:0 s 40 05 08ac 0000 0004 4 = 08faf00f
ffff000102d1c840 1164682191 C Co:6:002:0 0 4 >
ffff000102d1c840 1164682236 S Ci:6:002:0 s c0 05 08ac 0000 0004 4 <
ffff000102d1c840 1164682355 C Ci:6:002:0 0 4 = 08faf00f
ffff000102d1c840 1164682401 S Co:6:002:0 s 40 05 08ac 0000 0004 4 = 08faf00f
ffff000102d1c840 1164682519 C Co:6:002:0 0 4 >
ffff000102d1c840 1164682565 S Ci:6:002:0 s c0 05 08c4 0000 0004 4 <
ffff000102d1c840 1164682684 C Ci:6:002:0 0 4 = 00000000
ffff000102d1c840 1164682730 S Co:6:002:0 s 40 05 08c4 0000 0004 4 = 00000000
ffff000102d1c840 1164682837 C Co:6:002:0 0 4 >
ffff000102d1c840 1164682883 S Ci:6:002:0 s c0 05 0e00 0000 0004 4 <
ffff000102d1c840 1164683001 C Ci:6:002:0 0 4 = 07000000
ffff000102d1c840 1164683046 S Ci:6:002:0 s c0 05 08b0 0000 0004 4 <
ffff000102d1c840 1164683157 C Ci:6:002:0 0 4 = 18060000
ffff000102d1c840 1164683203 S Co:6:002:0 s 40 05 08b0 0000 0004 4 = 18060000
ffff000102d1c840 1164683316 C Co:6:002:0 0 4 >
ffff000102d1c840 1164683381 S Ci:6:002:0 s c0 05 0d44 0000 0004 4 <
ffff000102d1c840 1164683500 C Ci:6:002:0 0 4 = 017d91b1
ffff000102d1c840 1164683544 S Co:6:002:0 s 40 05 0e90 0000 0004 4 = 347d8101
ffff000102d1c840 1164683651 C Co:6:002:0 0 4 >
ffff000102d1c840 1164683710 S Ci:6:002:0 s c0 05 0668 0000 0002 2 <
ffff000102d1c840 1164683829 C Ci:6:002:0 0 2 = 0010
ffff000102d1c840 1164683875 S Co:6:002:0 s 40 05 0668 0000 0002 2 = 0010
ffff000102d1c840 1164683982 C Co:6:002:0 0 2 >
ffff000102d1c840 1164684027 S Co:6:002:0 s 40 05 0483 0000 0001 1 = 00
ffff000102d1c840 1164684157 C Co:6:002:0 0 1 >
ffff000102d1c840 1164684207 S Ci:6:002:0 s c0 05 0837 0000 0001 1 <
ffff000102d1c840 1164684328 C Ci:6:002:0 0 1 = 00
ffff000102d1c840 1164684374 S Ci:6:002:0 s c0 05 08ac 0000 0004 4 <
ffff000102d1c840 1164684487 C Ci:6:002:0 0 4 = 08faf00f
ffff000102d1c840 1164684532 S Co:6:002:0 s 40 05 08ac 0000 0004 4 = 08faf00f
ffff000102d1c840 1164684651 C Co:6:002:0 0 4 >
ffff000102d1c840 1164684698 S Ci:6:002:0 s c0 05 08c4 0000 0004 4 <
ffff000102d1c840 1164684818 C Ci:6:002:0 0 4 = 00000000
ffff000102d1c840 1164684862 S Co:6:002:0 s 40 05 08c4 0000 0004 4 = 00000000
ffff000102d1c840 1164684970 C Co:6:002:0 0 4 >
ffff000102d1c840 1164685016 S Ci:6:002:0 s c0 05 0848 0000 0004 4 <
ffff000102d1c840 1164685153 C Ci:6:002:0 0 4 = 8bffd061
ffff000102d1c840 1164685198 S Co:6:002:0 s 40 05 0848 0000 0004 4 = 8bffd061
ffff000102d1c840 1164685305 C Co:6:002:0 0 4 >
ffff000102d1c840 1164685351 S Ci:6:002:0 s c0 05 08ac 0000 0004 4 <
ffff000102d1c840 1164685471 C Ci:6:002:0 0 4 = 08faf00f
ffff000102d1c840 1164685516 S Co:6:002:0 s 40 05 08ac 0000 0004 4 = 08faf00f
ffff000102d1c840 1164685623 C Co:6:002:0 0 4 >
ffff000102d1c840 1164685669 S Ci:6:002:0 s c0 05 08ac 0000 0004 4 <
ffff000102d1c840 1164685788 C Ci:6:002:0 0 4 = 08faf00f
ffff000102d1c840 1164685833 S Co:6:002:0 s 40 05 08ac 0000 0004 4 = 08faf00f
ffff000102d1c840 1164685940 C Co:6:002:0 0 4 >
ffff000102d1c840 1164685986 S Ci:6:002:0 s c0 05 08c4 0000 0004 4 <
ffff000102d1c840 1164686107 C Ci:6:002:0 0 4 = 00000000
ffff000102d1c840 1164686152 S Co:6:002:0 s 40 05 08c4 0000 0004 4 = 00000000
ffff000102d1c840 1164686272 C Co:6:002:0 0 4 >
ffff000102d1c840 1164686320 S Ci:6:002:0 s c0 05 0c00 0000 0004 4 <
ffff000102d1c840 1164686440 C Ci:6:002:0 0 4 = 07000000
ffff000102d1c840 1164686484 S Ci:6:002:0 s c0 05 08b0 0000 0004 4 <
ffff000102d1c840 1164686596 C Ci:6:002:0 0 4 = 18060000
ffff000102d1c840 1164686641 S Co:6:002:0 s 40 05 08b0 0000 0004 4 = 18060000
ffff000102d1c840 1164686748 C Co:6:002:0 0 4 >
ffff000102d1c840 1164686815 S Ci:6:002:0 s c0 05 0d04 0000 0004 4 <
ffff000102d1c840 1164686935 C Ci:6:002:0 0 4 = 347d91b1
ffff000102d1c840 1164686980 S Co:6:002:0 s 40 05 0c90 0000 0004 4 = 347d8101
ffff000102d1c840 1164687087 C Co:6:002:0 0 4 >
ffff000102d1c840 1164687147 S Ci:6:002:0 s c0 05 0e00 0000 0004 4 <
ffff000102d1c840 1164687281 C Ci:6:002:0 0 4 = 07000000
ffff000102d1c840 1164687326 S Ci:6:002:0 s c0 05 08b0 0000 0004 4 <
ffff000102d1c840 1164687437 C Ci:6:002:0 0 4 = 18060000
ffff000102d1c840 1164687482 S Co:6:002:0 s 40 05 08b0 0000 0004 4 = 18060000
ffff000102d1c840 1164687589 C Co:6:002:0 0 4 >
ffff000102d1c840 1164687656 S Ci:6:002:0 s c0 05 0d44 0000 0004 4 <
ffff000102d1c840 1164687781 C Ci:6:002:0 0 4 = 347d91b1
ffff000102d1c840 1164687826 S Co:6:002:0 s 40 05 0e90 0000 0004 4 = 347d8101
ffff000102d1c840 1164687933 C Co:6:002:0 0 4 >
ffff000102d1c840 1164687995 S Ci:6:002:0 s c0 05 0073 0000 0001 1 <
ffff000102d1c840 1164688126 C Ci:6:002:0 0 1 = 07
ffff000102d1c840 1164688171 S Co:6:002:0 s 40 05 0073 0000 0001 1 = 07
ffff000102d1c840 1164688207 C Co:6:002:0 0 1 >
ffff000102d1c840 1164688265 S Ci:6:002:0 s c0 05 0c24 0000 0004 4 <
ffff000102d1c840 1164688333 C Ci:6:002:0 0 4 = 20202020
ffff000102d1c840 1164688369 S Co:6:002:0 s 40 05 0c24 0000 0004 4 = 24242424
ffff000102d1c840 1164688400 C Co:6:002:0 0 4 >
ffff000102d1c840 1164688434 S Ci:6:002:0 s c0 05 0c28 0000 0004 4 <
ffff000102d1c840 1164688471 C Ci:6:002:0 0 4 = 20201e1c
ffff000102d1c840 1164688506 S Co:6:002:0 s 40 05 0c28 0000 0004 4 = 24242220
ffff000102d1c840 1164688537 C Co:6:002:0 0 4 >
ffff000102d1c840 1164688572 S Ci:6:002:0 s c0 05 0c2c 0000 0004 4 <
ffff000102d1c840 1164688610 C Ci:6:002:0 0 4 = 20202020
ffff000102d1c840 1164688645 S Co:6:002:0 s 40 05 0c2c 0000 0004 4 = 29292929
ffff000102d1c840 1164688678 C Co:6:002:0 0 4 >
ffff000102d1c840 1164688712 S Ci:6:002:0 s c0 05 0c30 0000 0004 4 <
ffff000102d1c840 1164688751 C Ci:6:002:0 0 4 = 20201e1c
ffff000102d1c840 1164688785 S Co:6:002:0 s 40 05 0c30 0000 0004 4 = 27252321
ffff000102d1c840 1164688831 C Co:6:002:0 0 4 >
ffff000102d1c840 1164688865 S Ci:6:002:0 s c0 05 0c34 0000 0004 4 <
ffff000102d1c840 1164688903 C Ci:6:002:0 0 4 = 20202020
ffff000102d1c840 1164688938 S Co:6:002:0 s 40 05 0c34 0000 0004 4 = 25252525
ffff000102d1c840 1164688970 C Co:6:002:0 0 4 >
ffff000102d1c840 1164689004 S Ci:6:002:0 s c0 05 0c38 0000 0004 4 <
ffff000102d1c840 1164689042 C Ci:6:002:0 0 4 = 201e1c1a
ffff000102d1c840 1164689077 S Co:6:002:0 s 40 05 0c38 0000 0004 4 = 2523211f
ffff000102d1c840 1164689120 C Co:6:002:0 0 4 >
ffff000102d1c840 1164689155 S Ci:6:002:0 s c0 05 0c3c 0000 0004 4 <
ffff000102d1c840 1164689281 C Ci:6:002:0 0 4 = 20202020
ffff000102d1c840 1164689327 S Co:6:002:0 s 40 05 0c3c 0000 0004 4 = 29292929
ffff000102d1c840 1164689433 C Co:6:002:0 0 4 >
ffff000102d1c840 1164689481 S Ci:6:002:0 s c0 05 0c40 0000 0004 4 <
ffff000102d1c840 1164689602 C Ci:6:002:0 0 4 = 20201e1c
ffff000102d1c840 1164689648 S Co:6:002:0 s 40 05 0c40 0000 0004 4 = 27252321
ffff000102d1c840 1164689755 C Co:6:002:0 0 4 >
ffff000102d1c840 1164689801 S Ci:6:002:0 s c0 05 0c44 0000 0004 4 <
ffff000102d1c840 1164689921 C Ci:6:002:0 0 4 = 1a181e1e
ffff000102d1c840 1164689967 S Co:6:002:0 s 40 05 0c44 0000 0004 4 = 1f1f2525
ffff000102d1c840 1164690073 C Co:6:002:0 0 4 >
ffff000102d1c840 1164690120 S Ci:6:002:0 s c0 05 0c48 0000 0004 4 <
ffff000102d1c840 1164690241 C Ci:6:002:0 0 4 = 1e1e1e1e
ffff000102d1c840 1164690289 S Co:6:002:0 s 40 05 0c48 0000 0004 4 = 25252523
ffff000102d1c840 1164690401 C Co:6:002:0 0 4 >
ffff000102d1c840 1164690447 S Ci:6:002:0 s c0 05 0c4c 0000 0004 4 <
ffff000102d1c840 1164690568 C Ci:6:002:0 0 4 = 1c1a1816
ffff000102d1c840 1164690614 S Co:6:002:0 s 40 05 0c4c 0000 0004 4 = 211f1d1d
ffff000102d1c840 1164690721 C Co:6:002:0 0 4 >
ffff000102d1c840 1164690767 S Ci:6:002:0 s c0 05 0c54 0000 0004 4 <
ffff000102d1c840 1164690905 C Ci:6:002:0 0 4 = 120a0400
ffff000102d1c840 1164690950 S Co:6:002:0 s 40 05 0c54 0000 0004 4 = 170f0900
ffff000102d1c840 1164691057 C Co:6:002:0 0 4 >
ffff000102d1c840 1164691102 S Ci:6:002:0 s c0 05 0e24 0000 0004 4 <
ffff000102d1c840 1164691223 C Ci:6:002:0 0 4 = 1d1d1d1d
ffff000102d1c840 1164691268 S Co:6:002:0 s 40 05 0e24 0000 0004 4 = 23232323
ffff000102d1c840 1164691375 C Co:6:002:0 0 4 >
ffff000102d1c840 1164691421 S Ci:6:002:0 s c0 05 0e28 0000 0004 4 <
ffff000102d1c840 1164691541 C Ci:6:002:0 0 4 = 1d1d1b19
ffff000102d1c840 1164691586 S Co:6:002:0 s 40 05 0e28 0000 0004 4 = 2323211f
ffff000102d1c840 1164691694 C Co:6:002:0 0 4 >
ffff000102d1c840 1164691740 S Ci:6:002:0 s c0 05 0e2c 0000 0004 4 <
ffff000102d1c840 1164691860 C Ci:6:002:0 0 4 = 1f1f1f1f
ffff000102d1c840 1164691905 S Co:6:002:0 s 40 05 0e2c 0000 0004 4 = 28282828
ffff000102d1c840 1164692025 C Co:6:002:0 0 4 >
ffff000102d1c840 1164692072 S Ci:6:002:0 s c0 05 0e30 0000 0004 4 <
ffff000102d1c840 1164692204 C Ci:6:002:0 0 4 = 1f1f1d1b
ffff000102d1c840 1164692252 S Co:6:002:0 s 40 05 0e30 0000 0004 4 = 26242220
ffff000102d1c840 1164692367 C Co:6:002:0 0 4 >
ffff000102d1c840 1164692413 S Ci:6:002:0 s c0 05 0e34 0000 0004 4 <
ffff000102d1c840 1164692534 C Ci:6:002:0 0 4 = 1f1f1f1f
ffff000102d1c840 1164692579 S Co:6:002:0 s 40 05 0e34 0000 0004 4 = 24242424
ffff000102d1c840 1164692687 C Co:6:002:0 0 4 >
ffff000102d1c840 1164692733 S Ci:6:002:0 s c0 05 0e38 0000 0004 4 <
ffff000102d1c840 1164692854 C Ci:6:002:0 0 4 = 1f1d1b19
ffff000102d1c840 1164692899 S Co:6:002:0 s 40 05 0e38 0000 0004 4 = 2422201e
ffff000102d1c840 1164693019 C Co:6:002:0 0 4 >
ffff000102d1c840 1164693066 S Ci:6:002:0 s c0 05 0e3c 0000 0004 4 <
ffff000102d1c840 1164693187 C Ci:6:002:0 0 4 = 1f1f1f1f
ffff000102d1c840 1164693232 S Co:6:002:0 s 40 05 0e3c 0000 0004 4 = 28282828
ffff000102d1c840 1164693339 C Co:6:002:0 0 4 >
ffff000102d1c840 1164693385 S Ci:6:002:0 s c0 05 0e40 0000 0004 4 <
ffff000102d1c840 1164693524 C Ci:6:002:0 0 4 = 1f1f1d1b
ffff000102d1c840 1164693569 S Co:6:002:0 s 40 05 0e40 0000 0004 4 = 26242220
ffff000102d1c840 1164693676 C Co:6:002:0 0 4 >
ffff000102d1c840 1164693722 S Ci:6:002:0 s c0 05 0e44 0000 0004 4 <
ffff000102d1c840 1164693843 C Ci:6:002:0 0 4 = 19171d1d
ffff000102d1c840 1164693889 S Co:6:002:0 s 40 05 0e44 0000 0004 4 = 1e1e2424
ffff000102d1c840 1164693996 C Co:6:002:0 0 4 >
ffff000102d1c840 1164694042 S Ci:6:002:0 s c0 05 0e48 0000 0004 4 <
ffff000102d1c840 1164694164 C Ci:6:002:0 0 4 = 1d1d1d1d
ffff000102d1c840 1164694210 S Co:6:002:0 s 40 05 0e48 0000 0004 4 = 24242422
ffff000102d1c840 1164694316 C Co:6:002:0 0 4 >
ffff000102d1c840 1164694363 S Ci:6:002:0 s c0 05 0e4c 0000 0004 4 <
ffff000102d1c840 1164694485 C Ci:6:002:0 0 4 = 1b191715
ffff000102d1c840 1164694530 S Co:6:002:0 s 40 05 0e4c 0000 0004 4 = 201e1c1c
ffff000102d1c840 1164694649 C Co:6:002:0 0 4 >
ffff000102d1c840 1164694695 S Ci:6:002:0 s c0 05 0e54 0000 0004 4 <
ffff000102d1c840 1164694817 C Ci:6:002:0 0 4 = 11090300
ffff000102d1c840 1164694863 S Co:6:002:0 s 40 05 0e54 0000 0004 4 = 160e0800
ffff000102d1c840 1164694970 C Co:6:002:0 0 4 >
ffff000103533780 1164732326 S Ci:6:002:0 s c0 05 004c 0000 0001 1 <
ffff000103533780 1164732441 C Ci:6:002:0 0 1 = 20
ffff000103533780 1164732564 S Co:6:002:0 s 40 05 004c 0000 0001 1 = 20
ffff000103533780 1164732684 C Co:6:002:0 0 1 >
ffff000103533780 1164768219 S Ci:6:002:0 s c0 05 0770 0000 0004 4 <
ffff000103533780 1164768352 C Ci:6:002:0 0 4 = 00000000
ffff000103533780 1164768490 S Ci:6:002:0 s c0 05 0774 0000 0004 4 <
ffff000103533780 1164768610 C Ci:6:002:0 0 4 = 00000000
ffff000103533780 1164768739 S Co:6:002:0 s 40 05 076e 0000 0001 1 = 0c
ffff000103533780 1164768849 C Co:6:002:0 0 1 >
ffff000103533780 1164768982 S Ci:6:002:0 s c0 05 0808 0000 0004 4 <
ffff000103533780 1164769101 C Ci:6:002:0 0 4 = 3382023e
ffff000103533780 1164769231 S Ci:6:002:0 s c0 05 0a5c 0000 0002 2 <
ffff000103533780 1164769350 C Ci:6:002:0 0 2 = 0000
ffff000103533780 1164769481 S Ci:6:002:0 s c0 05 0f48 0000 0002 2 <
ffff000103533780 1164769600 C Ci:6:002:0 0 2 = 0a9a
ffff000103533780 1164769731 S Ci:6:002:0 s c0 05 0f04 0000 0004 4 <
ffff000103533780 1164769847 C Ci:6:002:0 0 4 = 00000000
ffff000103533780 1164769878 S Ci:6:002:0 s c0 05 0f14 0000 0004 4 <
ffff000103533780 1164769990 C Ci:6:002:0 0 4 = 7500e800
ffff000103533780 1164770021 S Ci:6:002:0 s c0 05 0f10 0000 0004 4 <
ffff000103533780 1164770146 C Ci:6:002:0 0 4 = 00000000
ffff000103533780 1164770176 S Ci:6:002:0 s c0 05 0f0c 0000 0004 4 <
ffff000103533780 1164770287 C Ci:6:002:0 0 4 = 00000000
ffff000103533780 1164770316 S Ci:6:002:0 s c0 05 0f08 0000 0004 4 <
ffff000103533780 1164770428 C Ci:6:002:0 0 4 = 09006a9b
ffff000103533780 1164770457 S Ci:6:002:0 s c0 05 0fcc 0000 0004 4 <
ffff000103533780 1164770568 C Ci:6:002:0 0 4 = 00000000
ffff000103533780 1164770598 S Ci:6:002:0 s c0 05 09a4 0000 0004 4 <
ffff000103533780 1164770709 C Ci:6:002:0 0 4 = 80000800
ffff000103533780 1164770739 S Co:6:002:0 s 40 05 09a4 0000 0004 4 = 80000a00
ffff000103533780 1164770846 C Co:6:002:0 0 4 >
ffff000103533780 1164770876 S Ci:6:002:0 s c0 05 09a4 0000 0004 4 <
ffff000103533780 1164770987 C Ci:6:002:0 0 4 = 80000a00
ffff000103533780 1164771017 S Co:6:002:0 s 40 05 09a4 0000 0004 4 = 80000800
ffff000103533780 1164771126 C Co:6:002:0 0 4 >
ffff000103533780 1164771155 S Ci:6:002:0 s c0 05 0a2c 0000 0004 4 <
ffff000103533780 1164771279 C Ci:6:002:0 0 4 = 00009000
ffff000103533780 1164771309 S Co:6:002:0 s 40 05 0a2c 0000 0004 4 = 00009000
ffff000103533780 1164771416 C Co:6:002:0 0 4 >
ffff000103533780 1164771445 S Ci:6:002:0 s c0 05 0a2c 0000 0004 4 <
ffff000103533780 1164771557 C Ci:6:002:0 0 4 = 00009000
ffff000103533780 1164771586 S Co:6:002:0 s 40 05 0a2c 0000 0004 4 = 00809000
ffff000103533780 1164771694 C Co:6:002:0 0 4 >
ffff000103533780 1164771723 S Ci:6:002:0 s c0 05 0b58 0000 0004 4 <
ffff000103533780 1164771835 C Ci:6:002:0 0 4 = 00000000
ffff000103533780 1164771864 S Co:6:002:0 s 40 05 0b58 0000 0004 4 = 01000000
ffff000103533780 1164771972 C Co:6:002:0 0 4 >
ffff000103533780 1164772021 S Ci:6:002:0 s c0 05 0b58 0000 0004 4 <
ffff000103533780 1164772147 C Ci:6:002:0 0 4 = 01000000
ffff000103533780 1164772178 S Co:6:002:0 s 40 05 0b58 0000 0004 4 = 00000000
ffff000103533780 1164772286 C Co:6:002:0 0 4 >
ffff000103533780 1164772308 S Ci:6:002:0 s c0 05 0c50 0000 0004 4 <
ffff000103533780 1164772418 C Ci:6:002:0 0 4 = 20000000
ffff000103533780 1164772447 S Co:6:002:0 s 40 05 0c50 0000 0004 4 = 22000000
ffff000103533780 1164772562 C Co:6:002:0 0 4 >
ffff000103533780 1164772583 S Ci:6:002:0 s c0 05 0e50 0000 0004 4 <
ffff000103533780 1164772695 C Ci:6:002:0 0 4 = 20000000
ffff000103533780 1164772725 S Co:6:002:0 s 40 05 0e50 0000 0004 4 = 22000000
ffff000103533780 1164772839 C Co:6:002:0 0 4 >
ffff000103533780 1164772861 S Ci:6:002:0 s c0 05 01cc 0000 0001 1 <
ffff000103533780 1164772972 C Ci:6:002:0 0 1 = 00
ffff000103533780 1164773001 S Co:6:002:0 s 40 05 01f0 0000 0004 4 = 00000000
ffff000103533780 1164773037 C Co:6:002:0 0 4 >
ffff000103533780 1164773053 S Co:6:002:0 s 40 05 01d0 0000 0004 4 = 58000000
ffff000103533780 1164773159 C Co:6:002:0 0 4 >
ffff000103533780 1164773191 S Co:6:002:0 s 40 05 0440 0000 0004 4 = 00000000
ffff000103533780 1164773305 C Co:6:002:0 0 4 >
ffff000103533780 1164773327 S Ci:6:002:0 s c0 05 0c00 0000 0004 4 <
ffff000103533780 1164773438 C Ci:6:002:0 0 4 = 07000000
ffff000103533780 1164773467 S Ci:6:002:0 s c0 05 08b0 0000 0004 4 <
ffff000103533780 1164773587 C Ci:6:002:0 0 4 = 18060000
ffff000103533780 1164773608 S Co:6:002:0 s 40 05 08b0 0000 0004 4 = 42060000
ffff000103533780 1164773716 C Co:6:002:0 0 4 >
ffff000103533780 1164773765 S Ci:6:002:0 s c0 05 0d04 0000 0004 4 <
ffff000103533780 1164773873 C Ci:6:002:0 0 4 = 088590b1
ffff000103533780 1164773903 S Co:6:002:0 s 40 05 0c90 0000 0004 4 = 08852304
ffff000103533780 1164774023 C Co:6:002:0 0 4 >
ffff000103533780 1164774065 S Co:6:002:0 s 40 05 0280 0000 0002 2 = 0001
ffff000103533780 1164774173 C Co:6:002:0 0 2 >
ffff000103533780 1164774196 S Ci:6:002:0 s c0 05 010c 0000 0001 1 <
ffff000103533780 1164774308 C Ci:6:002:0 0 1 = b0
ffff000103533780 1164774337 S Co:6:002:0 s 40 05 010c 0000 0001 1 = b4
ffff000103533780 1164774372 C Co:6:002:0 0 1 >
ffff000103533780 1165756134 S Ci:6:002:0 s c0 05 004c 0000 0001 1 <
ffff000103533780 1165756245 C Ci:6:002:0 0 1 = 20
ffff000103533780 1165756389 S Co:6:002:0 s 40 05 004c 0000 0001 1 = 20
ffff000103533780 1165756488 C Co:6:002:0 0 1 >
ffff000103533780 1166748266 S Ci:6:002:0 s c0 05 0770 0000 0004 4 <
ffff000103533780 1166748364 C Ci:6:002:0 0 4 = 00000000
ffff000103533780 1166748502 S Ci:6:002:0 s c0 05 0774 0000 0004 4 <
ffff000103533780 1166748647 C Ci:6:002:0 0 4 = 00000000
ffff000103533780 1166748798 S Co:6:002:0 s 40 05 076e 0000 0001 1 = 0c
ffff000103533780 1166748938 C Co:6:002:0 0 1 >
ffff000103533780 1166749097 S Ci:6:002:0 s c0 05 0808 0000 0004 4 <
ffff000103533780 1166749243 C Ci:6:002:0 0 4 = 3382023e
ffff000103533780 1166749398 S Ci:6:002:0 s c0 05 0a5c 0000 0002 2 <
ffff000103533780 1166749546 C Ci:6:002:0 0 2 = 0000
ffff000103533780 1166749700 S Ci:6:002:0 s c0 05 0f48 0000 0002 2 <
ffff000103533780 1166749845 C Ci:6:002:0 0 2 = a400
ffff000103533780 1166750000 S Ci:6:002:0 s c0 05 0f04 0000 0004 4 <
ffff000103533780 1166750134 C Ci:6:002:0 0 4 = 00000000
ffff000103533780 1166750160 S Ci:6:002:0 s c0 05 0f14 0000 0004 4 <
ffff000103533780 1166750279 C Ci:6:002:0 0 4 = 00000600
ffff000103533780 1166750307 S Ci:6:002:0 s c0 05 0f10 0000 0004 4 <
ffff000103533780 1166750426 C Ci:6:002:0 0 4 = 00000000
ffff000103533780 1166750447 S Ci:6:002:0 s c0 05 0f0c 0000 0004 4 <
ffff000103533780 1166750560 C Ci:6:002:0 0 4 = 00000000
ffff000103533780 1166750589 S Ci:6:002:0 s c0 05 0f08 0000 0004 4 <
ffff000103533780 1166750702 C Ci:6:002:0 0 4 = 0000a900
ffff000103533780 1166750731 S Ci:6:002:0 s c0 05 0fcc 0000 0004 4 <
ffff000103533780 1166750843 C Ci:6:002:0 0 4 = 00000000
ffff000103533780 1166750872 S Ci:6:002:0 s c0 05 09a4 0000 0004 4 <
ffff000103533780 1166750984 C Ci:6:002:0 0 4 = 80000800
ffff000103533780 1166751015 S Co:6:002:0 s 40 05 09a4 0000 0004 4 = 80000a00
ffff000103533780 1166751127 C Co:6:002:0 0 4 >
ffff000103533780 1166751156 S Ci:6:002:0 s c0 05 09a4 0000 0004 4 <
ffff000103533780 1166751275 C Ci:6:002:0 0 4 = 80000a00
ffff000103533780 1166751295 S Co:6:002:0 s 40 05 09a4 0000 0004 4 = 80000800
ffff000103533780 1166751403 C Co:6:002:0 0 4 >
ffff000103533780 1166751432 S Ci:6:002:0 s c0 05 0a2c 0000 0004 4 <
ffff000103533780 1166751551 C Ci:6:002:0 0 4 = 00809000
ffff000103533780 1166751572 S Co:6:002:0 s 40 05 0a2c 0000 0004 4 = 00009000
ffff000103533780 1166751680 C Co:6:002:0 0 4 >
ffff000103533780 1166751708 S Ci:6:002:0 s c0 05 0a2c 0000 0004 4 <
ffff000103533780 1166751828 C Ci:6:002:0 0 4 = 00009000
ffff000103533780 1166751848 S Co:6:002:0 s 40 05 0a2c 0000 0004 4 = 00809000
ffff000103533780 1166751956 C Co:6:002:0 0 4 >
ffff000103533780 1166751985 S Ci:6:002:0 s c0 05 0b58 0000 0004 4 <
ffff000103533780 1166752105 C Ci:6:002:0 0 4 = 00000000
ffff000103533780 1166752127 S Co:6:002:0 s 40 05 0b58 0000 0004 4 = 01000000
ffff000103533780 1166752171 C Co:6:002:0 0 4 >
ffff000103533780 1166752196 S Ci:6:002:0 s c0 05 0b58 0000 0004 4 <
ffff000103533780 1166752308 C Ci:6:002:0 0 4 = 01000000
ffff000103533780 1166752436 S Co:6:002:0 s 40 05 0b58 0000 0004 4 = 00000000
ffff000103533780 1166752554 C Co:6:002:0 0 4 >
ffff000103533780 1166752701 S Ci:6:002:0 s c0 05 0c50 0000 0004 4 <
ffff000103533780 1166752822 C Ci:6:002:0 0 4 = 22000000
ffff000103533780 1166752858 S Co:6:002:0 s 40 05 0c50 0000 0004 4 = 20000000
ffff000103533780 1166752964 C Co:6:002:0 0 4 >
ffff000103533780 1166752993 S Ci:6:002:0 s c0 05 0e50 0000 0004 4 <
ffff000103533780 1166753112 C Ci:6:002:0 0 4 = 22000000
ffff000103533780 1166753237 S Co:6:002:0 s 40 05 0e50 0000 0004 4 = 20000000
ffff000103533780 1166753349 C Co:6:002:0 0 4 >
ffff000103533780 1166753386 S Ci:6:002:0 s c0 05 01cc 0000 0001 1 <
ffff000103533780 1166753508 C Ci:6:002:0 0 1 = 00
ffff000103533780 1166753537 S Co:6:002:0 s 40 05 01f4 0000 0004 4 = 00000000
ffff000103533780 1166753644 C Co:6:002:0 0 4 >
ffff000103533780 1166753673 S Co:6:002:0 s 40 05 01d4 0000 0004 4 = 58000000
ffff000103533780 1166753781 C Co:6:002:0 0 4 >
ffff000103533780 1166753811 S Co:6:002:0 s 40 05 0440 0000 0004 4 = 00000000
ffff000103533780 1166753917 C Co:6:002:0 0 4 >
ffff000103533780 1166753949 S Ci:6:002:0 s c0 05 0c00 0000 0004 4 <
ffff000103533780 1166754058 C Ci:6:002:0 0 4 = 07000000
ffff000103533780 1166754087 S Ci:6:002:0 s c0 05 08b0 0000 0004 4 <
ffff000103533780 1166754202 C Ci:6:002:0 0 4 = 42060000
ffff000103533780 1166754231 S Co:6:002:0 s 40 05 08b0 0000 0004 4 = 42060000
ffff000103533780 1166754338 C Co:6:002:0 0 4 >
ffff000103533780 1166754388 S Ci:6:002:0 s c0 05 0d04 0000 0004 4 <
ffff000103533780 1166754507 C Ci:6:002:0 0 4 = 088d90b1
ffff000103533780 1166754537 S Ci:6:002:0 s c0 05 0c1c 0000 0004 4 <
ffff000103533780 1166754649 C Ci:6:002:0 0 4 = 0300402d
ffff000103533780 1166754678 S Co:6:002:0 s 40 05 0c1c 0000 0004 4 = 0300e032
ffff000103533780 1166754785 C Co:6:002:0 0 4 >
ffff000103533780 1166754814 S Ci:6:002:0 s c0 05 0e1c 0000 0004 4 <
ffff000103533780 1166754927 C Ci:6:002:0 0 4 = 0300402d
ffff000103533780 1166754955 S Co:6:002:0 s 40 05 0e1c 0000 0004 4 = 0300e035
ffff000103533780 1166755063 C Co:6:002:0 0 4 >
ffff000103533780 1166755092 S Co:6:002:0 s 40 05 0280 0000 0002 2 = 0001
ffff000103533780 1166755199 C Co:6:002:0 0 2 >
ffff000103533780 1166755229 S Ci:6:002:0 s c0 05 010c 0000 0001 1 <
ffff000103533780 1166755342 C Ci:6:002:0 0 1 = b4
ffff000103533780 1166755371 S Co:6:002:0 s 40 05 010c 0000 0001 1 = b4
ffff000103533780 1166755478 C Co:6:002:0 0 1 >
ffff000103533780 1166780149 S Ci:6:002:0 s c0 05 004c 0000 0001 1 <
ffff000103533780 1166780271 C Ci:6:002:0 0 1 = 20
ffff000103533780 1166780301 S Co:6:002:0 s 40 05 004c 0000 0001 1 = 20
ffff000103533780 1166780413 C Co:6:002:0 0 1 >
