ffff00014c2bf840 4044764176 S Ci:6:002:0 s c0 05 004c 0000 0001 1 <
ffff00014c2bf840 4044764339 C Ci:6:002:0 0 1 = 20
ffff00014c2bf840 4044764513 S Co:6:002:0 s 40 05 004c 0000 0001 1 = 20
ffff00014c2bf840 4044764626 C Co:6:002:0 0 1 >
ffff000103533480 4044789490 C Bi:6:002:1 0 351 = 27010484 00000f80 430d6000 04300000 00000000 44735101 443c0000 85f5f501
ffff000103533480 4044789521 S Bi:6:002:1 -115 32768 <
ffff000103533240 4044790255 C Bi:6:002:1 0 374 = 3e010484 00000f80 16086000 04300000 00000000 47765101 463c0000 87f2f201
ffff000103533240 4044790279 S Bi:6:002:1 -115 32768 <
ffff000103533780 4044791057 C Bi:6:002:1 0 384 = 48010484 00000f80 e60a6000 04300000 00000000 58795101 46380000 83efef01
ffff000103533780 4044791082 S Bi:6:002:1 -115 32768 <
ffff0001035330c0 4044889871 C Bi:6:002:1 0 383 = 47010484 00000f80 110c6000 04300000 00000000 6afb5201 463a0000 84ecec01
ffff0001035330c0 4044889899 S Bi:6:002:1 -115 32768 <
ffff000103533480 4044890748 C Bi:6:002:1 0 376 = 40010484 00000f80 7f036000 04300000 00000000 b6fe5201 463c0000 83f4f401
ffff000103533480 4044890776 S Bi:6:002:1 -115 32768 <
ffff000103533240 4044891523 C Bi:6:002:1 0 351 = 27010484 00000f80 440d6000 04300000 00000000 f3015301 443c0000 82f7f701
ffff000103533240 4044891548 S Bi:6:002:1 -115 32768 <
ffff000103533780 4044892303 C Bi:6:002:1 0 374 = 3e010484 00000f80 17086000 04300000 00000000 e4045301 443c0000 83e8e801
ffff000103533780 4044892326 S Bi:6:002:1 -115 32768 <
ffff0001035330c0 4044893158 C Bi:6:002:1 0 384 = 48010484 00000f80 e70a6000 04300000 00000000 2c085301 443a0000 82fcfc01
ffff0001035330c0 4044893183 S Bi:6:002:1 -115 32768 <
ffff000103533480 4044993855 C Bi:6:002:1 0 351 = 27010484 00000f80 450d6000 04300000 00000000 bd915401 443a0000 88f2f201
ffff000103533480 4044993885 S Bi:6:002:1 -115 32768 <
ffff000103533240 4044994669 C Bi:6:002:1 0 374 = 3e010484 00000f80 18086000 04300000 00000000 b9945401 4a3c0000 91f3f301
ffff000103533240 4044994695 S Bi:6:002:1 -115 32768 <
ffff000103533780 4044995550 C Bi:6:002:1 0 384 = 48010484 00000f80 e80a6000 04300000 00000000 28985401 443a0000 81f9f901
ffff000103533780 4044995574 S Bi:6:002:1 -115 32768 <
ffff0001035330c0 4045093454 C Bi:6:002:1 0 383 = 47010484 00000f80 130c6000 04300000 00000000 77165601 463c0000 86eded01
ffff0001035330c0 4045093500 S Bi:6:002:1 -115 32768 <
ffff000103533480 4045094289 C Bi:6:002:1 0 376 = 40010484 00000f80 81036000 04300000 00000000 e5195601 46380000 86eded01
ffff000103533480 4045094315 S Bi:6:002:1 -115 32768 <
ffff000103533240 4045096776 C Bi:6:002:1 0 374 = 3e010484 00000f80 19086000 04300000 00000000 9b235601 443a0000 83f1f101
ffff000103533240 4045096800 S Bi:6:002:1 -115 32768 <
ffff000103533780 4045097618 C Bi:6:002:1 0 384 = 48010484 00000f80 e90a6000 04300000 00000000 da265601 443e0000 87e8e801
ffff000103533780 4045097644 S Bi:6:002:1 -115 32768 <
ffff0001035330c0 4045195595 C Bi:6:002:1 0 383 = 47010484 00000f80 140c6000 04300000 00000000 7ca55701 443a0000 88f6f601
ffff0001035330c0 4045195619 S Bi:6:002:1 -115 32768 <
ffff000103533480 4045196586 C Bi:6:002:1 0 376 = 40010484 00000f80 82036000 04300000 00000000 86a95701 423a0000 85e5e501
ffff000103533480 4045196608 S Bi:6:002:1 -115 32768 <
ffff000103533240 4045197852 C Bi:6:002:1 0 374 = 3e010484 00000f80 1a086000 04300000 00000000 67ae5701 44380000 84fefe01
ffff000103533240 4045197879 S Bi:6:002:1 -115 32768 <
ffff000103533780 4045299512 C Bi:6:002:1 0 383 = 47010484 00000f80 150c6000 04300000 00000000 6e3b5901 463a0000 86f4f401
ffff000103533780 4045299564 S Bi:6:002:1 -115 32768 <
ffff0001035330c0 4045300372 C Bi:6:002:1 0 376 = 40010484 00000f80 83036000 04300000 00000000 d63e5901 443c0000 82fafa01
ffff0001035330c0 4045300398 S Bi:6:002:1 -115 32768 <
ffff000103533480 4045301118 C Bi:6:002:1 0 351 = 27010484 00000f80 480d6000 04300000 00000000 f4415901 463a0000 84fefe01
ffff000103533480 4045301144 S Bi:6:002:1 -115 32768 <
ffff000103533240 4045401917 C Bi:6:002:1 0 383 = 47010484 00000f80 160c6000 04300000 00000000 70cb5a01 46380000 88f9f901
ffff000103533240 4045401947 S Bi:6:002:1 -115 32768 <
ffff000103533780 4045402745 C Bi:6:002:1 0 376 = 40010484 00000f80 84036000 04300000 00000000 d0ce5a01 463c0000 81fcfc01
ffff000103533780 4045402771 S Bi:6:002:1 -115 32768 <
ffff0001035330c0 4045403503 C Bi:6:002:1 0 351 = 27010484 00000f80 490d6000 04300000 00000000 e4d15a01 463e0000 87fcfc01
ffff0001035330c0 4045403527 S Bi:6:002:1 -115 32768 <
ffff000103533480 4045404415 C Bi:6:002:1 0 374 = 3e010484 00000f80 1c086000 04300000 00000000 3cd55a01 443c0000 7ff5f501
ffff000103533480 4045404443 S Bi:6:002:1 -115 32768 <
ffff000103533240 4045405274 C Bi:6:002:1 0 384 = 48010484 00000f80 ec0a6000 04300000 00000000 a3d85a01 46380000 84f1f101
ffff000103533240 4045405299 S Bi:6:002:1 -115 32768 <
ffff000103533780 4045488023 C Bi:6:002:1 0 310 = fe000484 00000f80 70016000 00300000 00000000 80155c01 34360000 7d530001
ffff000103533780 4045488059 S Bi:6:002:1 -115 32768 <
ffff0001035330c0 4045503398 C Bi:6:002:1 0 383 = 47010484 00000f80 170c6000 04300000 00000000 ed575c01 443a0000 85f0f001
ffff0001035330c0 4045503423 S Bi:6:002:1 -115 32768 <
ffff000103533480 4045504261 C Bi:6:002:1 0 376 = 40010484 00000f80 85036000 04300000 00000000 595b5c01 44360000 83f4f401
ffff000103533480 4045504286 S Bi:6:002:1 -115 32768 <
ffff000103533240 4045505046 C Bi:6:002:1 0 351 = 27010484 00000f80 4a0d6000 04300000 00000000 995e5c01 463a0000 84f4f401
ffff000103533240 4045505067 S Bi:6:002:1 -115 32768 <
ffff000103533780 4045506441 C Bi:6:002:1 0 374 = 3e010484 00000f80 1d086000 04300000 00000000 e2635c01 443e0000 83fcfc01
ffff000103533780 4045506506 S Bi:6:002:1 -115 32768 <
ffff0001035330c0 4045507958 C Bi:6:002:1 0 384 = 48010484 00000f80 ed0a6000 04300000 00000000 bb695c01 40360000 86f7f701
ffff0001035330c0 4045507982 S Bi:6:002:1 -115 32768 <
ffff000103533480 4045607493 C Bi:6:002:1 0 383 = 47010484 00000f80 180c6000 04300000 00000000 a2ee5d01 423c0000 87f3f301
ffff000103533480 4045607520 S Bi:6:002:1 -115 32768 <
ffff000103533240 4045609523 C Bi:6:002:1 0 376 = 40010484 00000f80 86036000 04300000 00000000 71f65d01 463c0000 88f2f201
ffff000103533240 4045609552 S Bi:6:002:1 -115 32768 <
ffff000103533780 4045611484 C Bi:6:002:1 0 351 = 27010484 00000f80 4b0d6000 04300000 00000000 40fe5d01 46380000 87f7f701
ffff000103533780 4045611509 S Bi:6:002:1 -115 32768 <
ffff0001035330c0 4045613501 C Bi:6:002:1 0 374 = 3e010484 00000f80 1e086000 04300000 00000000 11065e01 443a0000 88efef01
ffff0001035330c0 4045613525 S Bi:6:002:1 -115 32768 <
ffff000103533480 4045614298 C Bi:6:002:1 0 384 = 48010484 00000f80 ee0a6000 04300000 00000000 24095e01 443c0000 85f1f101
ffff000103533480 4045614323 S Bi:6:002:1 -115 32768 <
ffff000103533240 4045708613 C Bi:6:002:1 0 376 = 40010484 00000f80 87036000 04300000 00000000 9a795f01 4a3c0000 94f2f201
ffff000103533240 4045708657 S Bi:6:002:1 -115 32768 <
ffff000103533780 4045710243 C Bi:6:002:1 0 374 = 3e010484 00000f80 1f086000 04300000 00000000 0e805f01 463a0000 87f2f201
ffff000103533780 4045710266 S Bi:6:002:1 -115 32768 <
ffff0001035330c0 4045711053 C Bi:6:002:1 0 384 = 48010484 00000f80 ef0a6000 04300000 00000000 2c835f01 463e0000 86f3f301
ffff0001035330c0 4045711075 S Bi:6:002:1 -115 32768 <
ffff000103151780 4045715279 S Ci:6:002:0 s c0 05 0454 0000 0001 1 <
ffff000103151780 4045715349 C Ci:6:002:0 0 1 = 00
ffff000103151780 4045715384 S Ci:6:002:0 s c0 05 0860 0000 0004 4 <
ffff000103151780 4045715427 C Ci:6:002:0 0 4 = 21c3d572
ffff000103151780 4045715453 S Co:6:002:0 s 40 05 0860 0000 0004 4 = 21c3d572
ffff000103151780 4045715500 C Co:6:002:0 0 4 >
ffff000103151780 4045715521 S Ci:6:002:0 s c0 05 0c00 0000 0004 4 <
ffff000103151780 4045715556 C Ci:6:002:0 0 4 = 07000000
ffff000103151780 4045715582 S Ci:6:002:0 s c0 05 08b0 0000 0004 4 <
ffff000103151780 4045715633 C Ci:6:002:0 0 4 = 42060000
ffff000103151780 4045715653 S Co:6:002:0 s 40 05 08b0 0000 0004 4 = 18060000
ffff000103151780 4045715682 C Co:6:002:0 0 4 >
ffff000103151780 4045715725 S Ci:6:002:0 s c0 05 0d04 0000 0004 4 <
ffff000103151780 4045715758 C Ci:6:002:0 0 4 = 017c90b1
ffff000103151780 4045715776 S Co:6:002:0 s 40 05 0c90 0000 0004 4 = 017c8001
ffff000103151780 4045715805 C Co:6:002:0 0 4 >
ffff000103151780 4045715835 S Ci:6:002:0 s c0 05 08ac 0000 0004 4 <
ffff000103151780 4045715880 C Ci:6:002:0 0 4 = 08faf00f
ffff000103151780 4045715898 S Co:6:002:0 s 40 05 08ac 0000 0004 4 = 08faf00f
ffff000103151780 4045715923 C Co:6:002:0 0 4 >
ffff000103151780 4045715940 S Ci:6:002:0 s c0 05 08ac 0000 0004 4 <
ffff000103151780 4045715973 C Ci:6:002:0 0 4 = 08faf00f
ffff000103151780 4045715991 S Co:6:002:0 s 40 05 08ac 0000 0004 4 = 08faf00f
ffff000103151780 4045716035 C Co:6:002:0 0 4 >
ffff000103151780 4045716055 S Ci:6:002:0 s c0 05 08c4 0000 0004 4 <
ffff000103151780 4045716089 C Ci:6:002:0 0 4 = 00000000
ffff000103151780 4045716107 S Co:6:002:0 s 40 05 08c4 0000 0004 4 = 00000000
ffff000103151780 4045716137 C Co:6:002:0 0 4 >
ffff000103151780 4045716158 S Ci:6:002:0 s c0 05 0c00 0000 0004 4 <
ffff000103151780 4045716192 C Ci:6:002:0 0 4 = 07000000
ffff000103151780 4045716213 S Ci:6:002:0 s c0 05 08b0 0000 0004 4 <
ffff000103151780 4045716262 C Ci:6:002:0 0 4 = 18060000
ffff000103151780 4045716283 S Co:6:002:0 s 40 05 08b0 0000 0004 4 = 18060000
ffff000103151780 4045716317 C Co:6:002:0 0 4 >
ffff000103151780 4045716358 S Ci:6:002:0 s c0 05 0d04 0000 0004 4 <
ffff000103151780 4045716393 C Ci:6:002:0 0 4 = 017c90b1
ffff000103151780 4045716413 S Co:6:002:0 s 40 05 0c90 0000 0004 4 = 017c8001
ffff000103151780 4045716444 C Co:6:002:0 0 4 >
ffff000103151780 4045716479 S Ci:6:002:0 s c0 05 0e00 0000 0004 4 <
ffff000103151780 4045716516 C Ci:6:002:0 0 4 = 07000000
ffff000103151780 4045716540 S Ci:6:002:0 s c0 05 08b0 0000 0004 4 <
ffff000103151780 4045716579 C Ci:6:002:0 0 4 = 18060000
ffff000103151780 4045716602 S Co:6:002:0 s 40 05 08b0 0000 0004 4 = 18060000
ffff000103151780 4045716633 C Co:6:002:0 0 4 >
ffff000103151780 4045716676 S Ci:6:002:0 s c0 05 0d44 0000 0004 4 <
ffff000103151780 4045716713 C Ci:6:002:0 0 4 = 017c90b1
ffff000103151780 4045716736 S Co:6:002:0 s 40 05 0e90 0000 0004 4 = 017c8001
ffff000103151780 4045716767 C Co:6:002:0 0 4 >
ffff000103151780 4045716803 S Ci:6:002:0 s c0 05 08ac 0000 0004 4 <
ffff000103151780 4045716840 C Ci:6:002:0 0 4 = 08faf00f
ffff000103151780 4045716863 S Co:6:002:0 s 40 05 08ac 0000 0004 4 = 08faf00f
ffff000103151780 4045716894 C Co:6:002:0 0 4 >
ffff000103151780 4045716917 S Ci:6:002:0 s c0 05 08ac 0000 0004 4 <
ffff000103151780 4045716954 C Ci:6:002:0 0 4 = 08faf00f
ffff000103151780 4045716977 S Co:6:002:0 s 40 05 08ac 0000 0004 4 = 08faf00f
ffff000103151780 4045717008 C Co:6:002:0 0 4 >
ffff000103151780 4045717032 S Ci:6:002:0 s c0 05 08c4 0000 0004 4 <
ffff000103151780 4045717066 C Ci:6:002:0 0 4 = 00000000
ffff000103151780 4045717090 S Co:6:002:0 s 40 05 08c4 0000 0004 4 = 00000000
ffff000103151780 4045717131 C Co:6:002:0 0 4 >
ffff000103151780 4045717153 S Ci:6:002:0 s c0 05 0e00 0000 0004 4 <
ffff000103151780 4045717187 C Ci:6:002:0 0 4 = 07000000
ffff000103151780 4045717210 S Ci:6:002:0 s c0 05 08b0 0000 0004 4 <
ffff000103151780 4045717257 C Ci:6:002:0 0 4 = 18060000
ffff000103151780 4045717280 S Co:6:002:0 s 40 05 08b0 0000 0004 4 = 18060000
ffff000103151780 4045717311 C Co:6:002:0 0 4 >
ffff000103151780 4045717354 S Ci:6:002:0 s c0 05 0d44 0000 0004 4 <
ffff000103151780 4045717388 C Ci:6:002:0 0 4 = 017c90b1
ffff000103151780 4045717411 S Co:6:002:0 s 40 05 0e90 0000 0004 4 = 017c8001
ffff000103151780 4045717442 C Co:6:002:0 0 4 >
ffff000103151780 4045717478 S Ci:6:002:0 s c0 05 0668 0000 0002 2 <
ffff000103151780 4045717512 C Ci:6:002:0 0 2 = 0010
ffff000103151780 4045717536 S Co:6:002:0 s 40 05 0668 0000 0002 2 = 0010
ffff000103151780 4045717567 C Co:6:002:0 0 2 >
ffff000103151780 4045717591 S Co:6:002:0 s 40 05 0483 0000 0001 1 = 00
ffff000103151780 4045717630 C Co:6:002:0 0 1 >
ffff000103151780 4045717653 S Ci:6:002:0 s c0 05 0837 0000 0001 1 <
ffff000103151780 4045717687 C Ci:6:002:0 0 1 = 00
ffff000103151780 4045717710 S Ci:6:002:0 s c0 05 08ac 0000 0004 4 <
ffff000103151780 4045717757 C Ci:6:002:0 0 4 = 08faf00f
ffff000103151780 4045717782 S Co:6:002:0 s 40 05 08ac 0000 0004 4 = 08faf00f
ffff000103151780 4045717812 C Co:6:002:0 0 4 >
ffff000103151780 4045717835 S Ci:6:002:0 s c0 05 08c4 0000 0004 4 <
ffff000103151780 4045717882 C Ci:6:002:0 0 4 = 00000000
ffff000103151780 4045717905 S Co:6:002:0 s 40 05 08c4 0000 0004 4 = 00000000
ffff000103151780 4045717936 C Co:6:002:0 0 4 >
ffff000103151780 4045717959 S Ci:6:002:0 s c0 05 0848 0000 0004 4 <
ffff000103151780 4045718007 C Ci:6:002:0 0 4 = 8bffd061
ffff000103151780 4045718030 S Co:6:002:0 s 40 05 0848 0000 0004 4 = 8bffd061
ffff000103151780 4045718061 C Co:6:002:0 0 4 >
ffff000103151780 4045718084 S Ci:6:002:0 s c0 05 08ac 0000 0004 4 <
ffff000103151780 4045718132 C Ci:6:002:0 0 4 = 08faf00f
ffff000103151780 4045718156 S Co:6:002:0 s 40 05 08ac 0000 0004 4 = 08faf00f
ffff000103151780 4045718186 C Co:6:002:0 0 4 >
ffff000103151780 4045718209 S Ci:6:002:0 s c0 05 08ac 0000 0004 4 <
ffff000103151780 4045718257 C Ci:6:002:0 0 4 = 08faf00f
ffff000103151780 4045718280 S Co:6:002:0 s 40 05 08ac 0000 0004 4 = 08faf00f
ffff000103151780 4045718314 C Co:6:002:0 0 4 >
ffff000103151780 4045718336 S Ci:6:002:0 s c0 05 08c4 0000 0004 4 <
ffff000103151780 4045718383 C Ci:6:002:0 0 4 = 00000000
ffff000103151780 4045718406 S Co:6:002:0 s 40 05 08c4 0000 0004 4 = 00000000
ffff000103151780 4045718438 C Co:6:002:0 0 4 >
ffff000103151780 4045718461 S Ci:6:002:0 s c0 05 0c00 0000 0004 4 <
ffff000103151780 4045718508 C Ci:6:002:0 0 4 = 07000000
ffff000103151780 4045718531 S Ci:6:002:0 s c0 05 08b0 0000 0004 4 <
ffff000103151780 4045718565 C Ci:6:002:0 0 4 = 18060000
ffff000103151780 4045718588 S Co:6:002:0 s 40 05 08b0 0000 0004 4 = 18060000
ffff000103151780 4045718630 C Co:6:002:0 0 4 >
ffff000103151780 4045718674 S Ci:6:002:0 s c0 05 0d04 0000 0004 4 <
ffff000103151780 4045718709 C Ci:6:002:0 0 4 = 017c90b1
ffff000103151780 4045718732 S Co:6:002:0 s 40 05 0c90 0000 0004 4 = 017c8001
ffff000103151780 4045718763 C Co:6:002:0 0 4 >
ffff000103151780 4045718799 S Ci:6:002:0 s c0 05 0e00 0000 0004 4 <
ffff000103151780 4045718834 C Ci:6:002:0 0 4 = 07000000
ffff000103151780 4045718857 S Ci:6:002:0 s c0 05 08b0 0000 0004 4 <
ffff000103151780 4045718891 C Ci:6:002:0 0 4 = 18060000
ffff000103151780 4045718914 S Co:6:002:0 s 40 05 08b0 0000 0004 4 = 18060000
ffff000103151780 4045718945 C Co:6:002:0 0 4 >
ffff000103151780 4045718988 S Ci:6:002:0 s c0 05 0d44 0000 0004 4 <
ffff000103151780 4045719023 C Ci:6:002:0 0 4 = 017c90b1
ffff000103151780 4045719047 S Co:6:002:0 s 40 05 0e90 0000 0004 4 = 017c8001
ffff000103151780 4045719077 C Co:6:002:0 0 4 >
ffff000103151780 4045719136 S Ci:6:002:0 s c0 05 0c20 0000 0004 4 <
ffff000103151780 4045719171 C Ci:6:002:0 0 4 = 13131313
ffff000103151780 4045719194 S Co:6:002:0 s 40 05 0c20 0000 0004 4 = 13131313
ffff000103151780 4045719225 C Co:6:002:0 0 4 >
ffff000103151780 4045719248 S Ci:6:002:0 s c0 05 0c24 0000 0004 4 <
ffff000103151780 4045719283 C Ci:6:002:0 0 4 = 20202020
ffff000103151780 4045719306 S Co:6:002:0 s 40 05 0c24 0000 0004 4 = 20202020
ffff000103151780 4045719336 C Co:6:002:0 0 4 >
ffff000103151780 4045719359 S Ci:6:002:0 s c0 05 0c28 0000 0004 4 <
ffff000103151780 4045719394 C Ci:6:002:0 0 4 = 20201e1c
ffff000103151780 4045719417 S Co:6:002:0 s 40 05 0c28 0000 0004 4 = 20201e1c
ffff000103151780 4045719448 C Co:6:002:0 0 4 >
ffff000103151780 4045719470 S Ci:6:002:0 s c0 05 0c2c 0000 0004 4 <
ffff000103151780 4045719508 C Ci:6:002:0 0 4 = 20202020
ffff000103151780 4045719531 S Co:6:002:0 s 40 05 0c2c 0000 0004 4 = 20202020
ffff000103151780 4045719562 C Co:6:002:0 0 4 >
ffff000103151780 4045719585 S Ci:6:002:0 s c0 05 0c30 0000 0004 4 <
ffff000103151780 4045719633 C Ci:6:002:0 0 4 = 20201e1c
ffff000103151780 4045719656 S Co:6:002:0 s 40 05 0c30 0000 0004 4 = 20201e1c
ffff000103151780 4045719687 C Co:6:002:0 0 4 >
ffff000103151780 4045719711 S Ci:6:002:0 s c0 05 0c34 0000 0004 4 <
ffff000103151780 4045719758 C Ci:6:002:0 0 4 = 20202020
ffff000103151780 4045719781 S Co:6:002:0 s 40 05 0c34 0000 0004 4 = 20202020
ffff000103151780 4045719811 C Co:6:002:0 0 4 >
ffff000103151780 4045719834 S Ci:6:002:0 s c0 05 0c38 0000 0004 4 <
ffff000103151780 4045719883 C Ci:6:002:0 0 4 = 201e1c1a
ffff000103151780 4045719906 S Co:6:002:0 s 40 05 0c38 0000 0004 4 = 201e1c1a
ffff000103151780 4045719934 C Co:6:002:0 0 4 >
ffff000103151780 4045719957 S Ci:6:002:0 s c0 05 0c3c 0000 0004 4 <
ffff000103151780 4045720019 C Ci:6:002:0 0 4 = 20202020
ffff000103151780 4045720043 S Co:6:002:0 s 40 05 0c3c 0000 0004 4 = 20202020
ffff000103151780 4045720076 C Co:6:002:0 0 4 >
ffff000103151780 4045720100 S Ci:6:002:0 s c0 05 0c40 0000 0004 4 <
ffff000103151780 4045720136 C Ci:6:002:0 0 4 = 20201e1c
ffff000103151780 4045720160 S Co:6:002:0 s 40 05 0c40 0000 0004 4 = 20201e1c
ffff000103151780 4045720190 C Co:6:002:0 0 4 >
ffff000103151780 4045720213 S Ci:6:002:0 s c0 05 0c44 0000 0004 4 <
ffff000103151780 4045720258 C Ci:6:002:0 0 4 = 1a181e1e
ffff000103151780 4045720281 S Co:6:002:0 s 40 05 0c44 0000 0004 4 = 1a181e1e
ffff000103151780 4045720312 C Co:6:002:0 0 4 >
ffff000103151780 4045720336 S Ci:6:002:0 s c0 05 0c48 0000 0004 4 <
ffff000103151780 4045720384 C Ci:6:002:0 0 4 = 1e1e1e1e
ffff000103151780 4045720407 S Co:6:002:0 s 40 05 0c48 0000 0004 4 = 1e1e1e1e
ffff000103151780 4045720437 C Co:6:002:0 0 4 >
ffff000103151780 4045720460 S Ci:6:002:0 s c0 05 0c4c 0000 0004 4 <
ffff000103151780 4045720508 C Ci:6:002:0 0 4 = 1c1a1816
ffff000103151780 4045720531 S Co:6:002:0 s 40 05 0c4c 0000 0004 4 = 1c1a1816
ffff000103151780 4045720562 C Co:6:002:0 0 4 >
ffff000103151780 4045720585 S Ci:6:002:0 s c0 05 0c54 0000 0004 4 <
ffff000103151780 4045720633 C Ci:6:002:0 0 4 = 120a0400
ffff000103151780 4045720656 S Co:6:002:0 s 40 05 0c54 0000 0004 4 = 120a0400
ffff000103151780 4045720687 C Co:6:002:0 0 4 >
ffff000103151780 4045720710 S Ci:6:002:0 s c0 05 0e20 0000 0004 4 <
ffff000103151780 4045720758 C Ci:6:002:0 0 4 = 14141414
ffff000103151780 4045720781 S Co:6:002:0 s 40 05 0e20 0000 0004 4 = 14141414
ffff000103151780 4045720812 C Co:6:002:0 0 4 >
ffff000103151780 4045720836 S Ci:6:002:0 s c0 05 0e24 0000 0004 4 <
ffff000103151780 4045720883 C Ci:6:002:0 0 4 = 1d1d1d1d
ffff000103151780 4045720907 S Co:6:002:0 s 40 05 0e24 0000 0004 4 = 1d1d1d1d
ffff000103151780 4045720937 C Co:6:002:0 0 4 >
ffff000103151780 4045720960 S Ci:6:002:0 s c0 05 0e28 0000 0004 4 <
ffff000103151780 4045721008 C Ci:6:002:0 0 4 = 1d1d1b19
ffff000103151780 4045721031 S Co:6:002:0 s 40 05 0e28 0000 0004 4 = 1d1d1b19
ffff000103151780 4045721061 C Co:6:002:0 0 4 >
ffff000103151780 4045721084 S Ci:6:002:0 s c0 05 0e2c 0000 0004 4 <
ffff000103151780 4045721133 C Ci:6:002:0 0 4 = 1f1f1f1f
ffff000103151780 4045721157 S Co:6:002:0 s 40 05 0e2c 0000 0004 4 = 1f1f1f1f
ffff000103151780 4045721188 C Co:6:002:0 0 4 >
ffff000103151780 4045721211 S Ci:6:002:0 s c0 05 0e30 0000 0004 4 <
ffff000103151780 4045721259 C Ci:6:002:0 0 4 = 1f1f1d1b
ffff000103151780 4045721282 S Co:6:002:0 s 40 05 0e30 0000 0004 4 = 1f1f1d1b
ffff000103151780 4045721313 C Co:6:002:0 0 4 >
ffff000103151780 4045721336 S Ci:6:002:0 s c0 05 0e34 0000 0004 4 <
ffff000103151780 4045721384 C Ci:6:002:0 0 4 = 1f1f1f1f
ffff000103151780 4045721407 S Co:6:002:0 s 40 05 0e34 0000 0004 4 = 1f1f1f1f
ffff000103151780 4045721437 C Co:6:002:0 0 4 >
ffff000103151780 4045721460 S Ci:6:002:0 s c0 05 0e38 0000 0004 4 <
ffff000103151780 4045721509 C Ci:6:002:0 0 4 = 1f1d1b19
ffff000103151780 4045721532 S Co:6:002:0 s 40 05 0e38 0000 0004 4 = 1f1d1b19
ffff000103151780 4045721563 C Co:6:002:0 0 4 >
ffff000103151780 4045721586 S Ci:6:002:0 s c0 05 0e3c 0000 0004 4 <
ffff000103151780 4045721634 C Ci:6:002:0 0 4 = 1f1f1f1f
ffff000103151780 4045721657 S Co:6:002:0 s 40 05 0e3c 0000 0004 4 = 1f1f1f1f
ffff000103151780 4045721687 C Co:6:002:0 0 4 >
ffff000103151780 4045721710 S Ci:6:002:0 s c0 05 0e40 0000 0004 4 <
ffff000103151780 4045721759 C Ci:6:002:0 0 4 = 1f1f1d1b
ffff000103151780 4045721782 S Co:6:002:0 s 40 05 0e40 0000 0004 4 = 1f1f1d1b
ffff000103151780 4045721812 C Co:6:002:0 0 4 >
ffff000103151780 4045721835 S Ci:6:002:0 s c0 05 0e44 0000 0004 4 <
ffff000103151780 4045721884 C Ci:6:002:0 0 4 = 19171d1d
ffff000103151780 4045721908 S Co:6:002:0 s 40 05 0e44 0000 0004 4 = 19171d1d
ffff000103151780 4045721938 C Co:6:002:0 0 4 >
ffff000103151780 4045721961 S Ci:6:002:0 s c0 05 0e48 0000 0004 4 <
ffff000103151780 4045722009 C Ci:6:002:0 0 4 = 1d1d1d1d
ffff000103151780 4045722032 S Co:6:002:0 s 40 05 0e48 0000 0004 4 = 1d1d1d1d
ffff000103151780 4045722062 C Co:6:002:0 0 4 >
ffff000103151780 4045722085 S Ci:6:002:0 s c0 05 0e4c 0000 0004 4 <
ffff000103151780 4045722134 C Ci:6:002:0 0 4 = 1b191715
ffff000103151780 4045722157 S Co:6:002:0 s 40 05 0e4c 0000 0004 4 = 1b191715
ffff000103151780 4045722188 C Co:6:002:0 0 4 >
ffff000103151780 4045722211 S Ci:6:002:0 s c0 05 0e54 0000 0004 4 <
ffff000103151780 4045722259 C Ci:6:002:0 0 4 = 11090300
ffff000103151780 4045722282 S Co:6:002:0 s 40 05 0e54 0000 0004 4 = 11090300
ffff000103151780 4045722313 C Co:6:002:0 0 4 >
ffff000103151780 4045722346 S Ci:6:002:0 s c0 05 0454 0000 0001 1 <
ffff000103151780 4045722384 C Ci:6:002:0 0 1 = 00
ffff000103151780 4045722407 S Ci:6:002:0 s c0 05 0454 0000 0001 1 <
ffff000103151780 4045722444 C Ci:6:002:0 0 1 = 00
ffff000103151780 4045722467 S Co:6:002:0 s 40 05 0454 0000 0001 1 = 80
ffff000103151780 4045722505 C Co:6:002:0 0 1 >
ffff000103151780 4045722528 S Ci:6:002:0 s c0 05 041a 0000 0002 2 <
ffff000103151780 4045722565 C Ci:6:002:0 0 2 = ff0f
ffff000103151780 4045722589 S Ci:6:002:0 s c0 05 0808 0000 0004 4 <
ffff000103151780 4045722634 C Ci:6:002:0 0 4 = 3382023e
ffff000103151780 4045722657 S Co:6:002:0 s 40 05 0808 0000 0004 4 = 3382023e
ffff000103151780 4045722688 C Co:6:002:0 0 4 >
ffff000103151780 4045722711 S Ci:6:002:0 s c0 05 0834 0000 0004 4 <
ffff000103151780 4045722759 C Ci:6:002:0 0 4 = 05a73700
ffff000103151780 4045722782 S Co:6:002:0 s 40 05 0834 0000 0004 4 = 06a73700
ffff000103151780 4045722813 C Co:6:002:0 0 4 >
ffff000103151780 4045722836 S Ci:6:002:0 s c0 05 0830 0000 0004 4 <
ffff000103151780 4045722884 C Ci:6:002:0 0 4 = b8eeaa2e
ffff000103151780 4045722907 S Co:6:002:0 s 40 05 0830 0000 0004 4 = b8aeaa2e
ffff000103151780 4045722938 C Co:6:002:0 0 4 >
ffff000103151780 4045722961 S Ci:6:002:0 s c0 05 0830 0000 0004 4 <
ffff000103151780 4045723009 C Ci:6:002:0 0 4 = b8aeaa2e
ffff000103151780 4045723032 S Co:6:002:0 s 40 05 0830 0000 0004 4 = b8aeaa2e
ffff000103151780 4045723063 C Co:6:002:0 0 4 >
ffff000103151780 4045723086 S Ci:6:002:0 s c0 05 082c 0000 0004 4 <
ffff000103151780 4045723134 C Ci:6:002:0 0 4 = dc832000
ffff000103151780 4045723157 S Co:6:002:0 s 40 05 082c 0000 0004 4 = dd832000
ffff000103151780 4045723188 C Co:6:002:0 0 4 >
ffff000103151780 4045723211 S Co:6:002:0 s 40 05 0cb0 0000 0004 4 = 17773354
ffff000103151780 4045723255 C Co:6:002:0 0 4 >
ffff000103151780 4045723278 S Co:6:002:0 s 40 05 0eb0 0000 0004 4 = 17773354
ffff000103151780 4045723308 C Co:6:002:0 0 4 >
ffff000103151780 4045723331 S Ci:6:002:0 s c0 05 0cb4 0000 0004 4 <
ffff000103151780 4045723384 C Ci:6:002:0 0 4 = 77000001
ffff000103151780 4045723407 S Co:6:002:0 s 40 05 0cb4 0000 0004 4 = 77000001
ffff000103151780 4045723438 C Co:6:002:0 0 4 >
ffff000103151780 4045723461 S Ci:6:002:0 s c0 05 0eb4 0000 0004 4 <
ffff000103151780 4045723509 C Ci:6:002:0 0 4 = 77000001
ffff000103151780 4045723532 S Co:6:002:0 s 40 05 0eb4 0000 0004 4 = 77000001
ffff000103151780 4045723563 C Co:6:002:0 0 4 >
ffff000103151780 4045723586 S Ci:6:002:0 s c0 05 0900 0000 0004 4 <
ffff000103151780 4045723635 C Ci:6:002:0 0 4 = 01040000
ffff000103151780 4045723659 S Co:6:002:0 s 40 05 0900 0000 0004 4 = 01040000
ffff000103151780 4045723690 C Co:6:002:0 0 4 >
ffff000103151780 4045723712 S Ci:6:002:0 s c0 05 080c 0000 0004 4 <
ffff000103151780 4045723759 C Ci:6:002:0 0 4 = 13111312
ffff000103151780 4045723782 S Co:6:002:0 s 40 05 080c 0000 0004 4 = 03111312
ffff000103151780 4045723813 C Co:6:002:0 0 4 >
ffff000103151780 4045723836 S Ci:6:002:0 s c0 05 0a04 0000 0004 4 <
ffff000103151780 4045723884 C Ci:6:002:0 0 4 = 0c00ff01
ffff000103151780 4045723907 S Co:6:002:0 s 40 05 0a04 0000 0004 4 = 0c00ff0f
ffff000103151780 4045723938 C Co:6:002:0 0 4 >
ffff000103151780 4045723961 S Ci:6:002:0 s c0 05 0440 0000 0004 4 <
ffff000103151780 4045724020 C Ci:6:002:0 0 4 = 00000000
ffff000103151780 4045724118 S Co:6:002:0 s 40 05 0440 0000 0004 4 = 50010000
ffff000103151780 4045724151 C Co:6:002:0 0 4 >
ffff000103151780 4045724176 S Ci:6:002:0 s c0 05 0c1c 0000 0004 4 <
ffff000103151780 4045724214 C Ci:6:002:0 0 4 = 03000040
ffff000103151780 4045724237 S Co:6:002:0 s 40 05 0c1c 0000 0004 4 = 0300402d
ffff000103151780 4045724268 C Co:6:002:0 0 4 >
ffff000103151780 4045724292 S Ci:6:002:0 s c0 05 0e1c 0000 0004 4 <
ffff000103151780 4045724329 C Ci:6:002:0 0 4 = 03000040
ffff000103151780 4045724352 S Co:6:002:0 s 40 05 0e1c 0000 0004 4 = 0300402d
ffff000103151780 4045724383 C Co:6:002:0 0 4 >
ffff000103151780 4045724406 S Ci:6:002:0 s c0 05 0860 0000 0004 4 <
ffff000103151780 4045724444 C Ci:6:002:0 0 4 = 21c3d572
ffff000103151780 4045724467 S Co:6:002:0 s 40 05 0860 0000 0004 4 = 21c32568
ffff000103151780 4045724505 C Co:6:002:0 0 4 >
ffff000103151780 4045724529 S Ci:6:002:0 s c0 05 0c00 0000 0004 4 <
ffff000103151780 4045724565 C Ci:6:002:0 0 4 = 07000000
ffff000103151780 4045724589 S Ci:6:002:0 s c0 05 08b0 0000 0004 4 <
ffff000103151780 4045724635 C Ci:6:002:0 0 4 = 18060000
ffff000103151780 4045724658 S Co:6:002:0 s 40 05 08b0 0000 0004 4 = 18060000
ffff000103151780 4045724689 C Co:6:002:0 0 4 >
ffff000103151780 4045724732 S Ci:6:002:0 s c0 05 0d04 0000 0004 4 <
ffff000103151780 4045724770 C Ci:6:002:0 0 4 = 017c90b1
ffff000103151780 4045724793 S Co:6:002:0 s 40 05 0c90 0000 0004 4 = 017d8301
ffff000103151780 4045724824 C Co:6:002:0 0 4 >
ffff000103151780 4045724860 S Ci:6:002:0 s c0 05 08ac 0000 0004 4 <
ffff000103151780 4045724894 C Ci:6:002:0 0 4 = 08faf00f
ffff000103151780 4045724917 S Co:6:002:0 s 40 05 08ac 0000 0004 4 = 08faf00f
ffff000103151780 4045724948 C Co:6:002:0 0 4 >
ffff000103151780 4045724971 S Ci:6:002:0 s c0 05 08ac 0000 0004 4 <
ffff000103151780 4045725007 C Ci:6:002:0 0 4 = 08faf00f
ffff000103151780 4045725030 S Co:6:002:0 s 40 05 08ac 0000 0004 4 = 08faf00f
ffff000103151780 4045725060 C Co:6:002:0 0 4 >
ffff000103151780 4045725083 S Ci:6:002:0 s c0 05 08c4 0000 0004 4 <
ffff000103151780 4045725132 C Ci:6:002:0 0 4 = 00000000
ffff000103151780 4045725155 S Co:6:002:0 s 40 05 08c4 0000 0004 4 = 00000000
ffff000103151780 4045725186 C Co:6:002:0 0 4 >
ffff000103151780 4045725210 S Ci:6:002:0 s c0 05 0c00 0000 0004 4 <
ffff000103151780 4045725257 C Ci:6:002:0 0 4 = 07000000
ffff000103151780 4045725280 S Ci:6:002:0 s c0 05 08b0 0000 0004 4 <
ffff000103151780 4045725315 C Ci:6:002:0 0 4 = 18060000
ffff000103151780 4045725339 S Co:6:002:0 s 40 05 08b0 0000 0004 4 = 18060000
ffff000103151780 4045725380 C Co:6:002:0 0 4 >
ffff000103151780 4045725424 S Ci:6:002:0 s c0 05 0d04 0000 0004 4 <
ffff000103151780 4045725458 C Ci:6:002:0 0 4 = 017d91b1
ffff000103151780 4045725480 S Co:6:002:0 s 40 05 0c90 0000 0004 4 = 847d8101
ffff000103151780 4045725511 C Co:6:002:0 0 4 >
ffff000103151780 4045725547 S Ci:6:002:0 s c0 05 0e00 0000 0004 4 <
ffff000103151780 4045725582 C Ci:6:002:0 0 4 = 07000000
ffff000103151780 4045725605 S Ci:6:002:0 s c0 05 08b0 0000 0004 4 <
ffff000103151780 4045725639 C Ci:6:002:0 0 4 = 18060000
ffff000103151780 4045725662 S Co:6:002:0 s 40 05 08b0 0000 0004 4 = 18060000
ffff000103151780 4045725693 C Co:6:002:0 0 4 >
ffff000103151780 4045725736 S Ci:6:002:0 s c0 05 0d44 0000 0004 4 <
ffff000103151780 4045725770 C Ci:6:002:0 0 4 = 017c90b1
ffff000103151780 4045725793 S Co:6:002:0 s 40 05 0e90 0000 0004 4 = 017d8301
ffff000103151780 4045725824 C Co:6:002:0 0 4 >
ffff000103151780 4045725860 S Ci:6:002:0 s c0 05 08ac 0000 0004 4 <
ffff000103151780 4045725894 C Ci:6:002:0 0 4 = 08faf00f
ffff000103151780 4045725918 S Co:6:002:0 s 40 05 08ac 0000 0004 4 = 08faf00f
ffff000103151780 4045725948 C Co:6:002:0 0 4 >
ffff000103151780 4045725971 S Ci:6:002:0 s c0 05 08ac 0000 0004 4 <
ffff000103151780 4045726008 C Ci:6:002:0 0 4 = 08faf00f
ffff000103151780 4045726032 S Co:6:002:0 s 40 05 08ac 0000 0004 4 = 08faf00f
ffff000103151780 4045726062 C Co:6:002:0 0 4 >
ffff000103151780 4045726085 S Ci:6:002:0 s c0 05 08c4 0000 0004 4 <
ffff000103151780 4045726133 C Ci:6:002:0 0 4 = 00000000
ffff000103151780 4045726156 S Co:6:002:0 s 40 05 08c4 0000 0004 4 = 00000000
ffff000103151780 4045726186 C Co:6:002:0 0 4 >
ffff000103151780 4045726210 S Ci:6:002:0 s c0 05 0e00 0000 0004 4 <
ffff000103151780 4045726258 C Ci:6:002:0 0 4 = 07000000
ffff000103151780 4045726282 S Ci:6:002:0 s c0 05 08b0 0000 0004 4 <
ffff000103151780 4045726316 C Ci:6:002:0 0 4 = 18060000
ffff000103151780 4045726339 S Co:6:002:0 s 40 05 08b0 0000 0004 4 = 18060000
ffff000103151780 4045726380 C Co:6:002:0 0 4 >
ffff000103151780 4045726424 S Ci:6:002:0 s c0 05 0d44 0000 0004 4 <
ffff000103151780 4045726458 C Ci:6:002:0 0 4 = 017d91b1
ffff000103151780 4045726481 S Co:6:002:0 s 40 05 0e90 0000 0004 4 = 847d8101
ffff000103151780 4045726511 C Co:6:002:0 0 4 >
ffff000103151780 4045726548 S Ci:6:002:0 s c0 05 0668 0000 0002 2 <
ffff000103151780 4045726582 C Ci:6:002:0 0 2 = 0010
ffff000103151780 4045726606 S Co:6:002:0 s 40 05 0668 0000 0002 2 = 0010
ffff000103151780 4045726636 C Co:6:002:0 0 2 >
ffff000103151780 4045726660 S Co:6:002:0 s 40 05 0483 0000 0001 1 = 00
ffff000103151780 4045726690 C Co:6:002:0 0 1 >
ffff000103151780 4045726713 S Ci:6:002:0 s c0 05 0837 0000 0001 1 <
ffff000103151780 4045726758 C Ci:6:002:0 0 1 = 00
ffff000103151780 4045726781 S Ci:6:002:0 s c0 05 08ac 0000 0004 4 <
ffff000103151780 4045726816 C Ci:6:002:0 0 4 = 08faf00f
ffff000103151780 4045726839 S Co:6:002:0 s 40 05 08ac 0000 0004 4 = 08faf00f
ffff000103151780 4045726880 C Co:6:002:0 0 4 >
ffff000103151780 4045726903 S Ci:6:002:0 s c0 05 08c4 0000 0004 4 <
ffff000103151780 4045726938 C Ci:6:002:0 0 4 = 00000000
ffff000103151780 4045726961 S Co:6:002:0 s 40 05 08c4 0000 0004 4 = 00000000
ffff000103151780 4045727005 C Co:6:002:0 0 4 >
ffff000103151780 4045727029 S Ci:6:002:0 s c0 05 0848 0000 0004 4 <
ffff000103151780 4045727064 C Ci:6:002:0 0 4 = 8bffd061
ffff000103151780 4045727087 S Co:6:002:0 s 40 05 0848 0000 0004 4 = 8bffd061
ffff000103151780 4045727130 C Co:6:002:0 0 4 >
ffff000103151780 4045727153 S Ci:6:002:0 s c0 05 08ac 0000 0004 4 <
ffff000103151780 4045727188 C Ci:6:002:0 0 4 = 08faf00f
ffff000103151780 4045727211 S Co:6:002:0 s 40 05 08ac 0000 0004 4 = 08faf00f
ffff000103151780 4045727255 C Co:6:002:0 0 4 >
ffff000103151780 4045727278 S Ci:6:002:0 s c0 05 08ac 0000 0004 4 <
ffff000103151780 4045727313 C Ci:6:002:0 0 4 = 08faf00f
ffff000103151780 4045727336 S Co:6:002:0 s 40 05 08ac 0000 0004 4 = 08faf00f
ffff000103151780 4045727380 C Co:6:002:0 0 4 >
ffff000103151780 4045727404 S Ci:6:002:0 s c0 05 08c4 0000 0004 4 <
ffff000103151780 4045727439 C Ci:6:002:0 0 4 = 00000000
ffff000103151780 4045727462 S Co:6:002:0 s 40 05 08c4 0000 0004 4 = 00000000
ffff000103151780 4045727505 C Co:6:002:0 0 4 >
ffff000103151780 4045727528 S Ci:6:002:0 s c0 05 0c00 0000 0004 4 <
ffff000103151780 4045727564 C Ci:6:002:0 0 4 = 07000000
ffff000103151780 4045727587 S Ci:6:002:0 s c0 05 08b0 0000 0004 4 <
ffff000103151780 4045727633 C Ci:6:002:0 0 4 = 18060000
ffff000103151780 4045727656 S Co:6:002:0 s 40 05 08b0 0000 0004 4 = 18060000
ffff000103151780 4045727687 C Co:6:002:0 0 4 >
ffff000103151780 4045727730 S Ci:6:002:0 s c0 05 0d04 0000 0004 4 <
ffff000103151780 4045727765 C Ci:6:002:0 0 4 = 847d93b1
ffff000103151780 4045727788 S Co:6:002:0 s 40 05 0c90 0000 0004 4 = 847d8301
ffff000103151780 4045727819 C Co:6:002:0 0 4 >
ffff000103151780 4045727855 S Ci:6:002:0 s c0 05 0e00 0000 0004 4 <
ffff000103151780 4045727891 C Ci:6:002:0 0 4 = 07000000
ffff000103151780 4045727914 S Ci:6:002:0 s c0 05 08b0 0000 0004 4 <
ffff000103151780 4045727950 C Ci:6:002:0 0 4 = 18060000
ffff000103151780 4045727973 S Co:6:002:0 s 40 05 08b0 0000 0004 4 = 18060000
ffff000103151780 4045728015 C Co:6:002:0 0 4 >
ffff000103151780 4045728059 S Ci:6:002:0 s c0 05 0d44 0000 0004 4 <
ffff000103151780 4045728096 C Ci:6:002:0 0 4 = 847d93b1
ffff000103151780 4045728120 S Co:6:002:0 s 40 05 0e90 0000 0004 4 = 847d8301
ffff000103151780 4045728151 C Co:6:002:0 0 4 >
ffff000103151780 4045728188 S Ci:6:002:0 s c0 05 0073 0000 0001 1 <
ffff000103151780 4045728224 C Ci:6:002:0 0 1 = 07
ffff000103151780 4045728247 S Co:6:002:0 s 40 05 0073 0000 0001 1 = 07
ffff000103151780 4045728278 C Co:6:002:0 0 1 >
ffff000103151780 4045728326 S Ci:6:002:0 s c0 05 0c24 0000 0004 4 <
ffff000103151780 4045728380 C Ci:6:002:0 0 4 = 20202020
ffff000103151780 4045728403 S Co:6:002:0 s 40 05 0c24 0000 0004 4 = 2c2c2c2c
ffff000103151780 4045728434 C Co:6:002:0 0 4 >
ffff000103151780 4045728458 S Ci:6:002:0 s c0 05 0c28 0000 0004 4 <
ffff000103151780 4045728508 C Ci:6:002:0 0 4 = 20201e1c
ffff000103151780 4045728532 S Co:6:002:0 s 40 05 0c28 0000 0004 4 = 2c2c2c2a
ffff000103151780 4045728563 C Co:6:002:0 0 4 >
ffff000103151780 4045728586 S Ci:6:002:0 s c0 05 0c2c 0000 0004 4 <
ffff000103151780 4045728634 C Ci:6:002:0 0 4 = 20202020
ffff000103151780 4045728657 S Co:6:002:0 s 40 05 0c2c 0000 0004 4 = 31313131
ffff000103151780 4045728687 C Co:6:002:0 0 4 >
ffff000103151780 4045728710 S Ci:6:002:0 s c0 05 0c30 0000 0004 4 <
ffff000103151780 4045728759 C Ci:6:002:0 0 4 = 20201e1c
ffff000103151780 4045728782 S Co:6:002:0 s 40 05 0c30 0000 0004 4 = 312f2d2b
ffff000103151780 4045728812 C Co:6:002:0 0 4 >
ffff000103151780 4045728835 S Ci:6:002:0 s c0 05 0c34 0000 0004 4 <
ffff000103151780 4045728884 C Ci:6:002:0 0 4 = 20202020
ffff000103151780 4045728907 S Co:6:002:0 s 40 05 0c34 0000 0004 4 = 2d2d2d2d
ffff000103151780 4045728937 C Co:6:002:0 0 4 >
ffff000103151780 4045728961 S Ci:6:002:0 s c0 05 0c38 0000 0004 4 <
ffff000103151780 4045729009 C Ci:6:002:0 0 4 = 201e1c1a
ffff000103151780 4045729032 S Co:6:002:0 s 40 05 0c38 0000 0004 4 = 2d2d2b29
ffff000103151780 4045729064 C Co:6:002:0 0 4 >
ffff000103151780 4045729087 S Ci:6:002:0 s c0 05 0c3c 0000 0004 4 <
ffff000103151780 4045729134 C Ci:6:002:0 0 4 = 20202020
ffff000103151780 4045729158 S Co:6:002:0 s 40 05 0c3c 0000 0004 4 = 31313131
ffff000103151780 4045729189 C Co:6:002:0 0 4 >
ffff000103151780 4045729212 S Ci:6:002:0 s c0 05 0c40 0000 0004 4 <
ffff000103151780 4045729259 C Ci:6:002:0 0 4 = 20201e1c
ffff000103151780 4045729282 S Co:6:002:0 s 40 05 0c40 0000 0004 4 = 312f2d2b
ffff000103151780 4045729313 C Co:6:002:0 0 4 >
ffff000103151780 4045729336 S Ci:6:002:0 s c0 05 0c44 0000 0004 4 <
ffff000103151780 4045729384 C Ci:6:002:0 0 4 = 1a181e1e
ffff000103151780 4045729407 S Co:6:002:0 s 40 05 0c44 0000 0004 4 = 29292d2d
ffff000103151780 4045729437 C Co:6:002:0 0 4 >
ffff000103151780 4045729460 S Ci:6:002:0 s c0 05 0c48 0000 0004 4 <
ffff000103151780 4045729509 C Ci:6:002:0 0 4 = 1e1e1e1e
ffff000103151780 4045729533 S Co:6:002:0 s 40 05 0c48 0000 0004 4 = 2d2d2d2d
ffff000103151780 4045729564 C Co:6:002:0 0 4 >
ffff000103151780 4045729587 S Ci:6:002:0 s c0 05 0c4c 0000 0004 4 <
ffff000103151780 4045729634 C Ci:6:002:0 0 4 = 1c1a1816
ffff000103151780 4045729657 S Co:6:002:0 s 40 05 0c4c 0000 0004 4 = 2b292727
ffff000103151780 4045729687 C Co:6:002:0 0 4 >
ffff000103151780 4045729710 S Ci:6:002:0 s c0 05 0c54 0000 0004 4 <
ffff000103151780 4045729759 C Ci:6:002:0 0 4 = 120a0400
ffff000103151780 4045729782 S Co:6:002:0 s 40 05 0c54 0000 0004 4 = 21191300
ffff000103151780 4045729813 C Co:6:002:0 0 4 >
ffff000103151780 4045729836 S Ci:6:002:0 s c0 05 0e24 0000 0004 4 <
ffff000103151780 4045729884 C Ci:6:002:0 0 4 = 1d1d1d1d
ffff000103151780 4045729907 S Co:6:002:0 s 40 05 0e24 0000 0004 4 = 19191919
ffff000103151780 4045729938 C Co:6:002:0 0 4 >
ffff000103151780 4045729961 S Ci:6:002:0 s c0 05 0e28 0000 0004 4 <
ffff000103151780 4045730009 C Ci:6:002:0 0 4 = 1d1d1b19
ffff000103151780 4045730032 S Co:6:002:0 s 40 05 0e28 0000 0004 4 = 19191917
ffff000103151780 4045730063 C Co:6:002:0 0 4 >
ffff000103151780 4045730086 S Ci:6:002:0 s c0 05 0e2c 0000 0004 4 <
ffff000103151780 4045730134 C Ci:6:002:0 0 4 = 1f1f1f1f
ffff000103151780 4045730157 S Co:6:002:0 s 40 05 0e2c 0000 0004 4 = 1e1e1e1e
ffff000103151780 4045730188 C Co:6:002:0 0 4 >
ffff000103151780 4045730211 S Ci:6:002:0 s c0 05 0e30 0000 0004 4 <
ffff000103151780 4045730259 C Ci:6:002:0 0 4 = 1f1f1d1b
ffff000103151780 4045730282 S Co:6:002:0 s 40 05 0e30 0000 0004 4 = 1e1c1a18
ffff000103151780 4045730313 C Co:6:002:0 0 4 >
ffff000103151780 4045730336 S Ci:6:002:0 s c0 05 0e34 0000 0004 4 <
ffff000103151780 4045730384 C Ci:6:002:0 0 4 = 1f1f1f1f
ffff000103151780 4045730407 S Co:6:002:0 s 40 05 0e34 0000 0004 4 = 1a1a1a1a
ffff000103151780 4045730435 C Co:6:002:0 0 4 >
ffff000103151780 4045730459 S Ci:6:002:0 s c0 05 0e38 0000 0004 4 <
ffff000103151780 4045730509 C Ci:6:002:0 0 4 = 1f1d1b19
ffff000103151780 4045730532 S Co:6:002:0 s 40 05 0e38 0000 0004 4 = 1a1a1816
ffff000103151780 4045730563 C Co:6:002:0 0 4 >
ffff000103151780 4045730586 S Ci:6:002:0 s c0 05 0e3c 0000 0004 4 <
ffff000103151780 4045730634 C Ci:6:002:0 0 4 = 1f1f1f1f
ffff000103151780 4045730658 S Co:6:002:0 s 40 05 0e3c 0000 0004 4 = 1e1e1e1e
ffff000103151780 4045730689 C Co:6:002:0 0 4 >
ffff000103151780 4045730712 S Ci:6:002:0 s c0 05 0e40 0000 0004 4 <
ffff000103151780 4045730759 C Ci:6:002:0 0 4 = 1f1f1d1b
ffff000103151780 4045730782 S Co:6:002:0 s 40 05 0e40 0000 0004 4 = 1e1c1a18
ffff000103151780 4045730813 C Co:6:002:0 0 4 >
ffff000103151780 4045730836 S Ci:6:002:0 s c0 05 0e44 0000 0004 4 <
ffff000103151780 4045730885 C Ci:6:002:0 0 4 = 19171d1d
ffff000103151780 4045730908 S Co:6:002:0 s 40 05 0e44 0000 0004 4 = 16161a1a
ffff000103151780 4045730938 C Co:6:002:0 0 4 >
ffff000103151780 4045730961 S Ci:6:002:0 s c0 05 0e48 0000 0004 4 <
ffff000103151780 4045731010 C Ci:6:002:0 0 4 = 1d1d1d1d
ffff000103151780 4045731033 S Co:6:002:0 s 40 05 0e48 0000 0004 4 = 1a1a1a1a
ffff000103151780 4045731063 C Co:6:002:0 0 4 >
ffff000103151780 4045731086 S Ci:6:002:0 s c0 05 0e4c 0000 0004 4 <
ffff000103151780 4045731134 C Ci:6:002:0 0 4 = 1b191715
ffff000103151780 4045731158 S Co:6:002:0 s 40 05 0e4c 0000 0004 4 = 18161414
ffff000103151780 4045731188 C Co:6:002:0 0 4 >
ffff000103151780 4045731211 S Ci:6:002:0 s c0 05 0e54 0000 0004 4 <
ffff000103151780 4045731259 C Ci:6:002:0 0 4 = 11090300
ffff000103151780 4045731282 S Co:6:002:0 s 40 05 0e54 0000 0004 4 = 0e060200
ffff000103151780 4045731313 C Co:6:002:0 0 4 >
ffff000103151780 4045756181 S Ci:6:002:0 s c0 05 004c 0000 0001 1 <
ffff000103151780 4045756314 C Ci:6:002:0 0 1 = 20
ffff000103151780 4045756452 S Co:6:002:0 s 40 05 004c 0000 0001 1 = 20
ffff000103151780 4045756591 C Co:6:002:0 0 1 >
ffff000103150540 4045756879 S Ci:6:002:0 s c0 05 0770 0000 0004 4 <
ffff000103150540 4045756948 C Ci:6:002:0 0 4 = 00000000
ffff000103150540 4045757085 S Ci:6:002:0 s c0 05 0774 0000 0004 4 <
ffff000103150540 4045757133 C Ci:6:002:0 0 4 = 00000000
ffff000103150540 4045757262 S Co:6:002:0 s 40 05 076e 0000 0001 1 = 0c
ffff000103150540 4045757294 C Co:6:002:0 0 1 >
ffff000103150540 4045757424 S Ci:6:002:0 s c0 05 0808 0000 0004 4 <
ffff000103150540 4045757469 C Ci:6:002:0 0 4 = 3382023e
ffff000103150540 4045757597 S Ci:6:002:0 s c0 05 0a5c 0000 0002 2 <
ffff000103150540 4045757642 C Ci:6:002:0 0 2 = a900
ffff000103150540 4045757770 S Ci:6:002:0 s c0 05 0f48 0000 0002 2 <
ffff000103150540 4045757815 C Ci:6:002:0 0 2 = 6816
ffff000103150540 4045757942 S Ci:6:002:0 s c0 05 0f04 0000 0004 4 <
ffff000103150540 4045758007 C Ci:6:002:0 0 4 = 04000c00
ffff000103150540 4045758031 S Ci:6:002:0 s c0 05 0f14 0000 0004 4 <
ffff000103150540 4045758068 C Ci:6:002:0 0 4 = 63001000
ffff000103150540 4045758090 S Ci:6:002:0 s c0 05 0f10 0000 0004 4 <
ffff000103150540 4045758132 C Ci:6:002:0 0 4 = 00000000
ffff000103150540 4045758155 S Ci:6:002:0 s c0 05 0f0c 0000 0004 4 <
ffff000103150540 4045758190 C Ci:6:002:0 0 4 = 00000000
ffff000103150540 4045758213 S Ci:6:002:0 s c0 05 0f08 0000 0004 4 <
ffff000103150540 4045758258 C Ci:6:002:0 0 4 = 0201db16
ffff000103150540 4045758280 S Ci:6:002:0 s c0 05 0fcc 0000 0004 4 <
ffff000103150540 4045758316 C Ci:6:002:0 0 4 = 00000000
ffff000103150540 4045758338 S Ci:6:002:0 s c0 05 09a4 0000 0004 4 <
ffff000103150540 4045758383 C Ci:6:002:0 0 4 = 80000800
ffff000103150540 4045758408 S Co:6:002:0 s 40 05 09a4 0000 0004 4 = 80000a00
ffff000103150540 4045758438 C Co:6:002:0 0 4 >
ffff000103150540 4045758461 S Ci:6:002:0 s c0 05 09a4 0000 0004 4 <
ffff000103150540 4045758508 C Ci:6:002:0 0 4 = 80000a00
ffff000103150540 4045758530 S Co:6:002:0 s 40 05 09a4 0000 0004 4 = 80000800
ffff000103150540 4045758561 C Co:6:002:0 0 4 >
ffff000103150540 4045758584 S Ci:6:002:0 s c0 05 0a2c 0000 0004 4 <
ffff000103150540 4045758633 C Ci:6:002:0 0 4 = 00809000
ffff000103150540 4045758655 S Co:6:002:0 s 40 05 0a2c 0000 0004 4 = 00009000
ffff000103150540 4045758686 C Co:6:002:0 0 4 >
ffff000103150540 4045758709 S Ci:6:002:0 s c0 05 0a2c 0000 0004 4 <
ffff000103150540 4045758758 C Ci:6:002:0 0 4 = 00009000
ffff000103150540 4045758781 S Co:6:002:0 s 40 05 0a2c 0000 0004 4 = 00809000
ffff000103150540 4045758811 C Co:6:002:0 0 4 >
ffff000103150540 4045758834 S Ci:6:002:0 s c0 05 0b58 0000 0004 4 <
ffff000103150540 4045758883 C Ci:6:002:0 0 4 = 00000000
ffff000103150540 4045758906 S Co:6:002:0 s 40 05 0b58 0000 0004 4 = 01000000
ffff000103150540 4045758936 C Co:6:002:0 0 4 >
ffff000103150540 4045758959 S Ci:6:002:0 s c0 05 0b58 0000 0004 4 <
ffff000103150540 4045759008 C Ci:6:002:0 0 4 = 01000000
ffff000103150540 4045759032 S Co:6:002:0 s 40 05 0b58 0000 0004 4 = 00000000
ffff000103150540 4045759063 C Co:6:002:0 0 4 >
ffff000103150540 4045759087 S Ci:6:002:0 s c0 05 0c50 0000 0004 4 <
ffff000103150540 4045759133 C Ci:6:002:0 0 4 = 1e000000
ffff000103150540 4045759156 S Co:6:002:0 s 40 05 0c50 0000 0004 4 = 20000000
ffff000103150540 4045759186 C Co:6:002:0 0 4 >
ffff000103150540 4045759208 S Ci:6:002:0 s c0 05 0e50 0000 0004 4 <
ffff000103150540 4045759258 C Ci:6:002:0 0 4 = 1e000000
ffff000103150540 4045759281 S Co:6:002:0 s 40 05 0e50 0000 0004 4 = 20000000
ffff000103150540 4045759311 C Co:6:002:0 0 4 >
ffff000103150540 4045759334 S Ci:6:002:0 s c0 05 01cc 0000 0001 1 <
ffff000103150540 4045759383 C Ci:6:002:0 0 1 = 00
ffff000103150540 4045759406 S Co:6:002:0 s 40 05 01f8 0000 0004 4 = 00000000
ffff000103150540 4045759436 C Co:6:002:0 0 4 >
ffff000103150540 4045759459 S Co:6:002:0 s 40 05 01d8 0000 0004 4 = 58000000
ffff000103150540 4045759505 C Co:6:002:0 0 4 >
ffff000103150540 4045759529 S Co:6:002:0 s 40 05 0440 0000 0004 4 = 00000000
ffff000103150540 4045759559 C Co:6:002:0 0 4 >
ffff000103150540 4045759583 S Ci:6:002:0 s c0 05 0c00 0000 0004 4 <
ffff000103150540 4045759633 C Ci:6:002:0 0 4 = 07000000
ffff000103150540 4045759656 S Ci:6:002:0 s c0 05 08b0 0000 0004 4 <
ffff000103150540 4045759694 C Ci:6:002:0 0 4 = 18060000
ffff000103150540 4045759716 S Co:6:002:0 s 40 05 08b0 0000 0004 4 = 42060000
ffff000103150540 4045759755 C Co:6:002:0 0 4 >
ffff000103150540 4045759798 S Ci:6:002:0 s c0 05 0d04 0000 0004 4 <
ffff000103150540 4045759834 C Ci:6:002:0 0 4 = 108d90b1
ffff000103150540 4045759857 S Co:6:002:0 s 40 05 0c90 0000 0004 4 = 108d2304
ffff000103150540 4045759888 C Co:6:002:0 0 4 >
ffff000103150540 4045759924 S Co:6:002:0 s 40 05 0280 0000 0002 2 = 0001
ffff000103150540 4045759955 C Co:6:002:0 0 2 >
ffff000103150540 4045759978 S Ci:6:002:0 s c0 05 010c 0000 0001 1 <
ffff000103150540 4045760036 C Ci:6:002:0 0 1 = b4
ffff000103150540 4045760061 S Co:6:002:0 s 40 05 010c 0000 0001 1 = b4
ffff000103150540 4045760095 C Co:6:002:0 0 1 >
ffff000103533480 4045810101 C Bi:6:002:1 0 477 = a5010484 00000f80 5b036000 04300000 00000000 70056101 20280000 4ae2e20f
ffff000103533480 4045810140 S Bi:6:002:1 -115 32768 <
ffff000103533240 4045811069 C Bi:6:002:1 0 470 = 9e010484 00000f80 63096000 04300000 00000000 5a096101 20280000 4bdede0f
ffff000103533240 4045811093 S Bi:6:002:1 -115 32768 <
ffff000103533780 4045811850 C Bi:6:002:1 0 445 = 85010484 00000f80 0d016000 04300000 00000000 e00c6101 20260000 4cdcdc0f
ffff000103533780 4045811867 S Bi:6:002:1 -115 32768 <
ffff0001035330c0 4045812853 C Bi:6:002:1 0 468 = 9c010484 00000f80 2d0f6000 04300000 00000000 43106101 20280000 4ddede0f
ffff0001035330c0 4045812874 S Bi:6:002:1 -115 32768 <
ffff000103533480 4045813778 C Bi:6:002:1 0 478 = a6010484 00000f80 dd0d6000 04300000 00000000 d4136101 20280000 4ddfdf0f
ffff000103533480 4045813805 S Bi:6:002:1 -115 32768 <
ffff000103533240 4045912510 C Bi:6:002:1 0 477 = a5010484 00000f80 5c036000 04300000 00000000 72956201 20260000 4fdddd0f
ffff000103533240 4045912568 S Bi:6:002:1 -115 32768 <
ffff000103533780 4045913530 C Bi:6:002:1 0 470 = 9e010484 00000f80 64096000 04300000 00000000 94996201 20260000 4edfdf0f
ffff000103533780 4045913556 S Bi:6:002:1 -115 32768 <
ffff0001035330c0 4045914502 C Bi:6:002:1 0 445 = 85010484 00000f80 0e016000 04300000 00000000 819d6201 20280000 4ce4e40f
ffff0001035330c0 4045914529 S Bi:6:002:1 -115 32768 <
ffff000103533480 4045915419 C Bi:6:002:1 0 468 = 9c010484 00000f80 2e0f6000 04300000 00000000 f7a06201 20280000 4de0e00f
ffff000103533480 4045915444 S Bi:6:002:1 -115 32768 <
ffff000103533240 4045916375 C Bi:6:002:1 0 478 = a6010484 00000f80 de0d6000 04300000 00000000 a0a46201 20260000 4fdbdb0f
ffff000103533240 4045916400 S Bi:6:002:1 -115 32768 <
ffff000103533780 4045978798 C Bi:6:002:1 0 464 = 98010484 00000f00 7e076000 04300000 00000000 a2986301 22280000 4de0e00f
ffff000103533780 4045978832 S Bi:6:002:1 -115 32768 <
ffff0001035330c0 4046014901 C Bi:6:002:1 0 477 = a5010484 00000f80 5d036000 04300000 00000000 73256401 20280000 4ddada0f
ffff0001035330c0 4046014936 S Bi:6:002:1 -115 32768 <
ffff000103533480 4046015855 C Bi:6:002:1 0 470 = 9e010484 00000f80 65096000 04300000 00000000 3d296401 202a0000 4bdfdf0f
ffff000103533480 4046015882 S Bi:6:002:1 -115 32768 <
ffff000103533240 4046016768 C Bi:6:002:1 0 445 = 85010484 00000f80 0f016000 04300000 00000000 ef2c6401 20280000 4de3e30f
ffff000103533240 4046016794 S Bi:6:002:1 -115 32768 <
ffff000103533780 4046017668 C Bi:6:002:1 0 468 = 9c010484 00000f80 2f0f6000 04300000 00000000 5e306401 20260000 4de3e30f
ffff000103533780 4046017693 S Bi:6:002:1 -115 32768 <
ffff0001035330c0 4046018567 C Bi:6:002:1 0 478 = a6010484 00000f80 df0d6000 04300000 00000000 d7336401 20240000 4eeaea0f
ffff0001035330c0 4046018592 S Bi:6:002:1 -115 32768 <
ffff000103533480 4046118348 C Bi:6:002:1 0 470 = 9e010484 00000f80 66096000 04300000 00000000 b2b96501 20280000 4cd9d90f
ffff000103533480 4046118379 S Bi:6:002:1 -115 32768 <
ffff000103533240 4046119281 C Bi:6:002:1 0 445 = 85010484 00000f80 10016000 04300000 00000000 63bd6501 202a0000 4fe3e30f
ffff000103533240 4046119309 S Bi:6:002:1 -115 32768 <
ffff000103533780 4046120155 C Bi:6:002:1 0 468 = 9c010484 00000f80 300f6000 04300000 00000000 b3c06501 20280000 4ddede0f
ffff000103533780 4046120180 S Bi:6:002:1 -115 32768 <
ffff0001035330c0 4046121079 C Bi:6:002:1 0 478 = a6010484 00000f80 e00d6000 04300000 00000000 48c46501 20260000 4cdfdf0f
ffff0001035330c0 4046121106 S Bi:6:002:1 -115 32768 <
ffff000103533480 4046219679 C Bi:6:002:1 0 477 = a5010484 00000f80 5f036000 04300000 00000000 76456701 20280000 4fdddd0f
ffff000103533480 4046219711 S Bi:6:002:1 -115 32768 <
ffff000103533240 4046220655 C Bi:6:002:1 0 470 = 9e010484 00000f80 67096000 04300000 00000000 42496701 20280000 4be4e40f
ffff000103533240 4046220684 S Bi:6:002:1 -115 32768 <
ffff000103533780 4046221522 C Bi:6:002:1 0 445 = 85010484 00000f80 11016000 04300000 00000000 cd4c6701 20280000 48e0e00f
ffff000103533780 4046221546 S Bi:6:002:1 -115 32768 <
ffff0001035330c0 4046222393 C Bi:6:002:1 0 468 = 9c010484 00000f80 310f6000 04300000 00000000 16506701 20280000 4ae2e20f
ffff0001035330c0 4046222418 S Bi:6:002:1 -115 32768 <
ffff000103533480 4046223313 C Bi:6:002:1 0 478 = a6010484 00000f80 e10d6000 04300000 00000000 a0536701 20240000 4ee8e80f
ffff000103533480 4046223338 S Bi:6:002:1 -115 32768 <
ffff000103533240 4046322087 C Bi:6:002:1 0 477 = a5010484 00000f80 60036000 04300000 00000000 78d56801 20280000 4edbdb0f
ffff000103533240 4046322140 S Bi:6:002:1 -115 32768 <
ffff000103533780 4046323178 C Bi:6:002:1 0 470 = 9e010484 00000f80 68096000 04300000 00000000 bbd96801 20280000 50e0e00f
ffff000103533780 4046323208 S Bi:6:002:1 -115 32768 <
ffff0001035330c0 4046324029 C Bi:6:002:1 0 445 = 85010484 00000f80 12016000 04300000 00000000 3cdd6801 20280000 50e2e20f
ffff0001035330c0 4046324053 S Bi:6:002:1 -115 32768 <
ffff000103533480 4046324986 C Bi:6:002:1 0 468 = 9c010484 00000f80 320f6000 04300000 00000000 e8e06801 20260000 4ee8e80f
ffff000103533480 4046325007 S Bi:6:002:1 -115 32768 <
ffff000103533240 4046325855 C Bi:6:002:1 0 478 = a6010484 00000f80 e20d6000 04300000 00000000 4ae46801 20280000 49e0e00f
ffff000103533240 4046325875 S Bi:6:002:1 -115 32768 <
ffff000103533780 4046424474 C Bi:6:002:1 0 477 = a5010484 00000f80 61036000 04300000 00000000 79656a01 20280000 4ee2e20f
ffff000103533780 4046424522 S Bi:6:002:1 -115 32768 <
ffff0001035330c0 4046425564 C Bi:6:002:1 0 470 = 9e010484 00000f80 69096000 04300000 00000000 b7696a01 20280000 4ce2e20f
ffff0001035330c0 4046425593 S Bi:6:002:1 -115 32768 <
ffff000103533480 4046426478 C Bi:6:002:1 0 445 = 85010484 00000f80 13016000 04300000 00000000 626d6a01 20280000 4bdcdc0f
ffff000103533480 4046426502 S Bi:6:002:1 -115 32768 <
ffff000103533240 4046427373 C Bi:6:002:1 0 468 = 9c010484 00000f80 330f6000 04300000 00000000 de706a01 202a0000 4ee1e10f
ffff000103533240 4046427395 S Bi:6:002:1 -115 32768 <
ffff000103533780 4046428327 C Bi:6:002:1 0 478 = a6010484 00000f80 e30d6000 04300000 00000000 6a746a01 20280000 4be1e10f
ffff000103533780 4046428355 S Bi:6:002:1 -115 32768 <
ffff0001035330c0 4046526876 C Bi:6:002:1 0 477 = a5010484 00000f80 62036000 04300000 00000000 7bf56b01 20260000 48dada0f
ffff0001035330c0 4046526930 S Bi:6:002:1 -115 32768 <
ffff000103533480 4046527875 C Bi:6:002:1 0 470 = 9e010484 00000f80 6a096000 04300000 00000000 57f96b01 20280000 4cdbdb0f
ffff000103533480 4046527905 S Bi:6:002:1 -115 32768 <
ffff000103533240 4046528790 C Bi:6:002:1 0 445 = 85010484 00000f80 14016000 04300000 00000000 14fd6b01 20280000 4ae2e20f
ffff000103533240 4046528814 S Bi:6:002:1 -115 32768 <
ffff000103533780 4046529679 C Bi:6:002:1 0 468 = 9c010484 00000f80 340f6000 04300000 00000000 6c006c01 20280000 4bdfdf0f
ffff000103533780 4046529702 S Bi:6:002:1 -115 32768 <
ffff0001035330c0 4046530614 C Bi:6:002:1 0 478 = a6010484 00000f80 e40d6000 04300000 00000000 09046c01 20280000 4fdfdf0f
ffff0001035330c0 4046530639 S Bi:6:002:1 -115 32768 <
ffff000103533480 4046629315 C Bi:6:002:1 0 477 = a5010484 00000f80 63036000 04300000 00000000 7c856d01 20280000 4bdfdf0f
ffff000103533480 4046629361 S Bi:6:002:1 -115 32768 <
ffff000103533240 4046630349 C Bi:6:002:1 0 470 = 9e010484 00000f80 6b096000 04300000 00000000 aa896d01 20280000 4fdbdb0f
ffff000103533240 4046630374 S Bi:6:002:1 -115 32768 <
ffff000103533780 4046631266 C Bi:6:002:1 0 445 = 85010484 00000f80 15016000 04300000 00000000 5e8d6d01 20280000 4edede0f
ffff000103533780 4046631291 S Bi:6:002:1 -115 32768 <
ffff0001035330c0 4046632173 C Bi:6:002:1 0 468 = 9c010484 00000f80 350f6000 04300000 00000000 c7906d01 20280000 4fdcdc0f
ffff0001035330c0 4046632198 S Bi:6:002:1 -115 32768 <
ffff000103533480 4046633155 C Bi:6:002:1 0 478 = a6010484 00000f80 e50d6000 04300000 00000000 95946d01 20240000 49e0e00f
ffff000103533480 4046633182 S Bi:6:002:1 -115 32768 <
ffff000103533240 4046731722 C Bi:6:002:1 0 477 = a5010484 00000f80 64036000 04300000 00000000 7e156f01 20280000 4be0e00f
ffff000103533240 4046731777 S Bi:6:002:1 -115 32768 <
ffff000103533780 4046732762 C Bi:6:002:1 0 470 = 9e010484 00000f80 6c096000 04300000 00000000 b5196f01 20260000 4de6e60f
ffff000103533780 4046732788 S Bi:6:002:1 -115 32768 <
ffff0001035330c0 4046733664 C Bi:6:002:1 0 445 = 85010484 00000f80 16016000 04300000 00000000 611d6f01 20240000 4de6e60f
ffff0001035330c0 4046733688 S Bi:6:002:1 -115 32768 <
ffff000103533480 4046734601 C Bi:6:002:1 0 468 = 9c010484 00000f80 360f6000 04300000 00000000 e1206f01 20280000 4de2e20f
ffff000103533480 4046734626 S Bi:6:002:1 -115 32768 <
ffff000103533240 4046735505 C Bi:6:002:1 0 478 = a6010484 00000f80 e60d6000 04300000 00000000 63246f01 20280000 4ee2e20f
ffff000103533240 4046735531 S Bi:6:002:1 -115 32768 <
ffff000103150540 4046748163 S Ci:6:002:0 s c0 05 004c 0000 0001 1 <
ffff000103150540 4046748227 C Ci:6:002:0 0 1 = 20
ffff000103150540 4046748356 S Co:6:002:0 s 40 05 004c 0000 0001 1 = 20
ffff000103150540 4046748494 C Co:6:002:0 0 1 >
ffff000103533780 4046834092 C Bi:6:002:1 0 477 = a5010484 00000f80 65036000 04300000 00000000 7fa57001 1e280000 4fe2e20f
ffff000103533780 4046834127 S Bi:6:002:1 -115 32768 <
ffff0001035330c0 4046835153 C Bi:6:002:1 0 470 = 9e010484 00000f80 6d096000 04300000 00000000 b3a97001 20280000 4fe1e10f
ffff0001035330c0 4046835182 S Bi:6:002:1 -115 32768 <
ffff000103533480 4046836060 C Bi:6:002:1 0 445 = 85010484 00000f80 17016000 04300000 00000000 5bad7001 20280000 48e0e00f
ffff000103533480 4046836086 S Bi:6:002:1 -115 32768 <
ffff000103533240 4046836973 C Bi:6:002:1 0 468 = 9c010484 00000f80 370f6000 04300000 00000000 cdb07001 20240000 4ae4e40f
ffff000103533240 4046836999 S Bi:6:002:1 -115 32768 <
ffff000103533780 4046837935 C Bi:6:002:1 0 478 = a6010484 00000f80 e70d6000 04300000 00000000 7fb47001 20280000 4bdfdf0f
ffff000103533780 4046837960 S Bi:6:002:1 -115 32768 <
ffff0001035330c0 4046936486 C Bi:6:002:1 0 477 = a5010484 00000f80 66036000 04300000 00000000 81357201 20280000 4ce5e50f
ffff0001035330c0 4046936530 S Bi:6:002:1 -115 32768 <
ffff000103533480 4046937472 C Bi:6:002:1 0 470 = 9e010484 00000f80 6e096000 04300000 00000000 5f397201 20260000 45e1e10f
ffff000103533480 4046937498 S Bi:6:002:1 -115 32768 <
ffff000103533240 4046938373 C Bi:6:002:1 0 445 = 85010484 00000f80 18016000 04300000 00000000 063d7201 20280000 4ddbdb0f
ffff000103533240 4046938397 S Bi:6:002:1 -115 32768 <
ffff000103533780 4046939338 C Bi:6:002:1 0 468 = 9c010484 00000f80 380f6000 04300000 00000000 bb407201 20260000 4de1e10f
ffff000103533780 4046939359 S Bi:6:002:1 -115 32768 <
ffff0001035330c0 4046940366 C Bi:6:002:1 0 478 = a6010484 00000f80 e80d6000 04300000 00000000 b6447201 20260000 49e0e00f
ffff0001035330c0 4046940387 S Bi:6:002:1 -115 32768 <
ffff000103533480 4047038924 C Bi:6:002:1 0 477 = a5010484 00000f80 67036000 04300000 00000000 82c57301 20280000 4bdcdc0f
ffff000103533480 4047038962 S Bi:6:002:1 -115 32768 <
ffff000103533240 4047039930 C Bi:6:002:1 0 470 = 9e010484 00000f80 6f096000 04300000 00000000 9cc97301 20280000 4bdada0f
ffff000103533240 4047039956 S Bi:6:002:1 -115 32768 <
ffff000103533780 4047040861 C Bi:6:002:1 0 445 = 85010484 00000f80 19016000 04300000 00000000 5ccd7301 20260000 4be0e00f
ffff000103533780 4047040887 S Bi:6:002:1 -115 32768 <
ffff0001035330c0 4047041796 C Bi:6:002:1 0 468 = 9c010484 00000f80 390f6000 04300000 00000000 ced07301 20280000 4ae0e00f
ffff0001035330c0 4047041831 S Bi:6:002:1 -115 32768 <
ffff000103533480 4047042787 C Bi:6:002:1 0 478 = a6010484 00000f80 e90d6000 04300000 00000000 b5d47301 1e260000 4de1e10f
ffff000103533480 4047042812 S Bi:6:002:1 -115 32768 <
ffff000103533240 4047141330 C Bi:6:002:1 0 477 = a5010484 00000f80 68036000 04300000 00000000 84557501 20280000 4ddcdc0f
ffff000103533240 4047141389 S Bi:6:002:1 -115 32768 <
ffff000103533780 4047142272 C Bi:6:002:1 0 470 = 9e010484 00000f80 70096000 04300000 00000000 60597501 20280000 4ee0e00f
ffff000103533780 4047142300 S Bi:6:002:1 -115 32768 <
ffff0001035330c0 4047143194 C Bi:6:002:1 0 445 = 85010484 00000f80 1a016000 04300000 00000000 1c5d7501 20280000 49dfdf0f
ffff0001035330c0 4047143219 S Bi:6:002:1 -115 32768 <
ffff000103533480 4047144114 C Bi:6:002:1 0 468 = 9c010484 00000f80 3a0f6000 04300000 00000000 94607501 20280000 4bdddd0f
ffff000103533480 4047144139 S Bi:6:002:1 -115 32768 <
ffff000103533240 4047145023 C Bi:6:002:1 0 478 = a6010484 00000f80 ea0d6000 04300000 00000000 17647501 20260000 4fe4e40f
ffff000103533240 4047145048 S Bi:6:002:1 -115 32768 <
ffff000103533780 4047243708 C Bi:6:002:1 0 477 = a5010484 00000f80 69036000 04300000 00000000 85e57601 20280000 47dddd0f
ffff000103533780 4047243742 S Bi:6:002:1 -115 32768 <
ffff0001035330c0 4047244784 C Bi:6:002:1 0 470 = 9e010484 00000f80 71096000 04300000 00000000 bae97601 20280000 4be1e10f
ffff0001035330c0 4047244811 S Bi:6:002:1 -115 32768 <
ffff000103533480 4047245644 C Bi:6:002:1 0 445 = 85010484 00000f80 1b016000 04300000 00000000 4ced7601 20280000 4ddddd0f
ffff000103533480 4047245670 S Bi:6:002:1 -115 32768 <
ffff000103533240 4047246543 C Bi:6:002:1 0 468 = 9c010484 00000f80 3b0f6000 04300000 00000000 b1f07601 20280000 48dfdf0f
ffff000103533240 4047246568 S Bi:6:002:1 -115 32768 <
ffff000103533780 4047247469 C Bi:6:002:1 0 478 = a6010484 00000f80 eb0d6000 04300000 00000000 3ef47601 20260000 49e4e40f
ffff000103533780 4047247494 S Bi:6:002:1 -115 32768 <
ffff0001035330c0 4047346138 C Bi:6:002:1 0 477 = a5010484 00000f80 6a036000 04300000 00000000 86757801 1e240000 4edfdf0f
ffff0001035330c0 4047346191 S Bi:6:002:1 -115 32768 <
ffff000103533480 4047347035 C Bi:6:002:1 0 470 = 9e010484 00000f80 72096000 04300000 00000000 3d797801 20280000 4bdcdc0f
ffff000103533480 4047347062 S Bi:6:002:1 -115 32768 <
ffff000103533240 4047348015 C Bi:6:002:1 0 445 = 85010484 00000f80 1c016000 04300000 00000000 327d7801 20280000 51dbdb0f
ffff000103533240 4047348040 S Bi:6:002:1 -115 32768 <
ffff000103533780 4047348950 C Bi:6:002:1 0 468 = 9c010484 00000f80 3c0f6000 04300000 00000000 b6807801 20280000 4cdddd0f
ffff000103533780 4047348971 S Bi:6:002:1 -115 32768 <
ffff0001035330c0 4047349861 C Bi:6:002:1 0 478 = a6010484 00000f80 ec0d6000 04300000 00000000 55847801 20280000 4cdfdf0f
ffff0001035330c0 4047349880 S Bi:6:002:1 -115 32768 <
ffff000103533480 4047448484 C Bi:6:002:1 0 477 = a5010484 00000f80 6b036000 04300000 00000000 88057a01 20260000 51e7e70f
ffff000103533480 4047448514 S Bi:6:002:1 -115 32768 <
ffff000103533240 4047449488 C Bi:6:002:1 0 470 = 9e010484 00000f80 73096000 04300000 00000000 67097a01 20280000 4bdede0f
ffff000103533240 4047449515 S Bi:6:002:1 -115 32768 <
ffff000103533780 4047450389 C Bi:6:002:1 0 445 = 85010484 00000f80 1d016000 04300000 00000000 160d7a01 20280000 4dd7d70f
ffff000103533780 4047450413 S Bi:6:002:1 -115 32768 <
ffff0001035330c0 4047451262 C Bi:6:002:1 0 468 = 9c010484 00000f80 3d0f6000 04300000 00000000 62107a01 20280000 4edbdb0f
ffff0001035330c0 4047451286 S Bi:6:002:1 -115 32768 <
ffff000103533480 4047452166 C Bi:6:002:1 0 478 = a6010484 00000f80 ed0d6000 04300000 00000000 df137a01 20280000 4be0e00f
ffff000103533480 4047452192 S Bi:6:002:1 -115 32768 <
ffff000103533240 4047533210 C Bi:6:002:1 0 86 = 1e008484 00000f20 00006900 04300000 00000000 84527b01 201a0000 43dfdf0f
ffff000103533240 4047533261 S Bi:6:002:1 -115 32768 <
ffff000103533780 4047550919 C Bi:6:002:1 0 477 = a5010484 00000f80 6c036000 04300000 00000000 89957b01 20280000 4ce9e90f
ffff000103533780 4047550948 S Bi:6:002:1 -115 32768 <
ffff0001035330c0 4047551868 C Bi:6:002:1 0 470 = 9e010484 00000f80 74096000 04300000 00000000 60997b01 20260000 4cdddd0f
ffff0001035330c0 4047551896 S Bi:6:002:1 -115 32768 <
ffff000103533480 4047552807 C Bi:6:002:1 0 445 = 85010484 00000f80 1e016000 04300000 00000000 269d7b01 20260000 4de0e00f
ffff000103533480 4047552831 S Bi:6:002:1 -115 32768 <
ffff000103533240 4047553721 C Bi:6:002:1 0 468 = 9c010484 00000f80 3e0f6000 04300000 00000000 9ba07b01 20280000 4ddddd0f
ffff000103533240 4047553745 S Bi:6:002:1 -115 32768 <
ffff000103533780 4047554677 C Bi:6:002:1 0 478 = a6010484 00000f80 ee0d6000 04300000 00000000 49a47b01 20280000 4ddfdf0f
ffff000103533780 4047554701 S Bi:6:002:1 -115 32768 <
ffff0001035330c0 4047653280 C Bi:6:002:1 0 477 = a5010484 00000f80 6d036000 04300000 00000000 8b257d01 20260000 4edcdc0f
ffff0001035330c0 4047653306 S Bi:6:002:1 -115 32768 <
ffff000103533480 4047654312 C Bi:6:002:1 0 470 = 9e010484 00000f80 75096000 04300000 00000000 83297d01 20280000 4be4e40f
ffff000103533480 4047654342 S Bi:6:002:1 -115 32768 <
ffff000103533240 4047655151 C Bi:6:002:1 0 445 = 85010484 00000f80 1f016000 04300000 00000000 f52c7d01 20280000 50dddd0f
ffff000103533240 4047655176 S Bi:6:002:1 -115 32768 <
ffff000103533780 4047656063 C Bi:6:002:1 0 468 = 9c010484 00000f80 3f0f6000 04300000 00000000 60307d01 20260000 47dcdc0f
ffff000103533780 4047656087 S Bi:6:002:1 -115 32768 <
ffff0001035330c0 4047656977 C Bi:6:002:1 0 478 = a6010484 00000f80 ef0d6000 04300000 00000000 e7337d01 20280000 4be2e20f
ffff0001035330c0 4047657003 S Bi:6:002:1 -115 32768 <
ffff000103533480 4047755626 C Bi:6:002:1 0 477 = a5010484 00000f80 6e036000 04300000 00000000 8cb57e01 20280000 4dd9d90f
ffff000103533480 4047755647 S Bi:6:002:1 -115 32768 <
ffff000103533240 4047756659 C Bi:6:002:1 0 470 = 9e010484 00000f80 76096000 04300000 00000000 4db97e01 20280000 4ae0e00f
ffff000103533240 4047756683 S Bi:6:002:1 -115 32768 <
ffff000103533780 4047757487 C Bi:6:002:1 0 445 = 85010484 00000f80 20016000 04300000 00000000 b6bc7e01 20280000 45e0e00f
ffff000103533780 4047757514 S Bi:6:002:1 -115 32768 <
ffff0001035330c0 4047758332 C Bi:6:002:1 0 468 = 9c010484 00000f80 400f6000 04300000 00000000 36c07e01 20260000 4ce2e20f
ffff0001035330c0 4047758352 S Bi:6:002:1 -115 32768 <
ffff000103533480 4047759249 C Bi:6:002:1 0 478 = a6010484 00000f80 f00d6000 04300000 00000000 c4c37e01 20280000 48dbdb0f
ffff000103533480 4047759273 S Bi:6:002:1 -115 32768 <
ffff000103150540 4047772134 S Ci:6:002:0 s c0 05 004c 0000 0001 1 <
ffff000103150540 4047772267 C Ci:6:002:0 0 1 = 20
ffff000103150540 4047772424 S Co:6:002:0 s 40 05 004c 0000 0001 1 = 20
ffff000103150540 4047772484 C Co:6:002:0 0 1 >
ffff000103150540 4047772611 S Ci:6:002:0 s c0 05 0770 0000 0004 4 <
ffff000103150540 4047772660 C Ci:6:002:0 0 4 = 00000000
ffff000103150540 4047772776 S Ci:6:002:0 s c0 05 0774 0000 0004 4 <
ffff000103150540 4047772824 C Ci:6:002:0 0 4 = 00000000
ffff000103150540 4047772951 S Co:6:002:0 s 40 05 076e 0000 0001 1 = 0c
ffff000103150540 4047772992 C Co:6:002:0 0 1 >
ffff000103150540 4047773122 S Ci:6:002:0 s c0 05 0808 0000 0004 4 <
ffff000103150540 4047773164 C Ci:6:002:0 0 4 = 3382023e
ffff000103150540 4047773282 S Ci:6:002:0 s c0 05 0a5c 0000 0002 2 <
ffff000103150540 4047773331 C Ci:6:002:0 0 2 = 0000
ffff000103150540 4047773347 S Ci:6:002:0 s c0 05 0f48 0000 0002 2 <
ffff000103150540 4047773386 C Ci:6:002:0 0 2 = 4600
ffff000102d1b480 4047773402 S Ci:6:002:0 s c0 05 0f04 0000 0004 4 <
ffff000102d1b480 4047773438 C Ci:6:002:0 0 4 = 00000000
ffff000102d1b480 4047773453 S Ci:6:002:0 s c0 05 0f14 0000 0004 4 <
ffff000102d1b480 4047773490 C Ci:6:002:0 0 4 = be001d00
ffff00011ac9ec00 4047773514 S Ci:6:002:0 s c0 05 0f10 0000 0004 4 <
ffff00011ac9ec00 4047773549 C Ci:6:002:0 0 4 = 00000000
ffff00011ac9ec00 4047773564 S Ci:6:002:0 s c0 05 0f0c 0000 0004 4 <
ffff00011ac9ec00 4047773618 C Ci:6:002:0 0 4 = 00000000
ffff00011ac9ec00 4047773632 S Ci:6:002:0 s c0 05 0f08 0000 0004 4 <
ffff00011ac9ec00 4047773667 C Ci:6:002:0 0 4 = 00002101
ffff00011ac9ec00 4047773683 S Ci:6:002:0 s c0 05 0fcc 0000 0004 4 <
ffff00011ac9ec00 4047773734 C Ci:6:002:0 0 4 = 00000000
ffff00011ac9ec00 4047773757 S Ci:6:002:0 s c0 05 09a4 0000 0004 4 <
ffff00011ac9ec00 4047773796 C Ci:6:002:0 0 4 = 80000800
ffff00011ac9ec00 4047773819 S Co:6:002:0 s 40 05 09a4 0000 0004 4 = 80000a00
ffff00011ac9ec00 4047773859 C Co:6:002:0 0 4 >
ffff000105bdce40 4047773874 S Ci:6:002:0 s c0 05 09a4 0000 0004 4 <
ffff000105bdce40 4047773909 C Ci:6:002:0 0 4 = 80000a00
ffff000105bdce40 4047773924 S Co:6:002:0 s 40 05 09a4 0000 0004 4 = 80000800
ffff000105bdce40 4047773952 C Co:6:002:0 0 4 >
ffff000105bdce40 4047773967 S Ci:6:002:0 s c0 05 0a2c 0000 0004 4 <
ffff000105bdce40 4047774008 C Ci:6:002:0 0 4 = 00809000
ffff000105bdce40 4047774032 S Co:6:002:0 s 40 05 0a2c 0000 0004 4 = 00009000
ffff000105bdce40 4047774062 C Co:6:002:0 0 4 >
ffff000105bdce40 4047774085 S Ci:6:002:0 s c0 05 0a2c 0000 0004 4 <
ffff000105bdce40 4047774123 C Ci:6:002:0 0 4 = 00009000
ffff000105bdce40 4047774146 S Co:6:002:0 s 40 05 0a2c 0000 0004 4 = 00809000
ffff000105bdce40 4047774177 C Co:6:002:0 0 4 >
ffff000105bdce40 4047774200 S Ci:6:002:0 s c0 05 0b58 0000 0004 4 <
ffff000105bdce40 4047774238 C Ci:6:002:0 0 4 = 00000000
ffff000105bdce40 4047774261 S Co:6:002:0 s 40 05 0b58 0000 0004 4 = 01000000
ffff000105bdce40 4047774291 C Co:6:002:0 0 4 >
ffff000105bdce40 4047774314 S Ci:6:002:0 s c0 05 0b58 0000 0004 4 <
ffff000105bdce40 4047774371 C Ci:6:002:0 0 4 = 01000000
ffff000105bdce40 4047774393 S Co:6:002:0 s 40 05 0b58 0000 0004 4 = 00000000
ffff000105bdce40 4047774424 C Co:6:002:0 0 4 >
ffff000105bdce40 4047774449 S Ci:6:002:0 s c0 05 0c50 0000 0004 4 <
ffff000105bdce40 4047774489 C Ci:6:002:0 0 4 = 20000000
ffff000105bdce40 4047774512 S Co:6:002:0 s 40 05 0c50 0000 0004 4 = 1e000000
ffff000105bdce40 4047774543 C Co:6:002:0 0 4 >
ffff000105bdce40 4047774567 S Ci:6:002:0 s c0 05 0e50 0000 0004 4 <
ffff000105bdce40 4047774610 C Ci:6:002:0 0 4 = 20000000
ffff000105bdce40 4047774635 S Co:6:002:0 s 40 05 0e50 0000 0004 4 = 1e000000
ffff000105bdce40 4047774666 C Co:6:002:0 0 4 >
ffff000105bdce40 4047774695 S Ci:6:002:0 s c0 05 01cc 0000 0001 1 <
ffff000105bdce40 4047774735 C Ci:6:002:0 0 1 = 00
ffff000105bdce40 4047774758 S Co:6:002:0 s 40 05 01fc 0000 0004 4 = 00000000
ffff000105bdce40 4047774789 C Co:6:002:0 0 4 >
ffff000105bdce40 4047774812 S Co:6:002:0 s 40 05 01dc 0000 0004 4 = 58000000
ffff000105bdce40 4047774858 C Co:6:002:0 0 4 >
ffff000105bdce40 4047774883 S Co:6:002:0 s 40 05 0440 0000 0004 4 = 00000000
ffff000105bdce40 4047774913 C Co:6:002:0 0 4 >
ffff000105bdce40 4047774939 S Ci:6:002:0 s c0 05 0c00 0000 0004 4 <
ffff000105bdce40 4047774995 C Ci:6:002:0 0 4 = 07000000
ffff000105bdce40 4047775019 S Ci:6:002:0 s c0 05 08b0 0000 0004 4 <
ffff000105bdce40 4047775054 C Ci:6:002:0 0 4 = 42060000
ffff000105bdce40 4047775078 S Co:6:002:0 s 40 05 08b0 0000 0004 4 = 42060000
ffff000105bdce40 4047775108 C Co:6:002:0 0 4 >
ffff000105bdce40 4047775152 S Ci:6:002:0 s c0 05 0d04 0000 0004 4 <
ffff000105bdce40 4047775186 C Ci:6:002:0 0 4 = 108d90b1
ffff000105bdce40 4047775209 S Ci:6:002:0 s c0 05 0c1c 0000 0004 4 <
ffff000105bdce40 4047775244 C Ci:6:002:0 0 4 = 0300402d
ffff000105bdce40 4047775267 S Co:6:002:0 s 40 05 0c1c 0000 0004 4 = 03000039
ffff000105bdce40 4047775304 C Co:6:002:0 0 4 >
ffff000105bdce40 4047775327 S Ci:6:002:0 s c0 05 0e1c 0000 0004 4 <
ffff000105bdce40 4047775362 C Ci:6:002:0 0 4 = 0300402d
ffff000105bdce40 4047775385 S Co:6:002:0 s 40 05 0e1c 0000 0004 4 = 0300e032
ffff000105bdce40 4047775416 C Co:6:002:0 0 4 >
ffff00011ac9e840 4047775439 S Co:6:002:0 s 40 05 0280 0000 0002 2 = 0001
ffff00011ac9e840 4047775483 C Co:6:002:0 0 2 >
ffff00011ac9e840 4047775507 S Ci:6:002:0 s c0 05 010c 0000 0001 1 <
ffff00011ac9e840 4047775548 C Ci:6:002:0 0 1 = b4
ffff00011ac9e840 4047775571 S Co:6:002:0 s 40 05 010c 0000 0001 1 = b4
ffff00011ac9e840 4047775608 C Co:6:002:0 0 1 >
ffff000103533240 4047803943 C Bi:6:002:1 0 86 = 1e008484 00000f22 00006900 04300000 00000000 68747f01 241e0000 48d3d30f
ffff000103533240 4047803965 S Bi:6:002:1 -115 32768 <
ffff000103533780 4047828631 C Bi:6:002:1 0 86 = 1e008484 00000f20 00006900 04300000 00000000 77d47f01 241a0000 49dede0f
ffff000103533780 4047828665 S Bi:6:002:1 -115 32768 <
ffff0001035330c0 4047835995 C Bi:6:002:1 0 203 = 93000484 00000f80 5d056000 04300000 00000000 ecf07f01 20240000 48e8e80f
ffff0001035330c0 4047836035 S Bi:6:002:1 -115 32768 <
ffff000103533480 4047858011 C Bi:6:002:1 0 477 = a5010484 00000f80 6f036000 04300000 00000000 8e458001 1e280000 4ddbdb0f
ffff000103533480 4047858029 S Bi:6:002:1 -115 32768 <
ffff000103533240 4047858966 C Bi:6:002:1 0 470 = 9e010484 00000f80 77096000 04300000 00000000 59498001 1e280000 4be0e00f
ffff000103533240 4047858983 S Bi:6:002:1 -115 32768 <
ffff000103533780 4047859891 C Bi:6:002:1 0 445 = 85010484 00000f80 21016000 04300000 00000000 0b4d8001 1e280000 4cdfdf0f
ffff000103533780 4047859908 S Bi:6:002:1 -115 32768 <
ffff0001035330c0 4047860763 C Bi:6:002:1 0 468 = 9c010484 00000f80 410f6000 04300000 00000000 5f508001 1e280000 4de1e10f
ffff0001035330c0 4047860780 S Bi:6:002:1 -115 32768 <
ffff000103533480 4047861681 C Bi:6:002:1 0 478 = a6010484 00000f80 f10d6000 04300000 00000000 e8538001 1e260000 49e3e30f
ffff000103533480 4047861696 S Bi:6:002:1 -115 32768 <
ffff000103533240 4047942642 C Bi:6:002:1 0 86 = 1e008484 00000f22 00006900 04300000 00000000 15928101 24200000 42cccc0f
ffff000103533240 4047942659 S Bi:6:002:1 -115 32768 <
ffff000103533780 4047960521 C Bi:6:002:1 0 477 = a5010484 00000f80 70036000 04300000 00000000 8fd58101 1e280000 4ee2e20f
ffff000103533780 4047960548 S Bi:6:002:1 -115 32768 <
ffff0001035330c0 4047961583 C Bi:6:002:1 0 470 = 9e010484 00000f80 78096000 04300000 00000000 c3d98101 20280000 48dada0f
ffff0001035330c0 4047961609 S Bi:6:002:1 -115 32768 <
ffff000103533480 4047962475 C Bi:6:002:1 0 445 = 85010484 00000f80 22016000 04300000 00000000 6edd8101 20260000 4cdfdf0f
ffff000103533480 4047962500 S Bi:6:002:1 -115 32768 <
ffff000103533240 4047963395 C Bi:6:002:1 0 468 = 9c010484 00000f80 420f6000 04300000 00000000 e8e08101 1e280000 4bdede0f
ffff000103533240 4047963420 S Bi:6:002:1 -115 32768 <
ffff000103533780 4047964391 C Bi:6:002:1 0 478 = a6010484 00000f80 f20d6000 04300000 00000000 a5e48101 1e260000 4be0e00f
ffff000103533780 4047964418 S Bi:6:002:1 -115 32768 <
ffff0001035330c0 4047967297 C Bi:6:002:1 0 86 = 1e008484 00000f20 00006900 04300000 00000000 2bf28101 24200000 48d4d40f
ffff0001035330c0 4047967324 S Bi:6:002:1 -115 32768 <
ffff000103533480 4048008862 C Bi:6:002:1 0 86 = 1e008484 00000f22 00006900 04300000 00000000 66948201 261e0000 48dede0f
ffff000103533480 4048008898 S Bi:6:002:1 -115 32768 <
ffff000103533240 4048033398 C Bi:6:002:1 0 86 = 1e008484 00000f20 00006900 04300000 00000000 6bf48201 221c0000 42f1f10f
ffff000103533240 4048033450 S Bi:6:002:1 -115 32768 <
ffff000103533780 4048062934 C Bi:6:002:1 0 477 = a5010484 00000f80 71036000 04300000 00000000 91658301 22280000 4ae5e50f
ffff000103533780 4048062970 S Bi:6:002:1 -115 32768 <
ffff0001035330c0 4048063885 C Bi:6:002:1 0 470 = 9e010484 00000f80 79096000 04300000 00000000 73698301 1e280000 4ee1e10f
ffff0001035330c0 4048063910 S Bi:6:002:1 -115 32768 <
ffff000103533480 4048064812 C Bi:6:002:1 0 445 = 85010484 00000f80 23016000 04300000 00000000 306d8301 20260000 48dddd0f
ffff000103533480 4048064840 S Bi:6:002:1 -115 32768 <
ffff000103533240 4048065709 C Bi:6:002:1 0 468 = 9c010484 00000f80 430f6000 04300000 00000000 8b708301 1e260000 4ddddd0f
ffff000103533240 4048065734 S Bi:6:002:1 -115 32768 <
ffff000103533780 4048066623 C Bi:6:002:1 0 478 = a6010484 00000f80 f30d6000 04300000 00000000 17748301 1e280000 4ce0e00f
ffff000103533780 4048066647 S Bi:6:002:1 -115 32768 <
ffff0001035330c0 4048147547 C Bi:6:002:1 0 86 = 1e008484 00000f22 00006900 04300000 00000000 19b28401 1e200000 3ee8e80f
ffff0001035330c0 4048147602 S Bi:6:002:1 -115 32768 <
ffff000103533480 4048165324 C Bi:6:002:1 0 477 = a5010484 00000f80 72036000 04300000 00000000 92f58401 1e280000 4de0e00f
ffff000103533480 4048165350 S Bi:6:002:1 -115 32768 <
ffff000103533240 4048166346 C Bi:6:002:1 0 470 = 9e010484 00000f80 7a096000 04300000 00000000 b3f98401 20260000 4be2e20f
ffff000103533240 4048166371 S Bi:6:002:1 -115 32768 <
ffff000103533780 4048167210 C Bi:6:002:1 0 445 = 85010484 00000f80 24016000 04300000 00000000 1bfd8401 1e260000 4be2e20f
ffff000103533780 4048167235 S Bi:6:002:1 -115 32768 <
ffff0001035330c0 4048168047 C Bi:6:002:1 0 468 = 9c010484 00000f80 440f6000 04300000 00000000 99008501 1e260000 4de8e80f
ffff0001035330c0 4048168065 S Bi:6:002:1 -115 32768 <
ffff000103533480 4048169045 C Bi:6:002:1 0 478 = a6010484 00000f80 f40d6000 04300000 00000000 21048501 1e280000 4ddfdf0f
ffff000103533480 4048169074 S Bi:6:002:1 -115 32768 <
ffff000103533240 4048267699 C Bi:6:002:1 0 477 = a5010484 00000f80 73036000 04300000 00000000 94858601 1e280000 4cdddd0f
ffff000103533240 4048267751 S Bi:6:002:1 -115 32768 <
ffff000103533780 4048268679 C Bi:6:002:1 0 470 = 9e010484 00000f80 7b096000 04300000 00000000 6b898601 1e260000 44e1e10f
ffff000103533780 4048268705 S Bi:6:002:1 -115 32768 <
ffff0001035330c0 4048269580 C Bi:6:002:1 0 445 = 85010484 00000f80 25016000 04300000 00000000 128d8601 1e280000 4cdddd0f
ffff0001035330c0 4048269604 S Bi:6:002:1 -115 32768 <
ffff000103533480 4048270522 C Bi:6:002:1 0 468 = 9c010484 00000f80 450f6000 04300000 00000000 a1908601 1e260000 4bdfdf0f
ffff000103533480 4048270546 S Bi:6:002:1 -115 32768 <
ffff000103533240 4048271455 C Bi:6:002:1 0 478 = a6010484 00000f80 f50d6000 04300000 00000000 34948601 1e260000 4cdbdb0f
ffff000103533240 4048271480 S Bi:6:002:1 -115 32768 <
ffff000103533780 4048370094 C Bi:6:002:1 0 477 = a5010484 00000f80 74036000 04300000 00000000 95158801 20280000 4be1e10f
ffff000103533780 4048370128 S Bi:6:002:1 -115 32768 <
ffff0001035330c0 4048371057 C Bi:6:002:1 0 470 = 9e010484 00000f80 7c096000 04300000 00000000 50198801 1e280000 4ee2e20f
ffff0001035330c0 4048371083 S Bi:6:002:1 -115 32768 <
ffff000103533480 4048371806 C Bi:6:002:1 0 445 = 85010484 00000f80 26016000 04300000 00000000 bf1c8801 1e280000 4adcdc0f
ffff000103533480 4048371824 S Bi:6:002:1 -115 32768 <
ffff000103533240 4048372820 C Bi:6:002:1 0 468 = 9c010484 00000f80 460f6000 04300000 00000000 39208801 1e260000 4de2e20f
ffff000103533240 4048372840 S Bi:6:002:1 -115 32768 <
ffff000103533780 4048373825 C Bi:6:002:1 0 478 = a6010484 00000f80 f60d6000 04300000 00000000 0d248801 1e280000 4de0e00f
ffff000103533780 4048373851 S Bi:6:002:1 -115 32768 <
ffff0001035330c0 4048472492 C Bi:6:002:1 0 477 = a5010484 00000f80 75036000 04300000 00000000 97a58901 1e280000 47dcdc0f
ffff0001035330c0 4048472544 S Bi:6:002:1 -115 32768 <
ffff000103533480 4048473460 C Bi:6:002:1 0 470 = 9e010484 00000f80 7d096000 04300000 00000000 6fa98901 1e260000 4ae3e30f
ffff000103533480 4048473496 S Bi:6:002:1 -115 32768 <
ffff000103533240 4048474459 C Bi:6:002:1 0 445 = 85010484 00000f80 27016000 04300000 00000000 5dad8901 20280000 4aeaea0f
ffff000103533240 4048474483 S Bi:6:002:1 -115 32768 <
ffff000103533780 4048475362 C Bi:6:002:1 0 468 = 9c010484 00000f80 470f6000 04300000 00000000 dbb08901 1e280000 4cdfdf0f
ffff000103533780 4048475383 S Bi:6:002:1 -115 32768 <
ffff0001035330c0 4048476202 C Bi:6:002:1 0 478 = a6010484 00000f80 f70d6000 04300000 00000000 62b48901 1e280000 4ddddd0f
ffff0001035330c0 4048476223 S Bi:6:002:1 -115 32768 <
ffff000103533480 4048574897 C Bi:6:002:1 0 477 = a5010484 00000f80 76036000 04300000 00000000 98358b01 1e280000 4adfdf0f
ffff000103533480 4048574930 S Bi:6:002:1 -115 32768 <
ffff000103533240 4048575891 C Bi:6:002:1 0 470 = 9e010484 00000f80 7e096000 04300000 00000000 79398b01 1e280000 4ae0e00f
ffff000103533240 4048575917 S Bi:6:002:1 -115 32768 <
ffff000103533780 4048576826 C Bi:6:002:1 0 445 = 85010484 00000f80 28016000 04300000 00000000 4a3d8b01 20280000 4de4e40f
ffff000103533780 4048576850 S Bi:6:002:1 -115 32768 <
ffff0001035330c0 4048577781 C Bi:6:002:1 0 468 = 9c010484 00000f80 480f6000 04300000 00000000 de408b01 1e260000 48dfdf0f
ffff0001035330c0 4048577805 S Bi:6:002:1 -115 32768 <
ffff000103533480 4048578755 C Bi:6:002:1 0 478 = a6010484 00000f80 f80d6000 04300000 00000000 a0448b01 1e260000 47dfdf0f
ffff000103533480 4048578780 S Bi:6:002:1 -115 32768 <
ffff000103533240 4048677322 C Bi:6:002:1 0 477 = a5010484 00000f80 77036000 04300000 00000000 9ac58c01 1e280000 4fdfdf0f
ffff000103533240 4048677370 S Bi:6:002:1 -115 32768 <
ffff000103533780 4048678289 C Bi:6:002:1 0 470 = 9e010484 00000f80 7f096000 04300000 00000000 79c98c01 1e280000 4adddd0f
ffff000103533780 4048678318 S Bi:6:002:1 -115 32768 <
ffff0001035330c0 4048679154 C Bi:6:002:1 0 445 = 85010484 00000f80 29016000 04300000 00000000 fccc8c01 1e260000 4fe1e10f
ffff0001035330c0 4048679177 S Bi:6:002:1 -115 32768 <
ffff000103533480 4048680249 C Bi:6:002:1 0 468 = 9c010484 00000f80 490f6000 04300000 00000000 1ed18c01 1e280000 4de4e40f
ffff000103533480 4048680273 S Bi:6:002:1 -115 32768 <
ffff000103533240 4048681202 C Bi:6:002:1 0 478 = a6010484 00000f80 f90d6000 04300000 00000000 bed48c01 1e260000 48dfdf0f
ffff000103533240 4048681228 S Bi:6:002:1 -115 32768 <
