ffff000103533480 4024276735 C Bi:6:002:1 0 471 = 9f010484 00000f80 4b066000 04300000 00000000 37721800 46420080 85dbdb01
ffff000103533480 4024276821 S Bi:6:002:1 -115 32768 <
ffff000103533240 4024277555 C Bi:6:002:1 0 446 = 86010484 00000f80 610c6000 04300000 00000000 c3751800 46400080 88dbdb01
ffff000103533240 4024277580 S Bi:6:002:1 -115 32768 <
ffff000103533780 4024278475 C Bi:6:002:1 0 469 = 9d010484 00000f80 06056000 04300000 00000000 36791800 46400080 86dbdb01
ffff000103533780 4024278500 S Bi:6:002:1 -115 32768 <
ffff0001035330c0 4024279386 C Bi:6:002:1 0 479 = a7010484 00000f80 41036000 04300000 00000000 bb7c1800 46400080 83dfdf01
ffff0001035330c0 4024279412 S Bi:6:002:1 -115 32768 <
ffff000103533480 4024378070 C Bi:6:002:1 0 478 = a6010484 00000f80 c5086000 04300000 00000000 1afe1900 46420080 86dbdb01
ffff000103533480 4024378103 S Bi:6:002:1 -115 32768 <
ffff000103533240 4024379962 C Bi:6:002:1 0 446 = 86010484 00000f80 620c6000 04300000 00000000 c9051a00 46400080 87dada01
ffff000103533240 4024379988 S Bi:6:002:1 -115 32768 <
ffff000103533780 4024380844 C Bi:6:002:1 0 469 = 9d010484 00000f80 07056000 04300000 00000000 2d091a00 46420080 88dbdb01
ffff000103533780 4024380868 S Bi:6:002:1 -115 32768 <
ffff0001035330c0 4024456570 C Bi:6:002:1 0 86 = 1e008484 00070f22 a5016900 04380000 00000000 ed321b00 36420080 88e9e901
ffff0001035330c0 4024456617 S Bi:6:002:1 -115 32768 <
ffff000103533480 4024481493 C Bi:6:002:1 0 471 = 9f010484 00000f80 4d066000 04300000 00000000 24921b00 46400080 85dada01
ffff000103533480 4024481526 S Bi:6:002:1 -115 32768 <
ffff000103533240 4024484155 C Bi:6:002:1 0 479 = a7010484 00000f80 43036000 04300000 00000000 9a9c1b00 46400080 85dbdb01
ffff000103533240 4024484180 S Bi:6:002:1 -115 32768 <
ffff000103533780 4024494654 C Bi:6:002:1 0 86 = 1e008484 00070f20 a6016900 04380000 00000000 abc71b00 3c420080 88eaea01
ffff000103533780 4024494680 S Bi:6:002:1 -115 32768 <
ffff0001035330c0 4024582868 C Bi:6:002:1 0 478 = a6010484 00000f80 c7086000 04300000 00000000 1e1e1d00 46420080 86dbdb01
ffff0001035330c0 4024582902 S Bi:6:002:1 -115 32768 <
ffff000103533480 4024584762 C Bi:6:002:1 0 446 = 86010484 00000f80 640c6000 04300000 00000000 c4251d00 46400080 86dbdb01
ffff000103533480 4024584788 S Bi:6:002:1 -115 32768 <
ffff000103533240 4024586601 C Bi:6:002:1 0 479 = a7010484 00000f80 44036000 04300000 00000000 e02c1d00 46400080 82dcdc01
ffff000103533240 4024586627 S Bi:6:002:1 -115 32768 <
ffff000103533780 4024686289 C Bi:6:002:1 0 471 = 9f010484 00000f80 4f066000 04300000 00000000 28b21e00 46420080 84dada01
ffff000103533780 4024686321 S Bi:6:002:1 -115 32768 <
ffff0001035330c0 4024688061 C Bi:6:002:1 0 469 = 9d010484 00000f80 0a056000 04300000 00000000 25b91e00 46420080 84dcdc01
ffff0001035330c0 4024688087 S Bi:6:002:1 -115 32768 <
ffff000103533480 4024688977 C Bi:6:002:1 0 479 = a7010484 00000f80 45036000 04300000 00000000 bcbc1e00 46400080 83dddd01
ffff000103533480 4024689003 S Bi:6:002:1 -115 32768 <
ffff000102da4300 4024764184 S Ci:6:002:0 s c0 05 004c 0000 0001 1 <
ffff000102da4300 4024764314 C Ci:6:002:0 0 1 = 20
ffff000102da4300 4024764524 S Co:6:002:0 s 40 05 004c 0000 0001 1 = 20
ffff000102da4300 4024764679 C Co:6:002:0 0 1 >
ffff000103533240 4024787670 C Bi:6:002:1 0 478 = a6010484 00000f80 c9086000 04300000 00000000 213e2000 44400080 86dbdb01
ffff000103533240 4024787698 S Bi:6:002:1 -115 32768 <
ffff000103533780 4024890065 C Bi:6:002:1 0 478 = a6010484 00000f80 ca086000 04300000 00000000 23ce2100 46400080 86dbdb01
ffff000103533780 4024890112 S Bi:6:002:1 -115 32768 <
ffff0001035330c0 4024892125 C Bi:6:002:1 0 446 = 86010484 00000f80 670c6000 04300000 00000000 3ed62100 44400080 85dcdc01
ffff0001035330c0 4024892151 S Bi:6:002:1 -115 32768 <
ffff000103533480 4024893039 C Bi:6:002:1 0 469 = 9d010484 00000f80 0c056000 04300000 00000000 cbd92100 46400080 85dbdb01
ffff000103533480 4024893065 S Bi:6:002:1 -115 32768 <
ffff000103533240 4024893931 C Bi:6:002:1 0 479 = a7010484 00000f80 47036000 04300000 00000000 4edd2100 46400080 89dada01
ffff000103533240 4024893956 S Bi:6:002:1 -115 32768 <
ffff000103533780 4024992448 C Bi:6:002:1 0 478 = a6010484 00000f80 cb086000 04300000 00000000 255e2300 44420080 88dbdb01
ffff000103533780 4024992483 S Bi:6:002:1 -115 32768 <
ffff0001035330c0 4024994366 C Bi:6:002:1 0 446 = 86010484 00000f80 680c6000 04300000 00000000 c3652300 46400080 86dbdb01
ffff0001035330c0 4024994395 S Bi:6:002:1 -115 32768 <
ffff000103533480 4024995255 C Bi:6:002:1 0 469 = 9d010484 00000f80 0d056000 04300000 00000000 29692300 44400080 86dbdb01
ffff000103533480 4024995280 S Bi:6:002:1 -115 32768 <
ffff000103533240 4025094843 C Bi:6:002:1 0 478 = a6010484 00000f80 cc086000 04300000 00000000 27ee2400 46400080 86dddd01
ffff000103533240 4025094876 S Bi:6:002:1 -115 32768 <
ffff000103533780 4025095845 C Bi:6:002:1 0 471 = 9f010484 00000f80 53066000 04300000 00000000 24f22400 44420080 88dcdc01
ffff000103533780 4025095867 S Bi:6:002:1 -115 32768 <
ffff0001035330c0 4025098557 C Bi:6:002:1 0 479 = a7010484 00000f80 49036000 04300000 00000000 adfc2400 44420080 86dbdb01
ffff0001035330c0 4025098579 S Bi:6:002:1 -115 32768 <
ffff000103533000 4025193758 S Ci:6:002:0 s c0 05 0454 0000 0001 1 <
ffff000103533000 4025193952 C Ci:6:002:0 0 1 = 00
ffff000103533000 4025193994 S Ci:6:002:0 s c0 05 0860 0000 0004 4 <
ffff000103533000 4025194100 C Ci:6:002:0 0 4 = 21c32969
ffff000103533000 4025194146 S Co:6:002:0 s 40 05 0860 0000 0004 4 = 21c3d572
ffff000103533000 4025194248 C Co:6:002:0 0 4 >
ffff000102da4300 4025194288 S Ci:6:002:0 s c0 05 0c00 0000 0004 4 <
ffff000102da4300 4025194399 C Ci:6:002:0 0 4 = 07000000
ffff000102da4300 4025194447 S Ci:6:002:0 s c0 05 08b0 0000 0004 4 <
ffff000102da4300 4025194558 C Ci:6:002:0 0 4 = 00060000
ffff000102da4300 4025194630 S Co:6:002:0 s 40 05 08b0 0000 0004 4 = 18060000
ffff000102da4300 4025194736 C Co:6:002:0 0 4 >
ffff000102da4300 4025194804 S Ci:6:002:0 s c0 05 0d04 0000 0004 4 <
ffff000102da4300 4025194924 C Ci:6:002:0 0 4 = 2a7191b1
ffff000102da4300 4025194970 S Co:6:002:0 s 40 05 0c90 0000 0004 4 = 2a708001
ffff000102da4300 4025195076 C Co:6:002:0 0 4 >
ffff000102da4300 4025195136 S Ci:6:002:0 s c0 05 08ac 0000 0004 4 <
ffff000102da4300 4025195256 C Ci:6:002:0 0 4 = 0afaf00f
ffff000102da4300 4025195304 S Co:6:002:0 s 40 05 08ac 0000 0004 4 = 0afaf00f
ffff000102da4300 4025195420 C Co:6:002:0 0 4 >
ffff000102da4300 4025195466 S Ci:6:002:0 s c0 05 08ac 0000 0004 4 <
ffff000102da4300 4025195587 C Ci:6:002:0 0 4 = 0afaf00f
ffff000102da4300 4025195632 S Co:6:002:0 s 40 05 08ac 0000 0004 4 = 0afaf00f
ffff000102da4300 4025195738 C Co:6:002:0 0 4 >
ffff000102da4300 4025195784 S Ci:6:002:0 s c0 05 08c4 0000 0004 4 <
ffff000102da4300 4025195923 C Ci:6:002:0 0 4 = 00000000
ffff000102da4300 4025195968 S Co:6:002:0 s 40 05 08c4 0000 0004 4 = 00000000
ffff000102da4300 4025196085 C Co:6:002:0 0 4 >
ffff000102da4300 4025196133 S Ci:6:002:0 s c0 05 0c00 0000 0004 4 <
ffff000102da4300 4025196255 C Ci:6:002:0 0 4 = 07000000
ffff000102da4300 4025196301 S Ci:6:002:0 s c0 05 08b0 0000 0004 4 <
ffff000102da4300 4025196425 C Ci:6:002:0 0 4 = 18060000
ffff000102da4300 4025196471 S Co:6:002:0 s 40 05 08b0 0000 0004 4 = 18060000
ffff000102da4300 4025196577 C Co:6:002:0 0 4 >
ffff000102da4300 4025196645 S Ci:6:002:0 s c0 05 0d04 0000 0004 4 <
ffff000102da4300 4025196765 C Ci:6:002:0 0 4 = 2a7090b1
ffff000102da4300 4025196811 S Co:6:002:0 s 40 05 0c90 0000 0004 4 = 01708001
ffff000102da4300 4025196920 C Co:6:002:0 0 4 >
ffff000102da4300 4025196981 S Ci:6:002:0 s c0 05 0e00 0000 0004 4 <
ffff000102da4300 4025197101 C Ci:6:002:0 0 4 = 07000000
ffff000102da4300 4025197147 S Ci:6:002:0 s c0 05 08b0 0000 0004 4 <
ffff000102da4300 4025197259 C Ci:6:002:0 0 4 = 18060000
ffff000102da4300 4025197304 S Co:6:002:0 s 40 05 08b0 0000 0004 4 = 18060000
ffff000102da4300 4025197420 C Co:6:002:0 0 4 >
ffff000102da4300 4025197487 S Ci:6:002:0 s c0 05 0d44 0000 0004 4 <
ffff000102da4300 4025197607 C Ci:6:002:0 0 4 = 2a7191b1
ffff000102da4300 4025197653 S Co:6:002:0 s 40 05 0e90 0000 0004 4 = 2a708001
ffff000102da4300 4025197759 C Co:6:002:0 0 4 >
ffff000102da4300 4025197819 S Ci:6:002:0 s c0 05 08ac 0000 0004 4 <
ffff000102da4300 4025197939 C Ci:6:002:0 0 4 = 0afaf00f
ffff000102da4300 4025197993 S Co:6:002:0 s 40 05 08ac 0000 0004 4 = 0afaf00f
ffff000102da4300 4025198094 C Co:6:002:0 0 4 >
ffff000102da4300 4025198141 S Ci:6:002:0 s c0 05 08ac 0000 0004 4 <
ffff000102da4300 4025198261 C Ci:6:002:0 0 4 = 0afaf00f
ffff000102da4300 4025198308 S Co:6:002:0 s 40 05 08ac 0000 0004 4 = 0afaf00f
ffff000102da4300 4025198420 C Co:6:002:0 0 4 >
ffff000102da4300 4025198467 S Ci:6:002:0 s c0 05 08c4 0000 0004 4 <
ffff000102da4300 4025198588 C Ci:6:002:0 0 4 = 00000000
ffff000102da4300 4025198633 S Co:6:002:0 s 40 05 08c4 0000 0004 4 = 00000000
ffff000102da4300 4025198740 C Co:6:002:0 0 4 >
ffff000102da4300 4025198786 S Ci:6:002:0 s c0 05 0e00 0000 0004 4 <
ffff000102da4300 4025198923 C Ci:6:002:0 0 4 = 07000000
ffff000102da4300 4025198971 S Ci:6:002:0 s c0 05 08b0 0000 0004 4 <
ffff000102da4300 4025199082 C Ci:6:002:0 0 4 = 18060000
ffff000102da4300 4025199126 S Co:6:002:0 s 40 05 08b0 0000 0004 4 = 18060000
ffff000102da4300 4025199233 C Co:6:002:0 0 4 >
ffff000102da4300 4025199301 S Ci:6:002:0 s c0 05 0d44 0000 0004 4 <
ffff000102da4300 4025199425 C Ci:6:002:0 0 4 = 2a7090b1
ffff000102da4300 4025199470 S Co:6:002:0 s 40 05 0e90 0000 0004 4 = 01708001
ffff000102da4300 4025199576 C Co:6:002:0 0 4 >
ffff000102da4300 4025199635 S Ci:6:002:0 s c0 05 0668 0000 0002 2 <
ffff000102da4300 4025199756 C Ci:6:002:0 0 2 = 0010
ffff000102da4300 4025199801 S Co:6:002:0 s 40 05 0668 0000 0002 2 = 0010
ffff000102da4300 4025199920 C Co:6:002:0 0 2 >
ffff000102da4300 4025199966 S Co:6:002:0 s 40 05 0483 0000 0001 1 = 00
ffff000102da4300 4025200079 C Co:6:002:0 0 1 >
ffff000102da4300 4025200125 S Ci:6:002:0 s c0 05 0837 0000 0001 1 <
ffff000102da4300 4025200237 C Ci:6:002:0 0 1 = 00
ffff000102da4300 4025200284 S Ci:6:002:0 s c0 05 08ac 0000 0004 4 <
ffff000102da4300 4025200395 C Ci:6:002:0 0 4 = 0afaf00f
ffff000102da4300 4025200442 S Co:6:002:0 s 40 05 08ac 0000 0004 4 = 08faf00f
ffff000102da4300 4025200547 C Co:6:002:0 0 4 >
ffff000102da4300 4025200594 S Ci:6:002:0 s c0 05 08c4 0000 0004 4 <
ffff000102da4300 4025200714 C Ci:6:002:0 0 4 = 00000000
ffff000102da4300 4025200759 S Co:6:002:0 s 40 05 08c4 0000 0004 4 = 00000000
ffff000102da4300 4025200865 C Co:6:002:0 0 4 >
ffff000102da4300 4025200911 S Ci:6:002:0 s c0 05 0848 0000 0004 4 <
ffff000102da4300 4025201048 C Ci:6:002:0 0 4 = 8bff1062
ffff000102da4300 4025201093 S Co:6:002:0 s 40 05 0848 0000 0004 4 = 8bffd061
ffff000102da4300 4025201200 C Co:6:002:0 0 4 >
ffff000102da4300 4025201246 S Ci:6:002:0 s c0 05 08ac 0000 0004 4 <
ffff000102da4300 4025201366 C Ci:6:002:0 0 4 = 08faf00f
ffff000102da4300 4025201412 S Co:6:002:0 s 40 05 08ac 0000 0004 4 = 08faf00f
ffff000102da4300 4025201518 C Co:6:002:0 0 4 >
ffff000102da4300 4025201564 S Ci:6:002:0 s c0 05 08ac 0000 0004 4 <
ffff000102da4300 4025201685 C Ci:6:002:0 0 4 = 08faf00f
ffff000102da4300 4025201730 S Co:6:002:0 s 40 05 08ac 0000 0004 4 = 08faf00f
ffff000102da4300 4025201836 C Co:6:002:0 0 4 >
ffff000102da4300 4025201883 S Ci:6:002:0 s c0 05 08c4 0000 0004 4 <
ffff000102da4300 4025202004 C Ci:6:002:0 0 4 = 00000000
ffff000102da4300 4025202050 S Co:6:002:0 s 40 05 08c4 0000 0004 4 = 00000000
ffff000102da4300 4025202169 C Co:6:002:0 0 4 >
ffff000102da4300 4025202215 S Ci:6:002:0 s c0 05 0c00 0000 0004 4 <
ffff000102da4300 4025202336 C Ci:6:002:0 0 4 = 07000000
ffff000102da4300 4025202381 S Ci:6:002:0 s c0 05 08b0 0000 0004 4 <
ffff000102da4300 4025202493 C Ci:6:002:0 0 4 = 18060000
ffff000102da4300 4025202538 S Co:6:002:0 s 40 05 08b0 0000 0004 4 = 18060000
ffff000102da4300 4025202645 C Co:6:002:0 0 4 >
ffff000102da4300 4025202712 S Ci:6:002:0 s c0 05 0d04 0000 0004 4 <
ffff000102da4300 4025202832 C Ci:6:002:0 0 4 = 017090b1
ffff000102da4300 4025202877 S Co:6:002:0 s 40 05 0c90 0000 0004 4 = 017c8001
ffff000102da4300 4025202984 C Co:6:002:0 0 4 >
ffff000102da4300 4025203044 S Ci:6:002:0 s c0 05 0e00 0000 0004 4 <
ffff000102da4300 4025203175 C Ci:6:002:0 0 4 = 07000000
ffff000102da4300 4025203221 S Ci:6:002:0 s c0 05 08b0 0000 0004 4 <
ffff000102da4300 4025203333 C Ci:6:002:0 0 4 = 18060000
ffff000102da4300 4025203378 S Co:6:002:0 s 40 05 08b0 0000 0004 4 = 18060000
ffff000102da4300 4025203484 C Co:6:002:0 0 4 >
ffff000102da4300 4025203552 S Ci:6:002:0 s c0 05 0d44 0000 0004 4 <
ffff000102da4300 4025203675 C Ci:6:002:0 0 4 = 017090b1
ffff000102da4300 4025203721 S Co:6:002:0 s 40 05 0e90 0000 0004 4 = 017c8001
ffff000102da4300 4025203827 C Co:6:002:0 0 4 >
ffff000102da4300 4025203889 S Ci:6:002:0 s c0 05 0073 0000 0001 1 <
ffff000102da4300 4025204007 C Ci:6:002:0 0 1 = 07
ffff000102da4300 4025204054 S Co:6:002:0 s 40 05 0073 0000 0001 1 = 07
ffff000102da4300 4025204196 C Co:6:002:0 0 1 >
ffff000102da4300 4025204265 S Ci:6:002:0 s c0 05 0c20 0000 0004 4 <
ffff000102da4300 4025204383 C Ci:6:002:0 0 4 = 12121212
ffff000102da4300 4025204428 S Co:6:002:0 s 40 05 0c20 0000 0004 4 = 13131313
ffff000102da4300 4025204545 C Co:6:002:0 0 4 >
ffff000102da4300 4025204593 S Ci:6:002:0 s c0 05 0c24 0000 0004 4 <
ffff000102da4300 4025204712 C Ci:6:002:0 0 4 = 12121212
ffff000102da4300 4025204757 S Co:6:002:0 s 40 05 0c24 0000 0004 4 = 20202020
ffff000102da4300 4025204863 C Co:6:002:0 0 4 >
ffff000102da4300 4025204910 S Ci:6:002:0 s c0 05 0c28 0000 0004 4 <
ffff000102da4300 4025205046 C Ci:6:002:0 0 4 = 12121212
ffff000102da4300 4025205092 S Co:6:002:0 s 40 05 0c28 0000 0004 4 = 20201e1c
ffff000102da4300 4025205198 C Co:6:002:0 0 4 >
ffff000102da4300 4025205244 S Ci:6:002:0 s c0 05 0c2c 0000 0004 4 <
ffff000102da4300 4025205362 C Ci:6:002:0 0 4 = 12121212
ffff000102da4300 4025205407 S Co:6:002:0 s 40 05 0c2c 0000 0004 4 = 20202020
ffff000102da4300 4025205513 C Co:6:002:0 0 4 >
ffff000102da4300 4025205560 S Ci:6:002:0 s c0 05 0c30 0000 0004 4 <
ffff000102da4300 4025205677 C Ci:6:002:0 0 4 = 12121212
ffff000102da4300 4025205723 S Co:6:002:0 s 40 05 0c30 0000 0004 4 = 20201e1c
ffff000102da4300 4025205829 C Co:6:002:0 0 4 >
ffff000102da4300 4025205876 S Ci:6:002:0 s c0 05 0c34 0000 0004 4 <
ffff000102da4300 4025205993 C Ci:6:002:0 0 4 = 12121212
ffff000102da4300 4025206039 S Co:6:002:0 s 40 05 0c34 0000 0004 4 = 20202020
ffff000102da4300 4025206145 C Co:6:002:0 0 4 >
ffff000102da4300 4025206191 S Ci:6:002:0 s c0 05 0c38 0000 0004 4 <
ffff000102da4300 4025206312 C Ci:6:002:0 0 4 = 12121212
ffff000102da4300 4025206358 S Co:6:002:0 s 40 05 0c38 0000 0004 4 = 201e1c1a
ffff000102da4300 4025206464 C Co:6:002:0 0 4 >
ffff000102da4300 4025206510 S Ci:6:002:0 s c0 05 0c3c 0000 0004 4 <
ffff000102da4300 4025206628 C Ci:6:002:0 0 4 = 12121212
ffff000102da4300 4025206673 S Co:6:002:0 s 40 05 0c3c 0000 0004 4 = 20202020
ffff000102da4300 4025206791 C Co:6:002:0 0 4 >
ffff000102da4300 4025206838 S Ci:6:002:0 s c0 05 0c40 0000 0004 4 <
ffff000102da4300 4025206956 C Ci:6:002:0 0 4 = 12121212
ffff000102da4300 4025207001 S Co:6:002:0 s 40 05 0c40 0000 0004 4 = 20201e1c
ffff000102da4300 4025207109 C Co:6:002:0 0 4 >
ffff000102da4300 4025207155 S Ci:6:002:0 s c0 05 0c44 0000 0004 4 <
ffff000102da4300 4025207291 C Ci:6:002:0 0 4 = 12121212
ffff000102da4300 4025207336 S Co:6:002:0 s 40 05 0c44 0000 0004 4 = 1a181e1e
ffff000102da4300 4025207442 C Co:6:002:0 0 4 >
ffff000102da4300 4025207488 S Ci:6:002:0 s c0 05 0c48 0000 0004 4 <
ffff000102da4300 4025207607 C Ci:6:002:0 0 4 = 12121212
ffff000102da4300 4025207652 S Co:6:002:0 s 40 05 0c48 0000 0004 4 = 1e1e1e1e
ffff000102da4300 4025207758 C Co:6:002:0 0 4 >
ffff000102da4300 4025207805 S Ci:6:002:0 s c0 05 0c4c 0000 0004 4 <
ffff000102da4300 4025207924 C Ci:6:002:0 0 4 = 12121212
ffff000102da4300 4025207969 S Co:6:002:0 s 40 05 0c4c 0000 0004 4 = 1c1a1816
ffff000102da4300 4025208080 C Co:6:002:0 0 4 >
ffff000102d1d000 4025208128 S Ci:6:002:0 s c0 05 0c54 0000 0004 4 <
ffff000102d1d000 4025208260 C Ci:6:002:0 0 4 = 1c120800
ffff000102d1d000 4025208308 S Co:6:002:0 s 40 05 0c54 0000 0004 4 = 120a0400
ffff000102d1d000 4025208420 C Co:6:002:0 0 4 >
ffff000102d1d000 4025208467 S Ci:6:002:0 s c0 05 0e20 0000 0004 4 <
ffff000102d1d000 4025208587 C Ci:6:002:0 0 4 = 12121212
ffff000102d1d000 4025208632 S Co:6:002:0 s 40 05 0e20 0000 0004 4 = 14141414
ffff000102d1d000 4025208738 C Co:6:002:0 0 4 >
ffff000102d1d000 4025208785 S Ci:6:002:0 s c0 05 0e24 0000 0004 4 <
ffff000102d1d000 4025208923 C Ci:6:002:0 0 4 = 12121212
ffff000102d1d000 4025208970 S Co:6:002:0 s 40 05 0e24 0000 0004 4 = 1d1d1d1d
ffff000102d1d000 4025209076 C Co:6:002:0 0 4 >
ffff000102d1d000 4025209122 S Ci:6:002:0 s c0 05 0e28 0000 0004 4 <
ffff000102d1d000 4025209241 C Ci:6:002:0 0 4 = 12121212
ffff000102d1d000 4025209287 S Co:6:002:0 s 40 05 0e28 0000 0004 4 = 1d1d1b19
ffff000102d1d000 4025209393 C Co:6:002:0 0 4 >
ffff000102d1d000 4025209439 S Ci:6:002:0 s c0 05 0e2c 0000 0004 4 <
ffff000102d1d000 4025209558 C Ci:6:002:0 0 4 = 12121212
ffff000102d1d000 4025209603 S Co:6:002:0 s 40 05 0e2c 0000 0004 4 = 1f1f1f1f
ffff000102d1d000 4025209709 C Co:6:002:0 0 4 >
ffff000102d1d000 4025209756 S Ci:6:002:0 s c0 05 0e30 0000 0004 4 <
ffff000102d1d000 4025209874 C Ci:6:002:0 0 4 = 12121212
ffff000102d1d000 4025209919 S Co:6:002:0 s 40 05 0e30 0000 0004 4 = 1f1f1d1b
ffff000102d1d000 4025210038 C Co:6:002:0 0 4 >
ffff000102d1d000 4025210085 S Ci:6:002:0 s c0 05 0e34 0000 0004 4 <
ffff000102d1d000 4025210204 C Ci:6:002:0 0 4 = 12121212
ffff000102d1d000 4025210250 S Co:6:002:0 s 40 05 0e34 0000 0004 4 = 1f1f1f1f
ffff000102d1d000 4025210356 C Co:6:002:0 0 4 >
ffff000102d1d000 4025210402 S Ci:6:002:0 s c0 05 0e38 0000 0004 4 <
ffff000102d1d000 4025210521 C Ci:6:002:0 0 4 = 12121212
ffff000102d1d000 4025210566 S Co:6:002:0 s 40 05 0e38 0000 0004 4 = 1f1d1b19
ffff000102d1d000 4025210672 C Co:6:002:0 0 4 >
ffff000102d1d000 4025210719 S Ci:6:002:0 s c0 05 0e3c 0000 0004 4 <
ffff000102d1d000 4025210837 C Ci:6:002:0 0 4 = 12121212
ffff000102d1d000 4025210883 S Co:6:002:0 s 40 05 0e3c 0000 0004 4 = 1f1f1f1f
ffff000102d1d000 4025210989 C Co:6:002:0 0 4 >
ffff000102d1d000 4025211035 S Ci:6:002:0 s c0 05 0e40 0000 0004 4 <
ffff000102d1d000 4025211172 C Ci:6:002:0 0 4 = 12121212
ffff000102d1d000 4025211217 S Co:6:002:0 s 40 05 0e40 0000 0004 4 = 1f1f1d1b
ffff000102d1d000 4025211324 C Co:6:002:0 0 4 >
ffff000102d1d000 4025211370 S Ci:6:002:0 s c0 05 0e44 0000 0004 4 <
ffff000102d1d000 4025211489 C Ci:6:002:0 0 4 = 12121212
ffff000102d1d000 4025211535 S Co:6:002:0 s 40 05 0e44 0000 0004 4 = 19171d1d
ffff000102d1d000 4025211640 C Co:6:002:0 0 4 >
ffff000102d1d000 4025211687 S Ci:6:002:0 s c0 05 0e48 0000 0004 4 <
ffff000102d1d000 4025211805 C Ci:6:002:0 0 4 = 12121212
ffff000102d1d000 4025211851 S Co:6:002:0 s 40 05 0e48 0000 0004 4 = 1d1d1d1d
ffff000102d1d000 4025211957 C Co:6:002:0 0 4 >
ffff000102d1d000 4025212021 S Ci:6:002:0 s c0 05 0e4c 0000 0004 4 <
ffff000102d1d000 4025212186 C Ci:6:002:0 0 4 = 12121212
ffff000102d1d000 4025212233 S Co:6:002:0 s 40 05 0e4c 0000 0004 4 = 1b191715
ffff000102d1d000 4025212340 C Co:6:002:0 0 4 >
ffff000102d1d000 4025212387 S Ci:6:002:0 s c0 05 0e54 0000 0004 4 <
ffff000102d1d000 4025212507 C Ci:6:002:0 0 4 = 1c120800
ffff000102d1d000 4025212552 S Co:6:002:0 s 40 05 0e54 0000 0004 4 = 11090300
ffff000102d1d000 4025212670 C Co:6:002:0 0 4 >
ffff000102d1d000 4025212731 S Ci:6:002:0 s c0 05 0454 0000 0001 1 <
ffff000102d1d000 4025212856 C Ci:6:002:0 0 1 = 00
ffff000102d1d000 4025212902 S Ci:6:002:0 s c0 05 0454 0000 0001 1 <
ffff000102d1d000 4025213011 C Ci:6:002:0 0 1 = 00
ffff000102d1d000 4025213056 S Co:6:002:0 s 40 05 0454 0000 0001 1 = 80
ffff000102d1d000 4025213170 C Co:6:002:0 0 1 >
ffff000102d1d000 4025213217 S Ci:6:002:0 s c0 05 041a 0000 0002 2 <
ffff000102d1d000 4025213336 C Ci:6:002:0 0 2 = ff0f
ffff000102d1d000 4025213382 S Ci:6:002:0 s c0 05 0808 0000 0004 4 <
ffff000102d1d000 4025213491 C Ci:6:002:0 0 4 = 3382023e
ffff000102d1d000 4025213538 S Co:6:002:0 s 40 05 0808 0000 0004 4 = 3382023e
ffff000102d1d000 4025213668 C Co:6:002:0 0 4 >
ffff000102d1d000 4025213714 S Ci:6:002:0 s c0 05 0834 0000 0004 4 <
ffff000102d1d000 4025213824 C Ci:6:002:0 0 4 = 05a73700
ffff000102d1d000 4025213869 S Co:6:002:0 s 40 05 0834 0000 0004 4 = 06a73700
ffff000102d1d000 4025213976 C Co:6:002:0 0 4 >
ffff000102d1d000 4025214023 S Ci:6:002:0 s c0 05 0830 0000 0004 4 <
ffff000102d1d000 4025214141 C Ci:6:002:0 0 4 = b8eeaa2e
ffff000102d1d000 4025214186 S Co:6:002:0 s 40 05 0830 0000 0004 4 = b8aeaa2e
ffff000102d1d000 4025214295 C Co:6:002:0 0 4 >
ffff000102d1d000 4025214343 S Ci:6:002:0 s c0 05 0830 0000 0004 4 <
ffff000102d1d000 4025214463 C Ci:6:002:0 0 4 = b8aeaa2e
ffff000102d1d000 4025214509 S Co:6:002:0 s 40 05 0830 0000 0004 4 = b8aeaa2e
ffff000102d1d000 4025214615 C Co:6:002:0 0 4 >
ffff000102d1d000 4025214661 S Ci:6:002:0 s c0 05 082c 0000 0004 4 <
ffff000102d1d000 4025214797 C Ci:6:002:0 0 4 = dc832000
ffff000102d1d000 4025214842 S Co:6:002:0 s 40 05 082c 0000 0004 4 = dd832000
ffff000102d1d000 4025214948 C Co:6:002:0 0 4 >
ffff000102d1d000 4025214995 S Co:6:002:0 s 40 05 0cb0 0000 0004 4 = 17773354
ffff000102d1d000 4025215108 C Co:6:002:0 0 4 >
ffff000102d1d000 4025215153 S Co:6:002:0 s 40 05 0eb0 0000 0004 4 = 17773354
ffff000102d1d000 4025215259 C Co:6:002:0 0 4 >
ffff000102d1d000 4025215309 S Ci:6:002:0 s c0 05 0cb4 0000 0004 4 <
ffff000102d1d000 4025215428 C Ci:6:002:0 0 4 = 77000001
ffff000102d1d000 4025215474 S Co:6:002:0 s 40 05 0cb4 0000 0004 4 = 77000001
ffff000102d1d000 4025215579 C Co:6:002:0 0 4 >
ffff000102d1d000 4025215626 S Ci:6:002:0 s c0 05 0eb4 0000 0004 4 <
ffff000102d1d000 4025215746 C Ci:6:002:0 0 4 = 77000001
ffff000102d1d000 4025215792 S Co:6:002:0 s 40 05 0eb4 0000 0004 4 = 77000001
ffff000102d1d000 4025215898 C Co:6:002:0 0 4 >
ffff000102d1d000 4025215944 S Ci:6:002:0 s c0 05 0900 0000 0004 4 <
ffff000102d1d000 4025216065 C Ci:6:002:0 0 4 = 01040000
ffff000102d1d000 4025216113 S Co:6:002:0 s 40 05 0900 0000 0004 4 = 01040000
ffff000102d1d000 4025216219 C Co:6:002:0 0 4 >
ffff000102d1d000 4025216265 S Ci:6:002:0 s c0 05 080c 0000 0004 4 <
ffff000102d1d000 4025216375 C Ci:6:002:0 0 4 = 13111312
ffff000102d1d000 4025216425 S Co:6:002:0 s 40 05 080c 0000 0004 4 = 03111312
ffff000102d1d000 4025216545 C Co:6:002:0 0 4 >
ffff000102d1d000 4025216591 S Ci:6:002:0 s c0 05 0a04 0000 0004 4 <
ffff000102d1d000 4025216702 C Ci:6:002:0 0 4 = 0c00ff01
ffff000102d1d000 4025216748 S Co:6:002:0 s 40 05 0a04 0000 0004 4 = 0c00ff0f
ffff000102d1d000 4025216863 C Co:6:002:0 0 4 >
ffff000102d1d000 4025216908 S Ci:6:002:0 s c0 05 0440 0000 0004 4 <
ffff000102d1d000 4025217019 C Ci:6:002:0 0 4 = 5f010000
ffff000102d1d000 4025217066 S Co:6:002:0 s 40 05 0440 0000 0004 4 = 50010000
ffff000102d1d000 4025217179 C Co:6:002:0 0 4 >
ffff000102d1d000 4025217224 S Ci:6:002:0 s c0 05 0c1c 0000 0004 4 <
ffff000102d1d000 4025217335 C Ci:6:002:0 0 4 = 03000040
ffff000102d1d000 4025217379 S Co:6:002:0 s 40 05 0c1c 0000 0004 4 = 0300402d
ffff000102d1d000 4025217486 C Co:6:002:0 0 4 >
ffff000102d1d000 4025217533 S Ci:6:002:0 s c0 05 0e1c 0000 0004 4 <
ffff000102d1d000 4025217668 C Ci:6:002:0 0 4 = 03000040
ffff000102d1d000 4025217713 S Co:6:002:0 s 40 05 0e1c 0000 0004 4 = 0300402d
ffff000102d1d000 4025217819 C Co:6:002:0 0 4 >
ffff000102d1d000 4025217866 S Ci:6:002:0 s c0 05 0860 0000 0004 4 <
ffff000102d1d000 4025217986 C Ci:6:002:0 0 4 = 21c3d572
ffff000102d1d000 4025218032 S Co:6:002:0 s 40 05 0860 0000 0004 4 = 21c32969
ffff000102d1d000 4025218138 C Co:6:002:0 0 4 >
ffff000102d1d000 4025218184 S Ci:6:002:0 s c0 05 0c00 0000 0004 4 <
ffff000102d1d000 4025218305 C Ci:6:002:0 0 4 = 07000000
ffff000102d1d000 4025218351 S Ci:6:002:0 s c0 05 08b0 0000 0004 4 <
ffff000102d1d000 4025218461 C Ci:6:002:0 0 4 = 18060000
ffff000102d1d000 4025218505 S Co:6:002:0 s 40 05 08b0 0000 0004 4 = 18060000
ffff000102d1d000 4025218613 C Co:6:002:0 0 4 >
ffff000102d1d000 4025218680 S Ci:6:002:0 s c0 05 0d04 0000 0004 4 <
ffff000102d1d000 4025218800 C Ci:6:002:0 0 4 = 017c90b1
ffff000102d1d000 4025218846 S Co:6:002:0 s 40 05 0c90 0000 0004 4 = 017d8101
ffff000102d1d000 4025218952 C Co:6:002:0 0 4 >
ffff000102d1d000 4025219012 S Ci:6:002:0 s c0 05 08ac 0000 0004 4 <
ffff000102d1d000 4025219131 C Ci:6:002:0 0 4 = 08faf00f
ffff000102d1d000 4025219177 S Co:6:002:0 s 40 05 08ac 0000 0004 4 = 08faf00f
ffff000102d1d000 4025219296 C Co:6:002:0 0 4 >
ffff000102d1d000 4025219342 S Ci:6:002:0 s c0 05 08ac 0000 0004 4 <
ffff000102d1d000 4025219462 C Ci:6:002:0 0 4 = 08faf00f
ffff000102d1d000 4025219507 S Co:6:002:0 s 40 05 08ac 0000 0004 4 = 08faf00f
ffff000102d1d000 4025219614 C Co:6:002:0 0 4 >
ffff000102d1d000 4025219661 S Ci:6:002:0 s c0 05 08c4 0000 0004 4 <
ffff000102d1d000 4025219800 C Ci:6:002:0 0 4 = 00000000
ffff000102d1d000 4025219846 S Co:6:002:0 s 40 05 08c4 0000 0004 4 = 00000000
ffff000102d1d000 4025219952 C Co:6:002:0 0 4 >
ffff000102d1d000 4025219999 S Ci:6:002:0 s c0 05 0c00 0000 0004 4 <
ffff000102d1d000 4025220136 C Ci:6:002:0 0 4 = 07000000
ffff000102d1d000 4025220183 S Ci:6:002:0 s c0 05 08b0 0000 0004 4 <
ffff000102d1d000 4025220300 C Ci:6:002:0 0 4 = 18060000
ffff000102d1d000 4025220344 S Co:6:002:0 s 40 05 08b0 0000 0004 4 = 18060000
ffff000102d1d000 4025220451 C Co:6:002:0 0 4 >
ffff000102d1d000 4025220519 S Ci:6:002:0 s c0 05 0d04 0000 0004 4 <
ffff000102d1d000 4025220639 C Ci:6:002:0 0 4 = 017d91b1
ffff000102d1d000 4025220684 S Co:6:002:0 s 40 05 0c90 0000 0004 4 = 287d8101
ffff000102d1d000 4025220795 C Co:6:002:0 0 4 >
ffff000102d1d000 4025220855 S Ci:6:002:0 s c0 05 0e00 0000 0004 4 <
ffff000102d1d000 4025220974 C Ci:6:002:0 0 4 = 07000000
ffff000102d1d000 4025221020 S Ci:6:002:0 s c0 05 08b0 0000 0004 4 <
ffff000102d1d000 4025221130 C Ci:6:002:0 0 4 = 18060000
ffff000102d1d000 4025221175 S Co:6:002:0 s 40 05 08b0 0000 0004 4 = 18060000
ffff000102d1d000 4025221293 C Co:6:002:0 0 4 >
ffff000102d1d000 4025221359 S Ci:6:002:0 s c0 05 0d44 0000 0004 4 <
ffff000102d1d000 4025221480 C Ci:6:002:0 0 4 = 017c90b1
ffff000102d1d000 4025221525 S Co:6:002:0 s 40 05 0e90 0000 0004 4 = 017d8101
ffff000102d1d000 4025221632 C Co:6:002:0 0 4 >
ffff000102d1d000 4025221691 S Ci:6:002:0 s c0 05 08ac 0000 0004 4 <
ffff000102d1d000 4025221812 C Ci:6:002:0 0 4 = 08faf00f
ffff000102d1d000 4025221858 S Co:6:002:0 s 40 05 08ac 0000 0004 4 = 08faf00f
ffff000102d1d000 4025221963 C Co:6:002:0 0 4 >
ffff000102d1d000 4025222010 S Ci:6:002:0 s c0 05 08ac 0000 0004 4 <
ffff000102d1d000 4025222131 C Ci:6:002:0 0 4 = 08faf00f
ffff000102d1d000 4025222176 S Co:6:002:0 s 40 05 08ac 0000 0004 4 = 08faf00f
ffff000102d1d000 4025222295 C Co:6:002:0 0 4 >
ffff000102d1d000 4025222341 S Ci:6:002:0 s c0 05 08c4 0000 0004 4 <
ffff000102d1d000 4025222461 C Ci:6:002:0 0 4 = 00000000
ffff000102d1d000 4025222507 S Co:6:002:0 s 40 05 08c4 0000 0004 4 = 00000000
ffff000102d1d000 4025222613 C Co:6:002:0 0 4 >
ffff000102d1d000 4025222659 S Ci:6:002:0 s c0 05 0e00 0000 0004 4 <
ffff000102d1d000 4025222797 C Ci:6:002:0 0 4 = 07000000
ffff000102d1d000 4025222842 S Ci:6:002:0 s c0 05 08b0 0000 0004 4 <
ffff000102d1d000 4025222954 C Ci:6:002:0 0 4 = 18060000
ffff000102d1d000 4025222999 S Co:6:002:0 s 40 05 08b0 0000 0004 4 = 18060000
ffff000102d1d000 4025223105 C Co:6:002:0 0 4 >
ffff000102d1d000 4025223172 S Ci:6:002:0 s c0 05 0d44 0000 0004 4 <
ffff000102d1d000 4025223300 C Ci:6:002:0 0 4 = 017d91b1
ffff000102d1d000 4025223346 S Co:6:002:0 s 40 05 0e90 0000 0004 4 = 287d8101
ffff000102d1d000 4025223451 C Co:6:002:0 0 4 >
ffff000102d1d000 4025223512 S Ci:6:002:0 s c0 05 0668 0000 0002 2 <
ffff000102d1d000 4025223632 C Ci:6:002:0 0 2 = 0010
ffff000102d1d000 4025223678 S Co:6:002:0 s 40 05 0668 0000 0002 2 = 0010
ffff000102d1d000 4025223795 C Co:6:002:0 0 2 >
ffff000102d1d000 4025223841 S Co:6:002:0 s 40 05 0483 0000 0001 1 = 00
ffff000102d1d000 4025223954 C Co:6:002:0 0 1 >
ffff000102d1d000 4025224018 S Ci:6:002:0 s c0 05 0837 0000 0001 1 <
ffff000102d1d000 4025224062 C Ci:6:002:0 0 1 = 00
ffff000102d1d000 4025224101 S Ci:6:002:0 s c0 05 08ac 0000 0004 4 <
ffff000102d1d000 4025224209 C Ci:6:002:0 0 4 = 08faf00f
ffff000102d1d000 4025224257 S Co:6:002:0 s 40 05 08ac 0000 0004 4 = 08faf00f
ffff000102d1d000 4025224362 C Co:6:002:0 0 4 >
ffff000102d1d000 4025224410 S Ci:6:002:0 s c0 05 08c4 0000 0004 4 <
ffff000102d1d000 4025224544 C Ci:6:002:0 0 4 = 00000000
ffff000102d1d000 4025224590 S Co:6:002:0 s 40 05 08c4 0000 0004 4 = 00000000
ffff000102d1d000 4025224696 C Co:6:002:0 0 4 >
ffff000102d1d000 4025224743 S Ci:6:002:0 s c0 05 0848 0000 0004 4 <
ffff000102d1d000 4025224860 C Ci:6:002:0 0 4 = 8bffd061
ffff000102d1d000 4025224906 S Co:6:002:0 s 40 05 0848 0000 0004 4 = 8bffd061
ffff000102d1d000 4025225012 C Co:6:002:0 0 4 >
ffff000102d1d000 4025225059 S Ci:6:002:0 s c0 05 08ac 0000 0004 4 <
ffff000102d1d000 4025225177 C Ci:6:002:0 0 4 = 08faf00f
ffff000102d1d000 4025225223 S Co:6:002:0 s 40 05 08ac 0000 0004 4 = 08faf00f
ffff000102d1d000 4025225329 C Co:6:002:0 0 4 >
ffff000102d1d000 4025225376 S Ci:6:002:0 s c0 05 08ac 0000 0004 4 <
ffff000102d1d000 4025225493 C Ci:6:002:0 0 4 = 08faf00f
ffff000102d1d000 4025225539 S Co:6:002:0 s 40 05 08ac 0000 0004 4 = 08faf00f
ffff000102d1d000 4025225645 C Co:6:002:0 0 4 >
ffff000102d1d000 4025225691 S Ci:6:002:0 s c0 05 08c4 0000 0004 4 <
ffff000102d1d000 4025225809 C Ci:6:002:0 0 4 = 00000000
ffff000102d1d000 4025225855 S Co:6:002:0 s 40 05 08c4 0000 0004 4 = 00000000
ffff000102d1d000 4025225961 C Co:6:002:0 0 4 >
ffff000102d1d000 4025226008 S Ci:6:002:0 s c0 05 0c00 0000 0004 4 <
ffff000102d1d000 4025226125 C Ci:6:002:0 0 4 = 07000000
ffff000102d1d000 4025226171 S Ci:6:002:0 s c0 05 08b0 0000 0004 4 <
ffff000102d1d000 4025226294 C Ci:6:002:0 0 4 = 18060000
ffff000102d1d000 4025226340 S Co:6:002:0 s 40 05 08b0 0000 0004 4 = 18060000
ffff000102d1d000 4025226446 C Co:6:002:0 0 4 >
ffff000102d1d000 4025226514 S Ci:6:002:0 s c0 05 0d04 0000 0004 4 <
ffff000102d1d000 4025226633 C Ci:6:002:0 0 4 = 287d91b1
ffff000102d1d000 4025226678 S Co:6:002:0 s 40 05 0c90 0000 0004 4 = 287d8101
ffff000102d1d000 4025226795 C Co:6:002:0 0 4 >
ffff000102d1d000 4025226854 S Ci:6:002:0 s c0 05 0e00 0000 0004 4 <
ffff000102d1d000 4025226972 C Ci:6:002:0 0 4 = 07000000
ffff000102d1d000 4025227018 S Ci:6:002:0 s c0 05 08b0 0000 0004 4 <
ffff000102d1d000 4025227127 C Ci:6:002:0 0 4 = 18060000
ffff000102d1d000 4025227172 S Co:6:002:0 s 40 05 08b0 0000 0004 4 = 18060000
ffff000102d1d000 4025227292 C Co:6:002:0 0 4 >
ffff000102d1d000 4025227359 S Ci:6:002:0 s c0 05 0d44 0000 0004 4 <
ffff000102d1d000 4025227476 C Ci:6:002:0 0 4 = 287d91b1
ffff000102d1d000 4025227521 S Co:6:002:0 s 40 05 0e90 0000 0004 4 = 287d8101
ffff000102d1d000 4025227628 C Co:6:002:0 0 4 >
ffff000102d1d000 4025227689 S Ci:6:002:0 s c0 05 0073 0000 0001 1 <
ffff000102d1d000 4025227808 C Ci:6:002:0 0 1 = 07
ffff000102d1d000 4025227854 S Co:6:002:0 s 40 05 0073 0000 0001 1 = 07
ffff000102d1d000 4025227960 C Co:6:002:0 0 1 >
ffff000102d1d000 4025228036 S Ci:6:002:0 s c0 05 0c24 0000 0004 4 <
ffff000102d1d000 4025228183 C Ci:6:002:0 0 4 = 20202020
ffff000102d1d000 4025228231 S Co:6:002:0 s 40 05 0c24 0000 0004 4 = 27272727
ffff000102d1d000 4025228336 C Co:6:002:0 0 4 >
ffff000102d1d000 4025228383 S Ci:6:002:0 s c0 05 0c28 0000 0004 4 <
ffff000102d1d000 4025228502 C Ci:6:002:0 0 4 = 20201e1c
ffff000102d1d000 4025228548 S Co:6:002:0 s 40 05 0c28 0000 0004 4 = 27272725
ffff000102d1d000 4025228666 C Co:6:002:0 0 4 >
ffff000102d1d000 4025228713 S Ci:6:002:0 s c0 05 0c2c 0000 0004 4 <
ffff000102d1d000 4025228832 C Ci:6:002:0 0 4 = 20202020
ffff000102d1d000 4025228878 S Co:6:002:0 s 40 05 0c2c 0000 0004 4 = 2c2c2c2c
ffff000102d1d000 4025228984 C Co:6:002:0 0 4 >
ffff000102d1d000 4025229030 S Ci:6:002:0 s c0 05 0c30 0000 0004 4 <
ffff000102d1d000 4025229166 C Ci:6:002:0 0 4 = 20201e1c
ffff000102d1d000 4025229212 S Co:6:002:0 s 40 05 0c30 0000 0004 4 = 2c2a2826
ffff000102d1d000 4025229318 C Co:6:002:0 0 4 >
ffff000102d1d000 4025229365 S Ci:6:002:0 s c0 05 0c34 0000 0004 4 <
ffff000102d1d000 4025229483 C Ci:6:002:0 0 4 = 20202020
ffff000102d1d000 4025229529 S Co:6:002:0 s 40 05 0c34 0000 0004 4 = 28282828
ffff000102d1d000 4025229635 C Co:6:002:0 0 4 >
ffff000102d1d000 4025229682 S Ci:6:002:0 s c0 05 0c38 0000 0004 4 <
ffff000102d1d000 4025229800 C Ci:6:002:0 0 4 = 201e1c1a
ffff000102d1d000 4025229845 S Co:6:002:0 s 40 05 0c38 0000 0004 4 = 28282624
ffff000102d1d000 4025229951 C Co:6:002:0 0 4 >
ffff000102d1d000 4025229998 S Ci:6:002:0 s c0 05 0c3c 0000 0004 4 <
ffff000102d1d000 4025230116 C Ci:6:002:0 0 4 = 20202020
ffff000102d1d000 4025230162 S Co:6:002:0 s 40 05 0c3c 0000 0004 4 = 2c2c2c2c
ffff000102d1d000 4025230267 C Co:6:002:0 0 4 >
ffff000102d1d000 4025230314 S Ci:6:002:0 s c0 05 0c40 0000 0004 4 <
ffff000102d1d000 4025230433 C Ci:6:002:0 0 4 = 20201e1c
ffff000102d1d000 4025230480 S Co:6:002:0 s 40 05 0c40 0000 0004 4 = 2c2a2826
ffff000102d1d000 4025230585 C Co:6:002:0 0 4 >
ffff000102d1d000 4025230632 S Ci:6:002:0 s c0 05 0c44 0000 0004 4 <
ffff000102d1d000 4025230751 C Ci:6:002:0 0 4 = 1a181e1e
ffff000102d1d000 4025230797 S Co:6:002:0 s 40 05 0c44 0000 0004 4 = 24242828
ffff000102d1d000 4025230916 C Co:6:002:0 0 4 >
ffff000102d1d000 4025230963 S Ci:6:002:0 s c0 05 0c48 0000 0004 4 <
ffff000102d1d000 4025231081 C Ci:6:002:0 0 4 = 1e1e1e1e
ffff000102d1d000 4025231127 S Co:6:002:0 s 40 05 0c48 0000 0004 4 = 28282828
ffff000102d1d000 4025231233 C Co:6:002:0 0 4 >
ffff000102d1d000 4025231280 S Ci:6:002:0 s c0 05 0c4c 0000 0004 4 <
ffff000102d1d000 4025231417 C Ci:6:002:0 0 4 = 1c1a1816
ffff000102d1d000 4025231463 S Co:6:002:0 s 40 05 0c4c 0000 0004 4 = 26242222
ffff000102d1d000 4025231569 C Co:6:002:0 0 4 >
ffff000102d1d000 4025231616 S Ci:6:002:0 s c0 05 0c54 0000 0004 4 <
ffff000102d1d000 4025231734 C Ci:6:002:0 0 4 = 120a0400
ffff000102d1d000 4025231780 S Co:6:002:0 s 40 05 0c54 0000 0004 4 = 1c140e00
ffff000102d1d000 4025231886 C Co:6:002:0 0 4 >
ffff000102d1d000 4025231933 S Ci:6:002:0 s c0 05 0e24 0000 0004 4 <
ffff000102d1d000 4025232055 C Ci:6:002:0 0 4 = 1d1d1d1d
ffff000102d1d000 4025232102 S Co:6:002:0 s 40 05 0e24 0000 0004 4 = 23232323
ffff000102d1d000 4025232209 C Co:6:002:0 0 4 >
ffff000102d1d000 4025232255 S Ci:6:002:0 s c0 05 0e28 0000 0004 4 <
ffff000102d1d000 4025232365 C Ci:6:002:0 0 4 = 1d1d1b19
ffff000102d1d000 4025232413 S Co:6:002:0 s 40 05 0e28 0000 0004 4 = 23232321
ffff000102d1d000 4025232543 C Co:6:002:0 0 4 >
ffff000102d1d000 4025232589 S Ci:6:002:0 s c0 05 0e2c 0000 0004 4 <
ffff000102d1d000 4025232699 C Ci:6:002:0 0 4 = 1f1f1f1f
ffff000102d1d000 4025232745 S Co:6:002:0 s 40 05 0e2c 0000 0004 4 = 28282828
ffff000102d1d000 4025232851 C Co:6:002:0 0 4 >
ffff000102d1d000 4025232898 S Ci:6:002:0 s c0 05 0e30 0000 0004 4 <
ffff000102d1d000 4025233017 C Ci:6:002:0 0 4 = 1f1f1d1b
ffff000102d1d000 4025233063 S Co:6:002:0 s 40 05 0e30 0000 0004 4 = 28262422
ffff000102d1d000 4025233170 C Co:6:002:0 0 4 >
ffff000102d1d000 4025233217 S Ci:6:002:0 s c0 05 0e34 0000 0004 4 <
ffff000102d1d000 4025233335 C Ci:6:002:0 0 4 = 1f1f1f1f
ffff000102d1d000 4025233381 S Co:6:002:0 s 40 05 0e34 0000 0004 4 = 24242424
ffff000102d1d000 4025233487 C Co:6:002:0 0 4 >
ffff000102d1d000 4025233533 S Ci:6:002:0 s c0 05 0e38 0000 0004 4 <
ffff000102d1d000 4025233670 C Ci:6:002:0 0 4 = 1f1d1b19
ffff000102d1d000 4025233715 S Co:6:002:0 s 40 05 0e38 0000 0004 4 = 24242220
ffff000102d1d000 4025233822 C Co:6:002:0 0 4 >
ffff000102d1d000 4025233869 S Ci:6:002:0 s c0 05 0e3c 0000 0004 4 <
ffff000102d1d000 4025233991 C Ci:6:002:0 0 4 = 1f1f1f1f
ffff000102d1d000 4025234037 S Co:6:002:0 s 40 05 0e3c 0000 0004 4 = 28282828
ffff000102d1d000 4025234143 C Co:6:002:0 0 4 >
ffff000102d1d000 4025234189 S Ci:6:002:0 s c0 05 0e40 0000 0004 4 <
ffff000102d1d000 4025234308 C Ci:6:002:0 0 4 = 1f1f1d1b
ffff000102d1d000 4025234353 S Co:6:002:0 s 40 05 0e40 0000 0004 4 = 28262422
ffff000102d1d000 4025234460 C Co:6:002:0 0 4 >
ffff000102d1d000 4025234506 S Ci:6:002:0 s c0 05 0e44 0000 0004 4 <
ffff000102d1d000 4025234625 C Ci:6:002:0 0 4 = 19171d1d
ffff000102d1d000 4025234672 S Co:6:002:0 s 40 05 0e44 0000 0004 4 = 20202424
ffff000102d1d000 4025234790 C Co:6:002:0 0 4 >
ffff000102d1d000 4025234837 S Ci:6:002:0 s c0 05 0e48 0000 0004 4 <
ffff000102d1d000 4025234957 C Ci:6:002:0 0 4 = 1d1d1d1d
ffff000102d1d000 4025235003 S Co:6:002:0 s 40 05 0e48 0000 0004 4 = 24242424
ffff000102d1d000 4025235109 C Co:6:002:0 0 4 >
ffff000102d1d000 4025235156 S Ci:6:002:0 s c0 05 0e4c 0000 0004 4 <
ffff000102d1d000 4025235292 C Ci:6:002:0 0 4 = 1b191715
ffff000102d1d000 4025235337 S Co:6:002:0 s 40 05 0e4c 0000 0004 4 = 22201e1e
ffff000102d1d000 4025235443 C Co:6:002:0 0 4 >
ffff000102d1d000 4025235490 S Ci:6:002:0 s c0 05 0e54 0000 0004 4 <
ffff000102d1d000 4025235609 C Ci:6:002:0 0 4 = 11090300
ffff000102d1d000 4025235655 S Co:6:002:0 s 40 05 0e54 0000 0004 4 = 18100a00
ffff000102d1d000 4025235762 C Co:6:002:0 0 4 >
ffff000103533480 4025281451 C Bi:6:002:1 0 303 = f7000484 00000f80 cb046000 04300000 00000000 f5c72700 22260000 4ad5d50f
ffff000103533480 4025281510 S Bi:6:002:1 -115 32768 <
ffff000103533240 4025299640 C Bi:6:002:1 0 478 = a6010484 00000f80 ce086000 04300000 00000000 2a0e2800 42440000 87dcdc0f
ffff000103533240 4025299677 S Bi:6:002:1 -115 32768 <
ffff000103533780 4025300684 C Bi:6:002:1 0 471 = 9f010484 00000f80 55066000 04300000 00000000 32122800 42420000 82dcdc0f
ffff000103533780 4025300714 S Bi:6:002:1 -115 32768 <
ffff0001035330c0 4025301578 C Bi:6:002:1 0 446 = 86010484 00000f80 6b0c6000 04300000 00000000 d4152800 42440000 86dddd0f
ffff0001035330c0 4025301607 S Bi:6:002:1 -115 32768 <
ffff000103533480 4025302465 C Bi:6:002:1 0 469 = 9d010484 00000f80 10056000 04300000 00000000 37192800 3e440000 88dcdc0f
ffff000103533480 4025302490 S Bi:6:002:1 -115 32768 <
ffff000103533240 4025303352 C Bi:6:002:1 0 479 = a7010484 00000f80 4b036000 04300000 00000000 b31c2800 42440000 88dbdb0f
ffff000103533240 4025303374 S Bi:6:002:1 -115 32768 <
ffff000103533780 4025385934 C Bi:6:002:1 0 303 = f7000484 00000f80 cc046000 04300000 00000000 f65f2900 20280000 50dada0f
ffff000103533780 4025385990 S Bi:6:002:1 -115 32768 <
ffff0001035330c0 4025402056 C Bi:6:002:1 0 478 = a6010484 00000f80 cf086000 04300000 00000000 2c9e2900 42420000 84dddd0f
ffff0001035330c0 4025402082 S Bi:6:002:1 -115 32768 <
ffff000103533480 4025403076 C Bi:6:002:1 0 471 = 9f010484 00000f80 56066000 04300000 00000000 2ea22900 44440000 88dcdc0f
ffff000103533480 4025403101 S Bi:6:002:1 -115 32768 <
ffff000103533240 4025403934 C Bi:6:002:1 0 446 = 86010484 00000f80 6c0c6000 04300000 00000000 b6a52900 44440000 89dcdc0f
ffff000103533240 4025403955 S Bi:6:002:1 -115 32768 <
ffff000103533780 4025404964 C Bi:6:002:1 0 469 = 9d010484 00000f80 11056000 04300000 00000000 aba92900 44440000 8bdbdb0f
ffff000103533780 4025404987 S Bi:6:002:1 -115 32768 <
ffff0001035330c0 4025405888 C Bi:6:002:1 0 479 = a7010484 00000f80 4c036000 04300000 00000000 40ad2900 42440000 88dcdc0f
ffff0001035330c0 4025405908 S Bi:6:002:1 -115 32768 <
ffff000103533480 4025490330 C Bi:6:002:1 0 303 = f7000484 00000f80 cd046000 04300000 00000000 f8f72a00 20280000 4dd7d70f
ffff000103533480 4025490354 S Bi:6:002:1 -115 32768 <
ffff000103533240 4025504446 C Bi:6:002:1 0 478 = a6010484 00000f80 d0086000 04300000 00000000 2e2e2b00 3e440000 88dbdb0f
ffff000103533240 4025504479 S Bi:6:002:1 -115 32768 <
ffff000103533780 4025505482 C Bi:6:002:1 0 471 = 9f010484 00000f80 57066000 04300000 00000000 38322b00 44440000 89dbdb0f
ffff000103533780 4025505511 S Bi:6:002:1 -115 32768 <
ffff0001035330c0 4025506357 C Bi:6:002:1 0 446 = 86010484 00000f80 6d0c6000 04300000 00000000 c9352b00 44440000 8adddd0f
ffff0001035330c0 4025506382 S Bi:6:002:1 -115 32768 <
ffff000103533480 4025507246 C Bi:6:002:1 0 469 = 9d010484 00000f80 12056000 04300000 00000000 24392b00 3e440000 88dddd0f
ffff000103533480 4025507270 S Bi:6:002:1 -115 32768 <
ffff000103533240 4025508159 C Bi:6:002:1 0 479 = a7010484 00000f80 4d036000 04300000 00000000 a43c2b00 44460000 88dddd0f
ffff000103533240 4025508184 S Bi:6:002:1 -115 32768 <
ffff000103533780 4025594786 C Bi:6:002:1 0 303 = f7000484 00000f80 ce046000 04300000 00000000 fa8f2c00 22280000 4ad3d30f
ffff000103533780 4025594844 S Bi:6:002:1 -115 32768 <
ffff0001035330c0 4025606868 C Bi:6:002:1 0 478 = a6010484 00000f80 d1086000 04300000 00000000 30be2c00 44460000 88dbdb0f
ffff0001035330c0 4025606897 S Bi:6:002:1 -115 32768 <
ffff000103533480 4025607858 C Bi:6:002:1 0 471 = 9f010484 00000f80 58066000 04300000 00000000 26c22c00 44440000 88dcdc0f
ffff000103533480 4025607884 S Bi:6:002:1 -115 32768 <
ffff000103533240 4025608712 C Bi:6:002:1 0 446 = 86010484 00000f80 6e0c6000 04300000 00000000 b2c52c00 42440000 88dbdb0f
ffff000103533240 4025608739 S Bi:6:002:1 -115 32768 <
ffff000103533780 4025609645 C Bi:6:002:1 0 469 = 9d010484 00000f80 13056000 04300000 00000000 19c92c00 42440000 85dcdc0f
ffff000103533780 4025609671 S Bi:6:002:1 -115 32768 <
ffff0001035330c0 4025610533 C Bi:6:002:1 0 479 = a7010484 00000f80 4e036000 04300000 00000000 8ecc2c00 44440000 8bdcdc0f
ffff0001035330c0 4025610558 S Bi:6:002:1 -115 32768 <
ffff000103533480 4025699230 C Bi:6:002:1 0 303 = f7000484 00000f80 cf046000 04300000 00000000 fc272e00 20280000 4dd3d30f
ffff000103533480 4025699287 S Bi:6:002:1 -115 32768 <
ffff000103533240 4025709267 C Bi:6:002:1 0 478 = a6010484 00000f80 d2086000 04300000 00000000 324e2e00 44440000 8edcdc0f
ffff000103533240 4025709295 S Bi:6:002:1 -115 32768 <
ffff000103533780 4025710278 C Bi:6:002:1 0 471 = 9f010484 00000f80 59066000 04300000 00000000 3e522e00 44440000 88dcdc0f
ffff000103533780 4025710303 S Bi:6:002:1 -115 32768 <
ffff0001035330c0 4025711161 C Bi:6:002:1 0 446 = 86010484 00000f80 6f0c6000 04300000 00000000 cd552e00 44440000 8ddddd0f
ffff0001035330c0 4025711186 S Bi:6:002:1 -115 32768 <
ffff000103533480 4025712074 C Bi:6:002:1 0 469 = 9d010484 00000f80 14056000 04300000 00000000 33592e00 44440000 8bdbdb0f
ffff000103533480 4025712098 S Bi:6:002:1 -115 32768 <
ffff000103533240 4025712967 C Bi:6:002:1 0 479 = a7010484 00000f80 4f036000 04300000 00000000 b25c2e00 44440000 8bdcdc0f
ffff000103533240 4025712994 S Bi:6:002:1 -115 32768 <
ffff000102d1d000 4025756191 S Ci:6:002:0 s c0 05 004c 0000 0001 1 <
ffff000102d1d000 4025756327 C Ci:6:002:0 0 1 = 20
ffff000102d1d000 4025756535 S Co:6:002:0 s 40 05 004c 0000 0001 1 = 20
ffff000102d1d000 4025756708 C Co:6:002:0 0 1 >
ffff000103533780 4025803731 C Bi:6:002:1 0 303 = f7000484 00000f80 d0046000 04300000 00000000 febf2f00 20260000 4cd7d70f
ffff000103533780 4025803788 S Bi:6:002:1 -115 32768 <
ffff0001035330c0 4025811685 C Bi:6:002:1 0 478 = a6010484 00000f80 d3086000 04300000 00000000 33de2f00 42440000 88dcdc0f
ffff0001035330c0 4025811722 S Bi:6:002:1 -115 32768 <
ffff000103533480 4025812672 C Bi:6:002:1 0 471 = 9f010484 00000f80 5a066000 04300000 00000000 2fe22f00 44440000 85dcdc0f
ffff000103533480 4025812698 S Bi:6:002:1 -115 32768 <
ffff000103533240 4025813545 C Bi:6:002:1 0 446 = 86010484 00000f80 700c6000 04300000 00000000 bfe52f00 42440000 88dbdb0f
ffff000103533240 4025813570 S Bi:6:002:1 -115 32768 <
ffff000103533780 4025814449 C Bi:6:002:1 0 469 = 9d010484 00000f80 15056000 04300000 00000000 27e92f00 44440000 89dcdc0f
ffff000103533780 4025814474 S Bi:6:002:1 -115 32768 <
ffff0001035330c0 4025815354 C Bi:6:002:1 0 479 = a7010484 00000f80 50036000 04300000 00000000 a2ec2f00 42440000 89dcdc0f
ffff0001035330c0 4025815379 S Bi:6:002:1 -115 32768 <
ffff000102d1d000 4025820181 S Ci:6:002:0 s c0 05 0770 0000 0004 4 <
ffff000102d1d000 4025820316 C Ci:6:002:0 0 4 = 00000000
ffff000102d1d000 4025820525 S Ci:6:002:0 s c0 05 0774 0000 0004 4 <
ffff000102d1d000 4025820711 C Ci:6:002:0 0 4 = 00000000
ffff000102d1d000 4025820874 S Co:6:002:0 s 40 05 076e 0000 0001 1 = 0c
ffff000102d1d000 4025820993 C Co:6:002:0 0 1 >
ffff000102d1d000 4025821199 S Ci:6:002:0 s c0 05 0808 0000 0004 4 <
ffff000102d1d000 4025821365 C Ci:6:002:0 0 4 = 3382023e
ffff000102d1d000 4025821527 S Ci:6:002:0 s c0 05 0a5c 0000 0002 2 <
ffff000102d1d000 4025821654 C Ci:6:002:0 0 2 = 0000
ffff000102d1d000 4025821855 S Ci:6:002:0 s c0 05 0f48 0000 0002 2 <
ffff000102d1d000 4025822022 C Ci:6:002:0 0 2 = c199
ffff000102d1d000 4025822180 S Ci:6:002:0 s c0 05 0f04 0000 0004 4 <
ffff000102d1d000 4025822317 C Ci:6:002:0 0 4 = 00000000
ffff000102d1d000 4025822514 S Ci:6:002:0 s c0 05 0f14 0000 0004 4 <
ffff000102d1d000 4025822681 C Ci:6:002:0 0 4 = ff3fff3f
ffff000102d1d000 4025822839 S Ci:6:002:0 s c0 05 0f10 0000 0004 4 <
ffff000102d1d000 4025822970 C Ci:6:002:0 0 4 = 00000000
ffff000102d1d000 4025823164 S Ci:6:002:0 s c0 05 0f0c 0000 0004 4 <
ffff000102d1d000 4025823306 C Ci:6:002:0 0 4 = 00000000
ffff000102d1d000 4025823354 S Ci:6:002:0 s c0 05 0f08 0000 0004 4 <
ffff000102d1d000 4025823475 C Ci:6:002:0 0 4 = 0200ffff
ffff000102d1d000 4025823512 S Ci:6:002:0 s c0 05 0fcc 0000 0004 4 <
ffff000102d1d000 4025823631 C Ci:6:002:0 0 4 = 00000000
ffff000102d1d000 4025823669 S Ci:6:002:0 s c0 05 09a4 0000 0004 4 <
ffff000102d1d000 4025823793 C Ci:6:002:0 0 4 = 80000800
ffff000102d1d000 4025823831 S Co:6:002:0 s 40 05 09a4 0000 0004 4 = 80000a00
ffff000102d1d000 4025823968 C Co:6:002:0 0 4 >
ffff000102d1d000 4025824036 S Ci:6:002:0 s c0 05 09a4 0000 0004 4 <
ffff000102d1d000 4025824134 C Ci:6:002:0 0 4 = 80000a00
ffff000102d1d000 4025824172 S Co:6:002:0 s 40 05 09a4 0000 0004 4 = 80000800
ffff000102d1d000 4025824290 C Co:6:002:0 0 4 >
ffff000102d1d000 4025824326 S Ci:6:002:0 s c0 05 0a2c 0000 0004 4 <
ffff000102d1d000 4025824439 C Ci:6:002:0 0 4 = 00009000
ffff000102d1d000 4025824475 S Co:6:002:0 s 40 05 0a2c 0000 0004 4 = 00009000
ffff000102d1d000 4025824583 C Co:6:002:0 0 4 >
ffff000102d1d000 4025824619 S Ci:6:002:0 s c0 05 0a2c 0000 0004 4 <
ffff000102d1d000 4025824731 C Ci:6:002:0 0 4 = 00009000
ffff000102d1d000 4025824768 S Co:6:002:0 s 40 05 0a2c 0000 0004 4 = 00809000
ffff000102d1d000 4025824875 C Co:6:002:0 0 4 >
ffff000102d1d000 4025824913 S Ci:6:002:0 s c0 05 0b58 0000 0004 4 <
ffff000102d1d000 4025825042 C Ci:6:002:0 0 4 = 00000000
ffff000102d1d000 4025825078 S Co:6:002:0 s 40 05 0b58 0000 0004 4 = 01000000
ffff000102d1d000 4025825186 C Co:6:002:0 0 4 >
ffff000102d1d000 4025825224 S Ci:6:002:0 s c0 05 0b58 0000 0004 4 <
ffff000102d1d000 4025825337 C Ci:6:002:0 0 4 = 01000000
ffff000102d1d000 4025825373 S Co:6:002:0 s 40 05 0b58 0000 0004 4 = 00000000
ffff000102d1d000 4025825480 C Co:6:002:0 0 4 >
ffff000102d1d000 4025825518 S Ci:6:002:0 s c0 05 0c50 0000 0004 4 <
ffff000102d1d000 4025825637 C Ci:6:002:0 0 4 = 20000000
ffff000102d1d000 4025825674 S Co:6:002:0 s 40 05 0c50 0000 0004 4 = 22000000
ffff000102d1d000 4025825788 C Co:6:002:0 0 4 >
ffff000102d1d000 4025825827 S Ci:6:002:0 s c0 05 0e50 0000 0004 4 <
ffff000102d1d000 4025825940 C Ci:6:002:0 0 4 = 20000000
ffff000102d1d000 4025825976 S Co:6:002:0 s 40 05 0e50 0000 0004 4 = 22000000
ffff000102d1d000 4025826084 C Co:6:002:0 0 4 >
ffff000102d1d000 4025826122 S Ci:6:002:0 s c0 05 01cc 0000 0001 1 <
ffff000102d1d000 4025826235 C Ci:6:002:0 0 1 = 00
ffff000102d1d000 4025826272 S Co:6:002:0 s 40 05 01f0 0000 0004 4 = 00000000
ffff000102d1d000 4025826381 C Co:6:002:0 0 4 >
ffff000102d1d000 4025826418 S Co:6:002:0 s 40 05 01d0 0000 0004 4 = 58000000
ffff000102d1d000 4025826538 C Co:6:002:0 0 4 >
ffff000102d1d000 4025826577 S Co:6:002:0 s 40 05 0440 0000 0004 4 = 00000000
ffff000102d1d000 4025826684 C Co:6:002:0 0 4 >
ffff000102d1d000 4025826722 S Ci:6:002:0 s c0 05 0c00 0000 0004 4 <
ffff000102d1d000 4025826841 C Ci:6:002:0 0 4 = 07000000
ffff000102d1d000 4025826877 S Ci:6:002:0 s c0 05 08b0 0000 0004 4 <
ffff000102d1d000 4025826990 C Ci:6:002:0 0 4 = 18060000
ffff000102d1d000 4025827026 S Co:6:002:0 s 40 05 08b0 0000 0004 4 = 42060000
ffff000102d1d000 4025827134 C Co:6:002:0 0 4 >
ffff000102d1d000 4025827192 S Ci:6:002:0 s c0 05 0d04 0000 0004 4 <
ffff000102d1d000 4025827302 C Ci:6:002:0 0 4 = 108990b1
ffff000102d1d000 4025827338 S Co:6:002:0 s 40 05 0c90 0000 0004 4 = 10892304
ffff000102d1d000 4025827460 C Co:6:002:0 0 4 >
ffff000102d1d000 4025827511 S Co:6:002:0 s 40 05 0280 0000 0002 2 = 0001
ffff000102d1d000 4025827571 C Co:6:002:0 0 2 >
ffff000102d1d000 4025827601 S Ci:6:002:0 s c0 05 010c 0000 0001 1 <
ffff000102d1d000 4025827651 C Ci:6:002:0 0 1 = b0
ffff000102d1d000 4025827681 S Co:6:002:0 s 40 05 010c 0000 0001 1 = b4
ffff000102d1d000 4025827723 C Co:6:002:0 0 1 >
ffff000103533480 4025908128 C Bi:6:002:1 0 303 = f7000484 00000f80 d1046000 04300000 00000000 00583100 22220000 4bd7d70f
ffff000103533480 4025908180 S Bi:6:002:1 -115 32768 <
ffff000103533240 4025914072 C Bi:6:002:1 0 478 = a6010484 00000f80 d4086000 04300000 00000000 356e3100 44440000 88dbdb0f
ffff000103533240 4025914100 S Bi:6:002:1 -115 32768 <
ffff000103533780 4025915138 C Bi:6:002:1 0 471 = 9f010484 00000f80 5b066000 04300000 00000000 75723100 44420000 87dbdb0f
ffff000103533780 4025915165 S Bi:6:002:1 -115 32768 <
ffff0001035330c0 4025916083 C Bi:6:002:1 0 446 = 86010484 00000f80 710c6000 04300000 00000000 48763100 44440000 88dcdc0f
ffff0001035330c0 4025916108 S Bi:6:002:1 -115 32768 <
ffff000103533480 4025917018 C Bi:6:002:1 0 469 = 9d010484 00000f80 16056000 04300000 00000000 d1793100 44440000 8bdddd0f
ffff000103533480 4025917044 S Bi:6:002:1 -115 32768 <
ffff000103533240 4025918091 C Bi:6:002:1 0 479 = a7010484 00000f80 51036000 04300000 00000000 f47d3100 42440000 88dcdc0f
ffff000103533240 4025918128 S Bi:6:002:1 -115 32768 <
ffff000103533780 4025918176 C Bi:6:002:1 0 84 = 1c000484 00000f20 ee0d6000 08300000 00000000 ad803100 3c360000 72f9f90f
ffff000103533780 4025918180 S Bi:6:002:1 -115 32768 <
ffff0001035330c0 4026000397 C Bi:6:002:1 0 84 = 1c000484 00000f22 ef0d6000 08300000 00000000 86c13200 3a360000 71fafa0f
ffff0001035330c0 4026000432 S Bi:6:002:1 -115 32768 <
ffff000103533480 4026012606 C Bi:6:002:1 0 303 = f7000484 00000f80 d2046000 04300000 00000000 02f03200 22260000 4cd8d80f
ffff000103533480 4026012633 S Bi:6:002:1 -115 32768 <
ffff000103533240 4026016439 C Bi:6:002:1 0 478 = a6010484 00000f80 d5086000 04300000 00000000 37fe3200 44440000 89dcdc0f
ffff000103533240 4026016464 S Bi:6:002:1 -115 32768 <
ffff000103533780 4026017578 C Bi:6:002:1 0 471 = 9f010484 00000f80 5c066000 04300000 00000000 8b023300 44440000 88dbdb0f
ffff000103533780 4026017606 S Bi:6:002:1 -115 32768 <
ffff0001035330c0 4026018488 C Bi:6:002:1 0 446 = 86010484 00000f80 720c6000 04300000 00000000 4f063300 44420000 8cdede0f
ffff0001035330c0 4026018513 S Bi:6:002:1 -115 32768 <
ffff000103533480 4026019489 C Bi:6:002:1 0 469 = 9d010484 00000f80 17056000 04300000 00000000 310a3300 42440000 85dcdc0f
ffff000103533480 4026019511 S Bi:6:002:1 -115 32768 <
ffff000103533240 4026020500 C Bi:6:002:1 0 479 = a7010484 00000f80 52036000 04300000 00000000 150e3300 42440000 86dcdc0f
ffff000103533240 4026020526 S Bi:6:002:1 -115 32768 <
ffff000103533780 4026117026 C Bi:6:002:1 0 303 = f7000484 00000f80 d3046000 04300000 00000000 04883400 22260000 4cdfdf0f
ffff000103533780 4026117079 S Bi:6:002:1 -115 32768 <
ffff0001035330c0 4026118869 C Bi:6:002:1 0 478 = a6010484 00000f80 d6086000 04300000 00000000 398e3400 44420000 8adcdc0f
ffff0001035330c0 4026118898 S Bi:6:002:1 -115 32768 <
ffff000103533480 4026119904 C Bi:6:002:1 0 471 = 9f010484 00000f80 5d066000 04300000 00000000 56923400 44440000 88dcdc0f
ffff000103533480 4026119929 S Bi:6:002:1 -115 32768 <
ffff000103533240 4026120816 C Bi:6:002:1 0 446 = 86010484 00000f80 730c6000 04300000 00000000 f8953400 42420000 89dcdc0f
ffff000103533240 4026120843 S Bi:6:002:1 -115 32768 <
ffff000103533780 4026121739 C Bi:6:002:1 0 469 = 9d010484 00000f80 18056000 04300000 00000000 83993400 44440000 89dbdb0f
ffff000103533780 4026121764 S Bi:6:002:1 -115 32768 <
ffff0001035330c0 4026122654 C Bi:6:002:1 0 479 = a7010484 00000f80 53036000 04300000 00000000 099d3400 44420000 89dcdc0f
ffff0001035330c0 4026122679 S Bi:6:002:1 -115 32768 <
ffff000103533480 4026221268 C Bi:6:002:1 0 478 = a6010484 00000f80 d7086000 04300000 00000000 541e3600 42440000 87dbdb0f
ffff000103533480 4026221309 S Bi:6:002:1 -115 32768 <
ffff000103533240 4026221699 C Bi:6:002:1 0 303 = f7000484 00000f80 d4046000 04300000 00000000 ca203600 22260000 4acccc0f
ffff000103533240 4026221729 S Bi:6:002:1 -115 32768 <
ffff000103533780 4026222290 C Bi:6:002:1 0 471 = 9f010484 00000f80 5e066000 04300000 00000000 47223600 42420000 85dcdc0f
ffff000103533780 4026222314 S Bi:6:002:1 -115 32768 <
ffff0001035330c0 4026223198 C Bi:6:002:1 0 446 = 86010484 00000f80 740c6000 04300000 00000000 f6253600 44420000 8bdddd0f
ffff0001035330c0 4026223223 S Bi:6:002:1 -115 32768 <
ffff000103533480 4026224103 C Bi:6:002:1 0 469 = 9d010484 00000f80 19056000 04300000 00000000 5f293600 42420000 86dcdc0f
ffff000103533480 4026224128 S Bi:6:002:1 -115 32768 <
ffff000103533240 4026225015 C Bi:6:002:1 0 479 = a7010484 00000f80 54036000 04300000 00000000 e42c3600 44440000 8bdcdc0f
ffff000103533240 4026225040 S Bi:6:002:1 -115 32768 <
ffff000103533780 4026323653 C Bi:6:002:1 0 478 = a6010484 00000f80 d8086000 04300000 00000000 3cae3700 44420000 88dddd0f
ffff000103533780 4026323693 S Bi:6:002:1 -115 32768 <
ffff0001035330c0 4026324696 C Bi:6:002:1 0 471 = 9f010484 00000f80 5f066000 04300000 00000000 3db23700 44440000 88dcdc0f
ffff0001035330c0 4026324724 S Bi:6:002:1 -115 32768 <
ffff000103533480 4026325565 C Bi:6:002:1 0 446 = 86010484 00000f80 750c6000 04300000 00000000 c9b53700 3e420000 86dcdc0f
ffff000103533480 4026325590 S Bi:6:002:1 -115 32768 <
ffff000103533240 4026325950 C Bi:6:002:1 0 303 = f7000484 00000f80 d5046000 04300000 00000000 12b83700 22240000 4ddfdf0f
ffff000103533240 4026325975 S Bi:6:002:1 -115 32768 <
ffff000103533780 4026326565 C Bi:6:002:1 0 469 = 9d010484 00000f80 1a056000 04300000 00000000 90b93700 44420000 83dede0f
ffff000103533780 4026326589 S Bi:6:002:1 -115 32768 <
ffff0001035330c0 4026327504 C Bi:6:002:1 0 479 = a7010484 00000f80 55036000 04300000 00000000 3bbd3700 44460000 8adcdc0f
ffff0001035330c0 4026327530 S Bi:6:002:1 -115 32768 <
ffff000103533480 4026426096 C Bi:6:002:1 0 478 = a6010484 00000f80 d9086000 04300000 00000000 3e3e3900 44420000 89dcdc0f
ffff000103533480 4026426153 S Bi:6:002:1 -115 32768 <
ffff000103533240 4026427089 C Bi:6:002:1 0 471 = 9f010484 00000f80 60066000 04300000 00000000 46423900 42420000 85dcdc0f
ffff000103533240 4026427118 S Bi:6:002:1 -115 32768 <
ffff000103533780 4026428078 C Bi:6:002:1 0 446 = 86010484 00000f80 760c6000 04300000 00000000 5f463900 42420000 84dcdc0f
ffff000103533780 4026428101 S Bi:6:002:1 -115 32768 <
ffff0001035330c0 4026429012 C Bi:6:002:1 0 469 = 9d010484 00000f80 1b056000 04300000 00000000 e6493900 44420000 8bdddd0f
ffff0001035330c0 4026429032 S Bi:6:002:1 -115 32768 <
ffff000103533480 4026429924 C Bi:6:002:1 0 479 = a7010484 00000f80 56036000 04300000 00000000 6c4d3900 44420000 8adddd0f
ffff000103533480 4026429944 S Bi:6:002:1 -115 32768 <
ffff000103533240 4026528458 C Bi:6:002:1 0 478 = a6010484 00000f80 da086000 04300000 00000000 40ce3a00 44420000 8cdfdf0f
ffff000103533240 4026528507 S Bi:6:002:1 -115 32768 <
ffff000103533780 4026529485 C Bi:6:002:1 0 471 = 9f010484 00000f80 61066000 04300000 00000000 3fd23a00 44420000 8bdddd0f
ffff000103533780 4026529511 S Bi:6:002:1 -115 32768 <
ffff0001035330c0 4026530407 C Bi:6:002:1 0 446 = 86010484 00000f80 770c6000 04300000 00000000 00d63a00 42420000 83dddd0f
ffff0001035330c0 4026530432 S Bi:6:002:1 -115 32768 <
ffff000103533480 4026531329 C Bi:6:002:1 0 469 = 9d010484 00000f80 1c056000 04300000 00000000 7ed93a00 42420000 8adddd0f
ffff000103533480 4026531353 S Bi:6:002:1 -115 32768 <
ffff000103533240 4026532246 C Bi:6:002:1 0 479 = a7010484 00000f80 57036000 04300000 00000000 01dd3a00 3e420000 85dddd0f
ffff000103533240 4026532270 S Bi:6:002:1 -115 32768 <
ffff000103533780 4026534833 C Bi:6:002:1 0 303 = f7000484 00000f80 d7046000 04300000 00000000 0ce83a00 22260000 4cd5d50f
ffff000103533780 4026534865 S Bi:6:002:1 -115 32768 <
ffff0001035330c0 4026630904 C Bi:6:002:1 0 478 = a6010484 00000f80 db086000 04300000 00000000 415e3c00 44420000 88dfdf0f
ffff0001035330c0 4026630960 S Bi:6:002:1 -115 32768 <
ffff000103533480 4026631882 C Bi:6:002:1 0 471 = 9f010484 00000f80 62066000 04300000 00000000 41623c00 42420000 88dcdc0f
ffff000103533480 4026631909 S Bi:6:002:1 -115 32768 <
ffff000103533240 4026632748 C Bi:6:002:1 0 446 = 86010484 00000f80 780c6000 04300000 00000000 c6653c00 42400000 86dddd0f
ffff000103533240 4026632772 S Bi:6:002:1 -115 32768 <
ffff000103533780 4026633645 C Bi:6:002:1 0 469 = 9d010484 00000f80 1d056000 04300000 00000000 28693c00 44400000 89dddd0f
ffff000103533780 4026633670 S Bi:6:002:1 -115 32768 <
ffff0001035330c0 4026634565 C Bi:6:002:1 0 479 = a7010484 00000f80 58036000 04300000 00000000 a76c3c00 3e420000 85dcdc0f
ffff0001035330c0 4026634589 S Bi:6:002:1 -115 32768 <
ffff000103533480 4026639289 C Bi:6:002:1 0 303 = f7000484 00000f80 d8046000 04300000 00000000 0e803c00 22260000 4ed3d30f
ffff000103533480 4026639314 S Bi:6:002:1 -115 32768 <
ffff000103533240 4026733300 C Bi:6:002:1 0 478 = a6010484 00000f80 dc086000 04300000 00000000 43ee3d00 44420000 89dbdb0f
ffff000103533240 4026733356 S Bi:6:002:1 -115 32768 <
ffff000103533780 4026734267 C Bi:6:002:1 0 471 = 9f010484 00000f80 63066000 04300000 00000000 34f23d00 42420000 8adcdc0f
ffff000103533780 4026734294 S Bi:6:002:1 -115 32768 <
ffff0001035330c0 4026735140 C Bi:6:002:1 0 446 = 86010484 00000f80 790c6000 04300000 00000000 bdf53d00 42420000 88dede0f
ffff0001035330c0 4026735164 S Bi:6:002:1 -115 32768 <
ffff000103533480 4026736034 C Bi:6:002:1 0 469 = 9d010484 00000f80 1e056000 04300000 00000000 1df93d00 48420000 8adbdb0f
ffff000103533480 4026736058 S Bi:6:002:1 -115 32768 <
ffff000103533240 4026736938 C Bi:6:002:1 0 479 = a7010484 00000f80 59036000 04300000 00000000 98fc3d00 40420000 89dddd0f
ffff000103533240 4026736964 S Bi:6:002:1 -115 32768 <
ffff000103533780 4026743759 C Bi:6:002:1 0 303 = f7000484 00000f80 d9046000 04300000 00000000 10183e00 22260000 4cdddd0f
ffff000103533780 4026743788 S Bi:6:002:1 -115 32768 <
ffff000102d1d000 4026748196 S Ci:6:002:0 s c0 05 004c 0000 0001 1 <
ffff000102d1d000 4026748318 C Ci:6:002:0 0 1 = 20
ffff000102d1d000 4026748453 S Co:6:002:0 s 40 05 004c 0000 0001 1 = 20
ffff000102d1d000 4026748580 C Co:6:002:0 0 1 >
ffff0001035330c0 4026835714 C Bi:6:002:1 0 478 = a6010484 00000f80 dd086000 04300000 00000000 457e3f00 42420000 82dcdc0f
ffff0001035330c0 4026835744 S Bi:6:002:1 -115 32768 <
ffff000103533480 4026836681 C Bi:6:002:1 0 471 = 9f010484 00000f80 64066000 04300000 00000000 45823f00 42420000 88dcdc0f
ffff000103533480 4026836708 S Bi:6:002:1 -115 32768 <
ffff000103533240 4026837560 C Bi:6:002:1 0 446 = 86010484 00000f80 7a0c6000 04300000 00000000 d4853f00 42420000 85dede0f
ffff000103533240 4026837585 S Bi:6:002:1 -115 32768 <
ffff000103533780 4026838475 C Bi:6:002:1 0 469 = 9d010484 00000f80 1f056000 04300000 00000000 36893f00 3e420000 89dddd0f
ffff000103533780 4026838500 S Bi:6:002:1 -115 32768 <
ffff0001035330c0 4026839362 C Bi:6:002:1 0 479 = a7010484 00000f80 5a036000 04300000 00000000 b28c3f00 42420000 87dcdc0f
ffff0001035330c0 4026839387 S Bi:6:002:1 -115 32768 <
ffff000103533480 4026848207 C Bi:6:002:1 0 303 = f7000484 00000f80 da046000 04300000 00000000 11b03f00 22280000 4ad8d80f
ffff000103533480 4026848233 S Bi:6:002:1 -115 32768 <
ffff000103533240 4026938088 C Bi:6:002:1 0 478 = a6010484 00000f80 de086000 04300000 00000000 470e4100 40420000 85dddd0f
ffff000103533240 4026938114 S Bi:6:002:1 -115 32768 <
ffff000103533780 4026939091 C Bi:6:002:1 0 471 = 9f010484 00000f80 65066000 04300000 00000000 4f124100 40420000 86dcdc0f
ffff000103533780 4026939118 S Bi:6:002:1 -115 32768 <
ffff0001035330c0 4026939960 C Bi:6:002:1 0 446 = 86010484 00000f80 7b0c6000 04300000 00000000 d2154100 42420000 85dddd0f
ffff0001035330c0 4026939985 S Bi:6:002:1 -115 32768 <
ffff000103533480 4026940846 C Bi:6:002:1 0 469 = 9d010484 00000f80 20056000 04300000 00000000 2d194100 42420000 86dddd0f
ffff000103533480 4026940875 S Bi:6:002:1 -115 32768 <
ffff000103533240 4026941769 C Bi:6:002:1 0 479 = a7010484 00000f80 5b036000 04300000 00000000 b91c4100 3e440000 87dddd0f
ffff000103533240 4026941794 S Bi:6:002:1 -115 32768 <
ffff000103533780 4026952640 C Bi:6:002:1 0 303 = f7000484 00000f80 db046000 04300000 00000000 13484100 22220000 4bd9d90f
ffff000103533780 4026952664 S Bi:6:002:1 -115 32768 <
ffff0001035330c0 4026954769 C Bi:6:002:1 0 84 = 1c000484 00000f20 ad0d6000 08300000 00000000 ac514100 40420000 7df8f80f
ffff0001035330c0 4026954794 S Bi:6:002:1 -115 32768 <
ffff000103533480 4027040457 C Bi:6:002:1 0 478 = a6010484 00000f80 df086000 04300000 00000000 499e4200 44440000 86dddd0f
ffff000103533480 4027040502 S Bi:6:002:1 -115 32768 <
ffff000103533240 4027041459 C Bi:6:002:1 0 471 = 9f010484 00000f80 66066000 04300000 00000000 28a24200 44420000 89dddd0f
ffff000103533240 4027041484 S Bi:6:002:1 -115 32768 <
ffff000103533780 4027042490 C Bi:6:002:1 0 446 = 86010484 00000f80 7c0c6000 04300000 00000000 58a64200 42440000 87dbdb0f
ffff000103533780 4027042515 S Bi:6:002:1 -115 32768 <
ffff0001035330c0 4027043536 C Bi:6:002:1 0 469 = 9d010484 00000f80 21056000 04300000 00000000 4caa4200 42420000 85dcdc0f
ffff0001035330c0 4027043561 S Bi:6:002:1 -115 32768 <
ffff000103533480 4027044620 C Bi:6:002:1 0 479 = a7010484 00000f80 5c036000 04300000 00000000 94ae4200 42440000 89dddd0f
ffff000103533480 4027044643 S Bi:6:002:1 -115 32768 <
ffff000103533240 4027057097 C Bi:6:002:1 0 303 = f7000484 00000f80 dc046000 04300000 00000000 15e04200 22260000 4fdbdb0f
ffff000103533240 4027057122 S Bi:6:002:1 -115 32768 <
ffff000103533780 4027142866 C Bi:6:002:1 0 478 = a6010484 00000f80 e0086000 04300000 00000000 4a2e4400 42440000 86dcdc0f
ffff000103533780 4027142916 S Bi:6:002:1 -115 32768 <
ffff0001035330c0 4027143905 C Bi:6:002:1 0 471 = 9f010484 00000f80 67066000 04300000 00000000 56324400 44440000 8cdddd0f
ffff0001035330c0 4027143931 S Bi:6:002:1 -115 32768 <
ffff000103533480 4027144774 C Bi:6:002:1 0 446 = 86010484 00000f80 7d0c6000 04300000 00000000 e3354400 42420000 87dede0f
ffff000103533480 4027144798 S Bi:6:002:1 -115 32768 <
ffff000103533240 4027145685 C Bi:6:002:1 0 469 = 9d010484 00000f80 22056000 04300000 00000000 4e394400 42420000 8adddd0f
ffff000103533240 4027145709 S Bi:6:002:1 -115 32768 <
ffff000103533780 4027146807 C Bi:6:002:1 0 479 = a7010484 00000f80 5d036000 04300000 00000000 a03d4400 44420000 88dbdb0f
ffff000103533780 4027146832 S Bi:6:002:1 -115 32768 <
ffff0001035330c0 4027161513 C Bi:6:002:1 0 303 = f7000484 00000f80 dd046000 04300000 00000000 17784400 22220000 4dd9d90f
ffff0001035330c0 4027161545 S Bi:6:002:1 -115 32768 <
ffff000103533480 4027227299 C Bi:6:002:1 0 84 = 1c000484 00000f20 f00d6000 08300000 00000000 207a4500 38360000 6ff9f90f
ffff000103533480 4027227356 S Bi:6:002:1 -115 32768 <
ffff000103533240 4027245278 C Bi:6:002:1 0 478 = a6010484 00000f80 e1086000 04300000 00000000 4cbe4500 44420000 8ddddd0f
ffff000103533240 4027245303 S Bi:6:002:1 -115 32768 <
ffff000103533780 4027246409 C Bi:6:002:1 0 471 = 9f010484 00000f80 68066000 04300000 00000000 c5c24500 42440000 89dcdc0f
ffff000103533780 4027246435 S Bi:6:002:1 -115 32768 <
ffff0001035330c0 4027247335 C Bi:6:002:1 0 446 = 86010484 00000f80 7e0c6000 04300000 00000000 84c64500 42420000 87dede0f
ffff0001035330c0 4027247360 S Bi:6:002:1 -115 32768 <
ffff000103533480 4027248261 C Bi:6:002:1 0 469 = 9d010484 00000f80 23056000 04300000 00000000 ffc94500 48460000 90dbdb0f
ffff000103533480 4027248286 S Bi:6:002:1 -115 32768 <
ffff000103533240 4027249184 C Bi:6:002:1 0 479 = a7010484 00000f80 5e036000 04300000 00000000 8bcd4500 44420000 89dddd0f
ffff000103533240 4027249210 S Bi:6:002:1 -115 32768 <
ffff000103533780 4027266000 C Bi:6:002:1 0 303 = f7000484 00000f80 de046000 04300000 00000000 19104600 22280000 48dada0f
ffff000103533780 4027266029 S Bi:6:002:1 -115 32768 <
ffff0001035330c0 4027289176 C Bi:6:002:1 0 84 = 1c000484 00000f22 f10d6000 08300000 00000000 086c4600 3a380000 6ffafa0f
ffff0001035330c0 4027289201 S Bi:6:002:1 -115 32768 <
ffff000103533480 4027347667 C Bi:6:002:1 0 478 = a6010484 00000f80 e2086000 04300000 00000000 4e4e4700 44420000 8ddcdc0f
ffff000103533480 4027347702 S Bi:6:002:1 -115 32768 <
ffff000103533240 4027348684 C Bi:6:002:1 0 471 = 9f010484 00000f80 69066000 04300000 00000000 4f524700 46440000 8cdbdb0f
ffff000103533240 4027348709 S Bi:6:002:1 -115 32768 <
ffff000103533780 4027349726 C Bi:6:002:1 0 446 = 86010484 00000f80 7f0c6000 04300000 00000000 72564700 42420000 88dcdc0f
ffff000103533780 4027349753 S Bi:6:002:1 -115 32768 <
ffff0001035330c0 4027350758 C Bi:6:002:1 0 469 = 9d010484 00000f80 24056000 04300000 00000000 635a4700 46420000 89dcdc0f
ffff0001035330c0 4027350782 S Bi:6:002:1 -115 32768 <
ffff000103533480 4027351793 C Bi:6:002:1 0 479 = a7010484 00000f80 5f036000 04300000 00000000 775e4700 46440000 86dbdb0f
ffff000103533480 4027351814 S Bi:6:002:1 -115 32768 <
ffff000103533240 4027370411 C Bi:6:002:1 0 303 = f7000484 00000f80 df046000 04300000 00000000 1ba84700 22260000 4fd7d70f
ffff000103533240 4027370438 S Bi:6:002:1 -115 32768 <
ffff000103533780 4027371892 C Bi:6:002:1 0 84 = 1c000484 00000f20 f20d6000 08300000 00000000 0aaf4700 38360000 70fbfb0f
ffff000103533780 4027371922 S Bi:6:002:1 -115 32768 <
ffff0001035330c0 4027395607 C Bi:6:002:1 0 84 = 1c000484 00000f22 ae0d6000 08300000 00000000 c80b4800 42440000 82f7f70f
ffff0001035330c0 4027395632 S Bi:6:002:1 -115 32768 <
ffff000103533480 4027433833 C Bi:6:002:1 0 84 = 1c000484 00000f22 f30d6000 08300000 00000000 f5a04800 3a3a0000 71fbfb0f
ffff000103533480 4027433859 S Bi:6:002:1 -115 32768 <
ffff000103533240 4027450099 C Bi:6:002:1 0 478 = a6010484 00000f80 e3086000 04300000 00000000 50de4800 42440000 85dddd0f
ffff000103533240 4027450125 S Bi:6:002:1 -115 32768 <
ffff000103533780 4027451111 C Bi:6:002:1 0 471 = 9f010484 00000f80 6a066000 04300000 00000000 64e24800 44420000 85dcdc0f
ffff000103533780 4027451139 S Bi:6:002:1 -115 32768 <
ffff0001035330c0 4027451989 C Bi:6:002:1 0 446 = 86010484 00000f80 800c6000 04300000 00000000 06e64800 46440000 89dada0f
ffff0001035330c0 4027452016 S Bi:6:002:1 -115 32768 <
ffff000103533480 4027452879 C Bi:6:002:1 0 469 = 9d010484 00000f80 25056000 04300000 00000000 68e94800 42440000 8adcdc0f
ffff000103533480 4027452914 S Bi:6:002:1 -115 32768 <
ffff000103533240 4027453787 C Bi:6:002:1 0 479 = a7010484 00000f80 60036000 04300000 00000000 e6ec4800 44420000 8edcdc0f
ffff000103533240 4027453807 S Bi:6:002:1 -115 32768 <
ffff000103533780 4027474862 C Bi:6:002:1 0 303 = f7000484 00000f80 e0046000 04300000 00000000 1d404900 22260000 4cd5d50f
ffff000103533780 4027474882 S Bi:6:002:1 -115 32768 <
ffff0001035330c0 4027552507 C Bi:6:002:1 0 478 = a6010484 00000f80 e4086000 04300000 00000000 516e4a00 42420000 85dddd0f
ffff0001035330c0 4027552540 S Bi:6:002:1 -115 32768 <
ffff000103533480 4027553489 C Bi:6:002:1 0 471 = 9f010484 00000f80 6b066000 04300000 00000000 65724a00 44420000 89dcdc0f
ffff000103533480 4027553523 S Bi:6:002:1 -115 32768 <
ffff000103533240 4027554383 C Bi:6:002:1 0 446 = 86010484 00000f80 810c6000 04300000 00000000 fd754a00 44440000 89dcdc0f
ffff000103533240 4027554413 S Bi:6:002:1 -115 32768 <
ffff000103533780 4027555306 C Bi:6:002:1 0 469 = 9d010484 00000f80 26056000 04300000 00000000 5c794a00 44440000 8adcdc0f
ffff000103533780 4027555330 S Bi:6:002:1 -115 32768 <
ffff0001035330c0 4027556223 C Bi:6:002:1 0 479 = a7010484 00000f80 61036000 04300000 00000000 ef7c4a00 44420000 84dede0f
ffff0001035330c0 4027556248 S Bi:6:002:1 -115 32768 <
ffff000103533480 4027579358 C Bi:6:002:1 0 303 = f7000484 00000f80 e1046000 04300000 00000000 1fd84a00 22280000 4dd7d70f
ffff000103533480 4027579367 S Bi:6:002:1 -115 32768 <
ffff000103533240 4027654875 C Bi:6:002:1 0 478 = a6010484 00000f80 e5086000 04300000 00000000 53fe4b00 42420000 87dddd0f
ffff000103533240 4027654927 S Bi:6:002:1 -115 32768 <
ffff000103533780 4027655927 C Bi:6:002:1 0 471 = 9f010484 00000f80 6c066000 04300000 00000000 60024c00 42420000 86dcdc0f
ffff000103533780 4027655953 S Bi:6:002:1 -115 32768 <
ffff0001035330c0 4027656811 C Bi:6:002:1 0 446 = 86010484 00000f80 820c6000 04300000 00000000 0a064c00 44420000 88dddd0f
ffff0001035330c0 4027656837 S Bi:6:002:1 -115 32768 <
ffff000103533480 4027657769 C Bi:6:002:1 0 469 = 9d010484 00000f80 27056000 04300000 00000000 aa094c00 44440000 86dcdc0f
ffff000103533480 4027657794 S Bi:6:002:1 -115 32768 <
ffff000103533240 4027658689 C Bi:6:002:1 0 479 = a7010484 00000f80 62036000 04300000 00000000 400d4c00 44420000 8bdcdc0f
ffff000103533240 4027658720 S Bi:6:002:1 -115 32768 <
ffff000103533780 4027683796 C Bi:6:002:1 0 303 = f7000484 00000f80 e2046000 04300000 00000000 21704c00 22260000 4ad7d70f
ffff000103533780 4027683825 S Bi:6:002:1 -115 32768 <
ffff0001035330c0 4027757269 C Bi:6:002:1 0 478 = a6010484 00000f80 e6086000 04300000 00000000 558e4d00 42420000 84dcdc0f
ffff0001035330c0 4027757319 S Bi:6:002:1 -115 32768 <
ffff000103533480 4027758312 C Bi:6:002:1 0 471 = 9f010484 00000f80 6d066000 04300000 00000000 5c924d00 44420000 88dbdb0f
ffff000103533480 4027758338 S Bi:6:002:1 -115 32768 <
ffff000103533240 4027759183 C Bi:6:002:1 0 446 = 86010484 00000f80 830c6000 04300000 00000000 ee954d00 42420000 83dede0f
ffff000103533240 4027759209 S Bi:6:002:1 -115 32768 <
ffff000103533780 4027760062 C Bi:6:002:1 0 469 = 9d010484 00000f80 28056000 04300000 00000000 4f994d00 44420000 8adddd0f
ffff000103533780 4027760090 S Bi:6:002:1 -115 32768 <
ffff0001035330c0 4027760995 C Bi:6:002:1 0 479 = a7010484 00000f80 63036000 04300000 00000000 d99c4d00 46420000 84dbdb0f
ffff0001035330c0 4027761021 S Bi:6:002:1 -115 32768 <
ffff000102d1d000 4027772289 S Ci:6:002:0 s c0 05 004c 0000 0001 1 <
ffff000102d1d000 4027772417 C Ci:6:002:0 0 1 = 20
ffff000102d1d000 4027772594 S Co:6:002:0 s 40 05 004c 0000 0001 1 = 20
ffff000102d1d000 4027772754 C Co:6:002:0 0 1 >
ffff000103150540 4027773058 S Ci:6:002:0 s c0 05 0770 0000 0004 4 <
ffff000103150540 4027773204 C Ci:6:002:0 0 4 = 00000000
ffff000103150540 4027773366 S Ci:6:002:0 s c0 05 0774 0000 0004 4 <
ffff000103150540 4027773512 C Ci:6:002:0 0 4 = 00000000
ffff000103150540 4027773673 S Co:6:002:0 s 40 05 076e 0000 0001 1 = 0c
ffff000103150540 4027773813 C Co:6:002:0 0 1 >
ffff000103150540 4027773978 S Ci:6:002:0 s c0 05 0808 0000 0004 4 <
ffff000103150540 4027774125 C Ci:6:002:0 0 4 = 3382023e
ffff000103150540 4027774287 S Ci:6:002:0 s c0 05 0a5c 0000 0002 2 <
ffff000103150540 4027774434 C Ci:6:002:0 0 2 = 0000
ffff000103150540 4027774581 S Ci:6:002:0 s c0 05 0f48 0000 0002 2 <
ffff000103150540 4027774706 C Ci:6:002:0 0 2 = 9d00
ffff000103150540 4027774851 S Ci:6:002:0 s c0 05 0f04 0000 0004 4 <
ffff000103150540 4027774971 C Ci:6:002:0 0 4 = 00000000
ffff000103150540 4027775007 S Ci:6:002:0 s c0 05 0f14 0000 0004 4 <
ffff000103150540 4027775118 C Ci:6:002:0 0 4 = 3904d601
ffff000103150540 4027775150 S Ci:6:002:0 s c0 05 0f10 0000 0004 4 <
ffff000103150540 4027775272 C Ci:6:002:0 0 4 = 00000000
ffff000103150540 4027775303 S Ci:6:002:0 s c0 05 0f0c 0000 0004 4 <
ffff000103150540 4027775414 C Ci:6:002:0 0 4 = 00000000
ffff000103150540 4027775443 S Ci:6:002:0 s c0 05 0f08 0000 0004 4 <
ffff000103150540 4027775561 C Ci:6:002:0 0 4 = 0000ac06
ffff000103150540 4027775582 S Ci:6:002:0 s c0 05 0fcc 0000 0004 4 <
ffff000103150540 4027775694 C Ci:6:002:0 0 4 = 00000000
ffff000103150540 4027775723 S Ci:6:002:0 s c0 05 09a4 0000 0004 4 <
ffff000103150540 4027775841 C Ci:6:002:0 0 4 = 80000800
ffff000103150540 4027775863 S Co:6:002:0 s 40 05 09a4 0000 0004 4 = 80000a00
ffff000103150540 4027775969 C Co:6:002:0 0 4 >
ffff000103150540 4027775998 S Ci:6:002:0 s c0 05 09a4 0000 0004 4 <
ffff000103150540 4027776062 C Ci:6:002:0 0 4 = 80000a00
ffff000103150540 4027776079 S Co:6:002:0 s 40 05 09a4 0000 0004 4 = 80000800
ffff000103150540 4027776183 C Co:6:002:0 0 4 >
ffff000103150540 4027776212 S Ci:6:002:0 s c0 05 0a2c 0000 0004 4 <
ffff000103150540 4027776331 C Ci:6:002:0 0 4 = 00809000
ffff000103150540 4027776351 S Co:6:002:0 s 40 05 0a2c 0000 0004 4 = 00009000
ffff000103150540 4027776461 C Co:6:002:0 0 4 >
ffff000103150540 4027776491 S Ci:6:002:0 s c0 05 0a2c 0000 0004 4 <
ffff000103150540 4027776608 C Ci:6:002:0 0 4 = 00009000
ffff000103150540 4027776628 S Co:6:002:0 s 40 05 0a2c 0000 0004 4 = 00809000
ffff000103150540 4027776736 C Co:6:002:0 0 4 >
ffff000103150540 4027776765 S Ci:6:002:0 s c0 05 0b58 0000 0004 4 <
ffff000103150540 4027776884 C Ci:6:002:0 0 4 = 00000000
ffff000103150540 4027776904 S Co:6:002:0 s 40 05 0b58 0000 0004 4 = 01000000
ffff000103150540 4027777018 C Co:6:002:0 0 4 >
ffff000103150540 4027777048 S Ci:6:002:0 s c0 05 0b58 0000 0004 4 <
ffff000103150540 4027777160 C Ci:6:002:0 0 4 = 01000000
ffff000103150540 4027777189 S Co:6:002:0 s 40 05 0b58 0000 0004 4 = 00000000
ffff000103150540 4027777303 C Co:6:002:0 0 4 >
ffff000103150540 4027777324 S Ci:6:002:0 s c0 05 0c50 0000 0004 4 <
ffff000103150540 4027777435 C Ci:6:002:0 0 4 = 22000000
ffff000103150540 4027777466 S Co:6:002:0 s 40 05 0c50 0000 0004 4 = 20000000
ffff000103150540 4027777579 C Co:6:002:0 0 4 >
ffff000103150540 4027777599 S Ci:6:002:0 s c0 05 0e50 0000 0004 4 <
ffff000103150540 4027777711 C Ci:6:002:0 0 4 = 22000000
ffff000103150540 4027777740 S Co:6:002:0 s 40 05 0e50 0000 0004 4 = 20000000
ffff000103150540 4027777850 C Co:6:002:0 0 4 >
ffff000103150540 4027777871 S Ci:6:002:0 s c0 05 01cc 0000 0001 1 <
ffff000103150540 4027777983 C Ci:6:002:0 0 1 = 00
ffff000103150540 4027778013 S Co:6:002:0 s 40 05 01f4 0000 0004 4 = 00000000
ffff000103150540 4027778127 C Co:6:002:0 0 4 >
ffff000103150540 4027778147 S Co:6:002:0 s 40 05 01d4 0000 0004 4 = 58000000
ffff000103150540 4027778264 C Co:6:002:0 0 4 >
ffff000103150540 4027778294 S Co:6:002:0 s 40 05 0440 0000 0004 4 = 00000000
ffff000103150540 4027778402 C Co:6:002:0 0 4 >
ffff000103150540 4027778425 S Ci:6:002:0 s c0 05 0c00 0000 0004 4 <
ffff000103150540 4027778535 C Ci:6:002:0 0 4 = 07000000
ffff000103150540 4027778565 S Ci:6:002:0 s c0 05 08b0 0000 0004 4 <
ffff000103150540 4027778682 C Ci:6:002:0 0 4 = 42060000
ffff000103150540 4027778706 S Co:6:002:0 s 40 05 08b0 0000 0004 4 = 42060000
ffff000103150540 4027778813 C Co:6:002:0 0 4 >
ffff000103150540 4027778863 S Ci:6:002:0 s c0 05 0d04 0000 0004 4 <
ffff000103150540 4027778969 C Ci:6:002:0 0 4 = 108d90b1
ffff000103150540 4027778993 S Ci:6:002:0 s c0 05 0c1c 0000 0004 4 <
ffff000103150540 4027779111 C Ci:6:002:0 0 4 = 0300402d
ffff000103150540 4027779132 S Co:6:002:0 s 40 05 0c1c 0000 0004 4 = 0300e032
ffff000103150540 4027779240 C Co:6:002:0 0 4 >
ffff000103150540 4027779269 S Ci:6:002:0 s c0 05 0e1c 0000 0004 4 <
ffff000103150540 4027779393 C Ci:6:002:0 0 4 = 0300402d
ffff000103150540 4027779423 S Co:6:002:0 s 40 05 0e1c 0000 0004 4 = 0300e035
ffff000103150540 4027779531 C Co:6:002:0 0 4 >
ffff000103150540 4027779561 S Co:6:002:0 s 40 05 0280 0000 0002 2 = 0001
ffff000103150540 4027779667 C Co:6:002:0 0 2 >
ffff000103150540 4027779697 S Ci:6:002:0 s c0 05 010c 0000 0001 1 <
ffff000103150540 4027779809 C Ci:6:002:0 0 1 = b4
ffff000103150540 4027779838 S Co:6:002:0 s 40 05 010c 0000 0001 1 = b4
ffff000103150540 4027779946 C Co:6:002:0 0 1 >
ffff000103533480 4027788157 C Bi:6:002:1 0 303 = f7000484 00000f80 e3046000 04300000 00000000 23084e00 22280000 48d6d60f
ffff000103533480 4027788180 S Bi:6:002:1 -115 32768 <
ffff000103533240 4027859715 C Bi:6:002:1 0 478 = a6010484 00000f80 e7086000 04300000 00000000 571e4f00 44420000 89dcdc0f
ffff000103533240 4027859774 S Bi:6:002:1 -115 32768 <
ffff000103533780 4027860735 C Bi:6:002:1 0 471 = 9f010484 00000f80 6e066000 04300000 00000000 79224f00 40440000 86dcdc0f
ffff000103533780 4027860761 S Bi:6:002:1 -115 32768 <
ffff0001035330c0 4027861645 C Bi:6:002:1 0 446 = 86010484 00000f80 840c6000 04300000 00000000 30264f00 44420000 89dddd0f
ffff0001035330c0 4027861670 S Bi:6:002:1 -115 32768 <
ffff000103533480 4027862550 C Bi:6:002:1 0 469 = 9d010484 00000f80 29056000 04300000 00000000 94294f00 42420000 84dddd0f
ffff000103533480 4027862575 S Bi:6:002:1 -115 32768 <
ffff000103533240 4027863468 C Bi:6:002:1 0 479 = a7010484 00000f80 64036000 04300000 00000000 202d4f00 42440000 87dcdc0f
ffff000103533240 4027863493 S Bi:6:002:1 -115 32768 <
ffff000103533780 4027892662 C Bi:6:002:1 0 303 = f7000484 00000f80 e4046000 04300000 00000000 25a04f00 20260000 4bd9d90f
ffff000103533780 4027892686 S Bi:6:002:1 -115 32768 <
ffff0001035330c0 4027905193 C Bi:6:002:1 0 86 = 1e008484 00070f20 ca026900 04380000 00000000 33d24f00 403a0000 7de6e60f
ffff0001035330c0 4027905224 S Bi:6:002:1 -115 32768 <
ffff000103533480 4027962069 C Bi:6:002:1 0 478 = a6010484 00000f80 e8086000 04300000 00000000 59ae5000 40420000 83dddd0f
ffff000103533480 4027962113 S Bi:6:002:1 -115 32768 <
ffff000103533240 4027963067 C Bi:6:002:1 0 471 = 9f010484 00000f80 6f066000 04300000 00000000 35b25000 40440000 86dcdc0f
ffff000103533240 4027963097 S Bi:6:002:1 -115 32768 <
ffff000103533780 4027963982 C Bi:6:002:1 0 446 = 86010484 00000f80 850c6000 04300000 00000000 4ab65000 40440000 83dcdc0f
ffff000103533780 4027963999 S Bi:6:002:1 -115 32768 <
ffff0001035330c0 4027965010 C Bi:6:002:1 0 469 = 9d010484 00000f80 2a056000 04300000 00000000 d4b95000 40440000 86dbdb0f
ffff0001035330c0 4027965034 S Bi:6:002:1 -115 32768 <
ffff000103533480 4027965938 C Bi:6:002:1 0 479 = a7010484 00000f80 65036000 04300000 00000000 56bd5000 42420000 84dcdc0f
ffff000103533480 4027965963 S Bi:6:002:1 -115 32768 <
ffff000103533240 4027997114 C Bi:6:002:1 0 303 = f7000484 00000f80 e5046000 04300000 00000000 27385100 22220000 4ad7d70f
ffff000103533240 4027997147 S Bi:6:002:1 -115 32768 <
ffff000103533780 4028064477 C Bi:6:002:1 0 478 = a6010484 00000f80 e9086000 04300000 00000000 5a3e5200 44440000 89dbdb0f
ffff000103533780 4028064529 S Bi:6:002:1 -115 32768 <
ffff0001035330c0 4028065625 C Bi:6:002:1 0 471 = 9f010484 00000f80 70066000 04300000 00000000 d4425200 42440000 86dcdc0f
ffff0001035330c0 4028065654 S Bi:6:002:1 -115 32768 <
ffff000103533480 4028066562 C Bi:6:002:1 0 446 = 86010484 00000f80 860c6000 04300000 00000000 a3465200 40440000 87dcdc0f
ffff000103533480 4028066587 S Bi:6:002:1 -115 32768 <
ffff000103533240 4028067604 C Bi:6:002:1 0 469 = 9d010484 00000f80 2b056000 04300000 00000000 974a5200 42440000 88dcdc0f
ffff000103533240 4028067629 S Bi:6:002:1 -115 32768 <
ffff000103533780 4028068519 C Bi:6:002:1 0 479 = a7010484 00000f80 66036000 04300000 00000000 254e5200 40440000 85dbdb0f
ffff000103533780 4028068542 S Bi:6:002:1 -115 32768 <
ffff0001035330c0 4028101566 C Bi:6:002:1 0 303 = f7000484 00000f80 e6046000 04300000 00000000 29d05200 22260000 4cd7d70f
ffff0001035330c0 4028101591 S Bi:6:002:1 -115 32768 <
ffff000103533480 4028166908 C Bi:6:002:1 0 478 = a6010484 00000f80 ea086000 04300000 00000000 5cce5300 42420000 86dcdc0f
ffff000103533480 4028166934 S Bi:6:002:1 -115 32768 <
ffff000103533240 4028167894 C Bi:6:002:1 0 471 = 9f010484 00000f80 71066000 04300000 00000000 55d25300 44440000 87dfdf0f
ffff000103533240 4028167920 S Bi:6:002:1 -115 32768 <
ffff000103533780 4028168757 C Bi:6:002:1 0 446 = 86010484 00000f80 870c6000 04300000 00000000 dfd55300 48400000 8bdbdb0f
ffff000103533780 4028168785 S Bi:6:002:1 -115 32768 <
ffff0001035330c0 4028169670 C Bi:6:002:1 0 469 = 9d010484 00000f80 2c056000 04300000 00000000 44d95300 46400000 88dada0f
ffff0001035330c0 4028169693 S Bi:6:002:1 -115 32768 <
ffff000103533480 4028170574 C Bi:6:002:1 0 479 = a7010484 00000f80 67036000 04300000 00000000 c2dc5300 42440000 88dcdc0f
ffff000103533480 4028170599 S Bi:6:002:1 -115 32768 <
