ffff000103533900 1174012682 C Bi:6:002:1 0 383 = 47010484 00000f80 cd0a6000 04300000 00000000 9c8bb400 46360000 89f6f601
ffff000103533900 1174012761 S Bi:6:002:1 -115 32768 <
ffff000103558cc0 1174013674 C Bi:6:002:1 0 376 = 40010484 00000f80 3a026000 04300000 00000000 ab8fb400 463a0000 88f5f501
ffff000103558cc0 1174013699 S Bi:6:002:1 -115 32768 <
ffff00014c2bf900 1174014595 C Bi:6:002:1 0 351 = 27010484 00000f80 fa0b6000 04300000 00000000 6493b400 463a0000 87ecec01
ffff00014c2bf900 1174014619 S Bi:6:002:1 -115 32768 <
ffff00013d62e840 1174015580 C Bi:6:002:1 0 374 = 3e010484 00000f80 cd066000 04300000 00000000 0d97b400 463c0000 87eaea01
ffff00013d62e840 1174015605 S Bi:6:002:1 -115 32768 <
ffff000103533900 1174016478 C Bi:6:002:1 0 384 = 48010484 00000f80 9d096000 04300000 00000000 909ab400 463c0000 87f4f401
ffff000103533900 1174016502 S Bi:6:002:1 -115 32768 <
ffff000103558cc0 1174115365 C Bi:6:002:1 0 383 = 47010484 00000f80 ce0a6000 04300000 00000000 c21cb600 463c0000 88ecec01
ffff000103558cc0 1174115419 S Bi:6:002:1 -115 32768 <
ffff00014c2bf900 1174116244 C Bi:6:002:1 0 376 = 40010484 00000f80 3b026000 04300000 00000000 6820b600 463a0000 82f0f001
ffff00014c2bf900 1174116269 S Bi:6:002:1 -115 32768 <
ffff00013d62e840 1174117214 C Bi:6:002:1 0 351 = 27010484 00000f80 fb0b6000 04300000 00000000 2324b600 463e0000 84f7f701
ffff00013d62e840 1174117240 S Bi:6:002:1 -115 32768 <
ffff000103533900 1174217730 C Bi:6:002:1 0 383 = 47010484 00000f80 cf0a6000 04300000 00000000 a3acb700 463a0000 86f2f201
ffff000103533900 1174217782 S Bi:6:002:1 -115 32768 <
ffff000103558cc0 1174218631 C Bi:6:002:1 0 376 = 40010484 00000f80 3c026000 04300000 00000000 49b0b700 443c0000 86efef01
ffff000103558cc0 1174218658 S Bi:6:002:1 -115 32768 <
ffff00014c2bf900 1174219551 C Bi:6:002:1 0 351 = 27010484 00000f80 fc0b6000 04300000 00000000 03b4b700 463c0000 86f9f901
ffff00014c2bf900 1174219576 S Bi:6:002:1 -115 32768 <
ffff00013d62e840 1174220523 C Bi:6:002:1 0 374 = 3e010484 00000f80 cf066000 04300000 00000000 adb7b700 423a0000 84fbfb01
ffff00013d62e840 1174220548 S Bi:6:002:1 -115 32768 <
ffff000103533900 1174221407 C Bi:6:002:1 0 384 = 48010484 00000f80 9f096000 04300000 00000000 16bbb700 443a0000 87ecec01
ffff000103533900 1174221432 S Bi:6:002:1 -115 32768 <
ffff000103558cc0 1174335730 C Bi:6:002:1 0 376 = 40010484 00000f80 3d026000 04300000 00000000 9a79b900 463c0000 83f9f901
ffff000103558cc0 1174335762 S Bi:6:002:1 -115 32768 <
ffff00014c2bf900 1174336840 C Bi:6:002:1 0 351 = 27010484 00000f80 fd0b6000 04300000 00000000 2c7eb900 403a0000 84f4f401
ffff00014c2bf900 1174336866 S Bi:6:002:1 -115 32768 <
ffff00013d62e840 1174337649 C Bi:6:002:1 0 374 = 3e010484 00000f80 d0066000 04300000 00000000 3881b900 443c0000 89ebeb01
ffff00013d62e840 1174337675 S Bi:6:002:1 -115 32768 <
ffff000103533900 1174338617 C Bi:6:002:1 0 384 = 48010484 00000f80 a0096000 04300000 00000000 f284b900 463c0000 84f0f001
ffff000103533900 1174338642 S Bi:6:002:1 -115 32768 <
ffff000103558cc0 1174423377 C Bi:6:002:1 0 376 = 40010484 00000f80 3e026000 04300000 00000000 fdcfba00 46360000 87f3f301
ffff000103558cc0 1174423425 S Bi:6:002:1 -115 32768 <
ffff00014c2bf900 1174424280 C Bi:6:002:1 0 351 = 27010484 00000f80 fe0b6000 04300000 00000000 b7d3ba00 443a0000 85f5f501
ffff00014c2bf900 1174424305 S Bi:6:002:1 -115 32768 <
ffff00013d62e840 1174425248 C Bi:6:002:1 0 374 = 3e010484 00000f80 d1066000 04300000 00000000 65d7ba00 44380000 86f4f401
ffff00013d62e840 1174425272 S Bi:6:002:1 -115 32768 <
ffff000103533900 1174426104 C Bi:6:002:1 0 384 = 48010484 00000f80 a1096000 04300000 00000000 b1daba00 463c0000 87ebeb01
ffff000103533900 1174426128 S Bi:6:002:1 -115 32768 <
ffff000103558cc0 1174525672 C Bi:6:002:1 0 376 = 40010484 00000f80 3f026000 04300000 00000000 975fbc00 443a0000 86f0f001
ffff000103558cc0 1174525705 S Bi:6:002:1 -115 32768 <
ffff00014c2bf900 1174526667 C Bi:6:002:1 0 351 = 27010484 00000f80 ff0b6000 04300000 00000000 b363bc00 463c0000 87e9e901
ffff00014c2bf900 1174526694 S Bi:6:002:1 -115 32768 <
ffff00013d62e840 1174527510 C Bi:6:002:1 0 374 = 3e010484 00000f80 d2066000 04300000 00000000 dd66bc00 463a0000 87000001
ffff00013d62e840 1174527535 S Bi:6:002:1 -115 32768 <
ffff000103533900 1174528369 C Bi:6:002:1 0 384 = 48010484 00000f80 a2096000 04300000 00000000 256abc00 443c0000 83f8f801
ffff000103533900 1174528395 S Bi:6:002:1 -115 32768 <
ffff000103558cc0 1174561871 C Bi:6:002:1 0 310 = fe000484 00000f80 410f6000 00300000 00000000 b5e6bc00 38380000 50520001
ffff000103558cc0 1174561927 S Bi:6:002:1 -115 32768 <
ffff00014c2bf900 1174627038 C Bi:6:002:1 0 383 = 47010484 00000f80 d30a6000 04300000 00000000 a5ebbd00 463e0000 88f8f801
ffff00014c2bf900 1174627061 S Bi:6:002:1 -115 32768 <
ffff00013d62e840 1174627963 C Bi:6:002:1 0 376 = 40010484 00000f80 40026000 04300000 00000000 55efbd00 463a0000 85f6f601
ffff00013d62e840 1174627987 S Bi:6:002:1 -115 32768 <
ffff000103533900 1174628756 C Bi:6:002:1 0 351 = 27010484 00000f80 000c6000 04300000 00000000 aff2bd00 443c0000 88f1f101
ffff000103533900 1174628774 S Bi:6:002:1 -115 32768 <
ffff000103558cc0 1174629634 C Bi:6:002:1 0 374 = 3e010484 00000f80 d3066000 04300000 00000000 e1f5bd00 463c0000 87f5f501
ffff000103558cc0 1174629657 S Bi:6:002:1 -115 32768 <
ffff00014c2bf900 1174630479 C Bi:6:002:1 0 384 = 48010484 00000f80 a3096000 04300000 00000000 02f9bd00 463c0000 84f8f801
ffff00014c2bf900 1174630504 S Bi:6:002:1 -115 32768 <
ffff00013d62e840 1174729477 C Bi:6:002:1 0 383 = 47010484 00000f80 d40a6000 04300000 00000000 a67bbf00 463a0000 87f1f101
ffff00013d62e840 1174729505 S Bi:6:002:1 -115 32768 <
ffff000103533900 1174730441 C Bi:6:002:1 0 376 = 40010484 00000f80 41026000 04300000 00000000 887fbf00 44380000 87f1f101
ffff000103533900 1174730502 S Bi:6:002:1 -115 32768 <
ffff000103558cc0 1174733445 C Bi:6:002:1 0 384 = 48010484 00000f80 a4096000 04300000 00000000 248bbf00 463c0000 89e6e601
ffff000103558cc0 1174733472 S Bi:6:002:1 -115 32768 <
ffff000103533780 1174748253 S Ci:6:002:0 s c0 05 0770 0000 0004 4 <
ffff000103533780 1174748431 C Ci:6:002:0 0 4 = 00000000
ffff000103533780 1174748584 S Ci:6:002:0 s c0 05 0774 0000 0004 4 <
ffff000103533780 1174748730 C Ci:6:002:0 0 4 = 00000000
ffff000103533780 1174748892 S Co:6:002:0 s 40 05 076e 0000 0001 1 = 0c
ffff000103533780 1174749029 C Co:6:002:0 0 1 >
ffff000103533780 1174749195 S Ci:6:002:0 s c0 05 0808 0000 0004 4 <
ffff000103533780 1174749340 C Ci:6:002:0 0 4 = 3382023e
ffff000103533780 1174749499 S Ci:6:002:0 s c0 05 0a5c 0000 0002 2 <
ffff000103533780 1174749646 C Ci:6:002:0 0 2 = aa00
ffff000103533780 1174749791 S Ci:6:002:0 s c0 05 0f48 0000 0002 2 <
ffff000103533780 1174749924 C Ci:6:002:0 0 2 = b701
ffff000103533780 1174750067 S Ci:6:002:0 s c0 05 0f04 0000 0004 4 <
ffff000103533780 1174750187 C Ci:6:002:0 0 4 = 01000500
ffff000103533780 1174750228 S Ci:6:002:0 s c0 05 0f14 0000 0004 4 <
ffff000103533780 1174750337 C Ci:6:002:0 0 4 = db001b00
ffff000103533780 1174750368 S Ci:6:002:0 s c0 05 0f10 0000 0004 4 <
ffff000103533780 1174750479 C Ci:6:002:0 0 4 = 00000000
ffff000103533780 1174750508 S Ci:6:002:0 s c0 05 0f0c 0000 0004 4 <
ffff000103533780 1174750626 C Ci:6:002:0 0 4 = 00000000
ffff000103533780 1174750647 S Ci:6:002:0 s c0 05 0f08 0000 0004 4 <
ffff000103533780 1174750760 C Ci:6:002:0 0 4 = 0001ad02
ffff000103533780 1174750788 S Ci:6:002:0 s c0 05 0fcc 0000 0004 4 <
ffff000103533780 1174750911 C Ci:6:002:0 0 4 = 00000000
ffff000103533780 1174750934 S Ci:6:002:0 s c0 05 09a4 0000 0004 4 <
ffff000103533780 1174751047 C Ci:6:002:0 0 4 = 80000800
ffff000103533780 1174751077 S Co:6:002:0 s 40 05 09a4 0000 0004 4 = 80000a00
ffff000103533780 1174751190 C Co:6:002:0 0 4 >
ffff000103533780 1174751210 S Ci:6:002:0 s c0 05 09a4 0000 0004 4 <
ffff000103533780 1174751322 C Ci:6:002:0 0 4 = 80000a00
ffff000103533780 1174751351 S Co:6:002:0 s 40 05 09a4 0000 0004 4 = 80000800
ffff000103533780 1174751466 C Co:6:002:0 0 4 >
ffff000103533780 1174751486 S Ci:6:002:0 s c0 05 0a2c 0000 0004 4 <
ffff000103533780 1174751599 C Ci:6:002:0 0 4 = 00809000
ffff000103533780 1174751627 S Co:6:002:0 s 40 05 0a2c 0000 0004 4 = 00009000
ffff000103533780 1174751742 C Co:6:002:0 0 4 >
ffff000103533780 1174751762 S Ci:6:002:0 s c0 05 0a2c 0000 0004 4 <
ffff000103533780 1174751874 C Ci:6:002:0 0 4 = 00009000
ffff000103533780 1174751903 S Co:6:002:0 s 40 05 0a2c 0000 0004 4 = 00809000
ffff000103533780 1174752011 C Co:6:002:0 0 4 >
ffff000103533780 1174752041 S Ci:6:002:0 s c0 05 0b58 0000 0004 4 <
ffff000103533780 1174752164 C Ci:6:002:0 0 4 = 00000000
ffff000103533780 1174752192 S Co:6:002:0 s 40 05 0b58 0000 0004 4 = 01000000
ffff000103533780 1174752307 C Co:6:002:0 0 4 >
ffff000103533780 1174752328 S Ci:6:002:0 s c0 05 0b58 0000 0004 4 <
ffff000103533780 1174752440 C Ci:6:002:0 0 4 = 01000000
ffff000103533780 1174752468 S Co:6:002:0 s 40 05 0b58 0000 0004 4 = 00000000
ffff000103533780 1174752582 C Co:6:002:0 0 4 >
ffff000103533780 1174752605 S Ci:6:002:0 s c0 05 01cc 0000 0001 1 <
ffff000103533780 1174752715 C Ci:6:002:0 0 1 = 00
ffff000103533780 1174752744 S Co:6:002:0 s 40 05 01f4 0000 0004 4 = 00000000
ffff000103533780 1174752780 C Co:6:002:0 0 4 >
ffff000103533780 1174752796 S Co:6:002:0 s 40 05 01d4 0000 0004 4 = 58000000
ffff000103533780 1174752913 C Co:6:002:0 0 4 >
ffff000103533780 1174753053 S Co:6:002:0 s 40 05 0440 0000 0004 4 = 00000000
ffff000103533780 1174753164 C Co:6:002:0 0 4 >
ffff000103533780 1174753199 S Ci:6:002:0 s c0 05 0c00 0000 0004 4 <
ffff000103533780 1174753313 C Ci:6:002:0 0 4 = 07000000
ffff000103533780 1174753340 S Ci:6:002:0 s c0 05 08b0 0000 0004 4 <
ffff000103533780 1174753452 C Ci:6:002:0 0 4 = 18060000
ffff000103533780 1174753482 S Co:6:002:0 s 40 05 08b0 0000 0004 4 = 42060000
ffff000103533780 1174753590 C Co:6:002:0 0 4 >
ffff000103533780 1174753632 S Ci:6:002:0 s c0 05 0d04 0000 0004 4 <
ffff000103533780 1174753742 C Ci:6:002:0 0 4 = 088d90b1
ffff000103533780 1174753775 S Co:6:002:0 s 40 05 0c90 0000 0004 4 = 088d2304
ffff000103533780 1174753888 C Co:6:002:0 0 4 >
ffff000103533780 1174753923 S Co:6:002:0 s 40 05 0280 0000 0002 2 = 0001
ffff000103533780 1174754036 C Co:6:002:0 0 2 >
ffff000103533780 1174754065 S Ci:6:002:0 s c0 05 010c 0000 0001 1 <
ffff000103533780 1174754183 C Ci:6:002:0 0 1 = b4
ffff000103533780 1174754206 S Co:6:002:0 s 40 05 010c 0000 0001 1 = b4
ffff000103533780 1174754315 C Co:6:002:0 0 1 >
ffff00014c2bf900 1174770699 C Bi:6:002:1 0 310 = fe000484 00000f80 430f6000 00300000 00000000 9d16c000 3c380000 5d520001
ffff00014c2bf900 1174770744 S Bi:6:002:1 -115 32768 <
ffff000103533780 1174780316 S Ci:6:002:0 s c0 05 004c 0000 0001 1 <
ffff000103533780 1174780463 C Ci:6:002:0 0 1 = 20
ffff000103533780 1174780616 S Co:6:002:0 s 40 05 004c 0000 0001 1 = 20
ffff000103533780 1174780754 C Co:6:002:0 0 1 >
ffff00013d62e840 1174831878 C Bi:6:002:1 0 383 = 47010484 00000f80 d50a6000 04300000 00000000 a80bc100 463c0000 86f5f501
ffff00013d62e840 1174831914 S Bi:6:002:1 -115 32768 <
ffff000103533900 1174833441 C Bi:6:002:1 0 376 = 40010484 00000f80 42026000 04300000 00000000 ec11c100 443a0000 86eaea01
ffff000103533900 1174833467 S Bi:6:002:1 -115 32768 <
ffff000103558cc0 1174834208 C Bi:6:002:1 0 351 = 27010484 00000f80 020c6000 04300000 00000000 0715c100 463c0000 86f0f001
ffff000103558cc0 1174834232 S Bi:6:002:1 -115 32768 <
ffff00014c2bf900 1174834983 C Bi:6:002:1 0 374 = 3e010484 00000f80 d5066000 04300000 00000000 0518c100 463a0000 88fafa01
ffff00014c2bf900 1174835004 S Bi:6:002:1 -115 32768 <
ffff00013d62e840 1174835794 C Bi:6:002:1 0 384 = 48010484 00000f80 a5096000 04300000 00000000 211bc100 463a0000 84ebeb01
ffff00013d62e840 1174835814 S Bi:6:002:1 -115 32768 <
ffff00013d62e540 1174922606 S Ci:6:002:0 s c0 05 0454 0000 0001 1 <
ffff00013d62e540 1174922766 C Ci:6:002:0 0 1 = 00
ffff00013d62e540 1174922802 S Ci:6:002:0 s c0 05 0860 0000 0004 4 <
ffff00013d62e540 1174922906 C Ci:6:002:0 0 4 = 21c3d572
ffff000102d1c840 1174922946 S Co:6:002:0 s 40 05 0860 0000 0004 4 = 21c3d572
ffff000102d1c840 1174923052 C Co:6:002:0 0 4 >
ffff00010314f0c0 1174923091 S Ci:6:002:0 s c0 05 0c00 0000 0004 4 <
ffff00010314f0c0 1174923203 C Ci:6:002:0 0 4 = 07000000
ffff00010314f0c0 1174923237 S Ci:6:002:0 s c0 05 08b0 0000 0004 4 <
ffff00010314f0c0 1174923350 C Ci:6:002:0 0 4 = 42060000
ffff00010314f0c0 1174923396 S Co:6:002:0 s 40 05 08b0 0000 0004 4 = 18060000
ffff00010314f0c0 1174923502 C Co:6:002:0 0 4 >
ffff00010314f0c0 1174923569 S Ci:6:002:0 s c0 05 0d04 0000 0004 4 <
ffff00010314f0c0 1174923689 C Ci:6:002:0 0 4 = 017c90b1
ffff00010314f0c0 1174923734 S Co:6:002:0 s 40 05 0c90 0000 0004 4 = 017c8001
ffff00010314f0c0 1174923842 C Co:6:002:0 0 4 >
ffff00010314f0c0 1174923929 S Ci:6:002:0 s c0 05 08ac 0000 0004 4 <
ffff00010314f0c0 1174924052 C Ci:6:002:0 0 4 = 08faf00f
ffff00010314f0c0 1174924098 S Co:6:002:0 s 40 05 08ac 0000 0004 4 = 08faf00f
ffff00010314f0c0 1174924211 C Co:6:002:0 0 4 >
ffff00010314f0c0 1174924366 S Ci:6:002:0 s c0 05 08ac 0000 0004 4 <
ffff00010314f0c0 1174924508 C Ci:6:002:0 0 4 = 08faf00f
ffff00010314f0c0 1174924636 S Co:6:002:0 s 40 05 08ac 0000 0004 4 = 08faf00f
ffff00010314f0c0 1174924761 C Co:6:002:0 0 4 >
ffff00010314f0c0 1174924925 S Ci:6:002:0 s c0 05 08c4 0000 0004 4 <
ffff00010314f0c0 1174925068 C Ci:6:002:0 0 4 = 00000000
ffff00010314f0c0 1174925197 S Co:6:002:0 s 40 05 08c4 0000 0004 4 = 00000000
ffff00010314f0c0 1174925308 C Co:6:002:0 0 4 >
ffff00010314f0c0 1174925357 S Ci:6:002:0 s c0 05 0c00 0000 0004 4 <
ffff00010314f0c0 1174925469 C Ci:6:002:0 0 4 = 07000000
ffff00010314f0c0 1174925514 S Ci:6:002:0 s c0 05 08b0 0000 0004 4 <
ffff00010314f0c0 1174925623 C Ci:6:002:0 0 4 = 18060000
ffff00010314f0c0 1174925670 S Co:6:002:0 s 40 05 08b0 0000 0004 4 = 18060000
ffff00010314f0c0 1174925784 C Co:6:002:0 0 4 >
ffff00010314f0c0 1174925850 S Ci:6:002:0 s c0 05 0d04 0000 0004 4 <
ffff00010314f0c0 1174925970 C Ci:6:002:0 0 4 = 017c90b1
ffff00010314f0c0 1174926016 S Co:6:002:0 s 40 05 0c90 0000 0004 4 = 017c8001
ffff00010314f0c0 1174926122 C Co:6:002:0 0 4 >
ffff00010314f0c0 1174926180 S Ci:6:002:0 s c0 05 0e00 0000 0004 4 <
ffff00010314f0c0 1174926298 C Ci:6:002:0 0 4 = 07000000
ffff00010314f0c0 1174926343 S Ci:6:002:0 s c0 05 08b0 0000 0004 4 <
ffff00010314f0c0 1174926454 C Ci:6:002:0 0 4 = 18060000
ffff00010314f0c0 1174926499 S Co:6:002:0 s 40 05 08b0 0000 0004 4 = 18060000
ffff00010314f0c0 1174926605 C Co:6:002:0 0 4 >
ffff00010314f0c0 1174926673 S Ci:6:002:0 s c0 05 0d44 0000 0004 4 <
ffff00010314f0c0 1174926792 C Ci:6:002:0 0 4 = 017c90b1
ffff00010314f0c0 1174926838 S Co:6:002:0 s 40 05 0e90 0000 0004 4 = 017c8001
ffff00010314f0c0 1174926943 C Co:6:002:0 0 4 >
ffff00010314f0c0 1174927002 S Ci:6:002:0 s c0 05 08ac 0000 0004 4 <
ffff00010314f0c0 1174927122 C Ci:6:002:0 0 4 = 08faf00f
ffff00010314f0c0 1174927168 S Co:6:002:0 s 40 05 08ac 0000 0004 4 = 08faf00f
ffff00010314f0c0 1174927285 C Co:6:002:0 0 4 >
ffff00010314f0c0 1174927330 S Ci:6:002:0 s c0 05 08ac 0000 0004 4 <
ffff00010314f0c0 1174927450 C Ci:6:002:0 0 4 = 08faf00f
ffff00010314f0c0 1174927495 S Co:6:002:0 s 40 05 08ac 0000 0004 4 = 08faf00f
ffff00010314f0c0 1174927601 C Co:6:002:0 0 4 >
ffff00010314f0c0 1174927649 S Ci:6:002:0 s c0 05 08c4 0000 0004 4 <
ffff00010314f0c0 1174927786 C Ci:6:002:0 0 4 = 00000000
ffff00010314f0c0 1174927831 S Co:6:002:0 s 40 05 08c4 0000 0004 4 = 00000000
ffff00010314f0c0 1174927938 C Co:6:002:0 0 4 >
ffff00010314f0c0 1174927984 S Ci:6:002:0 s c0 05 0e00 0000 0004 4 <
ffff00010314f0c0 1174928120 C Ci:6:002:0 0 4 = 07000000
ffff00010314f0c0 1174928170 S Ci:6:002:0 s c0 05 08b0 0000 0004 4 <
ffff00010314f0c0 1174928290 C Ci:6:002:0 0 4 = 18060000
ffff00010314f0c0 1174928337 S Co:6:002:0 s 40 05 08b0 0000 0004 4 = 18060000
ffff00010314f0c0 1174928451 C Co:6:002:0 0 4 >
ffff00010314f0c0 1174928516 S Ci:6:002:0 s c0 05 0d44 0000 0004 4 <
ffff00010314f0c0 1174928635 C Ci:6:002:0 0 4 = 017c90b1
ffff00010314f0c0 1174928680 S Co:6:002:0 s 40 05 0e90 0000 0004 4 = 017c8001
ffff00010314f0c0 1174928787 C Co:6:002:0 0 4 >
ffff00010314f0c0 1174928846 S Ci:6:002:0 s c0 05 0668 0000 0002 2 <
ffff00010314f0c0 1174928984 C Ci:6:002:0 0 2 = 0010
ffff00010314f0c0 1174929029 S Co:6:002:0 s 40 05 0668 0000 0002 2 = 0010
ffff00010314f0c0 1174929155 C Co:6:002:0 0 2 >
ffff00010314f0c0 1174929191 S Co:6:002:0 s 40 05 0483 0000 0001 1 = 00
ffff00010314f0c0 1174929305 C Co:6:002:0 0 1 >
ffff00010314f0c0 1174929351 S Ci:6:002:0 s c0 05 0837 0000 0001 1 <
ffff00010314f0c0 1174929460 C Ci:6:002:0 0 1 = 00
ffff00010314f0c0 1174929505 S Ci:6:002:0 s c0 05 08ac 0000 0004 4 <
ffff00010314f0c0 1174929614 C Ci:6:002:0 0 4 = 08faf00f
ffff00010314f0c0 1174929659 S Co:6:002:0 s 40 05 08ac 0000 0004 4 = 08faf00f
ffff00010314f0c0 1174929777 C Co:6:002:0 0 4 >
ffff00010314f0c0 1174929823 S Ci:6:002:0 s c0 05 08c4 0000 0004 4 <
ffff00010314f0c0 1174929944 C Ci:6:002:0 0 4 = 00000000
ffff00010314f0c0 1174929989 S Co:6:002:0 s 40 05 08c4 0000 0004 4 = 00000000
ffff00010314f0c0 1174930094 C Co:6:002:0 0 4 >
ffff00010314f0c0 1174930140 S Ci:6:002:0 s c0 05 0848 0000 0004 4 <
ffff00010314f0c0 1174930261 C Ci:6:002:0 0 4 = 8bffd061
ffff00010314f0c0 1174930306 S Co:6:002:0 s 40 05 0848 0000 0004 4 = 8bffd061
ffff00010314f0c0 1174930411 C Co:6:002:0 0 4 >
ffff00010314f0c0 1174930457 S Ci:6:002:0 s c0 05 08ac 0000 0004 4 <
ffff00010314f0c0 1174930577 C Ci:6:002:0 0 4 = 08faf00f
ffff00010314f0c0 1174930622 S Co:6:002:0 s 40 05 08ac 0000 0004 4 = 08faf00f
ffff00010314f0c0 1174930727 C Co:6:002:0 0 4 >
ffff00010314f0c0 1174930774 S Ci:6:002:0 s c0 05 08ac 0000 0004 4 <
ffff00010314f0c0 1174930911 C Ci:6:002:0 0 4 = 08faf00f
ffff00010314f0c0 1174930956 S Co:6:002:0 s 40 05 08ac 0000 0004 4 = 08faf00f
ffff00010314f0c0 1174931061 C Co:6:002:0 0 4 >
ffff00010314f0c0 1174931107 S Ci:6:002:0 s c0 05 08c4 0000 0004 4 <
ffff00010314f0c0 1174931158 C Ci:6:002:0 0 4 = 00000000
ffff00010314f0c0 1174931194 S Co:6:002:0 s 40 05 08c4 0000 0004 4 = 00000000
ffff00010314f0c0 1174931226 C Co:6:002:0 0 4 >
ffff00010314f0c0 1174931260 S Ci:6:002:0 s c0 05 0c00 0000 0004 4 <
ffff00010314f0c0 1174931297 C Ci:6:002:0 0 4 = 07000000
ffff00010314f0c0 1174931332 S Ci:6:002:0 s c0 05 08b0 0000 0004 4 <
ffff00010314f0c0 1174931369 C Ci:6:002:0 0 4 = 18060000
ffff00010314f0c0 1174931404 S Co:6:002:0 s 40 05 08b0 0000 0004 4 = 18060000
ffff00010314f0c0 1174931435 C Co:6:002:0 0 4 >
ffff00010314f0c0 1174931490 S Ci:6:002:0 s c0 05 0d04 0000 0004 4 <
ffff00010314f0c0 1174931539 C Ci:6:002:0 0 4 = 017c90b1
ffff00010314f0c0 1174931573 S Co:6:002:0 s 40 05 0c90 0000 0004 4 = 017c8001
ffff00010314f0c0 1174931604 C Co:6:002:0 0 4 >
ffff00010314f0c0 1174931650 S Ci:6:002:0 s c0 05 0e00 0000 0004 4 <
ffff00010314f0c0 1174931715 C Ci:6:002:0 0 4 = 07000000
ffff00010314f0c0 1174931750 S Ci:6:002:0 s c0 05 08b0 0000 0004 4 <
ffff00010314f0c0 1174931787 C Ci:6:002:0 0 4 = 18060000
ffff00010314f0c0 1174931820 S Co:6:002:0 s 40 05 08b0 0000 0004 4 = 18060000
ffff00010314f0c0 1174931852 C Co:6:002:0 0 4 >
ffff00010314f0c0 1174931905 S Ci:6:002:0 s c0 05 0d44 0000 0004 4 <
ffff00010314f0c0 1174931967 C Ci:6:002:0 0 4 = 017c90b1
ffff00010314f0c0 1174932014 S Co:6:002:0 s 40 05 0e90 0000 0004 4 = 017c8001
ffff00010314f0c0 1174932058 C Co:6:002:0 0 4 >
ffff00010314f0c0 1174932128 S Ci:6:002:0 s c0 05 0c20 0000 0004 4 <
ffff00010314f0c0 1174932250 C Ci:6:002:0 0 4 = 13131313
ffff00010314f0c0 1174932304 S Co:6:002:0 s 40 05 0c20 0000 0004 4 = 13131313
ffff00010314f0c0 1174932415 C Co:6:002:0 0 4 >
ffff00010314f0c0 1174932462 S Ci:6:002:0 s c0 05 0c24 0000 0004 4 <
ffff00010314f0c0 1174932582 C Ci:6:002:0 0 4 = 20202020
ffff00010314f0c0 1174932627 S Co:6:002:0 s 40 05 0c24 0000 0004 4 = 20202020
ffff00010314f0c0 1174932733 C Co:6:002:0 0 4 >
ffff00010314f0c0 1174932780 S Ci:6:002:0 s c0 05 0c28 0000 0004 4 <
ffff00010314f0c0 1174932914 C Ci:6:002:0 0 4 = 20201e1c
ffff00010314f0c0 1174932960 S Co:6:002:0 s 40 05 0c28 0000 0004 4 = 20201e1c
ffff00010314f0c0 1174933066 C Co:6:002:0 0 4 >
ffff00010314f0c0 1174933112 S Ci:6:002:0 s c0 05 0c2c 0000 0004 4 <
ffff00010314f0c0 1174933235 C Ci:6:002:0 0 4 = 20202020
ffff00010314f0c0 1174933281 S Co:6:002:0 s 40 05 0c2c 0000 0004 4 = 20202020
ffff00010314f0c0 1174933386 C Co:6:002:0 0 4 >
ffff00010314f0c0 1174933433 S Ci:6:002:0 s c0 05 0c30 0000 0004 4 <
ffff00010314f0c0 1174933554 C Ci:6:002:0 0 4 = 20201e1c
ffff00010314f0c0 1174933599 S Co:6:002:0 s 40 05 0c30 0000 0004 4 = 20201e1c
ffff00010314f0c0 1174933705 C Co:6:002:0 0 4 >
ffff00010314f0c0 1174933752 S Ci:6:002:0 s c0 05 0c34 0000 0004 4 <
ffff00010314f0c0 1174933885 C Ci:6:002:0 0 4 = 20202020
ffff00010314f0c0 1174933930 S Co:6:002:0 s 40 05 0c34 0000 0004 4 = 20202020
ffff00010314f0c0 1174934036 C Co:6:002:0 0 4 >
ffff00010314f0c0 1174934083 S Ci:6:002:0 s c0 05 0c38 0000 0004 4 <
ffff00010314f0c0 1174934211 C Ci:6:002:0 0 4 = 201e1c1a
ffff00010314f0c0 1174934257 S Co:6:002:0 s 40 05 0c38 0000 0004 4 = 201e1c1a
ffff000103533900 1174934265 C Bi:6:002:1 0 383 = 47010484 00000f80 d60a6000 04300000 00000000 a99bc200 443a0000 85efef01
ffff000103533900 1174934288 S Bi:6:002:1 -115 32768 <
ffff00010314f0c0 1174934343 C Co:6:002:0 0 4 >
ffff00010314f0c0 1174934381 S Ci:6:002:0 s c0 05 0c3c 0000 0004 4 <
ffff00010314f0c0 1174934446 C Ci:6:002:0 0 4 = 20202020
ffff00010314f0c0 1174934484 S Co:6:002:0 s 40 05 0c3c 0000 0004 4 = 20202020
ffff00010314f0c0 1174934588 C Co:6:002:0 0 4 >
ffff00010314f0c0 1174934633 S Ci:6:002:0 s c0 05 0c40 0000 0004 4 <
ffff00010314f0c0 1174934744 C Ci:6:002:0 0 4 = 20201e1c
ffff00010314f0c0 1174934790 S Co:6:002:0 s 40 05 0c40 0000 0004 4 = 20201e1c
ffff00010314f0c0 1174934909 C Co:6:002:0 0 4 >
ffff00010314f0c0 1174934956 S Ci:6:002:0 s c0 05 0c44 0000 0004 4 <
ffff00010314f0c0 1174935077 C Ci:6:002:0 0 4 = 1a181e1e
ffff00010314f0c0 1174935123 S Co:6:002:0 s 40 05 0c44 0000 0004 4 = 1a181e1e
ffff000103558cc0 1174935158 C Bi:6:002:1 0 376 = 40010484 00000f80 43026000 04300000 00000000 959fc200 463a0000 87f1f101
ffff000103558cc0 1174935186 S Bi:6:002:1 -115 32768 <
ffff00010314f0c0 1174935230 C Co:6:002:0 0 4 >
ffff00010314f0c0 1174935268 S Ci:6:002:0 s c0 05 0c48 0000 0004 4 <
ffff00010314f0c0 1174935339 C Ci:6:002:0 0 4 = 1e1e1e1e
ffff00010314f0c0 1174935376 S Co:6:002:0 s 40 05 0c48 0000 0004 4 = 1e1e1e1e
ffff00010314f0c0 1174935408 C Co:6:002:0 0 4 >
ffff00010314f0c0 1174935443 S Ci:6:002:0 s c0 05 0c4c 0000 0004 4 <
ffff00010314f0c0 1174935482 C Ci:6:002:0 0 4 = 1c1a1816
ffff00010314f0c0 1174935517 S Co:6:002:0 s 40 05 0c4c 0000 0004 4 = 1c1a1816
ffff00010314f0c0 1174935548 C Co:6:002:0 0 4 >
ffff00010314f0c0 1174935583 S Ci:6:002:0 s c0 05 0c54 0000 0004 4 <
ffff00010314f0c0 1174935623 C Ci:6:002:0 0 4 = 120a0400
ffff00010314f0c0 1174935658 S Co:6:002:0 s 40 05 0c54 0000 0004 4 = 120a0400
ffff00010314f0c0 1174935707 C Co:6:002:0 0 4 >
ffff00010314f0c0 1174935742 S Ci:6:002:0 s c0 05 0e20 0000 0004 4 <
ffff00010314f0c0 1174935781 C Ci:6:002:0 0 4 = 14141414
ffff00010314f0c0 1174935816 S Co:6:002:0 s 40 05 0e20 0000 0004 4 = 14141414
ffff00010314f0c0 1174935849 C Co:6:002:0 0 4 >
ffff00010314f0c0 1174935884 S Ci:6:002:0 s c0 05 0e24 0000 0004 4 <
ffff00010314f0c0 1174935923 C Ci:6:002:0 0 4 = 1d1d1d1d
ffff000105bdc000 1174935958 S Co:6:002:0 s 40 05 0e24 0000 0004 4 = 1d1d1d1d
ffff00014c2bf900 1174935981 C Bi:6:002:1 0 351 = 27010484 00000f80 030c6000 04300000 00000000 d4a2c200 463c0000 86e6e601
ffff00014c2bf900 1174936025 S Bi:6:002:1 -115 32768 <
ffff000105bdc000 1174936091 C Co:6:002:0 0 4 >
ffff000105bdc000 1174936131 S Ci:6:002:0 s c0 05 0e28 0000 0004 4 <
ffff000105bdc000 1174936180 C Ci:6:002:0 0 4 = 1d1d1b19
ffff000105bdc000 1174936219 S Co:6:002:0 s 40 05 0e28 0000 0004 4 = 1d1d1b19
ffff000105bdc000 1174936252 C Co:6:002:0 0 4 >
ffff000105bdc000 1174936288 S Ci:6:002:0 s c0 05 0e2c 0000 0004 4 <
ffff000105bdc000 1174936343 C Ci:6:002:0 0 4 = 1f1f1f1f
ffff000105bdc000 1174936379 S Co:6:002:0 s 40 05 0e2c 0000 0004 4 = 1f1f1f1f
ffff000105bdc000 1174936411 C Co:6:002:0 0 4 >
ffff000105bdc000 1174936446 S Ci:6:002:0 s c0 05 0e30 0000 0004 4 <
ffff000105bdc000 1174936481 C Ci:6:002:0 0 4 = 1f1f1d1b
ffff000105bdc000 1174936517 S Co:6:002:0 s 40 05 0e30 0000 0004 4 = 1f1f1d1b
ffff000105bdc000 1174936549 C Co:6:002:0 0 4 >
ffff000105bdc000 1174936583 S Ci:6:002:0 s c0 05 0e34 0000 0004 4 <
ffff000105bdc000 1174936619 C Ci:6:002:0 0 4 = 1f1f1f1f
ffff000105bdc000 1174936654 S Co:6:002:0 s 40 05 0e34 0000 0004 4 = 1f1f1f1f
ffff000105bdc000 1174936686 C Co:6:002:0 0 4 >
ffff000103a6e000 1174936720 S Ci:6:002:0 s c0 05 0e38 0000 0004 4 <
ffff00013d62e840 1174936744 C Bi:6:002:1 0 374 = 3e010484 00000f80 d6066000 04300000 00000000 d0a5c200 443c0000 86f7f701
ffff00013d62e840 1174936771 S Bi:6:002:1 -115 32768 <
ffff000103a6e000 1174936806 C Ci:6:002:0 0 4 = 1f1d1b19
ffff000103a6e000 1174936844 S Co:6:002:0 s 40 05 0e38 0000 0004 4 = 1f1d1b19
ffff000103a6e000 1174936878 C Co:6:002:0 0 4 >
ffff000103a6e000 1174936915 S Ci:6:002:0 s c0 05 0e3c 0000 0004 4 <
ffff000103a6e000 1174936967 C Ci:6:002:0 0 4 = 1f1f1f1f
ffff000103a6e000 1174937002 S Co:6:002:0 s 40 05 0e3c 0000 0004 4 = 1f1f1f1f
ffff000103a6e000 1174937034 C Co:6:002:0 0 4 >
ffff000103a6e000 1174937068 S Ci:6:002:0 s c0 05 0e40 0000 0004 4 <
ffff000103a6e000 1174937104 C Ci:6:002:0 0 4 = 1f1f1d1b
ffff000103a6e000 1174937139 S Co:6:002:0 s 40 05 0e40 0000 0004 4 = 1f1f1d1b
ffff000103a6e000 1174937171 C Co:6:002:0 0 4 >
ffff000103a6e000 1174937206 S Ci:6:002:0 s c0 05 0e44 0000 0004 4 <
ffff000103a6e000 1174937242 C Ci:6:002:0 0 4 = 19171d1d
ffff000103a6e000 1174937277 S Co:6:002:0 s 40 05 0e44 0000 0004 4 = 19171d1d
ffff000103a6e000 1174937309 C Co:6:002:0 0 4 >
ffff000103a6e000 1174937343 S Ci:6:002:0 s c0 05 0e48 0000 0004 4 <
ffff000103a6e000 1174937380 C Ci:6:002:0 0 4 = 1d1d1d1d
ffff000103a6e000 1174937415 S Co:6:002:0 s 40 05 0e48 0000 0004 4 = 1d1d1d1d
ffff000103a6e000 1174937464 C Co:6:002:0 0 4 >
ffff000103a6e000 1174937499 S Ci:6:002:0 s c0 05 0e4c 0000 0004 4 <
ffff000103a6e000 1174937539 C Ci:6:002:0 0 4 = 1b191715
ffff000103a6e000 1174937574 S Co:6:002:0 s 40 05 0e4c 0000 0004 4 = 1b191715
ffff000103533900 1174937580 C Bi:6:002:1 0 384 = 48010484 00000f80 a6096000 04300000 00000000 e9a8c200 3e3a0000 85f1f101
ffff000103533900 1174937586 S Bi:6:002:1 -115 32768 <
ffff000103a6e000 1174937630 C Co:6:002:0 0 4 >
ffff000103a6e000 1174937669 S Ci:6:002:0 s c0 05 0e54 0000 0004 4 <
ffff000103a6e000 1174937718 C Ci:6:002:0 0 4 = 11090300
ffff000103a6e000 1174937756 S Co:6:002:0 s 40 05 0e54 0000 0004 4 = 11090300
ffff000103a6e000 1174937788 C Co:6:002:0 0 4 >
ffff000103a6e000 1174937839 S Ci:6:002:0 s c0 05 0454 0000 0001 1 <
ffff000103a6e000 1174937887 C Ci:6:002:0 0 1 = 00
ffff000103a6e000 1174937922 S Ci:6:002:0 s c0 05 0454 0000 0001 1 <
ffff000103a6e000 1174937966 C Ci:6:002:0 0 1 = 00
ffff000103a6e000 1174938000 S Co:6:002:0 s 40 05 0454 0000 0001 1 = 80
ffff000103a6e000 1174938031 C Co:6:002:0 0 1 >
ffff000103a6e000 1174938065 S Ci:6:002:0 s c0 05 041a 0000 0002 2 <
ffff000103a6e000 1174938101 C Ci:6:002:0 0 2 = ff0f
ffff000103a6e000 1174938136 S Ci:6:002:0 s c0 05 0808 0000 0004 4 <
ffff000103a6e000 1174938172 C Ci:6:002:0 0 4 = 3382023e
ffff000103a6e000 1174938208 S Co:6:002:0 s 40 05 0808 0000 0004 4 = 3382023e
ffff000103a6e000 1174938239 C Co:6:002:0 0 4 >
ffff000103a6e000 1174938274 S Ci:6:002:0 s c0 05 0834 0000 0004 4 <
ffff000103a6e000 1174938311 C Ci:6:002:0 0 4 = 05a73700
ffff000103a6e000 1174938346 S Co:6:002:0 s 40 05 0834 0000 0004 4 = 06a73700
ffff000103a6e000 1174938378 C Co:6:002:0 0 4 >
ffff000103a6e000 1174938412 S Ci:6:002:0 s c0 05 0830 0000 0004 4 <
ffff000103a6e000 1174938466 C Ci:6:002:0 0 4 = b8eeaa2e
ffff000103a6e000 1174938500 S Co:6:002:0 s 40 05 0830 0000 0004 4 = b8aeaa2e
ffff000103a6e000 1174938532 C Co:6:002:0 0 4 >
ffff000103a6e000 1174938567 S Ci:6:002:0 s c0 05 0830 0000 0004 4 <
ffff000103a6e000 1174938603 C Ci:6:002:0 0 4 = b8aeaa2e
ffff000103a6e000 1174938638 S Co:6:002:0 s 40 05 0830 0000 0004 4 = b8aeaa2e
ffff000103a6e000 1174938670 C Co:6:002:0 0 4 >
ffff000103a6e000 1174938704 S Ci:6:002:0 s c0 05 082c 0000 0004 4 <
ffff000103a6e000 1174938740 C Ci:6:002:0 0 4 = dc832000
ffff000103a6e000 1174938775 S Co:6:002:0 s 40 05 082c 0000 0004 4 = dd832000
ffff000103a6e000 1174938807 C Co:6:002:0 0 4 >
ffff000103a6e000 1174938842 S Co:6:002:0 s 40 05 0cb0 0000 0004 4 = 17773354
ffff000103a6e000 1174938875 C Co:6:002:0 0 4 >
ffff000103a6e000 1174938910 S Co:6:002:0 s 40 05 0eb0 0000 0004 4 = 17773354
ffff000103a6e000 1174938956 C Co:6:002:0 0 4 >
ffff000103a6e000 1174938990 S Ci:6:002:0 s c0 05 0cb4 0000 0004 4 <
ffff000103a6e000 1174939027 C Ci:6:002:0 0 4 = 77000001
ffff000103a6e000 1174939061 S Co:6:002:0 s 40 05 0cb4 0000 0004 4 = 77000001
ffff000103a6e000 1174939093 C Co:6:002:0 0 4 >
ffff000103a6e000 1174939126 S Ci:6:002:0 s c0 05 0eb4 0000 0004 4 <
ffff000103a6e000 1174939162 C Ci:6:002:0 0 4 = 77000001
ffff000103a6e000 1174939197 S Co:6:002:0 s 40 05 0eb4 0000 0004 4 = 77000001
ffff000103a6e000 1174939229 C Co:6:002:0 0 4 >
ffff000103a6e000 1174939263 S Ci:6:002:0 s c0 05 0900 0000 0004 4 <
ffff000103a6e000 1174939299 C Ci:6:002:0 0 4 = 01040000
ffff000103a6e000 1174939335 S Co:6:002:0 s 40 05 0900 0000 0004 4 = 01040000
ffff000103a6e000 1174939367 C Co:6:002:0 0 4 >
ffff000103a6e000 1174939402 S Ci:6:002:0 s c0 05 080c 0000 0004 4 <
ffff000103a6e000 1174939438 C Ci:6:002:0 0 4 = 13111312
ffff000103a6e000 1174939473 S Co:6:002:0 s 40 05 080c 0000 0004 4 = 03111312
ffff000103a6e000 1174939505 C Co:6:002:0 0 4 >
ffff000103a6e000 1174939540 S Ci:6:002:0 s c0 05 0a04 0000 0004 4 <
ffff000103a6e000 1174939591 C Ci:6:002:0 0 4 = 0c00ff01
ffff000103a6e000 1174939626 S Co:6:002:0 s 40 05 0a04 0000 0004 4 = 0c00ff0f
ffff000103a6e000 1174939658 C Co:6:002:0 0 4 >
ffff000103a6e000 1174939692 S Ci:6:002:0 s c0 05 0440 0000 0004 4 <
ffff000103a6e000 1174939729 C Ci:6:002:0 0 4 = 00000000
ffff000103a6e000 1174939764 S Co:6:002:0 s 40 05 0440 0000 0004 4 = 50010000
ffff000103a6e000 1174939795 C Co:6:002:0 0 4 >
ffff000103a6e000 1174939829 S Ci:6:002:0 s c0 05 0c1c 0000 0004 4 <
ffff000103a6e000 1174939867 C Ci:6:002:0 0 4 = 03000040
ffff000103a6e000 1174939901 S Co:6:002:0 s 40 05 0c1c 0000 0004 4 = 0300402d
ffff000103a6e000 1174939933 C Co:6:002:0 0 4 >
ffff000103a6e000 1174939967 S Ci:6:002:0 s c0 05 0e1c 0000 0004 4 <
ffff000103a6e000 1174940018 C Ci:6:002:0 0 4 = 03000040
ffff000103a6e000 1174940067 S Co:6:002:0 s 40 05 0e1c 0000 0004 4 = 0300402d
ffff000103a6e000 1174940101 C Co:6:002:0 0 4 >
ffff00013d29e600 1174940137 S Ci:6:002:0 s c0 05 0860 0000 0004 4 <
ffff00013d29e600 1174940218 C Ci:6:002:0 0 4 = 21c3d572
ffff00013d29e600 1174940255 S Co:6:002:0 s 40 05 0860 0000 0004 4 = 21c3a768
ffff00013d29e600 1174940301 C Co:6:002:0 0 4 >
ffff00013d29e600 1174940335 S Ci:6:002:0 s c0 05 0c00 0000 0004 4 <
ffff00013d29e600 1174940371 C Ci:6:002:0 0 4 = 07000000
ffff00013d29e600 1174940404 S Ci:6:002:0 s c0 05 08b0 0000 0004 4 <
ffff00013d29e600 1174940441 C Ci:6:002:0 0 4 = 18060000
ffff00013d29e600 1174940476 S Co:6:002:0 s 40 05 08b0 0000 0004 4 = 18060000
ffff00013d29e600 1174940507 C Co:6:002:0 0 4 >
ffff00013d29e600 1174940562 S Ci:6:002:0 s c0 05 0d04 0000 0004 4 <
ffff00013d29e600 1174940611 C Ci:6:002:0 0 4 = 017c90b1
ffff00013d29e600 1174940644 S Co:6:002:0 s 40 05 0c90 0000 0004 4 = 017d8101
ffff00013d29e600 1174940675 C Co:6:002:0 0 4 >
ffff00013d29e600 1174940722 S Ci:6:002:0 s c0 05 08ac 0000 0004 4 <
ffff00013d29e600 1174940771 C Ci:6:002:0 0 4 = 08faf00f
ffff00013d29e600 1174940805 S Co:6:002:0 s 40 05 08ac 0000 0004 4 = 08faf00f
ffff00013d29e600 1174940838 C Co:6:002:0 0 4 >
ffff00013d29e600 1174940872 S Ci:6:002:0 s c0 05 08ac 0000 0004 4 <
ffff00013d29e600 1174940908 C Ci:6:002:0 0 4 = 08faf00f
ffff00013d29e600 1174940943 S Co:6:002:0 s 40 05 08ac 0000 0004 4 = 08faf00f
ffff00013d29e600 1174940974 C Co:6:002:0 0 4 >
ffff00013d29e600 1174941008 S Ci:6:002:0 s c0 05 08c4 0000 0004 4 <
ffff00013d29e600 1174941045 C Ci:6:002:0 0 4 = 00000000
ffff00013d29e600 1174941079 S Co:6:002:0 s 40 05 08c4 0000 0004 4 = 00000000
ffff00013d29e600 1174941111 C Co:6:002:0 0 4 >
ffff00013d29e600 1174941146 S Ci:6:002:0 s c0 05 0c00 0000 0004 4 <
ffff00013d29e600 1174941186 C Ci:6:002:0 0 4 = 07000000
ffff00013d29e600 1174941220 S Ci:6:002:0 s c0 05 08b0 0000 0004 4 <
ffff00013d29e600 1174941257 C Ci:6:002:0 0 4 = 18060000
ffff00013d29e600 1174941292 S Co:6:002:0 s 40 05 08b0 0000 0004 4 = 18060000
ffff00013d29e600 1174941338 C Co:6:002:0 0 4 >
ffff00013d29e600 1174941393 S Ci:6:002:0 s c0 05 0d04 0000 0004 4 <
ffff00013d29e600 1174941459 C Ci:6:002:0 0 4 = 017d91b1
ffff00013d29e600 1174941493 S Co:6:002:0 s 40 05 0c90 0000 0004 4 = 3c7d8101
ffff00013d29e600 1174941523 C Co:6:002:0 0 4 >
ffff00013d29e600 1174941571 S Ci:6:002:0 s c0 05 0e00 0000 0004 4 <
ffff00013d29e600 1174941631 C Ci:6:002:0 0 4 = 07000000
ffff00013d29e600 1174941665 S Ci:6:002:0 s c0 05 08b0 0000 0004 4 <
ffff00013d29e600 1174941717 C Ci:6:002:0 0 4 = 18060000
ffff00013d29e600 1174941750 S Co:6:002:0 s 40 05 08b0 0000 0004 4 = 18060000
ffff00013d29e600 1174941782 C Co:6:002:0 0 4 >
ffff00013d29e600 1174941836 S Ci:6:002:0 s c0 05 0d44 0000 0004 4 <
ffff00013d29e600 1174941884 C Ci:6:002:0 0 4 = 017c90b1
ffff00013d29e600 1174941918 S Co:6:002:0 s 40 05 0e90 0000 0004 4 = 017d8101
ffff00013d29e600 1174941963 C Co:6:002:0 0 4 >
ffff00013d29e600 1174942011 S Ci:6:002:0 s c0 05 08ac 0000 0004 4 <
ffff00013d29e600 1174942060 C Ci:6:002:0 0 4 = 08faf00f
ffff00013d29e600 1174942094 S Co:6:002:0 s 40 05 08ac 0000 0004 4 = 08faf00f
ffff00013d29e600 1174942125 C Co:6:002:0 0 4 >
ffff00013d29e600 1174942158 S Ci:6:002:0 s c0 05 08ac 0000 0004 4 <
ffff00013d29e600 1174942210 C Ci:6:002:0 0 4 = 08faf00f
ffff00013d29e600 1174942244 S Co:6:002:0 s 40 05 08ac 0000 0004 4 = 08faf00f
ffff00013d29e600 1174942276 C Co:6:002:0 0 4 >
ffff00013d29e600 1174942310 S Ci:6:002:0 s c0 05 08c4 0000 0004 4 <
ffff00013d29e600 1174942348 C Ci:6:002:0 0 4 = 00000000
ffff00013d29e600 1174942383 S Co:6:002:0 s 40 05 08c4 0000 0004 4 = 00000000
ffff00013d29e600 1174942414 C Co:6:002:0 0 4 >
ffff00013d29e600 1174942448 S Ci:6:002:0 s c0 05 0e00 0000 0004 4 <
ffff00013d29e600 1174942486 C Ci:6:002:0 0 4 = 07000000
ffff00013d29e600 1174942520 S Ci:6:002:0 s c0 05 08b0 0000 0004 4 <
ffff00013d29e600 1174942559 C Ci:6:002:0 0 4 = 18060000
ffff00013d29e600 1174942592 S Co:6:002:0 s 40 05 08b0 0000 0004 4 = 18060000
ffff00013d29e600 1174942623 C Co:6:002:0 0 4 >
ffff00013d29e600 1174942678 S Ci:6:002:0 s c0 05 0d44 0000 0004 4 <
ffff00013d29e600 1174942726 C Ci:6:002:0 0 4 = 017d91b1
ffff00013d29e600 1174942761 S Co:6:002:0 s 40 05 0e90 0000 0004 4 = 3c7d8101
ffff00013d29e600 1174942793 C Co:6:002:0 0 4 >
ffff00013d29e600 1174942839 S Ci:6:002:0 s c0 05 0668 0000 0002 2 <
ffff00013d29e600 1174942888 C Ci:6:002:0 0 2 = 0010
ffff00013d29e600 1174942923 S Co:6:002:0 s 40 05 0668 0000 0002 2 = 0010
ffff00013d29e600 1174942963 C Co:6:002:0 0 2 >
ffff00013d29e600 1174942997 S Co:6:002:0 s 40 05 0483 0000 0001 1 = 00
ffff00013d29e600 1174943028 C Co:6:002:0 0 1 >
ffff00013d29e600 1174943062 S Ci:6:002:0 s c0 05 0837 0000 0001 1 <
ffff00013d29e600 1174943098 C Ci:6:002:0 0 1 = 00
ffff00013d29e600 1174943133 S Ci:6:002:0 s c0 05 08ac 0000 0004 4 <
ffff00013d29e600 1174943171 C Ci:6:002:0 0 4 = 08faf00f
ffff00013d29e600 1174943206 S Co:6:002:0 s 40 05 08ac 0000 0004 4 = 08faf00f
ffff00013d29e600 1174943238 C Co:6:002:0 0 4 >
ffff00013d29e600 1174943272 S Ci:6:002:0 s c0 05 08c4 0000 0004 4 <
ffff00013d29e600 1174943309 C Ci:6:002:0 0 4 = 00000000
ffff00013d29e600 1174943344 S Co:6:002:0 s 40 05 08c4 0000 0004 4 = 00000000
ffff00013d29e600 1174943376 C Co:6:002:0 0 4 >
ffff00013d29e600 1174943410 S Ci:6:002:0 s c0 05 0848 0000 0004 4 <
ffff00013d29e600 1174943466 C Ci:6:002:0 0 4 = 8bffd061
ffff00013d29e600 1174943501 S Co:6:002:0 s 40 05 0848 0000 0004 4 = 8bffd061
ffff00013d29e600 1174943532 C Co:6:002:0 0 4 >
ffff00013d29e600 1174943567 S Ci:6:002:0 s c0 05 08ac 0000 0004 4 <
ffff00013d29e600 1174943605 C Ci:6:002:0 0 4 = 08faf00f
ffff00013d29e600 1174943639 S Co:6:002:0 s 40 05 08ac 0000 0004 4 = 08faf00f
ffff00013d29e600 1174943671 C Co:6:002:0 0 4 >
ffff00013d29e600 1174943706 S Ci:6:002:0 s c0 05 08ac 0000 0004 4 <
ffff00013d29e600 1174943744 C Ci:6:002:0 0 4 = 08faf00f
ffff00013d29e600 1174943779 S Co:6:002:0 s 40 05 08ac 0000 0004 4 = 08faf00f
ffff00013d29e600 1174943810 C Co:6:002:0 0 4 >
ffff00013d29e600 1174943845 S Ci:6:002:0 s c0 05 08c4 0000 0004 4 <
ffff00013d29e600 1174943884 C Ci:6:002:0 0 4 = 00000000
ffff00013d29e600 1174943919 S Co:6:002:0 s 40 05 08c4 0000 0004 4 = 00000000
ffff00013d29e600 1174943963 C Co:6:002:0 0 4 >
ffff00013d29e600 1174943998 S Ci:6:002:0 s c0 05 0c00 0000 0004 4 <
ffff00013d29e600 1174944066 C Ci:6:002:0 0 4 = 07000000
ffff00013d29e600 1174944103 S Ci:6:002:0 s c0 05 08b0 0000 0004 4 <
ffff00013d29e600 1174944142 C Ci:6:002:0 0 4 = 18060000
ffff00013d29e600 1174944183 S Co:6:002:0 s 40 05 08b0 0000 0004 4 = 18060000
ffff00013d29e600 1174944215 C Co:6:002:0 0 4 >
ffff00013d29e600 1174944270 S Ci:6:002:0 s c0 05 0d04 0000 0004 4 <
ffff00013d29e600 1174944335 C Ci:6:002:0 0 4 = 3c7d91b1
ffff00013d29e600 1174944370 S Co:6:002:0 s 40 05 0c90 0000 0004 4 = 3c7d8101
ffff00013d29e600 1174944400 C Co:6:002:0 0 4 >
ffff00013d29e600 1174944447 S Ci:6:002:0 s c0 05 0e00 0000 0004 4 <
ffff00013d29e600 1174944497 C Ci:6:002:0 0 4 = 07000000
ffff00013d29e600 1174944531 S Ci:6:002:0 s c0 05 08b0 0000 0004 4 <
ffff00013d29e600 1174944586 C Ci:6:002:0 0 4 = 18060000
ffff00013d29e600 1174944619 S Co:6:002:0 s 40 05 08b0 0000 0004 4 = 18060000
ffff00013d29e600 1174944650 C Co:6:002:0 0 4 >
ffff00013d29e600 1174944706 S Ci:6:002:0 s c0 05 0d44 0000 0004 4 <
ffff00013d29e600 1174944755 C Ci:6:002:0 0 4 = 3c7d91b1
ffff00013d29e600 1174944789 S Co:6:002:0 s 40 05 0e90 0000 0004 4 = 3c7d8101
ffff00013d29e600 1174944836 C Co:6:002:0 0 4 >
ffff00013d29e600 1174944885 S Ci:6:002:0 s c0 05 0073 0000 0001 1 <
ffff00013d29e600 1174944936 C Ci:6:002:0 0 1 = 07
ffff00013d29e600 1174944970 S Co:6:002:0 s 40 05 0073 0000 0001 1 = 07
ffff00013d29e600 1174945002 C Co:6:002:0 0 1 >
ffff00013d29e600 1174945058 S Ci:6:002:0 s c0 05 0c24 0000 0004 4 <
ffff00013d29e600 1174945108 C Ci:6:002:0 0 4 = 20202020
ffff00013d29e600 1174945142 S Co:6:002:0 s 40 05 0c24 0000 0004 4 = 22222222
ffff00013d29e600 1174945174 C Co:6:002:0 0 4 >
ffff00013d29e600 1174945208 S Ci:6:002:0 s c0 05 0c28 0000 0004 4 <
ffff00013d29e600 1174945247 C Ci:6:002:0 0 4 = 20201e1c
ffff00013d29e600 1174945282 S Co:6:002:0 s 40 05 0c28 0000 0004 4 = 2222201e
ffff00013d29e600 1174945331 C Co:6:002:0 0 4 >
ffff00013d29e600 1174945364 S Ci:6:002:0 s c0 05 0c2c 0000 0004 4 <
ffff00013d29e600 1174945403 C Ci:6:002:0 0 4 = 20202020
ffff00013d29e600 1174945437 S Co:6:002:0 s 40 05 0c2c 0000 0004 4 = 27272727
ffff00013d29e600 1174945468 C Co:6:002:0 0 4 >
ffff00013d29e600 1174945503 S Ci:6:002:0 s c0 05 0c30 0000 0004 4 <
ffff00013d29e600 1174945542 C Ci:6:002:0 0 4 = 20201e1c
ffff00013d29e600 1174945576 S Co:6:002:0 s 40 05 0c30 0000 0004 4 = 2523211f
ffff00013d29e600 1174945608 C Co:6:002:0 0 4 >
ffff00013d29e600 1174945642 S Ci:6:002:0 s c0 05 0c34 0000 0004 4 <
ffff00013d29e600 1174945681 C Ci:6:002:0 0 4 = 20202020
ffff00013d29e600 1174945715 S Co:6:002:0 s 40 05 0c34 0000 0004 4 = 23232323
ffff00013d29e600 1174945746 C Co:6:002:0 0 4 >
ffff00013d29e600 1174945781 S Ci:6:002:0 s c0 05 0c38 0000 0004 4 <
ffff00013d29e600 1174945833 C Ci:6:002:0 0 4 = 201e1c1a
ffff00013d29e600 1174945868 S Co:6:002:0 s 40 05 0c38 0000 0004 4 = 23211f1d
ffff00013d29e600 1174945900 C Co:6:002:0 0 4 >
ffff00013d29e600 1174945935 S Ci:6:002:0 s c0 05 0c3c 0000 0004 4 <
ffff00013d29e600 1174945970 C Ci:6:002:0 0 4 = 20202020
ffff00013d29e600 1174946004 S Co:6:002:0 s 40 05 0c3c 0000 0004 4 = 27272727
ffff00013d29e600 1174946036 C Co:6:002:0 0 4 >
ffff00013d29e600 1174946071 S Ci:6:002:0 s c0 05 0c40 0000 0004 4 <
ffff00013d29e600 1174946107 C Ci:6:002:0 0 4 = 20201e1c
ffff00013d29e600 1174946142 S Co:6:002:0 s 40 05 0c40 0000 0004 4 = 2523211f
ffff00013d29e600 1174946174 C Co:6:002:0 0 4 >
ffff00013d29e600 1174946209 S Ci:6:002:0 s c0 05 0c44 0000 0004 4 <
ffff00013d29e600 1174946244 C Ci:6:002:0 0 4 = 1a181e1e
ffff00013d29e600 1174946278 S Co:6:002:0 s 40 05 0c44 0000 0004 4 = 1d1d2323
ffff00013d29e600 1174946310 C Co:6:002:0 0 4 >
ffff00013d29e600 1174946344 S Ci:6:002:0 s c0 05 0c48 0000 0004 4 <
ffff00013d29e600 1174946380 C Ci:6:002:0 0 4 = 1e1e1e1e
ffff00013d29e600 1174946415 S Co:6:002:0 s 40 05 0c48 0000 0004 4 = 23232321
ffff00013d29e600 1174946463 C Co:6:002:0 0 4 >
ffff00013d29e600 1174946498 S Ci:6:002:0 s c0 05 0c4c 0000 0004 4 <
ffff00013d29e600 1174946534 C Ci:6:002:0 0 4 = 1c1a1816
ffff00013d29e600 1174946569 S Co:6:002:0 s 40 05 0c4c 0000 0004 4 = 1f1d1b1b
ffff00013d29e600 1174946600 C Co:6:002:0 0 4 >
ffff00013d29e600 1174946634 S Ci:6:002:0 s c0 05 0c54 0000 0004 4 <
ffff00013d29e600 1174946670 C Ci:6:002:0 0 4 = 120a0400
ffff00013d29e600 1174946709 S Co:6:002:0 s 40 05 0c54 0000 0004 4 = 150d0700
ffff00013d29e600 1174946740 C Co:6:002:0 0 4 >
ffff00013d29e600 1174946775 S Ci:6:002:0 s c0 05 0e24 0000 0004 4 <
ffff00013d29e600 1174946811 C Ci:6:002:0 0 4 = 1d1d1d1d
ffff00013d29e600 1174946847 S Co:6:002:0 s 40 05 0e24 0000 0004 4 = 22222222
ffff00013d29e600 1174946879 C Co:6:002:0 0 4 >
ffff00013d29e600 1174946913 S Ci:6:002:0 s c0 05 0e28 0000 0004 4 <
ffff00013d29e600 1174946966 C Ci:6:002:0 0 4 = 1d1d1b19
ffff00013d29e600 1174947001 S Co:6:002:0 s 40 05 0e28 0000 0004 4 = 2222201e
ffff00013d29e600 1174947033 C Co:6:002:0 0 4 >
ffff00013d29e600 1174947067 S Ci:6:002:0 s c0 05 0e2c 0000 0004 4 <
ffff00013d29e600 1174947103 C Ci:6:002:0 0 4 = 1f1f1f1f
ffff00013d29e600 1174947138 S Co:6:002:0 s 40 05 0e2c 0000 0004 4 = 27272727
ffff00013d29e600 1174947169 C Co:6:002:0 0 4 >
ffff00013d29e600 1174947204 S Ci:6:002:0 s c0 05 0e30 0000 0004 4 <
ffff00013d29e600 1174947241 C Ci:6:002:0 0 4 = 1f1f1d1b
ffff00013d29e600 1174947276 S Co:6:002:0 s 40 05 0e30 0000 0004 4 = 2523211f
ffff00013d29e600 1174947307 C Co:6:002:0 0 4 >
ffff00013d29e600 1174947342 S Ci:6:002:0 s c0 05 0e34 0000 0004 4 <
ffff00013d29e600 1174947378 C Ci:6:002:0 0 4 = 1f1f1f1f
ffff00013d29e600 1174947414 S Co:6:002:0 s 40 05 0e34 0000 0004 4 = 23232323
ffff00013d29e600 1174947463 C Co:6:002:0 0 4 >
ffff00013d29e600 1174947498 S Ci:6:002:0 s c0 05 0e38 0000 0004 4 <
ffff00013d29e600 1174947535 C Ci:6:002:0 0 4 = 1f1d1b19
ffff00013d29e600 1174947570 S Co:6:002:0 s 40 05 0e38 0000 0004 4 = 23211f1d
ffff00013d29e600 1174947601 C Co:6:002:0 0 4 >
ffff00013d29e600 1174947636 S Ci:6:002:0 s c0 05 0e3c 0000 0004 4 <
ffff00013d29e600 1174947674 C Ci:6:002:0 0 4 = 1f1f1f1f
ffff00013d29e600 1174947709 S Co:6:002:0 s 40 05 0e3c 0000 0004 4 = 27272727
ffff00013d29e600 1174947741 C Co:6:002:0 0 4 >
ffff00013d29e600 1174947775 S Ci:6:002:0 s c0 05 0e40 0000 0004 4 <
ffff00013d29e600 1174947811 C Ci:6:002:0 0 4 = 1f1f1d1b
ffff00013d29e600 1174947845 S Co:6:002:0 s 40 05 0e40 0000 0004 4 = 2523211f
ffff00013d29e600 1174947877 C Co:6:002:0 0 4 >
ffff00013d29e600 1174947911 S Ci:6:002:0 s c0 05 0e44 0000 0004 4 <
ffff00013d29e600 1174947965 C Ci:6:002:0 0 4 = 19171d1d
ffff00013d29e600 1174948014 S Co:6:002:0 s 40 05 0e44 0000 0004 4 = 1d1d2323
ffff00013d29e600 1174948061 C Co:6:002:0 0 4 >
ffff00013d29e600 1174948098 S Ci:6:002:0 s c0 05 0e48 0000 0004 4 <
ffff00013d29e600 1174948137 C Ci:6:002:0 0 4 = 1d1d1d1d
ffff00013d29e600 1174948173 S Co:6:002:0 s 40 05 0e48 0000 0004 4 = 23232321
ffff00013d29e600 1174948214 C Co:6:002:0 0 4 >
ffff00013d29e600 1174948250 S Ci:6:002:0 s c0 05 0e4c 0000 0004 4 <
ffff00013d29e600 1174948287 C Ci:6:002:0 0 4 = 1b191715
ffff00013d29e600 1174948321 S Co:6:002:0 s 40 05 0e4c 0000 0004 4 = 1f1d1b1b
ffff00013d29e600 1174948352 C Co:6:002:0 0 4 >
ffff00013d29e600 1174948386 S Ci:6:002:0 s c0 05 0e54 0000 0004 4 <
ffff00013d29e600 1174948422 C Ci:6:002:0 0 4 = 11090300
ffff00013d29e600 1174948457 S Co:6:002:0 s 40 05 0e54 0000 0004 4 = 150d0700
ffff00013d29e600 1174948488 C Co:6:002:0 0 4 >
ffff000103533780 1175772228 S Ci:6:002:0 s c0 05 004c 0000 0001 1 <
ffff000103533780 1175772313 C Ci:6:002:0 0 1 = 20
ffff000103533780 1175772455 S Co:6:002:0 s 40 05 004c 0000 0001 1 = 20
ffff000103533780 1175772578 C Co:6:002:0 0 1 >
ffff000103533780 1176764167 S Ci:6:002:0 s c0 05 004c 0000 0001 1 <
ffff000103533780 1176764271 C Ci:6:002:0 0 1 = 20
ffff000103533780 1176764421 S Co:6:002:0 s 40 05 004c 0000 0001 1 = 20
ffff000103533780 1176764546 C Co:6:002:0 0 1 >
ffff000103533780 1176764729 S Ci:6:002:0 s c0 05 0770 0000 0004 4 <
ffff000103533780 1176764876 C Ci:6:002:0 0 4 = 00000000
ffff000103533780 1176765035 S Ci:6:002:0 s c0 05 0774 0000 0004 4 <
ffff000103533780 1176765183 C Ci:6:002:0 0 4 = 00000000
ffff000103533780 1176765343 S Co:6:002:0 s 40 05 076e 0000 0001 1 = 0c
ffff000103533780 1176765482 C Co:6:002:0 0 1 >
ffff000103533780 1176765640 S Ci:6:002:0 s c0 05 0808 0000 0004 4 <
ffff000103533780 1176765790 C Ci:6:002:0 0 4 = 3382023e
ffff000103533780 1176765943 S Ci:6:002:0 s c0 05 0a5c 0000 0002 2 <
ffff000103533780 1176766066 C Ci:6:002:0 0 2 = 0c00
ffff000103533780 1176766093 S Ci:6:002:0 s c0 05 0f48 0000 0002 2 <
ffff000103533780 1176766211 C Ci:6:002:0 0 2 = 1801
ffff000103533780 1176766242 S Ci:6:002:0 s c0 05 0f04 0000 0004 4 <
ffff000103533780 1176766352 C Ci:6:002:0 0 4 = 01000000
ffff000103533780 1176766381 S Ci:6:002:0 s c0 05 0f14 0000 0004 4 <
ffff000103533780 1176766493 C Ci:6:002:0 0 4 = 0a000800
ffff000103533780 1176766522 S Ci:6:002:0 s c0 05 0f10 0000 0004 4 <
ffff000103533780 1176766643 C Ci:6:002:0 0 4 = 00000000
ffff000103533780 1176766672 S Ci:6:002:0 s c0 05 0f0c 0000 0004 4 <
ffff000103533780 1176766783 C Ci:6:002:0 0 4 = 00000000
ffff000103533780 1176766812 S Ci:6:002:0 s c0 05 0f08 0000 0004 4 <
ffff000103533780 1176766930 C Ci:6:002:0 0 4 = 11002901
ffff000103533780 1176766951 S Ci:6:002:0 s c0 05 0fcc 0000 0004 4 <
ffff000103533780 1176767063 C Ci:6:002:0 0 4 = 00000000
ffff000103533780 1176767091 S Ci:6:002:0 s c0 05 09a4 0000 0004 4 <
ffff000103533780 1176767127 C Ci:6:002:0 0 4 = 80000800
ffff000103533780 1176767144 S Co:6:002:0 s 40 05 09a4 0000 0004 4 = 80000a00
ffff000103533780 1176767191 C Co:6:002:0 0 4 >
ffff000103533780 1176767205 S Ci:6:002:0 s c0 05 09a4 0000 0004 4 <
ffff000103533780 1176767240 C Ci:6:002:0 0 4 = 80000a00
ffff000103533780 1176767262 S Co:6:002:0 s 40 05 09a4 0000 0004 4 = 80000800
ffff000103533780 1176767310 C Co:6:002:0 0 4 >
ffff000103533780 1176767333 S Ci:6:002:0 s c0 05 0a2c 0000 0004 4 <
ffff000103533780 1176767367 C Ci:6:002:0 0 4 = 00809000
ffff000103533780 1176767382 S Co:6:002:0 s 40 05 0a2c 0000 0004 4 = 00009000
ffff000103533780 1176767411 C Co:6:002:0 0 4 >
ffff000103533780 1176767426 S Ci:6:002:0 s c0 05 0a2c 0000 0004 4 <
ffff000103533780 1176767462 C Ci:6:002:0 0 4 = 00009000
ffff000103533780 1176767479 S Co:6:002:0 s 40 05 0a2c 0000 0004 4 = 00809000
ffff000103533780 1176767508 C Co:6:002:0 0 4 >
ffff000103533780 1176767530 S Ci:6:002:0 s c0 05 0b58 0000 0004 4 <
ffff000103533780 1176767572 C Ci:6:002:0 0 4 = 00000000
ffff000103533780 1176767587 S Co:6:002:0 s 40 05 0b58 0000 0004 4 = 01000000
ffff000103533780 1176767616 C Co:6:002:0 0 4 >
ffff000103533780 1176767631 S Ci:6:002:0 s c0 05 0b58 0000 0004 4 <
ffff000103533780 1176767666 C Ci:6:002:0 0 4 = 01000000
ffff000103533780 1176767681 S Co:6:002:0 s 40 05 0b58 0000 0004 4 = 00000000
ffff000103533780 1176767711 C Co:6:002:0 0 4 >
ffff000103533780 1176767735 S Ci:6:002:0 s c0 05 01cc 0000 0001 1 <
ffff000103533780 1176767770 C Ci:6:002:0 0 1 = 00
ffff000103533780 1176767792 S Co:6:002:0 s 40 05 01f8 0000 0004 4 = 00000000
ffff000103533780 1176767820 C Co:6:002:0 0 4 >
ffff000103533780 1176767835 S Co:6:002:0 s 40 05 01d8 0000 0004 4 = 58000000
ffff000103533780 1176767863 C Co:6:002:0 0 4 >
ffff000103533780 1176767879 S Co:6:002:0 s 40 05 0440 0000 0004 4 = 00000000
ffff000103533780 1176767907 C Co:6:002:0 0 4 >
ffff000103533780 1176767923 S Ci:6:002:0 s c0 05 0c00 0000 0004 4 <
ffff000103533780 1176767958 C Ci:6:002:0 0 4 = 07000000
ffff000103533780 1176767981 S Ci:6:002:0 s c0 05 08b0 0000 0004 4 <
ffff000103533780 1176768043 C Ci:6:002:0 0 4 = 18060000
ffff000103533780 1176768066 S Co:6:002:0 s 40 05 08b0 0000 0004 4 = 42060000
ffff000103533780 1176768106 C Co:6:002:0 0 4 >
ffff000103533780 1176768142 S Ci:6:002:0 s c0 05 0d04 0000 0004 4 <
ffff000103533780 1176768262 C Ci:6:002:0 0 4 = 088d90b1
ffff000103533780 1176768291 S Co:6:002:0 s 40 05 0c90 0000 0004 4 = 088d2304
ffff000103533780 1176768404 C Co:6:002:0 0 4 >
ffff000103533780 1176768438 S Co:6:002:0 s 40 05 0280 0000 0002 2 = 0001
ffff000103533780 1176768541 C Co:6:002:0 0 2 >
ffff000103533780 1176768570 S Ci:6:002:0 s c0 05 010c 0000 0001 1 <
ffff000103533780 1176768679 C Ci:6:002:0 0 1 = b4
ffff000103533780 1176768708 S Co:6:002:0 s 40 05 010c 0000 0001 1 = b4
ffff000103533780 1176768815 C Co:6:002:0 0 1 >
ffff000103533780 1177756278 S Ci:6:002:0 s c0 05 004c 0000 0001 1 <
ffff000103533780 1177756347 C Ci:6:002:0 0 1 = 20
ffff000103533780 1177756478 S Co:6:002:0 s 40 05 004c 0000 0001 1 = 20
ffff000103533780 1177756617 C Co:6:002:0 0 1 >
