ffff000103533780 4034458599 C Bi:6:002:1 0 172 = 74000484 00000f80 5d026000 00300000 00000000 67ceb300 443a0000 08520001
ffff000103533780 4034458647 S Bi:6:002:1 -115 32768 <
ffff0001035330c0 4034545879 C Bi:6:002:1 0 383 = 47010484 00000f80 ac0b6000 04300000 00000000 cf24b500 463c0000 86f1f101
ffff0001035330c0 4034545910 S Bi:6:002:1 -115 32768 <
ffff000103533480 4034546888 C Bi:6:002:1 0 376 = 40010484 00000f80 1a036000 04300000 00000000 e328b500 463e0000 86f5f501
ffff000103533480 4034546913 S Bi:6:002:1 -115 32768 <
ffff000103533240 4034556048 C Bi:6:002:1 0 377 = 41010484 00000f00 f3086000 04300000 00000000 bc4cb500 44380000 84f6f601
ffff000103533240 4034556072 S Bi:6:002:1 -115 32768 <
ffff000103533780 4034556710 C Bi:6:002:1 0 377 = 41010484 00000f00 f3086000 04300000 00000000 4e4fb500 463e0000 86f7f701
ffff000103533780 4034556737 S Bi:6:002:1 -115 32768 <
ffff0001035330c0 4034561250 C Bi:6:002:1 0 172 = 74000484 00000f80 5e026000 00300000 00000000 1a5fb500 463e0000 0a520001
ffff0001035330c0 4034561273 S Bi:6:002:1 -115 32768 <
ffff000103533480 4034561911 C Bi:6:002:1 0 377 = 41010484 00000f00 f3086000 04300000 00000000 8863b500 443c0000 88f4f401
ffff000103533480 4034561938 S Bi:6:002:1 -115 32768 <
ffff000103533240 4034571604 C Bi:6:002:1 0 370 = 3a010484 00000f00 28016000 04300000 00000000 6d89b500 463c0000 86f4f401
ffff000103533240 4034571628 S Bi:6:002:1 -115 32768 <
ffff000103533780 4034576494 C Bi:6:002:1 0 370 = 3a010484 00000f00 28016000 04300000 00000000 a99cb500 44380000 86f3f301
ffff000103533780 4034576520 S Bi:6:002:1 -115 32768 <
ffff0001035330c0 4034577126 C Bi:6:002:1 0 345 = 21010484 00000f00 61046000 04300000 00000000 219fb500 463a0000 81f0f001
ffff0001035330c0 4034577152 S Bi:6:002:1 -115 32768 <
ffff000103533480 4034577708 C Bi:6:002:1 0 345 = 21010484 00000f00 61046000 04300000 00000000 70a1b500 42380000 86030301
ffff000103533480 4034577731 S Bi:6:002:1 -115 32768 <
ffff000103533240 4034578277 C Bi:6:002:1 0 345 = 21010484 00000f00 61046000 04300000 00000000 ada3b500 443c0000 87f4f401
ffff000103533240 4034578302 S Bi:6:002:1 -115 32768 <
ffff000103533780 4034578835 C Bi:6:002:1 0 345 = 21010484 00000f00 61046000 04300000 00000000 eaa5b500 46380000 85f6f601
ffff000103533780 4034578856 S Bi:6:002:1 -115 32768 <
ffff0001035330c0 4034579452 C Bi:6:002:1 0 378 = 42010484 00000f00 14066000 04300000 00000000 30a8b500 463c0000 84eded01
ffff0001035330c0 4034579471 S Bi:6:002:1 -115 32768 <
ffff000103533480 4034580026 C Bi:6:002:1 0 378 = 42010484 00000f00 14066000 04300000 00000000 9eaab500 463c0000 86f4f401
ffff000103533480 4034580044 S Bi:6:002:1 -115 32768 <
ffff000103533240 4034580994 C Bi:6:002:1 0 378 = 42010484 00000f00 14066000 04300000 00000000 31aeb500 44360000 86ecec01
ffff000103533240 4034581018 S Bi:6:002:1 -115 32768 <
ffff000103533780 4034650165 C Bi:6:002:1 0 376 = 40010484 00000f80 1b036000 04300000 00000000 5ebcb600 443a0000 84f2f201
ffff000103533780 4034650216 S Bi:6:002:1 -115 32768 <
ffff0001035330c0 4034650997 C Bi:6:002:1 0 351 = 27010484 00000f80 e00c6000 04300000 00000000 b3bfb600 423a0000 86f7f701
ffff0001035330c0 4034651026 S Bi:6:002:1 -115 32768 <
ffff000103533480 4034651866 C Bi:6:002:1 0 374 = 3e010484 00000f80 b3076000 04300000 00000000 f9c2b600 46380000 86fefe01
ffff000103533480 4034651890 S Bi:6:002:1 -115 32768 <
ffff000103533240 4034652640 C Bi:6:002:1 0 384 = 48010484 00000f80 830a6000 04300000 00000000 0cc6b600 42360000 88fdfd01
ffff000103533240 4034652661 S Bi:6:002:1 -115 32768 <
ffff000103533780 4034663498 C Bi:6:002:1 0 172 = 74000484 00000f80 5f026000 00300000 00000000 86eeb600 42360000 1f510001
ffff000103533780 4034663517 S Bi:6:002:1 -115 32768 <
ffff0001035330c0 4034750678 C Bi:6:002:1 0 383 = 47010484 00000f80 ae0b6000 04300000 00000000 d144b800 463a0000 89f1f101
ffff0001035330c0 4034750713 S Bi:6:002:1 -115 32768 <
ffff000103533480 4034766042 C Bi:6:002:1 0 172 = 74000484 00000f80 60026000 00300000 00000000 157fb800 443a0000 36510001
ffff000103533480 4034766067 S Bi:6:002:1 -115 32768 <
ffff000103533c00 4034780190 S Ci:6:002:0 s c0 05 004c 0000 0001 1 <
ffff000103533c00 4034780337 C Ci:6:002:0 0 1 = 20
ffff000103533c00 4034780485 S Co:6:002:0 s 40 05 004c 0000 0001 1 = 20
ffff000103533c00 4034780597 C Co:6:002:0 0 1 >
ffff000103533240 4034854140 C Bi:6:002:1 0 376 = 40010484 00000f80 1d036000 04300000 00000000 f8d8b900 463e0000 87f7f701
ffff000103533240 4034854200 S Bi:6:002:1 -115 32768 <
ffff000103533780 4034854932 C Bi:6:002:1 0 351 = 27010484 00000f80 e20c6000 04300000 00000000 55dcb900 46380000 87f2f201
ffff000103533780 4034854959 S Bi:6:002:1 -115 32768 <
ffff0001035330c0 4034856600 C Bi:6:002:1 0 384 = 48010484 00000f80 850a6000 04300000 00000000 a0e2b900 463a0000 87f1f101
ffff0001035330c0 4034856624 S Bi:6:002:1 -115 32768 <
ffff000103533480 4034868296 C Bi:6:002:1 0 172 = 74000484 00000f80 61026000 00300000 00000000 830eba00 36360000 16510001
ffff000103533480 4034868320 S Bi:6:002:1 -115 32768 <
ffff000103533240 4034955433 C Bi:6:002:1 0 383 = 47010484 00000f80 b00b6000 04300000 00000000 d464bb00 44380000 86f4f401
ffff000103533240 4034955476 S Bi:6:002:1 -115 32768 <
ffff000103533780 4034956535 C Bi:6:002:1 0 376 = 40010484 00000f80 1e036000 04300000 00000000 0a69bb00 46380000 89f9f901
ffff000103533780 4034956564 S Bi:6:002:1 -115 32768 <
ffff0001035330c0 4034957320 C Bi:6:002:1 0 351 = 27010484 00000f80 e30c6000 04300000 00000000 496cbb00 443a0000 82efef01
ffff0001035330c0 4034957343 S Bi:6:002:1 -115 32768 <
ffff000103533480 4034958937 C Bi:6:002:1 0 374 = 3e010484 00000f80 b6076000 04300000 00000000 7b72bb00 443a0000 86efef01
ffff000103533480 4034958963 S Bi:6:002:1 -115 32768 <
ffff000103533240 4034959794 C Bi:6:002:1 0 384 = 48010484 00000f80 860a6000 04300000 00000000 da75bb00 44380000 86f1f101
ffff000103533240 4034959815 S Bi:6:002:1 -115 32768 <
ffff000103533780 4034960299 C Bi:6:002:1 0 370 = 3a010484 00000f00 29016000 04300000 00000000 e977bb00 44380000 89f4f401
ffff000103533780 4034960318 S Bi:6:002:1 -115 32768 <
ffff0001035330c0 4034961569 C Bi:6:002:1 0 370 = 3a010484 00000f00 29016000 04300000 00000000 c77cbb00 463e0000 86eeee01
ffff0001035330c0 4034961594 S Bi:6:002:1 -115 32768 <
ffff000103533480 4034962085 C Bi:6:002:1 0 370 = 3a010484 00000f00 29016000 04300000 00000000 247fbb00 46380000 88f3f301
ffff000103533480 4034962103 S Bi:6:002:1 -115 32768 <
ffff000103533240 4034972243 C Bi:6:002:1 0 172 = 74000484 00000f80 62026000 00300000 00000000 d0a3bb00 46380000 1a510001
ffff000103533240 4034972265 S Bi:6:002:1 -115 32768 <
ffff000103533780 4035009004 C Bi:6:002:1 0 249 = c1000484 00000f80 0e016000 00300000 00000000 7e31bc00 34340000 366e0001
ffff000103533780 4035009042 S Bi:6:002:1 -115 32768 <
ffff0001035330c0 4035057896 C Bi:6:002:1 0 383 = 47010484 00000f80 b10b6000 04300000 00000000 d6f4bc00 443c0000 83f2f201
ffff0001035330c0 4035057953 S Bi:6:002:1 -115 32768 <
ffff000103533480 4035058904 C Bi:6:002:1 0 376 = 40010484 00000f80 1f036000 04300000 00000000 f8f8bc00 463c0000 87eded01
ffff000103533480 4035058930 S Bi:6:002:1 -115 32768 <
ffff000103533240 4035059725 C Bi:6:002:1 0 351 = 27010484 00000f80 e40c6000 04300000 00000000 4efcbc00 463c0000 86ecec01
ffff000103533240 4035059749 S Bi:6:002:1 -115 32768 <
ffff000103533780 4035060602 C Bi:6:002:1 0 374 = 3e010484 00000f80 b7076000 04300000 00000000 91ffbc00 463a0000 86eded01
ffff000103533780 4035060627 S Bi:6:002:1 -115 32768 <
ffff0001035330c0 4035061424 C Bi:6:002:1 0 384 = 48010484 00000f80 870a6000 04300000 00000000 c502bd00 463a0000 84fbfb01
ffff0001035330c0 4035061449 S Bi:6:002:1 -115 32768 <
ffff000103533480 4035073330 C Bi:6:002:1 0 172 = 74000484 00000f80 63026000 00300000 00000000 5b2fbd00 463a0000 14510001
ffff000103533480 4035073355 S Bi:6:002:1 -115 32768 <
ffff000103533240 4035160267 C Bi:6:002:1 0 383 = 47010484 00000f80 b20b6000 04300000 00000000 d784be00 463a0000 89e9e901
ffff000103533240 4035160301 S Bi:6:002:1 -115 32768 <
ffff000103533780 4035161325 C Bi:6:002:1 0 376 = 40010484 00000f80 20036000 04300000 00000000 0c89be00 44380000 85fafa01
ffff000103533780 4035161373 S Bi:6:002:1 -115 32768 <
ffff0001035330c0 4035162098 C Bi:6:002:1 0 351 = 27010484 00000f80 e50c6000 04300000 00000000 308cbe00 463a0000 87f8f801
ffff0001035330c0 4035162123 S Bi:6:002:1 -115 32768 <
ffff000103533480 4035162937 C Bi:6:002:1 0 374 = 3e010484 00000f80 b8076000 04300000 00000000 5d8fbe00 463a0000 86eeee01
ffff000103533480 4035162963 S Bi:6:002:1 -115 32768 <
ffff000103533240 4035176705 C Bi:6:002:1 0 172 = 74000484 00000f80 64026000 00300000 00000000 2dc3be00 463a0000 09750001
ffff000103533240 4035176739 S Bi:6:002:1 -115 32768 <
ffff000103533780 4035262649 C Bi:6:002:1 0 383 = 47010484 00000f80 b30b6000 04300000 00000000 d914c000 443a0000 86f4f401
ffff000103533780 4035262699 S Bi:6:002:1 -115 32768 <
ffff0001035330c0 4035265772 C Bi:6:002:1 0 384 = 48010484 00000f80 890a6000 04300000 00000000 1721c000 443c0000 88f2f201
ffff0001035330c0 4035265796 S Bi:6:002:1 -115 32768 <
ffff000103533480 4035278110 C Bi:6:002:1 0 172 = 74000484 00000f80 65026000 00300000 00000000 314fc000 443c0000 0a510001
ffff000103533480 4035278135 S Bi:6:002:1 -115 32768 <
ffff000103533240 4035367704 C Bi:6:002:1 0 374 = 3e010484 00000f80 ba076000 04300000 00000000 4cafc100 443a0000 89f7f701
ffff000103533240 4035367737 S Bi:6:002:1 -115 32768 <
ffff000103533780 4035380302 C Bi:6:002:1 0 172 = 74000484 00000f80 66026000 00300000 00000000 87dec100 32340000 18510001
ffff000103533780 4035380333 S Bi:6:002:1 -115 32768 <
ffff000103151480 4035453366 S Ci:6:002:0 s c0 05 0454 0000 0001 1 <
ffff000103151480 4035453552 C Ci:6:002:0 0 1 = 00
ffff000103151480 4035453604 S Ci:6:002:0 s c0 05 0860 0000 0004 4 <
ffff000103151480 4035453708 C Ci:6:002:0 0 4 = 21c3d572
ffff000103151480 4035453748 S Co:6:002:0 s 40 05 0860 0000 0004 4 = 21c3d572
ffff000103151480 4035453779 C Co:6:002:0 0 4 >
ffff000103151480 4035453809 S Ci:6:002:0 s c0 05 0c00 0000 0004 4 <
ffff000103151480 4035453861 C Ci:6:002:0 0 4 = 07000000
ffff000103151480 4035453891 S Ci:6:002:0 s c0 05 08b0 0000 0004 4 <
ffff000103151480 4035453927 C Ci:6:002:0 0 4 = 42060000
ffff000103151480 4035453956 S Co:6:002:0 s 40 05 08b0 0000 0004 4 = 18060000
ffff000103151480 4035453989 C Co:6:002:0 0 4 >
ffff000103151480 4035454040 S Ci:6:002:0 s c0 05 0d04 0000 0004 4 <
ffff000103151480 4035454087 C Ci:6:002:0 0 4 = 017c90b1
ffff000103151480 4035454119 S Co:6:002:0 s 40 05 0c90 0000 0004 4 = 017c8001
ffff000103151480 4035454159 C Co:6:002:0 0 4 >
ffff000103151480 4035454202 S Ci:6:002:0 s c0 05 08ac 0000 0004 4 <
ffff000103151480 4035454250 C Ci:6:002:0 0 4 = 08faf00f
ffff000103151480 4035454279 S Co:6:002:0 s 40 05 08ac 0000 0004 4 = 08faf00f
ffff000103151480 4035454308 C Co:6:002:0 0 4 >
ffff000103151480 4035454336 S Ci:6:002:0 s c0 05 08ac 0000 0004 4 <
ffff000103151480 4035454370 C Ci:6:002:0 0 4 = 08faf00f
ffff000103151480 4035454399 S Co:6:002:0 s 40 05 08ac 0000 0004 4 = 08faf00f
ffff000103151480 4035454439 C Co:6:002:0 0 4 >
ffff000103151480 4035454469 S Ci:6:002:0 s c0 05 08c4 0000 0004 4 <
ffff000103151480 4035454516 C Ci:6:002:0 0 4 = 00000000
ffff000103151480 4035454544 S Co:6:002:0 s 40 05 08c4 0000 0004 4 = 00000000
ffff000103151480 4035454575 C Co:6:002:0 0 4 >
ffff000103151480 4035454604 S Ci:6:002:0 s c0 05 0c00 0000 0004 4 <
ffff000103151480 4035454639 C Ci:6:002:0 0 4 = 07000000
ffff000103151480 4035454668 S Ci:6:002:0 s c0 05 08b0 0000 0004 4 <
ffff000103151480 4035454703 C Ci:6:002:0 0 4 = 18060000
ffff000103151480 4035454732 S Co:6:002:0 s 40 05 08b0 0000 0004 4 = 18060000
ffff000103151480 4035454761 C Co:6:002:0 0 4 >
ffff000103151480 4035454810 S Ci:6:002:0 s c0 05 0d04 0000 0004 4 <
ffff000103151480 4035454865 C Ci:6:002:0 0 4 = 017c90b1
ffff000103151480 4035454895 S Co:6:002:0 s 40 05 0c90 0000 0004 4 = 017c8001
ffff000103151480 4035454926 C Co:6:002:0 0 4 >
ffff000103151480 4035454968 S Ci:6:002:0 s c0 05 0e00 0000 0004 4 <
ffff000103151480 4035455011 C Ci:6:002:0 0 4 = 07000000
ffff000103151480 4035455041 S Ci:6:002:0 s c0 05 08b0 0000 0004 4 <
ffff000103151480 4035455083 C Ci:6:002:0 0 4 = 18060000
ffff000103151480 4035455114 S Co:6:002:0 s 40 05 08b0 0000 0004 4 = 18060000
ffff000103151480 4035455143 C Co:6:002:0 0 4 >
ffff000103151480 4035455191 S Ci:6:002:0 s c0 05 0d44 0000 0004 4 <
ffff000103151480 4035455254 C Ci:6:002:0 0 4 = 017c90b1
ffff000103151480 4035455283 S Co:6:002:0 s 40 05 0e90 0000 0004 4 = 017c8001
ffff000103151480 4035455323 C Co:6:002:0 0 4 >
ffff000103151480 4035455366 S Ci:6:002:0 s c0 05 08ac 0000 0004 4 <
ffff000103151480 4035455411 C Ci:6:002:0 0 4 = 08faf00f
ffff000103151480 4035455439 S Co:6:002:0 s 40 05 08ac 0000 0004 4 = 08faf00f
ffff000103151480 4035455484 C Co:6:002:0 0 4 >
ffff000103151480 4035455512 S Ci:6:002:0 s c0 05 08ac 0000 0004 4 <
ffff000103151480 4035455544 C Ci:6:002:0 0 4 = 08faf00f
ffff000103151480 4035455573 S Co:6:002:0 s 40 05 08ac 0000 0004 4 = 08faf00f
ffff000103151480 4035455613 C Co:6:002:0 0 4 >
ffff000103151480 4035455642 S Ci:6:002:0 s c0 05 08c4 0000 0004 4 <
ffff000103151480 4035455686 C Ci:6:002:0 0 4 = 00000000
ffff000103151480 4035455714 S Co:6:002:0 s 40 05 08c4 0000 0004 4 = 00000000
ffff000103151480 4035455742 C Co:6:002:0 0 4 >
ffff000103151480 4035455770 S Ci:6:002:0 s c0 05 0e00 0000 0004 4 <
ffff000103151480 4035455803 C Ci:6:002:0 0 4 = 07000000
ffff000103151480 4035455832 S Ci:6:002:0 s c0 05 08b0 0000 0004 4 <
ffff000103151480 4035455875 C Ci:6:002:0 0 4 = 18060000
ffff000103151480 4035455904 S Co:6:002:0 s 40 05 08b0 0000 0004 4 = 18060000
ffff000103151480 4035455932 C Co:6:002:0 0 4 >
ffff000103151480 4035455981 S Ci:6:002:0 s c0 05 0d44 0000 0004 4 <
ffff000103151480 4035456048 C Ci:6:002:0 0 4 = 017c90b1
ffff000103151480 4035456084 S Co:6:002:0 s 40 05 0e90 0000 0004 4 = 017c8001
ffff000103151480 4035456114 C Co:6:002:0 0 4 >
ffff000103151480 4035456156 S Ci:6:002:0 s c0 05 0668 0000 0002 2 <
ffff000103151480 4035456203 C Ci:6:002:0 0 2 = 0010
ffff00014a4c29c0 4035456235 S Co:6:002:0 s 40 05 0668 0000 0002 2 = 0010
ffff00014a4c29c0 4035456265 C Co:6:002:0 0 2 >
ffff00014a4c29c0 4035456297 S Co:6:002:0 s 40 05 0483 0000 0001 1 = 00
ffff00014a4c29c0 4035456327 C Co:6:002:0 0 1 >
ffff00014a4c29c0 4035456357 S Ci:6:002:0 s c0 05 0837 0000 0001 1 <
ffff00014a4c29c0 4035456398 C Ci:6:002:0 0 1 = 00
ffff00014a4c29c0 4035456431 S Ci:6:002:0 s c0 05 08ac 0000 0004 4 <
ffff00014a4c29c0 4035456471 C Ci:6:002:0 0 4 = 08faf00f
ffff00014a4c29c0 4035456503 S Co:6:002:0 s 40 05 08ac 0000 0004 4 = 08faf00f
ffff00014a4c29c0 4035456534 C Co:6:002:0 0 4 >
ffff00014a4c29c0 4035456569 S Ci:6:002:0 s c0 05 08c4 0000 0004 4 <
ffff00014a4c29c0 4035456618 C Ci:6:002:0 0 4 = 00000000
ffff00014a4c29c0 4035456653 S Co:6:002:0 s 40 05 08c4 0000 0004 4 = 00000000
ffff00014a4c29c0 4035456685 C Co:6:002:0 0 4 >
ffff00014a4c29c0 4035456719 S Ci:6:002:0 s c0 05 0848 0000 0004 4 <
ffff00014a4c29c0 4035456755 C Ci:6:002:0 0 4 = 8bffd061
ffff00014a4c29c0 4035456790 S Co:6:002:0 s 40 05 0848 0000 0004 4 = 8bffd061
ffff00014a4c29c0 4035456822 C Co:6:002:0 0 4 >
ffff00014a4c29c0 4035456857 S Ci:6:002:0 s c0 05 08ac 0000 0004 4 <
ffff00014a4c29c0 4035456893 C Ci:6:002:0 0 4 = 08faf00f
ffff00014a4c29c0 4035456927 S Co:6:002:0 s 40 05 08ac 0000 0004 4 = 08faf00f
ffff00014a4c29c0 4035456958 C Co:6:002:0 0 4 >
ffff00014a4c29c0 4035456992 S Ci:6:002:0 s c0 05 08ac 0000 0004 4 <
ffff00014a4c29c0 4035457028 C Ci:6:002:0 0 4 = 08faf00f
ffff00014a4c29c0 4035457063 S Co:6:002:0 s 40 05 08ac 0000 0004 4 = 08faf00f
ffff00014a4c29c0 4035457111 C Co:6:002:0 0 4 >
ffff00014a4c29c0 4035457146 S Ci:6:002:0 s c0 05 08c4 0000 0004 4 <
ffff00014a4c29c0 4035457182 C Ci:6:002:0 0 4 = 00000000
ffff00014a4c29c0 4035457217 S Co:6:002:0 s 40 05 08c4 0000 0004 4 = 00000000
ffff00014a4c29c0 4035457249 C Co:6:002:0 0 4 >
ffff00014a4c29c0 4035457283 S Ci:6:002:0 s c0 05 0c00 0000 0004 4 <
ffff00014a4c29c0 4035457319 C Ci:6:002:0 0 4 = 07000000
ffff00014a4c29c0 4035457353 S Ci:6:002:0 s c0 05 08b0 0000 0004 4 <
ffff00014a4c29c0 4035457389 C Ci:6:002:0 0 4 = 18060000
ffff00014a4c29c0 4035457423 S Co:6:002:0 s 40 05 08b0 0000 0004 4 = 18060000
ffff00014a4c29c0 4035457456 C Co:6:002:0 0 4 >
ffff00014a4c29c0 4035457510 S Ci:6:002:0 s c0 05 0d04 0000 0004 4 <
ffff00014a4c29c0 4035457557 C Ci:6:002:0 0 4 = 017c90b1
ffff00014a4c29c0 4035457592 S Co:6:002:0 s 40 05 0c90 0000 0004 4 = 017c8001
ffff00014a4c29c0 4035457622 C Co:6:002:0 0 4 >
ffff00014a4c29c0 4035457675 S Ci:6:002:0 s c0 05 0e00 0000 0004 4 <
ffff00014a4c29c0 4035457739 C Ci:6:002:0 0 4 = 07000000
ffff00014a4c29c0 4035457773 S Ci:6:002:0 s c0 05 08b0 0000 0004 4 <
ffff00014a4c29c0 4035457809 C Ci:6:002:0 0 4 = 18060000
ffff00014a4c29c0 4035457843 S Co:6:002:0 s 40 05 08b0 0000 0004 4 = 18060000
ffff00014a4c29c0 4035457873 C Co:6:002:0 0 4 >
ffff00014a4c29c0 4035457927 S Ci:6:002:0 s c0 05 0d44 0000 0004 4 <
ffff00014a4c29c0 4035457991 C Ci:6:002:0 0 4 = 017c90b1
ffff00014a4c29c0 4035458025 S Co:6:002:0 s 40 05 0e90 0000 0004 4 = 017c8001
ffff00014a4c29c0 4035458056 C Co:6:002:0 0 4 >
ffff00014a4c29c0 4035458125 S Ci:6:002:0 s c0 05 0c20 0000 0004 4 <
ffff00014a4c29c0 4035458173 C Ci:6:002:0 0 4 = 13131313
ffff00014a4c29c0 4035458207 S Co:6:002:0 s 40 05 0c20 0000 0004 4 = 13131313
ffff00014a4c29c0 4035458240 C Co:6:002:0 0 4 >
ffff00014a4c29c0 4035458274 S Ci:6:002:0 s c0 05 0c24 0000 0004 4 <
ffff00014a4c29c0 4035458310 C Ci:6:002:0 0 4 = 20202020
ffff00014a4c29c0 4035458345 S Co:6:002:0 s 40 05 0c24 0000 0004 4 = 20202020
ffff00014a4c29c0 4035458376 C Co:6:002:0 0 4 >
ffff00014a4c29c0 4035458411 S Ci:6:002:0 s c0 05 0c28 0000 0004 4 <
ffff00014a4c29c0 4035458448 C Ci:6:002:0 0 4 = 20201e1c
ffff00014a4c29c0 4035458483 S Co:6:002:0 s 40 05 0c28 0000 0004 4 = 20201e1c
ffff00014a4c29c0 4035458515 C Co:6:002:0 0 4 >
ffff00014a4c29c0 4035458550 S Ci:6:002:0 s c0 05 0c2c 0000 0004 4 <
ffff00014a4c29c0 4035458587 C Ci:6:002:0 0 4 = 20202020
ffff00014a4c29c0 4035458621 S Co:6:002:0 s 40 05 0c2c 0000 0004 4 = 20202020
ffff00014a4c29c0 4035458653 C Co:6:002:0 0 4 >
ffff00014a4c29c0 4035458688 S Ci:6:002:0 s c0 05 0c30 0000 0004 4 <
ffff00014a4c29c0 4035458742 C Ci:6:002:0 0 4 = 20201e1c
ffff00014a4c29c0 4035458777 S Co:6:002:0 s 40 05 0c30 0000 0004 4 = 20201e1c
ffff00014a4c29c0 4035458808 C Co:6:002:0 0 4 >
ffff00014a4c29c0 4035458843 S Ci:6:002:0 s c0 05 0c34 0000 0004 4 <
ffff00014a4c29c0 4035458881 C Ci:6:002:0 0 4 = 20202020
ffff00014a4c29c0 4035458916 S Co:6:002:0 s 40 05 0c34 0000 0004 4 = 20202020
ffff00014a4c29c0 4035458947 C Co:6:002:0 0 4 >
ffff00014a4c29c0 4035458983 S Ci:6:002:0 s c0 05 0c38 0000 0004 4 <
ffff00014a4c29c0 4035459021 C Ci:6:002:0 0 4 = 201e1c1a
ffff00014a4c29c0 4035459056 S Co:6:002:0 s 40 05 0c38 0000 0004 4 = 201e1c1a
ffff00014a4c29c0 4035459088 C Co:6:002:0 0 4 >
ffff00014a4c29c0 4035459124 S Ci:6:002:0 s c0 05 0c3c 0000 0004 4 <
ffff00014a4c29c0 4035459161 C Ci:6:002:0 0 4 = 20202020
ffff00014a4c29c0 4035459197 S Co:6:002:0 s 40 05 0c3c 0000 0004 4 = 20202020
ffff00014a4c29c0 4035459241 C Co:6:002:0 0 4 >
ffff00014a4c29c0 4035459276 S Ci:6:002:0 s c0 05 0c40 0000 0004 4 <
ffff00014a4c29c0 4035459313 C Ci:6:002:0 0 4 = 20201e1c
ffff00014a4c29c0 4035459349 S Co:6:002:0 s 40 05 0c40 0000 0004 4 = 20201e1c
ffff00014a4c29c0 4035459381 C Co:6:002:0 0 4 >
ffff00014a4c29c0 4035459416 S Ci:6:002:0 s c0 05 0c44 0000 0004 4 <
ffff00014a4c29c0 4035459453 C Ci:6:002:0 0 4 = 1a181e1e
ffff00014a4c29c0 4035459488 S Co:6:002:0 s 40 05 0c44 0000 0004 4 = 1a181e1e
ffff00014a4c29c0 4035459520 C Co:6:002:0 0 4 >
ffff00014a4c29c0 4035459555 S Ci:6:002:0 s c0 05 0c48 0000 0004 4 <
ffff00014a4c29c0 4035459593 C Ci:6:002:0 0 4 = 1e1e1e1e
ffff00014a4c29c0 4035459627 S Co:6:002:0 s 40 05 0c48 0000 0004 4 = 1e1e1e1e
ffff00014a4c29c0 4035459659 C Co:6:002:0 0 4 >
ffff00014a4c29c0 4035459694 S Ci:6:002:0 s c0 05 0c4c 0000 0004 4 <
ffff00014a4c29c0 4035459744 C Ci:6:002:0 0 4 = 1c1a1816
ffff00014a4c29c0 4035459779 S Co:6:002:0 s 40 05 0c4c 0000 0004 4 = 1c1a1816
ffff00014a4c29c0 4035459811 C Co:6:002:0 0 4 >
ffff00014a4c29c0 4035459845 S Ci:6:002:0 s c0 05 0c54 0000 0004 4 <
ffff00014a4c29c0 4035459883 C Ci:6:002:0 0 4 = 120a0400
ffff00014a4c29c0 4035459917 S Co:6:002:0 s 40 05 0c54 0000 0004 4 = 120a0400
ffff00014a4c29c0 4035459948 C Co:6:002:0 0 4 >
ffff00014a4c29c0 4035459983 S Ci:6:002:0 s c0 05 0e20 0000 0004 4 <
ffff00014a4c29c0 4035460032 C Ci:6:002:0 0 4 = 14141414
ffff00014a4c29c0 4035460106 S Co:6:002:0 s 40 05 0e20 0000 0004 4 = 14141414
ffff00014a4c29c0 4035460136 C Co:6:002:0 0 4 >
ffff00014a4c29c0 4035460166 S Ci:6:002:0 s c0 05 0e24 0000 0004 4 <
ffff00014a4c29c0 4035460217 C Ci:6:002:0 0 4 = 1d1d1d1d
ffff00014a4c29c0 4035460252 S Co:6:002:0 s 40 05 0e24 0000 0004 4 = 1d1d1d1d
ffff00014a4c29c0 4035460282 C Co:6:002:0 0 4 >
ffff00014a4c29c0 4035460316 S Ci:6:002:0 s c0 05 0e28 0000 0004 4 <
ffff00014a4c29c0 4035460369 C Ci:6:002:0 0 4 = 1d1d1b19
ffff00014a4c29c0 4035460403 S Co:6:002:0 s 40 05 0e28 0000 0004 4 = 1d1d1b19
ffff00014a4c29c0 4035460435 C Co:6:002:0 0 4 >
ffff00014a4c29c0 4035460469 S Ci:6:002:0 s c0 05 0e2c 0000 0004 4 <
ffff00014a4c29c0 4035460507 C Ci:6:002:0 0 4 = 1f1f1f1f
ffff00014a4c29c0 4035460543 S Co:6:002:0 s 40 05 0e2c 0000 0004 4 = 1f1f1f1f
ffff00014a4c29c0 4035460574 C Co:6:002:0 0 4 >
ffff00014a4c29c0 4035460609 S Ci:6:002:0 s c0 05 0e30 0000 0004 4 <
ffff00014a4c29c0 4035460646 C Ci:6:002:0 0 4 = 1f1f1d1b
ffff00014a4c29c0 4035460681 S Co:6:002:0 s 40 05 0e30 0000 0004 4 = 1f1f1d1b
ffff00014a4c29c0 4035460712 C Co:6:002:0 0 4 >
ffff00014a4c29c0 4035460747 S Ci:6:002:0 s c0 05 0e34 0000 0004 4 <
ffff00014a4c29c0 4035460785 C Ci:6:002:0 0 4 = 1f1f1f1f
ffff00014a4c29c0 4035460820 S Co:6:002:0 s 40 05 0e34 0000 0004 4 = 1f1f1f1f
ffff00014a4c29c0 4035460865 C Co:6:002:0 0 4 >
ffff00014a4c29c0 4035460900 S Ci:6:002:0 s c0 05 0e38 0000 0004 4 <
ffff00014a4c29c0 4035460939 C Ci:6:002:0 0 4 = 1f1d1b19
ffff00014a4c29c0 4035460973 S Co:6:002:0 s 40 05 0e38 0000 0004 4 = 1f1d1b19
ffff00014a4c29c0 4035461005 C Co:6:002:0 0 4 >
ffff00014a4c29c0 4035461040 S Ci:6:002:0 s c0 05 0e3c 0000 0004 4 <
ffff00014a4c29c0 4035461078 C Ci:6:002:0 0 4 = 1f1f1f1f
ffff00014a4c29c0 4035461112 S Co:6:002:0 s 40 05 0e3c 0000 0004 4 = 1f1f1f1f
ffff00014a4c29c0 4035461144 C Co:6:002:0 0 4 >
ffff00014a4c29c0 4035461179 S Ci:6:002:0 s c0 05 0e40 0000 0004 4 <
ffff00014a4c29c0 4035461237 C Ci:6:002:0 0 4 = 1f1f1d1b
ffff00014a4c29c0 4035461272 S Co:6:002:0 s 40 05 0e40 0000 0004 4 = 1f1f1d1b
ffff00014a4c29c0 4035461303 C Co:6:002:0 0 4 >
ffff00014a4c29c0 4035461338 S Ci:6:002:0 s c0 05 0e44 0000 0004 4 <
ffff00014a4c29c0 4035461376 C Ci:6:002:0 0 4 = 19171d1d
ffff00014a4c29c0 4035461411 S Co:6:002:0 s 40 05 0e44 0000 0004 4 = 19171d1d
ffff00014a4c29c0 4035461443 C Co:6:002:0 0 4 >
ffff00014a4c29c0 4035461477 S Ci:6:002:0 s c0 05 0e48 0000 0004 4 <
ffff00014a4c29c0 4035461516 C Ci:6:002:0 0 4 = 1d1d1d1d
ffff00014a4c29c0 4035461551 S Co:6:002:0 s 40 05 0e48 0000 0004 4 = 1d1d1d1d
ffff00014a4c29c0 4035461583 C Co:6:002:0 0 4 >
ffff00014a4c29c0 4035461617 S Ci:6:002:0 s c0 05 0e4c 0000 0004 4 <
ffff00014a4c29c0 4035461656 C Ci:6:002:0 0 4 = 1b191715
ffff00014a4c29c0 4035461691 S Co:6:002:0 s 40 05 0e4c 0000 0004 4 = 1b191715
ffff00014a4c29c0 4035461738 C Co:6:002:0 0 4 >
ffff00014a4c29c0 4035461773 S Ci:6:002:0 s c0 05 0e54 0000 0004 4 <
ffff00014a4c29c0 4035461810 C Ci:6:002:0 0 4 = 11090300
ffff00014a4c29c0 4035461845 S Co:6:002:0 s 40 05 0e54 0000 0004 4 = 11090300
ffff00014a4c29c0 4035461877 C Co:6:002:0 0 4 >
ffff00014a4c29c0 4035461926 S Ci:6:002:0 s c0 05 0454 0000 0001 1 <
ffff00014a4c29c0 4035461994 C Ci:6:002:0 0 1 = 00
ffff00014a4c29c0 4035462029 S Ci:6:002:0 s c0 05 0454 0000 0001 1 <
ffff00014a4c29c0 4035462066 C Ci:6:002:0 0 1 = 00
ffff00014a4c29c0 4035462100 S Co:6:002:0 s 40 05 0454 0000 0001 1 = 80
ffff00014a4c29c0 4035462131 C Co:6:002:0 0 1 >
ffff00014a4c29c0 4035462165 S Ci:6:002:0 s c0 05 041a 0000 0002 2 <
ffff00014a4c29c0 4035462204 C Ci:6:002:0 0 2 = ff0f
ffff00014a4c29c0 4035462239 S Ci:6:002:0 s c0 05 0808 0000 0004 4 <
ffff00014a4c29c0 4035462276 C Ci:6:002:0 0 4 = 3382023e
ffff00014a4c29c0 4035462312 S Co:6:002:0 s 40 05 0808 0000 0004 4 = 3382023e
ffff00014a4c29c0 4035462358 C Co:6:002:0 0 4 >
ffff00014a4c29c0 4035462393 S Ci:6:002:0 s c0 05 0834 0000 0004 4 <
ffff00014a4c29c0 4035462431 C Ci:6:002:0 0 4 = 05a73700
ffff00014a4c29c0 4035462466 S Co:6:002:0 s 40 05 0834 0000 0004 4 = 06a73700
ffff00014a4c29c0 4035462498 C Co:6:002:0 0 4 >
ffff00014a4c29c0 4035462532 S Ci:6:002:0 s c0 05 0830 0000 0004 4 <
ffff00014a4c29c0 4035462571 C Ci:6:002:0 0 4 = b8eeaa2e
ffff00014a4c29c0 4035462609 S Co:6:002:0 s 40 05 0830 0000 0004 4 = b8aeaa2e
ffff00014a4c29c0 4035462640 C Co:6:002:0 0 4 >
ffff00014a4c29c0 4035462675 S Ci:6:002:0 s c0 05 0830 0000 0004 4 <
ffff00014a4c29c0 4035462713 C Ci:6:002:0 0 4 = b8aeaa2e
ffff00014a4c29c0 4035462748 S Co:6:002:0 s 40 05 0830 0000 0004 4 = b8aeaa2e
ffff00014a4c29c0 4035462780 C Co:6:002:0 0 4 >
ffff00014a4c29c0 4035462813 S Ci:6:002:0 s c0 05 082c 0000 0004 4 <
ffff00014a4c29c0 4035462870 C Ci:6:002:0 0 4 = dc832000
ffff00014a4c29c0 4035462905 S Co:6:002:0 s 40 05 082c 0000 0004 4 = dd832000
ffff00014a4c29c0 4035462936 C Co:6:002:0 0 4 >
ffff00014a4c29c0 4035462971 S Co:6:002:0 s 40 05 0cb0 0000 0004 4 = 17773354
ffff00014a4c29c0 4035463002 C Co:6:002:0 0 4 >
ffff00014a4c29c0 4035463037 S Co:6:002:0 s 40 05 0eb0 0000 0004 4 = 17773354
ffff00014a4c29c0 4035463068 C Co:6:002:0 0 4 >
ffff00014a4c29c0 4035463103 S Ci:6:002:0 s c0 05 0cb4 0000 0004 4 <
ffff00014a4c29c0 4035463141 C Ci:6:002:0 0 4 = 77000001
ffff00014a4c29c0 4035463176 S Co:6:002:0 s 40 05 0cb4 0000 0004 4 = 77000001
ffff00014a4c29c0 4035463207 C Co:6:002:0 0 4 >
ffff00014a4c29c0 4035463243 S Ci:6:002:0 s c0 05 0eb4 0000 0004 4 <
ffff00014a4c29c0 4035463282 C Ci:6:002:0 0 4 = 77000001
ffff00014a4c29c0 4035463317 S Co:6:002:0 s 40 05 0eb4 0000 0004 4 = 77000001
ffff00014a4c29c0 4035463366 C Co:6:002:0 0 4 >
ffff00014a4c29c0 4035463400 S Ci:6:002:0 s c0 05 0900 0000 0004 4 <
ffff00014a4c29c0 4035463440 C Ci:6:002:0 0 4 = 01040000
ffff00014a4c29c0 4035463474 S Co:6:002:0 s 40 05 0900 0000 0004 4 = 01040000
ffff00014a4c29c0 4035463506 C Co:6:002:0 0 4 >
ffff00014a4c29c0 4035463540 S Ci:6:002:0 s c0 05 080c 0000 0004 4 <
ffff00014a4c29c0 4035463579 C Ci:6:002:0 0 4 = 13111312
ffff00014a4c29c0 4035463613 S Co:6:002:0 s 40 05 080c 0000 0004 4 = 03111312
ffff00014a4c29c0 4035463645 C Co:6:002:0 0 4 >
ffff00014a4c29c0 4035463679 S Ci:6:002:0 s c0 05 0a04 0000 0004 4 <
ffff00014a4c29c0 4035463718 C Ci:6:002:0 0 4 = 0c00ff01
ffff00014a4c29c0 4035463753 S Co:6:002:0 s 40 05 0a04 0000 0004 4 = 0c00ff0f
ffff00014a4c29c0 4035463784 C Co:6:002:0 0 4 >
ffff00014a4c29c0 4035463819 S Ci:6:002:0 s c0 05 0440 0000 0004 4 <
ffff00014a4c29c0 4035463869 C Ci:6:002:0 0 4 = 00000000
ffff00014a4c29c0 4035463904 S Co:6:002:0 s 40 05 0440 0000 0004 4 = 50010000
ffff00014a4c29c0 4035463936 C Co:6:002:0 0 4 >
ffff00014a4c29c0 4035463970 S Ci:6:002:0 s c0 05 0c1c 0000 0004 4 <
ffff00014a4c29c0 4035464018 C Ci:6:002:0 0 4 = 03000040
ffff00014a4c29c0 4035464053 S Co:6:002:0 s 40 05 0c1c 0000 0004 4 = 0300402d
ffff00014a4c29c0 4035464208 C Co:6:002:0 0 4 >
ffff00014a4c29c0 4035464251 S Ci:6:002:0 s c0 05 0e1c 0000 0004 4 <
ffff00014a4c29c0 4035464288 C Ci:6:002:0 0 4 = 03000040
ffff00014a4c29c0 4035464324 S Co:6:002:0 s 40 05 0e1c 0000 0004 4 = 0300402d
ffff00014a4c29c0 4035464366 C Co:6:002:0 0 4 >
ffff00014a4c29c0 4035464402 S Ci:6:002:0 s c0 05 0860 0000 0004 4 <
ffff00014a4c29c0 4035464437 C Ci:6:002:0 0 4 = 21c3d572
ffff00014a4c29c0 4035464472 S Co:6:002:0 s 40 05 0860 0000 0004 4 = 21c3a568
ffff00014a4c29c0 4035464503 C Co:6:002:0 0 4 >
ffff00014a4c29c0 4035464538 S Ci:6:002:0 s c0 05 0c00 0000 0004 4 <
ffff00014a4c29c0 4035464574 C Ci:6:002:0 0 4 = 07000000
ffff00014a4c29c0 4035464608 S Ci:6:002:0 s c0 05 08b0 0000 0004 4 <
ffff00014a4c29c0 4035464644 C Ci:6:002:0 0 4 = 18060000
ffff00014a4c29c0 4035464678 S Co:6:002:0 s 40 05 08b0 0000 0004 4 = 18060000
ffff00014a4c29c0 4035464710 C Co:6:002:0 0 4 >
ffff00014a4c29c0 4035464764 S Ci:6:002:0 s c0 05 0d04 0000 0004 4 <
ffff00014a4c29c0 4035464811 C Ci:6:002:0 0 4 = 017c90b1
ffff00014a4c29c0 4035464845 S Co:6:002:0 s 40 05 0c90 0000 0004 4 = 017d8301
ffff00014a4c29c0 4035464876 C Co:6:002:0 0 4 >
ffff00014a4c29c0 4035464924 S Ci:6:002:0 s c0 05 08ac 0000 0004 4 <
ffff00014a4c29c0 4035464989 C Ci:6:002:0 0 4 = 08faf00f
ffff00014a4c29c0 4035465023 S Co:6:002:0 s 40 05 08ac 0000 0004 4 = 08faf00f
ffff00014a4c29c0 4035465055 C Co:6:002:0 0 4 >
ffff00014a4c29c0 4035465088 S Ci:6:002:0 s c0 05 08ac 0000 0004 4 <
ffff00014a4c29c0 4035465123 C Ci:6:002:0 0 4 = 08faf00f
ffff00014a4c29c0 4035465161 S Co:6:002:0 s 40 05 08ac 0000 0004 4 = 08faf00f
ffff00014a4c29c0 4035465200 C Co:6:002:0 0 4 >
ffff00014a4c29c0 4035465235 S Ci:6:002:0 s c0 05 08c4 0000 0004 4 <
ffff00014a4c29c0 4035465271 C Ci:6:002:0 0 4 = 00000000
ffff00014a4c29c0 4035465306 S Co:6:002:0 s 40 05 08c4 0000 0004 4 = 00000000
ffff00014a4c29c0 4035465338 C Co:6:002:0 0 4 >
ffff00014a4c29c0 4035465372 S Ci:6:002:0 s c0 05 0c00 0000 0004 4 <
ffff00014a4c29c0 4035465408 C Ci:6:002:0 0 4 = 07000000
ffff00014a4c29c0 4035465442 S Ci:6:002:0 s c0 05 08b0 0000 0004 4 <
ffff00014a4c29c0 4035465493 C Ci:6:002:0 0 4 = 18060000
ffff00014a4c29c0 4035465527 S Co:6:002:0 s 40 05 08b0 0000 0004 4 = 18060000
ffff00014a4c29c0 4035465559 C Co:6:002:0 0 4 >
ffff00014a4c29c0 4035465613 S Ci:6:002:0 s c0 05 0d04 0000 0004 4 <
ffff00014a4c29c0 4035465661 C Ci:6:002:0 0 4 = 017d91b1
ffff00014a4c29c0 4035465695 S Co:6:002:0 s 40 05 0c90 0000 0004 4 = 647d8101
ffff00014a4c29c0 4035465740 C Co:6:002:0 0 4 >
ffff00014a4c29c0 4035465787 S Ci:6:002:0 s c0 05 0e00 0000 0004 4 <
ffff00014a4c29c0 4035465834 C Ci:6:002:0 0 4 = 07000000
ffff00014a4c29c0 4035465868 S Ci:6:002:0 s c0 05 08b0 0000 0004 4 <
ffff00014a4c29c0 4035465903 C Ci:6:002:0 0 4 = 18060000
ffff00014a4c29c0 4035465937 S Co:6:002:0 s 40 05 08b0 0000 0004 4 = 18060000
ffff00014a4c29c0 4035465986 C Co:6:002:0 0 4 >
ffff00014a4c29c0 4035466041 S Ci:6:002:0 s c0 05 0d44 0000 0004 4 <
ffff00014a4c29c0 4035466088 C Ci:6:002:0 0 4 = 017c90b1
ffff00014a4c29c0 4035466122 S Co:6:002:0 s 40 05 0e90 0000 0004 4 = 017d8301
ffff00014a4c29c0 4035466152 C Co:6:002:0 0 4 >
ffff00014a4c29c0 4035466199 S Ci:6:002:0 s c0 05 08ac 0000 0004 4 <
ffff00014a4c29c0 4035466247 C Ci:6:002:0 0 4 = 08faf00f
ffff00014a4c29c0 4035466280 S Co:6:002:0 s 40 05 08ac 0000 0004 4 = 08faf00f
ffff00014a4c29c0 4035466311 C Co:6:002:0 0 4 >
ffff00014a4c29c0 4035466344 S Ci:6:002:0 s c0 05 08ac 0000 0004 4 <
ffff00014a4c29c0 4035466380 C Ci:6:002:0 0 4 = 08faf00f
ffff00014a4c29c0 4035466414 S Co:6:002:0 s 40 05 08ac 0000 0004 4 = 08faf00f
ffff00014a4c29c0 4035466446 C Co:6:002:0 0 4 >
ffff00014a4c29c0 4035466480 S Ci:6:002:0 s c0 05 08c4 0000 0004 4 <
ffff00014a4c29c0 4035466516 C Ci:6:002:0 0 4 = 00000000
ffff00014a4c29c0 4035466550 S Co:6:002:0 s 40 05 08c4 0000 0004 4 = 00000000
ffff00014a4c29c0 4035466581 C Co:6:002:0 0 4 >
ffff00014a4c29c0 4035466617 S Ci:6:002:0 s c0 05 0e00 0000 0004 4 <
ffff00014a4c29c0 4035466654 C Ci:6:002:0 0 4 = 07000000
ffff00014a4c29c0 4035466688 S Ci:6:002:0 s c0 05 08b0 0000 0004 4 <
ffff00014a4c29c0 4035466743 C Ci:6:002:0 0 4 = 18060000
ffff00014a4c29c0 4035466778 S Co:6:002:0 s 40 05 08b0 0000 0004 4 = 18060000
ffff00014a4c29c0 4035466810 C Co:6:002:0 0 4 >
ffff00014a4c29c0 4035466864 S Ci:6:002:0 s c0 05 0d44 0000 0004 4 <
ffff00014a4c29c0 4035466911 C Ci:6:002:0 0 4 = 017d91b1
ffff00014a4c29c0 4035466945 S Co:6:002:0 s 40 05 0e90 0000 0004 4 = 647d8101
ffff00014a4c29c0 4035466990 C Co:6:002:0 0 4 >
ffff00014a4c29c0 4035467037 S Ci:6:002:0 s c0 05 0668 0000 0002 2 <
ffff00014a4c29c0 4035467085 C Ci:6:002:0 0 2 = 0010
ffff00014a4c29c0 4035467120 S Co:6:002:0 s 40 05 0668 0000 0002 2 = 0010
ffff00014a4c29c0 4035467150 C Co:6:002:0 0 2 >
ffff00014a4c29c0 4035467184 S Co:6:002:0 s 40 05 0483 0000 0001 1 = 00
ffff00014a4c29c0 4035467233 C Co:6:002:0 0 1 >
ffff00014a4c29c0 4035467267 S Ci:6:002:0 s c0 05 0837 0000 0001 1 <
ffff00014a4c29c0 4035467303 C Ci:6:002:0 0 1 = 00
ffff00014a4c29c0 4035467338 S Ci:6:002:0 s c0 05 08ac 0000 0004 4 <
ffff00014a4c29c0 4035467375 C Ci:6:002:0 0 4 = 08faf00f
ffff00014a4c29c0 4035467410 S Co:6:002:0 s 40 05 08ac 0000 0004 4 = 08faf00f
ffff00014a4c29c0 4035467442 C Co:6:002:0 0 4 >
ffff00014a4c29c0 4035467476 S Ci:6:002:0 s c0 05 08c4 0000 0004 4 <
ffff00014a4c29c0 4035467513 C Ci:6:002:0 0 4 = 00000000
ffff00014a4c29c0 4035467548 S Co:6:002:0 s 40 05 08c4 0000 0004 4 = 00000000
ffff00014a4c29c0 4035467580 C Co:6:002:0 0 4 >
ffff00014a4c29c0 4035467614 S Ci:6:002:0 s c0 05 0848 0000 0004 4 <
ffff00014a4c29c0 4035467652 C Ci:6:002:0 0 4 = 8bffd061
ffff00014a4c29c0 4035467687 S Co:6:002:0 s 40 05 0848 0000 0004 4 = 8bffd061
ffff00014a4c29c0 4035467737 C Co:6:002:0 0 4 >
ffff00014a4c29c0 4035467771 S Ci:6:002:0 s c0 05 08ac 0000 0004 4 <
ffff00014a4c29c0 4035467809 C Ci:6:002:0 0 4 = 08faf00f
ffff00014a4c29c0 4035467844 S Co:6:002:0 s 40 05 08ac 0000 0004 4 = 08faf00f
ffff00014a4c29c0 4035467875 C Co:6:002:0 0 4 >
ffff00014a4c29c0 4035467909 S Ci:6:002:0 s c0 05 08ac 0000 0004 4 <
ffff00014a4c29c0 4035467946 C Ci:6:002:0 0 4 = 08faf00f
ffff00014a4c29c0 4035467980 S Co:6:002:0 s 40 05 08ac 0000 0004 4 = 08faf00f
ffff00014a4c29c0 4035468024 C Co:6:002:0 0 4 >
ffff00014a4c29c0 4035468059 S Ci:6:002:0 s c0 05 08c4 0000 0004 4 <
ffff00014a4c29c0 4035468115 C Ci:6:002:0 0 4 = 00000000
ffff00014a4c29c0 4035468151 S Co:6:002:0 s 40 05 08c4 0000 0004 4 = 00000000
ffff00014a4c29c0 4035468182 C Co:6:002:0 0 4 >
ffff00014a4c29c0 4035468217 S Ci:6:002:0 s c0 05 0c00 0000 0004 4 <
ffff00014a4c29c0 4035468254 C Ci:6:002:0 0 4 = 07000000
ffff00014a4c29c0 4035468288 S Ci:6:002:0 s c0 05 08b0 0000 0004 4 <
ffff00014a4c29c0 4035468325 C Ci:6:002:0 0 4 = 18060000
ffff00014a4c29c0 4035468360 S Co:6:002:0 s 40 05 08b0 0000 0004 4 = 18060000
ffff00014a4c29c0 4035468391 C Co:6:002:0 0 4 >
ffff00014a4c29c0 4035468446 S Ci:6:002:0 s c0 05 0d04 0000 0004 4 <
ffff00014a4c29c0 4035468494 C Ci:6:002:0 0 4 = 647d93b1
ffff00014a4c29c0 4035468528 S Co:6:002:0 s 40 05 0c90 0000 0004 4 = 647d8301
ffff00014a4c29c0 4035468558 C Co:6:002:0 0 4 >
ffff00014a4c29c0 4035468605 S Ci:6:002:0 s c0 05 0e00 0000 0004 4 <
ffff00014a4c29c0 4035468654 C Ci:6:002:0 0 4 = 07000000
ffff00014a4c29c0 4035468688 S Ci:6:002:0 s c0 05 08b0 0000 0004 4 <
ffff00014a4c29c0 4035468742 C Ci:6:002:0 0 4 = 18060000
ffff00014a4c29c0 4035468775 S Co:6:002:0 s 40 05 08b0 0000 0004 4 = 18060000
ffff00014a4c29c0 4035468806 C Co:6:002:0 0 4 >
ffff00014a4c29c0 4035468861 S Ci:6:002:0 s c0 05 0d44 0000 0004 4 <
ffff00014a4c29c0 4035468909 C Ci:6:002:0 0 4 = 647d93b1
ffff00014a4c29c0 4035468943 S Co:6:002:0 s 40 05 0e90 0000 0004 4 = 647d8301
ffff00014a4c29c0 4035468990 C Co:6:002:0 0 4 >
ffff00014a4c29c0 4035469039 S Ci:6:002:0 s c0 05 0073 0000 0001 1 <
ffff00014a4c29c0 4035469088 C Ci:6:002:0 0 1 = 07
ffff00014a4c29c0 4035469122 S Co:6:002:0 s 40 05 0073 0000 0001 1 = 07
ffff00014a4c29c0 4035469152 C Co:6:002:0 0 1 >
ffff00014a4c29c0 4035469209 S Ci:6:002:0 s c0 05 0c24 0000 0004 4 <
ffff00014a4c29c0 4035469258 C Ci:6:002:0 0 4 = 20202020
ffff00014a4c29c0 4035469292 S Co:6:002:0 s 40 05 0c24 0000 0004 4 = 27272727
ffff00014a4c29c0 4035469323 C Co:6:002:0 0 4 >
ffff00014a4c29c0 4035469357 S Ci:6:002:0 s c0 05 0c28 0000 0004 4 <
ffff00014a4c29c0 4035469393 C Ci:6:002:0 0 4 = 20201e1c
ffff00014a4c29c0 4035469428 S Co:6:002:0 s 40 05 0c28 0000 0004 4 = 27272725
ffff00014a4c29c0 4035469459 C Co:6:002:0 0 4 >
ffff00014a4c29c0 4035469492 S Ci:6:002:0 s c0 05 0c2c 0000 0004 4 <
ffff00014a4c29c0 4035469530 C Ci:6:002:0 0 4 = 20202020
ffff00014a4c29c0 4035469565 S Co:6:002:0 s 40 05 0c2c 0000 0004 4 = 2c2c2c2c
ffff00014a4c29c0 4035469613 C Co:6:002:0 0 4 >
ffff00014a4c29c0 4035469647 S Ci:6:002:0 s c0 05 0c30 0000 0004 4 <
ffff00014a4c29c0 4035469686 C Ci:6:002:0 0 4 = 20201e1c
ffff00014a4c29c0 4035469720 S Co:6:002:0 s 40 05 0c30 0000 0004 4 = 2c2a2826
ffff00014a4c29c0 4035469751 C Co:6:002:0 0 4 >
ffff00014a4c29c0 4035469785 S Ci:6:002:0 s c0 05 0c34 0000 0004 4 <
ffff00014a4c29c0 4035469823 C Ci:6:002:0 0 4 = 20202020
ffff00014a4c29c0 4035469857 S Co:6:002:0 s 40 05 0c34 0000 0004 4 = 28282828
ffff00014a4c29c0 4035469889 C Co:6:002:0 0 4 >
ffff00014a4c29c0 4035469923 S Ci:6:002:0 s c0 05 0c38 0000 0004 4 <
ffff00014a4c29c0 4035469960 C Ci:6:002:0 0 4 = 201e1c1a
ffff00014a4c29c0 4035469995 S Co:6:002:0 s 40 05 0c38 0000 0004 4 = 28282624
ffff00014a4c29c0 4035470027 C Co:6:002:0 0 4 >
ffff00014a4c29c0 4035470060 S Ci:6:002:0 s c0 05 0c3c 0000 0004 4 <
ffff00014a4c29c0 4035470115 C Ci:6:002:0 0 4 = 20202020
ffff00014a4c29c0 4035470150 S Co:6:002:0 s 40 05 0c3c 0000 0004 4 = 2c2c2c2c
ffff00014a4c29c0 4035470181 C Co:6:002:0 0 4 >
ffff00014a4c29c0 4035470216 S Ci:6:002:0 s c0 05 0c40 0000 0004 4 <
ffff00014a4c29c0 4035470254 C Ci:6:002:0 0 4 = 20201e1c
ffff00014a4c29c0 4035470288 S Co:6:002:0 s 40 05 0c40 0000 0004 4 = 2c2a2826
ffff00014a4c29c0 4035470320 C Co:6:002:0 0 4 >
ffff00014a4c29c0 4035470354 S Ci:6:002:0 s c0 05 0c44 0000 0004 4 <
ffff00014a4c29c0 4035470392 C Ci:6:002:0 0 4 = 1a181e1e
ffff00014a4c29c0 4035470427 S Co:6:002:0 s 40 05 0c44 0000 0004 4 = 24242828
ffff00014a4c29c0 4035470458 C Co:6:002:0 0 4 >
ffff00014a4c29c0 4035470492 S Ci:6:002:0 s c0 05 0c48 0000 0004 4 <
ffff00014a4c29c0 4035470530 C Ci:6:002:0 0 4 = 1e1e1e1e
ffff00014a4c29c0 4035470565 S Co:6:002:0 s 40 05 0c48 0000 0004 4 = 28282828
ffff00014a4c29c0 4035470613 C Co:6:002:0 0 4 >
ffff00014a4c29c0 4035470648 S Ci:6:002:0 s c0 05 0c4c 0000 0004 4 <
ffff00014a4c29c0 4035470686 C Ci:6:002:0 0 4 = 1c1a1816
ffff00014a4c29c0 4035470720 S Co:6:002:0 s 40 05 0c4c 0000 0004 4 = 26242222
ffff00014a4c29c0 4035470752 C Co:6:002:0 0 4 >
ffff00014a4c29c0 4035470786 S Ci:6:002:0 s c0 05 0c54 0000 0004 4 <
ffff00014a4c29c0 4035470824 C Ci:6:002:0 0 4 = 120a0400
ffff00014a4c29c0 4035470859 S Co:6:002:0 s 40 05 0c54 0000 0004 4 = 1c140e00
ffff00014a4c29c0 4035470891 C Co:6:002:0 0 4 >
ffff00014a4c29c0 4035470926 S Ci:6:002:0 s c0 05 0e24 0000 0004 4 <
ffff00014a4c29c0 4035470963 C Ci:6:002:0 0 4 = 1d1d1d1d
ffff00014a4c29c0 4035470998 S Co:6:002:0 s 40 05 0e24 0000 0004 4 = 21212121
ffff00014a4c29c0 4035471029 C Co:6:002:0 0 4 >
ffff00014a4c29c0 4035471063 S Ci:6:002:0 s c0 05 0e28 0000 0004 4 <
ffff00014a4c29c0 4035471117 C Ci:6:002:0 0 4 = 1d1d1b19
ffff00014a4c29c0 4035471152 S Co:6:002:0 s 40 05 0e28 0000 0004 4 = 2121211f
ffff00014a4c29c0 4035471184 C Co:6:002:0 0 4 >
ffff00014a4c29c0 4035471219 S Ci:6:002:0 s c0 05 0e2c 0000 0004 4 <
ffff00014a4c29c0 4035471257 C Ci:6:002:0 0 4 = 1f1f1f1f
ffff00014a4c29c0 4035471291 S Co:6:002:0 s 40 05 0e2c 0000 0004 4 = 26262626
ffff00014a4c29c0 4035471322 C Co:6:002:0 0 4 >
ffff00014a4c29c0 4035471357 S Ci:6:002:0 s c0 05 0e30 0000 0004 4 <
ffff00014a4c29c0 4035471396 C Ci:6:002:0 0 4 = 1f1f1d1b
ffff00014a4c29c0 4035471430 S Co:6:002:0 s 40 05 0e30 0000 0004 4 = 26242220
ffff00014a4c29c0 4035471462 C Co:6:002:0 0 4 >
ffff00014a4c29c0 4035471496 S Ci:6:002:0 s c0 05 0e34 0000 0004 4 <
ffff00014a4c29c0 4035471534 C Ci:6:002:0 0 4 = 1f1f1f1f
ffff00014a4c29c0 4035471568 S Co:6:002:0 s 40 05 0e34 0000 0004 4 = 22222222
ffff00014a4c29c0 4035471616 C Co:6:002:0 0 4 >
ffff00014a4c29c0 4035471650 S Ci:6:002:0 s c0 05 0e38 0000 0004 4 <
ffff00014a4c29c0 4035471689 C Ci:6:002:0 0 4 = 1f1d1b19
ffff00014a4c29c0 4035471724 S Co:6:002:0 s 40 05 0e38 0000 0004 4 = 2222201e
ffff00014a4c29c0 4035471755 C Co:6:002:0 0 4 >
ffff00014a4c29c0 4035471789 S Ci:6:002:0 s c0 05 0e3c 0000 0004 4 <
ffff00014a4c29c0 4035471828 C Ci:6:002:0 0 4 = 1f1f1f1f
ffff00014a4c29c0 4035471862 S Co:6:002:0 s 40 05 0e3c 0000 0004 4 = 26262626
ffff00014a4c29c0 4035471894 C Co:6:002:0 0 4 >
ffff00014a4c29c0 4035471928 S Ci:6:002:0 s c0 05 0e40 0000 0004 4 <
ffff00014a4c29c0 4035471966 C Ci:6:002:0 0 4 = 1f1f1d1b
ffff00014a4c29c0 4035472018 S Co:6:002:0 s 40 05 0e40 0000 0004 4 = 26242220
ffff00014a4c29c0 4035472051 C Co:6:002:0 0 4 >
ffff00014a4c29c0 4035472088 S Ci:6:002:0 s c0 05 0e44 0000 0004 4 <
ffff00014a4c29c0 4035472126 C Ci:6:002:0 0 4 = 19171d1d
ffff00014a4c29c0 4035472161 S Co:6:002:0 s 40 05 0e44 0000 0004 4 = 1e1e2222
ffff00014a4c29c0 4035472193 C Co:6:002:0 0 4 >
ffff00014a4c29c0 4035472227 S Ci:6:002:0 s c0 05 0e48 0000 0004 4 <
ffff00014a4c29c0 4035472266 C Ci:6:002:0 0 4 = 1d1d1d1d
ffff00014a4c29c0 4035472300 S Co:6:002:0 s 40 05 0e48 0000 0004 4 = 22222222
ffff00014a4c29c0 4035472332 C Co:6:002:0 0 4 >
ffff00014a4c29c0 4035472366 S Ci:6:002:0 s c0 05 0e4c 0000 0004 4 <
ffff00014a4c29c0 4035472404 C Ci:6:002:0 0 4 = 1b191715
ffff00014a4c29c0 4035472438 S Co:6:002:0 s 40 05 0e4c 0000 0004 4 = 201e1c1c
ffff00014a4c29c0 4035472486 C Co:6:002:0 0 4 >
ffff00014a4c29c0 4035472521 S Ci:6:002:0 s c0 05 0e54 0000 0004 4 <
ffff00014a4c29c0 4035472560 C Ci:6:002:0 0 4 = 11090300
ffff00014a4c29c0 4035472595 S Co:6:002:0 s 40 05 0e54 0000 0004 4 = 160e0800
ffff00014a4c29c0 4035472626 C Co:6:002:0 0 4 >
ffff0001035330c0 4035524704 C Bi:6:002:1 0 478 = a6010484 00000f80 5a086000 04300000 00000000 d313c400 2c2a0000 55d9d90f
ffff0001035330c0 4035524743 S Bi:6:002:1 -115 32768 <
ffff000103533480 4035525615 C Bi:6:002:1 0 471 = 9f010484 00000f80 fa046000 04300000 00000000 9617c400 2c2a0000 52dfdf0f
ffff000103533480 4035525641 S Bi:6:002:1 -115 32768 <
ffff000103533240 4035526469 C Bi:6:002:1 0 446 = 86010484 00000f80 7e066000 04300000 00000000 071bc400 2c2a0000 55e1e10f
ffff000103533240 4035526494 S Bi:6:002:1 -115 32768 <
ffff000103533780 4035527398 C Bi:6:002:1 0 469 = 9d010484 00000f80 0c0b6000 04300000 00000000 891ec400 2c2a0000 55e2e20f
ffff000103533780 4035527423 S Bi:6:002:1 -115 32768 <
ffff0001035330c0 4035528339 C Bi:6:002:1 0 479 = a7010484 00000f80 2c026000 04300000 00000000 1322c400 2c280000 57e0e00f
ffff0001035330c0 4035528374 S Bi:6:002:1 -115 32768 <
ffff000103533480 4035627094 C Bi:6:002:1 0 478 = a6010484 00000f80 5b086000 04300000 00000000 d5a3c500 2a2a0000 54e1e10f
ffff000103533480 4035627121 S Bi:6:002:1 -115 32768 <
ffff000103533240 4035628022 C Bi:6:002:1 0 471 = 9f010484 00000f80 fb046000 04300000 00000000 9ca7c500 2c2a0000 56dede0f
ffff000103533240 4035628047 S Bi:6:002:1 -115 32768 <
ffff000103533780 4035628864 C Bi:6:002:1 0 446 = 86010484 00000f80 7f066000 04300000 00000000 08abc500 2e2a0000 53dddd0f
ffff000103533780 4035628890 S Bi:6:002:1 -115 32768 <
ffff0001035330c0 4035629786 C Bi:6:002:1 0 469 = 9d010484 00000f80 0d0b6000 04300000 00000000 84aec500 2c280000 54dbdb0f
ffff0001035330c0 4035629811 S Bi:6:002:1 -115 32768 <
ffff000103533480 4035630717 C Bi:6:002:1 0 479 = a7010484 00000f80 2d026000 04300000 00000000 09b2c500 2a280000 52dede0f
ffff000103533480 4035630742 S Bi:6:002:1 -115 32768 <
ffff000103533240 4035729490 C Bi:6:002:1 0 478 = a6010484 00000f80 5c086000 04300000 00000000 d633c700 2e280000 56dede0f
ffff000103533240 4035729522 S Bi:6:002:1 -115 32768 <
ffff000103533780 4035730440 C Bi:6:002:1 0 471 = 9f010484 00000f80 fc046000 04300000 00000000 ab37c700 2e2a0000 53e1e10f
ffff000103533780 4035730465 S Bi:6:002:1 -115 32768 <
ffff0001035330c0 4035731289 C Bi:6:002:1 0 446 = 86010484 00000f80 80066000 04300000 00000000 213bc700 2a2c0000 54dada0f
ffff0001035330c0 4035731313 S Bi:6:002:1 -115 32768 <
ffff000103533480 4035732197 C Bi:6:002:1 0 469 = 9d010484 00000f80 0e0b6000 04300000 00000000 863ec700 2c280000 53dddd0f
ffff000103533480 4035732222 S Bi:6:002:1 -115 32768 <
ffff000103533240 4035733163 C Bi:6:002:1 0 479 = a7010484 00000f80 2e026000 04300000 00000000 4742c700 2e2a0000 53e0e00f
ffff000103533240 4035733188 S Bi:6:002:1 -115 32768 <
ffff000103533c00 4035772169 S Ci:6:002:0 s c0 05 004c 0000 0001 1 <
ffff000103533c00 4035772302 C Ci:6:002:0 0 1 = 20
ffff000103533c00 4035772447 S Co:6:002:0 s 40 05 004c 0000 0001 1 = 20
ffff000103533c00 4035772585 C Co:6:002:0 0 1 >
ffff000103150540 4035772900 S Ci:6:002:0 s c0 05 0770 0000 0004 4 <
ffff000103150540 4035773079 C Ci:6:002:0 0 4 = 00000000
ffff000103150540 4035773239 S Ci:6:002:0 s c0 05 0774 0000 0004 4 <
ffff000103150540 4035773386 C Ci:6:002:0 0 4 = 00000000
ffff000103150540 4035773547 S Co:6:002:0 s 40 05 076e 0000 0001 1 = 0c
ffff000103150540 4035773686 C Co:6:002:0 0 1 >
ffff000103150540 4035773850 S Ci:6:002:0 s c0 05 0808 0000 0004 4 <
ffff000103150540 4035773994 C Ci:6:002:0 0 4 = 3382023e
ffff000103150540 4035774156 S Ci:6:002:0 s c0 05 0a5c 0000 0002 2 <
ffff000103150540 4035774300 C Ci:6:002:0 0 2 = 6300
ffff000103150540 4035774461 S Ci:6:002:0 s c0 05 0f48 0000 0002 2 <
ffff000103150540 4035774606 C Ci:6:002:0 0 2 = 4314
ffff000103150540 4035774751 S Ci:6:002:0 s c0 05 0f04 0000 0004 4 <
ffff000103150540 4035774871 C Ci:6:002:0 0 4 = 15001000
ffff000103150540 4035774907 S Ci:6:002:0 s c0 05 0f14 0000 0004 4 <
ffff000103150540 4035775018 C Ci:6:002:0 0 4 = 55000a00
ffff000103150540 4035775048 S Ci:6:002:0 s c0 05 0f10 0000 0004 4 <
ffff000103150540 4035775159 C Ci:6:002:0 0 4 = 00000000
ffff000103150540 4035775188 S Ci:6:002:0 s c0 05 0f0c 0000 0004 4 <
ffff000103150540 4035775312 C Ci:6:002:0 0 4 = 00000000
ffff000103150540 4035775340 S Ci:6:002:0 s c0 05 0f08 0000 0004 4 <
ffff000103150540 4035775459 C Ci:6:002:0 0 4 = b0009e14
ffff000103150540 4035775479 S Ci:6:002:0 s c0 05 0fcc 0000 0004 4 <
ffff000103150540 4035775592 C Ci:6:002:0 0 4 = 00000000
ffff000103150540 4035775621 S Ci:6:002:0 s c0 05 09a4 0000 0004 4 <
ffff000103150540 4035775740 C Ci:6:002:0 0 4 = 80000800
ffff000103150540 4035775761 S Co:6:002:0 s 40 05 09a4 0000 0004 4 = 80000a00
ffff000103150540 4035775868 C Co:6:002:0 0 4 >
ffff000103150540 4035775897 S Ci:6:002:0 s c0 05 09a4 0000 0004 4 <
ffff000103150540 4035776020 C Ci:6:002:0 0 4 = 80000a00
ffff000103150540 4035776041 S Co:6:002:0 s 40 05 09a4 0000 0004 4 = 80000800
ffff000103150540 4035776079 C Co:6:002:0 0 4 >
ffff000103150540 4035776104 S Ci:6:002:0 s c0 05 0a2c 0000 0004 4 <
ffff000103150540 4035776223 C Ci:6:002:0 0 4 = 00809000
ffff000103150540 4035776349 S Co:6:002:0 s 40 05 0a2c 0000 0004 4 = 00009000
ffff000103150540 4035776465 C Co:6:002:0 0 4 >
ffff000103150540 4035776619 S Ci:6:002:0 s c0 05 0a2c 0000 0004 4 <
ffff000103150540 4035776739 C Ci:6:002:0 0 4 = 00009000
ffff000103150540 4035776874 S Co:6:002:0 s 40 05 0a2c 0000 0004 4 = 00809000
ffff000103150540 4035776990 C Co:6:002:0 0 4 >
ffff000103150540 4035777137 S Ci:6:002:0 s c0 05 0b58 0000 0004 4 <
ffff000103150540 4035777264 C Ci:6:002:0 0 4 = 00000000
ffff000103150540 4035777410 S Co:6:002:0 s 40 05 0b58 0000 0004 4 = 01000000
ffff000103150540 4035777527 C Co:6:002:0 0 4 >
ffff000103150540 4035777673 S Ci:6:002:0 s c0 05 0b58 0000 0004 4 <
ffff000103150540 4035777811 C Ci:6:002:0 0 4 = 01000000
ffff000103150540 4035777847 S Co:6:002:0 s 40 05 0b58 0000 0004 4 = 00000000
ffff000103150540 4035777953 C Co:6:002:0 0 4 >
ffff000103150540 4035777985 S Ci:6:002:0 s c0 05 0c50 0000 0004 4 <
ffff000103150540 4035778096 C Ci:6:002:0 0 4 = 1f000000
ffff000103150540 4035778126 S Co:6:002:0 s 40 05 0c50 0000 0004 4 = 21000000
ffff000103150540 4035778234 C Co:6:002:0 0 4 >
ffff000103150540 4035778264 S Ci:6:002:0 s c0 05 0e50 0000 0004 4 <
ffff000103150540 4035778382 C Ci:6:002:0 0 4 = 1f000000
ffff000103150540 4035778405 S Co:6:002:0 s 40 05 0e50 0000 0004 4 = 21000000
ffff000103150540 4035778511 C Co:6:002:0 0 4 >
ffff000103150540 4035778541 S Ci:6:002:0 s c0 05 01cc 0000 0001 1 <
ffff000103150540 4035778659 C Ci:6:002:0 0 1 = 00
ffff000103150540 4035778683 S Co:6:002:0 s 40 05 01f4 0000 0004 4 = 00000000
ffff000103150540 4035778801 C Co:6:002:0 0 4 >
ffff000103150540 4035778830 S Co:6:002:0 s 40 05 01d4 0000 0004 4 = 58000000
ffff000103150540 4035778945 C Co:6:002:0 0 4 >
ffff000103150540 4035778968 S Co:6:002:0 s 40 05 0440 0000 0004 4 = 00000000
ffff000103150540 4035779075 C Co:6:002:0 0 4 >
ffff000103150540 4035779106 S Ci:6:002:0 s c0 05 0c00 0000 0004 4 <
ffff000103150540 4035779223 C Ci:6:002:0 0 4 = 07000000
ffff000103150540 4035779244 S Ci:6:002:0 s c0 05 08b0 0000 0004 4 <
ffff000103150540 4035779356 C Ci:6:002:0 0 4 = 18060000
ffff000103150540 4035779386 S Co:6:002:0 s 40 05 08b0 0000 0004 4 = 42060000
ffff000103150540 4035779493 C Co:6:002:0 0 4 >
ffff000103150540 4035779543 S Ci:6:002:0 s c0 05 0d04 0000 0004 4 <
ffff000103150540 4035779652 C Ci:6:002:0 0 4 = 108d90b1
ffff000103150540 4035779682 S Co:6:002:0 s 40 05 0c90 0000 0004 4 = 108d2304
ffff000103150540 4035779804 C Co:6:002:0 0 4 >
ffff000103150540 4035779847 S Co:6:002:0 s 40 05 0280 0000 0002 2 = 0001
ffff000103150540 4035779949 C Co:6:002:0 0 2 >
ffff000103150540 4035779979 S Ci:6:002:0 s c0 05 010c 0000 0001 1 <
ffff000103150540 4035780091 C Ci:6:002:0 0 1 = b4
ffff000103150540 4035780121 S Co:6:002:0 s 40 05 010c 0000 0001 1 = b4
ffff000103150540 4035780235 C Co:6:002:0 0 1 >
ffff000103533780 4035831845 C Bi:6:002:1 0 478 = a6010484 00000f80 5d086000 04300000 00000000 d8c3c800 2a2a0000 55dede0f
ffff000103533780 4035831871 S Bi:6:002:1 -115 32768 <
ffff0001035330c0 4035832816 C Bi:6:002:1 0 471 = 9f010484 00000f80 fd046000 04300000 00000000 a5c7c800 2a2c0000 57dddd0f
ffff0001035330c0 4035832841 S Bi:6:002:1 -115 32768 <
ffff000103533480 4035833732 C Bi:6:002:1 0 446 = 86010484 00000f80 81066000 04300000 00000000 41cbc800 2a2e0000 53dfdf0f
ffff000103533480 4035833758 S Bi:6:002:1 -115 32768 <
ffff000103533240 4035834621 C Bi:6:002:1 0 469 = 9d010484 00000f80 0f0b6000 04300000 00000000 a7cec800 2a280000 54dddd0f
ffff000103533240 4035834645 S Bi:6:002:1 -115 32768 <
ffff000103533780 4035835538 C Bi:6:002:1 0 479 = a7010484 00000f80 2f026000 04300000 00000000 2cd2c800 2c260000 52dddd0f
ffff000103533780 4035835563 S Bi:6:002:1 -115 32768 <
ffff0001035330c0 4035934254 C Bi:6:002:1 0 478 = a6010484 00000f80 5e086000 04300000 00000000 d953ca00 2a2a0000 56dbdb0f
ffff0001035330c0 4035934297 S Bi:6:002:1 -115 32768 <
ffff000103533480 4035935304 C Bi:6:002:1 0 471 = 9f010484 00000f80 fe046000 04300000 00000000 fb57ca00 2c2a0000 55dcdc0f
ffff000103533480 4035935328 S Bi:6:002:1 -115 32768 <
ffff000103533240 4035936166 C Bi:6:002:1 0 446 = 86010484 00000f80 82066000 04300000 00000000 7f5bca00 2c280000 53dcdc0f
ffff000103533240 4035936184 S Bi:6:002:1 -115 32768 <
ffff000103533780 4035937113 C Bi:6:002:1 0 469 = 9d010484 00000f80 100b6000 04300000 00000000 fd5eca00 2a280000 56dfdf0f
ffff000103533780 4035937137 S Bi:6:002:1 -115 32768 <
ffff0001035330c0 4035938092 C Bi:6:002:1 0 479 = a7010484 00000f80 30026000 04300000 00000000 ca62ca00 2a280000 55e0e00f
ffff0001035330c0 4035938116 S Bi:6:002:1 -115 32768 <
ffff000103533480 4036036690 C Bi:6:002:1 0 478 = a6010484 00000f80 5f086000 04300000 00000000 dbe3cb00 2a280000 54dcdc0f
ffff000103533480 4036036720 S Bi:6:002:1 -115 32768 <
ffff000103533240 4036037618 C Bi:6:002:1 0 471 = 9f010484 00000f80 ff046000 04300000 00000000 98e7cb00 282a0000 55dcdc0f
ffff000103533240 4036037644 S Bi:6:002:1 -115 32768 <
ffff000103533780 4036038492 C Bi:6:002:1 0 446 = 86010484 00000f80 83066000 04300000 00000000 21ebcb00 2c2a0000 54dada0f
ffff000103533780 4036038516 S Bi:6:002:1 -115 32768 <
ffff0001035330c0 4036039381 C Bi:6:002:1 0 469 = 9d010484 00000f80 110b6000 04300000 00000000 91eecb00 2a2c0000 53dddd0f
ffff0001035330c0 4036039402 S Bi:6:002:1 -115 32768 <
ffff000103533480 4036040281 C Bi:6:002:1 0 479 = a7010484 00000f80 31026000 04300000 00000000 17f2cb00 2a2a0000 55dada0f
ffff000103533480 4036040304 S Bi:6:002:1 -115 32768 <
ffff000103533240 4036139113 C Bi:6:002:1 0 478 = a6010484 00000f80 60086000 04300000 00000000 dd73cd00 2a2a0000 52dfdf0f
ffff000103533240 4036139149 S Bi:6:002:1 -115 32768 <
ffff000103533780 4036140024 C Bi:6:002:1 0 471 = 9f010484 00000f80 00056000 04300000 00000000 a277cd00 2c2a0000 55dada0f
ffff000103533780 4036140044 S Bi:6:002:1 -115 32768 <
ffff0001035330c0 4036140873 C Bi:6:002:1 0 446 = 86010484 00000f80 84066000 04300000 00000000 1b7bcd00 2a2a0000 52d9d90f
ffff0001035330c0 4036140896 S Bi:6:002:1 -115 32768 <
ffff000103533480 4036141781 C Bi:6:002:1 0 469 = 9d010484 00000f80 120b6000 04300000 00000000 7f7ecd00 2a280000 54dddd0f
ffff000103533480 4036141805 S Bi:6:002:1 -115 32768 <
ffff000103533240 4036142724 C Bi:6:002:1 0 479 = a7010484 00000f80 32026000 04300000 00000000 3682cd00 2a280000 50dbdb0f
ffff000103533240 4036142746 S Bi:6:002:1 -115 32768 <
ffff000103533780 4036241507 C Bi:6:002:1 0 478 = a6010484 00000f80 61086000 04300000 00000000 de03cf00 2a2a0000 52dbdb0f
ffff000103533780 4036241559 S Bi:6:002:1 -115 32768 <
ffff0001035330c0 4036242476 C Bi:6:002:1 0 471 = 9f010484 00000f80 01056000 04300000 00000000 d207cf00 2a2a0000 54d7d70f
ffff0001035330c0 4036242502 S Bi:6:002:1 -115 32768 <
ffff000103533480 4036243382 C Bi:6:002:1 0 446 = 86010484 00000f80 85066000 04300000 00000000 7f0bcf00 2a280000 56dddd0f
ffff000103533480 4036243409 S Bi:6:002:1 -115 32768 <
ffff000103533240 4036244338 C Bi:6:002:1 0 469 = 9d010484 00000f80 130b6000 04300000 00000000 150fcf00 2a280000 51dfdf0f
ffff000103533240 4036244364 S Bi:6:002:1 -115 32768 <
ffff000103533780 4036245259 C Bi:6:002:1 0 479 = a7010484 00000f80 33026000 04300000 00000000 a812cf00 2c280000 54e0e00f
ffff000103533780 4036245283 S Bi:6:002:1 -115 32768 <
ffff0001035330c0 4036343872 C Bi:6:002:1 0 478 = a6010484 00000f80 62086000 04300000 00000000 e093d000 2a280000 55dddd0f
ffff0001035330c0 4036343905 S Bi:6:002:1 -115 32768 <
ffff000103533480 4036344844 C Bi:6:002:1 0 471 = 9f010484 00000f80 02056000 04300000 00000000 a997d000 2a2a0000 51dbdb0f
ffff000103533480 4036344871 S Bi:6:002:1 -115 32768 <
ffff000103533240 4036345708 C Bi:6:002:1 0 446 = 86010484 00000f80 86066000 04300000 00000000 319bd000 2c2a0000 55dddd0f
ffff000103533240 4036345732 S Bi:6:002:1 -115 32768 <
ffff000103533780 4036346634 C Bi:6:002:1 0 469 = 9d010484 00000f80 140b6000 04300000 00000000 b49ed000 2c2a0000 4fdddd0f
ffff000103533780 4036346658 S Bi:6:002:1 -115 32768 <
ffff0001035330c0 4036347466 C Bi:6:002:1 0 479 = a7010484 00000f80 34026000 04300000 00000000 42a2d000 2a280000 56e1e10f
ffff0001035330c0 4036347489 S Bi:6:002:1 -115 32768 <
ffff000103533480 4036387094 C Bi:6:002:1 0 245 = bd000484 00000f80 4b0a6000 04300000 00000000 f53dd100 28280000 50efef0f
ffff000103533480 4036387144 S Bi:6:002:1 -115 32768 <
ffff000103533240 4036421988 C Bi:6:002:1 0 245 = bd000484 00000f80 4c0a6000 04300000 00000000 35c6d100 2e280000 58eeee0f
ffff000103533240 4036422014 S Bi:6:002:1 -115 32768 <
ffff000103533780 4036447216 C Bi:6:002:1 0 471 = 9f010484 00000f80 03056000 04300000 00000000 a327d200 2a2c0000 55e0e00f
ffff000103533780 4036447244 S Bi:6:002:1 -115 32768 <
ffff0001035330c0 4036448094 C Bi:6:002:1 0 446 = 86010484 00000f80 87066000 04300000 00000000 212bd200 2a280000 54dcdc0f
ffff0001035330c0 4036448120 S Bi:6:002:1 -115 32768 <
ffff000103533480 4036448998 C Bi:6:002:1 0 469 = 9d010484 00000f80 150b6000 04300000 00000000 8e2ed200 2a280000 51dcdc0f
ffff000103533480 4036449023 S Bi:6:002:1 -115 32768 <
ffff000103533240 4036548669 C Bi:6:002:1 0 478 = a6010484 00000f80 64086000 04300000 00000000 e3b3d300 2a2c0000 4fdcdc0f
ffff000103533240 4036548702 S Bi:6:002:1 -115 32768 <
ffff000103533780 4036549632 C Bi:6:002:1 0 471 = 9f010484 00000f80 04056000 04300000 00000000 a6b7d300 2a2a0000 55dddd0f
ffff000103533780 4036549657 S Bi:6:002:1 -115 32768 <
ffff0001035330c0 4036550474 C Bi:6:002:1 0 446 = 86010484 00000f80 88066000 04300000 00000000 16bbd300 2c280000 52dddd0f
ffff0001035330c0 4036550499 S Bi:6:002:1 -115 32768 <
ffff000103533480 4036551400 C Bi:6:002:1 0 469 = 9d010484 00000f80 160b6000 04300000 00000000 94bed300 2a2a0000 57e0e00f
ffff000103533480 4036551425 S Bi:6:002:1 -115 32768 <
ffff000103533240 4036552396 C Bi:6:002:1 0 479 = a7010484 00000f80 36026000 04300000 00000000 6cc2d300 2a260000 55dddd0f
ffff000103533240 4036552421 S Bi:6:002:1 -115 32768 <
ffff000103533780 4036651073 C Bi:6:002:1 0 478 = a6010484 00000f80 65086000 04300000 00000000 e443d500 2c280000 54e0e00f
ffff000103533780 4036651107 S Bi:6:002:1 -115 32768 <
ffff0001035330c0 4036652161 C Bi:6:002:1 0 471 = 9f010484 00000f80 05056000 04300000 00000000 2748d500 2a2a0000 54dada0f
ffff0001035330c0 4036652187 S Bi:6:002:1 -115 32768 <
ffff000103533480 4036653038 C Bi:6:002:1 0 446 = 86010484 00000f80 89066000 04300000 00000000 bb4bd500 2c280000 53dddd0f
ffff000103533480 4036653063 S Bi:6:002:1 -115 32768 <
ffff000103533240 4036653956 C Bi:6:002:1 0 469 = 9d010484 00000f80 170b6000 04300000 00000000 204fd500 2c280000 4fdcdc0f
ffff000103533240 4036653980 S Bi:6:002:1 -115 32768 <
ffff000103533780 4036654869 C Bi:6:002:1 0 479 = a7010484 00000f80 37026000 04300000 00000000 b552d500 2a280000 56dcdc0f
ffff000103533780 4036654893 S Bi:6:002:1 -115 32768 <
ffff0001035330c0 4036753511 C Bi:6:002:1 0 478 = a6010484 00000f80 66086000 04300000 00000000 e6d3d600 2a280000 4edfdf0f
ffff0001035330c0 4036753562 S Bi:6:002:1 -115 32768 <
ffff000103533480 4036754456 C Bi:6:002:1 0 471 = 9f010484 00000f80 06056000 04300000 00000000 bfd7d600 2a280000 54dbdb0f
ffff000103533480 4036754483 S Bi:6:002:1 -115 32768 <
ffff000103533240 4036755306 C Bi:6:002:1 0 446 = 86010484 00000f80 8a066000 04300000 00000000 3adbd600 2c2a0000 55e2e20f
ffff000103533240 4036755330 S Bi:6:002:1 -115 32768 <
ffff000103533780 4036756287 C Bi:6:002:1 0 469 = 9d010484 00000f80 180b6000 04300000 00000000 e9ded600 2a280000 52dddd0f
ffff000103533780 4036756312 S Bi:6:002:1 -115 32768 <
ffff0001035330c0 4036757203 C Bi:6:002:1 0 479 = a7010484 00000f80 38026000 04300000 00000000 73e2d600 2a2c0000 53d8d80f
ffff0001035330c0 4036757230 S Bi:6:002:1 -115 32768 <
ffff000103533c00 4036764195 S Ci:6:002:0 s c0 05 004c 0000 0001 1 <
ffff000103533c00 4036764326 C Ci:6:002:0 0 1 = 20
ffff000103533c00 4036764474 S Co:6:002:0 s 40 05 004c 0000 0001 1 = 20
ffff000103533c00 4036764586 C Co:6:002:0 0 1 >
ffff000103533480 4036855873 C Bi:6:002:1 0 478 = a6010484 00000f80 67086000 04300000 00000000 e863d800 2c2a0000 54dada0f
ffff000103533480 4036855929 S Bi:6:002:1 -115 32768 <
ffff000103533240 4036856804 C Bi:6:002:1 0 471 = 9f010484 00000f80 07056000 04300000 00000000 8e67d800 28280000 54dddd0f
ffff000103533240 4036856832 S Bi:6:002:1 -115 32768 <
ffff000103533780 4036857661 C Bi:6:002:1 0 446 = 86010484 00000f80 8b066000 04300000 00000000 0a6bd800 2a280000 54dcdc0f
ffff000103533780 4036857686 S Bi:6:002:1 -115 32768 <
ffff0001035330c0 4036858585 C Bi:6:002:1 0 469 = 9d010484 00000f80 190b6000 04300000 00000000 876ed800 2a2a0000 55dede0f
ffff0001035330c0 4036858610 S Bi:6:002:1 -115 32768 <
ffff000103533480 4036859419 C Bi:6:002:1 0 479 = a7010484 00000f80 39026000 04300000 00000000 1472d800 282a0000 50dede0f
ffff000103533480 4036859457 S Bi:6:002:1 -115 32768 <
ffff000103533240 4036958309 C Bi:6:002:1 0 478 = a6010484 00000f80 68086000 04300000 00000000 e9f3d900 2a280000 56dfdf0f
ffff000103533240 4036958345 S Bi:6:002:1 -115 32768 <
ffff000103533780 4036959231 C Bi:6:002:1 0 471 = 9f010484 00000f80 08056000 04300000 00000000 a8f7d900 2a2a0000 55d9d90f
ffff000103533780 4036959258 S Bi:6:002:1 -115 32768 <
ffff0001035330c0 4036960079 C Bi:6:002:1 0 446 = 86010484 00000f80 8c066000 04300000 00000000 1dfbd900 282a0000 54dcdc0f
ffff0001035330c0 4036960104 S Bi:6:002:1 -115 32768 <
ffff000103533480 4036961001 C Bi:6:002:1 0 469 = 9d010484 00000f80 1a0b6000 04300000 00000000 96fed900 2a2a0000 54dede0f
ffff000103533480 4036961025 S Bi:6:002:1 -115 32768 <
ffff000103533240 4036961930 C Bi:6:002:1 0 479 = a7010484 00000f80 3a026000 04300000 00000000 2d02da00 2a2a0000 55dcdc0f
ffff000103533240 4036961955 S Bi:6:002:1 -115 32768 <
ffff000103533780 4037060704 C Bi:6:002:1 0 478 = a6010484 00000f80 69086000 04300000 00000000 eb83db00 2c2a0000 51dcdc0f
ffff000103533780 4037060732 S Bi:6:002:1 -115 32768 <
ffff0001035330c0 4037061634 C Bi:6:002:1 0 471 = 9f010484 00000f80 09056000 04300000 00000000 ae87db00 2a2c0000 53dada0f
ffff0001035330c0 4037061658 S Bi:6:002:1 -115 32768 <
ffff000103533480 4037062489 C Bi:6:002:1 0 446 = 86010484 00000f80 8d066000 04300000 00000000 258bdb00 2c2a0000 53dddd0f
ffff000103533480 4037062513 S Bi:6:002:1 -115 32768 <
ffff000103533240 4037063413 C Bi:6:002:1 0 469 = 9d010484 00000f80 1b0b6000 04300000 00000000 a48edb00 2a280000 54e2e20f
ffff000103533240 4037063438 S Bi:6:002:1 -115 32768 <
ffff000103533780 4037064347 C Bi:6:002:1 0 479 = a7010484 00000f80 3b026000 04300000 00000000 3b92db00 2c280000 54dfdf0f
ffff000103533780 4037064371 S Bi:6:002:1 -115 32768 <
ffff0001035330c0 4037163066 C Bi:6:002:1 0 478 = a6010484 00000f80 6a086000 04300000 00000000 ec13dd00 2a260000 56dddd0f
ffff0001035330c0 4037163099 S Bi:6:002:1 -115 32768 <
ffff000103533480 4037163985 C Bi:6:002:1 0 471 = 9f010484 00000f80 0a056000 04300000 00000000 d317dd00 2c2a0000 56dada0f
ffff000103533480 4037164039 S Bi:6:002:1 -115 32768 <
ffff000103533240 4037164923 C Bi:6:002:1 0 446 = 86010484 00000f80 8e066000 04300000 00000000 4a1bdd00 2c280000 53dcdc0f
ffff000103533240 4037164947 S Bi:6:002:1 -115 32768 <
ffff000103533780 4037165840 C Bi:6:002:1 0 469 = 9d010484 00000f80 1c0b6000 04300000 00000000 ba1edd00 2c260000 55dfdf0f
ffff000103533780 4037165865 S Bi:6:002:1 -115 32768 <
ffff0001035330c0 4037166752 C Bi:6:002:1 0 479 = a7010484 00000f80 3c026000 04300000 00000000 4222dd00 2a280000 55dddd0f
ffff0001035330c0 4037166776 S Bi:6:002:1 -115 32768 <
ffff000103533480 4037265555 C Bi:6:002:1 0 478 = a6010484 00000f80 6b086000 04300000 00000000 eea3de00 2a280000 50e0e00f
ffff000103533480 4037265581 S Bi:6:002:1 -115 32768 <
ffff000103533240 4037266491 C Bi:6:002:1 0 471 = 9f010484 00000f80 0b056000 04300000 00000000 e7a7de00 2a280000 56dddd0f
ffff000103533240 4037266517 S Bi:6:002:1 -115 32768 <
ffff000103533780 4037267373 C Bi:6:002:1 0 446 = 86010484 00000f80 8f066000 04300000 00000000 7cabde00 2c280000 52dfdf0f
ffff000103533780 4037267398 S Bi:6:002:1 -115 32768 <
ffff0001035330c0 4037268397 C Bi:6:002:1 0 469 = 9d010484 00000f80 1d0b6000 04300000 00000000 69afde00 2a2a0000 53dede0f
ffff0001035330c0 4037268419 S Bi:6:002:1 -115 32768 <
ffff000103533480 4037269358 C Bi:6:002:1 0 479 = a7010484 00000f80 3d026000 04300000 00000000 04b3de00 2a280000 54e1e10f
ffff000103533480 4037269384 S Bi:6:002:1 -115 32768 <
ffff000103533240 4037367870 C Bi:6:002:1 0 478 = a6010484 00000f80 6c086000 04300000 00000000 f033e000 2a2a0000 54dfdf0f
ffff000103533240 4037367905 S Bi:6:002:1 -115 32768 <
ffff000103533780 4037368856 C Bi:6:002:1 0 471 = 9f010484 00000f80 0c056000 04300000 00000000 ba37e000 2a2a0000 54dcdc0f
ffff000103533780 4037368882 S Bi:6:002:1 -115 32768 <
ffff0001035330c0 4037369697 C Bi:6:002:1 0 446 = 86010484 00000f80 90066000 04300000 00000000 333be000 2a280000 53e0e00f
ffff0001035330c0 4037369722 S Bi:6:002:1 -115 32768 <
ffff000103533480 4037370594 C Bi:6:002:1 0 469 = 9d010484 00000f80 1e0b6000 04300000 00000000 943ee000 2a2a0000 53dfdf0f
ffff000103533480 4037370618 S Bi:6:002:1 -115 32768 <
ffff000103533240 4037371525 C Bi:6:002:1 0 479 = a7010484 00000f80 3e026000 04300000 00000000 2942e000 2a280000 56e0e00f
ffff000103533240 4037371550 S Bi:6:002:1 -115 32768 <
ffff000103533780 4037470269 C Bi:6:002:1 0 478 = a6010484 00000f80 6d086000 04300000 00000000 f1c3e100 2a280000 56dddd0f
ffff000103533780 4037470301 S Bi:6:002:1 -115 32768 <
ffff0001035330c0 4037471259 C Bi:6:002:1 0 471 = 9f010484 00000f80 0d056000 04300000 00000000 bcc7e100 2a280000 53dfdf0f
ffff0001035330c0 4037471284 S Bi:6:002:1 -115 32768 <
ffff000103533480 4037472030 C Bi:6:002:1 0 446 = 86010484 00000f80 91066000 04300000 00000000 2ecbe100 2a280000 54dddd0f
ffff000103533480 4037472047 S Bi:6:002:1 -115 32768 <
ffff000103533240 4037473038 C Bi:6:002:1 0 469 = 9d010484 00000f80 1f0b6000 04300000 00000000 bdcee100 2a280000 54dbdb0f
ffff000103533240 4037473063 S Bi:6:002:1 -115 32768 <
ffff000103533780 4037473948 C Bi:6:002:1 0 479 = a7010484 00000f80 3f026000 04300000 00000000 3ed2e100 2a2a0000 51dcdc0f
ffff000103533780 4037473973 S Bi:6:002:1 -115 32768 <
ffff0001035330c0 4037572681 C Bi:6:002:1 0 478 = a6010484 00000f80 6e086000 04300000 00000000 f353e300 2a280000 50dfdf0f
ffff0001035330c0 4037572707 S Bi:6:002:1 -115 32768 <
ffff000103533480 4037573650 C Bi:6:002:1 0 471 = 9f010484 00000f80 0e056000 04300000 00000000 b757e300 2a2a0000 54dfdf0f
ffff000103533480 4037573677 S Bi:6:002:1 -115 32768 <
ffff000103533240 4037574505 C Bi:6:002:1 0 446 = 86010484 00000f80 92066000 04300000 00000000 385be300 2a280000 54dede0f
ffff000103533240 4037574528 S Bi:6:002:1 -115 32768 <
ffff000103533780 4037575398 C Bi:6:002:1 0 469 = 9d010484 00000f80 200b6000 04300000 00000000 ac5ee300 2a280000 54dddd0f
ffff000103533780 4037575420 S Bi:6:002:1 -115 32768 <
ffff0001035330c0 4037576368 C Bi:6:002:1 0 479 = a7010484 00000f80 40026000 04300000 00000000 4362e300 282a0000 55e0e00f
ffff0001035330c0 4037576400 S Bi:6:002:1 -115 32768 <
ffff000103533480 4037675115 C Bi:6:002:1 0 478 = a6010484 00000f80 6f086000 04300000 00000000 f4e3e400 2a2c0000 52e4e40f
ffff000103533480 4037675171 S Bi:6:002:1 -115 32768 <
ffff000103533240 4037676074 C Bi:6:002:1 0 471 = 9f010484 00000f80 0f056000 04300000 00000000 d4e7e400 2a280000 54dcdc0f
ffff000103533240 4037676102 S Bi:6:002:1 -115 32768 <
ffff000103533780 4037676974 C Bi:6:002:1 0 446 = 86010484 00000f80 93066000 04300000 00000000 7febe400 2a280000 54dfdf0f
ffff000103533780 4037676998 S Bi:6:002:1 -115 32768 <
ffff0001035330c0 4037677890 C Bi:6:002:1 0 469 = 9d010484 00000f80 210b6000 04300000 00000000 f2eee400 2a280000 54dcdc0f
ffff0001035330c0 4037677914 S Bi:6:002:1 -115 32768 <
ffff000103533480 4037678841 C Bi:6:002:1 0 479 = a7010484 00000f80 41026000 04300000 00000000 a1f2e400 2c2a0000 54e1e10f
ffff000103533480 4037678865 S Bi:6:002:1 -115 32768 <
ffff000103533c00 4037756172 S Ci:6:002:0 s c0 05 004c 0000 0001 1 <
ffff000103533c00 4037756295 C Ci:6:002:0 0 1 = 20
ffff000103533c00 4037756452 S Co:6:002:0 s 40 05 004c 0000 0001 1 = 20
ffff000103533c00 4037756565 C Co:6:002:0 0 1 >
ffff000103150540 4037756815 S Ci:6:002:0 s c0 05 0770 0000 0004 4 <
ffff000103150540 4037756973 C Ci:6:002:0 0 4 = 00000000
ffff000103150540 4037757134 S Ci:6:002:0 s c0 05 0774 0000 0004 4 <
ffff000103150540 4037757281 C Ci:6:002:0 0 4 = 00000000
ffff000103150540 4037757443 S Co:6:002:0 s 40 05 076e 0000 0001 1 = 0c
ffff000103150540 4037757580 C Co:6:002:0 0 1 >
ffff000103150540 4037757743 S Ci:6:002:0 s c0 05 0808 0000 0004 4 <
ffff000103150540 4037757889 C Ci:6:002:0 0 4 = 3382023e
ffff000103150540 4037758035 S Ci:6:002:0 s c0 05 0a5c 0000 0002 2 <
ffff000103150540 4037758175 C Ci:6:002:0 0 2 = 0000
ffff000103150540 4037758321 S Ci:6:002:0 s c0 05 0f48 0000 0002 2 <
ffff000103150540 4037758448 C Ci:6:002:0 0 2 = 3001
ffff000103150540 4037758594 S Ci:6:002:0 s c0 05 0f04 0000 0004 4 <
ffff000103150540 4037758714 C Ci:6:002:0 0 4 = 00000000
ffff000103150540 4037758750 S Ci:6:002:0 s c0 05 0f14 0000 0004 4 <
ffff000103150540 4037758862 C Ci:6:002:0 0 4 = 65000400
ffff000103150540 4037758892 S Ci:6:002:0 s c0 05 0f10 0000 0004 4 <
ffff000103150540 4037759005 C Ci:6:002:0 0 4 = 00000000
ffff000103150540 4037759034 S Ci:6:002:0 s c0 05 0f0c 0000 0004 4 <
ffff000103150540 4037759159 C Ci:6:002:0 0 4 = 00000000
ffff000103150540 4037759189 S Ci:6:002:0 s c0 05 0f08 0000 0004 4 <
ffff000103150540 4037759307 C Ci:6:002:0 0 4 = 00009901
ffff000103150540 4037759328 S Ci:6:002:0 s c0 05 0fcc 0000 0004 4 <
ffff000103150540 4037759441 C Ci:6:002:0 0 4 = 00000000
ffff000103150540 4037759470 S Ci:6:002:0 s c0 05 09a4 0000 0004 4 <
ffff000103150540 4037759590 C Ci:6:002:0 0 4 = 80000800
ffff000103150540 4037759611 S Co:6:002:0 s 40 05 09a4 0000 0004 4 = 80000a00
ffff000103150540 4037759718 C Co:6:002:0 0 4 >
ffff000103150540 4037759747 S Ci:6:002:0 s c0 05 09a4 0000 0004 4 <
ffff000103150540 4037759866 C Ci:6:002:0 0 4 = 80000a00
ffff000103150540 4037759886 S Co:6:002:0 s 40 05 09a4 0000 0004 4 = 80000800
ffff000103150540 4037759994 C Co:6:002:0 0 4 >
ffff000103150540 4037760024 S Ci:6:002:0 s c0 05 0a2c 0000 0004 4 <
ffff000103150540 4037760143 C Ci:6:002:0 0 4 = 00809000
ffff000103150540 4037760163 S Co:6:002:0 s 40 05 0a2c 0000 0004 4 = 00009000
ffff000103150540 4037760280 C Co:6:002:0 0 4 >
ffff000103150540 4037760310 S Ci:6:002:0 s c0 05 0a2c 0000 0004 4 <
ffff000103150540 4037760422 C Ci:6:002:0 0 4 = 00009000
ffff000103150540 4037760452 S Co:6:002:0 s 40 05 0a2c 0000 0004 4 = 00809000
ffff000103150540 4037760559 C Co:6:002:0 0 4 >
ffff000103150540 4037760589 S Ci:6:002:0 s c0 05 0b58 0000 0004 4 <
ffff000103150540 4037760698 C Ci:6:002:0 0 4 = 00000000
ffff000103150540 4037760728 S Co:6:002:0 s 40 05 0b58 0000 0004 4 = 01000000
ffff000103150540 4037760842 C Co:6:002:0 0 4 >
ffff000103150540 4037760863 S Ci:6:002:0 s c0 05 0b58 0000 0004 4 <
ffff000103150540 4037760973 C Ci:6:002:0 0 4 = 01000000
ffff000103150540 4037761003 S Co:6:002:0 s 40 05 0b58 0000 0004 4 = 00000000
ffff000103150540 4037761116 C Co:6:002:0 0 4 >
ffff000103150540 4037761139 S Ci:6:002:0 s c0 05 0c50 0000 0004 4 <
ffff000103150540 4037761247 C Ci:6:002:0 0 4 = 21000000
ffff000103150540 4037761276 S Co:6:002:0 s 40 05 0c50 0000 0004 4 = 1f000000
ffff000103150540 4037761389 C Co:6:002:0 0 4 >
ffff000103150540 4037761411 S Ci:6:002:0 s c0 05 0e50 0000 0004 4 <
ffff000103150540 4037761535 C Ci:6:002:0 0 4 = 21000000
ffff000103150540 4037761564 S Co:6:002:0 s 40 05 0e50 0000 0004 4 = 1f000000
ffff000103150540 4037761679 C Co:6:002:0 0 4 >
ffff000103150540 4037761700 S Ci:6:002:0 s c0 05 01cc 0000 0001 1 <
ffff000103150540 4037761810 C Ci:6:002:0 0 1 = 00
ffff000103150540 4037761839 S Co:6:002:0 s 40 05 01f8 0000 0004 4 = 00000000
ffff000103150540 4037761946 C Co:6:002:0 0 4 >
ffff000103150540 4037761977 S Co:6:002:0 s 40 05 01d8 0000 0004 4 = 58000000
ffff000103150540 4037762084 C Co:6:002:0 0 4 >
ffff000103150540 4037762114 S Co:6:002:0 s 40 05 0440 0000 0004 4 = 00000000
ffff000103150540 4037762220 C Co:6:002:0 0 4 >
ffff000103150540 4037762252 S Ci:6:002:0 s c0 05 0c00 0000 0004 4 <
ffff000103150540 4037762363 C Ci:6:002:0 0 4 = 07000000
ffff000103150540 4037762393 S Ci:6:002:0 s c0 05 08b0 0000 0004 4 <
ffff000103150540 4037762502 C Ci:6:002:0 0 4 = 42060000
ffff000103150540 4037762532 S Co:6:002:0 s 40 05 08b0 0000 0004 4 = 42060000
ffff000103150540 4037762639 C Co:6:002:0 0 4 >
ffff000103150540 4037762690 S Ci:6:002:0 s c0 05 0d04 0000 0004 4 <
ffff000103150540 4037762796 C Ci:6:002:0 0 4 = 108d90b1
ffff000103150540 4037762826 S Ci:6:002:0 s c0 05 0c1c 0000 0004 4 <
ffff000103150540 4037762937 C Ci:6:002:0 0 4 = 0300402d
ffff000103150540 4037762966 S Co:6:002:0 s 40 05 0c1c 0000 0004 4 = 03000039
ffff000103150540 4037763073 C Co:6:002:0 0 4 >
ffff000103150540 4037763103 S Ci:6:002:0 s c0 05 0e1c 0000 0004 4 <
ffff000103150540 4037763213 C Ci:6:002:0 0 4 = 0300402d
ffff000103150540 4037763243 S Co:6:002:0 s 40 05 0e1c 0000 0004 4 = 0300e032
ffff000103150540 4037763350 C Co:6:002:0 0 4 >
ffff000103150540 4037763380 S Co:6:002:0 s 40 05 0280 0000 0002 2 = 0001
ffff000103150540 4037763487 C Co:6:002:0 0 2 >
ffff000103150540 4037763517 S Ci:6:002:0 s c0 05 010c 0000 0001 1 <
ffff000103150540 4037763627 C Ci:6:002:0 0 1 = b4
ffff000103150540 4037763657 S Co:6:002:0 s 40 05 010c 0000 0001 1 = b4
ffff000103150540 4037763764 C Co:6:002:0 0 1 >
ffff000103533240 4037777474 C Bi:6:002:1 0 478 = a6010484 00000f80 70086000 04300000 00000000 f673e600 2a280000 52dddd0f
ffff000103533240 4037777497 S Bi:6:002:1 -115 32768 <
ffff000103533780 4037778460 C Bi:6:002:1 0 471 = 9f010484 00000f80 10056000 04300000 00000000 ce77e600 2a280000 56e1e10f
ffff000103533780 4037778484 S Bi:6:002:1 -115 32768 <
ffff0001035330c0 4037780344 C Bi:6:002:1 0 469 = 9d010484 00000f80 220b6000 04300000 00000000 267fe600 2c2a0000 53e1e10f
ffff0001035330c0 4037780369 S Bi:6:002:1 -115 32768 <
ffff000103533480 4037781262 C Bi:6:002:1 0 479 = a7010484 00000f80 42026000 04300000 00000000 b482e600 2a2a0000 54e1e10f
ffff000103533480 4037781287 S Bi:6:002:1 -115 32768 <
ffff000103533240 4037879925 C Bi:6:002:1 0 478 = a6010484 00000f80 71086000 04300000 00000000 f803e800 282a0000 54dcdc0f
ffff000103533240 4037879983 S Bi:6:002:1 -115 32768 <
ffff000103533780 4037880872 C Bi:6:002:1 0 471 = 9f010484 00000f80 11056000 04300000 00000000 d907e800 28260000 53dbdb0f
ffff000103533780 4037880901 S Bi:6:002:1 -115 32768 <
ffff0001035330c0 4037881732 C Bi:6:002:1 0 446 = 86010484 00000f80 95066000 04300000 00000000 560be800 28280000 52dddd0f
ffff0001035330c0 4037881756 S Bi:6:002:1 -115 32768 <
ffff000103533480 4037882670 C Bi:6:002:1 0 469 = 9d010484 00000f80 230b6000 04300000 00000000 e40ee800 2a280000 55dcdc0f
ffff000103533480 4037882695 S Bi:6:002:1 -115 32768 <
ffff000103533240 4037883591 C Bi:6:002:1 0 479 = a7010484 00000f80 43026000 04300000 00000000 6e12e800 2a2a0000 54e6e60f
ffff000103533240 4037883615 S Bi:6:002:1 -115 32768 <
ffff000103533780 4037982319 C Bi:6:002:1 0 478 = a6010484 00000f80 72086000 04300000 00000000 f993e900 2c280000 51e1e10f
ffff000103533780 4037982372 S Bi:6:002:1 -115 32768 <
ffff0001035330c0 4037983260 C Bi:6:002:1 0 471 = 9f010484 00000f80 12056000 04300000 00000000 cb97e900 2a280000 50dddd0f
ffff0001035330c0 4037983287 S Bi:6:002:1 -115 32768 <
ffff000103533480 4037984124 C Bi:6:002:1 0 446 = 86010484 00000f80 96066000 04300000 00000000 509be900 2a280000 53dddd0f
ffff000103533480 4037984149 S Bi:6:002:1 -115 32768 <
ffff000103533240 4037985034 C Bi:6:002:1 0 469 = 9d010484 00000f80 240b6000 04300000 00000000 bb9ee900 2c280000 52dbdb0f
ffff000103533240 4037985057 S Bi:6:002:1 -115 32768 <
ffff000103533780 4037985941 C Bi:6:002:1 0 479 = a7010484 00000f80 44026000 04300000 00000000 35a2e900 2a2a0000 54e1e10f
ffff000103533780 4037985966 S Bi:6:002:1 -115 32768 <
ffff0001035330c0 4038084709 C Bi:6:002:1 0 478 = a6010484 00000f80 73086000 04300000 00000000 fb23eb00 2c2a0000 52e1e10f
ffff0001035330c0 4038084737 S Bi:6:002:1 -115 32768 <
ffff000103533480 4038085655 C Bi:6:002:1 0 471 = 9f010484 00000f80 13056000 04300000 00000000 c827eb00 2a280000 4edfdf0f
ffff000103533480 4038085679 S Bi:6:002:1 -115 32768 <
ffff000103533240 4038086534 C Bi:6:002:1 0 446 = 86010484 00000f80 97066000 04300000 00000000 5a2beb00 2a280000 54dddd0f
ffff000103533240 4038086558 S Bi:6:002:1 -115 32768 <
ffff000103533780 4038087438 C Bi:6:002:1 0 469 = 9d010484 00000f80 250b6000 04300000 00000000 c22eeb00 2a280000 54dfdf0f
ffff000103533780 4038087461 S Bi:6:002:1 -115 32768 <
ffff0001035330c0 4038088354 C Bi:6:002:1 0 479 = a7010484 00000f80 45026000 04300000 00000000 4632eb00 2c2c0000 56dcdc0f
ffff0001035330c0 4038088378 S Bi:6:002:1 -115 32768 <
ffff000103533480 4038187082 C Bi:6:002:1 0 478 = a6010484 00000f80 74086000 04300000 00000000 fcb3ec00 2a260000 52e0e00f
ffff000103533480 4038187114 S Bi:6:002:1 -115 32768 <
ffff000103533240 4038188131 C Bi:6:002:1 0 471 = 9f010484 00000f80 14056000 04300000 00000000 25b8ec00 2a2a0000 55dfdf0f
ffff000103533240 4038188168 S Bi:6:002:1 -115 32768 <
ffff000103533780 4038189069 C Bi:6:002:1 0 446 = 86010484 00000f80 98066000 04300000 00000000 d2bbec00 2a260000 50dddd0f
ffff000103533780 4038189094 S Bi:6:002:1 -115 32768 <
ffff0001035330c0 4038189941 C Bi:6:002:1 0 469 = 9d010484 00000f80 260b6000 04300000 00000000 22bfec00 2c280000 54dcdc0f
ffff0001035330c0 4038189965 S Bi:6:002:1 -115 32768 <
ffff000103533480 4038190867 C Bi:6:002:1 0 479 = a7010484 00000f80 46026000 04300000 00000000 bdc2ec00 2a2a0000 54dada0f
ffff000103533480 4038190892 S Bi:6:002:1 -115 32768 <
ffff000103533240 4038289532 C Bi:6:002:1 0 478 = a6010484 00000f80 75086000 04300000 00000000 fe43ee00 2a280000 52dede0f
ffff000103533240 4038289585 S Bi:6:002:1 -115 32768 <
ffff000103533780 4038290514 C Bi:6:002:1 0 471 = 9f010484 00000f80 15056000 04300000 00000000 0648ee00 2a280000 52dddd0f
ffff000103533780 4038290540 S Bi:6:002:1 -115 32768 <
ffff0001035330c0 4038291399 C Bi:6:002:1 0 446 = 86010484 00000f80 99066000 04300000 00000000 9c4bee00 2e2a0000 53dbdb0f
ffff0001035330c0 4038291423 S Bi:6:002:1 -115 32768 <
ffff000103533480 4038292307 C Bi:6:002:1 0 469 = 9d010484 00000f80 270b6000 04300000 00000000 144fee00 2a280000 55e0e00f
ffff000103533480 4038292329 S Bi:6:002:1 -115 32768 <
ffff000103533240 4038293252 C Bi:6:002:1 0 479 = a7010484 00000f80 47026000 04300000 00000000 9f52ee00 2c2a0000 51dfdf0f
ffff000103533240 4038293279 S Bi:6:002:1 -115 32768 <
ffff000103533780 4038391886 C Bi:6:002:1 0 478 = a6010484 00000f80 76086000 04300000 00000000 00d4ef00 2a2a0000 52dcdc0f
ffff000103533780 4038391935 S Bi:6:002:1 -115 32768 <
ffff0001035330c0 4038392880 C Bi:6:002:1 0 471 = 9f010484 00000f80 16056000 04300000 00000000 dbd7ef00 2a280000 55dddd0f
ffff0001035330c0 4038392909 S Bi:6:002:1 -115 32768 <
ffff000103533480 4038393747 C Bi:6:002:1 0 446 = 86010484 00000f80 9a066000 04300000 00000000 69dbef00 2a2a0000 52dfdf0f
ffff000103533480 4038393771 S Bi:6:002:1 -115 32768 <
ffff000103533240 4038394652 C Bi:6:002:1 0 469 = 9d010484 00000f80 280b6000 04300000 00000000 d4deef00 2c280000 55dfdf0f
ffff000103533240 4038394676 S Bi:6:002:1 -115 32768 <
ffff000103533780 4038395553 C Bi:6:002:1 0 479 = a7010484 00000f80 48026000 04300000 00000000 5ce2ef00 2a280000 54e2e20f
ffff000103533780 4038395574 S Bi:6:002:1 -115 32768 <
