ffff0001035330c0 4055029897 C Bi:6:002:1 0 384 = 48010484 00000f80 4a0b6000 04300000 00000000 01b5ed01 463a0000 87f7f701
ffff0001035330c0 4055029984 S Bi:6:002:1 -115 32768 <
ffff000103533480 4055130002 C Bi:6:002:1 0 383 = 47010484 00000f80 750c6000 04300000 00000000 d53bef01 463a0000 86e4e401
ffff000103533480 4055130051 S Bi:6:002:1 -115 32768 <
ffff000103533240 4055130778 C Bi:6:002:1 0 376 = 40010484 00000f80 e3036000 04300000 00000000 1f3fef01 46380000 87efef01
ffff000103533240 4055130805 S Bi:6:002:1 -115 32768 <
ffff000103533780 4055131528 C Bi:6:002:1 0 351 = 27010484 00000f80 a80d6000 04300000 00000000 2b42ef01 443c0000 88f1f101
ffff000103533780 4055131554 S Bi:6:002:1 -115 32768 <
ffff0001035330c0 4055132354 C Bi:6:002:1 0 374 = 3e010484 00000f80 7b086000 04300000 00000000 4c45ef01 443c0000 83f8f801
ffff0001035330c0 4055132379 S Bi:6:002:1 -115 32768 <
ffff000103533480 4055133173 C Bi:6:002:1 0 384 = 48010484 00000f80 4b0b6000 04300000 00000000 6b48ef01 463a0000 84f6f601
ffff000103533480 4055133201 S Bi:6:002:1 -115 32768 <
ffff000103533240 4055231918 C Bi:6:002:1 0 376 = 40010484 00000f80 e4036000 04300000 00000000 1dcaf001 443a0000 88efef01
ffff000103533240 4055231953 S Bi:6:002:1 -115 32768 <
ffff000103533780 4055232790 C Bi:6:002:1 0 351 = 27010484 00000f80 a90d6000 04300000 00000000 bacdf001 46380000 80f5f501
ffff000103533780 4055232816 S Bi:6:002:1 -115 32768 <
ffff0001035330c0 4055233756 C Bi:6:002:1 0 374 = 3e010484 00000f80 7c086000 04300000 00000000 58d1f001 463a0000 85eded01
ffff0001035330c0 4055233781 S Bi:6:002:1 -115 32768 <
ffff000103533480 4055234632 C Bi:6:002:1 0 384 = 48010484 00000f80 4c0b6000 04300000 00000000 b9d4f001 443a0000 86f1f101
ffff000103533480 4055234657 S Bi:6:002:1 -115 32768 <
ffff000103533240 4055334802 C Bi:6:002:1 0 383 = 47010484 00000f80 770c6000 04300000 00000000 f55bf201 44380000 86ebeb01
ffff000103533240 4055334859 S Bi:6:002:1 -115 32768 <
ffff000103533780 4055336426 C Bi:6:002:1 0 351 = 27010484 00000f80 aa0d6000 04300000 00000000 8e62f201 42380000 83efef01
ffff000103533780 4055336452 S Bi:6:002:1 -115 32768 <
ffff0001035330c0 4055337224 C Bi:6:002:1 0 374 = 3e010484 00000f80 7d086000 04300000 00000000 9365f201 423c0000 84f9f901
ffff0001035330c0 4055337248 S Bi:6:002:1 -115 32768 <
ffff000103533480 4055338099 C Bi:6:002:1 0 384 = 48010484 00000f80 4d0b6000 04300000 00000000 ed68f201 443a0000 84020201
ffff000103533480 4055338124 S Bi:6:002:1 -115 32768 <
ffff000103533240 4055435667 C Bi:6:002:1 0 383 = 47010484 00000f80 780c6000 04300000 00000000 fbe5f301 443a0000 87f4f401
ffff000103533240 4055435693 S Bi:6:002:1 -115 32768 <
ffff000103533780 4055436686 C Bi:6:002:1 0 376 = 40010484 00000f80 e6036000 04300000 00000000 1eeaf301 42380000 82e9e901
ffff000103533780 4055436711 S Bi:6:002:1 -115 32768 <
ffff0001035330c0 4055437516 C Bi:6:002:1 0 351 = 27010484 00000f80 ab0d6000 04300000 00000000 55edf301 423e0000 85f8f801
ffff0001035330c0 4055437542 S Bi:6:002:1 -115 32768 <
ffff000103533480 4055439179 C Bi:6:002:1 0 384 = 48010484 00000f80 4e0b6000 04300000 00000000 c3f3f301 463a0000 86f5f501
ffff000103533480 4055439203 S Bi:6:002:1 -115 32768 <
ffff000103533240 4055539578 C Bi:6:002:1 0 383 = 47010484 00000f80 790c6000 04300000 00000000 d87bf501 46380000 86eded01
ffff000103533240 4055539611 S Bi:6:002:1 -115 32768 <
ffff000103533780 4055540381 C Bi:6:002:1 0 376 = 40010484 00000f80 e7036000 04300000 00000000 157ff501 443c0000 86f7f701
ffff000103533780 4055540406 S Bi:6:002:1 -115 32768 <
ffff0001035330c0 4055541128 C Bi:6:002:1 0 351 = 27010484 00000f80 ac0d6000 04300000 00000000 2882f501 46360000 87ecec01
ffff0001035330c0 4055541154 S Bi:6:002:1 -115 32768 <
ffff000103533480 4055641973 C Bi:6:002:1 0 383 = 47010484 00000f80 7a0c6000 04300000 00000000 da0bf701 463c0000 87f1f101
ffff000103533480 4055642032 S Bi:6:002:1 -115 32768 <
ffff000103533240 4055643658 C Bi:6:002:1 0 376 = 40010484 00000f80 e8036000 04300000 00000000 9112f701 463c0000 87ebeb01
ffff000103533240 4055643684 S Bi:6:002:1 -115 32768 <
ffff000103533780 4055646027 C Bi:6:002:1 0 384 = 48010484 00000f80 500b6000 04300000 00000000 a21bf701 463e0000 86efef01
ffff000103533780 4055646056 S Bi:6:002:1 -115 32768 <
ffff0001035330c0 4055744333 C Bi:6:002:1 0 383 = 47010484 00000f80 7b0c6000 04300000 00000000 da9bf801 42380000 80fafa01
ffff0001035330c0 4055744387 S Bi:6:002:1 -115 32768 <
ffff000103533480 4055745173 C Bi:6:002:1 0 376 = 40010484 00000f80 e9036000 04300000 00000000 149ff801 443c0000 83ecec01
ffff000103533480 4055745199 S Bi:6:002:1 -115 32768 <
ffff000103533240 4055745927 C Bi:6:002:1 0 351 = 27010484 00000f80 ae0d6000 04300000 00000000 30a2f801 443e0000 84f0f001
ffff000103533240 4055745952 S Bi:6:002:1 -115 32768 <
ffff000103533780 4055746754 C Bi:6:002:1 0 374 = 3e010484 00000f80 81086000 04300000 00000000 42a5f801 443a0000 86f6f601
ffff000103533780 4055746778 S Bi:6:002:1 -115 32768 <
ffff000102d1d840 4055772195 S Ci:6:002:0 s c0 05 004c 0000 0001 1 <
ffff000102d1d840 4055772302 C Ci:6:002:0 0 1 = 20
ffff000102d1d840 4055772444 S Co:6:002:0 s 40 05 004c 0000 0001 1 = 20
ffff000102d1d840 4055772555 C Co:6:002:0 0 1 >
ffff00011ac9e840 4055772808 S Ci:6:002:0 s c0 05 0770 0000 0004 4 <
ffff00011ac9e840 4055772989 C Ci:6:002:0 0 4 = 00000000
ffff00011ac9e840 4055773148 S Ci:6:002:0 s c0 05 0774 0000 0004 4 <
ffff00011ac9e840 4055773297 C Ci:6:002:0 0 4 = 00000000
ffff00011ac9e840 4055773458 S Co:6:002:0 s 40 05 076e 0000 0001 1 = 0c
ffff00011ac9e840 4055773598 C Co:6:002:0 0 1 >
ffff00011ac9e840 4055773761 S Ci:6:002:0 s c0 05 0808 0000 0004 4 <
ffff00011ac9e840 4055773907 C Ci:6:002:0 0 4 = 3382023e
ffff00011ac9e840 4055774069 S Ci:6:002:0 s c0 05 0a5c 0000 0002 2 <
ffff00011ac9e840 4055774126 C Ci:6:002:0 0 2 = 5600
ffff00011ac9e840 4055774250 S Ci:6:002:0 s c0 05 0f48 0000 0002 2 <
ffff00011ac9e840 4055774294 C Ci:6:002:0 0 2 = 5116
ffff00011ac9e840 4055774417 S Ci:6:002:0 s c0 05 0f04 0000 0004 4 <
ffff00011ac9e840 4055774462 C Ci:6:002:0 0 4 = 00000700
ffff00011ac9e840 4055774623 S Ci:6:002:0 s c0 05 0f14 0000 0004 4 <
ffff00011ac9e840 4055774668 C Ci:6:002:0 0 4 = 46000600
ffff00011ac9e840 4055774793 S Ci:6:002:0 s c0 05 0f10 0000 0004 4 <
ffff00011ac9e840 4055774919 C Ci:6:002:0 0 4 = 00000000
ffff00011ac9e840 4055775063 S Ci:6:002:0 s c0 05 0f0c 0000 0004 4 <
ffff00011ac9e840 4055775207 C Ci:6:002:0 0 4 = 00000000
ffff00011ac9e840 4055775350 S Ci:6:002:0 s c0 05 0f08 0000 0004 4 <
ffff00011ac9e840 4055775482 C Ci:6:002:0 0 4 = 7d009d16
ffff00011ac9e840 4055775631 S Ci:6:002:0 s c0 05 0fcc 0000 0004 4 <
ffff00011ac9e840 4055775757 C Ci:6:002:0 0 4 = 00000000
ffff00011ac9e840 4055775905 S Ci:6:002:0 s c0 05 09a4 0000 0004 4 <
ffff00011ac9e840 4055776030 C Ci:6:002:0 0 4 = 80000800
ffff00011ac9e840 4055776178 S Co:6:002:0 s 40 05 09a4 0000 0004 4 = 80000a00
ffff00011ac9e840 4055776294 C Co:6:002:0 0 4 >
ffff00011ac9e840 4055776322 S Ci:6:002:0 s c0 05 09a4 0000 0004 4 <
ffff00011ac9e840 4055776433 C Ci:6:002:0 0 4 = 80000a00
ffff00011ac9e840 4055776462 S Co:6:002:0 s 40 05 09a4 0000 0004 4 = 80000800
ffff00011ac9e840 4055776497 C Co:6:002:0 0 4 >
ffff00011ac9e840 4055776513 S Ci:6:002:0 s c0 05 0a2c 0000 0004 4 <
ffff00011ac9e840 4055776622 C Ci:6:002:0 0 4 = 00809000
ffff00011ac9e840 4055776653 S Co:6:002:0 s 40 05 0a2c 0000 0004 4 = 00009000
ffff00011ac9e840 4055776767 C Co:6:002:0 0 4 >
ffff00011ac9e840 4055776788 S Ci:6:002:0 s c0 05 0a2c 0000 0004 4 <
ffff00011ac9e840 4055776899 C Ci:6:002:0 0 4 = 00009000
ffff00011ac9e840 4055776928 S Co:6:002:0 s 40 05 0a2c 0000 0004 4 = 00809000
ffff00011ac9e840 4055777037 C Co:6:002:0 0 4 >
ffff00011ac9e840 4055777058 S Ci:6:002:0 s c0 05 0b58 0000 0004 4 <
ffff00011ac9e840 4055777169 C Ci:6:002:0 0 4 = 00000000
ffff00011ac9e840 4055777198 S Co:6:002:0 s 40 05 0b58 0000 0004 4 = 01000000
ffff00011ac9e840 4055777313 C Co:6:002:0 0 4 >
ffff00011ac9e840 4055777333 S Ci:6:002:0 s c0 05 0b58 0000 0004 4 <
ffff00011ac9e840 4055777445 C Ci:6:002:0 0 4 = 01000000
ffff00011ac9e840 4055777474 S Co:6:002:0 s 40 05 0b58 0000 0004 4 = 00000000
ffff00011ac9e840 4055777591 C Co:6:002:0 0 4 >
ffff00011ac9e840 4055777613 S Ci:6:002:0 s c0 05 0c50 0000 0004 4 <
ffff00011ac9e840 4055777723 C Ci:6:002:0 0 4 = 1c000000
ffff00011ac9e840 4055777753 S Co:6:002:0 s 40 05 0c50 0000 0004 4 = 1e000000
ffff00011ac9e840 4055777860 C Co:6:002:0 0 4 >
ffff00011ac9e840 4055777890 S Ci:6:002:0 s c0 05 0e50 0000 0004 4 <
ffff00011ac9e840 4055778001 C Ci:6:002:0 0 4 = 1c000000
ffff00011ac9e840 4055778032 S Co:6:002:0 s 40 05 0e50 0000 0004 4 = 1e000000
ffff00011ac9e840 4055778146 C Co:6:002:0 0 4 >
ffff00011ac9e840 4055778167 S Ci:6:002:0 s c0 05 01cc 0000 0001 1 <
ffff00011ac9e840 4055778279 C Ci:6:002:0 0 1 = 00
ffff00011ac9e840 4055778308 S Co:6:002:0 s 40 05 01fc 0000 0004 4 = 00000000
ffff00011ac9e840 4055778343 C Co:6:002:0 0 4 >
ffff00011ac9e840 4055778359 S Co:6:002:0 s 40 05 01dc 0000 0004 4 = 58000000
ffff00011ac9e840 4055778469 C Co:6:002:0 0 4 >
ffff00011ac9e840 4055778500 S Co:6:002:0 s 40 05 0440 0000 0004 4 = 00000000
ffff00011ac9e840 4055778614 C Co:6:002:0 0 4 >
ffff00011ac9e840 4055778636 S Ci:6:002:0 s c0 05 0c00 0000 0004 4 <
ffff00011ac9e840 4055778747 C Ci:6:002:0 0 4 = 07000000
ffff00011ac9e840 4055778777 S Ci:6:002:0 s c0 05 08b0 0000 0004 4 <
ffff00011ac9e840 4055778888 C Ci:6:002:0 0 4 = 18060000
ffff00011ac9e840 4055778909 S Co:6:002:0 s 40 05 08b0 0000 0004 4 = 42060000
ffff00011ac9e840 4055779017 C Co:6:002:0 0 4 >
ffff00011ac9e840 4055779066 S Ci:6:002:0 s c0 05 0d04 0000 0004 4 <
ffff00011ac9e840 4055779171 C Ci:6:002:0 0 4 = 108d90b1
ffff00011ac9e840 4055779191 S Co:6:002:0 s 40 05 0c90 0000 0004 4 = 108d2304
ffff00011ac9e840 4055779300 C Co:6:002:0 0 4 >
ffff00011ac9e840 4055779344 S Co:6:002:0 s 40 05 0280 0000 0002 2 = 0001
ffff00011ac9e840 4055779443 C Co:6:002:0 0 2 >
ffff00011ac9e840 4055779464 S Ci:6:002:0 s c0 05 010c 0000 0001 1 <
ffff00011ac9e840 4055779591 C Ci:6:002:0 0 1 = b4
ffff00011ac9e840 4055779620 S Co:6:002:0 s 40 05 010c 0000 0001 1 = b4
ffff00011ac9e840 4055779655 C Co:6:002:0 0 1 >
ffff0001035330c0 4055846727 C Bi:6:002:1 0 383 = 47010484 00000f80 7c0c6000 04300000 00000000 dc2bfa01 46380000 85e8e801
ffff0001035330c0 4055846778 S Bi:6:002:1 -115 32768 <
ffff000103533480 4055847628 C Bi:6:002:1 0 376 = 40010484 00000f80 ea036000 04300000 00000000 442ffa01 463a0000 87f4f401
ffff000103533480 4055847655 S Bi:6:002:1 -115 32768 <
ffff000103533240 4055848379 C Bi:6:002:1 0 351 = 27010484 00000f80 af0d6000 04300000 00000000 5a32fa01 423c0000 7ff9f901
ffff000103533240 4055848406 S Bi:6:002:1 -115 32768 <
ffff000103533780 4055849152 C Bi:6:002:1 0 374 = 3e010484 00000f80 82086000 04300000 00000000 4935fa01 44360000 80f1f101
ffff000103533780 4055849178 S Bi:6:002:1 -115 32768 <
ffff0001035330c0 4055850001 C Bi:6:002:1 0 384 = 48010484 00000f80 520b6000 04300000 00000000 7f38fa01 44360000 86f0f001
ffff0001035330c0 4055850024 S Bi:6:002:1 -115 32768 <
ffff000103533480 4055949152 C Bi:6:002:1 0 383 = 47010484 00000f80 7d0c6000 04300000 00000000 dcbbfb01 44360000 84e5e501
ffff000103533480 4055949183 S Bi:6:002:1 -115 32768 <
ffff000103533240 4055949969 C Bi:6:002:1 0 376 = 40010484 00000f80 eb036000 04300000 00000000 20bffb01 443a0000 87f5f501
ffff000103533240 4055949993 S Bi:6:002:1 -115 32768 <
ffff000103533780 4055950725 C Bi:6:002:1 0 351 = 27010484 00000f80 b00d6000 04300000 00000000 4fc2fb01 463a0000 87f1f101
ffff000103533780 4055950744 S Bi:6:002:1 -115 32768 <
ffff0001035330c0 4055951490 C Bi:6:002:1 0 374 = 3e010484 00000f80 83086000 04300000 00000000 33c5fb01 44380000 87f6f601
ffff0001035330c0 4055951506 S Bi:6:002:1 -115 32768 <
ffff000103533480 4055952323 C Bi:6:002:1 0 384 = 48010484 00000f80 530b6000 04300000 00000000 5ec8fb01 463a0000 86f7f701
ffff000103533480 4055952344 S Bi:6:002:1 -115 32768 <
ffff000103151600 4055972683 S Ci:6:002:0 s c0 05 0454 0000 0001 1 <
ffff000103151600 4055972820 C Ci:6:002:0 0 1 = 00
ffff000103151600 4055972866 S Ci:6:002:0 s c0 05 0860 0000 0004 4 <
ffff000103151600 4055972964 C Ci:6:002:0 0 4 = 21c3d572
ffff000103151600 4055972999 S Co:6:002:0 s 40 05 0860 0000 0004 4 = 21c3d572
ffff000103151600 4055973087 C Co:6:002:0 0 4 >
ffff000103151600 4055973122 S Ci:6:002:0 s c0 05 0c00 0000 0004 4 <
ffff000103151600 4055973216 C Ci:6:002:0 0 4 = 07000000
ffff000103151600 4055973264 S Ci:6:002:0 s c0 05 08b0 0000 0004 4 <
ffff000103151600 4055973359 C Ci:6:002:0 0 4 = 42060000
ffff000103151600 4055973394 S Co:6:002:0 s 40 05 08b0 0000 0004 4 = 18060000
ffff000103151600 4055973496 C Co:6:002:0 0 4 >
ffff000103151600 4055973551 S Ci:6:002:0 s c0 05 0d04 0000 0004 4 <
ffff000103151600 4055973658 C Ci:6:002:0 0 4 = 017c90b1
ffff000103151600 4055973691 S Co:6:002:0 s 40 05 0c90 0000 0004 4 = 017c8001
ffff000103151600 4055973778 C Co:6:002:0 0 4 >
ffff000103151600 4055973849 S Ci:6:002:0 s c0 05 08ac 0000 0004 4 <
ffff000103151600 4055973958 C Ci:6:002:0 0 4 = 08faf00f
ffff000103151600 4055973993 S Co:6:002:0 s 40 05 08ac 0000 0004 4 = 08faf00f
ffff000103151600 4055974081 C Co:6:002:0 0 4 >
ffff000103151600 4055974114 S Ci:6:002:0 s c0 05 08ac 0000 0004 4 <
ffff000103151600 4055974207 C Ci:6:002:0 0 4 = 08faf00f
ffff000103151600 4055974241 S Co:6:002:0 s 40 05 08ac 0000 0004 4 = 08faf00f
ffff000103151600 4055974329 C Co:6:002:0 0 4 >
ffff000103151600 4055974363 S Ci:6:002:0 s c0 05 08c4 0000 0004 4 <
ffff000103151600 4055974458 C Ci:6:002:0 0 4 = 00000000
ffff000103151600 4055974491 S Co:6:002:0 s 40 05 08c4 0000 0004 4 = 00000000
ffff000103151600 4055974579 C Co:6:002:0 0 4 >
ffff000103151600 4055974613 S Ci:6:002:0 s c0 05 0c00 0000 0004 4 <
ffff000103151600 4055974708 C Ci:6:002:0 0 4 = 07000000
ffff000103151600 4055974742 S Ci:6:002:0 s c0 05 08b0 0000 0004 4 <
ffff000103151600 4055974836 C Ci:6:002:0 0 4 = 18060000
ffff000103151600 4055974870 S Co:6:002:0 s 40 05 08b0 0000 0004 4 = 18060000
ffff000103151600 4055974959 C Co:6:002:0 0 4 >
ffff000103151600 4055975013 S Ci:6:002:0 s c0 05 0d04 0000 0004 4 <
ffff000103151600 4055975119 C Ci:6:002:0 0 4 = 017c90b1
ffff000103151600 4055975153 S Co:6:002:0 s 40 05 0c90 0000 0004 4 = 017c8001
ffff000103151600 4055975182 C Co:6:002:0 0 4 >
ffff000103151600 4055975221 S Ci:6:002:0 s c0 05 0e00 0000 0004 4 <
ffff000103151600 4055975273 C Ci:6:002:0 0 4 = 07000000
ffff000103151600 4055975299 S Ci:6:002:0 s c0 05 08b0 0000 0004 4 <
ffff000103151600 4055975330 C Ci:6:002:0 0 4 = 18060000
ffff000103151600 4055975355 S Co:6:002:0 s 40 05 08b0 0000 0004 4 = 18060000
ffff000103151600 4055975394 C Co:6:002:0 0 4 >
ffff000103151600 4055975442 S Ci:6:002:0 s c0 05 0d44 0000 0004 4 <
ffff000103151600 4055975484 C Ci:6:002:0 0 4 = 017c90b1
ffff000103151600 4055975511 S Co:6:002:0 s 40 05 0e90 0000 0004 4 = 017c8001
ffff000103151600 4055975549 C Co:6:002:0 0 4 >
ffff000103151600 4055975590 S Ci:6:002:0 s c0 05 08ac 0000 0004 4 <
ffff000103151600 4055975647 C Ci:6:002:0 0 4 = 08faf00f
ffff000103151600 4055975672 S Co:6:002:0 s 40 05 08ac 0000 0004 4 = 08faf00f
ffff000103151600 4055975700 C Co:6:002:0 0 4 >
ffff000103151600 4055975724 S Ci:6:002:0 s c0 05 08ac 0000 0004 4 <
ffff000103151600 4055975771 C Ci:6:002:0 0 4 = 08faf00f
ffff000103151600 4055975797 S Co:6:002:0 s 40 05 08ac 0000 0004 4 = 08faf00f
ffff000103151600 4055975836 C Co:6:002:0 0 4 >
ffff000103151600 4055975862 S Ci:6:002:0 s c0 05 08c4 0000 0004 4 <
ffff000103151600 4055975905 C Ci:6:002:0 0 4 = 00000000
ffff000103151600 4055975931 S Co:6:002:0 s 40 05 08c4 0000 0004 4 = 00000000
ffff000103151600 4055975969 C Co:6:002:0 0 4 >
ffff000103151600 4055975995 S Ci:6:002:0 s c0 05 0e00 0000 0004 4 <
ffff000103151600 4055976084 C Ci:6:002:0 0 4 = 07000000
ffff000103151600 4055976111 S Ci:6:002:0 s c0 05 08b0 0000 0004 4 <
ffff000103151600 4055976206 C Ci:6:002:0 0 4 = 18060000
ffff000103151600 4055976245 S Co:6:002:0 s 40 05 08b0 0000 0004 4 = 18060000
ffff000103151600 4055976356 C Co:6:002:0 0 4 >
ffff000103151600 4055976416 S Ci:6:002:0 s c0 05 0d44 0000 0004 4 <
ffff000103151600 4055976511 C Ci:6:002:0 0 4 = 017c90b1
ffff000103151600 4055976550 S Co:6:002:0 s 40 05 0e90 0000 0004 4 = 017c8001
ffff000103151600 4055976655 C Co:6:002:0 0 4 >
ffff000103151600 4055976706 S Ci:6:002:0 s c0 05 0668 0000 0002 2 <
ffff000103151600 4055976832 C Ci:6:002:0 0 2 = 0010
ffff000103151600 4055976877 S Co:6:002:0 s 40 05 0668 0000 0002 2 = 0010
ffff000103151600 4055976982 C Co:6:002:0 0 2 >
ffff000103151600 4055977030 S Co:6:002:0 s 40 05 0483 0000 0001 1 = 00
ffff000103151600 4055977159 C Co:6:002:0 0 1 >
ffff000103151600 4055977204 S Ci:6:002:0 s c0 05 0837 0000 0001 1 <
ffff000103151600 4055977312 C Ci:6:002:0 0 1 = 00
ffff000103151600 4055977356 S Ci:6:002:0 s c0 05 08ac 0000 0004 4 <
ffff000103151600 4055977470 C Ci:6:002:0 0 4 = 08faf00f
ffff000103151600 4055977516 S Co:6:002:0 s 40 05 08ac 0000 0004 4 = 08faf00f
ffff000103151600 4055977630 C Co:6:002:0 0 4 >
ffff000103151600 4055977675 S Ci:6:002:0 s c0 05 08c4 0000 0004 4 <
ffff000103151600 4055977784 C Ci:6:002:0 0 4 = 00000000
ffff000103151600 4055977828 S Co:6:002:0 s 40 05 08c4 0000 0004 4 = 00000000
ffff000103151600 4055977934 C Co:6:002:0 0 4 >
ffff000103151600 4055977980 S Ci:6:002:0 s c0 05 0848 0000 0004 4 <
ffff000103151600 4055978098 C Ci:6:002:0 0 4 = 8bffd061
ffff000103151600 4055978145 S Co:6:002:0 s 40 05 0848 0000 0004 4 = 8bffd061
ffff000103151600 4055978250 C Co:6:002:0 0 4 >
ffff000103151600 4055978297 S Ci:6:002:0 s c0 05 08ac 0000 0004 4 <
ffff000103151600 4055978415 C Ci:6:002:0 0 4 = 08faf00f
ffff000103151600 4055978461 S Co:6:002:0 s 40 05 08ac 0000 0004 4 = 08faf00f
ffff000103151600 4055978565 C Co:6:002:0 0 4 >
ffff000103151600 4055978611 S Ci:6:002:0 s c0 05 08ac 0000 0004 4 <
ffff000103151600 4055978730 C Ci:6:002:0 0 4 = 08faf00f
ffff000103151600 4055978775 S Co:6:002:0 s 40 05 08ac 0000 0004 4 = 08faf00f
ffff000103151600 4055978880 C Co:6:002:0 0 4 >
ffff000103151600 4055978926 S Ci:6:002:0 s c0 05 08c4 0000 0004 4 <
ffff000103151600 4055979045 C Ci:6:002:0 0 4 = 00000000
ffff000103151600 4055979091 S Co:6:002:0 s 40 05 08c4 0000 0004 4 = 00000000
ffff000103151600 4055979141 C Co:6:002:0 0 4 >
ffff000103151600 4055979177 S Ci:6:002:0 s c0 05 0c00 0000 0004 4 <
ffff000103151600 4055979225 C Ci:6:002:0 0 4 = 07000000
ffff000103151600 4055979260 S Ci:6:002:0 s c0 05 08b0 0000 0004 4 <
ffff000103151600 4055979296 C Ci:6:002:0 0 4 = 18060000
ffff000103151600 4055979331 S Co:6:002:0 s 40 05 08b0 0000 0004 4 = 18060000
ffff000103151600 4055979362 C Co:6:002:0 0 4 >
ffff000103151600 4055979417 S Ci:6:002:0 s c0 05 0d04 0000 0004 4 <
ffff000103151600 4055979464 C Ci:6:002:0 0 4 = 017c90b1
ffff000103151600 4055979498 S Co:6:002:0 s 40 05 0c90 0000 0004 4 = 017c8001
ffff000103151600 4055979530 C Co:6:002:0 0 4 >
ffff000103151600 4055979577 S Ci:6:002:0 s c0 05 0e00 0000 0004 4 <
ffff000103151600 4055979642 C Ci:6:002:0 0 4 = 07000000
ffff000103151600 4055979677 S Ci:6:002:0 s c0 05 08b0 0000 0004 4 <
ffff000103151600 4055979713 C Ci:6:002:0 0 4 = 18060000
ffff000103151600 4055979747 S Co:6:002:0 s 40 05 08b0 0000 0004 4 = 18060000
ffff000103151600 4055979778 C Co:6:002:0 0 4 >
ffff000103151600 4055979831 S Ci:6:002:0 s c0 05 0d44 0000 0004 4 <
ffff000103151600 4055979896 C Ci:6:002:0 0 4 = 017c90b1
ffff000103151600 4055979930 S Co:6:002:0 s 40 05 0e90 0000 0004 4 = 017c8001
ffff000103151600 4055979962 C Co:6:002:0 0 4 >
ffff000103151600 4055980035 S Ci:6:002:0 s c0 05 0c20 0000 0004 4 <
ffff000103151600 4055980190 C Ci:6:002:0 0 4 = 13131313
ffff000103151600 4055980239 S Co:6:002:0 s 40 05 0c20 0000 0004 4 = 13131313
ffff000103151600 4055980352 C Co:6:002:0 0 4 >
ffff000103151600 4055980400 S Ci:6:002:0 s c0 05 0c24 0000 0004 4 <
ffff000103151600 4055980519 C Ci:6:002:0 0 4 = 20202020
ffff000103151600 4055980565 S Co:6:002:0 s 40 05 0c24 0000 0004 4 = 20202020
ffff000103151600 4055980671 C Co:6:002:0 0 4 >
ffff000103151600 4055980718 S Ci:6:002:0 s c0 05 0c28 0000 0004 4 <
ffff000103151600 4055980847 C Ci:6:002:0 0 4 = 20201e1c
ffff000103151600 4055980892 S Co:6:002:0 s 40 05 0c28 0000 0004 4 = 20201e1c
ffff000103151600 4055980997 C Co:6:002:0 0 4 >
ffff000103151600 4055981043 S Ci:6:002:0 s c0 05 0c2c 0000 0004 4 <
ffff000103151600 4055981162 C Ci:6:002:0 0 4 = 20202020
ffff000103151600 4055981209 S Co:6:002:0 s 40 05 0c2c 0000 0004 4 = 20202020
ffff000103151600 4055981314 C Co:6:002:0 0 4 >
ffff000103151600 4055981360 S Ci:6:002:0 s c0 05 0c30 0000 0004 4 <
ffff000103151600 4055981480 C Ci:6:002:0 0 4 = 20201e1c
ffff000103151600 4055981526 S Co:6:002:0 s 40 05 0c30 0000 0004 4 = 20201e1c
ffff000103151600 4055981631 C Co:6:002:0 0 4 >
ffff000103151600 4055981678 S Ci:6:002:0 s c0 05 0c34 0000 0004 4 <
ffff000103151600 4055981798 C Ci:6:002:0 0 4 = 20202020
ffff000103151600 4055981844 S Co:6:002:0 s 40 05 0c34 0000 0004 4 = 20202020
ffff000103151600 4055981964 C Co:6:002:0 0 4 >
ffff000103151600 4055982010 S Ci:6:002:0 s c0 05 0c38 0000 0004 4 <
ffff000103151600 4055982130 C Ci:6:002:0 0 4 = 201e1c1a
ffff000103151600 4055982175 S Co:6:002:0 s 40 05 0c38 0000 0004 4 = 201e1c1a
ffff000103151600 4055982281 C Co:6:002:0 0 4 >
ffff000103151600 4055982327 S Ci:6:002:0 s c0 05 0c3c 0000 0004 4 <
ffff000103151600 4055982464 C Ci:6:002:0 0 4 = 20202020
ffff000103151600 4055982510 S Co:6:002:0 s 40 05 0c3c 0000 0004 4 = 20202020
ffff000103151600 4055982615 C Co:6:002:0 0 4 >
ffff000103151600 4055982661 S Ci:6:002:0 s c0 05 0c40 0000 0004 4 <
ffff000103151600 4055982782 C Ci:6:002:0 0 4 = 20201e1c
ffff000103151600 4055982827 S Co:6:002:0 s 40 05 0c40 0000 0004 4 = 20201e1c
ffff000103151600 4055982932 C Co:6:002:0 0 4 >
ffff000103151600 4055982979 S Ci:6:002:0 s c0 05 0c44 0000 0004 4 <
ffff000103151600 4055983099 C Ci:6:002:0 0 4 = 1a181e1e
ffff000103151600 4055983144 S Co:6:002:0 s 40 05 0c44 0000 0004 4 = 1a181e1e
ffff000103151600 4055983176 C Co:6:002:0 0 4 >
ffff000103151600 4055983213 S Ci:6:002:0 s c0 05 0c48 0000 0004 4 <
ffff000103151600 4055983276 C Ci:6:002:0 0 4 = 1e1e1e1e
ffff000103151600 4055983310 S Co:6:002:0 s 40 05 0c48 0000 0004 4 = 1e1e1e1e
ffff000103151600 4055983342 C Co:6:002:0 0 4 >
ffff000103151600 4055983375 S Ci:6:002:0 s c0 05 0c4c 0000 0004 4 <
ffff000103151600 4055983412 C Ci:6:002:0 0 4 = 1c1a1816
ffff000103151600 4055983447 S Co:6:002:0 s 40 05 0c4c 0000 0004 4 = 1c1a1816
ffff000103151600 4055983479 C Co:6:002:0 0 4 >
ffff000103151600 4055983514 S Ci:6:002:0 s c0 05 0c54 0000 0004 4 <
ffff000103151600 4055983552 C Ci:6:002:0 0 4 = 120a0400
ffff000103151600 4055983587 S Co:6:002:0 s 40 05 0c54 0000 0004 4 = 120a0400
ffff000103151600 4055983619 C Co:6:002:0 0 4 >
ffff000103151600 4055983655 S Ci:6:002:0 s c0 05 0e20 0000 0004 4 <
ffff000103151600 4055983692 C Ci:6:002:0 0 4 = 14141414
ffff000103151600 4055983727 S Co:6:002:0 s 40 05 0e20 0000 0004 4 = 14141414
ffff000103151600 4055983772 C Co:6:002:0 0 4 >
ffff000103151600 4055983807 S Ci:6:002:0 s c0 05 0e24 0000 0004 4 <
ffff000103151600 4055983845 C Ci:6:002:0 0 4 = 1d1d1d1d
ffff000103151600 4055983881 S Co:6:002:0 s 40 05 0e24 0000 0004 4 = 1d1d1d1d
ffff000103151600 4055983912 C Co:6:002:0 0 4 >
ffff000103151600 4055983947 S Ci:6:002:0 s c0 05 0e28 0000 0004 4 <
ffff000103151600 4055983985 C Ci:6:002:0 0 4 = 1d1d1b19
ffff0001031510c0 4055984032 S Co:6:002:0 s 40 05 0e28 0000 0004 4 = 1d1d1b19
ffff0001031510c0 4055984063 C Co:6:002:0 0 4 >
ffff0001031510c0 4055984101 S Ci:6:002:0 s c0 05 0e2c 0000 0004 4 <
ffff0001031510c0 4055984230 C Ci:6:002:0 0 4 = 1f1f1f1f
ffff0001031510c0 4055984278 S Co:6:002:0 s 40 05 0e2c 0000 0004 4 = 1f1f1f1f
ffff0001031510c0 4055984383 C Co:6:002:0 0 4 >
ffff0001031510c0 4055984429 S Ci:6:002:0 s c0 05 0e30 0000 0004 4 <
ffff0001031510c0 4055984550 C Ci:6:002:0 0 4 = 1f1f1d1b
ffff0001031510c0 4055984595 S Co:6:002:0 s 40 05 0e30 0000 0004 4 = 1f1f1d1b
ffff0001031510c0 4055984713 C Co:6:002:0 0 4 >
ffff0001031510c0 4055984760 S Ci:6:002:0 s c0 05 0e34 0000 0004 4 <
ffff0001031510c0 4055984880 C Ci:6:002:0 0 4 = 1f1f1f1f
ffff0001031510c0 4055984926 S Co:6:002:0 s 40 05 0e34 0000 0004 4 = 1f1f1f1f
ffff0001031510c0 4055985031 C Co:6:002:0 0 4 >
ffff0001031510c0 4055985078 S Ci:6:002:0 s c0 05 0e38 0000 0004 4 <
ffff0001031510c0 4055985215 C Ci:6:002:0 0 4 = 1f1d1b19
ffff0001031510c0 4055985260 S Co:6:002:0 s 40 05 0e38 0000 0004 4 = 1f1d1b19
ffff0001031510c0 4055985365 C Co:6:002:0 0 4 >
ffff0001031510c0 4055985412 S Ci:6:002:0 s c0 05 0e3c 0000 0004 4 <
ffff0001031510c0 4055985532 C Ci:6:002:0 0 4 = 1f1f1f1f
ffff0001031510c0 4055985578 S Co:6:002:0 s 40 05 0e3c 0000 0004 4 = 1f1f1f1f
ffff0001031510c0 4055985683 C Co:6:002:0 0 4 >
ffff0001031510c0 4055985730 S Ci:6:002:0 s c0 05 0e40 0000 0004 4 <
ffff0001031510c0 4055985862 C Ci:6:002:0 0 4 = 1f1f1d1b
ffff0001031510c0 4055985908 S Co:6:002:0 s 40 05 0e40 0000 0004 4 = 1f1f1d1b
ffff0001031510c0 4055986014 C Co:6:002:0 0 4 >
ffff0001031510c0 4055986061 S Ci:6:002:0 s c0 05 0e44 0000 0004 4 <
ffff0001031510c0 4055986181 C Ci:6:002:0 0 4 = 19171d1d
ffff0001031510c0 4055986227 S Co:6:002:0 s 40 05 0e44 0000 0004 4 = 19171d1d
ffff0001031510c0 4055986342 C Co:6:002:0 0 4 >
ffff0001031510c0 4055986389 S Ci:6:002:0 s c0 05 0e48 0000 0004 4 <
ffff0001031510c0 4055986509 C Ci:6:002:0 0 4 = 1d1d1d1d
ffff0001031510c0 4055986555 S Co:6:002:0 s 40 05 0e48 0000 0004 4 = 1d1d1d1d
ffff0001031510c0 4055986660 C Co:6:002:0 0 4 >
ffff0001031510c0 4055986706 S Ci:6:002:0 s c0 05 0e4c 0000 0004 4 <
ffff0001031510c0 4055986845 C Ci:6:002:0 0 4 = 1b191715
ffff0001031510c0 4055986891 S Co:6:002:0 s 40 05 0e4c 0000 0004 4 = 1b191715
ffff0001031510c0 4055986996 C Co:6:002:0 0 4 >
ffff0001031510c0 4055987043 S Ci:6:002:0 s c0 05 0e54 0000 0004 4 <
ffff0001031510c0 4055987094 C Ci:6:002:0 0 4 = 11090300
ffff0001031510c0 4055987130 S Co:6:002:0 s 40 05 0e54 0000 0004 4 = 11090300
ffff0001031510c0 4055987162 C Co:6:002:0 0 4 >
ffff0001031510c0 4055987209 S Ci:6:002:0 s c0 05 0454 0000 0001 1 <
ffff0001031510c0 4055987276 C Ci:6:002:0 0 1 = 00
ffff0001031510c0 4055987311 S Ci:6:002:0 s c0 05 0454 0000 0001 1 <
ffff0001031510c0 4055987348 C Ci:6:002:0 0 1 = 00
ffff0001031510c0 4055987382 S Co:6:002:0 s 40 05 0454 0000 0001 1 = 80
ffff0001031510c0 4055987413 C Co:6:002:0 0 1 >
ffff0001031510c0 4055987448 S Ci:6:002:0 s c0 05 041a 0000 0002 2 <
ffff0001031510c0 4055987486 C Ci:6:002:0 0 2 = ff0f
ffff0001031510c0 4055987520 S Ci:6:002:0 s c0 05 0808 0000 0004 4 <
ffff0001031510c0 4055987558 C Ci:6:002:0 0 4 = 3382023e
ffff0001031510c0 4055987593 S Co:6:002:0 s 40 05 0808 0000 0004 4 = 3382023e
ffff0001031510c0 4055987640 C Co:6:002:0 0 4 >
ffff0001031510c0 4055987674 S Ci:6:002:0 s c0 05 0834 0000 0004 4 <
ffff0001031510c0 4055987712 C Ci:6:002:0 0 4 = 05a73700
ffff0001031510c0 4055987746 S Co:6:002:0 s 40 05 0834 0000 0004 4 = 06a73700
ffff0001031510c0 4055987777 C Co:6:002:0 0 4 >
ffff0001031510c0 4055987812 S Ci:6:002:0 s c0 05 0830 0000 0004 4 <
ffff0001031510c0 4055987851 C Ci:6:002:0 0 4 = b8eeaa2e
ffff0001031510c0 4055987886 S Co:6:002:0 s 40 05 0830 0000 0004 4 = b8aeaa2e
ffff0001031510c0 4055987920 C Co:6:002:0 0 4 >
ffff0001031510c0 4055987955 S Ci:6:002:0 s c0 05 0830 0000 0004 4 <
ffff0001031510c0 4055987994 C Ci:6:002:0 0 4 = b8aeaa2e
ffff0001031510c0 4055988053 S Co:6:002:0 s 40 05 0830 0000 0004 4 = b8aeaa2e
ffff0001031510c0 4055988099 C Co:6:002:0 0 4 >
ffff0001031510c0 4055988136 S Ci:6:002:0 s c0 05 082c 0000 0004 4 <
ffff0001031510c0 4055988250 C Ci:6:002:0 0 4 = dc832000
ffff0001031510c0 4055988295 S Co:6:002:0 s 40 05 082c 0000 0004 4 = dd832000
ffff0001031510c0 4055988400 C Co:6:002:0 0 4 >
ffff0001031510c0 4055988448 S Co:6:002:0 s 40 05 0cb0 0000 0004 4 = 17773354
ffff0001031510c0 4055988562 C Co:6:002:0 0 4 >
ffff0001031510c0 4055988608 S Co:6:002:0 s 40 05 0eb0 0000 0004 4 = 17773354
ffff0001031510c0 4055988717 C Co:6:002:0 0 4 >
ffff0001031510c0 4055988763 S Ci:6:002:0 s c0 05 0cb4 0000 0004 4 <
ffff0001031510c0 4055988884 C Ci:6:002:0 0 4 = 77000001
ffff0001031510c0 4055988929 S Co:6:002:0 s 40 05 0cb4 0000 0004 4 = 77000001
ffff0001031510c0 4055989035 C Co:6:002:0 0 4 >
ffff0001031510c0 4055989082 S Ci:6:002:0 s c0 05 0eb4 0000 0004 4 <
ffff0001031510c0 4055989220 C Ci:6:002:0 0 4 = 77000001
ffff0001031510c0 4055989265 S Co:6:002:0 s 40 05 0eb4 0000 0004 4 = 77000001
ffff0001031510c0 4055989371 C Co:6:002:0 0 4 >
ffff0001031510c0 4055989418 S Ci:6:002:0 s c0 05 0900 0000 0004 4 <
ffff0001031510c0 4055989539 C Ci:6:002:0 0 4 = 01040000
ffff0001031510c0 4055989584 S Co:6:002:0 s 40 05 0900 0000 0004 4 = 01040000
ffff0001031510c0 4055989689 C Co:6:002:0 0 4 >
ffff0001031510c0 4055989735 S Ci:6:002:0 s c0 05 080c 0000 0004 4 <
ffff0001031510c0 4055989857 C Ci:6:002:0 0 4 = 13111312
ffff0001031510c0 4055989903 S Co:6:002:0 s 40 05 080c 0000 0004 4 = 03111312
ffff0001031510c0 4055990008 C Co:6:002:0 0 4 >
ffff0001031510c0 4055990055 S Ci:6:002:0 s c0 05 0a04 0000 0004 4 <
ffff0001031510c0 4055990177 C Ci:6:002:0 0 4 = 0c00ff01
ffff0001031510c0 4055990222 S Co:6:002:0 s 40 05 0a04 0000 0004 4 = 0c00ff0f
ffff0001031510c0 4055990340 C Co:6:002:0 0 4 >
ffff0001031510c0 4055990386 S Ci:6:002:0 s c0 05 0440 0000 0004 4 <
ffff0001031510c0 4055990507 C Ci:6:002:0 0 4 = 00000000
ffff0001031510c0 4055990552 S Co:6:002:0 s 40 05 0440 0000 0004 4 = 50010000
ffff0001031510c0 4055990658 C Co:6:002:0 0 4 >
ffff0001031510c0 4055990704 S Ci:6:002:0 s c0 05 0c1c 0000 0004 4 <
ffff0001031510c0 4055990841 C Ci:6:002:0 0 4 = 03000040
ffff0001031510c0 4055990886 S Co:6:002:0 s 40 05 0c1c 0000 0004 4 = 0300402d
ffff0001031510c0 4055990991 C Co:6:002:0 0 4 >
ffff0001031510c0 4055991037 S Ci:6:002:0 s c0 05 0e1c 0000 0004 4 <
ffff0001031510c0 4055991089 C Ci:6:002:0 0 4 = 03000040
ffff0001031510c0 4055991124 S Co:6:002:0 s 40 05 0e1c 0000 0004 4 = 0300402d
ffff0001031510c0 4055991157 C Co:6:002:0 0 4 >
ffff0001031510c0 4055991192 S Ci:6:002:0 s c0 05 0860 0000 0004 4 <
ffff0001031510c0 4055991227 C Ci:6:002:0 0 4 = 21c3d572
ffff0001031510c0 4055991262 S Co:6:002:0 s 40 05 0860 0000 0004 4 = 21c32568
ffff0001031510c0 4055991294 C Co:6:002:0 0 4 >
ffff0001031510c0 4055991329 S Ci:6:002:0 s c0 05 0c00 0000 0004 4 <
ffff0001031510c0 4055991364 C Ci:6:002:0 0 4 = 07000000
ffff0001031510c0 4055991398 S Ci:6:002:0 s c0 05 08b0 0000 0004 4 <
ffff0001031510c0 4055991433 C Ci:6:002:0 0 4 = 18060000
ffff0001031510c0 4055991467 S Co:6:002:0 s 40 05 08b0 0000 0004 4 = 18060000
ffff0001031510c0 4055991514 C Co:6:002:0 0 4 >
ffff0001031510c0 4055991569 S Ci:6:002:0 s c0 05 0d04 0000 0004 4 <
ffff0001031510c0 4055991614 C Ci:6:002:0 0 4 = 017c90b1
ffff0001031510c0 4055991649 S Co:6:002:0 s 40 05 0c90 0000 0004 4 = 017d8501
ffff0001031510c0 4055991679 C Co:6:002:0 0 4 >
ffff0001031510c0 4055991726 S Ci:6:002:0 s c0 05 08ac 0000 0004 4 <
ffff0001031510c0 4055991774 C Ci:6:002:0 0 4 = 08faf00f
ffff0001031510c0 4055991808 S Co:6:002:0 s 40 05 08ac 0000 0004 4 = 08faf00f
ffff0001031510c0 4055991839 C Co:6:002:0 0 4 >
ffff0001031510c0 4055991872 S Ci:6:002:0 s c0 05 08ac 0000 0004 4 <
ffff0001031510c0 4055991908 C Ci:6:002:0 0 4 = 08faf00f
ffff0001031510c0 4055991942 S Co:6:002:0 s 40 05 08ac 0000 0004 4 = 08faf00f
ffff0001031510c0 4055991973 C Co:6:002:0 0 4 >
ffff0001031510c0 4055992137 S Ci:6:002:0 s c0 05 08c4 0000 0004 4 <
ffff0001031510c0 4055992254 C Ci:6:002:0 0 4 = 00000000
ffff0001031510c0 4055992303 S Co:6:002:0 s 40 05 08c4 0000 0004 4 = 00000000
ffff0001031510c0 4055992409 C Co:6:002:0 0 4 >
ffff0001031510c0 4055992456 S Ci:6:002:0 s c0 05 0c00 0000 0004 4 <
ffff0001031510c0 4055992593 C Ci:6:002:0 0 4 = 07000000
ffff0001031510c0 4055992639 S Ci:6:002:0 s c0 05 08b0 0000 0004 4 <
ffff0001031510c0 4055992747 C Ci:6:002:0 0 4 = 18060000
ffff0001031510c0 4055992792 S Co:6:002:0 s 40 05 08b0 0000 0004 4 = 18060000
ffff0001031510c0 4055992898 C Co:6:002:0 0 4 >
ffff0001031510c0 4055992965 S Ci:6:002:0 s c0 05 0d04 0000 0004 4 <
ffff0001031510c0 4055993095 C Ci:6:002:0 0 4 = 017d91b1
ffff0001031510c0 4055993141 S Co:6:002:0 s 40 05 0c90 0000 0004 4 = 997d8101
ffff0001031510c0 4055993246 C Co:6:002:0 0 4 >
ffff0001031510c0 4055993306 S Ci:6:002:0 s c0 05 0e00 0000 0004 4 <
ffff0001031510c0 4055993424 C Ci:6:002:0 0 4 = 07000000
ffff0001031510c0 4055993470 S Ci:6:002:0 s c0 05 08b0 0000 0004 4 <
ffff0001031510c0 4055993594 C Ci:6:002:0 0 4 = 18060000
ffff0001031510c0 4055993639 S Co:6:002:0 s 40 05 08b0 0000 0004 4 = 18060000
ffff0001031510c0 4055993745 C Co:6:002:0 0 4 >
ffff0001031510c0 4055993811 S Ci:6:002:0 s c0 05 0d44 0000 0004 4 <
ffff0001031510c0 4055993930 C Ci:6:002:0 0 4 = 017c90b1
ffff0001031510c0 4055993975 S Co:6:002:0 s 40 05 0e90 0000 0004 4 = 017d8501
ffff0001031510c0 4055994092 C Co:6:002:0 0 4 >
ffff0001031510c0 4055994152 S Ci:6:002:0 s c0 05 08ac 0000 0004 4 <
ffff0001031510c0 4055994270 C Ci:6:002:0 0 4 = 08faf00f
ffff0001031510c0 4055994315 S Co:6:002:0 s 40 05 08ac 0000 0004 4 = 08faf00f
ffff0001031510c0 4055994420 C Co:6:002:0 0 4 >
ffff0001031510c0 4055994467 S Ci:6:002:0 s c0 05 08ac 0000 0004 4 <
ffff0001031510c0 4055994596 C Ci:6:002:0 0 4 = 08faf00f
ffff0001031510c0 4055994641 S Co:6:002:0 s 40 05 08ac 0000 0004 4 = 08faf00f
ffff0001031510c0 4055994746 C Co:6:002:0 0 4 >
ffff0001031510c0 4055994793 S Ci:6:002:0 s c0 05 08c4 0000 0004 4 <
ffff0001031510c0 4055994911 C Ci:6:002:0 0 4 = 00000000
ffff0001031510c0 4055994956 S Co:6:002:0 s 40 05 08c4 0000 0004 4 = 00000000
ffff0001031510c0 4055995062 C Co:6:002:0 0 4 >
ffff0001031510c0 4055995108 S Ci:6:002:0 s c0 05 0e00 0000 0004 4 <
ffff0001031510c0 4055995158 C Ci:6:002:0 0 4 = 07000000
ffff0001031510c0 4055995194 S Ci:6:002:0 s c0 05 08b0 0000 0004 4 <
ffff0001031510c0 4055995229 C Ci:6:002:0 0 4 = 18060000
ffff0001031510c0 4055995264 S Co:6:002:0 s 40 05 08b0 0000 0004 4 = 18060000
ffff0001031510c0 4055995295 C Co:6:002:0 0 4 >
ffff0001031510c0 4055995350 S Ci:6:002:0 s c0 05 0d44 0000 0004 4 <
ffff0001031510c0 4055995400 C Ci:6:002:0 0 4 = 017d91b1
ffff0001031510c0 4055995434 S Co:6:002:0 s 40 05 0e90 0000 0004 4 = 997d8101
ffff0001031510c0 4055995465 C Co:6:002:0 0 4 >
ffff0001031510c0 4055995513 S Ci:6:002:0 s c0 05 0668 0000 0002 2 <
ffff0001031510c0 4055995560 C Ci:6:002:0 0 2 = 0010
ffff0001031510c0 4055995594 S Co:6:002:0 s 40 05 0668 0000 0002 2 = 0010
ffff0001031510c0 4055995643 C Co:6:002:0 0 2 >
ffff0001031510c0 4055995677 S Co:6:002:0 s 40 05 0483 0000 0001 1 = 00
ffff0001031510c0 4055995707 C Co:6:002:0 0 1 >
ffff0001031510c0 4055995740 S Ci:6:002:0 s c0 05 0837 0000 0001 1 <
ffff0001031510c0 4055995776 C Ci:6:002:0 0 1 = 00
ffff0001031510c0 4055995810 S Ci:6:002:0 s c0 05 08ac 0000 0004 4 <
ffff0001031510c0 4055995846 C Ci:6:002:0 0 4 = 08faf00f
ffff0001031510c0 4055995880 S Co:6:002:0 s 40 05 08ac 0000 0004 4 = 08faf00f
ffff0001031510c0 4055995911 C Co:6:002:0 0 4 >
ffff0001031510c0 4055995946 S Ci:6:002:0 s c0 05 08c4 0000 0004 4 <
ffff0001031510c0 4055995982 C Ci:6:002:0 0 4 = 00000000
ffff000103151780 4055996036 S Co:6:002:0 s 40 05 08c4 0000 0004 4 = 00000000
ffff000103151780 4055996088 C Co:6:002:0 0 4 >
ffff000103151780 4055996126 S Ci:6:002:0 s c0 05 0848 0000 0004 4 <
ffff000103151780 4055996265 C Ci:6:002:0 0 4 = 8bffd061
ffff000103151780 4055996314 S Co:6:002:0 s 40 05 0848 0000 0004 4 = 8bffd061
ffff000103151780 4055996430 C Co:6:002:0 0 4 >
ffff000103151780 4055996476 S Ci:6:002:0 s c0 05 08ac 0000 0004 4 <
ffff000103151780 4055996596 C Ci:6:002:0 0 4 = 08faf00f
ffff000103151780 4055996642 S Co:6:002:0 s 40 05 08ac 0000 0004 4 = 08faf00f
ffff000103151780 4055996747 C Co:6:002:0 0 4 >
ffff000103151780 4055996793 S Ci:6:002:0 s c0 05 08ac 0000 0004 4 <
ffff000103151780 4055996912 C Ci:6:002:0 0 4 = 08faf00f
ffff000103151780 4055996958 S Co:6:002:0 s 40 05 08ac 0000 0004 4 = 08faf00f
ffff000103151780 4055997063 C Co:6:002:0 0 4 >
ffff000103151780 4055997109 S Ci:6:002:0 s c0 05 08c4 0000 0004 4 <
ffff000103151780 4055997228 C Ci:6:002:0 0 4 = 00000000
ffff000103151780 4055997274 S Co:6:002:0 s 40 05 08c4 0000 0004 4 = 00000000
ffff000103151780 4055997378 C Co:6:002:0 0 4 >
ffff000103151780 4055997425 S Ci:6:002:0 s c0 05 0c00 0000 0004 4 <
ffff000103151780 4055997544 C Ci:6:002:0 0 4 = 07000000
ffff000103151780 4055997589 S Ci:6:002:0 s c0 05 08b0 0000 0004 4 <
ffff000103151780 4055997714 C Ci:6:002:0 0 4 = 18060000
ffff000103151780 4055997759 S Co:6:002:0 s 40 05 08b0 0000 0004 4 = 18060000
ffff000103151780 4055997865 C Co:6:002:0 0 4 >
ffff000103151780 4055997931 S Ci:6:002:0 s c0 05 0d04 0000 0004 4 <
ffff000103151780 4055998051 C Ci:6:002:0 0 4 = 997d95b1
ffff000103151780 4055998096 S Co:6:002:0 s 40 05 0c90 0000 0004 4 = 997d8501
ffff000103151780 4055998216 C Co:6:002:0 0 4 >
ffff000103151780 4055998275 S Ci:6:002:0 s c0 05 0e00 0000 0004 4 <
ffff000103151780 4055998395 C Ci:6:002:0 0 4 = 07000000
ffff000103151780 4055998440 S Ci:6:002:0 s c0 05 08b0 0000 0004 4 <
ffff000103151780 4055998549 C Ci:6:002:0 0 4 = 18060000
ffff000103151780 4055998596 S Co:6:002:0 s 40 05 08b0 0000 0004 4 = 18060000
ffff000103151780 4055998721 C Co:6:002:0 0 4 >
ffff000103151780 4055998787 S Ci:6:002:0 s c0 05 0d44 0000 0004 4 <
ffff000103151780 4055998906 C Ci:6:002:0 0 4 = 997d95b1
ffff000103151780 4055998951 S Co:6:002:0 s 40 05 0e90 0000 0004 4 = 997d8501
ffff000103151780 4055999058 C Co:6:002:0 0 4 >
ffff000103151780 4055999119 S Ci:6:002:0 s c0 05 0073 0000 0001 1 <
ffff000103151780 4055999170 C Ci:6:002:0 0 1 = 07
ffff000103151780 4055999206 S Co:6:002:0 s 40 05 0073 0000 0001 1 = 07
ffff000103151780 4055999237 C Co:6:002:0 0 1 >
ffff000103151780 4055999300 S Ci:6:002:0 s c0 05 0c24 0000 0004 4 <
ffff000103151780 4055999352 C Ci:6:002:0 0 4 = 20202020
ffff000103151780 4055999386 S Co:6:002:0 s 40 05 0c24 0000 0004 4 = 30303030
ffff000103151780 4055999417 C Co:6:002:0 0 4 >
ffff000103151780 4055999451 S Ci:6:002:0 s c0 05 0c28 0000 0004 4 <
ffff000103151780 4055999489 C Ci:6:002:0 0 4 = 20201e1c
ffff000103151780 4055999523 S Co:6:002:0 s 40 05 0c28 0000 0004 4 = 30302e2c
ffff000103151780 4055999554 C Co:6:002:0 0 4 >
ffff000103151780 4055999589 S Ci:6:002:0 s c0 05 0c2c 0000 0004 4 <
ffff000103151780 4055999643 C Ci:6:002:0 0 4 = 20202020
ffff000103151780 4055999678 S Co:6:002:0 s 40 05 0c2c 0000 0004 4 = 35353535
ffff000103151780 4055999710 C Co:6:002:0 0 4 >
ffff000103151780 4055999744 S Ci:6:002:0 s c0 05 0c30 0000 0004 4 <
ffff000103151780 4055999781 C Ci:6:002:0 0 4 = 20201e1c
ffff000103151780 4055999816 S Co:6:002:0 s 40 05 0c30 0000 0004 4 = 33312f2d
ffff000103151780 4055999848 C Co:6:002:0 0 4 >
ffff000103151780 4055999883 S Ci:6:002:0 s c0 05 0c34 0000 0004 4 <
ffff000103151780 4055999921 C Ci:6:002:0 0 4 = 20202020
ffff000103151780 4055999955 S Co:6:002:0 s 40 05 0c34 0000 0004 4 = 31313131
ffff000103151780 4055999986 C Co:6:002:0 0 4 >
ffff000103151780 4056000033 S Ci:6:002:0 s c0 05 0c38 0000 0004 4 <
ffff000103151780 4056000087 C Ci:6:002:0 0 4 = 201e1c1a
ffff000103151780 4056000125 S Co:6:002:0 s 40 05 0c38 0000 0004 4 = 312f2d2b
ffff000103151780 4056000239 C Co:6:002:0 0 4 >
ffff000103151780 4056000288 S Ci:6:002:0 s c0 05 0c3c 0000 0004 4 <
ffff000103151780 4056000402 C Ci:6:002:0 0 4 = 20202020
ffff000103151780 4056000446 S Co:6:002:0 s 40 05 0c3c 0000 0004 4 = 35353535
ffff000103151780 4056000552 C Co:6:002:0 0 4 >
ffff000103151780 4056000599 S Ci:6:002:0 s c0 05 0c40 0000 0004 4 <
ffff000103151780 4056000722 C Ci:6:002:0 0 4 = 20201e1c
ffff000103151780 4056000767 S Co:6:002:0 s 40 05 0c40 0000 0004 4 = 33312f2d
ffff000103151780 4056000871 C Co:6:002:0 0 4 >
ffff000103151780 4056000918 S Ci:6:002:0 s c0 05 0c44 0000 0004 4 <
ffff000103151780 4056001039 C Ci:6:002:0 0 4 = 1a181e1e
ffff000103151780 4056001084 S Co:6:002:0 s 40 05 0c44 0000 0004 4 = 2b2b3131
ffff000103151780 4056001189 C Co:6:002:0 0 4 >
ffff000103151780 4056001235 S Ci:6:002:0 s c0 05 0c48 0000 0004 4 <
ffff000103151780 4056001355 C Ci:6:002:0 0 4 = 1e1e1e1e
ffff000103151780 4056001400 S Co:6:002:0 s 40 05 0c48 0000 0004 4 = 3131312f
ffff000103151780 4056001506 C Co:6:002:0 0 4 >
ffff000103151780 4056001552 S Ci:6:002:0 s c0 05 0c4c 0000 0004 4 <
ffff000103151780 4056001672 C Ci:6:002:0 0 4 = 1c1a1816
ffff000103151780 4056001717 S Co:6:002:0 s 40 05 0c4c 0000 0004 4 = 2d2b2929
ffff000103151780 4056001834 C Co:6:002:0 0 4 >
ffff000103151780 4056001880 S Ci:6:002:0 s c0 05 0c54 0000 0004 4 <
ffff000103151780 4056002001 C Ci:6:002:0 0 4 = 120a0400
ffff000103151780 4056002046 S Co:6:002:0 s 40 05 0c54 0000 0004 4 = 231b1500
ffff000103151780 4056002152 C Co:6:002:0 0 4 >
ffff000103151780 4056002198 S Ci:6:002:0 s c0 05 0e24 0000 0004 4 <
ffff000103151780 4056002318 C Ci:6:002:0 0 4 = 1d1d1d1d
ffff000103151780 4056002364 S Co:6:002:0 s 40 05 0e24 0000 0004 4 = 1e1e1e1e
ffff000103151780 4056002469 C Co:6:002:0 0 4 >
ffff000103151780 4056002515 S Ci:6:002:0 s c0 05 0e28 0000 0004 4 <
ffff000103151780 4056002636 C Ci:6:002:0 0 4 = 1d1d1b19
ffff000103151780 4056002681 S Co:6:002:0 s 40 05 0e28 0000 0004 4 = 1e1e1c1a
ffff000103151780 4056002786 C Co:6:002:0 0 4 >
ffff000103151780 4056002833 S Ci:6:002:0 s c0 05 0e2c 0000 0004 4 <
ffff000103151780 4056002971 C Ci:6:002:0 0 4 = 1f1f1f1f
ffff000103151780 4056003017 S Co:6:002:0 s 40 05 0e2c 0000 0004 4 = 23232323
ffff000103151780 4056003050 C Co:6:002:0 0 4 >
ffff000103151780 4056003087 S Ci:6:002:0 s c0 05 0e30 0000 0004 4 <
ffff000103151780 4056003151 C Ci:6:002:0 0 4 = 1f1f1d1b
ffff000103151780 4056003186 S Co:6:002:0 s 40 05 0e30 0000 0004 4 = 211f1d1b
ffff000103151780 4056003218 C Co:6:002:0 0 4 >
ffff000103151780 4056003251 S Ci:6:002:0 s c0 05 0e34 0000 0004 4 <
ffff000103151780 4056003289 C Ci:6:002:0 0 4 = 1f1f1f1f
ffff000103151780 4056003324 S Co:6:002:0 s 40 05 0e34 0000 0004 4 = 1f1f1f1f
ffff000103151780 4056003356 C Co:6:002:0 0 4 >
ffff000103151780 4056003391 S Ci:6:002:0 s c0 05 0e38 0000 0004 4 <
ffff000103151780 4056003428 C Ci:6:002:0 0 4 = 1f1d1b19
ffff000103151780 4056003463 S Co:6:002:0 s 40 05 0e38 0000 0004 4 = 1f1d1b19
ffff000103151780 4056003495 C Co:6:002:0 0 4 >
ffff000103151780 4056003529 S Ci:6:002:0 s c0 05 0e3c 0000 0004 4 <
ffff000103151780 4056003568 C Ci:6:002:0 0 4 = 1f1f1f1f
ffff000103151780 4056003603 S Co:6:002:0 s 40 05 0e3c 0000 0004 4 = 23232323
ffff000103151780 4056003646 C Co:6:002:0 0 4 >
ffff000103151780 4056003681 S Ci:6:002:0 s c0 05 0e40 0000 0004 4 <
ffff000103151780 4056003720 C Ci:6:002:0 0 4 = 1f1f1d1b
ffff000103151780 4056003755 S Co:6:002:0 s 40 05 0e40 0000 0004 4 = 211f1d1b
ffff000103151780 4056003786 C Co:6:002:0 0 4 >
ffff000103151780 4056003821 S Ci:6:002:0 s c0 05 0e44 0000 0004 4 <
ffff000103151780 4056003860 C Ci:6:002:0 0 4 = 19171d1d
ffff000103151780 4056003895 S Co:6:002:0 s 40 05 0e44 0000 0004 4 = 19191f1f
ffff000103151780 4056003927 C Co:6:002:0 0 4 >
ffff000103151780 4056003961 S Ci:6:002:0 s c0 05 0e48 0000 0004 4 <
ffff000103151780 4056004013 C Ci:6:002:0 0 4 = 1d1d1d1d
ffff000103151780 4056004058 S Co:6:002:0 s 40 05 0e48 0000 0004 4 = 1f1f1f1d
ffff000103151780 4056004109 C Co:6:002:0 0 4 >
ffff000103151780 4056004146 S Ci:6:002:0 s c0 05 0e4c 0000 0004 4 <
ffff000103151780 4056004259 C Ci:6:002:0 0 4 = 1b191715
ffff000103151780 4056004306 S Co:6:002:0 s 40 05 0e4c 0000 0004 4 = 1b191717
ffff000103151780 4056004419 C Co:6:002:0 0 4 >
ffff000103151780 4056004467 S Ci:6:002:0 s c0 05 0e54 0000 0004 4 <
ffff000103151780 4056004597 C Ci:6:002:0 0 4 = 11090300
ffff000103151780 4056004643 S Co:6:002:0 s 40 05 0e54 0000 0004 4 = 11090300
ffff000103151780 4056004749 C Co:6:002:0 0 4 >
ffff000102d1d840 4056796196 S Ci:6:002:0 s c0 05 004c 0000 0001 1 <
ffff000102d1d840 4056796365 C Ci:6:002:0 0 1 = 20
ffff000102d1d840 4056796533 S Co:6:002:0 s 40 05 004c 0000 0001 1 = 20
ffff000102d1d840 4056796672 C Co:6:002:0 0 1 >
ffff000102d1d840 4057756211 S Ci:6:002:0 s c0 05 0770 0000 0004 4 <
ffff000102d1d840 4057756363 C Ci:6:002:0 0 4 = 00000000
ffff000102d1d840 4057756515 S Ci:6:002:0 s c0 05 0774 0000 0004 4 <
ffff000102d1d840 4057756661 C Ci:6:002:0 0 4 = 00000000
ffff000102d1d840 4057756820 S Co:6:002:0 s 40 05 076e 0000 0001 1 = 0c
ffff000102d1d840 4057756964 C Co:6:002:0 0 1 >
ffff000102d1d840 4057757123 S Ci:6:002:0 s c0 05 0808 0000 0004 4 <
ffff000102d1d840 4057757268 C Ci:6:002:0 0 4 = 3382023e
ffff000102d1d840 4057757427 S Ci:6:002:0 s c0 05 0a5c 0000 0002 2 <
ffff000102d1d840 4057757572 C Ci:6:002:0 0 2 = 0a00
ffff000102d1d840 4057757732 S Ci:6:002:0 s c0 05 0f48 0000 0002 2 <
ffff000102d1d840 4057757853 C Ci:6:002:0 0 2 = ca02
ffff000102d1d840 4057757883 S Ci:6:002:0 s c0 05 0f04 0000 0004 4 <
ffff000102d1d840 4057757999 C Ci:6:002:0 0 4 = 00000000
ffff000102d1d840 4057758028 S Ci:6:002:0 s c0 05 0f14 0000 0004 4 <
ffff000102d1d840 4057758150 C Ci:6:002:0 0 4 = 5a005a00
ffff000102d1d840 4057758170 S Ci:6:002:0 s c0 05 0f10 0000 0004 4 <
ffff000102d1d840 4057758283 C Ci:6:002:0 0 4 = 00000000
ffff000102d1d840 4057758312 S Ci:6:002:0 s c0 05 0f0c 0000 0004 4 <
ffff000102d1d840 4057758424 C Ci:6:002:0 0 4 = 00000000
ffff000102d1d840 4057758454 S Ci:6:002:0 s c0 05 0f08 0000 0004 4 <
ffff000102d1d840 4057758577 C Ci:6:002:0 0 4 = 13007e03
ffff000102d1d840 4057758607 S Ci:6:002:0 s c0 05 0fcc 0000 0004 4 <
ffff000102d1d840 4057758718 C Ci:6:002:0 0 4 = 00000000
ffff000102d1d840 4057758747 S Ci:6:002:0 s c0 05 09a4 0000 0004 4 <
ffff000102d1d840 4057758865 C Ci:6:002:0 0 4 = 80000800
ffff000102d1d840 4057758887 S Co:6:002:0 s 40 05 09a4 0000 0004 4 = 80000a00
ffff000102d1d840 4057758994 C Co:6:002:0 0 4 >
ffff000102d1d840 4057759024 S Ci:6:002:0 s c0 05 09a4 0000 0004 4 <
ffff000102d1d840 4057759142 C Ci:6:002:0 0 4 = 80000a00
ffff000102d1d840 4057759162 S Co:6:002:0 s 40 05 09a4 0000 0004 4 = 80000800
ffff000102d1d840 4057759270 C Co:6:002:0 0 4 >
ffff000102d1d840 4057759299 S Ci:6:002:0 s c0 05 0a2c 0000 0004 4 <
ffff000102d1d840 4057759412 C Ci:6:002:0 0 4 = 00809000
ffff000102d1d840 4057759433 S Co:6:002:0 s 40 05 0a2c 0000 0004 4 = 00009000
ffff000102d1d840 4057759541 C Co:6:002:0 0 4 >
ffff000102d1d840 4057759569 S Ci:6:002:0 s c0 05 0a2c 0000 0004 4 <
ffff000102d1d840 4057759688 C Ci:6:002:0 0 4 = 00009000
ffff000102d1d840 4057759708 S Co:6:002:0 s 40 05 0a2c 0000 0004 4 = 00809000
ffff000102d1d840 4057759823 C Co:6:002:0 0 4 >
ffff000102d1d840 4057759852 S Ci:6:002:0 s c0 05 0b58 0000 0004 4 <
ffff000102d1d840 4057759971 C Ci:6:002:0 0 4 = 00000000
ffff000102d1d840 4057759992 S Co:6:002:0 s 40 05 0b58 0000 0004 4 = 01000000
ffff000102d1d840 4057760110 C Co:6:002:0 0 4 >
ffff000102d1d840 4057760141 S Ci:6:002:0 s c0 05 0b58 0000 0004 4 <
ffff000102d1d840 4057760251 C Ci:6:002:0 0 4 = 01000000
ffff000102d1d840 4057760282 S Co:6:002:0 s 40 05 0b58 0000 0004 4 = 00000000
ffff000102d1d840 4057760389 C Co:6:002:0 0 4 >
ffff000102d1d840 4057760420 S Ci:6:002:0 s c0 05 0c50 0000 0004 4 <
ffff000102d1d840 4057760537 C Ci:6:002:0 0 4 = 1e000000
ffff000102d1d840 4057760558 S Co:6:002:0 s 40 05 0c50 0000 0004 4 = 1c000000
ffff000102d1d840 4057760665 C Co:6:002:0 0 4 >
ffff000102d1d840 4057760695 S Ci:6:002:0 s c0 05 0e50 0000 0004 4 <
ffff000102d1d840 4057760814 C Ci:6:002:0 0 4 = 1e000000
ffff000102d1d840 4057760835 S Co:6:002:0 s 40 05 0e50 0000 0004 4 = 1c000000
ffff000102d1d840 4057760948 C Co:6:002:0 0 4 >
ffff000102d1d840 4057760978 S Ci:6:002:0 s c0 05 01cc 0000 0001 1 <
ffff000102d1d840 4057761091 C Ci:6:002:0 0 1 = 00
ffff000102d1d840 4057761113 S Co:6:002:0 s 40 05 01f0 0000 0004 4 = 00000000
ffff000102d1d840 4057761220 C Co:6:002:0 0 4 >
ffff000102d1d840 4057761249 S Co:6:002:0 s 40 05 01d0 0000 0004 4 = 58000000
ffff000102d1d840 4057761364 C Co:6:002:0 0 4 >
ffff000102d1d840 4057761386 S Co:6:002:0 s 40 05 0440 0000 0004 4 = 00000000
ffff000102d1d840 4057761493 C Co:6:002:0 0 4 >
ffff000102d1d840 4057761524 S Ci:6:002:0 s c0 05 0c00 0000 0004 4 <
ffff000102d1d840 4057761642 C Ci:6:002:0 0 4 = 07000000
ffff000102d1d840 4057761663 S Ci:6:002:0 s c0 05 08b0 0000 0004 4 <
ffff000102d1d840 4057761775 C Ci:6:002:0 0 4 = 18060000
ffff000102d1d840 4057761805 S Co:6:002:0 s 40 05 08b0 0000 0004 4 = 42060000
ffff000102d1d840 4057761919 C Co:6:002:0 0 4 >
ffff000102d1d840 4057761960 S Ci:6:002:0 s c0 05 0d04 0000 0004 4 <
ffff000102d1d840 4057762079 C Ci:6:002:0 0 4 = 108d90b1
ffff000102d1d840 4057762109 S Co:6:002:0 s 40 05 0c90 0000 0004 4 = 108d2304
ffff000102d1d840 4057762223 C Co:6:002:0 0 4 >
ffff000102d1d840 4057762257 S Co:6:002:0 s 40 05 0280 0000 0002 2 = 0001
ffff000102d1d840 4057762359 C Co:6:002:0 0 2 >
ffff000102d1d840 4057762389 S Ci:6:002:0 s c0 05 010c 0000 0001 1 <
ffff000102d1d840 4057762507 C Ci:6:002:0 0 1 = b4
ffff000102d1d840 4057762528 S Co:6:002:0 s 40 05 010c 0000 0001 1 = b4
ffff000102d1d840 4057762636 C Co:6:002:0 0 1 >
ffff000102d1d840 4057788261 S Ci:6:002:0 s c0 05 004c 0000 0001 1 <
ffff000102d1d840 4057788395 C Ci:6:002:0 0 1 = 20
ffff000102d1d840 4057788548 S Co:6:002:0 s 40 05 004c 0000 0001 1 = 20
ffff000102d1d840 4057788689 C Co:6:002:0 0 1 >
ffff000102d1d840 4058780172 S Ci:6:002:0 s c0 05 004c 0000 0001 1 <
ffff000102d1d840 4058780303 C Ci:6:002:0 0 1 = 20
ffff000102d1d840 4058780443 S Co:6:002:0 s 40 05 004c 0000 0001 1 = 20
ffff000102d1d840 4058780578 C Co:6:002:0 0 1 >
