ffff000103558000 1400812908 C Bi:6:002:1 0 84 = 1c000484 00000f22 bf026000 08300000 00000000 7a5f0900 4c460080 93f2f201
ffff000103558000 1400812983 S Bi:6:002:1 -115 32768 <
ffff000103558600 1400863259 C Bi:6:002:1 0 84 = 1c000484 00000f22 02086000 08300000 00000000 38240a00 3e440080 90f4f401
ffff000103558600 1400863302 S Bi:6:002:1 -115 32768 <
ffff0001035580c0 1400865997 C Bi:6:002:1 0 446 = 86010484 00000f80 4f086000 04300000 00000000 ee2c0a00 48400080 8ad7d701
ffff0001035580c0 1400866022 S Bi:6:002:1 -115 32768 <
ffff000103558e40 1400885472 C Bi:6:002:1 0 84 = 1c000484 00000f20 c0026000 08300000 00000000 ca7a0a00 4a460080 95f2f201
ffff000103558e40 1400885499 S Bi:6:002:1 -115 32768 <
ffff000103558000 1401040208 C Bi:6:002:1 0 86 = 1e008484 00060f22 d2056900 04300000 00000000 3ad70c00 464c0080 93ecec01
ffff000103558000 1401040237 S Bi:6:002:1 -115 32768 <
ffff000103558600 1401093408 C Bi:6:002:1 0 86 = 1e008484 00000f20 d3056900 04300000 00000000 efa60d00 464c0080 92ecec01
ffff000103558600 1401093446 S Bi:6:002:1 -115 32768 <
ffff0001035580c0 1401114561 C Bi:6:002:1 0 84 = 1c000484 00000f22 e40f6000 08300000 00000000 b3f90d00 34320080 6afdfd01
ffff0001035580c0 1401114588 S Bi:6:002:1 -115 32768 <
ffff000103558e40 1401119908 C Bi:6:002:1 0 86 = 1e008484 00060f22 d4056900 04300000 00000000 aa0e0e00 464c0080 97ecec01
ffff000103558e40 1401119930 S Bi:6:002:1 -115 32768 <
ffff000103558000 1401174297 C Bi:6:002:1 0 469 = 9d010484 00000f80 f7006000 04300000 00000000 ece00e00 48400080 8ad7d701
ffff000103558000 1401174355 S Bi:6:002:1 -115 32768 <
ffff000103558600 1401175365 C Bi:6:002:1 0 479 = a7010484 00000f80 320f6000 04300000 00000000 1ce50e00 48400080 88d7d701
ffff000103558600 1401175394 S Bi:6:002:1 -115 32768 <
ffff0001035580c0 1401436703 C Bi:6:002:1 0 84 = 1c000484 00000f20 e50f6000 08300000 00000000 41e41200 3c340080 76fdfd01
ffff0001035580c0 1401436731 S Bi:6:002:1 -115 32768 <
ffff000103558e40 1401488563 C Bi:6:002:1 0 285 = e5000484 00000f80 830b6000 04300000 00000000 a9ad1300 545200a8 a8e5e501
ffff000103558e40 1401488618 S Bi:6:002:1 -115 32768 <
ffff000103558000 1401509525 C Bi:6:002:1 0 285 = e5000484 00000f80 840b6000 04300000 00000000 95ff1300 545200a8 a9e5e501
ffff000103558000 1401509549 S Bi:6:002:1 -115 32768 <
ffff000103558600 1401571873 C Bi:6:002:1 0 285 = e5000484 00000f80 870b6000 04300000 00000000 16f31400 56560080 a9e4e401
ffff000103558600 1401571896 S Bi:6:002:1 -115 32768 <
ffff0001035580c0 1401583829 C Bi:6:002:1 0 469 = 9d010484 00000f80 fb006000 04300000 00000000 b0201500 48400080 8ad7d701
ffff0001035580c0 1401583856 S Bi:6:002:1 -115 32768 <
ffff000103558e40 1401592095 C Bi:6:002:1 0 285 = e5000484 00000f80 880b6000 04300000 00000000 0c421500 56560080 ade6e601
ffff000103558e40 1401592152 S Bi:6:002:1 -115 32768 <
ffff000103558000 1401655164 C Bi:6:002:1 0 195 = 8b00848c 00000f20 67007900 04300000 00000000 bf381600 32460080 89e0e001
ffff000103558000 1401655201 S Bi:6:002:1 -115 32768 <
ffff000103558600 1401673649 C Bi:6:002:1 0 84 = 1c000484 00000f20 e70f6000 08300000 00000000 dd811600 34320080 67fefe01
ffff000103558600 1401673684 S Bi:6:002:1 -115 32768 <
ffff0001035580c0 1401683277 C Bi:6:002:1 0 478 = a6010484 00000f80 b0046000 04300000 00000000 2da51600 48420080 87d6d601
ffff0001035580c0 1401683303 S Bi:6:002:1 -115 32768 <
ffff000103558e40 1401684269 C Bi:6:002:1 0 471 = 9f010484 00000f80 12026000 04300000 00000000 1da91600 46400080 87d7d701
ffff000103558e40 1401684295 S Bi:6:002:1 -115 32768 <
ffff000103558000 1401685286 C Bi:6:002:1 0 446 = 86010484 00000f80 57086000 04300000 00000000 42ad1600 48400080 87d7d701
ffff000103558000 1401685311 S Bi:6:002:1 -115 32768 <
ffff000103558600 1401761481 C Bi:6:002:1 0 86 = 1e008484 00000f22 00006900 04300000 00000000 c5d81700 32460080 8fdfdf01
ffff000103558600 1401761529 S Bi:6:002:1 -115 32768 <
ffff00014a4c2180 1401768139 S Ci:6:002:0 s c0 05 004c 0000 0001 1 <
ffff00014a4c2180 1401768225 C Ci:6:002:0 0 1 = 20
ffff00014a4c2180 1401768361 S Co:6:002:0 s 40 05 004c 0000 0001 1 = 28
ffff00014a4c2180 1401768485 C Co:6:002:0 0 1 >
ffff000103558c00 1401771596 S Ci:6:002:0 s c0 05 0454 0000 0001 1 <
ffff000103558c00 1401771774 C Ci:6:002:0 0 1 = 00
ffff000103558c00 1401771912 S Ci:6:002:0 s c0 05 0860 0000 0004 4 <
ffff000103558c00 1401772026 C Ci:6:002:0 0 4 = 21c32969
ffff000103558c00 1401772151 S Co:6:002:0 s 40 05 0860 0000 0004 4 = 21c3d572
ffff000103558c00 1401772206 C Co:6:002:0 0 4 >
ffff000103558c00 1401772335 S Ci:6:002:0 s c0 05 0c00 0000 0004 4 <
ffff000103558c00 1401772467 C Ci:6:002:0 0 4 = 07000000
ffff000103558c00 1401772599 S Ci:6:002:0 s c0 05 08b0 0000 0004 4 <
ffff000103558c00 1401772725 C Ci:6:002:0 0 4 = 00060000
ffff000103558c00 1401772859 S Co:6:002:0 s 40 05 08b0 0000 0004 4 = 18060000
ffff000103558c00 1401772977 C Co:6:002:0 0 4 >
ffff000103558c00 1401773030 S Ci:6:002:0 s c0 05 0d04 0000 0004 4 <
ffff000103558c00 1401773144 C Ci:6:002:0 0 4 = 2a7191b1
ffff000103558c00 1401773277 S Co:6:002:0 s 40 05 0c90 0000 0004 4 = 2a708001
ffff000103558c00 1401773395 C Co:6:002:0 0 4 >
ffff000103558c00 1401773442 S Ci:6:002:0 s c0 05 08ac 0000 0004 4 <
ffff000103558c00 1401773571 C Ci:6:002:0 0 4 = 0afaf00f
ffff000103558c00 1401773604 S Co:6:002:0 s 40 05 08ac 0000 0004 4 = 0afaf00f
ffff000103558c00 1401773708 C Co:6:002:0 0 4 >
ffff000103558c00 1401773738 S Ci:6:002:0 s c0 05 08ac 0000 0004 4 <
ffff000103558c00 1401773849 C Ci:6:002:0 0 4 = 0afaf00f
ffff000103558c00 1401773879 S Co:6:002:0 s 40 05 08ac 0000 0004 4 = 0afaf00f
ffff000103558c00 1401773985 C Co:6:002:0 0 4 >
ffff000103558c00 1401774015 S Ci:6:002:0 s c0 05 08c4 0000 0004 4 <
ffff000103558c00 1401774127 C Ci:6:002:0 0 4 = 00000000
ffff000103558c00 1401774157 S Co:6:002:0 s 40 05 08c4 0000 0004 4 = 00000000
ffff000103558c00 1401774263 C Co:6:002:0 0 4 >
ffff000103558c00 1401774293 S Ci:6:002:0 s c0 05 0c00 0000 0004 4 <
ffff000103558c00 1401774404 C Ci:6:002:0 0 4 = 07000000
ffff000103558c00 1401774434 S Ci:6:002:0 s c0 05 08b0 0000 0004 4 <
ffff000103558c00 1401774545 C Ci:6:002:0 0 4 = 18060000
ffff000103558c00 1401774576 S Co:6:002:0 s 40 05 08b0 0000 0004 4 = 18060000
ffff000103558c00 1401774695 C Co:6:002:0 0 4 >
ffff000103558c00 1401774745 S Ci:6:002:0 s c0 05 0d04 0000 0004 4 <
ffff000103558c00 1401774853 C Ci:6:002:0 0 4 = 2a7090b1
ffff000103558c00 1401774883 S Co:6:002:0 s 40 05 0c90 0000 0004 4 = 01708001
ffff000103558c00 1401774990 C Co:6:002:0 0 4 >
ffff000103558c00 1401775054 S Ci:6:002:0 s c0 05 0e00 0000 0004 4 <
ffff000103558c00 1401775163 C Ci:6:002:0 0 4 = 07000000
ffff000103558c00 1401775193 S Ci:6:002:0 s c0 05 08b0 0000 0004 4 <
ffff000103558c00 1401775318 C Ci:6:002:0 0 4 = 18060000
ffff000103558c00 1401775348 S Co:6:002:0 s 40 05 08b0 0000 0004 4 = 18060000
ffff000103558c00 1401775454 C Co:6:002:0 0 4 >
ffff000103558c00 1401775504 S Ci:6:002:0 s c0 05 0d44 0000 0004 4 <
ffff000103558c00 1401775612 C Ci:6:002:0 0 4 = 2a7191b1
ffff000103558c00 1401775643 S Co:6:002:0 s 40 05 0e90 0000 0004 4 = 2a708001
ffff000103558c00 1401775749 C Co:6:002:0 0 4 >
ffff000103558c00 1401775792 S Ci:6:002:0 s c0 05 08ac 0000 0004 4 <
ffff000103558c00 1401775902 C Ci:6:002:0 0 4 = 0afaf00f
ffff000103558c00 1401775932 S Co:6:002:0 s 40 05 08ac 0000 0004 4 = 0afaf00f
ffff000103558c00 1401776042 C Co:6:002:0 0 4 >
ffff000103558c00 1401776072 S Ci:6:002:0 s c0 05 08ac 0000 0004 4 <
ffff000103558c00 1401776199 C Ci:6:002:0 0 4 = 0afaf00f
ffff000103558c00 1401776229 S Co:6:002:0 s 40 05 08ac 0000 0004 4 = 0afaf00f
ffff000103558c00 1401776336 C Co:6:002:0 0 4 >
ffff000103558c00 1401776366 S Ci:6:002:0 s c0 05 08c4 0000 0004 4 <
ffff000103558c00 1401776477 C Ci:6:002:0 0 4 = 00000000
ffff000103558c00 1401776507 S Co:6:002:0 s 40 05 08c4 0000 0004 4 = 00000000
ffff000103558c00 1401776613 C Co:6:002:0 0 4 >
ffff000103558c00 1401776643 S Ci:6:002:0 s c0 05 0e00 0000 0004 4 <
ffff000103558c00 1401776754 C Ci:6:002:0 0 4 = 07000000
ffff000103558c00 1401776785 S Ci:6:002:0 s c0 05 08b0 0000 0004 4 <
ffff000103558c00 1401776896 C Ci:6:002:0 0 4 = 18060000
ffff000103558c00 1401776926 S Co:6:002:0 s 40 05 08b0 0000 0004 4 = 18060000
ffff000103558c00 1401777032 C Co:6:002:0 0 4 >
ffff000103558c00 1401777082 S Ci:6:002:0 s c0 05 0d44 0000 0004 4 <
ffff000103558c00 1401777200 C Ci:6:002:0 0 4 = 2a7090b1
ffff000103558c00 1401777230 S Co:6:002:0 s 40 05 0e90 0000 0004 4 = 01708001
ffff000103558c00 1401777337 C Co:6:002:0 0 4 >
ffff000103558c00 1401777380 S Ci:6:002:0 s c0 05 0668 0000 0002 2 <
ffff000103558c00 1401777488 C Ci:6:002:0 0 2 = 0010
ffff000103558c00 1401777518 S Co:6:002:0 s 40 05 0668 0000 0002 2 = 0010
ffff000103558c00 1401777624 C Co:6:002:0 0 2 >
ffff000103558c00 1401777654 S Co:6:002:0 s 40 05 0483 0000 0001 1 = 00
ffff000103558c00 1401777760 C Co:6:002:0 0 1 >
ffff000103558c00 1401777791 S Ci:6:002:0 s c0 05 0837 0000 0001 1 <
ffff000103558c00 1401777901 C Ci:6:002:0 0 1 = 00
ffff000103558c00 1401777933 S Ci:6:002:0 s c0 05 08ac 0000 0004 4 <
ffff000103558c00 1401778044 C Ci:6:002:0 0 4 = 0afaf00f
ffff000103558c00 1401778074 S Co:6:002:0 s 40 05 08ac 0000 0004 4 = 08faf00f
ffff000103558c00 1401778192 C Co:6:002:0 0 4 >
ffff000103558c00 1401778222 S Ci:6:002:0 s c0 05 08c4 0000 0004 4 <
ffff000103558c00 1401778334 C Ci:6:002:0 0 4 = 00000000
ffff000103558c00 1401778364 S Co:6:002:0 s 40 05 08c4 0000 0004 4 = 00000000
ffff000103558c00 1401778470 C Co:6:002:0 0 4 >
ffff000103558c00 1401778500 S Ci:6:002:0 s c0 05 0848 0000 0004 4 <
ffff000103558c00 1401778611 C Ci:6:002:0 0 4 = 8bff1062
ffff000103558c00 1401778641 S Co:6:002:0 s 40 05 0848 0000 0004 4 = 8bffd061
ffff000103558c00 1401778748 C Co:6:002:0 0 4 >
ffff000103558c00 1401778778 S Ci:6:002:0 s c0 05 08ac 0000 0004 4 <
ffff000103558c00 1401778889 C Ci:6:002:0 0 4 = 08faf00f
ffff000103558c00 1401778920 S Co:6:002:0 s 40 05 08ac 0000 0004 4 = 08faf00f
ffff000103558c00 1401779026 C Co:6:002:0 0 4 >
ffff000103558c00 1401779056 S Ci:6:002:0 s c0 05 08ac 0000 0004 4 <
ffff000103558c00 1401779167 C Ci:6:002:0 0 4 = 08faf00f
ffff000103558c00 1401779197 S Co:6:002:0 s 40 05 08ac 0000 0004 4 = 08faf00f
ffff000103558c00 1401779316 C Co:6:002:0 0 4 >
ffff000103558c00 1401779346 S Ci:6:002:0 s c0 05 08c4 0000 0004 4 <
ffff000103558c00 1401779457 C Ci:6:002:0 0 4 = 00000000
ffff000103558c00 1401779487 S Co:6:002:0 s 40 05 08c4 0000 0004 4 = 00000000
ffff000103558c00 1401779594 C Co:6:002:0 0 4 >
ffff000103558c00 1401779624 S Ci:6:002:0 s c0 05 0c00 0000 0004 4 <
ffff000103558c00 1401779735 C Ci:6:002:0 0 4 = 07000000
ffff000103558c00 1401779765 S Ci:6:002:0 s c0 05 08b0 0000 0004 4 <
ffff000103558c00 1401779874 C Ci:6:002:0 0 4 = 18060000
ffff000103558c00 1401779905 S Co:6:002:0 s 40 05 08b0 0000 0004 4 = 18060000
ffff000103558c00 1401780010 C Co:6:002:0 0 4 >
ffff000103558c00 1401780061 S Ci:6:002:0 s c0 05 0d04 0000 0004 4 <
ffff000103558c00 1401780172 C Ci:6:002:0 0 4 = 017090b1
ffff000103558c00 1401780203 S Co:6:002:0 s 40 05 0c90 0000 0004 4 = 017c8001
ffff000103558c00 1401780321 C Co:6:002:0 0 4 >
ffff000103558c00 1401780364 S Ci:6:002:0 s c0 05 0e00 0000 0004 4 <
ffff000103558c00 1401780470 C Ci:6:002:0 0 4 = 07000000
ffff000103558c00 1401780500 S Ci:6:002:0 s c0 05 08b0 0000 0004 4 <
ffff000103558c00 1401780610 C Ci:6:002:0 0 4 = 18060000
ffff000103558c00 1401780639 S Co:6:002:0 s 40 05 08b0 0000 0004 4 = 18060000
ffff000103558c00 1401780746 C Co:6:002:0 0 4 >
ffff000103558c00 1401780796 S Ci:6:002:0 s c0 05 0d44 0000 0004 4 <
ffff000103558c00 1401780903 C Ci:6:002:0 0 4 = 017090b1
ffff000103558c00 1401780933 S Co:6:002:0 s 40 05 0e90 0000 0004 4 = 017c8001
ffff000103558c00 1401781040 C Co:6:002:0 0 4 >
ffff000103558c00 1401781086 S Ci:6:002:0 s c0 05 0073 0000 0001 1 <
ffff000103558c00 1401781198 C Ci:6:002:0 0 1 = 07
ffff000103558c00 1401781228 S Co:6:002:0 s 40 05 0073 0000 0001 1 = 07
ffff000103558c00 1401781335 C Co:6:002:0 0 1 >
ffff000103558c00 1401781385 S Ci:6:002:0 s c0 05 0c20 0000 0004 4 <
ffff000103558c00 1401781491 C Ci:6:002:0 0 4 = 12121212
ffff000103558c00 1401781521 S Co:6:002:0 s 40 05 0c20 0000 0004 4 = 13131313
ffff000103558c00 1401781627 C Co:6:002:0 0 4 >
ffff000103558c00 1401781657 S Ci:6:002:0 s c0 05 0c24 0000 0004 4 <
ffff000103558c00 1401781767 C Ci:6:002:0 0 4 = 12121212
ffff000103558c00 1401781797 S Co:6:002:0 s 40 05 0c24 0000 0004 4 = 20202020
ffff000103558c00 1401781904 C Co:6:002:0 0 4 >
ffff000103558c00 1401781934 S Ci:6:002:0 s c0 05 0c28 0000 0004 4 <
ffff000103558c00 1401782043 C Ci:6:002:0 0 4 = 12121212
ffff000103558c00 1401782074 S Co:6:002:0 s 40 05 0c28 0000 0004 4 = 20201e1c
ffff000103558c00 1401782192 C Co:6:002:0 0 4 >
ffff000103558c00 1401782223 S Ci:6:002:0 s c0 05 0c2c 0000 0004 4 <
ffff000103558c00 1401782332 C Ci:6:002:0 0 4 = 12121212
ffff000103558c00 1401782362 S Co:6:002:0 s 40 05 0c2c 0000 0004 4 = 20202020
ffff000103558c00 1401782469 C Co:6:002:0 0 4 >
ffff000103558c00 1401782499 S Ci:6:002:0 s c0 05 0c30 0000 0004 4 <
ffff000103558c00 1401782609 C Ci:6:002:0 0 4 = 12121212
ffff000103558c00 1401782638 S Co:6:002:0 s 40 05 0c30 0000 0004 4 = 20201e1c
ffff000103558c00 1401782745 C Co:6:002:0 0 4 >
ffff000103558c00 1401782775 S Ci:6:002:0 s c0 05 0c34 0000 0004 4 <
ffff000103558c00 1401782885 C Ci:6:002:0 0 4 = 12121212
ffff000103558c00 1401782915 S Co:6:002:0 s 40 05 0c34 0000 0004 4 = 20202020
ffff000103558c00 1401783021 C Co:6:002:0 0 4 >
ffff000103558c00 1401783051 S Ci:6:002:0 s c0 05 0c38 0000 0004 4 <
ffff000103558c00 1401783161 C Ci:6:002:0 0 4 = 12121212
ffff000103558c00 1401783192 S Co:6:002:0 s 40 05 0c38 0000 0004 4 = 201e1c1a
ffff000103558c00 1401783297 C Co:6:002:0 0 4 >
ffff000103558c00 1401783327 S Ci:6:002:0 s c0 05 0c3c 0000 0004 4 <
ffff000103558c00 1401783448 C Ci:6:002:0 0 4 = 12121212
ffff000103558c00 1401783478 S Co:6:002:0 s 40 05 0c3c 0000 0004 4 = 20202020
ffff000103558c00 1401783584 C Co:6:002:0 0 4 >
ffff000103558c00 1401783615 S Ci:6:002:0 s c0 05 0c40 0000 0004 4 <
ffff000103558c00 1401783725 C Ci:6:002:0 0 4 = 12121212
ffff000103558c00 1401783755 S Co:6:002:0 s 40 05 0c40 0000 0004 4 = 20201e1c
ffff000103558c00 1401783861 C Co:6:002:0 0 4 >
ffff000103558c00 1401783891 S Ci:6:002:0 s c0 05 0c44 0000 0004 4 <
ffff000103558c00 1401784001 C Ci:6:002:0 0 4 = 12121212
ffff000103558c00 1401784047 S Co:6:002:0 s 40 05 0c44 0000 0004 4 = 1a181e1e
ffff000103558c00 1401784154 C Co:6:002:0 0 4 >
ffff000103558c00 1401784186 S Ci:6:002:0 s c0 05 0c48 0000 0004 4 <
ffff000103558c00 1401784296 C Ci:6:002:0 0 4 = 12121212
ffff000103558c00 1401784327 S Co:6:002:0 s 40 05 0c48 0000 0004 4 = 1e1e1e1e
ffff000103558c00 1401784445 C Co:6:002:0 0 4 >
ffff000103558c00 1401784475 S Ci:6:002:0 s c0 05 0c4c 0000 0004 4 <
ffff000103558c00 1401784585 C Ci:6:002:0 0 4 = 12121212
ffff000103558c00 1401784615 S Co:6:002:0 s 40 05 0c4c 0000 0004 4 = 1c1a1816
ffff000103558c00 1401784722 C Co:6:002:0 0 4 >
ffff000103558c00 1401784752 S Ci:6:002:0 s c0 05 0c54 0000 0004 4 <
ffff000103558c00 1401784862 C Ci:6:002:0 0 4 = 1c120800
ffff000103558c00 1401784892 S Co:6:002:0 s 40 05 0c54 0000 0004 4 = 120a0400
ffff000103558c00 1401784998 C Co:6:002:0 0 4 >
ffff000103558c00 1401785028 S Ci:6:002:0 s c0 05 0e20 0000 0004 4 <
ffff000103558c00 1401785138 C Ci:6:002:0 0 4 = 12121212
ffff000103558c00 1401785169 S Co:6:002:0 s 40 05 0e20 0000 0004 4 = 14141414
ffff000103558c00 1401785275 C Co:6:002:0 0 4 >
ffff000103558c00 1401785306 S Ci:6:002:0 s c0 05 0e24 0000 0004 4 <
ffff000103558c00 1401785415 C Ci:6:002:0 0 4 = 12121212
ffff000103558c00 1401785445 S Co:6:002:0 s 40 05 0e24 0000 0004 4 = 1d1d1d1d
ffff000103558c00 1401785562 C Co:6:002:0 0 4 >
ffff000103558c00 1401785593 S Ci:6:002:0 s c0 05 0e28 0000 0004 4 <
ffff000103558c00 1401785703 C Ci:6:002:0 0 4 = 12121212
ffff000103558c00 1401785733 S Co:6:002:0 s 40 05 0e28 0000 0004 4 = 1d1d1b19
ffff000103558c00 1401785839 C Co:6:002:0 0 4 >
ffff000103558c00 1401785870 S Ci:6:002:0 s c0 05 0e2c 0000 0004 4 <
ffff000103558c00 1401785980 C Ci:6:002:0 0 4 = 12121212
ffff000103558c00 1401786011 S Co:6:002:0 s 40 05 0e2c 0000 0004 4 = 1f1f1f1f
ffff000103558c00 1401786117 C Co:6:002:0 0 4 >
ffff000103558c00 1401786147 S Ci:6:002:0 s c0 05 0e30 0000 0004 4 <
ffff000103558c00 1401786257 C Ci:6:002:0 0 4 = 12121212
ffff000103558c00 1401786287 S Co:6:002:0 s 40 05 0e30 0000 0004 4 = 1f1f1d1b
ffff000103558c00 1401786394 C Co:6:002:0 0 4 >
ffff000103558c00 1401786425 S Ci:6:002:0 s c0 05 0e34 0000 0004 4 <
ffff000103558c00 1401786535 C Ci:6:002:0 0 4 = 12121212
ffff000103558c00 1401786565 S Co:6:002:0 s 40 05 0e34 0000 0004 4 = 1f1f1f1f
ffff000103558c00 1401786672 C Co:6:002:0 0 4 >
ffff000103558c00 1401786702 S Ci:6:002:0 s c0 05 0e38 0000 0004 4 <
ffff000103558c00 1401786824 C Ci:6:002:0 0 4 = 12121212
ffff000103558c00 1401786854 S Co:6:002:0 s 40 05 0e38 0000 0004 4 = 1f1d1b19
ffff000103558c00 1401786960 C Co:6:002:0 0 4 >
ffff000103558c00 1401786990 S Ci:6:002:0 s c0 05 0e3c 0000 0004 4 <
ffff000103558c00 1401787101 C Ci:6:002:0 0 4 = 12121212
ffff000103558c00 1401787131 S Co:6:002:0 s 40 05 0e3c 0000 0004 4 = 1f1f1f1f
ffff000103558c00 1401787238 C Co:6:002:0 0 4 >
ffff000103558c00 1401787268 S Ci:6:002:0 s c0 05 0e40 0000 0004 4 <
ffff000103558c00 1401787377 C Ci:6:002:0 0 4 = 12121212
ffff000103558c00 1401787409 S Co:6:002:0 s 40 05 0e40 0000 0004 4 = 1f1f1d1b
ffff000103558c00 1401787514 C Co:6:002:0 0 4 >
ffff000103558c00 1401787545 S Ci:6:002:0 s c0 05 0e44 0000 0004 4 <
ffff000103558c00 1401787655 C Ci:6:002:0 0 4 = 12121212
ffff000103558c00 1401787685 S Co:6:002:0 s 40 05 0e44 0000 0004 4 = 19171d1d
ffff000103558c00 1401787791 C Co:6:002:0 0 4 >
ffff000103558c00 1401787821 S Ci:6:002:0 s c0 05 0e48 0000 0004 4 <
ffff000103558c00 1401787946 C Ci:6:002:0 0 4 = 12121212
ffff000103558c00 1401787976 S Co:6:002:0 s 40 05 0e48 0000 0004 4 = 1d1d1d1d
ffff000103558c00 1401788085 C Co:6:002:0 0 4 >
ffff000103558c00 1401788116 S Ci:6:002:0 s c0 05 0e4c 0000 0004 4 <
ffff000103558c00 1401788234 C Ci:6:002:0 0 4 = 12121212
ffff000103558c00 1401788264 S Co:6:002:0 s 40 05 0e4c 0000 0004 4 = 1b191715
ffff000103558c00 1401788373 C Co:6:002:0 0 4 >
ffff000103558c00 1401788403 S Ci:6:002:0 s c0 05 0e54 0000 0004 4 <
ffff000103558c00 1401788514 C Ci:6:002:0 0 4 = 1c120800
ffff000103558c00 1401788545 S Co:6:002:0 s 40 05 0e54 0000 0004 4 = 11090300
ffff000103558c00 1401788651 C Co:6:002:0 0 4 >
ffff000103558c00 1401788692 S Ci:6:002:0 s c0 05 0454 0000 0001 1 <
ffff000103558c00 1401788818 C Ci:6:002:0 0 1 = 00
ffff000103558c00 1401788848 S Ci:6:002:0 s c0 05 0454 0000 0001 1 <
ffff000103558c00 1401788959 C Ci:6:002:0 0 1 = 00
ffff000103558c00 1401788989 S Co:6:002:0 s 40 05 0454 0000 0001 1 = 80
ffff000103558c00 1401789095 C Co:6:002:0 0 1 >
ffff000103558c00 1401789125 S Ci:6:002:0 s c0 05 041a 0000 0002 2 <
ffff000103558c00 1401789235 C Ci:6:002:0 0 2 = ff0f
ffff000103558c00 1401789265 S Ci:6:002:0 s c0 05 0808 0000 0004 4 <
ffff000103558c00 1401789376 C Ci:6:002:0 0 4 = 3382023e
ffff000103558c00 1401789406 S Co:6:002:0 s 40 05 0808 0000 0004 4 = 3382023e
ffff000103558c00 1401789512 C Co:6:002:0 0 4 >
ffff000103558c00 1401789544 S Ci:6:002:0 s c0 05 0834 0000 0004 4 <
ffff000103558c00 1401789654 C Ci:6:002:0 0 4 = 05a73700
ffff000103558c00 1401789684 S Co:6:002:0 s 40 05 0834 0000 0004 4 = 06a73700
ffff000103558c00 1401789790 C Co:6:002:0 0 4 >
ffff000103558c00 1401789820 S Ci:6:002:0 s c0 05 0830 0000 0004 4 <
ffff000103558c00 1401789945 C Ci:6:002:0 0 4 = b8eeaa2e
ffff000103558c00 1401789974 S Co:6:002:0 s 40 05 0830 0000 0004 4 = b8aeaa2e
ffff000103558c00 1401790081 C Co:6:002:0 0 4 >
ffff000103558c00 1401790111 S Ci:6:002:0 s c0 05 0830 0000 0004 4 <
ffff000103558c00 1401790222 C Ci:6:002:0 0 4 = b8aeaa2e
ffff000103558c00 1401790252 S Co:6:002:0 s 40 05 0830 0000 0004 4 = b8aeaa2e
ffff000103558c00 1401790358 C Co:6:002:0 0 4 >
ffff000103558c00 1401790389 S Ci:6:002:0 s c0 05 082c 0000 0004 4 <
ffff000103558c00 1401790499 C Ci:6:002:0 0 4 = dc832000
ffff000103558c00 1401790530 S Co:6:002:0 s 40 05 082c 0000 0004 4 = dd832000
ffff000103558c00 1401790635 C Co:6:002:0 0 4 >
ffff000103558c00 1401790667 S Co:6:002:0 s 40 05 0cb0 0000 0004 4 = 17773354
ffff000103558c00 1401790772 C Co:6:002:0 0 4 >
ffff000103558c00 1401790802 S Co:6:002:0 s 40 05 0eb0 0000 0004 4 = 17773354
ffff000103558c00 1401790908 C Co:6:002:0 0 4 >
ffff000103558c00 1401790938 S Ci:6:002:0 s c0 05 0cb4 0000 0004 4 <
ffff000103558c00 1401791049 C Ci:6:002:0 0 4 = 77000001
ffff000103558c00 1401791079 S Co:6:002:0 s 40 05 0cb4 0000 0004 4 = 77000001
ffff000103558c00 1401791194 C Co:6:002:0 0 4 >
ffff000103558c00 1401791225 S Ci:6:002:0 s c0 05 0eb4 0000 0004 4 <
ffff000103558c00 1401791335 C Ci:6:002:0 0 4 = 77000001
ffff000103558c00 1401791365 S Co:6:002:0 s 40 05 0eb4 0000 0004 4 = 77000001
ffff000103558c00 1401791471 C Co:6:002:0 0 4 >
ffff000103558c00 1401791501 S Ci:6:002:0 s c0 05 0900 0000 0004 4 <
ffff000103558c00 1401791612 C Ci:6:002:0 0 4 = 01040000
ffff000103558c00 1401791643 S Co:6:002:0 s 40 05 0900 0000 0004 4 = 01040000
ffff000103558c00 1401791748 C Co:6:002:0 0 4 >
ffff000103558c00 1401791779 S Ci:6:002:0 s c0 05 080c 0000 0004 4 <
ffff000103558c00 1401791890 C Ci:6:002:0 0 4 = 13111312
ffff000103558c00 1401791920 S Co:6:002:0 s 40 05 080c 0000 0004 4 = 03111312
ffff000103558c00 1401792029 C Co:6:002:0 0 4 >
ffff000103558c00 1401792061 S Ci:6:002:0 s c0 05 0a04 0000 0004 4 <
ffff000103558c00 1401792175 C Ci:6:002:0 0 4 = 0c00ff01
ffff000103558c00 1401792205 S Co:6:002:0 s 40 05 0a04 0000 0004 4 = 0c00ff0f
ffff000103558c00 1401792319 C Co:6:002:0 0 4 >
ffff000103558c00 1401792349 S Ci:6:002:0 s c0 05 0440 0000 0004 4 <
ffff000103558c00 1401792461 C Ci:6:002:0 0 4 = 5f010000
ffff000103558c00 1401792491 S Co:6:002:0 s 40 05 0440 0000 0004 4 = 50010000
ffff000103558c00 1401792597 C Co:6:002:0 0 4 >
ffff000103558c00 1401792627 S Ci:6:002:0 s c0 05 0c1c 0000 0004 4 <
ffff000103558c00 1401792739 C Ci:6:002:0 0 4 = 03000040
ffff000103558c00 1401792770 S Co:6:002:0 s 40 05 0c1c 0000 0004 4 = 0300402d
ffff000103558c00 1401792876 C Co:6:002:0 0 4 >
ffff000103558c00 1401792906 S Ci:6:002:0 s c0 05 0e1c 0000 0004 4 <
ffff000103558c00 1401793018 C Ci:6:002:0 0 4 = 03000040
ffff000103558c00 1401793048 S Co:6:002:0 s 40 05 0e1c 0000 0004 4 = 0300402d
ffff000103558c00 1401793154 C Co:6:002:0 0 4 >
ffff000103558c00 1401793185 S Ci:6:002:0 s c0 05 0860 0000 0004 4 <
ffff000103558c00 1401793295 C Ci:6:002:0 0 4 = 21c3d572
ffff000103558c00 1401793325 S Co:6:002:0 s 40 05 0860 0000 0004 4 = 21c32969
ffff000103558c00 1401793445 C Co:6:002:0 0 4 >
ffff000103558c00 1401793475 S Ci:6:002:0 s c0 05 0c00 0000 0004 4 <
ffff000103558c00 1401793586 C Ci:6:002:0 0 4 = 07000000
ffff000103558c00 1401793616 S Ci:6:002:0 s c0 05 08b0 0000 0004 4 <
ffff000103558c00 1401793727 C Ci:6:002:0 0 4 = 18060000
ffff000103558c00 1401793757 S Co:6:002:0 s 40 05 08b0 0000 0004 4 = 18060000
ffff000103558c00 1401793863 C Co:6:002:0 0 4 >
ffff000103558c00 1401793914 S Ci:6:002:0 s c0 05 0d04 0000 0004 4 <
ffff000103558c00 1401794023 C Ci:6:002:0 0 4 = 017c90b1
ffff000103558c00 1401794053 S Co:6:002:0 s 40 05 0c90 0000 0004 4 = 017d8101
ffff000103558c00 1401794159 C Co:6:002:0 0 4 >
ffff000103558c00 1401794203 S Ci:6:002:0 s c0 05 08ac 0000 0004 4 <
ffff000103558c00 1401794325 C Ci:6:002:0 0 4 = 08faf00f
ffff000103558c00 1401794355 S Co:6:002:0 s 40 05 08ac 0000 0004 4 = 08faf00f
ffff000103558c00 1401794461 C Co:6:002:0 0 4 >
ffff000103558c00 1401794491 S Ci:6:002:0 s c0 05 08ac 0000 0004 4 <
ffff000103558c00 1401794602 C Ci:6:002:0 0 4 = 08faf00f
ffff000103558c00 1401794632 S Co:6:002:0 s 40 05 08ac 0000 0004 4 = 08faf00f
ffff000103558c00 1401794739 C Co:6:002:0 0 4 >
ffff000103558c00 1401794770 S Ci:6:002:0 s c0 05 08c4 0000 0004 4 <
ffff000103558c00 1401794880 C Ci:6:002:0 0 4 = 00000000
ffff000103558c00 1401794912 S Co:6:002:0 s 40 05 08c4 0000 0004 4 = 00000000
ffff000103558c00 1401795017 C Co:6:002:0 0 4 >
ffff000103558c00 1401795047 S Ci:6:002:0 s c0 05 0c00 0000 0004 4 <
ffff000103558c00 1401795158 C Ci:6:002:0 0 4 = 07000000
ffff000103558c00 1401795188 S Ci:6:002:0 s c0 05 08b0 0000 0004 4 <
ffff000103558c00 1401795300 C Ci:6:002:0 0 4 = 18060000
ffff000103558c00 1401795329 S Co:6:002:0 s 40 05 08b0 0000 0004 4 = 18060000
ffff000103558c00 1401795444 C Co:6:002:0 0 4 >
ffff000103558c00 1401795494 S Ci:6:002:0 s c0 05 0d04 0000 0004 4 <
ffff000103558c00 1401795602 C Ci:6:002:0 0 4 = 017d91b1
ffff000103558c00 1401795632 S Co:6:002:0 s 40 05 0c90 0000 0004 4 = 247d8101
ffff000103558c00 1401795738 C Co:6:002:0 0 4 >
ffff000103558c00 1401795781 S Ci:6:002:0 s c0 05 0e00 0000 0004 4 <
ffff000103558c00 1401795889 C Ci:6:002:0 0 4 = 07000000
ffff000103558c00 1401795921 S Ci:6:002:0 s c0 05 08b0 0000 0004 4 <
ffff000103558c00 1401796034 C Ci:6:002:0 0 4 = 18060000
ffff000103558c00 1401796064 S Co:6:002:0 s 40 05 08b0 0000 0004 4 = 18060000
ffff000103558c00 1401796171 C Co:6:002:0 0 4 >
ffff000103558c00 1401796222 S Ci:6:002:0 s c0 05 0d44 0000 0004 4 <
ffff000103558c00 1401796331 C Ci:6:002:0 0 4 = 017c90b1
ffff000103558c00 1401796361 S Co:6:002:0 s 40 05 0e90 0000 0004 4 = 017d8101
ffff000103558c00 1401796467 C Co:6:002:0 0 4 >
ffff000103558c00 1401796511 S Ci:6:002:0 s c0 05 08ac 0000 0004 4 <
ffff000103558c00 1401796620 C Ci:6:002:0 0 4 = 08faf00f
ffff000103558c00 1401796649 S Co:6:002:0 s 40 05 08ac 0000 0004 4 = 08faf00f
ffff000103558c00 1401796756 C Co:6:002:0 0 4 >
ffff000103558c00 1401796786 S Ci:6:002:0 s c0 05 08ac 0000 0004 4 <
ffff000103558c00 1401796897 C Ci:6:002:0 0 4 = 08faf00f
ffff000103558c00 1401796927 S Co:6:002:0 s 40 05 08ac 0000 0004 4 = 08faf00f
ffff000103558c00 1401797034 C Co:6:002:0 0 4 >
ffff000103558c00 1401797065 S Ci:6:002:0 s c0 05 08c4 0000 0004 4 <
ffff000103558c00 1401797176 C Ci:6:002:0 0 4 = 00000000
ffff000103558c00 1401797206 S Co:6:002:0 s 40 05 08c4 0000 0004 4 = 00000000
ffff000103558c00 1401797320 C Co:6:002:0 0 4 >
ffff000103558c00 1401797351 S Ci:6:002:0 s c0 05 0e00 0000 0004 4 <
ffff000103558c00 1401797460 C Ci:6:002:0 0 4 = 07000000
ffff000103558c00 1401797489 S Ci:6:002:0 s c0 05 08b0 0000 0004 4 <
ffff000103558c00 1401797599 C Ci:6:002:0 0 4 = 18060000
ffff000103558c00 1401797628 S Co:6:002:0 s 40 05 08b0 0000 0004 4 = 18060000
ffff000103558c00 1401797735 C Co:6:002:0 0 4 >
ffff000103558c00 1401797785 S Ci:6:002:0 s c0 05 0d44 0000 0004 4 <
ffff000103558c00 1401797891 C Ci:6:002:0 0 4 = 017d91b1
ffff000103558c00 1401797920 S Co:6:002:0 s 40 05 0e90 0000 0004 4 = 247d8101
ffff000103558c00 1401798027 C Co:6:002:0 0 4 >
ffff000103558c00 1401798071 S Ci:6:002:0 s c0 05 0668 0000 0002 2 <
ffff000103558c00 1401798193 C Ci:6:002:0 0 2 = 0010
ffff000103558c00 1401798223 S Co:6:002:0 s 40 05 0668 0000 0002 2 = 0010
ffff000103558c00 1401798329 C Co:6:002:0 0 2 >
ffff000103558c00 1401798360 S Co:6:002:0 s 40 05 0483 0000 0001 1 = 00
ffff000103558c00 1401798466 C Co:6:002:0 0 1 >
ffff000103558c00 1401798496 S Ci:6:002:0 s c0 05 0837 0000 0001 1 <
ffff000103558c00 1401798605 C Ci:6:002:0 0 1 = 00
ffff000103558c00 1401798635 S Ci:6:002:0 s c0 05 08ac 0000 0004 4 <
ffff000103558c00 1401798746 C Ci:6:002:0 0 4 = 08faf00f
ffff000103558c00 1401798775 S Co:6:002:0 s 40 05 08ac 0000 0004 4 = 08faf00f
ffff000103558c00 1401798882 C Co:6:002:0 0 4 >
ffff000103558c00 1401798912 S Ci:6:002:0 s c0 05 08c4 0000 0004 4 <
ffff000103558c00 1401799021 C Ci:6:002:0 0 4 = 00000000
ffff000103558c00 1401799051 S Co:6:002:0 s 40 05 08c4 0000 0004 4 = 00000000
ffff000103558c00 1401799158 C Co:6:002:0 0 4 >
ffff000103558c00 1401799189 S Ci:6:002:0 s c0 05 0848 0000 0004 4 <
ffff000103558c00 1401799297 C Ci:6:002:0 0 4 = 8bffd061
ffff000103558c00 1401799328 S Co:6:002:0 s 40 05 0848 0000 0004 4 = 8bffd061
ffff000103558c00 1401799444 C Co:6:002:0 0 4 >
ffff000103558c00 1401799474 S Ci:6:002:0 s c0 05 08ac 0000 0004 4 <
ffff000103558c00 1401799584 C Ci:6:002:0 0 4 = 08faf00f
ffff000103558c00 1401799614 S Co:6:002:0 s 40 05 08ac 0000 0004 4 = 08faf00f
ffff000103558c00 1401799720 C Co:6:002:0 0 4 >
ffff000103558c00 1401799750 S Ci:6:002:0 s c0 05 08ac 0000 0004 4 <
ffff000103558c00 1401799860 C Ci:6:002:0 0 4 = 08faf00f
ffff000103558c00 1401799890 S Co:6:002:0 s 40 05 08ac 0000 0004 4 = 08faf00f
ffff000103558c00 1401799996 C Co:6:002:0 0 4 >
ffff000103558c00 1401800036 S Ci:6:002:0 s c0 05 08c4 0000 0004 4 <
ffff000103558c00 1401800146 C Ci:6:002:0 0 4 = 00000000
ffff000103558c00 1401800182 S Co:6:002:0 s 40 05 08c4 0000 0004 4 = 00000000
ffff000103558c00 1401800283 C Co:6:002:0 0 4 >
ffff000103558c00 1401800314 S Ci:6:002:0 s c0 05 0c00 0000 0004 4 <
ffff000103558c00 1401800423 C Ci:6:002:0 0 4 = 07000000
ffff000103558c00 1401800453 S Ci:6:002:0 s c0 05 08b0 0000 0004 4 <
ffff000103558c00 1401800572 C Ci:6:002:0 0 4 = 18060000
ffff000103558c00 1401800603 S Co:6:002:0 s 40 05 08b0 0000 0004 4 = 18060000
ffff000103558c00 1401800710 C Co:6:002:0 0 4 >
ffff000103558c00 1401800759 S Ci:6:002:0 s c0 05 0d04 0000 0004 4 <
ffff000103558c00 1401800865 C Ci:6:002:0 0 4 = 247d91b1
ffff000103558c00 1401800895 S Co:6:002:0 s 40 05 0c90 0000 0004 4 = 247d8101
ffff000103558c00 1401801002 C Co:6:002:0 0 4 >
ffff000103558c00 1401801045 S Ci:6:002:0 s c0 05 0e00 0000 0004 4 <
ffff000103558c00 1401801151 C Ci:6:002:0 0 4 = 07000000
ffff000103558c00 1401801180 S Ci:6:002:0 s c0 05 08b0 0000 0004 4 <
ffff000103558c00 1401801290 C Ci:6:002:0 0 4 = 18060000
ffff000103558c00 1401801321 S Co:6:002:0 s 40 05 08b0 0000 0004 4 = 18060000
ffff000103558c00 1401801440 C Co:6:002:0 0 4 >
ffff000103558c00 1401801490 S Ci:6:002:0 s c0 05 0d44 0000 0004 4 <
ffff000103558c00 1401801597 C Ci:6:002:0 0 4 = 247d91b1
ffff000103558c00 1401801626 S Co:6:002:0 s 40 05 0e90 0000 0004 4 = 247d8101
ffff000103558c00 1401801733 C Co:6:002:0 0 4 >
ffff000103558c00 1401801777 S Ci:6:002:0 s c0 05 0073 0000 0001 1 <
ffff000103558c00 1401801883 C Ci:6:002:0 0 1 = 07
ffff000103558c00 1401801913 S Co:6:002:0 s 40 05 0073 0000 0001 1 = 07
ffff000103558c00 1401802020 C Co:6:002:0 0 1 >
ffff000103558c00 1401802067 S Ci:6:002:0 s c0 05 0c24 0000 0004 4 <
ffff000103558c00 1401802191 C Ci:6:002:0 0 4 = 20202020
ffff000103558c00 1401802221 S Co:6:002:0 s 40 05 0c24 0000 0004 4 = 27272727
ffff000103558c00 1401802328 C Co:6:002:0 0 4 >
ffff000103558c00 1401802359 S Ci:6:002:0 s c0 05 0c28 0000 0004 4 <
ffff000103558c00 1401802468 C Ci:6:002:0 0 4 = 20201e1c
ffff000103558c00 1401802498 S Co:6:002:0 s 40 05 0c28 0000 0004 4 = 27272725
ffff000103558c00 1401802604 C Co:6:002:0 0 4 >
ffff000103558c00 1401802635 S Ci:6:002:0 s c0 05 0c2c 0000 0004 4 <
ffff000103558c00 1401802744 C Ci:6:002:0 0 4 = 20202020
ffff000103558c00 1401802774 S Co:6:002:0 s 40 05 0c2c 0000 0004 4 = 2c2c2c2c
ffff000103558c00 1401802881 C Co:6:002:0 0 4 >
ffff000103558c00 1401802911 S Ci:6:002:0 s c0 05 0c30 0000 0004 4 <
ffff000103558c00 1401803021 C Ci:6:002:0 0 4 = 20201e1c
ffff000103558c00 1401803051 S Co:6:002:0 s 40 05 0c30 0000 0004 4 = 2c2a2826
ffff000103558c00 1401803157 C Co:6:002:0 0 4 >
ffff000103558c00 1401803187 S Ci:6:002:0 s c0 05 0c34 0000 0004 4 <
ffff000103558c00 1401803297 C Ci:6:002:0 0 4 = 20202020
ffff000103558c00 1401803327 S Co:6:002:0 s 40 05 0c34 0000 0004 4 = 28282828
ffff000103558c00 1401803444 C Co:6:002:0 0 4 >
ffff000103558c00 1401803475 S Ci:6:002:0 s c0 05 0c38 0000 0004 4 <
ffff000103558c00 1401803585 C Ci:6:002:0 0 4 = 201e1c1a
ffff000103558c00 1401803615 S Co:6:002:0 s 40 05 0c38 0000 0004 4 = 28282624
ffff000103558c00 1401803722 C Co:6:002:0 0 4 >
ffff000103558c00 1401803752 S Ci:6:002:0 s c0 05 0c3c 0000 0004 4 <
ffff000103558c00 1401803862 C Ci:6:002:0 0 4 = 20202020
ffff000103558c00 1401803892 S Co:6:002:0 s 40 05 0c3c 0000 0004 4 = 2c2c2c2c
ffff000103558c00 1401803998 C Co:6:002:0 0 4 >
ffff000103558c00 1401804029 S Ci:6:002:0 s c0 05 0c40 0000 0004 4 <
ffff000103558c00 1401804144 C Ci:6:002:0 0 4 = 20201e1c
ffff000103558c00 1401804174 S Co:6:002:0 s 40 05 0c40 0000 0004 4 = 2c2a2826
ffff000103558c00 1401804280 C Co:6:002:0 0 4 >
ffff000103558c00 1401804310 S Ci:6:002:0 s c0 05 0c44 0000 0004 4 <
ffff000103558c00 1401804421 C Ci:6:002:0 0 4 = 1a181e1e
ffff000103558c00 1401804452 S Co:6:002:0 s 40 05 0c44 0000 0004 4 = 24242828
ffff000103558c00 1401804569 C Co:6:002:0 0 4 >
ffff000103558c00 1401804599 S Ci:6:002:0 s c0 05 0c48 0000 0004 4 <
ffff000103558c00 1401804710 C Ci:6:002:0 0 4 = 1e1e1e1e
ffff000103558c00 1401804740 S Co:6:002:0 s 40 05 0c48 0000 0004 4 = 28282828
ffff000103558c00 1401804846 C Co:6:002:0 0 4 >
ffff000103558c00 1401804876 S Ci:6:002:0 s c0 05 0c4c 0000 0004 4 <
ffff000103558c00 1401804986 C Ci:6:002:0 0 4 = 1c1a1816
ffff000103558c00 1401805016 S Co:6:002:0 s 40 05 0c4c 0000 0004 4 = 26242222
ffff000103558c00 1401805122 C Co:6:002:0 0 4 >
ffff000103558c00 1401805152 S Ci:6:002:0 s c0 05 0c54 0000 0004 4 <
ffff000103558c00 1401805262 C Ci:6:002:0 0 4 = 120a0400
ffff000103558c00 1401805292 S Co:6:002:0 s 40 05 0c54 0000 0004 4 = 1c140e00
ffff000103558c00 1401805399 C Co:6:002:0 0 4 >
ffff000103558c00 1401805429 S Ci:6:002:0 s c0 05 0e24 0000 0004 4 <
ffff000103558c00 1401805539 C Ci:6:002:0 0 4 = 1d1d1d1d
ffff000103558c00 1401805570 S Co:6:002:0 s 40 05 0e24 0000 0004 4 = 23232323
ffff000103558c00 1401805687 C Co:6:002:0 0 4 >
ffff000103558c00 1401805717 S Ci:6:002:0 s c0 05 0e28 0000 0004 4 <
ffff000103558c00 1401805829 C Ci:6:002:0 0 4 = 1d1d1b19
ffff000103558c00 1401805859 S Co:6:002:0 s 40 05 0e28 0000 0004 4 = 23232321
ffff000103558c00 1401805965 C Co:6:002:0 0 4 >
ffff000103558c00 1401805995 S Ci:6:002:0 s c0 05 0e2c 0000 0004 4 <
ffff000103558c00 1401806106 C Ci:6:002:0 0 4 = 1f1f1f1f
ffff000103558c00 1401806136 S Co:6:002:0 s 40 05 0e2c 0000 0004 4 = 28282828
ffff000103558c00 1401806242 C Co:6:002:0 0 4 >
ffff000103558c00 1401806272 S Ci:6:002:0 s c0 05 0e30 0000 0004 4 <
ffff000103558c00 1401806383 C Ci:6:002:0 0 4 = 1f1f1d1b
ffff000103558c00 1401806413 S Co:6:002:0 s 40 05 0e30 0000 0004 4 = 28262422
ffff000103558c00 1401806519 C Co:6:002:0 0 4 >
ffff000103558c00 1401806549 S Ci:6:002:0 s c0 05 0e34 0000 0004 4 <
ffff000103558c00 1401806660 C Ci:6:002:0 0 4 = 1f1f1f1f
ffff000103558c00 1401806691 S Co:6:002:0 s 40 05 0e34 0000 0004 4 = 24242424
ffff000103558c00 1401806797 C Co:6:002:0 0 4 >
ffff000103558c00 1401806827 S Ci:6:002:0 s c0 05 0e38 0000 0004 4 <
ffff000103558c00 1401806948 C Ci:6:002:0 0 4 = 1f1d1b19
ffff000103558c00 1401806978 S Co:6:002:0 s 40 05 0e38 0000 0004 4 = 24242220
ffff000103558c00 1401807084 C Co:6:002:0 0 4 >
ffff000103558c00 1401807115 S Ci:6:002:0 s c0 05 0e3c 0000 0004 4 <
ffff000103558c00 1401807225 C Ci:6:002:0 0 4 = 1f1f1f1f
ffff000103558c00 1401807255 S Co:6:002:0 s 40 05 0e3c 0000 0004 4 = 28282828
ffff000103558c00 1401807361 C Co:6:002:0 0 4 >
ffff000103558c00 1401807391 S Ci:6:002:0 s c0 05 0e40 0000 0004 4 <
ffff000103558c00 1401807501 C Ci:6:002:0 0 4 = 1f1f1d1b
ffff000103558c00 1401807531 S Co:6:002:0 s 40 05 0e40 0000 0004 4 = 28262422
ffff000103558c00 1401807638 C Co:6:002:0 0 4 >
ffff000103558c00 1401807669 S Ci:6:002:0 s c0 05 0e44 0000 0004 4 <
ffff000103558c00 1401807779 C Ci:6:002:0 0 4 = 19171d1d
ffff000103558c00 1401807809 S Co:6:002:0 s 40 05 0e44 0000 0004 4 = 20202424
ffff000103558c00 1401807915 C Co:6:002:0 0 4 >
ffff000103558c00 1401807945 S Ci:6:002:0 s c0 05 0e48 0000 0004 4 <
ffff000103558c00 1401808072 C Ci:6:002:0 0 4 = 1d1d1d1d
ffff000103558c00 1401808103 S Co:6:002:0 s 40 05 0e48 0000 0004 4 = 24242424
ffff000103558c00 1401808214 C Co:6:002:0 0 4 >
ffff000103558c00 1401808244 S Ci:6:002:0 s c0 05 0e4c 0000 0004 4 <
ffff000103558c00 1401808355 C Ci:6:002:0 0 4 = 1b191715
ffff000103558c00 1401808385 S Co:6:002:0 s 40 05 0e4c 0000 0004 4 = 22201e1e
ffff000103558c00 1401808491 C Co:6:002:0 0 4 >
ffff000103558c00 1401808521 S Ci:6:002:0 s c0 05 0e54 0000 0004 4 <
ffff000103558c00 1401808632 C Ci:6:002:0 0 4 = 11090300
ffff000103558c00 1401808662 S Co:6:002:0 s 40 05 0e54 0000 0004 4 = 18100a00
ffff000103558c00 1401808768 C Co:6:002:0 0 4 >
ffff000103558180 1401940256 S Ci:6:002:0 s c0 05 004c 0000 0001 1 <
ffff000103558180 1401940412 C Ci:6:002:0 0 1 = 28
ffff000103558180 1401940552 S Co:6:002:0 s 40 05 004c 0000 0001 1 = 20
ffff000103558180 1401940670 C Co:6:002:0 0 1 >
ffff000103558180 1402112271 S Ci:6:002:0 s c0 05 004c 0000 0001 1 <
ffff000103558180 1402112411 C Ci:6:002:0 0 1 = 20
ffff000103558180 1402112577 S Co:6:002:0 s 40 05 004c 0000 0001 1 = 28
ffff000103558180 1402112703 C Co:6:002:0 0 1 >
ffff000103558180 1402284194 S Ci:6:002:0 s c0 05 004c 0000 0001 1 <
ffff000103558180 1402284329 C Ci:6:002:0 0 1 = 28
ffff000103558180 1402284537 S Co:6:002:0 s 40 05 004c 0000 0001 1 = 20
ffff000103558180 1402284693 C Co:6:002:0 0 1 >
ffff000103558180 1402456187 S Ci:6:002:0 s c0 05 004c 0000 0001 1 <
ffff000103558180 1402456289 C Ci:6:002:0 0 1 = 20
ffff000103558180 1402456475 S Co:6:002:0 s 40 05 004c 0000 0001 1 = 28
ffff000103558180 1402456633 C Co:6:002:0 0 1 >
ffff000103558c00 1402628207 S Ci:6:002:0 s c0 05 004c 0000 0001 1 <
ffff000103558c00 1402628345 C Ci:6:002:0 0 1 = 28
ffff000103558c00 1402628506 S Co:6:002:0 s 40 05 004c 0000 0001 1 = 20
ffff000103558c00 1402628638 C Co:6:002:0 0 1 >
ffff000103558c00 1402748182 S Ci:6:002:0 s c0 05 004c 0000 0001 1 <
ffff000103558c00 1402748278 C Ci:6:002:0 0 1 = 20
ffff000103558c00 1402748412 S Co:6:002:0 s 40 05 004c 0000 0001 1 = 20
ffff000103558c00 1402748529 C Co:6:002:0 0 1 >
ffff000103558c00 1402844272 S Ci:6:002:0 s c0 05 0770 0000 0004 4 <
ffff000103558c00 1402844352 C Ci:6:002:0 0 4 = 00000000
ffff000103558c00 1402844495 S Ci:6:002:0 s c0 05 0774 0000 0004 4 <
ffff000103558c00 1402844630 C Ci:6:002:0 0 4 = 00000000
ffff000103558c00 1402844788 S Co:6:002:0 s 40 05 076e 0000 0001 1 = 0c
ffff000103558c00 1402844934 C Co:6:002:0 0 1 >
ffff000103558c00 1402845102 S Ci:6:002:0 s c0 05 0808 0000 0004 4 <
ffff000103558c00 1402845251 C Ci:6:002:0 0 4 = 3382023e
ffff000103558c00 1402845414 S Ci:6:002:0 s c0 05 0a5c 0000 0002 2 <
ffff000103558c00 1402845566 C Ci:6:002:0 0 2 = 0000
ffff000103558c00 1402845725 S Ci:6:002:0 s c0 05 0f48 0000 0002 2 <
ffff000103558c00 1402845871 C Ci:6:002:0 0 2 = 5581
ffff000103558c00 1402846036 S Ci:6:002:0 s c0 05 0f04 0000 0004 4 <
ffff000103558c00 1402846172 C Ci:6:002:0 0 4 = 3a1a7903
ffff000103558c00 1402846199 S Ci:6:002:0 s c0 05 0f14 0000 0004 4 <
ffff000103558c00 1402846315 C Ci:6:002:0 0 4 = ff3f6b17
ffff000103558c00 1402846345 S Ci:6:002:0 s c0 05 0f10 0000 0004 4 <
ffff000103558c00 1402846455 C Ci:6:002:0 0 4 = 00007904
ffff000103558c00 1402846485 S Ci:6:002:0 s c0 05 0f0c 0000 0004 4 <
ffff000103558c00 1402846596 C Ci:6:002:0 0 4 = 00000000
ffff000103558c00 1402846625 S Ci:6:002:0 s c0 05 0f08 0000 0004 4 <
ffff000103558c00 1402846742 C Ci:6:002:0 0 4 = ffffffff
ffff000103558c00 1402846762 S Ci:6:002:0 s c0 05 0fcc 0000 0004 4 <
ffff000103558c00 1402846873 C Ci:6:002:0 0 4 = 00000000
ffff000103558c00 1402846903 S Ci:6:002:0 s c0 05 09a4 0000 0004 4 <
ffff000103558c00 1402847019 C Ci:6:002:0 0 4 = 80000800
ffff000103558c00 1402847041 S Co:6:002:0 s 40 05 09a4 0000 0004 4 = 80000a00
ffff000103558c00 1402847148 C Co:6:002:0 0 4 >
ffff000103558c00 1402847176 S Ci:6:002:0 s c0 05 09a4 0000 0004 4 <
ffff000103558c00 1402847296 C Ci:6:002:0 0 4 = 80000a00
ffff000103558c00 1402847316 S Co:6:002:0 s 40 05 09a4 0000 0004 4 = 80000800
ffff000103558c00 1402847424 C Co:6:002:0 0 4 >
ffff000103558c00 1402847453 S Ci:6:002:0 s c0 05 0a2c 0000 0004 4 <
ffff000103558c00 1402847565 C Ci:6:002:0 0 4 = 00009000
ffff000103558c00 1402847585 S Co:6:002:0 s 40 05 0a2c 0000 0004 4 = 00009000
ffff000103558c00 1402847693 C Co:6:002:0 0 4 >
ffff000103558c00 1402847722 S Ci:6:002:0 s c0 05 0a2c 0000 0004 4 <
ffff000103558c00 1402847839 C Ci:6:002:0 0 4 = 00009000
ffff000103558c00 1402847860 S Co:6:002:0 s 40 05 0a2c 0000 0004 4 = 00809000
ffff000103558c00 1402847968 C Co:6:002:0 0 4 >
ffff000103558c00 1402847997 S Ci:6:002:0 s c0 05 0b58 0000 0004 4 <
ffff000103558c00 1402848112 C Ci:6:002:0 0 4 = 00000000
ffff000103558c00 1402848140 S Co:6:002:0 s 40 05 0b58 0000 0004 4 = 01000000
ffff000103558c00 1402848177 C Co:6:002:0 0 4 >
ffff000103558c00 1402848193 S Ci:6:002:0 s c0 05 0b58 0000 0004 4 <
ffff000103558c00 1402848302 C Ci:6:002:0 0 4 = 01000000
ffff000103558c00 1402848331 S Co:6:002:0 s 40 05 0b58 0000 0004 4 = 00000000
ffff000103558c00 1402848367 C Co:6:002:0 0 4 >
ffff000103558c00 1402848385 S Ci:6:002:0 s c0 05 0c50 0000 0004 4 <
ffff000103558c00 1402848491 C Ci:6:002:0 0 4 = 20000000
ffff000103558c00 1402848520 S Co:6:002:0 s 40 05 0c50 0000 0004 4 = 22000000
ffff000103558c00 1402848556 C Co:6:002:0 0 4 >
ffff000103558c00 1402848572 S Ci:6:002:0 s c0 05 0e50 0000 0004 4 <
ffff000103558c00 1402848683 C Ci:6:002:0 0 4 = 20000000
ffff000103558c00 1402848712 S Co:6:002:0 s 40 05 0e50 0000 0004 4 = 22000000
ffff000103558c00 1402848821 C Co:6:002:0 0 4 >
ffff000103558c00 1402848851 S Ci:6:002:0 s c0 05 01cc 0000 0001 1 <
ffff000103558c00 1402848963 C Ci:6:002:0 0 1 = 00
ffff000103558c00 1402848983 S Co:6:002:0 s 40 05 01f0 0000 0004 4 = 00000000
ffff000103558c00 1402849091 C Co:6:002:0 0 4 >
ffff000103558c00 1402849120 S Co:6:002:0 s 40 05 01d0 0000 0004 4 = 58000000
ffff000103558c00 1402849229 C Co:6:002:0 0 4 >
ffff000103558c00 1402849251 S Co:6:002:0 s 40 05 0440 0000 0004 4 = 00000000
ffff000103558c00 1402849357 C Co:6:002:0 0 4 >
ffff000103558c00 1402849388 S Ci:6:002:0 s c0 05 0c00 0000 0004 4 <
ffff000103558c00 1402849504 C Ci:6:002:0 0 4 = 07000000
ffff000103558c00 1402849525 S Ci:6:002:0 s c0 05 08b0 0000 0004 4 <
ffff000103558c00 1402849637 C Ci:6:002:0 0 4 = 18060000
ffff000103558c00 1402849665 S Co:6:002:0 s 40 05 08b0 0000 0004 4 = 42060000
ffff000103558c00 1402849780 C Co:6:002:0 0 4 >
ffff000103558c00 1402849820 S Ci:6:002:0 s c0 05 0d04 0000 0004 4 <
ffff000103558c00 1402849932 C Ci:6:002:0 0 4 = f07890b1
ffff000103558c00 1402849953 S Co:6:002:0 s 40 05 0c90 0000 0004 4 = f0782304
ffff000103558c00 1402850061 C Co:6:002:0 0 4 >
ffff000103558c00 1402850103 S Co:6:002:0 s 40 05 0280 0000 0002 2 = 0001
ffff000103558c00 1402850203 C Co:6:002:0 0 2 >
ffff000103558c00 1402850224 S Ci:6:002:0 s c0 05 010c 0000 0001 1 <
ffff000103558c00 1402850335 C Ci:6:002:0 0 1 = b0
ffff000103558c00 1402850364 S Co:6:002:0 s 40 05 010c 0000 0001 1 = b4
ffff000103558c00 1402850471 C Co:6:002:0 0 1 >
ffff000103558c00 1403772301 S Ci:6:002:0 s c0 05 004c 0000 0001 1 <
ffff000103558c00 1403772444 C Ci:6:002:0 0 1 = 20
ffff000103558c00 1403772611 S Co:6:002:0 s 40 05 004c 0000 0001 1 = 20
ffff000103558c00 1403772749 C Co:6:002:0 0 1 >
ffff000103558180 1404732296 S Ci:6:002:0 s c0 05 0770 0000 0004 4 <
ffff000103558180 1404732377 C Ci:6:002:0 0 4 = 00000000
ffff000103558180 1404732403 S Ci:6:002:0 s c0 05 0774 0000 0004 4 <
ffff000103558180 1404732516 C Ci:6:002:0 0 4 = 00000000
ffff000103558180 1404732655 S Co:6:002:0 s 40 05 076e 0000 0001 1 = 0c
ffff000103558180 1404732774 C Co:6:002:0 0 1 >
ffff000103558180 1404732982 S Ci:6:002:0 s c0 05 0808 0000 0004 4 <
ffff000103558180 1404733146 C Ci:6:002:0 0 4 = 3382023e
ffff000103558180 1404733309 S Ci:6:002:0 s c0 05 0a5c 0000 0002 2 <
ffff000103558180 1404733435 C Ci:6:002:0 0 2 = 0000
ffff000103558180 1404733637 S Ci:6:002:0 s c0 05 0f48 0000 0002 2 <
ffff000103558180 1404733802 C Ci:6:002:0 0 2 = 2171
ffff000103558180 1404733964 S Ci:6:002:0 s c0 05 0f04 0000 0004 4 <
ffff000103558180 1404734089 C Ci:6:002:0 0 4 = 00000000
ffff000103558180 1404734290 S Ci:6:002:0 s c0 05 0f14 0000 0004 4 <
ffff000103558180 1404734454 C Ci:6:002:0 0 4 = 75064f09
ffff000103558180 1404734617 S Ci:6:002:0 s c0 05 0f10 0000 0004 4 <
ffff000103558180 1404734741 C Ci:6:002:0 0 4 = 00000000
ffff000103558180 1404734943 S Ci:6:002:0 s c0 05 0f0c 0000 0004 4 <
ffff000103558180 1404735073 C Ci:6:002:0 0 4 = 00000000
ffff000103558180 1404735121 S Ci:6:002:0 s c0 05 0f08 0000 0004 4 <
ffff000103558180 1404735256 C Ci:6:002:0 0 4 = 0000f780
ffff000103558180 1404735293 S Ci:6:002:0 s c0 05 0fcc 0000 0004 4 <
ffff000103558180 1404735411 C Ci:6:002:0 0 4 = 00000000
ffff000103558180 1404735448 S Ci:6:002:0 s c0 05 09a4 0000 0004 4 <
ffff000103558180 1404735566 C Ci:6:002:0 0 4 = 80000800
ffff000103558180 1404735603 S Co:6:002:0 s 40 05 09a4 0000 0004 4 = 80000a00
ffff000103558180 1404735716 C Co:6:002:0 0 4 >
ffff000103558180 1404735754 S Ci:6:002:0 s c0 05 09a4 0000 0004 4 <
ffff000103558180 1404735881 C Ci:6:002:0 0 4 = 80000a00
ffff000103558180 1404735918 S Co:6:002:0 s 40 05 09a4 0000 0004 4 = 80000800
ffff000103558180 1404736027 C Co:6:002:0 0 4 >
ffff000103558180 1404736071 S Ci:6:002:0 s c0 05 0a2c 0000 0004 4 <
ffff000103558180 1404736180 C Ci:6:002:0 0 4 = 00809000
ffff000103558180 1404736217 S Co:6:002:0 s 40 05 0a2c 0000 0004 4 = 00009000
ffff000103558180 1404736324 C Co:6:002:0 0 4 >
ffff000103558180 1404736360 S Ci:6:002:0 s c0 05 0a2c 0000 0004 4 <
ffff000103558180 1404736471 C Ci:6:002:0 0 4 = 00009000
ffff000103558180 1404736507 S Co:6:002:0 s 40 05 0a2c 0000 0004 4 = 00809000
ffff000103558180 1404736627 C Co:6:002:0 0 4 >
ffff000103558180 1404736666 S Ci:6:002:0 s c0 05 0b58 0000 0004 4 <
ffff000103558180 1404736778 C Ci:6:002:0 0 4 = 00000000
ffff000103558180 1404736814 S Co:6:002:0 s 40 05 0b58 0000 0004 4 = 01000000
ffff000103558180 1404736922 C Co:6:002:0 0 4 >
ffff000103558180 1404736959 S Ci:6:002:0 s c0 05 0b58 0000 0004 4 <
ffff000103558180 1404737070 C Ci:6:002:0 0 4 = 01000000
ffff000103558180 1404737106 S Co:6:002:0 s 40 05 0b58 0000 0004 4 = 00000000
ffff000103558180 1404737214 C Co:6:002:0 0 4 >
ffff000103558180 1404737252 S Ci:6:002:0 s c0 05 0c50 0000 0004 4 <
ffff000103558180 1404737381 C Ci:6:002:0 0 4 = 22000000
ffff000103558180 1404737417 S Co:6:002:0 s 40 05 0c50 0000 0004 4 = 24000000
ffff000103558180 1404737525 C Co:6:002:0 0 4 >
ffff000103558180 1404737563 S Ci:6:002:0 s c0 05 0e50 0000 0004 4 <
ffff000103558180 1404737675 C Ci:6:002:0 0 4 = 22000000
ffff000103558180 1404737711 S Co:6:002:0 s 40 05 0e50 0000 0004 4 = 24000000
ffff000103558180 1404737819 C Co:6:002:0 0 4 >
ffff000103558180 1404737856 S Ci:6:002:0 s c0 05 01cc 0000 0001 1 <
ffff000103558180 1404737974 C Ci:6:002:0 0 1 = 00
ffff000103558180 1404738013 S Co:6:002:0 s 40 05 01f4 0000 0004 4 = 00000000
ffff000103558180 1404738128 C Co:6:002:0 0 4 >
ffff000103558180 1404738166 S Co:6:002:0 s 40 05 01d4 0000 0004 4 = 58000000
ffff000103558180 1404738274 C Co:6:002:0 0 4 >
ffff000103558180 1404738314 S Co:6:002:0 s 40 05 0440 0000 0004 4 = 00000000
ffff000103558180 1404738420 C Co:6:002:0 0 4 >
ffff000103558180 1404738460 S Ci:6:002:0 s c0 05 0c00 0000 0004 4 <
ffff000103558180 1404738571 C Ci:6:002:0 0 4 = 07000000
ffff000103558180 1404738607 S Ci:6:002:0 s c0 05 08b0 0000 0004 4 <
ffff000103558180 1404738719 C Ci:6:002:0 0 4 = 42060000
ffff000103558180 1404738755 S Co:6:002:0 s 40 05 08b0 0000 0004 4 = 42060000
ffff000103558180 1404738875 C Co:6:002:0 0 4 >
ffff000103558180 1404738934 S Ci:6:002:0 s c0 05 0d04 0000 0004 4 <
ffff000103558180 1404739043 C Ci:6:002:0 0 4 = f07c90b1
ffff000103558180 1404739081 S Co:6:002:0 s 40 05 0280 0000 0002 2 = 0001
ffff000103558180 1404739193 C Co:6:002:0 0 2 >
ffff000103558180 1404739231 S Ci:6:002:0 s c0 05 010c 0000 0001 1 <
ffff000103558180 1404739344 C Ci:6:002:0 0 1 = b4
ffff000103558180 1404739379 S Co:6:002:0 s 40 05 010c 0000 0001 1 = b4
ffff000103558180 1404739501 C Co:6:002:0 0 1 >
ffff000103558c00 1404739647 S Ci:6:002:0 s c0 05 004c 0000 0001 1 <
ffff000103558c00 1404739778 C Ci:6:002:0 0 1 = 20
ffff000103558c00 1404739907 S Co:6:002:0 s 40 05 004c 0000 0001 1 = 20
ffff000103558c00 1404740032 C Co:6:002:0 0 1 >
ffff000103558180 1405756209 S Ci:6:002:0 s c0 05 004c 0000 0001 1 <
ffff000103558180 1405756336 C Ci:6:002:0 0 1 = 20
ffff000103558180 1405756529 S Co:6:002:0 s 40 05 004c 0000 0001 1 = 20
ffff000103558180 1405756601 C Co:6:002:0 0 1 >
