ffff0001035339c0 2985518946 C Bi:6:002:1 0 446 = 86010484 00000f80 c2046000 04300000 00000000 f1161800 46420080 90dbdb01
ffff0001035339c0 2985519034 S Bi:6:002:1 -115 32768 <
ffff000103533840 2985617572 C Bi:6:002:1 0 86 = 1e008484 00060f22 49066900 04300000 00000000 509a1900 64640080 c8f5f501
ffff000103533840 2985617599 S Bi:6:002:1 -115 32768 <
ffff000103533b40 2985668903 C Bi:6:002:1 0 86 = 1e008484 00000f20 4a066900 04300000 00000000 b6621a00 62640080 c7f4f401
ffff000103533b40 2985668931 S Bi:6:002:1 -115 32768 <
ffff00014c2bfc00 2985756263 S Ci:6:002:0 s c0 05 004c 0000 0001 1 <
ffff00014c2bfc00 2985756430 C Ci:6:002:0 0 1 = 20
ffff00014c2bfc00 2985756583 S Co:6:002:0 s 40 05 004c 0000 0001 1 = 20
ffff00014c2bfc00 2985756722 C Co:6:002:0 0 1 >
ffff000103533d80 2985779505 C Bi:6:002:1 0 86 = 1e008484 00060f22 4b066900 04300000 00000000 bc121c00 64680080 cef4f401
ffff000103533d80 2985779532 S Bi:6:002:1 -115 32768 <
ffff0001035339c0 2985937103 C Bi:6:002:1 0 86 = 1e008484 00000f20 4c066900 04300000 00000000 807a1e00 62640080 c5f4f401
ffff0001035339c0 2985937137 S Bi:6:002:1 -115 32768 <
ffff000103533840 2985957641 C Bi:6:002:1 0 84 = 1c000484 00000f20 210c6000 08300000 00000000 d1ca1e00 463c0080 89fdfd01
ffff000103533840 2985957667 S Bi:6:002:1 -115 32768 <
ffff000103533b40 2985991458 C Bi:6:002:1 0 203 = 93000484 00000f80 cd026000 04300000 00000000 184e1f00 34300080 65e3e301
ffff000103533b40 2985991508 S Bi:6:002:1 -115 32768 <
ffff000103533d80 2986019571 C Bi:6:002:1 0 84 = 1c000484 00000f22 220c6000 08300000 00000000 d7bc1f00 463e0080 87f9f901
ffff000103533d80 2986019594 S Bi:6:002:1 -115 32768 <
ffff0001035339c0 2986273173 C Bi:6:002:1 0 84 = 1c000484 00000f20 230c6000 08300000 00000000 499b2300 463e0080 87fafa01
ffff0001035339c0 2986273218 S Bi:6:002:1 -115 32768 <
ffff000103533840 2986326225 C Bi:6:002:1 0 86 = 1e008484 00060f22 4f066900 04300000 00000000 646a2400 64640080 c7f5f501
ffff000103533840 2986326251 S Bi:6:002:1 -115 32768 <
ffff000103533b40 2986377379 C Bi:6:002:1 0 86 = 1e008484 00000f20 50066900 04300000 00000000 65322500 62640080 c5f4f401
ffff000103533b40 2986377410 S Bi:6:002:1 -115 32768 <
ffff000103533d80 2986413769 C Bi:6:002:1 0 86 = 1e008484 00060f22 51066900 04300000 00000000 8bc02500 64640080 c7f5f501
ffff000103533d80 2986413787 S Bi:6:002:1 -115 32768 <
ffff000103533a80 2986442159 S Ci:6:002:0 s c0 05 0454 0000 0001 1 <
ffff000103533a80 2986442358 C Ci:6:002:0 0 1 = 00
ffff000103533a80 2986442402 S Ci:6:002:0 s c0 05 0860 0000 0004 4 <
ffff000103533a80 2986442507 C Ci:6:002:0 0 4 = 21c32969
ffff00013d9fb6c0 2986442548 S Co:6:002:0 s 40 05 0860 0000 0004 4 = 21c3d572
ffff00013d9fb6c0 2986442652 C Co:6:002:0 0 4 >
ffff00014a4c23c0 2986442692 S Ci:6:002:0 s c0 05 0c00 0000 0004 4 <
ffff00014a4c23c0 2986442803 C Ci:6:002:0 0 4 = 07000000
ffff00014c2bf0c0 2986442843 S Ci:6:002:0 s c0 05 08b0 0000 0004 4 <
ffff00014c2bf0c0 2986442959 C Ci:6:002:0 0 4 = 00060000
ffff00014c2bf0c0 2986443006 S Co:6:002:0 s 40 05 08b0 0000 0004 4 = 18060000
ffff00014c2bf0c0 2986443111 C Co:6:002:0 0 4 >
ffff00014c2bf0c0 2986443178 S Ci:6:002:0 s c0 05 0d04 0000 0004 4 <
ffff00014c2bf0c0 2986443299 C Ci:6:002:0 0 4 = 2a7191b1
ffff00014c2bf0c0 2986443346 S Co:6:002:0 s 40 05 0c90 0000 0004 4 = 2a708001
ffff00014c2bf0c0 2986443451 C Co:6:002:0 0 4 >
ffff00014c2bf0c0 2986443510 S Ci:6:002:0 s c0 05 08ac 0000 0004 4 <
ffff00014c2bf0c0 2986443646 C Ci:6:002:0 0 4 = 0afaf00f
ffff00014c2bf0c0 2986443691 S Co:6:002:0 s 40 05 08ac 0000 0004 4 = 0afaf00f
ffff00014c2bf0c0 2986443797 C Co:6:002:0 0 4 >
ffff00014c2bf0c0 2986443843 S Ci:6:002:0 s c0 05 08ac 0000 0004 4 <
ffff00014c2bf0c0 2986443964 C Ci:6:002:0 0 4 = 0afaf00f
ffff00014c2bf0c0 2986444028 S Co:6:002:0 s 40 05 08ac 0000 0004 4 = 0afaf00f
ffff00014c2bf0c0 2986444166 C Co:6:002:0 0 4 >
ffff00014c2bf0c0 2986444214 S Ci:6:002:0 s c0 05 08c4 0000 0004 4 <
ffff00014c2bf0c0 2986444337 C Ci:6:002:0 0 4 = 00000000
ffff00014c2bf0c0 2986444382 S Co:6:002:0 s 40 05 08c4 0000 0004 4 = 00000000
ffff00014c2bf0c0 2986444489 C Co:6:002:0 0 4 >
ffff00014c2bf0c0 2986444535 S Ci:6:002:0 s c0 05 0c00 0000 0004 4 <
ffff00014c2bf0c0 2986444681 C Ci:6:002:0 0 4 = 07000000
ffff00014c2bf0c0 2986444731 S Ci:6:002:0 s c0 05 08b0 0000 0004 4 <
ffff00014c2bf0c0 2986444854 C Ci:6:002:0 0 4 = 18060000
ffff00014c2bf0c0 2986444900 S Co:6:002:0 s 40 05 08b0 0000 0004 4 = 18060000
ffff00014c2bf0c0 2986445018 C Co:6:002:0 0 4 >
ffff00014c2bf0c0 2986445085 S Ci:6:002:0 s c0 05 0d04 0000 0004 4 <
ffff00014c2bf0c0 2986445207 C Ci:6:002:0 0 4 = 2a7090b1
ffff00014c2bf0c0 2986445253 S Co:6:002:0 s 40 05 0c90 0000 0004 4 = 01708001
ffff00014c2bf0c0 2986445359 C Co:6:002:0 0 4 >
ffff00014c2bf0c0 2986445419 S Ci:6:002:0 s c0 05 0e00 0000 0004 4 <
ffff00014c2bf0c0 2986445541 C Ci:6:002:0 0 4 = 07000000
ffff00014c2bf0c0 2986445587 S Ci:6:002:0 s c0 05 08b0 0000 0004 4 <
ffff00014c2bf0c0 2986445699 C Ci:6:002:0 0 4 = 18060000
ffff00014c2bf0c0 2986445744 S Co:6:002:0 s 40 05 08b0 0000 0004 4 = 18060000
ffff00014c2bf0c0 2986445851 C Co:6:002:0 0 4 >
ffff00014c2bf0c0 2986445918 S Ci:6:002:0 s c0 05 0d44 0000 0004 4 <
ffff00014c2bf0c0 2986446038 C Ci:6:002:0 0 4 = 2a7191b1
ffff00014c2bf0c0 2986446085 S Co:6:002:0 s 40 05 0e90 0000 0004 4 = 2a708001
ffff00014c2bf0c0 2986446193 C Co:6:002:0 0 4 >
ffff00014c2bf0c0 2986446253 S Ci:6:002:0 s c0 05 08ac 0000 0004 4 <
ffff00014c2bf0c0 2986446390 C Ci:6:002:0 0 4 = 0afaf00f
ffff00014c2bf0c0 2986446436 S Co:6:002:0 s 40 05 08ac 0000 0004 4 = 0afaf00f
ffff00014c2bf0c0 2986446542 C Co:6:002:0 0 4 >
ffff00014c2bf0c0 2986446589 S Ci:6:002:0 s c0 05 08ac 0000 0004 4 <
ffff00014c2bf0c0 2986446710 C Ci:6:002:0 0 4 = 0afaf00f
ffff00014c2bf0c0 2986446756 S Co:6:002:0 s 40 05 08ac 0000 0004 4 = 0afaf00f
ffff00014c2bf0c0 2986446862 C Co:6:002:0 0 4 >
ffff00014c2bf0c0 2986446908 S Ci:6:002:0 s c0 05 08c4 0000 0004 4 <
ffff00014c2bf0c0 2986447029 C Ci:6:002:0 0 4 = 00000000
ffff00014c2bf0c0 2986447075 S Co:6:002:0 s 40 05 08c4 0000 0004 4 = 00000000
ffff00014c2bf0c0 2986447181 C Co:6:002:0 0 4 >
ffff00014c2bf0c0 2986447228 S Ci:6:002:0 s c0 05 0e00 0000 0004 4 <
ffff00014c2bf0c0 2986447350 C Ci:6:002:0 0 4 = 07000000
ffff00014c2bf0c0 2986447395 S Ci:6:002:0 s c0 05 08b0 0000 0004 4 <
ffff00014c2bf0c0 2986447521 C Ci:6:002:0 0 4 = 18060000
ffff00014c2bf0c0 2986447566 S Co:6:002:0 s 40 05 08b0 0000 0004 4 = 18060000
ffff00014c2bf0c0 2986447673 C Co:6:002:0 0 4 >
ffff00014c2bf0c0 2986447740 S Ci:6:002:0 s c0 05 0d44 0000 0004 4 <
ffff00014c2bf0c0 2986447861 C Ci:6:002:0 0 4 = 2a7090b1
ffff00014c2bf0c0 2986447907 S Co:6:002:0 s 40 05 0e90 0000 0004 4 = 01708001
ffff00014c2bf0c0 2986448018 C Co:6:002:0 0 4 >
ffff00014c2bf0c0 2986448078 S Ci:6:002:0 s c0 05 0668 0000 0002 2 <
ffff00014c2bf0c0 2986448202 C Ci:6:002:0 0 2 = 0010
ffff00014c2bf0c0 2986448248 S Co:6:002:0 s 40 05 0668 0000 0002 2 = 0010
ffff00014c2bf0c0 2986448353 C Co:6:002:0 0 2 >
ffff00014c2bf0c0 2986448423 S Co:6:002:0 s 40 05 0483 0000 0001 1 = 00
ffff00014c2bf0c0 2986448537 C Co:6:002:0 0 1 >
ffff00014c2bf0c0 2986448582 S Ci:6:002:0 s c0 05 0837 0000 0001 1 <
ffff00014c2bf0c0 2986448694 C Ci:6:002:0 0 1 = 00
ffff00014c2bf0c0 2986448739 S Ci:6:002:0 s c0 05 08ac 0000 0004 4 <
ffff00014c2bf0c0 2986448852 C Ci:6:002:0 0 4 = 0afaf00f
ffff00014c2bf0c0 2986448898 S Co:6:002:0 s 40 05 08ac 0000 0004 4 = 08faf00f
ffff00014c2bf0c0 2986449018 C Co:6:002:0 0 4 >
ffff00014c2bf0c0 2986449063 S Ci:6:002:0 s c0 05 08c4 0000 0004 4 <
ffff00014c2bf0c0 2986449174 C Ci:6:002:0 0 4 = 00000000
ffff00014c2bf0c0 2986449219 S Co:6:002:0 s 40 05 08c4 0000 0004 4 = 00000000
ffff00014c2bf0c0 2986449326 C Co:6:002:0 0 4 >
ffff00014c2bf0c0 2986449373 S Ci:6:002:0 s c0 05 0848 0000 0004 4 <
ffff00014c2bf0c0 2986449491 C Ci:6:002:0 0 4 = 8bff1062
ffff00014c2bf0c0 2986449535 S Co:6:002:0 s 40 05 0848 0000 0004 4 = 8bffd061
ffff00014c2bf0c0 2986449643 C Co:6:002:0 0 4 >
ffff00014c2bf0c0 2986449689 S Ci:6:002:0 s c0 05 08ac 0000 0004 4 <
ffff00014c2bf0c0 2986449808 C Ci:6:002:0 0 4 = 08faf00f
ffff00014c2bf0c0 2986449852 S Co:6:002:0 s 40 05 08ac 0000 0004 4 = 08faf00f
ffff00014c2bf0c0 2986449959 C Co:6:002:0 0 4 >
ffff00014c2bf0c0 2986450006 S Ci:6:002:0 s c0 05 08ac 0000 0004 4 <
ffff00014c2bf0c0 2986450145 C Ci:6:002:0 0 4 = 08faf00f
ffff00014c2bf0c0 2986450191 S Co:6:002:0 s 40 05 08ac 0000 0004 4 = 08faf00f
ffff00014c2bf0c0 2986450297 C Co:6:002:0 0 4 >
ffff00014c2bf0c0 2986450343 S Ci:6:002:0 s c0 05 08c4 0000 0004 4 <
ffff00014c2bf0c0 2986450461 C Ci:6:002:0 0 4 = 00000000
ffff00014c2bf0c0 2986450507 S Co:6:002:0 s 40 05 08c4 0000 0004 4 = 00000000
ffff00014c2bf0c0 2986450613 C Co:6:002:0 0 4 >
ffff00014c2bf0c0 2986450659 S Ci:6:002:0 s c0 05 0c00 0000 0004 4 <
ffff00014c2bf0c0 2986450777 C Ci:6:002:0 0 4 = 07000000
ffff00014c2bf0c0 2986450823 S Ci:6:002:0 s c0 05 08b0 0000 0004 4 <
ffff00014c2bf0c0 2986450932 C Ci:6:002:0 0 4 = 18060000
ffff00014c2bf0c0 2986450977 S Co:6:002:0 s 40 05 08b0 0000 0004 4 = 18060000
ffff00014c2bf0c0 2986451084 C Co:6:002:0 0 4 >
ffff00014c2bf0c0 2986451151 S Ci:6:002:0 s c0 05 0d04 0000 0004 4 <
ffff00014c2bf0c0 2986451271 C Ci:6:002:0 0 4 = 017090b1
ffff00014c2bf0c0 2986451317 S Co:6:002:0 s 40 05 0c90 0000 0004 4 = 017c8001
ffff00014c2bf0c0 2986451423 C Co:6:002:0 0 4 >
ffff00014c2bf0c0 2986451483 S Ci:6:002:0 s c0 05 0e00 0000 0004 4 <
ffff00014c2bf0c0 2986451601 C Ci:6:002:0 0 4 = 07000000
ffff00014c2bf0c0 2986451648 S Ci:6:002:0 s c0 05 08b0 0000 0004 4 <
ffff00014c2bf0c0 2986451770 C Ci:6:002:0 0 4 = 18060000
ffff00014c2bf0c0 2986451815 S Co:6:002:0 s 40 05 08b0 0000 0004 4 = 18060000
ffff00014c2bf0c0 2986451923 C Co:6:002:0 0 4 >
ffff00014c2bf0c0 2986451990 S Ci:6:002:0 s c0 05 0d44 0000 0004 4 <
ffff00014c2bf0c0 2986452129 C Ci:6:002:0 0 4 = 017090b1
ffff00014c2bf0c0 2986452175 S Co:6:002:0 s 40 05 0e90 0000 0004 4 = 017c8001
ffff00014c2bf0c0 2986452283 C Co:6:002:0 0 4 >
ffff00014c2bf0c0 2986452345 S Ci:6:002:0 s c0 05 0073 0000 0001 1 <
ffff00014c2bf0c0 2986452464 C Ci:6:002:0 0 1 = 07
ffff00014c2bf0c0 2986452510 S Co:6:002:0 s 40 05 0073 0000 0001 1 = 07
ffff00014c2bf0c0 2986452617 C Co:6:002:0 0 1 >
ffff00014c2bf0c0 2986452682 S Ci:6:002:0 s c0 05 0c20 0000 0004 4 <
ffff00014c2bf0c0 2986452802 C Ci:6:002:0 0 4 = 12121212
ffff00014c2bf0c0 2986452847 S Co:6:002:0 s 40 05 0c20 0000 0004 4 = 13131313
ffff00014c2bf0c0 2986452953 C Co:6:002:0 0 4 >
ffff00014c2bf0c0 2986453000 S Ci:6:002:0 s c0 05 0c24 0000 0004 4 <
ffff00014c2bf0c0 2986453119 C Ci:6:002:0 0 4 = 12121212
ffff00014c2bf0c0 2986453165 S Co:6:002:0 s 40 05 0c24 0000 0004 4 = 20202020
ffff00014c2bf0c0 2986453271 C Co:6:002:0 0 4 >
ffff00014c2bf0c0 2986453318 S Ci:6:002:0 s c0 05 0c28 0000 0004 4 <
ffff00014c2bf0c0 2986453436 C Ci:6:002:0 0 4 = 12121212
ffff00014c2bf0c0 2986453482 S Co:6:002:0 s 40 05 0c28 0000 0004 4 = 20201e1c
ffff00014c2bf0c0 2986453588 C Co:6:002:0 0 4 >
ffff00014c2bf0c0 2986453635 S Ci:6:002:0 s c0 05 0c2c 0000 0004 4 <
ffff00014c2bf0c0 2986453771 C Ci:6:002:0 0 4 = 12121212
ffff00014c2bf0c0 2986453817 S Co:6:002:0 s 40 05 0c2c 0000 0004 4 = 20202020
ffff00014c2bf0c0 2986453923 C Co:6:002:0 0 4 >
ffff00014c2bf0c0 2986453969 S Ci:6:002:0 s c0 05 0c30 0000 0004 4 <
ffff00014c2bf0c0 2986454088 C Ci:6:002:0 0 4 = 12121212
ffff00014c2bf0c0 2986454134 S Co:6:002:0 s 40 05 0c30 0000 0004 4 = 20201e1c
ffff00014c2bf0c0 2986454241 C Co:6:002:0 0 4 >
ffff00014c2bf0c0 2986454287 S Ci:6:002:0 s c0 05 0c34 0000 0004 4 <
ffff00014c2bf0c0 2986454408 C Ci:6:002:0 0 4 = 12121212
ffff00014c2bf0c0 2986454454 S Co:6:002:0 s 40 05 0c34 0000 0004 4 = 20202020
ffff00014c2bf0c0 2986454560 C Co:6:002:0 0 4 >
ffff00014c2bf0c0 2986454606 S Ci:6:002:0 s c0 05 0c38 0000 0004 4 <
ffff00014c2bf0c0 2986454724 C Ci:6:002:0 0 4 = 12121212
ffff00014c2bf0c0 2986454770 S Co:6:002:0 s 40 05 0c38 0000 0004 4 = 201e1c1a
ffff00014c2bf0c0 2986454889 C Co:6:002:0 0 4 >
ffff00014c2bf0c0 2986454935 S Ci:6:002:0 s c0 05 0c3c 0000 0004 4 <
ffff00014c2bf0c0 2986455054 C Ci:6:002:0 0 4 = 12121212
ffff00014c2bf0c0 2986455100 S Co:6:002:0 s 40 05 0c3c 0000 0004 4 = 20202020
ffff00014c2bf0c0 2986455206 C Co:6:002:0 0 4 >
ffff00014c2bf0c0 2986455252 S Ci:6:002:0 s c0 05 0c40 0000 0004 4 <
ffff00014c2bf0c0 2986455389 C Ci:6:002:0 0 4 = 12121212
ffff00014c2bf0c0 2986455435 S Co:6:002:0 s 40 05 0c40 0000 0004 4 = 20201e1c
ffff00014c2bf0c0 2986455541 C Co:6:002:0 0 4 >
ffff00014c2bf0c0 2986455588 S Ci:6:002:0 s c0 05 0c44 0000 0004 4 <
ffff00014c2bf0c0 2986455709 C Ci:6:002:0 0 4 = 12121212
ffff00014c2bf0c0 2986455754 S Co:6:002:0 s 40 05 0c44 0000 0004 4 = 1a181e1e
ffff00014c2bf0c0 2986455860 C Co:6:002:0 0 4 >
ffff00014c2bf0c0 2986455907 S Ci:6:002:0 s c0 05 0c48 0000 0004 4 <
ffff00014c2bf0c0 2986456026 C Ci:6:002:0 0 4 = 12121212
ffff00014c2bf0c0 2986456109 S Co:6:002:0 s 40 05 0c48 0000 0004 4 = 1e1e1e1e
ffff00014c2bf0c0 2986456213 C Co:6:002:0 0 4 >
ffff00014c2bf0c0 2986456264 S Ci:6:002:0 s c0 05 0c4c 0000 0004 4 <
ffff00014c2bf0c0 2986456397 C Ci:6:002:0 0 4 = 12121212
ffff00014c2bf0c0 2986456443 S Co:6:002:0 s 40 05 0c4c 0000 0004 4 = 1c1a1816
ffff00014c2bf0c0 2986456548 C Co:6:002:0 0 4 >
ffff00014c2bf0c0 2986456595 S Ci:6:002:0 s c0 05 0c54 0000 0004 4 <
ffff00014c2bf0c0 2986456714 C Ci:6:002:0 0 4 = 1c120800
ffff00014c2bf0c0 2986456759 S Co:6:002:0 s 40 05 0c54 0000 0004 4 = 120a0400
ffff00014c2bf0c0 2986456866 C Co:6:002:0 0 4 >
ffff00014c2bf0c0 2986456912 S Ci:6:002:0 s c0 05 0e20 0000 0004 4 <
ffff00014c2bf0c0 2986457031 C Ci:6:002:0 0 4 = 12121212
ffff00014c2bf0c0 2986457077 S Co:6:002:0 s 40 05 0e20 0000 0004 4 = 14141414
ffff00014c2bf0c0 2986457183 C Co:6:002:0 0 4 >
ffff00014c2bf0c0 2986457230 S Ci:6:002:0 s c0 05 0e24 0000 0004 4 <
ffff00014c2bf0c0 2986457350 C Ci:6:002:0 0 4 = 12121212
ffff00014c2bf0c0 2986457395 S Co:6:002:0 s 40 05 0e24 0000 0004 4 = 1d1d1d1d
ffff00014c2bf0c0 2986457514 C Co:6:002:0 0 4 >
ffff00014c2bf0c0 2986457560 S Ci:6:002:0 s c0 05 0e28 0000 0004 4 <
ffff00014c2bf0c0 2986457679 C Ci:6:002:0 0 4 = 12121212
ffff00014c2bf0c0 2986457724 S Co:6:002:0 s 40 05 0e28 0000 0004 4 = 1d1d1b19
ffff00014c2bf0c0 2986457831 C Co:6:002:0 0 4 >
ffff00014c2bf0c0 2986457877 S Ci:6:002:0 s c0 05 0e2c 0000 0004 4 <
ffff00014c2bf0c0 2986457995 C Ci:6:002:0 0 4 = 12121212
ffff00014c2bf0c0 2986458041 S Co:6:002:0 s 40 05 0e2c 0000 0004 4 = 1f1f1f1f
ffff00014c2bf0c0 2986458148 C Co:6:002:0 0 4 >
ffff00014c2bf0c0 2986458195 S Ci:6:002:0 s c0 05 0e30 0000 0004 4 <
ffff00014c2bf0c0 2986458314 C Ci:6:002:0 0 4 = 12121212
ffff00014c2bf0c0 2986458360 S Co:6:002:0 s 40 05 0e30 0000 0004 4 = 1f1f1d1b
ffff00014c2bf0c0 2986458466 C Co:6:002:0 0 4 >
ffff00014c2bf0c0 2986458513 S Ci:6:002:0 s c0 05 0e34 0000 0004 4 <
ffff00014c2bf0c0 2986458646 C Ci:6:002:0 0 4 = 12121212
ffff00014c2bf0c0 2986458692 S Co:6:002:0 s 40 05 0e34 0000 0004 4 = 1f1f1f1f
ffff00014c2bf0c0 2986458798 C Co:6:002:0 0 4 >
ffff00014c2bf0c0 2986458844 S Ci:6:002:0 s c0 05 0e38 0000 0004 4 <
ffff00014c2bf0c0 2986458963 C Ci:6:002:0 0 4 = 12121212
ffff00014c2bf0c0 2986459009 S Co:6:002:0 s 40 05 0e38 0000 0004 4 = 1f1d1b19
ffff00014c2bf0c0 2986459115 C Co:6:002:0 0 4 >
ffff00014c2bf0c0 2986459162 S Ci:6:002:0 s c0 05 0e3c 0000 0004 4 <
ffff00014c2bf0c0 2986459280 C Ci:6:002:0 0 4 = 12121212
ffff00014c2bf0c0 2986459325 S Co:6:002:0 s 40 05 0e3c 0000 0004 4 = 1f1f1f1f
ffff00014c2bf0c0 2986459432 C Co:6:002:0 0 4 >
ffff00014c2bf0c0 2986459479 S Ci:6:002:0 s c0 05 0e40 0000 0004 4 <
ffff00014c2bf0c0 2986459598 C Ci:6:002:0 0 4 = 12121212
ffff00014c2bf0c0 2986459644 S Co:6:002:0 s 40 05 0e40 0000 0004 4 = 1f1f1d1b
ffff00014c2bf0c0 2986459764 C Co:6:002:0 0 4 >
ffff00014c2bf0c0 2986459811 S Ci:6:002:0 s c0 05 0e44 0000 0004 4 <
ffff00014c2bf0c0 2986459930 C Ci:6:002:0 0 4 = 12121212
ffff00014c2bf0c0 2986459976 S Co:6:002:0 s 40 05 0e44 0000 0004 4 = 19171d1d
ffff00014c2bf0c0 2986460082 C Co:6:002:0 0 4 >
ffff00014c2bf0c0 2986460133 S Ci:6:002:0 s c0 05 0e48 0000 0004 4 <
ffff00014c2bf0c0 2986460271 C Ci:6:002:0 0 4 = 12121212
ffff00014c2bf0c0 2986460319 S Co:6:002:0 s 40 05 0e48 0000 0004 4 = 1d1d1d1d
ffff00014c2bf0c0 2986460428 C Co:6:002:0 0 4 >
ffff00014c2bf0c0 2986460475 S Ci:6:002:0 s c0 05 0e4c 0000 0004 4 <
ffff00014c2bf0c0 2986460596 C Ci:6:002:0 0 4 = 12121212
ffff00014c2bf0c0 2986460641 S Co:6:002:0 s 40 05 0e4c 0000 0004 4 = 1b191715
ffff00014c2bf0c0 2986460761 C Co:6:002:0 0 4 >
ffff00014c2bf0c0 2986460807 S Ci:6:002:0 s c0 05 0e54 0000 0004 4 <
ffff00014c2bf0c0 2986460927 C Ci:6:002:0 0 4 = 1c120800
ffff00014c2bf0c0 2986460976 S Co:6:002:0 s 40 05 0e54 0000 0004 4 = 11090300
ffff00014c2bf0c0 2986461079 C Co:6:002:0 0 4 >
ffff00014c2bf0c0 2986461141 S Ci:6:002:0 s c0 05 0454 0000 0001 1 <
ffff00014c2bf0c0 2986461272 C Ci:6:002:0 0 1 = 00
ffff00014c2bf0c0 2986461319 S Ci:6:002:0 s c0 05 0454 0000 0001 1 <
ffff00014c2bf0c0 2986461429 C Ci:6:002:0 0 1 = 00
ffff00014c2bf0c0 2986461474 S Co:6:002:0 s 40 05 0454 0000 0001 1 = 80
ffff00014c2bf0c0 2986461581 C Co:6:002:0 0 1 >
ffff00014c2bf0c0 2986461628 S Ci:6:002:0 s c0 05 041a 0000 0002 2 <
ffff00014c2bf0c0 2986461765 C Ci:6:002:0 0 2 = ff0f
ffff00014c2bf0c0 2986461811 S Ci:6:002:0 s c0 05 0808 0000 0004 4 <
ffff00014c2bf0c0 2986461921 C Ci:6:002:0 0 4 = 3382023e
ffff00014c2bf0c0 2986461966 S Co:6:002:0 s 40 05 0808 0000 0004 4 = 3382023e
ffff00014c2bf0c0 2986462072 C Co:6:002:0 0 4 >
ffff00014c2bf0c0 2986462119 S Ci:6:002:0 s c0 05 0834 0000 0004 4 <
ffff00014c2bf0c0 2986462239 C Ci:6:002:0 0 4 = 05a73700
ffff00014c2bf0c0 2986462284 S Co:6:002:0 s 40 05 0834 0000 0004 4 = 06a73700
ffff00014c2bf0c0 2986462392 C Co:6:002:0 0 4 >
ffff00014c2bf0c0 2986462439 S Ci:6:002:0 s c0 05 0830 0000 0004 4 <
ffff00014c2bf0c0 2986462559 C Ci:6:002:0 0 4 = b8eeaa2e
ffff00014c2bf0c0 2986462605 S Co:6:002:0 s 40 05 0830 0000 0004 4 = b8aeaa2e
ffff00014c2bf0c0 2986462711 C Co:6:002:0 0 4 >
ffff00014c2bf0c0 2986462757 S Ci:6:002:0 s c0 05 0830 0000 0004 4 <
ffff00014c2bf0c0 2986462895 C Ci:6:002:0 0 4 = b8aeaa2e
ffff00014c2bf0c0 2986462941 S Co:6:002:0 s 40 05 0830 0000 0004 4 = b8aeaa2e
ffff00014c2bf0c0 2986463047 C Co:6:002:0 0 4 >
ffff00014c2bf0c0 2986463094 S Ci:6:002:0 s c0 05 082c 0000 0004 4 <
ffff00014c2bf0c0 2986463214 C Ci:6:002:0 0 4 = dc832000
ffff00014c2bf0c0 2986463260 S Co:6:002:0 s 40 05 082c 0000 0004 4 = dd832000
ffff00014c2bf0c0 2986463366 C Co:6:002:0 0 4 >
ffff00014c2bf0c0 2986463413 S Co:6:002:0 s 40 05 0cb0 0000 0004 4 = 17773354
ffff00014c2bf0c0 2986463527 C Co:6:002:0 0 4 >
ffff00014c2bf0c0 2986463572 S Co:6:002:0 s 40 05 0eb0 0000 0004 4 = 17773354
ffff00014c2bf0c0 2986463678 C Co:6:002:0 0 4 >
ffff00014c2bf0c0 2986463725 S Ci:6:002:0 s c0 05 0cb4 0000 0004 4 <
ffff00014c2bf0c0 2986463846 C Ci:6:002:0 0 4 = 77000001
ffff00014c2bf0c0 2986463892 S Co:6:002:0 s 40 05 0cb4 0000 0004 4 = 77000001
ffff00014c2bf0c0 2986464010 C Co:6:002:0 0 4 >
ffff00014c2bf0c0 2986464055 S Ci:6:002:0 s c0 05 0eb4 0000 0004 4 <
ffff00014c2bf0c0 2986464183 C Ci:6:002:0 0 4 = 77000001
ffff00014c2bf0c0 2986464234 S Co:6:002:0 s 40 05 0eb4 0000 0004 4 = 77000001
ffff00014c2bf0c0 2986464341 C Co:6:002:0 0 4 >
ffff00014c2bf0c0 2986464388 S Ci:6:002:0 s c0 05 0900 0000 0004 4 <
ffff00014c2bf0c0 2986464499 C Ci:6:002:0 0 4 = 01040000
ffff00014c2bf0c0 2986464544 S Co:6:002:0 s 40 05 0900 0000 0004 4 = 01040000
ffff00014c2bf0c0 2986464651 C Co:6:002:0 0 4 >
ffff00014c2bf0c0 2986464698 S Ci:6:002:0 s c0 05 080c 0000 0004 4 <
ffff00014c2bf0c0 2986464819 C Ci:6:002:0 0 4 = 13111312
ffff00014c2bf0c0 2986464864 S Co:6:002:0 s 40 05 080c 0000 0004 4 = 03111312
ffff00014c2bf0c0 2986464970 C Co:6:002:0 0 4 >
ffff00014c2bf0c0 2986465017 S Ci:6:002:0 s c0 05 0a04 0000 0004 4 <
ffff00014c2bf0c0 2986465148 C Ci:6:002:0 0 4 = 0c00ff01
ffff00014c2bf0c0 2986465193 S Co:6:002:0 s 40 05 0a04 0000 0004 4 = 0c00ff0f
ffff00014c2bf0c0 2986465300 C Co:6:002:0 0 4 >
ffff00014c2bf0c0 2986465346 S Ci:6:002:0 s c0 05 0440 0000 0004 4 <
ffff00014c2bf0c0 2986465467 C Ci:6:002:0 0 4 = 5f010000
ffff00014c2bf0c0 2986465512 S Co:6:002:0 s 40 05 0440 0000 0004 4 = 50010000
ffff00014c2bf0c0 2986465618 C Co:6:002:0 0 4 >
ffff00014c2bf0c0 2986465665 S Ci:6:002:0 s c0 05 0c1c 0000 0004 4 <
ffff00014c2bf0c0 2986465786 C Ci:6:002:0 0 4 = 03000040
ffff00014c2bf0c0 2986465832 S Co:6:002:0 s 40 05 0c1c 0000 0004 4 = 0300402d
ffff00014c2bf0c0 2986465937 C Co:6:002:0 0 4 >
ffff00014c2bf0c0 2986465984 S Ci:6:002:0 s c0 05 0e1c 0000 0004 4 <
ffff00014c2bf0c0 2986466104 C Ci:6:002:0 0 4 = 03000040
ffff00014c2bf0c0 2986466150 S Co:6:002:0 s 40 05 0e1c 0000 0004 4 = 0300402d
ffff00014c2bf0c0 2986466268 C Co:6:002:0 0 4 >
ffff00014c2bf0c0 2986466315 S Ci:6:002:0 s c0 05 0860 0000 0004 4 <
ffff00014c2bf0c0 2986466437 C Ci:6:002:0 0 4 = 21c3d572
ffff00014c2bf0c0 2986466482 S Co:6:002:0 s 40 05 0860 0000 0004 4 = 21c32969
ffff00014c2bf0c0 2986466588 C Co:6:002:0 0 4 >
ffff00014c2bf0c0 2986466635 S Ci:6:002:0 s c0 05 0c00 0000 0004 4 <
ffff00014c2bf0c0 2986466773 C Ci:6:002:0 0 4 = 07000000
ffff00014c2bf0c0 2986466818 S Ci:6:002:0 s c0 05 08b0 0000 0004 4 <
ffff00014c2bf0c0 2986466930 C Ci:6:002:0 0 4 = 18060000
ffff00014c2bf0c0 2986466975 S Co:6:002:0 s 40 05 08b0 0000 0004 4 = 18060000
ffff00014c2bf0c0 2986467082 C Co:6:002:0 0 4 >
ffff00014c2bf0c0 2986467149 S Ci:6:002:0 s c0 05 0d04 0000 0004 4 <
ffff00014c2bf0c0 2986467273 C Ci:6:002:0 0 4 = 017c90b1
ffff00014c2bf0c0 2986467318 S Co:6:002:0 s 40 05 0c90 0000 0004 4 = 017d8101
ffff00014c2bf0c0 2986467424 C Co:6:002:0 0 4 >
ffff00014c2bf0c0 2986467484 S Ci:6:002:0 s c0 05 08ac 0000 0004 4 <
ffff00014c2bf0c0 2986467605 C Ci:6:002:0 0 4 = 08faf00f
ffff00014c2bf0c0 2986467651 S Co:6:002:0 s 40 05 08ac 0000 0004 4 = 08faf00f
ffff00014c2bf0c0 2986467768 C Co:6:002:0 0 4 >
ffff00014c2bf0c0 2986467814 S Ci:6:002:0 s c0 05 08ac 0000 0004 4 <
ffff00014c2bf0c0 2986467935 C Ci:6:002:0 0 4 = 08faf00f
ffff00014c2bf0c0 2986467982 S Co:6:002:0 s 40 05 08ac 0000 0004 4 = 08faf00f
ffff00014c2bf0c0 2986468089 C Co:6:002:0 0 4 >
ffff00014c2bf0c0 2986468139 S Ci:6:002:0 s c0 05 08c4 0000 0004 4 <
ffff00014c2bf0c0 2986468275 C Ci:6:002:0 0 4 = 00000000
ffff00014c2bf0c0 2986468321 S Co:6:002:0 s 40 05 08c4 0000 0004 4 = 00000000
ffff00014c2bf0c0 2986468427 C Co:6:002:0 0 4 >
ffff00014c2bf0c0 2986468474 S Ci:6:002:0 s c0 05 0c00 0000 0004 4 <
ffff00014c2bf0c0 2986468595 C Ci:6:002:0 0 4 = 07000000
ffff00014c2bf0c0 2986468641 S Ci:6:002:0 s c0 05 08b0 0000 0004 4 <
ffff00014c2bf0c0 2986468766 C Ci:6:002:0 0 4 = 18060000
ffff00014c2bf0c0 2986468810 S Co:6:002:0 s 40 05 08b0 0000 0004 4 = 18060000
ffff00014c2bf0c0 2986468917 C Co:6:002:0 0 4 >
ffff00014c2bf0c0 2986468984 S Ci:6:002:0 s c0 05 0d04 0000 0004 4 <
ffff00014c2bf0c0 2986469104 C Ci:6:002:0 0 4 = 017d91b1
ffff00014c2bf0c0 2986469150 S Co:6:002:0 s 40 05 0c90 0000 0004 4 = 2c7d8101
ffff00014c2bf0c0 2986469267 C Co:6:002:0 0 4 >
ffff00014c2bf0c0 2986469327 S Ci:6:002:0 s c0 05 0e00 0000 0004 4 <
ffff00014c2bf0c0 2986469448 C Ci:6:002:0 0 4 = 07000000
ffff00014c2bf0c0 2986469494 S Ci:6:002:0 s c0 05 08b0 0000 0004 4 <
ffff00014c2bf0c0 2986469602 C Ci:6:002:0 0 4 = 18060000
ffff00014c2bf0c0 2986469647 S Co:6:002:0 s 40 05 08b0 0000 0004 4 = 18060000
ffff00014c2bf0c0 2986469766 C Co:6:002:0 0 4 >
ffff00014c2bf0c0 2986469833 S Ci:6:002:0 s c0 05 0d44 0000 0004 4 <
ffff00014c2bf0c0 2986469950 C Ci:6:002:0 0 4 = 017c90b1
ffff00014c2bf0c0 2986469996 S Co:6:002:0 s 40 05 0e90 0000 0004 4 = 017d8101
ffff00014c2bf0c0 2986470102 C Co:6:002:0 0 4 >
ffff00014c2bf0c0 2986470162 S Ci:6:002:0 s c0 05 08ac 0000 0004 4 <
ffff00014c2bf0c0 2986470280 C Ci:6:002:0 0 4 = 08faf00f
ffff00014c2bf0c0 2986470326 S Co:6:002:0 s 40 05 08ac 0000 0004 4 = 08faf00f
ffff00014c2bf0c0 2986470432 C Co:6:002:0 0 4 >
ffff00014c2bf0c0 2986470478 S Ci:6:002:0 s c0 05 08ac 0000 0004 4 <
ffff00014c2bf0c0 2986470595 C Ci:6:002:0 0 4 = 08faf00f
ffff00014c2bf0c0 2986470641 S Co:6:002:0 s 40 05 08ac 0000 0004 4 = 08faf00f
ffff00014c2bf0c0 2986470761 C Co:6:002:0 0 4 >
ffff00014c2bf0c0 2986470807 S Ci:6:002:0 s c0 05 08c4 0000 0004 4 <
ffff00014c2bf0c0 2986470925 C Ci:6:002:0 0 4 = 00000000
ffff00014c2bf0c0 2986470971 S Co:6:002:0 s 40 05 08c4 0000 0004 4 = 00000000
ffff00014c2bf0c0 2986471078 C Co:6:002:0 0 4 >
ffff00014c2bf0c0 2986471124 S Ci:6:002:0 s c0 05 0e00 0000 0004 4 <
ffff00014c2bf0c0 2986471242 C Ci:6:002:0 0 4 = 07000000
ffff00014c2bf0c0 2986471288 S Ci:6:002:0 s c0 05 08b0 0000 0004 4 <
ffff00014c2bf0c0 2986471398 C Ci:6:002:0 0 4 = 18060000
ffff00014c2bf0c0 2986471444 S Co:6:002:0 s 40 05 08b0 0000 0004 4 = 18060000
ffff00014c2bf0c0 2986471557 C Co:6:002:0 0 4 >
ffff00014c2bf0c0 2986471623 S Ci:6:002:0 s c0 05 0d44 0000 0004 4 <
ffff00014c2bf0c0 2986471740 C Ci:6:002:0 0 4 = 017d91b1
ffff00014c2bf0c0 2986471785 S Co:6:002:0 s 40 05 0e90 0000 0004 4 = 2c7d8101
ffff00014c2bf0c0 2986471892 C Co:6:002:0 0 4 >
ffff00014c2bf0c0 2986471952 S Ci:6:002:0 s c0 05 0668 0000 0002 2 <
ffff00014c2bf0c0 2986472071 C Ci:6:002:0 0 2 = 0010
ffff00014c2bf0c0 2986472118 S Co:6:002:0 s 40 05 0668 0000 0002 2 = 0010
ffff00014c2bf0c0 2986472231 C Co:6:002:0 0 2 >
ffff00014c2bf0c0 2986472279 S Co:6:002:0 s 40 05 0483 0000 0001 1 = 00
ffff00014c2bf0c0 2986472393 C Co:6:002:0 0 1 >
ffff00014c2bf0c0 2986472439 S Ci:6:002:0 s c0 05 0837 0000 0001 1 <
ffff00014c2bf0c0 2986472548 C Ci:6:002:0 0 1 = 00
ffff00014c2bf0c0 2986472594 S Ci:6:002:0 s c0 05 08ac 0000 0004 4 <
ffff00014c2bf0c0 2986472713 C Ci:6:002:0 0 4 = 08faf00f
ffff00014c2bf0c0 2986472758 S Co:6:002:0 s 40 05 08ac 0000 0004 4 = 08faf00f
ffff00014c2bf0c0 2986472864 C Co:6:002:0 0 4 >
ffff00014c2bf0c0 2986472911 S Ci:6:002:0 s c0 05 08c4 0000 0004 4 <
ffff00014c2bf0c0 2986473029 C Ci:6:002:0 0 4 = 00000000
ffff00014c2bf0c0 2986473074 S Co:6:002:0 s 40 05 08c4 0000 0004 4 = 00000000
ffff00014c2bf0c0 2986473181 C Co:6:002:0 0 4 >
ffff00014c2bf0c0 2986473227 S Ci:6:002:0 s c0 05 0848 0000 0004 4 <
ffff00014c2bf0c0 2986473346 C Ci:6:002:0 0 4 = 8bffd061
ffff00014c2bf0c0 2986473398 S Co:6:002:0 s 40 05 0848 0000 0004 4 = 8bffd061
ffff00014c2bf0c0 2986473518 C Co:6:002:0 0 4 >
ffff00014c2bf0c0 2986473564 S Ci:6:002:0 s c0 05 08ac 0000 0004 4 <
ffff00014c2bf0c0 2986473674 C Ci:6:002:0 0 4 = 08faf00f
ffff00014c2bf0c0 2986473719 S Co:6:002:0 s 40 05 08ac 0000 0004 4 = 08faf00f
ffff00014c2bf0c0 2986473826 C Co:6:002:0 0 4 >
ffff00014c2bf0c0 2986473873 S Ci:6:002:0 s c0 05 08ac 0000 0004 4 <
ffff00014c2bf0c0 2986474014 C Ci:6:002:0 0 4 = 08faf00f
ffff00014c2bf0c0 2986474060 S Co:6:002:0 s 40 05 08ac 0000 0004 4 = 08faf00f
ffff00014c2bf0c0 2986474165 C Co:6:002:0 0 4 >
ffff00014c2bf0c0 2986474211 S Ci:6:002:0 s c0 05 08c4 0000 0004 4 <
ffff00014c2bf0c0 2986474331 C Ci:6:002:0 0 4 = 00000000
ffff00014c2bf0c0 2986474376 S Co:6:002:0 s 40 05 08c4 0000 0004 4 = 00000000
ffff00014c2bf0c0 2986474483 C Co:6:002:0 0 4 >
ffff00014c2bf0c0 2986474530 S Ci:6:002:0 s c0 05 0c00 0000 0004 4 <
ffff00014c2bf0c0 2986474649 C Ci:6:002:0 0 4 = 07000000
ffff00014c2bf0c0 2986474694 S Ci:6:002:0 s c0 05 08b0 0000 0004 4 <
ffff00014c2bf0c0 2986474805 C Ci:6:002:0 0 4 = 18060000
ffff00014c2bf0c0 2986474849 S Co:6:002:0 s 40 05 08b0 0000 0004 4 = 18060000
ffff00014c2bf0c0 2986474956 C Co:6:002:0 0 4 >
ffff00014c2bf0c0 2986475024 S Ci:6:002:0 s c0 05 0d04 0000 0004 4 <
ffff00014c2bf0c0 2986475146 C Ci:6:002:0 0 4 = 2c7d91b1
ffff00014c2bf0c0 2986475192 S Co:6:002:0 s 40 05 0c90 0000 0004 4 = 2c7d8101
ffff00014c2bf0c0 2986475298 C Co:6:002:0 0 4 >
ffff00014c2bf0c0 2986475358 S Ci:6:002:0 s c0 05 0e00 0000 0004 4 <
ffff00014c2bf0c0 2986475476 C Ci:6:002:0 0 4 = 07000000
ffff00014c2bf0c0 2986475522 S Ci:6:002:0 s c0 05 08b0 0000 0004 4 <
ffff00014c2bf0c0 2986475647 C Ci:6:002:0 0 4 = 18060000
ffff00014c2bf0c0 2986475692 S Co:6:002:0 s 40 05 08b0 0000 0004 4 = 18060000
ffff00014c2bf0c0 2986475799 C Co:6:002:0 0 4 >
ffff00014c2bf0c0 2986475867 S Ci:6:002:0 s c0 05 0d44 0000 0004 4 <
ffff00014c2bf0c0 2986475986 C Ci:6:002:0 0 4 = 2c7d91b1
ffff00014c2bf0c0 2986476051 S Co:6:002:0 s 40 05 0e90 0000 0004 4 = 2c7d8101
ffff00014c2bf0c0 2986476084 C Co:6:002:0 0 4 >
ffff00014c2bf0c0 2986476140 S Ci:6:002:0 s c0 05 0073 0000 0001 1 <
ffff00014c2bf0c0 2986476201 C Ci:6:002:0 0 1 = 07
ffff00014c2bf0c0 2986476238 S Co:6:002:0 s 40 05 0073 0000 0001 1 = 07
ffff00014c2bf0c0 2986476270 C Co:6:002:0 0 1 >
ffff00014c2bf0c0 2986476324 S Ci:6:002:0 s c0 05 0c24 0000 0004 4 <
ffff00014c2bf0c0 2986476372 C Ci:6:002:0 0 4 = 20202020
ffff00014c2bf0c0 2986476552 S Co:6:002:0 s 40 05 0c24 0000 0004 4 = 24242424
ffff00014c2bf0c0 2986476586 C Co:6:002:0 0 4 >
ffff00014c2bf0c0 2986476621 S Ci:6:002:0 s c0 05 0c28 0000 0004 4 <
ffff00014c2bf0c0 2986476657 C Ci:6:002:0 0 4 = 20201e1c
ffff00014c2bf0c0 2986476863 S Co:6:002:0 s 40 05 0c28 0000 0004 4 = 24242422
ffff00014c2bf0c0 2986476898 C Co:6:002:0 0 4 >
ffff00014c2bf0c0 2986476930 S Ci:6:002:0 s c0 05 0c2c 0000 0004 4 <
ffff00014c2bf0c0 2986476998 C Ci:6:002:0 0 4 = 20202020
ffff00014c2bf0c0 2986477147 S Co:6:002:0 s 40 05 0c2c 0000 0004 4 = 29292929
ffff00014c2bf0c0 2986477197 C Co:6:002:0 0 4 >
ffff00014c2bf0c0 2986477215 S Ci:6:002:0 s c0 05 0c30 0000 0004 4 <
ffff00014c2bf0c0 2986477251 C Ci:6:002:0 0 4 = 20201e1c
ffff00014c2bf0c0 2986477274 S Co:6:002:0 s 40 05 0c30 0000 0004 4 = 29272523
ffff00014c2bf0c0 2986477320 C Co:6:002:0 0 4 >
ffff00014c2bf0c0 2986477356 S Ci:6:002:0 s c0 05 0c34 0000 0004 4 <
ffff00014c2bf0c0 2986477393 C Ci:6:002:0 0 4 = 20202020
ffff00014c2bf0c0 2986477428 S Co:6:002:0 s 40 05 0c34 0000 0004 4 = 25252525
ffff00014c2bf0c0 2986477460 C Co:6:002:0 0 4 >
ffff00014c2bf0c0 2986477496 S Ci:6:002:0 s c0 05 0c38 0000 0004 4 <
ffff00014c2bf0c0 2986477532 C Ci:6:002:0 0 4 = 201e1c1a
ffff00014c2bf0c0 2986477568 S Co:6:002:0 s 40 05 0c38 0000 0004 4 = 25252321
ffff00014c2bf0c0 2986477599 C Co:6:002:0 0 4 >
ffff00014c2bf0c0 2986477633 S Ci:6:002:0 s c0 05 0c3c 0000 0004 4 <
ffff00014c2bf0c0 2986477670 C Ci:6:002:0 0 4 = 20202020
ffff00014c2bf0c0 2986477705 S Co:6:002:0 s 40 05 0c3c 0000 0004 4 = 29292929
ffff00014c2bf0c0 2986477737 C Co:6:002:0 0 4 >
ffff00014c2bf0c0 2986477772 S Ci:6:002:0 s c0 05 0c40 0000 0004 4 <
ffff00014c2bf0c0 2986477825 C Ci:6:002:0 0 4 = 20201e1c
ffff00014c2bf0c0 2986477860 S Co:6:002:0 s 40 05 0c40 0000 0004 4 = 29272523
ffff00014c2bf0c0 2986477892 C Co:6:002:0 0 4 >
ffff00014c2bf0c0 2986477927 S Ci:6:002:0 s c0 05 0c44 0000 0004 4 <
ffff00014c2bf0c0 2986477964 C Ci:6:002:0 0 4 = 1a181e1e
ffff00014c2bf0c0 2986477998 S Co:6:002:0 s 40 05 0c44 0000 0004 4 = 21212525
ffff00014c2bf0c0 2986478030 C Co:6:002:0 0 4 >
ffff00014c2bf0c0 2986478064 S Ci:6:002:0 s c0 05 0c48 0000 0004 4 <
ffff00014c2bf0c0 2986478101 C Ci:6:002:0 0 4 = 1e1e1e1e
ffff00014c2bf0c0 2986478136 S Co:6:002:0 s 40 05 0c48 0000 0004 4 = 25252525
ffff00014c2bf0c0 2986478168 C Co:6:002:0 0 4 >
ffff00014c2bf0c0 2986478203 S Ci:6:002:0 s c0 05 0c4c 0000 0004 4 <
ffff00014c2bf0c0 2986478240 C Ci:6:002:0 0 4 = 1c1a1816
ffff00014c2bf0c0 2986478276 S Co:6:002:0 s 40 05 0c4c 0000 0004 4 = 23211f1f
ffff00014c2bf0c0 2986478322 C Co:6:002:0 0 4 >
ffff00014c2bf0c0 2986478357 S Ci:6:002:0 s c0 05 0c54 0000 0004 4 <
ffff00014c2bf0c0 2986478394 C Ci:6:002:0 0 4 = 120a0400
ffff00014c2bf0c0 2986478430 S Co:6:002:0 s 40 05 0c54 0000 0004 4 = 19110b00
ffff00014c2bf0c0 2986478462 C Co:6:002:0 0 4 >
ffff00014c2bf0c0 2986478497 S Ci:6:002:0 s c0 05 0e24 0000 0004 4 <
ffff00014c2bf0c0 2986478535 C Ci:6:002:0 0 4 = 1d1d1d1d
ffff00014c2bf0c0 2986478570 S Co:6:002:0 s 40 05 0e24 0000 0004 4 = 21212121
ffff00014c2bf0c0 2986478602 C Co:6:002:0 0 4 >
ffff00014c2bf0c0 2986478637 S Ci:6:002:0 s c0 05 0e28 0000 0004 4 <
ffff00014c2bf0c0 2986478693 C Ci:6:002:0 0 4 = 1d1d1b19
ffff00014c2bf0c0 2986478729 S Co:6:002:0 s 40 05 0e28 0000 0004 4 = 2121211f
ffff00014c2bf0c0 2986478760 C Co:6:002:0 0 4 >
ffff00014c2bf0c0 2986478795 S Ci:6:002:0 s c0 05 0e2c 0000 0004 4 <
ffff00014c2bf0c0 2986478833 C Ci:6:002:0 0 4 = 1f1f1f1f
ffff00014c2bf0c0 2986478868 S Co:6:002:0 s 40 05 0e2c 0000 0004 4 = 26262626
ffff00014c2bf0c0 2986478900 C Co:6:002:0 0 4 >
ffff00014c2bf0c0 2986478935 S Ci:6:002:0 s c0 05 0e30 0000 0004 4 <
ffff00014c2bf0c0 2986478972 C Ci:6:002:0 0 4 = 1f1f1d1b
ffff00014c2bf0c0 2986479007 S Co:6:002:0 s 40 05 0e30 0000 0004 4 = 26242220
ffff00014c2bf0c0 2986479039 C Co:6:002:0 0 4 >
ffff00014c2bf0c0 2986479075 S Ci:6:002:0 s c0 05 0e34 0000 0004 4 <
ffff00014c2bf0c0 2986479112 C Ci:6:002:0 0 4 = 1f1f1f1f
ffff00014c2bf0c0 2986479149 S Co:6:002:0 s 40 05 0e34 0000 0004 4 = 22222222
ffff00014c2bf0c0 2986479197 C Co:6:002:0 0 4 >
ffff00014c2bf0c0 2986479232 S Ci:6:002:0 s c0 05 0e38 0000 0004 4 <
ffff00014c2bf0c0 2986479272 C Ci:6:002:0 0 4 = 1f1d1b19
ffff00014c2bf0c0 2986479307 S Co:6:002:0 s 40 05 0e38 0000 0004 4 = 2222201e
ffff00014c2bf0c0 2986479338 C Co:6:002:0 0 4 >
ffff00014c2bf0c0 2986479374 S Ci:6:002:0 s c0 05 0e3c 0000 0004 4 <
ffff00014c2bf0c0 2986479411 C Ci:6:002:0 0 4 = 1f1f1f1f
ffff00014c2bf0c0 2986479446 S Co:6:002:0 s 40 05 0e3c 0000 0004 4 = 26262626
ffff00014c2bf0c0 2986479478 C Co:6:002:0 0 4 >
ffff00014c2bf0c0 2986479493 S Ci:6:002:0 s c0 05 0e40 0000 0004 4 <
ffff00014c2bf0c0 2986479527 C Ci:6:002:0 0 4 = 1f1f1d1b
ffff00014c2bf0c0 2986479564 S Co:6:002:0 s 40 05 0e40 0000 0004 4 = 26242220
ffff00014c2bf0c0 2986479609 C Co:6:002:0 0 4 >
ffff00014c2bf0c0 2986479644 S Ci:6:002:0 s c0 05 0e44 0000 0004 4 <
ffff00014c2bf0c0 2986479699 C Ci:6:002:0 0 4 = 19171d1d
ffff00014c2bf0c0 2986479733 S Co:6:002:0 s 40 05 0e44 0000 0004 4 = 1e1e2222
ffff00014c2bf0c0 2986479763 C Co:6:002:0 0 4 >
ffff00014c2bf0c0 2986479798 S Ci:6:002:0 s c0 05 0e48 0000 0004 4 <
ffff00014c2bf0c0 2986479835 C Ci:6:002:0 0 4 = 1d1d1d1d
ffff00014c2bf0c0 2986479870 S Co:6:002:0 s 40 05 0e48 0000 0004 4 = 22222222
ffff00014c2bf0c0 2986479902 C Co:6:002:0 0 4 >
ffff00014c2bf0c0 2986479937 S Ci:6:002:0 s c0 05 0e4c 0000 0004 4 <
ffff00014c2bf0c0 2986479974 C Ci:6:002:0 0 4 = 1b191715
ffff00011ac9e240 2986480023 S Co:6:002:0 s 40 05 0e4c 0000 0004 4 = 201e1c1c
ffff00011ac9e240 2986480112 C Co:6:002:0 0 4 >
ffff00011ac9e240 2986480151 S Ci:6:002:0 s c0 05 0e54 0000 0004 4 <
ffff00011ac9e240 2986480204 C Ci:6:002:0 0 4 = 11090300
ffff00011ac9e240 2986480240 S Co:6:002:0 s 40 05 0e54 0000 0004 4 = 160e0800
ffff00011ac9e240 2986480272 C Co:6:002:0 0 4 >
ffff0001035339c0 2986614623 C Bi:6:002:1 0 281 = e1000484 00000f00 16006000 04300000 00000000 e8cf2800 2a360000 6bf0f00f
ffff0001035339c0 2986614680 S Bi:6:002:1 -115 32768 <
ffff000103533840 2986679426 C Bi:6:002:1 0 99 = 2b008484 00000f20 00006900 04380000 00000000 2ece2900 3c460000 86eaea0f
ffff000103533840 2986679458 S Bi:6:002:1 -115 32768 <
ffff000103533b40 2986716679 C Bi:6:002:1 0 281 = e1000484 00000f00 17006000 04300000 00000000 9c5e2a00 282c0000 50f2f20f
ffff000103533b40 2986716736 S Bi:6:002:1 -115 32768 <
ffff00014c2bfc00 2986756157 S Ci:6:002:0 s c0 05 004c 0000 0001 1 <
ffff00014c2bfc00 2986756311 C Ci:6:002:0 0 1 = 20
ffff00014c2bfc00 2986756469 S Co:6:002:0 s 40 05 004c 0000 0001 1 = 28
ffff00014c2bfc00 2986756607 C Co:6:002:0 0 1 >
ffff000103533d80 2986820367 C Bi:6:002:1 0 281 = e1000484 00000f00 19006000 04300000 00000000 c6f32b00 262a0000 51f3f30f
ffff000103533d80 2986820426 S Bi:6:002:1 -115 32768 <
ffff0001035339c0 2986921712 C Bi:6:002:1 0 281 = e1000484 00000f00 1a006000 04300000 00000000 827f2d00 282a0000 4cf1f10f
ffff0001035339c0 2986921739 S Bi:6:002:1 -115 32768 <
ffff00014c2bfc00 2986928299 S Ci:6:002:0 s c0 05 004c 0000 0001 1 <
ffff00014c2bfc00 2986928451 C Ci:6:002:0 0 1 = 28
ffff00014c2bfc00 2986928616 S Co:6:002:0 s 40 05 004c 0000 0001 1 = 20
ffff00014c2bfc00 2986928755 C Co:6:002:0 0 1 >
ffff00014c2bfc00 2986972206 S Ci:6:002:0 s c0 05 0770 0000 0004 4 <
ffff00014c2bfc00 2986972340 C Ci:6:002:0 0 4 = 00000000
ffff00014c2bfc00 2986972490 S Ci:6:002:0 s c0 05 0774 0000 0004 4 <
ffff00014c2bfc00 2986972631 C Ci:6:002:0 0 4 = 00000000
ffff00014c2bfc00 2986972788 S Co:6:002:0 s 40 05 076e 0000 0001 1 = 0c
ffff00014c2bfc00 2986972930 C Co:6:002:0 0 1 >
ffff00014c2bfc00 2986973087 S Ci:6:002:0 s c0 05 0808 0000 0004 4 <
ffff00014c2bfc00 2986973234 C Ci:6:002:0 0 4 = 3382023e
ffff00014c2bfc00 2986973384 S Ci:6:002:0 s c0 05 0a5c 0000 0002 2 <
ffff00014c2bfc00 2986973520 C Ci:6:002:0 0 2 = 0000
ffff00014c2bfc00 2986973557 S Ci:6:002:0 s c0 05 0f48 0000 0002 2 <
ffff00014c2bfc00 2986973669 C Ci:6:002:0 0 2 = 8b90
ffff00014c2bfc00 2986973697 S Ci:6:002:0 s c0 05 0f04 0000 0004 4 <
ffff00014c2bfc00 2986973805 C Ci:6:002:0 0 4 = 00000000
ffff00014c2bfc00 2986973836 S Ci:6:002:0 s c0 05 0f14 0000 0004 4 <
ffff00014c2bfc00 2986973947 C Ci:6:002:0 0 4 = 7a0cb00f
ffff00014c2bfc00 2986973977 S Ci:6:002:0 s c0 05 0f10 0000 0004 4 <
ffff00014c2bfc00 2986974089 C Ci:6:002:0 0 4 = 00000000
ffff00014c2bfc00 2986974120 S Ci:6:002:0 s c0 05 0f0c 0000 0004 4 <
ffff00014c2bfc00 2986974242 C Ci:6:002:0 0 4 = 00000000
ffff00014c2bfc00 2986974265 S Ci:6:002:0 s c0 05 0f08 0000 0004 4 <
ffff00014c2bfc00 2986974390 C Ci:6:002:0 0 4 = 010005e5
ffff00014c2bfc00 2986974419 S Ci:6:002:0 s c0 05 0fcc 0000 0004 4 <
ffff00014c2bfc00 2986974460 C Ci:6:002:0 0 4 = 00000000
ffff00014c2bfc00 2986974476 S Ci:6:002:0 s c0 05 09a4 0000 0004 4 <
ffff00014c2bfc00 2986974588 C Ci:6:002:0 0 4 = 80000800
ffff00014c2bfc00 2986974614 S Co:6:002:0 s 40 05 09a4 0000 0004 4 = 80000a00
ffff00014c2bfc00 2986974719 C Co:6:002:0 0 4 >
ffff00014c2bfc00 2986974748 S Ci:6:002:0 s c0 05 09a4 0000 0004 4 <
ffff00014c2bfc00 2986974864 C Ci:6:002:0 0 4 = 80000a00
ffff00014c2bfc00 2986974885 S Co:6:002:0 s 40 05 09a4 0000 0004 4 = 80000800
ffff00014c2bfc00 2986974992 C Co:6:002:0 0 4 >
ffff00014c2bfc00 2986975021 S Ci:6:002:0 s c0 05 0a2c 0000 0004 4 <
ffff00014c2bfc00 2986975145 C Ci:6:002:0 0 4 = 00009000
ffff00014c2bfc00 2986975165 S Co:6:002:0 s 40 05 0a2c 0000 0004 4 = 00009000
ffff00014c2bfc00 2986975274 C Co:6:002:0 0 4 >
ffff00014c2bfc00 2986975303 S Ci:6:002:0 s c0 05 0a2c 0000 0004 4 <
ffff00014c2bfc00 2986975419 C Ci:6:002:0 0 4 = 00009000
ffff00014c2bfc00 2986975440 S Co:6:002:0 s 40 05 0a2c 0000 0004 4 = 00809000
ffff00014c2bfc00 2986975548 C Co:6:002:0 0 4 >
ffff00014c2bfc00 2986975577 S Ci:6:002:0 s c0 05 0b58 0000 0004 4 <
ffff00014c2bfc00 2986975620 C Ci:6:002:0 0 4 = 00000000
ffff00014c2bfc00 2986975636 S Co:6:002:0 s 40 05 0b58 0000 0004 4 = 01000000
ffff00014c2bfc00 2986975743 C Co:6:002:0 0 4 >
ffff00014c2bfc00 2986975772 S Ci:6:002:0 s c0 05 0b58 0000 0004 4 <
ffff00014c2bfc00 2986975892 C Ci:6:002:0 0 4 = 01000000
ffff00014c2bfc00 2986975921 S Co:6:002:0 s 40 05 0b58 0000 0004 4 = 00000000
ffff00014c2bfc00 2986976030 C Co:6:002:0 0 4 >
ffff00014c2bfc00 2986976062 S Ci:6:002:0 s c0 05 0c50 0000 0004 4 <
ffff00014c2bfc00 2986976181 C Ci:6:002:0 0 4 = 20000000
ffff00014c2bfc00 2986976202 S Co:6:002:0 s 40 05 0c50 0000 0004 4 = 22000000
ffff00014c2bfc00 2986976310 C Co:6:002:0 0 4 >
ffff00014c2bfc00 2986976340 S Ci:6:002:0 s c0 05 0e50 0000 0004 4 <
ffff00014c2bfc00 2986976464 C Ci:6:002:0 0 4 = 20000000
ffff00014c2bfc00 2986976485 S Co:6:002:0 s 40 05 0e50 0000 0004 4 = 22000000
ffff00014c2bfc00 2986976594 C Co:6:002:0 0 4 >
ffff00014c2bfc00 2986976624 S Ci:6:002:0 s c0 05 01cc 0000 0001 1 <
ffff00014c2bfc00 2986976740 C Ci:6:002:0 0 1 = 00
ffff00014c2bfc00 2986976762 S Co:6:002:0 s 40 05 01f0 0000 0004 4 = 00000000
ffff00014c2bfc00 2986976879 C Co:6:002:0 0 4 >
ffff00014c2bfc00 2986976909 S Co:6:002:0 s 40 05 01d0 0000 0004 4 = 58000000
ffff00014c2bfc00 2986977028 C Co:6:002:0 0 4 >
ffff00014c2bfc00 2986977054 S Co:6:002:0 s 40 05 0440 0000 0004 4 = 00000000
ffff00014c2bfc00 2986977161 C Co:6:002:0 0 4 >
ffff00014c2bfc00 2986977192 S Ci:6:002:0 s c0 05 0c00 0000 0004 4 <
ffff00014c2bfc00 2986977315 C Ci:6:002:0 0 4 = 07000000
ffff00014c2bfc00 2986977336 S Ci:6:002:0 s c0 05 08b0 0000 0004 4 <
ffff00014c2bfc00 2986977451 C Ci:6:002:0 0 4 = 18060000
ffff00014c2bfc00 2986977480 S Co:6:002:0 s 40 05 08b0 0000 0004 4 = 42060000
ffff00014c2bfc00 2986977592 C Co:6:002:0 0 4 >
ffff00014c2bfc00 2986977634 S Ci:6:002:0 s c0 05 0d04 0000 0004 4 <
ffff00014c2bfc00 2986977759 C Ci:6:002:0 0 4 = 108990b1
ffff00014c2bfc00 2986977789 S Co:6:002:0 s 40 05 0c90 0000 0004 4 = 10892304
ffff00014c2bfc00 2986977906 C Co:6:002:0 0 4 >
ffff00014c2bfc00 2986977941 S Co:6:002:0 s 40 05 0280 0000 0002 2 = 0001
ffff00014c2bfc00 2986978043 C Co:6:002:0 0 2 >
ffff00014c2bfc00 2986978065 S Ci:6:002:0 s c0 05 010c 0000 0001 1 <
ffff00014c2bfc00 2986978179 C Ci:6:002:0 0 1 = b0
ffff00014c2bfc00 2986978209 S Co:6:002:0 s 40 05 010c 0000 0001 1 = b4
ffff00014c2bfc00 2986978317 C Co:6:002:0 0 1 >
ffff000103533840 2987029764 C Bi:6:002:1 0 281 = e1000484 00000f00 1c006000 04300000 00000000 98252f00 22280000 55efef0f
ffff000103533840 2987029824 S Bi:6:002:1 -115 32768 <
ffff00014c2bfc00 2987100153 S Ci:6:002:0 s c0 05 004c 0000 0001 1 <
ffff00014c2bfc00 2987100269 C Ci:6:002:0 0 1 = 20
ffff00014c2bfc00 2987100397 S Co:6:002:0 s 40 05 004c 0000 0001 1 = 28
ffff00014c2bfc00 2987100524 C Co:6:002:0 0 1 >
ffff000103533b40 2987119801 C Bi:6:002:1 0 111 = 37008484 00000f20 01006900 04380000 00000000 61863000 42400000 84eaea0f
ffff000103533b40 2987119828 S Bi:6:002:1 -115 32768 <
ffff000103533d80 2987120067 C Bi:6:002:1 0 111 = 37008484 00000f20 02006900 04380000 00000000 92873000 44400000 87eaea0f
ffff000103533d80 2987120084 S Bi:6:002:1 -115 32768 <
ffff0001035339c0 2987136367 C Bi:6:002:1 0 281 = e1000484 00000f00 1d006000 04300000 00000000 02c63000 282e0000 5ff3f30f
ffff0001035339c0 2987136422 S Bi:6:002:1 -115 32768 <
ffff000103533840 2987144919 C Bi:6:002:1 0 104 = 30008484 00000f20 03006900 04380000 00000000 69e83000 403a0000 7deaea0f
ffff000103533840 2987144945 S Bi:6:002:1 -115 32768 <
ffff000103533b40 2987181185 C Bi:6:002:1 0 535 = df018484 00000f20 04006900 04380000 00000000 c0733100 403a0000 7debeb0f
ffff000103533b40 2987181213 S Bi:6:002:1 -115 32768 <
ffff000103533d80 2987196852 C Bi:6:002:1 0 104 = 30008484 00000f20 05006900 04380000 00000000 64b33100 3e3c0000 7aeaea0f
ffff000103533d80 2987196877 S Bi:6:002:1 -115 32768 <
ffff0001035339c0 2987209808 C Bi:6:002:1 0 104 = 30008484 00000f20 06006900 04380000 00000000 eae53100 403c0000 79e9e90f
ffff0001035339c0 2987209834 S Bi:6:002:1 -115 32768 <
ffff000103533840 2987219860 C Bi:6:002:1 0 104 = 30008484 00000f20 07006900 04380000 00000000 310d3200 403a0000 7ae9e90f
ffff000103533840 2987219889 S Bi:6:002:1 -115 32768 <
ffff000103533b40 2987230485 C Bi:6:002:1 0 104 = 30008484 00000f20 08006900 04380000 00000000 9c363200 3e3a0000 7ae9e90f
ffff000103533b40 2987230514 S Bi:6:002:1 -115 32768 <
ffff000103533d80 2987242214 C Bi:6:002:1 0 104 = 30008484 00000f20 09006900 04380000 00000000 63643200 40380000 79e8e80f
ffff000103533d80 2987242271 S Bi:6:002:1 -115 32768 <
ffff0001035339c0 2987252122 C Bi:6:002:1 0 104 = 30008484 00000f20 0a006900 04380000 00000000 398b3200 3e3a0000 79e9e90f
ffff0001035339c0 2987252150 S Bi:6:002:1 -115 32768 <
ffff00014c2bfc00 2987272258 S Ci:6:002:0 s c0 05 004c 0000 0001 1 <
ffff00014c2bfc00 2987272347 C Ci:6:002:0 0 1 = 28
ffff00014c2bfc00 2987272490 S Co:6:002:0 s 40 05 004c 0000 0001 1 = 20
ffff00014c2bfc00 2987272615 C Co:6:002:0 0 1 >
ffff000103533840 2987290297 C Bi:6:002:1 0 266 = d2008484 00000f20 0b006900 04380000 00000000 661f3300 3e3a0000 76eaea0f
ffff000103533840 2987290324 S Bi:6:002:1 -115 32768 <
ffff000103533b40 2987300240 C Bi:6:002:1 0 281 = e1000484 00000f00 1e006000 04300000 00000000 2e463300 32340000 64f1f10f
ffff000103533b40 2987300266 S Bi:6:002:1 -115 32768 <
ffff000103533d80 2987363339 C Bi:6:002:1 0 104 = 30008484 00000f20 0c006900 04380000 00000000 873d3400 3c3e0000 78e9e90f
ffff000103533d80 2987363368 S Bi:6:002:1 -115 32768 <
ffff0001035339c0 2987373625 C Bi:6:002:1 0 142 = 56008484 00000f20 0d006900 04380000 00000000 94653400 3c3e0000 77ebeb0f
ffff0001035339c0 2987373650 S Bi:6:002:1 -115 32768 <
ffff000103533840 2987388235 C Bi:6:002:1 0 196 = 8c008484 00000f20 0e006900 04380000 00000000 729e3400 3e3e0000 76eaea0f
ffff000103533840 2987388272 S Bi:6:002:1 -115 32768 <
ffff000103533b40 2987406777 C Bi:6:002:1 0 281 = e1000484 00000f00 20006000 04300000 00000000 54e63400 2e340000 65efef0f
ffff000103533b40 2987406801 S Bi:6:002:1 -115 32768 <
ffff000103533d80 2987410167 C Bi:6:002:1 0 135 = 4f008484 00000f20 0f006900 04380000 00000000 69f43400 3c400000 7de8e80f
ffff000103533d80 2987410194 S Bi:6:002:1 -115 32768 <
ffff0001035339c0 2987429208 C Bi:6:002:1 0 144 = 58008484 00000f20 10006900 04380000 00000000 da3e3500 3c400000 80e9e90f
ffff0001035339c0 2987429231 S Bi:6:002:1 -115 32768 <
ffff00014c2bfc00 2987444267 S Ci:6:002:0 s c0 05 004c 0000 0001 1 <
ffff00014c2bfc00 2987444410 C Ci:6:002:0 0 1 = 20
ffff00014c2bfc00 2987444576 S Co:6:002:0 s 40 05 004c 0000 0001 1 = 28
ffff00014c2bfc00 2987444718 C Co:6:002:0 0 1 >
ffff000103533840 2987452758 C Bi:6:002:1 0 336 = 18018484 00000f20 11006900 04380000 00000000 ca993500 3c400000 7aeaea0f
ffff000103533840 2987452796 S Bi:6:002:1 -115 32768 <
ffff000103533b40 2987475665 C Bi:6:002:1 0 193 = 89008484 00000f20 12006900 04380000 00000000 09f43500 3e420000 7fe9e90f
ffff000103533b40 2987475697 S Bi:6:002:1 -115 32768 <
ffff000103533d80 2987568783 C Bi:6:002:1 0 281 = e1000484 00000f00 21006000 04300000 00000000 435f3700 32340000 64f4f40f
ffff000103533d80 2987568831 S Bi:6:002:1 -115 32768 <
ffff0001035339c0 2987579563 C Bi:6:002:1 0 438 = 7e01848c 00000f20 16007900 04380000 00000000 87883700 40400000 80e8e80f
ffff0001035339c0 2987579591 S Bi:6:002:1 -115 32768 <
ffff00014c2bfc00 2987616268 S Ci:6:002:0 s c0 05 004c 0000 0001 1 <
ffff00014c2bfc00 2987616428 C Ci:6:002:0 0 1 = 28
ffff00014c2bfc00 2987616589 S Co:6:002:0 s 40 05 004c 0000 0001 1 = 20
ffff00014c2bfc00 2987616728 C Co:6:002:0 0 1 >
ffff000103533840 2987710903 C Bi:6:002:1 0 281 = e1000484 00000f00 22006000 04300000 00000000 4a8a3900 2e340000 62f2f20f
ffff000103533840 2987710961 S Bi:6:002:1 -115 32768 <
ffff00014c2bfc00 2987780283 S Ci:6:002:0 s c0 05 004c 0000 0001 1 <
ffff00014c2bfc00 2987780439 C Ci:6:002:0 0 1 = 20
ffff00014c2bfc00 2987780604 S Co:6:002:0 s 40 05 004c 0000 0001 1 = 28
ffff00014c2bfc00 2987780742 C Co:6:002:0 0 1 >
ffff000103533b40 2987847112 C Bi:6:002:1 0 281 = e1000484 00000f00 23006000 04300000 00000000 6c9e3b00 2c360000 67eded0f
ffff000103533b40 2987847139 S Bi:6:002:1 -115 32768 <
ffff000103533d80 2987951398 C Bi:6:002:1 0 281 = e1000484 00000f00 24006000 04300000 00000000 bc353d00 2c340000 60efef0f
ffff000103533d80 2987951458 S Bi:6:002:1 -115 32768 <
ffff00014c2bfc00 2987952157 S Ci:6:002:0 s c0 05 004c 0000 0001 1 <
ffff00014c2bfc00 2987952241 C Ci:6:002:0 0 1 = 28
ffff00014c2bfc00 2987952376 S Co:6:002:0 s 40 05 004c 0000 0001 1 = 20
ffff00014c2bfc00 2987952514 C Co:6:002:0 0 1 >
ffff00014c2bfc00 2988124159 S Ci:6:002:0 s c0 05 004c 0000 0001 1 <
ffff00014c2bfc00 2988124224 C Ci:6:002:0 0 1 = 20
ffff00014c2bfc00 2988124367 S Co:6:002:0 s 40 05 004c 0000 0001 1 = 28
ffff00014c2bfc00 2988124510 C Co:6:002:0 0 1 >
ffff0001035339c0 2988286126 C Bi:6:002:1 0 281 = e1000484 00000f00 25006000 04300000 00000000 53514200 2e300000 5ff0f00f
ffff0001035339c0 2988286173 S Bi:6:002:1 -115 32768 <
ffff00014c2bfc00 2988296174 S Ci:6:002:0 s c0 05 004c 0000 0001 1 <
ffff00014c2bfc00 2988296308 C Ci:6:002:0 0 1 = 28
ffff00014c2bfc00 2988296461 S Co:6:002:0 s 40 05 004c 0000 0001 1 = 20
ffff00014c2bfc00 2988296572 C Co:6:002:0 0 1 >
ffff00014c2bfc00 2988468280 S Ci:6:002:0 s c0 05 004c 0000 0001 1 <
ffff00014c2bfc00 2988468440 C Ci:6:002:0 0 1 = 20
ffff00014c2bfc00 2988468603 S Co:6:002:0 s 40 05 004c 0000 0001 1 = 28
ffff00014c2bfc00 2988468741 C Co:6:002:0 0 1 >
ffff000103533840 2988638728 C Bi:6:002:1 0 281 = e1000484 00000f00 27006000 04300000 00000000 d2b24700 2c2a0000 5ef3f30f
ffff000103533840 2988638782 S Bi:6:002:1 -115 32768 <
ffff00014c2bfc00 2988640169 S Ci:6:002:0 s c0 05 004c 0000 0001 1 <
ffff00014c2bfc00 2988640321 C Ci:6:002:0 0 1 = 28
ffff00014c2bfc00 2988640478 S Co:6:002:0 s 40 05 004c 0000 0001 1 = 20
ffff00014c2bfc00 2988640616 C Co:6:002:0 0 1 >
ffff00014c2bfc00 2988764199 S Ci:6:002:0 s c0 05 0770 0000 0004 4 <
ffff00014c2bfc00 2988764350 C Ci:6:002:0 0 4 = 00000000
ffff00014c2bfc00 2988764507 S Ci:6:002:0 s c0 05 0774 0000 0004 4 <
ffff00014c2bfc00 2988764651 C Ci:6:002:0 0 4 = 00000000
ffff00014c2bfc00 2988764813 S Co:6:002:0 s 40 05 076e 0000 0001 1 = 0c
ffff00014c2bfc00 2988764952 C Co:6:002:0 0 1 >
ffff00014c2bfc00 2988765117 S Ci:6:002:0 s c0 05 0808 0000 0004 4 <
ffff00014c2bfc00 2988765264 C Ci:6:002:0 0 4 = 3382023e
ffff00014c2bfc00 2988765424 S Ci:6:002:0 s c0 05 0a5c 0000 0002 2 <
ffff00014c2bfc00 2988765569 C Ci:6:002:0 0 2 = 0000
ffff00014c2bfc00 2988765730 S Ci:6:002:0 s c0 05 0f48 0000 0002 2 <
ffff00014c2bfc00 2988765879 C Ci:6:002:0 0 2 = 7d02
ffff00014c2bfc00 2988766024 S Ci:6:002:0 s c0 05 0f04 0000 0004 4 <
ffff00014c2bfc00 2988766143 C Ci:6:002:0 0 4 = 00000000
ffff00014c2bfc00 2988766179 S Ci:6:002:0 s c0 05 0f14 0000 0004 4 <
ffff00014c2bfc00 2988766289 C Ci:6:002:0 0 4 = 50044b02
ffff00014c2bfc00 2988766318 S Ci:6:002:0 s c0 05 0f10 0000 0004 4 <
ffff00014c2bfc00 2988766429 C Ci:6:002:0 0 4 = 00000000
ffff00014c2bfc00 2988766458 S Ci:6:002:0 s c0 05 0f0c 0000 0004 4 <
ffff00014c2bfc00 2988766569 C Ci:6:002:0 0 4 = 00000000
ffff00014c2bfc00 2988766598 S Ci:6:002:0 s c0 05 0f08 0000 0004 4 <
ffff00014c2bfc00 2988766714 C Ci:6:002:0 0 4 = 00001709
ffff00014c2bfc00 2988766735 S Ci:6:002:0 s c0 05 0fcc 0000 0004 4 <
ffff00014c2bfc00 2988766846 C Ci:6:002:0 0 4 = 00000000
ffff00014c2bfc00 2988766874 S Ci:6:002:0 s c0 05 09a4 0000 0004 4 <
ffff00014c2bfc00 2988766993 C Ci:6:002:0 0 4 = 80000800
ffff00014c2bfc00 2988767016 S Co:6:002:0 s 40 05 09a4 0000 0004 4 = 80000a00
ffff00014c2bfc00 2988767122 C Co:6:002:0 0 4 >
ffff00014c2bfc00 2988767151 S Ci:6:002:0 s c0 05 09a4 0000 0004 4 <
ffff00014c2bfc00 2988767263 C Ci:6:002:0 0 4 = 80000a00
ffff00014c2bfc00 2988767284 S Co:6:002:0 s 40 05 09a4 0000 0004 4 = 80000800
ffff00014c2bfc00 2988767391 C Co:6:002:0 0 4 >
ffff00014c2bfc00 2988767420 S Ci:6:002:0 s c0 05 0a2c 0000 0004 4 <
ffff00014c2bfc00 2988767531 C Ci:6:002:0 0 4 = 00809000
ffff00014c2bfc00 2988767560 S Co:6:002:0 s 40 05 0a2c 0000 0004 4 = 00009000
ffff00014c2bfc00 2988767674 C Co:6:002:0 0 4 >
ffff00014c2bfc00 2988767695 S Ci:6:002:0 s c0 05 0a2c 0000 0004 4 <
ffff00014c2bfc00 2988767807 C Ci:6:002:0 0 4 = 00009000
ffff00014c2bfc00 2988767836 S Co:6:002:0 s 40 05 0a2c 0000 0004 4 = 00809000
ffff00014c2bfc00 2988767947 C Co:6:002:0 0 4 >
ffff00014c2bfc00 2988767969 S Ci:6:002:0 s c0 05 0b58 0000 0004 4 <
ffff00014c2bfc00 2988768096 C Ci:6:002:0 0 4 = 00000000
ffff00014c2bfc00 2988768126 S Co:6:002:0 s 40 05 0b58 0000 0004 4 = 01000000
ffff00014c2bfc00 2988768241 C Co:6:002:0 0 4 >
ffff00014c2bfc00 2988768262 S Ci:6:002:0 s c0 05 0b58 0000 0004 4 <
ffff00014c2bfc00 2988768373 C Ci:6:002:0 0 4 = 01000000
ffff00014c2bfc00 2988768402 S Co:6:002:0 s 40 05 0b58 0000 0004 4 = 00000000
ffff00014c2bfc00 2988768517 C Co:6:002:0 0 4 >
ffff00014c2bfc00 2988768539 S Ci:6:002:0 s c0 05 0c50 0000 0004 4 <
ffff00014c2bfc00 2988768649 C Ci:6:002:0 0 4 = 22000000
ffff00014c2bfc00 2988768679 S Co:6:002:0 s 40 05 0c50 0000 0004 4 = 20000000
ffff00014c2bfc00 2988768793 C Co:6:002:0 0 4 >
ffff00014c2bfc00 2988768814 S Ci:6:002:0 s c0 05 0e50 0000 0004 4 <
ffff00014c2bfc00 2988768926 C Ci:6:002:0 0 4 = 22000000
ffff00014c2bfc00 2988768955 S Co:6:002:0 s 40 05 0e50 0000 0004 4 = 20000000
ffff00014c2bfc00 2988769070 C Co:6:002:0 0 4 >
ffff00014c2bfc00 2988769092 S Ci:6:002:0 s c0 05 01cc 0000 0001 1 <
ffff00014c2bfc00 2988769202 C Ci:6:002:0 0 1 = 00
ffff00014c2bfc00 2988769232 S Co:6:002:0 s 40 05 01f4 0000 0004 4 = 00000000
ffff00014c2bfc00 2988769339 C Co:6:002:0 0 4 >
ffff00014c2bfc00 2988769370 S Co:6:002:0 s 40 05 01d4 0000 0004 4 = 58000000
ffff00014c2bfc00 2988769489 C Co:6:002:0 0 4 >
ffff00014c2bfc00 2988769520 S Co:6:002:0 s 40 05 0440 0000 0004 4 = 00000000
ffff00014c2bfc00 2988769626 C Co:6:002:0 0 4 >
ffff00014c2bfc00 2988769658 S Ci:6:002:0 s c0 05 0c00 0000 0004 4 <
ffff00014c2bfc00 2988769772 C Ci:6:002:0 0 4 = 07000000
ffff00014c2bfc00 2988769793 S Ci:6:002:0 s c0 05 08b0 0000 0004 4 <
ffff00014c2bfc00 2988769905 C Ci:6:002:0 0 4 = 42060000
ffff00014c2bfc00 2988769934 S Co:6:002:0 s 40 05 08b0 0000 0004 4 = 42060000
ffff00014c2bfc00 2988770043 C Co:6:002:0 0 4 >
ffff00014c2bfc00 2988770085 S Ci:6:002:0 s c0 05 0d04 0000 0004 4 <
ffff00014c2bfc00 2988770191 C Ci:6:002:0 0 4 = 108d90b1
ffff00014c2bfc00 2988770214 S Ci:6:002:0 s c0 05 0c1c 0000 0004 4 <
ffff00014c2bfc00 2988770328 C Ci:6:002:0 0 4 = 0300402d
ffff00014c2bfc00 2988770358 S Co:6:002:0 s 40 05 0c1c 0000 0004 4 = 0300e032
ffff00014c2bfc00 2988770472 C Co:6:002:0 0 4 >
ffff00014c2bfc00 2988770493 S Ci:6:002:0 s c0 05 0e1c 0000 0004 4 <
ffff00014c2bfc00 2988770620 C Ci:6:002:0 0 4 = 0300402d
ffff00014c2bfc00 2988770649 S Co:6:002:0 s 40 05 0e1c 0000 0004 4 = 0300e035
ffff00014c2bfc00 2988770764 C Co:6:002:0 0 4 >
ffff00014c2bfc00 2988770786 S Co:6:002:0 s 40 05 0280 0000 0002 2 = 0001
ffff00014c2bfc00 2988770893 C Co:6:002:0 0 2 >
ffff00014c2bfc00 2988770923 S Ci:6:002:0 s c0 05 010c 0000 0001 1 <
ffff00014c2bfc00 2988771034 C Ci:6:002:0 0 1 = b4
ffff00014c2bfc00 2988771065 S Co:6:002:0 s 40 05 010c 0000 0001 1 = b4
ffff00014c2bfc00 2988771171 C Co:6:002:0 0 1 >
ffff00014c2bfc00 2988796355 S Ci:6:002:0 s c0 05 004c 0000 0001 1 <
ffff00014c2bfc00 2988796518 C Ci:6:002:0 0 1 = 20
ffff00014c2bfc00 2988796674 S Co:6:002:0 s 40 05 004c 0000 0001 1 = 20
ffff00014c2bfc00 2988796792 C Co:6:002:0 0 1 >
ffff000103533b40 2989028858 C Bi:6:002:1 0 281 = e1000484 00000f00 28006000 04300000 00000000 c0a64d00 2e320000 56f1f10f
ffff000103533b40 2989028915 S Bi:6:002:1 -115 32768 <
ffff00014c2bfc00 2989756150 S Ci:6:002:0 s c0 05 004c 0000 0001 1 <
ffff00014c2bfc00 2989756236 C Ci:6:002:0 0 1 = 20
ffff00014c2bfc00 2989756383 S Co:6:002:0 s 40 05 004c 0000 0001 1 = 20
ffff00014c2bfc00 2989756508 C Co:6:002:0 0 1 >
ffff000103533d80 2989773751 C Bi:6:002:1 0 118 = 3e000484 00000f80 11056000 04300000 00000000 65055900 3c400000 7eeded0f
ffff000103533d80 2989773785 S Bi:6:002:1 -115 32768 <
ffff0001035339c0 2989776067 C Bi:6:002:1 0 118 = 3e000484 00000f80 12056000 04300000 00000000 5a0e5900 3c400000 81ecec0f
ffff0001035339c0 2989776093 S Bi:6:002:1 -115 32768 <
ffff000103533840 2989924500 C Bi:6:002:1 0 281 = e1000484 00000f00 2a006000 04300000 00000000 32515b00 2e280000 56f4f40f
ffff000103533840 2989924544 S Bi:6:002:1 -115 32768 <
ffff000103533b40 2990089000 C Bi:6:002:1 0 281 = e1000484 00000f00 2b006000 04300000 00000000 fdd35d00 2a2a0000 56f0f00f
ffff000103533b40 2990089032 S Bi:6:002:1 -115 32768 <
ffff000103533d80 2990194922 C Bi:6:002:1 0 281 = e1000484 00000f00 2c006000 04300000 00000000 95715f00 2a260000 59f1f10f
ffff000103533d80 2990194971 S Bi:6:002:1 -115 32768 <
