ffff00014c2bf900 1199612842 C Bi:6:002:1 0 383 = 47010484 00000f80 c70b6000 04300000 00000000 102d3b02 463c0000 85f4f401
ffff00014c2bf900 1199612892 S Bi:6:002:1 -115 32768 <
ffff00013d62e840 1199613887 C Bi:6:002:1 0 376 = 40010484 00000f80 34036000 04300000 00000000 2e313b02 463e0000 89f0f001
ffff00013d62e840 1199613904 S Bi:6:002:1 -115 32768 <
ffff000103533900 1199614794 C Bi:6:002:1 0 351 = 27010484 00000f80 f60c6000 04300000 00000000 e8343b02 463c0000 8cecec01
ffff000103533900 1199614808 S Bi:6:002:1 -115 32768 <
ffff000103558cc0 1199615692 C Bi:6:002:1 0 374 = 3e010484 00000f80 c7076000 04300000 00000000 92383b02 463c0000 85f1f101
ffff000103558cc0 1199615702 S Bi:6:002:1 -115 32768 <
ffff00014c2bf900 1199616683 C Bi:6:002:1 0 384 = 48010484 00000f80 970a6000 04300000 00000000 153c3b02 463e0000 87f2f201
ffff00014c2bf900 1199616705 S Bi:6:002:1 -115 32768 <
ffff00013d62e840 1199715594 C Bi:6:002:1 0 383 = 47010484 00000f80 c80b6000 04300000 00000000 46be3c02 463e0000 8cf2f201
ffff00013d62e840 1199715646 S Bi:6:002:1 -115 32768 <
ffff000103533900 1199716506 C Bi:6:002:1 0 376 = 40010484 00000f80 35036000 04300000 00000000 ecc13c02 463c0000 8cefef01
ffff000103533900 1199716532 S Bi:6:002:1 -115 32768 <
ffff000103558cc0 1199717419 C Bi:6:002:1 0 351 = 27010484 00000f80 f70c6000 04300000 00000000 a6c53c02 48400000 8af0f001
ffff000103558cc0 1199717444 S Bi:6:002:1 -115 32768 <
ffff00014c2bf900 1199719251 C Bi:6:002:1 0 384 = 48010484 00000f80 980a6000 04300000 00000000 9ecc3c02 46380000 8aecec01
ffff00014c2bf900 1199719276 S Bi:6:002:1 -115 32768 <
ffff00013d9fb000 1199740200 S Ci:6:002:0 s c0 05 004c 0000 0001 1 <
ffff00013d9fb000 1199740350 C Ci:6:002:0 0 1 = 20
ffff00013d9fb000 1199740495 S Co:6:002:0 s 40 05 004c 0000 0001 1 = 20
ffff00013d9fb000 1199740606 C Co:6:002:0 0 1 >
ffff00013d62e840 1199791312 C Bi:6:002:1 0 377 = 41010484 00000f00 4a0d6000 04300000 00000000 12e63d02 483a0000 8aeded01
ffff00013d62e840 1199791352 S Bi:6:002:1 -115 32768 <
ffff000103533900 1199791949 C Bi:6:002:1 0 377 = 41010484 00000f00 4a0d6000 04300000 00000000 a8e83d02 463c0000 8aeaea01
ffff000103533900 1199791974 S Bi:6:002:1 -115 32768 <
ffff000103558cc0 1199792564 C Bi:6:002:1 0 377 = 41010484 00000f00 4a0d6000 04300000 00000000 10eb3d02 46380000 85ebeb01
ffff000103558cc0 1199792589 S Bi:6:002:1 -115 32768 <
ffff00014c2bf900 1199793179 C Bi:6:002:1 0 377 = 41010484 00000f00 4a0d6000 04300000 00000000 75ed3d02 463a0000 8aefef01
ffff00014c2bf900 1199793203 S Bi:6:002:1 -115 32768 <
ffff00013d62e840 1199793792 C Bi:6:002:1 0 370 = 3a010484 00000f00 2d066000 04300000 00000000 e5ef3d02 46400000 86f5f501
ffff00013d62e840 1199793817 S Bi:6:002:1 -115 32768 <
ffff000103533900 1199794420 C Bi:6:002:1 0 370 = 3a010484 00000f00 2d066000 04300000 00000000 54f23d02 463c0000 87f4f401
ffff000103533900 1199794444 S Bi:6:002:1 -115 32768 <
ffff000103558cc0 1199795032 C Bi:6:002:1 0 370 = 3a010484 00000f00 2d066000 04300000 00000000 b2f43d02 443a0000 89f5f501
ffff000103558cc0 1199795056 S Bi:6:002:1 -115 32768 <
ffff00014c2bf900 1199795611 C Bi:6:002:1 0 370 = 3a010484 00000f00 2d066000 04300000 00000000 0ef73d02 46360000 89f6f601
ffff00014c2bf900 1199795632 S Bi:6:002:1 -115 32768 <
ffff00013d62e840 1199796185 C Bi:6:002:1 0 345 = 21010484 00000f00 dd086000 04300000 00000000 74f93d02 463e0000 87f9f901
ffff00013d62e840 1199796205 S Bi:6:002:1 -115 32768 <
ffff000103533900 1199796768 C Bi:6:002:1 0 345 = 21010484 00000f00 dd086000 04300000 00000000 bafb3d02 463a0000 89f7f701
ffff000103533900 1199796788 S Bi:6:002:1 -115 32768 <
ffff000103558cc0 1199797347 C Bi:6:002:1 0 345 = 21010484 00000f00 dd086000 04300000 00000000 00fe3d02 463c0000 89f1f101
ffff000103558cc0 1199797366 S Bi:6:002:1 -115 32768 <
ffff00014c2bf900 1199797961 C Bi:6:002:1 0 345 = 21010484 00000f00 dd086000 04300000 00000000 3e003e02 463a0000 84f2f201
ffff00014c2bf900 1199797986 S Bi:6:002:1 -115 32768 <
ffff00013d62e840 1199798572 C Bi:6:002:1 0 378 = 42010484 00000f00 7f0a6000 04300000 00000000 83023e02 463c0000 86f2f201
ffff00013d62e840 1199798596 S Bi:6:002:1 -115 32768 <
ffff000103533900 1199799200 C Bi:6:002:1 0 378 = 42010484 00000f00 7f0a6000 04300000 00000000 f5043e02 463a0000 8cf8f801
ffff000103533900 1199799225 S Bi:6:002:1 -115 32768 <
ffff000103558cc0 1199799797 C Bi:6:002:1 0 378 = 42010484 00000f00 7f0a6000 04300000 00000000 5e073e02 463a0000 8aefef01
ffff000103558cc0 1199799818 S Bi:6:002:1 -115 32768 <
ffff00014c2bf900 1199800416 C Bi:6:002:1 0 378 = 42010484 00000f00 7f0a6000 04300000 00000000 c7093e02 463c0000 89f1f101
ffff00014c2bf900 1199800437 S Bi:6:002:1 -115 32768 <
ffff00013d62e840 1199817689 C Bi:6:002:1 0 383 = 47010484 00000f80 c90b6000 04300000 00000000 134d3e02 463a0000 86f1f101
ffff00013d62e840 1199817717 S Bi:6:002:1 -115 32768 <
ffff000103533900 1199819070 C Bi:6:002:1 0 376 = 40010484 00000f80 36036000 04300000 00000000 98523e02 463c0000 88fefe01
ffff000103533900 1199819095 S Bi:6:002:1 -115 32768 <
ffff000103558cc0 1199819989 C Bi:6:002:1 0 351 = 27010484 00000f80 f80c6000 04300000 00000000 52563e02 463a0000 86efef01
ffff000103558cc0 1199820014 S Bi:6:002:1 -115 32768 <
ffff00014c2bf900 1199821784 C Bi:6:002:1 0 384 = 48010484 00000f80 990a6000 04300000 00000000 225d3e02 463c0000 88fbfb01
ffff00014c2bf900 1199821810 S Bi:6:002:1 -115 32768 <
ffff00013d62e840 1199920075 C Bi:6:002:1 0 383 = 47010484 00000f80 ca0b6000 04300000 00000000 14dd3f02 463e0000 8af1f101
ffff00013d62e840 1199920097 S Bi:6:002:1 -115 32768 <
ffff000103533900 1199921509 C Bi:6:002:1 0 376 = 40010484 00000f80 37036000 04300000 00000000 c7e23f02 46380000 88f4f401
ffff000103533900 1199921534 S Bi:6:002:1 -115 32768 <
ffff000103558cc0 1199923198 C Bi:6:002:1 0 374 = 3e010484 00000f80 ca076000 04300000 00000000 51e93f02 443a0000 86fbfb01
ffff000103558cc0 1199923223 S Bi:6:002:1 -115 32768 <
ffff00014c2bf900 1199924055 C Bi:6:002:1 0 384 = 48010484 00000f80 9a0a6000 04300000 00000000 a0ec3f02 463a0000 87f7f701
ffff00014c2bf900 1199924080 S Bi:6:002:1 -115 32768 <
ffff00013d62e840 1199927759 C Bi:6:002:1 0 377 = 41010484 00000f00 4b0d6000 04300000 00000000 29fb3f02 463c0000 8af0f001
ffff00013d62e840 1199927784 S Bi:6:002:1 -115 32768 <
ffff000103533900 1199928411 C Bi:6:002:1 0 377 = 41010484 00000f00 4b0d6000 04300000 00000000 a9fd3f02 46400000 87fefe01
ffff000103533900 1199928435 S Bi:6:002:1 -115 32768 <
ffff000103558cc0 1199929031 C Bi:6:002:1 0 377 = 41010484 00000f00 4b0d6000 04300000 00000000 17004002 463a0000 87f1f101
ffff000103558cc0 1199929056 S Bi:6:002:1 -115 32768 <
ffff00014c2bf900 1199929634 C Bi:6:002:1 0 377 = 41010484 00000f00 4b0d6000 04300000 00000000 7c024002 463c0000 86f7f701
ffff00014c2bf900 1199929659 S Bi:6:002:1 -115 32768 <
ffff00013d62e840 1199930246 C Bi:6:002:1 0 370 = 3a010484 00000f00 2e066000 04300000 00000000 ea044002 463c0000 8bf9f901
ffff00013d62e840 1199930270 S Bi:6:002:1 -115 32768 <
ffff000103533900 1199930871 C Bi:6:002:1 0 370 = 3a010484 00000f00 2e066000 04300000 00000000 59074002 463c0000 85eaea01
ffff000103533900 1199930895 S Bi:6:002:1 -115 32768 <
ffff000103558cc0 1199936492 C Bi:6:002:1 0 370 = 3a010484 00000f00 2e066000 04300000 00000000 461d4002 463c0000 88000001
ffff000103558cc0 1199936518 S Bi:6:002:1 -115 32768 <
ffff00014c2bf900 1199937099 C Bi:6:002:1 0 370 = 3a010484 00000f00 2e066000 04300000 00000000 ac1f4002 463a0000 88f5f501
ffff00014c2bf900 1199937126 S Bi:6:002:1 -115 32768 <
ffff00013d62e840 1199937660 C Bi:6:002:1 0 345 = 21010484 00000f00 de086000 04300000 00000000 12224002 463a0000 8de6e601
ffff00013d62e840 1199937682 S Bi:6:002:1 -115 32768 <
ffff000103533900 1199938238 C Bi:6:002:1 0 345 = 21010484 00000f00 de086000 04300000 00000000 58244002 443a0000 89f9f901
ffff000103533900 1199938258 S Bi:6:002:1 -115 32768 <
ffff000103558cc0 1199938825 C Bi:6:002:1 0 345 = 21010484 00000f00 de086000 04300000 00000000 a7264002 463a0000 87f3f301
ffff000103558cc0 1199938844 S Bi:6:002:1 -115 32768 <
ffff00014c2bf900 1199940113 C Bi:6:002:1 0 378 = 42010484 00000f00 800a6000 04300000 00000000 572b4002 463c0000 89fafa01
ffff00014c2bf900 1199940138 S Bi:6:002:1 -115 32768 <
ffff00013d62e840 1199943858 C Bi:6:002:1 0 378 = 42010484 00000f00 800a6000 04300000 00000000 0a3a4002 463c0000 86f3f301
ffff00013d62e840 1199943884 S Bi:6:002:1 -115 32768 <
ffff000103533900 1199944459 C Bi:6:002:1 0 378 = 42010484 00000f00 800a6000 04300000 00000000 733c4002 463a0000 84f5f501
ffff000103533900 1199944486 S Bi:6:002:1 -115 32768 <
ffff000103558cc0 1199989641 C Bi:6:002:1 0 370 = 3a010484 00000f00 2f066000 04300000 00000000 f9ec4002 463c0000 88f7f701
ffff000103558cc0 1199989676 S Bi:6:002:1 -115 32768 <
ffff00014c2bf900 1199996339 C Bi:6:002:1 0 370 = 3a010484 00000f00 2f066000 04300000 00000000 1c074102 463e0000 8af4f401
ffff00014c2bf900 1199996371 S Bi:6:002:1 -115 32768 <
ffff00013d62e840 1199996968 C Bi:6:002:1 0 370 = 3a010484 00000f00 2f066000 04300000 00000000 8b094102 46380000 8af9f901
ffff00013d62e840 1199996993 S Bi:6:002:1 -115 32768 <
ffff000103533900 1199997575 C Bi:6:002:1 0 370 = 3a010484 00000f00 2f066000 04300000 00000000 e80b4102 463a0000 89f4f401
ffff000103533900 1199997599 S Bi:6:002:1 -115 32768 <
ffff000103558cc0 1200022482 C Bi:6:002:1 0 383 = 47010484 00000f80 cb0b6000 04300000 00000000 166d4102 463e0000 8af2f201
ffff000103558cc0 1200022508 S Bi:6:002:1 -115 32768 <
ffff00014c2bf900 1200023505 C Bi:6:002:1 0 376 = 40010484 00000f80 38036000 04300000 00000000 2e714102 463c0000 87f2f201
ffff00014c2bf900 1200023531 S Bi:6:002:1 -115 32768 <
ffff00013d62e840 1200024343 C Bi:6:002:1 0 351 = 27010484 00000f80 fa0c6000 04300000 00000000 a3744102 423a0000 84efef01
ffff00013d62e840 1200024369 S Bi:6:002:1 -115 32768 <
ffff000103533900 1200026033 C Bi:6:002:1 0 384 = 48010484 00000f80 9b0a6000 04300000 00000000 027b4102 463a0000 87fbfb01
ffff000103533900 1200026057 S Bi:6:002:1 -115 32768 <
ffff000103558cc0 1200124896 C Bi:6:002:1 0 383 = 47010484 00000f80 cc0b6000 04300000 00000000 17fd4202 463a0000 8bf4f401
ffff000103558cc0 1200124942 S Bi:6:002:1 -115 32768 <
ffff00014c2bf900 1200125956 C Bi:6:002:1 0 376 = 40010484 00000f80 39036000 04300000 00000000 5e014302 46380000 89eeee01
ffff00014c2bf900 1200125983 S Bi:6:002:1 -115 32768 <
ffff00013d62e840 1200126875 C Bi:6:002:1 0 351 = 27010484 00000f80 fb0c6000 04300000 00000000 18054302 44380000 88f5f501
ffff00013d62e840 1200126899 S Bi:6:002:1 -115 32768 <
ffff000103533900 1200127825 C Bi:6:002:1 0 374 = 3e010484 00000f80 cc076000 04300000 00000000 c2084302 46380000 87eded01
ffff000103533900 1200127847 S Bi:6:002:1 -115 32768 <
ffff000103558cc0 1200128800 C Bi:6:002:1 0 384 = 48010484 00000f80 9c0a6000 04300000 00000000 560c4302 483e0000 8af2f201
ffff000103558cc0 1200128825 S Bi:6:002:1 -115 32768 <
ffff00014c2bf900 1200222755 C Bi:6:002:1 0 84 = 1c000484 00000f20 b1046000 00300000 00000000 2f7c4402 463c0000 2d540001
ffff00014c2bf900 1200222794 S Bi:6:002:1 -115 32768 <
ffff00013d62e840 1200223489 C Bi:6:002:1 0 84 = 1c000484 00000f20 b1046000 00300000 00000000 2a7f4402 463c0000 29540001
ffff00013d62e840 1200223517 S Bi:6:002:1 -115 32768 <
ffff000103533900 1200224259 C Bi:6:002:1 0 84 = 1c000484 00000f20 b1046000 00300000 00000000 26824402 463c0000 43540001
ffff000103533900 1200224283 S Bi:6:002:1 -115 32768 <
ffff000103558cc0 1200225027 C Bi:6:002:1 0 84 = 1c000484 00000f20 b1046000 00300000 00000000 18854402 463c0000 33700001
ffff000103558cc0 1200225053 S Bi:6:002:1 -115 32768 <
ffff00014c2bf900 1200227281 C Bi:6:002:1 0 383 = 47010484 00000f80 cd0b6000 04300000 00000000 198d4402 463a0000 8bf1f101
ffff00014c2bf900 1200227305 S Bi:6:002:1 -115 32768 <
ffff00013d62e840 1200228473 C Bi:6:002:1 0 376 = 40010484 00000f80 3a036000 04300000 00000000 d4914402 483e0000 8eeded01
ffff00013d62e840 1200228498 S Bi:6:002:1 -115 32768 <
ffff000103533900 1200229405 C Bi:6:002:1 0 351 = 27010484 00000f80 fc0c6000 04300000 00000000 8e954402 463e0000 89eeee01
ffff000103533900 1200229430 S Bi:6:002:1 -115 32768 <
ffff000103558cc0 1200231187 C Bi:6:002:1 0 384 = 48010484 00000f80 9d0a6000 04300000 00000000 789c4402 46400000 87efef01
ffff000103558cc0 1200231208 S Bi:6:002:1 -115 32768 <
ffff00014c2bf900 1200314612 C Bi:6:002:1 0 84 = 1c000484 00000f20 b3046000 00300000 00000000 09e34502 46420000 1d6f0001
ffff00014c2bf900 1200314637 S Bi:6:002:1 -115 32768 <
ffff00013d62e840 1200330790 C Bi:6:002:1 0 376 = 40010484 00000f80 3b036000 04300000 00000000 93214602 463c0000 83fefe01
ffff00013d62e840 1200330823 S Bi:6:002:1 -115 32768 <
ffff000103533900 1200331714 C Bi:6:002:1 0 351 = 27010484 00000f80 fd0c6000 04300000 00000000 4d254602 463a0000 86f2f201
ffff000103533900 1200331735 S Bi:6:002:1 -115 32768 <
ffff000103558cc0 1200332670 C Bi:6:002:1 0 374 = 3e010484 00000f80 ce076000 04300000 00000000 f7284602 46360000 89f3f301
ffff000103558cc0 1200332689 S Bi:6:002:1 -115 32768 <
ffff00014c2bf900 1200333603 C Bi:6:002:1 0 384 = 48010484 00000f80 9e0a6000 04300000 00000000 702c4602 443c0000 89f3f301
ffff00014c2bf900 1200333628 S Bi:6:002:1 -115 32768 <
ffff00013d62e840 1200432059 C Bi:6:002:1 0 383 = 47010484 00000f80 cf0b6000 04300000 00000000 1cad4702 463a0000 87eeee01
ffff00013d62e840 1200432107 S Bi:6:002:1 -115 32768 <
ffff000103533900 1200433207 C Bi:6:002:1 0 376 = 40010484 00000f80 3c036000 04300000 00000000 95b14702 46380000 87f2f201
ffff000103533900 1200433235 S Bi:6:002:1 -115 32768 <
ffff000103558cc0 1200434129 C Bi:6:002:1 0 351 = 27010484 00000f80 fe0c6000 04300000 00000000 4fb54702 463a0000 8cf1f101
ffff000103558cc0 1200434153 S Bi:6:002:1 -115 32768 <
ffff00014c2bf900 1200435095 C Bi:6:002:1 0 374 = 3e010484 00000f80 cf076000 04300000 00000000 f9b84702 463a0000 85f5f501
ffff00014c2bf900 1200435119 S Bi:6:002:1 -115 32768 <
ffff00013d62e840 1200455388 C Bi:6:002:1 0 377 = 41010484 00000f00 4c0d6000 04300000 00000000 17084802 463c0000 89f2f201
ffff00013d62e840 1200455416 S Bi:6:002:1 -115 32768 <
ffff000103533900 1200456528 C Bi:6:002:1 0 377 = 41010484 00000f00 4c0d6000 04300000 00000000 a00c4802 423c0000 8af2f201
ffff000103533900 1200456553 S Bi:6:002:1 -115 32768 <
ffff000103558cc0 1200457154 C Bi:6:002:1 0 377 = 41010484 00000f00 4c0d6000 04300000 00000000 200f4802 463c0000 89f0f001
ffff000103558cc0 1200457180 S Bi:6:002:1 -115 32768 <
ffff00014c2bf900 1200458650 C Bi:6:002:1 0 370 = 3a010484 00000f00 30066000 04300000 00000000 00154802 463a0000 86eded01
ffff00014c2bf900 1200458674 S Bi:6:002:1 -115 32768 <
ffff00013d62e840 1200459279 C Bi:6:002:1 0 370 = 3a010484 00000f00 30066000 04300000 00000000 6f174802 46380000 89f7f701
ffff00013d62e840 1200459303 S Bi:6:002:1 -115 32768 <
ffff000103533900 1200459876 C Bi:6:002:1 0 370 = 3a010484 00000f00 30066000 04300000 00000000 cc194802 463c0000 88fafa01
ffff000103533900 1200459900 S Bi:6:002:1 -115 32768 <
ffff000103558cc0 1200461074 C Bi:6:002:1 0 345 = 21010484 00000f00 df086000 04300000 00000000 981e4802 463a0000 87f9f901
ffff000103558cc0 1200461100 S Bi:6:002:1 -115 32768 <
ffff00014c2bf900 1200461654 C Bi:6:002:1 0 345 = 21010484 00000f00 df086000 04300000 00000000 de204802 463a0000 87ecec01
ffff00014c2bf900 1200461678 S Bi:6:002:1 -115 32768 <
ffff00013d62e840 1200462439 C Bi:6:002:1 0 345 = 21010484 00000f00 df086000 04300000 00000000 ec234802 463e0000 86f2f201
ffff00013d62e840 1200462463 S Bi:6:002:1 -115 32768 <
ffff000103533900 1200463024 C Bi:6:002:1 0 345 = 21010484 00000f00 df086000 04300000 00000000 29264802 42400000 8bfbfb01
ffff000103533900 1200463049 S Bi:6:002:1 -115 32768 <
ffff000103558cc0 1200465533 C Bi:6:002:1 0 378 = 42010484 00000f00 810a6000 04300000 00000000 ce2f4802 46380000 8cf4f401
ffff000103558cc0 1200465558 S Bi:6:002:1 -115 32768 <
ffff00014c2bf900 1200466137 C Bi:6:002:1 0 378 = 42010484 00000f00 810a6000 04300000 00000000 46324802 463a0000 8af7f701
ffff00014c2bf900 1200466160 S Bi:6:002:1 -115 32768 <
ffff00013d62e840 1200467347 C Bi:6:002:1 0 378 = 42010484 00000f00 810a6000 04300000 00000000 ff364802 463e0000 89f3f301
ffff00013d62e840 1200467376 S Bi:6:002:1 -115 32768 <
ffff000103533900 1200467889 C Bi:6:002:1 0 378 = 42010484 00000f00 810a6000 04300000 00000000 6a394802 483c0000 89f2f201
ffff000103533900 1200467905 S Bi:6:002:1 -115 32768 <
ffff000103558cc0 1200534650 C Bi:6:002:1 0 383 = 47010484 00000f80 d00b6000 04300000 00000000 b03d4902 463c0000 88f3f301
ffff000103558cc0 1200534702 S Bi:6:002:1 -115 32768 <
ffff00014c2bf900 1200535583 C Bi:6:002:1 0 376 = 40010484 00000f80 3d036000 04300000 00000000 7e414902 463c0000 8becec01
ffff00014c2bf900 1200535610 S Bi:6:002:1 -115 32768 <
ffff00013d62e840 1200538058 C Bi:6:002:1 0 374 = 3e010484 00000f80 d0076000 04300000 00000000 2b4b4902 463a0000 8aeeee01
ffff00013d62e840 1200538084 S Bi:6:002:1 -115 32768 <
ffff000102d1dcc0 1200606848 S Ci:6:002:0 s c0 05 0454 0000 0001 1 <
ffff000102d1dcc0 1200607025 C Ci:6:002:0 0 1 = 00
ffff000102d1dcc0 1200607082 S Ci:6:002:0 s c0 05 0860 0000 0004 4 <
ffff000102d1dcc0 1200607195 C Ci:6:002:0 0 4 = 21c3d572
ffff000102d1dcc0 1200607231 S Co:6:002:0 s 40 05 0860 0000 0004 4 = 21c3d572
ffff000102d1dcc0 1200607335 C Co:6:002:0 0 4 >
ffff000102d1dcc0 1200607370 S Ci:6:002:0 s c0 05 0c00 0000 0004 4 <
ffff000102d1dcc0 1200607471 C Ci:6:002:0 0 4 = 07000000
ffff000102d1dcc0 1200607506 S Ci:6:002:0 s c0 05 08b0 0000 0004 4 <
ffff000102d1dcc0 1200607619 C Ci:6:002:0 0 4 = 42060000
ffff000102d1dcc0 1200607666 S Co:6:002:0 s 40 05 08b0 0000 0004 4 = 18060000
ffff000102d1dcc0 1200607771 C Co:6:002:0 0 4 >
ffff000102d1dcc0 1200607839 S Ci:6:002:0 s c0 05 0d04 0000 0004 4 <
ffff000102d1dcc0 1200607957 C Ci:6:002:0 0 4 = 017c90b1
ffff000102d1dcc0 1200608100 S Co:6:002:0 s 40 05 0c90 0000 0004 4 = 017c8001
ffff000102d1dcc0 1200608201 C Co:6:002:0 0 4 >
ffff000102d1dcc0 1200608261 S Ci:6:002:0 s c0 05 08ac 0000 0004 4 <
ffff000102d1dcc0 1200608380 C Ci:6:002:0 0 4 = 08faf00f
ffff000102d1dcc0 1200608426 S Co:6:002:0 s 40 05 08ac 0000 0004 4 = 08faf00f
ffff000102d1dcc0 1200608532 C Co:6:002:0 0 4 >
ffff000102d1dcc0 1200608578 S Ci:6:002:0 s c0 05 08ac 0000 0004 4 <
ffff000102d1dcc0 1200608697 C Ci:6:002:0 0 4 = 08faf00f
ffff000102d1dcc0 1200608742 S Co:6:002:0 s 40 05 08ac 0000 0004 4 = 08faf00f
ffff000102d1dcc0 1200608859 C Co:6:002:0 0 4 >
ffff000102d1dcc0 1200608905 S Ci:6:002:0 s c0 05 08c4 0000 0004 4 <
ffff000102d1dcc0 1200609023 C Ci:6:002:0 0 4 = 00000000
ffff000102d1dcc0 1200609069 S Co:6:002:0 s 40 05 08c4 0000 0004 4 = 00000000
ffff000102d1dcc0 1200609174 C Co:6:002:0 0 4 >
ffff000102d1dcc0 1200609221 S Ci:6:002:0 s c0 05 0c00 0000 0004 4 <
ffff000102d1dcc0 1200609341 C Ci:6:002:0 0 4 = 07000000
ffff000102d1dcc0 1200609386 S Ci:6:002:0 s c0 05 08b0 0000 0004 4 <
ffff000102d1dcc0 1200609496 C Ci:6:002:0 0 4 = 18060000
ffff000102d1dcc0 1200609542 S Co:6:002:0 s 40 05 08b0 0000 0004 4 = 18060000
ffff000102d1dcc0 1200609656 C Co:6:002:0 0 4 >
ffff000102d1dcc0 1200609721 S Ci:6:002:0 s c0 05 0d04 0000 0004 4 <
ffff000102d1dcc0 1200609838 C Ci:6:002:0 0 4 = 017c90b1
ffff000102d1dcc0 1200609883 S Co:6:002:0 s 40 05 0c90 0000 0004 4 = 017c8001
ffff000102d1dcc0 1200609991 C Co:6:002:0 0 4 >
ffff000102d1dcc0 1200610051 S Ci:6:002:0 s c0 05 0e00 0000 0004 4 <
ffff000102d1dcc0 1200610168 C Ci:6:002:0 0 4 = 07000000
ffff000102d1dcc0 1200610214 S Ci:6:002:0 s c0 05 08b0 0000 0004 4 <
ffff000102d1dcc0 1200610324 C Ci:6:002:0 0 4 = 18060000
ffff000102d1dcc0 1200610369 S Co:6:002:0 s 40 05 08b0 0000 0004 4 = 18060000
ffff000102d1dcc0 1200610487 C Co:6:002:0 0 4 >
ffff000102d1dcc0 1200610554 S Ci:6:002:0 s c0 05 0d44 0000 0004 4 <
ffff000102d1dcc0 1200610672 C Ci:6:002:0 0 4 = 017c90b1
ffff000102d1dcc0 1200610717 S Co:6:002:0 s 40 05 0e90 0000 0004 4 = 017c8001
ffff000102d1dcc0 1200610824 C Co:6:002:0 0 4 >
ffff000102d1dcc0 1200610883 S Ci:6:002:0 s c0 05 08ac 0000 0004 4 <
ffff000102d1dcc0 1200611003 C Ci:6:002:0 0 4 = 08faf00f
ffff000102d1dcc0 1200611049 S Co:6:002:0 s 40 05 08ac 0000 0004 4 = 08faf00f
ffff000102d1dcc0 1200611155 C Co:6:002:0 0 4 >
ffff000102d1dcc0 1200611201 S Ci:6:002:0 s c0 05 08ac 0000 0004 4 <
ffff000102d1dcc0 1200611320 C Ci:6:002:0 0 4 = 08faf00f
ffff000102d1dcc0 1200611365 S Co:6:002:0 s 40 05 08ac 0000 0004 4 = 08faf00f
ffff000102d1dcc0 1200611484 C Co:6:002:0 0 4 >
ffff000102d1dcc0 1200611531 S Ci:6:002:0 s c0 05 08c4 0000 0004 4 <
ffff000102d1dcc0 1200611650 C Ci:6:002:0 0 4 = 00000000
ffff000102d1dcc0 1200611695 S Co:6:002:0 s 40 05 08c4 0000 0004 4 = 00000000
ffff000102d1dcc0 1200611802 C Co:6:002:0 0 4 >
ffff000102d1dcc0 1200611848 S Ci:6:002:0 s c0 05 0e00 0000 0004 4 <
ffff000102d1dcc0 1200611968 C Ci:6:002:0 0 4 = 07000000
ffff000102d1dcc0 1200612041 S Ci:6:002:0 s c0 05 08b0 0000 0004 4 <
ffff000102d1dcc0 1200612162 C Ci:6:002:0 0 4 = 18060000
ffff000102d1dcc0 1200612209 S Co:6:002:0 s 40 05 08b0 0000 0004 4 = 18060000
ffff000102d1dcc0 1200612324 C Co:6:002:0 0 4 >
ffff000102d1dcc0 1200612389 S Ci:6:002:0 s c0 05 0d44 0000 0004 4 <
ffff000102d1dcc0 1200612508 C Ci:6:002:0 0 4 = 017c90b1
ffff000102d1dcc0 1200612553 S Co:6:002:0 s 40 05 0e90 0000 0004 4 = 017c8001
ffff000102d1dcc0 1200612660 C Co:6:002:0 0 4 >
ffff000102d1dcc0 1200612720 S Ci:6:002:0 s c0 05 0668 0000 0002 2 <
ffff000102d1dcc0 1200612839 C Ci:6:002:0 0 2 = 0010
ffff000102d1dcc0 1200612884 S Co:6:002:0 s 40 05 0668 0000 0002 2 = 0010
ffff000102d1dcc0 1200612992 C Co:6:002:0 0 2 >
ffff000102d1dcc0 1200613039 S Co:6:002:0 s 40 05 0483 0000 0001 1 = 00
ffff000102d1dcc0 1200613152 C Co:6:002:0 0 1 >
ffff000102d1dcc0 1200613197 S Ci:6:002:0 s c0 05 0837 0000 0001 1 <
ffff000102d1dcc0 1200613307 C Ci:6:002:0 0 1 = 00
ffff000102d1dcc0 1200613352 S Ci:6:002:0 s c0 05 08ac 0000 0004 4 <
ffff000102d1dcc0 1200613462 C Ci:6:002:0 0 4 = 08faf00f
ffff000102d1dcc0 1200613510 S Co:6:002:0 s 40 05 08ac 0000 0004 4 = 08faf00f
ffff000102d1dcc0 1200613623 C Co:6:002:0 0 4 >
ffff000102d1dcc0 1200613669 S Ci:6:002:0 s c0 05 08c4 0000 0004 4 <
ffff000102d1dcc0 1200613779 C Ci:6:002:0 0 4 = 00000000
ffff000102d1dcc0 1200613824 S Co:6:002:0 s 40 05 08c4 0000 0004 4 = 00000000
ffff000102d1dcc0 1200613930 C Co:6:002:0 0 4 >
ffff000102d1dcc0 1200613977 S Ci:6:002:0 s c0 05 0848 0000 0004 4 <
ffff000102d1dcc0 1200614114 C Ci:6:002:0 0 4 = 8bffd061
ffff000102d1dcc0 1200614159 S Co:6:002:0 s 40 05 0848 0000 0004 4 = 8bffd061
ffff000102d1dcc0 1200614265 C Co:6:002:0 0 4 >
ffff000102d1dcc0 1200614311 S Ci:6:002:0 s c0 05 08ac 0000 0004 4 <
ffff000102d1dcc0 1200614430 C Ci:6:002:0 0 4 = 08faf00f
ffff000102d1dcc0 1200614475 S Co:6:002:0 s 40 05 08ac 0000 0004 4 = 08faf00f
ffff000102d1dcc0 1200614581 C Co:6:002:0 0 4 >
ffff000102d1dcc0 1200614628 S Ci:6:002:0 s c0 05 08ac 0000 0004 4 <
ffff000102d1dcc0 1200614747 C Ci:6:002:0 0 4 = 08faf00f
ffff000102d1dcc0 1200614792 S Co:6:002:0 s 40 05 08ac 0000 0004 4 = 08faf00f
ffff000102d1dcc0 1200614898 C Co:6:002:0 0 4 >
ffff000102d1dcc0 1200614945 S Ci:6:002:0 s c0 05 08c4 0000 0004 4 <
ffff000102d1dcc0 1200615063 C Ci:6:002:0 0 4 = 00000000
ffff000102d1dcc0 1200615108 S Co:6:002:0 s 40 05 08c4 0000 0004 4 = 00000000
ffff000102d1dcc0 1200615215 C Co:6:002:0 0 4 >
ffff000102d1dcc0 1200615262 S Ci:6:002:0 s c0 05 0c00 0000 0004 4 <
ffff000102d1dcc0 1200615380 C Ci:6:002:0 0 4 = 07000000
ffff000102d1dcc0 1200615425 S Ci:6:002:0 s c0 05 08b0 0000 0004 4 <
ffff000102d1dcc0 1200615536 C Ci:6:002:0 0 4 = 18060000
ffff000102d1dcc0 1200615580 S Co:6:002:0 s 40 05 08b0 0000 0004 4 = 18060000
ffff000102d1dcc0 1200615687 C Co:6:002:0 0 4 >
ffff000102d1dcc0 1200615755 S Ci:6:002:0 s c0 05 0d04 0000 0004 4 <
ffff000102d1dcc0 1200615873 C Ci:6:002:0 0 4 = 017c90b1
ffff000102d1dcc0 1200615921 S Co:6:002:0 s 40 05 0c90 0000 0004 4 = 017c8001
ffff000102d1dcc0 1200616027 C Co:6:002:0 0 4 >
ffff000102d1dcc0 1200616087 S Ci:6:002:0 s c0 05 0e00 0000 0004 4 <
ffff000102d1dcc0 1200616210 C Ci:6:002:0 0 4 = 07000000
ffff000102d1dcc0 1200616263 S Ci:6:002:0 s c0 05 08b0 0000 0004 4 <
ffff000102d1dcc0 1200616374 C Ci:6:002:0 0 4 = 18060000
ffff000102d1dcc0 1200616419 S Co:6:002:0 s 40 05 08b0 0000 0004 4 = 18060000
ffff000102d1dcc0 1200616525 C Co:6:002:0 0 4 >
ffff000102d1dcc0 1200616593 S Ci:6:002:0 s c0 05 0d44 0000 0004 4 <
ffff000102d1dcc0 1200616712 C Ci:6:002:0 0 4 = 017c90b1
ffff000102d1dcc0 1200616758 S Co:6:002:0 s 40 05 0e90 0000 0004 4 = 017c8001
ffff000102d1dcc0 1200616867 C Co:6:002:0 0 4 >
ffff000102d1dcc0 1200616949 S Ci:6:002:0 s c0 05 0c20 0000 0004 4 <
ffff000102d1dcc0 1200617070 C Ci:6:002:0 0 4 = 13131313
ffff000102d1dcc0 1200617116 S Co:6:002:0 s 40 05 0c20 0000 0004 4 = 13131313
ffff000102d1dcc0 1200617234 C Co:6:002:0 0 4 >
ffff000102d1dcc0 1200617281 S Ci:6:002:0 s c0 05 0c24 0000 0004 4 <
ffff000102d1dcc0 1200617400 C Ci:6:002:0 0 4 = 20202020
ffff000102d1dcc0 1200617447 S Co:6:002:0 s 40 05 0c24 0000 0004 4 = 20202020
ffff000102d1dcc0 1200617551 C Co:6:002:0 0 4 >
ffff000102d1dcc0 1200617598 S Ci:6:002:0 s c0 05 0c28 0000 0004 4 <
ffff000102d1dcc0 1200617718 C Ci:6:002:0 0 4 = 20201e1c
ffff000102d1dcc0 1200617763 S Co:6:002:0 s 40 05 0c28 0000 0004 4 = 20201e1c
ffff000102d1dcc0 1200617869 C Co:6:002:0 0 4 >
ffff000102d1dcc0 1200617916 S Ci:6:002:0 s c0 05 0c2c 0000 0004 4 <
ffff000102d1dcc0 1200618036 C Ci:6:002:0 0 4 = 20202020
ffff000102d1dcc0 1200618082 S Co:6:002:0 s 40 05 0c2c 0000 0004 4 = 20202020
ffff000102d1dcc0 1200618188 C Co:6:002:0 0 4 >
ffff000102d1dcc0 1200618234 S Ci:6:002:0 s c0 05 0c30 0000 0004 4 <
ffff000102d1dcc0 1200618371 C Ci:6:002:0 0 4 = 20201e1c
ffff000102d1dcc0 1200618417 S Co:6:002:0 s 40 05 0c30 0000 0004 4 = 20201e1c
ffff000102d1dcc0 1200618523 C Co:6:002:0 0 4 >
ffff000102d1dcc0 1200618569 S Ci:6:002:0 s c0 05 0c34 0000 0004 4 <
ffff000102d1dcc0 1200618690 C Ci:6:002:0 0 4 = 20202020
ffff000102d1dcc0 1200618735 S Co:6:002:0 s 40 05 0c34 0000 0004 4 = 20202020
ffff000102d1dcc0 1200618841 C Co:6:002:0 0 4 >
ffff000102d1dcc0 1200618888 S Ci:6:002:0 s c0 05 0c38 0000 0004 4 <
ffff000102d1dcc0 1200619009 C Ci:6:002:0 0 4 = 201e1c1a
ffff000102d1dcc0 1200619054 S Co:6:002:0 s 40 05 0c38 0000 0004 4 = 201e1c1a
ffff000102d1dcc0 1200619161 C Co:6:002:0 0 4 >
ffff000102d1dcc0 1200619207 S Ci:6:002:0 s c0 05 0c3c 0000 0004 4 <
ffff000102d1dcc0 1200619328 C Ci:6:002:0 0 4 = 20202020
ffff000102d1dcc0 1200619374 S Co:6:002:0 s 40 05 0c3c 0000 0004 4 = 20202020
ffff000102d1dcc0 1200619491 C Co:6:002:0 0 4 >
ffff000102d1dcc0 1200619537 S Ci:6:002:0 s c0 05 0c40 0000 0004 4 <
ffff000102d1dcc0 1200619657 C Ci:6:002:0 0 4 = 20201e1c
ffff000102d1dcc0 1200619703 S Co:6:002:0 s 40 05 0c40 0000 0004 4 = 20201e1c
ffff000102d1dcc0 1200619809 C Co:6:002:0 0 4 >
ffff000102d1dcc0 1200619855 S Ci:6:002:0 s c0 05 0c44 0000 0004 4 <
ffff000102d1dcc0 1200619993 C Ci:6:002:0 0 4 = 1a181e1e
ffff000102d1dcc0 1200620094 S Co:6:002:0 s 40 05 0c44 0000 0004 4 = 1a181e1e
ffff000102d1dcc0 1200620198 C Co:6:002:0 0 4 >
ffff000102d1dcc0 1200620247 S Ci:6:002:0 s c0 05 0c48 0000 0004 4 <
ffff000102d1dcc0 1200620371 C Ci:6:002:0 0 4 = 1e1e1e1e
ffff000102d1dcc0 1200620417 S Co:6:002:0 s 40 05 0c48 0000 0004 4 = 1e1e1e1e
ffff000102d1dcc0 1200620523 C Co:6:002:0 0 4 >
ffff000102d1dcc0 1200620569 S Ci:6:002:0 s c0 05 0c4c 0000 0004 4 <
ffff000102d1dcc0 1200620690 C Ci:6:002:0 0 4 = 1c1a1816
ffff000102d1dcc0 1200620735 S Co:6:002:0 s 40 05 0c4c 0000 0004 4 = 1c1a1816
ffff000102d1dcc0 1200620841 C Co:6:002:0 0 4 >
ffff000102d1dcc0 1200620887 S Ci:6:002:0 s c0 05 0c54 0000 0004 4 <
ffff000102d1dcc0 1200621008 C Ci:6:002:0 0 4 = 120a0400
ffff000102d1dcc0 1200621054 S Co:6:002:0 s 40 05 0c54 0000 0004 4 = 120a0400
ffff000102d1dcc0 1200621160 C Co:6:002:0 0 4 >
ffff000102d1dcc0 1200621206 S Ci:6:002:0 s c0 05 0e20 0000 0004 4 <
ffff000102d1dcc0 1200621327 C Ci:6:002:0 0 4 = 14141414
ffff000102d1dcc0 1200621373 S Co:6:002:0 s 40 05 0e20 0000 0004 4 = 14141414
ffff000102d1dcc0 1200621491 C Co:6:002:0 0 4 >
ffff000102d1dcc0 1200621538 S Ci:6:002:0 s c0 05 0e24 0000 0004 4 <
ffff000102d1dcc0 1200621657 C Ci:6:002:0 0 4 = 1d1d1d1d
ffff000102d1dcc0 1200621703 S Co:6:002:0 s 40 05 0e24 0000 0004 4 = 1d1d1d1d
ffff000102d1dcc0 1200621809 C Co:6:002:0 0 4 >
ffff000102d1dcc0 1200621855 S Ci:6:002:0 s c0 05 0e28 0000 0004 4 <
ffff000102d1dcc0 1200621993 C Ci:6:002:0 0 4 = 1d1d1b19
ffff000102d1dcc0 1200622038 S Co:6:002:0 s 40 05 0e28 0000 0004 4 = 1d1d1b19
ffff000102d1dcc0 1200622145 C Co:6:002:0 0 4 >
ffff000102d1dcc0 1200622191 S Ci:6:002:0 s c0 05 0e2c 0000 0004 4 <
ffff000102d1dcc0 1200622311 C Ci:6:002:0 0 4 = 1f1f1f1f
ffff000102d1dcc0 1200622357 S Co:6:002:0 s 40 05 0e2c 0000 0004 4 = 1f1f1f1f
ffff000102d1dcc0 1200622463 C Co:6:002:0 0 4 >
ffff000102d1dcc0 1200622509 S Ci:6:002:0 s c0 05 0e30 0000 0004 4 <
ffff000102d1dcc0 1200622630 C Ci:6:002:0 0 4 = 1f1f1d1b
ffff000102d1dcc0 1200622675 S Co:6:002:0 s 40 05 0e30 0000 0004 4 = 1f1f1d1b
ffff000102d1dcc0 1200622781 C Co:6:002:0 0 4 >
ffff000102d1dcc0 1200622828 S Ci:6:002:0 s c0 05 0e34 0000 0004 4 <
ffff000102d1dcc0 1200622950 C Ci:6:002:0 0 4 = 1f1f1f1f
ffff000102d1dcc0 1200622995 S Co:6:002:0 s 40 05 0e34 0000 0004 4 = 1f1f1f1f
ffff000102d1dcc0 1200623115 C Co:6:002:0 0 4 >
ffff000102d1dcc0 1200623161 S Ci:6:002:0 s c0 05 0e38 0000 0004 4 <
ffff000102d1dcc0 1200623282 C Ci:6:002:0 0 4 = 1f1d1b19
ffff000102d1dcc0 1200623327 S Co:6:002:0 s 40 05 0e38 0000 0004 4 = 1f1d1b19
ffff000102d1dcc0 1200623434 C Co:6:002:0 0 4 >
ffff000102d1dcc0 1200623480 S Ci:6:002:0 s c0 05 0e3c 0000 0004 4 <
ffff000102d1dcc0 1200623618 C Ci:6:002:0 0 4 = 1f1f1f1f
ffff000102d1dcc0 1200623663 S Co:6:002:0 s 40 05 0e3c 0000 0004 4 = 1f1f1f1f
ffff000102d1dcc0 1200623769 C Co:6:002:0 0 4 >
ffff000102d1dcc0 1200623816 S Ci:6:002:0 s c0 05 0e40 0000 0004 4 <
ffff000102d1dcc0 1200623937 C Ci:6:002:0 0 4 = 1f1f1d1b
ffff000102d1dcc0 1200623982 S Co:6:002:0 s 40 05 0e40 0000 0004 4 = 1f1f1d1b
ffff000102d1dcc0 1200624101 C Co:6:002:0 0 4 >
ffff000102d1dcc0 1200624149 S Ci:6:002:0 s c0 05 0e44 0000 0004 4 <
ffff000102d1dcc0 1200624275 C Ci:6:002:0 0 4 = 19171d1d
ffff000102d1dcc0 1200624332 S Co:6:002:0 s 40 05 0e44 0000 0004 4 = 19171d1d
ffff000102d1dcc0 1200624445 C Co:6:002:0 0 4 >
ffff000102d1dcc0 1200624492 S Ci:6:002:0 s c0 05 0e48 0000 0004 4 <
ffff000102d1dcc0 1200624622 C Ci:6:002:0 0 4 = 1d1d1d1d
ffff000102d1dcc0 1200624667 S Co:6:002:0 s 40 05 0e48 0000 0004 4 = 1d1d1d1d
ffff000102d1dcc0 1200624774 C Co:6:002:0 0 4 >
ffff000102d1dcc0 1200624821 S Ci:6:002:0 s c0 05 0e4c 0000 0004 4 <
ffff000102d1dcc0 1200624942 C Ci:6:002:0 0 4 = 1b191715
ffff000102d1dcc0 1200624987 S Co:6:002:0 s 40 05 0e4c 0000 0004 4 = 1b191715
ffff000102d1dcc0 1200625093 C Co:6:002:0 0 4 >
ffff000102d1dcc0 1200625140 S Ci:6:002:0 s c0 05 0e54 0000 0004 4 <
ffff000102d1dcc0 1200625261 C Ci:6:002:0 0 4 = 11090300
ffff000102d1dcc0 1200625306 S Co:6:002:0 s 40 05 0e54 0000 0004 4 = 11090300
ffff000102d1dcc0 1200625413 C Co:6:002:0 0 4 >
ffff000102d1dcc0 1200625474 S Ci:6:002:0 s c0 05 0454 0000 0001 1 <
ffff000102d1dcc0 1200625612 C Ci:6:002:0 0 1 = 00
ffff000102d1dcc0 1200625657 S Ci:6:002:0 s c0 05 0454 0000 0001 1 <
ffff000102d1dcc0 1200625766 C Ci:6:002:0 0 1 = 00
ffff000102d1dcc0 1200625813 S Co:6:002:0 s 40 05 0454 0000 0001 1 = 80
ffff000102d1dcc0 1200625927 C Co:6:002:0 0 1 >
ffff000102d1dcc0 1200625972 S Ci:6:002:0 s c0 05 041a 0000 0002 2 <
ffff000102d1dcc0 1200626081 C Ci:6:002:0 0 2 = ff0f
ffff000102d1dcc0 1200626127 S Ci:6:002:0 s c0 05 0808 0000 0004 4 <
ffff000102d1dcc0 1200626244 C Ci:6:002:0 0 4 = 3382023e
ffff000102d1dcc0 1200626289 S Co:6:002:0 s 40 05 0808 0000 0004 4 = 3382023e
ffff000102d1dcc0 1200626395 C Co:6:002:0 0 4 >
ffff000102d1dcc0 1200626442 S Ci:6:002:0 s c0 05 0834 0000 0004 4 <
ffff000102d1dcc0 1200626559 C Ci:6:002:0 0 4 = 05a73700
ffff000102d1dcc0 1200626604 S Co:6:002:0 s 40 05 0834 0000 0004 4 = 06a73700
ffff000102d1dcc0 1200626711 C Co:6:002:0 0 4 >
ffff000102d1dcc0 1200626757 S Ci:6:002:0 s c0 05 0830 0000 0004 4 <
ffff000102d1dcc0 1200626874 C Ci:6:002:0 0 4 = b8eeaa2e
ffff000102d1dcc0 1200626920 S Co:6:002:0 s 40 05 0830 0000 0004 4 = b8aeaa2e
ffff000102d1dcc0 1200627026 C Co:6:002:0 0 4 >
ffff000102d1dcc0 1200627072 S Ci:6:002:0 s c0 05 0830 0000 0004 4 <
ffff000102d1dcc0 1200627191 C Ci:6:002:0 0 4 = b8aeaa2e
ffff000102d1dcc0 1200627236 S Co:6:002:0 s 40 05 0830 0000 0004 4 = b8aeaa2e
ffff000102d1dcc0 1200627342 C Co:6:002:0 0 4 >
ffff000102d1dcc0 1200627388 S Ci:6:002:0 s c0 05 082c 0000 0004 4 <
ffff000102d1dcc0 1200627506 C Ci:6:002:0 0 4 = dc832000
ffff000102d1dcc0 1200627551 S Co:6:002:0 s 40 05 082c 0000 0004 4 = dd832000
ffff000102d1dcc0 1200627658 C Co:6:002:0 0 4 >
ffff000102d1dcc0 1200627704 S Co:6:002:0 s 40 05 0cb0 0000 0004 4 = 17773354
ffff000102d1dcc0 1200627817 C Co:6:002:0 0 4 >
ffff000102d1dcc0 1200627861 S Co:6:002:0 s 40 05 0eb0 0000 0004 4 = 17773354
ffff000102d1dcc0 1200627968 C Co:6:002:0 0 4 >
ffff000102d1dcc0 1200628051 S Ci:6:002:0 s c0 05 0cb4 0000 0004 4 <
ffff000102d1dcc0 1200628090 C Ci:6:002:0 0 4 = 77000001
ffff000102d1dcc0 1200628128 S Co:6:002:0 s 40 05 0cb4 0000 0004 4 = 77000001
ffff000102d1dcc0 1200628243 C Co:6:002:0 0 4 >
ffff000102d1dcc0 1200628291 S Ci:6:002:0 s c0 05 0eb4 0000 0004 4 <
ffff000102d1dcc0 1200628400 C Ci:6:002:0 0 4 = 77000001
ffff000102d1dcc0 1200628445 S Co:6:002:0 s 40 05 0eb4 0000 0004 4 = 77000001
ffff000102d1dcc0 1200628552 C Co:6:002:0 0 4 >
ffff000102d1dcc0 1200628599 S Ci:6:002:0 s c0 05 0900 0000 0004 4 <
ffff000102d1dcc0 1200628717 C Ci:6:002:0 0 4 = 01040000
ffff000102d1dcc0 1200628762 S Co:6:002:0 s 40 05 0900 0000 0004 4 = 01040000
ffff000102d1dcc0 1200628870 C Co:6:002:0 0 4 >
ffff000102d1dcc0 1200628916 S Ci:6:002:0 s c0 05 080c 0000 0004 4 <
ffff000102d1dcc0 1200629035 C Ci:6:002:0 0 4 = 13111312
ffff000102d1dcc0 1200629080 S Co:6:002:0 s 40 05 080c 0000 0004 4 = 03111312
ffff000102d1dcc0 1200629187 C Co:6:002:0 0 4 >
ffff000102d1dcc0 1200629233 S Ci:6:002:0 s c0 05 0a04 0000 0004 4 <
ffff000102d1dcc0 1200629367 C Ci:6:002:0 0 4 = 0c00ff01
ffff000102d1dcc0 1200629413 S Co:6:002:0 s 40 05 0a04 0000 0004 4 = 0c00ff0f
ffff000102d1dcc0 1200629518 C Co:6:002:0 0 4 >
ffff000102d1dcc0 1200629565 S Ci:6:002:0 s c0 05 0440 0000 0004 4 <
ffff000102d1dcc0 1200629683 C Ci:6:002:0 0 4 = 00000000
ffff000102d1dcc0 1200629728 S Co:6:002:0 s 40 05 0440 0000 0004 4 = 50010000
ffff000102d1dcc0 1200629835 C Co:6:002:0 0 4 >
ffff000102d1dcc0 1200629881 S Ci:6:002:0 s c0 05 0c1c 0000 0004 4 <
ffff000102d1dcc0 1200629999 C Ci:6:002:0 0 4 = 03000040
ffff000102d1dcc0 1200630044 S Co:6:002:0 s 40 05 0c1c 0000 0004 4 = 0300402d
ffff000102d1dcc0 1200630151 C Co:6:002:0 0 4 >
ffff000102d1dcc0 1200630197 S Ci:6:002:0 s c0 05 0e1c 0000 0004 4 <
ffff000102d1dcc0 1200630315 C Ci:6:002:0 0 4 = 03000040
ffff000102d1dcc0 1200630360 S Co:6:002:0 s 40 05 0e1c 0000 0004 4 = 0300402d
ffff000102d1dcc0 1200630466 C Co:6:002:0 0 4 >
ffff000102d1dcc0 1200630513 S Ci:6:002:0 s c0 05 0860 0000 0004 4 <
ffff000102d1dcc0 1200630631 C Ci:6:002:0 0 4 = 21c3d572
ffff000102d1dcc0 1200630677 S Co:6:002:0 s 40 05 0860 0000 0004 4 = 21c32568
ffff000102d1dcc0 1200630783 C Co:6:002:0 0 4 >
ffff000102d1dcc0 1200630830 S Ci:6:002:0 s c0 05 0c00 0000 0004 4 <
ffff000102d1dcc0 1200630948 C Ci:6:002:0 0 4 = 07000000
ffff000102d1dcc0 1200630994 S Ci:6:002:0 s c0 05 08b0 0000 0004 4 <
ffff000102d1dcc0 1200631118 C Ci:6:002:0 0 4 = 18060000
ffff000102d1dcc0 1200631162 S Co:6:002:0 s 40 05 08b0 0000 0004 4 = 18060000
ffff000102d1dcc0 1200631269 C Co:6:002:0 0 4 >
ffff000102d1dcc0 1200631336 S Ci:6:002:0 s c0 05 0d04 0000 0004 4 <
ffff000102d1dcc0 1200631453 C Ci:6:002:0 0 4 = 017c90b1
ffff000102d1dcc0 1200631499 S Co:6:002:0 s 40 05 0c90 0000 0004 4 = 017d8301
ffff000102d1dcc0 1200631616 C Co:6:002:0 0 4 >
ffff000102d1dcc0 1200631676 S Ci:6:002:0 s c0 05 08ac 0000 0004 4 <
ffff000102d1dcc0 1200631794 C Ci:6:002:0 0 4 = 08faf00f
ffff000102d1dcc0 1200631840 S Co:6:002:0 s 40 05 08ac 0000 0004 4 = 08faf00f
ffff000102d1dcc0 1200631946 C Co:6:002:0 0 4 >
ffff000102d1dcc0 1200631993 S Ci:6:002:0 s c0 05 08ac 0000 0004 4 <
ffff000102d1dcc0 1200632135 C Ci:6:002:0 0 4 = 08faf00f
ffff000102d1dcc0 1200632181 S Co:6:002:0 s 40 05 08ac 0000 0004 4 = 08faf00f
ffff000102d1dcc0 1200632295 C Co:6:002:0 0 4 >
ffff000102d1dcc0 1200632340 S Ci:6:002:0 s c0 05 08c4 0000 0004 4 <
ffff000102d1dcc0 1200632450 C Ci:6:002:0 0 4 = 00000000
ffff000102d1dcc0 1200632497 S Co:6:002:0 s 40 05 08c4 0000 0004 4 = 00000000
ffff000102d1dcc0 1200632616 C Co:6:002:0 0 4 >
ffff000102d1dcc0 1200632662 S Ci:6:002:0 s c0 05 0c00 0000 0004 4 <
ffff000102d1dcc0 1200632772 C Ci:6:002:0 0 4 = 07000000
ffff000102d1dcc0 1200632818 S Ci:6:002:0 s c0 05 08b0 0000 0004 4 <
ffff000102d1dcc0 1200632937 C Ci:6:002:0 0 4 = 18060000
ffff000102d1dcc0 1200632982 S Co:6:002:0 s 40 05 08b0 0000 0004 4 = 18060000
ffff000102d1dcc0 1200633089 C Co:6:002:0 0 4 >
ffff000102d1dcc0 1200633155 S Ci:6:002:0 s c0 05 0d04 0000 0004 4 <
ffff000102d1dcc0 1200633274 C Ci:6:002:0 0 4 = 017d91b1
ffff000102d1dcc0 1200633319 S Co:6:002:0 s 40 05 0c90 0000 0004 4 = 787d8101
ffff000102d1dcc0 1200633426 C Co:6:002:0 0 4 >
ffff000102d1dcc0 1200633486 S Ci:6:002:0 s c0 05 0e00 0000 0004 4 <
ffff000102d1dcc0 1200633621 C Ci:6:002:0 0 4 = 07000000
ffff000102d1dcc0 1200633666 S Ci:6:002:0 s c0 05 08b0 0000 0004 4 <
ffff000102d1dcc0 1200633778 C Ci:6:002:0 0 4 = 18060000
ffff000102d1dcc0 1200633822 S Co:6:002:0 s 40 05 08b0 0000 0004 4 = 18060000
ffff000102d1dcc0 1200633929 C Co:6:002:0 0 4 >
ffff000102d1dcc0 1200633996 S Ci:6:002:0 s c0 05 0d44 0000 0004 4 <
ffff000102d1dcc0 1200634120 C Ci:6:002:0 0 4 = 017c90b1
ffff000102d1dcc0 1200634166 S Co:6:002:0 s 40 05 0e90 0000 0004 4 = 017d8301
ffff000102d1dcc0 1200634272 C Co:6:002:0 0 4 >
ffff000102d1dcc0 1200634331 S Ci:6:002:0 s c0 05 08ac 0000 0004 4 <
ffff000102d1dcc0 1200634450 C Ci:6:002:0 0 4 = 08faf00f
ffff000102d1dcc0 1200634495 S Co:6:002:0 s 40 05 08ac 0000 0004 4 = 08faf00f
ffff000102d1dcc0 1200634614 C Co:6:002:0 0 4 >
ffff000102d1dcc0 1200634660 S Ci:6:002:0 s c0 05 08ac 0000 0004 4 <
ffff000102d1dcc0 1200634779 C Ci:6:002:0 0 4 = 08faf00f
ffff000102d1dcc0 1200634824 S Co:6:002:0 s 40 05 08ac 0000 0004 4 = 08faf00f
ffff000102d1dcc0 1200634931 C Co:6:002:0 0 4 >
ffff000102d1dcc0 1200634977 S Ci:6:002:0 s c0 05 08c4 0000 0004 4 <
ffff000102d1dcc0 1200635113 C Ci:6:002:0 0 4 = 00000000
ffff000102d1dcc0 1200635158 S Co:6:002:0 s 40 05 08c4 0000 0004 4 = 00000000
ffff000102d1dcc0 1200635264 C Co:6:002:0 0 4 >
ffff000102d1dcc0 1200635311 S Ci:6:002:0 s c0 05 0e00 0000 0004 4 <
ffff000102d1dcc0 1200635431 C Ci:6:002:0 0 4 = 07000000
ffff000102d1dcc0 1200635476 S Ci:6:002:0 s c0 05 08b0 0000 0004 4 <
ffff000102d1dcc0 1200635587 C Ci:6:002:0 0 4 = 18060000
ffff000102d1dcc0 1200635632 S Co:6:002:0 s 40 05 08b0 0000 0004 4 = 18060000
ffff000102d1dcc0 1200635741 C Co:6:002:0 0 4 >
ffff000102d1dcc0 1200635808 S Ci:6:002:0 s c0 05 0d44 0000 0004 4 <
ffff000102d1dcc0 1200635927 C Ci:6:002:0 0 4 = 017d91b1
ffff000102d1dcc0 1200635972 S Co:6:002:0 s 40 05 0e90 0000 0004 4 = 787d8101
ffff000102d1dcc0 1200636079 C Co:6:002:0 0 4 >
ffff000102d1dcc0 1200636140 S Ci:6:002:0 s c0 05 0668 0000 0002 2 <
ffff000102d1dcc0 1200636260 C Ci:6:002:0 0 2 = 0010
ffff000102d1dcc0 1200636306 S Co:6:002:0 s 40 05 0668 0000 0002 2 = 0010
ffff000102d1dcc0 1200636413 C Co:6:002:0 0 2 >
ffff000102d1dcc0 1200636459 S Co:6:002:0 s 40 05 0483 0000 0001 1 = 00
ffff000102d1dcc0 1200636573 C Co:6:002:0 0 1 >
ffff000102d1dcc0 1200636618 S Ci:6:002:0 s c0 05 0837 0000 0001 1 <
ffff000102d1dcc0 1200636744 C Ci:6:002:0 0 1 = 00
ffff000102d1dcc0 1200636790 S Ci:6:002:0 s c0 05 08ac 0000 0004 4 <
ffff000102d1dcc0 1200636909 C Ci:6:002:0 0 4 = 08faf00f
ffff000102d1dcc0 1200636953 S Co:6:002:0 s 40 05 08ac 0000 0004 4 = 08faf00f
ffff000102d1dcc0 1200637060 C Co:6:002:0 0 4 >
ffff000102d1dcc0 1200637106 S Ci:6:002:0 s c0 05 08c4 0000 0004 4 <
ffff000102d1dcc0 1200637243 C Ci:6:002:0 0 4 = 00000000
ffff000102d1dcc0 1200637288 S Co:6:002:0 s 40 05 08c4 0000 0004 4 = 00000000
ffff000102d1dcc0 1200637395 C Co:6:002:0 0 4 >
ffff000102d1dcc0 1200637441 S Ci:6:002:0 s c0 05 0848 0000 0004 4 <
ffff000102d1dcc0 1200637561 C Ci:6:002:0 0 4 = 8bffd061
ffff000102d1dcc0 1200637606 S Co:6:002:0 s 40 05 0848 0000 0004 4 = 8bffd061
ffff000102d1dcc0 1200637713 C Co:6:002:0 0 4 >
ffff000102d1dcc0 1200637759 S Ci:6:002:0 s c0 05 08ac 0000 0004 4 <
ffff000102d1dcc0 1200637879 C Ci:6:002:0 0 4 = 08faf00f
ffff000102d1dcc0 1200637924 S Co:6:002:0 s 40 05 08ac 0000 0004 4 = 08faf00f
ffff000102d1dcc0 1200638030 C Co:6:002:0 0 4 >
ffff000102d1dcc0 1200638077 S Ci:6:002:0 s c0 05 08ac 0000 0004 4 <
ffff000102d1dcc0 1200638196 C Ci:6:002:0 0 4 = 08faf00f
ffff000102d1dcc0 1200638241 S Co:6:002:0 s 40 05 08ac 0000 0004 4 = 08faf00f
ffff000102d1dcc0 1200638359 C Co:6:002:0 0 4 >
ffff000102d1dcc0 1200638404 S Ci:6:002:0 s c0 05 08c4 0000 0004 4 <
ffff000102d1dcc0 1200638524 C Ci:6:002:0 0 4 = 00000000
ffff000102d1dcc0 1200638569 S Co:6:002:0 s 40 05 08c4 0000 0004 4 = 00000000
ffff000102d1dcc0 1200638676 C Co:6:002:0 0 4 >
ffff000102d1dcc0 1200638722 S Ci:6:002:0 s c0 05 0c00 0000 0004 4 <
ffff000102d1dcc0 1200638842 C Ci:6:002:0 0 4 = 07000000
ffff000102d1dcc0 1200638887 S Ci:6:002:0 s c0 05 08b0 0000 0004 4 <
ffff000102d1dcc0 1200638999 C Ci:6:002:0 0 4 = 18060000
ffff000102d1dcc0 1200639044 S Co:6:002:0 s 40 05 08b0 0000 0004 4 = 18060000
ffff000102d1dcc0 1200639151 C Co:6:002:0 0 4 >
ffff000102d1dcc0 1200639218 S Ci:6:002:0 s c0 05 0d04 0000 0004 4 <
ffff000102d1dcc0 1200639338 C Ci:6:002:0 0 4 = 787d93b1
ffff000102d1dcc0 1200639384 S Co:6:002:0 s 40 05 0c90 0000 0004 4 = 787d8301
ffff000102d1dcc0 1200639491 C Co:6:002:0 0 4 >
ffff000102d1dcc0 1200639550 S Ci:6:002:0 s c0 05 0e00 0000 0004 4 <
ffff000102d1dcc0 1200639670 C Ci:6:002:0 0 4 = 07000000
ffff000102d1dcc0 1200639715 S Ci:6:002:0 s c0 05 08b0 0000 0004 4 <
ffff000102d1dcc0 1200639826 C Ci:6:002:0 0 4 = 18060000
ffff000102d1dcc0 1200639871 S Co:6:002:0 s 40 05 08b0 0000 0004 4 = 18060000
ffff000102d1dcc0 1200639989 C Co:6:002:0 0 4 >
ffff000102d1dcc0 1200640056 S Ci:6:002:0 s c0 05 0d44 0000 0004 4 <
ffff000102d1dcc0 1200640185 C Ci:6:002:0 0 4 = 787d93b1
ffff000102d1dcc0 1200640243 S Co:6:002:0 s 40 05 0e90 0000 0004 4 = 787d8301
ffff000102d1dcc0 1200640359 C Co:6:002:0 0 4 >
ffff000102d1dcc0 1200640421 S Ci:6:002:0 s c0 05 0073 0000 0001 1 <
ffff000102d1dcc0 1200640542 C Ci:6:002:0 0 1 = 07
ffff000102d1dcc0 1200640587 S Co:6:002:0 s 40 05 0073 0000 0001 1 = 07
ffff000102d1dcc0 1200640694 C Co:6:002:0 0 1 >
ffff000102d1dcc0 1200640766 S Ci:6:002:0 s c0 05 0c24 0000 0004 4 <
ffff000102d1dcc0 1200640886 C Ci:6:002:0 0 4 = 20202020
ffff000102d1dcc0 1200640932 S Co:6:002:0 s 40 05 0c24 0000 0004 4 = 2c2c2c2c
ffff000102d1dcc0 1200641038 C Co:6:002:0 0 4 >
ffff000102d1dcc0 1200641085 S Ci:6:002:0 s c0 05 0c28 0000 0004 4 <
ffff000102d1dcc0 1200641204 C Ci:6:002:0 0 4 = 20201e1c
ffff000102d1dcc0 1200641249 S Co:6:002:0 s 40 05 0c28 0000 0004 4 = 2c2c2a28
ffff000102d1dcc0 1200641366 C Co:6:002:0 0 4 >
ffff000102d1dcc0 1200641412 S Ci:6:002:0 s c0 05 0c2c 0000 0004 4 <
ffff000102d1dcc0 1200641537 C Ci:6:002:0 0 4 = 20202020
ffff000102d1dcc0 1200641582 S Co:6:002:0 s 40 05 0c2c 0000 0004 4 = 31313131
ffff000103533900 1200641591 C Bi:6:002:1 0 478 = a6010484 00000f80 e50b6000 04300000 00000000 31df4a02 3c3c0000 74dddd0f
ffff000103533900 1200641613 S Bi:6:002:1 -115 32768 <
ffff000102d1dcc0 1200641671 C Co:6:002:0 0 4 >
ffff000102d1dcc0 1200641709 S Ci:6:002:0 s c0 05 0c30 0000 0004 4 <
ffff000102d1dcc0 1200641777 C Ci:6:002:0 0 4 = 20201e1c
ffff000102d1dcc0 1200641815 S Co:6:002:0 s 40 05 0c30 0000 0004 4 = 2f2d2b29
ffff000102d1dcc0 1200641930 C Co:6:002:0 0 4 >
ffff000102d1dcc0 1200642094 S Ci:6:002:0 s c0 05 0c34 0000 0004 4 <
ffff000102d1dcc0 1200642258 C Ci:6:002:0 0 4 = 20202020
ffff000102d1dcc0 1200642415 S Co:6:002:0 s 40 05 0c34 0000 0004 4 = 2d2d2d2d
ffff000102d1dcc0 1200642526 C Co:6:002:0 0 4 >
ffff000102d1dcc0 1200642581 S Ci:6:002:0 s c0 05 0c38 0000 0004 4 <
ffff000103558cc0 1200642632 C Bi:6:002:1 0 471 = 9f010484 00000f80 9e0e6000 04300000 00000000 75e34a02 3c3e0000 73dbdb0f
ffff000103558cc0 1200642648 S Bi:6:002:1 -115 32768 <
ffff000102d1dcc0 1200642677 C Ci:6:002:0 0 4 = 201e1c1a
ffff000102d1dcc0 1200642715 S Co:6:002:0 s 40 05 0c38 0000 0004 4 = 2d2b2927
ffff000102d1dcc0 1200642752 C Co:6:002:0 0 4 >
ffff000102d1dcc0 1200642789 S Ci:6:002:0 s c0 05 0c3c 0000 0004 4 <
ffff000102d1dcc0 1200642901 C Ci:6:002:0 0 4 = 20202020
ffff000102d1dcc0 1200642947 S Co:6:002:0 s 40 05 0c3c 0000 0004 4 = 31313131
ffff000102d1dcc0 1200643053 C Co:6:002:0 0 4 >
ffff000102d1dcc0 1200643102 S Ci:6:002:0 s c0 05 0c40 0000 0004 4 <
ffff000102d1dcc0 1200643239 C Ci:6:002:0 0 4 = 20201e1c
ffff000102d1dcc0 1200643286 S Co:6:002:0 s 40 05 0c40 0000 0004 4 = 2f2d2b29
ffff000102d1dcc0 1200643390 C Co:6:002:0 0 4 >
ffff000102d1dcc0 1200643437 S Ci:6:002:0 s c0 05 0c44 0000 0004 4 <
ffff00014c2bf900 1200643480 C Bi:6:002:1 0 446 = 86010484 00000f80 47066000 04300000 00000000 ebe64a02 3c3c0000 75dcdc0f
ffff00014c2bf900 1200643508 S Bi:6:002:1 -115 32768 <
ffff000102d1dcc0 1200643547 C Ci:6:002:0 0 4 = 1a181e1e
ffff000102d1dcc0 1200643586 S Co:6:002:0 s 40 05 0c44 0000 0004 4 = 27272d2d
ffff000102d1dcc0 1200643631 C Co:6:002:0 0 4 >
ffff000102d1dcc0 1200643670 S Ci:6:002:0 s c0 05 0c48 0000 0004 4 <
ffff000102d1dcc0 1200643811 C Ci:6:002:0 0 4 = 1e1e1e1e
ffff000102d1dcc0 1200643856 S Co:6:002:0 s 40 05 0c48 0000 0004 4 = 2d2d2d2b
ffff000102d1dcc0 1200643962 C Co:6:002:0 0 4 >
ffff000102d1dcc0 1200644026 S Ci:6:002:0 s c0 05 0c4c 0000 0004 4 <
ffff000102d1dcc0 1200644095 C Ci:6:002:0 0 4 = 1c1a1816
ffff000102d1dcc0 1200644133 S Co:6:002:0 s 40 05 0c4c 0000 0004 4 = 29272525
ffff000102d1dcc0 1200644250 C Co:6:002:0 0 4 >
ffff000102d1dcc0 1200644297 S Ci:6:002:0 s c0 05 0c54 0000 0004 4 <
ffff000102d1dcc0 1200644409 C Ci:6:002:0 0 4 = 120a0400
ffff000102d1dcc0 1200644457 S Co:6:002:0 s 40 05 0c54 0000 0004 4 = 1f171100
ffff00013d62e840 1200644467 C Bi:6:002:1 0 469 = 9d010484 00000f80 990e6000 04300000 00000000 88ea4a02 3c3c0000 73dbdb0f
ffff00013d62e840 1200644473 S Bi:6:002:1 -115 32768 <
ffff000102d1dcc0 1200644522 C Co:6:002:0 0 4 >
ffff000102d1dcc0 1200644564 S Ci:6:002:0 s c0 05 0e24 0000 0004 4 <
ffff000102d1dcc0 1200644615 C Ci:6:002:0 0 4 = 1d1d1d1d
ffff000102d1dcc0 1200644655 S Co:6:002:0 s 40 05 0e24 0000 0004 4 = 1e1e1e1e
ffff000102d1dcc0 1200644758 C Co:6:002:0 0 4 >
ffff000102d1dcc0 1200644804 S Ci:6:002:0 s c0 05 0e28 0000 0004 4 <
ffff000102d1dcc0 1200644916 C Ci:6:002:0 0 4 = 1d1d1b19
ffff000102d1dcc0 1200644962 S Co:6:002:0 s 40 05 0e28 0000 0004 4 = 1e1e1c1a
ffff000102d1dcc0 1200645068 C Co:6:002:0 0 4 >
ffff000102d1dcc0 1200645113 S Ci:6:002:0 s c0 05 0e2c 0000 0004 4 <
ffff000102d1dcc0 1200645236 C Ci:6:002:0 0 4 = 1f1f1f1f
ffff000102d1dcc0 1200645282 S Co:6:002:0 s 40 05 0e2c 0000 0004 4 = 23232323
ffff000102d1dcc0 1200645391 C Co:6:002:0 0 4 >
ffff000102d1dcc0 1200645436 S Ci:6:002:0 s c0 05 0e30 0000 0004 4 <
ffff000103533900 1200645443 C Bi:6:002:1 0 479 = a7010484 00000f80 220e6000 04300000 00000000 39ee4a02 3c3c0000 73dada0f
ffff000103533900 1200645449 S Bi:6:002:1 -115 32768 <
ffff000102d1dcc0 1200645499 C Ci:6:002:0 0 4 = 1f1f1d1b
ffff000102d1dcc0 1200645538 S Co:6:002:0 s 40 05 0e30 0000 0004 4 = 211f1d1b
ffff000102d1dcc0 1200645583 C Co:6:002:0 0 4 >
ffff000102d1dcc0 1200645622 S Ci:6:002:0 s c0 05 0e34 0000 0004 4 <
ffff000102d1dcc0 1200645743 C Ci:6:002:0 0 4 = 1f1f1f1f
ffff000102d1dcc0 1200645790 S Co:6:002:0 s 40 05 0e34 0000 0004 4 = 1f1f1f1f
ffff000102d1dcc0 1200645894 C Co:6:002:0 0 4 >
ffff000102d1dcc0 1200645942 S Ci:6:002:0 s c0 05 0e38 0000 0004 4 <
ffff000102d1dcc0 1200646061 C Ci:6:002:0 0 4 = 1f1d1b19
ffff000102d1dcc0 1200646106 S Co:6:002:0 s 40 05 0e38 0000 0004 4 = 1f1d1b19
ffff000102d1dcc0 1200646212 C Co:6:002:0 0 4 >
ffff000102d1dcc0 1200646259 S Ci:6:002:0 s c0 05 0e3c 0000 0004 4 <
ffff000102d1dcc0 1200646377 C Ci:6:002:0 0 4 = 1f1f1f1f
ffff000102d1dcc0 1200646423 S Co:6:002:0 s 40 05 0e3c 0000 0004 4 = 23232323
ffff000102d1dcc0 1200646528 C Co:6:002:0 0 4 >
ffff000102d1dcc0 1200646575 S Ci:6:002:0 s c0 05 0e40 0000 0004 4 <
ffff000102d1dcc0 1200646692 C Ci:6:002:0 0 4 = 1f1f1d1b
ffff000102d1dcc0 1200646738 S Co:6:002:0 s 40 05 0e40 0000 0004 4 = 211f1d1b
ffff000102d1dcc0 1200646844 C Co:6:002:0 0 4 >
ffff000102d1dcc0 1200646891 S Ci:6:002:0 s c0 05 0e44 0000 0004 4 <
ffff000102d1dcc0 1200647009 C Ci:6:002:0 0 4 = 19171d1d
ffff000102d1dcc0 1200647055 S Co:6:002:0 s 40 05 0e44 0000 0004 4 = 19191f1f
ffff000102d1dcc0 1200647161 C Co:6:002:0 0 4 >
ffff000102d1dcc0 1200647207 S Ci:6:002:0 s c0 05 0e48 0000 0004 4 <
ffff000102d1dcc0 1200647325 C Ci:6:002:0 0 4 = 1d1d1d1d
ffff000102d1dcc0 1200647371 S Co:6:002:0 s 40 05 0e48 0000 0004 4 = 1f1f1f1d
ffff000102d1dcc0 1200647491 C Co:6:002:0 0 4 >
ffff000102d1dcc0 1200647537 S Ci:6:002:0 s c0 05 0e4c 0000 0004 4 <
ffff000102d1dcc0 1200647655 C Ci:6:002:0 0 4 = 1b191715
ffff000102d1dcc0 1200647701 S Co:6:002:0 s 40 05 0e4c 0000 0004 4 = 1b191717
ffff000102d1dcc0 1200647806 C Co:6:002:0 0 4 >
ffff000102d1dcc0 1200647853 S Ci:6:002:0 s c0 05 0e54 0000 0004 4 <
ffff000102d1dcc0 1200647987 C Ci:6:002:0 0 4 = 11090300
ffff000102d1dcc0 1200648070 S Co:6:002:0 s 40 05 0e54 0000 0004 4 = 11090300
ffff000102d1dcc0 1200648208 C Co:6:002:0 0 4 >
ffff000103558cc0 1200694822 C Bi:6:002:1 0 281 = e1000484 00000f00 27006000 04300000 00000000 e3af4b02 5e600000 c6e9e90f
ffff000103558cc0 1200694888 S Bi:6:002:1 -115 32768 <
ffff00014c2bf900 1200744062 C Bi:6:002:1 0 478 = a6010484 00000f80 e60b6000 04300000 00000000 336f4c02 3c3a0000 75dcdc0f
ffff00014c2bf900 1200744099 S Bi:6:002:1 -115 32768 <
ffff00013d62e840 1200744983 C Bi:6:002:1 0 471 = 9f010484 00000f80 9f0e6000 04300000 00000000 f5724c02 3c3c0000 73dede0f
ffff00013d62e840 1200745009 S Bi:6:002:1 -115 32768 <
ffff000103533900 1200745829 C Bi:6:002:1 0 446 = 86010484 00000f80 48066000 04300000 00000000 69764c02 3c3c0000 71dbdb0f
ffff000103533900 1200745852 S Bi:6:002:1 -115 32768 <
ffff000103558cc0 1200746722 C Bi:6:002:1 0 469 = 9d010484 00000f80 9a0e6000 04300000 00000000 c4794c02 3c3a0000 75dada0f
ffff000103558cc0 1200746747 S Bi:6:002:1 -115 32768 <
ffff00014c2bf900 1200747650 C Bi:6:002:1 0 479 = a7010484 00000f80 230e6000 04300000 00000000 497d4c02 3c3c0000 73dada0f
ffff00014c2bf900 1200747674 S Bi:6:002:1 -115 32768 <
ffff00013d9fb000 1200764322 S Ci:6:002:0 s c0 05 0770 0000 0004 4 <
ffff00013d9fb000 1200764465 C Ci:6:002:0 0 4 = 00000000
ffff00013d9fb000 1200764621 S Ci:6:002:0 s c0 05 0774 0000 0004 4 <
ffff00013d9fb000 1200764769 C Ci:6:002:0 0 4 = 00000000
ffff00013d9fb000 1200764931 S Co:6:002:0 s 40 05 076e 0000 0001 1 = 0c
ffff00013d9fb000 1200765070 C Co:6:002:0 0 1 >
ffff00013d9fb000 1200765234 S Ci:6:002:0 s c0 05 0808 0000 0004 4 <
ffff00013d9fb000 1200765385 C Ci:6:002:0 0 4 = 3382023e
ffff00013d9fb000 1200765545 S Ci:6:002:0 s c0 05 0a5c 0000 0002 2 <
ffff00013d9fb000 1200765693 C Ci:6:002:0 0 2 = 7c00
ffff00013d9fb000 1200765834 S Ci:6:002:0 s c0 05 0f48 0000 0002 2 <
ffff00013d9fb000 1200765956 C Ci:6:002:0 0 2 = ae03
ffff00013d9fb000 1200765992 S Ci:6:002:0 s c0 05 0f04 0000 0004 4 <
ffff00013d9fb000 1200766119 C Ci:6:002:0 0 4 = 0b000100
ffff00013d9fb000 1200766148 S Ci:6:002:0 s c0 05 0f14 0000 0004 4 <
ffff00013d9fb000 1200766260 C Ci:6:002:0 0 4 = 1d011400
ffff00013d9fb000 1200766290 S Ci:6:002:0 s c0 05 0f10 0000 0004 4 <
ffff00013d9fb000 1200766402 C Ci:6:002:0 0 4 = 00000000
ffff00013d9fb000 1200766430 S Ci:6:002:0 s c0 05 0f0c 0000 0004 4 <
ffff00013d9fb000 1200766549 C Ci:6:002:0 0 4 = 00000000
ffff00013d9fb000 1200766569 S Ci:6:002:0 s c0 05 0f08 0000 0004 4 <
ffff00013d9fb000 1200766682 C Ci:6:002:0 0 4 = b800df04
ffff00013d9fb000 1200766710 S Ci:6:002:0 s c0 05 0fcc 0000 0004 4 <
ffff00013d9fb000 1200766830 C Ci:6:002:0 0 4 = 00000000
ffff00013d9fb000 1200766850 S Ci:6:002:0 s c0 05 09a4 0000 0004 4 <
ffff00013d9fb000 1200766963 C Ci:6:002:0 0 4 = 80000800
ffff00013d9fb000 1200766993 S Co:6:002:0 s 40 05 09a4 0000 0004 4 = 80000a00
ffff00013d9fb000 1200767107 C Co:6:002:0 0 4 >
ffff00013d9fb000 1200767128 S Ci:6:002:0 s c0 05 09a4 0000 0004 4 <
ffff00013d9fb000 1200767244 C Ci:6:002:0 0 4 = 80000a00
ffff00013d9fb000 1200767273 S Co:6:002:0 s 40 05 09a4 0000 0004 4 = 80000800
ffff00013d9fb000 1200767387 C Co:6:002:0 0 4 >
ffff00013d9fb000 1200767408 S Ci:6:002:0 s c0 05 0a2c 0000 0004 4 <
ffff00013d9fb000 1200767521 C Ci:6:002:0 0 4 = 00809000
ffff00013d9fb000 1200767550 S Co:6:002:0 s 40 05 0a2c 0000 0004 4 = 00009000
ffff00013d9fb000 1200767658 C Co:6:002:0 0 4 >
ffff00013d9fb000 1200767687 S Ci:6:002:0 s c0 05 0a2c 0000 0004 4 <
ffff00013d9fb000 1200767799 C Ci:6:002:0 0 4 = 00009000
ffff00013d9fb000 1200767829 S Co:6:002:0 s 40 05 0a2c 0000 0004 4 = 00809000
ffff00013d9fb000 1200767937 C Co:6:002:0 0 4 >
ffff00013d9fb000 1200767966 S Ci:6:002:0 s c0 05 0b58 0000 0004 4 <
ffff00013d9fb000 1200768081 C Ci:6:002:0 0 4 = 00000000
ffff00013d9fb000 1200768111 S Co:6:002:0 s 40 05 0b58 0000 0004 4 = 01000000
ffff00013d9fb000 1200768224 C Co:6:002:0 0 4 >
ffff00013d9fb000 1200768245 S Ci:6:002:0 s c0 05 0b58 0000 0004 4 <
ffff00013d9fb000 1200768367 C Ci:6:002:0 0 4 = 01000000
ffff00013d9fb000 1200768396 S Co:6:002:0 s 40 05 0b58 0000 0004 4 = 00000000
ffff00013d9fb000 1200768431 C Co:6:002:0 0 4 >
ffff00013d9fb000 1200768448 S Ci:6:002:0 s c0 05 01cc 0000 0001 1 <
ffff00013d9fb000 1200768557 C Ci:6:002:0 0 1 = 00
ffff00013d9fb000 1200768586 S Co:6:002:0 s 40 05 01f8 0000 0004 4 = 00000000
ffff00013d9fb000 1200768695 C Co:6:002:0 0 4 >
ffff00013d9fb000 1200768724 S Co:6:002:0 s 40 05 01d8 0000 0004 4 = 58000000
ffff00013d9fb000 1200768833 C Co:6:002:0 0 4 >
ffff00013d9fb000 1200768855 S Co:6:002:0 s 40 05 0440 0000 0004 4 = 00000000
ffff00013d9fb000 1200768962 C Co:6:002:0 0 4 >
ffff00013d9fb000 1200768992 S Ci:6:002:0 s c0 05 0c00 0000 0004 4 <
ffff00013d9fb000 1200769115 C Ci:6:002:0 0 4 = 07000000
ffff00013d9fb000 1200769135 S Ci:6:002:0 s c0 05 08b0 0000 0004 4 <
ffff00013d9fb000 1200769256 C Ci:6:002:0 0 4 = 18060000
ffff00013d9fb000 1200769277 S Co:6:002:0 s 40 05 08b0 0000 0004 4 = 42060000
ffff00013d9fb000 1200769385 C Co:6:002:0 0 4 >
ffff00013d9fb000 1200769434 S Ci:6:002:0 s c0 05 0d04 0000 0004 4 <
ffff00013d9fb000 1200769540 C Ci:6:002:0 0 4 = 088d90b1
ffff00013d9fb000 1200769563 S Co:6:002:0 s 40 05 0c90 0000 0004 4 = 088d2304
ffff00013d9fb000 1200769671 C Co:6:002:0 0 4 >
ffff00013d9fb000 1200769713 S Co:6:002:0 s 40 05 0280 0000 0002 2 = 0001
ffff00013d9fb000 1200769813 C Co:6:002:0 0 2 >
ffff00013d9fb000 1200769834 S Ci:6:002:0 s c0 05 010c 0000 0001 1 <
ffff00013d9fb000 1200769947 C Ci:6:002:0 0 1 = b4
ffff00013d9fb000 1200769975 S Co:6:002:0 s 40 05 010c 0000 0001 1 = b4
ffff00013d9fb000 1200770089 C Co:6:002:0 0 1 >
ffff00013d9fb000 1200770121 S Ci:6:002:0 s c0 05 004c 0000 0001 1 <
ffff00013d9fb000 1200770245 C Ci:6:002:0 0 1 = 20
ffff00013d9fb000 1200770275 S Co:6:002:0 s 40 05 004c 0000 0001 1 = 20
ffff00013d9fb000 1200770383 C Co:6:002:0 0 1 >
ffff00013d62e840 1200846459 C Bi:6:002:1 0 478 = a6010484 00000f80 e70b6000 04300000 00000000 34ff4d02 3c3c0000 76dada0f
ffff00013d62e840 1200846512 S Bi:6:002:1 -115 32768 <
ffff000103533900 1200847429 C Bi:6:002:1 0 471 = 9f010484 00000f80 a00e6000 04300000 00000000 29034e02 3c3c0000 75dbdb0f
ffff000103533900 1200847455 S Bi:6:002:1 -115 32768 <
ffff000103558cc0 1200848275 C Bi:6:002:1 0 446 = 86010484 00000f80 49066000 04300000 00000000 8e064e02 3c3c0000 73dcdc0f
ffff000103558cc0 1200848300 S Bi:6:002:1 -115 32768 <
ffff00014c2bf900 1200849209 C Bi:6:002:1 0 469 = 9d010484 00000f80 9b0e6000 04300000 00000000 1e0a4e02 3c3c0000 76dada0f
ffff00014c2bf900 1200849236 S Bi:6:002:1 -115 32768 <
ffff00013d62e840 1200850108 C Bi:6:002:1 0 479 = a7010484 00000f80 240e6000 04300000 00000000 940d4e02 3c3c0000 72d9d90f
ffff00013d62e840 1200850134 S Bi:6:002:1 -115 32768 <
ffff000103533900 1200915471 C Bi:6:002:1 0 84 = 1c000484 00000f22 980a6000 08300000 00000000 fa0e4f02 66660000 cde9e90f
ffff000103533900 1200915529 S Bi:6:002:1 -115 32768 <
ffff000103558cc0 1200948859 C Bi:6:002:1 0 478 = a6010484 00000f80 e80b6000 04300000 00000000 368f4f02 3c3a0000 73dbdb0f
ffff000103558cc0 1200948895 S Bi:6:002:1 -115 32768 <
ffff00014c2bf900 1200949820 C Bi:6:002:1 0 471 = 9f010484 00000f80 a10e6000 04300000 00000000 1e934f02 3c380000 72dbdb0f
ffff00014c2bf900 1200949846 S Bi:6:002:1 -115 32768 <
ffff00013d62e840 1200950693 C Bi:6:002:1 0 446 = 86010484 00000f80 4a066000 04300000 00000000 a8964f02 3c3a0000 74dddd0f
ffff00013d62e840 1200950718 S Bi:6:002:1 -115 32768 <
ffff000103533900 1200951644 C Bi:6:002:1 0 469 = 9d010484 00000f80 9c0e6000 04300000 00000000 359a4f02 3c3a0000 74dbdb0f
ffff000103533900 1200951669 S Bi:6:002:1 -115 32768 <
ffff000103558cc0 1200952561 C Bi:6:002:1 0 479 = a7010484 00000f80 250e6000 04300000 00000000 c49d4f02 3a3a0000 74dcdc0f
ffff000103558cc0 1200952586 S Bi:6:002:1 -115 32768 <
ffff00014c2bf900 1201051206 C Bi:6:002:1 0 478 = a6010484 00000f80 e90b6000 04300000 00000000 381f5102 3c3c0000 72dbdb0f
ffff00014c2bf900 1201051229 S Bi:6:002:1 -115 32768 <
ffff00013d62e840 1201052228 C Bi:6:002:1 0 471 = 9f010484 00000f80 a20e6000 04300000 00000000 34235102 3a3c0000 72dddd0f
ffff00013d62e840 1201052252 S Bi:6:002:1 -115 32768 <
ffff000103533900 1201053094 C Bi:6:002:1 0 446 = 86010484 00000f80 4b066000 04300000 00000000 ac265102 3a3a0000 72dede0f
ffff000103533900 1201053120 S Bi:6:002:1 -115 32768 <
ffff000103558cc0 1201053960 C Bi:6:002:1 0 469 = 9d010484 00000f80 9d0e6000 04300000 00000000 ed295102 3a3a0000 6fd8d80f
ffff000103558cc0 1201053985 S Bi:6:002:1 -115 32768 <
ffff00014c2bf900 1201054872 C Bi:6:002:1 0 479 = a7010484 00000f80 260e6000 04300000 00000000 642d5102 3a3c0000 72dddd0f
ffff00014c2bf900 1201054889 S Bi:6:002:1 -115 32768 <
ffff00013d62e840 1201104054 C Bi:6:002:1 0 84 = 1c000484 00000f20 990a6000 08300000 00000000 c6ef5102 64680000 d0eaea0f
ffff00013d62e840 1201104079 S Bi:6:002:1 -115 32768 <
ffff000103533900 1201125047 C Bi:6:002:1 0 281 = e1000484 00000f00 28006000 04300000 00000000 80405202 5e600000 c4e9e90f
ffff000103533900 1201125085 S Bi:6:002:1 -115 32768 <
ffff000103558cc0 1201153669 C Bi:6:002:1 0 478 = a6010484 00000f80 ea0b6000 04300000 00000000 39af5202 3c3c0000 75dbdb0f
ffff000103558cc0 1201153707 S Bi:6:002:1 -115 32768 <
ffff00014c2bf900 1201154664 C Bi:6:002:1 0 471 = 9f010484 00000f80 a30e6000 04300000 00000000 27b35202 3c3c0000 76dada0f
ffff00014c2bf900 1201154692 S Bi:6:002:1 -115 32768 <
ffff00013d62e840 1201155518 C Bi:6:002:1 0 446 = 86010484 00000f80 4c066000 04300000 00000000 c3b65202 3c3a0000 77dbdb0f
ffff00013d62e840 1201155544 S Bi:6:002:1 -115 32768 <
ffff000103533900 1201156447 C Bi:6:002:1 0 469 = 9d010484 00000f80 9e0e6000 04300000 00000000 2eba5202 3c3c0000 75dbdb0f
ffff000103533900 1201156477 S Bi:6:002:1 -115 32768 <
ffff000103558cc0 1201157334 C Bi:6:002:1 0 479 = a7010484 00000f80 270e6000 04300000 00000000 afbd5202 3c3c0000 74dbdb0f
ffff000103558cc0 1201157364 S Bi:6:002:1 -115 32768 <
ffff00014c2bf900 1201256009 C Bi:6:002:1 0 478 = a6010484 00000f80 eb0b6000 04300000 00000000 3b3f5402 3c3c0000 75dcdc0f
ffff00014c2bf900 1201256031 S Bi:6:002:1 -115 32768 <
ffff00013d62e840 1201256925 C Bi:6:002:1 0 471 = 9f010484 00000f80 a40e6000 04300000 00000000 12435402 3c3c0000 72dbdb0f
ffff00013d62e840 1201256941 S Bi:6:002:1 -115 32768 <
ffff000103533900 1201257805 C Bi:6:002:1 0 446 = 86010484 00000f80 4d066000 04300000 00000000 b2465402 3a3a0000 74dbdb0f
ffff000103533900 1201257820 S Bi:6:002:1 -115 32768 <
ffff000103558cc0 1201258726 C Bi:6:002:1 0 469 = 9d010484 00000f80 9f0e6000 04300000 00000000 254a5402 3c3c0000 74dcdc0f
ffff000103558cc0 1201258744 S Bi:6:002:1 -115 32768 <
ffff00014c2bf900 1201259667 C Bi:6:002:1 0 479 = a7010484 00000f80 280e6000 04300000 00000000 b64d5402 3c3c0000 74dcdc0f
ffff00014c2bf900 1201259713 S Bi:6:002:1 -115 32768 <
ffff00013d62e840 1201358467 C Bi:6:002:1 0 478 = a6010484 00000f80 ec0b6000 04300000 00000000 3dcf5502 3c3a0000 73dbdb0f
ffff00013d62e840 1201358505 S Bi:6:002:1 -115 32768 <
ffff000103533900 1201359495 C Bi:6:002:1 0 471 = 9f010484 00000f80 a50e6000 04300000 00000000 75d35502 3c3c0000 72dbdb0f
ffff000103533900 1201359517 S Bi:6:002:1 -115 32768 <
ffff000103558cc0 1201360312 C Bi:6:002:1 0 446 = 86010484 00000f80 4e066000 04300000 00000000 0ed75502 3c3c0000 74dcdc0f
ffff000103558cc0 1201360328 S Bi:6:002:1 -115 32768 <
ffff00014c2bf900 1201361277 C Bi:6:002:1 0 469 = 9d010484 00000f80 a00e6000 04300000 00000000 71da5502 3c3c0000 72dbdb0f
ffff00014c2bf900 1201361299 S Bi:6:002:1 -115 32768 <
ffff00013d62e840 1201362183 C Bi:6:002:1 0 479 = a7010484 00000f80 290e6000 04300000 00000000 f5dd5502 3c3c0000 75dcdc0f
ffff00013d62e840 1201362206 S Bi:6:002:1 -115 32768 <
ffff000103533900 1201389321 C Bi:6:002:1 0 84 = 1c000484 00000f22 9a0a6000 08300000 00000000 1d4a5602 66680000 cce9e90f
ffff000103533900 1201389355 S Bi:6:002:1 -115 32768 <
ffff000103558cc0 1201460865 C Bi:6:002:1 0 478 = a6010484 00000f80 ed0b6000 04300000 00000000 3e5f5702 3c3c0000 73dada0f
ffff000103558cc0 1201460900 S Bi:6:002:1 -115 32768 <
ffff00014c2bf900 1201461922 C Bi:6:002:1 0 471 = 9f010484 00000f80 a60e6000 04300000 00000000 87635702 3c3c0000 73dddd0f
ffff00014c2bf900 1201461948 S Bi:6:002:1 -115 32768 <
ffff00013d62e840 1201462920 C Bi:6:002:1 0 446 = 86010484 00000f80 4f066000 04300000 00000000 8e675702 3c3a0000 70dbdb0f
ffff00013d62e840 1201462944 S Bi:6:002:1 -115 32768 <
ffff000103533900 1201463889 C Bi:6:002:1 0 469 = 9d010484 00000f80 a10e6000 04300000 00000000 376b5702 3c3c0000 72dada0f
ffff000103533900 1201463914 S Bi:6:002:1 -115 32768 <
ffff000103558cc0 1201464837 C Bi:6:002:1 0 479 = a7010484 00000f80 2a0e6000 04300000 00000000 e06e5702 3a3c0000 72dada0f
ffff000103558cc0 1201464863 S Bi:6:002:1 -115 32768 <
ffff00014c2bf900 1201563220 C Bi:6:002:1 0 478 = a6010484 00000f80 ee0b6000 04300000 00000000 40ef5802 3c3c0000 73dddd0f
ffff00014c2bf900 1201563245 S Bi:6:002:1 -115 32768 <
ffff00013d62e840 1201564220 C Bi:6:002:1 0 471 = 9f010484 00000f80 a70e6000 04300000 00000000 19f35802 3c3c0000 75dada0f
ffff00013d62e840 1201564247 S Bi:6:002:1 -115 32768 <
ffff000103533900 1201565053 C Bi:6:002:1 0 446 = 86010484 00000f80 50066000 04300000 00000000 87f65802 3a3c0000 74dddd0f
ffff000103533900 1201565082 S Bi:6:002:1 -115 32768 <
ffff000103558cc0 1201565954 C Bi:6:002:1 0 469 = 9d010484 00000f80 a20e6000 04300000 00000000 eaf95802 3c3c0000 73dada0f
ffff000103558cc0 1201565979 S Bi:6:002:1 -115 32768 <
ffff00014c2bf900 1201566887 C Bi:6:002:1 0 479 = a7010484 00000f80 2b0e6000 04300000 00000000 80fd5802 3a3c0000 73dcdc0f
ffff00014c2bf900 1201566912 S Bi:6:002:1 -115 32768 <
ffff00013d62e840 1201609305 C Bi:6:002:1 0 84 = 1c000484 00000f20 9b0a6000 08300000 00000000 4da55902 66760000 eae8e80f
ffff00013d62e840 1201609331 S Bi:6:002:1 -115 32768 <
ffff000103533900 1201623425 C Bi:6:002:1 0 281 = e1000484 00000f00 29006000 04300000 00000000 79db5902 60600000 c5e9e90f
ffff000103533900 1201623478 S Bi:6:002:1 -115 32768 <
ffff000103558cc0 1201665631 C Bi:6:002:1 0 478 = a6010484 00000f80 ef0b6000 04300000 00000000 427f5a02 3a3c0000 74dbdb0f
ffff000103558cc0 1201665659 S Bi:6:002:1 -115 32768 <
ffff00014c2bf900 1201666637 C Bi:6:002:1 0 471 = 9f010484 00000f80 a80e6000 04300000 00000000 31835a02 3a3e0000 75dbdb0f
ffff00014c2bf900 1201666667 S Bi:6:002:1 -115 32768 <
ffff00013d62e840 1201667485 C Bi:6:002:1 0 446 = 86010484 00000f80 51066000 04300000 00000000 a5865a02 3a3c0000 76dcdc0f
ffff00013d62e840 1201667509 S Bi:6:002:1 -115 32768 <
ffff000103533900 1201668406 C Bi:6:002:1 0 469 = 9d010484 00000f80 a30e6000 04300000 00000000 1f8a5a02 3c3e0000 76dddd0f
ffff000103533900 1201668431 S Bi:6:002:1 -115 32768 <
ffff000103558cc0 1201669407 C Bi:6:002:1 0 479 = a7010484 00000f80 2c0e6000 04300000 00000000 fb8d5a02 3c3c0000 73dddd0f
ffff000103558cc0 1201669432 S Bi:6:002:1 -115 32768 <
ffff00013d9fb000 1201756171 S Ci:6:002:0 s c0 05 004c 0000 0001 1 <
ffff00013d9fb000 1201756324 C Ci:6:002:0 0 1 = 20
ffff00013d9fb000 1201756486 S Co:6:002:0 s 40 05 004c 0000 0001 1 = 20
ffff00013d9fb000 1201756626 C Co:6:002:0 0 1 >
ffff00014c2bf900 1201768064 C Bi:6:002:1 0 478 = a6010484 00000f80 f00b6000 04300000 00000000 430f5c02 3c3a0000 75dddd0f
ffff00014c2bf900 1201768090 S Bi:6:002:1 -115 32768 <
ffff00013d62e840 1201769013 C Bi:6:002:1 0 471 = 9f010484 00000f80 a90e6000 04300000 00000000 1d135c02 3c3a0000 72dddd0f
ffff00013d62e840 1201769039 S Bi:6:002:1 -115 32768 <
ffff000103533900 1201769911 C Bi:6:002:1 0 446 = 86010484 00000f80 52066000 04300000 00000000 c1165c02 3c3a0000 72dcdc0f
ffff000103533900 1201769936 S Bi:6:002:1 -115 32768 <
ffff000103558cc0 1201770816 C Bi:6:002:1 0 469 = 9d010484 00000f80 a40e6000 04300000 00000000 281a5c02 3a3a0000 74dddd0f
ffff000103558cc0 1201770840 S Bi:6:002:1 -115 32768 <
ffff00014c2bf900 1201771727 C Bi:6:002:1 0 479 = a7010484 00000f80 2d0e6000 04300000 00000000 ad1d5c02 3c3a0000 73dcdc0f
ffff00014c2bf900 1201771752 S Bi:6:002:1 -115 32768 <
ffff00013d62e840 1201870419 C Bi:6:002:1 0 478 = a6010484 00000f80 f10b6000 04300000 00000000 459f5d02 3c3a0000 73dddd0f
ffff00013d62e840 1201870442 S Bi:6:002:1 -115 32768 <
ffff000103533900 1201871396 C Bi:6:002:1 0 471 = 9f010484 00000f80 aa0e6000 04300000 00000000 26a35d02 3c3a0000 73dede0f
ffff000103533900 1201871417 S Bi:6:002:1 -115 32768 <
ffff000103558cc0 1201872253 C Bi:6:002:1 0 446 = 86010484 00000f80 53066000 04300000 00000000 9aa65d02 3c3a0000 72d9d90f
ffff000103558cc0 1201872272 S Bi:6:002:1 -115 32768 <
ffff00014c2bf900 1201873195 C Bi:6:002:1 0 469 = 9d010484 00000f80 a50e6000 04300000 00000000 0caa5d02 3c3a0000 72dada0f
ffff00014c2bf900 1201873221 S Bi:6:002:1 -115 32768 <
ffff00013d62e840 1201874141 C Bi:6:002:1 0 479 = a7010484 00000f80 2e0e6000 04300000 00000000 baad5d02 3c380000 72dddd0f
ffff00013d62e840 1201874167 S Bi:6:002:1 -115 32768 <
ffff000103533900 1201901680 C Bi:6:002:1 0 84 = 1c000484 00000f22 9c0a6000 08300000 00000000 651b5e02 66680000 cae9e90f
ffff000103533900 1201901705 S Bi:6:002:1 -115 32768 <
ffff000103558cc0 1201972825 C Bi:6:002:1 0 478 = a6010484 00000f80 f20b6000 04300000 00000000 472f5f02 3e3a0000 76dcdc0f
ffff000103558cc0 1201972880 S Bi:6:002:1 -115 32768 <
ffff00014c2bf900 1201973826 C Bi:6:002:1 0 471 = 9f010484 00000f80 ab0e6000 04300000 00000000 28335f02 3e3c0000 74dcdc0f
ffff00014c2bf900 1201973853 S Bi:6:002:1 -115 32768 <
ffff00013d62e840 1201974673 C Bi:6:002:1 0 446 = 86010484 00000f80 54066000 04300000 00000000 9a365f02 3c3c0000 74dbdb0f
ffff00013d62e840 1201974698 S Bi:6:002:1 -115 32768 <
ffff000103533900 1201975568 C Bi:6:002:1 0 469 = 9d010484 00000f80 a60e6000 04300000 00000000 fe395f02 3c380000 74dcdc0f
ffff000103533900 1201975594 S Bi:6:002:1 -115 32768 <
ffff000103558cc0 1201976491 C Bi:6:002:1 0 479 = a7010484 00000f80 2f0e6000 04300000 00000000 8c3d5f02 3c380000 76dcdc0f
ffff000103558cc0 1201976515 S Bi:6:002:1 -115 32768 <
ffff00014c2bf900 1202059290 C Bi:6:002:1 0 84 = 1c000484 00000f20 9d0a6000 08300000 00000000 14836002 66640000 cfeaea0f
ffff00014c2bf900 1202059319 S Bi:6:002:1 -115 32768 <
ffff00013d62e840 1202075259 C Bi:6:002:1 0 478 = a6010484 00000f80 f30b6000 04300000 00000000 48bf6002 3e3a0000 77dbdb0f
ffff00013d62e840 1202075285 S Bi:6:002:1 -115 32768 <
ffff000103533900 1202076268 C Bi:6:002:1 0 471 = 9f010484 00000f80 ac0e6000 04300000 00000000 52c36002 3c3a0000 76d9d90f
ffff000103533900 1202076294 S Bi:6:002:1 -115 32768 <
ffff000103558cc0 1202077134 C Bi:6:002:1 0 446 = 86010484 00000f80 55066000 04300000 00000000 d7c66002 3e3a0000 76dcdc0f
ffff000103558cc0 1202077160 S Bi:6:002:1 -115 32768 <
ffff00014c2bf900 1202078065 C Bi:6:002:1 0 469 = 9d010484 00000f80 a70e6000 04300000 00000000 5cca6002 3c3a0000 77dfdf0f
ffff00014c2bf900 1202078090 S Bi:6:002:1 -115 32768 <
ffff00013d62e840 1202078988 C Bi:6:002:1 0 479 = a7010484 00000f80 300e6000 04300000 00000000 eacd6002 3e3a0000 76dbdb0f
ffff00013d62e840 1202079013 S Bi:6:002:1 -115 32768 <
ffff000103533900 1202080633 C Bi:6:002:1 0 281 = e1000484 00000f00 2a006000 04300000 00000000 52d56002 60600000 c3e8e80f
ffff000103533900 1202080658 S Bi:6:002:1 -115 32768 <
ffff000103558cc0 1202177634 C Bi:6:002:1 0 478 = a6010484 00000f80 f40b6000 04300000 00000000 4a4f6202 3c3a0000 77dede0f
ffff000103558cc0 1202177669 S Bi:6:002:1 -115 32768 <
ffff00014c2bf900 1202178630 C Bi:6:002:1 0 471 = 9f010484 00000f80 ad0e6000 04300000 00000000 21536202 3c3a0000 75dbdb0f
ffff00014c2bf900 1202178656 S Bi:6:002:1 -115 32768 <
ffff00013d62e840 1202179464 C Bi:6:002:1 0 446 = 86010484 00000f80 56066000 04300000 00000000 a5566202 3c3a0000 74dede0f
ffff00013d62e840 1202179485 S Bi:6:002:1 -115 32768 <
ffff000103533900 1202180411 C Bi:6:002:1 0 469 = 9d010484 00000f80 a80e6000 04300000 00000000 115a6202 3c3a0000 77dbdb0f
ffff000103533900 1202180435 S Bi:6:002:1 -115 32768 <
ffff000103558cc0 1202181296 C Bi:6:002:1 0 479 = a7010484 00000f80 310e6000 04300000 00000000 8f5d6202 3c3a0000 73dcdc0f
ffff000103558cc0 1202181322 S Bi:6:002:1 -115 32768 <
ffff00014c2bf900 1202280042 C Bi:6:002:1 0 478 = a6010484 00000f80 f50b6000 04300000 00000000 4cdf6302 3e3a0000 73dbdb0f
ffff00014c2bf900 1202280077 S Bi:6:002:1 -115 32768 <
ffff00013d62e840 1202281124 C Bi:6:002:1 0 471 = 9f010484 00000f80 ae0e6000 04300000 00000000 a1e36302 3c3a0000 73dcdc0f
ffff00013d62e840 1202281149 S Bi:6:002:1 -115 32768 <
ffff000103533900 1202282095 C Bi:6:002:1 0 446 = 86010484 00000f80 57066000 04300000 00000000 7fe76302 3c380000 74dcdc0f
ffff000103533900 1202282122 S Bi:6:002:1 -115 32768 <
ffff000103558cc0 1202282975 C Bi:6:002:1 0 469 = 9d010484 00000f80 a90e6000 04300000 00000000 ccea6302 3c3a0000 76dddd0f
ffff000103558cc0 1202283001 S Bi:6:002:1 -115 32768 <
ffff00014c2bf900 1202283790 C Bi:6:002:1 0 479 = a7010484 00000f80 320e6000 04300000 00000000 47ee6302 3c3a0000 75dbdb0f
ffff00014c2bf900 1202283808 S Bi:6:002:1 -115 32768 <
ffff00013d62e840 1202380214 C Bi:6:002:1 0 84 = 1c000484 00000f22 9e0a6000 08300000 00000000 cd686502 66640000 cfe9e90f
ffff00013d62e840 1202380245 S Bi:6:002:1 -115 32768 <
ffff000103533900 1202382452 C Bi:6:002:1 0 478 = a6010484 00000f80 f60b6000 04300000 00000000 4d6f6502 3c380000 78d9d90f
ffff000103533900 1202382479 S Bi:6:002:1 -115 32768 <
ffff000103558cc0 1202383381 C Bi:6:002:1 0 471 = 9f010484 00000f80 af0e6000 04300000 00000000 fc726502 3e380000 77dede0f
ffff000103558cc0 1202383406 S Bi:6:002:1 -115 32768 <
ffff00014c2bf900 1202384256 C Bi:6:002:1 0 446 = 86010484 00000f80 58066000 04300000 00000000 82766502 3e380000 76dcdc0f
ffff00014c2bf900 1202384281 S Bi:6:002:1 -115 32768 <
ffff00013d62e840 1202385117 C Bi:6:002:1 0 469 = 9d010484 00000f80 aa0e6000 04300000 00000000 db796502 3e380000 74dddd0f
ffff00013d62e840 1202385139 S Bi:6:002:1 -115 32768 <
ffff000103533900 1202386011 C Bi:6:002:1 0 479 = a7010484 00000f80 330e6000 04300000 00000000 577d6502 3e360000 76dbdb0f
ffff000103533900 1202386031 S Bi:6:002:1 -115 32768 <
ffff000103558cc0 1202484875 C Bi:6:002:1 0 478 = a6010484 00000f80 f70b6000 04300000 00000000 4fff6602 3e3a0000 78dada0f
ffff000103558cc0 1202484929 S Bi:6:002:1 -115 32768 <
ffff00014c2bf900 1202485820 C Bi:6:002:1 0 471 = 9f010484 00000f80 b00e6000 04300000 00000000 28036702 3e3a0000 77dcdc0f
ffff00014c2bf900 1202485847 S Bi:6:002:1 -115 32768 <
ffff00013d62e840 1202486669 C Bi:6:002:1 0 446 = 86010484 00000f80 59066000 04300000 00000000 9a066702 3e3a0000 76dbdb0f
ffff00013d62e840 1202486694 S Bi:6:002:1 -115 32768 <
ffff000103533900 1202487563 C Bi:6:002:1 0 469 = 9d010484 00000f80 ab0e6000 04300000 00000000 fa096702 3e3a0000 79dbdb0f
ffff000103533900 1202487588 S Bi:6:002:1 -115 32768 <
ffff000103558cc0 1202488487 C Bi:6:002:1 0 479 = a7010484 00000f80 340e6000 04300000 00000000 840d6702 3e3a0000 76dada0f
ffff000103558cc0 1202488512 S Bi:6:002:1 -115 32768 <
ffff00014c2bf900 1202566121 C Bi:6:002:1 0 84 = 1c000484 00000f20 18026000 08300000 00000000 f83e6802 24260000 4afefe0f
ffff00014c2bf900 1202566175 S Bi:6:002:1 -115 32768 <
ffff00013d62e840 1202587231 C Bi:6:002:1 0 478 = a6010484 00000f80 f80b6000 04300000 00000000 518f6802 3e3a0000 77dddd0f
ffff00013d62e840 1202587259 S Bi:6:002:1 -115 32768 <
ffff000103533900 1202588279 C Bi:6:002:1 0 471 = 9f010484 00000f80 b10e6000 04300000 00000000 6c936802 3c3a0000 76e2e20f
ffff000103533900 1202588311 S Bi:6:002:1 -115 32768 <
ffff000103558cc0 1202589252 C Bi:6:002:1 0 446 = 86010484 00000f80 5a066000 04300000 00000000 54976802 3e3a0000 76dcdc0f
ffff000103558cc0 1202589278 S Bi:6:002:1 -115 32768 <
ffff00014c2bf900 1202590130 C Bi:6:002:1 0 469 = 9d010484 00000f80 ac0e6000 04300000 00000000 a49a6802 3c3a0000 75e0e00f
ffff00014c2bf900 1202590155 S Bi:6:002:1 -115 32768 <
ffff00013d62e840 1202591037 C Bi:6:002:1 0 479 = a7010484 00000f80 350e6000 04300000 00000000 209e6802 3c380000 75dcdc0f
ffff00013d62e840 1202591061 S Bi:6:002:1 -115 32768 <
ffff000103533900 1202689680 C Bi:6:002:1 0 478 = a6010484 00000f80 f90b6000 04300000 00000000 521f6a02 3e3a0000 76dcdc0f
ffff000103533900 1202689734 S Bi:6:002:1 -115 32768 <
ffff000103558cc0 1202690693 C Bi:6:002:1 0 471 = 9f010484 00000f80 b20e6000 04300000 00000000 6f236a02 3e3a0000 76dcdc0f
ffff000103558cc0 1202690721 S Bi:6:002:1 -115 32768 <
ffff00014c2bf900 1202691561 C Bi:6:002:1 0 446 = 86010484 00000f80 5b066000 04300000 00000000 f4266a02 3c3a0000 75dbdb0f
ffff00014c2bf900 1202691586 S Bi:6:002:1 -115 32768 <
ffff00013d62e840 1202691621 C Bi:6:002:1 0 84 = 1c000484 00000f20 9f0a6000 08300000 00000000 51296a02 64680000 cde9e90f
ffff00013d62e840 1202691624 S Bi:6:002:1 -115 32768 <
ffff000103533900 1202692461 C Bi:6:002:1 0 469 = 9d010484 00000f80 ad0e6000 04300000 00000000 ab2a6a02 3e3a0000 77dddd0f
ffff000103533900 1202692478 S Bi:6:002:1 -115 32768 <
ffff000103558cc0 1202693463 C Bi:6:002:1 0 479 = a7010484 00000f80 360e6000 04300000 00000000 482e6a02 3c3a0000 73e0e00f
ffff000103558cc0 1202693485 S Bi:6:002:1 -115 32768 <
ffff00014c2bf900 1202694098 C Bi:6:002:1 0 281 = e1000484 00000f00 2b006000 04300000 00000000 c9316a02 5c600000 c3e8e80f
ffff00014c2bf900 1202694118 S Bi:6:002:1 -115 32768 <
ffff00013d9fb000 1202748252 S Ci:6:002:0 s c0 05 0770 0000 0004 4 <
ffff00013d9fb000 1202748388 C Ci:6:002:0 0 4 = 00000000
ffff00013d9fb000 1202748535 S Ci:6:002:0 s c0 05 0774 0000 0004 4 <
ffff00013d9fb000 1202748684 C Ci:6:002:0 0 4 = 00000000
ffff00013d9fb000 1202748845 S Co:6:002:0 s 40 05 076e 0000 0001 1 = 0c
ffff00013d9fb000 1202748987 C Co:6:002:0 0 1 >
ffff00013d9fb000 1202749149 S Ci:6:002:0 s c0 05 0808 0000 0004 4 <
ffff00013d9fb000 1202749297 C Ci:6:002:0 0 4 = 3382023e
ffff00013d9fb000 1202749454 S Ci:6:002:0 s c0 05 0a5c 0000 0002 2 <
ffff00013d9fb000 1202749607 C Ci:6:002:0 0 2 = 0000
ffff00013d9fb000 1202749764 S Ci:6:002:0 s c0 05 0f48 0000 0002 2 <
ffff00013d9fb000 1202749913 C Ci:6:002:0 0 2 = 1800
ffff00013d9fb000 1202750055 S Ci:6:002:0 s c0 05 0f04 0000 0004 4 <
ffff00013d9fb000 1202750178 C Ci:6:002:0 0 4 = 00000000
ffff00013d9fb000 1202750214 S Ci:6:002:0 s c0 05 0f14 0000 0004 4 <
ffff00013d9fb000 1202750340 C Ci:6:002:0 0 4 = d8003f00
ffff00013d9fb000 1202750372 S Ci:6:002:0 s c0 05 0f10 0000 0004 4 <
ffff00013d9fb000 1202750483 C Ci:6:002:0 0 4 = 00000000
ffff00013d9fb000 1202750512 S Ci:6:002:0 s c0 05 0f0c 0000 0004 4 <
ffff00013d9fb000 1202750626 C Ci:6:002:0 0 4 = 00000000
ffff00013d9fb000 1202750656 S Ci:6:002:0 s c0 05 0f08 0000 0004 4 <
ffff00013d9fb000 1202750775 C Ci:6:002:0 0 4 = 00002f01
ffff00013d9fb000 1202750796 S Ci:6:002:0 s c0 05 0fcc 0000 0004 4 <
ffff00013d9fb000 1202750910 C Ci:6:002:0 0 4 = 00000000
ffff00013d9fb000 1202750938 S Ci:6:002:0 s c0 05 09a4 0000 0004 4 <
ffff00013d9fb000 1202751055 C Ci:6:002:0 0 4 = 80000800
ffff00013d9fb000 1202751077 S Co:6:002:0 s 40 05 09a4 0000 0004 4 = 80000a00
ffff00013d9fb000 1202751184 C Co:6:002:0 0 4 >
ffff00013d9fb000 1202751213 S Ci:6:002:0 s c0 05 09a4 0000 0004 4 <
ffff00013d9fb000 1202751329 C Ci:6:002:0 0 4 = 80000a00
ffff00013d9fb000 1202751350 S Co:6:002:0 s 40 05 09a4 0000 0004 4 = 80000800
ffff00013d9fb000 1202751467 C Co:6:002:0 0 4 >
ffff00013d9fb000 1202751496 S Ci:6:002:0 s c0 05 0a2c 0000 0004 4 <
ffff00013d9fb000 1202751613 C Ci:6:002:0 0 4 = 00809000
ffff00013d9fb000 1202751633 S Co:6:002:0 s 40 05 0a2c 0000 0004 4 = 00009000
ffff00013d9fb000 1202751741 C Co:6:002:0 0 4 >
ffff00013d9fb000 1202751770 S Ci:6:002:0 s c0 05 0a2c 0000 0004 4 <
ffff00013d9fb000 1202751881 C Ci:6:002:0 0 4 = 00009000
ffff00013d9fb000 1202751910 S Co:6:002:0 s 40 05 0a2c 0000 0004 4 = 00809000
ffff00013d9fb000 1202752020 C Co:6:002:0 0 4 >
ffff00013d9fb000 1202752049 S Ci:6:002:0 s c0 05 0b58 0000 0004 4 <
ffff00013d9fb000 1202752165 C Ci:6:002:0 0 4 = 00000000
ffff00013d9fb000 1202752186 S Co:6:002:0 s 40 05 0b58 0000 0004 4 = 01000000
ffff00013d9fb000 1202752293 C Co:6:002:0 0 4 >
ffff00013d9fb000 1202752322 S Ci:6:002:0 s c0 05 0b58 0000 0004 4 <
ffff00013d9fb000 1202752439 C Ci:6:002:0 0 4 = 01000000
ffff00013d9fb000 1202752459 S Co:6:002:0 s 40 05 0b58 0000 0004 4 = 00000000
ffff00013d9fb000 1202752567 C Co:6:002:0 0 4 >
ffff00013d9fb000 1202752599 S Ci:6:002:0 s c0 05 01cc 0000 0001 1 <
ffff00013d9fb000 1202752720 C Ci:6:002:0 0 1 = 00
ffff00013d9fb000 1202752749 S Co:6:002:0 s 40 05 01fc 0000 0004 4 = 00000000
ffff00013d9fb000 1202752857 C Co:6:002:0 0 4 >
ffff00013d9fb000 1202752886 S Co:6:002:0 s 40 05 01dc 0000 0004 4 = 58000000
ffff00013d9fb000 1202752993 C Co:6:002:0 0 4 >
ffff00013d9fb000 1202753024 S Co:6:002:0 s 40 05 0440 0000 0004 4 = 00000000
ffff00013d9fb000 1202753130 C Co:6:002:0 0 4 >
ffff00013d9fb000 1202753161 S Ci:6:002:0 s c0 05 0c00 0000 0004 4 <
ffff00013d9fb000 1202753270 C Ci:6:002:0 0 4 = 07000000
ffff00013d9fb000 1202753299 S Ci:6:002:0 s c0 05 08b0 0000 0004 4 <
ffff00013d9fb000 1202753409 C Ci:6:002:0 0 4 = 42060000
ffff00013d9fb000 1202753438 S Co:6:002:0 s 40 05 08b0 0000 0004 4 = 42060000
ffff00013d9fb000 1202753546 C Co:6:002:0 0 4 >
ffff00013d9fb000 1202753596 S Ci:6:002:0 s c0 05 0d04 0000 0004 4 <
ffff00013d9fb000 1202753718 C Ci:6:002:0 0 4 = 088d90b1
ffff00013d9fb000 1202753748 S Ci:6:002:0 s c0 05 0c1c 0000 0004 4 <
ffff00013d9fb000 1202753857 C Ci:6:002:0 0 4 = 0300402d
ffff00013d9fb000 1202753886 S Co:6:002:0 s 40 05 0c1c 0000 0004 4 = 03000039
ffff00013d9fb000 1202753993 C Co:6:002:0 0 4 >
ffff00013d9fb000 1202754023 S Ci:6:002:0 s c0 05 0e1c 0000 0004 4 <
ffff00013d9fb000 1202754133 C Ci:6:002:0 0 4 = 0300402d
ffff00013d9fb000 1202754162 S Co:6:002:0 s 40 05 0e1c 0000 0004 4 = 0300e032
ffff00013d9fb000 1202754269 C Co:6:002:0 0 4 >
ffff00013d9fb000 1202754298 S Co:6:002:0 s 40 05 0280 0000 0002 2 = 0001
ffff00013d9fb000 1202754406 C Co:6:002:0 0 2 >
ffff00013d9fb000 1202754434 S Ci:6:002:0 s c0 05 010c 0000 0001 1 <
ffff00013d9fb000 1202754546 C Ci:6:002:0 0 1 = b4
ffff00013d9fb000 1202754575 S Co:6:002:0 s 40 05 010c 0000 0001 1 = b4
ffff00013d9fb000 1202754682 C Co:6:002:0 0 1 >
ffff00013d9fb000 1202754722 S Ci:6:002:0 s c0 05 004c 0000 0001 1 <
ffff00013d9fb000 1202754846 C Ci:6:002:0 0 1 = 20
ffff00013d9fb000 1202754876 S Co:6:002:0 s 40 05 004c 0000 0001 1 = 20
ffff00013d9fb000 1202754983 C Co:6:002:0 0 1 >
ffff00013d62e840 1202792080 C Bi:6:002:1 0 478 = a6010484 00000f80 fa0b6000 04300000 00000000 54af6b02 3c380000 77dcdc0f
ffff00013d62e840 1202792131 S Bi:6:002:1 -115 32768 <
ffff000103533900 1202793865 C Bi:6:002:1 0 446 = 86010484 00000f80 5c066000 04300000 00000000 b0b66b02 3c3a0000 76dcdc0f
ffff000103533900 1202793888 S Bi:6:002:1 -115 32768 <
ffff000103558cc0 1202794773 C Bi:6:002:1 0 469 = 9d010484 00000f80 ae0e6000 04300000 00000000 1eba6b02 3c3a0000 75dfdf0f
ffff000103558cc0 1202794794 S Bi:6:002:1 -115 32768 <
ffff00014c2bf900 1202795733 C Bi:6:002:1 0 479 = a7010484 00000f80 370e6000 04300000 00000000 b0bd6b02 3c380000 74dcdc0f
ffff00014c2bf900 1202795749 S Bi:6:002:1 -115 32768 <
ffff00013d62e840 1202859995 C Bi:6:002:1 0 281 = e1000484 00000f00 2c006000 04300000 00000000 d9b96c02 605e0000 c2e9e90f
ffff00013d62e840 1202860037 S Bi:6:002:1 -115 32768 <
ffff000103533900 1202894442 C Bi:6:002:1 0 478 = a6010484 00000f80 fb0b6000 04300000 00000000 553f6d02 3e3a0000 73dbdb0f
ffff000103533900 1202894482 S Bi:6:002:1 -115 32768 <
ffff000103558cc0 1202895465 C Bi:6:002:1 0 471 = 9f010484 00000f80 b40e6000 04300000 00000000 52436d02 3c3a0000 77e0e00f
ffff000103558cc0 1202895494 S Bi:6:002:1 -115 32768 <
ffff00014c2bf900 1202896325 C Bi:6:002:1 0 446 = 86010484 00000f80 5d066000 04300000 00000000 d7466d02 3e3a0000 74dcdc0f
ffff00014c2bf900 1202896350 S Bi:6:002:1 -115 32768 <
ffff00013d62e840 1202897201 C Bi:6:002:1 0 469 = 9d010484 00000f80 af0e6000 04300000 00000000 224a6d02 3e380000 77dbdb0f
ffff00013d62e840 1202897227 S Bi:6:002:1 -115 32768 <
ffff000103533900 1202898123 C Bi:6:002:1 0 479 = a7010484 00000f80 380e6000 04300000 00000000 af4d6d02 3e3a0000 76dcdc0f
ffff000103533900 1202898149 S Bi:6:002:1 -115 32768 <
ffff000103558cc0 1202996836 C Bi:6:002:1 0 478 = a6010484 00000f80 fc0b6000 04300000 00000000 57cf6e02 3c360000 73dbdb0f
ffff000103558cc0 1202996889 S Bi:6:002:1 -115 32768 <
ffff00014c2bf900 1202997828 C Bi:6:002:1 0 471 = 9f010484 00000f80 b50e6000 04300000 00000000 2ad36e02 3c380000 73dcdc0f
ffff00014c2bf900 1202997855 S Bi:6:002:1 -115 32768 <
ffff00013d62e840 1202998661 C Bi:6:002:1 0 446 = 86010484 00000f80 5e066000 04300000 00000000 95d66e02 3c380000 72dcdc0f
ffff00013d62e840 1202998686 S Bi:6:002:1 -115 32768 <
ffff000103533900 1202999553 C Bi:6:002:1 0 469 = 9d010484 00000f80 b00e6000 04300000 00000000 f3d96e02 3c360000 75dcdc0f
ffff000103533900 1202999577 S Bi:6:002:1 -115 32768 <
ffff000103558cc0 1203000512 C Bi:6:002:1 0 479 = a7010484 00000f80 390e6000 04300000 00000000 a1dd6e02 3c380000 73dcdc0f
ffff000103558cc0 1203000538 S Bi:6:002:1 -115 32768 <
ffff00014c2bf900 1203041708 C Bi:6:002:1 0 281 = e1000484 00000f00 2d006000 04300000 00000000 837f6f02 605e0000 c4e9e90f
ffff00014c2bf900 1203041734 S Bi:6:002:1 -115 32768 <
ffff00013d62e840 1203100781 C Bi:6:002:1 0 471 = 9f010484 00000f80 b60e6000 04300000 00000000 3c657002 3c3a0000 72dddd0f
ffff00013d62e840 1203100836 S Bi:6:002:1 -115 32768 <
ffff000103533900 1203142590 C Bi:6:002:1 0 281 = e1000484 00000f00 2e006000 04300000 00000000 8b097102 605c0000 c3e9e90f
ffff000103533900 1203142626 S Bi:6:002:1 -115 32768 <
ffff000103558cc0 1203201638 C Bi:6:002:1 0 478 = a6010484 00000f80 fe0b6000 04300000 00000000 5aef7102 3c380000 75dcdc0f
ffff000103558cc0 1203201682 S Bi:6:002:1 -115 32768 <
ffff00014c2bf900 1203202642 C Bi:6:002:1 0 471 = 9f010484 00000f80 b70e6000 04300000 00000000 3af37102 3e380000 76dcdc0f
ffff00014c2bf900 1203202671 S Bi:6:002:1 -115 32768 <
ffff00013d62e840 1203203496 C Bi:6:002:1 0 446 = 86010484 00000f80 60066000 04300000 00000000 acf67102 3e3a0000 75dede0f
ffff00013d62e840 1203203521 S Bi:6:002:1 -115 32768 <
ffff000103533900 1203204409 C Bi:6:002:1 0 469 = 9d010484 00000f80 b20e6000 04300000 00000000 2afa7102 3c380000 72dcdc0f
ffff000103533900 1203204432 S Bi:6:002:1 -115 32768 <
ffff000103558cc0 1203205328 C Bi:6:002:1 0 479 = a7010484 00000f80 3b0e6000 04300000 00000000 b6fd7102 3c380000 75dbdb0f
ffff000103558cc0 1203205353 S Bi:6:002:1 -115 32768 <
ffff00014c2bf900 1203304073 C Bi:6:002:1 0 478 = a6010484 00000f80 ff0b6000 04300000 00000000 5c7f7302 3e3c0000 75dfdf0f
ffff00014c2bf900 1203304116 S Bi:6:002:1 -115 32768 <
ffff00013d62e840 1203305078 C Bi:6:002:1 0 471 = 9f010484 00000f80 b80e6000 04300000 00000000 78837302 3c3c0000 75dcdc0f
ffff00013d62e840 1203305102 S Bi:6:002:1 -115 32768 <
ffff000103533900 1203305930 C Bi:6:002:1 0 446 = 86010484 00000f80 61066000 04300000 00000000 df867302 3a3a0000 75dfdf0f
ffff000103533900 1203305954 S Bi:6:002:1 -115 32768 <
ffff000103558cc0 1203306801 C Bi:6:002:1 0 469 = 9d010484 00000f80 b30e6000 04300000 00000000 358a7302 3c3a0000 72dcdc0f
ffff000103558cc0 1203306822 S Bi:6:002:1 -115 32768 <
ffff00014c2bf900 1203307718 C Bi:6:002:1 0 479 = a7010484 00000f80 3c0e6000 04300000 00000000 b78d7302 3a3a0000 75dfdf0f
ffff00014c2bf900 1203307738 S Bi:6:002:1 -115 32768 <
ffff00013d62e840 1203406444 C Bi:6:002:1 0 478 = a6010484 00000f80 000c6000 04300000 00000000 5e0f7502 3a3a0000 71dcdc0f
ffff00013d62e840 1203406481 S Bi:6:002:1 -115 32768 <
ffff000103533900 1203407429 C Bi:6:002:1 0 471 = 9f010484 00000f80 b90e6000 04300000 00000000 32137502 3a3a0000 73dddd0f
ffff000103533900 1203407456 S Bi:6:002:1 -115 32768 <
ffff000103558cc0 1203408302 C Bi:6:002:1 0 446 = 86010484 00000f80 62066000 04300000 00000000 be167502 3a3c0000 74dbdb0f
ffff000103558cc0 1203408328 S Bi:6:002:1 -115 32768 <
ffff00014c2bf900 1203409207 C Bi:6:002:1 0 469 = 9d010484 00000f80 b40e6000 04300000 00000000 2c1a7502 3a3a0000 73dddd0f
ffff00014c2bf900 1203409233 S Bi:6:002:1 -115 32768 <
ffff00013d62e840 1203410120 C Bi:6:002:1 0 479 = a7010484 00000f80 3d0e6000 04300000 00000000 c11d7502 3a3a0000 72dddd0f
ffff00013d62e840 1203410141 S Bi:6:002:1 -115 32768 <
ffff000103533900 1203420085 C Bi:6:002:1 0 84 = 1c000484 00000f22 a00a6000 08300000 00000000 b6467502 64780000 f0ebeb0f
ffff000103533900 1203420109 S Bi:6:002:1 -115 32768 <
ffff000103558cc0 1203508854 C Bi:6:002:1 0 478 = a6010484 00000f80 010c6000 04300000 00000000 5f9f7602 3c3c0000 73dddd0f
ffff000103558cc0 1203508890 S Bi:6:002:1 -115 32768 <
ffff00014c2bf900 1203509808 C Bi:6:002:1 0 471 = 9f010484 00000f80 ba0e6000 04300000 00000000 34a37602 3a3a0000 72dbdb0f
ffff00014c2bf900 1203509844 S Bi:6:002:1 -115 32768 <
ffff00013d62e840 1203510703 C Bi:6:002:1 0 446 = 86010484 00000f80 63066000 04300000 00000000 b8a67602 3c3c0000 74e0e00f
ffff00013d62e840 1203510728 S Bi:6:002:1 -115 32768 <
ffff000103533900 1203511545 C Bi:6:002:1 0 469 = 9d010484 00000f80 b50e6000 04300000 00000000 46aa7602 3c3c0000 72dcdc0f
ffff000103533900 1203511566 S Bi:6:002:1 -115 32768 <
ffff000103558cc0 1203512476 C Bi:6:002:1 0 479 = a7010484 00000f80 3e0e6000 04300000 00000000 dcad7602 3c3a0000 74dcdc0f
ffff000103558cc0 1203512492 S Bi:6:002:1 -115 32768 <
