ffff000103533900 1209956293 C Bi:6:002:1 0 383 = 47010484 00000f80 2c0c6000 04300000 00000000 2e01d902 463a0000 88f4f401
ffff000103533900 1209956359 S Bi:6:002:1 -115 32768 <
ffff000103558cc0 1209957141 C Bi:6:002:1 0 376 = 40010484 00000f80 99036000 04300000 00000000 ae04d902 463a0000 8cf9f901
ffff000103558cc0 1209957166 S Bi:6:002:1 -115 32768 <
ffff00014c2bf900 1209957927 C Bi:6:002:1 0 351 = 27010484 00000f80 5b0d6000 04300000 00000000 db07d902 463c0000 87f7f701
ffff00014c2bf900 1209957953 S Bi:6:002:1 -115 32768 <
ffff00013d62e840 1209958732 C Bi:6:002:1 0 374 = 3e010484 00000f80 2c086000 04300000 00000000 e60ad902 443c0000 85f7f701
ffff00013d62e840 1209958756 S Bi:6:002:1 -115 32768 <
ffff000103533900 1209961311 C Bi:6:002:1 0 384 = 48010484 00000f80 fc0a6000 04300000 00000000 e314d902 463a0000 86efef01
ffff000103533900 1209961336 S Bi:6:002:1 -115 32768 <
ffff000103558cc0 1210057949 C Bi:6:002:1 0 383 = 47010484 00000f80 2d0c6000 04300000 00000000 498eda02 463c0000 89f1f101
ffff000103558cc0 1210058004 S Bi:6:002:1 -115 32768 <
ffff00014c2bf900 1210058839 C Bi:6:002:1 0 376 = 40010484 00000f80 9a036000 04300000 00000000 ec91da02 463a0000 87f9f901
ffff00014c2bf900 1210058865 S Bi:6:002:1 -115 32768 <
ffff00013d62e840 1210059666 C Bi:6:002:1 0 351 = 27010484 00000f80 5c0d6000 04300000 00000000 4a95da02 463c0000 87f6f601
ffff00013d62e840 1210059692 S Bi:6:002:1 -115 32768 <
ffff000103533900 1210060636 C Bi:6:002:1 0 374 = 3e010484 00000f80 2d086000 04300000 00000000 f398da02 3c360000 86f2f201
ffff000103533900 1210060662 S Bi:6:002:1 -115 32768 <
ffff000103558cc0 1210061503 C Bi:6:002:1 0 384 = 48010484 00000f80 fd0a6000 04300000 00000000 4b9cda02 463a0000 87f4f401
ffff000103558cc0 1210061531 S Bi:6:002:1 -115 32768 <
ffff00014c2bf900 1210161474 C Bi:6:002:1 0 383 = 47010484 00000f80 2e0c6000 04300000 00000000 db22dc02 443a0000 86f4f401
ffff00014c2bf900 1210161507 S Bi:6:002:1 -115 32768 <
ffff00013d62e840 1210162485 C Bi:6:002:1 0 376 = 40010484 00000f80 9b036000 04300000 00000000 c526dc02 443a0000 89f4f401
ffff00013d62e840 1210162513 S Bi:6:002:1 -115 32768 <
ffff000103533900 1210164339 C Bi:6:002:1 0 374 = 3e010484 00000f80 2e086000 04300000 00000000 fd2ddc02 463c0000 87f2f201
ffff000103533900 1210164367 S Bi:6:002:1 -115 32768 <
ffff000103558cc0 1210165729 C Bi:6:002:1 0 384 = 48010484 00000f80 fe0a6000 04300000 00000000 6e33dc02 463c0000 87f9f901
ffff000103558cc0 1210165754 S Bi:6:002:1 -115 32768 <
ffff00014c2bf900 1210178704 C Bi:6:002:1 0 310 = fe000484 00000f80 96006000 00300000 00000000 c55fdc02 463c0000 39530001
ffff00014c2bf900 1210178740 S Bi:6:002:1 -115 32768 <
ffff00013d62e840 1210262586 C Bi:6:002:1 0 383 = 47010484 00000f80 2f0c6000 04300000 00000000 aaaddd02 463a0000 89f8f801
ffff00013d62e840 1210262638 S Bi:6:002:1 -115 32768 <
ffff000103533900 1210263464 C Bi:6:002:1 0 376 = 40010484 00000f80 9c036000 04300000 00000000 96b1dd02 463e0000 87f1f101
ffff000103533900 1210263488 S Bi:6:002:1 -115 32768 <
ffff000103558cc0 1210264461 C Bi:6:002:1 0 351 = 27010484 00000f80 5e0d6000 04300000 00000000 34b5dd02 463e0000 87f4f401
ffff000103558cc0 1210264486 S Bi:6:002:1 -115 32768 <
ffff00014c2bf900 1210265730 C Bi:6:002:1 0 374 = 3e010484 00000f80 2f086000 04300000 00000000 1cbadd02 463a0000 87ecec01
ffff00014c2bf900 1210265756 S Bi:6:002:1 -115 32768 <
ffff00013d62e840 1210266539 C Bi:6:002:1 0 384 = 48010484 00000f80 ff0a6000 04300000 00000000 2ebddd02 443c0000 86f7f701
ffff00013d62e840 1210266565 S Bi:6:002:1 -115 32768 <
ffff000103533900 1210283143 C Bi:6:002:1 0 310 = fe000484 00000f80 97006000 00300000 00000000 c6f7dd02 443c0000 38520001
ffff000103533900 1210283169 S Bi:6:002:1 -115 32768 <
ffff000103558cc0 1210364944 C Bi:6:002:1 0 383 = 47010484 00000f80 300c6000 04300000 00000000 ac3ddf02 463a0000 85f0f001
ffff000103558cc0 1210364994 S Bi:6:002:1 -115 32768 <
ffff00014c2bf900 1210367298 C Bi:6:002:1 0 376 = 40010484 00000f80 9d036000 04300000 00000000 c746df02 463c0000 84eaea01
ffff00014c2bf900 1210367325 S Bi:6:002:1 -115 32768 <
ffff00013d62e840 1210368177 C Bi:6:002:1 0 351 = 27010484 00000f80 5f0d6000 04300000 00000000 654adf02 443c0000 82eaea01
ffff00013d62e840 1210368202 S Bi:6:002:1 -115 32768 <
ffff000103533900 1210369124 C Bi:6:002:1 0 374 = 3e010484 00000f80 30086000 04300000 00000000 ff4ddf02 443e0000 83ebeb01
ffff000103533900 1210369151 S Bi:6:002:1 -115 32768 <
ffff000103558cc0 1210370197 C Bi:6:002:1 0 384 = 48010484 00000f80 000b6000 04300000 00000000 2352df02 443a0000 84f7f701
ffff000103558cc0 1210370223 S Bi:6:002:1 -115 32768 <
ffff00014c2bf900 1210387556 C Bi:6:002:1 0 310 = fe000484 00000f80 98006000 00300000 00000000 c78fdf02 443a0000 2c520001
ffff00014c2bf900 1210387580 S Bi:6:002:1 -115 32768 <
ffff00013d62e840 1210467390 C Bi:6:002:1 0 383 = 47010484 00000f80 310c6000 04300000 00000000 adcde002 443a0000 88f4f401
ffff00013d62e840 1210467448 S Bi:6:002:1 -115 32768 <
ffff000103533900 1210468612 C Bi:6:002:1 0 376 = 40010484 00000f80 9e036000 04300000 00000000 99d2e002 443e0000 7ff9f901
ffff000103533900 1210468638 S Bi:6:002:1 -115 32768 <
ffff000103558cc0 1210469821 C Bi:6:002:1 0 351 = 27010484 00000f80 600d6000 04300000 00000000 76d7e002 443a0000 83f5f501
ffff000103558cc0 1210469846 S Bi:6:002:1 -115 32768 <
ffff00014c2bf900 1210471052 C Bi:6:002:1 0 374 = 3e010484 00000f80 31086000 04300000 00000000 27dce002 463e0000 87f1f101
ffff00014c2bf900 1210471077 S Bi:6:002:1 -115 32768 <
ffff00013d62e840 1210471917 C Bi:6:002:1 0 384 = 48010484 00000f80 010b6000 04300000 00000000 7bdfe002 463a0000 86fcfc01
ffff00013d62e840 1210471943 S Bi:6:002:1 -115 32768 <
ffff000103533900 1210492066 C Bi:6:002:1 0 310 = fe000484 00000f80 99006000 00300000 00000000 c827e102 3c3c0000 3f520001
ffff000103533900 1210492102 S Bi:6:002:1 -115 32768 <
ffff000103558cc0 1210570079 C Bi:6:002:1 0 383 = 47010484 00000f80 320c6000 04300000 00000000 f95ee202 463a0000 84ebeb01
ffff000103558cc0 1210570130 S Bi:6:002:1 -115 32768 <
ffff00014c2bf900 1210571017 C Bi:6:002:1 0 376 = 40010484 00000f80 9f036000 04300000 00000000 9f62e202 463c0000 87eded01
ffff00014c2bf900 1210571044 S Bi:6:002:1 -115 32768 <
ffff00013d62e840 1210571935 C Bi:6:002:1 0 351 = 27010484 00000f80 610d6000 04300000 00000000 5966e202 463a0000 87f2f201
ffff00013d62e840 1210571960 S Bi:6:002:1 -115 32768 <
ffff000103533900 1210575641 C Bi:6:002:1 0 384 = 48010484 00000f80 020b6000 04300000 00000000 ad74e202 463a0000 86f0f001
ffff000103533900 1210575668 S Bi:6:002:1 -115 32768 <
ffff000103558cc0 1210596447 C Bi:6:002:1 0 310 = fe000484 00000f80 9a006000 00300000 00000000 c9bfe202 36360000 54520001
ffff000103558cc0 1210596472 S Bi:6:002:1 -115 32768 <
ffff00014c2bf900 1210672819 C Bi:6:002:1 0 383 = 47010484 00000f80 330c6000 04300000 00000000 4df0e302 463a0000 86f2f201
ffff00014c2bf900 1210672872 S Bi:6:002:1 -115 32768 <
ffff00013d62e840 1210675269 C Bi:6:002:1 0 376 = 40010484 00000f80 a0036000 04300000 00000000 f5f9e302 463c0000 84f4f401
ffff00013d62e840 1210675297 S Bi:6:002:1 -115 32768 <
ffff000103533900 1210678737 C Bi:6:002:1 0 374 = 3e010484 00000f80 33086000 04300000 00000000 6007e402 46380000 86ecec01
ffff000103533900 1210678764 S Bi:6:002:1 -115 32768 <
ffff000103558cc0 1210681410 C Bi:6:002:1 0 384 = 48010484 00000f80 030b6000 04300000 00000000 bf11e402 463a0000 86fbfb01
ffff000103558cc0 1210681437 S Bi:6:002:1 -115 32768 <
ffff00014c2bf900 1210700954 C Bi:6:002:1 0 310 = fe000484 00000f80 9b006000 00300000 00000000 ca57e402 443c0000 43520001
ffff00014c2bf900 1210700994 S Bi:6:002:1 -115 32768 <
ffff00013d9fb000 1210748200 S Ci:6:002:0 s c0 05 0770 0000 0004 4 <
ffff00013d9fb000 1210748330 C Ci:6:002:0 0 4 = 00000000
ffff00013d9fb000 1210748532 S Ci:6:002:0 s c0 05 0774 0000 0004 4 <
ffff00013d9fb000 1210748698 C Ci:6:002:0 0 4 = 00000000
ffff00013d9fb000 1210748862 S Co:6:002:0 s 40 05 076e 0000 0001 1 = 0c
ffff00013d9fb000 1210748989 C Co:6:002:0 0 1 >
ffff00013d9fb000 1210749186 S Ci:6:002:0 s c0 05 0808 0000 0004 4 <
ffff00013d9fb000 1210749353 C Ci:6:002:0 0 4 = 3382023e
ffff00013d9fb000 1210749514 S Ci:6:002:0 s c0 05 0a5c 0000 0002 2 <
ffff00013d9fb000 1210749659 C Ci:6:002:0 0 2 = 6000
ffff00013d9fb000 1210749855 S Ci:6:002:0 s c0 05 0f48 0000 0002 2 <
ffff00013d9fb000 1210750018 C Ci:6:002:0 0 2 = 0901
ffff00013d9fb000 1210750173 S Ci:6:002:0 s c0 05 0f04 0000 0004 4 <
ffff00013d9fb000 1210750297 C Ci:6:002:0 0 4 = 0a000700
ffff00013d9fb000 1210750340 S Ci:6:002:0 s c0 05 0f14 0000 0004 4 <
ffff00013d9fb000 1210750467 C Ci:6:002:0 0 4 = ff003200
ffff00013d9fb000 1210750609 S Ci:6:002:0 s c0 05 0f10 0000 0004 4 <
ffff00013d9fb000 1210750731 C Ci:6:002:0 0 4 = 00000000
ffff00013d9fb000 1210750773 S Ci:6:002:0 s c0 05 0f0c 0000 0004 4 <
ffff00013d9fb000 1210750896 C Ci:6:002:0 0 4 = 00000000
ffff00013d9fb000 1210750935 S Ci:6:002:0 s c0 05 0f08 0000 0004 4 <
ffff00013d9fb000 1210751053 C Ci:6:002:0 0 4 = 96003a02
ffff00013d9fb000 1210751089 S Ci:6:002:0 s c0 05 0fcc 0000 0004 4 <
ffff00013d9fb000 1210751200 C Ci:6:002:0 0 4 = 00000000
ffff00013d9fb000 1210751236 S Ci:6:002:0 s c0 05 09a4 0000 0004 4 <
ffff00013d9fb000 1210751348 C Ci:6:002:0 0 4 = 80000800
ffff00013d9fb000 1210751385 S Co:6:002:0 s 40 05 09a4 0000 0004 4 = 80000a00
ffff00013d9fb000 1210751502 C Co:6:002:0 0 4 >
ffff00013d9fb000 1210751543 S Ci:6:002:0 s c0 05 09a4 0000 0004 4 <
ffff00013d9fb000 1210751659 C Ci:6:002:0 0 4 = 80000a00
ffff00013d9fb000 1210751696 S Co:6:002:0 s 40 05 09a4 0000 0004 4 = 80000800
ffff00013d9fb000 1210751803 C Co:6:002:0 0 4 >
ffff00013d9fb000 1210751842 S Ci:6:002:0 s c0 05 0a2c 0000 0004 4 <
ffff00013d9fb000 1210751953 C Ci:6:002:0 0 4 = 00809000
ffff00013d9fb000 1210751990 S Co:6:002:0 s 40 05 0a2c 0000 0004 4 = 00009000
ffff00013d9fb000 1210752156 C Co:6:002:0 0 4 >
ffff00013d9fb000 1210752192 S Ci:6:002:0 s c0 05 0a2c 0000 0004 4 <
ffff00013d9fb000 1210752304 C Ci:6:002:0 0 4 = 00009000
ffff00013d9fb000 1210752341 S Co:6:002:0 s 40 05 0a2c 0000 0004 4 = 00809000
ffff00013d9fb000 1210752454 C Co:6:002:0 0 4 >
ffff00013d9fb000 1210752492 S Ci:6:002:0 s c0 05 0b58 0000 0004 4 <
ffff00013d9fb000 1210752626 C Ci:6:002:0 0 4 = 00000000
ffff00013d9fb000 1210752663 S Co:6:002:0 s 40 05 0b58 0000 0004 4 = 01000000
ffff00013d9fb000 1210752775 C Co:6:002:0 0 4 >
ffff00013d9fb000 1210752813 S Ci:6:002:0 s c0 05 0b58 0000 0004 4 <
ffff00013d9fb000 1210752930 C Ci:6:002:0 0 4 = 01000000
ffff00013d9fb000 1210752966 S Co:6:002:0 s 40 05 0b58 0000 0004 4 = 00000000
ffff00013d9fb000 1210753073 C Co:6:002:0 0 4 >
ffff00013d9fb000 1210753114 S Ci:6:002:0 s c0 05 01cc 0000 0001 1 <
ffff00013d9fb000 1210753223 C Ci:6:002:0 0 1 = 00
ffff00013d9fb000 1210753261 S Co:6:002:0 s 40 05 01fc 0000 0004 4 = 00000000
ffff00013d9fb000 1210753376 C Co:6:002:0 0 4 >
ffff00013d9fb000 1210753414 S Co:6:002:0 s 40 05 01dc 0000 0004 4 = 58000000
ffff00013d9fb000 1210753522 C Co:6:002:0 0 4 >
ffff00013d9fb000 1210753561 S Co:6:002:0 s 40 05 0440 0000 0004 4 = 00000000
ffff00013d9fb000 1210753668 C Co:6:002:0 0 4 >
ffff00013d9fb000 1210753706 S Ci:6:002:0 s c0 05 0c00 0000 0004 4 <
ffff00013d9fb000 1210753823 C Ci:6:002:0 0 4 = 07000000
ffff00013d9fb000 1210753861 S Ci:6:002:0 s c0 05 08b0 0000 0004 4 <
ffff00013d9fb000 1210753979 C Ci:6:002:0 0 4 = 18060000
ffff00013d9fb000 1210754015 S Co:6:002:0 s 40 05 08b0 0000 0004 4 = 42060000
ffff00013d9fb000 1210754127 C Co:6:002:0 0 4 >
ffff00013d9fb000 1210754184 S Ci:6:002:0 s c0 05 0d04 0000 0004 4 <
ffff00013d9fb000 1210754300 C Ci:6:002:0 0 4 = 088d90b1
ffff00013d9fb000 1210754337 S Co:6:002:0 s 40 05 0c90 0000 0004 4 = 088d2304
ffff00013d9fb000 1210754444 C Co:6:002:0 0 4 >
ffff00013d9fb000 1210754495 S Co:6:002:0 s 40 05 0280 0000 0002 2 = 0001
ffff00013d9fb000 1210754599 C Co:6:002:0 0 2 >
ffff00013d9fb000 1210754637 S Ci:6:002:0 s c0 05 010c 0000 0001 1 <
ffff00013d9fb000 1210754755 C Ci:6:002:0 0 1 = b4
ffff00013d9fb000 1210754792 S Co:6:002:0 s 40 05 010c 0000 0001 1 = b4
ffff00013d9fb000 1210754900 C Co:6:002:0 0 1 >
ffff00013d62e840 1210774584 C Bi:6:002:1 0 383 = 47010484 00000f80 340c6000 04300000 00000000 b27de502 463a0000 89f4f401
ffff00013d62e840 1210774640 S Bi:6:002:1 -115 32768 <
ffff000103533900 1210778056 C Bi:6:002:1 0 351 = 27010484 00000f80 630d6000 04300000 00000000 5d8be502 46380000 8bfbfb01
ffff000103533900 1210778082 S Bi:6:002:1 -115 32768 <
ffff000103558cc0 1210778819 C Bi:6:002:1 0 374 = 3e010484 00000f80 34086000 04300000 00000000 768ee502 463c0000 87f3f301
ffff000103558cc0 1210778841 S Bi:6:002:1 -115 32768 <
ffff00014c2bf900 1210779739 C Bi:6:002:1 0 384 = 48010484 00000f80 040b6000 04300000 00000000 0292e502 44380000 85f1f101
ffff00014c2bf900 1210779786 S Bi:6:002:1 -115 32768 <
ffff00013d9fb000 1210780065 S Ci:6:002:0 s c0 05 004c 0000 0001 1 <
ffff00013d9fb000 1210780200 C Ci:6:002:0 0 1 = 20
ffff00013d9fb000 1210780398 S Co:6:002:0 s 40 05 004c 0000 0001 1 = 20
ffff00013d9fb000 1210780554 C Co:6:002:0 0 1 >
ffff000190514480 1210859618 S Ci:6:002:0 s c0 05 0454 0000 0001 1 <
ffff000190514480 1210859778 C Ci:6:002:0 0 1 = 00
ffff000190514480 1210859822 S Ci:6:002:0 s c0 05 0860 0000 0004 4 <
ffff000190514480 1210859891 C Ci:6:002:0 0 4 = 21c3d572
ffff000190514480 1210859919 S Co:6:002:0 s 40 05 0860 0000 0004 4 = 21c3d572
ffff000190514480 1210859950 C Co:6:002:0 0 4 >
ffff000190514480 1210859973 S Ci:6:002:0 s c0 05 0c00 0000 0004 4 <
ffff000190514480 1210860030 C Ci:6:002:0 0 4 = 07000000
ffff000190514480 1210860053 S Ci:6:002:0 s c0 05 08b0 0000 0004 4 <
ffff000190514480 1210860096 C Ci:6:002:0 0 4 = 42060000
ffff000190514480 1210860116 S Co:6:002:0 s 40 05 08b0 0000 0004 4 = 18060000
ffff000190514480 1210860146 C Co:6:002:0 0 4 >
ffff000190514480 1210860186 S Ci:6:002:0 s c0 05 0d04 0000 0004 4 <
ffff000190514480 1210860222 C Ci:6:002:0 0 4 = 017c90b1
ffff000190514480 1210860244 S Co:6:002:0 s 40 05 0c90 0000 0004 4 = 017c8001
ffff000190514480 1210860284 C Co:6:002:0 0 4 >
ffff000190514480 1210860319 S Ci:6:002:0 s c0 05 08ac 0000 0004 4 <
ffff000190514480 1210860354 C Ci:6:002:0 0 4 = 08faf00f
ffff000190514480 1210860376 S Co:6:002:0 s 40 05 08ac 0000 0004 4 = 08faf00f
ffff000190514480 1210860426 C Co:6:002:0 0 4 >
ffff000190514480 1210860448 S Ci:6:002:0 s c0 05 08ac 0000 0004 4 <
ffff000190514480 1210860573 C Ci:6:002:0 0 4 = 08faf00f
ffff000190514480 1210860603 S Co:6:002:0 s 40 05 08ac 0000 0004 4 = 08faf00f
ffff000190514480 1210860636 C Co:6:002:0 0 4 >
ffff000190514480 1210860661 S Ci:6:002:0 s c0 05 08c4 0000 0004 4 <
ffff000190514480 1210860713 C Ci:6:002:0 0 4 = 00000000
ffff000190514480 1210860739 S Co:6:002:0 s 40 05 08c4 0000 0004 4 = 00000000
ffff000190514480 1210860842 C Co:6:002:0 0 4 >
ffff000190514480 1210860872 S Ci:6:002:0 s c0 05 0c00 0000 0004 4 <
ffff000190514480 1210860997 C Ci:6:002:0 0 4 = 07000000
ffff000190514480 1210861027 S Ci:6:002:0 s c0 05 08b0 0000 0004 4 <
ffff000190514480 1210861136 C Ci:6:002:0 0 4 = 18060000
ffff000190514480 1210861166 S Co:6:002:0 s 40 05 08b0 0000 0004 4 = 18060000
ffff000190514480 1210861198 C Co:6:002:0 0 4 >
ffff000190514480 1210861243 S Ci:6:002:0 s c0 05 0d04 0000 0004 4 <
ffff000190514480 1210861280 C Ci:6:002:0 0 4 = 017c90b1
ffff000190514480 1210861303 S Co:6:002:0 s 40 05 0c90 0000 0004 4 = 017c8001
ffff000190514480 1210861334 C Co:6:002:0 0 4 >
ffff000190514480 1210861371 S Ci:6:002:0 s c0 05 0e00 0000 0004 4 <
ffff000190514480 1210861425 C Ci:6:002:0 0 4 = 07000000
ffff000190514480 1210861449 S Ci:6:002:0 s c0 05 08b0 0000 0004 4 <
ffff000190514480 1210861485 C Ci:6:002:0 0 4 = 18060000
ffff000190514480 1210861510 S Co:6:002:0 s 40 05 08b0 0000 0004 4 = 18060000
ffff000190514480 1210861554 C Co:6:002:0 0 4 >
ffff000190514480 1210861597 S Ci:6:002:0 s c0 05 0d44 0000 0004 4 <
ffff000190514480 1210861633 C Ci:6:002:0 0 4 = 017c90b1
ffff000190514480 1210861659 S Co:6:002:0 s 40 05 0e90 0000 0004 4 = 017c8001
ffff000190514480 1210861690 C Co:6:002:0 0 4 >
ffff000190514480 1210861727 S Ci:6:002:0 s c0 05 08ac 0000 0004 4 <
ffff000190514480 1210861764 C Ci:6:002:0 0 4 = 08faf00f
ffff000190514480 1210861787 S Co:6:002:0 s 40 05 08ac 0000 0004 4 = 08faf00f
ffff000190514480 1210861818 C Co:6:002:0 0 4 >
ffff000190514480 1210861841 S Ci:6:002:0 s c0 05 08ac 0000 0004 4 <
ffff000190514480 1210861877 C Ci:6:002:0 0 4 = 08faf00f
ffff000190514480 1210861901 S Co:6:002:0 s 40 05 08ac 0000 0004 4 = 08faf00f
ffff000190514480 1210861931 C Co:6:002:0 0 4 >
ffff000190514480 1210861954 S Ci:6:002:0 s c0 05 08c4 0000 0004 4 <
ffff000190514480 1210861991 C Ci:6:002:0 0 4 = 00000000
ffff000190514480 1210862014 S Co:6:002:0 s 40 05 08c4 0000 0004 4 = 00000000
ffff000190514480 1210862053 C Co:6:002:0 0 4 >
ffff000190514480 1210862076 S Ci:6:002:0 s c0 05 0e00 0000 0004 4 <
ffff000190514480 1210862113 C Ci:6:002:0 0 4 = 07000000
ffff000190514480 1210862136 S Ci:6:002:0 s c0 05 08b0 0000 0004 4 <
ffff000190514480 1210862183 C Ci:6:002:0 0 4 = 18060000
ffff000190514480 1210862206 S Co:6:002:0 s 40 05 08b0 0000 0004 4 = 18060000
ffff000190514480 1210862237 C Co:6:002:0 0 4 >
ffff000190514480 1210862281 S Ci:6:002:0 s c0 05 0d44 0000 0004 4 <
ffff000190514480 1210862318 C Ci:6:002:0 0 4 = 017c90b1
ffff000190514480 1210862341 S Co:6:002:0 s 40 05 0e90 0000 0004 4 = 017c8001
ffff000190514480 1210862372 C Co:6:002:0 0 4 >
ffff000190514480 1210862408 S Ci:6:002:0 s c0 05 0668 0000 0002 2 <
ffff000190514480 1210862445 C Ci:6:002:0 0 2 = 0010
ffff000190514480 1210862468 S Co:6:002:0 s 40 05 0668 0000 0002 2 = 0010
ffff000190514480 1210862499 C Co:6:002:0 0 2 >
ffff000190514480 1210862522 S Co:6:002:0 s 40 05 0483 0000 0001 1 = 00
ffff000190514480 1210862553 C Co:6:002:0 0 1 >
ffff000190514480 1210862576 S Ci:6:002:0 s c0 05 0837 0000 0001 1 <
ffff000190514480 1210862613 C Ci:6:002:0 0 1 = 00
ffff000190514480 1210862637 S Ci:6:002:0 s c0 05 08ac 0000 0004 4 <
ffff000190514480 1210862682 C Ci:6:002:0 0 4 = 08faf00f
ffff000190514480 1210862706 S Co:6:002:0 s 40 05 08ac 0000 0004 4 = 08faf00f
ffff000190514480 1210862737 C Co:6:002:0 0 4 >
ffff000190514480 1210862760 S Ci:6:002:0 s c0 05 08c4 0000 0004 4 <
ffff000190514480 1210862808 C Ci:6:002:0 0 4 = 00000000
ffff000190514480 1210862832 S Co:6:002:0 s 40 05 08c4 0000 0004 4 = 00000000
ffff000190514480 1210862862 C Co:6:002:0 0 4 >
ffff000190514480 1210862885 S Ci:6:002:0 s c0 05 0848 0000 0004 4 <
ffff000190514480 1210862933 C Ci:6:002:0 0 4 = 8bffd061
ffff000190514480 1210862955 S Co:6:002:0 s 40 05 0848 0000 0004 4 = 8bffd061
ffff000190514480 1210862986 C Co:6:002:0 0 4 >
ffff000190514480 1210863010 S Ci:6:002:0 s c0 05 08ac 0000 0004 4 <
ffff000190514480 1210863058 C Ci:6:002:0 0 4 = 08faf00f
ffff000190514480 1210863081 S Co:6:002:0 s 40 05 08ac 0000 0004 4 = 08faf00f
ffff000190514480 1210863112 C Co:6:002:0 0 4 >
ffff000190514480 1210863135 S Ci:6:002:0 s c0 05 08ac 0000 0004 4 <
ffff000190514480 1210863183 C Ci:6:002:0 0 4 = 08faf00f
ffff000190514480 1210863206 S Co:6:002:0 s 40 05 08ac 0000 0004 4 = 08faf00f
ffff000190514480 1210863237 C Co:6:002:0 0 4 >
ffff000190514480 1210863260 S Ci:6:002:0 s c0 05 08c4 0000 0004 4 <
ffff000190514480 1210863308 C Ci:6:002:0 0 4 = 00000000
ffff000190514480 1210863331 S Co:6:002:0 s 40 05 08c4 0000 0004 4 = 00000000
ffff000190514480 1210863362 C Co:6:002:0 0 4 >
ffff000190514480 1210863385 S Ci:6:002:0 s c0 05 0c00 0000 0004 4 <
ffff000190514480 1210863433 C Ci:6:002:0 0 4 = 07000000
ffff000190514480 1210863456 S Ci:6:002:0 s c0 05 08b0 0000 0004 4 <
ffff000190514480 1210863493 C Ci:6:002:0 0 4 = 18060000
ffff000190514480 1210863517 S Co:6:002:0 s 40 05 08b0 0000 0004 4 = 18060000
ffff000190514480 1210863554 C Co:6:002:0 0 4 >
ffff000190514480 1210863597 S Ci:6:002:0 s c0 05 0d04 0000 0004 4 <
ffff000190514480 1210863634 C Ci:6:002:0 0 4 = 017c90b1
ffff000190514480 1210863658 S Co:6:002:0 s 40 05 0c90 0000 0004 4 = 017c8001
ffff000190514480 1210863689 C Co:6:002:0 0 4 >
ffff000190514480 1210863725 S Ci:6:002:0 s c0 05 0e00 0000 0004 4 <
ffff000190514480 1210863761 C Ci:6:002:0 0 4 = 07000000
ffff000190514480 1210863786 S Ci:6:002:0 s c0 05 08b0 0000 0004 4 <
ffff000190514480 1210863820 C Ci:6:002:0 0 4 = 18060000
ffff000190514480 1210863844 S Co:6:002:0 s 40 05 08b0 0000 0004 4 = 18060000
ffff000190514480 1210863874 C Co:6:002:0 0 4 >
ffff000190514480 1210863919 S Ci:6:002:0 s c0 05 0d44 0000 0004 4 <
ffff000190514480 1210863953 C Ci:6:002:0 0 4 = 017c90b1
ffff000190514480 1210863976 S Co:6:002:0 s 40 05 0e90 0000 0004 4 = 017c8001
ffff000190514480 1210864019 C Co:6:002:0 0 4 >
ffff000190514480 1210864079 S Ci:6:002:0 s c0 05 0c20 0000 0004 4 <
ffff000190514480 1210864116 C Ci:6:002:0 0 4 = 13131313
ffff000190514480 1210864140 S Co:6:002:0 s 40 05 0c20 0000 0004 4 = 13131313
ffff000190514480 1210864179 C Co:6:002:0 0 4 >
ffff000190514480 1210864202 S Ci:6:002:0 s c0 05 0c24 0000 0004 4 <
ffff000190514480 1210864237 C Ci:6:002:0 0 4 = 20202020
ffff000190514480 1210864261 S Co:6:002:0 s 40 05 0c24 0000 0004 4 = 20202020
ffff000190514480 1210864305 C Co:6:002:0 0 4 >
ffff000190514480 1210864328 S Ci:6:002:0 s c0 05 0c28 0000 0004 4 <
ffff000190514480 1210864362 C Ci:6:002:0 0 4 = 20201e1c
ffff000190514480 1210864385 S Co:6:002:0 s 40 05 0c28 0000 0004 4 = 20201e1c
ffff000190514480 1210864428 C Co:6:002:0 0 4 >
ffff000190514480 1210864451 S Ci:6:002:0 s c0 05 0c2c 0000 0004 4 <
ffff000190514480 1210864486 C Ci:6:002:0 0 4 = 20202020
ffff000190514480 1210864509 S Co:6:002:0 s 40 05 0c2c 0000 0004 4 = 20202020
ffff000190514480 1210864553 C Co:6:002:0 0 4 >
ffff000190514480 1210864577 S Ci:6:002:0 s c0 05 0c30 0000 0004 4 <
ffff000190514480 1210864611 C Ci:6:002:0 0 4 = 20201e1c
ffff000190514480 1210864634 S Co:6:002:0 s 40 05 0c30 0000 0004 4 = 20201e1c
ffff000190514480 1210864678 C Co:6:002:0 0 4 >
ffff000190514480 1210864701 S Ci:6:002:0 s c0 05 0c34 0000 0004 4 <
ffff000190514480 1210864735 C Ci:6:002:0 0 4 = 20202020
ffff000190514480 1210864759 S Co:6:002:0 s 40 05 0c34 0000 0004 4 = 20202020
ffff000190514480 1210864803 C Co:6:002:0 0 4 >
ffff000190514480 1210864826 S Ci:6:002:0 s c0 05 0c38 0000 0004 4 <
ffff000190514480 1210864861 C Ci:6:002:0 0 4 = 201e1c1a
ffff000190514480 1210864884 S Co:6:002:0 s 40 05 0c38 0000 0004 4 = 201e1c1a
ffff000190514480 1210864928 C Co:6:002:0 0 4 >
ffff000190514480 1210864951 S Ci:6:002:0 s c0 05 0c3c 0000 0004 4 <
ffff000190514480 1210864985 C Ci:6:002:0 0 4 = 20202020
ffff000190514480 1210865010 S Co:6:002:0 s 40 05 0c3c 0000 0004 4 = 20202020
ffff000190514480 1210865053 C Co:6:002:0 0 4 >
ffff000190514480 1210865076 S Ci:6:002:0 s c0 05 0c40 0000 0004 4 <
ffff000190514480 1210865111 C Ci:6:002:0 0 4 = 20201e1c
ffff000190514480 1210865134 S Co:6:002:0 s 40 05 0c40 0000 0004 4 = 20201e1c
ffff000190514480 1210865179 C Co:6:002:0 0 4 >
ffff000190514480 1210865202 S Ci:6:002:0 s c0 05 0c44 0000 0004 4 <
ffff000190514480 1210865237 C Ci:6:002:0 0 4 = 1a181e1e
ffff000190514480 1210865260 S Co:6:002:0 s 40 05 0c44 0000 0004 4 = 1a181e1e
ffff000190514480 1210865303 C Co:6:002:0 0 4 >
ffff000190514480 1210865326 S Ci:6:002:0 s c0 05 0c48 0000 0004 4 <
ffff000190514480 1210865361 C Ci:6:002:0 0 4 = 1e1e1e1e
ffff000190514480 1210865384 S Co:6:002:0 s 40 05 0c48 0000 0004 4 = 1e1e1e1e
ffff000190514480 1210865428 C Co:6:002:0 0 4 >
ffff000190514480 1210865451 S Ci:6:002:0 s c0 05 0c4c 0000 0004 4 <
ffff000190514480 1210865486 C Ci:6:002:0 0 4 = 1c1a1816
ffff000190514480 1210865509 S Co:6:002:0 s 40 05 0c4c 0000 0004 4 = 1c1a1816
ffff000190514480 1210865554 C Co:6:002:0 0 4 >
ffff000190514480 1210865577 S Ci:6:002:0 s c0 05 0c54 0000 0004 4 <
ffff000190514480 1210865614 C Ci:6:002:0 0 4 = 120a0400
ffff000190514480 1210865637 S Co:6:002:0 s 40 05 0c54 0000 0004 4 = 120a0400
ffff000190514480 1210865678 C Co:6:002:0 0 4 >
ffff000190514480 1210865701 S Ci:6:002:0 s c0 05 0e20 0000 0004 4 <
ffff000190514480 1210865736 C Ci:6:002:0 0 4 = 14141414
ffff000190514480 1210865759 S Co:6:002:0 s 40 05 0e20 0000 0004 4 = 14141414
ffff000190514480 1210865803 C Co:6:002:0 0 4 >
ffff000190514480 1210865826 S Ci:6:002:0 s c0 05 0e24 0000 0004 4 <
ffff000190514480 1210865861 C Ci:6:002:0 0 4 = 1d1d1d1d
ffff000190514480 1210865884 S Co:6:002:0 s 40 05 0e24 0000 0004 4 = 1d1d1d1d
ffff000190514480 1210865928 C Co:6:002:0 0 4 >
ffff000190514480 1210865951 S Ci:6:002:0 s c0 05 0e28 0000 0004 4 <
ffff000190514480 1210865986 C Ci:6:002:0 0 4 = 1d1d1b19
ffff000190514480 1210866009 S Co:6:002:0 s 40 05 0e28 0000 0004 4 = 1d1d1b19
ffff000190514480 1210866053 C Co:6:002:0 0 4 >
ffff000190514480 1210866077 S Ci:6:002:0 s c0 05 0e2c 0000 0004 4 <
ffff000190514480 1210866112 C Ci:6:002:0 0 4 = 1f1f1f1f
ffff000190514480 1210866135 S Co:6:002:0 s 40 05 0e2c 0000 0004 4 = 1f1f1f1f
ffff000190514480 1210866178 C Co:6:002:0 0 4 >
ffff000190514480 1210866201 S Ci:6:002:0 s c0 05 0e30 0000 0004 4 <
ffff000190514480 1210866236 C Ci:6:002:0 0 4 = 1f1f1d1b
ffff000190514480 1210866260 S Co:6:002:0 s 40 05 0e30 0000 0004 4 = 1f1f1d1b
ffff000190514480 1210866303 C Co:6:002:0 0 4 >
ffff000190514480 1210866327 S Ci:6:002:0 s c0 05 0e34 0000 0004 4 <
ffff000190514480 1210866362 C Ci:6:002:0 0 4 = 1f1f1f1f
ffff000190514480 1210866385 S Co:6:002:0 s 40 05 0e34 0000 0004 4 = 1f1f1f1f
ffff000190514480 1210866428 C Co:6:002:0 0 4 >
ffff000190514480 1210866451 S Ci:6:002:0 s c0 05 0e38 0000 0004 4 <
ffff000190514480 1210866486 C Ci:6:002:0 0 4 = 1f1d1b19
ffff000190514480 1210866510 S Co:6:002:0 s 40 05 0e38 0000 0004 4 = 1f1d1b19
ffff000190514480 1210866553 C Co:6:002:0 0 4 >
ffff000190514480 1210866576 S Ci:6:002:0 s c0 05 0e3c 0000 0004 4 <
ffff000190514480 1210866611 C Ci:6:002:0 0 4 = 1f1f1f1f
ffff000190514480 1210866634 S Co:6:002:0 s 40 05 0e3c 0000 0004 4 = 1f1f1f1f
ffff000190514480 1210866678 C Co:6:002:0 0 4 >
ffff000190514480 1210866702 S Ci:6:002:0 s c0 05 0e40 0000 0004 4 <
ffff000190514480 1210866737 C Ci:6:002:0 0 4 = 1f1f1d1b
ffff000190514480 1210866760 S Co:6:002:0 s 40 05 0e40 0000 0004 4 = 1f1f1d1b
ffff000190514480 1210866803 C Co:6:002:0 0 4 >
ffff000190514480 1210866827 S Ci:6:002:0 s c0 05 0e44 0000 0004 4 <
ffff000190514480 1210866862 C Ci:6:002:0 0 4 = 19171d1d
ffff000190514480 1210866885 S Co:6:002:0 s 40 05 0e44 0000 0004 4 = 19171d1d
ffff000190514480 1210866928 C Co:6:002:0 0 4 >
ffff000190514480 1210866952 S Ci:6:002:0 s c0 05 0e48 0000 0004 4 <
ffff000190514480 1210866986 C Ci:6:002:0 0 4 = 1d1d1d1d
ffff000190514480 1210867009 S Co:6:002:0 s 40 05 0e48 0000 0004 4 = 1d1d1d1d
ffff000190514480 1210867053 C Co:6:002:0 0 4 >
ffff000190514480 1210867076 S Ci:6:002:0 s c0 05 0e4c 0000 0004 4 <
ffff000190514480 1210867112 C Ci:6:002:0 0 4 = 1b191715
ffff000190514480 1210867136 S Co:6:002:0 s 40 05 0e4c 0000 0004 4 = 1b191715
ffff000190514480 1210867178 C Co:6:002:0 0 4 >
ffff000190514480 1210867201 S Ci:6:002:0 s c0 05 0e54 0000 0004 4 <
ffff000190514480 1210867237 C Ci:6:002:0 0 4 = 11090300
ffff000190514480 1210867261 S Co:6:002:0 s 40 05 0e54 0000 0004 4 = 11090300
ffff000190514480 1210867303 C Co:6:002:0 0 4 >
ffff000190514480 1210867340 S Ci:6:002:0 s c0 05 0454 0000 0001 1 <
ffff000190514480 1210867376 C Ci:6:002:0 0 1 = 00
ffff000190514480 1210867400 S Ci:6:002:0 s c0 05 0454 0000 0001 1 <
ffff000190514480 1210867435 C Ci:6:002:0 0 1 = 00
ffff000190514480 1210867458 S Co:6:002:0 s 40 05 0454 0000 0001 1 = 80
ffff000190514480 1210867488 C Co:6:002:0 0 1 >
ffff000190514480 1210867512 S Ci:6:002:0 s c0 05 041a 0000 0002 2 <
ffff000190514480 1210867556 C Ci:6:002:0 0 2 = ff0f
ffff000190514480 1210867580 S Ci:6:002:0 s c0 05 0808 0000 0004 4 <
ffff000190514480 1210867616 C Ci:6:002:0 0 4 = 3382023e
ffff000190514480 1210867640 S Co:6:002:0 s 40 05 0808 0000 0004 4 = 3382023e
ffff000190514480 1210867678 C Co:6:002:0 0 4 >
ffff000190514480 1210867701 S Ci:6:002:0 s c0 05 0834 0000 0004 4 <
ffff000190514480 1210867737 C Ci:6:002:0 0 4 = 05a73700
ffff000190514480 1210867760 S Co:6:002:0 s 40 05 0834 0000 0004 4 = 06a73700
ffff000190514480 1210867803 C Co:6:002:0 0 4 >
ffff000190514480 1210867827 S Ci:6:002:0 s c0 05 0830 0000 0004 4 <
ffff000190514480 1210867862 C Ci:6:002:0 0 4 = b8eeaa2e
ffff000190514480 1210867885 S Co:6:002:0 s 40 05 0830 0000 0004 4 = b8aeaa2e
ffff000190514480 1210867928 C Co:6:002:0 0 4 >
ffff000190514480 1210867952 S Ci:6:002:0 s c0 05 0830 0000 0004 4 <
ffff000190514480 1210867987 C Ci:6:002:0 0 4 = b8aeaa2e
ffff000190514480 1210868071 S Co:6:002:0 s 40 05 0830 0000 0004 4 = b8aeaa2e
ffff000190514480 1210868170 C Co:6:002:0 0 4 >
ffff000190514480 1210868197 S Ci:6:002:0 s c0 05 082c 0000 0004 4 <
ffff000190514480 1210868237 C Ci:6:002:0 0 4 = dc832000
ffff000190514480 1210868263 S Co:6:002:0 s 40 05 082c 0000 0004 4 = dd832000
ffff000190514480 1210868305 C Co:6:002:0 0 4 >
ffff000190514480 1210868328 S Co:6:002:0 s 40 05 0cb0 0000 0004 4 = 17773354
ffff000190514480 1210868359 C Co:6:002:0 0 4 >
ffff000190514480 1210868382 S Co:6:002:0 s 40 05 0eb0 0000 0004 4 = 17773354
ffff000190514480 1210868428 C Co:6:002:0 0 4 >
ffff000190514480 1210868451 S Ci:6:002:0 s c0 05 0cb4 0000 0004 4 <
ffff000190514480 1210868487 C Ci:6:002:0 0 4 = 77000001
ffff000190514480 1210868510 S Co:6:002:0 s 40 05 0cb4 0000 0004 4 = 77000001
ffff000190514480 1210868554 C Co:6:002:0 0 4 >
ffff000190514480 1210868577 S Ci:6:002:0 s c0 05 0eb4 0000 0004 4 <
ffff000190514480 1210868613 C Ci:6:002:0 0 4 = 77000001
ffff000190514480 1210868636 S Co:6:002:0 s 40 05 0eb4 0000 0004 4 = 77000001
ffff000190514480 1210868678 C Co:6:002:0 0 4 >
ffff000190514480 1210868702 S Ci:6:002:0 s c0 05 0900 0000 0004 4 <
ffff000190514480 1210868738 C Ci:6:002:0 0 4 = 01040000
ffff000190514480 1210868761 S Co:6:002:0 s 40 05 0900 0000 0004 4 = 01040000
ffff000190514480 1210868803 C Co:6:002:0 0 4 >
ffff000190514480 1210868826 S Ci:6:002:0 s c0 05 080c 0000 0004 4 <
ffff000190514480 1210868863 C Ci:6:002:0 0 4 = 13111312
ffff000190514480 1210868886 S Co:6:002:0 s 40 05 080c 0000 0004 4 = 03111312
ffff000190514480 1210868928 C Co:6:002:0 0 4 >
ffff000190514480 1210868952 S Ci:6:002:0 s c0 05 0a04 0000 0004 4 <
ffff000190514480 1210868988 C Ci:6:002:0 0 4 = 0c00ff01
ffff000190514480 1210869011 S Co:6:002:0 s 40 05 0a04 0000 0004 4 = 0c00ff0f
ffff000190514480 1210869054 C Co:6:002:0 0 4 >
ffff000190514480 1210869077 S Ci:6:002:0 s c0 05 0440 0000 0004 4 <
ffff000190514480 1210869113 C Ci:6:002:0 0 4 = 00000000
ffff000190514480 1210869136 S Co:6:002:0 s 40 05 0440 0000 0004 4 = 50010000
ffff000190514480 1210869178 C Co:6:002:0 0 4 >
ffff000190514480 1210869202 S Ci:6:002:0 s c0 05 0c1c 0000 0004 4 <
ffff000190514480 1210869238 C Ci:6:002:0 0 4 = 03000040
ffff000190514480 1210869262 S Co:6:002:0 s 40 05 0c1c 0000 0004 4 = 0300402d
ffff000190514480 1210869303 C Co:6:002:0 0 4 >
ffff000190514480 1210869328 S Ci:6:002:0 s c0 05 0e1c 0000 0004 4 <
ffff000190514480 1210869364 C Ci:6:002:0 0 4 = 03000040
ffff000190514480 1210869388 S Co:6:002:0 s 40 05 0e1c 0000 0004 4 = 0300402d
ffff000190514480 1210869429 C Co:6:002:0 0 4 >
ffff000190514480 1210869452 S Ci:6:002:0 s c0 05 0860 0000 0004 4 <
ffff000190514480 1210869488 C Ci:6:002:0 0 4 = 21c3d572
ffff000190514480 1210869512 S Co:6:002:0 s 40 05 0860 0000 0004 4 = 21c32568
ffff000190514480 1210869553 C Co:6:002:0 0 4 >
ffff000190514480 1210869577 S Ci:6:002:0 s c0 05 0c00 0000 0004 4 <
ffff000190514480 1210869614 C Ci:6:002:0 0 4 = 07000000
ffff000190514480 1210869637 S Ci:6:002:0 s c0 05 08b0 0000 0004 4 <
ffff000190514480 1210869682 C Ci:6:002:0 0 4 = 18060000
ffff000190514480 1210869706 S Co:6:002:0 s 40 05 08b0 0000 0004 4 = 18060000
ffff000190514480 1210869736 C Co:6:002:0 0 4 >
ffff000190514480 1210869779 S Ci:6:002:0 s c0 05 0d04 0000 0004 4 <
ffff000190514480 1210869816 C Ci:6:002:0 0 4 = 017c90b1
ffff000190514480 1210869840 S Co:6:002:0 s 40 05 0c90 0000 0004 4 = 017d8301
ffff000190514480 1210869870 C Co:6:002:0 0 4 >
ffff000190514480 1210869906 S Ci:6:002:0 s c0 05 08ac 0000 0004 4 <
ffff000190514480 1210869943 C Ci:6:002:0 0 4 = 08faf00f
ffff000190514480 1210869966 S Co:6:002:0 s 40 05 08ac 0000 0004 4 = 08faf00f
ffff000190514480 1210869997 C Co:6:002:0 0 4 >
ffff000190514480 1210870020 S Ci:6:002:0 s c0 05 08ac 0000 0004 4 <
ffff000190514480 1210870057 C Ci:6:002:0 0 4 = 08faf00f
ffff000190514480 1210870081 S Co:6:002:0 s 40 05 08ac 0000 0004 4 = 08faf00f
ffff000190514480 1210870111 C Co:6:002:0 0 4 >
ffff000190514480 1210870135 S Ci:6:002:0 s c0 05 08c4 0000 0004 4 <
ffff000190514480 1210870182 C Ci:6:002:0 0 4 = 00000000
ffff000190514480 1210870206 S Co:6:002:0 s 40 05 08c4 0000 0004 4 = 00000000
ffff000190514480 1210870236 C Co:6:002:0 0 4 >
ffff000190514480 1210870259 S Ci:6:002:0 s c0 05 0c00 0000 0004 4 <
ffff000190514480 1210870307 C Ci:6:002:0 0 4 = 07000000
ffff000190514480 1210870330 S Ci:6:002:0 s c0 05 08b0 0000 0004 4 <
ffff000190514480 1210870367 C Ci:6:002:0 0 4 = 18060000
ffff000190514480 1210870391 S Co:6:002:0 s 40 05 08b0 0000 0004 4 = 18060000
ffff000190514480 1210870429 C Co:6:002:0 0 4 >
ffff000190514480 1210870473 S Ci:6:002:0 s c0 05 0d04 0000 0004 4 <
ffff000190514480 1210870510 C Ci:6:002:0 0 4 = 017d91b1
ffff000190514480 1210870533 S Co:6:002:0 s 40 05 0c90 0000 0004 4 = 807d8101
ffff000190514480 1210870565 C Co:6:002:0 0 4 >
ffff000190514480 1210870601 S Ci:6:002:0 s c0 05 0e00 0000 0004 4 <
ffff000190514480 1210870638 C Ci:6:002:0 0 4 = 07000000
ffff000190514480 1210870661 S Ci:6:002:0 s c0 05 08b0 0000 0004 4 <
ffff000190514480 1210870699 C Ci:6:002:0 0 4 = 18060000
ffff000190514480 1210870722 S Co:6:002:0 s 40 05 08b0 0000 0004 4 = 18060000
ffff000190514480 1210870752 C Co:6:002:0 0 4 >
ffff000190514480 1210870796 S Ci:6:002:0 s c0 05 0d44 0000 0004 4 <
ffff000190514480 1210870832 C Ci:6:002:0 0 4 = 017c90b1
ffff000190514480 1210870856 S Co:6:002:0 s 40 05 0e90 0000 0004 4 = 017d8301
ffff000190514480 1210870886 C Co:6:002:0 0 4 >
ffff000190514480 1210870923 S Ci:6:002:0 s c0 05 08ac 0000 0004 4 <
ffff000190514480 1210870960 C Ci:6:002:0 0 4 = 08faf00f
ffff000190514480 1210870983 S Co:6:002:0 s 40 05 08ac 0000 0004 4 = 08faf00f
ffff000190514480 1210871014 C Co:6:002:0 0 4 >
ffff000190514480 1210871037 S Ci:6:002:0 s c0 05 08ac 0000 0004 4 <
ffff000190514480 1210871076 C Ci:6:002:0 0 4 = 08faf00f
ffff000190514480 1210871100 S Co:6:002:0 s 40 05 08ac 0000 0004 4 = 08faf00f
ffff000190514480 1210871130 C Co:6:002:0 0 4 >
ffff000190514480 1210871154 S Ci:6:002:0 s c0 05 08c4 0000 0004 4 <
ffff000190514480 1210871191 C Ci:6:002:0 0 4 = 00000000
ffff000190514480 1210871214 S Co:6:002:0 s 40 05 08c4 0000 0004 4 = 00000000
ffff000190514480 1210871245 C Co:6:002:0 0 4 >
ffff000190514480 1210871268 S Ci:6:002:0 s c0 05 0e00 0000 0004 4 <
ffff000190514480 1210871308 C Ci:6:002:0 0 4 = 07000000
ffff000190514480 1210871331 S Ci:6:002:0 s c0 05 08b0 0000 0004 4 <
ffff000190514480 1210871368 C Ci:6:002:0 0 4 = 18060000
ffff000190514480 1210871391 S Co:6:002:0 s 40 05 08b0 0000 0004 4 = 18060000
ffff000190514480 1210871428 C Co:6:002:0 0 4 >
ffff000190514480 1210871472 S Ci:6:002:0 s c0 05 0d44 0000 0004 4 <
ffff000190514480 1210871509 C Ci:6:002:0 0 4 = 017d91b1
ffff000190514480 1210871534 S Co:6:002:0 s 40 05 0e90 0000 0004 4 = 807d8101
ffff000190514480 1210871564 C Co:6:002:0 0 4 >
ffff000190514480 1210871601 S Ci:6:002:0 s c0 05 0668 0000 0002 2 <
ffff000190514480 1210871637 C Ci:6:002:0 0 2 = 0010
ffff000190514480 1210871660 S Co:6:002:0 s 40 05 0668 0000 0002 2 = 0010
ffff000190514480 1210871690 C Co:6:002:0 0 2 >
ffff000190514480 1210871714 S Co:6:002:0 s 40 05 0483 0000 0001 1 = 00
ffff000190514480 1210871745 C Co:6:002:0 0 1 >
ffff000190514480 1210871767 S Ci:6:002:0 s c0 05 0837 0000 0001 1 <
ffff000190514480 1210871805 C Ci:6:002:0 0 1 = 00
ffff000190514480 1210871828 S Ci:6:002:0 s c0 05 08ac 0000 0004 4 <
ffff000190514480 1210871862 C Ci:6:002:0 0 4 = 08faf00f
ffff000190514480 1210871885 S Co:6:002:0 s 40 05 08ac 0000 0004 4 = 08faf00f
ffff000190514480 1210871929 C Co:6:002:0 0 4 >
ffff000190514480 1210871953 S Ci:6:002:0 s c0 05 08c4 0000 0004 4 <
ffff000190514480 1210871986 C Ci:6:002:0 0 4 = 00000000
ffff00014c2bf3c0 1210872014 S Co:6:002:0 s 40 05 08c4 0000 0004 4 = 00000000
ffff00014c2bf3c0 1210872061 C Co:6:002:0 0 4 >
ffff00014c2bf3c0 1210872086 S Ci:6:002:0 s c0 05 0848 0000 0004 4 <
ffff00014c2bf3c0 1210872123 C Ci:6:002:0 0 4 = 8bffd061
ffff00014c2bf3c0 1210872148 S Co:6:002:0 s 40 05 0848 0000 0004 4 = 8bffd061
ffff00014c2bf3c0 1210872179 C Co:6:002:0 0 4 >
ffff00014c2bf3c0 1210872203 S Ci:6:002:0 s c0 05 08ac 0000 0004 4 <
ffff00014c2bf3c0 1210872237 C Ci:6:002:0 0 4 = 08faf00f
ffff00014c2bf3c0 1210872260 S Co:6:002:0 s 40 05 08ac 0000 0004 4 = 08faf00f
ffff00014c2bf3c0 1210872304 C Co:6:002:0 0 4 >
ffff00014c2bf3c0 1210872327 S Ci:6:002:0 s c0 05 08ac 0000 0004 4 <
ffff00014c2bf3c0 1210872361 C Ci:6:002:0 0 4 = 08faf00f
ffff00014c2bf3c0 1210872384 S Co:6:002:0 s 40 05 08ac 0000 0004 4 = 08faf00f
ffff00014c2bf3c0 1210872429 C Co:6:002:0 0 4 >
ffff00014c2bf3c0 1210872452 S Ci:6:002:0 s c0 05 08c4 0000 0004 4 <
ffff00014c2bf3c0 1210872486 C Ci:6:002:0 0 4 = 00000000
ffff00014c2bf3c0 1210872509 S Co:6:002:0 s 40 05 08c4 0000 0004 4 = 00000000
ffff00014c2bf3c0 1210872554 C Co:6:002:0 0 4 >
ffff00014c2bf3c0 1210872577 S Ci:6:002:0 s c0 05 0c00 0000 0004 4 <
ffff00014c2bf3c0 1210872612 C Ci:6:002:0 0 4 = 07000000
ffff00014c2bf3c0 1210872635 S Ci:6:002:0 s c0 05 08b0 0000 0004 4 <
ffff00014c2bf3c0 1210872681 C Ci:6:002:0 0 4 = 18060000
ffff00014c2bf3c0 1210872704 S Co:6:002:0 s 40 05 08b0 0000 0004 4 = 18060000
ffff00014c2bf3c0 1210872735 C Co:6:002:0 0 4 >
ffff00014c2bf3c0 1210872778 S Ci:6:002:0 s c0 05 0d04 0000 0004 4 <
ffff00014c2bf3c0 1210872812 C Ci:6:002:0 0 4 = 807d93b1
ffff00014c2bf3c0 1210872836 S Co:6:002:0 s 40 05 0c90 0000 0004 4 = 807d8301
ffff00014c2bf3c0 1210872866 C Co:6:002:0 0 4 >
ffff00014c2bf3c0 1210872903 S Ci:6:002:0 s c0 05 0e00 0000 0004 4 <
ffff00014c2bf3c0 1210872938 C Ci:6:002:0 0 4 = 07000000
ffff00014c2bf3c0 1210872961 S Ci:6:002:0 s c0 05 08b0 0000 0004 4 <
ffff00014c2bf3c0 1210872995 C Ci:6:002:0 0 4 = 18060000
ffff00014c2bf3c0 1210873019 S Co:6:002:0 s 40 05 08b0 0000 0004 4 = 18060000
ffff00014c2bf3c0 1210873053 C Co:6:002:0 0 4 >
ffff00014c2bf3c0 1210873097 S Ci:6:002:0 s c0 05 0d44 0000 0004 4 <
ffff00014c2bf3c0 1210873131 C Ci:6:002:0 0 4 = 807d93b1
ffff00014c2bf3c0 1210873154 S Co:6:002:0 s 40 05 0e90 0000 0004 4 = 807d8301
ffff00014c2bf3c0 1210873185 C Co:6:002:0 0 4 >
ffff00014c2bf3c0 1210873222 S Ci:6:002:0 s c0 05 0073 0000 0001 1 <
ffff00014c2bf3c0 1210873256 C Ci:6:002:0 0 1 = 07
ffff00014c2bf3c0 1210873280 S Co:6:002:0 s 40 05 0073 0000 0001 1 = 07
ffff00014c2bf3c0 1210873310 C Co:6:002:0 0 1 >
ffff00014c2bf3c0 1210873359 S Ci:6:002:0 s c0 05 0c24 0000 0004 4 <
ffff00014c2bf3c0 1210873394 C Ci:6:002:0 0 4 = 20202020
ffff00014c2bf3c0 1210873417 S Co:6:002:0 s 40 05 0c24 0000 0004 4 = 2c2c2c2c
ffff00014c2bf3c0 1210873448 C Co:6:002:0 0 4 >
ffff00014c2bf3c0 1210873471 S Ci:6:002:0 s c0 05 0c28 0000 0004 4 <
ffff00014c2bf3c0 1210873505 C Ci:6:002:0 0 4 = 20201e1c
ffff00014c2bf3c0 1210873529 S Co:6:002:0 s 40 05 0c28 0000 0004 4 = 2c2c2a28
ffff00014c2bf3c0 1210873559 C Co:6:002:0 0 4 >
ffff00014c2bf3c0 1210873582 S Ci:6:002:0 s c0 05 0c2c 0000 0004 4 <
ffff00014c2bf3c0 1210873617 C Ci:6:002:0 0 4 = 20202020
ffff00014c2bf3c0 1210873641 S Co:6:002:0 s 40 05 0c2c 0000 0004 4 = 31313131
ffff00014c2bf3c0 1210873678 C Co:6:002:0 0 4 >
ffff00014c2bf3c0 1210873702 S Ci:6:002:0 s c0 05 0c30 0000 0004 4 <
ffff00014c2bf3c0 1210873737 C Ci:6:002:0 0 4 = 20201e1c
ffff00014c2bf3c0 1210873760 S Co:6:002:0 s 40 05 0c30 0000 0004 4 = 2f2d2b29
ffff00014c2bf3c0 1210873803 C Co:6:002:0 0 4 >
ffff00014c2bf3c0 1210873827 S Ci:6:002:0 s c0 05 0c34 0000 0004 4 <
ffff00014c2bf3c0 1210873861 C Ci:6:002:0 0 4 = 20202020
ffff00014c2bf3c0 1210873885 S Co:6:002:0 s 40 05 0c34 0000 0004 4 = 2d2d2d2d
ffff00014c2bf3c0 1210873928 C Co:6:002:0 0 4 >
ffff00014c2bf3c0 1210873951 S Ci:6:002:0 s c0 05 0c38 0000 0004 4 <
ffff00014c2bf3c0 1210873986 C Ci:6:002:0 0 4 = 201e1c1a
ffff00014c2bf3c0 1210874009 S Co:6:002:0 s 40 05 0c38 0000 0004 4 = 2d2b2927
ffff00014c2bf3c0 1210874053 C Co:6:002:0 0 4 >
ffff00014c2bf3c0 1210874078 S Ci:6:002:0 s c0 05 0c3c 0000 0004 4 <
ffff00014c2bf3c0 1210874112 C Ci:6:002:0 0 4 = 20202020
ffff00014c2bf3c0 1210874135 S Co:6:002:0 s 40 05 0c3c 0000 0004 4 = 31313131
ffff00014c2bf3c0 1210874178 C Co:6:002:0 0 4 >
ffff00014c2bf3c0 1210874201 S Ci:6:002:0 s c0 05 0c40 0000 0004 4 <
ffff00014c2bf3c0 1210874236 C Ci:6:002:0 0 4 = 20201e1c
ffff00014c2bf3c0 1210874260 S Co:6:002:0 s 40 05 0c40 0000 0004 4 = 2f2d2b29
ffff00014c2bf3c0 1210874303 C Co:6:002:0 0 4 >
ffff00014c2bf3c0 1210874326 S Ci:6:002:0 s c0 05 0c44 0000 0004 4 <
ffff00014c2bf3c0 1210874361 C Ci:6:002:0 0 4 = 1a181e1e
ffff00014c2bf3c0 1210874385 S Co:6:002:0 s 40 05 0c44 0000 0004 4 = 27272d2d
ffff00014c2bf3c0 1210874428 C Co:6:002:0 0 4 >
ffff00014c2bf3c0 1210874451 S Ci:6:002:0 s c0 05 0c48 0000 0004 4 <
ffff00014c2bf3c0 1210874487 C Ci:6:002:0 0 4 = 1e1e1e1e
ffff00014c2bf3c0 1210874510 S Co:6:002:0 s 40 05 0c48 0000 0004 4 = 2d2d2d2b
ffff00014c2bf3c0 1210874553 C Co:6:002:0 0 4 >
ffff00014c2bf3c0 1210874576 S Ci:6:002:0 s c0 05 0c4c 0000 0004 4 <
ffff00014c2bf3c0 1210874611 C Ci:6:002:0 0 4 = 1c1a1816
ffff00014c2bf3c0 1210874634 S Co:6:002:0 s 40 05 0c4c 0000 0004 4 = 29272525
ffff00014c2bf3c0 1210874678 C Co:6:002:0 0 4 >
ffff00014c2bf3c0 1210874702 S Ci:6:002:0 s c0 05 0c54 0000 0004 4 <
ffff00014c2bf3c0 1210874737 C Ci:6:002:0 0 4 = 120a0400
ffff00014c2bf3c0 1210874761 S Co:6:002:0 s 40 05 0c54 0000 0004 4 = 1f171100
ffff00014c2bf3c0 1210874803 C Co:6:002:0 0 4 >
ffff00014c2bf3c0 1210874827 S Ci:6:002:0 s c0 05 0e24 0000 0004 4 <
ffff00014c2bf3c0 1210874862 C Ci:6:002:0 0 4 = 1d1d1d1d
ffff00014c2bf3c0 1210874885 S Co:6:002:0 s 40 05 0e24 0000 0004 4 = 1b1b1b1b
ffff00014c2bf3c0 1210874929 C Co:6:002:0 0 4 >
ffff00014c2bf3c0 1210874952 S Ci:6:002:0 s c0 05 0e28 0000 0004 4 <
ffff00014c2bf3c0 1210874987 C Ci:6:002:0 0 4 = 1d1d1b19
ffff00014c2bf3c0 1210875010 S Co:6:002:0 s 40 05 0e28 0000 0004 4 = 1b1b1917
ffff00014c2bf3c0 1210875053 C Co:6:002:0 0 4 >
ffff00014c2bf3c0 1210875076 S Ci:6:002:0 s c0 05 0e2c 0000 0004 4 <
ffff00014c2bf3c0 1210875112 C Ci:6:002:0 0 4 = 1f1f1f1f
ffff00014c2bf3c0 1210875135 S Co:6:002:0 s 40 05 0e2c 0000 0004 4 = 20202020
ffff00014c2bf3c0 1210875179 C Co:6:002:0 0 4 >
ffff00014c2bf3c0 1210875202 S Ci:6:002:0 s c0 05 0e30 0000 0004 4 <
ffff00014c2bf3c0 1210875238 C Ci:6:002:0 0 4 = 1f1f1d1b
ffff00014c2bf3c0 1210875261 S Co:6:002:0 s 40 05 0e30 0000 0004 4 = 1e1c1a18
ffff00014c2bf3c0 1210875304 C Co:6:002:0 0 4 >
ffff00014c2bf3c0 1210875327 S Ci:6:002:0 s c0 05 0e34 0000 0004 4 <
ffff00014c2bf3c0 1210875362 C Ci:6:002:0 0 4 = 1f1f1f1f
ffff00014c2bf3c0 1210875385 S Co:6:002:0 s 40 05 0e34 0000 0004 4 = 1c1c1c1c
ffff00014c2bf3c0 1210875428 C Co:6:002:0 0 4 >
ffff00014c2bf3c0 1210875451 S Ci:6:002:0 s c0 05 0e38 0000 0004 4 <
ffff00014c2bf3c0 1210875487 C Ci:6:002:0 0 4 = 1f1d1b19
ffff00014c2bf3c0 1210875510 S Co:6:002:0 s 40 05 0e38 0000 0004 4 = 1c1a1816
ffff00014c2bf3c0 1210875554 C Co:6:002:0 0 4 >
ffff00014c2bf3c0 1210875576 S Ci:6:002:0 s c0 05 0e3c 0000 0004 4 <
ffff00014c2bf3c0 1210875612 C Ci:6:002:0 0 4 = 1f1f1f1f
ffff00014c2bf3c0 1210875635 S Co:6:002:0 s 40 05 0e3c 0000 0004 4 = 20202020
ffff00014c2bf3c0 1210875680 C Co:6:002:0 0 4 >
ffff00014c2bf3c0 1210875704 S Ci:6:002:0 s c0 05 0e40 0000 0004 4 <
ffff00014c2bf3c0 1210875740 C Ci:6:002:0 0 4 = 1f1f1d1b
ffff00014c2bf3c0 1210875763 S Co:6:002:0 s 40 05 0e40 0000 0004 4 = 1e1c1a18
ffff00014c2bf3c0 1210875804 C Co:6:002:0 0 4 >
ffff00014c2bf3c0 1210875828 S Ci:6:002:0 s c0 05 0e44 0000 0004 4 <
ffff00014c2bf3c0 1210875864 C Ci:6:002:0 0 4 = 19171d1d
ffff00014c2bf3c0 1210875888 S Co:6:002:0 s 40 05 0e44 0000 0004 4 = 16161c1c
ffff00014c2bf3c0 1210875929 C Co:6:002:0 0 4 >
ffff00014c2bf3c0 1210875952 S Ci:6:002:0 s c0 05 0e48 0000 0004 4 <
ffff00014c2bf3c0 1210875988 C Ci:6:002:0 0 4 = 1d1d1d1d
ffff00014c2bf3c0 1210876013 S Co:6:002:0 s 40 05 0e48 0000 0004 4 = 1c1c1c1a
ffff00014c2bf3c0 1210876064 C Co:6:002:0 0 4 >
ffff00014c2bf3c0 1210876089 S Ci:6:002:0 s c0 05 0e4c 0000 0004 4 <
ffff00014c2bf3c0 1210876127 C Ci:6:002:0 0 4 = 1b191715
ffff00014c2bf3c0 1210876151 S Co:6:002:0 s 40 05 0e4c 0000 0004 4 = 18161414
ffff00014c2bf3c0 1210876182 C Co:6:002:0 0 4 >
ffff00014c2bf3c0 1210876206 S Ci:6:002:0 s c0 05 0e54 0000 0004 4 <
ffff00014c2bf3c0 1210876242 C Ci:6:002:0 0 4 = 11090300
ffff00014c2bf3c0 1210876266 S Co:6:002:0 s 40 05 0e54 0000 0004 4 = 0e060200
ffff00014c2bf3c0 1210876304 C Co:6:002:0 0 4 >
ffff00013d62e840 1211193336 C Bi:6:002:1 0 281 = e1000484 00000f00 09006000 04300000 00000000 e9e1eb02 5e5c0000 bdeaea0f
ffff00013d62e840 1211193394 S Bi:6:002:1 -115 32768 <
ffff000103533900 1211705391 C Bi:6:002:1 0 281 = e1000484 00000f00 0b006000 04300000 00000000 48b2f302 5e600000 bbe8e80f
ffff000103533900 1211705438 S Bi:6:002:1 -115 32768 <
ffff00013d9fb000 1211772200 S Ci:6:002:0 s c0 05 004c 0000 0001 1 <
ffff00013d9fb000 1211772324 C Ci:6:002:0 0 1 = 20
ffff00013d9fb000 1211772513 S Co:6:002:0 s 40 05 004c 0000 0001 1 = 20
ffff00013d9fb000 1211772669 C Co:6:002:0 0 1 >
ffff000103558cc0 1212217261 C Bi:6:002:1 0 281 = e1000484 00000f00 0c006000 04300000 00000000 b181fb02 5e5c0000 bbe9e90f
ffff000103558cc0 1212217308 S Bi:6:002:1 -115 32768 <
ffff00014c2bf900 1212349376 C Bi:6:002:1 0 281 = e1000484 00000f00 0d006000 04300000 00000000 e785fd02 5c5c0000 bbe9e90f
ffff00014c2bf900 1212349411 S Bi:6:002:1 -115 32768 <
ffff00013d62e840 1212729321 C Bi:6:002:1 0 281 = e1000484 00000f00 0e006000 04300000 00000000 ee510303 5e5e0000 bce8e80f
ffff00013d62e840 1212729367 S Bi:6:002:1 -115 32768 <
ffff00013d9fb000 1212764182 S Ci:6:002:0 s c0 05 004c 0000 0001 1 <
ffff00013d9fb000 1212764311 C Ci:6:002:0 0 1 = 20
ffff00013d9fb000 1212764518 S Co:6:002:0 s 40 05 004c 0000 0001 1 = 20
ffff00013d9fb000 1212764675 C Co:6:002:0 0 1 >
ffff00013d9fb000 1212764914 S Ci:6:002:0 s c0 05 0770 0000 0004 4 <
ffff00013d9fb000 1212765076 C Ci:6:002:0 0 4 = 00000000
ffff00013d9fb000 1212765245 S Ci:6:002:0 s c0 05 0774 0000 0004 4 <
ffff00013d9fb000 1212765373 C Ci:6:002:0 0 4 = 00000000
ffff00013d9fb000 1212765583 S Co:6:002:0 s 40 05 076e 0000 0001 1 = 0c
ffff00013d9fb000 1212765738 C Co:6:002:0 0 1 >
ffff00013d9fb000 1212765910 S Ci:6:002:0 s c0 05 0808 0000 0004 4 <
ffff00013d9fb000 1212766037 C Ci:6:002:0 0 4 = 3382023e
ffff00013d9fb000 1212766243 S Ci:6:002:0 s c0 05 0a5c 0000 0002 2 <
ffff00013d9fb000 1212766408 C Ci:6:002:0 0 2 = 0c00
ffff00013d9fb000 1212766577 S Ci:6:002:0 s c0 05 0f48 0000 0002 2 <
ffff00013d9fb000 1212766702 C Ci:6:002:0 0 2 = 2600
ffff00013d9fb000 1212766910 S Ci:6:002:0 s c0 05 0f04 0000 0004 4 <
ffff00013d9fb000 1212767075 C Ci:6:002:0 0 4 = 00000000
ffff00013d9fb000 1212767246 S Ci:6:002:0 s c0 05 0f14 0000 0004 4 <
ffff00013d9fb000 1212767288 C Ci:6:002:0 0 4 = 42001c00
ffff00013d9fb000 1212767306 S Ci:6:002:0 s c0 05 0f10 0000 0004 4 <
ffff00013d9fb000 1212767339 C Ci:6:002:0 0 4 = 00000000
ffff00013d9fb000 1212767365 S Ci:6:002:0 s c0 05 0f0c 0000 0004 4 <
ffff00013d9fb000 1212767418 C Ci:6:002:0 0 4 = 00000000
ffff00013d9fb000 1212767446 S Ci:6:002:0 s c0 05 0f08 0000 0004 4 <
ffff00013d9fb000 1212767493 C Ci:6:002:0 0 4 = 10008300
ffff00013d9fb000 1212767521 S Ci:6:002:0 s c0 05 0fcc 0000 0004 4 <
ffff00013d9fb000 1212767569 C Ci:6:002:0 0 4 = 00000000
ffff00013d9fb000 1212767596 S Ci:6:002:0 s c0 05 09a4 0000 0004 4 <
ffff00013d9fb000 1212767661 C Ci:6:002:0 0 4 = 80000800
ffff00013d9fb000 1212767689 S Co:6:002:0 s 40 05 09a4 0000 0004 4 = 80000a00
ffff00013d9fb000 1212767735 C Co:6:002:0 0 4 >
ffff00013d9fb000 1212767763 S Ci:6:002:0 s c0 05 09a4 0000 0004 4 <
ffff00013d9fb000 1212767809 C Ci:6:002:0 0 4 = 80000a00
ffff00013d9fb000 1212767836 S Co:6:002:0 s 40 05 09a4 0000 0004 4 = 80000800
ffff00013d9fb000 1212767878 C Co:6:002:0 0 4 >
ffff00013d9fb000 1212767906 S Ci:6:002:0 s c0 05 0a2c 0000 0004 4 <
ffff00013d9fb000 1212767951 C Ci:6:002:0 0 4 = 00809000
ffff00013d9fb000 1212767979 S Co:6:002:0 s 40 05 0a2c 0000 0004 4 = 00009000
ffff00013d9fb000 1212768053 C Co:6:002:0 0 4 >
ffff00013d9fb000 1212768093 S Ci:6:002:0 s c0 05 0a2c 0000 0004 4 <
ffff00013d9fb000 1212768203 C Ci:6:002:0 0 4 = 00009000
ffff00013d9fb000 1212768241 S Co:6:002:0 s 40 05 0a2c 0000 0004 4 = 00809000
ffff00013d9fb000 1212768354 C Co:6:002:0 0 4 >
ffff00013d9fb000 1212768391 S Ci:6:002:0 s c0 05 0b58 0000 0004 4 <
ffff00013d9fb000 1212768505 C Ci:6:002:0 0 4 = 00000000
ffff00013d9fb000 1212768684 S Co:6:002:0 s 40 05 0b58 0000 0004 4 = 01000000
ffff00013d9fb000 1212768843 C Co:6:002:0 0 4 >
ffff00013d9fb000 1212769003 S Ci:6:002:0 s c0 05 0b58 0000 0004 4 <
ffff00013d9fb000 1212769136 C Ci:6:002:0 0 4 = 01000000
ffff00013d9fb000 1212769335 S Co:6:002:0 s 40 05 0b58 0000 0004 4 = 00000000
ffff00013d9fb000 1212769489 C Co:6:002:0 0 4 >
ffff00013d9fb000 1212769650 S Ci:6:002:0 s c0 05 01cc 0000 0001 1 <
ffff00013d9fb000 1212769771 C Ci:6:002:0 0 1 = 00
ffff00013d9fb000 1212769814 S Co:6:002:0 s 40 05 01f0 0000 0004 4 = 00000000
ffff00013d9fb000 1212769933 C Co:6:002:0 0 4 >
ffff00013d9fb000 1212769973 S Co:6:002:0 s 40 05 01d0 0000 0004 4 = 58000000
ffff00013d9fb000 1212770103 C Co:6:002:0 0 4 >
ffff00013d9fb000 1212770141 S Co:6:002:0 s 40 05 0440 0000 0004 4 = 00000000
ffff00013d9fb000 1212770316 C Co:6:002:0 0 4 >
ffff00013d9fb000 1212770356 S Ci:6:002:0 s c0 05 0c00 0000 0004 4 <
ffff00013d9fb000 1212770483 C Ci:6:002:0 0 4 = 07000000
ffff00013d9fb000 1212770521 S Ci:6:002:0 s c0 05 08b0 0000 0004 4 <
ffff00013d9fb000 1212770633 C Ci:6:002:0 0 4 = 18060000
ffff00013d9fb000 1212770670 S Co:6:002:0 s 40 05 08b0 0000 0004 4 = 42060000
ffff00013d9fb000 1212770783 C Co:6:002:0 0 4 >
ffff00013d9fb000 1212770842 S Ci:6:002:0 s c0 05 0d04 0000 0004 4 <
ffff00013d9fb000 1212770975 C Ci:6:002:0 0 4 = 088990b1
ffff00013d9fb000 1212771013 S Co:6:002:0 s 40 05 0c90 0000 0004 4 = 08892304
ffff00013d9fb000 1212771121 C Co:6:002:0 0 4 >
ffff00013d9fb000 1212771173 S Co:6:002:0 s 40 05 0280 0000 0002 2 = 0001
ffff00013d9fb000 1212771276 C Co:6:002:0 0 2 >
ffff00013d9fb000 1212771313 S Ci:6:002:0 s c0 05 010c 0000 0001 1 <
ffff00013d9fb000 1212771425 C Ci:6:002:0 0 1 = b4
ffff00013d9fb000 1212771461 S Co:6:002:0 s 40 05 010c 0000 0001 1 = b4
ffff00013d9fb000 1212771569 C Co:6:002:0 0 1 >
ffff000103533900 1212844991 C Bi:6:002:1 0 281 = e1000484 00000f00 0f006000 04300000 00000000 c6150503 5c5c0000 bbeaea0f
ffff000103533900 1212845027 S Bi:6:002:1 -115 32768 <
ffff000103558cc0 1213080781 C Bi:6:002:1 0 281 = e1000484 00000f00 10006000 04300000 00000000 feae0803 5c5c0000 baeaea0f
ffff000103558cc0 1213080835 S Bi:6:002:1 -115 32768 <
ffff00014c2bf900 1213195663 C Bi:6:002:1 0 281 = e1000484 00000f00 11006000 04300000 00000000 c76f0a03 5e5c0000 bbeaea0f
ffff00014c2bf900 1213195704 S Bi:6:002:1 -115 32768 <
ffff00013d62e840 1213300488 C Bi:6:002:1 0 281 = e1000484 00000f00 12006000 04300000 00000000 12090c03 5e5c0000 b9e8e80f
ffff00013d62e840 1213300543 S Bi:6:002:1 -115 32768 <
ffff000103533900 1213753282 C Bi:6:002:1 0 281 = e1000484 00000f00 14006000 04300000 00000000 c2f11203 5e5c0000 bae8e80f
ffff000103533900 1213753338 S Bi:6:002:1 -115 32768 <
ffff00013d9fb000 1213756158 S Ci:6:002:0 s c0 05 004c 0000 0001 1 <
ffff00013d9fb000 1213756214 C Ci:6:002:0 0 1 = 20
ffff00013d9fb000 1213756237 S Co:6:002:0 s 40 05 004c 0000 0001 1 = 20
ffff00013d9fb000 1213756272 C Co:6:002:0 0 1 >
