ffff000103533240 4039669547 C Bi:6:002:1 0 351 = 27010484 00000f80 110d6000 04300000 00000000 41530301 463c0000 81ecec01
ffff000103533240 4039669605 S Bi:6:002:1 -115 32768 <
ffff000103533780 4039670296 C Bi:6:002:1 0 374 = 3e010484 00000f80 e4076000 04300000 00000000 43560301 443c0000 82fcfc01
ffff000103533780 4039670322 S Bi:6:002:1 -115 32768 <
ffff0001035330c0 4039671082 C Bi:6:002:1 0 384 = 48010484 00000f80 b40a6000 04300000 00000000 54590301 46380000 84f4f401
ffff0001035330c0 4039671106 S Bi:6:002:1 -115 32768 <
ffff000103533480 4039681478 C Bi:6:002:1 0 172 = 74000484 00000f80 90026000 00300000 00000000 f47f0301 34340000 13520001
ffff000103533480 4039681509 S Bi:6:002:1 -115 32768 <
ffff000103533240 4039720741 C Bi:6:002:1 0 249 = c1000484 00000f80 3c016000 00300000 00000000 0a170401 36360000 466e0001
ffff000103533240 4039720792 S Bi:6:002:1 -115 32768 <
ffff000103533780 4039769273 C Bi:6:002:1 0 383 = 47010484 00000f80 df0b6000 04300000 00000000 cdd80401 463a0000 88f6f601
ffff000103533780 4039769312 S Bi:6:002:1 -115 32768 <
ffff0001035330c0 4039770103 C Bi:6:002:1 0 376 = 40010484 00000f80 4d036000 04300000 00000000 2fdc0401 463a0000 84f4f401
ffff0001035330c0 4039770131 S Bi:6:002:1 -115 32768 <
ffff000103533480 4039770874 C Bi:6:002:1 0 351 = 27010484 00000f80 120d6000 04300000 00000000 54df0401 42360000 86f9f901
ffff000103533480 4039770898 S Bi:6:002:1 -115 32768 <
ffff000103533240 4039771655 C Bi:6:002:1 0 374 = 3e010484 00000f80 e5076000 04300000 00000000 50e20401 443a0000 88e9e901
ffff000103533240 4039771676 S Bi:6:002:1 -115 32768 <
ffff000103150540 4039772170 S Ci:6:002:0 s c0 05 004c 0000 0001 1 <
ffff000103150540 4039772330 C Ci:6:002:0 0 1 = 20
ffff000103150540 4039772484 S Co:6:002:0 s 40 05 004c 0000 0001 1 = 20
ffff000103150540 4039772624 C Co:6:002:0 0 1 >
ffff00014c2bf840 4039772941 S Ci:6:002:0 s c0 05 0770 0000 0004 4 <
ffff00014c2bf840 4039773090 C Ci:6:002:0 0 4 = 00000000
ffff00014c2bf840 4039773253 S Ci:6:002:0 s c0 05 0774 0000 0004 4 <
ffff00014c2bf840 4039773383 C Ci:6:002:0 0 4 = 00000000
ffff00014c2bf840 4039773530 S Co:6:002:0 s 40 05 076e 0000 0001 1 = 0c
ffff00014c2bf840 4039773667 C Co:6:002:0 0 1 >
ffff00014c2bf840 4039773817 S Ci:6:002:0 s c0 05 0808 0000 0004 4 <
ffff000103533780 4039773870 C Bi:6:002:1 0 384 = 48010484 00000f80 b50a6000 04300000 00000000 ebea0401 46400000 85eded01
ffff000103533780 4039773878 S Bi:6:002:1 -115 32768 <
ffff00014c2bf840 4039773903 C Ci:6:002:0 0 4 = 3382023e
ffff00014c2bf840 4039773926 S Ci:6:002:0 s c0 05 0a5c 0000 0002 2 <
ffff00014c2bf840 4039773987 C Ci:6:002:0 0 2 = 4000
ffff00014c2bf840 4039774023 S Ci:6:002:0 s c0 05 0f48 0000 0002 2 <
ffff00014c2bf840 4039774144 C Ci:6:002:0 0 2 = 0010
ffff00014c2bf840 4039774180 S Ci:6:002:0 s c0 05 0f04 0000 0004 4 <
ffff00014c2bf840 4039774298 C Ci:6:002:0 0 4 = 0d000b00
ffff00014c2bf840 4039774337 S Ci:6:002:0 s c0 05 0f14 0000 0004 4 <
ffff00014c2bf840 4039774456 C Ci:6:002:0 0 4 = 56000800
ffff00014c2bf840 4039774493 S Ci:6:002:0 s c0 05 0f10 0000 0004 4 <
ffff00014c2bf840 4039774603 C Ci:6:002:0 0 4 = 00000000
ffff00014c2bf840 4039774639 S Ci:6:002:0 s c0 05 0f0c 0000 0004 4 <
ffff00014c2bf840 4039774764 C Ci:6:002:0 0 4 = 00000000
ffff00014c2bf840 4039774801 S Ci:6:002:0 s c0 05 0f08 0000 0004 4 <
ffff00014c2bf840 4039774912 C Ci:6:002:0 0 4 = 78005e10
ffff00014c2bf840 4039774948 S Ci:6:002:0 s c0 05 0fcc 0000 0004 4 <
ffff00014c2bf840 4039775060 C Ci:6:002:0 0 4 = 00000000
ffff00014c2bf840 4039775096 S Ci:6:002:0 s c0 05 09a4 0000 0004 4 <
ffff00014c2bf840 4039775207 C Ci:6:002:0 0 4 = 80000800
ffff00014c2bf840 4039775244 S Co:6:002:0 s 40 05 09a4 0000 0004 4 = 80000a00
ffff00014c2bf840 4039775357 C Co:6:002:0 0 4 >
ffff00014c2bf840 4039775395 S Ci:6:002:0 s c0 05 09a4 0000 0004 4 <
ffff00014c2bf840 4039775518 C Ci:6:002:0 0 4 = 80000a00
ffff00014c2bf840 4039775555 S Co:6:002:0 s 40 05 09a4 0000 0004 4 = 80000800
ffff00014c2bf840 4039775662 C Co:6:002:0 0 4 >
ffff00014c2bf840 4039775700 S Ci:6:002:0 s c0 05 0a2c 0000 0004 4 <
ffff00014c2bf840 4039775812 C Ci:6:002:0 0 4 = 00809000
ffff00014c2bf840 4039775849 S Co:6:002:0 s 40 05 0a2c 0000 0004 4 = 00009000
ffff00014c2bf840 4039775956 C Co:6:002:0 0 4 >
ffff00014c2bf840 4039775993 S Ci:6:002:0 s c0 05 0a2c 0000 0004 4 <
ffff00014c2bf840 4039776110 C Ci:6:002:0 0 4 = 00009000
ffff00014c2bf840 4039776149 S Co:6:002:0 s 40 05 0a2c 0000 0004 4 = 00809000
ffff00014c2bf840 4039776246 C Co:6:002:0 0 4 >
ffff00014c2bf840 4039776276 S Ci:6:002:0 s c0 05 0b58 0000 0004 4 <
ffff00014c2bf840 4039776394 C Ci:6:002:0 0 4 = 00000000
ffff00014c2bf840 4039776431 S Co:6:002:0 s 40 05 0b58 0000 0004 4 = 01000000
ffff00014c2bf840 4039776539 C Co:6:002:0 0 4 >
ffff00014c2bf840 4039776577 S Ci:6:002:0 s c0 05 0b58 0000 0004 4 <
ffff00014c2bf840 4039776689 C Ci:6:002:0 0 4 = 01000000
ffff00014c2bf840 4039776726 S Co:6:002:0 s 40 05 0b58 0000 0004 4 = 00000000
ffff00014c2bf840 4039776834 C Co:6:002:0 0 4 >
ffff00014c2bf840 4039776873 S Ci:6:002:0 s c0 05 0c50 0000 0004 4 <
ffff00014c2bf840 4039776984 C Ci:6:002:0 0 4 = 1f000000
ffff00014c2bf840 4039777021 S Co:6:002:0 s 40 05 0c50 0000 0004 4 = 20000000
ffff00014c2bf840 4039777140 C Co:6:002:0 0 4 >
ffff00014c2bf840 4039777178 S Ci:6:002:0 s c0 05 0e50 0000 0004 4 <
ffff00014c2bf840 4039777290 C Ci:6:002:0 0 4 = 1f000000
ffff00014c2bf840 4039777327 S Co:6:002:0 s 40 05 0e50 0000 0004 4 = 20000000
ffff00014c2bf840 4039777435 C Co:6:002:0 0 4 >
ffff00014c2bf840 4039777474 S Ci:6:002:0 s c0 05 01cc 0000 0001 1 <
ffff00014c2bf840 4039777588 C Ci:6:002:0 0 1 = 00
ffff00014c2bf840 4039777625 S Co:6:002:0 s 40 05 01fc 0000 0004 4 = 00000000
ffff00014c2bf840 4039777732 C Co:6:002:0 0 4 >
ffff00014c2bf840 4039777771 S Co:6:002:0 s 40 05 01dc 0000 0004 4 = 58000000
ffff00014c2bf840 4039777890 C Co:6:002:0 0 4 >
ffff00014c2bf840 4039777928 S Co:6:002:0 s 40 05 0440 0000 0004 4 = 00000000
ffff00014c2bf840 4039778037 C Co:6:002:0 0 4 >
ffff00014c2bf840 4039778075 S Ci:6:002:0 s c0 05 0c00 0000 0004 4 <
ffff00014c2bf840 4039778192 C Ci:6:002:0 0 4 = 07000000
ffff00014c2bf840 4039778230 S Ci:6:002:0 s c0 05 08b0 0000 0004 4 <
ffff00014c2bf840 4039778348 C Ci:6:002:0 0 4 = 18060000
ffff00014c2bf840 4039778385 S Co:6:002:0 s 40 05 08b0 0000 0004 4 = 42060000
ffff00014c2bf840 4039778492 C Co:6:002:0 0 4 >
ffff00014c2bf840 4039778551 S Ci:6:002:0 s c0 05 0d04 0000 0004 4 <
ffff00014c2bf840 4039778659 C Ci:6:002:0 0 4 = 108d90b1
ffff00014c2bf840 4039778696 S Co:6:002:0 s 40 05 0c90 0000 0004 4 = 108d2304
ffff00014c2bf840 4039778803 C Co:6:002:0 0 4 >
ffff00014c2bf840 4039778856 S Co:6:002:0 s 40 05 0280 0000 0002 2 = 0001
ffff00014c2bf840 4039778959 C Co:6:002:0 0 2 >
ffff00014c2bf840 4039778997 S Ci:6:002:0 s c0 05 010c 0000 0001 1 <
ffff00014c2bf840 4039779109 C Ci:6:002:0 0 1 = b4
ffff00014c2bf840 4039779146 S Co:6:002:0 s 40 05 010c 0000 0001 1 = b4
ffff00014c2bf840 4039779265 C Co:6:002:0 0 1 >
ffff0001035330c0 4039783788 C Bi:6:002:1 0 172 = 74000484 00000f80 91026000 00300000 00000000 c60f0501 46400000 1d510001
ffff0001035330c0 4039783838 S Bi:6:002:1 -115 32768 <
ffff000103533480 4039870719 C Bi:6:002:1 0 383 = 47010484 00000f80 e00b6000 04300000 00000000 1b650601 443e0000 85eded01
ffff000103533480 4039870744 S Bi:6:002:1 -115 32768 <
ffff000103533240 4039871700 C Bi:6:002:1 0 376 = 40010484 00000f80 4e036000 04300000 00000000 0b690601 443e0000 88f5f501
ffff000103533240 4039871728 S Bi:6:002:1 -115 32768 <
ffff000103533780 4039872963 C Bi:6:002:1 0 351 = 27010484 00000f80 130d6000 04300000 00000000 1d6e0601 44340000 85f1f101
ffff000103533780 4039872988 S Bi:6:002:1 -115 32768 <
ffff0001035330c0 4039874053 C Bi:6:002:1 0 374 = 3e010484 00000f80 e6076000 04300000 00000000 42720601 463a0000 84f6f601
ffff0001035330c0 4039874078 S Bi:6:002:1 -115 32768 <
ffff000103533480 4039874865 C Bi:6:002:1 0 384 = 48010484 00000f80 b60a6000 04300000 00000000 5f750601 46360000 84f5f501
ffff000103533480 4039874891 S Bi:6:002:1 -115 32768 <
ffff000103533240 4039886238 C Bi:6:002:1 0 172 = 74000484 00000f80 92026000 00300000 00000000 c89f0601 32320000 0d500001
ffff000103533240 4039886267 S Bi:6:002:1 -115 32768 <
ffff000103533780 4039952241 C Bi:6:002:1 0 310 = fe000484 00000f80 3b016000 00300000 00000000 529d0701 30320000 6d520001
ffff000103533780 4039952270 S Bi:6:002:1 -115 32768 <
ffff0001035330c0 4039973117 C Bi:6:002:1 0 383 = 47010484 00000f80 e10b6000 04300000 00000000 1df50701 463c0000 86eded01
ffff0001035330c0 4039973142 S Bi:6:002:1 -115 32768 <
ffff000103533480 4039974170 C Bi:6:002:1 0 376 = 40010484 00000f80 4f036000 04300000 00000000 4ff90701 44380000 84f9f901
ffff000103533480 4039974202 S Bi:6:002:1 -115 32768 <
ffff000103533240 4039974993 C Bi:6:002:1 0 351 = 27010484 00000f80 140d6000 04300000 00000000 a8fc0701 40340000 81f1f101
ffff000103533240 4039975018 S Bi:6:002:1 -115 32768 <
ffff000103533780 4039975808 C Bi:6:002:1 0 374 = 3e010484 00000f80 e7076000 04300000 00000000 beff0701 443c0000 88fbfb01
ffff000103533780 4039975833 S Bi:6:002:1 -115 32768 <
ffff0001035330c0 4039976613 C Bi:6:002:1 0 384 = 48010484 00000f80 b70a6000 04300000 00000000 d1020801 443a0000 86eded01
ffff0001035330c0 4039976640 S Bi:6:002:1 -115 32768 <
ffff000103533480 4040024283 C Bi:6:002:1 0 377 = 41010484 00000f00 fa086000 04300000 00000000 11bd0801 443a0000 84fefe01
ffff000103533480 4040024331 S Bi:6:002:1 -115 32768 <
ffff000103533240 4040025142 C Bi:6:002:1 0 377 = 41010484 00000f00 fa086000 04300000 00000000 6dc00801 463c0000 85f3f301
ffff000103533240 4040025168 S Bi:6:002:1 -115 32768 <
ffff000103533780 4040027310 C Bi:6:002:1 0 377 = 41010484 00000f00 fa086000 04300000 00000000 e8c80801 48400000 8aeeee01
ffff000103533780 4040027334 S Bi:6:002:1 -115 32768 <
ffff0001035330c0 4040027839 C Bi:6:002:1 0 377 = 41010484 00000f00 fa086000 04300000 00000000 4dcb0801 443e0000 85f7f701
ffff0001035330c0 4040027856 S Bi:6:002:1 -115 32768 <
ffff000103533480 4040028539 C Bi:6:002:1 0 370 = 3a010484 00000f00 30016000 04300000 00000000 bbcd0801 44380000 83f4f401
ffff000103533480 4040028563 S Bi:6:002:1 -115 32768 <
ffff000103533240 4040029172 C Bi:6:002:1 0 370 = 3a010484 00000f00 30016000 04300000 00000000 24d00801 443a0000 86eded01
ffff000103533240 4040029195 S Bi:6:002:1 -115 32768 <
ffff000103533780 4040030363 C Bi:6:002:1 0 370 = 3a010484 00000f00 30016000 04300000 00000000 ded40801 463e0000 86f2f201
ffff000103533780 4040030387 S Bi:6:002:1 -115 32768 <
ffff0001035330c0 4040076135 C Bi:6:002:1 0 383 = 47010484 00000f80 e20b6000 04300000 00000000 74870901 44380000 86f3f301
ffff0001035330c0 4040076161 S Bi:6:002:1 -115 32768 <
ffff000103533480 4040076918 C Bi:6:002:1 0 376 = 40010484 00000f80 50036000 04300000 00000000 ae8a0901 463e0000 86f4f401
ffff000103533480 4040076944 S Bi:6:002:1 -115 32768 <
ffff000103533240 4040085407 C Bi:6:002:1 0 374 = 3e010484 00000f80 e8076000 04300000 00000000 efab0901 463e0000 87ebeb01
ffff000103533240 4040085429 S Bi:6:002:1 -115 32768 <
ffff000103533780 4040086302 C Bi:6:002:1 0 384 = 48010484 00000f80 b80a6000 04300000 00000000 3faf0901 443c0000 83f7f701
ffff000103533780 4040086331 S Bi:6:002:1 -115 32768 <
ffff0001035330c0 4040179448 C Bi:6:002:1 0 383 = 47010484 00000f80 e30b6000 04300000 00000000 391b0b01 463a0000 88f9f901
ffff0001035330c0 4040179480 S Bi:6:002:1 -115 32768 <
ffff000103533480 4040180313 C Bi:6:002:1 0 376 = 40010484 00000f80 51036000 04300000 00000000 9d1e0b01 463c0000 88f3f301
ffff000103533480 4040180342 S Bi:6:002:1 -115 32768 <
ffff000103533240 4040181089 C Bi:6:002:1 0 351 = 27010484 00000f80 160d6000 04300000 00000000 af210b01 463c0000 89f9f901
ffff000103533240 4040181116 S Bi:6:002:1 -115 32768 <
ffff000103533780 4040281387 C Bi:6:002:1 0 376 = 40010484 00000f80 52036000 04300000 00000000 4fa90c01 4c3a0000 93f4f401
ffff000103533780 4040281413 S Bi:6:002:1 -115 32768 <
ffff0001035330c0 4040384290 C Bi:6:002:1 0 383 = 47010484 00000f80 e50b6000 04300000 00000000 3b3b0e01 443a0000 85fafa01
ffff0001035330c0 4040384317 S Bi:6:002:1 -115 32768 <
ffff000103533480 4040385088 C Bi:6:002:1 0 376 = 40010484 00000f80 53036000 04300000 00000000 7d3e0e01 463c0000 86e6e601
ffff000103533480 4040385115 S Bi:6:002:1 -115 32768 <
ffff000103533240 4040385882 C Bi:6:002:1 0 351 = 27010484 00000f80 180d6000 04300000 00000000 b3410e01 46380000 87f5f501
ffff000103533240 4040385906 S Bi:6:002:1 -115 32768 <
ffff000103533780 4040386633 C Bi:6:002:1 0 374 = 3e010484 00000f80 eb076000 04300000 00000000 8a440e01 423c0000 88f8f801
ffff000103533780 4040386658 S Bi:6:002:1 -115 32768 <
ffff0001035330c0 4040387466 C Bi:6:002:1 0 384 = 48010484 00000f80 bb0a6000 04300000 00000000 b8470e01 46380000 89f0f001
ffff0001035330c0 4040387491 S Bi:6:002:1 -115 32768 <
ffff000103533480 4040486651 C Bi:6:002:1 0 383 = 47010484 00000f80 e60b6000 04300000 00000000 3ccb0f01 44360000 80efef01
ffff000103533480 4040486674 S Bi:6:002:1 -115 32768 <
ffff000103533240 4040487486 C Bi:6:002:1 0 376 = 40010484 00000f80 54036000 04300000 00000000 79ce0f01 44360000 83f4f401
ffff000103533240 4040487511 S Bi:6:002:1 -115 32768 <
ffff000103533780 4040489028 C Bi:6:002:1 0 374 = 3e010484 00000f80 ec076000 04300000 00000000 88d40f01 463e0000 85f5f501
ffff000103533780 4040489052 S Bi:6:002:1 -115 32768 <
ffff0001035330c0 4040489947 C Bi:6:002:1 0 384 = 48010484 00000f80 bc0a6000 04300000 00000000 00d80f01 463a0000 83fbfb01
ffff0001035330c0 4040489975 S Bi:6:002:1 -115 32768 <
ffff000103151240 4040579711 S Ci:6:002:0 s c0 05 0454 0000 0001 1 <
ffff000103151240 4040579897 C Ci:6:002:0 0 1 = 00
ffff000103151240 4040579940 S Ci:6:002:0 s c0 05 0860 0000 0004 4 <
ffff000103151240 4040580038 C Ci:6:002:0 0 4 = 21c3d572
ffff000103151240 4040580106 S Co:6:002:0 s 40 05 0860 0000 0004 4 = 21c3d572
ffff000103151240 4040580204 C Co:6:002:0 0 4 >
ffff000103151240 4040580242 S Ci:6:002:0 s c0 05 0c00 0000 0004 4 <
ffff000103151240 4040580378 C Ci:6:002:0 0 4 = 07000000
ffff000103151240 4040580413 S Ci:6:002:0 s c0 05 08b0 0000 0004 4 <
ffff000103151240 4040580514 C Ci:6:002:0 0 4 = 42060000
ffff000103151240 4040580549 S Co:6:002:0 s 40 05 08b0 0000 0004 4 = 18060000
ffff000103151240 4040580646 C Co:6:002:0 0 4 >
ffff00014c2bf840 4040580702 S Ci:6:002:0 s c0 05 0d04 0000 0004 4 <
ffff00014c2bf840 4040580826 C Ci:6:002:0 0 4 = 017c90b1
ffff00014c2bf840 4040580874 S Co:6:002:0 s 40 05 0c90 0000 0004 4 = 017c8001
ffff00014c2bf840 4040581008 C Co:6:002:0 0 4 >
ffff00014c2bf840 4040581066 S Ci:6:002:0 s c0 05 08ac 0000 0004 4 <
ffff00014c2bf840 4040581185 C Ci:6:002:0 0 4 = 08faf00f
ffff00014c2bf840 4040581232 S Co:6:002:0 s 40 05 08ac 0000 0004 4 = 08faf00f
ffff00014c2bf840 4040581336 C Co:6:002:0 0 4 >
ffff00014c2bf840 4040581381 S Ci:6:002:0 s c0 05 08ac 0000 0004 4 <
ffff00014c2bf840 4040581503 C Ci:6:002:0 0 4 = 08faf00f
ffff00014c2bf840 4040581550 S Co:6:002:0 s 40 05 08ac 0000 0004 4 = 08faf00f
ffff00014c2bf840 4040581664 C Co:6:002:0 0 4 >
ffff00014c2bf840 4040581710 S Ci:6:002:0 s c0 05 08c4 0000 0004 4 <
ffff00014c2bf840 4040581820 C Ci:6:002:0 0 4 = 00000000
ffff00014c2bf840 4040581866 S Co:6:002:0 s 40 05 08c4 0000 0004 4 = 00000000
ffff00014c2bf840 4040581973 C Co:6:002:0 0 4 >
ffff00014c2bf840 4040582020 S Ci:6:002:0 s c0 05 0c00 0000 0004 4 <
ffff00014c2bf840 4040582140 C Ci:6:002:0 0 4 = 07000000
ffff00014c2bf840 4040582184 S Ci:6:002:0 s c0 05 08b0 0000 0004 4 <
ffff00014c2bf840 4040582295 C Ci:6:002:0 0 4 = 18060000
ffff00014c2bf840 4040582340 S Co:6:002:0 s 40 05 08b0 0000 0004 4 = 18060000
ffff00014c2bf840 4040582446 C Co:6:002:0 0 4 >
ffff00014c2bf840 4040582513 S Ci:6:002:0 s c0 05 0d04 0000 0004 4 <
ffff00014c2bf840 4040582636 C Ci:6:002:0 0 4 = 017c90b1
ffff00014c2bf840 4040582682 S Co:6:002:0 s 40 05 0c90 0000 0004 4 = 017c8001
ffff00014c2bf840 4040582788 C Co:6:002:0 0 4 >
ffff00014c2bf840 4040582848 S Ci:6:002:0 s c0 05 0e00 0000 0004 4 <
ffff00014c2bf840 4040582968 C Ci:6:002:0 0 4 = 07000000
ffff00014c2bf840 4040583013 S Ci:6:002:0 s c0 05 08b0 0000 0004 4 <
ffff00014c2bf840 4040583136 C Ci:6:002:0 0 4 = 18060000
ffff00014c2bf840 4040583181 S Co:6:002:0 s 40 05 08b0 0000 0004 4 = 18060000
ffff00014c2bf840 4040583287 C Co:6:002:0 0 4 >
ffff00014c2bf840 4040583356 S Ci:6:002:0 s c0 05 0d44 0000 0004 4 <
ffff00014c2bf840 4040583476 C Ci:6:002:0 0 4 = 017c90b1
ffff00014c2bf840 4040583521 S Co:6:002:0 s 40 05 0e90 0000 0004 4 = 017c8001
ffff00014c2bf840 4040583631 C Co:6:002:0 0 4 >
ffff00014c2bf840 4040583691 S Ci:6:002:0 s c0 05 08ac 0000 0004 4 <
ffff00014c2bf840 4040583833 C Ci:6:002:0 0 4 = 08faf00f
ffff00014c2bf840 4040583879 S Co:6:002:0 s 40 05 08ac 0000 0004 4 = 08faf00f
ffff00014c2bf840 4040583999 C Co:6:002:0 0 4 >
ffff00014c2bf840 4040584049 S Ci:6:002:0 s c0 05 08ac 0000 0004 4 <
ffff00014c2bf840 4040584182 C Ci:6:002:0 0 4 = 08faf00f
ffff00014c2bf840 4040584230 S Co:6:002:0 s 40 05 08ac 0000 0004 4 = 08faf00f
ffff00014c2bf840 4040584344 C Co:6:002:0 0 4 >
ffff00014c2bf840 4040584392 S Ci:6:002:0 s c0 05 08c4 0000 0004 4 <
ffff00014c2bf840 4040584513 C Ci:6:002:0 0 4 = 00000000
ffff00014c2bf840 4040584558 S Co:6:002:0 s 40 05 08c4 0000 0004 4 = 00000000
ffff00014c2bf840 4040584664 C Co:6:002:0 0 4 >
ffff00014c2bf840 4040584711 S Ci:6:002:0 s c0 05 0e00 0000 0004 4 <
ffff00014c2bf840 4040584830 C Ci:6:002:0 0 4 = 07000000
ffff00014c2bf840 4040584876 S Ci:6:002:0 s c0 05 08b0 0000 0004 4 <
ffff00014c2bf840 4040584987 C Ci:6:002:0 0 4 = 18060000
ffff00014c2bf840 4040585032 S Co:6:002:0 s 40 05 08b0 0000 0004 4 = 18060000
ffff00014c2bf840 4040585140 C Co:6:002:0 0 4 >
ffff00014c2bf840 4040585207 S Ci:6:002:0 s c0 05 0d44 0000 0004 4 <
ffff00014c2bf840 4040585327 C Ci:6:002:0 0 4 = 017c90b1
ffff00014c2bf840 4040585373 S Co:6:002:0 s 40 05 0e90 0000 0004 4 = 017c8001
ffff00014c2bf840 4040585479 C Co:6:002:0 0 4 >
ffff00014c2bf840 4040585539 S Ci:6:002:0 s c0 05 0668 0000 0002 2 <
ffff00014c2bf840 4040585659 C Ci:6:002:0 0 2 = 0010
ffff00014c2bf840 4040585705 S Co:6:002:0 s 40 05 0668 0000 0002 2 = 0010
ffff00014c2bf840 4040585811 C Co:6:002:0 0 2 >
ffff00014c2bf840 4040585857 S Co:6:002:0 s 40 05 0483 0000 0001 1 = 00
ffff00014c2bf840 4040585970 C Co:6:002:0 0 1 >
ffff00014c2bf840 4040586016 S Ci:6:002:0 s c0 05 0837 0000 0001 1 <
ffff00014c2bf840 4040586157 C Ci:6:002:0 0 1 = 00
ffff00014c2bf840 4040586203 S Ci:6:002:0 s c0 05 08ac 0000 0004 4 <
ffff00014c2bf840 4040586269 C Ci:6:002:0 0 4 = 08faf00f
ffff00014c2bf840 4040586306 S Co:6:002:0 s 40 05 08ac 0000 0004 4 = 08faf00f
ffff00014c2bf840 4040586413 C Co:6:002:0 0 4 >
ffff00014c2bf840 4040586458 S Ci:6:002:0 s c0 05 08c4 0000 0004 4 <
ffff00014c2bf840 4040586570 C Ci:6:002:0 0 4 = 00000000
ffff00014c2bf840 4040586616 S Co:6:002:0 s 40 05 08c4 0000 0004 4 = 00000000
ffff00014c2bf840 4040586722 C Co:6:002:0 0 4 >
ffff00014c2bf840 4040586769 S Ci:6:002:0 s c0 05 0848 0000 0004 4 <
ffff00014c2bf840 4040586890 C Ci:6:002:0 0 4 = 8bffd061
ffff00014c2bf840 4040586935 S Co:6:002:0 s 40 05 0848 0000 0004 4 = 8bffd061
ffff00014c2bf840 4040587042 C Co:6:002:0 0 4 >
ffff00014c2bf840 4040587088 S Ci:6:002:0 s c0 05 08ac 0000 0004 4 <
ffff00014c2bf840 4040587210 C Ci:6:002:0 0 4 = 08faf00f
ffff00014c2bf840 4040587256 S Co:6:002:0 s 40 05 08ac 0000 0004 4 = 08faf00f
ffff00014c2bf840 4040587374 C Co:6:002:0 0 4 >
ffff00014c2bf840 4040587420 S Ci:6:002:0 s c0 05 08ac 0000 0004 4 <
ffff000103533480 4040587430 C Bi:6:002:1 0 383 = 47010484 00000f80 e70b6000 04300000 00000000 25551101 42380000 83fbfb01
ffff000103533480 4040587440 S Bi:6:002:1 -115 32768 <
ffff00014c2bf840 4040587503 C Ci:6:002:0 0 4 = 08faf00f
ffff00014c2bf840 4040587545 S Co:6:002:0 s 40 05 08ac 0000 0004 4 = 08faf00f
ffff00014c2bf840 4040587585 C Co:6:002:0 0 4 >
ffff00014c2bf840 4040587623 S Ci:6:002:0 s c0 05 08c4 0000 0004 4 <
ffff00014c2bf840 4040587762 C Ci:6:002:0 0 4 = 00000000
ffff00014c2bf840 4040587808 S Co:6:002:0 s 40 05 08c4 0000 0004 4 = 00000000
ffff00014c2bf840 4040587914 C Co:6:002:0 0 4 >
ffff00014c2bf840 4040587960 S Ci:6:002:0 s c0 05 0c00 0000 0004 4 <
ffff00014c2bf840 4040588081 C Ci:6:002:0 0 4 = 07000000
ffff00014c2bf840 4040588127 S Ci:6:002:0 s c0 05 08b0 0000 0004 4 <
ffff00014c2bf840 4040588274 C Ci:6:002:0 0 4 = 18060000
ffff00014c2bf840 4040588322 S Co:6:002:0 s 40 05 08b0 0000 0004 4 = 18060000
ffff00014c2bf840 4040588436 C Co:6:002:0 0 4 >
ffff000103533240 4040588494 C Bi:6:002:1 0 376 = 40010484 00000f80 55036000 04300000 00000000 58591101 46320000 87ecec01
ffff00014c2bf840 4040588518 S Ci:6:002:0 s c0 05 0d04 0000 0004 4 <
ffff000103533240 4040588523 S Bi:6:002:1 -115 32768 <
ffff00014c2bf840 4040588578 C Ci:6:002:0 0 4 = 017c90b1
ffff00014c2bf840 4040588618 S Co:6:002:0 s 40 05 0c90 0000 0004 4 = 017c8001
ffff00014c2bf840 4040588663 C Co:6:002:0 0 4 >
ffff00014c2bf840 4040588714 S Ci:6:002:0 s c0 05 0e00 0000 0004 4 <
ffff00014c2bf840 4040588831 C Ci:6:002:0 0 4 = 07000000
ffff00014c2bf840 4040588877 S Ci:6:002:0 s c0 05 08b0 0000 0004 4 <
ffff00014c2bf840 4040588985 C Ci:6:002:0 0 4 = 18060000
ffff00014c2bf840 4040589032 S Co:6:002:0 s 40 05 08b0 0000 0004 4 = 18060000
ffff00014c2bf840 4040589146 C Co:6:002:0 0 4 >
ffff00014c2bf840 4040589211 S Ci:6:002:0 s c0 05 0d44 0000 0004 4 <
ffff00014c2bf840 4040589332 C Ci:6:002:0 0 4 = 017c90b1
ffff00014c2bf840 4040589378 S Co:6:002:0 s 40 05 0e90 0000 0004 4 = 017c8001
ffff000103533780 4040589386 C Bi:6:002:1 0 351 = 27010484 00000f80 1a0d6000 04300000 00000000 955c1101 46340000 86f2f201
ffff000103533780 4040589394 S Bi:6:002:1 -115 32768 <
ffff00014c2bf840 4040589441 C Co:6:002:0 0 4 >
ffff00014c2bf840 4040589517 S Ci:6:002:0 s c0 05 0c20 0000 0004 4 <
ffff00014c2bf840 4040589636 C Ci:6:002:0 0 4 = 13131313
ffff00014c2bf840 4040589682 S Co:6:002:0 s 40 05 0c20 0000 0004 4 = 13131313
ffff00014c2bf840 4040589788 C Co:6:002:0 0 4 >
ffff00014c2bf840 4040589836 S Ci:6:002:0 s c0 05 0c24 0000 0004 4 <
ffff00014c2bf840 4040589955 C Ci:6:002:0 0 4 = 20202020
ffff00014c2bf840 4040590000 S Co:6:002:0 s 40 05 0c24 0000 0004 4 = 20202020
ffff00014c2bf840 4040590106 C Co:6:002:0 0 4 >
ffff00014c2bf840 4040590153 S Ci:6:002:0 s c0 05 0c28 0000 0004 4 <
ffff00014c2bf840 4040590270 C Ci:6:002:0 0 4 = 20201e1c
ffff00014c2bf840 4040590319 S Co:6:002:0 s 40 05 0c28 0000 0004 4 = 20201e1c
ffff00014c2bf840 4040590424 C Co:6:002:0 0 4 >
ffff00014c2bf840 4040590471 S Ci:6:002:0 s c0 05 0c2c 0000 0004 4 <
ffff00014c2bf840 4040590590 C Ci:6:002:0 0 4 = 20202020
ffff00014c2bf840 4040590635 S Co:6:002:0 s 40 05 0c2c 0000 0004 4 = 20202020
ffff00014c2bf840 4040590754 C Co:6:002:0 0 4 >
ffff00014c2bf840 4040590801 S Ci:6:002:0 s c0 05 0c30 0000 0004 4 <
ffff00014c2bf840 4040590924 C Ci:6:002:0 0 4 = 20201e1c
ffff00014c2bf840 4040590969 S Co:6:002:0 s 40 05 0c30 0000 0004 4 = 20201e1c
ffff0001035330c0 4040590977 C Bi:6:002:1 0 384 = 48010484 00000f80 bd0a6000 04300000 00000000 d7621101 44380000 83f1f101
ffff0001035330c0 4040590985 S Bi:6:002:1 -115 32768 <
ffff00014c2bf840 4040591033 C Co:6:002:0 0 4 >
ffff00014c2bf840 4040591073 S Ci:6:002:0 s c0 05 0c34 0000 0004 4 <
ffff00014c2bf840 4040591199 C Ci:6:002:0 0 4 = 20202020
ffff00014c2bf840 4040591244 S Co:6:002:0 s 40 05 0c34 0000 0004 4 = 20202020
ffff00014c2bf840 4040591351 C Co:6:002:0 0 4 >
ffff00014c2bf840 4040591398 S Ci:6:002:0 s c0 05 0c38 0000 0004 4 <
ffff00014c2bf840 4040591516 C Ci:6:002:0 0 4 = 201e1c1a
ffff00014c2bf840 4040591561 S Co:6:002:0 s 40 05 0c38 0000 0004 4 = 201e1c1a
ffff00014c2bf840 4040591667 C Co:6:002:0 0 4 >
ffff00014c2bf840 4040591714 S Ci:6:002:0 s c0 05 0c3c 0000 0004 4 <
ffff00014c2bf840 4040591833 C Ci:6:002:0 0 4 = 20202020
ffff00014c2bf840 4040591878 S Co:6:002:0 s 40 05 0c3c 0000 0004 4 = 20202020
ffff00014c2bf840 4040591984 C Co:6:002:0 0 4 >
ffff00014c2bf840 4040592036 S Ci:6:002:0 s c0 05 0c40 0000 0004 4 <
ffff00014c2bf840 4040592143 C Ci:6:002:0 0 4 = 20201e1c
ffff00014c2bf840 4040592190 S Co:6:002:0 s 40 05 0c40 0000 0004 4 = 20201e1c
ffff00014c2bf840 4040592295 C Co:6:002:0 0 4 >
ffff00014c2bf840 4040592342 S Ci:6:002:0 s c0 05 0c44 0000 0004 4 <
ffff00014c2bf840 4040592461 C Ci:6:002:0 0 4 = 1a181e1e
ffff00014c2bf840 4040592507 S Co:6:002:0 s 40 05 0c44 0000 0004 4 = 1a181e1e
ffff00014c2bf840 4040592624 C Co:6:002:0 0 4 >
ffff00014c2bf840 4040592671 S Ci:6:002:0 s c0 05 0c48 0000 0004 4 <
ffff00014c2bf840 4040592789 C Ci:6:002:0 0 4 = 1e1e1e1e
ffff00014c2bf840 4040592835 S Co:6:002:0 s 40 05 0c48 0000 0004 4 = 1e1e1e1e
ffff00014c2bf840 4040592941 C Co:6:002:0 0 4 >
ffff00014c2bf840 4040592987 S Ci:6:002:0 s c0 05 0c4c 0000 0004 4 <
ffff00014c2bf840 4040593106 C Ci:6:002:0 0 4 = 1c1a1816
ffff00014c2bf840 4040593152 S Co:6:002:0 s 40 05 0c4c 0000 0004 4 = 1c1a1816
ffff00014c2bf840 4040593259 C Co:6:002:0 0 4 >
ffff00014c2bf840 4040593305 S Ci:6:002:0 s c0 05 0c54 0000 0004 4 <
ffff00014c2bf840 4040593424 C Ci:6:002:0 0 4 = 120a0400
ffff00014c2bf840 4040593470 S Co:6:002:0 s 40 05 0c54 0000 0004 4 = 120a0400
ffff00014c2bf840 4040593576 C Co:6:002:0 0 4 >
ffff00014c2bf840 4040593624 S Ci:6:002:0 s c0 05 0e20 0000 0004 4 <
ffff00014c2bf840 4040593760 C Ci:6:002:0 0 4 = 14141414
ffff00014c2bf840 4040593805 S Co:6:002:0 s 40 05 0e20 0000 0004 4 = 14141414
ffff00014c2bf840 4040593912 C Co:6:002:0 0 4 >
ffff00014c2bf840 4040593959 S Ci:6:002:0 s c0 05 0e24 0000 0004 4 <
ffff00014c2bf840 4040594077 C Ci:6:002:0 0 4 = 1d1d1d1d
ffff00014c2bf840 4040594122 S Co:6:002:0 s 40 05 0e24 0000 0004 4 = 1d1d1d1d
ffff00014c2bf840 4040594229 C Co:6:002:0 0 4 >
ffff00014c2bf840 4040594275 S Ci:6:002:0 s c0 05 0e28 0000 0004 4 <
ffff00014c2bf840 4040594394 C Ci:6:002:0 0 4 = 1d1d1b19
ffff00014c2bf840 4040594439 S Co:6:002:0 s 40 05 0e28 0000 0004 4 = 1d1d1b19
ffff00014c2bf840 4040594545 C Co:6:002:0 0 4 >
ffff00014c2bf840 4040594592 S Ci:6:002:0 s c0 05 0e2c 0000 0004 4 <
ffff00014c2bf840 4040594713 C Ci:6:002:0 0 4 = 1f1f1f1f
ffff00014c2bf840 4040594759 S Co:6:002:0 s 40 05 0e2c 0000 0004 4 = 1f1f1f1f
ffff00014c2bf840 4040594877 C Co:6:002:0 0 4 >
ffff00014c2bf840 4040594924 S Ci:6:002:0 s c0 05 0e30 0000 0004 4 <
ffff00014c2bf840 4040595042 C Ci:6:002:0 0 4 = 1f1f1d1b
ffff00014c2bf840 4040595088 S Co:6:002:0 s 40 05 0e30 0000 0004 4 = 1f1f1d1b
ffff00014c2bf840 4040595194 C Co:6:002:0 0 4 >
ffff00014c2bf840 4040595241 S Ci:6:002:0 s c0 05 0e34 0000 0004 4 <
ffff00014c2bf840 4040595359 C Ci:6:002:0 0 4 = 1f1f1f1f
ffff00014c2bf840 4040595405 S Co:6:002:0 s 40 05 0e34 0000 0004 4 = 1f1f1f1f
ffff00014c2bf840 4040595511 C Co:6:002:0 0 4 >
ffff00014c2bf840 4040595557 S Ci:6:002:0 s c0 05 0e38 0000 0004 4 <
ffff00014c2bf840 4040595676 C Ci:6:002:0 0 4 = 1f1d1b19
ffff00014c2bf840 4040595723 S Co:6:002:0 s 40 05 0e38 0000 0004 4 = 1f1d1b19
ffff00014c2bf840 4040595829 C Co:6:002:0 0 4 >
ffff00014c2bf840 4040595875 S Ci:6:002:0 s c0 05 0e3c 0000 0004 4 <
ffff00014c2bf840 4040596010 C Ci:6:002:0 0 4 = 1f1f1f1f
ffff00014c2bf840 4040596117 S Co:6:002:0 s 40 05 0e3c 0000 0004 4 = 1f1f1f1f
ffff00014c2bf840 4040596236 C Co:6:002:0 0 4 >
ffff00014c2bf840 4040596285 S Ci:6:002:0 s c0 05 0e40 0000 0004 4 <
ffff00014c2bf840 4040596406 C Ci:6:002:0 0 4 = 1f1f1d1b
ffff00014c2bf840 4040596451 S Co:6:002:0 s 40 05 0e40 0000 0004 4 = 1f1f1d1b
ffff00014c2bf840 4040596558 C Co:6:002:0 0 4 >
ffff00014c2bf840 4040596604 S Ci:6:002:0 s c0 05 0e44 0000 0004 4 <
ffff00014c2bf840 4040596723 C Ci:6:002:0 0 4 = 19171d1d
ffff00014c2bf840 4040596768 S Co:6:002:0 s 40 05 0e44 0000 0004 4 = 19171d1d
ffff00014c2bf840 4040596881 C Co:6:002:0 0 4 >
ffff00014c2bf840 4040596928 S Ci:6:002:0 s c0 05 0e48 0000 0004 4 <
ffff00014c2bf840 4040597047 C Ci:6:002:0 0 4 = 1d1d1d1d
ffff00014c2bf840 4040597093 S Co:6:002:0 s 40 05 0e48 0000 0004 4 = 1d1d1d1d
ffff00014c2bf840 4040597200 C Co:6:002:0 0 4 >
ffff00014c2bf840 4040597246 S Ci:6:002:0 s c0 05 0e4c 0000 0004 4 <
ffff00014c2bf840 4040597384 C Ci:6:002:0 0 4 = 1b191715
ffff00014c2bf840 4040597429 S Co:6:002:0 s 40 05 0e4c 0000 0004 4 = 1b191715
ffff00014c2bf840 4040597535 C Co:6:002:0 0 4 >
ffff00014c2bf840 4040597581 S Ci:6:002:0 s c0 05 0e54 0000 0004 4 <
ffff00014c2bf840 4040597700 C Ci:6:002:0 0 4 = 11090300
ffff00014c2bf840 4040597746 S Co:6:002:0 s 40 05 0e54 0000 0004 4 = 11090300
ffff00014c2bf840 4040597852 C Co:6:002:0 0 4 >
ffff00014c2bf840 4040597913 S Ci:6:002:0 s c0 05 0454 0000 0001 1 <
ffff00014c2bf840 4040598034 C Ci:6:002:0 0 1 = 00
ffff00014c2bf840 4040598079 S Ci:6:002:0 s c0 05 0454 0000 0001 1 <
ffff00014c2bf840 4040598190 C Ci:6:002:0 0 1 = 00
ffff00014c2bf840 4040598236 S Co:6:002:0 s 40 05 0454 0000 0001 1 = 80
ffff00014c2bf840 4040598350 C Co:6:002:0 0 1 >
ffff00014c2bf840 4040598395 S Ci:6:002:0 s c0 05 041a 0000 0002 2 <
ffff00014c2bf840 4040598510 C Ci:6:002:0 0 2 = ff0f
ffff00014c2bf840 4040598555 S Ci:6:002:0 s c0 05 0808 0000 0004 4 <
ffff00014c2bf840 4040598666 C Ci:6:002:0 0 4 = 3382023e
ffff00014c2bf840 4040598711 S Co:6:002:0 s 40 05 0808 0000 0004 4 = 3382023e
ffff00014c2bf840 4040598817 C Co:6:002:0 0 4 >
ffff00014c2bf840 4040598865 S Ci:6:002:0 s c0 05 0834 0000 0004 4 <
ffff00014c2bf840 4040599003 C Ci:6:002:0 0 4 = 05a73700
ffff00014c2bf840 4040599049 S Co:6:002:0 s 40 05 0834 0000 0004 4 = 06a73700
ffff00014c2bf840 4040599156 C Co:6:002:0 0 4 >
ffff00014c2bf840 4040599202 S Ci:6:002:0 s c0 05 0830 0000 0004 4 <
ffff00014c2bf840 4040599321 C Ci:6:002:0 0 4 = b8eeaa2e
ffff00014c2bf840 4040599366 S Co:6:002:0 s 40 05 0830 0000 0004 4 = b8aeaa2e
ffff00014c2bf840 4040599473 C Co:6:002:0 0 4 >
ffff00014c2bf840 4040599520 S Ci:6:002:0 s c0 05 0830 0000 0004 4 <
ffff00014c2bf840 4040599639 C Ci:6:002:0 0 4 = b8aeaa2e
ffff00014c2bf840 4040599685 S Co:6:002:0 s 40 05 0830 0000 0004 4 = b8aeaa2e
ffff00014c2bf840 4040599791 C Co:6:002:0 0 4 >
ffff00014c2bf840 4040599837 S Ci:6:002:0 s c0 05 082c 0000 0004 4 <
ffff00014c2bf840 4040599957 C Ci:6:002:0 0 4 = dc832000
ffff00014c2bf840 4040600026 S Co:6:002:0 s 40 05 082c 0000 0004 4 = dd832000
ffff00014c2bf840 4040600099 C Co:6:002:0 0 4 >
ffff00014c2bf840 4040600139 S Co:6:002:0 s 40 05 0cb0 0000 0004 4 = 17773354
ffff00014c2bf840 4040600271 C Co:6:002:0 0 4 >
ffff00014c2bf840 4040600318 S Co:6:002:0 s 40 05 0eb0 0000 0004 4 = 17773354
ffff00014c2bf840 4040600432 C Co:6:002:0 0 4 >
ffff00014c2bf840 4040600479 S Ci:6:002:0 s c0 05 0cb4 0000 0004 4 <
ffff00014c2bf840 4040600598 C Ci:6:002:0 0 4 = 77000001
ffff00014c2bf840 4040600643 S Co:6:002:0 s 40 05 0cb4 0000 0004 4 = 77000001
ffff00014c2bf840 4040600756 C Co:6:002:0 0 4 >
ffff00014c2bf840 4040600803 S Ci:6:002:0 s c0 05 0eb4 0000 0004 4 <
ffff00014c2bf840 4040600922 C Ci:6:002:0 0 4 = 77000001
ffff00014c2bf840 4040600968 S Co:6:002:0 s 40 05 0eb4 0000 0004 4 = 77000001
ffff00014c2bf840 4040601074 C Co:6:002:0 0 4 >
ffff00014c2bf840 4040601121 S Ci:6:002:0 s c0 05 0900 0000 0004 4 <
ffff00014c2bf840 4040601257 C Ci:6:002:0 0 4 = 01040000
ffff00014c2bf840 4040601303 S Co:6:002:0 s 40 05 0900 0000 0004 4 = 01040000
ffff00014c2bf840 4040601409 C Co:6:002:0 0 4 >
ffff00014c2bf840 4040601455 S Ci:6:002:0 s c0 05 080c 0000 0004 4 <
ffff00014c2bf840 4040601575 C Ci:6:002:0 0 4 = 13111312
ffff00014c2bf840 4040601621 S Co:6:002:0 s 40 05 080c 0000 0004 4 = 03111312
ffff00014c2bf840 4040601726 C Co:6:002:0 0 4 >
ffff00014c2bf840 4040601773 S Ci:6:002:0 s c0 05 0a04 0000 0004 4 <
ffff00014c2bf840 4040601895 C Ci:6:002:0 0 4 = 0c00ff01
ffff00014c2bf840 4040601940 S Co:6:002:0 s 40 05 0a04 0000 0004 4 = 0c00ff0f
ffff00014c2bf840 4040602047 C Co:6:002:0 0 4 >
ffff00014c2bf840 4040602093 S Ci:6:002:0 s c0 05 0440 0000 0004 4 <
ffff00014c2bf840 4040602212 C Ci:6:002:0 0 4 = 00000000
ffff00014c2bf840 4040602258 S Co:6:002:0 s 40 05 0440 0000 0004 4 = 50010000
ffff00014c2bf840 4040602377 C Co:6:002:0 0 4 >
ffff00014c2bf840 4040602424 S Ci:6:002:0 s c0 05 0c1c 0000 0004 4 <
ffff00014c2bf840 4040602544 C Ci:6:002:0 0 4 = 03000040
ffff00014c2bf840 4040602589 S Co:6:002:0 s 40 05 0c1c 0000 0004 4 = 0300402d
ffff00014c2bf840 4040602696 C Co:6:002:0 0 4 >
ffff00014c2bf840 4040602742 S Ci:6:002:0 s c0 05 0e1c 0000 0004 4 <
ffff00014c2bf840 4040602879 C Ci:6:002:0 0 4 = 03000040
ffff00014c2bf840 4040602923 S Co:6:002:0 s 40 05 0e1c 0000 0004 4 = 0300402d
ffff00014c2bf840 4040603030 C Co:6:002:0 0 4 >
ffff00014c2bf840 4040603077 S Ci:6:002:0 s c0 05 0860 0000 0004 4 <
ffff00014c2bf840 4040603197 C Ci:6:002:0 0 4 = 21c3d572
ffff00014c2bf840 4040603242 S Co:6:002:0 s 40 05 0860 0000 0004 4 = 21c3a568
ffff00014c2bf840 4040603349 C Co:6:002:0 0 4 >
ffff00014c2bf840 4040603396 S Ci:6:002:0 s c0 05 0c00 0000 0004 4 <
ffff00014c2bf840 4040603516 C Ci:6:002:0 0 4 = 07000000
ffff00014c2bf840 4040603561 S Ci:6:002:0 s c0 05 08b0 0000 0004 4 <
ffff00014c2bf840 4040603672 C Ci:6:002:0 0 4 = 18060000
ffff00014c2bf840 4040603717 S Co:6:002:0 s 40 05 08b0 0000 0004 4 = 18060000
ffff00014c2bf840 4040603824 C Co:6:002:0 0 4 >
ffff00014c2bf840 4040603890 S Ci:6:002:0 s c0 05 0d04 0000 0004 4 <
ffff00014c2bf840 4040604011 C Ci:6:002:0 0 4 = 017c90b1
ffff00014c2bf840 4040604057 S Co:6:002:0 s 40 05 0c90 0000 0004 4 = 017d8301
ffff00014c2bf840 4040604171 C Co:6:002:0 0 4 >
ffff00014c2bf840 4040604232 S Ci:6:002:0 s c0 05 08ac 0000 0004 4 <
ffff00014c2bf840 4040604354 C Ci:6:002:0 0 4 = 08faf00f
ffff00014c2bf840 4040604400 S Co:6:002:0 s 40 05 08ac 0000 0004 4 = 08faf00f
ffff00014c2bf840 4040604507 C Co:6:002:0 0 4 >
ffff00014c2bf840 4040604553 S Ci:6:002:0 s c0 05 08ac 0000 0004 4 <
ffff00014c2bf840 4040604674 C Ci:6:002:0 0 4 = 08faf00f
ffff00014c2bf840 4040604719 S Co:6:002:0 s 40 05 08ac 0000 0004 4 = 08faf00f
ffff00014c2bf840 4040604825 C Co:6:002:0 0 4 >
ffff00014c2bf840 4040604871 S Ci:6:002:0 s c0 05 08c4 0000 0004 4 <
ffff00014c2bf840 4040605009 C Ci:6:002:0 0 4 = 00000000
ffff00014c2bf840 4040605055 S Co:6:002:0 s 40 05 08c4 0000 0004 4 = 00000000
ffff00014c2bf840 4040605161 C Co:6:002:0 0 4 >
ffff00014c2bf840 4040605208 S Ci:6:002:0 s c0 05 0c00 0000 0004 4 <
ffff00014c2bf840 4040605329 C Ci:6:002:0 0 4 = 07000000
ffff00014c2bf840 4040605375 S Ci:6:002:0 s c0 05 08b0 0000 0004 4 <
ffff00014c2bf840 4040605486 C Ci:6:002:0 0 4 = 18060000
ffff00014c2bf840 4040605531 S Co:6:002:0 s 40 05 08b0 0000 0004 4 = 18060000
ffff00014c2bf840 4040605638 C Co:6:002:0 0 4 >
ffff00014c2bf840 4040605705 S Ci:6:002:0 s c0 05 0d04 0000 0004 4 <
ffff00014c2bf840 4040605825 C Ci:6:002:0 0 4 = 017d91b1
ffff00014c2bf840 4040605870 S Co:6:002:0 s 40 05 0c90 0000 0004 4 = 747d8101
ffff00014c2bf840 4040605977 C Co:6:002:0 0 4 >
ffff00014c2bf840 4040606037 S Ci:6:002:0 s c0 05 0e00 0000 0004 4 <
ffff00014c2bf840 4040606158 C Ci:6:002:0 0 4 = 07000000
ffff00014c2bf840 4040606203 S Ci:6:002:0 s c0 05 08b0 0000 0004 4 <
ffff00014c2bf840 4040606315 C Ci:6:002:0 0 4 = 18060000
ffff00014c2bf840 4040606359 S Co:6:002:0 s 40 05 08b0 0000 0004 4 = 18060000
ffff00014c2bf840 4040606466 C Co:6:002:0 0 4 >
ffff00014c2bf840 4040606533 S Ci:6:002:0 s c0 05 0d44 0000 0004 4 <
ffff00014c2bf840 4040606654 C Ci:6:002:0 0 4 = 017c90b1
ffff00014c2bf840 4040606699 S Co:6:002:0 s 40 05 0e90 0000 0004 4 = 017d8301
ffff00014c2bf840 4040606805 C Co:6:002:0 0 4 >
ffff00014c2bf840 4040606865 S Ci:6:002:0 s c0 05 08ac 0000 0004 4 <
ffff00014c2bf840 4040607005 C Ci:6:002:0 0 4 = 08faf00f
ffff00014c2bf840 4040607051 S Co:6:002:0 s 40 05 08ac 0000 0004 4 = 08faf00f
ffff00014c2bf840 4040607157 C Co:6:002:0 0 4 >
ffff00014c2bf840 4040607203 S Ci:6:002:0 s c0 05 08ac 0000 0004 4 <
ffff00014c2bf840 4040607324 C Ci:6:002:0 0 4 = 08faf00f
ffff00014c2bf840 4040607369 S Co:6:002:0 s 40 05 08ac 0000 0004 4 = 08faf00f
ffff00014c2bf840 4040607476 C Co:6:002:0 0 4 >
ffff00014c2bf840 4040607523 S Ci:6:002:0 s c0 05 08c4 0000 0004 4 <
ffff00014c2bf840 4040607644 C Ci:6:002:0 0 4 = 00000000
ffff00014c2bf840 4040607689 S Co:6:002:0 s 40 05 08c4 0000 0004 4 = 00000000
ffff00014c2bf840 4040607796 C Co:6:002:0 0 4 >
ffff00014c2bf840 4040607843 S Ci:6:002:0 s c0 05 0e00 0000 0004 4 <
ffff00014c2bf840 4040607963 C Ci:6:002:0 0 4 = 07000000
ffff00014c2bf840 4040608028 S Ci:6:002:0 s c0 05 08b0 0000 0004 4 <
ffff00014c2bf840 4040608086 C Ci:6:002:0 0 4 = 18060000
ffff00014c2bf840 4040608124 S Co:6:002:0 s 40 05 08b0 0000 0004 4 = 18060000
ffff00014c2bf840 4040608233 C Co:6:002:0 0 4 >
ffff00014c2bf840 4040608304 S Ci:6:002:0 s c0 05 0d44 0000 0004 4 <
ffff00014c2bf840 4040608425 C Ci:6:002:0 0 4 = 017d91b1
ffff00014c2bf840 4040608470 S Co:6:002:0 s 40 05 0e90 0000 0004 4 = 747d8101
ffff00014c2bf840 4040608576 C Co:6:002:0 0 4 >
ffff00014c2bf840 4040608636 S Ci:6:002:0 s c0 05 0668 0000 0002 2 <
ffff00014c2bf840 4040608758 C Ci:6:002:0 0 2 = 0010
ffff00014c2bf840 4040608804 S Co:6:002:0 s 40 05 0668 0000 0002 2 = 0010
ffff00014c2bf840 4040608910 C Co:6:002:0 0 2 >
ffff00014c2bf840 4040608956 S Co:6:002:0 s 40 05 0483 0000 0001 1 = 00
ffff00014c2bf840 4040609070 C Co:6:002:0 0 1 >
ffff00014c2bf840 4040609115 S Ci:6:002:0 s c0 05 0837 0000 0001 1 <
ffff00014c2bf840 4040609225 C Ci:6:002:0 0 1 = 00
ffff00014c2bf840 4040609271 S Ci:6:002:0 s c0 05 08ac 0000 0004 4 <
ffff00014c2bf840 4040609389 C Ci:6:002:0 0 4 = 08faf00f
ffff00014c2bf840 4040609434 S Co:6:002:0 s 40 05 08ac 0000 0004 4 = 08faf00f
ffff00014c2bf840 4040609540 C Co:6:002:0 0 4 >
ffff00014c2bf840 4040609587 S Ci:6:002:0 s c0 05 08c4 0000 0004 4 <
ffff00014c2bf840 4040609705 C Ci:6:002:0 0 4 = 00000000
ffff00014c2bf840 4040609750 S Co:6:002:0 s 40 05 08c4 0000 0004 4 = 00000000
ffff00014c2bf840 4040609856 C Co:6:002:0 0 4 >
ffff00014c2bf840 4040609902 S Ci:6:002:0 s c0 05 0848 0000 0004 4 <
ffff00014c2bf840 4040610020 C Ci:6:002:0 0 4 = 8bffd061
ffff00014c2bf840 4040610065 S Co:6:002:0 s 40 05 0848 0000 0004 4 = 8bffd061
ffff00014c2bf840 4040610171 C Co:6:002:0 0 4 >
ffff00014c2bf840 4040610217 S Ci:6:002:0 s c0 05 08ac 0000 0004 4 <
ffff00014c2bf840 4040610335 C Ci:6:002:0 0 4 = 08faf00f
ffff00014c2bf840 4040610380 S Co:6:002:0 s 40 05 08ac 0000 0004 4 = 08faf00f
ffff00014c2bf840 4040610498 C Co:6:002:0 0 4 >
ffff00014c2bf840 4040610545 S Ci:6:002:0 s c0 05 08ac 0000 0004 4 <
ffff00014c2bf840 4040610663 C Ci:6:002:0 0 4 = 08faf00f
ffff00014c2bf840 4040610708 S Co:6:002:0 s 40 05 08ac 0000 0004 4 = 08faf00f
ffff00014c2bf840 4040610814 C Co:6:002:0 0 4 >
ffff00014c2bf840 4040610860 S Ci:6:002:0 s c0 05 08c4 0000 0004 4 <
ffff00014c2bf840 4040610978 C Ci:6:002:0 0 4 = 00000000
ffff00014c2bf840 4040611024 S Co:6:002:0 s 40 05 08c4 0000 0004 4 = 00000000
ffff00014c2bf840 4040611131 C Co:6:002:0 0 4 >
ffff00014c2bf840 4040611177 S Ci:6:002:0 s c0 05 0c00 0000 0004 4 <
ffff00014c2bf840 4040611295 C Ci:6:002:0 0 4 = 07000000
ffff00014c2bf840 4040611339 S Ci:6:002:0 s c0 05 08b0 0000 0004 4 <
ffff00014c2bf840 4040611450 C Ci:6:002:0 0 4 = 18060000
ffff00014c2bf840 4040611496 S Co:6:002:0 s 40 05 08b0 0000 0004 4 = 18060000
ffff00014c2bf840 4040611627 C Co:6:002:0 0 4 >
ffff00014c2bf840 4040611692 S Ci:6:002:0 s c0 05 0d04 0000 0004 4 <
ffff00014c2bf840 4040611809 C Ci:6:002:0 0 4 = 747d93b1
ffff00014c2bf840 4040611855 S Co:6:002:0 s 40 05 0c90 0000 0004 4 = 747d8301
ffff00014c2bf840 4040611961 C Co:6:002:0 0 4 >
ffff00014c2bf840 4040612039 S Ci:6:002:0 s c0 05 0e00 0000 0004 4 <
ffff00014c2bf840 4040612164 C Ci:6:002:0 0 4 = 07000000
ffff00014c2bf840 4040612209 S Ci:6:002:0 s c0 05 08b0 0000 0004 4 <
ffff00014c2bf840 4040612328 C Ci:6:002:0 0 4 = 18060000
ffff00014c2bf840 4040612374 S Co:6:002:0 s 40 05 08b0 0000 0004 4 = 18060000
ffff00014c2bf840 4040612506 C Co:6:002:0 0 4 >
ffff00014c2bf840 4040612572 S Ci:6:002:0 s c0 05 0d44 0000 0004 4 <
ffff00014c2bf840 4040612689 C Ci:6:002:0 0 4 = 747d93b1
ffff00014c2bf840 4040612734 S Co:6:002:0 s 40 05 0e90 0000 0004 4 = 747d8301
ffff00014c2bf840 4040612841 C Co:6:002:0 0 4 >
ffff00014c2bf840 4040612902 S Ci:6:002:0 s c0 05 0073 0000 0001 1 <
ffff00014c2bf840 4040613021 C Ci:6:002:0 0 1 = 07
ffff00014c2bf840 4040613067 S Co:6:002:0 s 40 05 0073 0000 0001 1 = 07
ffff00014c2bf840 4040613173 C Co:6:002:0 0 1 >
ffff00014c2bf840 4040613245 S Ci:6:002:0 s c0 05 0c24 0000 0004 4 <
ffff00014c2bf840 4040613381 C Ci:6:002:0 0 4 = 20202020
ffff00014c2bf840 4040613427 S Co:6:002:0 s 40 05 0c24 0000 0004 4 = 2c2c2c2c
ffff00014c2bf840 4040613533 C Co:6:002:0 0 4 >
ffff00014c2bf840 4040613579 S Ci:6:002:0 s c0 05 0c28 0000 0004 4 <
ffff00014c2bf840 4040613697 C Ci:6:002:0 0 4 = 20201e1c
ffff00014c2bf840 4040613743 S Co:6:002:0 s 40 05 0c28 0000 0004 4 = 2c2c2a28
ffff00014c2bf840 4040613850 C Co:6:002:0 0 4 >
ffff00014c2bf840 4040613896 S Ci:6:002:0 s c0 05 0c2c 0000 0004 4 <
ffff00014c2bf840 4040614014 C Ci:6:002:0 0 4 = 20202020
ffff00014c2bf840 4040614060 S Co:6:002:0 s 40 05 0c2c 0000 0004 4 = 31313131
ffff00014c2bf840 4040614166 C Co:6:002:0 0 4 >
ffff00014c2bf840 4040614212 S Ci:6:002:0 s c0 05 0c30 0000 0004 4 <
ffff00014c2bf840 4040614331 C Ci:6:002:0 0 4 = 20201e1c
ffff00014c2bf840 4040614376 S Co:6:002:0 s 40 05 0c30 0000 0004 4 = 2f2d2b29
ffff00014c2bf840 4040614482 C Co:6:002:0 0 4 >
ffff00014c2bf840 4040614528 S Ci:6:002:0 s c0 05 0c34 0000 0004 4 <
ffff00014c2bf840 4040614647 C Ci:6:002:0 0 4 = 20202020
ffff00014c2bf840 4040614692 S Co:6:002:0 s 40 05 0c34 0000 0004 4 = 2d2d2d2d
ffff00014c2bf840 4040614798 C Co:6:002:0 0 4 >
ffff00014c2bf840 4040614844 S Ci:6:002:0 s c0 05 0c38 0000 0004 4 <
ffff00014c2bf840 4040614974 C Ci:6:002:0 0 4 = 201e1c1a
ffff00014c2bf840 4040615020 S Co:6:002:0 s 40 05 0c38 0000 0004 4 = 2d2b2927
ffff00014c2bf840 4040615131 C Co:6:002:0 0 4 >
ffff00014c2bf840 4040615177 S Ci:6:002:0 s c0 05 0c3c 0000 0004 4 <
ffff00014c2bf840 4040615296 C Ci:6:002:0 0 4 = 20202020
ffff00014c2bf840 4040615342 S Co:6:002:0 s 40 05 0c3c 0000 0004 4 = 31313131
ffff00014c2bf840 4040615449 C Co:6:002:0 0 4 >
ffff00014c2bf840 4040615495 S Ci:6:002:0 s c0 05 0c40 0000 0004 4 <
ffff00014c2bf840 4040615631 C Ci:6:002:0 0 4 = 20201e1c
ffff00014c2bf840 4040615676 S Co:6:002:0 s 40 05 0c40 0000 0004 4 = 2f2d2b29
ffff00014c2bf840 4040615783 C Co:6:002:0 0 4 >
ffff00014c2bf840 4040615830 S Ci:6:002:0 s c0 05 0c44 0000 0004 4 <
ffff00014c2bf840 4040615948 C Ci:6:002:0 0 4 = 1a181e1e
ffff00014c2bf840 4040615993 S Co:6:002:0 s 40 05 0c44 0000 0004 4 = 27272d2d
ffff00014c2bf840 4040616104 C Co:6:002:0 0 4 >
ffff00014c2bf840 4040616155 S Ci:6:002:0 s c0 05 0c48 0000 0004 4 <
ffff00014c2bf840 4040616280 C Ci:6:002:0 0 4 = 1e1e1e1e
ffff00014c2bf840 4040616324 S Co:6:002:0 s 40 05 0c48 0000 0004 4 = 2d2d2d2b
ffff00014c2bf840 4040616439 C Co:6:002:0 0 4 >
ffff00014c2bf840 4040616489 S Ci:6:002:0 s c0 05 0c4c 0000 0004 4 <
ffff00014c2bf840 4040616607 C Ci:6:002:0 0 4 = 1c1a1816
ffff00014c2bf840 4040616654 S Co:6:002:0 s 40 05 0c4c 0000 0004 4 = 29272525
ffff00014c2bf840 4040616769 C Co:6:002:0 0 4 >
ffff00014c2bf840 4040616814 S Ci:6:002:0 s c0 05 0c54 0000 0004 4 <
ffff00014c2bf840 4040616924 C Ci:6:002:0 0 4 = 120a0400
ffff00014c2bf840 4040616971 S Co:6:002:0 s 40 05 0c54 0000 0004 4 = 1f171100
ffff00014c2bf840 4040617084 C Co:6:002:0 0 4 >
ffff00014c2bf840 4040617129 S Ci:6:002:0 s c0 05 0e24 0000 0004 4 <
ffff00014c2bf840 4040617183 C Ci:6:002:0 0 4 = 1d1d1d1d
ffff00014c2bf840 4040617219 S Co:6:002:0 s 40 05 0e24 0000 0004 4 = 1e1e1e1e
ffff00014c2bf840 4040617250 C Co:6:002:0 0 4 >
ffff00014c2bf840 4040617286 S Ci:6:002:0 s c0 05 0e28 0000 0004 4 <
ffff00014c2bf840 4040617322 C Ci:6:002:0 0 4 = 1d1d1b19
ffff00014c2bf840 4040617505 S Co:6:002:0 s 40 05 0e28 0000 0004 4 = 1e1e1c1a
ffff00014c2bf840 4040617556 C Co:6:002:0 0 4 >
ffff00014c2bf840 4040617709 S Ci:6:002:0 s c0 05 0e2c 0000 0004 4 <
ffff00014c2bf840 4040617749 C Ci:6:002:0 0 4 = 1f1f1f1f
ffff00014c2bf840 4040617768 S Co:6:002:0 s 40 05 0e2c 0000 0004 4 = 23232323
ffff00014c2bf840 4040617810 C Co:6:002:0 0 4 >
ffff00014c2bf840 4040617846 S Ci:6:002:0 s c0 05 0e30 0000 0004 4 <
ffff00014c2bf840 4040617883 C Ci:6:002:0 0 4 = 1f1f1d1b
ffff00014c2bf840 4040618040 S Co:6:002:0 s 40 05 0e30 0000 0004 4 = 211f1d1b
ffff00014c2bf840 4040618148 C Co:6:002:0 0 4 >
ffff00014c2bf840 4040618338 S Ci:6:002:0 s c0 05 0e34 0000 0004 4 <
ffff00014c2bf840 4040618499 C Ci:6:002:0 0 4 = 1f1f1f1f
ffff00014c2bf840 4040618662 S Co:6:002:0 s 40 05 0e34 0000 0004 4 = 1f1f1f1f
ffff00014c2bf840 4040618774 C Co:6:002:0 0 4 >
ffff00014c2bf840 4040618828 S Ci:6:002:0 s c0 05 0e38 0000 0004 4 <
ffff00014c2bf840 4040618940 C Ci:6:002:0 0 4 = 1f1d1b19
ffff00014c2bf840 4040618986 S Co:6:002:0 s 40 05 0e38 0000 0004 4 = 1f1d1b19
ffff00014c2bf840 4040619092 C Co:6:002:0 0 4 >
ffff00014c2bf840 4040619140 S Ci:6:002:0 s c0 05 0e3c 0000 0004 4 <
ffff00014c2bf840 4040619261 C Ci:6:002:0 0 4 = 1f1f1f1f
ffff00014c2bf840 4040619306 S Co:6:002:0 s 40 05 0e3c 0000 0004 4 = 23232323
ffff00014c2bf840 4040619414 C Co:6:002:0 0 4 >
ffff00014c2bf840 4040619601 S Ci:6:002:0 s c0 05 0e40 0000 0004 4 <
ffff00014c2bf840 4040619728 C Ci:6:002:0 0 4 = 1f1f1d1b
ffff00014c2bf840 4040619785 S Co:6:002:0 s 40 05 0e40 0000 0004 4 = 211f1d1b
ffff00014c2bf840 4040619903 C Co:6:002:0 0 4 >
ffff00014c2bf840 4040619950 S Ci:6:002:0 s c0 05 0e44 0000 0004 4 <
ffff00014c2bf840 4040620060 C Ci:6:002:0 0 4 = 19171d1d
ffff00014c2bf840 4040620109 S Co:6:002:0 s 40 05 0e44 0000 0004 4 = 19191f1f
ffff00014c2bf840 4040620222 C Co:6:002:0 0 4 >
ffff00014c2bf840 4040620281 S Ci:6:002:0 s c0 05 0e48 0000 0004 4 <
ffff00014c2bf840 4040620404 C Ci:6:002:0 0 4 = 1d1d1d1d
ffff00014c2bf840 4040620585 S Co:6:002:0 s 40 05 0e48 0000 0004 4 = 1f1f1f1d
ffff00014c2bf840 4040620703 C Co:6:002:0 0 4 >
ffff00014c2bf840 4040620865 S Ci:6:002:0 s c0 05 0e4c 0000 0004 4 <
ffff00014c2bf840 4040620986 C Ci:6:002:0 0 4 = 1b191715
ffff00014c2bf840 4040621040 S Co:6:002:0 s 40 05 0e4c 0000 0004 4 = 1b191717
ffff00014c2bf840 4040621147 C Co:6:002:0 0 4 >
ffff00014c2bf840 4040621196 S Ci:6:002:0 s c0 05 0e54 0000 0004 4 <
ffff00014c2bf840 4040621320 C Ci:6:002:0 0 4 = 11090300
ffff00014c2bf840 4040621366 S Co:6:002:0 s 40 05 0e54 0000 0004 4 = 11090300
ffff00014c2bf840 4040621472 C Co:6:002:0 0 4 >
ffff000103533480 4040649767 C Bi:6:002:1 0 471 = 9f010484 00000f80 e70e6000 04300000 00000000 ba471201 20260000 47fbfb0f
ffff000103533480 4040649821 S Bi:6:002:1 -115 32768 <
ffff000103533240 4040652427 C Bi:6:002:1 0 479 = a7010484 00000f80 de096000 04300000 00000000 4f521201 20240000 43e6e60f
ffff000103533240 4040652455 S Bi:6:002:1 -115 32768 <
ffff000103533780 4040751099 C Bi:6:002:1 0 478 = a6010484 00000f80 180c6000 04300000 00000000 bad31301 20260000 44efef0f
ffff000103533780 4040751154 S Bi:6:002:1 -115 32768 <
ffff0001035330c0 4040753948 C Bi:6:002:1 0 469 = 9d010484 00000f80 93076000 04300000 00000000 c0de1301 20240000 45e6e60f
ffff0001035330c0 4040753984 S Bi:6:002:1 -115 32768 <
ffff000103533480 4040754854 C Bi:6:002:1 0 479 = a7010484 00000f80 df096000 04300000 00000000 5ce21301 22240000 48d5d50f
ffff000103533480 4040754880 S Bi:6:002:1 -115 32768 <
ffff00014c2bf840 4040764154 S Ci:6:002:0 s c0 05 004c 0000 0001 1 <
ffff00014c2bf840 4040764223 C Ci:6:002:0 0 1 = 20
ffff00014c2bf840 4040764246 S Co:6:002:0 s 40 05 004c 0000 0001 1 = 20
ffff00014c2bf840 4040764347 C Co:6:002:0 0 1 >
ffff000103533240 4040853533 C Bi:6:002:1 0 478 = a6010484 00000f80 190c6000 04300000 00000000 bc631501 20200000 46eeee0f
ffff000103533240 4040853579 S Bi:6:002:1 -115 32768 <
ffff000103533780 4040854543 C Bi:6:002:1 0 471 = 9f010484 00000f80 e90e6000 04300000 00000000 cf671501 20240000 47e5e50f
ffff000103533780 4040854568 S Bi:6:002:1 -115 32768 <
ffff0001035330c0 4040908210 C Bi:6:002:1 0 281 = e1000484 00000f00 3c006000 04300000 00000000 6c3a1601 64640000 c2e5e50f
ffff0001035330c0 4040908234 S Bi:6:002:1 -115 32768 <
ffff000103533480 4040957839 C Bi:6:002:1 0 446 = 86010484 00000f80 24036000 04300000 00000000 79fb1601 20220000 45efef0f
ffff000103533480 4040957895 S Bi:6:002:1 -115 32768 <
ffff000103533240 4041059022 C Bi:6:002:1 0 281 = e1000484 00000f00 3d006000 04300000 00000000 6b871801 62640000 bfe5e50f
ffff000103533240 4041059060 S Bi:6:002:1 -115 32768 <
ffff000103533780 4041061962 C Bi:6:002:1 0 479 = a7010484 00000f80 e2096000 04300000 00000000 13921801 20240000 49dede0f
ffff000103533780 4041062013 S Bi:6:002:1 -115 32768 <
ffff0001035330c0 4041179320 C Bi:6:002:1 0 281 = e1000484 00000f00 3e006000 04300000 00000000 845d1a01 64640000 c2e5e50f
ffff0001035330c0 4041179373 S Bi:6:002:1 -115 32768 <
ffff000103533480 4041264163 C Bi:6:002:1 0 471 = 9f010484 00000f80 ed0e6000 04300000 00000000 c5a71b01 20260000 46d6d60f
ffff000103533480 4041264202 S Bi:6:002:1 -115 32768 <
ffff000103533240 4041265913 C Bi:6:002:1 0 469 = 9d010484 00000f80 98076000 04300000 00000000 bcae1b01 20260000 47e1e10f
ffff000103533240 4041265940 S Bi:6:002:1 -115 32768 <
ffff000103533780 4041365562 C Bi:6:002:1 0 478 = a6010484 00000f80 1e0c6000 04300000 00000000 c1331d01 20240000 46e9e90f
ffff000103533780 4041365612 S Bi:6:002:1 -115 32768 <
ffff0001035330c0 4041368317 C Bi:6:002:1 0 469 = 9d010484 00000f80 99076000 04300000 00000000 bd3e1d01 20240000 42dbdb0f
ffff0001035330c0 4041368344 S Bi:6:002:1 -115 32768 <
ffff000103533480 4041467899 C Bi:6:002:1 0 478 = a6010484 00000f80 1f0c6000 04300000 00000000 c3c31e01 20220000 42d6d60f
ffff000103533480 4041467933 S Bi:6:002:1 -115 32768 <
ffff000103533240 4041471591 C Bi:6:002:1 0 479 = a7010484 00000f80 e6096000 04300000 00000000 26d21e01 20260000 4acece0f
ffff000103533240 4041471617 S Bi:6:002:1 -115 32768 <
ffff000103533780 4041559929 C Bi:6:002:1 0 281 = e1000484 00000f00 3f006000 04300000 00000000 282c2001 64640000 c2e5e50f
ffff000103533780 4041559966 S Bi:6:002:1 -115 32768 <
ffff0001035330c0 4041570310 C Bi:6:002:1 0 478 = a6010484 00000f80 200c6000 04300000 00000000 c4532001 20240000 46f2f20f
ffff0001035330c0 4041570341 S Bi:6:002:1 -115 32768 <
ffff000103533480 4041571340 C Bi:6:002:1 0 471 = 9f010484 00000f80 f00e6000 04300000 00000000 ce572001 20220000 47dada0f
ffff000103533480 4041571367 S Bi:6:002:1 -115 32768 <
ffff000103533240 4041574046 C Bi:6:002:1 0 479 = a7010484 00000f80 e7096000 04300000 00000000 54622001 1e200000 46e9e90f
ffff000103533240 4041574071 S Bi:6:002:1 -115 32768 <
ffff000103533780 4041676432 C Bi:6:002:1 0 479 = a7010484 00000f80 e8096000 04300000 00000000 52f22101 20240000 42d3d30f
ffff000103533780 4041676479 S Bi:6:002:1 -115 32768 <
ffff00014c2bf840 4041756255 S Ci:6:002:0 s c0 05 004c 0000 0001 1 <
ffff00014c2bf840 4041756318 C Ci:6:002:0 0 1 = 20
ffff00014c2bf840 4041756339 S Co:6:002:0 s 40 05 004c 0000 0001 1 = 20
ffff00014c2bf840 4041756447 C Co:6:002:0 0 1 >
ffff000103150540 4041756723 S Ci:6:002:0 s c0 05 0770 0000 0004 4 <
ffff000103150540 4041756881 C Ci:6:002:0 0 4 = 00000000
ffff000103150540 4041757032 S Ci:6:002:0 s c0 05 0774 0000 0004 4 <
ffff000103150540 4041757180 C Ci:6:002:0 0 4 = 00000000
ffff000103150540 4041757335 S Co:6:002:0 s 40 05 076e 0000 0001 1 = 0c
ffff000103150540 4041757474 C Co:6:002:0 0 1 >
ffff000103150540 4041757633 S Ci:6:002:0 s c0 05 0808 0000 0004 4 <
ffff000103150540 4041757780 C Ci:6:002:0 0 4 = 3382023e
ffff000103150540 4041757932 S Ci:6:002:0 s c0 05 0a5c 0000 0002 2 <
ffff000103150540 4041758056 C Ci:6:002:0 0 2 = 3700
ffff000103150540 4041758082 S Ci:6:002:0 s c0 05 0f48 0000 0002 2 <
ffff000103150540 4041758197 C Ci:6:002:0 0 2 = 0209
ffff000103150540 4041758227 S Ci:6:002:0 s c0 05 0f04 0000 0004 4 <
ffff000103150540 4041758338 C Ci:6:002:0 0 4 = 03000400
ffff000103150540 4041758368 S Ci:6:002:0 s c0 05 0f14 0000 0004 4 <
ffff000103150540 4041758494 C Ci:6:002:0 0 4 = 61003200
ffff000103150540 4041758524 S Ci:6:002:0 s c0 05 0f10 0000 0004 4 <
ffff000103150540 4041758636 C Ci:6:002:0 0 4 = 00000000
ffff000103150540 4041758665 S Ci:6:002:0 s c0 05 0f0c 0000 0004 4 <
ffff000103150540 4041758783 C Ci:6:002:0 0 4 = 00000000
ffff000103150540 4041758804 S Ci:6:002:0 s c0 05 0f08 0000 0004 4 <
ffff000103150540 4041758916 C Ci:6:002:0 0 4 = 4f009509
ffff000103150540 4041758944 S Ci:6:002:0 s c0 05 0fcc 0000 0004 4 <
ffff000103150540 4041759063 C Ci:6:002:0 0 4 = 00000000
ffff000103150540 4041759084 S Ci:6:002:0 s c0 05 09a4 0000 0004 4 <
ffff000103150540 4041759196 C Ci:6:002:0 0 4 = 80000800
ffff000103150540 4041759226 S Co:6:002:0 s 40 05 09a4 0000 0004 4 = 80000a00
ffff000103150540 4041759339 C Co:6:002:0 0 4 >
ffff000103150540 4041759360 S Ci:6:002:0 s c0 05 09a4 0000 0004 4 <
ffff000103150540 4041759472 C Ci:6:002:0 0 4 = 80000a00
ffff000103150540 4041759501 S Co:6:002:0 s 40 05 09a4 0000 0004 4 = 80000800
ffff000103150540 4041759618 C Co:6:002:0 0 4 >
ffff000103150540 4041759639 S Ci:6:002:0 s c0 05 0a2c 0000 0004 4 <
ffff000103150540 4041759751 C Ci:6:002:0 0 4 = 00809000
ffff000103150540 4041759781 S Co:6:002:0 s 40 05 0a2c 0000 0004 4 = 00009000
ffff000103150540 4041759888 C Co:6:002:0 0 4 >
ffff000103150540 4041759918 S Ci:6:002:0 s c0 05 0a2c 0000 0004 4 <
ffff000103150540 4041760029 C Ci:6:002:0 0 4 = 00009000
ffff000103150540 4041760069 S Co:6:002:0 s 40 05 0a2c 0000 0004 4 = 00809000
ffff000103150540 4041760184 C Co:6:002:0 0 4 >
ffff000103150540 4041760305 S Ci:6:002:0 s c0 05 0b58 0000 0004 4 <
ffff000103150540 4041760453 C Ci:6:002:0 0 4 = 00000000
ffff000103150540 4041760608 S Co:6:002:0 s 40 05 0b58 0000 0004 4 = 01000000
ffff000103150540 4041760752 C Co:6:002:0 0 4 >
ffff000103150540 4041760911 S Ci:6:002:0 s c0 05 0b58 0000 0004 4 <
ffff000103150540 4041761033 C Ci:6:002:0 0 4 = 01000000
ffff000103150540 4041761061 S Co:6:002:0 s 40 05 0b58 0000 0004 4 = 00000000
ffff000103150540 4041761176 C Co:6:002:0 0 4 >
ffff000103150540 4041761315 S Ci:6:002:0 s c0 05 01cc 0000 0001 1 <
ffff000103150540 4041761430 C Ci:6:002:0 0 1 = 00
ffff000103150540 4041761464 S Co:6:002:0 s 40 05 01f0 0000 0004 4 = 00000000
ffff000103150540 4041761571 C Co:6:002:0 0 4 >
ffff000103150540 4041761602 S Co:6:002:0 s 40 05 01d0 0000 0004 4 = 58000000
ffff000103150540 4041761709 C Co:6:002:0 0 4 >
ffff000103150540 4041761741 S Co:6:002:0 s 40 05 0440 0000 0004 4 = 00000000
ffff000103150540 4041761861 C Co:6:002:0 0 4 >
ffff000103150540 4041761893 S Ci:6:002:0 s c0 05 0c00 0000 0004 4 <
ffff000103150540 4041762008 C Ci:6:002:0 0 4 = 07000000
ffff000103150540 4041762033 S Ci:6:002:0 s c0 05 08b0 0000 0004 4 <
ffff000103150540 4041762147 C Ci:6:002:0 0 4 = 18060000
ffff000103150540 4041762177 S Co:6:002:0 s 40 05 08b0 0000 0004 4 = 42060000
ffff000103150540 4041762286 C Co:6:002:0 0 4 >
ffff000103150540 4041762328 S Ci:6:002:0 s c0 05 0d04 0000 0004 4 <
ffff000103150540 4041762441 C Ci:6:002:0 0 4 = 108d90b1
ffff000103150540 4041762462 S Co:6:002:0 s 40 05 0c90 0000 0004 4 = 108d2304
ffff000103150540 4041762570 C Co:6:002:0 0 4 >
ffff000103150540 4041762613 S Co:6:002:0 s 40 05 0280 0000 0002 2 = 0001
ffff000103150540 4041762714 C Co:6:002:0 0 2 >
ffff000103150540 4041762735 S Ci:6:002:0 s c0 05 010c 0000 0001 1 <
ffff000103150540 4041762847 C Ci:6:002:0 0 1 = b4
ffff000103150540 4041762877 S Co:6:002:0 s 40 05 010c 0000 0001 1 = b4
ffff000103150540 4041762994 C Co:6:002:0 0 1 >
ffff0001035330c0 4041775101 C Bi:6:002:1 0 478 = a6010484 00000f80 220c6000 04300000 00000000 c6732301 1c220000 46efef0f
ffff0001035330c0 4041775124 S Bi:6:002:1 -115 32768 <
ffff000103533480 4041777068 C Bi:6:002:1 0 446 = 86010484 00000f80 2c036000 04300000 00000000 8f7b2301 20240000 46e6e60f
ffff000103533480 4041777094 S Bi:6:002:1 -115 32768 <
ffff000103533240 4041778881 C Bi:6:002:1 0 479 = a7010484 00000f80 e9096000 04300000 00000000 82822301 20260000 48e5e50f
ffff000103533240 4041778907 S Bi:6:002:1 -115 32768 <
ffff000103533780 4041980915 C Bi:6:002:1 0 471 = 9f010484 00000f80 f40e6000 04300000 00000000 ce972601 20200000 48dede0f
ffff000103533780 4041980956 S Bi:6:002:1 -115 32768 <
ffff0001035330c0 4042289053 C Bi:6:002:1 0 446 = 86010484 00000f80 31036000 04300000 00000000 5b4b2b01 20200000 47fcfc0f
ffff0001035330c0 4042289088 S Bi:6:002:1 -115 32768 <
ffff000103533480 4042391442 C Bi:6:002:1 0 446 = 86010484 00000f80 32036000 04300000 00000000 5edb2c01 1c240000 45e0e00f
ffff000103533480 4042391473 S Bi:6:002:1 -115 32768 <
ffff000103533240 4042392326 C Bi:6:002:1 0 469 = 9d010484 00000f80 a3076000 04300000 00000000 ccde2c01 1c220000 4ae0e00f
ffff000103533240 4042392352 S Bi:6:002:1 -115 32768 <
ffff000103533780 4042471310 C Bi:6:002:1 0 281 = e1000484 00000f00 00006000 04300000 00000000 5b142e01 62620000 c0e5e50f
ffff000103533780 4042471342 S Bi:6:002:1 -115 32768 <
ffff0001035330c0 4042495702 C Bi:6:002:1 0 479 = a7010484 00000f80 f0096000 04300000 00000000 76722e01 20240000 47ecec0f
ffff0001035330c0 4042495734 S Bi:6:002:1 -115 32768 <
ffff000103533480 4042598106 C Bi:6:002:1 0 479 = a7010484 00000f80 f1096000 04300000 00000000 7e023001 20220000 46ecec0f
ffff000103533480 4042598140 S Bi:6:002:1 -115 32768 <
ffff000103150540 4042780182 S Ci:6:002:0 s c0 05 004c 0000 0001 1 <
ffff000103150540 4042780312 C Ci:6:002:0 0 1 = 20
ffff000103150540 4042780460 S Co:6:002:0 s 40 05 004c 0000 0001 1 = 20
ffff000103150540 4042780571 C Co:6:002:0 0 1 >
ffff000103533240 4042801962 C Bi:6:002:1 0 469 = 9d010484 00000f80 a7076000 04300000 00000000 de1e3301 20240000 42f1f10f
ffff000103533240 4042801993 S Bi:6:002:1 -115 32768 <
ffff000103533780 4042834139 C Bi:6:002:1 0 281 = e1000484 00000f00 01006000 04300000 00000000 889d3301 62620000 c2e6e60f
ffff000103533780 4042834191 S Bi:6:002:1 -115 32768 <
ffff0001035330c0 4043004978 C Bi:6:002:1 0 471 = 9f010484 00000f80 fe0e6000 04300000 00000000 e0373601 20240000 48f9f90f
ffff0001035330c0 4043005015 S Bi:6:002:1 -115 32768 <
ffff000103533480 4043413552 C Bi:6:002:1 0 478 = a6010484 00000f80 320c6000 04300000 00000000 d9733c01 20260000 46e8e80f
ffff000103533480 4043413580 S Bi:6:002:1 -115 32768 <
ffff000103533240 4043415405 C Bi:6:002:1 0 446 = 86010484 00000f80 3c036000 04300000 00000000 6f7b3c01 20260000 43f8f80f
ffff000103533240 4043415442 S Bi:6:002:1 -115 32768 <
ffff000103533780 4043417242 C Bi:6:002:1 0 479 = a7010484 00000f80 f9096000 04300000 00000000 54823c01 20240000 45e1e10f
ffff000103533780 4043417269 S Bi:6:002:1 -115 32768 <
ffff0001035330c0 4043500993 C Bi:6:002:1 0 281 = e1000484 00000f00 02006000 04300000 00000000 87ca3d01 62620000 c2e5e50f
ffff0001035330c0 4043501026 S Bi:6:002:1 -115 32768 <
ffff000103533480 4043515938 C Bi:6:002:1 0 478 = a6010484 00000f80 330c6000 04300000 00000000 da033e01 20220000 43dfdf0f
ffff000103533480 4043515964 S Bi:6:002:1 -115 32768 <
ffff000103533240 4043517841 C Bi:6:002:1 0 446 = 86010484 00000f80 3d036000 04300000 00000000 7f0b3e01 1c240000 48dfdf0f
ffff000103533240 4043517871 S Bi:6:002:1 -115 32768 <
