ffff000103533780 4049905996 C Bi:6:002:1 0 383 = 47010484 00000f80 420c6000 04300000 00000000 ab859f01 463e0000 87f6f601
ffff000103533780 4049906059 S Bi:6:002:1 -115 32768 <
ffff0001035330c0 4049907042 C Bi:6:002:1 0 376 = 40010484 00000f80 b0036000 04300000 00000000 ce899f01 463a0000 84ebeb01
ffff0001035330c0 4049907067 S Bi:6:002:1 -115 32768 <
ffff000103533480 4049907765 C Bi:6:002:1 0 351 = 27010484 00000f80 750d6000 04300000 00000000 198d9f01 463a0000 86efef01
ffff000103533480 4049907783 S Bi:6:002:1 -115 32768 <
ffff000103533240 4049908705 C Bi:6:002:1 0 374 = 3e010484 00000f80 48086000 04300000 00000000 58909f01 423a0000 86f1f101
ffff000103533240 4049908733 S Bi:6:002:1 -115 32768 <
ffff000103533780 4050009953 C Bi:6:002:1 0 383 = 47010484 00000f80 430c6000 04300000 00000000 9f1ba101 463a0000 87fbfb01
ffff000103533780 4050010008 S Bi:6:002:1 -115 32768 <
ffff0001035330c0 4050010748 C Bi:6:002:1 0 376 = 40010484 00000f80 b1036000 04300000 00000000 e71ea101 44380000 83f9f901
ffff0001035330c0 4050010776 S Bi:6:002:1 -115 32768 <
ffff000103533480 4050011502 C Bi:6:002:1 0 351 = 27010484 00000f80 760d6000 04300000 00000000 f721a101 463a0000 84f2f201
ffff000103533480 4050011527 S Bi:6:002:1 -115 32768 <
ffff000103533240 4050012282 C Bi:6:002:1 0 374 = 3e010484 00000f80 49086000 04300000 00000000 ea24a101 44380000 83f5f501
ffff000103533240 4050012307 S Bi:6:002:1 -115 32768 <
ffff000103533780 4050013113 C Bi:6:002:1 0 384 = 48010484 00000f80 190b6000 04300000 00000000 1828a101 46380000 85f4f401
ffff000103533780 4050013137 S Bi:6:002:1 -115 32768 <
ffff0001035330c0 4050077640 C Bi:6:002:1 0 377 = 41010484 00000f00 04096000 04300000 00000000 4324a201 443a0000 88f5f501
ffff0001035330c0 4050077676 S Bi:6:002:1 -115 32768 <
ffff000103533480 4050078281 C Bi:6:002:1 0 377 = 41010484 00000f00 04096000 04300000 00000000 a826a201 46380000 88fafa01
ffff000103533480 4050078307 S Bi:6:002:1 -115 32768 <
ffff000103533240 4050078880 C Bi:6:002:1 0 377 = 41010484 00000f00 04096000 04300000 00000000 0d29a201 443a0000 85f8f801
ffff000103533240 4050078905 S Bi:6:002:1 -115 32768 <
ffff000103533780 4050079488 C Bi:6:002:1 0 370 = 3a010484 00000f00 42016000 04300000 00000000 842ba201 463a0000 87fcfc01
ffff000103533780 4050079509 S Bi:6:002:1 -115 32768 <
ffff0001035330c0 4050086025 C Bi:6:002:1 0 345 = 21010484 00000f00 75046000 04300000 00000000 2c45a201 463a0000 86eeee01
ffff0001035330c0 4050086054 S Bi:6:002:1 -115 32768 <
ffff000103533480 4050086661 C Bi:6:002:1 0 345 = 21010484 00000f00 75046000 04300000 00000000 9647a201 443a0000 83f8f801
ffff000103533480 4050086688 S Bi:6:002:1 -115 32768 <
ffff000103533240 4050087248 C Bi:6:002:1 0 345 = 21010484 00000f00 75046000 04300000 00000000 e549a201 443a0000 86f8f801
ffff000103533240 4050087273 S Bi:6:002:1 -115 32768 <
ffff000103533780 4050087890 C Bi:6:002:1 0 345 = 21010484 00000f00 75046000 04300000 00000000 bc4ca201 44360000 84e7e701
ffff000103533780 4050087907 S Bi:6:002:1 -115 32768 <
ffff0001035330c0 4050088597 C Bi:6:002:1 0 378 = 42010484 00000f00 25066000 04300000 00000000 024fa201 443a0000 85f5f501
ffff0001035330c0 4050088623 S Bi:6:002:1 -115 32768 <
ffff000103533480 4050089230 C Bi:6:002:1 0 378 = 42010484 00000f00 25066000 04300000 00000000 7451a201 443a0000 86f9f901
ffff000103533480 4050089256 S Bi:6:002:1 -115 32768 <
ffff000103533240 4050089901 C Bi:6:002:1 0 378 = 42010484 00000f00 25066000 04300000 00000000 1654a201 44380000 85ecec01
ffff000103533240 4050089925 S Bi:6:002:1 -115 32768 <
ffff000103533780 4050090520 C Bi:6:002:1 0 378 = 42010484 00000f00 25066000 04300000 00000000 9156a201 443a0000 85fafa01
ffff000103533780 4050090544 S Bi:6:002:1 -115 32768 <
ffff0001035330c0 4050117508 C Bi:6:002:1 0 351 = 27010484 00000f80 770d6000 04300000 00000000 20c0a201 463a0000 83f5f501
ffff0001035330c0 4050117556 S Bi:6:002:1 -115 32768 <
ffff000103533480 4050213600 C Bi:6:002:1 0 383 = 47010484 00000f80 450c6000 04300000 00000000 2737a401 463a0000 88f5f501
ffff000103533480 4050213655 S Bi:6:002:1 -115 32768 <
ffff000103533240 4050214434 C Bi:6:002:1 0 376 = 40010484 00000f80 b3036000 04300000 00000000 873aa401 44360000 84ecec01
ffff000103533240 4050214460 S Bi:6:002:1 -115 32768 <
ffff000103533780 4050215187 C Bi:6:002:1 0 351 = 27010484 00000f80 780d6000 04300000 00000000 a03da401 40380000 82f7f701
ffff000103533780 4050215213 S Bi:6:002:1 -115 32768 <
ffff0001035330c0 4050216008 C Bi:6:002:1 0 374 = 3e010484 00000f80 4b086000 04300000 00000000 b940a401 443a0000 84eaea01
ffff0001035330c0 4050216033 S Bi:6:002:1 -115 32768 <
ffff000103533480 4050303014 C Bi:6:002:1 0 377 = 41010484 00000f00 05096000 04300000 00000000 7694a501 443a0000 82f2f201
ffff000103533480 4050303048 S Bi:6:002:1 -115 32768 <
ffff000103533240 4050303632 C Bi:6:002:1 0 377 = 41010484 00000f00 05096000 04300000 00000000 ff96a501 463a0000 88ecec01
ffff000103533240 4050303658 S Bi:6:002:1 -115 32768 <
ffff000103533780 4050304250 C Bi:6:002:1 0 377 = 41010484 00000f00 05096000 04300000 00000000 6499a501 483a0000 86f1f101
ffff000103533780 4050304275 S Bi:6:002:1 -115 32768 <
ffff0001035330c0 4050304872 C Bi:6:002:1 0 377 = 41010484 00000f00 05096000 04300000 00000000 d49ba501 463c0000 89f7f701
ffff0001035330c0 4050304895 S Bi:6:002:1 -115 32768 <
ffff000103533480 4050305515 C Bi:6:002:1 0 370 = 3a010484 00000f00 43016000 04300000 00000000 5d9ea501 443c0000 86f2f201
ffff000103533480 4050305540 S Bi:6:002:1 -115 32768 <
ffff000103533240 4050306739 C Bi:6:002:1 0 370 = 3a010484 00000f00 43016000 04300000 00000000 29a3a501 443a0000 86f1f101
ffff000103533240 4050306764 S Bi:6:002:1 -115 32768 <
ffff000103533780 4050307356 C Bi:6:002:1 0 370 = 3a010484 00000f00 43016000 04300000 00000000 8fa5a501 443a0000 880b0b01
ffff000103533780 4050307415 S Bi:6:002:1 -115 32768 <
ffff0001035330c0 4050307938 C Bi:6:002:1 0 345 = 21010484 00000f00 76046000 04300000 00000000 f5a7a501 443a0000 88e9e901
ffff0001035330c0 4050307962 S Bi:6:002:1 -115 32768 <
ffff000103533480 4050308501 C Bi:6:002:1 0 345 = 21010484 00000f00 76046000 04300000 00000000 3baaa501 463a0000 87ecec01
ffff000103533480 4050308523 S Bi:6:002:1 -115 32768 <
ffff000103533240 4050309065 C Bi:6:002:1 0 345 = 21010484 00000f00 76046000 04300000 00000000 78aca501 46360000 87fdfd01
ffff000103533240 4050309085 S Bi:6:002:1 -115 32768 <
ffff000103533780 4050309661 C Bi:6:002:1 0 345 = 21010484 00000f00 76046000 04300000 00000000 beaea501 463a0000 88f5f501
ffff000103533780 4050309680 S Bi:6:002:1 -115 32768 <
ffff0001035330c0 4050310284 C Bi:6:002:1 0 378 = 42010484 00000f00 26066000 04300000 00000000 04b1a501 42360000 85eded01
ffff0001035330c0 4050310305 S Bi:6:002:1 -115 32768 <
ffff000103533480 4050310949 C Bi:6:002:1 0 378 = 42010484 00000f00 26066000 04300000 00000000 7fb3a501 44380000 86efef01
ffff000103533480 4050310974 S Bi:6:002:1 -115 32768 <
ffff000103533240 4050312038 C Bi:6:002:1 0 378 = 42010484 00000f00 26066000 04300000 00000000 d7b7a501 463e0000 83eded01
ffff000103533240 4050312061 S Bi:6:002:1 -115 32768 <
ffff000103533780 4050313379 C Bi:6:002:1 0 378 = 42010484 00000f00 26066000 04300000 00000000 0bbda501 44380000 85f5f501
ffff000103533780 4050313404 S Bi:6:002:1 -115 32768 <
ffff0001035330c0 4050315577 C Bi:6:002:1 0 383 = 47010484 00000f80 460c6000 04300000 00000000 b1c5a501 463a0000 86f7f701
ffff0001035330c0 4050315599 S Bi:6:002:1 -115 32768 <
ffff000103533480 4050316633 C Bi:6:002:1 0 376 = 40010484 00000f80 b4036000 04300000 00000000 d3c9a501 42360000 87f4f401
ffff000103533480 4050316682 S Bi:6:002:1 -115 32768 <
ffff000103533240 4050317605 C Bi:6:002:1 0 351 = 27010484 00000f80 790d6000 04300000 00000000 afcda501 443a0000 87f1f101
ffff000103533240 4050317631 S Bi:6:002:1 -115 32768 <
ffff000103533780 4050318487 C Bi:6:002:1 0 374 = 3e010484 00000f80 4c086000 04300000 00000000 10d1a501 443a0000 84fcfc01
ffff000103533780 4050318510 S Bi:6:002:1 -115 32768 <
ffff0001035330c0 4050319324 C Bi:6:002:1 0 384 = 48010484 00000f80 1c0b6000 04300000 00000000 32d4a501 443a0000 88f7f701
ffff0001035330c0 4050319349 S Bi:6:002:1 -115 32768 <
ffff000103533480 4050325840 C Bi:6:002:1 0 377 = 41010484 00000f00 06096000 04300000 00000000 b4eda501 44320000 81fbfb01
ffff000103533480 4050325864 S Bi:6:002:1 -115 32768 <
ffff000103533240 4050334413 C Bi:6:002:1 0 378 = 42010484 00000f00 27066000 04300000 00000000 340fa601 443c0000 86f5f501
ffff000103533240 4050334442 S Bi:6:002:1 -115 32768 <
ffff000103533780 4050418025 C Bi:6:002:1 0 383 = 47010484 00000f80 470c6000 04300000 00000000 b355a701 443e0000 88f5f501
ffff000103533780 4050418059 S Bi:6:002:1 -115 32768 <
ffff0001035330c0 4050418945 C Bi:6:002:1 0 376 = 40010484 00000f80 b5036000 04300000 00000000 8359a701 44360000 84fcfc01
ffff0001035330c0 4050418967 S Bi:6:002:1 -115 32768 <
ffff000103533480 4050419785 C Bi:6:002:1 0 351 = 27010484 00000f80 7a0d6000 04300000 00000000 e05ca701 44380000 87f4f401
ffff000103533480 4050419805 S Bi:6:002:1 -115 32768 <
ffff000103533240 4050422117 C Bi:6:002:1 0 374 = 3e010484 00000f80 4d086000 04300000 00000000 e965a701 44380000 83f7f701
ffff000103533240 4050422165 S Bi:6:002:1 -115 32768 <
ffff000103533780 4050424430 C Bi:6:002:1 0 384 = 48010484 00000f80 1d0b6000 04300000 00000000 b66ea701 463a0000 86f8f801
ffff000103533780 4050424458 S Bi:6:002:1 -115 32768 <
ffff0001035330c0 4050521919 C Bi:6:002:1 0 383 = 47010484 00000f80 480c6000 04300000 00000000 a4eba801 463c0000 80ffff01
ffff0001035330c0 4050521957 S Bi:6:002:1 -115 32768 <
ffff000103533480 4050524501 C Bi:6:002:1 0 351 = 27010484 00000f80 7b0d6000 04300000 00000000 c9f5a801 44380000 86eded01
ffff000103533480 4050524558 S Bi:6:002:1 -115 32768 <
ffff000103533240 4050526134 C Bi:6:002:1 0 374 = 3e010484 00000f80 4e086000 04300000 00000000 29fca801 443a0000 84ecec01
ffff000103533240 4050526160 S Bi:6:002:1 -115 32768 <
ffff000103533780 4050527832 C Bi:6:002:1 0 384 = 48010484 00000f80 1e0b6000 04300000 00000000 b902a901 46380000 87f0f001
ffff000103533780 4050527857 S Bi:6:002:1 -115 32768 <
ffff0001035330c0 4050625562 C Bi:6:002:1 0 383 = 47010484 00000f80 490c6000 04300000 00000000 8b80aa01 463a0000 87f1f101
ffff0001035330c0 4050625589 S Bi:6:002:1 -115 32768 <
ffff000103533480 4050627567 C Bi:6:002:1 0 376 = 40010484 00000f80 b7036000 04300000 00000000 5a88aa01 463c0000 87f2f201
ffff000103533480 4050627594 S Bi:6:002:1 -115 32768 <
ffff000103533240 4050629554 C Bi:6:002:1 0 351 = 27010484 00000f80 7c0d6000 04300000 00000000 2a90aa01 443a0000 88f4f401
ffff000103533240 4050629610 S Bi:6:002:1 -115 32768 <
ffff000103533780 4050710507 C Bi:6:002:1 0 310 = fe000484 00000f80 a2016000 00300000 00000000 f2c5ab01 38380000 39520001
ffff000103533780 4050710535 S Bi:6:002:1 -115 32768 <
ffff0001035330c0 4050725179 C Bi:6:002:1 0 383 = 47010484 00000f80 4a0c6000 04300000 00000000 b705ac01 443a0000 86eaea01
ffff0001035330c0 4050725204 S Bi:6:002:1 -115 32768 <
ffff000103533480 4050729581 C Bi:6:002:1 0 376 = 40010484 00000f80 b8036000 04300000 00000000 cc16ac01 463c0000 86f1f101
ffff000103533480 4050729608 S Bi:6:002:1 -115 32768 <
ffff000103533240 4050733587 C Bi:6:002:1 0 374 = 3e010484 00000f80 50086000 04300000 00000000 6b26ac01 443a0000 86f1f101
ffff000103533240 4050733644 S Bi:6:002:1 -115 32768 <
ffff000103533780 4050734104 C Bi:6:002:1 0 370 = 3a010484 00000f00 45016000 04300000 00000000 8d28ac01 463a0000 88f7f701
ffff000103533780 4050734129 S Bi:6:002:1 -115 32768 <
ffff0001035330c0 4050734650 C Bi:6:002:1 0 384 = 48010484 00000f80 200b6000 04300000 00000000 a12aac01 463a0000 87f5f501
ffff0001035330c0 4050734675 S Bi:6:002:1 -115 32768 <
ffff0001031510c0 4050812136 S Ci:6:002:0 s c0 05 004c 0000 0001 1 <
ffff0001031510c0 4050812267 C Ci:6:002:0 0 1 = 20
ffff0001031510c0 4050812392 S Co:6:002:0 s 40 05 004c 0000 0001 1 = 20
ffff0001031510c0 4050812453 C Co:6:002:0 0 1 >
ffff000103533480 4050829121 C Bi:6:002:1 0 383 = 47010484 00000f80 4b0c6000 04300000 00000000 a89bad01 44340000 83e9e901
ffff000103533480 4050829151 S Bi:6:002:1 -115 32768 <
ffff000103533240 4050829926 C Bi:6:002:1 0 376 = 40010484 00000f80 b9036000 04300000 00000000 eb9ead01 46380000 87ffff01
ffff000103533240 4050829947 S Bi:6:002:1 -115 32768 <
ffff000103533780 4050830675 C Bi:6:002:1 0 351 = 27010484 00000f80 7e0d6000 04300000 00000000 f9a1ad01 443a0000 85efef01
ffff000103533780 4050830695 S Bi:6:002:1 -115 32768 <
ffff0001035330c0 4050831482 C Bi:6:002:1 0 374 = 3e010484 00000f80 51086000 04300000 00000000 06a5ad01 463c0000 88e8e801
ffff0001035330c0 4050831502 S Bi:6:002:1 -115 32768 <
ffff000103533480 4050832313 C Bi:6:002:1 0 384 = 48010484 00000f80 210b6000 04300000 00000000 33a8ad01 46340000 87f2f201
ffff000103533480 4050832333 S Bi:6:002:1 -115 32768 <
ffff000103151e40 4050843068 S Ci:6:002:0 s c0 05 0454 0000 0001 1 <
ffff000103151e40 4050843213 C Ci:6:002:0 0 1 = 00
ffff000103151e40 4050843254 S Ci:6:002:0 s c0 05 0860 0000 0004 4 <
ffff000103151e40 4050843354 C Ci:6:002:0 0 4 = 21c3d572
ffff000103151e40 4050843400 S Co:6:002:0 s 40 05 0860 0000 0004 4 = 21c3d572
ffff000103151e40 4050843521 C Co:6:002:0 0 4 >
ffff000103151e40 4050843554 S Ci:6:002:0 s c0 05 0c00 0000 0004 4 <
ffff000103151e40 4050843659 C Ci:6:002:0 0 4 = 07000000
ffff000103151e40 4050843694 S Ci:6:002:0 s c0 05 08b0 0000 0004 4 <
ffff000103151e40 4050843807 C Ci:6:002:0 0 4 = 42060000
ffff000103151e40 4050843854 S Co:6:002:0 s 40 05 08b0 0000 0004 4 = 18060000
ffff000103151e40 4050843959 C Co:6:002:0 0 4 >
ffff000103151e40 4050844050 S Ci:6:002:0 s c0 05 0d04 0000 0004 4 <
ffff000103151e40 4050844192 C Ci:6:002:0 0 4 = 017c90b1
ffff000103151e40 4050844238 S Co:6:002:0 s 40 05 0c90 0000 0004 4 = 017c8001
ffff000103151e40 4050844350 C Co:6:002:0 0 4 >
ffff000103151e40 4050844410 S Ci:6:002:0 s c0 05 08ac 0000 0004 4 <
ffff000103151e40 4050844533 C Ci:6:002:0 0 4 = 08faf00f
ffff000103151e40 4050844578 S Co:6:002:0 s 40 05 08ac 0000 0004 4 = 08faf00f
ffff000103151e40 4050844684 C Co:6:002:0 0 4 >
ffff000103151e40 4050844731 S Ci:6:002:0 s c0 05 08ac 0000 0004 4 <
ffff000103151e40 4050844851 C Ci:6:002:0 0 4 = 08faf00f
ffff000103151e40 4050844899 S Co:6:002:0 s 40 05 08ac 0000 0004 4 = 08faf00f
ffff000103151e40 4050845017 C Co:6:002:0 0 4 >
ffff000103151e40 4050845067 S Ci:6:002:0 s c0 05 08c4 0000 0004 4 <
ffff000103151e40 4050845188 C Ci:6:002:0 0 4 = 00000000
ffff000103151e40 4050845233 S Co:6:002:0 s 40 05 08c4 0000 0004 4 = 00000000
ffff000103151e40 4050845339 C Co:6:002:0 0 4 >
ffff000103151e40 4050845386 S Ci:6:002:0 s c0 05 0c00 0000 0004 4 <
ffff000103151e40 4050845523 C Ci:6:002:0 0 4 = 07000000
ffff000103151e40 4050845567 S Ci:6:002:0 s c0 05 08b0 0000 0004 4 <
ffff000103151e40 4050845679 C Ci:6:002:0 0 4 = 18060000
ffff000103151e40 4050845724 S Co:6:002:0 s 40 05 08b0 0000 0004 4 = 18060000
ffff000103151e40 4050845830 C Co:6:002:0 0 4 >
ffff000103151e40 4050845898 S Ci:6:002:0 s c0 05 0d04 0000 0004 4 <
ffff000103151e40 4050846027 C Ci:6:002:0 0 4 = 017c90b1
ffff000103151e40 4050846073 S Co:6:002:0 s 40 05 0c90 0000 0004 4 = 017c8001
ffff000103151e40 4050846179 C Co:6:002:0 0 4 >
ffff000103151e40 4050846239 S Ci:6:002:0 s c0 05 0e00 0000 0004 4 <
ffff000103151e40 4050846358 C Ci:6:002:0 0 4 = 07000000
ffff000103151e40 4050846404 S Ci:6:002:0 s c0 05 08b0 0000 0004 4 <
ffff000103151e40 4050846526 C Ci:6:002:0 0 4 = 18060000
ffff000103151e40 4050846571 S Co:6:002:0 s 40 05 08b0 0000 0004 4 = 18060000
ffff000103151e40 4050846677 C Co:6:002:0 0 4 >
ffff000103151e40 4050846745 S Ci:6:002:0 s c0 05 0d44 0000 0004 4 <
ffff000103151e40 4050846866 C Ci:6:002:0 0 4 = 017c90b1
ffff000103151e40 4050846911 S Co:6:002:0 s 40 05 0e90 0000 0004 4 = 017c8001
ffff000103151e40 4050847022 C Co:6:002:0 0 4 >
ffff000103151e40 4050847082 S Ci:6:002:0 s c0 05 08ac 0000 0004 4 <
ffff000103151e40 4050847202 C Ci:6:002:0 0 4 = 08faf00f
ffff000103151e40 4050847248 S Co:6:002:0 s 40 05 08ac 0000 0004 4 = 08faf00f
ffff000103151e40 4050847354 C Co:6:002:0 0 4 >
ffff000103151e40 4050847400 S Ci:6:002:0 s c0 05 08ac 0000 0004 4 <
ffff000103151e40 4050847527 C Ci:6:002:0 0 4 = 08faf00f
ffff000103151e40 4050847572 S Co:6:002:0 s 40 05 08ac 0000 0004 4 = 08faf00f
ffff000103151e40 4050847679 C Co:6:002:0 0 4 >
ffff000103151e40 4050847725 S Ci:6:002:0 s c0 05 08c4 0000 0004 4 <
ffff000103151e40 4050847846 C Ci:6:002:0 0 4 = 00000000
ffff000103151e40 4050847891 S Co:6:002:0 s 40 05 08c4 0000 0004 4 = 00000000
ffff000103151e40 4050847997 C Co:6:002:0 0 4 >
ffff000103151e40 4050848045 S Ci:6:002:0 s c0 05 0e00 0000 0004 4 <
ffff000103151e40 4050848175 C Ci:6:002:0 0 4 = 07000000
ffff000103151e40 4050848226 S Ci:6:002:0 s c0 05 08b0 0000 0004 4 <
ffff000103151e40 4050848345 C Ci:6:002:0 0 4 = 18060000
ffff000103151e40 4050848390 S Co:6:002:0 s 40 05 08b0 0000 0004 4 = 18060000
ffff000103151e40 4050848497 C Co:6:002:0 0 4 >
ffff000103151e40 4050848565 S Ci:6:002:0 s c0 05 0d44 0000 0004 4 <
ffff000103151e40 4050848686 C Ci:6:002:0 0 4 = 017c90b1
ffff000103151e40 4050848732 S Co:6:002:0 s 40 05 0e90 0000 0004 4 = 017c8001
ffff000103151e40 4050848838 C Co:6:002:0 0 4 >
ffff000103151e40 4050848898 S Ci:6:002:0 s c0 05 0668 0000 0002 2 <
ffff000103151e40 4050849027 C Ci:6:002:0 0 2 = 0010
ffff000103151e40 4050849072 S Co:6:002:0 s 40 05 0668 0000 0002 2 = 0010
ffff000103151e40 4050849179 C Co:6:002:0 0 2 >
ffff000103151e40 4050849226 S Co:6:002:0 s 40 05 0483 0000 0001 1 = 00
ffff000103151e40 4050849339 C Co:6:002:0 0 1 >
ffff000103151e40 4050849384 S Ci:6:002:0 s c0 05 0837 0000 0001 1 <
ffff000103151e40 4050849493 C Ci:6:002:0 0 1 = 00
ffff000103151e40 4050849539 S Ci:6:002:0 s c0 05 08ac 0000 0004 4 <
ffff000103151e40 4050849655 C Ci:6:002:0 0 4 = 08faf00f
ffff000103151e40 4050849701 S Co:6:002:0 s 40 05 08ac 0000 0004 4 = 08faf00f
ffff000103151e40 4050849806 C Co:6:002:0 0 4 >
ffff000103151e40 4050849853 S Ci:6:002:0 s c0 05 08c4 0000 0004 4 <
ffff000103151e40 4050849970 C Ci:6:002:0 0 4 = 00000000
ffff000103151e40 4050850015 S Co:6:002:0 s 40 05 08c4 0000 0004 4 = 00000000
ffff000103151e40 4050850121 C Co:6:002:0 0 4 >
ffff000103151e40 4050850168 S Ci:6:002:0 s c0 05 0848 0000 0004 4 <
ffff000103151e40 4050850285 C Ci:6:002:0 0 4 = 8bffd061
ffff000103151e40 4050850330 S Co:6:002:0 s 40 05 0848 0000 0004 4 = 8bffd061
ffff000103151e40 4050850436 C Co:6:002:0 0 4 >
ffff000103151e40 4050850483 S Ci:6:002:0 s c0 05 08ac 0000 0004 4 <
ffff000103151e40 4050850600 C Ci:6:002:0 0 4 = 08faf00f
ffff000103151e40 4050850646 S Co:6:002:0 s 40 05 08ac 0000 0004 4 = 08faf00f
ffff000103151e40 4050850764 C Co:6:002:0 0 4 >
ffff000103151e40 4050850811 S Ci:6:002:0 s c0 05 08ac 0000 0004 4 <
ffff000103151e40 4050850928 C Ci:6:002:0 0 4 = 08faf00f
ffff000103151e40 4050850973 S Co:6:002:0 s 40 05 08ac 0000 0004 4 = 08faf00f
ffff000103151e40 4050851079 C Co:6:002:0 0 4 >
ffff000103151e40 4050851125 S Ci:6:002:0 s c0 05 08c4 0000 0004 4 <
ffff000103151e40 4050851243 C Ci:6:002:0 0 4 = 00000000
ffff000103151e40 4050851288 S Co:6:002:0 s 40 05 08c4 0000 0004 4 = 00000000
ffff000103151e40 4050851396 C Co:6:002:0 0 4 >
ffff000103151e40 4050851443 S Ci:6:002:0 s c0 05 0c00 0000 0004 4 <
ffff000103151e40 4050851560 C Ci:6:002:0 0 4 = 07000000
ffff000103151e40 4050851606 S Ci:6:002:0 s c0 05 08b0 0000 0004 4 <
ffff000103151e40 4050851715 C Ci:6:002:0 0 4 = 18060000
ffff000103151e40 4050851760 S Co:6:002:0 s 40 05 08b0 0000 0004 4 = 18060000
ffff000103151e40 4050851867 C Co:6:002:0 0 4 >
ffff000103151e40 4050851934 S Ci:6:002:0 s c0 05 0d04 0000 0004 4 <
ffff000103151e40 4050852052 C Ci:6:002:0 0 4 = 017c90b1
ffff000103151e40 4050852098 S Co:6:002:0 s 40 05 0c90 0000 0004 4 = 017c8001
ffff000103151e40 4050852212 C Co:6:002:0 0 4 >
ffff000103151e40 4050852273 S Ci:6:002:0 s c0 05 0e00 0000 0004 4 <
ffff000103151e40 4050852401 C Ci:6:002:0 0 4 = 07000000
ffff000103151e40 4050852446 S Ci:6:002:0 s c0 05 08b0 0000 0004 4 <
ffff000103151e40 4050852555 C Ci:6:002:0 0 4 = 18060000
ffff000103151e40 4050852601 S Co:6:002:0 s 40 05 08b0 0000 0004 4 = 18060000
ffff000103151e40 4050852707 C Co:6:002:0 0 4 >
ffff000103151e40 4050852775 S Ci:6:002:0 s c0 05 0d44 0000 0004 4 <
ffff000103151e40 4050852900 C Ci:6:002:0 0 4 = 017c90b1
ffff000103151e40 4050852946 S Co:6:002:0 s 40 05 0e90 0000 0004 4 = 017c8001
ffff000103151e40 4050853052 C Co:6:002:0 0 4 >
ffff000103151e40 4050853133 S Ci:6:002:0 s c0 05 0c20 0000 0004 4 <
ffff000103151e40 4050853268 C Ci:6:002:0 0 4 = 13131313
ffff000103151e40 4050853313 S Co:6:002:0 s 40 05 0c20 0000 0004 4 = 13131313
ffff000103151e40 4050853420 C Co:6:002:0 0 4 >
ffff000103151e40 4050853470 S Ci:6:002:0 s c0 05 0c24 0000 0004 4 <
ffff000103151e40 4050853600 C Ci:6:002:0 0 4 = 20202020
ffff000103151e40 4050853646 S Co:6:002:0 s 40 05 0c24 0000 0004 4 = 20202020
ffff000103151e40 4050853764 C Co:6:002:0 0 4 >
ffff000103151e40 4050853810 S Ci:6:002:0 s c0 05 0c28 0000 0004 4 <
ffff000103151e40 4050853928 C Ci:6:002:0 0 4 = 20201e1c
ffff000103151e40 4050853974 S Co:6:002:0 s 40 05 0c28 0000 0004 4 = 20201e1c
ffff000103151e40 4050854081 C Co:6:002:0 0 4 >
ffff000103151e40 4050854127 S Ci:6:002:0 s c0 05 0c2c 0000 0004 4 <
ffff000103151e40 4050854245 C Ci:6:002:0 0 4 = 20202020
ffff000103151e40 4050854290 S Co:6:002:0 s 40 05 0c2c 0000 0004 4 = 20202020
ffff000103151e40 4050854396 C Co:6:002:0 0 4 >
ffff000103151e40 4050854443 S Ci:6:002:0 s c0 05 0c30 0000 0004 4 <
ffff000103151e40 4050854561 C Ci:6:002:0 0 4 = 20201e1c
ffff000103151e40 4050854606 S Co:6:002:0 s 40 05 0c30 0000 0004 4 = 20201e1c
ffff000103151e40 4050854712 C Co:6:002:0 0 4 >
ffff000103151e40 4050854759 S Ci:6:002:0 s c0 05 0c34 0000 0004 4 <
ffff000103151e40 4050854894 C Ci:6:002:0 0 4 = 20202020
ffff000103151e40 4050854939 S Co:6:002:0 s 40 05 0c34 0000 0004 4 = 20202020
ffff000103151e40 4050855044 C Co:6:002:0 0 4 >
ffff000103151e40 4050855091 S Ci:6:002:0 s c0 05 0c38 0000 0004 4 <
ffff000103151e40 4050855210 C Ci:6:002:0 0 4 = 201e1c1a
ffff000103151e40 4050855255 S Co:6:002:0 s 40 05 0c38 0000 0004 4 = 201e1c1a
ffff000103151e40 4050855361 C Co:6:002:0 0 4 >
ffff000103151e40 4050855408 S Ci:6:002:0 s c0 05 0c3c 0000 0004 4 <
ffff000103151e40 4050855526 C Ci:6:002:0 0 4 = 20202020
ffff000103151e40 4050855571 S Co:6:002:0 s 40 05 0c3c 0000 0004 4 = 20202020
ffff000103151e40 4050855678 C Co:6:002:0 0 4 >
ffff000103151e40 4050855724 S Ci:6:002:0 s c0 05 0c40 0000 0004 4 <
ffff000103151e40 4050855842 C Ci:6:002:0 0 4 = 20201e1c
ffff000103151e40 4050855888 S Co:6:002:0 s 40 05 0c40 0000 0004 4 = 20201e1c
ffff000103151e40 4050855994 C Co:6:002:0 0 4 >
ffff000103151e40 4050856047 S Ci:6:002:0 s c0 05 0c44 0000 0004 4 <
ffff000103151e40 4050856152 C Ci:6:002:0 0 4 = 1a181e1e
ffff000103151e40 4050856199 S Co:6:002:0 s 40 05 0c44 0000 0004 4 = 1a181e1e
ffff000103151e40 4050856305 C Co:6:002:0 0 4 >
ffff000103151e40 4050856352 S Ci:6:002:0 s c0 05 0c48 0000 0004 4 <
ffff000103151e40 4050856471 C Ci:6:002:0 0 4 = 1e1e1e1e
ffff000103151e40 4050856516 S Co:6:002:0 s 40 05 0c48 0000 0004 4 = 1e1e1e1e
ffff000103151e40 4050856622 C Co:6:002:0 0 4 >
ffff000103151e40 4050856669 S Ci:6:002:0 s c0 05 0c4c 0000 0004 4 <
ffff000103151e40 4050856787 C Ci:6:002:0 0 4 = 1c1a1816
ffff000103151e40 4050856834 S Co:6:002:0 s 40 05 0c4c 0000 0004 4 = 1c1a1816
ffff000103151e40 4050856939 C Co:6:002:0 0 4 >
ffff000103151e40 4050856985 S Ci:6:002:0 s c0 05 0c54 0000 0004 4 <
ffff000103151e40 4050857095 C Ci:6:002:0 0 4 = 120a0400
ffff000103151e40 4050857140 S Co:6:002:0 s 40 05 0c54 0000 0004 4 = 120a0400
ffff000103151e40 4050857247 C Co:6:002:0 0 4 >
ffff000103151e40 4050857293 S Ci:6:002:0 s c0 05 0e20 0000 0004 4 <
ffff000103151e40 4050857412 C Ci:6:002:0 0 4 = 14141414
ffff000103151e40 4050857457 S Co:6:002:0 s 40 05 0e20 0000 0004 4 = 14141414
ffff000103151e40 4050857563 C Co:6:002:0 0 4 >
ffff000103151e40 4050857610 S Ci:6:002:0 s c0 05 0e24 0000 0004 4 <
ffff000103151e40 4050857728 C Ci:6:002:0 0 4 = 1d1d1d1d
ffff000103151e40 4050857774 S Co:6:002:0 s 40 05 0e24 0000 0004 4 = 1d1d1d1d
ffff000103151e40 4050857893 C Co:6:002:0 0 4 >
ffff000103151e40 4050857939 S Ci:6:002:0 s c0 05 0e28 0000 0004 4 <
ffff000103151e40 4050858059 C Ci:6:002:0 0 4 = 1d1d1b19
ffff000103151e40 4050858104 S Co:6:002:0 s 40 05 0e28 0000 0004 4 = 1d1d1b19
ffff000103151e40 4050858211 C Co:6:002:0 0 4 >
ffff000103151e40 4050858257 S Ci:6:002:0 s c0 05 0e2c 0000 0004 4 <
ffff000103151e40 4050858393 C Ci:6:002:0 0 4 = 1f1f1f1f
ffff000103151e40 4050858439 S Co:6:002:0 s 40 05 0e2c 0000 0004 4 = 1f1f1f1f
ffff000103151e40 4050858545 C Co:6:002:0 0 4 >
ffff000103151e40 4050858591 S Ci:6:002:0 s c0 05 0e30 0000 0004 4 <
ffff000103151e40 4050858711 C Ci:6:002:0 0 4 = 1f1f1d1b
ffff000103151e40 4050858756 S Co:6:002:0 s 40 05 0e30 0000 0004 4 = 1f1f1d1b
ffff000103151e40 4050858863 C Co:6:002:0 0 4 >
ffff000103151e40 4050858910 S Ci:6:002:0 s c0 05 0e34 0000 0004 4 <
ffff000103151e40 4050859031 C Ci:6:002:0 0 4 = 1f1f1f1f
ffff000103151e40 4050859076 S Co:6:002:0 s 40 05 0e34 0000 0004 4 = 1f1f1f1f
ffff000103151e40 4050859182 C Co:6:002:0 0 4 >
ffff000103151e40 4050859229 S Ci:6:002:0 s c0 05 0e38 0000 0004 4 <
ffff000103151e40 4050859348 C Ci:6:002:0 0 4 = 1f1d1b19
ffff000103151e40 4050859393 S Co:6:002:0 s 40 05 0e38 0000 0004 4 = 1f1d1b19
ffff000103151e40 4050859499 C Co:6:002:0 0 4 >
ffff000103151e40 4050859546 S Ci:6:002:0 s c0 05 0e3c 0000 0004 4 <
ffff000103151e40 4050859665 C Ci:6:002:0 0 4 = 1f1f1f1f
ffff000103151e40 4050859711 S Co:6:002:0 s 40 05 0e3c 0000 0004 4 = 1f1f1f1f
ffff000103151e40 4050859817 C Co:6:002:0 0 4 >
ffff000103151e40 4050859864 S Ci:6:002:0 s c0 05 0e40 0000 0004 4 <
ffff000103151e40 4050859983 C Ci:6:002:0 0 4 = 1f1f1d1b
ffff000103151e40 4050860155 S Co:6:002:0 s 40 05 0e40 0000 0004 4 = 1f1f1d1b
ffff000103151e40 4050860294 C Co:6:002:0 0 4 >
ffff000103151e40 4050860345 S Ci:6:002:0 s c0 05 0e44 0000 0004 4 <
ffff000103151e40 4050860468 C Ci:6:002:0 0 4 = 19171d1d
ffff000103151e40 4050860514 S Co:6:002:0 s 40 05 0e44 0000 0004 4 = 19171d1d
ffff000103151e40 4050860621 C Co:6:002:0 0 4 >
ffff000103151e40 4050860667 S Ci:6:002:0 s c0 05 0e48 0000 0004 4 <
ffff000103151e40 4050860788 C Ci:6:002:0 0 4 = 1d1d1d1d
ffff000103151e40 4050860833 S Co:6:002:0 s 40 05 0e48 0000 0004 4 = 1d1d1d1d
ffff000103151e40 4050860939 C Co:6:002:0 0 4 >
ffff000103151e40 4050860986 S Ci:6:002:0 s c0 05 0e4c 0000 0004 4 <
ffff000103151e40 4050861106 C Ci:6:002:0 0 4 = 1b191715
ffff000103151e40 4050861151 S Co:6:002:0 s 40 05 0e4c 0000 0004 4 = 1b191715
ffff000103151e40 4050861269 C Co:6:002:0 0 4 >
ffff000103151e40 4050861316 S Ci:6:002:0 s c0 05 0e54 0000 0004 4 <
ffff000103151e40 4050861435 C Ci:6:002:0 0 4 = 11090300
ffff000103151e40 4050861481 S Co:6:002:0 s 40 05 0e54 0000 0004 4 = 11090300
ffff000103151e40 4050861588 C Co:6:002:0 0 4 >
ffff000103151e40 4050861648 S Ci:6:002:0 s c0 05 0454 0000 0001 1 <
ffff000103151e40 4050861776 C Ci:6:002:0 0 1 = 00
ffff000103151e40 4050861821 S Ci:6:002:0 s c0 05 0454 0000 0001 1 <
ffff000103151e40 4050861932 C Ci:6:002:0 0 1 = 00
ffff000103151e40 4050861979 S Co:6:002:0 s 40 05 0454 0000 0001 1 = 80
ffff000103151e40 4050862094 C Co:6:002:0 0 1 >
ffff000103151e40 4050862139 S Ci:6:002:0 s c0 05 041a 0000 0002 2 <
ffff000103151e40 4050862250 C Ci:6:002:0 0 2 = ff0f
ffff000103151e40 4050862295 S Ci:6:002:0 s c0 05 0808 0000 0004 4 <
ffff000103151e40 4050862406 C Ci:6:002:0 0 4 = 3382023e
ffff000103151e40 4050862452 S Co:6:002:0 s 40 05 0808 0000 0004 4 = 3382023e
ffff000103151e40 4050862567 C Co:6:002:0 0 4 >
ffff000103151e40 4050862612 S Ci:6:002:0 s c0 05 0834 0000 0004 4 <
ffff000103151e40 4050862723 C Ci:6:002:0 0 4 = 05a73700
ffff000103151e40 4050862769 S Co:6:002:0 s 40 05 0834 0000 0004 4 = 06a73700
ffff000103151e40 4050862897 C Co:6:002:0 0 4 >
ffff000103151e40 4050862942 S Ci:6:002:0 s c0 05 0830 0000 0004 4 <
ffff000103151e40 4050863053 C Ci:6:002:0 0 4 = b8eeaa2e
ffff000103151e40 4050863097 S Co:6:002:0 s 40 05 0830 0000 0004 4 = b8aeaa2e
ffff000103151e40 4050863204 C Co:6:002:0 0 4 >
ffff000103151e40 4050863251 S Ci:6:002:0 s c0 05 0830 0000 0004 4 <
ffff000103151e40 4050863371 C Ci:6:002:0 0 4 = b8aeaa2e
ffff000103151e40 4050863415 S Co:6:002:0 s 40 05 0830 0000 0004 4 = b8aeaa2e
ffff000103151e40 4050863522 C Co:6:002:0 0 4 >
ffff000103151e40 4050863569 S Ci:6:002:0 s c0 05 082c 0000 0004 4 <
ffff000103151e40 4050863688 C Ci:6:002:0 0 4 = dc832000
ffff000103151e40 4050863733 S Co:6:002:0 s 40 05 082c 0000 0004 4 = dd832000
ffff000103151e40 4050863840 C Co:6:002:0 0 4 >
ffff000103151e40 4050863887 S Co:6:002:0 s 40 05 0cb0 0000 0004 4 = 17773354
ffff000103151e40 4050864018 C Co:6:002:0 0 4 >
ffff000103151e40 4050864065 S Co:6:002:0 s 40 05 0eb0 0000 0004 4 = 17773354
ffff000103151e40 4050864172 C Co:6:002:0 0 4 >
ffff000103151e40 4050864220 S Ci:6:002:0 s c0 05 0cb4 0000 0004 4 <
ffff000103151e40 4050864353 C Ci:6:002:0 0 4 = 77000001
ffff000103151e40 4050864398 S Co:6:002:0 s 40 05 0cb4 0000 0004 4 = 77000001
ffff000103151e40 4050864517 C Co:6:002:0 0 4 >
ffff000103151e40 4050864564 S Ci:6:002:0 s c0 05 0eb4 0000 0004 4 <
ffff000103151e40 4050864684 C Ci:6:002:0 0 4 = 77000001
ffff000103151e40 4050864730 S Co:6:002:0 s 40 05 0eb4 0000 0004 4 = 77000001
ffff000103151e40 4050864836 C Co:6:002:0 0 4 >
ffff000103151e40 4050864883 S Ci:6:002:0 s c0 05 0900 0000 0004 4 <
ffff000103151e40 4050865019 C Ci:6:002:0 0 4 = 01040000
ffff000103151e40 4050865064 S Co:6:002:0 s 40 05 0900 0000 0004 4 = 01040000
ffff000103151e40 4050865170 C Co:6:002:0 0 4 >
ffff000103151e40 4050865217 S Ci:6:002:0 s c0 05 080c 0000 0004 4 <
ffff000103151e40 4050865336 C Ci:6:002:0 0 4 = 13111312
ffff000103151e40 4050865382 S Co:6:002:0 s 40 05 080c 0000 0004 4 = 03111312
ffff000103151e40 4050865488 C Co:6:002:0 0 4 >
ffff000103151e40 4050865535 S Ci:6:002:0 s c0 05 0a04 0000 0004 4 <
ffff000103151e40 4050865655 C Ci:6:002:0 0 4 = 0c00ff01
ffff000103151e40 4050865699 S Co:6:002:0 s 40 05 0a04 0000 0004 4 = 0c00ff0f
ffff000103151e40 4050865807 C Co:6:002:0 0 4 >
ffff000103151e40 4050865853 S Ci:6:002:0 s c0 05 0440 0000 0004 4 <
ffff000103151e40 4050865973 C Ci:6:002:0 0 4 = 00000000
ffff000103151e40 4050866018 S Co:6:002:0 s 40 05 0440 0000 0004 4 = 50010000
ffff000103151e40 4050866124 C Co:6:002:0 0 4 >
ffff000103151e40 4050866171 S Ci:6:002:0 s c0 05 0c1c 0000 0004 4 <
ffff000103151e40 4050866291 C Ci:6:002:0 0 4 = 03000040
ffff000103151e40 4050866335 S Co:6:002:0 s 40 05 0c1c 0000 0004 4 = 0300402d
ffff000103151e40 4050866442 C Co:6:002:0 0 4 >
ffff000103151e40 4050866489 S Ci:6:002:0 s c0 05 0e1c 0000 0004 4 <
ffff000103151e40 4050866608 C Ci:6:002:0 0 4 = 03000040
ffff000103151e40 4050866654 S Co:6:002:0 s 40 05 0e1c 0000 0004 4 = 0300402d
ffff000103151e40 4050866772 C Co:6:002:0 0 4 >
ffff000103151e40 4050866819 S Ci:6:002:0 s c0 05 0860 0000 0004 4 <
ffff000103151e40 4050866940 C Ci:6:002:0 0 4 = 21c3d572
ffff000103151e40 4050866984 S Co:6:002:0 s 40 05 0860 0000 0004 4 = 21c32568
ffff000103151e40 4050867091 C Co:6:002:0 0 4 >
ffff000103151e40 4050867137 S Ci:6:002:0 s c0 05 0c00 0000 0004 4 <
ffff000103151e40 4050867275 C Ci:6:002:0 0 4 = 07000000
ffff000103151e40 4050867321 S Ci:6:002:0 s c0 05 08b0 0000 0004 4 <
ffff000103151e40 4050867432 C Ci:6:002:0 0 4 = 18060000
ffff000103151e40 4050867477 S Co:6:002:0 s 40 05 08b0 0000 0004 4 = 18060000
ffff000103151e40 4050867584 C Co:6:002:0 0 4 >
ffff000103151e40 4050867651 S Ci:6:002:0 s c0 05 0d04 0000 0004 4 <
ffff000103151e40 4050867777 C Ci:6:002:0 0 4 = 017c90b1
ffff000103151e40 4050867822 S Co:6:002:0 s 40 05 0c90 0000 0004 4 = 017d8301
ffff000103151e40 4050867928 C Co:6:002:0 0 4 >
ffff000103151e40 4050867987 S Ci:6:002:0 s c0 05 08ac 0000 0004 4 <
ffff000103151e40 4050868124 C Ci:6:002:0 0 4 = 08faf00f
ffff000103151e40 4050868170 S Co:6:002:0 s 40 05 08ac 0000 0004 4 = 08faf00f
ffff000103151e40 4050868278 C Co:6:002:0 0 4 >
ffff000103151e40 4050868325 S Ci:6:002:0 s c0 05 08ac 0000 0004 4 <
ffff000103151e40 4050868447 C Ci:6:002:0 0 4 = 08faf00f
ffff000103151e40 4050868492 S Co:6:002:0 s 40 05 08ac 0000 0004 4 = 08faf00f
ffff000103151e40 4050868598 C Co:6:002:0 0 4 >
ffff000103151e40 4050868645 S Ci:6:002:0 s c0 05 08c4 0000 0004 4 <
ffff000103151e40 4050868777 C Ci:6:002:0 0 4 = 00000000
ffff000103151e40 4050868823 S Co:6:002:0 s 40 05 08c4 0000 0004 4 = 00000000
ffff000103151e40 4050868929 C Co:6:002:0 0 4 >
ffff000103151e40 4050868975 S Ci:6:002:0 s c0 05 0c00 0000 0004 4 <
ffff000103151e40 4050869096 C Ci:6:002:0 0 4 = 07000000
ffff000103151e40 4050869141 S Ci:6:002:0 s c0 05 08b0 0000 0004 4 <
ffff000103151e40 4050869253 C Ci:6:002:0 0 4 = 18060000
ffff000103151e40 4050869297 S Co:6:002:0 s 40 05 08b0 0000 0004 4 = 18060000
ffff000103151e40 4050869404 C Co:6:002:0 0 4 >
ffff000103151e40 4050869471 S Ci:6:002:0 s c0 05 0d04 0000 0004 4 <
ffff000103151e40 4050869588 C Ci:6:002:0 0 4 = 017d91b1
ffff000103151e40 4050869634 S Co:6:002:0 s 40 05 0c90 0000 0004 4 = 8c7d8101
ffff000103151e40 4050869740 C Co:6:002:0 0 4 >
ffff000103151e40 4050869800 S Ci:6:002:0 s c0 05 0e00 0000 0004 4 <
ffff000103151e40 4050869918 C Ci:6:002:0 0 4 = 07000000
ffff000103151e40 4050869964 S Ci:6:002:0 s c0 05 08b0 0000 0004 4 <
ffff000103151e40 4050870073 C Ci:6:002:0 0 4 = 18060000
ffff000103151e40 4050870119 S Co:6:002:0 s 40 05 08b0 0000 0004 4 = 18060000
ffff000103151e40 4050870233 C Co:6:002:0 0 4 >
ffff000103151e40 4050870299 S Ci:6:002:0 s c0 05 0d44 0000 0004 4 <
ffff000103151e40 4050870417 C Ci:6:002:0 0 4 = 017c90b1
ffff000103151e40 4050870462 S Co:6:002:0 s 40 05 0e90 0000 0004 4 = 017d8301
ffff000103151e40 4050870568 C Co:6:002:0 0 4 >
ffff000103151e40 4050870628 S Ci:6:002:0 s c0 05 08ac 0000 0004 4 <
ffff000103151e40 4050870746 C Ci:6:002:0 0 4 = 08faf00f
ffff000103151e40 4050870792 S Co:6:002:0 s 40 05 08ac 0000 0004 4 = 08faf00f
ffff000103151e40 4050870898 C Co:6:002:0 0 4 >
ffff000103151e40 4050870944 S Ci:6:002:0 s c0 05 08ac 0000 0004 4 <
ffff000103151e40 4050871061 C Ci:6:002:0 0 4 = 08faf00f
ffff000103151e40 4050871106 S Co:6:002:0 s 40 05 08ac 0000 0004 4 = 08faf00f
ffff000103151e40 4050871213 C Co:6:002:0 0 4 >
ffff000103151e40 4050871259 S Ci:6:002:0 s c0 05 08c4 0000 0004 4 <
ffff000103151e40 4050871392 C Ci:6:002:0 0 4 = 00000000
ffff000103151e40 4050871438 S Co:6:002:0 s 40 05 08c4 0000 0004 4 = 00000000
ffff000103151e40 4050871544 C Co:6:002:0 0 4 >
ffff000103151e40 4050871591 S Ci:6:002:0 s c0 05 0e00 0000 0004 4 <
ffff000103151e40 4050871709 C Ci:6:002:0 0 4 = 07000000
ffff000103151e40 4050871754 S Ci:6:002:0 s c0 05 08b0 0000 0004 4 <
ffff000103151e40 4050871863 C Ci:6:002:0 0 4 = 18060000
ffff000103151e40 4050871908 S Co:6:002:0 s 40 05 08b0 0000 0004 4 = 18060000
ffff000103151e40 4050872025 C Co:6:002:0 0 4 >
ffff000103151e40 4050872095 S Ci:6:002:0 s c0 05 0d44 0000 0004 4 <
ffff000103151e40 4050872215 C Ci:6:002:0 0 4 = 017d91b1
ffff000103151e40 4050872260 S Co:6:002:0 s 40 05 0e90 0000 0004 4 = 8c7d8101
ffff000103151e40 4050872374 C Co:6:002:0 0 4 >
ffff000103151e40 4050872434 S Ci:6:002:0 s c0 05 0668 0000 0002 2 <
ffff000103151e40 4050872552 C Ci:6:002:0 0 2 = 0010
ffff000103151e40 4050872597 S Co:6:002:0 s 40 05 0668 0000 0002 2 = 0010
ffff000103151e40 4050872703 C Co:6:002:0 0 2 >
ffff000103151e40 4050872749 S Co:6:002:0 s 40 05 0483 0000 0001 1 = 00
ffff000103151e40 4050872863 C Co:6:002:0 0 1 >
ffff000103151e40 4050872908 S Ci:6:002:0 s c0 05 0837 0000 0001 1 <
ffff000103151e40 4050873024 C Ci:6:002:0 0 1 = 00
ffff000103151e40 4050873070 S Ci:6:002:0 s c0 05 08ac 0000 0004 4 <
ffff000103151e40 4050873188 C Ci:6:002:0 0 4 = 08faf00f
ffff000103151e40 4050873233 S Co:6:002:0 s 40 05 08ac 0000 0004 4 = 08faf00f
ffff000103151e40 4050873339 C Co:6:002:0 0 4 >
ffff000103151e40 4050873386 S Ci:6:002:0 s c0 05 08c4 0000 0004 4 <
ffff000103151e40 4050873521 C Ci:6:002:0 0 4 = 00000000
ffff000103151e40 4050873566 S Co:6:002:0 s 40 05 08c4 0000 0004 4 = 00000000
ffff000103151e40 4050873674 C Co:6:002:0 0 4 >
ffff000103151e40 4050873720 S Ci:6:002:0 s c0 05 0848 0000 0004 4 <
ffff000103151e40 4050873838 C Ci:6:002:0 0 4 = 8bffd061
ffff000103151e40 4050873883 S Co:6:002:0 s 40 05 0848 0000 0004 4 = 8bffd061
ffff000103151e40 4050873990 C Co:6:002:0 0 4 >
ffff000103151e40 4050874037 S Ci:6:002:0 s c0 05 08ac 0000 0004 4 <
ffff000103151e40 4050874155 C Ci:6:002:0 0 4 = 08faf00f
ffff000103151e40 4050874200 S Co:6:002:0 s 40 05 08ac 0000 0004 4 = 08faf00f
ffff000103151e40 4050874306 C Co:6:002:0 0 4 >
ffff000103151e40 4050874352 S Ci:6:002:0 s c0 05 08ac 0000 0004 4 <
ffff000103151e40 4050874470 C Ci:6:002:0 0 4 = 08faf00f
ffff000103151e40 4050874515 S Co:6:002:0 s 40 05 08ac 0000 0004 4 = 08faf00f
ffff000103151e40 4050874621 C Co:6:002:0 0 4 >
ffff000103151e40 4050874667 S Ci:6:002:0 s c0 05 08c4 0000 0004 4 <
ffff000103151e40 4050874785 C Ci:6:002:0 0 4 = 00000000
ffff000103151e40 4050874830 S Co:6:002:0 s 40 05 08c4 0000 0004 4 = 00000000
ffff000103151e40 4050874937 C Co:6:002:0 0 4 >
ffff000103151e40 4050874984 S Ci:6:002:0 s c0 05 0c00 0000 0004 4 <
ffff000103151e40 4050875102 C Ci:6:002:0 0 4 = 07000000
ffff000103151e40 4050875147 S Ci:6:002:0 s c0 05 08b0 0000 0004 4 <
ffff000103151e40 4050875271 C Ci:6:002:0 0 4 = 18060000
ffff000103151e40 4050875316 S Co:6:002:0 s 40 05 08b0 0000 0004 4 = 18060000
ffff000103151e40 4050875423 C Co:6:002:0 0 4 >
ffff000103151e40 4050875490 S Ci:6:002:0 s c0 05 0d04 0000 0004 4 <
ffff000103151e40 4050875608 C Ci:6:002:0 0 4 = 8c7d93b1
ffff000103151e40 4050875653 S Co:6:002:0 s 40 05 0c90 0000 0004 4 = 8c7d8301
ffff000103151e40 4050875772 C Co:6:002:0 0 4 >
ffff000103151e40 4050875831 S Ci:6:002:0 s c0 05 0e00 0000 0004 4 <
ffff000103151e40 4050875950 C Ci:6:002:0 0 4 = 07000000
ffff000103151e40 4050875994 S Ci:6:002:0 s c0 05 08b0 0000 0004 4 <
ffff000103151e40 4050876151 C Ci:6:002:0 0 4 = 18060000
ffff000103151e40 4050876195 S Co:6:002:0 s 40 05 08b0 0000 0004 4 = 18060000
ffff000103151e40 4050876312 C Co:6:002:0 0 4 >
ffff000103151e40 4050876379 S Ci:6:002:0 s c0 05 0d44 0000 0004 4 <
ffff000103151e40 4050876499 C Ci:6:002:0 0 4 = 8c7d93b1
ffff000103151e40 4050876544 S Co:6:002:0 s 40 05 0e90 0000 0004 4 = 8c7d8301
ffff000103151e40 4050876651 C Co:6:002:0 0 4 >
ffff000103151e40 4050876712 S Ci:6:002:0 s c0 05 0073 0000 0001 1 <
ffff000103151e40 4050876834 C Ci:6:002:0 0 1 = 07
ffff000103151e40 4050876878 S Co:6:002:0 s 40 05 0073 0000 0001 1 = 07
ffff000103151e40 4050876985 C Co:6:002:0 0 1 >
ffff000103151e40 4050877059 S Ci:6:002:0 s c0 05 0c24 0000 0004 4 <
ffff000103151e40 4050877179 C Ci:6:002:0 0 4 = 20202020
ffff000103151e40 4050877224 S Co:6:002:0 s 40 05 0c24 0000 0004 4 = 2b2b2b2b
ffff000103151e40 4050877330 C Co:6:002:0 0 4 >
ffff000103151e40 4050877377 S Ci:6:002:0 s c0 05 0c28 0000 0004 4 <
ffff000103151e40 4050877496 C Ci:6:002:0 0 4 = 20201e1c
ffff000103151e40 4050877540 S Co:6:002:0 s 40 05 0c28 0000 0004 4 = 2b2b2b2b
ffff000103151e40 4050877647 C Co:6:002:0 0 4 >
ffff000103151e40 4050877693 S Ci:6:002:0 s c0 05 0c2c 0000 0004 4 <
ffff000103151e40 4050877813 C Ci:6:002:0 0 4 = 20202020
ffff000103151e40 4050877858 S Co:6:002:0 s 40 05 0c2c 0000 0004 4 = 30303030
ffff000103151e40 4050877965 C Co:6:002:0 0 4 >
ffff000103151e40 4050878011 S Ci:6:002:0 s c0 05 0c30 0000 0004 4 <
ffff000103151e40 4050878146 C Ci:6:002:0 0 4 = 20201e1c
ffff000103151e40 4050878191 S Co:6:002:0 s 40 05 0c30 0000 0004 4 = 30302e2c
ffff000103151e40 4050878297 C Co:6:002:0 0 4 >
ffff000103151e40 4050878343 S Ci:6:002:0 s c0 05 0c34 0000 0004 4 <
ffff000103151e40 4050878463 C Ci:6:002:0 0 4 = 20202020
ffff000103151e40 4050878507 S Co:6:002:0 s 40 05 0c34 0000 0004 4 = 2c2c2c2c
ffff000103151e40 4050878614 C Co:6:002:0 0 4 >
ffff000103151e40 4050878660 S Ci:6:002:0 s c0 05 0c38 0000 0004 4 <
ffff000103151e40 4050878779 C Ci:6:002:0 0 4 = 201e1c1a
ffff000103151e40 4050878823 S Co:6:002:0 s 40 05 0c38 0000 0004 4 = 2c2c2c2a
ffff000103151e40 4050878930 C Co:6:002:0 0 4 >
ffff000103151e40 4050878976 S Ci:6:002:0 s c0 05 0c3c 0000 0004 4 <
ffff000103151e40 4050879094 C Ci:6:002:0 0 4 = 20202020
ffff000103151e40 4050879139 S Co:6:002:0 s 40 05 0c3c 0000 0004 4 = 30303030
ffff000103151e40 4050879245 C Co:6:002:0 0 4 >
ffff000103151e40 4050879292 S Ci:6:002:0 s c0 05 0c40 0000 0004 4 <
ffff000103151e40 4050879411 C Ci:6:002:0 0 4 = 20201e1c
ffff000103151e40 4050879456 S Co:6:002:0 s 40 05 0c40 0000 0004 4 = 30302e2c
ffff000103151e40 4050879563 C Co:6:002:0 0 4 >
ffff000103151e40 4050879609 S Ci:6:002:0 s c0 05 0c44 0000 0004 4 <
ffff000103151e40 4050879729 C Ci:6:002:0 0 4 = 1a181e1e
ffff000103151e40 4050879774 S Co:6:002:0 s 40 05 0c44 0000 0004 4 = 2a2a2c2c
ffff000103151e40 4050879893 C Co:6:002:0 0 4 >
ffff000103151e40 4050879939 S Ci:6:002:0 s c0 05 0c48 0000 0004 4 <
ffff000103151e40 4050880059 C Ci:6:002:0 0 4 = 1e1e1e1e
ffff000103151e40 4050880109 S Co:6:002:0 s 40 05 0c48 0000 0004 4 = 2c2c2c2c
ffff000103151e40 4050880233 C Co:6:002:0 0 4 >
ffff000103151e40 4050880282 S Ci:6:002:0 s c0 05 0c4c 0000 0004 4 <
ffff000103151e40 4050880402 C Ci:6:002:0 0 4 = 1c1a1816
ffff000103151e40 4050880447 S Co:6:002:0 s 40 05 0c4c 0000 0004 4 = 2c2a2828
ffff000103151e40 4050880554 C Co:6:002:0 0 4 >
ffff000103151e40 4050880600 S Ci:6:002:0 s c0 05 0c54 0000 0004 4 <
ffff000103151e40 4050880721 C Ci:6:002:0 0 4 = 120a0400
ffff000103151e40 4050880767 S Co:6:002:0 s 40 05 0c54 0000 0004 4 = 221a1400
ffff000103151e40 4050880873 C Co:6:002:0 0 4 >
ffff000103151e40 4050880921 S Ci:6:002:0 s c0 05 0e24 0000 0004 4 <
ffff000103151e40 4050881041 C Ci:6:002:0 0 4 = 1d1d1d1d
ffff000103151e40 4050881086 S Co:6:002:0 s 40 05 0e24 0000 0004 4 = 17171717
ffff000103151e40 4050881193 C Co:6:002:0 0 4 >
ffff000103151e40 4050881240 S Ci:6:002:0 s c0 05 0e28 0000 0004 4 <
ffff000103151e40 4050881359 C Ci:6:002:0 0 4 = 1d1d1b19
ffff000103151e40 4050881405 S Co:6:002:0 s 40 05 0e28 0000 0004 4 = 17171717
ffff000103151e40 4050881522 C Co:6:002:0 0 4 >
ffff000103151e40 4050881568 S Ci:6:002:0 s c0 05 0e2c 0000 0004 4 <
ffff000103151e40 4050881689 C Ci:6:002:0 0 4 = 1f1f1f1f
ffff000103151e40 4050881735 S Co:6:002:0 s 40 05 0e2c 0000 0004 4 = 1c1c1c1c
ffff000103151e40 4050881841 C Co:6:002:0 0 4 >
ffff000103151e40 4050881887 S Ci:6:002:0 s c0 05 0e30 0000 0004 4 <
ffff000103151e40 4050882024 C Ci:6:002:0 0 4 = 1f1f1d1b
ffff000103151e40 4050882070 S Co:6:002:0 s 40 05 0e30 0000 0004 4 = 1c1c1a18
ffff000103151e40 4050882176 C Co:6:002:0 0 4 >
ffff000103151e40 4050882223 S Ci:6:002:0 s c0 05 0e34 0000 0004 4 <
ffff000103151e40 4050882342 C Ci:6:002:0 0 4 = 1f1f1f1f
ffff000103151e40 4050882387 S Co:6:002:0 s 40 05 0e34 0000 0004 4 = 18181818
ffff000103151e40 4050882494 C Co:6:002:0 0 4 >
ffff000103151e40 4050882541 S Ci:6:002:0 s c0 05 0e38 0000 0004 4 <
ffff000103151e40 4050882660 C Ci:6:002:0 0 4 = 1f1d1b19
ffff000103151e40 4050882705 S Co:6:002:0 s 40 05 0e38 0000 0004 4 = 18181816
ffff000103151e40 4050882811 C Co:6:002:0 0 4 >
ffff000103151e40 4050882858 S Ci:6:002:0 s c0 05 0e3c 0000 0004 4 <
ffff000103151e40 4050882977 C Ci:6:002:0 0 4 = 1f1f1f1f
ffff000103151e40 4050883023 S Co:6:002:0 s 40 05 0e3c 0000 0004 4 = 1c1c1c1c
ffff000103151e40 4050883139 C Co:6:002:0 0 4 >
ffff000103151e40 4050883186 S Ci:6:002:0 s c0 05 0e40 0000 0004 4 <
ffff000103151e40 4050883305 C Ci:6:002:0 0 4 = 1f1f1d1b
ffff000103151e40 4050883350 S Co:6:002:0 s 40 05 0e40 0000 0004 4 = 1c1c1a18
ffff000103151e40 4050883457 C Co:6:002:0 0 4 >
ffff000103151e40 4050883504 S Ci:6:002:0 s c0 05 0e44 0000 0004 4 <
ffff000103151e40 4050883623 C Ci:6:002:0 0 4 = 19171d1d
ffff000103151e40 4050883669 S Co:6:002:0 s 40 05 0e44 0000 0004 4 = 16161818
ffff000103151e40 4050883775 C Co:6:002:0 0 4 >
ffff000103151e40 4050883821 S Ci:6:002:0 s c0 05 0e48 0000 0004 4 <
ffff000103151e40 4050883941 C Ci:6:002:0 0 4 = 1d1d1d1d
ffff000103151e40 4050883987 S Co:6:002:0 s 40 05 0e48 0000 0004 4 = 18181818
ffff000103151e40 4050884099 C Co:6:002:0 0 4 >
ffff000103151e40 4050884147 S Ci:6:002:0 s c0 05 0e4c 0000 0004 4 <
ffff000103151e40 4050884280 C Ci:6:002:0 0 4 = 1b191715
ffff000103151e40 4050884327 S Co:6:002:0 s 40 05 0e4c 0000 0004 4 = 18161414
ffff000103151e40 4050884442 C Co:6:002:0 0 4 >
ffff000103151e40 4050884488 S Ci:6:002:0 s c0 05 0e54 0000 0004 4 <
ffff000103151e40 4050884608 C Ci:6:002:0 0 4 = 11090300
ffff000103151e40 4050884654 S Co:6:002:0 s 40 05 0e54 0000 0004 4 = 0e060200
ffff000103151e40 4050884772 C Co:6:002:0 0 4 >
ffff000103533240 4050901053 C Bi:6:002:1 0 476 = a4010484 00000f80 15036000 04300000 00000000 36b4ae01 363a0000 6adcdc0f
ffff000103533240 4050901081 S Bi:6:002:1 -115 32768 <
ffff000103533780 4050902073 C Bi:6:002:1 0 469 = 9d010484 00000f80 670d6000 04300000 00000000 3db8ae01 34340000 6bd9d90f
ffff000103533780 4050902094 S Bi:6:002:1 -115 32768 <
ffff0001035330c0 4050902940 C Bi:6:002:1 0 444 = 84010484 00000f80 f3096000 04300000 00000000 cbbbae01 34340000 6bd7d70f
ffff0001035330c0 4050902959 S Bi:6:002:1 -115 32768 <
ffff000103533480 4050903824 C Bi:6:002:1 0 467 = 9b010484 00000f80 e5086000 04300000 00000000 2abfae01 34360000 69d7d70f
ffff000103533480 4050903841 S Bi:6:002:1 -115 32768 <
ffff000103533240 4050904754 C Bi:6:002:1 0 477 = a5010484 00000f80 6f086000 04300000 00000000 a5c2ae01 34340000 6dd7d70f
ffff000103533240 4050904785 S Bi:6:002:1 -115 32768 <
ffff000103533780 4051003463 C Bi:6:002:1 0 476 = a4010484 00000f80 16036000 04300000 00000000 3844b001 38320000 69dada0f
ffff000103533780 4051003492 S Bi:6:002:1 -115 32768 <
ffff0001035330c0 4051004457 C Bi:6:002:1 0 469 = 9d010484 00000f80 680d6000 04300000 00000000 3648b001 36340000 68d9d90f
ffff0001035330c0 4051004484 S Bi:6:002:1 -115 32768 <
ffff000103533480 4051005337 C Bi:6:002:1 0 444 = 84010484 00000f80 f4096000 04300000 00000000 bd4bb001 363a0000 6ae1e10f
ffff000103533480 4051005356 S Bi:6:002:1 -115 32768 <
ffff000103533240 4051006159 C Bi:6:002:1 0 467 = 9b010484 00000f80 e6086000 04300000 00000000 174fb001 38320000 68dada0f
ffff000103533240 4051006174 S Bi:6:002:1 -115 32768 <
ffff000103533780 4051007156 C Bi:6:002:1 0 477 = a5010484 00000f80 70086000 04300000 00000000 9952b001 36320000 6cd8d80f
ffff000103533780 4051007173 S Bi:6:002:1 -115 32768 <
ffff0001035330c0 4051105845 C Bi:6:002:1 0 476 = a4010484 00000f80 17036000 04300000 00000000 39d4b101 34360000 6bd7d70f
ffff0001035330c0 4051105866 S Bi:6:002:1 -115 32768 <
ffff000103533480 4051106853 C Bi:6:002:1 0 469 = 9d010484 00000f80 690d6000 04300000 00000000 2ed8b101 36360000 6cdada0f
ffff000103533480 4051106875 S Bi:6:002:1 -115 32768 <
ffff000103533240 4051107739 C Bi:6:002:1 0 444 = 84010484 00000f80 f5096000 04300000 00000000 c6dbb101 38360000 6cdbdb0f
ffff000103533240 4051107761 S Bi:6:002:1 -115 32768 <
ffff000103533780 4051108656 C Bi:6:002:1 0 467 = 9b010484 00000f80 e7086000 04300000 00000000 2cdfb101 34360000 6ad9d90f
ffff000103533780 4051108678 S Bi:6:002:1 -115 32768 <
ffff0001035330c0 4051109540 C Bi:6:002:1 0 477 = a5010484 00000f80 71086000 04300000 00000000 a3e2b101 36320000 6cdcdc0f
ffff0001035330c0 4051109562 S Bi:6:002:1 -115 32768 <
ffff000103533480 4051208295 C Bi:6:002:1 0 476 = a4010484 00000f80 18036000 04300000 00000000 3b64b301 34360000 69d8d80f
ffff000103533480 4051208325 S Bi:6:002:1 -115 32768 <
ffff000103533240 4051209270 C Bi:6:002:1 0 469 = 9d010484 00000f80 6a0d6000 04300000 00000000 2f68b301 36360000 6bdada0f
ffff000103533240 4051209295 S Bi:6:002:1 -115 32768 <
ffff000103533780 4051210177 C Bi:6:002:1 0 444 = 84010484 00000f80 f6096000 04300000 00000000 d46bb301 36340000 6ad8d80f
ffff000103533780 4051210202 S Bi:6:002:1 -115 32768 <
ffff0001035330c0 4051211072 C Bi:6:002:1 0 467 = 9b010484 00000f80 e8086000 04300000 00000000 3a6fb301 34320000 69dada0f
ffff0001035330c0 4051211097 S Bi:6:002:1 -115 32768 <
ffff000103533480 4051211978 C Bi:6:002:1 0 477 = a5010484 00000f80 72086000 04300000 00000000 b172b301 36340000 6ad8d80f
ffff000103533480 4051212003 S Bi:6:002:1 -115 32768 <
ffff000103533240 4051310696 C Bi:6:002:1 0 476 = a4010484 00000f80 19036000 04300000 00000000 3cf4b401 363a0000 6cdddd0f
ffff000103533240 4051310724 S Bi:6:002:1 -115 32768 <
ffff000103533780 4051311685 C Bi:6:002:1 0 469 = 9d010484 00000f80 6b0d6000 04300000 00000000 3bf8b401 36340000 69d8d80f
ffff000103533780 4051311710 S Bi:6:002:1 -115 32768 <
ffff0001035330c0 4051312565 C Bi:6:002:1 0 444 = 84010484 00000f80 f7096000 04300000 00000000 c4fbb401 34360000 68d9d90f
ffff0001035330c0 4051312590 S Bi:6:002:1 -115 32768 <
ffff000103533480 4051313457 C Bi:6:002:1 0 467 = 9b010484 00000f80 e9086000 04300000 00000000 28ffb401 38300000 6bd9d90f
ffff000103533480 4051313482 S Bi:6:002:1 -115 32768 <
ffff000103533240 4051314374 C Bi:6:002:1 0 477 = a5010484 00000f80 73086000 04300000 00000000 b102b501 34320000 6cd8d80f
ffff000103533240 4051314399 S Bi:6:002:1 -115 32768 <
ffff000103533780 4051413098 C Bi:6:002:1 0 476 = a4010484 00000f80 1a036000 04300000 00000000 3e84b601 34340000 69d6d60f
ffff000103533780 4051413126 S Bi:6:002:1 -115 32768 <
ffff0001035330c0 4051414955 C Bi:6:002:1 0 444 = 84010484 00000f80 f8096000 04300000 00000000 c38bb601 36360000 6bd9d90f
ffff0001035330c0 4051414980 S Bi:6:002:1 -115 32768 <
ffff000103533480 4051415838 C Bi:6:002:1 0 467 = 9b010484 00000f80 ea086000 04300000 00000000 2a8fb601 34340000 6ad8d80f
ffff000103533480 4051415860 S Bi:6:002:1 -115 32768 <
ffff000103533240 4051416773 C Bi:6:002:1 0 477 = a5010484 00000f80 74086000 04300000 00000000 a092b601 363a0000 6adede0f
ffff000103533240 4051416800 S Bi:6:002:1 -115 32768 <
ffff000103533780 4051515507 C Bi:6:002:1 0 476 = a4010484 00000f80 1b036000 04300000 00000000 3f14b801 34360000 69d7d70f
ffff000103533780 4051515565 S Bi:6:002:1 -115 32768 <
ffff0001035330c0 4051516507 C Bi:6:002:1 0 469 = 9d010484 00000f80 6d0d6000 04300000 00000000 5018b801 36360000 6cd8d80f
ffff0001035330c0 4051516533 S Bi:6:002:1 -115 32768 <
ffff000103533480 4051517378 C Bi:6:002:1 0 444 = 84010484 00000f80 f9096000 04300000 00000000 d61bb801 38320000 66d9d90f
ffff000103533480 4051517405 S Bi:6:002:1 -115 32768 <
ffff000103533240 4051518267 C Bi:6:002:1 0 467 = 9b010484 00000f80 eb086000 04300000 00000000 381fb801 363a0000 6cdddd0f
ffff000103533240 4051518292 S Bi:6:002:1 -115 32768 <
ffff000103533780 4051519194 C Bi:6:002:1 0 477 = a5010484 00000f80 75086000 04300000 00000000 c322b801 36360000 6ad9d90f
ffff000103533780 4051519220 S Bi:6:002:1 -115 32768 <
ffff0001035330c0 4051617854 C Bi:6:002:1 0 476 = a4010484 00000f80 1c036000 04300000 00000000 41a4b901 34340000 6ad6d60f
ffff0001035330c0 4051617879 S Bi:6:002:1 -115 32768 <
ffff000103533480 4051618886 C Bi:6:002:1 0 469 = 9d010484 00000f80 6e0d6000 04300000 00000000 34a8b901 36360000 6adada0f
ffff000103533480 4051618916 S Bi:6:002:1 -115 32768 <
ffff000103533240 4051619729 C Bi:6:002:1 0 444 = 84010484 00000f80 fa096000 04300000 00000000 bcabb901 383a0000 6ddada0f
ffff000103533240 4051619750 S Bi:6:002:1 -115 32768 <
ffff000103533780 4051620616 C Bi:6:002:1 0 467 = 9b010484 00000f80 ec086000 04300000 00000000 19afb901 34360000 6cd9d90f
ffff000103533780 4051620642 S Bi:6:002:1 -115 32768 <
ffff0001035330c0 4051621555 C Bi:6:002:1 0 477 = a5010484 00000f80 76086000 04300000 00000000 92b2b901 34340000 69d6d60f
ffff0001035330c0 4051621581 S Bi:6:002:1 -115 32768 <
ffff000103533480 4051720309 C Bi:6:002:1 0 476 = a4010484 00000f80 1d036000 04300000 00000000 4234bb01 36360000 69d8d80f
ffff000103533480 4051720365 S Bi:6:002:1 -115 32768 <
ffff000103533240 4051721293 C Bi:6:002:1 0 469 = 9d010484 00000f80 6f0d6000 04300000 00000000 3a38bb01 34320000 6ad7d70f
ffff000103533240 4051721321 S Bi:6:002:1 -115 32768 <
ffff000103533780 4051722170 C Bi:6:002:1 0 444 = 84010484 00000f80 fb096000 04300000 00000000 d13bbb01 363a0000 6edddd0f
ffff000103533780 4051722195 S Bi:6:002:1 -115 32768 <
ffff0001035330c0 4051723067 C Bi:6:002:1 0 467 = 9b010484 00000f80 ed086000 04300000 00000000 383fbb01 34360000 69d9d90f
ffff0001035330c0 4051723092 S Bi:6:002:1 -115 32768 <
ffff000103533480 4051724002 C Bi:6:002:1 0 477 = a5010484 00000f80 77086000 04300000 00000000 b742bb01 36340000 6adada0f
ffff000103533480 4051724036 S Bi:6:002:1 -115 32768 <
ffff000103151e40 4051772178 S Ci:6:002:0 s c0 05 004c 0000 0001 1 <
ffff000103151e40 4051772302 C Ci:6:002:0 0 1 = 20
ffff000103151e40 4051772501 S Co:6:002:0 s 40 05 004c 0000 0001 1 = 20
ffff000103151e40 4051772643 C Co:6:002:0 0 1 >
ffff00011ac9e840 4051772953 S Ci:6:002:0 s c0 05 0770 0000 0004 4 <
ffff00011ac9e840 4051773115 C Ci:6:002:0 0 4 = 00000000
ffff00011ac9e840 4051773274 S Ci:6:002:0 s c0 05 0774 0000 0004 4 <
ffff00011ac9e840 4051773422 C Ci:6:002:0 0 4 = 00000000
ffff00011ac9e840 4051773583 S Co:6:002:0 s 40 05 076e 0000 0001 1 = 0c
ffff00011ac9e840 4051773721 C Co:6:002:0 0 1 >
ffff00011ac9e840 4051773873 S Ci:6:002:0 s c0 05 0808 0000 0004 4 <
ffff00011ac9e840 4051774011 C Ci:6:002:0 0 4 = 3382023e
ffff00011ac9e840 4051774048 S Ci:6:002:0 s c0 05 0a5c 0000 0002 2 <
ffff00011ac9e840 4051774158 C Ci:6:002:0 0 2 = 9e00
ffff00011ac9e840 4051774189 S Ci:6:002:0 s c0 05 0f48 0000 0002 2 <
ffff00011ac9e840 4051774300 C Ci:6:002:0 0 2 = 1e0c
ffff00011ac9e840 4051774331 S Ci:6:002:0 s c0 05 0f04 0000 0004 4 <
ffff00011ac9e840 4051774443 C Ci:6:002:0 0 4 = 01000900
ffff00011ac9e840 4051774472 S Ci:6:002:0 s c0 05 0f14 0000 0004 4 <
ffff00011ac9e840 4051774589 C Ci:6:002:0 0 4 = 78000900
ffff00011ac9e840 4051774610 S Ci:6:002:0 s c0 05 0f10 0000 0004 4 <
ffff00011ac9e840 4051774723 C Ci:6:002:0 0 4 = 00000000
ffff00011ac9e840 4051774752 S Ci:6:002:0 s c0 05 0f0c 0000 0004 4 <
ffff00011ac9e840 4051774870 C Ci:6:002:0 0 4 = 00000000
ffff00011ac9e840 4051774891 S Ci:6:002:0 s c0 05 0f08 0000 0004 4 <
ffff00011ac9e840 4051775014 C Ci:6:002:0 0 4 = d2009f0c
ffff00011ac9e840 4051775044 S Ci:6:002:0 s c0 05 0fcc 0000 0004 4 <
ffff00011ac9e840 4051775162 C Ci:6:002:0 0 4 = 00000000
ffff00011ac9e840 4051775183 S Ci:6:002:0 s c0 05 09a4 0000 0004 4 <
ffff00011ac9e840 4051775295 C Ci:6:002:0 0 4 = 80000800
ffff00011ac9e840 4051775326 S Co:6:002:0 s 40 05 09a4 0000 0004 4 = 80000a00
ffff00011ac9e840 4051775432 C Co:6:002:0 0 4 >
ffff00011ac9e840 4051775462 S Ci:6:002:0 s c0 05 09a4 0000 0004 4 <
ffff00011ac9e840 4051775574 C Ci:6:002:0 0 4 = 80000a00
ffff00011ac9e840 4051775604 S Co:6:002:0 s 40 05 09a4 0000 0004 4 = 80000800
ffff00011ac9e840 4051775711 C Co:6:002:0 0 4 >
ffff00011ac9e840 4051775741 S Ci:6:002:0 s c0 05 0a2c 0000 0004 4 <
ffff00011ac9e840 4051775853 C Ci:6:002:0 0 4 = 00809000
ffff00011ac9e840 4051775884 S Co:6:002:0 s 40 05 0a2c 0000 0004 4 = 00009000
ffff00011ac9e840 4051775991 C Co:6:002:0 0 4 >
ffff00011ac9e840 4051776022 S Ci:6:002:0 s c0 05 0a2c 0000 0004 4 <
ffff00011ac9e840 4051776142 C Ci:6:002:0 0 4 = 00009000
ffff00011ac9e840 4051776171 S Co:6:002:0 s 40 05 0a2c 0000 0004 4 = 00809000
ffff00011ac9e840 4051776284 C Co:6:002:0 0 4 >
ffff00011ac9e840 4051776304 S Ci:6:002:0 s c0 05 0b58 0000 0004 4 <
ffff00011ac9e840 4051776416 C Ci:6:002:0 0 4 = 00000000
ffff00011ac9e840 4051776445 S Co:6:002:0 s 40 05 0b58 0000 0004 4 = 01000000
ffff00011ac9e840 4051776559 C Co:6:002:0 0 4 >
ffff00011ac9e840 4051776580 S Ci:6:002:0 s c0 05 0b58 0000 0004 4 <
ffff00011ac9e840 4051776692 C Ci:6:002:0 0 4 = 01000000
ffff00011ac9e840 4051776721 S Co:6:002:0 s 40 05 0b58 0000 0004 4 = 00000000
ffff00011ac9e840 4051776835 C Co:6:002:0 0 4 >
ffff00011ac9e840 4051776857 S Ci:6:002:0 s c0 05 01cc 0000 0001 1 <
ffff00011ac9e840 4051776968 C Ci:6:002:0 0 1 = 00
ffff00011ac9e840 4051776998 S Co:6:002:0 s 40 05 01f4 0000 0004 4 = 00000000
ffff00011ac9e840 4051777111 C Co:6:002:0 0 4 >
ffff00011ac9e840 4051777132 S Co:6:002:0 s 40 05 01d4 0000 0004 4 = 58000000
ffff00011ac9e840 4051777239 C Co:6:002:0 0 4 >
ffff00011ac9e840 4051777268 S Co:6:002:0 s 40 05 0440 0000 0004 4 = 00000000
ffff00011ac9e840 4051777385 C Co:6:002:0 0 4 >
ffff00011ac9e840 4051777407 S Ci:6:002:0 s c0 05 0c00 0000 0004 4 <
ffff00011ac9e840 4051777519 C Ci:6:002:0 0 4 = 07000000
ffff00011ac9e840 4051777548 S Ci:6:002:0 s c0 05 08b0 0000 0004 4 <
ffff00011ac9e840 4051777666 C Ci:6:002:0 0 4 = 18060000
ffff00011ac9e840 4051777686 S Co:6:002:0 s 40 05 08b0 0000 0004 4 = 42060000
ffff00011ac9e840 4051777793 C Co:6:002:0 0 4 >
ffff00011ac9e840 4051777844 S Ci:6:002:0 s c0 05 0d04 0000 0004 4 <
ffff00011ac9e840 4051777952 C Ci:6:002:0 0 4 = 108d90b1
ffff00011ac9e840 4051777981 S Co:6:002:0 s 40 05 0c90 0000 0004 4 = 108d2304
ffff00011ac9e840 4051778094 C Co:6:002:0 0 4 >
ffff00011ac9e840 4051778129 S Co:6:002:0 s 40 05 0280 0000 0002 2 = 0001
ffff00011ac9e840 4051778230 C Co:6:002:0 0 2 >
ffff00011ac9e840 4051778252 S Ci:6:002:0 s c0 05 010c 0000 0001 1 <
ffff00011ac9e840 4051778367 C Ci:6:002:0 0 1 = b4
ffff00011ac9e840 4051778396 S Co:6:002:0 s 40 05 010c 0000 0001 1 = b4
ffff00011ac9e840 4051778512 C Co:6:002:0 0 1 >
ffff000103533240 4051822695 C Bi:6:002:1 0 476 = a4010484 00000f80 1e036000 04300000 00000000 44c4bc01 36340000 6edada0f
ffff000103533240 4051822722 S Bi:6:002:1 -115 32768 <
ffff000103533780 4051823709 C Bi:6:002:1 0 469 = 9d010484 00000f80 700d6000 04300000 00000000 56c8bc01 36360000 67dada0f
ffff000103533780 4051823735 S Bi:6:002:1 -115 32768 <
ffff0001035330c0 4051824566 C Bi:6:002:1 0 444 = 84010484 00000f80 fc096000 04300000 00000000 d9cbbc01 3a3a0000 6ddbdb0f
ffff0001035330c0 4051824590 S Bi:6:002:1 -115 32768 <
ffff000103533480 4051825482 C Bi:6:002:1 0 467 = 9b010484 00000f80 ee086000 04300000 00000000 38cfbc01 36320000 6ad8d80f
ffff000103533480 4051825512 S Bi:6:002:1 -115 32768 <
ffff000103533240 4051826377 C Bi:6:002:1 0 477 = a5010484 00000f80 78086000 04300000 00000000 b7d2bc01 36320000 68d6d60f
ffff000103533240 4051826402 S Bi:6:002:1 -115 32768 <
ffff000103533780 4051925062 C Bi:6:002:1 0 476 = a4010484 00000f80 1f036000 04300000 00000000 4654be01 36340000 6bd8d80f
ffff000103533780 4051925095 S Bi:6:002:1 -115 32768 <
ffff0001035330c0 4051926104 C Bi:6:002:1 0 469 = 9d010484 00000f80 710d6000 04300000 00000000 4d58be01 36320000 67d6d60f
ffff0001035330c0 4051926131 S Bi:6:002:1 -115 32768 <
ffff000103533480 4051926983 C Bi:6:002:1 0 444 = 84010484 00000f80 fd096000 04300000 00000000 df5bbe01 34340000 69d8d80f
ffff000103533480 4051927009 S Bi:6:002:1 -115 32768 <
ffff000103533240 4051927859 C Bi:6:002:1 0 467 = 9b010484 00000f80 ef086000 04300000 00000000 445fbe01 36340000 6cd9d90f
ffff000103533240 4051927881 S Bi:6:002:1 -115 32768 <
ffff000103533780 4051928775 C Bi:6:002:1 0 477 = a5010484 00000f80 79086000 04300000 00000000 c062be01 36340000 6dd9d90f
ffff000103533780 4051928798 S Bi:6:002:1 -115 32768 <
ffff0001035330c0 4051980168 C Bi:6:002:1 0 470 = 9e010484 00000f00 c0076000 04300000 00000000 902bbf01 34340000 68dada0f
ffff0001035330c0 4051980218 S Bi:6:002:1 -115 32768 <
ffff000103533480 4051980935 C Bi:6:002:1 0 470 = 9e010484 00000f00 c0076000 04300000 00000000 952ebf01 36340000 6bd9d90f
ffff000103533480 4051980956 S Bi:6:002:1 -115 32768 <
ffff000103533240 4051981708 C Bi:6:002:1 0 470 = 9e010484 00000f00 c0076000 04300000 00000000 7f31bf01 38380000 6bd9d90f
ffff000103533240 4051981732 S Bi:6:002:1 -115 32768 <
ffff000103533780 4051982436 C Bi:6:002:1 0 470 = 9e010484 00000f00 c0076000 04300000 00000000 5b34bf01 34320000 6ad9d90f
ffff000103533780 4051982463 S Bi:6:002:1 -115 32768 <
ffff0001035330c0 4051983181 C Bi:6:002:1 0 463 = 97010484 00000f00 db0e6000 04300000 00000000 4e37bf01 34360000 6dd7d70f
ffff0001035330c0 4051983206 S Bi:6:002:1 -115 32768 <
ffff000103533480 4051983950 C Bi:6:002:1 0 463 = 97010484 00000f00 db0e6000 04300000 00000000 5f3abf01 36320000 6bd6d60f
ffff000103533480 4051983971 S Bi:6:002:1 -115 32768 <
ffff000103533240 4051984698 C Bi:6:002:1 0 463 = 97010484 00000f00 db0e6000 04300000 00000000 523dbf01 363a0000 6bdddd0f
ffff000103533240 4051984718 S Bi:6:002:1 -115 32768 <
ffff000103533780 4051985460 C Bi:6:002:1 0 463 = 97010484 00000f00 db0e6000 04300000 00000000 4440bf01 34360000 68dada0f
ffff000103533780 4051985482 S Bi:6:002:1 -115 32768 <
ffff0001035330c0 4051986154 C Bi:6:002:1 0 438 = 7e010484 00000f00 880b6000 04300000 00000000 2643bf01 38360000 6ddcdc0f
ffff0001035330c0 4051986174 S Bi:6:002:1 -115 32768 <
ffff000103533480 4051986959 C Bi:6:002:1 0 471 = 9f010484 00000f00 a4086000 04300000 00000000 1c46bf01 34340000 6bd5d50f
ffff000103533480 4051986979 S Bi:6:002:1 -115 32768 <
ffff000103533240 4051987706 C Bi:6:002:1 0 471 = 9f010484 00000f00 a4086000 04300000 00000000 0a49bf01 34320000 6bd5d50f
ffff000103533240 4051987725 S Bi:6:002:1 -115 32768 <
ffff000103533780 4051988458 C Bi:6:002:1 0 471 = 9f010484 00000f00 a4086000 04300000 00000000 ef4bbf01 36340000 6ddbdb0f
ffff000103533780 4051988481 S Bi:6:002:1 -115 32768 <
ffff0001035330c0 4051989315 C Bi:6:002:1 0 471 = 9f010484 00000f00 a4086000 04300000 00000000 544fbf01 34360000 6cd8d80f
ffff0001035330c0 4051989335 S Bi:6:002:1 -115 32768 <
ffff000103533480 4052027463 C Bi:6:002:1 0 476 = a4010484 00000f80 20036000 04300000 00000000 47e4bf01 34340000 6cdada0f
ffff000103533480 4052027498 S Bi:6:002:1 -115 32768 <
ffff000103533240 4052028450 C Bi:6:002:1 0 469 = 9d010484 00000f80 720d6000 04300000 00000000 2ce8bf01 34360000 67d7d70f
ffff000103533240 4052028477 S Bi:6:002:1 -115 32768 <
ffff000103533780 4052029350 C Bi:6:002:1 0 444 = 84010484 00000f80 fe096000 04300000 00000000 d3ebbf01 38380000 6bdddd0f
ffff000103533780 4052029373 S Bi:6:002:1 -115 32768 <
ffff0001035330c0 4052030239 C Bi:6:002:1 0 467 = 9b010484 00000f80 f0086000 04300000 00000000 32efbf01 36380000 6adddd0f
ffff0001035330c0 4052030260 S Bi:6:002:1 -115 32768 <
ffff000103533480 4052031147 C Bi:6:002:1 0 477 = a5010484 00000f80 7a086000 04300000 00000000 acf2bf01 36360000 6dd8d80f
ffff000103533480 4052031169 S Bi:6:002:1 -115 32768 <
ffff000103533240 4052129855 C Bi:6:002:1 0 476 = a4010484 00000f80 21036000 04300000 00000000 4974c101 36340000 69dada0f
ffff000103533240 4052129899 S Bi:6:002:1 -115 32768 <
ffff000103533780 4052130923 C Bi:6:002:1 0 469 = 9d010484 00000f80 730d6000 04300000 00000000 4b78c101 362e0000 6bd9d90f
ffff000103533780 4052130951 S Bi:6:002:1 -115 32768 <
ffff0001035330c0 4052131743 C Bi:6:002:1 0 444 = 84010484 00000f80 ff096000 04300000 00000000 cd7bc101 38380000 6bdada0f
ffff0001035330c0 4052131765 S Bi:6:002:1 -115 32768 <
ffff000103533480 4052132690 C Bi:6:002:1 0 467 = 9b010484 00000f80 f1086000 04300000 00000000 287fc101 34340000 68dada0f
ffff000103533480 4052132723 S Bi:6:002:1 -115 32768 <
ffff000103533240 4052133549 C Bi:6:002:1 0 477 = a5010484 00000f80 7b086000 04300000 00000000 af82c101 36360000 6cdada0f
ffff000103533240 4052133571 S Bi:6:002:1 -115 32768 <
ffff000103533780 4052232217 C Bi:6:002:1 0 476 = a4010484 00000f80 22036000 04300000 00000000 4a04c301 36360000 69dbdb0f
ffff000103533780 4052232233 S Bi:6:002:1 -115 32768 <
ffff0001035330c0 4052233302 C Bi:6:002:1 0 469 = 9d010484 00000f80 740d6000 04300000 00000000 5d08c301 36340000 68d9d90f
ffff0001035330c0 4052233326 S Bi:6:002:1 -115 32768 <
ffff000103533480 4052234193 C Bi:6:002:1 0 444 = 84010484 00000f80 000a6000 04300000 00000000 e70bc301 36360000 6dd9d90f
ffff000103533480 4052234218 S Bi:6:002:1 -115 32768 <
ffff000103533240 4052235082 C Bi:6:002:1 0 467 = 9b010484 00000f80 f2086000 04300000 00000000 4a0fc301 38380000 6dd9d90f
ffff000103533240 4052235108 S Bi:6:002:1 -115 32768 <
ffff000103533780 4052235896 C Bi:6:002:1 0 477 = a5010484 00000f80 7c086000 04300000 00000000 c012c301 36380000 6bdddd0f
ffff000103533780 4052235913 S Bi:6:002:1 -115 32768 <
ffff0001035330c0 4052334671 C Bi:6:002:1 0 476 = a4010484 00000f80 23036000 04300000 00000000 4c94c401 383a0000 6ed9d90f
ffff0001035330c0 4052334719 S Bi:6:002:1 -115 32768 <
ffff000103533480 4052335724 C Bi:6:002:1 0 469 = 9d010484 00000f80 750d6000 04300000 00000000 6198c401 34340000 69dada0f
ffff000103533480 4052335752 S Bi:6:002:1 -115 32768 <
ffff000103533240 4052336581 C Bi:6:002:1 0 444 = 84010484 00000f80 010a6000 04300000 00000000 e09bc401 34360000 6cdada0f
ffff000103533240 4052336606 S Bi:6:002:1 -115 32768 <
ffff000103533780 4052337480 C Bi:6:002:1 0 467 = 9b010484 00000f80 f3086000 04300000 00000000 459fc401 36340000 69dada0f
ffff000103533780 4052337505 S Bi:6:002:1 -115 32768 <
ffff0001035330c0 4052338386 C Bi:6:002:1 0 477 = a5010484 00000f80 7d086000 04300000 00000000 c1a2c401 34340000 6bd8d80f
ffff0001035330c0 4052338410 S Bi:6:002:1 -115 32768 <
ffff000103533480 4052437114 C Bi:6:002:1 0 476 = a4010484 00000f80 24036000 04300000 00000000 4d24c601 34360000 6cd6d60f
ffff000103533480 4052437172 S Bi:6:002:1 -115 32768 <
ffff000103533240 4052438098 C Bi:6:002:1 0 469 = 9d010484 00000f80 760d6000 04300000 00000000 3e28c601 362e0000 6ad8d80f
ffff000103533240 4052438124 S Bi:6:002:1 -115 32768 <
ffff000103533780 4052438998 C Bi:6:002:1 0 444 = 84010484 00000f80 020a6000 04300000 00000000 f22bc601 363a0000 6cdede0f
ffff000103533780 4052439024 S Bi:6:002:1 -115 32768 <
ffff0001035330c0 4052439820 C Bi:6:002:1 0 467 = 9b010484 00000f80 f4086000 04300000 00000000 572fc601 36380000 6bdddd0f
ffff0001035330c0 4052439837 S Bi:6:002:1 -115 32768 <
ffff000103533480 4052440814 C Bi:6:002:1 0 477 = a5010484 00000f80 7e086000 04300000 00000000 c832c601 36320000 6cd7d70f
ffff000103533480 4052440837 S Bi:6:002:1 -115 32768 <
ffff000103533240 4052539507 C Bi:6:002:1 0 476 = a4010484 00000f80 25036000 04300000 00000000 4fb4c701 38380000 6ddada0f
ffff000103533240 4052539542 S Bi:6:002:1 -115 32768 <
ffff000103533780 4052540503 C Bi:6:002:1 0 469 = 9d010484 00000f80 770d6000 04300000 00000000 3bb8c701 34340000 69dada0f
ffff000103533780 4052540536 S Bi:6:002:1 -115 32768 <
ffff0001035330c0 4052541345 C Bi:6:002:1 0 444 = 84010484 00000f80 030a6000 04300000 00000000 c7bbc701 34360000 6ddada0f
ffff0001035330c0 4052541368 S Bi:6:002:1 -115 32768 <
ffff000103533480 4052542263 C Bi:6:002:1 0 467 = 9b010484 00000f80 f5086000 04300000 00000000 28bfc701 36320000 66d8d80f
ffff000103533480 4052542287 S Bi:6:002:1 -115 32768 <
ffff000103533240 4052543181 C Bi:6:002:1 0 477 = a5010484 00000f80 7f086000 04300000 00000000 bfc2c701 34340000 6bd7d70f
ffff000103533240 4052543207 S Bi:6:002:1 -115 32768 <
ffff000103533780 4052641877 C Bi:6:002:1 0 476 = a4010484 00000f80 26036000 04300000 00000000 5044c901 383a0000 6bd8d80f
ffff000103533780 4052641930 S Bi:6:002:1 -115 32768 <
ffff0001035330c0 4052642900 C Bi:6:002:1 0 469 = 9d010484 00000f80 780d6000 04300000 00000000 4f48c901 34340000 6adada0f
ffff0001035330c0 4052642923 S Bi:6:002:1 -115 32768 <
ffff000103533480 4052643786 C Bi:6:002:1 0 444 = 84010484 00000f80 040a6000 04300000 00000000 d94bc901 383a0000 6bd9d90f
ffff000103533480 4052643812 S Bi:6:002:1 -115 32768 <
ffff000103533240 4052644664 C Bi:6:002:1 0 467 = 9b010484 00000f80 f6086000 04300000 00000000 394fc901 38380000 6cdada0f
ffff000103533240 4052644688 S Bi:6:002:1 -115 32768 <
ffff000103533780 4052645547 C Bi:6:002:1 0 477 = a5010484 00000f80 80086000 04300000 00000000 ae52c901 34340000 6bd9d90f
ffff000103533780 4052645569 S Bi:6:002:1 -115 32768 <
ffff0001035330c0 4052744269 C Bi:6:002:1 0 476 = a4010484 00000f80 27036000 04300000 00000000 52d4ca01 36380000 6ae0e00f
ffff0001035330c0 4052744295 S Bi:6:002:1 -115 32768 <
ffff000103533480 4052745299 C Bi:6:002:1 0 469 = 9d010484 00000f80 790d6000 04300000 00000000 46d8ca01 34320000 69d5d50f
ffff000103533480 4052745327 S Bi:6:002:1 -115 32768 <
ffff000103533240 4052746157 C Bi:6:002:1 0 444 = 84010484 00000f80 050a6000 04300000 00000000 bedbca01 34360000 6bd9d90f
ffff000103533240 4052746183 S Bi:6:002:1 -115 32768 <
ffff000103533780 4052747058 C Bi:6:002:1 0 467 = 9b010484 00000f80 f7086000 04300000 00000000 32dfca01 36380000 6bdcdc0f
ffff000103533780 4052747083 S Bi:6:002:1 -115 32768 <
ffff0001035330c0 4052747961 C Bi:6:002:1 0 477 = a5010484 00000f80 81086000 04300000 00000000 abe2ca01 38360000 6bdbdb0f
ffff0001035330c0 4052747984 S Bi:6:002:1 -115 32768 <
ffff00011ac9e840 4052764265 S Ci:6:002:0 s c0 05 004c 0000 0001 1 <
ffff00011ac9e840 4052764335 C Ci:6:002:0 0 1 = 20
ffff00011ac9e840 4052764465 S Co:6:002:0 s 40 05 004c 0000 0001 1 = 20
ffff00011ac9e840 4052764605 C Co:6:002:0 0 1 >
ffff000103533480 4052847673 C Bi:6:002:1 0 469 = 9d010484 00000f80 7a0d6000 04300000 00000000 4568cc01 38380000 6ad9d90f
ffff000103533480 4052847714 S Bi:6:002:1 -115 32768 <
ffff000103533240 4052848584 C Bi:6:002:1 0 444 = 84010484 00000f80 060a6000 04300000 00000000 d76bcc01 362e0000 69dada0f
ffff000103533240 4052848610 S Bi:6:002:1 -115 32768 <
ffff000103533780 4052849498 C Bi:6:002:1 0 467 = 9b010484 00000f80 f8086000 04300000 00000000 5c6fcc01 362e0000 6ad8d80f
ffff000103533780 4052849524 S Bi:6:002:1 -115 32768 <
ffff0001035330c0 4052850406 C Bi:6:002:1 0 477 = a5010484 00000f80 82086000 04300000 00000000 d672cc01 363a0000 69dada0f
ffff0001035330c0 4052850431 S Bi:6:002:1 -115 32768 <
ffff000103533480 4052949112 C Bi:6:002:1 0 476 = a4010484 00000f80 29036000 04300000 00000000 55f4cd01 34340000 6ad8d80f
ffff000103533480 4052949138 S Bi:6:002:1 -115 32768 <
ffff000103533240 4052950134 C Bi:6:002:1 0 469 = 9d010484 00000f80 7b0d6000 04300000 00000000 77f8cd01 383a0000 6bd9d90f
ffff000103533240 4052950160 S Bi:6:002:1 -115 32768 <
ffff000103533780 4052951007 C Bi:6:002:1 0 444 = 84010484 00000f80 070a6000 04300000 00000000 fcfbcd01 36340000 6ad9d90f
ffff000103533780 4052951032 S Bi:6:002:1 -115 32768 <
ffff0001035330c0 4052951938 C Bi:6:002:1 0 467 = 9b010484 00000f80 f9086000 04300000 00000000 84ffcd01 36340000 68d8d80f
ffff0001035330c0 4052951961 S Bi:6:002:1 -115 32768 <
ffff000103533480 4052952878 C Bi:6:002:1 0 477 = a5010484 00000f80 83086000 04300000 00000000 1f03ce01 36340000 6bd8d80f
ffff000103533480 4052952905 S Bi:6:002:1 -115 32768 <
ffff000103533240 4053051514 C Bi:6:002:1 0 476 = a4010484 00000f80 2a036000 04300000 00000000 5784cf01 34360000 67dada0f
ffff000103533240 4053051562 S Bi:6:002:1 -115 32768 <
ffff000103533780 4053052490 C Bi:6:002:1 0 469 = 9d010484 00000f80 7c0d6000 04300000 00000000 5288cf01 36340000 6cd8d80f
ffff000103533780 4053052520 S Bi:6:002:1 -115 32768 <
ffff0001035330c0 4053053357 C Bi:6:002:1 0 444 = 84010484 00000f80 080a6000 04300000 00000000 e58bcf01 34360000 68d9d90f
ffff0001035330c0 4053053378 S Bi:6:002:1 -115 32768 <
ffff000103533480 4053054257 C Bi:6:002:1 0 467 = 9b010484 00000f80 fa086000 04300000 00000000 458fcf01 36340000 6bd8d80f
ffff000103533480 4053054277 S Bi:6:002:1 -115 32768 <
ffff000103533240 4053055186 C Bi:6:002:1 0 477 = a5010484 00000f80 84086000 04300000 00000000 df92cf01 36340000 69dada0f
ffff000103533240 4053055206 S Bi:6:002:1 -115 32768 <
ffff000103533780 4053153929 C Bi:6:002:1 0 476 = a4010484 00000f80 2b036000 04300000 00000000 5814d101 34320000 69d7d70f
ffff000103533780 4053153953 S Bi:6:002:1 -115 32768 <
ffff0001035330c0 4053154903 C Bi:6:002:1 0 469 = 9d010484 00000f80 7d0d6000 04300000 00000000 5518d101 34320000 69dada0f
ffff0001035330c0 4053154929 S Bi:6:002:1 -115 32768 <
ffff000103533480 4053155762 C Bi:6:002:1 0 444 = 84010484 00000f80 090a6000 04300000 00000000 df1bd101 363a0000 65dfdf0f
ffff000103533480 4053155783 S Bi:6:002:1 -115 32768 <
ffff000103533240 4053156644 C Bi:6:002:1 0 467 = 9b010484 00000f80 fb086000 04300000 00000000 401fd101 38380000 6bdada0f
ffff000103533240 4053156663 S Bi:6:002:1 -115 32768 <
ffff000103533780 4053157590 C Bi:6:002:1 0 477 = a5010484 00000f80 85086000 04300000 00000000 ba22d101 36340000 6bdbdb0f
ffff000103533780 4053157617 S Bi:6:002:1 -115 32768 <
ffff0001035330c0 4053256279 C Bi:6:002:1 0 476 = a4010484 00000f80 2c036000 04300000 00000000 5aa4d201 36340000 6bd9d90f
ffff0001035330c0 4053256335 S Bi:6:002:1 -115 32768 <
ffff000103533480 4053257309 C Bi:6:002:1 0 469 = 9d010484 00000f80 7e0d6000 04300000 00000000 55a8d201 34340000 6dd7d70f
ffff000103533480 4053257336 S Bi:6:002:1 -115 32768 <
ffff000103533240 4053258175 C Bi:6:002:1 0 444 = 84010484 00000f80 0a0a6000 04300000 00000000 e1abd201 363a0000 6bdddd0f
ffff000103533240 4053258200 S Bi:6:002:1 -115 32768 <
ffff000103533780 4053259089 C Bi:6:002:1 0 467 = 9b010484 00000f80 fc086000 04300000 00000000 55afd201 34340000 6dd6d60f
ffff000103533780 4053259114 S Bi:6:002:1 -115 32768 <
ffff0001035330c0 4053259993 C Bi:6:002:1 0 477 = a5010484 00000f80 86086000 04300000 00000000 ceb2d201 36320000 68dada0f
ffff0001035330c0 4053260018 S Bi:6:002:1 -115 32768 <
ffff000103533480 4053358680 C Bi:6:002:1 0 476 = a4010484 00000f80 2d036000 04300000 00000000 5b34d401 36340000 68d9d90f
ffff000103533480 4053358732 S Bi:6:002:1 -115 32768 <
ffff000103533240 4053359405 C Bi:6:002:1 0 285 = e5000484 00000f80 8f086000 04300000 00000000 3838d401 5a5a0000 b3e8e80f
ffff000103533240 4053359433 S Bi:6:002:1 -115 32768 <
ffff000103533780 4053360011 C Bi:6:002:1 0 469 = 9d010484 00000f80 7f0d6000 04300000 00000000 9f39d401 34360000 6cd7d70f
ffff000103533780 4053360033 S Bi:6:002:1 -115 32768 <
ffff0001035330c0 4053361024 C Bi:6:002:1 0 470 = 9e010484 00000f00 c1076000 04300000 00000000 853dd401 363a0000 6ddddd0f
ffff0001035330c0 4053361048 S Bi:6:002:1 -115 32768 <
ffff000103533480 4053361664 C Bi:6:002:1 0 444 = 84010484 00000f80 0b0a6000 04300000 00000000 1e40d401 34360000 6cd7d70f
ffff000103533480 4053361690 S Bi:6:002:1 -115 32768 <
ffff000103533240 4053362326 C Bi:6:002:1 0 463 = 97010484 00000f00 dc0e6000 04300000 00000000 a042d401 36360000 6ddada0f
ffff000103533240 4053362351 S Bi:6:002:1 -115 32768 <
ffff000103533780 4053362909 C Bi:6:002:1 0 467 = 9b010484 00000f80 fd086000 04300000 00000000 3145d401 34340000 6cd8d80f
ffff000103533780 4053362927 S Bi:6:002:1 -115 32768 <
ffff0001035330c0 4053363584 C Bi:6:002:1 0 438 = 7e010484 00000f00 890b6000 04300000 00000000 ab47d401 36340000 6bd9d90f
ffff0001035330c0 4053363610 S Bi:6:002:1 -115 32768 <
ffff000103533480 4053364195 C Bi:6:002:1 0 477 = a5010484 00000f80 87086000 04300000 00000000 1c4ad401 38360000 6adcdc0f
ffff000103533480 4053364213 S Bi:6:002:1 -115 32768 <
ffff000103533240 4053364921 C Bi:6:002:1 0 471 = 9f010484 00000f00 a5086000 04300000 00000000 ca4cd401 34360000 67d8d80f
ffff000103533240 4053364940 S Bi:6:002:1 -115 32768 <
ffff000103533780 4053461085 C Bi:6:002:1 0 476 = a4010484 00000f80 2e036000 04300000 00000000 5dc4d501 34320000 68d7d70f
ffff000103533780 4053461134 S Bi:6:002:1 -115 32768 <
ffff0001035330c0 4053462105 C Bi:6:002:1 0 469 = 9d010484 00000f80 800d6000 04300000 00000000 56c8d501 36320000 67d6d60f
ffff0001035330c0 4053462131 S Bi:6:002:1 -115 32768 <
ffff000103533480 4053462978 C Bi:6:002:1 0 444 = 84010484 00000f80 0c0a6000 04300000 00000000 e0cbd501 36340000 6ad9d90f
ffff000103533480 4053463002 S Bi:6:002:1 -115 32768 <
ffff000103533240 4053463857 C Bi:6:002:1 0 467 = 9b010484 00000f80 fe086000 04300000 00000000 37cfd501 34340000 68d9d90f
ffff000103533240 4053463881 S Bi:6:002:1 -115 32768 <
ffff000103533780 4053464756 C Bi:6:002:1 0 477 = a5010484 00000f80 88086000 04300000 00000000 b7d2d501 34360000 6bd8d80f
ffff000103533780 4053464785 S Bi:6:002:1 -115 32768 <
ffff0001035330c0 4053563525 C Bi:6:002:1 0 476 = a4010484 00000f80 2f036000 04300000 00000000 5e54d701 36340000 6cd9d90f
ffff0001035330c0 4053563580 S Bi:6:002:1 -115 32768 <
ffff000103533480 4053564473 C Bi:6:002:1 0 469 = 9d010484 00000f80 810d6000 04300000 00000000 4d58d701 222a0000 63dfdf0f
ffff000103533480 4053564511 S Bi:6:002:1 -115 32768 <
ffff000103533240 4053565325 C Bi:6:002:1 0 444 = 84010484 00000f80 0d0a6000 04300000 00000000 d35bd701 36340000 6ad8d80f
ffff000103533240 4053565347 S Bi:6:002:1 -115 32768 <
ffff000103533780 4053566186 C Bi:6:002:1 0 467 = 9b010484 00000f80 ff086000 04300000 00000000 3d5fd701 36360000 6cd7d70f
ffff000103533780 4053566204 S Bi:6:002:1 -115 32768 <
ffff0001035330c0 4053567084 C Bi:6:002:1 0 477 = a5010484 00000f80 89086000 04300000 00000000 ba62d701 34340000 6dd9d90f
ffff0001035330c0 4053567109 S Bi:6:002:1 -115 32768 <
ffff000103533480 4053665886 C Bi:6:002:1 0 476 = a4010484 00000f80 30036000 04300000 00000000 60e4d801 36380000 6adcdc0f
ffff000103533480 4053665940 S Bi:6:002:1 -115 32768 <
ffff000103533240 4053666931 C Bi:6:002:1 0 469 = 9d010484 00000f80 820d6000 04300000 00000000 6fe8d801 38380000 6ddbdb0f
ffff000103533240 4053666959 S Bi:6:002:1 -115 32768 <
ffff000103533780 4053667790 C Bi:6:002:1 0 444 = 84010484 00000f80 0e0a6000 04300000 00000000 eeebd801 36380000 6adbdb0f
ffff000103533780 4053667813 S Bi:6:002:1 -115 32768 <
ffff0001035330c0 4053668685 C Bi:6:002:1 0 467 = 9b010484 00000f80 00096000 04300000 00000000 52efd801 34360000 6bd9d90f
ffff0001035330c0 4053668710 S Bi:6:002:1 -115 32768 <
ffff000103533480 4053669598 C Bi:6:002:1 0 477 = a5010484 00000f80 8a086000 04300000 00000000 d2f2d801 363a0000 6be0e00f
ffff000103533480 4053669623 S Bi:6:002:1 -115 32768 <
ffff000103151e40 4053756238 S Ci:6:002:0 s c0 05 0770 0000 0004 4 <
ffff000103151e40 4053756399 C Ci:6:002:0 0 4 = 00000000
ffff000103151e40 4053756540 S Ci:6:002:0 s c0 05 0774 0000 0004 4 <
ffff000103151e40 4053756677 C Ci:6:002:0 0 4 = 00000000
ffff000103151e40 4053756820 S Co:6:002:0 s 40 05 076e 0000 0001 1 = 0c
ffff000103151e40 4053756947 C Co:6:002:0 0 1 >
ffff000103151e40 4053757097 S Ci:6:002:0 s c0 05 0808 0000 0004 4 <
ffff000103151e40 4053757232 C Ci:6:002:0 0 4 = 3382023e
ffff000103151e40 4053757366 S Ci:6:002:0 s c0 05 0a5c 0000 0002 2 <
ffff000103151e40 4053757463 C Ci:6:002:0 0 2 = 0000
ffff000103151e40 4053757604 S Ci:6:002:0 s c0 05 0f48 0000 0002 2 <
ffff000103151e40 4053757718 C Ci:6:002:0 0 2 = 3800
ffff000103151e40 4053757780 S Ci:6:002:0 s c0 05 0f04 0000 0004 4 <
ffff000103151e40 4053757927 C Ci:6:002:0 0 4 = 00000000
ffff000103151e40 4053758058 S Ci:6:002:0 s c0 05 0f14 0000 0004 4 <
ffff000103151e40 4053758164 C Ci:6:002:0 0 4 = 74000300
ffff000103151e40 4053758302 S Ci:6:002:0 s c0 05 0f10 0000 0004 4 <
ffff000103151e40 4053758421 C Ci:6:002:0 0 4 = 00000000
ffff000103151e40 4053758552 S Ci:6:002:0 s c0 05 0f0c 0000 0004 4 <
ffff000103151e40 4053758634 C Ci:6:002:0 0 4 = 00000000
ffff000103151e40 4053758682 S Ci:6:002:0 s c0 05 0f08 0000 0004 4 <
ffff000103151e40 4053758810 C Ci:6:002:0 0 4 = 0000af00
ffff000103151e40 4053758935 S Ci:6:002:0 s c0 05 0fcc 0000 0004 4 <
ffff000103151e40 4053759062 C Ci:6:002:0 0 4 = 00000000
ffff000103151e40 4053759178 S Ci:6:002:0 s c0 05 09a4 0000 0004 4 <
ffff000103151e40 4053759255 C Ci:6:002:0 0 4 = 80000800
ffff000103151e40 4053759393 S Co:6:002:0 s 40 05 09a4 0000 0004 4 = 80000a00
ffff000103151e40 4053759494 C Co:6:002:0 0 4 >
ffff000103151e40 4053759536 S Ci:6:002:0 s c0 05 09a4 0000 0004 4 <
ffff000103151e40 4053759650 C Ci:6:002:0 0 4 = 80000a00
ffff000102d1d840 4053759689 S Co:6:002:0 s 40 05 09a4 0000 0004 4 = 80000800
ffff000102d1d840 4053759731 C Co:6:002:0 0 4 >
ffff000102d1d840 4053759875 S Ci:6:002:0 s c0 05 0a2c 0000 0004 4 <
ffff000102d1d840 4053760025 C Ci:6:002:0 0 4 = 00809000
ffff000102d1d840 4053760174 S Co:6:002:0 s 40 05 0a2c 0000 0004 4 = 00009000
ffff000102d1d840 4053760248 C Co:6:002:0 0 4 >
ffff000102d1d840 4053760322 S Ci:6:002:0 s c0 05 0a2c 0000 0004 4 <
ffff000102d1d840 4053760363 C Ci:6:002:0 0 4 = 00009000
ffff000102d1d840 4053760397 S Co:6:002:0 s 40 05 0a2c 0000 0004 4 = 00809000
ffff000102d1d840 4053760498 C Co:6:002:0 0 4 >
ffff000102d1d840 4053760554 S Ci:6:002:0 s c0 05 0b58 0000 0004 4 <
ffff000102d1d840 4053760699 C Ci:6:002:0 0 4 = 00000000
ffff000102d1d840 4053760787 S Co:6:002:0 s 40 05 0b58 0000 0004 4 = 01000000
ffff000102d1d840 4053760888 C Co:6:002:0 0 4 >
ffff000102d1d840 4053760929 S Ci:6:002:0 s c0 05 0b58 0000 0004 4 <
ffff000102d1d840 4053761036 C Ci:6:002:0 0 4 = 01000000
ffff000102d1d840 4053761094 S Co:6:002:0 s 40 05 0b58 0000 0004 4 = 00000000
ffff000102d1d840 4053761213 C Co:6:002:0 0 4 >
ffff000102d1d840 4053761270 S Ci:6:002:0 s c0 05 0c50 0000 0004 4 <
ffff000102d1d840 4053761383 C Ci:6:002:0 0 4 = 1e000000
ffff000102d1d840 4053761442 S Co:6:002:0 s 40 05 0c50 0000 0004 4 = 1c000000
ffff000102d1d840 4053761560 C Co:6:002:0 0 4 >
ffff000102d1d840 4053761614 S Ci:6:002:0 s c0 05 0e50 0000 0004 4 <
ffff000102d1d840 4053761745 C Ci:6:002:0 0 4 = 1e000000
ffff000102d1d840 4053761801 S Co:6:002:0 s 40 05 0e50 0000 0004 4 = 1c000000
ffff000102d1d840 4053761909 C Co:6:002:0 0 4 >
ffff000102d1d840 4053762085 S Ci:6:002:0 s c0 05 01cc 0000 0001 1 <
ffff000102d1d840 4053762202 C Ci:6:002:0 0 1 = 00
ffff000102d1d840 4053762254 S Co:6:002:0 s 40 05 01f8 0000 0004 4 = 00000000
ffff000102d1d840 4053762365 C Co:6:002:0 0 4 >
ffff000102d1d840 4053762415 S Co:6:002:0 s 40 05 01d8 0000 0004 4 = 58000000
ffff000102d1d840 4053762519 C Co:6:002:0 0 4 >
ffff000102d1d840 4053762571 S Co:6:002:0 s 40 05 0440 0000 0004 4 = 00000000
ffff000102d1d840 4053762673 C Co:6:002:0 0 4 >
ffff000102d1d840 4053762708 S Ci:6:002:0 s c0 05 0c00 0000 0004 4 <
ffff000102d1d840 4053762815 C Ci:6:002:0 0 4 = 07000000
ffff000102d1d840 4053762871 S Ci:6:002:0 s c0 05 08b0 0000 0004 4 <
ffff000102d1d840 4053762995 C Ci:6:002:0 0 4 = 42060000
ffff000102d1d840 4053763050 S Co:6:002:0 s 40 05 08b0 0000 0004 4 = 42060000
ffff000102d1d840 4053763167 C Co:6:002:0 0 4 >
ffff000102d1d840 4053763606 S Ci:6:002:0 s c0 05 0d04 0000 0004 4 <
ffff000102d1d840 4053763738 C Ci:6:002:0 0 4 = 108d90b1
ffff000102d1d840 4053763796 S Ci:6:002:0 s c0 05 0c1c 0000 0004 4 <
ffff000102d1d840 4053763909 C Ci:6:002:0 0 4 = 0300402d
ffff000102d1d840 4053763959 S Co:6:002:0 s 40 05 0c1c 0000 0004 4 = 03000039
ffff000102d1d840 4053764069 C Co:6:002:0 0 4 >
ffff000102d1d840 4053764137 S Ci:6:002:0 s c0 05 0e1c 0000 0004 4 <
ffff000102d1d840 4053764265 C Ci:6:002:0 0 4 = 0300402d
ffff000102d1d840 4053764315 S Co:6:002:0 s 40 05 0e1c 0000 0004 4 = 0300e032
ffff000102d1d840 4053764419 C Co:6:002:0 0 4 >
ffff000102d1d840 4053764470 S Co:6:002:0 s 40 05 0280 0000 0002 2 = 0001
ffff000102d1d840 4053764572 C Co:6:002:0 0 2 >
ffff000102d1d840 4053764622 S Ci:6:002:0 s c0 05 010c 0000 0001 1 <
ffff000102d1d840 4053764745 C Ci:6:002:0 0 1 = b4
ffff000102d1d840 4053764797 S Co:6:002:0 s 40 05 010c 0000 0001 1 = b4
ffff000102d1d840 4053764837 C Co:6:002:0 0 1 >
ffff000103533240 4053768222 C Bi:6:002:1 0 476 = a4010484 00000f80 31036000 04300000 00000000 6274da01 362e0000 69dada0f
ffff000103533240 4053768242 S Bi:6:002:1 -115 32768 <
ffff000103533780 4053769276 C Bi:6:002:1 0 469 = 9d010484 00000f80 830d6000 04300000 00000000 5178da01 34360000 6cd9d90f
ffff000103533780 4053769302 S Bi:6:002:1 -115 32768 <
ffff0001035330c0 4053770170 C Bi:6:002:1 0 444 = 84010484 00000f80 0f0a6000 04300000 00000000 e57bda01 36380000 67d9d90f
ffff0001035330c0 4053770196 S Bi:6:002:1 -115 32768 <
ffff000103533480 4053771010 C Bi:6:002:1 0 467 = 9b010484 00000f80 01096000 04300000 00000000 4d7fda01 383a0000 6edada0f
ffff000103533480 4053771036 S Bi:6:002:1 -115 32768 <
ffff000103533240 4053771963 C Bi:6:002:1 0 477 = a5010484 00000f80 8b086000 04300000 00000000 c482da01 36340000 6adada0f
ffff000103533240 4053771989 S Bi:6:002:1 -115 32768 <
ffff000102d1d840 4053788167 S Ci:6:002:0 s c0 05 004c 0000 0001 1 <
ffff000102d1d840 4053788268 C Ci:6:002:0 0 1 = 20
ffff000102d1d840 4053788416 S Co:6:002:0 s 40 05 004c 0000 0001 1 = 20
ffff000102d1d840 4053788534 C Co:6:002:0 0 1 >
