ffff000103533240 4065266170 C Bi:6:002:1 0 383 = 47010484 00000f80 d80c6000 04300000 00000000 88e68902 443e0000 86f2f201
ffff000103533240 4065266242 S Bi:6:002:1 -115 32768 <
ffff000103533780 4065267490 C Bi:6:002:1 0 351 = 27010484 00000f80 0b0e6000 04300000 00000000 54ec8902 463a0000 83f6f601
ffff000103533780 4065267506 S Bi:6:002:1 -115 32768 <
ffff0001035330c0 4065268373 C Bi:6:002:1 0 374 = 3e010484 00000f80 de086000 04300000 00000000 4bef8902 463c0000 84fafa01
ffff0001035330c0 4065268396 S Bi:6:002:1 -115 32768 <
ffff000103533480 4065269170 C Bi:6:002:1 0 384 = 48010484 00000f80 ae0b6000 04300000 00000000 65f28902 423e0000 86f2f201
ffff000103533480 4065269192 S Bi:6:002:1 -115 32768 <
ffff000103533240 4065370190 C Bi:6:002:1 0 383 = 47010484 00000f80 d90c6000 04300000 00000000 ce7c8b02 443c0000 86f8f801
ffff000103533240 4065370247 S Bi:6:002:1 -115 32768 <
ffff000103533780 4065374281 C Bi:6:002:1 0 376 = 40010484 00000f80 47046000 04300000 00000000 158d8b02 463a0000 87f3f301
ffff000103533780 4065374308 S Bi:6:002:1 -115 32768 <
ffff0001035330c0 4065375103 C Bi:6:002:1 0 351 = 27010484 00000f80 0c0e6000 04300000 00000000 55908b02 46380000 85f2f201
ffff0001035330c0 4065375128 S Bi:6:002:1 -115 32768 <
ffff000103533480 4065375882 C Bi:6:002:1 0 374 = 3e010484 00000f80 df086000 04300000 00000000 47938b02 443a0000 88eeee01
ffff000103533480 4065375903 S Bi:6:002:1 -115 32768 <
ffff000103533240 4065376659 C Bi:6:002:1 0 384 = 48010484 00000f80 af0b6000 04300000 00000000 58968b02 443a0000 86f1f101
ffff000103533240 4065376679 S Bi:6:002:1 -115 32768 <
ffff000103533780 4065416270 C Bi:6:002:1 0 195 = 8b000484 00000f80 b6056000 04300000 00000000 f8318c02 3c3a0000 79f1f101
ffff000103533780 4065416301 S Bi:6:002:1 -115 32768 <
ffff0001035330c0 4065427720 C Bi:6:002:1 0 195 = 8b000484 00000f80 b7056000 02300000 00000000 9e5e8c02 36360000 18540001
ffff0001035330c0 4065427743 S Bi:6:002:1 -115 32768 <
ffff000103533480 4065475735 C Bi:6:002:1 0 376 = 40010484 00000f80 48046000 04300000 00000000 5f198d02 443a0000 85f1f101
ffff000103533480 4065475771 S Bi:6:002:1 -115 32768 <
ffff000103533240 4065477733 C Bi:6:002:1 0 351 = 27010484 00000f80 0d0e6000 04300000 00000000 32218d02 443c0000 87f6f601
ffff000103533240 4065477759 S Bi:6:002:1 -115 32768 <
ffff000103533780 4065574331 C Bi:6:002:1 0 376 = 40010484 00000f80 49046000 04300000 00000000 519a8e02 42340000 85000001
ffff000103533780 4065574369 S Bi:6:002:1 -115 32768 <
ffff0001035330c0 4065575094 C Bi:6:002:1 0 351 = 27010484 00000f80 0e0e6000 04300000 00000000 909d8e02 44380000 82e9e901
ffff0001035330c0 4065575119 S Bi:6:002:1 -115 32768 <
ffff000103533480 4065575900 C Bi:6:002:1 0 374 = 3e010484 00000f80 e1086000 04300000 00000000 8da08e02 463a0000 83fafa01
ffff000103533480 4065575923 S Bi:6:002:1 -115 32768 <
ffff000103533240 4065576782 C Bi:6:002:1 0 384 = 48010484 00000f80 b10b6000 04300000 00000000 bda38e02 42380000 82f6f601
ffff000103533240 4065576798 S Bi:6:002:1 -115 32768 <
ffff000103533780 4065676770 C Bi:6:002:1 0 376 = 40010484 00000f80 4a046000 04300000 00000000 792a9002 443e0000 80f5f501
ffff000103533780 4065676825 S Bi:6:002:1 -115 32768 <
ffff0001035330c0 4065677591 C Bi:6:002:1 0 351 = 27010484 00000f80 0f0e6000 04300000 00000000 e72d9002 423e0000 81eded01
ffff0001035330c0 4065677615 S Bi:6:002:1 -115 32768 <
ffff000103533480 4065678461 C Bi:6:002:1 0 374 = 3e010484 00000f80 e2086000 04300000 00000000 2e319002 443a0000 88efef01
ffff000103533480 4065678486 S Bi:6:002:1 -115 32768 <
ffff000103533240 4065679314 C Bi:6:002:1 0 384 = 48010484 00000f80 b20b6000 04300000 00000000 80349002 443c0000 85f3f301
ffff000103533240 4065679338 S Bi:6:002:1 -115 32768 <
ffff00011ac9e840 4065756258 S Ci:6:002:0 s c0 05 004c 0000 0001 1 <
ffff00011ac9e840 4065756424 C Ci:6:002:0 0 1 = 20
ffff00011ac9e840 4065756580 S Co:6:002:0 s 40 05 004c 0000 0001 1 = 20
ffff00011ac9e840 4065756721 C Co:6:002:0 0 1 >
ffff000103533780 4065778139 C Bi:6:002:1 0 383 = 47010484 00000f80 dd0c6000 04300000 00000000 90b69102 443a0000 87f6f601
ffff000103533780 4065778168 S Bi:6:002:1 -115 32768 <
ffff0001035330c0 4065779185 C Bi:6:002:1 0 376 = 40010484 00000f80 4b046000 04300000 00000000 b7ba9102 443c0000 85efef01
ffff0001035330c0 4065779208 S Bi:6:002:1 -115 32768 <
ffff000103533480 4065780004 C Bi:6:002:1 0 351 = 27010484 00000f80 100e6000 04300000 00000000 f1bd9102 463c0000 86f5f501
ffff000103533480 4065780029 S Bi:6:002:1 -115 32768 <
ffff000103533240 4065780845 C Bi:6:002:1 0 374 = 3e010484 00000f80 e3086000 04300000 00000000 2ec19102 443c0000 84f7f701
ffff000103533240 4065780869 S Bi:6:002:1 -115 32768 <
ffff000103533780 4065781669 C Bi:6:002:1 0 384 = 48010484 00000f80 b30b6000 04300000 00000000 52c49102 44380000 83eeee01
ffff000103533780 4065781693 S Bi:6:002:1 -115 32768 <
ffff00011ac9e840 4065788373 S Ci:6:002:0 s c0 05 0770 0000 0004 4 <
ffff00011ac9e840 4065788531 C Ci:6:002:0 0 4 = 00000000
ffff00011ac9e840 4065788687 S Ci:6:002:0 s c0 05 0774 0000 0004 4 <
ffff00011ac9e840 4065788835 C Ci:6:002:0 0 4 = 00000000
ffff00011ac9e840 4065788990 S Co:6:002:0 s 40 05 076e 0000 0001 1 = 0c
ffff00011ac9e840 4065789135 C Co:6:002:0 0 1 >
ffff00011ac9e840 4065789299 S Ci:6:002:0 s c0 05 0808 0000 0004 4 <
ffff00011ac9e840 4065789423 C Ci:6:002:0 0 4 = 3382023e
ffff00011ac9e840 4065789450 S Ci:6:002:0 s c0 05 0a5c 0000 0002 2 <
ffff00011ac9e840 4065789564 C Ci:6:002:0 0 2 = 4b00
ffff00011ac9e840 4065789593 S Ci:6:002:0 s c0 05 0f48 0000 0002 2 <
ffff00011ac9e840 4065789713 C Ci:6:002:0 0 2 = 3b21
ffff00011ac9e840 4065789736 S Ci:6:002:0 s c0 05 0f04 0000 0004 4 <
ffff00011ac9e840 4065789861 C Ci:6:002:0 0 4 = 02000a00
ffff00011ac9e840 4065789890 S Ci:6:002:0 s c0 05 0f14 0000 0004 4 <
ffff00011ac9e840 4065790004 C Ci:6:002:0 0 4 = 5f003400
ffff00011ac9e840 4065790025 S Ci:6:002:0 s c0 05 0f10 0000 0004 4 <
ffff00011ac9e840 4065790138 C Ci:6:002:0 0 4 = 00000000
ffff00011ac9e840 4065790170 S Ci:6:002:0 s c0 05 0f0c 0000 0004 4 <
ffff00011ac9e840 4065790282 C Ci:6:002:0 0 4 = 00000000
ffff00011ac9e840 4065790347 S Ci:6:002:0 s c0 05 0f08 0000 0004 4 <
ffff00011ac9e840 4065790468 C Ci:6:002:0 0 4 = 7d00c221
ffff00011ac9e840 4065790491 S Ci:6:002:0 s c0 05 0fcc 0000 0004 4 <
ffff00011ac9e840 4065790618 C Ci:6:002:0 0 4 = 00000000
ffff00011ac9e840 4065790647 S Ci:6:002:0 s c0 05 09a4 0000 0004 4 <
ffff00011ac9e840 4065790761 C Ci:6:002:0 0 4 = 80000800
ffff00011ac9e840 4065790782 S Co:6:002:0 s 40 05 09a4 0000 0004 4 = 80000a00
ffff00011ac9e840 4065790890 C Co:6:002:0 0 4 >
ffff00011ac9e840 4065790921 S Ci:6:002:0 s c0 05 09a4 0000 0004 4 <
ffff00011ac9e840 4065791040 C Ci:6:002:0 0 4 = 80000a00
ffff00011ac9e840 4065791063 S Co:6:002:0 s 40 05 09a4 0000 0004 4 = 80000800
ffff00011ac9e840 4065791171 C Co:6:002:0 0 4 >
ffff00011ac9e840 4065791201 S Ci:6:002:0 s c0 05 0a2c 0000 0004 4 <
ffff00011ac9e840 4065791315 C Ci:6:002:0 0 4 = 00809000
ffff00011ac9e840 4065791336 S Co:6:002:0 s 40 05 0a2c 0000 0004 4 = 00009000
ffff00011ac9e840 4065791444 C Co:6:002:0 0 4 >
ffff00011ac9e840 4065791473 S Ci:6:002:0 s c0 05 0a2c 0000 0004 4 <
ffff00011ac9e840 4065791592 C Ci:6:002:0 0 4 = 00009000
ffff00011ac9e840 4065791615 S Co:6:002:0 s 40 05 0a2c 0000 0004 4 = 00809000
ffff00011ac9e840 4065791734 C Co:6:002:0 0 4 >
ffff00011ac9e840 4065791764 S Ci:6:002:0 s c0 05 0b58 0000 0004 4 <
ffff00011ac9e840 4065791879 C Ci:6:002:0 0 4 = 00000000
ffff00011ac9e840 4065791908 S Co:6:002:0 s 40 05 0b58 0000 0004 4 = 01000000
ffff00011ac9e840 4065792017 C Co:6:002:0 0 4 >
ffff00011ac9e840 4065792040 S Ci:6:002:0 s c0 05 0b58 0000 0004 4 <
ffff00011ac9e840 4065792161 C Ci:6:002:0 0 4 = 01000000
ffff00011ac9e840 4065792190 S Co:6:002:0 s 40 05 0b58 0000 0004 4 = 00000000
ffff00011ac9e840 4065792227 C Co:6:002:0 0 4 >
ffff00011ac9e840 4065792244 S Ci:6:002:0 s c0 05 0c50 0000 0004 4 <
ffff00011ac9e840 4065792368 C Ci:6:002:0 0 4 = 20000000
ffff00011ac9e840 4065792398 S Co:6:002:0 s 40 05 0c50 0000 0004 4 = 22000000
ffff00011ac9e840 4065792433 C Co:6:002:0 0 4 >
ffff00011ac9e840 4065792449 S Ci:6:002:0 s c0 05 0e50 0000 0004 4 <
ffff00011ac9e840 4065792561 C Ci:6:002:0 0 4 = 20000000
ffff00011ac9e840 4065792591 S Co:6:002:0 s 40 05 0e50 0000 0004 4 = 22000000
ffff00011ac9e840 4065792699 C Co:6:002:0 0 4 >
ffff00011ac9e840 4065792729 S Ci:6:002:0 s c0 05 01cc 0000 0001 1 <
ffff00011ac9e840 4065792843 C Ci:6:002:0 0 1 = 00
ffff00011ac9e840 4065792864 S Co:6:002:0 s 40 05 01f0 0000 0004 4 = 00000000
ffff00011ac9e840 4065792984 C Co:6:002:0 0 4 >
ffff00011ac9e840 4065793013 S Co:6:002:0 s 40 05 01d0 0000 0004 4 = 58000000
ffff00011ac9e840 4065793123 C Co:6:002:0 0 4 >
ffff00011ac9e840 4065793144 S Co:6:002:0 s 40 05 0440 0000 0004 4 = 00000000
ffff00011ac9e840 4065793252 C Co:6:002:0 0 4 >
ffff00011ac9e840 4065793281 S Ci:6:002:0 s c0 05 0c00 0000 0004 4 <
ffff00011ac9e840 4065793400 C Ci:6:002:0 0 4 = 07000000
ffff00011ac9e840 4065793424 S Ci:6:002:0 s c0 05 08b0 0000 0004 4 <
ffff00011ac9e840 4065793537 C Ci:6:002:0 0 4 = 18060000
ffff00011ac9e840 4065793566 S Co:6:002:0 s 40 05 08b0 0000 0004 4 = 42060000
ffff00011ac9e840 4065793676 C Co:6:002:0 0 4 >
ffff00011ac9e840 4065793717 S Ci:6:002:0 s c0 05 0d04 0000 0004 4 <
ffff00011ac9e840 4065793823 C Ci:6:002:0 0 4 = 108d90b1
ffff00011ac9e840 4065793846 S Co:6:002:0 s 40 05 0c90 0000 0004 4 = 108d2304
ffff00011ac9e840 4065793960 C Co:6:002:0 0 4 >
ffff00011ac9e840 4065794003 S Co:6:002:0 s 40 05 0280 0000 0002 2 = 0001
ffff00011ac9e840 4065794113 C Co:6:002:0 0 2 >
ffff00011ac9e840 4065794143 S Ci:6:002:0 s c0 05 010c 0000 0001 1 <
ffff00011ac9e840 4065794260 C Ci:6:002:0 0 1 = b4
ffff00011ac9e840 4065794280 S Co:6:002:0 s 40 05 010c 0000 0001 1 = b4
ffff00011ac9e840 4065794389 C Co:6:002:0 0 1 >
ffff0001035330c0 4065882002 C Bi:6:002:1 0 383 = 47010484 00000f80 de0c6000 04300000 00000000 444c9302 443c0000 88f2f201
ffff0001035330c0 4065882029 S Bi:6:002:1 -115 32768 <
ffff000103533480 4065885252 C Bi:6:002:1 0 384 = 48010484 00000f80 b40b6000 04300000 00000000 f5589302 42320000 81fefe01
ffff000103533480 4065885277 S Bi:6:002:1 -115 32768 <
ffff000103533240 4065989747 C Bi:6:002:1 0 351 = 27010484 00000f80 120e6000 04300000 00000000 37f19402 46380000 86f8f801
ffff000103533240 4065989773 S Bi:6:002:1 -115 32768 <
ffff000103533780 4066085335 C Bi:6:002:1 0 383 = 47010484 00000f80 e00c6000 04300000 00000000 94669602 483a0000 8aefef01
ffff000103533780 4066085368 S Bi:6:002:1 -115 32768 <
ffff0001035330c0 4066089737 C Bi:6:002:1 0 351 = 27010484 00000f80 130e6000 04300000 00000000 dc779602 443c0000 85fefe01
ffff0001035330c0 4066089763 S Bi:6:002:1 -115 32768 <
ffff000103533480 4066091768 C Bi:6:002:1 0 374 = 3e010484 00000f80 e6086000 04300000 00000000 a97f9602 44380000 83eded01
ffff000103533480 4066091794 S Bi:6:002:1 -115 32768 <
ffff000103533240 4066093772 C Bi:6:002:1 0 384 = 48010484 00000f80 b60b6000 04300000 00000000 7c879602 443a0000 82f2f201
ffff000103533240 4066093797 S Bi:6:002:1 -115 32768 <
ffff000103533780 4066189191 C Bi:6:002:1 0 383 = 47010484 00000f80 e10c6000 04300000 00000000 48fc9702 423a0000 7ef9f901
ffff000103533780 4066189216 S Bi:6:002:1 -115 32768 <
ffff0001035330c0 4066190032 C Bi:6:002:1 0 376 = 40010484 00000f80 4f046000 04300000 00000000 8fff9702 443a0000 84f7f701
ffff0001035330c0 4066190058 S Bi:6:002:1 -115 32768 <
ffff000103533480 4066191641 C Bi:6:002:1 0 374 = 3e010484 00000f80 e7086000 04300000 00000000 c7059802 443c0000 83f6f601
ffff000103533480 4066191666 S Bi:6:002:1 -115 32768 <
ffff000103533240 4066192490 C Bi:6:002:1 0 384 = 48010484 00000f80 b70b6000 04300000 00000000 1a099802 443e0000 88eeee01
ffff000103533240 4066192514 S Bi:6:002:1 -115 32768 <
ffff000103533780 4066197550 C Bi:6:002:1 0 290 = ea000484 00000f80 be0b6000 00300000 00000000 31179802 443e0000 1b520001
ffff000103533780 4066197575 S Bi:6:002:1 -115 32768 <
ffff0001035330c0 4066199831 C Bi:6:002:1 0 377 = 41010484 00000f00 12096000 04300000 00000000 d5259802 463a0000 86f4f401
ffff0001035330c0 4066199856 S Bi:6:002:1 -115 32768 <
ffff000103533480 4066205792 C Bi:6:002:1 0 377 = 41010484 00000f00 12096000 04300000 00000000 023d9802 443c0000 88e5e501
ffff000103533480 4066205820 S Bi:6:002:1 -115 32768 <
ffff000103533240 4066206420 C Bi:6:002:1 0 370 = 3a010484 00000f00 55016000 04300000 00000000 9b3f9802 44380000 86f4f401
ffff000103533240 4066206448 S Bi:6:002:1 -115 32768 <
ffff000103533780 4066207058 C Bi:6:002:1 0 345 = 21010484 00000f00 83046000 04300000 00000000 35429802 443e0000 88f9f901
ffff000103533780 4066207083 S Bi:6:002:1 -115 32768 <
ffff0001035330c0 4066208143 C Bi:6:002:1 0 345 = 21010484 00000f00 83046000 04300000 00000000 6a469802 443e0000 84f8f801
ffff0001035330c0 4066208168 S Bi:6:002:1 -115 32768 <
ffff000103533480 4066208794 C Bi:6:002:1 0 378 = 42010484 00000f00 33066000 04300000 00000000 d2489802 463c0000 86eaea01
ffff000103533480 4066208818 S Bi:6:002:1 -115 32768 <
ffff000103151f00 4066249788 S Ci:6:002:0 s c0 05 0454 0000 0001 1 <
ffff000103151f00 4066249970 C Ci:6:002:0 0 1 = 00
ffff000103151f00 4066250015 S Ci:6:002:0 s c0 05 0860 0000 0004 4 <
ffff000103151f00 4066250128 C Ci:6:002:0 0 4 = 21c3d572
ffff000103151f00 4066250278 S Co:6:002:0 s 40 05 0860 0000 0004 4 = 21c3d572
ffff000103151f00 4066250322 C Co:6:002:0 0 4 >
ffff000103151f00 4066250366 S Ci:6:002:0 s c0 05 0c00 0000 0004 4 <
ffff000103151f00 4066250489 C Ci:6:002:0 0 4 = 07000000
ffff000103151f00 4066250529 S Ci:6:002:0 s c0 05 08b0 0000 0004 4 <
ffff000103151f00 4066250641 C Ci:6:002:0 0 4 = 42060000
ffff000103151f00 4066250677 S Co:6:002:0 s 40 05 08b0 0000 0004 4 = 18060000
ffff000103151f00 4066250783 C Co:6:002:0 0 4 >
ffff000103533a80 4066250846 S Ci:6:002:0 s c0 05 0d04 0000 0004 4 <
ffff000103533a80 4066250982 C Ci:6:002:0 0 4 = 017c90b1
ffff000103533a80 4066251028 S Co:6:002:0 s 40 05 0c90 0000 0004 4 = 017c8001
ffff000103533a80 4066251133 C Co:6:002:0 0 4 >
ffff000103533a80 4066251193 S Ci:6:002:0 s c0 05 08ac 0000 0004 4 <
ffff000103533a80 4066251311 C Ci:6:002:0 0 4 = 08faf00f
ffff000103533a80 4066251357 S Co:6:002:0 s 40 05 08ac 0000 0004 4 = 08faf00f
ffff000103533a80 4066251475 C Co:6:002:0 0 4 >
ffff000103533a80 4066251520 S Ci:6:002:0 s c0 05 08ac 0000 0004 4 <
ffff000103533a80 4066251630 C Ci:6:002:0 0 4 = 08faf00f
ffff000103533a80 4066251675 S Co:6:002:0 s 40 05 08ac 0000 0004 4 = 08faf00f
ffff000103533a80 4066251780 C Co:6:002:0 0 4 >
ffff000103533a80 4066251826 S Ci:6:002:0 s c0 05 08c4 0000 0004 4 <
ffff000103533a80 4066251944 C Ci:6:002:0 0 4 = 00000000
ffff000103533a80 4066251990 S Co:6:002:0 s 40 05 08c4 0000 0004 4 = 00000000
ffff000103533a80 4066252109 C Co:6:002:0 0 4 >
ffff000103533a80 4066252156 S Ci:6:002:0 s c0 05 0c00 0000 0004 4 <
ffff000103533a80 4066252276 C Ci:6:002:0 0 4 = 07000000
ffff000103533a80 4066252321 S Ci:6:002:0 s c0 05 08b0 0000 0004 4 <
ffff000103533a80 4066252431 C Ci:6:002:0 0 4 = 18060000
ffff000103533a80 4066252475 S Co:6:002:0 s 40 05 08b0 0000 0004 4 = 18060000
ffff000103533a80 4066252582 C Co:6:002:0 0 4 >
ffff000103533a80 4066252648 S Ci:6:002:0 s c0 05 0d04 0000 0004 4 <
ffff000103533a80 4066252766 C Ci:6:002:0 0 4 = 017c90b1
ffff000103533a80 4066252812 S Co:6:002:0 s 40 05 0c90 0000 0004 4 = 017c8001
ffff000103533a80 4066252918 C Co:6:002:0 0 4 >
ffff000103533a80 4066252977 S Ci:6:002:0 s c0 05 0e00 0000 0004 4 <
ffff000103533a80 4066253111 C Ci:6:002:0 0 4 = 07000000
ffff000103533a80 4066253157 S Ci:6:002:0 s c0 05 08b0 0000 0004 4 <
ffff000103533a80 4066253266 C Ci:6:002:0 0 4 = 18060000
ffff000103533a80 4066253311 S Co:6:002:0 s 40 05 08b0 0000 0004 4 = 18060000
ffff000103533a80 4066253417 C Co:6:002:0 0 4 >
ffff000103533a80 4066253485 S Ci:6:002:0 s c0 05 0d44 0000 0004 4 <
ffff000103533a80 4066253611 C Ci:6:002:0 0 4 = 017c90b1
ffff000103533a80 4066253657 S Co:6:002:0 s 40 05 0e90 0000 0004 4 = 017c8001
ffff000103533a80 4066253762 C Co:6:002:0 0 4 >
ffff000103533a80 4066253821 S Ci:6:002:0 s c0 05 08ac 0000 0004 4 <
ffff000103533a80 4066253939 C Ci:6:002:0 0 4 = 08faf00f
ffff000103533a80 4066253984 S Co:6:002:0 s 40 05 08ac 0000 0004 4 = 08faf00f
ffff000103533a80 4066254104 C Co:6:002:0 0 4 >
ffff000103533a80 4066254151 S Ci:6:002:0 s c0 05 08ac 0000 0004 4 <
ffff000103533a80 4066254269 C Ci:6:002:0 0 4 = 08faf00f
ffff000103533a80 4066254315 S Co:6:002:0 s 40 05 08ac 0000 0004 4 = 08faf00f
ffff000103533a80 4066254420 C Co:6:002:0 0 4 >
ffff000103533a80 4066254467 S Ci:6:002:0 s c0 05 08c4 0000 0004 4 <
ffff000103533a80 4066254611 C Ci:6:002:0 0 4 = 00000000
ffff000103533a80 4066254657 S Co:6:002:0 s 40 05 08c4 0000 0004 4 = 00000000
ffff000103533a80 4066254761 C Co:6:002:0 0 4 >
ffff000103533a80 4066254808 S Ci:6:002:0 s c0 05 0e00 0000 0004 4 <
ffff000103533a80 4066254927 C Ci:6:002:0 0 4 = 07000000
ffff000103533a80 4066254972 S Ci:6:002:0 s c0 05 08b0 0000 0004 4 <
ffff000103533a80 4066255081 C Ci:6:002:0 0 4 = 18060000
ffff000103533a80 4066255126 S Co:6:002:0 s 40 05 08b0 0000 0004 4 = 18060000
ffff000103533a80 4066255232 C Co:6:002:0 0 4 >
ffff000103533a80 4066255300 S Ci:6:002:0 s c0 05 0d44 0000 0004 4 <
ffff000103533a80 4066255418 C Ci:6:002:0 0 4 = 017c90b1
ffff000103533a80 4066255464 S Co:6:002:0 s 40 05 0e90 0000 0004 4 = 017c8001
ffff000103533a80 4066255569 C Co:6:002:0 0 4 >
ffff000103533a80 4066255628 S Ci:6:002:0 s c0 05 0668 0000 0002 2 <
ffff000103533a80 4066255747 C Ci:6:002:0 0 2 = 0010
ffff000103533a80 4066255793 S Co:6:002:0 s 40 05 0668 0000 0002 2 = 0010
ffff000103533a80 4066255898 C Co:6:002:0 0 2 >
ffff000103533a80 4066255945 S Co:6:002:0 s 40 05 0483 0000 0001 1 = 00
ffff000103533a80 4066256063 C Co:6:002:0 0 1 >
ffff000103533a80 4066256108 S Ci:6:002:0 s c0 05 0837 0000 0001 1 <
ffff000103533a80 4066256233 C Ci:6:002:0 0 1 = 00
ffff000103533a80 4066256279 S Ci:6:002:0 s c0 05 08ac 0000 0004 4 <
ffff000103533a80 4066256398 C Ci:6:002:0 0 4 = 08faf00f
ffff000103533a80 4066256445 S Co:6:002:0 s 40 05 08ac 0000 0004 4 = 08faf00f
ffff000103533a80 4066256560 C Co:6:002:0 0 4 >
ffff000103533a80 4066256606 S Ci:6:002:0 s c0 05 08c4 0000 0004 4 <
ffff000103533a80 4066256729 C Ci:6:002:0 0 4 = 00000000
ffff000103533a80 4066256773 S Co:6:002:0 s 40 05 08c4 0000 0004 4 = 00000000
ffff000103533a80 4066256879 C Co:6:002:0 0 4 >
ffff000103533a80 4066256927 S Ci:6:002:0 s c0 05 0848 0000 0004 4 <
ffff000103533a80 4066257045 C Ci:6:002:0 0 4 = 8bffd061
ffff000103533a80 4066257091 S Co:6:002:0 s 40 05 0848 0000 0004 4 = 8bffd061
ffff000103533a80 4066257197 C Co:6:002:0 0 4 >
ffff000103533a80 4066257243 S Ci:6:002:0 s c0 05 08ac 0000 0004 4 <
ffff000103533a80 4066257362 C Ci:6:002:0 0 4 = 08faf00f
ffff000103533a80 4066257408 S Co:6:002:0 s 40 05 08ac 0000 0004 4 = 08faf00f
ffff000103533a80 4066257514 C Co:6:002:0 0 4 >
ffff000103533a80 4066257560 S Ci:6:002:0 s c0 05 08ac 0000 0004 4 <
ffff000103533a80 4066257679 C Ci:6:002:0 0 4 = 08faf00f
ffff000103533a80 4066257725 S Co:6:002:0 s 40 05 08ac 0000 0004 4 = 08faf00f
ffff000103533a80 4066257831 C Co:6:002:0 0 4 >
ffff000103533a80 4066257877 S Ci:6:002:0 s c0 05 08c4 0000 0004 4 <
ffff000103533a80 4066257995 C Ci:6:002:0 0 4 = 00000000
ffff000103533a80 4066258040 S Co:6:002:0 s 40 05 08c4 0000 0004 4 = 00000000
ffff000103533a80 4066258146 C Co:6:002:0 0 4 >
ffff000103533a80 4066258193 S Ci:6:002:0 s c0 05 0c00 0000 0004 4 <
ffff000103533a80 4066258312 C Ci:6:002:0 0 4 = 07000000
ffff000103533a80 4066258357 S Ci:6:002:0 s c0 05 08b0 0000 0004 4 <
ffff000103533a80 4066258482 C Ci:6:002:0 0 4 = 18060000
ffff000103533a80 4066258528 S Co:6:002:0 s 40 05 08b0 0000 0004 4 = 18060000
ffff000103533a80 4066258634 C Co:6:002:0 0 4 >
ffff000103533a80 4066258702 S Ci:6:002:0 s c0 05 0d04 0000 0004 4 <
ffff000103533a80 4066258822 C Ci:6:002:0 0 4 = 017c90b1
ffff000103533a80 4066258867 S Co:6:002:0 s 40 05 0c90 0000 0004 4 = 017c8001
ffff000103533a80 4066258982 C Co:6:002:0 0 4 >
ffff000103533a80 4066259042 S Ci:6:002:0 s c0 05 0e00 0000 0004 4 <
ffff000103533a80 4066259161 C Ci:6:002:0 0 4 = 07000000
ffff000103533a80 4066259206 S Ci:6:002:0 s c0 05 08b0 0000 0004 4 <
ffff000103533a80 4066259317 C Ci:6:002:0 0 4 = 18060000
ffff000103533a80 4066259361 S Co:6:002:0 s 40 05 08b0 0000 0004 4 = 18060000
ffff000103533a80 4066259480 C Co:6:002:0 0 4 >
ffff000103533a80 4066259546 S Ci:6:002:0 s c0 05 0d44 0000 0004 4 <
ffff000103533a80 4066259665 C Ci:6:002:0 0 4 = 017c90b1
ffff000103533a80 4066259711 S Co:6:002:0 s 40 05 0e90 0000 0004 4 = 017c8001
ffff000103533a80 4066259818 C Co:6:002:0 0 4 >
ffff000103533a80 4066259899 S Ci:6:002:0 s c0 05 0c20 0000 0004 4 <
ffff000103533a80 4066260020 C Ci:6:002:0 0 4 = 13131313
ffff000103533a80 4066260115 S Co:6:002:0 s 40 05 0c20 0000 0004 4 = 13131313
ffff000103533a80 4066260233 C Co:6:002:0 0 4 >
ffff000103533a80 4066260283 S Ci:6:002:0 s c0 05 0c24 0000 0004 4 <
ffff000103533a80 4066260403 C Ci:6:002:0 0 4 = 20202020
ffff000103533a80 4066260448 S Co:6:002:0 s 40 05 0c24 0000 0004 4 = 20202020
ffff000103533a80 4066260554 C Co:6:002:0 0 4 >
ffff000103533a80 4066260601 S Ci:6:002:0 s c0 05 0c28 0000 0004 4 <
ffff000103533a80 4066260736 C Ci:6:002:0 0 4 = 20201e1c
ffff000103533a80 4066260782 S Co:6:002:0 s 40 05 0c28 0000 0004 4 = 20201e1c
ffff000103533a80 4066260888 C Co:6:002:0 0 4 >
ffff000103533a80 4066260934 S Ci:6:002:0 s c0 05 0c2c 0000 0004 4 <
ffff000103533a80 4066261055 C Ci:6:002:0 0 4 = 20202020
ffff000103533a80 4066261100 S Co:6:002:0 s 40 05 0c2c 0000 0004 4 = 20202020
ffff000103533a80 4066261206 C Co:6:002:0 0 4 >
ffff000103533a80 4066261253 S Ci:6:002:0 s c0 05 0c30 0000 0004 4 <
ffff000103533a80 4066261373 C Ci:6:002:0 0 4 = 20201e1c
ffff000103533a80 4066261419 S Co:6:002:0 s 40 05 0c30 0000 0004 4 = 20201e1c
ffff000103533a80 4066261524 C Co:6:002:0 0 4 >
ffff000103533a80 4066261571 S Ci:6:002:0 s c0 05 0c34 0000 0004 4 <
ffff000103533a80 4066261691 C Ci:6:002:0 0 4 = 20202020
ffff000103533a80 4066261736 S Co:6:002:0 s 40 05 0c34 0000 0004 4 = 20202020
ffff000103533a80 4066261856 C Co:6:002:0 0 4 >
ffff000103533a80 4066261902 S Ci:6:002:0 s c0 05 0c38 0000 0004 4 <
ffff000103533a80 4066262022 C Ci:6:002:0 0 4 = 201e1c1a
ffff000103533a80 4066262067 S Co:6:002:0 s 40 05 0c38 0000 0004 4 = 201e1c1a
ffff000103533a80 4066262173 C Co:6:002:0 0 4 >
ffff000103533a80 4066262220 S Ci:6:002:0 s c0 05 0c3c 0000 0004 4 <
ffff000103533a80 4066262355 C Ci:6:002:0 0 4 = 20202020
ffff000103533a80 4066262400 S Co:6:002:0 s 40 05 0c3c 0000 0004 4 = 20202020
ffff000103533a80 4066262507 C Co:6:002:0 0 4 >
ffff000103533a80 4066262553 S Ci:6:002:0 s c0 05 0c40 0000 0004 4 <
ffff000103533a80 4066262673 C Ci:6:002:0 0 4 = 20201e1c
ffff000103533a80 4066262719 S Co:6:002:0 s 40 05 0c40 0000 0004 4 = 20201e1c
ffff000103533a80 4066262824 C Co:6:002:0 0 4 >
ffff000103533a80 4066262871 S Ci:6:002:0 s c0 05 0c44 0000 0004 4 <
ffff000103533a80 4066262991 C Ci:6:002:0 0 4 = 1a181e1e
ffff000103533a80 4066263036 S Co:6:002:0 s 40 05 0c44 0000 0004 4 = 1a181e1e
ffff000103533a80 4066263142 C Co:6:002:0 0 4 >
ffff000103533a80 4066263189 S Ci:6:002:0 s c0 05 0c48 0000 0004 4 <
ffff000103533a80 4066263309 C Ci:6:002:0 0 4 = 1e1e1e1e
ffff000103533a80 4066263354 S Co:6:002:0 s 40 05 0c48 0000 0004 4 = 1e1e1e1e
ffff000103533a80 4066263461 C Co:6:002:0 0 4 >
ffff000103533a80 4066263507 S Ci:6:002:0 s c0 05 0c4c 0000 0004 4 <
ffff000103533a80 4066263626 C Ci:6:002:0 0 4 = 1c1a1816
ffff000103533a80 4066263672 S Co:6:002:0 s 40 05 0c4c 0000 0004 4 = 1c1a1816
ffff000103533a80 4066263778 C Co:6:002:0 0 4 >
ffff000103533a80 4066263824 S Ci:6:002:0 s c0 05 0c54 0000 0004 4 <
ffff000103533a80 4066263944 C Ci:6:002:0 0 4 = 120a0400
ffff000103533a80 4066263989 S Co:6:002:0 s 40 05 0c54 0000 0004 4 = 120a0400
ffff000103533a80 4066264111 C Co:6:002:0 0 4 >
ffff000103533a80 4066264162 S Ci:6:002:0 s c0 05 0e20 0000 0004 4 <
ffff000103533a80 4066264285 C Ci:6:002:0 0 4 = 14141414
ffff000103533a80 4066264333 S Co:6:002:0 s 40 05 0e20 0000 0004 4 = 14141414
ffff000103533a80 4066264446 C Co:6:002:0 0 4 >
ffff000103533a80 4066264493 S Ci:6:002:0 s c0 05 0e24 0000 0004 4 <
ffff000103533a80 4066264613 C Ci:6:002:0 0 4 = 1d1d1d1d
ffff000103533a80 4066264659 S Co:6:002:0 s 40 05 0e24 0000 0004 4 = 1d1d1d1d
ffff000103533a80 4066264765 C Co:6:002:0 0 4 >
ffff000103533a80 4066264811 S Ci:6:002:0 s c0 05 0e28 0000 0004 4 <
ffff000103533a80 4066264931 C Ci:6:002:0 0 4 = 1d1d1b19
ffff000103533a80 4066264977 S Co:6:002:0 s 40 05 0e28 0000 0004 4 = 1d1d1b19
ffff000103533a80 4066265083 C Co:6:002:0 0 4 >
ffff000103533a80 4066265129 S Ci:6:002:0 s c0 05 0e2c 0000 0004 4 <
ffff000103533a80 4066265249 C Ci:6:002:0 0 4 = 1f1f1f1f
ffff000103533a80 4066265295 S Co:6:002:0 s 40 05 0e2c 0000 0004 4 = 1f1f1f1f
ffff000103533a80 4066265401 C Co:6:002:0 0 4 >
ffff000103533a80 4066265447 S Ci:6:002:0 s c0 05 0e30 0000 0004 4 <
ffff000103533a80 4066265568 C Ci:6:002:0 0 4 = 1f1f1d1b
ffff000103533a80 4066265614 S Co:6:002:0 s 40 05 0e30 0000 0004 4 = 1f1f1d1b
ffff000103533a80 4066265732 C Co:6:002:0 0 4 >
ffff000103533a80 4066265779 S Ci:6:002:0 s c0 05 0e34 0000 0004 4 <
ffff000103533a80 4066265899 C Ci:6:002:0 0 4 = 1f1f1f1f
ffff000103533a80 4066265945 S Co:6:002:0 s 40 05 0e34 0000 0004 4 = 1f1f1f1f
ffff000103533a80 4066266051 C Co:6:002:0 0 4 >
ffff000103533a80 4066266097 S Ci:6:002:0 s c0 05 0e38 0000 0004 4 <
ffff000103533a80 4066266235 C Ci:6:002:0 0 4 = 1f1d1b19
ffff000103533a80 4066266280 S Co:6:002:0 s 40 05 0e38 0000 0004 4 = 1f1d1b19
ffff000103533a80 4066266387 C Co:6:002:0 0 4 >
ffff000103533a80 4066266434 S Ci:6:002:0 s c0 05 0e3c 0000 0004 4 <
ffff000103533a80 4066266554 C Ci:6:002:0 0 4 = 1f1f1f1f
ffff000103533a80 4066266600 S Co:6:002:0 s 40 05 0e3c 0000 0004 4 = 1f1f1f1f
ffff000103533a80 4066266705 C Co:6:002:0 0 4 >
ffff000103533a80 4066266751 S Ci:6:002:0 s c0 05 0e40 0000 0004 4 <
ffff000103533a80 4066266872 C Ci:6:002:0 0 4 = 1f1f1d1b
ffff000103533a80 4066266918 S Co:6:002:0 s 40 05 0e40 0000 0004 4 = 1f1f1d1b
ffff000103533a80 4066267024 C Co:6:002:0 0 4 >
ffff000103533a80 4066267071 S Ci:6:002:0 s c0 05 0e44 0000 0004 4 <
ffff000103533a80 4066267192 C Ci:6:002:0 0 4 = 19171d1d
ffff000103533a80 4066267238 S Co:6:002:0 s 40 05 0e44 0000 0004 4 = 19171d1d
ffff000103533a80 4066267355 C Co:6:002:0 0 4 >
ffff000103533a80 4066267402 S Ci:6:002:0 s c0 05 0e48 0000 0004 4 <
ffff000103533a80 4066267522 C Ci:6:002:0 0 4 = 1d1d1d1d
ffff000103533a80 4066267567 S Co:6:002:0 s 40 05 0e48 0000 0004 4 = 1d1d1d1d
ffff000103533a80 4066267674 C Co:6:002:0 0 4 >
ffff000103533a80 4066267721 S Ci:6:002:0 s c0 05 0e4c 0000 0004 4 <
ffff000103533a80 4066267859 C Ci:6:002:0 0 4 = 1b191715
ffff000103533a80 4066267904 S Co:6:002:0 s 40 05 0e4c 0000 0004 4 = 1b191715
ffff000103533a80 4066268011 C Co:6:002:0 0 4 >
ffff000103533a80 4066268058 S Ci:6:002:0 s c0 05 0e54 0000 0004 4 <
ffff000103533a80 4066268201 C Ci:6:002:0 0 4 = 11090300
ffff000103533a80 4066268251 S Co:6:002:0 s 40 05 0e54 0000 0004 4 = 11090300
ffff000103533a80 4066268356 C Co:6:002:0 0 4 >
ffff000103533a80 4066268416 S Ci:6:002:0 s c0 05 0454 0000 0001 1 <
ffff000103533a80 4066268542 C Ci:6:002:0 0 1 = 00
ffff000103533a80 4066268589 S Ci:6:002:0 s c0 05 0454 0000 0001 1 <
ffff000103533a80 4066268701 C Ci:6:002:0 0 1 = 00
ffff000103533a80 4066268746 S Co:6:002:0 s 40 05 0454 0000 0001 1 = 80
ffff000103533a80 4066268857 C Co:6:002:0 0 1 >
ffff000103533a80 4066268903 S Ci:6:002:0 s c0 05 041a 0000 0002 2 <
ffff000103533a80 4066269024 C Ci:6:002:0 0 2 = ff0f
ffff000103533a80 4066269069 S Ci:6:002:0 s c0 05 0808 0000 0004 4 <
ffff000103533a80 4066269178 C Ci:6:002:0 0 4 = 3382023e
ffff000103533a80 4066269224 S Co:6:002:0 s 40 05 0808 0000 0004 4 = 3382023e
ffff000103533a80 4066269355 C Co:6:002:0 0 4 >
ffff000103533a80 4066269400 S Ci:6:002:0 s c0 05 0834 0000 0004 4 <
ffff000103533a80 4066269509 C Ci:6:002:0 0 4 = 05a73700
ffff000103533a80 4066269555 S Co:6:002:0 s 40 05 0834 0000 0004 4 = 06a73700
ffff000103533a80 4066269669 C Co:6:002:0 0 4 >
ffff000103533a80 4066269714 S Ci:6:002:0 s c0 05 0830 0000 0004 4 <
ffff000103533a80 4066269822 C Ci:6:002:0 0 4 = b8eeaa2e
ffff000103533a80 4066269868 S Co:6:002:0 s 40 05 0830 0000 0004 4 = b8aeaa2e
ffff000103533a80 4066269982 C Co:6:002:0 0 4 >
ffff000103533a80 4066270027 S Ci:6:002:0 s c0 05 0830 0000 0004 4 <
ffff000103533a80 4066270249 C Ci:6:002:0 0 4 = b8aeaa2e
ffff000103533a80 4066270289 S Co:6:002:0 s 40 05 0830 0000 0004 4 = b8aeaa2e
ffff000103533a80 4066270400 C Co:6:002:0 0 4 >
ffff000103533a80 4066270447 S Ci:6:002:0 s c0 05 082c 0000 0004 4 <
ffff000103533a80 4066270565 C Ci:6:002:0 0 4 = dc832000
ffff000103533a80 4066270612 S Co:6:002:0 s 40 05 082c 0000 0004 4 = dd832000
ffff000103533a80 4066270730 C Co:6:002:0 0 4 >
ffff000103533a80 4066270777 S Co:6:002:0 s 40 05 0cb0 0000 0004 4 = 17773354
ffff000103533a80 4066270890 C Co:6:002:0 0 4 >
ffff000103533a80 4066270937 S Co:6:002:0 s 40 05 0eb0 0000 0004 4 = 17773354
ffff000103533a80 4066271040 C Co:6:002:0 0 4 >
ffff000103533a80 4066271086 S Ci:6:002:0 s c0 05 0cb4 0000 0004 4 <
ffff000103533a80 4066271135 C Ci:6:002:0 0 4 = 77000001
ffff000103533a80 4066271170 S Co:6:002:0 s 40 05 0cb4 0000 0004 4 = 77000001
ffff000103533a80 4066271201 C Co:6:002:0 0 4 >
ffff000103533a80 4066271236 S Ci:6:002:0 s c0 05 0eb4 0000 0004 4 <
ffff000103533a80 4066271288 C Ci:6:002:0 0 4 = 77000001
ffff000103533a80 4066271324 S Co:6:002:0 s 40 05 0eb4 0000 0004 4 = 77000001
ffff000103533a80 4066271354 C Co:6:002:0 0 4 >
ffff000103533a80 4066271389 S Ci:6:002:0 s c0 05 0900 0000 0004 4 <
ffff000103533a80 4066271426 C Ci:6:002:0 0 4 = 01040000
ffff000103533a80 4066271461 S Co:6:002:0 s 40 05 0900 0000 0004 4 = 01040000
ffff000103533a80 4066271492 C Co:6:002:0 0 4 >
ffff000103533a80 4066271527 S Ci:6:002:0 s c0 05 080c 0000 0004 4 <
ffff000103533a80 4066271564 C Ci:6:002:0 0 4 = 13111312
ffff000103533a80 4066271598 S Co:6:002:0 s 40 05 080c 0000 0004 4 = 03111312
ffff000103533a80 4066271630 C Co:6:002:0 0 4 >
ffff000103533a80 4066271666 S Ci:6:002:0 s c0 05 0a04 0000 0004 4 <
ffff000103533a80 4066271702 C Ci:6:002:0 0 4 = 0c00ff01
ffff000103533a80 4066271737 S Co:6:002:0 s 40 05 0a04 0000 0004 4 = 0c00ff0f
ffff000103533a80 4066271785 C Co:6:002:0 0 4 >
ffff000103533a80 4066271820 S Ci:6:002:0 s c0 05 0440 0000 0004 4 <
ffff000103533a80 4066271856 C Ci:6:002:0 0 4 = 00000000
ffff000103533a80 4066271891 S Co:6:002:0 s 40 05 0440 0000 0004 4 = 50010000
ffff000103533a80 4066271923 C Co:6:002:0 0 4 >
ffff000103533a80 4066271958 S Ci:6:002:0 s c0 05 0c1c 0000 0004 4 <
ffff000103533a80 4066271994 C Ci:6:002:0 0 4 = 03000040
ffff000103533a80 4066272040 S Co:6:002:0 s 40 05 0c1c 0000 0004 4 = 0300402d
ffff000103533a80 4066272092 C Co:6:002:0 0 4 >
ffff000103533a80 4066272129 S Ci:6:002:0 s c0 05 0e1c 0000 0004 4 <
ffff000103533a80 4066272167 C Ci:6:002:0 0 4 = 03000040
ffff000103533a80 4066272203 S Co:6:002:0 s 40 05 0e1c 0000 0004 4 = 0300402d
ffff000103533a80 4066272235 C Co:6:002:0 0 4 >
ffff000103533a80 4066272271 S Ci:6:002:0 s c0 05 0860 0000 0004 4 <
ffff000103533a80 4066272307 C Ci:6:002:0 0 4 = 21c3d572
ffff000103533a80 4066272342 S Co:6:002:0 s 40 05 0860 0000 0004 4 = 21c32568
ffff000103533a80 4066272374 C Co:6:002:0 0 4 >
ffff000103533a80 4066272409 S Ci:6:002:0 s c0 05 0c00 0000 0004 4 <
ffff000103533a80 4066272445 C Ci:6:002:0 0 4 = 07000000
ffff000103533a80 4066272479 S Ci:6:002:0 s c0 05 08b0 0000 0004 4 <
ffff000103533a80 4066272532 C Ci:6:002:0 0 4 = 18060000
ffff000103533a80 4066272567 S Co:6:002:0 s 40 05 08b0 0000 0004 4 = 18060000
ffff000103533a80 4066272598 C Co:6:002:0 0 4 >
ffff000103533a80 4066272653 S Ci:6:002:0 s c0 05 0d04 0000 0004 4 <
ffff000103533a80 4066272699 C Ci:6:002:0 0 4 = 017c90b1
ffff000103533a80 4066272733 S Co:6:002:0 s 40 05 0c90 0000 0004 4 = 017d8501
ffff000103533a80 4066272780 C Co:6:002:0 0 4 >
ffff000103533a80 4066272827 S Ci:6:002:0 s c0 05 08ac 0000 0004 4 <
ffff000103533a80 4066272877 C Ci:6:002:0 0 4 = 08faf00f
ffff000103533a80 4066272911 S Co:6:002:0 s 40 05 08ac 0000 0004 4 = 08faf00f
ffff000103533a80 4066272943 C Co:6:002:0 0 4 >
ffff000103533a80 4066272976 S Ci:6:002:0 s c0 05 08ac 0000 0004 4 <
ffff000103533a80 4066273012 C Ci:6:002:0 0 4 = 08faf00f
ffff000103533a80 4066273047 S Co:6:002:0 s 40 05 08ac 0000 0004 4 = 08faf00f
ffff000103533a80 4066273078 C Co:6:002:0 0 4 >
ffff000103533a80 4066273112 S Ci:6:002:0 s c0 05 08c4 0000 0004 4 <
ffff000103533a80 4066273165 C Ci:6:002:0 0 4 = 00000000
ffff000103533a80 4066273200 S Co:6:002:0 s 40 05 08c4 0000 0004 4 = 00000000
ffff000103533a80 4066273231 C Co:6:002:0 0 4 >
ffff000103533a80 4066273266 S Ci:6:002:0 s c0 05 0c00 0000 0004 4 <
ffff000103533a80 4066273302 C Ci:6:002:0 0 4 = 07000000
ffff000103533a80 4066273337 S Ci:6:002:0 s c0 05 08b0 0000 0004 4 <
ffff000103533a80 4066273374 C Ci:6:002:0 0 4 = 18060000
ffff000103533a80 4066273408 S Co:6:002:0 s 40 05 08b0 0000 0004 4 = 18060000
ffff000103533a80 4066273441 C Co:6:002:0 0 4 >
ffff000103533a80 4066273501 S Ci:6:002:0 s c0 05 0d04 0000 0004 4 <
ffff000103533a80 4066273549 C Ci:6:002:0 0 4 = 017d91b1
ffff000103533a80 4066273583 S Co:6:002:0 s 40 05 0c90 0000 0004 4 = a57d8101
ffff000103533a80 4066273614 C Co:6:002:0 0 4 >
ffff000103533a80 4066273661 S Ci:6:002:0 s c0 05 0e00 0000 0004 4 <
ffff000103533a80 4066273709 C Ci:6:002:0 0 4 = 07000000
ffff000103533a80 4066273743 S Ci:6:002:0 s c0 05 08b0 0000 0004 4 <
ffff000103533a80 4066273790 C Ci:6:002:0 0 4 = 18060000
ffff000103533a80 4066273823 S Co:6:002:0 s 40 05 08b0 0000 0004 4 = 18060000
ffff000103533a80 4066273854 C Co:6:002:0 0 4 >
ffff000103533a80 4066273909 S Ci:6:002:0 s c0 05 0d44 0000 0004 4 <
ffff000103533a80 4066273956 C Ci:6:002:0 0 4 = 017c90b1
ffff000103533a80 4066273991 S Co:6:002:0 s 40 05 0e90 0000 0004 4 = 017d8501
ffff000103533a80 4066274037 C Co:6:002:0 0 4 >
ffff000103533a80 4066274084 S Ci:6:002:0 s c0 05 08ac 0000 0004 4 <
ffff000103533a80 4066274132 C Ci:6:002:0 0 4 = 08faf00f
ffff000103533a80 4066274166 S Co:6:002:0 s 40 05 08ac 0000 0004 4 = 08faf00f
ffff000103533a80 4066274197 C Co:6:002:0 0 4 >
ffff000103533a80 4066274230 S Ci:6:002:0 s c0 05 08ac 0000 0004 4 <
ffff000103533a80 4066274283 C Ci:6:002:0 0 4 = 08faf00f
ffff000103533a80 4066274317 S Co:6:002:0 s 40 05 08ac 0000 0004 4 = 08faf00f
ffff000103533a80 4066274348 C Co:6:002:0 0 4 >
ffff000103533a80 4066274382 S Ci:6:002:0 s c0 05 08c4 0000 0004 4 <
ffff000103533a80 4066274419 C Ci:6:002:0 0 4 = 00000000
ffff000103533a80 4066274453 S Co:6:002:0 s 40 05 08c4 0000 0004 4 = 00000000
ffff000103533a80 4066274484 C Co:6:002:0 0 4 >
ffff000103533a80 4066274519 S Ci:6:002:0 s c0 05 0e00 0000 0004 4 <
ffff000103533a80 4066274555 C Ci:6:002:0 0 4 = 07000000
ffff000103533a80 4066274591 S Ci:6:002:0 s c0 05 08b0 0000 0004 4 <
ffff000103533a80 4066274627 C Ci:6:002:0 0 4 = 18060000
ffff000103533a80 4066274662 S Co:6:002:0 s 40 05 08b0 0000 0004 4 = 18060000
ffff000103533a80 4066274693 C Co:6:002:0 0 4 >
ffff000103533a80 4066274749 S Ci:6:002:0 s c0 05 0d44 0000 0004 4 <
ffff000103533a80 4066274796 C Ci:6:002:0 0 4 = 017d91b1
ffff000103533a80 4066274830 S Co:6:002:0 s 40 05 0e90 0000 0004 4 = a57d8101
ffff000103533a80 4066274861 C Co:6:002:0 0 4 >
ffff000103533a80 4066274908 S Ci:6:002:0 s c0 05 0668 0000 0002 2 <
ffff000103533a80 4066274956 C Ci:6:002:0 0 2 = 0010
ffff000103533a80 4066274990 S Co:6:002:0 s 40 05 0668 0000 0002 2 = 0010
ffff000103533a80 4066275037 C Co:6:002:0 0 2 >
ffff000103533a80 4066275070 S Co:6:002:0 s 40 05 0483 0000 0001 1 = 00
ffff000103533a80 4066275100 C Co:6:002:0 0 1 >
ffff000103533a80 4066275134 S Ci:6:002:0 s c0 05 0837 0000 0001 1 <
ffff000103533a80 4066275170 C Ci:6:002:0 0 1 = 00
ffff000103533a80 4066275205 S Ci:6:002:0 s c0 05 08ac 0000 0004 4 <
ffff000103533a80 4066275241 C Ci:6:002:0 0 4 = 08faf00f
ffff000103533a80 4066275275 S Co:6:002:0 s 40 05 08ac 0000 0004 4 = 08faf00f
ffff000103533a80 4066275306 C Co:6:002:0 0 4 >
ffff000103533a80 4066275341 S Ci:6:002:0 s c0 05 08c4 0000 0004 4 <
ffff000103533a80 4066275379 C Ci:6:002:0 0 4 = 00000000
ffff000103533a80 4066275413 S Co:6:002:0 s 40 05 08c4 0000 0004 4 = 00000000
ffff000103533a80 4066275444 C Co:6:002:0 0 4 >
ffff000103533a80 4066275479 S Ci:6:002:0 s c0 05 0848 0000 0004 4 <
ffff000103533a80 4066275533 C Ci:6:002:0 0 4 = 8bffd061
ffff000103533a80 4066275568 S Co:6:002:0 s 40 05 0848 0000 0004 4 = 8bffd061
ffff000103533a80 4066275599 C Co:6:002:0 0 4 >
ffff000103533a80 4066275634 S Ci:6:002:0 s c0 05 08ac 0000 0004 4 <
ffff000103533a80 4066275671 C Ci:6:002:0 0 4 = 08faf00f
ffff000103533a80 4066275706 S Co:6:002:0 s 40 05 08ac 0000 0004 4 = 08faf00f
ffff000103533a80 4066275737 C Co:6:002:0 0 4 >
ffff000103533a80 4066275771 S Ci:6:002:0 s c0 05 08ac 0000 0004 4 <
ffff000103533a80 4066275808 C Ci:6:002:0 0 4 = 08faf00f
ffff000103533a80 4066275842 S Co:6:002:0 s 40 05 08ac 0000 0004 4 = 08faf00f
ffff000103533a80 4066275873 C Co:6:002:0 0 4 >
ffff000103533a80 4066275907 S Ci:6:002:0 s c0 05 08c4 0000 0004 4 <
ffff000103533a80 4066275944 C Ci:6:002:0 0 4 = 00000000
ffff000103533a80 4066275979 S Co:6:002:0 s 40 05 08c4 0000 0004 4 = 00000000
ffff000103533a80 4066276026 C Co:6:002:0 0 4 >
ffff000103533a80 4066276062 S Ci:6:002:0 s c0 05 0c00 0000 0004 4 <
ffff000103533a80 4066276122 C Ci:6:002:0 0 4 = 07000000
ffff000103533a80 4066276159 S Ci:6:002:0 s c0 05 08b0 0000 0004 4 <
ffff000103533a80 4066276198 C Ci:6:002:0 0 4 = 18060000
ffff000103533a80 4066276233 S Co:6:002:0 s 40 05 08b0 0000 0004 4 = 18060000
ffff000103533a80 4066276283 C Co:6:002:0 0 4 >
ffff000103533a80 4066276338 S Ci:6:002:0 s c0 05 0d04 0000 0004 4 <
ffff000103533a80 4066276387 C Ci:6:002:0 0 4 = a57d95b1
ffff000103533a80 4066276421 S Co:6:002:0 s 40 05 0c90 0000 0004 4 = a57d8501
ffff000103533a80 4066276452 C Co:6:002:0 0 4 >
ffff000103533a80 4066276499 S Ci:6:002:0 s c0 05 0e00 0000 0004 4 <
ffff000103533a80 4066276548 C Ci:6:002:0 0 4 = 07000000
ffff000103533a80 4066276583 S Ci:6:002:0 s c0 05 08b0 0000 0004 4 <
ffff000103533a80 4066276619 C Ci:6:002:0 0 4 = 18060000
ffff000103533a80 4066276652 S Co:6:002:0 s 40 05 08b0 0000 0004 4 = 18060000
ffff000103533a80 4066276683 C Co:6:002:0 0 4 >
ffff000103533a80 4066276738 S Ci:6:002:0 s c0 05 0d44 0000 0004 4 <
ffff000103533a80 4066276791 C Ci:6:002:0 0 4 = a57d95b1
ffff000103533a80 4066276825 S Co:6:002:0 s 40 05 0e90 0000 0004 4 = a57d8501
ffff000103533a80 4066276856 C Co:6:002:0 0 4 >
ffff000103533a80 4066276905 S Ci:6:002:0 s c0 05 0073 0000 0001 1 <
ffff000103533a80 4066276954 C Ci:6:002:0 0 1 = 07
ffff000103533a80 4066276988 S Co:6:002:0 s 40 05 0073 0000 0001 1 = 07
ffff000103533a80 4066277037 C Co:6:002:0 0 1 >
ffff000103533a80 4066277101 S Ci:6:002:0 s c0 05 0c24 0000 0004 4 <
ffff000103533a80 4066277166 C Ci:6:002:0 0 4 = 20202020
ffff000103533a80 4066277200 S Co:6:002:0 s 40 05 0c24 0000 0004 4 = 31313131
ffff000103533a80 4066277231 C Co:6:002:0 0 4 >
ffff000103533a80 4066277265 S Ci:6:002:0 s c0 05 0c28 0000 0004 4 <
ffff000103533a80 4066277302 C Ci:6:002:0 0 4 = 20201e1c
ffff000103533a80 4066277337 S Co:6:002:0 s 40 05 0c28 0000 0004 4 = 31312f2d
ffff000103533a80 4066277368 C Co:6:002:0 0 4 >
ffff000103533a80 4066277403 S Ci:6:002:0 s c0 05 0c2c 0000 0004 4 <
ffff000103533a80 4066277441 C Ci:6:002:0 0 4 = 20202020
ffff000103533a80 4066277476 S Co:6:002:0 s 40 05 0c2c 0000 0004 4 = 36363636
ffff000103533a80 4066277507 C Co:6:002:0 0 4 >
ffff000103533a80 4066277542 S Ci:6:002:0 s c0 05 0c30 0000 0004 4 <
ffff000103533a80 4066277581 C Ci:6:002:0 0 4 = 20201e1c
ffff000103533a80 4066277615 S Co:6:002:0 s 40 05 0c30 0000 0004 4 = 3432302e
ffff000103533a80 4066277662 C Co:6:002:0 0 4 >
ffff000103533a80 4066277697 S Ci:6:002:0 s c0 05 0c34 0000 0004 4 <
ffff000103533a80 4066277735 C Ci:6:002:0 0 4 = 20202020
ffff000103533a80 4066277770 S Co:6:002:0 s 40 05 0c34 0000 0004 4 = 32323232
ffff000103533a80 4066277802 C Co:6:002:0 0 4 >
ffff000103533a80 4066277837 S Ci:6:002:0 s c0 05 0c38 0000 0004 4 <
ffff000103533a80 4066277875 C Ci:6:002:0 0 4 = 201e1c1a
ffff000103533a80 4066277910 S Co:6:002:0 s 40 05 0c38 0000 0004 4 = 32302e2c
ffff000103533a80 4066277942 C Co:6:002:0 0 4 >
ffff000103533a80 4066277976 S Ci:6:002:0 s c0 05 0c3c 0000 0004 4 <
ffff000103533a80 4066278015 C Ci:6:002:0 0 4 = 20202020
ffff000103533a80 4066278050 S Co:6:002:0 s 40 05 0c3c 0000 0004 4 = 36363636
ffff000103533a80 4066278083 C Co:6:002:0 0 4 >
ffff000103533a80 4066278117 S Ci:6:002:0 s c0 05 0c40 0000 0004 4 <
ffff000103533a80 4066278166 C Ci:6:002:0 0 4 = 20201e1c
ffff000103533a80 4066278201 S Co:6:002:0 s 40 05 0c40 0000 0004 4 = 3432302e
ffff000103533a80 4066278232 C Co:6:002:0 0 4 >
ffff000103533a80 4066278267 S Ci:6:002:0 s c0 05 0c44 0000 0004 4 <
ffff000103533a80 4066278305 C Ci:6:002:0 0 4 = 1a181e1e
ffff000103533a80 4066278339 S Co:6:002:0 s 40 05 0c44 0000 0004 4 = 2c2c3232
ffff000103533a80 4066278370 C Co:6:002:0 0 4 >
ffff000103533a80 4066278404 S Ci:6:002:0 s c0 05 0c48 0000 0004 4 <
ffff000103533a80 4066278443 C Ci:6:002:0 0 4 = 1e1e1e1e
ffff000103533a80 4066278477 S Co:6:002:0 s 40 05 0c48 0000 0004 4 = 32323230
ffff000103533a80 4066278509 C Co:6:002:0 0 4 >
ffff000103533a80 4066278543 S Ci:6:002:0 s c0 05 0c4c 0000 0004 4 <
ffff000103533a80 4066278581 C Ci:6:002:0 0 4 = 1c1a1816
ffff000103533a80 4066278616 S Co:6:002:0 s 40 05 0c4c 0000 0004 4 = 2e2c2a2a
ffff000103533a80 4066278662 C Co:6:002:0 0 4 >
ffff000103533a80 4066278696 S Ci:6:002:0 s c0 05 0c54 0000 0004 4 <
ffff000103533a80 4066278735 C Ci:6:002:0 0 4 = 120a0400
ffff000103533a80 4066278770 S Co:6:002:0 s 40 05 0c54 0000 0004 4 = 241c1600
ffff000103533a80 4066278801 C Co:6:002:0 0 4 >
ffff000103533a80 4066278836 S Ci:6:002:0 s c0 05 0e24 0000 0004 4 <
ffff000103533a80 4066278875 C Ci:6:002:0 0 4 = 1d1d1d1d
ffff000103533a80 4066278909 S Co:6:002:0 s 40 05 0e24 0000 0004 4 = 21212121
ffff000103533a80 4066278941 C Co:6:002:0 0 4 >
ffff000103533a80 4066278976 S Ci:6:002:0 s c0 05 0e28 0000 0004 4 <
ffff000103533a80 4066279014 C Ci:6:002:0 0 4 = 1d1d1b19
ffff000103533a80 4066279050 S Co:6:002:0 s 40 05 0e28 0000 0004 4 = 21211f1d
ffff000103533a80 4066279081 C Co:6:002:0 0 4 >
ffff000103533a80 4066279116 S Ci:6:002:0 s c0 05 0e2c 0000 0004 4 <
ffff000103533a80 4066279166 C Ci:6:002:0 0 4 = 1f1f1f1f
ffff000103533a80 4066279201 S Co:6:002:0 s 40 05 0e2c 0000 0004 4 = 26262626
ffff000103533a80 4066279233 C Co:6:002:0 0 4 >
ffff000103533a80 4066279267 S Ci:6:002:0 s c0 05 0e30 0000 0004 4 <
ffff000103533a80 4066279308 C Ci:6:002:0 0 4 = 1f1f1d1b
ffff000103533a80 4066279343 S Co:6:002:0 s 40 05 0e30 0000 0004 4 = 2422201e
ffff000103533a80 4066279375 C Co:6:002:0 0 4 >
ffff000103533a80 4066279409 S Ci:6:002:0 s c0 05 0e34 0000 0004 4 <
ffff000103533a80 4066279447 C Ci:6:002:0 0 4 = 1f1f1f1f
ffff000103533a80 4066279482 S Co:6:002:0 s 40 05 0e34 0000 0004 4 = 22222222
ffff000103533a80 4066279529 C Co:6:002:0 0 4 >
ffff000103533a80 4066279564 S Ci:6:002:0 s c0 05 0e38 0000 0004 4 <
ffff000103533a80 4066279600 C Ci:6:002:0 0 4 = 1f1d1b19
ffff000103533a80 4066279635 S Co:6:002:0 s 40 05 0e38 0000 0004 4 = 22201e1c
ffff000103533a80 4066279666 C Co:6:002:0 0 4 >
ffff000103533a80 4066279701 S Ci:6:002:0 s c0 05 0e3c 0000 0004 4 <
ffff000103533a80 4066279737 C Ci:6:002:0 0 4 = 1f1f1f1f
ffff000103533a80 4066279771 S Co:6:002:0 s 40 05 0e3c 0000 0004 4 = 26262626
ffff000103533a80 4066279802 C Co:6:002:0 0 4 >
ffff000103533a80 4066279836 S Ci:6:002:0 s c0 05 0e40 0000 0004 4 <
ffff000103533a80 4066279871 C Ci:6:002:0 0 4 = 1f1f1d1b
ffff000103533a80 4066279905 S Co:6:002:0 s 40 05 0e40 0000 0004 4 = 2422201e
ffff000103533a80 4066279937 C Co:6:002:0 0 4 >
ffff000103533a80 4066279971 S Ci:6:002:0 s c0 05 0e44 0000 0004 4 <
ffff000103533a80 4066280021 C Ci:6:002:0 0 4 = 19171d1d
ffff000103533a80 4066280057 S Co:6:002:0 s 40 05 0e44 0000 0004 4 = 1c1c2222
ffff000103533a80 4066280089 C Co:6:002:0 0 4 >
ffff000103533a80 4066280125 S Ci:6:002:0 s c0 05 0e48 0000 0004 4 <
ffff000103533a80 4066280164 C Ci:6:002:0 0 4 = 1d1d1d1d
ffff000103533a80 4066280199 S Co:6:002:0 s 40 05 0e48 0000 0004 4 = 22222220
ffff000103533a80 4066280231 C Co:6:002:0 0 4 >
ffff000103533a80 4066280266 S Ci:6:002:0 s c0 05 0e4c 0000 0004 4 <
ffff000103533a80 4066280302 C Ci:6:002:0 0 4 = 1b191715
ffff000103533a80 4066280337 S Co:6:002:0 s 40 05 0e4c 0000 0004 4 = 1e1c1a1a
ffff000103533a80 4066280368 C Co:6:002:0 0 4 >
ffff000103533a80 4066280403 S Ci:6:002:0 s c0 05 0e54 0000 0004 4 <
ffff000103533a80 4066280439 C Ci:6:002:0 0 4 = 11090300
ffff000103533a80 4066280474 S Co:6:002:0 s 40 05 0e54 0000 0004 4 = 140c0600
ffff000103533a80 4066280506 C Co:6:002:0 0 4 >
ffff00011ac9e840 4066748203 S Ci:6:002:0 s c0 05 004c 0000 0001 1 <
ffff00011ac9e840 4066748361 C Ci:6:002:0 0 1 = 20
ffff00011ac9e840 4066748519 S Co:6:002:0 s 40 05 004c 0000 0001 1 = 20
ffff00011ac9e840 4066748659 C Co:6:002:0 0 1 >
ffff000102d1d840 4067772245 S Ci:6:002:0 s c0 05 004c 0000 0001 1 <
ffff000102d1d840 4067772396 C Ci:6:002:0 0 1 = 20
ffff000102d1d840 4067772513 S Co:6:002:0 s 40 05 004c 0000 0001 1 = 20
ffff000102d1d840 4067772639 C Co:6:002:0 0 1 >
ffff00011ac9e840 4067772953 S Ci:6:002:0 s c0 05 0770 0000 0004 4 <
ffff00011ac9e840 4067773111 C Ci:6:002:0 0 4 = 00000000
ffff00011ac9e840 4067773270 S Ci:6:002:0 s c0 05 0774 0000 0004 4 <
ffff00011ac9e840 4067773416 C Ci:6:002:0 0 4 = 00000000
ffff00011ac9e840 4067773573 S Co:6:002:0 s 40 05 076e 0000 0001 1 = 0c
ffff00011ac9e840 4067773698 C Co:6:002:0 0 1 >
ffff00011ac9e840 4067773864 S Ci:6:002:0 s c0 05 0808 0000 0004 4 <
ffff00011ac9e840 4067774010 C Ci:6:002:0 0 4 = 3382023e
ffff00011ac9e840 4067774172 S Ci:6:002:0 s c0 05 0a5c 0000 0002 2 <
ffff00011ac9e840 4067774318 C Ci:6:002:0 0 2 = 3000
ffff00011ac9e840 4067774478 S Ci:6:002:0 s c0 05 0f48 0000 0002 2 <
ffff00011ac9e840 4067774624 C Ci:6:002:0 0 2 = d704
ffff00011ac9e840 4067774770 S Ci:6:002:0 s c0 05 0f04 0000 0004 4 <
ffff00011ac9e840 4067774889 C Ci:6:002:0 0 4 = 01000200
ffff00011ac9e840 4067774926 S Ci:6:002:0 s c0 05 0f14 0000 0004 4 <
ffff00011ac9e840 4067775036 C Ci:6:002:0 0 4 = 13000b00
ffff00011ac9e840 4067775066 S Ci:6:002:0 s c0 05 0f10 0000 0004 4 <
ffff00011ac9e840 4067775177 C Ci:6:002:0 0 4 = 00000000
ffff00011ac9e840 4067775207 S Ci:6:002:0 s c0 05 0f0c 0000 0004 4 <
ffff00011ac9e840 4067775318 C Ci:6:002:0 0 4 = 00000000
ffff00011ac9e840 4067775347 S Ci:6:002:0 s c0 05 0f08 0000 0004 4 <
ffff00011ac9e840 4067775470 C Ci:6:002:0 0 4 = 5200f404
ffff00011ac9e840 4067775490 S Ci:6:002:0 s c0 05 0fcc 0000 0004 4 <
ffff00011ac9e840 4067775603 C Ci:6:002:0 0 4 = 00000000
ffff00011ac9e840 4067775631 S Ci:6:002:0 s c0 05 09a4 0000 0004 4 <
ffff00011ac9e840 4067775744 C Ci:6:002:0 0 4 = 80000800
ffff00011ac9e840 4067775766 S Co:6:002:0 s 40 05 09a4 0000 0004 4 = 80000a00
ffff00011ac9e840 4067775873 C Co:6:002:0 0 4 >
ffff00011ac9e840 4067775903 S Ci:6:002:0 s c0 05 09a4 0000 0004 4 <
ffff00011ac9e840 4067776020 C Ci:6:002:0 0 4 = 80000a00
ffff00011ac9e840 4067776042 S Co:6:002:0 s 40 05 09a4 0000 0004 4 = 80000800
ffff00011ac9e840 4067776151 C Co:6:002:0 0 4 >
ffff00011ac9e840 4067776181 S Ci:6:002:0 s c0 05 0a2c 0000 0004 4 <
ffff00011ac9e840 4067776309 C Ci:6:002:0 0 4 = 00809000
ffff00011ac9e840 4067776339 S Co:6:002:0 s 40 05 0a2c 0000 0004 4 = 00009000
ffff00011ac9e840 4067776453 C Co:6:002:0 0 4 >
ffff00011ac9e840 4067776474 S Ci:6:002:0 s c0 05 0a2c 0000 0004 4 <
ffff00011ac9e840 4067776595 C Ci:6:002:0 0 4 = 00009000
ffff00011ac9e840 4067776625 S Co:6:002:0 s 40 05 0a2c 0000 0004 4 = 00809000
ffff00011ac9e840 4067776739 C Co:6:002:0 0 4 >
ffff00011ac9e840 4067776759 S Ci:6:002:0 s c0 05 0b58 0000 0004 4 <
ffff00011ac9e840 4067776871 C Ci:6:002:0 0 4 = 00000000
ffff00011ac9e840 4067776902 S Co:6:002:0 s 40 05 0b58 0000 0004 4 = 01000000
ffff00011ac9e840 4067777014 C Co:6:002:0 0 4 >
ffff00011ac9e840 4067777044 S Ci:6:002:0 s c0 05 0b58 0000 0004 4 <
ffff00011ac9e840 4067777155 C Ci:6:002:0 0 4 = 01000000
ffff00011ac9e840 4067777185 S Co:6:002:0 s 40 05 0b58 0000 0004 4 = 00000000
ffff00011ac9e840 4067777299 C Co:6:002:0 0 4 >
ffff00011ac9e840 4067777322 S Ci:6:002:0 s c0 05 0c50 0000 0004 4 <
ffff00011ac9e840 4067777432 C Ci:6:002:0 0 4 = 22000000
ffff00011ac9e840 4067777462 S Co:6:002:0 s 40 05 0c50 0000 0004 4 = 20000000
ffff00011ac9e840 4067777497 C Co:6:002:0 0 4 >
ffff00011ac9e840 4067777514 S Ci:6:002:0 s c0 05 0e50 0000 0004 4 <
ffff00011ac9e840 4067777624 C Ci:6:002:0 0 4 = 22000000
ffff00011ac9e840 4067777655 S Co:6:002:0 s 40 05 0e50 0000 0004 4 = 20000000
ffff00011ac9e840 4067777763 C Co:6:002:0 0 4 >
ffff00011ac9e840 4067777794 S Ci:6:002:0 s c0 05 01cc 0000 0001 1 <
ffff00011ac9e840 4067777906 C Ci:6:002:0 0 1 = 00
ffff00011ac9e840 4067777927 S Co:6:002:0 s 40 05 01f4 0000 0004 4 = 00000000
ffff00011ac9e840 4067778035 C Co:6:002:0 0 4 >
ffff00011ac9e840 4067778065 S Co:6:002:0 s 40 05 01d4 0000 0004 4 = 58000000
ffff00011ac9e840 4067778179 C Co:6:002:0 0 4 >
ffff00011ac9e840 4067778202 S Co:6:002:0 s 40 05 0440 0000 0004 4 = 00000000
ffff00011ac9e840 4067778309 C Co:6:002:0 0 4 >
ffff00011ac9e840 4067778340 S Ci:6:002:0 s c0 05 0c00 0000 0004 4 <
ffff00011ac9e840 4067778458 C Ci:6:002:0 0 4 = 07000000
ffff00011ac9e840 4067778479 S Ci:6:002:0 s c0 05 08b0 0000 0004 4 <
ffff00011ac9e840 4067778596 C Ci:6:002:0 0 4 = 18060000
ffff00011ac9e840 4067778626 S Co:6:002:0 s 40 05 08b0 0000 0004 4 = 42060000
ffff00011ac9e840 4067778735 C Co:6:002:0 0 4 >
ffff00011ac9e840 4067778778 S Ci:6:002:0 s c0 05 0d04 0000 0004 4 <
ffff00011ac9e840 4067778883 C Ci:6:002:0 0 4 = 108d90b1
ffff00011ac9e840 4067778912 S Co:6:002:0 s 40 05 0c90 0000 0004 4 = 108d2304
ffff00011ac9e840 4067779027 C Co:6:002:0 0 4 >
ffff00011ac9e840 4067779062 S Co:6:002:0 s 40 05 0280 0000 0002 2 = 0001
ffff00011ac9e840 4067779164 C Co:6:002:0 0 2 >
ffff00011ac9e840 4067779195 S Ci:6:002:0 s c0 05 010c 0000 0001 1 <
ffff00011ac9e840 4067779306 C Ci:6:002:0 0 1 = b4
ffff00011ac9e840 4067779336 S Co:6:002:0 s 40 05 010c 0000 0001 1 = b4
ffff00011ac9e840 4067779444 C Co:6:002:0 0 1 >
ffff00011ac9e840 4068796230 S Ci:6:002:0 s c0 05 004c 0000 0001 1 <
ffff00011ac9e840 4068796382 C Ci:6:002:0 0 1 = 20
ffff00011ac9e840 4068796546 S Co:6:002:0 s 40 05 004c 0000 0001 1 = 20
ffff00011ac9e840 4068796684 C Co:6:002:0 0 1 >
